page_index,movie_id,title,username,user_id,rating,date,time,comment,useful_count
1,26313740,玩命,月鱼,ouseiu0226,力荐,2017-01-06,21:16:51,"【年度欧美最佳预定🙂】

本来只是冲着Dave去看的
结果被Emma美哭
这俩颜值我能舔一年
更何况我D直接露胸(/▽＼)
好般配啊 在一起吧😭😂

主题和剧情都是直戳我心
担心的烂尾也没有很糟
好希望BBC爸爸可以注意到投资拍个series🙈

BGM也是好听到爆肝💗",2
1,26313740,玩命,∞,52106146,推荐,2016-11-03,12:12:25,很热闹 节奏紧凑 非常适合大家一起看,1
1,26313740,玩命,刍狗,74967915,推荐,2018-02-03,22:08:33,合格的小制作商业片，故事有趣节奏紧凑，还有个紧贴当下时代背景的设定，完成度很OK了。,0
1,26313740,玩命,承泽明,4075446,还行,2016-12-03,22:37:29,概念很酷，有点像“饥饿游戏”，全程嗨不停，就是结尾转得太突兀。,0
1,26313740,玩命,豆友66,66328313,,2023-01-24,22:30:17,96.18,0
1,26313740,玩命,шill醬,willorz,还行,2021-10-17,01:08:17,單純給裡面的各位🍊演員➕1星吧⋯隔壁目害看做的解說可能更好看⋯大刺激2.0 （x 2021.6.12 in.Tokyo,0
1,26313740,玩命,cult,53088168,还行,2017-01-04,02:08:08,爆米花电影的属性让片子对网络暴力的主题挖掘上未能再深入一步，游戏直播的过程很好玩儿，但结尾也太弱了。为了营造都市游乐场的游戏氛围，大量的霓虹效果让整座城市五彩缤纷，此处加分，艾玛·罗伯茨颜值加分。,0
1,26313740,玩命,JEWISH,DizzyFox,还行,2017-03-28,23:08:42,砍掉那些多余的突然航拍MV和sloooooooooooo mo 其实也还及格啦,0
1,26313740,玩命,心之旋影,Fe.douban,还行,2017-01-08,00:43:06,武昌首义横店电影城 2017.1.7 22:02 9.9*2,0
1,26313740,玩命,不姨妈的大白色,56492985,还行,2017-02-01,15:08:36,滚幕设计的真好看啊,0
1,26313740,玩命,横丫肠,fightim,还行,2016-10-21,23:20:29,艾玛好美,0
1,26313740,玩命,恬儿萌,moobabol,力荐,2017-01-18,04:39:53,Totally got my adredeline rushing!! ＋颜值高＋New York City 虽然故事有点漏洞，但是看这种片儿就为爽一下 ps 配合mac观感最佳,0
1,26313740,玩命,MR.Charles,106347535,较差,2016-12-13,15:14:20,补标,0
1,26313740,玩命,响箭,wolf_zhchk,还行,2017-01-09,21:30:56,我查一下原著的情况，如果有意思的话，就去捋一本。,0
1,26313740,玩命,杨淇羽,yangqiyualice,推荐,2017-03-13,17:05:57,如果只把这部电影当作一部青春片的话，女主从活的迷迷茫茫到找到自我，从闺蜜的阴影中走出，收获爱情，完成了一个青春片女主的完整进化。直播过程带感又刺激，还带着那么一丝黑暗惊悚，绝对合格了。但如果你期待它讨论更多的话，结局男主白马王子设定削弱了角色塑造，朋友下线游戏违背了游戏的约束力。,0
1,26313740,玩命,拾幾,wuyazui,推荐,2016-11-10,21:38:41,结合视频直播元素的现代背景下的逃生游戏。★★★☆,0
1,26313740,玩命,ryan,vigilgt,,2016-12-04,05:15:27,比我预期的拍得好,0
1,26313740,玩命,白开水,watermemory,还行,2017-03-23,12:37:45,社交网络带来的舆论暴力，结局相当讽刺，但我认为女主真的死了比较好,0
1,26313740,玩命,LoudCrazyHeart,72086305,较差,2016-11-10,17:04:24,结尾轻松化解社交网络的暴戾，厉害。,0
1,26313740,玩命,澳大利亚喂袋鼠,18021724,推荐,2016-10-14,22:31:18,戴兰兰啷个楞个好看哟  剪辑可以再凌厉点,1
1,26313740,玩命,Fly  Away,riverphoenix1,还行,2021-07-23,01:09:30,还是特别迎合当下的流行文化，设定还是耐看，电影转场和剪辑也十分舒服，前半段很吊胃口，可越到后面就越偏了，女主人设也是个问题，而结局是最大的败笔，说教般的光明结局根本不切合这个本就黑暗的游戏，说是网络科技发展的弊端，其实根本就是人性的恶，只是借助网络更好表达出来，各种元素都还在，甚至包括穿插到整部电影的流行BGM都让人有好感，好看但也可以做得更好，艾玛罗伯茨还是美的,0
1,26313740,玩命,Grigia,61158911,较差,2021-10-05,22:13:16,又是爱上经典男二的一天。,0
1,26313740,玩命,雪后林中有鹿,108077404,还行,2016-10-16,15:33:45,前半部真是好啊，玩儿得越来越刺激，完美展现女主是如何在游戏中放飞自我不可自拔的。可惜从撕逼开始就一路走向俗套，直到结尾草草收场。我说男主怎么这么眼熟，原来是付兰兰的弟弟，男主女还挺搭的。,0
1,26313740,玩命,小步捯饬着,69646287,还行,2022-03-15,15:57:54,概念不错 内核不够 撑不起后半段,0
1,26313740,玩命,阿边,jerk1990,力荐,2017-01-06,15:27:03,好看,1
1,26313740,玩命,影子的影子,yfqc24pippo,还行,2018-07-24,02:03:37,短一点会更好吧，前半节奏都不错，后面有点垮了,0
1,26313740,玩命,Entrop1e,vincent910203,力荐,2016-08-24,18:57:58,Bgm不能更棒 戴兰兰跟弗兰兰简直牛逼bro 爱玛更棒了 casie 倾情客串,0
1,26313740,玩命,三年,threeyears,还行,2016-12-27,03:37:47,不是很理解 年轻人,0
1,26313740,玩命,常在我心,55480143,推荐,2016-10-25,19:35:06,典型的预告比正片好看。。中途高空爬楼梯让我好害怕！,0
1,26313740,玩命,Morning,qiweiming750,较差,2016-10-18,01:40:19,如果一开始玩直播是和闺蜜赌气，尾段高空挑战是和闺蜜撕逼，那么中段能找到唯一理由就是异性的劝说了，艾玛罗伯茨完成得很扁平，角色被她分割成几个大块，很表面。这个故事用直播的形式包装了校园片，但没有校园片里的人情，最后严重大烂尾。,2
1,26313740,玩命,点击即刻爆炸,78065496,还行,2016-10-30,10:19:41,节奏跟配乐都还可以，结局前的那个全民选择也有点意思，只是从头到尾透着一种青春中二感让我不太爽。,0
1,26313740,玩命,这一年那些人,zr90129,还行,2022-03-10,22:37:25,说教太直白了，结局好像是拿着大喇叭对你喊：“我有没有引发你的思考？！”,0
1,26313740,玩命,阿撇,elevenmaple,还行,2016-11-03,20:52:55,三星半。情节紧凑，没废话。观影过程还是挺爽的。网络杀人迟早会成真，而且结局远不会像电影这么美好。,0
1,26313740,玩命,DrBlackWatson,DoctorHou,还行,2016-12-23,22:48:50,很好的主题，但没拍好，成了快餐片。,0
1,26313740,玩命,roseheart,yanghuicheng,推荐,2016-10-16,13:39:43,有些虎头蛇尾，前半部引人入胜，快节奏，题材新鲜，创意满满，但后半部这口气就有些接不上来了，就是从女主想退出游戏那一刻吧。仓促，草率，满满尴尬。五星的开头，四星的中段，三星的收尾。IT从业者不可错过。,0
1,26313740,玩命,鸡头井。,1172054,还行,2016-08-26,00:21:06,一部表征自媒体时代的电影，和这个糟糕而令人兴奋的世界保持同样的速度与激情。后半段稍弱，异托邦冒险让位于懵懂恋爱火苗。总体完成度高，有张有弛，那么近，又那么远。,0
1,26313740,玩命,养小狗叫spark,46082749,还行,2016-07-31,08:45:58,女主美 绿裙子好看 男主身材好 中间几个场景有紧张感 结尾烂 惊喜是看到oitnb的小couple演员 Soso&Poussey,2
1,26313740,玩命,一个头两个大,iamluoluo,推荐,2016-11-12,13:49:52,把女主换掉我就给五星,0
1,26313740,玩命,小跳,earlymorning,还行,2016-10-16,16:54:43,主题非常酷的一部teenager film,0
1,26313740,玩命,C.,C.,还行,2022-02-10,02:14:54,爱情片啊,0
1,26313740,玩命,SleepWalker,44564069,推荐,2016-10-17,22:14:32,前面一小时真想给满分，主题鲜明，节奏轻快，设局巧妙，再加上精心挑选的bgm(or ost)配合艾玛的表演，没有任何可以挑剔的地方。可惜最后并没有继续深挖，仅仅只是讽刺和控诉网络暴民，有点虎头蛇尾。片尾留一手，可以拍续集，但是让人眼前一亮的艾玛付兰弟组合肯定不会继续演了。,2
1,26313740,玩命,哗啦啦,hualala,还行,2016-12-05,02:06:58,好题材却不够残酷也不够酷，因为导演太规矩了。,0
1,26313740,玩命,马可new仔,zechewang007,还行,2016-10-23,18:54:51,画面异常优秀，呈现了些许诡异的氛围，美式惊悚的感觉也挺有想法的，可惜人物描画和结尾还是偏弱了,0
1,26313740,玩命,Q-bits,qbits,推荐,2016-10-17,09:57:06,歪果直播网红和键盘侠们的小对决，蒙着网络这层面具，人人都可能是犯罪的共谋。备胎男二神似弗莱迪海默，前半段真有种《家庭作业》里的错觉,0
1,26313740,玩命,嘛哭当拿路哆,2598777,较差,2016-10-19,21:25:06,小儿科,0
1,26313740,玩命,小琪琪,tutusky,较差,2016-10-17,16:41:42,结局也太快了……乱七八糟的，不过这个故事很有意思,0
1,26313740,玩命,notrealdante,49048693,较差,2017-06-26,22:44:51,后半段好尴尬,0
1,26313740,玩命,元帅,Sh1neYuan,推荐,2016-08-14,23:03:57,挺好看哒！超惊险的 整个游戏的presentation很有意思 结尾有一点仓促 片尾调侃了很多热门app网页也是很戳geek的点,0
1,26313740,玩命,drowsy.esme🥀,49252622,很差,2016-10-12,20:40:22,太低龄,0
1,26313740,玩命,饮歌,35790692,较差,2016-10-17,22:30:16,开始以为是对时下年轻人沉迷网络关注度的一次针砭时弊的批斗。但中后段完全跑偏，而且人物之间的感情变化也太无厘头了，难道年轻人之间的感情就一定要这么廉价这么轻浮？,1
1,26313740,玩命,毛病小精灵,chickying,力荐,2022-05-01,15:00:46,Emma真是好看呢,0
1,26313740,玩命,轨迹猫,SokSolon,推荐,2016-11-28,13:25:23,"2016.11.28清纯女孩表白失败从此堕落成为女主播。直播的时事话题有加分。2333.
另外卧槽。母亲是天生杀人狂的女杀手朱莉亚老成这样了哇！
女主，艾玛罗伯茨，朱莉亚罗伯茨的侄女，年轻小甜心。还有惊天魔盗团的年轻魔法师。嘿！你得相信我们，信任是一切的基础。",1
1,26313740,玩命,けんちゃん,KatoShigeaki,还行,2016-10-23,00:31:42,逻辑硬伤捉急,0
1,26313740,玩命,黄悦_,69475039,还行,2016-10-22,15:29:17,如果不是阑尾 就这网络暴力的意义、色调、摄影都可以表明这是场好想象力的佳作。前半部分非常引人入胜 可惜坑太大填不了 但是导演你也不要那么瞎扯好吗……白浪费了艾玛这美腿。,0
1,26313740,玩命,轩煜,xuanyushuo,还行,2016-10-16,17:34:35,这才叫饥饿游戏,0
1,26313740,玩命,風來,fenglai,推荐,2016-10-20,16:56:42,结尾有点无力，不像前面刺激，不然就神作了。,0
1,26313740,玩命,goldenday,goldenday,还行,2017-03-25,23:04:08,青少年版13骇人游戏。,0
1,26313740,玩命,韦恩斯坦_李,wayne211,推荐,2016-10-29,22:06:01,剧情还可以，贴切现在这个火热的直播时代，讽刺了网络背后那些带着面具、用网名伪装自己而缺乏责任心的吃瓜群众，结尾反转的不错，不过也是流俗了，也是为了结局看起来温暖和期望网络变得美好故意设定的吧。女主男主颜值都非常高，很刺激很唯美很拍年轻观众马屁的现代故事。,1
1,26313740,玩命,φ,1156983,推荐,2016-10-13,16:20:14,现实中的乌托邦，时下流行的练胆视频+直播主持+真心话大冒险。帅哥美女，无尿点。全民都是谋杀犯。,0
1,26313740,玩命,vivien,fishlittle,推荐,2017-03-09,20:59:28,可惜有点虎头蛇尾,0
1,26313740,玩命,5432,137494068,推荐,2017-01-08,01:57:24,内容以迎合现代流行的直播为题材，一群说话不用负责匿名的网络暴徒追求惊险刺激，实名制以后观众全部选择退出， over 。讽刺现在的键盘侠，网络喷子。希望现在社会，微博豆瓣各种社交少点这种人。私心觉得微博实名制以后也会大大减少网络暴力。,1
1,26313740,玩命,大發,blueser,还行,2016-10-17,00:20:48,前半都很有趣，结尾经不起推敲咯,0
1,26313740,玩命,一事无成孟烦了,liaozhai,,2016-11-11,21:07:39,这片拍的感觉像个破娃娃，到处都有需要缝缝补补的地方,1
1,26313740,玩命,Zoe,XVenom,较差,2016-10-22,22:06:40,对年轻人玩儿的这些东西无感，加之还是一男一女。这类型电影偏浮躁，不喜欢。,0
1,26313740,玩命,琼斯黄,lengleng,还行,2017-03-24,15:49:32,结尾真是......表现形式倒真是不错，可以启发一些新探索。以及，年青一代叫艾玛的，真是一个比一个演戏看着拙计。,0
1,26313740,玩命,大音希声,45315390,还行,2017-08-26,11:52:32,就想知道他们手机不会没有电？,1
1,26313740,玩命,高詩遠,sunaosquare,推荐,2021-10-24,20:31:14,意外地惊喜。虽然拍的是很严肃的题材，但是在前半段矛盾还没有到达高潮时，选择了一种很青春励志的方式去呈现这个议题，画面制作得也非常高级，很有未来感，并且BGM都特别好听，有点《忌日快乐》的感觉，这种表现手法深得我心。美中不足的就是prisoner这个设定就是个噱头，还以为有啥惩罚呢，到最后就是个帮女主进决赛的工具。结尾也拍砸了，虽然点题了It's easy to be brave in a crowd，到最后观众的面孔真实地曝光在网络当中时，人们纷纷作鸟兽散，可是这个Nerve就被衬托得不堪一击，失去了前面提到过的这个平台很难被摧毁的说服力。另外，这部电影的中文名翻译很难听。,0
1,26313740,玩命,会花光的金子,2712953,还行,2016-11-02,03:05:06,很养眼也很刺激，在当下人人争当网红的时代，显然这片很有话题性。类似主题，相比《黑镜》nerve还是太青少年向拍得太燥了，最后怎么可能一下子所有人就都退出了，收尾太草率,0
1,26313740,玩命,未知,65531183,还行,2016-10-14,12:41:40,绿茶婊变圣母,1
1,26313740,玩命,梦行30,57080555,还行,2016-10-17,18:42:20,女子监狱演员客串？某人的弟弟帅。。看的我都恐高症了！电影告诉我们不要沉迷虚拟世界。等等，后半部好弱智，我觉得女二还可以。,0
1,26313740,玩命,草帽岳飞,44290871,推荐,2016-10-23,23:02:15,又名《网络暴力的巨大危害》，节奏紧凑，前60分钟尤其好。立意既新颖又深刻，某些键盘侠根本不是吃瓜群众，而是犯罪的帮凶。我支持网络实名制。,0
1,26313740,玩命,sunking,77089569,推荐,2016-11-26,22:22:49,直播，网红，粉丝，虽是科幻片但现实感也很强。影片结尾女主说“其实你们都是凶手”直指网络暴力。影片节奏很紧凑，会揪着观众的心往下走，但结尾的故弄玄虚毁了这一切，可能导演还是太年轻。男主帅到不光女生会爱，怪蜀黍也会爱，女主就一般了，但据说女主来头不小，另外影片配乐很带劲。,0
1,26313740,玩命,太阳小鸟花和我,allegretto,较差,2017-06-06,23:31:56,两星都给Emma的脸. ,0
2,26313740,玩命,陈赖汉,clh7,还行,2016-10-20,18:34:34,题材不错，前一个小时都很好，但结局明显拍砸了。,0
2,26313740,玩命,崔泽九段,Jensen4ever,还行,2016-10-17,23:46:57,emma roberts真的。。好瘦。。she has the body of a ten-year-old...,0
2,26313740,玩命,通叔,47983459,还行,2017-01-31,00:14:37,虚拟网络和真实人生的结合，大众认同和诋毁在网络时代的暴力倾向，如此深刻的主题在俊男美女的好莱坞式包装下，有点脱序了。,0
2,26313740,玩命,空山,139964679,还行,2016-10-16,23:13:43,结尾是怎么搞得……一泻千里,0
2,26313740,玩命,林晚夕,vantcy,还行,2016-10-13,19:48:11,挺好的设定但是为了可以理解的原因剧情还是小打小闹了点。况且这种设定前作也不是没有。好在够紧张刺激，演员长得好演得好，音乐也好听。后半段有点蛇尾感，但是总体还是挺好看的。。。,0
2,26313740,玩命,鱼·无,dd770523,推荐,2016-10-15,21:28:36,相当不错，能让人全程无心玩手机！,0
2,26313740,玩命,pinkmark,rainbow225,推荐,2016-10-28,19:15:09,题材不错，结局俗套！,0
2,26313740,玩命,KMPD-SWAT,3709827,推荐,2017-01-17,22:24:02,和当时看时间规划局感觉一样，剧本新，但漏洞太多，可以出续集,0
2,26313740,玩命,浆糊骗子,xslidian,推荐,2017-01-14,22:50:11,"虽然把 sign out 当作删号理解 把开源当作分布式想象 但这部非主流片在 UI 的细致度已经超过 99% 的大片 各方面都没拖后腿 
那个催人站起来的男婊声音好烦呀",0
2,26313740,玩命,小鬼,Bellanica,推荐,2019-04-21,21:47:56,挺好的 节奏明快 男女主角养眼 又紧贴现代话题,0
2,26313740,玩命,Mr.荣少,148199579,还行,2021-02-24,17:22:07,emm，一开始我是冲着艾玛罗伯茨来的，后来发现，我也只能冲着艾玛罗伯茨来了...,0
2,26313740,玩命,蜉蝣渡海,56392220,推荐,2016-10-21,11:21:40,充满着青春荷尔蒙的电影，看点在挑战的过程拍的惊险刺激，可以当极限挑战类的片子看。结尾爱玛嘴炮说出了网络焦点人物对键盘侠的指责和愤怒。网络时代正在这样玩的其实还不少吧。,0
2,26313740,玩命,阿呆民,adaimin,还行,2020-08-15,20:28:32,也是一种网络暴力，因为看的时候忍不住联系现实反倒不爽了ε=(´ο｀*)))唉,0
2,26313740,玩命,小然看云歌,4253202,还行,2020-08-08,23:15:46,结局什么鬼,0
2,26313740,玩命,Knight Night,Mooncalf-Z,推荐,2020-01-25,03:23:32,sei能想到男主是个好人呢.. 朋友替它加了分..,0
2,26313740,玩命,HAN YUE,181044148,还行,2021-05-16,03:10:08,"【121/166】金钱的诱惑是多么的吸引人呀，以及每个玩家对粉丝数量的攀比，他们可以为此在商场裸奔🤣甚至可以赌上自己的生命🙃在虚拟的网路世界🕸之中，即使是好朋友也有可能成为那个设坑的对象，毕竟大家都是为了自己银行卡的余额罢了。
PS：说白了，这个电影的主题就是如何顺利把自己的朋友带入坑中🤣虽然最后的结局挺美好的🧩
",0
2,26313740,玩命,七姐Claudia,21771687,还行,2017-01-01,22:55:08,节奏很好，有拍成黑镜的潜质却因为结局沦为二流青春片,1
2,26313740,玩命,那么倔强,namejuejiang,还行,2016-10-19,18:08:52,闭眼开60迈的摩托还挺刺激，单手在塔吊坚持5秒看得我手心出汗，一幕幕挺刺激，结尾圣母心全开有点没意思，如果有3D的看着应该更好看,2
2,26313740,玩命,静眠虚空,pinklover,还行,2020-08-22,05:11:07,没有一片雪花是无辜的,0
2,26313740,玩命,小卷毛章鱼,62248397,很差,2021-05-08,09:28:11,适合“三分钟看完”,1
2,26313740,玩命,六弄奶茶廳,56789007,还行,2016-12-29,18:09:56,看起來就是一群死屁孩們，想玩的HIGH一點，相互鼓舞捧吹愛逞強，搞這些無厘頭的挑戰，想要炫耀自己的能力，玩下去又有錢，和樂不為，女主角也是跟著起鬨深現泥沼，最後還不是靠朋友來救，原來後面的工具人還是工具人阿,0
2,26313740,玩命,尚未崩坏,36766370,还行,2016-10-20,21:42:51,13骇人游戏既视感，衔接上直播现时这最时髦的话题，有趣但格局还是局限在少年男女的爱慕、嫉妒等小情绪中，结局的大团圆过于突兀和缺乏逻辑。,0
2,26313740,玩命,MichelleLOU,xuanxinxi,还行,2016-10-18,15:26:06,設定很現代，最後結尾的反轉諷刺得不夠狠，反轉不夠有趣，表面,0
2,26313740,玩命,熊能能脚不沾地,newbear,还行,2017-02-25,23:56:16,想法蛮好的，就是这个妈妈有点low…,0
2,26313740,玩命,空瓶子,76670521,推荐,2019-09-11,15:19:41,很不错的电影，只可惜结尾仁慈了点。整部电影的节奏处理的非常漂亮，从头到尾因为各种任务，使得故事紧张刺激，又一环套一环。就故事而言，本片有两方面的内容，一方面是网络暴力，另一方面是直播带来的纸醉金迷，从这两点来看，真的是相当讽刺现在的那些网红和键盘侠。如果当直播成为赚钱的手段，那拼尽性命的事一定会成为必然，之前就有某主播为了增加收视率，徒手攀大厦，最后摔死的报道；同时，现在的网民很多都分不清言论自由和网络暴力的区分，认为自己发几个辱骂别人的东西、抹黑别人的东西、甚至造谣、攻击和人肉他人，不过是玩笑，不过是凸显自己是“正义的使者”，但这却是能毁了一个人的暴力行径，是最下作的，但影片的结尾对于那些选择“YES”的人却都这样放过了，真的正确吗？另外，IT男那么舔狗，却得不到女主，真的好可怜。,1
2,26313740,玩命,路伽维加,1175766,还行,2016-11-05,13:49:31,没有观看，没有伤害。,0
2,26313740,玩命,untery,60289458,还行,2018-01-22,19:54:03,五分钟带你看完全程无尿点电影《玩命直播》结局引人深思,0
2,26313740,玩命,弓谷所長,misty-yy,推荐,2016-10-27,23:08:39,一些情节设计还算可以，看的蛮紧张的，可惜结局感觉过于仓促，网络时代的娱乐至死，每个人都是杀手，所以网络暴力比看的见的暴力更加可怕。,0
2,26313740,玩命,影观,1373968,力荐,2016-10-16,21:09:11,果断五星！,0
2,26313740,玩命,月直直,swingzhizhi,推荐,2021-11-17,23:41:32,前半段节奏太快以至于商业感和俗气感太满，后半段的网络世界匿名处决影射性过强以至于我陷入沉默。,2
2,26313740,玩命,停止的时钟动了,aarcher,推荐,2017-02-10,20:35:31,艾玛罗伯茨好漂亮。。。看了太多沉重的电影。。。看看这部换换口味。。,0
2,26313740,玩命,轻如纸张,herringcg,还行,2021-05-04,00:48:56,到走完梯子都是《黑镜》剧场版的感觉，之后全面崩坏，「开源代码」什么的简直肯丁。都花了那么多功夫在意淫情节上了，最后还不如彻底黑化，似是而非地反思一下其实毫无深度,0
2,26313740,玩命,lovewaiter,lovewaiter,推荐,2017-02-21,21:18:00,节奏非常Cool,0
2,26313740,玩命,柯里昂,pirealwei,较差,2016-11-06,22:31:54,旧瓶装新酒，看点不多,0
2,26313740,玩命,Tia,blunting,较差,2022-01-13,00:31:44,话题挺好的，结果拍成青少年电影了。结局好尬。,0
2,26313740,玩命,兒子,sophie1900,推荐,2016-10-18,15:31:44,颜值双高，概念表浅，讽刺不到位。以及我实在太厌恶网络暴民和吃瓜群众了,0
2,26313740,玩命,边说边学的小涛,163211396,还行,2020-10-23,07:46:58,#玩命直播# 这电影 对于我来说 不是很刺激 剧情也很一般 甚至于有点淡 我在这电影里面 感受很好的是它很正能量 可是又感觉正能量和这名字 有点距离，其实我给这电影三星但是 我觉得应该 推广一下它和楚门的世界 警灯长鸣嘛 给我们的窥视欲 好奇心提个醒ε=(′ο｀*)))唉。,0
2,26313740,玩命,Steamed Punk,minus16,推荐,2016-08-13,02:29:40,要是一黑到底就更好了不过毕竟是YA电影也没办法。片尾字幕几乎把pc史上各种热门的软件网页都调侃了一遍太可爱了,0
2,26313740,玩命,柠檬不好吃,83244806,较差,2016-10-21,12:36:52,蛇头蛇尾的电影，最后剧情转折僵硬的不忍直视，一星给男二很帅！男一长得像兰兰！！晕呐看完男主介绍才发现原来是弗兰兰的弟弟，我说怎么那么像😂,0
2,26313740,玩命,Torrilla,52071601,还行,2016-10-26,14:56:49,躲在匿名后的恶意满满,0
2,26313740,玩命,阿甘正在转,41533651,还行,2019-04-06,20:11:48,故事虚构的很真实,0
2,26313740,玩命,开心快乐每一天,154292831,较差,2019-03-29,17:58:05,少年的荒诞与冒险。,1
2,26313740,玩命,建筑大师·搬砖Z,48950448,推荐,2016-10-21,22:57:55,前段节奏很好.后面烂尾..拍成迷你剧应该不错.男女主角的颜很喜欢多给一星,0
2,26313740,玩命,西柚女孩喜逼力,neverchanges,推荐,2016-12-29,14:27:58,全程设定没毛病够了 在飞机上看到东村有点迷之泪目 一厢情愿觉得电影隐喻了纽约生活 得去趟staten island了,1
2,26313740,玩命,JenIna,1105624,推荐,2017-01-07,18:30:34,20170107买了三张电影票。比三星好不到四星。Dave Franco除了声音外太迷人了！看到传说中的烂尾结尾也是好笑，不过想想其实那不是烂尾。,0
2,26313740,玩命,烟霏云敛,Zoe0116,还行,2016-12-04,14:35:08,类似“黑镜”中某一集，但差好几个段位。,0
2,26313740,玩命,冬日暖阳,3510245,还行,2016-10-30,16:47:57,俊男美女快节奏，就挺好看了，剧情挺抓人也并不想细究。女主是茱莉亚罗伯茨的侄女哦～身材一流～闺蜜肉嘟嘟很像Queen B,0
2,26313740,玩命,江倍恒,42137037,较差,2019-08-13,21:58:38,神奇的展开,0
2,26313740,玩命,Frances,4356952,推荐,2016-10-12,21:25:23,搞事情，搞事情啊~,0
2,26313740,玩命,路易十七,68805354,还行,2017-05-13,17:53:28,"全世界小鲜肉都一样，Beauty is justice，观影时心里有这个原则就行。艾玛美丽依旧，男主演技不能再尴尬，如果不是有颜，举手投足间的气场表现所展示的简直是死肥宅级的社交水平。也是为了做高英课课前演讲才看的这个。课题是“A generation of pessimism”,关键词“adolescents are stupid.”",0
2,26313740,玩命,白色条纹,whiteStripes,还行,2021-02-24,01:31:59,不知道灵感是否来自日本的一部漫画。算是比较工整的爆米花电影。,0
2,26313740,玩命,nichkhun,57111606,推荐,2016-10-22,15:38:12,跟时下的直播作结合，剧情不无聊，部分dare的任务看得人还是很燃的，部分情节不经推敲，喜欢它的快节奏和BGM，加一星。,0
2,26313740,玩命,momotea_Summer,Su33er,较差,2018-04-07,23:34:51,套路太深，演技太水，结尾尴尬，Emma&Dave有点失望。,0
