﻿page_index,movie_id,title,username,user_id,rating,date,time,comment,useful_count
2,7056414,通勤营救,妍春,AndyEyre,很差,2018-04-17,19:37:21,《鹰眼》起步，《空中营救》人设，《时间规划局》架构，《极限空间》场景，《王牌对王牌》高潮……狗13编剧真是不计成本的玩耍呢。叔自从taken过后，接了太多孤胆片，形象被卡得死死的，被好莱坞吃住了么。龙哥推荐也只是讲了片头5分钟很有趣。,0
2,7056414,通勤营救,St☆r,alla,推荐,2018-08-20,23:42:29,女巫在火中选中的王,0
2,7056414,通勤营救,漫随天外,2316813,还行,2018-04-05,20:04:12,略搞脑,0
2,7056414,通勤营救,心之旋影,Fe.douban,还行,2018-03-30,21:53:45,耀莱成龙国际影城八大家店 2018.3.30 15:44 22.9*2,0
2,7056414,通勤营救,Mia,184177407,推荐,2022-04-12,03:41:40,3.5星🌟，生活不易，60多岁了还在“打拼”，戏里戏外都是～,1
2,7056414,通勤营救,零点,75033795,还行,2018-03-08,17:08:16,挺无聊的,0
2,7056414,通勤营救,zuzu,dojko,还行,2018-04-01,20:08:48,大叔明显动作迟缓了，太拼。,1
2,7056414,通勤营救,Aly,aly,力荐,2018-04-06,20:36:14,连姆尼森的营救系列。电影院排片有点少，可是很好看。就跟当年飓风营救一样，名字取得普通但是好看，一点都不老套。绝对跟你想象得不一样。,0
2,7056414,通勤营救,Josephine,joloveyou,推荐,2018-04-01,16:50:54,超出预期，本来以为又是一部叔被虐狂打人的戏，结果叔依旧被虐但是没咋打人。想看叔打人,0
2,7056414,通勤营救,momo哥哥,59451032,还行,2018-01-16,09:35:53,大叔这次过得可落魄了，不仅丢了工作，还没办法跟家人坦白，然后在车上被人殴打。在铁轨下面玩那场游戏，真的是跟死神打交道。惊险不错，细节做得不够好。,1
2,7056414,通勤营救,点金,cyeon,还行,2018-05-02,22:18:54,一看男主角 这个基本剧情走向就已经定性了 排除万难 拯救生命 这个片子有意思的是一个女乘客在代表她的利益相关方下一盘大棋 只是 谁是棋手 谁是棋子还不一定呢,0
2,7056414,通勤营救,HULIN,66754854,还行,2018-05-23,16:01:04,期待连姆尼森大叔下一部太阳系营救 和续集宇宙营救,0
2,7056414,通勤营救,初雪,55668809,力荐,2018-05-05,22:10:45,好惊险刺激又不恐怖，超爱这位厉害的大叔,1
2,7056414,通勤营救,版王,82096379,还行,2018-04-10,23:35:27,飞火车夸张过头了,0
2,7056414,通勤营救,Hannah🤦🏻‍♀️,bolilulu,推荐,2021-03-28,00:45:27,这爸爸都熬成爷爷了，还要钻好几次火车底下。太难混了好莱坞，不能这么对待老年人。超文本内容很赞，还有陪读那条线，非常会用。,0
2,7056414,通勤营救,Vision,51007365,力荐,2018-04-01,22:22:09,"左手吉他并不常见也太巧合了吧
一开始监视他的人后来去哪儿呢
后来又是谁打死司机的呢
打架那么凶手机硬碟都还完好无损？",0
2,7056414,通勤营救,Mosquito史歌,Hebebabemaik,还行,2019-04-15,18:14:30,连姆尼森是真的老了 动作迟缓 老态龙钟 跟现如今的成龙一样 这一部电影过分依赖特效和灾难大场面 却完全没达到正常水平 在剧情的悬疑度上同前一部空中营救相比也是天上地下 甚至节奏还略有些缓慢 大叔在车上走来走去搜寻目标的戏份完全感受不到紧张氛围 这种营救类影片真的不要再拍了 之前不要让大叔再来了,0
2,7056414,通勤营救,七姐Claudia,21771687,推荐,2018-07-07,02:33:06,整个局不够复杂，但是对几个演员感情分可以达到四星,0
2,7056414,通勤营救,ᴟoi&ioᴇ,urasucker,还行,2020-04-28,18:47:57,我一直在等源代码的反转结果看完了都没,0
2,7056414,通勤营救,满江红,1340414,还行,2018-03-31,19:09:23,法国动作片对我来说就是死穴，前一个半小时看得我昏昏欲睡，全靠最后半小时挽回，怎么说也就是一般普通的动作片吧,1
2,7056414,通勤营救,云中雨阳,K110,还行,2021-12-09,15:17:43,那个约男主角下车喝酒的老年男子挺倒霉的，无辜被撞死。中央电视台电影频道节目中心引进。,0
2,7056414,通勤营救,Young,4051784,较差,2022-06-04,23:46:36,以为是10年的片子，剧本简直弱智。但是动作场面拍得不错。,0
2,7056414,通勤营救,一锅豆干,156992074,力荐,2019-06-26,22:22:11,评分低的搞笑，黑的也很没水平,1
2,7056414,通勤营救,横丫肠,fightim,还行,2018-03-31,16:07:55,连姆有营救系列了，证明是真的红。很标准的动作片套路。,0
2,7056414,通勤营救,轻风羽,87019401,推荐,2018-04-01,23:29:20,不怕套路老，只要玩得好。从头到尾都看得人紧张兮兮，最后一幕超燃。有勇有谋的营救侠——连姆大叔还能再战五十年！,0
2,7056414,通勤营救,恐怖食人大火鸡,53738611,还行,2018-04-05,18:47:13,【C+】几乎就是《急速天劫》的高铁版…故事完全没长进，比《急速天劫》更弱。而且情节逻辑完全不能推敲，第三幕光是我就能想出N种比这更好的处理方法。不过导演拍这类片技法也还算稍微成熟了。第二幕的动作长镜效果还是有的，娱乐性也不错。算是没什么抱负的商业片。,0
2,7056414,通勤营救,Delphinus,3958326,还行,2018-08-18,21:52:38,三星半。飞机上看的。,0
2,7056414,通勤营救,杳圻,38648875,还行,2018-05-07,23:16:56,Clara lago 简直是板鸭景甜，什么片子都有她……不过英语比想象中好呢！,0
2,7056414,通勤营救,Quester,Quester,力荐,2018-04-12,11:40:36,太过华丽的演员阵容，节奏和摄影让人愉悦。如果说有“火车犯罪片”这个类型的话，本片就是佼佼者了。类似的狭小空间受胁迫完成任务的剧情已经不新鲜了，但是本片能保持不闷不拖沓，实在不容易。看见维拉法米拉上火车就觉得事情好不了，好像刚从源代码过来一样。nypd真忙。山姆老得快认不出了。,1
2,7056414,通勤营救,吃菜不吃呱,139066724,还行,2018-04-03,11:19:56,又救？当他老婆孩子真危险，总要被绑架监控。不过节奏还不错，最后半小时毫无悬疑,0
2,7056414,通勤营救,beglobetrotter,edchan,还行,2018-05-20,17:02:49,Patrick Wilson就没演过几个好人吧,0
2,7056414,通勤营救,一个头两个大,iamluoluo,力荐,2018-04-03,21:41:58,天上不会掉馅饼！天上不会掉馅饼！天上不会掉馅饼！,0
2,7056414,通勤营救,24岁，是影评人,168689338,还行,2019-02-12,13:49:11,大佬们在美国特色列车里van♂游戏，列车内的画面都非常dark♂（6）,1
2,7056414,通勤营救,开●逆光,kaitokuroba,推荐,2018-03-31,16:28:19,不错呢~连姆尼森老归老还挺能打~简直还可以出续集,0
2,7056414,通勤营救,goldenday,goldenday,还行,2018-06-20,08:12:44,补记录……,0
2,7056414,通勤营救,[Deleted],roseinthedark,较差,2018-06-19,00:48:37,车毁人亡后还演了20分钟...可见故事不太好编下了,0
2,7056414,通勤营救,午睡猪,lunababe,还行,2018-08-06,14:39:41,看到毒师里的老麦出现倍感亲切！,0
2,7056414,通勤营救,Ecane,ecane,还行,2018-04-01,22:32:55,剧本实在很乱，精彩的动作场面，全被最后莫名其妙的对峙戏拖下水，勉强及格之作，美国警察/FBI日常黑化+1。美国的通勤列车原来这么辛苦，还要人工检票的。,0
2,7056414,通勤营救,★冰凌宫★,3993233,较差,2018-06-26,22:39:11,这片子有很多地方说不过去，还是那种自以为聪明的漏洞百出，你要是早拍个五六年可能还可以，现在人脑子那么快，这让连姆看起来像老年痴呆外加肌肉发达的矛盾体，结局高潮非常歇菜，本来以为众人拾柴火焰高，却还是不了了之，真凶与无证到头也没说出个所以然来，这不会又成系列营救下去吧！,0
2,7056414,通勤营救,少年赵里昂,57338332,推荐,2018-04-06,11:21:53,本片真的非常符合核心主义价值观了，那段舍身忘死自认身份的戏，完美诠释了友善、平等、和谐、文明等……还有结局也像满满的我朝作风。不过有一说一电影还是蛮不错的，连姆大叔66岁了还这么拼，被揍的时候让人不禁心疼两秒。哦对了，片头的剪辑非常喜欢，教科书般的电影语言。,0
2,7056414,通勤营救,影子的影子,yfqc24pippo,还行,2018-06-13,12:11:11,不如上一部，开局好刻意，但是中间还是好看，导演控制节奏的水平一直到位。只是我每次看大叔打成这样真的好心疼啊,0
2,7056414,通勤营救,Chapelle L.,SoyQueenaTse,还行,2018-12-19,01:05:03,開片那幾個介紹時間的鏡頭剪輯把我驚豔到了 很讚啊！故事懸念鋪墊很好啊 很想讓人繼續看下去 無奈後面解密過程有點俗套了 演員演技挺棒 不過這麼理想化的英雄主義真的現實麼？,0
2,7056414,通勤营救,Riobluemoon,51715849,推荐,2018-04-02,21:00:11,7分。相对比较平庸吧，与其说是动作片，说成是悬疑片更有意思点。特别是前半段车上寻找证人的段落不错，但可惜逻辑上硬伤有点太多了，导致观感下降很多。反派前半段都快全知全能了，怎么还需要个前警察去找人？实在是太扯了。,0
2,7056414,通勤营救,秉心塞渊,byjch,还行,2018-04-12,13:39:10,剧情表演推理悬疑都较弱，好看的是我喜欢的演员同框了！给法米加，厄门绍特，连姆尼森各一星。,0
2,7056414,通勤营救,SundanceKid🌈,rudygiraffe,还行,2018-04-01,22:46:15,招魂夫妇是最佳拍档,0
2,7056414,通勤营救,你好花束爷爷,eslian,还行,2018-06-04,23:33:51,3.5,0
2,7056414,通勤营救,NarvikAustin,7632975,还行,2018-01-16,14:19:08,仿佛穿越了，正是小时候租碟看的那种好莱坞动作片,1
2,7056414,通勤营救,苏麻离青,53376629,推荐,2018-01-27,04:15:00,原来……在美帝要工作到六十五岁才能退休……太可怕了！忽然发现我社会主义国家的劳动人民地位实在太高了！只要六十就能退休！,0
2,7056414,通勤营救,奔跑的不锈钢,conan575,还行,2018-06-02,11:56:32,这到底是什么电影啊,0
2,7056414,通勤营救,神气猪🌈,lovebugzhang,推荐,2020-12-14,22:57:24,其实电影只值三星半，不过主演那么敬业，多给半星是完全没问题的,0
2,7056414,通勤营救,毛栗子爱果果,177722334,还行,2021-08-24,20:00:30,连姆尼森一辈子都在救人的路上，但这部作品的逻辑确实有硬伤~我的注意力主要还是在招魂夫妇身上，既视感实在太强了哈哈哈~,0
2,7056414,通勤营救,天堂羽,2310617,还行,2018-07-10,01:19:25,导演和连姆尼森合作的几部都挺不错，和空中营救一样， 封闭空间倒计时设定，不过尼森又更老了，角色也是六十岁了，打起来吃力，也不断被更年轻的揍。整体还是不错的，不过这一部悬念弱了，布局也牵强了一点，也没有太爽。,0
2,7056414,通勤营救,苗斑,modayuxin,还行,2018-09-12,08:41:43,剧情偏老套但是整体挺好看的，特效也不错，打斗设计也很刺激，就是看连姆大叔挨打惹人心疼,0
2,7056414,通勤营救,金星上的红茶馆,3271944,还行,2022-08-18,20:30:26,前面还不错，收尾太仓促了，而且你们都忘了殉职的老黑人乘务员了吗。。。。。这片里熟脸好多，还都是我喜欢的熟脸。连姆尼森大叔老了比年轻时帅。,0
2,7056414,通勤营救,zykmilan,zykmilan,还行,2018-03-27,15:30:07,各种细节很经不起推敲。基本就是营救系列一脉相承下来的套路，没什么惊喜。看在连姆大叔一把年纪还要一直营救家人、营救陌生人的份儿上给个辛苦分……,0
2,7056414,通勤营救,Dilettante G,live4liberty,还行,2018-04-01,21:49:36,陌生人給的糖（甜頭）不能要～小孩子都懂得道理你一個六十幾的老頭都整不明白？！［攤手］🤷♂️～捉鬼夫婦CP感太強讓片子也少了一絲懸念～,0
2,7056414,通勤营救,Sami,toryronweasley,还行,2018-04-02,10:20:14,不相信那么快转折的HE,0
2,7056414,通勤营救,岚调,ceffee,还行,2020-02-11,10:24:35,前半段铺垫的太长，后面剧情逻辑上没有理顺，想拍的格局大点但是编剧又能力有限，可怜了连姆大叔这么大年纪还这么拼，总得来说比空中营救差远了,0
2,7056414,通勤营救,嘛哭当拿路哆,2598777,还行,2018-04-01,23:39:06,在一人vs人群的题材，与人互动过于单调且段落都独立于故事，这违背了题材本身的特点,0
2,7056414,通勤营救,浅蓝深蓝,2727701,还行,2018-04-01,16:07:37,连叔好像许子东老师,0
2,7056414,通勤营救,小弟震,gionlau,还行,2018-04-19,20:41:32,3.5吧 片子其实不错，就是让连姆尼森反复演这个题材，就很难给人惊喜了。,0
2,7056414,通勤营救,忧伤的小斑狗,120627904,还行,2018-10-26,20:34:50,等等，我还有个《空中营救》没看。,0
2,7056414,通勤营救,拖鞋垃圾,yi_bahktmlmw,推荐,2021-08-07,23:58:45,救命啊，六十岁了被解雇还要被迫重操旧业，太辛苦了,1
2,7056414,通勤营救,雪后林中有鹿,108077404,还行,2018-04-10,22:41:00,节奏还挺好，就是实在没啥可以琢磨的地方，看过就忘。,0
2,7056414,通勤营救,骑马的丁丁,martinchen,较差,2018-08-06,19:55:52,June2018  爱奇艺,0
2,7056414,通勤营救,Michele,Michele19,较差,2021-10-20,09:47:44,6.0 反转得还可以,0
2,7056414,通勤营救,马可new仔,zechewang007,较差,2018-04-16,14:48:08,开头的通勤部分剪辑很精彩，然而利亚姆尼森的孤胆英雄模式依然是熟悉的配方却过期的味道，脱轨处的特效完全脱戏，至于剧情和反派更是逻辑漏洞百出。,0
2,7056414,通勤营救,DrBlackWatson,DoctorHou,还行,2018-07-27,00:00:35,前天周二影咖看的。没有很好的一部片。连姆尼森真的不行了。比老无所依差多了，但我都给了3星，很不公平。其实这部5.5分，那部7分。,0
2,7056414,通勤营救,||:da da da:||,60734053,还行,2018-04-10,20:35:19,叔真的很拼，看得很得劲儿！只是情节太刻意，经不起推敲…,0
2,7056414,通勤营救,蓝莓果酱,186868611,还行,2023-01-27,21:29:02,家庭观影，节奏感很不错，如果结尾再设计点小悬念是最好的,0
2,7056414,通勤营救,莫小巧,lvmocho,还行,2018-04-14,17:04:58,列车空间戏。中段冲突挑战娱乐性动作性刺激密布，全片却缺少主题性的统摄，动机到落点极其怪异，纯粹功能感。几乎是对观众的蔑视。,0
2,7056414,通勤营救,寡狗,143049789,还行,2018-03-30,21:57:40,剧情很像《一个好人》，尼森叔苍老如《英伦对决》里的龙叔，动作戏没那么利落不过很写实，最后关头反角强行暴露一波很侮辱智商，像女boss这种专为政客权贵利益集团铲事儿害人出谋划策的掮客，很像《疑犯追踪》里的佐伊，最后为啥还要假装路人呢？,0
2,7056414,通勤营救,Mike Suen,mikesun,还行,2019-11-15,16:06:44,节奏感还是不错的，导演埋藏的主题明朗，有意设计出一场阶级和人性的实验，但不如导演的《空中营救》。做局者和入局者开场安排和导演推动情节的方式非常刻意，戏剧处理很单一，简单的故事被故弄玄虚消磨得失去了神秘感，最终剧情反转出现得有点早，但没有觉得很突兀。心疼尼姆大叔，三星吧,0
2,7056414,通勤营救,M,Miss.Z.,力荐,2018-11-19,21:14:36,择善从之,0
2,7056414,通勤营救,轩煜,xuanyushuo,还行,2018-04-03,20:45:07,乔纳森·班克斯死的好冤,0
2,7056414,通勤营救,J,49121250,推荐,2018-06-06,22:00:03,优酷的画质真的是不能更黑了,1
2,7056414,通勤营救,老蚌壳布布,xialiang1900,较差,2018-04-02,08:37:44,？？？？,0
2,7056414,通勤营救,七里八里,dengqianjun,,2018-07-15,22:51:28,不知道该怎么评价==反派一开始很逆天，后来就……,0
2,7056414,通勤营救,无忧逍遥,56333481,还行,2018-04-02,14:18:35,看到招魂夫妇总让人有点出戏,0
2,7056414,通勤营救,望月封道,urielwang,还行,2018-04-21,13:16:25,连尼大爷还可以再打一个decade,0
2,7056414,通勤营救,酥牧奇,artemisu,还行,2018-04-12,14:58:38,最后大反派为毛自投罗网,0
2,7056414,通勤营救,芬芬达,q164511490,还行,2020-01-22,12:11:22,救完女儿救老婆，救完飞机救火车，尼森在营救的路上越走越远。。。,0
2,7056414,通勤营救,Zane,tang7876,还行,2018-12-20,21:07:35,反转的悬念还真是有点让人没有猜到,0
2,7056414,通勤营救,麦姆威,122924939,推荐,2021-08-08,16:12:20,比想象的好，连姆大叔越老越打不动，这种片就显得越惊心动魄。连姆大叔大战招魂夫妇，太穿越了！,0
2,7056414,通勤营救,一只熊猫,ramenkun,较差,2018-04-08,17:04:48,设定是挺好的：限时任务，杀掉无辜的人抑或家人被杀。只不过男主看起来并没有啥判断力，最后都没找出真正的目击者。列车营救的场景很刺激，也很不真实，哪个火车能给你这样搞。。,0
2,7056414,通勤营救,大發,blueser,较差,2020-11-15,19:45:00,剧情真不咋样,0
2,7056414,通勤营救,walker.hill,45863415,较差,2018-05-01,23:26:17,连我这种看电影不太管逻辑的人都觉得硬伤多到爆……,1
2,7056414,通勤营救,巴别塔上的雇工,1495717,力荐,2018-04-13,22:42:15,这片剧情相当棒，不要纠结于动作戏，电影重要的是故事。,1
2,7056414,通勤营救,局外人,49926534,还行,2019-03-11,09:33:16,内容很足，故事也足够精彩，结尾甚至有点正能量，但悬疑立足点的阴谋论比较牵强，标准的先设下一个局，然后想方设法把它圆合理了，这本身就违背人性，要截杀一个普通人，大可不必如此大费周章，节外生枝，这点会极度影响观影体验。当然，忽视了这一点，电影还是相当精彩的，确定身份这个悬念其实早早的就被破解了，电影前面里出现的人物和道具都会是后面有用的信息。心疼Mike爷爷,0
2,7056414,通勤营救,张楠,54382756,推荐,2018-11-19,09:31:04,https://movie.douban.com/review/9771264/,0
2,7056414,通勤营救,麻绳,ma-sheng,还行,2018-03-30,20:17:32,火车版《空中营救》，没什么新鲜感了，这恐怕是世界上最愚蠢的谋杀证人方式。大叔那个长镜头好拼，看得心疼。,0
2,7056414,通勤营救,馋猫麦昆,rotest105354,较差,2018-05-31,10:55:53,如此重要的人和资料就这么处理，警方和编剧一定有py交易,0
2,7056414,通勤营救,穆子衿,155602014,较差,2018-04-10,12:02:15,乏味而单调的剧情，虽定位于悬疑片，却几乎没有悬疑部分，埋得实在草率的伏笔，几近于零的推理过程……,0
2,7056414,通勤营救,太阳小鸟花和我,allegretto,较差,2018-05-16,23:52:28,扯淡,0
2,7056414,通勤营救,开放社会,57573627,还行,2021-05-14,13:21:07,"1.连叔是营救专家当之无愧，不过这回看，他真的老了，打斗很少了
2.很不喜欢这种黑暗的画面，看起来很不清楚
3.前面太拖沓，后面15分钟才是营救系列应该有的节奏
4.那个神秘的乔安娜本来消失了，就让她继续神秘下去不好吗？从那个女人的角度也没有必要再暴露
5.大家纷纷说自己将就是普林那段，平民百姓为了正义，挺身而出，还是令人敬佩和欣慰
6.下一部应该是在船上了吧？",0
2,7056414,通勤营救,七十三,se7enty3,还行,2018-04-08,16:55:35,从一开头就猜中结局，中规中矩,0
2,7056414,通勤营救,冲田总悟,148933548,推荐,2018-04-11,21:11:51,还好,0
2,7056414,通勤营救,瞎画郭,50918899,还行,2021-08-08,16:10:15,救不过来了，大叔很忙,0
2,7056414,通勤营救,Freebird,63354645,还行,2018-12-28,21:16:46,"话说大叔都60多了啊.片名<连姆大叔爱上营救>营救就营救,通勤是几个意思??脑残译名.悬疑部分还行,但是漏洞太多,头目有这么大的能力,全程监控列车,让列车停运,远程狙击驾驶室,却找不到证人的相关资料.在车上安排了人,还要费劲心思找个前警察来干这事,一切都是说不通的脑残.话说车上的人都没有4G信号了?不能偷摸发个信给好友.驱魔夫妇大战营救叔,也没什么大战,打斗动作细分很少,总体一般吧,不能细品,6分.",0
2,7056414,通勤营救,sunking,77089569,还行,2018-07-23,20:14:10,连姆尼森这么大岁数了还在坚持，值得敬佩。相比其他那些过气动作明星只能拍拍二三流的烂片，连姆尼森还能登陆主流院线。至于电影本身还是中规中矩，很连姆尼森式的苦逼英雄片。,0
2,7056414,通勤营救,草帽岳飞,44290871,还行,2018-10-22,23:40:47,不喜欢看连姆·尼森被人按在地上摩擦，还是更想看他花式吊打别人。,0
2,7056414,通勤营救,无聊,150948299,还行,2018-04-09,13:43:22,紧张感可以，可设定太扯了，尼森老了感觉打不动了啊,0
2,7056414,通勤营救,Sh@rk,sharkspeare,还行,2021-06-29,22:58:09,老爷子例行营救，居然和孤儿怨导演四度合作了。。挺简单一故事，很用力地想讲得高级，当观众注意到这种用力，就无从高级了。。,0
2,7056414,通勤营救,电影Mark,moviemark,还行,2018-03-20,21:53:22,剧本不够精致，悬疑还是弱了些。没什么惊喜。,1
2,7056414,通勤营救,乐安蓝,neverblue,推荐,2018-04-05,00:45:24,还可以，不应该那么低分,0
2,7056414,通勤营救,黑刀,heidao,还行,2018-04-05,02:04:08,杀人游戏，剧本算是比较聪明。以后可以再看一遍。,1
2,7056414,通勤营救,Mamacita117,139657634,较差,2018-04-03,13:53:56,当初飓风营救异军突起无非是凌厉的动作剪辑和我说要弄死你就一定弄死你的牛逼轰轰，结果后面的营救就开始各种做加法，换个身份，换个阴谋，换个环境，罗列来去，只能记得连叔一次又一次的跑来跑去，爬上爬下，何必呢这是…,0
2,7056414,通勤营救,梦行30,57080555,较差,2018-04-04,22:32:49,拜托！不要让连姆老爷子再受苦了，演点普通老爹也可以啊，这么多老动作演员依然拍打戏看的我都于心不忍。电影有够乱的。本来挺好的火车密室设定，硬是莫名其妙的叙事和节奏，把悬念打破，让人空虚。一句话，脱了裤子你就给我看这个？最后不知所云，只记得，那一刻，我们都是挺身而出的英雄？呵呵呵。,0
2,7056414,通勤营救,一事无成孟烦了,liaozhai,还行,2018-12-22,01:34:51,前面比后面好看点,0
2,7056414,通勤营救,凉,iwei,还行,2018-03-30,22:50:36,规规矩矩的连姆尼森式动作片。格局小，但故事说的很圆，有悬疑有反转，麻雀虽小五脏俱全。那句经典的“I swear ...”还是说出口了，可以说是『营救』宇宙系列的彩蛋了。连姆尼森大战招魂夫妻。033018，六里桥银座恒业。,0
2,7056414,通勤营救,R,35409946,较差,2018-04-09,14:49:58,女神就配了个音 还我票钱,0
2,7056414,通勤营救,小噢哩,10011120,力荐,2018-04-04,09:03:05,老爷子真是不容易，一把年纪还要扒火车。开头原声特别赞，已经单曲循环n遍。档期不好，排片太少了。十年通勤路，下班还要ﾍ(´ー｀ﾍ)搞事情哈哈。,1
2,7056414,通勤营救,哆啦Z梦,4275367,还行,2018-04-06,13:46:01,短评里写的叔勇斗招婚夫妇笑死了，开头的快速切换还是挺喜欢的，全片节奏也不错，一个点接着一个点，火车出轨意料之中，群众们纷纷是我是我没想到，搁国产片里肯定被骂主旋律假大空，最心疼的还是mike叔的死，一路走好别站第一排。,0
2,7056414,通勤营救,杨零度,sethyoung,还行,2018-04-19,08:56:42,剧情挺硬,0
2,7056414,通勤营救,猫久禧,yao2harry,还行,2018-04-05,19:45:10,老骥伏枥，他还是英雄hero ，这个系列出下去我还会看的！连姆大叔带眼镜的时候真是超级斯文,0
2,7056414,通勤营救,平行世界,Winnie2100,推荐,2021-08-10,19:16:27,CCTV6佳片有约，还是挺不错的。,0
2,7056414,通勤营救,求索溪熬夜亚军,baicaitai,,2018-03-31,22:24:51,骗人啊！维拉.法米加就两段镜头！加起来不超过5分钟！方便面包装都不带这么骗人的啊！,0
2,7056414,通勤营救,子不语,85333070,还行,2018-04-20,21:55:56,生活已经如此艰辛，为什么还要如此折磨一个老男人……,0
2,7056414,通勤营救,星竹,36621770,推荐,2019-10-02,23:34:41,连姆尼森每年来这么一部真的很努力 拍的片子也有一定的水准 能在如此狭小的空间里凑出一百分钟的片子还不注水真的不容易,0
2,7056414,通勤营救,豆瓣派之托尼,50203188,,2018-06-20,09:03:47,用号称“多媒体创意大本营”的UbuntuStudio 18.10 Cosmic 20180617自带的Parole播放器软件看的。居然没有禁用屏幕保护或节能--因为看了一段时间之后，显示器亮度会变暗，得手动按下键盘或鼠标才能恢复。,0
2,7056414,通勤营救,段郎RockDuan,rockduan1987,还行,2018-07-22,17:37:04,连姆尼森一辈子都在营救别人，好累啊……,0
2,7056414,通勤营救,AMY园,amyli1989,推荐,2018-04-01,10:59:48,90年代英雄动作片风,0
2,7056414,通勤营救,熊能能脚不沾地,newbear,推荐,2018-04-07,22:57:29,不错不错,0
2,7056414,通勤营救,slipknot,42857942,还行,2019-08-21,10:30:30,尼姆联森陆的拍了，空的也拍了，就差海的没拍了！,0
