﻿page_index,movie_id,title,username,user_id,rating,date,time,comment,useful_count
1,7056414,通勤营救,江寒园,63306399,还行,2018-04-01,14:18:28,nice,0
1,7056414,通勤营救,勾陈一,linyoung,还行,2018-04-02,01:49:53,六旬老翁通勤绿皮车大战神秘人事件,1
1,7056414,通勤营救,叩歌,62604143,较差,2018-04-06,17:56:52,1、放过老爹吧，临退休了还要营救，心累；2、用了很长的篇幅才进入正题，拖沓，节奏差，一小时才打了一次，心塞。,0
1,7056414,通勤营救,凝烬,47661856,较差,2018-04-10,20:47:28,剧情有BUG，为什么电话那头对主角的动态了如指掌？主角的正义感来的也是莫名奇妙。怎么看都别扭的一部影片。,1
1,7056414,通勤营救,白云在青天,47925189,力荐,2018-04-06,15:38:48,I'm Prynne.,0
1,7056414,通勤营救,空山,139964679,较差,2018-04-07,01:03:43,其实这部电影讲的是什么呢？是，如果你在被辞退那天还肯加一会班，就不会在下班路上遇到危险。（一个被工作压垮的可怜人如是说）,0
1,7056414,通勤营救,De Ajacied,siemielu,还行,2018-01-12,03:43:50,Nah... 看看动作特效什么好了…,1
1,7056414,通勤营救,sheeparker,sheeparker,还行,2018-01-26,06:40:46,略扯 不如non stop,0
1,7056414,通勤营救,喜宴,anothers,推荐,2018-11-17,16:02:02,连叔很帅，片尾曲很好听，某人车上打电话时的一句“钱你拿了吗”就已经暴露了…,0
1,7056414,通勤营救,索博斯基,72882574,还行,2018-04-14,11:14:06,6/10，很一般通俗电影，主要是结尾有些90年代感。连穆继续他各种营救计划，前半部分还算精彩。,0
1,7056414,通勤营救,我爱沙尘暴,42295837,还行,2018-04-12,14:05:04,演员不错,0
1,7056414,通勤营救,小石匠,coolchuan,推荐,2018-04-11,20:54:41,这种禁闭空间的作案，永远不缺乏活力。哦！,0
1,7056414,通勤营救,飞客流依,fikirui,推荐,2018-05-12,01:13:55,想了半天没想明白为什么找个目击证人要花那么多功夫……,0
1,7056414,通勤营救,冬叶,34820112,推荐,2018-12-31,18:47:27,心疼连姆尼森。。,0
1,7056414,通勤营救,𝗟𝗼𝘂🍅,louis15yao,较差,2018-04-09,16:08:30,点解可以拍得咁鬼唔吸引,0
1,7056414,通勤营救,"杉小爱|好姑娘,咱们走起来",OneiLulu,还行,2018-06-05,14:30:22,连姆尼森一辈子都在救别人，马特达蒙一辈子都在被别人救，他俩应该合作拍部电影，让连姆尼森来救马特达蒙。,0
1,7056414,通勤营救,Tom Light,xhlaxhla,还行,2018-03-31,22:12:20,Vera Farmiga和Patrick Wilson越来越有CP感了。Liam Neeson66岁了，可以颐养天年，为啥还要不断救家人？这个人设真是挥之不去了？ o(╥﹏╥)o ,0
1,7056414,通勤营救,Sissi,Sissi17,推荐,2018-03-31,21:11:59,十年前就在想年近六十的连姆尼森还能拍几部营救系列，结果十年后还有，并且是系列最佳。,0
1,7056414,通勤营救,凤尾狐,kingcopushu,还行,2019-04-22,01:05:35,剧情有点扯，看看还是可以的,0
1,7056414,通勤营救,好好活着信仰q,50747236,还行,2018-12-23,01:45:42,自圆其说就不错咯,0
1,7056414,通勤营救,黄苦儿,82763376,推荐,2018-08-17,00:44:32,喜欢这个霸气的结局,0
1,7056414,通勤营救,腹有诗书肚子大,shaxianfen,还行,2018-05-19,20:43:09,连姆·尼森60了，看着他气喘嘘嘘的打斗，有点英雄迟暮的悲壮了。但是我猥琐的想了一个问题，他都被解雇了，还算通勤吗。,0
1,7056414,通勤营救,大貓騎士🦁️,iplus26,较差,2019-02-17,00:47:31,Liam大叔拍完《空中营救》之后同个剧本拍了地铁版...,0
1,7056414,通勤营救,MovieFace,58080207,,2021-11-29,13:37:50,连姆尼森这个年纪也太拼了，吐槽后半部分画面太暗了，你想让我看啥，啥都看不到啊,0
1,7056414,通勤营救,#烧光光#,Kafka663,还行,2018-04-07,01:23:09,除了故事后面很扯以外，整个很好看，成功抚慰了一个劳累工作一天的人,0
1,7056414,通勤营救,Ying_0111,53021898,还行,2018-03-31,01:27:20,逃出封闭空间重新跑上列车和列车脱轨的戏挺好看。本来是想看维拉法米加，可是她只出现在了两三场戏里，更多时候都是“声音出演”。最不满意的地方就是那个证人刚起来换位的时候就觉得应该是那个人了，结果还真是……主角呢还要等到怀疑的对象都一一剔除了才发现，这算是反转的话也太老套了吧？三星半,0
1,7056414,通勤营救,孤狼,46818877,还行,2018-04-02,23:07:56,"这类电影越来越少了
难得有，就看看吧",0
1,7056414,通勤营救,隔岸之雨,searchforriver,力荐,2018-04-01,00:06:30,大叔老了还要这么拼 好心疼啊,1
1,7056414,通勤营救,Vulpecula.h,Vulpeculae,还行,2018-03-31,19:33:30,60多的连姆尼森(被)打成这样也是够可怜的。话说翻译挺逗的 这几年他的片子全都不是直接翻译全是翻译成什么什么营救 别说还都是差不多的套路 中年大叔的个人英雄主义。,0
1,7056414,通勤营救,Nineveh,NinevehQ,还行,2018-04-09,03:43:57,3.5,0
1,7056414,通勤营救,犯罪,55864948,推荐,2018-04-03,23:28:40,有别于之前几部救家行动，不再把动作场面放在重心，居然把悬疑氛围弄得像模像样，不错，可以一看！,0
1,7056414,通勤营救,梦飞扬,53238292,还行,2018-06-25,18:10:35,大叔很拼，值得敬重，名字很low，开了个好头，却烂尾了,0
1,7056414,通勤营救,阿潘,jackieatdnv,还行,2018-01-17,01:11:43,老牌美国英雄片。,1
1,7056414,通勤营救,一十一,53659864,推荐,2018-04-06,15:29:48,没有想到连姆尼森可以完成如此精彩的独角戏，出彩程度甚至比起那部更优秀的飓风营救还要胜过一筹。,0
1,7056414,通勤营救,mark,1215748,较差,2018-06-11,01:15:54,营救叔又一力作，除了在通勤火车上这一个点以外，不管是斗智还是动作都泛善可陈,0
1,7056414,通勤营救,Valium,52817746,还行,2019-01-21,15:03:42,结尾倒是圆回来一些，故事也还可以，但拍的太烂了，节奏太差，打光也让人看不下去，要是好导演拍说不定会很不错,1
1,7056414,通勤营救,拂袖斋客人,skysnow5201314,还行,2018-06-11,14:57:47,"11'17""：Be careful with this one.埋下千里伏线啊！",0
1,7056414,通勤营救,nanawoo,2604988,还行,2018-04-04,21:23:37,及格动作片 中规中矩,1
1,7056414,通勤营救,左眼看电影,nicdone,推荐,2018-04-10,23:13:42,连姆尼尔森的营救宇宙，从飓风营救到空中营救再到这部通勤营救，还期待海上营救、太空营救，不过可能要终结了，因为连姆尼尔森已经65岁，不再拍动作片了,0
1,7056414,通勤营救,wallace李,wallaceLee,还行,2018-04-23,18:21:06,还行吧？,0
1,7056414,通勤营救,外苏,suh5213,很差,2020-08-24,22:42:04,好难看啊……这辈子都get不到连姆尼森了吧我,0
1,7056414,通勤营救,子夜奔腾,43409918,还行,2018-07-28,19:41:15,5.9,0
1,7056414,通勤营救,米线儿,27289465,还行,2018-03-30,13:54:01,大概因为看之前没抱太大希望，结果比想象的好看。故事大背景(一如既往地)有点立不住，不过悬念啥的还是挺精彩的，连姆叔爬火车的戏也很吓人，66了啊很不错了！作为商业动作片来说及格了。一男一女两个反派觉得特眼熟，看了影评才知道原来是招魂两口子。,0
1,7056414,通勤营救,WrongMe,gu90,还行,2020-12-10,21:32:17,所以到底是啥证据啥犯罪让一众权贵如此不择手段色令智昏……只能脑补一个阴谋论式的幕后黑手了。,0
1,7056414,通勤营救,请叫我腹黑,metkee,还行,2018-04-01,20:07:24,连叔这辈子就逃不开救人的命运，从救老婆救女儿到救陌生人，被打被虐已是家常便饭。,0
1,7056414,通勤营救,今生、唯爱,72520254,推荐,2021-05-08,23:03:14,"人家六十几岁的老同志还这么拼
还有什么懒惰的理由呢",0
1,7056414,通勤营救,头比人大,167926921,还行,2021-08-08,15:16:35,除了连叔和设局，其他都很乏味,1
1,7056414,通勤营救,流光溢彩`,23034235,还行,2018-03-31,17:27:26,前两幕的故事铺垫和节奏都很顺利，但切断车厢之后就泄气了啊！尼森的妻儿那么轻易就被救了，让这条本该是最重要的线变得鸡肋，墨菲死后号称只手遮天的反派几乎没有任何还手机会，搞的好像事件核心是墨菲一样。此外，作为动作片，并且还是十分精彩刺激的动作片，本片CG特效用的太过量了，有些喧宾夺主。,0
1,7056414,通勤营救,luer..一串字母,luerdelphic,还行,2018-04-18,00:26:12,挺悬疑，但悬疑就像魔术，解谜的恍然大悟才是点睛之处。这个电影就是坑太大，填不起，很有艺术感的挖了一个坑，最后却用一团乱草胡乱塞这个窟窿。到底是谁泄露了目击者的行踪？为什么神秘女叫她“普兰”（是目击者看的《红字》主人公的名字？为什么谈判连姆不直接要求见媒体公布证据.。blablabla。。。,0
1,7056414,通勤营救,多多洛,cerrol,还行,2018-03-30,20:32:34,从《飓风营救》1、2、3，《空中营救》到《通勤营救》，从退役特工到空警再到转行卖保险至即将退休却被fire的中老年原警员，从救女儿救妻子救乘客救证人救来救去的折腾，这些年尼森叔的营救路线不曾停止，真的要对尼森叔说一句：叔，你辛苦了！不过尚无赶超《飓风》1的经典，最初的美好永远不破。,1
1,7056414,通勤营救,老泰瑞,ccva,还行,2018-04-01,14:35:37,可能最大的bug就是列车的设定吧，开头像科幻片，结尾像灾难片，《招魂》夫妇的人设太难改变了，所以看着没什么惊艳效果。但连叔一把年纪了还在拯救世界，看着心疼。,0
1,7056414,通勤营救,明年今日,1387854,力荐,2018-04-05,23:25:50,打五颗星提提分。至少四星。其实我的看点一开始是招魂夫妻档，结果两人打了一手好酱油，全程Liam叔叔各种能打，跟黑人小哥那场打戏长镜头蛮过瘾。我们一家三口看得紧张刺激，有套路但是完成度好，超出预期，看完很舒爽。,0
1,7056414,通勤营救,星夜桐影_TV5XQ,tvxqmilk,推荐,2020-01-19,21:36:24,有時候被陷害百口莫辯，但真相會自己說話。警察朋友也只想幫助失業的老朋友，可惜了。,0
1,7056414,通勤营救,BIGD,1797671,还行,2018-05-02,04:35:35,没有女儿老婆救。总觉得没那么刺激了,0
1,7056414,通勤营救,梵顿Kirin,140116141,推荐,2018-03-31,15:19:51,"因为有沃伦夫妇 所以4星 
剧情设置没有代入感 找Prynne的过程也不悬疑也没有任何亮点 
整部电影bug还蛮多 
但是结局还行吧 
我的维拉女神就只在开头和结尾露面 中途全是只有声音出场 不开心 虽然维拉女神胖了点 但还是美 
",1
1,7056414,通勤营救,阿五,140594033,还行,2018-03-31,14:59:48,太惨了，在Liam叔的电影里不管他是什么职业最后都得踏上一条救人的不归路（x）。,1
1,7056414,通勤营救,Miss1708,vivianflower,力荐,2021-02-07,14:00:27,最近疯狂迷这个老大叔啊,0
1,7056414,通勤营救,八月槎,quills,较差,2018-05-14,10:58:12,剧本太尬，半个小时弃,0
1,7056414,通勤营救,lostmore,lostmore,还行,2018-04-01,01:06:55,期待很久的电影，不太好看，有些零散，不太紧张，没有空中营救好看，也没什么反转，很多地方都很好猜，太多电影的影子，和女主演的源代码比起来差了很多，其实可以拍的更黑暗一些，死的乘客还是太少，猜哪个顾客到还可以。和生死时速比起来还是差了很多。最后的火车的特效好假，没有大片的特效好。,0
1,7056414,通勤营救,盆栽金鱼,47331203,推荐,2018-04-12,01:22:51,空中营救变成火车营救，好看过瘾，合格紧张到握紧拳头的爆米花大片。,0
1,7056414,通勤营救,发条橙,76630020,还行,2018-04-16,08:36:22,所有的悬念其实都能猜到个八九不离十。,1
1,7056414,通勤营救,资深低阶路人,92775477,推荐,2018-04-03,01:09:14,连姆·尼森52年的，都66了还在打，火车脱轨那一刻的主角光环可以照亮地球。看到Jonathan Banks很开心,0
1,7056414,通勤营救,t0psh1t,YthguaN,较差,2018-03-20,22:00:14,又名“沃伦夫妇的失败卧底行动”？剧情故作玄虚其实一点吸引力都没有 快让Liam大叔跟巩皇去谈恋爱吧 别整天营救了我的苍天呢 ,0
1,7056414,通勤营救,身体大师,61736839,还行,2018-06-12,21:28:20,只能算是一般，开头的确还有悬念让人忍不住一直想看下去，不过最后感觉有点没啥意思。,0
1,7056414,通勤营救,不懈不戒,buxiebujie,推荐,2018-07-29,20:44:50,开头设的局不错，悬疑感十足，虽然最后圆得不完美，但不影响整体观感。一些颇具亲情色彩的小细节铺成也挺令人唏嘘感动。,0
1,7056414,通勤营救,末药煎肉塔,1454015,还行,2018-04-03,00:30:46,救救老人！,0
1,7056414,通勤营救,荒淫少女朴赞郁,bushuai1,较差,2020-06-30,16:04:07,强行人性本善,0
1,7056414,通勤营救,红皇后,yican,还行,2018-04-03,16:12:49,个人感觉好过飓风营救，题材还算比较讨喜，每天路上同车的人你是否有好奇的打量过，虽然有bug，但是节奏快，又很紧凑，所以观感不错，就是结局是不是有点太大团圆了？,0
1,7056414,通勤营救,Cat,kitty_cat,推荐,2018-11-28,21:54:25,大叔好辛苦，不是在营救就是在去营救的路上,0
1,7056414,通勤营救,声色画报,24274750,还行,2018-04-05,00:25:10,导演是个玩悬疑的老手，但这个作品还是比较粗，也有些老套的东西。尼森好老了，还在拼。,0
1,7056414,通勤营救,Moesama,dearnotwo,还行,2018-06-06,15:20:15,总体来说 整个电影下来连大爷打架基本上没赢过 这才符合逻辑 题外话有没有发现现在的电影调色滤镜都严重有问题 为了制造悬疑惊悚的气氛 拼命的往黑里做 啥他妈的也看不着啊! 睁眼瞎啊! ,1
1,7056414,通勤营救,凹凸曼,56970395,还行,2018-04-07,22:54:44,营救叔大战驱鬼夫妻档。四星妥妥的，结局的时候大家抢着站出来这个桥段扣两星都不多。,0
1,7056414,通勤营救,睿蕊,1978997,较差,2018-01-28,13:28:14,看的我不耐烦 想睡觉,1
1,7056414,通勤营救,王写写,dreamending,较差,2019-06-16,21:29:53,把所有乘客集中在后车厢解谜的时候像东方快车谋杀案，结尾集体普兰也太硬核了,0
1,7056414,通勤营救,萬和生,4378595,推荐,2018-04-07,12:04:30,廉颇老矣，能不打就不打了，靠脑力取胜。,0
1,7056414,通勤营救,旺仔流奶,63663780,推荐,2018-03-31,09:34:45,全球营救专业户连姆·尼森通勤快线手撕《招魂》夫妻档。66岁高龄还能战斗在好莱坞一线揍人和挨揍，用充满磁性的嗓音给你安全感，必须给大叔一个好顶赞。中规中矩好莱坞制作，除了长镜头车厢打斗，惊喜不多，但值得一张电影票。期待一辈子救别人的大叔和一辈子被人救的马达有生之年来一次激情碰撞～,0
1,7056414,通勤营救,张腾森,52470011,还行,2018-03-31,16:35:06,动作、悬疑、灾难三种类型的融合，选择现代都市人最熟悉的上下班通勤为故事背景，剧情本身有点故弄玄虚，但节奏把握得不错，算是一部制作精良的电影；越老越能打的连姆尼森大叔刚刚营救飞机，又营救火车，下一部海上营救？？,0
1,7056414,通勤营救,深溪虎,Mercury9999,较差,2018-05-23,23:21:37,有种把背景换成天朝春运再拍一遍？,0
1,7056414,通勤营救,NICOLE,KATHLEEN285,还行,2018-01-21,10:28:09,"情节简单，动作刺激惊险加分
累的缘故看得昏昏欲睡，整体看还行吧 ",0
1,7056414,通勤营救,三色堇紫,w2248605855,还行,2019-12-07,16:38:56,连姆·尼森之营救系列影片。,0
1,7056414,通勤营救,a什么hj,littleisle,还行,2019-03-08,13:23:11,永远无法避免出轨的奔驰列车和永远都在救人的连姆尼森。以及从史泰龙到布鲁斯威利斯，从成龙到李连杰，每每看见动作巨星的皱纹与疲态，都有一种英雄迟暮的心有戚戚。,1
1,7056414,通勤营救,肆意,3446335,力荐,2018-04-01,22:04:07,连叔,0
1,7056414,通勤营救,私恋失调,46682134,还行,2018-04-17,18:22:20,我看的营救系列第一部，还蛮好看的啊,0
1,7056414,通勤营救,花生,115707608,还行,2021-10-21,17:23:23,国庆节看的，电影放到一半，我姐突然来了句，这次不是救他女儿啊？！,0
1,7056414,通勤营救,Woody,IncredibleWoody,还行,2021-06-14,23:43:20,悬疑氛围还不错，有一幕穿过整条列车的镜头很棒，火车外几场动作戏足够惊险刺激。不过推理情节一般，可能不是主要卖点吧，无所不能的幕后组织设定似乎也没啥说服力，就是个推动剧情的工具。这样说来还挺像近年来的柯南剧场版呢~:-p ★★★☆,0
1,7056414,通勤营救,けんちゃん,KatoShigeaki,还行,2018-05-12,22:07:27,好人坏人傻傻分不清,0
1,7056414,通勤营救,FEI,2245827,推荐,2018-05-12,10:21:59,格子间🐶在路上救人自救~倒是开头那几分钟真心是道出了数十年如一日勤恳丧班的格子间🐶随时卷铺盖走人被房贷车贷学费各种账单负累击溃的所谓中产人生的脆弱与可悲……,0
1,7056414,通勤营救,冬瓜,senor,还行,2022-01-31,22:25:57,快看完才惊觉《招魂》的男女主角都在其中。,0
1,7056414,通勤营救,ILM,3167300,还行,2018-03-31,20:31:20,没有Taken好,0
2,7056414,通勤营救,环化生材穷三代,74862253,较差,2018-03-30,19:41:40,女人主动搭讪一定要警惕！邪恶的资本家解雇老员工！美帝官警勾结谋害人民的好干部！所以好干部究竟为什么被扔下楼去？到底是谁在开上帝视角操盘全局？,1
2,7056414,通勤营救,有个影迷,wokoo,还行,2018-04-02,16:04:44,有bug，也有魅力。,0
2,7056414,通勤营救,Johnny Fung,jazzbon,还行,2018-04-06,15:45:51,连姆好拼啊，卡司表的设计挺有意思的。,0
2,7056414,通勤营救,Merov Mugatu!,merovingianeven,较差,2018-04-01,16:03:06,人肉版“鹰眼系统”太弱了，人家可是连电缆掉下电死人这种事都做得到的P.S. 看样子连姆尼森还能再打十年,0
2,7056414,通勤营救,黄小佳,huangshiren,还行,2021-11-29,20:15:20,悬疑的有点多了，交代的也不是很清楚。节奏感把握的还是可以的。气氛渲染的非常好。,0
2,7056414,通勤营救,会花光的金子,2712953,还行,2018-04-02,21:34:54,整个过程很精彩，但为了神秘感和制造悬念不合理的设定也比较多，比如女反派根本没必要亲自出面，其实去掉点动作元素，在悬疑上再下点功夫，本片会是经典。不管怎么说，大叔这把年纪还能开启营救宇宙，实在佩服。招魂夫妇这回一起腹黑了,0
2,7056414,通勤营救,娓娓,dinosaw,力荐,2018-12-15,21:34:33,连姆尼森就适合演退休警察啊。维拉可能还会走奥斯卡的路。为什么我永远都不能先看出谁是坏人呢……通勤火车超级神奇。还有咱们的wp,0
2,7056414,通勤营救,pssn1314,62577024,还行,2018-04-07,23:05:20,纯纯的美国片,1
2,7056414,通勤营救,墨惜之,shooan,推荐,2018-04-01,18:13:58,还是挺好看的！为老爷子捏把汗啊！,0
2,7056414,通勤营救,VincentP,57523661,还行,2018-04-06,09:23:09,《招魂》里的捉鬼夫妻退休之后搞起了暗杀的勾当,1
2,7056414,通勤营救,你也疯了,159633375,,2018-03-30,15:23:29,这大叔跟【营救】杠上了吧,1
2,7056414,通勤营救,拔刀诀,1182787,较差,2018-03-31,20:24:11,套路得不能再套路～,0
2,7056414,通勤营救,施晓波,63211106,还行,2022-04-12,11:42:54,被片名骗了，以为是飓风营救的续作。好吧，也不难看，就是剧情上的问题太多了。家人怎么就被警方救下了，编剧这是偷懒了吧。初期无所不能的反派，结尾就？？？,0
2,7056414,通勤营救,Arabesques,philia_eo,力荐,2018-07-28,15:59:15,惊心动魄挺不错的~,0
2,7056414,通勤营救,leo,1414370,还行,2018-03-30,23:09:26,连大叔怎么又又又演了这样一部电影？还是翻译故意翻成这样？大叔你能不救了吗，都打不动了,0
2,7056414,通勤营救,Hangain,137169217,推荐,2018-04-03,12:51:26,表象营救家人，实则与政治黑暗作斗争，营救国家，衬托出警察的高尚与无私。通勤人员年复一年日复一日工作生活，都不曾想如何改变自我，是麦考利改变了他们的生活，任何时候都不要被表象所迷惑。影片中的动作戏惊险刺激揪人心，真心为花甲的连姆大叔捏把汗。,0
2,7056414,通勤营救,幼银,annsniper,还行,2018-05-13,22:23:20,感觉有点老套。。,0
2,7056414,通勤营救,Alec,143433332,还行,2018-06-17,18:07:30,7/10分。冲着惊悚/动作来看的，看的还算过瘾。就是最后结尾差点劲啊，说的那么大阴谋，牵扯那么多高层，最后既没抓点大人物，又没把证据爆出来，缺点什么似的。,0
2,7056414,通勤营救,karenlin,48666472,还行,2018-04-05,20:23:54,3.5/5 连姆大叔一把年纪了还在拼。还不错的电影，有点小套路，但看着也一气呵成。,0
2,7056414,通勤营救,小猪泡汤,cuisandy,力荐,2018-04-01,01:03:49,一部爆米花电影居然有一个文艺片的开头,1
2,7056414,通勤营救,西瓜大侠女,iloveperfect,推荐,2018-03-30,20:39:49,也就3颗星，但说真的，60多岁的大叔还要这样拼，确实心疼，多给一颗星！当然了，全片也是很紧凑的，完全没有睡点，尤其刚刚看完《第三度嫌疑人》一对比……原来果然是一趟列车上发生的事啊！每次看大叔挨揍都特别不忍看！虽然感觉像美国正能量主旋律但毕竟这世界需要“高尚”。安贞UME1号厅人还真不少,0
2,7056414,通勤营救,导演摄像路人,46703304,较差,2018-03-31,17:48:02,不及格！,0
2,7056414,通勤营救,蛮蛮,lizheng1982819,还行,2022-01-28,20:04:07,3星，老腊肉老而弥坚， 尊重老人，特此加分。,0
2,7056414,通勤营救,轨迹猫,SokSolon,推荐,2018-04-11,03:33:26,"18.04.11★★★★
https://movie.douban.com/review/9288094/
通勤救援:我都60岁了 还能再给他们什么
如果你想知道上帝对钱的看法，只要去看看那些他给了钱的人就知道了----这句话是什么意思?

只是我突然想到 It just occurred to me that most of us,
车厢里大部分人每天都乘坐这列火车 we ride this",0
2,7056414,通勤营救,柏拉不图,planoto,还行,2018-04-03,22:42:50,这么大年纪了，还让人家扒火车，好莱坞真残忍。另外，让《招魂》两口子来演，真的很让人出戏啊。,0
2,7056414,通勤营救,哗啦啦,hualala,还行,2018-05-06,13:49:16,大叔系列套餐，这回考密闭空间。,0
2,7056414,通勤营救,joemayxu,joemayxu,还行,2018-04-29,23:29:26,一个下岗再就业的故事,0
2,7056414,通勤营救,月下劈云笑一声,2125570,较差,2018-04-01,20:58:32,什么都差一点，故事差一点，悬念差一点，动作差一点，表演差一点……加起来就差许多了。,0
2,7056414,通勤营救,Andrea,casoon,推荐,2018-04-05,19:59:41,挺好的，效果不错还有我喜欢的演员，拍摄风格也很棒。叔天天救人，警察局不请他做代言人天理不容。,0
2,7056414,通勤营救,phoenie,phoenie,推荐,2018-04-06,01:24:05,从被人布局操控到翻盘抓住主谋，大叔真厉害啊！,0
2,7056414,通勤营救,悠公子,146797984,还行,2021-07-11,20:48:06,同样是在封闭的环境里找出目标，跟《空中营救》差了十个《飓风营救》,0
2,7056414,通勤营救,王别树,wtforz,还行,2018-04-01,11:48:22,最大感慨是米国中产真是存不下钱，一个人失业全家就要喝西北风，还有维拉·法米加是跟帕特里克·威尔森捆绑销售买一赠一吗。,0
2,7056414,通勤营救,徐友惟,xuyouweit,力荐,2022-10-17,01:28:11,都是普兰时 立住了 人间值得,0
2,7056414,通勤营救,夏天11,1732296,推荐,2019-03-13,20:34:47,连姆尼森永远在救别人，一辆疯狂的列车，每个人都站起来说自己才是目击者的时候，非常感人。,0
2,7056414,通勤营救,海遨,encre,力荐,2018-04-30,22:44:17,为啥分数这么低，高品质爆米花，就算是爆米花也是优质爆米花！,0
2,7056414,通勤营救,蒋思诺,194079855,力荐,2019-06-26,14:12:07,好看,1
2,7056414,通勤营救,peipakoa,tangniluobo,还行,2019-10-31,14:48:51,中间过程精彩，最后的小反转及其没必要。,0
2,7056414,通勤营救,MaclovenZD,MaclovenZD,较差,2018-04-05,15:39:09,佐米·希尔拉执导的惊悚片履历表，就是看下去的理由。没有什么惊喜，也不算浪费时间。,0
2,7056414,通勤营救,zzfznp,zzfznp,还行,2018-04-07,19:31:55,连姆叔打斗弱化，脑子还是很灵活。剧情挺紧凑，只是套路有些老。背后指挥的人这设的局是不是有点过于复杂了，过了那么多手，不确定性大大增加啊。,0
2,7056414,通勤营救,阿底,adi,还行,2018-04-03,11:23:45,及格动作片，就是后半段不过瘾。自从连叔当上了打星，电影的译名就都变成了“营救”系列。看60多岁的人还在屏幕上奋力卖肉，感觉自己不好好工作也是对不起人生啊。,0
2,7056414,通勤营救,空思,szeze,还行,2018-12-15,12:42:15,开头表现时光流转的一段，剪辑很惊艳，后面的情节就有些扯淡了,0
2,7056414,通勤营救,想念season,tinatang0609,还行,2018-04-15,17:51:13,打戏很牛逼，但剧情有点呵呵,0
2,7056414,通勤营救,格林童话,56906475,较差,2018-08-28,12:27:44,不要考虑剧情，打斗其实也不怎么地……,0
