page_index,movie_id,title,username,user_id,rating,date,time,comment,useful_count
1,1892134,夺命来电,Minder,ACE18865185199,还行,2020-10-27,21:58:03,按原著好好拍应该会不错，改的啥也不是，很多东西根本没交代清，拍成剧差不了,0
1,1892134,夺命来电,古月魅影,57876333,还行,2019-10-15,00:20:56,三星半,0
1,1892134,夺命来电,星空,72936086,还行,2017-10-16,09:53:50,是编剧想告诉大家珍爱生命，远离手机的道理,0
1,1892134,夺命来电,卡拉马佐夫,52519737,还行,2016-06-13,14:07:10,用手机在b站看的 主题其实很简单，以前的丧尸片是病毒控制人类，这部片子是讲的手机。红衬衫是主角话的这点很想《战栗黑洞》，但剧情太平淡，结局有反转也是回天乏术，操场和绕电塔场面还是很大。,0
1,1892134,夺命来电,人间情感观察员,68020726,较差,2017-04-19,18:16:11,什么玩意,0
1,1892134,夺命来电,衡景景,181907766,较差,2018-11-08,14:26:24,烂透了的改编,1
1,1892134,夺命来电,葛紫苏,geniuskathy,还行,2017-11-27,17:52:40,什么时候看的忘了，上半年？20171127,0
1,1892134,夺命来电,拂北,189311195,还行,2019-03-10,21:49:42,"三个主演不错，配角有些差强人意。剧情，立意还是可以的，但剧本略显单薄，发挥空间还有很大没发挥出来，不够饱满、充实。可惜了几个演员都是很好的演员......
",0
1,1892134,夺命来电,a,1275549,较差,2016-07-11,10:02:43,库萨克越来越像那个叫凯奇的家伙了 然后 他的电影。。。大家都懂,1
1,1892134,夺命来电,PANDA-MAN,55753594,很差,2018-12-26,14:50:14,手机丧尸。黑乎乎什么也看不清，导演是瞎吗？,0
1,1892134,夺命来电,肖申克的囚徒,zhenzhenzi,较差,2019-05-05,22:50:20,拍的啥玩意？漫不经心的看完了。然后看影评解析竟然是全是漫画男主角幻想出来的？那可真是脑洞大开。,0
1,1892134,夺命来电,玉波殿下,140728654,较差,2019-04-11,22:25:06,都没有个原因的，手机可以向人类感染病毒，被感染的人喉咙里发出怪声就可以互相联系并传染给他人，而且只能感染人？动物不行吗？最后主角也被同化了？烦死了，z.f不能直接给颗原子弹吗？,0
1,1892134,夺命来电,Mizar,169923258,还行,2019-08-01,12:59:32,不太好，挺好的题材却拍的莫名扯淡,0
1,1892134,夺命来电,山阳月阴,176431975,还行,2022-08-21,22:40:12,以前不知道什么时候看的,0
1,1892134,夺命来电,Valk,Valk,还行,2018-06-06,02:54:28,开局挺好，后面就那么回事了。。。,0
1,1892134,夺命来电,AgathaChristie,160899849,较差,2019-08-20,23:24:57,丧尸就是比喻玩手机,0
2,1892134,夺命来电,dz902,dz902,还行,2016-06-27,15:40:47,挺悚的,0
2,1892134,夺命来电,無名,73112329,较差,2016-06-11,19:02:50,"看片頭就可以了,,之後的都是垃圾",0
2,1892134,夺命来电,莫萨听,mosatsu,很差,2016-06-12,13:26:52,看完只有一种“什么鬼”的想法,0
2,1892134,夺命来电,达尼苟头,52722463,较差,2017-03-08,23:06:22,创意很好，但结局也太流于俗套了。低头族的警言吗？还有这五毛特效也太令人无语了。,0
2,1892134,夺命来电,李夸父,48604788,很差,2016-12-25,14:59:51,"20161223 萍乡酒店MacBook 
莫名其妙地演变成了僵尸片，太恶心了。
本来是个很好的讽刺题材，结果( ･᷄ὢ･᷅ )",0
2,1892134,夺命来电,楼上的石头,21282914,推荐,2016-06-25,07:35:52,叫你玩手机，叫你玩手机，叫你玩手机。玩个手机变成僵尸，有创意。僵尸一起放歌，一起大圈。导演是想说如果人人玩下去都会变成僵尸一样的人,0
2,1892134,夺命来电,ROLLOTOMASI,53710950,很差,2016-06-18,11:08:25,不忍直视,0
2,1892134,夺命来电,谁在树上听吹泡,chillstep,很差,2018-03-19,20:05:54,女主差评,0
2,1892134,夺命来电,退役选手,48436074,较差,2016-12-28,02:07:10,虎头蛇尾，高潮很快，又很快泄了。。。,0
2,1892134,夺命来电,一沙,66767418,较差,2016-07-04,19:18:52,实在无聊你可以看看，用一个很扯淡的故事讲一个很暖心的故事，配上最悲情的结局.. ...,0
2,1892134,夺命来电,吃寿司的羊,56018293,较差,2016-06-15,16:22:54,结局是补的吗。。。。,0
2,1892134,夺命来电,树上的猴,31466605,很差,2016-07-31,09:45:55,垃圾中的垃圾,0
2,1892134,夺命来电,春风十里不如你,138063906,较差,2020-02-08,07:51:19,别打电话了，发微信吧。,0
2,1892134,夺命来电,风之,128617206,还行,2018-06-12,12:58:33,有一点点辣鸡,0
2,1892134,夺命来电,二郎真君,157943276,还行,2021-08-26,22:12:37,感觉片子的初衷是为了提示人们，不要过度依赖手机。但是结尾太拉跨了,0
2,1892134,夺命来电,维维,qsb1985,较差,2016-06-22,22:24:44,片尾曲是You'll never walk alone...醉了,0
2,1892134,夺命来电,黎明之光,224579731,较差,2021-02-17,17:17:11,开头不错，逐渐烂尾，不知所云,0
2,1892134,夺命来电,罗林的星期天,135411774,很差,2020-07-25,20:23:20,motherfuck侠和世界末日哥的黄金阵容是怎么被骗进这坨电影的？,0
2,1892134,夺命来电,Mr.Jj,dearjan,很差,2017-05-27,19:33:37,开头还蛮紧张的，可看着看着就跳大神了…电影有点吵…,0
2,1892134,夺命来电,Bad Joker,ys1013,很差,2016-06-12,21:54:41,直接丧尸不更好,0
2,1892134,夺命来电,Rongmao,10828318,较差,2016-06-18,13:26:36,只能说剧本不错,0
2,1892134,夺命来电,寻雾启示,151691015,很差,2018-04-11,10:46:47,约翰库萨克被凯奇叔感染了吗？怎么近年烂片不断，又出了部五毛特效丧尸片,0
2,1892134,夺命来电,Louis,4134812,还行,2016-07-02,23:51:59,现实梦幻分不清，手机使用恐惧症。,0
2,1892134,夺命来电,谷玄,3874094,还行,2016-06-26,02:31:20,感觉很烂，不过看了一篇神解读。好吧，3星。,0
2,1892134,夺命来电,薄荷不要糖,147556540,较差,2022-09-03,22:02:09,接个电话感染可还行？😂,0
2,1892134,夺命来电,punkseed,rockinghead,很差,2018-04-15,01:13:19,？？？？？？？,0
2,1892134,夺命来电,懂哥就是我,131073747,较差,2018-02-19,01:51:27,我强忍住心中的怒火，终于看完了！,0
2,1892134,夺命来电,公子,52022745,还行,2016-06-30,17:43:32,好一般哦,0
2,1892134,夺命来电,莹小宝,benbenmuxi,很差,2018-06-07,15:25:20,难看。竟然不知道史蒂芬金的小说能被改编的这么垃圾~~我还是喜欢《迷雾》,0
2,1892134,夺命来电,临渊止渴,178008708,还行,2020-01-13,09:13:04,主演还不错。,0
2,1892134,夺命来电,环形废墟,Zimablue,很差,2019-02-07,16:18:57,说来说去手机俺觉得还是个好东西，有什么意义啊这个手机让人变丧尸的故事，设定不是bug是根本不交代，且没有一点科幻色彩，牵强的开场，无动机的人物，主人公漫无目的的行走，而且丧尸也完全不恐怖，还掺了不少不必要的俗套惊奇，总之，感受不到一点应当成为电影的特质，最后收不回来又搞得虚头巴脑的神秘主义，全程让人一头雾水，还有孤儿怨的女人让我出戏，我哥睡着了又被一声叫吓醒了……,0
2,1892134,夺命来电,63号的橘子,51836771,很差,2016-08-20,00:25:06,装神弄鬼不知所云！,0
2,1892134,夺命来电,24℃,4482032,较差,2017-01-14,14:18:26,人生也许本就是一场幻觉,0
2,1892134,夺命来电,lost,L1111112,较差,2019-05-20,10:56:36,很无聊,0
2,1892134,夺命来电,麦克阿斗,4299372,还行,2019-01-26,07:54:46,手机依赖症,0
2,1892134,夺命来电,blhying,2082278,较差,2017-09-27,13:40:33,现在这样的片子也在进化职，现在都可以相互之间通话了！再拍下去，僵尸都要占领地球了！,0
2,1892134,夺命来电,chentu,2735338,较差,2016-06-27,10:58:32,什么跟什么啊,0
2,1892134,夺命来电,hardware,34592808,较差,2016-07-07,23:34:12,好吧，原来又是斯蒂芬金的恐怖无厘头作品之一。。。不是渐入佳境，是越来越扯淡！,0
2,1892134,夺命来电,芥 末,doggicense,较差,2016-07-23,17:21:56,竟然是部丧尸片。。。有够无聊的,0
2,1892134,夺命来电,宝井惠,36329774,较差,2019-01-28,03:59:01,真的看起来就是低成本野路子的片儿，但是有孤儿院小女孩多给一星，她长大了啊,0
2,1892134,夺命来电,卫堇然,88000660,较差,2018-06-05,22:16:34,我猜马上就快有电视浩劫了，正好总决赛外加世界杯🙃🙃🙃看电视的人多。,0
2,1892134,夺命来电,dinosaurs,dinosaurs,推荐,2017-01-20,14:30:19,评价如此之低，很难不让人认定是当代电影观众对手机痴恋而不自知造成的。斯蒂芬金把手机和人际的联系/统合联系起来，带出个体对群体，对整齐划一，对丧失个人意志的恐惧，我认为是难得的准确和有力。不想做手机丧尸的话，就只能做社会的孤狼，父亲不能割舍与儿子的联系，所以只有加入丧尸的行列一途。,0
2,1892134,夺命来电,duo_azrael,116073490,较差,2016-06-29,01:27:00,变种僵尸片，话说库萨克怎么这么残了,0
2,1892134,夺命来电,朴实刚健二土哥,guiluo,较差,2017-04-09,00:44:07,……？？？,0
2,1892134,夺命来电,老板死机了,66130179,还行,2018-01-14,13:54:33,一切都是主角臆想出来的世界，导演没有拍好，可惜了史蒂芬金,0
2,1892134,夺命来电,爱生活爱电影,113487954,还行,2016-06-29,17:38:07,提议很好但没拍出我想要的感觉,0
2,1892134,夺命来电,芥子书屋,47819631,较差,2017-04-22,10:48:05,玩手机会变僵尸的,0
2,1892134,夺命来电,wlaurelw,91581315,还行,2016-12-10,06:04:55,3.5，一个加入现代科技的末世逃生故事。前1/3重点讲述末日来临各种灾难场景和自相残杀，逃生场面，抑郁黯淡的气氛渲染得不错；接下来的历险和逃难部分比较紧凑，内容丰富，突出了紧张恐慌感和孤立无援的悲哀。最后男主为救孩子回去也是情理之中。不考虑逻辑的严谨性，此片在末日题材里还是比较好的。,0
2,1892134,夺命来电,碎玻璃渣子,74479513,还行,2017-04-16,16:24:12,虎头蛇尾,0
2,1892134,夺命来电,向上吧！少楠,125267371,很差,2016-08-18,23:05:15,开头惊喜，后面简直垃圾了,0
2,1892134,夺命来电,Sylvia,skylviewoo,很差,2016-12-28,18:46:44,垃圾丧尸片,0
2,1892134,夺命来电,本尊神灵,41842523,较差,2016-06-12,21:44:28,想不到我大名鼎鼎的塞缪尔·杰克逊也接这种烂片。,0
2,1892134,夺命来电,你会有猫的,137117380,较差,2018-04-15,18:25:14,emmmm.....,0
2,1892134,夺命来电,oneno,119361490,较差,2016-06-11,22:09:38,一直觉得斯蒂芬金的小说氛围营造的很好，但也是仅此而已了。电影同理。,0
2,1892134,夺命来电,.,71918561,较差,2017-08-05,21:41:47,结局还不错,0
2,1892134,夺命来电,又上当了,skymelove,很差,2016-07-18,12:16:17,这部片子的题材有一点偏了，怎么说呢？不太可能。因为现在都没有一种声音，或者是频率使人听后立即失去理智变成丧尸。还想再吐一下，他们这样整的话，感觉比生化武器核武器都还厉害。,0
2,1892134,夺命来电,梦想高飞,57591346,很差,2016-09-11,22:32:18,垃圾,0
2,1892134,夺命来电,花大叔爱电影,yangteng1107,较差,2017-01-30,13:43:47,斯蒂芬金编剧？可剧情依然很无聊！,0
2,1892134,夺命来电,别要再失眠,66972334,还行,2018-06-10,21:10:08,开始还挺有新意吧，后面突然结束又不交代起因，看得云里雾里…,0
2,1892134,夺命来电,奶来了,61226866,较差,2017-10-13,21:35:05,刚开始还很新鲜，后来就不知所云了,0
2,1892134,夺命来电,丿灬咖丶啡灬,50519870,较差,2016-07-03,10:53:59,开头成功吸引了我的注意力，然后解释了半天没解释清楚，烂尾！,0
2,1892134,夺命来电,夜の贝影,114740943,还行,2016-08-14,21:21:55,唯一能够给我打三星滴就是结尾You'll never walk alone这首歌听说库萨克是红军球迷这是致敬吗？反正电影剧情滴真是狗血到爆。。。,0
2,1892134,夺命来电,Velvetgolden,1852923,较差,2018-10-26,21:51:49,僵尸们对着太阳集体练黑嗓，这个有点儿想法。小孤儿女长大了不演变态可惜了。,0
2,1892134,夺命来电,jeno,jenifa,推荐,2017-02-05,22:08:26,Fucking hell i am using cell phone to type this comment now.. ,0
2,1892134,夺命来电,未遂的文艺青年,macrocheng,较差,2016-07-09,00:12:28,什么鬼！,0
2,1892134,夺命来电,悲伤的太阳雨,LeoY9499,很差,2016-06-11,17:46:36,什么j8电影,0
2,1892134,夺命来电,周星星,4129696,较差,2017-05-03,23:40:14,感觉是个好题材啊，可惜拍成屎了。,0
2,1892134,夺命来电,油炸灌汤包,frog323,很差,2018-07-05,17:19:11,什么乱七八糟,0
2,1892134,夺命来电,我爱麦兜,68433941,较差,2018-06-05,04:39:09,2018-6-5纪王巷前33腾讯视频,0
2,1892134,夺命来电,笑三少,66810723,很差,2016-07-25,00:29:11,不好看,0
2,1892134,夺命来电,樊与凡,148839386,较差,2016-12-28,00:10:25,除了浅显的寓意和两个老戏骨，其他要什么没什么,0
2,1892134,夺命来电,朝观夕评,81480517,很差,2017-04-03,22:20:53,开头还把我吓着了……调到结局也把我吓着了！认真看……看了半小时觉得还是别看了，没意义╮(╯▽╰)╭,0
2,1892134,夺命来电,BLUE SCORPHIO,33245540,较差,2016-06-29,20:27:00,结局太烂了吧，是收不住了吗,0
2,1892134,夺命来电,faroe.,146852422,很差,2018-05-08,06:43:16,确实是开年第一部灾难片。,0
2,1892134,夺命来电,欢大,JOY8,较差,2019-12-10,08:51:31,开头设定还以为是部有意思的片，没想到全程无聊,0
2,1892134,夺命来电,那一年的风,103271136,较差,2016-07-30,18:50:51,这是 行尸走肉 的前传吗?,0
2,1892134,夺命来电,Mono戴耳机,80803700,较差,2016-06-16,00:36:11,哎  虎头蛇尾的标版。不落入俗套，也请不要搞些囧剧情啊,0
2,1892134,夺命来电,蚀野区,MALUbudstikken,很差,2018-06-07,20:13:38,伊莎贝拉·弗尔曼,0
2,1892134,夺命来电,圣殿骑士,82299258,较差,2018-04-16,22:58:30,剧情太烂,0
2,1892134,夺命来电,Alina,133630899,较差,2019-04-26,22:06:51,剧情有点，，，,0
2,1892134,夺命来电,Troy~AI,60283579,很差,2019-12-29,04:36:17,大腕云集的丧尸烂片。,0
2,1892134,夺命来电,peterpen,70638098,较差,2017-07-24,22:14:22,这个一言难尽的片子啊。。。。手机统治世界。,0
2,1892134,夺命来电,平板车,pbc0615,较差,2016-08-19,22:49:22,拍到后面就感觉导演在说“我特么实在不想拍了”,0
2,1892134,夺命来电,春暮,53706113,很差,2016-06-14,14:12:04,好无聊好无聊好无聊。暂停了不记得次数的次数去干别的事。,0
2,1892134,夺命来电,桂花🌸君,creekseven,很差,2018-06-05,08:45:45,看了一刻钟坚持不下去了……,0
2,1892134,夺命来电,Tart_coffee,147339723,很差,2018-06-15,02:31:40,一流的小说，一流的演员，可这拍的什么玩意啊，逻辑线不清晰，拍摄手法感人,0
2,1892134,夺命来电,淘乐妤,48938261,很差,2016-07-15,17:42:36,卡司阵容还不错，但是故事太难看了。,0
2,1892134,夺命来电,梦游仙境,98956225,还行,2017-02-19,10:28:08,改编的没有书籍有慢热敢 不过人类会有这么一天的。。。,0
2,1892134,夺命来电,Tschuess马,140244823,很差,2018-11-17,23:16:52,what the fuck！,0
2,1892134,夺命来电,SylvesterChu,174599571,很差,2021-04-14,18:07:22,做个俗人，理智到绝望，自由为一生,0
2,1892134,夺命来电,欧阳协成,44412475,很差,2016-07-18,22:58:00,好题材拍成这样，小成本制作，比较无聊，跟其他僵尸类题材没有任何区别，特别容易使人困倦。完全不理解为什么会这样，浪费时间的电影。,0
2,1892134,夺命来电,庄亦谐,RP86,较差,2018-07-26,22:37:27,看不懂,0
2,1892134,夺命来电,知书达李,LY827116516417,很差,2018-07-23,21:11:57,这个题材真的有点儿无聊了,0
2,1892134,夺命来电,女王头上有鹿角,162424622,较差,2018-04-10,19:59:09,因为原著其实也就那样了所以本来就没抱太大希望，但电影拍的实在是更为失败。,0
2,1892134,夺命来电,方桨,bmwxusen,较差,2018-06-05,23:17:42,啊咧？,0
2,1892134,夺命来电,光光,4356018,很差,2017-01-26,18:11:22,神马?丧尸片??没看懂哎 意思是最后男主也尸变了?,0
2,1892134,夺命来电,遄遄,75260597,很差,2016-06-12,16:54:57,又名《移动与联通的未来》,0
2,1892134,夺命来电,yvonne,wych,较差,2018-06-07,22:18:52,神马玩意？,0
2,1892134,夺命来电,Buenos Aires,76621126,较差,2016-06-14,14:04:48,本质上其实就是个丧尸电影，整个剧情都是莫名其妙的。,0
2,1892134,夺命来电,果果一个水果,4574615,还行,2018-06-05,00:00:05,我觉得还不错呀，至少看到此后好多电影抄袭这部的影子。,0
2,1892134,夺命来电,SX,1831746,较差,2016-06-25,14:09:13,白瞎几个好演员了 扯淡,0
2,1892134,夺命来电,桐玺夏X君,summer4_ever,较差,2019-04-21,16:44:45,……结尾？,0
2,1892134,夺命来电,ゝ浮生若梦,52656841,较差,2016-06-23,11:58:38,2016-6-23 11:58:28,0
2,1892134,夺命来电,忘忧结,3690879,较差,2018-07-02,21:17:07,开头不错，其他是什么鬼？,0
2,1892134,夺命来电,隔壁子的李寡妇,144418820,很差,2017-08-16,13:09:54,五毛特效，垃圾结尾，开片还不错,0
2,1892134,夺命来电,哈哈宝宝,189159207,很差,2022-07-27,01:13:57,两大影帝都缺钱了,0
2,1892134,夺命来电,木白木白木白,138384680,较差,2017-05-09,23:04:16,不喜欢,0
2,1892134,夺命来电,[已注销],anthony1123,较差,2016-06-13,20:00:51,看来老金还是没能完全预言未来啊 要是换成一连wifi就被控制 估计也就不会有幸存者了（John Cusack啥时候能再拍一部稍微有看头的片子啊,0
2,1892134,夺命来电,朱朱小当家,53457477,较差,2017-02-07,22:03:38,虎头蛇尾,0
2,1892134,夺命来电,Alex,gt5222,还行,2016-06-11,21:05:52,高科技丧尸潮，还有入梦boss,0
2,1892134,夺命来电,Verlaat,yuedawei,较差,2016-06-11,21:57:41,手机丧尸,0
2,1892134,夺命来电,Angel,46994035,很差,2018-06-06,21:09:53,看到45分钟的时候关掉了。,0
2,1892134,夺命来电,EvilGoblin,64996012,还行,2018-08-16,12:11:07,手机僵尸。,0
2,1892134,夺命来电,安静的山茶花,84922944,较差,2018-04-21,22:04:16,剧情有点太凑合随意，但诡异感塑造还算不错。,0
2,1892134,夺命来电,M丶,133864365,较差,2017-05-29,20:55:34,低配的生化危机 ？ 喜欢丧尸片仅此而已,0
2,1892134,夺命来电,drcltxzg,61328957,还行,2018-04-03,23:26:41,手机是邪恶轴心,0
2,1892134,夺命来电,Yurki,Yurki,较差,2019-09-04,23:47:42,太搞笑了吧,0
2,1892134,夺命来电,constantine,50869237,,2018-04-15,02:27:06,以后别再说大陆老爱拍烂片了，好莱坞一样很多，只是能传到我们这边的不多了。这不，眼前就有一部。,0
2,1892134,夺命来电,沈若凡,13809497,较差,2016-07-19,13:48:47,没想到斯蒂芬·金的东西也竟然落到了老美丧尸片的下乘，剧情根本不值一提，想要表现手机对人的占有和冲击，结果硬是憋住了，说得太不到位。唉，算了，不评价了，根本就不值得评论。,0
2,1892134,夺命来电,明雪寂,67423420,较差,2018-06-15,21:15:34,讽刺了当今的手机依赖症患者。情节一般，很多东西没讲清楚，比如为什么大家会梦到同一位红衣人？,0
2,1892134,夺命来电,梦之安魂曲,Makoto614,较差,2016-06-14,22:31:37,因为手机变成了僵尸，脑洞真大。除了这个设定比较新颖以外，走得还是末日打僵尸的俗套路子。这样的已经拍过很多部了，看腻了。,0
2,1892134,夺命来电,LUUJ_,Lieutenant_Lu,很差,2016-08-31,08:20:34,既然是老金的改编。我咋也得坚持看完。,0
2,1892134,夺命来电,紫贝朱鱼,40138522,还行,2016-08-16,18:08:37,很不斯蒂芬金的改编。对于斯蒂芬金作品的质量很放心的，但是相比《迷雾》真是失望很多。勉强能看出作者对于现在手机影响生活现状的思考，不过后来真的是莫名其妙的，爆炸以后孩子就恢复正常了？对于红色帽衫形象的映射也没解释清楚。,0
2,1892134,夺命来电,McTavish,53011724,较差,2017-04-23,14:18:45,史蒂芬金的剧本拍出来还挺多烂片的，这是其中之一。该片最精彩之处是设定手机打电话就会变丧尸的开头，之后主角一路杀怪找family的情节就非常无聊了。至于为什么打电话会变丧尸，这和主角的漫画又有什么关系，电影里只有悬念，没有解释。是因为剧本只写了一半么？,0
2,1892134,夺命来电,Teal-Blue,134156029,较差,2016-06-25,17:16:37,刚开始很不错，但搞到后来只是僵尸片,0
2,1892134,夺命来电,Chenghuan007,chenghuan007,较差,2019-04-08,13:23:52,好黑,0
2,1892134,夺命来电,瘸腿儿小蚂蚁,brandyjn,很差,2016-06-18,00:05:23,烂的不成样子,0
2,1892134,夺命来电,nihaohrl,103544666,很差,2016-06-28,21:29:49,鼠头蛇尾,0
2,1892134,夺命来电,没意思,melancholyhill,很差,2016-07-10,17:43:30,最近到底看了多少恐怖烂片交友不慎,0
2,1892134,夺命来电,ricoshi,3598044,很差,2018-04-24,23:35:08,导演毁了全片,0
2,1892134,夺命来电,玄159,119961917,,2019-01-18,22:27:52,C,0
2,1892134,夺命来电,香草把噗,yuwersun,,2018-10-07,13:55:03,瞬间扔掉手机 真踏马没想到是丧尸片 ,0
2,1892134,夺命来电,长歌暖浮生。,66122486,较差,2017-08-12,14:29:49,演员阵容我蛮喜欢，可是电影我真是不敢苟同，两星给两个演员。电影零分。,0
2,1892134,夺命来电,ROGIC,120797927,很差,2016-09-13,00:23:15,应该是2016年看过的最烂的电影,0
2,1892134,夺命来电,chen301415,50901673,较差,2019-01-26,12:48:48,不知所云，情节混乱,0
2,1892134,夺命来电,岚,101159801,较差,2021-04-15,20:10:04,还不如拍成僵尸片 ,0
2,1892134,夺命来电,风吹沙,174690694,较差,2021-10-17,16:00:31,让移动网络电视的评分9.2骗了，史蒂芬金怎么能写出这样的烂片？无线电能控制大脑，全城大停电还能洗澡，就男主几个人始终百毒不侵，上当了，1.5倍速看完。,0
2,1892134,夺命来电,Love丶bug,145977623,较差,2016-07-16,23:11:06,不是很好看，其实之前看简介也想到了，为了约翰库萨克而看的，剧情感觉不怎么样，结尾也没弄明白，豆瓣有个影评写的很好，分析的很全面，但只从电影丝毫看不出来，想起来了一个香港电影，叫那一夜，我们坐上了到哪里哪里的巴士，有点迷茫，感觉这种情节就不该这么设计，想想库萨克的致命ID，有点失落,0
2,1892134,夺命来电,寡人叫啥好呢,87979553,较差,2018-04-26,23:08:22,局长没事 干嘛接这种烂片呢？,0
2,1892134,夺命来电,*,9319366,很差,2018-06-07,00:21:27,看不懂,0
2,1892134,夺命来电,打遍天下不还手,75667669,很差,2016-08-28,13:52:37,白瞎俩大牌。,0
2,1892134,夺命来电,skncn007,109993491,较差,2016-10-16,00:20:58,人类何等脆弱，之前是病毒变丧尸，现在打个电话就能变丧尸，越来越先进。到底想表达什么？纯恐怖吗，仅此而已？？电影后半段基本可以催眠了。,0
2,1892134,夺命来电,清风-俊,56014812,还行,2016-08-29,02:46:25,冲着大编导的名气去的，结果发现活脱脱的一幕我们现在生活中的惊悚剧，人民离不开网络离不开手机，像是中了毒，只是没电影里那么劲爆，如出一撤。,0
2,1892134,夺命来电,Msquare,Bes,较差,2019-05-09,02:25:09,could be a better one,0
2,1892134,夺命来电,上五楼的快活,142158399,较差,2017-06-26,00:37:34,约翰库萨克和塞谬尔杰克逊联手居然演这样一部没有深度的公路电影………还是史蒂芬金的，砸了,0
2,1892134,夺命来电,JoakimLiu,156931622,较差,2018-08-28,11:24:37,夜戏自然光拍摄要看机器性能，可能电影荧幕好一点点，但电视上看的话暗部真是一坨si，没有细节不说，所以暗部过渡如同粗糙的毛毡飞舞，看到想吐。,1
2,1892134,夺命来电,俟,wyhleon,还行,2018-06-04,21:54:31,5分。不怎么好看,0
2,1892134,夺命来电,CerizMe,lx1994,较差,2016-10-03,18:43:24,烂尾啊有些,0
2,1892134,夺命来电,苏鸣,139623324,较差,2017-02-08,04:45:56,一切都是一个梦，不过中途也没有暗示过是幻觉，结局就这样真心太突兀了。设定真的很好可惜后面剧情无力，孤儿怨的小姑娘长残了真可惜。,0
2,1892134,夺命来电,高冷先生,186758078,还行,2022-04-10,23:40:35,题材挺不错的，虽然拍的不咋样,0
2,1892134,夺命来电,亚畑雄一,DopeHigbee,较差,2016-12-28,09:09:25,没有手机能活几天,0
2,1892134,夺命来电,富员外,nmgfgq,较差,2016-06-24,19:38:37,开头不错，中段无聊，结局稀烂,0
2,1892134,夺命来电,池見荷,cn1027,较差,2016-07-18,13:49:45,这啥玩意？就是操场上那群手机僵尸躺着，不就是我们夜晚的写照吗？,0
2,1892134,夺命来电,SkYoung,Sk.Young,较差,2018-04-16,08:16:43,因原作斯蒂芬·金和主演塞缪尔·杰克逊、约翰·库萨克才看的，但这画面，这叙事，击败了我！看评论有人说整个故事都是男主的幻觉，如是，则导演更不及格了，玩深层含义可不是简单在场景上添置隐晦元素就行了的。,0
2,1892134,夺命来电,LA JI,60025721,较差,2018-06-06,10:14:54,最后十分钟全靠我脑补,0
2,1892134,夺命来电,Leon,mfding,很差,2018-07-20,03:09:25,垃圾电影，浪费时间。,0
