page_index,movie_id,title,username,user_id,rating,date,time,comment,useful_count
2,1892134,夺命来电,晕船的小水手,ala7lee,较差,2016-06-26,12:24:13,说实话，手机科技发展迅速的今天，世界末日人类变成手机僵尸的可能性要比变丧尸的可能性大得多。其实密密麻麻围着信号塔跑圈更像是某种邪教仪式，这部戏不太成功的地方就是斯蒂芬金来·金小说里那种恐怖和恐怖过后的绝望完全没有发挥出来，库萨克在1408里演的多棒啊，这里完全就是敷衍了事。,0
2,1892134,夺命来电,这里X货真多,4004601,很差,2018-06-06,19:09:42,真能糊弄,0
2,1892134,夺命来电,难陀愚公,58547608,较差,2019-08-24,22:54:06,需要好多好多的耐心,0
2,1892134,夺命来电,杨东,119488264,还行,2021-04-19,23:42:01,什么破玩意？手机传播的病毒，一开始看感觉还不错，越看越拖沓和无厘头！莫名其妙的流水账而已，导演似乎想匆忙结束回家拉屎。,0
2,1892134,夺命来电,老北,27658050,很差,2019-02-10,21:27:15,睡着了,0
2,1892134,夺命来电,ζωή,3281196,较差,2017-01-02,22:00:09,看了半小时实在看不下去了。,0
2,1892134,夺命来电,freesia,84558178,较差,2018-07-15,22:42:12,莫名其妙，白瞎了好演员,0
2,1892134,夺命来电,尝尝酒酒,137662269,较差,2019-05-18,08:47:30,不知所谓,0
2,1892134,夺命来电,你是笨蛋,43664862,还行,2016-08-14,14:34:37,看到主角还蛮惊喜。可是整部剧太空啊！太空！拼命半天居然要为了儿子，瞬间就弱爆了。智商呢？智商最在线的校长死的太惨,0
2,1892134,夺命来电,牧羊骑士,64026031,很差,2020-10-23,22:00:53,这什么狗屁电影，一点逻辑都没有，看得让人昏昏欲睡，太差了。,0
2,1892134,夺命来电,PIE 觀,xuliking,推荐,2016-08-17,13:46:25,末日,0
2,1892134,夺命来电,不贰。,46545185,较差,2018-07-21,17:45:55,你俩咋想起来接这种剧本…,0
2,1892134,夺命来电,知名不具,Kristin97,较差,2021-05-27,21:21:38,拍了个寂寞。,0
2,1892134,夺命来电,芳珂,lovewar,很差,2018-06-05,21:51:47,什么沙雕片,0
2,1892134,夺命来电,Childe Roland,VincentValentin,很差,2018-06-27,16:25:25,我的高中时代最喜欢的几个角色之一，哈佛帽兜男请你一定要在，也是我的几个连环梦境之一，总有一天我会让你出现在我的书里的。看了半个多小时看不下去了，很失望。,0
2,1892134,夺命来电,桃芝芝桃,80652857,还行,2020-04-17,23:41:13,额，能说第一次看的时候压根没理解那个结局是什么意思吗？翻了一下影评发现原来有这么多隐喻的……但就算不管这些，无脑看的话个人觉得还是有精彩刺激的地方的，还是可以看一下的啦~~~,0
2,1892134,夺命来电,査,184758076,很差,2019-02-24,17:11:52,编剧挺有创意，但缺乏合理性，不是丧尸缺有着丧尸的外形，其实总的来说电影挺傻逼的。,0
2,1892134,夺命来电,丸,2571333,推荐,2019-10-19,23:43:18,最后要是再拍点TJD 结尾就不会那么粗糙了,0
2,1892134,夺命来电,태양,73883581,还行,2018-06-05,13:29:56,请不要保留您对我们的仁慈，亲爱的主。愿您的爱和真知一直护佑我们，我们身边充满无尽的磨难，我们已被罪行淹没，却无法看清。我们的罪行多如发丝，我们的内心已经崩塌。主啊，请拯救我们吧。主啊，请速来拯救我们。愿那些想要夺走我们生命的人，都陷入羞愧和迷惑中。,0
2,1892134,夺命来电,bluee1977,bluee1977,较差,2016-09-29,21:57:20,小学水准的剧本,0
2,1892134,夺命来电,玄月,137604028,较差,2016-07-30,17:28:14,电话很丧尸的病毒一样,0
2,1892134,夺命来电,Junda阿肥,jundaafei,很差,2016-08-15,12:16:31,真的烂。。。这个拍的,0
2,1892134,夺命来电,seth,sixprecepts,还行,2016-06-11,22:24:03,20160611,0
2,1892134,夺命来电,yussen,78786637,较差,2016-06-28,18:39:13,男主是我最不喜欢的老外长相,0
2,1892134,夺命来电,马踏飞燕,121730093,力荐,2020-11-14,10:51:14,手机迟早害死人，灭亡人类。,0
2,1892134,夺命来电,大能豆,176445603,很差,2018-11-15,21:06:38,这一星是给演员的,1
2,1892134,夺命来电,目瞪狗呆,MissU8657290,很差,2016-08-21,21:53:03,太浪费时间了……要不是塞缪约杰克逊，根本不会看。后来看了网友的影评，才明白这是个心理片………也是我看过的比较差的心理片之一，一点也不烧脑，惊悚也谈不上，就是恶心…一颗星都不想给…,0
2,1892134,夺命来电,国国子,ArisaLee,还行,2021-06-06,20:12:52,有点无聊 题材好像还行 女孩是孤女主角诶 美,0
2,1892134,夺命来电,于非,154751472,很差,2018-04-13,18:33:03,主题根本撑不起这部电影。,0
2,1892134,夺命来电,琴声何愁,60053495,很差,2018-06-05,00:36:22,是因为剪太狠还是怎么着，为什么都没过度，那么突然……看得我一脑袋为什么。,0
2,1892134,夺命来电,侯玉榆,surrealistrock,还行,2016-06-12,09:08:12,单身有罪，所以叫“单身狗”（《龙虾》），整天盯着手机，最后就变成“丧逼”。单身狗没有对象，还不能玩手机，马上就让人觉得了无生趣。,0
2,1892134,夺命来电,无心恋战,101872138,很差,2016-06-16,16:23:51,老人家接片真是有钱就行么,0
2,1892134,夺命来电,英俊直男张洋洋,142295009,较差,2016-06-25,02:20:27,这病毒靠电话传播的设定……,0
2,1892134,夺命来电,伽蓝,14068242,还行,2017-01-08,00:40:18,2-3中间的位置，开头很惊艳！卡司强大！但是从女主死了之后怎么感觉就不好好讲故事了呢……还是有续集？还是我智商下线了(Ｔ▽Ｔ),0
2,1892134,夺命来电,豆酱灵药,WeWang,较差,2018-04-11,23:30:48,只能这么多了。,0
2,1892134,夺命来电,北寺,flyingwhale,很差,2018-06-07,11:16:37,Steven King也有失灵的时候。。。考虑到是16年拍的，可能是我看过的最烂的僵尸片,0
2,1892134,夺命来电,万历丰臣,122229691,很差,2016-10-27,21:07:10,两大影星联手演绎了一个烂俗的，没有任何营养的，老套的，拖沓的，不是丧尸的丧尸电影。塞缪尔，约翰，你们堕落了,0
2,1892134,夺命来电,alternative,alternative,较差,2016-06-30,13:04:33,哈哈哈哈我就想来推荐一下大规模僵尸小碎步朝圣的姿态哈哈哈哈哈怎么这么有喜感,0
2,1892134,夺命来电,淡淡,2847308,较差,2019-10-26,11:32:02,设定实在太扯了----看的苏苏的解说版,0
2,1892134,夺命来电,不懂叫啥的gin,cup_date,力荐,2016-07-04,22:15:10,不明所以地看完，只会让我想到生化危机这层罢了，神人分析得很透彻,0
2,1892134,夺命来电,莱辛巴赫之约,165849744,很差,2018-09-07,20:54:22,都什么鬼，看的我一头雾水，里面无数坑都没填上，结局也很莫名其妙，简直浪费时间,0
2,1892134,夺命来电,mayday静,42334349,较差,2016-06-15,23:08:12,烂头烂尾 寓意过于明显反而让观众觉得自己是智障 ,0
2,1892134,夺命来电,Andrew,gq,还行,2016-07-30,01:46:51,160729@ 手机丧尸@@,0
2,1892134,夺命来电,就是来乱逛,155403332,很差,2020-11-08,11:46:29,看了个寂寞,0
