page_index,movie_id,title,username,user_id,rating,date,time,comment,useful_count
0,30183443,壹号别墅,渚渚渚,155451932,很差,2018-04-19,11:53:14,你们看看下面五星评论的ID就会回来赞我,57
0,30183443,壹号别墅,黄悦_,69475039,很差,2018-04-19,14:51:43,小女孩把头发扎起来之后太像关晓彤了哈哈哈 害我一直出戏,10
0,30183443,壹号别墅,望舒,154516644,很差,2018-04-19,10:44:39,为什么豆瓣不能打负分？为什么一星是2分？不给这部电影负分是对导演和编剧的侮辱！,18
0,30183443,壹号别墅,假笑girl,2161666,很差,2018-04-19,18:51:23,导演出来我保证不打死你我就想跟你谈谈系列,5
0,30183443,壹号别墅,针眼画师,51266657,较差,2018-06-09,16:07:44,朋友主演的电影，感觉整体乱七八糟，除两主演外，其它演员实在太业余了。,4
0,30183443,壹号别墅,叫我敏胖胖,70147844,力荐,2018-04-19,16:44:47,最喜欢看国产恐怖片的预告片了，当成喜剧看,9
0,30183443,壹号别墅,啦啦啦,157273478,很差,2018-04-19,11:10:40,妈呀，什么烂片,6
0,30183443,壹号别墅,付玲,flowertide,很差,2018-06-06,06:57:45,终于见识了一次国产可怕片，太兴奋了。,0
0,30183443,壹号别墅,ericxu,219916521,很差,2021-06-17,19:37:22,负分,0
0,30183443,壹号别墅,weakish,WeakishJiang,很差,2018-08-19,20:22:44,味同嚼蜡,1
0,30183443,壹号别墅,Que sera,iamafrog,很差,2018-06-01,17:54:11,电视里总有国产恐怖电影，看得我无欲无求的，演员好看点能给两星，梅姨算最好看的了，但怎么看都像会馆里唱京东大鼓的。,1
0,30183443,壹号别墅,爱比死更冷,70421764,很差,2018-05-29,10:12:58,"导演: 王保国
编剧: 王保国 / 祁晓野 / 刘玉璇
主演: 项洪 / 侯宇航 / 林诗曈 / 关健
类型: 剧情 / 悬疑
制片国家/地区: 中国大陆",1
0,30183443,壹号别墅,uu_whatevs,56917736,很差,2018-12-19,22:04:08,这我都看过，牛逼不,3
0,30183443,壹号别墅,聚羽成翼,S7vv,很差,2018-05-30,01:58:52,.,0
0,30183443,壹号别墅,给钱写电影好评,joker1114713710,力荐,2019-05-02,22:22:19,很多孩子很讨厌，水煮小孩的概念很值得学习，点赞了，过两天我就把我的孩子煮了。,0
0,30183443,壹号别墅,雪白干净少帮主,66470368,很差,2022-12-02,21:13:12,救命 我看完了 水开了 又要做饭了 切切切 我疯了,0
0,30183443,壹号别墅,烟火佳人,151076960,很差,2018-04-20,23:54:39,一点都不好看,0
0,30183443,壹号别墅,子期已归西,lasomabra,很差,2019-08-25,23:07:47,梅姨是魔仙堡里出来的,1
0,30183443,壹号别墅,香火兄弟,gw150080,很差,2018-05-28,15:53:50,实在没耐心看完了^_^,0
0,30183443,壹号别墅,安贞里,140835094,很差,2021-07-28,03:11:40,导演和马保国是表兄弟吧,0
0,30183443,壹号别墅,啊啊啊,175948971,很差,2018-04-19,12:20:04,对不起 我知道这样不好 可还是得说一句 辣鸡,3
0,30183443,壹号别墅,Geralt,78327576,很差,2018-05-27,19:47:50,大家看到“国产+恐怖片”可以直接弃了，没必要尝试。,0
0,30183443,壹号别墅,王木川,jielunxiaoxin,较差,2018-06-23,13:43:13,好迷幻，小女孩演技最佳。,0
0,30183443,壹号别墅,麦子,btone0808,很差,2018-05-26,09:54:56,恐怖片的耻辱，神神叨叨的菜刀舞倒是蛮有喜感,0
0,30183443,壹号别墅,小丑,155014456,很差,2018-04-14,22:06:58,国产恐怖片。。。,0
0,30183443,壹号别墅,小棍,27403984,很差,2018-05-29,22:42:56,什么JB玩意，真TM烂，没有之一,0
0,30183443,壹号别墅,雪豆儿炖蹄花儿,143481653,很差,2018-04-21,09:42:24,fhhdijfugogdbiifucib,0
0,30183443,壹号别墅,浪味仙,dijianglin,很差,2018-04-19,16:18:40,不说话…,2
0,30183443,壹号别墅,🚪🌙,157637086,推荐,2022-03-02,11:24:08,"一鍋水燒開了，開始做飯了，又要動刀了，切切切，菜花，蔥花，韭菜花，我的寶貝，我的寶貝，看看是誰！
梅姨的表演真的很尬。梅姨对毛豆说：知音啊，要是我的女儿该多好啊。
毛豆梦游找的小姐姐
神秘的地下室
老是刻意的出现帮助女主还爱尬唱的外卖员，让女主速离开梅姨，说梅姨有精神障碍，杀人
女主叫老板，梅姨叫老公，外卖员叫姑父
会易容的老板女秘书（即梅姨口中的大魔王，也是她易容成好心人让女主住进壹号别墅）
梅姨的童年阴影，后妈恐吓她要拿她煲汤，后来跟着厨子学会了厨艺。
梅姨为了清醒把双手放进了滚烫的汤里，小哥将硫酸倾向自己女主抱着女儿拿着证据跑去报警了。梅姨把门一关，三个恶魔谁也别想跑
",0
0,30183443,壹号别墅,超爱电影,136082670,,2018-09-23,20:31:41,好多人打五星……,0
0,30183443,壹号别墅,幻魔师,Vanya,很差,2018-04-19,17:48:18,看你妹的头,2
0,30183443,壹号别墅,比巴卜大王皮皮,154105324,还行,2018-05-25,08:58:54,做家务放着看看挺好的,1
0,30183443,壹号别墅,M,4657732,很差,2018-12-09,03:52:28,看过的最烂的电影吧,0
0,30183443,壹号别墅,EvilGoblin,64996012,很差,2018-07-06,21:15:58,精神病类电影之最。,0
0,30183443,壹号别墅,林深时见,175763784,很差,2018-05-24,20:57:05,什么垃圾东西，演员演的不尴尬吗？,0
0,30183443,壹号别墅,梦懿,165386510,力荐,2020-09-03,14:08:02,一般,0
0,30183443,壹号别墅,艾玛.杜蒙特,171502733,很差,2018-07-11,10:44:25,垃圾,0
0,30183443,壹号别墅,撼动,134159440,很差,2018-05-25,10:53:52,shabi,0
0,30183443,壹号别墅,放射海,120002421,较差,2020-04-23,02:41:33,沉醉了笑到头掉,0
0,30183443,壹号别墅,Lindsey,lindsey0909,很差,2018-05-28,21:35:46,负分吧,0
0,30183443,壹号别墅,旭哥,32657268,很差,2018-05-26,18:33:33,不要看，太尼玛浪费时间，编剧是脑残吗,0
0,30183443,壹号别墅,Anaru,nine219,很差,2019-02-10,20:19:35,动不动就拿菜刀，国产恐怖片果然没让我失望,0
0,30183443,壹号别墅,竹小息,197386564,很差,2020-03-09,15:31:15,额……什么鬼，镜头尴尬死了……无力吐槽,0
0,30183443,壹号别墅,零,61412163,,2019-09-10,14:18:44,"一分都不想给……
看到绝望，烂",0
0,30183443,壹号别墅,荔枝,194287330,很差,2021-01-26,10:29:03,总是在挑战我对烂片的极限。,0
0,30183443,壹号别墅,若为情,54903981,很差,2018-05-27,14:54:20,给小女孩一星。。演技嘛倒还可以。。这故事就是太傻缺了。。最傻缺的我居然看完了,0
0,30183443,壹号别墅,biu..biu..biu,68816004,很差,2018-04-20,22:18:34,壹星别墅,0
0,30183443,壹号别墅,青菜先生,136936658,,2018-06-01,09:07:39,终于见识了一次国产可怕片，太兴奋了。,0
0,30183443,壹号别墅,Fighting~!!!,162238394,很差,2018-06-07,00:08:30,就一抽风的神经病，负分！,0
0,30183443,壹号别墅,安然,172003905,推荐,2018-04-21,11:47:51,悬疑的，很脑洞哦！,0
0,30183443,壹号别墅,火日立,160627163,很差,2018-04-19,09:45:21,想想水煮也合情合理……毕竟女孩叫毛豆，总不能爆炒吧,1
0,30183443,壹号别墅,康宁,177530954,力荐,2018-04-18,22:48:54,哈哈哈，有悬念吗？,0
0,30183443,壹号别墅,魏 丞. 志 Zz,150569248,很差,2018-04-19,19:06:46,就这破电影居然还不要碧莲刷评分。你当我们傻啊,2
0,30183443,壹号别墅,Master Gan,157712802,很差,2019-02-23,17:12:21,乱七八糟的，不知道在说什么。什么鬼！,0
0,30183443,壹号别墅,庸人自扰,188659848,很差,2019-11-09,01:17:34,奇奇怪怪,0
0,30183443,壹号别墅,死神来了,154021147,力荐,2018-08-12,23:13:13,好烂啊,0
0,30183443,壹号别墅,Aki,akakiwong,很差,2019-06-12,21:31:22,标准国产恐怖片水平,0
0,30183443,壹号别墅,不用担心2,144525079,,2019-02-15,15:22:34,烂到极致,0
0,30183443,壹号别墅,smile岁月静好,143363671,较差,2018-05-31,19:08:45,强硬的悬疑，用语言交代的案件，用贪官作为噱头，所以虽然用力，但过于敷衍、浅薄。,0
0,30183443,壹号别墅,橸橸,140906602,很差,2018-04-21,22:11:26,不咋地,0
0,30183443,壹号别墅,&呦呦鹿鸣,183616588,很差,2019-05-05,18:55:54,emmm你懂的,0
0,30183443,壹号别墅,我曾那么接近你,129221003,很差,2020-10-06,23:09:22,什么时候在家看电视不看国产恐怖片呀😂😂😂,0
0,30183443,壹号别墅,铃兰的冬天,97839460,很差,2018-05-31,00:15:02,还能再靠谱点儿吗？强忍着看完...,0
0,30183443,壹号别墅,万事胜意,171709204,较差,2018-06-12,16:00:51,永远不要对国产恐怖片有期待,0
0,30183443,壹号别墅,靓靓Niki,177726293,力荐,2018-04-22,22:54:06,赞,0
0,30183443,壹号别墅,从前的冬天,lulinqing2050,很差,2020-09-07,22:55:12,垃圾,0
0,30183443,壹号别墅,,151915731,很差,2018-04-19,12:25:39,1尼玛的别墅 ,2
0,30183443,壹号别墅,未来江湖术士,132224202,很差,2020-02-18,23:26:59,我还以为是自己拍着玩的...没想到还有制作...,0
0,30183443,壹号别墅,沂曦,82054705,很差,2018-04-21,23:49:48,？？？,0
0,30183443,壹号别墅,郭老师的附件,184518864,很差,2019-05-08,15:45:34,这里有占星魔仙,1
0,30183443,壹号别墅,阿姆僵尸粉,154123679,很差,2018-04-22,09:46:48,我看到第二十八张剧照就明白一切了，又是从精神病院跑出来做妖的货色,0
0,30183443,壹号别墅,无能小白,227508392,较差,2022-08-25,22:40:09,初二看的。因为在271上免费,0
0,30183443,壹号别墅,y_xh,136895741,很差,2020-02-02,18:45:45,辣鸡。辣鸡。辣鸡。,0
0,30183443,壹号别墅,白天不懂爷的黑,154604679,很差,2018-04-28,00:00:40,刚看完。看的我想吐，真的后悔。想过很烂。没想到这么烂。没下限，真的卧槽。无敌尴尬的演技。迷之配音，说好的恐怖片，看的想睡觉。,0
0,30183443,壹号别墅,SC,153842937,很差,2018-04-22,13:35:05,为什么给评分的都没有,0
0,30183443,壹号别墅,额滴个陈,132853255,很差,2018-09-08,16:00:45,这样的国产恐怖真的越看越失望，估计到后来听到国产这几个字就会失望透顶了吧，这么烂的剧情，我一个农民来来当导演恐怕也能拍出这种效果吧，一个镜头重复重复再重复，一句话也是这般重复，真实臭婆娘的裹脚布——又臭又长，电影80多分钟，干脆买个复读机摄像头直接对准他都能拍个40分钟，去死吧，傻逼导演，傻逼编剧！国产恐怖片没有最烂，只有更烂！,0
0,30183443,壹号别墅,Randomway,174431397,很差,2018-05-28,17:00:56,不是太烂的我不评论，真的太烂了，感觉就像是导演自己看了完整的小说或剧本，然后拍的时候跳过了一些情节，导演自己看可能不觉得怎么着，毕竟完整剧本在你脑子里你可以联系起来，但观众们看完电影云里雾里，前后情节挨不着边，跳跃特别大。咋没有负分呢？真是一部更比一部烂，没有底线，还不如济公归位,0
0,30183443,壹号别墅,我想环球旅行,136706656,很差,2020-10-07,18:29:58,哇，太好看来，快来看吧，此片将彻底颠覆你对电影的认知,0
0,30183443,壹号别墅,fei,177014752,力荐,2018-04-17,10:00:42,挺好看的，有点恐怖,0
0,30183443,壹号别墅,舒雪,173327258,,2018-04-19,19:26:30,正义之战,0
0,30183443,壹号别墅,A-麦兜,177480868,力荐,2018-04-17,22:25:03,还想再看一遍,0
0,30183443,壹号别墅,吃瓜吗,172780673,还行,2018-04-25,21:43:20,感觉没有想象中这么恐怖,0
0,30183443,壹号别墅,YoonMi92,176043373,力荐,2018-04-17,09:35:00,演员们很棒，值得一看,0
0,30183443,壹号别墅,choledrow,98732279,很差,2018-09-03,23:39:31,"题材还成……
不过，拍的什么鬼？",0
0,30183443,壹号别墅,五味子,144872418,很差,2019-02-11,11:28:27,看的我想骂人。,0
0,30183443,壹号别墅,老王家的床头柜,162578402,很差,2018-04-19,22:33:20,这么多五星有点不平衡的感觉（看出来的人藏在心里就不要说出来了）,0
0,30183443,壹号别墅,七七,174108276,较差,2018-04-19,14:31:03,看到这么多的五星好评，我就呵呵哒了，有一个坑是一个坑，能入就入！,5
0,30183443,壹号别墅,Viva La Vida,VivaLaVidaatu,很差,2018-10-30,19:44:23,这是我看过最难看的电影...,0
0,30183443,壹号别墅,真□赤色彗星,16734504,很差,2018-04-19,07:47:33,中国女鬼标配1白色长裙2长头发3四肢无力式站姿4永远挡住头发5身边必须有个小孩或者姑娘,2
0,30183443,壹号别墅,机智的小蘑菇,182763417,很差,2019-08-10,16:46:16,中国的恐怖片…呵呵,0
0,30183443,壹号别墅,神仙,177123373,较差,2018-04-23,00:33:11,烂片,0
0,30183443,壹号别墅,凡间,217945674,很差,2022-09-11,23:17:17,太好看了🤩🤩🤩大家快去看,0
0,30183443,壹号别墅,1970s,TheShowMustGoOn,很差,2019-01-13,23:52:20,这是我迄今为止看过最垃圾的一部电影。,0
0,30183443,壹号别墅,静心,175909689,很差,2018-04-23,20:30:06,导演。我就想知道，你是用什么方法，拍成烂片中的战斗机的？,0
0,30183443,壹号别墅,吉他手,95840894,很差,2018-07-25,15:25:53,说实话。看完之后第一次有种想要把钱退给我的冲动,0
0,30183443,壹号别墅,Dj_yang154,14539286,,2018-04-22,18:40:59,这么好的片居然没人评论，我一会就约女朋友去看,0
0,30183443,壹号别墅,用户6454197773,177578035,,2018-04-20,00:09:05,入,0
0,30183443,壹号别墅,再向虎山行,177807779,很差,2018-04-24,18:30:04,超级烂片，我给的是负一星，刷五星的全脑残,0
0,30183443,壹号别墅,蒲茵蜀,171353094,很差,2018-05-28,17:29:22,"吃饭的时候看 然后就 反胃了
第一次看一部电影看十几分钟就想吐
尝试着想把内容往阳春白雪上靠，但实在看不下去",0
0,30183443,壹号别墅,狼牙t,196043465,很差,2020-02-06,19:25:45,无语,0
0,30183443,壹号别墅,无人像我,177121307,还行,2018-04-20,19:00:37,一般的烂,0
0,30183443,壹号别墅,豆友201137947,201137947,很差,2019-08-07,12:19:57,我看过最垃圾的恐怖片，不不不，垃圾已经不足以形容这部片的烂了。感觉导演编剧一个是弱智一个是脑瘫,0
0,30183443,壹号别墅,河马牛哥哥,142757145,很差,2018-04-22,22:23:59,票房9万，哈哈，杀青摆个庆功宴都不够吧😄,0
0,30183443,壹号别墅,I M Way,177716177,力荐,2018-04-22,20:01:15,吓到我了，很好👍,0
0,30183443,壹号别墅,风骚的浪子,179819628,很差,2018-06-12,20:57:55,烂片这片说第二没有人敢说第一,0
0,30183443,壹号别墅,Brady啦啦啦,165193545,很差,2018-04-21,21:55:57,好看尼玛大西瓜,0
0,30183443,壹号别墅,烟火的季节,136831387,很差,2020-11-11,20:27:37,这种片子不用去喷 因为它拍出来就不为什么 只为洗钱,0
0,30183443,壹号别墅,秋风之墩UNSC,177457001,较差,2018-04-19,14:31:06,太尬，我看的是浑身难受,0
