page_index,movie_id,title,username,user_id,rating,date,time,comment,useful_count
1,26935777,玛丽与魔女之花,wenwen,hujiapapa,还行,2018-05-02,22:16:35,无功无过的一部动画片，但给我的感觉也是平平。感觉片中充满了各种宫崎骏的元素，但人物却没有宫崎骏的纯真与完美，女主是有缺点有私心的孩子。和中午看的《黄金花》一样，这片主要是败在了剧本，叙事太扁平，男主尤其寡淡。果然，不是每个制作人，都叫宫崎骏啊！,0
1,26935777,玛丽与魔女之花,weakish,WeakishJiang,还行,2018-04-30,23:19:04,能在大银幕上看到吉卜力画风真是太好了。然而这不是看了能让人想「去寻找属于你自己的国吧！哪怕倾尽一生。」的动画。,0
1,26935777,玛丽与魔女之花,莽果,90693816,还行,2019-02-27,17:37:18,猫的报恩+千与千寻。,0
1,26935777,玛丽与魔女之花,泡泡,yoyo1412,较差,2021-09-12,22:10:08,米林宏昌没有吉卜力的加持原来是一个这么无聊的监督吗！我能get最后这个不需要魔法的主题，但讲的实在是不行。这种主题不好讲的。我在想天才与庸才导演到底差别在哪……,0
1,26935777,玛丽与魔女之花,麥田捕手,102925360,力荐,2018-09-10,19:07:21,很棒,0
1,26935777,玛丽与魔女之花,Lolali,stealingbeauty,推荐,2019-03-31,12:24:46,画面非常棒。可是咂摸一下，没有什么滋味。,0
1,26935777,玛丽与魔女之花,电个爆炸头,73046958,还行,2018-03-26,01:02:22,相较以前，这些动画的水准直线下降。（并非因为我长大了）同样时长下，它们要么想象欠缺，情节单薄，不够惊心动魄；要么忽视细节，急于求成，架构痕迹过重；制作也略显随意。我怀念啊，转校，乡下，误打误撞，冒险之旅，抑或现实日常，少女情怀（总是少女）...那些真挚动人的经历和情愫多么令人羡慕！,0
1,26935777,玛丽与魔女之花,mariko,121847124,推荐,2018-04-28,17:42:37,在日本看的时候，就觉得还不错，女孩还是蛮可爱的，3.5星,1
1,26935777,玛丽与魔女之花,依萍暴富了吗,131023951,还行,2018-05-01,20:00:22,没啥电影看，跑来看这部，可看性很高啊，只是其他导演的影子比较明显，再接再励吧。,0
1,26935777,玛丽与魔女之花,丹莫罗的冷峰,3906030,还行,2018-05-06,12:28:23,又见马猴烧酒～CV阵容瞩目，世终的片尾曲尤其迷人。片尾字幕感谢了吉卜力三巨头，米林宏昌应该是最能延续吉卜力的人吧。,0
1,26935777,玛丽与魔女之花,luoyinluoxuan,zxuanzi,还行,2018-05-05,19:16:12,画风还是值得肯定的，宫崎骏动画的影子，但现在大部分动画电影都可以达到这种水平，人物刻画得还不够细腻，故事讲得有点糟糕，结构问题还是叙述问题呢？看得快睡着了～,0
1,26935777,玛丽与魔女之花,Braimbo,Braimbo,推荐,2018-03-31,00:28:23,加油,0
2,26935777,玛丽与魔女之花,汤姆贝利芬,41902485,还行,2018-05-14,21:00:01,感觉他非常迫不及待地想将毕生绝技都放进去，要做到错落有致才行啊，故事欠点深度,0
2,26935777,玛丽与魔女之花,Hawl,3579800,还行,2018-04-04,09:03:46,真的好普通，不管从设定作画还是内核都没法跟《天空之城》比，就算跟同样幼齿画风的《波妞》比也输了，米林宏昌格局真的太小，宫崎骏老爷子真是举世无双,0
2,26935777,玛丽与魔女之花,雪·法妮奥,trininottrinity,还行,2018-05-01,11:49:29,满满的吉卜力元素，自卑的小女主的成长史。,0
2,26935777,玛丽与魔女之花,戎夷先生,maitianwuya,还行,2019-09-20,04:02:16,补标记，去年在安就看过了。整体其实不如记忆中的玛妮。人物扁平，故事简单且略显俗套。除了偶尔一些有想象力的细节，以及导演从吉卜力带出来的画风，没有太多可观之处。,0
2,26935777,玛丽与魔女之花,timeseeker,timeseeker,还行,2018-05-03,17:33:58,手绘的场景很美，倒是涉及动画的部分很多时候看着都觉得粗糙。故事不复杂，也没多少设定，立意还是爱、勇气、返璞归真。一部简单着赏心悦目的动画。,0
2,26935777,玛丽与魔女之花,三千嬉皮,Nemowithcat,还行,2021-02-13,19:48:06,好平庸哦,0
2,26935777,玛丽与魔女之花,UE,ue0215,还行,2019-05-24,11:33:07,很多场景和元素都有别的电影的既视感，却没学来怎样建立不讨人厌的人设，也讲不好故事,0
2,26935777,玛丽与魔女之花,momo,83206457,较差,2018-12-09,18:55:01,只有配乐印象深刻。,0
2,26935777,玛丽与魔女之花,伪装的甘党,2700292,还行,2020-02-24,14:05:51,吉卜力的印记真深，而且更像是吉卜力流水线产物，元素过多,0
2,26935777,玛丽与魔女之花,杨三月_,143228826,还行,2018-07-08,13:59:38,浓浓的吉卜力味道，故事超一般，女主人很烦人。,0
2,26935777,玛丽与魔女之花,御姐控_光崽,natyumi,还行,2018-04-28,17:43:53,导演在选主题歌方面总是极对口味，故事中规中矩，天海的配音有亮点，刚开始有几句像在演欧美舞台剧，不过越到后面越收放自如了。,0
2,26935777,玛丽与魔女之花,夏染,49983396,还行,2018-05-02,13:22:35,我爱动漫，我爱吉卜力,0
2,26935777,玛丽与魔女之花,蓝木缨子,68849291,还行,2018-07-02,18:28:15,前半段看得昏昏欲睡，后面才稍微好点,0
2,26935777,玛丽与魔女之花,jason,55609637,还行,2019-07-09,18:30:49,类似大神的画风、一样清奇的脑洞，但格局却还有一定差距，导致本片在娱乐性和寓意上明显不足，故事就像还没开始就结束了一样。导演还需要加油啊！,0
2,26935777,玛丽与魔女之花,Ginkgo,Ginkgo,推荐,2018-06-23,11:00:31,"Beautiful background drawing, especially the forest and grass",0
2,26935777,玛丽与魔女之花,turnturn,turnturn,推荐,2018-04-05,23:40:24,滿是致敬，魔女宅急便 + 霍爾的移動城堡的前傳，故事不夠豐滿是主要敗筆，動作場遠景人物作畫有時崩,0
2,26935777,玛丽与魔女之花,种田小懒包。,arika.L,还行,2021-01-19,22:41:03,仿生吉卜力么,0
2,26935777,玛丽与魔女之花,世之介,xudeya,还行,2018-07-03,20:07:05,除了蓝莓，毫无亮点,0
2,26935777,玛丽与魔女之花,魚小樂,smilingfish21,还行,2019-01-06,14:30:28,和宝贝一起看的 想看又害怕一到教授出现就让我捂着眼睛 一直很紧张地问我Mary和小猫咪怎么还不回家啊 不管怎样 这是我们一起看的第一个关于魔法的动画 还是挺特别的记忆,0
2,26935777,玛丽与魔女之花,doubankiz,muiy,推荐,2019-08-28,21:34:52,有吉卜力的风格，叙事紧凑，节奏控制得好,0
2,26935777,玛丽与魔女之花,尼尼尼奥,leoo_leee,推荐,2018-05-13,02:55:56,夜间最后一场影院只有五个人，我们都不约而同看完所有字幕和鸣谢才离场。不是吉卜力工作室作品，却处处都是吉卜力的痕迹，画风、人物塑造上可见导演还是受到很多影响。故事内容稍显薄弱，主题深化上也相对简单，音乐同样没有太多记忆点，但并不妨碍是一部不错的动画作品。脚踏实地不追求无的极致是真理,0
2,26935777,玛丽与魔女之花,天凉气清,156675491,还行,2018-07-19,16:26:24,emmm...一般吧,0
2,26935777,玛丽与魔女之花,shun,NatsuTrevor,推荐,2018-05-06,23:18:51,感觉就是天空之城+千与千寻混合版。,0
2,26935777,玛丽与魔女之花,小小斌,50472495,推荐,2018-08-02,23:41:19,随处可见的吉卜力元素，格局不大，感情不剧烈，但是有趣。,0
2,26935777,玛丽与魔女之花,烟花,61914185,推荐,2018-05-06,10:14:00,一开始还以为女主是琪琪的女儿呢 不过画风还是熟悉的样子  即便剧情诸多bug 电影还是不错的 ,0
2,26935777,玛丽与魔女之花,绫波丽,48269530,力荐,2018-07-15,15:57:38,4.5星，假日的奇妙冒险与少女成长，其实吉卜力味很足，成人童话能拍到这个程度，我不知道还能有啥不满意的。,0
2,26935777,玛丽与魔女之花,梅林,2340389,还行,2022-10-15,17:25:36,先是魔法学院一日游，然后是动物胜利大逃亡，最后是拯救权欲熏心的魔法夫妻和路人男主，压着劲儿拍太散了。,0
2,26935777,玛丽与魔女之花,岩井俊七,1815039,还行,2018-04-29,10:46:04,开场很提神，可越看下去越失去兴趣了，情节人物造型主旨音乐等等各个方面能让人联想到的作品数都数不过来，偶尔致敬没事，可致敬太多太多就显得杂烩了，故事也无甚新意，好几处可用来酝酿情绪与情感的地方，却都戛然而止；十分十分想念借东西的小人阿莉埃蒂，求米林宏昌早日重回巅峰,0
2,26935777,玛丽与魔女之花,与地球重修旧好,the7th_bloom,还行,2020-10-10,04:07:36,"两个人的感情简直莫名其妙，前面还是叫红毛猴子，后面就是i made a promise, i will be coming back with him(then everyone). 很莫名啊。两个人的性格都没有什么讨喜或者值得挖掘的地方，像是为了剧情服务的提线木偶。

唯一不知道是加分还是减分的就是Netflix只有英文版，Mary操着一口英音说些很assertive的话，外加这个发型，非常像赫敏。

以及整个画面就是吉卜力大合集吧，像是从各个电影拼出来的。",0
2,26935777,玛丽与魔女之花,arrcmis,arrcmis,还行,2018-03-25,23:08:45,很宫崎骏风格的电影，但确实很平淡，基本情节设置都很老套，随便都能猜出来结局，少了很多乐趣……太中规中矩了～,0
2,26935777,玛丽与魔女之花,撞墙,theyoungwall,较差,2018-04-23,23:57:11,猫画的不错,0
2,26935777,玛丽与魔女之花,废土行者,64650992,还行,2018-04-23,22:57:26,电影一共才102分钟，抛开片头片尾，不太到1个半小时。本来电影时间就不多，但进入正题时间太晚了。电影花了一半的时间，给大家演了一个动画版的“哈利波特”，如何进了魔法学校，展示了魔法学校的牛逼等等。《千与千寻》，里面也描绘了一个宏大的神怪世界，但是那部电影是125分钟，多了这20分钟，,0
2,26935777,玛丽与魔女之花,非编码Postdoc,QKeenACl.,,2018-09-23,02:48:28,一言难尽,0
2,26935777,玛丽与魔女之花,ZArt,lemonchill,推荐,2018-05-02,12:58:57,欠了太多吉卜力的票根，这次多带了一个人去看也算了却心愿，也算是陪伴新的一代人成长了，好想再重温一遍魔女宅急便,0
2,26935777,玛丽与魔女之花,杨哒哒,65578251,还行,2018-04-30,19:20:46,剧本差强人意 然而音乐一出我还是哭ORZ另外 这个双马尾真的让我串戏小圆！！,0
2,26935777,玛丽与魔女之花,Joywhen,50561433,还行,2017-07-09,21:47:55,米导自立门户后的首作，完成度及格，格局比较小，很多地方还欠打磨。片尾对吉卜力三元老的感谢有点泪目。希望米导继续努力，2D动画长片的未来依然光明。,4
2,26935777,玛丽与魔女之花,燻,xunnn,还行,2022-09-21,22:21:56,真的很吉卜力。也没有看懂立意。『Double.21Sep.2022』@bilibili,0
2,26935777,玛丽与魔女之花,西西弗推巨石,160338896,还行,2018-05-08,18:33:07,基本满足预期，对于中二的电影就抱着青少年向的期待呗~其中本应存在的对魔法超自然的不可解的旖旎想象只剩下不及格的外壳，而被偷换成为科技主义之后人类对于科技的恐慌。神神叨叨本人非常不喜欢这种设定🙄,1
2,26935777,玛丽与魔女之花,侧耳倾听,greenlemonsky,推荐,2018-06-30,19:55:39,多加一颗星是为了鼓励，期待以后有更好看的吉卜力作品。,0
2,26935777,玛丽与魔女之花,qia|有痣青年,1091657,还行,2018-05-02,19:50:31,有魔女宅急便、红发安妮、穿靴子的猫等一连串影子，就是没有感染力,0
2,26935777,玛丽与魔女之花,Abay,abay,推荐,2018-04-28,20:10:24,一个人的包场电影，最后音乐响着想去屏幕前面扭一扭～吉卜力的碎片到处都是，男鹿和雄的场景，男孩女孩的小脸庞，头发被风吹起来的样子，很多飞行的镜头像魔女宅急便，两个人握住手那里好像千寻和白龙啊,1
2,26935777,玛丽与魔女之花,下天legend,55884452,推荐,2018-05-06,20:47:40,Ghibli画风好亲切，银幕首看强Mark！,0
2,26935777,玛丽与魔女之花,韩景峰看电影,63612050,还行,2018-04-12,17:30:26,《玛丽与魔女之花》是米林宏昌执导动画电影的最低水平，它在画风上就给人略带粗糙的感觉，而最可怕的是，电影的剧情从头到尾都处于疲软无力的状态，鲜有乐趣又没有意义，爆米花感极重，剩下那些似曾相识的飞行扫帚、魔女、魔法、田园风光，都像是导演在给观众喂宫崎骏的剩饭。,0
2,26935777,玛丽与魔女之花,Eccentric Cat,2352053,,2020-12-13,00:08:41,这一锅乱炖得...,0
2,26935777,玛丽与魔女之花,anyway,108238339,还行,2018-06-06,20:26:16,还不错。,5
2,26935777,玛丽与魔女之花,FOX,81497323,还行,2018-04-29,21:40:59,和导演前两部比差很多，很平庸,0
2,26935777,玛丽与魔女之花,Seela,byandby,还行,2017-10-24,15:43:50,看到一半我还以为是女版哈利波特，结果，还是千与千寻的套路啊,0
2,26935777,玛丽与魔女之花,Benjamin,45919192,还行,2018-05-08,22:20:08,🌕🌕🌗 宮崎駿的影子 看完之後太想重溫宮崎駿的全部作品 米林宏昌的故事一點態度都沒有,0
2,26935777,玛丽与魔女之花,我是美工,61806904,还行,2018-05-01,13:05:14,挺好看的，就是导演胆子小点儿，没敢放开玩，还没尽情释放就冷却了。但责任应该吉卜力来承担，吉卜力年轻导演的压力可想而知。一昧地施压就会束缚手脚。,0
2,26935777,玛丽与魔女之花,熱風,phon,推荐,2018-05-01,17:10:09,“米林宏昌式”的舒缓感与更富激情的奇幻想象结合，情节偏简单易懂，人物塑造可以更丰满，不少地方有吉卜力的影子，可以理解为导演还做不到不落窠臼？不过就现在这个水准其实还可以了。是不是大家的期望值太高？,0
2,26935777,玛丽与魔女之花,CL,CaptainL,还行,2018-11-28,21:55:38,三星。。顶多了。。too simple too naive even for a cartoon...,0
2,26935777,玛丽与魔女之花,LLtoping,173926556,还行,2022-08-26,16:39:18,画风还是继承了师父宫崎骏 但是剧情很差 女主前期撒谎自大偷东西我真的接受无能,0
2,26935777,玛丽与魔女之花,科克托马斯,72391986,推荐,2020-01-05,12:39:28,好看啊,0
2,26935777,玛丽与魔女之花,代号A,TAIGOUA,还行,2018-05-10,00:26:04,只剩女孩子可爱一个感想了,0
2,26935777,玛丽与魔女之花,安妮王子殿下,icecreamdd,还行,2019-04-28,23:48:33,画面很棒，但故事本身确实不够流畅。,0
2,26935777,玛丽与魔女之花,别人家的孩子Y,146144741,还行,2022-10-21,20:28:47,em…作为《魔女宅急便》同样是魔女、扫把、黑猫的配置，不光画面精美，还探讨主角成长。这个红发魔女，拿什么比？（我其实是冲着片尾曲来的）,0
2,26935777,玛丽与魔女之花,两个路障,178904443,还行,2022-10-22,01:03:14,很薄，从人物到剧本到动画设计，都很薄。,0
2,26935777,玛丽与魔女之花,虎子,1714845,还行,2018-11-12,10:46:41,飞回SFO第二弹。和借东西的小人比起来有点弱的感觉，虽然前者的剧情也很简单，但是这部的剧情就更弱了... 总是让会飞扫帚的狐狸叔叔救场是不是主角也太不够看了？小日向大叔的配音倒是第一时间就认出来了。,0
2,26935777,玛丽与魔女之花,苏娃,suwa,较差,2017-12-28,15:03:22,实在太无聊了,1
2,26935777,玛丽与魔女之花,归途,77536605,还行,2021-07-18,20:10:22,"吉卜力一贯的风格，只是没有宫崎骏的内核，差点劲儿。
对于极致力量的追寻必然导致毁灭",0
2,26935777,玛丽与魔女之花,カルロス三郎太,Czechoslovakia,较差,2018-04-30,15:10:22,感觉浪费了我几十块钱的电影票……世终的歌之前单听也挺好的，但是和电影不是很搭啊……这电影不就是各种梗堆积的吗……,0
2,26935777,玛丽与魔女之花,夭八,FRedLaw,较差,2018-06-27,10:09:41,确实是不太行。。,0
2,26935777,玛丽与魔女之花,沉山泥🐇,popopo,还行,2018-05-05,12:16:43,很适合小孩子看。天海佑希的反派声优演出很带感，dramatic,0
2,26935777,玛丽与魔女之花,Maomaokai,mickey19900513,还行,2018-05-28,22:00:49,女主真的废柴白痴 不招人喜欢 ,0
2,26935777,玛丽与魔女之花,ipcjs,ipcjs,还行,2018-05-02,01:58:44,大屏幕看吉卜力风格的动画还是很值得的。故事当然和千寻没得比~。最后“不需要魔法”这个结论尤其突兀。,0
2,26935777,玛丽与魔女之花,叶七,114615833,推荐,2018-04-29,15:40:27,"请务必坐到最后品一品我世终主题曲的少年音！
豪华声优配置中天海女王和小日向叔的cp感爆棚
字幕最后写着 「感谢 高畑勋 宫崎骏 铃木敏夫」 去年刚上映的时候还在说三剑客后继有人  没想到国内上映 其中一个已经不在了  看着字幕百感交集
手绘动画万岁  唯一遗憾的是坏人动机不太完整",1
2,26935777,玛丽与魔女之花,坚定躺平的锡兵,Stewart,还行,2018-04-30,11:16:50,相当平淡。差点儿以为结尾会有一场群殴戏，激动得眼泪都准备好了，没想到虚晃一枪，还是让玛丽自己轻松搞定了。多处致敬或模仿的吉卜力电影包括《魔女宅急便》，《千与千寻》，《天空之城》和《悬崖上的金鱼姬》。,0
2,26935777,玛丽与魔女之花,热力学第二定律,14247291,还行,2018-05-06,22:37:38,延续宫崎骏风格，能看出一点来，但也就是一点了，故事太单薄。,0
2,26935777,玛丽与魔女之花,可爱多,142335389,推荐,2018-05-14,23:53:42,非常有童心和少女心，值得一看！,0
2,26935777,玛丽与魔女之花,岁月何须溪上记,shojo,推荐,2018-09-06,22:40:15,米林宏昌。看到了很多《魔女宅急便》的影子。不太喜欢的地方是片头偷花种的魔女、后来失去魔力，身体发福，成为软弱的老阿姨。最亮眼的是扫帚看守人，雪中送炭解决所有难题。,0
2,26935777,玛丽与魔女之花,小花,Supittsusunmer,还行,2022-11-17,01:12:03,本来吃饭看个乐，弹幕属实让人感觉索然无味了,0
2,26935777,玛丽与魔女之花,关彳山,davidzdh,还行,2018-04-30,20:06:54,还是期待导演之后的作品吧。,0
2,26935777,玛丽与魔女之花,NEVER MIND,54028610,还行,2020-06-09,23:28:39,黑猫不错 严肃的小表情我很喜欢,0
2,26935777,玛丽与魔女之花,lemoncan,lemoncan,还行,2018-10-22,18:42:19,画面、节奏都不错，但剧情太多硬伤了，主角也不讨喜。,0
2,26935777,玛丽与魔女之花,Cage,163210363,推荐,2021-09-13,23:29:37,英国儿童小说改编，所以虽然有着非常吉卜力的舒心画风，剧情却非常子供向，立意和世界观的呈现与宫崎骏的作品相差甚远。最主要的是缺乏有趣的设定，在已然比不上经典的《魔女宅急便》时，并没有想着另辟蹊径，而是传统至极的冒险和战胜坏人，魔法学院总出戏Harry Potter。脱离了吉卜力的米林宏昌，缺少了宫崎骏编剧的动画新作，失去了借物小人的那份惊喜。,2
2,26935777,玛丽与魔女之花,山绘秋岚,guanala,还行,2018-05-06,15:49:37,"emmm…有种一头雾水的感觉…像一篇牵强的命题作文… 
本来想给四星的 一星扣在peter的发型XD",0
2,26935777,玛丽与魔女之花,好嘞,kimi0916,还行,2018-05-09,22:21:30,天空之城+千与千寻+龙猫+魔女宅急便+记忆中的玛妮，故事相当相当无聊，一百分钟我扫了两次地、剪了指甲敷了面膜、在屋里溜达了好几圈才终于看完，米林宏昌最好的动画还是借东西的小人阿莉埃蒂。,0
2,26935777,玛丽与魔女之花,聽見月光,ougree,推荐,2018-04-29,09:35:23,@_UME 神木DD 長大以來真是CV、變態兩手抓，可以這次戲份好少,0
2,26935777,玛丽与魔女之花,小蠍,victorjie,较差,2018-04-28,20:34:01,能使用所有魔法…能使用解除所有魔法的魔法吗…能…结束…,2
2,26935777,玛丽与魔女之花,达力猿,92843234,还行,2019-04-24,23:53:30,虎头蛇尾。种草了玛丽的小包包（跑偏,0
2,26935777,玛丽与魔女之花,Tyiya,4675330,还行,2021-04-04,15:46:33,这是对工业文明的一记棒槌吗笑死……太子供向了我差点没撑下去，看在制作精良的份上多打一星。,0
2,26935777,玛丽与魔女之花,J,161938201,还行,2022-05-08,00:30:05,"首先，是被小红书上一张在花丛间吃着美味食物的照片给吸引住了。日本动画就喜欢这种颜色饱和度高，画面流线简单，食物看着可口的。
魔法🔮学院校长我叫她“水婆婆”，戴眼镜的样子太像傅首尔了吧。玛丽有种波妞的赶脚。",0
2,26935777,玛丽与魔女之花,红辣椒,13695982,还行,2018-07-08,09:06:34,玛丽画得也太像波妞了吧,0
2,26935777,玛丽与魔女之花,十四卷,41553512,很差,2018-04-28,16:37:48,再次感受被《声之形》支配的恐惧。《小魔女学园》真棒！,0
2,26935777,玛丽与魔女之花,WHON大吉,Wdlan,还行,2018-10-09,17:16:51,差远了,0
2,26935777,玛丽与魔女之花,Leibiennnnnnn,lymh,还行,2018-08-23,04:56:18,还是承了宫崎骏衣钵的。就是个童话，缺了点深度。以及哈利波特果然是东抄抄西抄抄啊……,0
2,26935777,玛丽与魔女之花,TreasureCruise,darklipstick,较差,2018-05-05,13:21:30,男主太丑了！！！！稍微好看一点点我都能尝试假装自己有enjoy一点点这种弱智故事。,1
2,26935777,玛丽与魔女之花,进化喽,137936134,力荐,2018-04-28,12:13:07,好看啊 今年看过最好看的动画,2
2,26935777,玛丽与魔女之花,hbr,hbr,还行,2018-08-13,09:35:21,画得了皮，画不了魂,0
2,26935777,玛丽与魔女之花,ofelia11,128665149,还行,2019-01-25,21:38:52,从2010年的《借东西的小人阿莉埃蒂》到2014年的《记忆中的玛妮》再到2017年的《玛丽与魔女之花》，人物画风色彩一如既往吉卜力，然而人物塑造和剧情推进的能力直线下滑，处女作一鸣惊人的米林宏昌是江郎才尽了吗？看到最后字幕感谢高畑勋、宫崎骏、铃木敏夫，还是被感动到，一日为师，即使现在自立门户，米林宏昌也算是吉卜力最后的传人，但和大师相比，讲故事的能力真的要加强，这一点不是模仿可以得来的。,0
2,26935777,玛丽与魔女之花,特伦,milkyo,还行,2018-05-05,18:33:17,人物角色和小镇场景延续了《借东西的小人》的可爱精致。但是在展现大场景的时候就有些乏味了（不怎么好看的魔法学校内景、群兽奔腾场景），与《千与千寻》等差距还是有点大的。最后不得不说原本小切入点可以出佳作，但剧本无味，节奏失衡，完成度很低，很拖后腿。OST 倒是绝赞。,0
2,26935777,玛丽与魔女之花,假笑girl,2161666,还行,2018-04-29,16:07:21,所以那些不受关注的小孩就最容易被利用了。,0
2,26935777,玛丽与魔女之花,忘我洗澡,runqueen,还行,2018-05-04,19:42:45,剧情神经病的地方真是太多了，但是画面！太特么厉害了！三星全部给画面和配乐。PS，玛丽穿着黑色安全裤哟！🌚,0
2,26935777,玛丽与魔女之花,有过的L和KA,whitehairpin,推荐,2018-05-03,12:05:39,想象力仍在 故事中规中矩偏幼齿 满满吉卜力元素 玛妮 魔女宅急便 天空城 但因为是根据英国文学改编 其实最像哈利波特；被嫌弃的玛丽 教授和校长 飞行之花 一天时效的魔法 黑猫 液状法术 起风了飞行器 云雾森林；动物变身 魔法怪物 前尘往事；校园里某些细节有趣 化学 隐身。,0
2,26935777,玛丽与魔女之花,咚咚tomato,AkiraShirosawa,还行,2018-04-03,14:39:29,如果连米林宏昌自己都讨厌自己打造的魔法世界，那如何能做成打动人心的作品？不看好离开吉卜力后的路。,0
2,26935777,玛丽与魔女之花,明光暗影,145849529,较差,2018-05-15,10:14:07,离宫崎骏的味道还是差很远，还弄个“哈利波特”的情节，不如导演前作《借东西的小人》，内地票房差也是可以理解的了~,1
2,26935777,玛丽与魔女之花,甘楽,50617725,还行,2021-04-03,22:37:00,小狗不陪我看还妨碍我看 记下了,0
2,26935777,玛丽与魔女之花,Vince,129732283,还行,2023-01-30,09:13:18,非常宫崎骏的外表，但剧情和内核还需打磨！首先影片前段对于玛丽的交代过于平面！导致了剧情突然发展到中期主角还停留在纸片人的程度！影片想要表达认真做事、待人以诚的重要性，比之要靠天赋才能找到自我存在感的方式要重要得多！但影片对于这个主题的深化也不够，最终导致主旨变得不伦不类的！不过美术与画工确实没得说！,0
2,26935777,玛丽与魔女之花,菲到一亿光年外,144881358,力荐,2018-04-19,10:27:06,光听神木隆之介和天海佑希配音就很棒了,1
2,26935777,玛丽与魔女之花,酒月,TaeyeonBaehyun,较差,2022-03-03,18:51:17,宫崎骏作品缝合成品，剧本细化一下完全可以更自然，现在的剧情漏洞百出，生硬得要死，角色废物，明明是人造成的问题，最后都怪到魔法上，有病吧？女主伪成长，男主的造型美国味儿太重了，完全没有纯洁少年的感觉！,0
2,26935777,玛丽与魔女之花,1999cctv,143472117,还行,2022-04-06,16:51:36,剧情生硬,0
2,26935777,玛丽与魔女之花,AKang,144620339,还行,2021-11-29,13:55:00,我们一起回家ba,0
