page_index,movie_id,title,username,user_id,rating,date,time,comment,useful_count
1,26935777,玛丽与魔女之花,Zizi在十年前,mlzizi,还行,2018-06-26,21:26:21,高仿吉卜力，但说实话故事、画面、音乐、内涵和细节，都还差的远。最后字幕的“感谢高畑勲，宫崎骏，铃木敏夫”，也是对整个画风最后的解释。有些失望。,0
1,26935777,玛丽与魔女之花,Fleurs.哼哼,56922790,还行,2018-05-01,11:40:25,看到好多影子,1
1,26935777,玛丽与魔女之花,夏映竹,28524946,推荐,2018-04-29,13:15:12,把每一次看电影当做和前辈们交谈。,0
1,26935777,玛丽与魔女之花,段郎RockDuan,rockduan1987,还行,2018-05-10,18:10:03,"米林宏昌比他师父宫崎骏差了至少一百倍。
画面尚可，人物充满槽点，原著就是这么松散的故事吗？实在是不吸引人，在单人包场的情况下，我全程在玩手机。
不是烂片，但吉卜力该有的那种“童心”氛围，没做出来……",0
1,26935777,玛丽与魔女之花,月棠,65162419,推荐,2020-04-23,23:33:52,一如既往可爱的画风，勇敢的少年少女。,0
1,26935777,玛丽与魔女之花,Just Jean,jean_zx,还行,2018-03-28,17:02:09,画面精美，故事内核还需要努力啊,0
1,26935777,玛丽与魔女之花,春垓,horadric,很差,2018-10-20,14:52:42,恭喜吉卜力，终于达到了中国网文水平，除了结尾略有不同外，我看不出这个剧本和网文中流行的那种屌丝逆袭打脸故事，有什么区别。即便有原著，我也希望脚本家们能认真对待作品，动画是远超真人电影想象力的存在，如此轻视想象力，只会看到吉卜力消失在海量作品当中。,0
1,26935777,玛丽与魔女之花,熊能能脚不沾地,newbear,还行,2018-06-06,23:58:14,这真的不是宫崎骏吗？哈哈哈哈哈。,0
1,26935777,玛丽与魔女之花,書呆子,28227017,还行,2018-04-28,23:04:09,"似乎一切都很完美了。劇本足夠純真、卡司足夠強大、音樂足夠令人動容。可還是感覺不太對。
音樂部分很棒，松村的第一個音符出來我就熱淚盈眶，甚至連ED，世終的曲子，卻也唱出了滿滿希望。
但感覺太平庸了，總感覺黑貓的眼神是「鄙視」。故事簡單沒關係，只要滿懷真情，也會有情感上的沖擊和感動。",0
1,26935777,玛丽与魔女之花,被遗忘的米粒,haman,还行,2018-04-28,12:40:07,说实话，很失望，之前导演的两部作品都还很不错，这部的叙事画风都很让我失望，剧情平庸，人物设定乏善可陈毫无亮点，主旨不清晰不深刻……差不多可以说是对魔女宅急便的复制……,1
1,26935777,玛丽与魔女之花,瑞波恩,39690610,推荐,2018-04-30,14:01:01,走火入魔的米林宏昌，节奏失控，虽打着宫崎骏的招牌，拍的都如同机动战士。吉卜力讲天人合一以静制动，然这部只得其表，不得真髓。,0
1,26935777,玛丽与魔女之花,苏彦明,44594309,推荐,2018-04-17,22:41:56,风格熟悉的动画，看起来一点不费劲。故事中的各种形象有点类似于魔女宅急便，但仅仅是形似，内在完全不同，讲述的故事更加像是消遣性质，并不能看到什么浓厚的感情，人物刻画也过于简单。甚至是男女之间的朦胧爱情，也显得生硬，还不如两只猫。不过故事还是足够曲折，也充满想象，总体观影感还行。,0
1,26935777,玛丽与魔女之花,木樨,32891974,还行,2018-04-30,12:07:02,就那么回事吧。无论是玛尼还是借东西的小人都能感觉到一种激动，魔女之花没有。,1
1,26935777,玛丽与魔女之花,荔蘿,saint.sebastian,还行,2018-01-20,16:04:34,"很精美的作画,很厉害的阵容,可惜很平庸。天马行空的童心才是魔力。",0
1,26935777,玛丽与魔女之花,一颗晚星,45466177,还行,2018-06-30,23:37:51,一般般是真的，没有力量没有灵魂,0
1,26935777,玛丽与魔女之花,Soc,magic.rhythm,还行,2018-04-12,20:52:36,什么元素都有了，却少了魔女宅急便的魔女味～,1
1,26935777,玛丽与魔女之花,走走看看,3538758,还行,2018-03-21,09:27:06,新瓶装旧酒,0
1,26935777,玛丽与魔女之花,电影上言君,tianranzijiegou,推荐,2018-08-09,14:08:07,果然从配音表就可以看出阵容的强大。电影很宫崎骏的画风，日本动画带给人的感动会一直延续。拥有魔法的玛丽就是带给人希望的女魔法师。拯救了误入歧途的大人们。,0
1,26935777,玛丽与魔女之花,raVen,karasu419,还行,2018-04-22,18:44:16,有评论说，只是我们长大了，我不同意。吉卜力的动画向来不是只给小孩看的。米林宏昌前两部我也很喜欢，可是这部，只看到想靠来沾光的似曾相识的满满吉卜力元素,0
1,26935777,玛丽与魔女之花,limo,53144632,推荐,2018-05-05,11:58:17,魔法少女的故事怎么都看不够啊。,0
1,26935777,玛丽与魔女之花,银毛熊,57636780,推荐,2018-04-30,13:31:15,有个比较惊艳的开场，片名出来后大部分时间的故事情节略平也略俗套，好在重点桥段动画表现挺不错。,1
1,26935777,玛丽与魔女之花,囍樂,fatiaomuou,还行,2018-07-24,15:28:55,挺温暖的挺热闹的挺白痴的。。。。,0
1,26935777,玛丽与魔女之花,mo酱,monos,较差,2019-04-05,22:44:13,这个世界连魔法都不需要了还要动画做什么,0
1,26935777,玛丽与魔女之花,阿欧,154564472,较差,2023-01-20,15:07:22,"把做音效的人鲨了吧，一惊一乍的，和神经病一样。配音也不太贴脸，主角的声音太乖了，不适合这种烦人鬼女主。然后整体各个方面有点像缝合怪。
天海的声音还是好听的",0
1,26935777,玛丽与魔女之花,三炮,27469780,,2018-06-09,22:01:39,据说是吉卜力出身的画师的作品，这画风可以说是非常纯的吉卜力了。故事还是挺新鲜的，不过那些设定接受起来有点难度,0
1,26935777,玛丽与魔女之花,杀猪大娘,4574689,推荐,2018-03-28,10:51:28,虽然是我讨厌的主题，回头想想也不是很喜欢这个故事。尤其是最后还说了一句“这个世界不需要魔法”，讨厌这种现在世界是完好的价值观。然而全片还是看的津津有味，也许是因为蓝色的花吧，也许是因为可以飞在天上的扫把，也许是因为红头发的少女。,0
1,26935777,玛丽与魔女之花,zeroasd123,60016173,较差,2018-05-04,16:24:26,前半程我还以为又是一部低配版的小魔女学院，结果后半程却显示了不同的想法。怎么说呢，主题那所谓消灭危险的魔法实质就是导演对现代化和科技文明的强烈否定，在这一点上倒是继承了中早期宫崎骏的环保恐怖主义情绪。然而我对于这种日左特有的扭曲却有点欣赏，至少比通篇一律的小确信有骨气的多（笑,1
1,26935777,玛丽与魔女之花,春卷er,75170821,较差,2018-06-29,21:16:26,最后的魔力哪来的,1
1,26935777,玛丽与魔女之花,ztlpoppy,ztl-poppy,推荐,2018-07-28,00:19:47,画的一定很辛苦吧，但是还是有种在看吉卜力往年作品大集合的感觉,0
1,26935777,玛丽与魔女之花,云,TheKeys,较差,2021-07-03,02:18:08,38分钟还在铺垫……,0
1,26935777,玛丽与魔女之花,Leorange,50343257,推荐,2018-04-30,17:47:52,看到豆瓣评分只有6点几，真是惊讶。虽然跟《千与千寻》、《龙猫》、《天空之城》比是有差距，但是较之《猫的报恩》、《借东西的小人阿莉埃蒂》真的是丝毫不差。魔女的故事总是有趣~,1
1,26935777,玛丽与魔女之花,张卯,yesenia1988,还行,2018-05-02,09:16:25,消磨时光,0
1,26935777,玛丽与魔女之花,Sugar,2850261,还行,2018-07-21,20:20:46,不能和以往相比,0
1,26935777,玛丽与魔女之花,烨明,shinehall,推荐,2018-04-29,12:11:05,能够温暖人心的电影都是好电影，“一緒に帰ろう”真的感动死了,0
1,26935777,玛丽与魔女之花,不喝水的鲫鱼,83771916,推荐,2019-04-05,17:14:31,"@@@@（2017-07-08）メアリと魔女の花（玛丽与魔女之花）（Mary and The Witch's Flower）
（剧情没什么独到之处，但看着不无聊。或许很有童趣吧。作画非常精致。）",0
1,26935777,玛丽与魔女之花,willow,willow_0319,还行,2017-12-31,12:59:07,真的…很低幼…声优都好大牌,0
1,26935777,玛丽与魔女之花,Fionn,philia-li,,2018-04-29,18:08:58,最大的问题在于意义的缺失：玛丽对红发的芥蒂、彼得对家庭的担负都是应该重点展开并升华的内容，这些有关“改变/成长”的细节被浮皮潦草地带过，以至于最终呈现出的是这样一个苍白的故事。从这个方面说，它远逊于魔女宅急便，甚至就连魔法奇观的打造也比不上地海传说。收获其实是那个清爽帅气的小哥哥,0
1,26935777,玛丽与魔女之花,蔡名名,154461735,推荐,2018-05-09,19:38:08,夜间飞行花  力量 欲望  贪婪 。希望所有的孩子看了懂得节制,1
1,26935777,玛丽与魔女之花,去年槲寄生,PulpPaprika,还行,2018-05-01,17:41:34,平淡俗套的少女历险成长故事。和小澈一起,0
1,26935777,玛丽与魔女之花,MonkeyDfly,qazwsx132,较差,2018-05-04,18:05:29,表酱紫，让我享受了一个没有了灵魂的吉卜力，突然感叹宫老爷子坚持住让我再多看你的电影。人物故事世界场景没有没有！任何一个是值得讨论的！这样子来说可以说是完全的失败。一星给波妞和魔女宅急便。,0
1,26935777,玛丽与魔女之花,三太子,KQueen,还行,2020-03-22,12:02:23,故事复盘还不够 感觉没头没尾,0
1,26935777,玛丽与魔女之花,makiyo0826,59203993,推荐,2019-10-29,01:58:00,红发娇娃 恋上扫把 飞的潇洒 誓做麻瓜,1
1,26935777,玛丽与魔女之花,KUMA,oursonkuma,还行,2018-02-26,02:04:00,"Le 1er long métrage du studio Ghibli Bis rime avec 1 conte fantaisiste initiatique dans le sillon du vieux maître Miyazaki, avec sans doute la poésie en moins.  Là où il gagne en fluidité narrative et en spectaculaire de l'action, se perdent la subtilité et l'équilibre.",0
1,26935777,玛丽与魔女之花,秋水共长天一色,48435609,较差,2021-02-10,23:59:54,前有珠玉，画面都很好。但是似乎没有内容，都很空洞。,0
1,26935777,玛丽与魔女之花,请尊敬王道长,WX0822,,2018-04-23,22:55:26,虽然只能给3星，但是看完心情很好。春夜晚风溜溜达达，看看路边能不能捡到一个会飞的扫把,0
1,26935777,玛丽与魔女之花,爱思特梵·娃娃,TiffanyBrisset,推荐,2018-05-05,21:38:09,比想象中好，女性向动画，可爱，趣味，画面感觉也很魔幻，小女孩应该会喜欢。,0
1,26935777,玛丽与魔女之花,kyou,43783147,推荐,2018-07-04,07:29:43,3.5 吧 美术没有以前精致啊 故事还行 但是就是很吉卜力那种,0
1,26935777,玛丽与魔女之花,杜小德,lanedo,推荐,2018-12-04,01:53:14,两小无猜的感情比魔法更重要～童真多一些，但也很好看呀～,0
1,26935777,玛丽与魔女之花,克劳克罗,clockcrow,还行,2017-10-23,00:23:51,很像吉卜力，但终究觉得差了一点。故事本身不够有趣，反派逻辑不合理，也没什么伏笔。魔法学校的设计想象力也不够，有太多其他电影的影子。小朋友看还行吧 给成人看不够有趣。,0
1,26935777,玛丽与魔女之花,轻如纸张,herringcg,较差,2020-01-01,10:42:05,已经不是这种作品的年代了，更不用说是这种高度仿制品，像是一款商品火了之后铺天盖地出现的山寨四不像产品,0
1,26935777,玛丽与魔女之花,怪獸のMonster,55699366,较差,2020-02-01,21:15:08,龙猫+魔宅+哈尔+天空+千寻，基本上预告片里都可以看到这些影子。,0
1,26935777,玛丽与魔女之花,simonfaye,simonyao,,2018-02-01,02:09:26,我睡着了，得再看一遍,0
1,26935777,玛丽与魔女之花,心之呢喃,54721365,还行,2018-07-04,23:17:02,确实这是一部中规中矩的作品，简单的描绘了一个孩子的梦想世界，作为米林昌宏的第一部单独作品来说，有很多以往吉卜力的影子，没有突破只有致敬，总体过得去，期望在接下来作品中看到更好的米林昌宏  20180629,0
1,26935777,玛丽与魔女之花,小嘢喵子,lovejany,还行,2018-04-27,13:22:29,剧情虽弱，但寓意了吉卜力“魔法”的传承，前辈相继退位，吉卜力辉煌时代终将过去，米林宏昌是迷茫的，没有魔法真的可以吗？,0
1,26935777,玛丽与魔女之花,纤手破新橙,xj121166836,力荐,2018-04-20,11:31:10,很久没有看日本动画了，还可以，导演感觉很熟悉。,0
1,26935777,玛丽与魔女之花,偏執小塵埃,cheermusic,较差,2018-02-26,05:18:51,俗气,0
1,26935777,玛丽与魔女之花,KaliMata,taomen0125,,2018-09-28,19:29:32,"反魔法系列
“这个世界上很多力量是人控制不了的”
是啊 一起回家吧
那个 扫帚变身的时候 真是浮想联翩啊噗",0
1,26935777,玛丽与魔女之花,PAMBO,l6HrsOfDreams,还行,2021-05-16,21:46:54,小女生本来没见过世面就单纯，会害怕所以就说了谎，这才是最真实的状态。经历过这些他才能成长，懂得防范别人，保护别人，没啥好吐槽人设的。只是这个故事不高级，很一般罢了。,1
1,26935777,玛丽与魔女之花,longhann,longhann,较差,2018-07-23,16:58:54,猫可爱,0
1,26935777,玛丽与魔女之花,沙客,96000077,还行,2021-03-09,17:54:08,"平平庸庸，近年出的几部吉卜力的作品好像都不太行
果然宫崎骏才是永远的神",0
1,26935777,玛丽与魔女之花,果步,sanatoria,推荐,2018-05-08,01:01:18,虽然蓝色扫把 红头发都是熟悉的故事点 可是新故事还是很可爱的阿 是有自己美好的地方的,0
1,26935777,玛丽与魔女之花,传说北美狗鱼,52396951,推荐,2020-04-15,14:50:35,比起他的上一部《回忆中的玛尼》好看了很多，但可能原著的功劳比较大。,0
1,26935777,玛丽与魔女之花,神迦乐小舞,centlelover,较差,2018-04-30,19:47:38,美术和音乐不错，剩下的一团糟。,1
1,26935777,玛丽与魔女之花,桔梗,bluekikyo,推荐,2018-04-04,23:45:39,爱是永不抛弃,0
1,26935777,玛丽与魔女之花,海月梦香,154620886,还行,2018-04-28,17:34:04,用不错的作画搭配奇怪的设定讲了个无聊的故事,0
1,26935777,玛丽与魔女之花,yihan1010,1609757,还行,2018-04-30,17:39:26,少女成长类的低幼故事，看起来似乎天马行空，实际上还是那些宫崎骏元素的堆砌以及哈利波特魔法学校的臆想扩展，倒是多少带点原著英国儿童文学属性的影子，人物的性格和塑造都不太讨喜，只能靠吉卜力明亮鲜艳的色彩海洋来吸引注意力了。（59）,0
1,26935777,玛丽与魔女之花,司马缸,2155432,还行,2019-07-01,20:39:49,对扫帚这个词有了认识。,0
1,26935777,玛丽与魔女之花,Katsura,49855373,还行,2018-04-22,00:49:03,还可以，前半段比较好，临近结尾有点乏力,0
1,26935777,玛丽与魔女之花,NaiveWimp,67245376,力荐,2018-05-24,13:29:25,小孩子为了满足小小的虚荣心，羞怯的应答着与能力不符的夸奖，这有什么好苛责的啊。那么勇敢的玛丽，不是还挺可爱的吗,2
1,26935777,玛丽与魔女之花,jl心程7,120775047,较差,2021-05-28,05:33:07,为了片尾曲看的，画风完美，然而剧情 人物塑造单薄，差点弃了,0
1,26935777,玛丽与魔女之花,一季风,51589341,还行,2019-07-17,23:56:35,剧情真的是弱了些。至少的孩子怎么了，之后的魔法世界会怎么样，都没说。可以说整个世界观根本没有完善，真的只是南宫一梦，路过而已。,0
1,26935777,玛丽与魔女之花,momo,121490926,还行,2018-03-22,12:11:11,"感谢友邻提供资源!很单纯的故事，仿佛爱丽丝梦游仙境+动物世界233,片尾曲好听到不行，想起最后两人牵手""一起回去吧，一切的魔法消失吧，这个世界不需要什么魔法。""还是挺感动的。有些剧情偏不合逻辑，明明有魔法了可以更快脱逃的嘛!",0
1,26935777,玛丽与魔女之花,口苗君🌊,cynthiawong,还行,2018-06-29,10:21:30,超级一般了。,0
1,26935777,玛丽与魔女之花,Silent Lullaby,52696490,还行,2018-08-02,02:01:27,千与千寻、哈尔的移动城堡、魔女宅急便和龙猫的大杂烩。总体质量上乘，但无突破和可圈可点之处。,0
1,26935777,玛丽与魔女之花,阿冉,65161109,很差,2018-05-15,18:05:12,有形无神。导演大概从来没研究过宫崎骏笔下的少女是多么坚韧，塑造了这么一个又蠢又贱又光环附体的女主。,2
1,26935777,玛丽与魔女之花,火娃,70990506,较差,2021-09-25,12:33:31,5/10。开头是与吉卜力风格不同的高强度节奏，炙热爆炸的火焰、诡异的巫堡和无法控制的蓝色魔法色彩对比鲜明，特写对准仓皇逃跑的红发女孩垮上的花袋，对花袋的强调吊足了观众胃口，也对玛丽发现魔法之花的情节埋了伏笔，但开场太出彩而后续平庸乏味，反而会加重观众的厌恶，致使对宫崎骏传统意象的大量照搬缺乏出色的内容支撑，例如扫帚、黑猫、起飞落地不稳定的魔女，慈祥的奶奶、女仆和田园景色，魔法学院的观摩场景和奉女校长之命的追兵变身空中乌贼，甚至玛丽自家的花匠，其贝雷帽、粗框眼镜、白胡须和工装背带裤的形象很像宫崎骏本人，使文本充满拼凑感。关于成长的主题有明显的割裂，当扫帚把玛丽带入一所自动点亮灯柱的房子，发现魔镜中的红发女孩就是玛丽奶奶，仅仅揭开了身世就使笨手笨脚、容易虚荣的玛丽迅速修正自我、克服磨难，未免太突兀。,0
1,26935777,玛丽与魔女之花,孤独的夜行侠,73064038,还行,2018-05-02,19:54:00,还是有不少一时难以摆脱的吉卜力的影子，另外剧本和人物形象太糟糕，建议打回重做。,0
1,26935777,玛丽与魔女之花,悲辛無盡獨行夜,huppert,推荐,2018-04-28,20:04:53,国配很好，片尾曲好听，当你学会飞翔，别忘记脚踏实地，红发果然与众不同，中世纪欧洲黑猫是女巫宠物，校长教授致力于魔法普世目的崇高不代表手段可以卑劣，剧情走向有些意想不到，没有天赋光靠魔力本末倒置，收获勇气与友谊，玛丽得到了成长，魔法学校的设计可以更大胆些，,0
1,26935777,玛丽与魔女之花,沉水,yoma,还行,2018-06-27,12:05:44,从角色到剧情都欠火候，但仍希望创作者能够脱离宫崎骏的阴影，开创属于自己的道路。,0
1,26935777,玛丽与魔女之花,唐某人,tlhzte,力荐,2018-04-30,21:11:07,还是熟悉的味道，虽然有的地方有点生硬，但看见熟悉的场景和人物还是喜欢的不得了。,1
1,26935777,玛丽与魔女之花,lulu890708,2640194,还行,2018-04-28,16:50:23,太多吉卜力的影子了，配乐多加一星吧，给三星,0
1,26935777,玛丽与魔女之花,雨中散步,54277204,还行,2018-04-09,21:50:36,故事讲不好，再好的画面都是白搭~,0
1,26935777,玛丽与魔女之花,笑笑笑笑笑,4594990,还行,2018-05-06,22:02:44,吉卜力烙印很深,0
1,26935777,玛丽与魔女之花,第二个乌托邦人,48941452,推荐,2019-10-21,01:48:37,女主应该是开场那凌然的身姿和只出现了五分钟的满岛光的声音才对，主角的声音太过了些。到处都让人觉得充满了宫崎骏的影子，魔女的小屋真的太美了吧！！！那个可以看到天空的落地窗，还有贴心守护的火苗，我要是夏洛特，绝对不会就这样放弃我的家啊！,0
1,26935777,玛丽与魔女之花,Ginjiro,61797915,还行,2018-08-22,11:46:39,到处充满了千与千寻的影子，女校长如汤婆婆，博士如锅炉爷爷，同样是在开学前发生的冒险，结束时女主头发上的花对应小千的发卡…,0
1,26935777,玛丽与魔女之花,奔跑的狐一步步,158029414,还行,2022-07-03,04:00:27,女主太蠢，虽然看得很生气，但不得不说魔仙堡和各种魔法生物的设定其实不错，蛮有想象力的，画面很好看。唯美治愈风，但故事很不治愈看得人心梗。猫咪太可爱了，好抢戏，下垂眼什么的不要太萌\(//∇//)\！,0
1,26935777,玛丽与魔女之花,水红,2197048,还行,2021-11-26,15:24:24,很吉卜力，每每想起《魔女宅急便》（其实想给娃看那个的）。各种眼熟，哥哥有点害怕，总是爱与勇气吧，不过不失，也没任何惊艳，如此而已。,0
1,26935777,玛丽与魔女之花,陈精病,soul922,较差,2018-03-31,23:33:14,一点也不吸引人,0
1,26935777,玛丽与魔女之花,微阳,1933139,较差,2018-06-16,14:29:06,故事越来越套路化了，没有什么宏达的世界观也没有什么特别的角色。每个人都能在以前的作品里找到原型，像拼凑出来的山寨货,1
1,26935777,玛丽与魔女之花,川者,68812580,还行,2018-07-07,16:08:39,前面五十分钟好慢，好闷,0
1,26935777,玛丽与魔女之花,Diana,1202743,还行,2018-06-30,20:29:33,故事单薄了点,0
1,26935777,玛丽与魔女之花,夏季的天空,141049149,推荐,2018-03-28,13:08:44,延续了之前《记忆中的玛妮》和《借东西的小人阿莉埃蒂》的风格，清新，可爱，温柔；当然，吉卜力的痕迹一如既往的很重，《哈尔的移动城堡》、《千与千寻》、《天空之城》和《魔女宅急便》历历在目，感动依稀。,0
1,26935777,玛丽与魔女之花,咸鱼王腐loli,fuloli,推荐,2018-04-27,14:46:25,勇敢的少女哟，去拯救世界吧！从世界观人设到各种细节都很吉卜力，使魔猫，行走的扫帚，天空之城，胖胖又有点蠢的反派魔女，长着锅炉爷爷的脸的科学家，自动点亮的灯，瞬间长大有点帅的男主，有故事的奶奶，最后一次飞行。剧情中规中矩但音乐太棒，ed响起的时候有种梦醒的感觉。,0
1,26935777,玛丽与魔女之花,小明,chuxuemu,还行,2018-06-26,21:31:27,设定不错，但Bug很多，而且很多其他电影的影子。,0
1,26935777,玛丽与魔女之花,李易安,xinnbabe,较差,2021-05-16,20:55:37,披着吉卜力外衣的一个莫名其妙的故事？？？？看了一场寂寞,0
1,26935777,玛丽与魔女之花,白梦非梦,daydreamerre,还行,2018-08-06,12:03:26,有这么多厉害元素却做成这么无聊的四不像，不知道该说什么好。,0
1,26935777,玛丽与魔女之花,罚款时间y,64980691,还行,2018-04-30,19:03:49,事实证明只是画面模仿吉普力是达不到吉普力的成功的。本片的画面和人设乃至声优其实都是非常不错的，但是这些硬条件都被本片平庸乃至有些屎的剧本给毁了，而且感觉导演制作动画的经验都不太足，不少场景相当尴尬和无趣。感觉这个工作室的作品还有很长的路走，不过画面和制作水平过关了应该前景会不错,1
1,26935777,玛丽与魔女之花,车氏赛卡,175047130,还行,2022-12-31,23:51:16,2022最后冲业绩补标系列,0
1,26935777,玛丽与魔女之花,江户川乱跑步,blossombirds,推荐,2018-04-29,18:46:32,画风是吉卜力一贯的风格，剧情节奏其实都不错，但是是完全属于小朋友的动画，大人看会觉得少了点什么。一直觉得含有“限定魔法”概念的作品很适合小朋友看。,1
1,26935777,玛丽与魔女之花,吃个大香瓜,toutoulan,推荐,2018-04-28,17:44:32,属于那种看了之后会有种那么认真干嘛的感慨的电影,0
1,26935777,玛丽与魔女之花,桃不碧,garbage_minipig,还行,2018-07-07,00:23:23,不好看不好看唯一女主看得我太难受故事也是莫名其妙没劲,0
1,26935777,玛丽与魔女之花,生活甜蜜的邮差,MessPostman,较差,2018-08-28,18:35:28,3.5/10。极度类型化的吉卜力作品：空洞无趣，借鉴的元素太多，更严重丢失了自我风格，只是一部纯粹商业面相的庸作。,0
1,26935777,玛丽与魔女之花,菲依,50967494,推荐,2018-05-04,20:35:55,评分太低了，大家期待很高。本片有很多不足，比如人物脸谱化剧情一根线略微有点不尊重ginger（把红猴子看成人还行？），但是整体来说还是很合格的，还能坚持手绘动画就很难得了，麻烦下次剧本充实一点哈。（国语配音又把人名搞的中英混杂，彼得或者皮特都可以吧，一直“逼的逼的”，我要疯了。）,0
1,26935777,玛丽与魔女之花,向日葵d兽,18313578,还行,2019-05-02,09:51:19,3.5。1.前吉卜力员工集結的Ponoc工作室首部长片，比预想好看很多；即便满满的都是吉卜力元素（魔女宅急便+龙猫+天空之城+千与千寻），但原始蓝本其实是来自英国儿童文学。2.米林宏昌延续了前作《借东西的小人》的可爱风格，同时也是对曾经辉煌一时的吉卜力的诚意致敬。,0
1,26935777,玛丽与魔女之花,Rap bunny bot,warmblanket,还行,2020-02-13,19:47:55,大杂烩,0
1,26935777,玛丽与魔女之花,umi,ChanelFive,推荐,2019-08-13,14:33:09,依旧是吉卜力画风 可惜失了神韵 故事流于俗套 配乐原声没留下印象 片尾歌曲是唯一的亮点,0
1,26935777,玛丽与魔女之花,乍暖,134002125,还行,2018-06-27,14:59:55,5.5/10。吉卜力风格的重现，真的很用力。主角缺少魅力，故事也一般。,0
1,26935777,玛丽与魔女之花,姜鲤。,65407142,还行,2020-11-25,12:01:11,用来消磨时间的话，还是挺有趣的。,0
1,26935777,玛丽与魔女之花,衡Isabella,62117223,较差,2018-07-03,23:00:36,二星半，实在看不出导演有自己的东西。,0
