page_index,movie_id,title,username,user_id,rating,date,time,comment,useful_count
2,2342687,家,哆啦A梦的猫,203862383,,2020-05-23,18:12:02,李小冉气质美女,0
2,2342687,家,spring,138402865,力荐,2016-07-28,17:21:36,陆毅演得真好,0
2,2342687,家,振衣直上最高楼,190079198,推荐,2019-05-06,14:09:17,遇到真正要守护的人和物，要奋力争取，切切不可稍遇阻扰和挫折就放弃，特别是来自身边说关心你的人。因为放弃之后，不管再怎么找借口安慰自己，最主要的原因都是自己怯弱。,0
2,2342687,家,睡午觉,257246919,推荐,2023-02-01,22:37:08,剧中大量近景、特写镜头的运用，对人物内心的描写、挖掘起到很大好处，使人物性格的塑造更加深刻，艺术性和故事性达到了较高的结合。,0
2,2342687,家,他，,178116512,推荐,2018-05-29,16:20:04,经典之作。演员演技都在线 没有一场多余的戏份 长度适中 优秀。,0
2,2342687,家,Larry Chang,141777999,力荐,2016-03-10,10:53:11,好剧,0
2,2342687,家,唯一,133701208,力荐,2018-05-28,17:38:27,不错,0
2,2342687,家,豆友3Vo5ksGvNk,260410332,还行,2023-01-01,12:21:22,他们演的故事都比较感人 他们的精神也可以让我们去学习 和传承 演员们有非常优秀 可以向他们学习,0
2,2342687,家,wjldhcgnt,170357227,还行,2018-01-31,19:45:01,巴金《家》,0
2,2342687,家,驼毛,254665368,,2022-03-29,10:50:17,原来这部戏也是汪俊导演的…,0
2,2342687,家,这还差不多！,177282088,推荐,2018-06-27,09:37:32,我觉得演的还挺好的，看过原著之后看的这个剧，它似乎给了我相似的场景和很不同的人物形象，剧中的解读似乎更好一些，也更悲。,0
2,2342687,家,丽.,wjl2010813,还行,2023-01-25,20:05:21,"受不了那大家庭的压抑
虽然都是熟面孔，可突然间觉得不认识了",0
2,2342687,家,敏感患者,220372615,推荐,2020-08-25,22:21:40,演员阵容非常强大 导演 编剧 剧本 都是精品 剧情不拖沓 ,0
2,2342687,家,豆友KBlzSIoL1Y,264009229,还行,2022-12-10,14:19:29,了解封建社会人们等级的悲哀,0
2,2342687,家,穆青,160306541,推荐,2017-06-08,22:34:50,黄磊年轻的时候真的太适合民国的形象了，这剧挺不错的,0
2,2342687,家,豆友7497045383,257474229,推荐,2022-11-08,23:04:25,看过，挺好看的 演员演技好也很好,0
2,2342687,家,gz4xywm,178145490,还行,2018-07-05,23:55:25,还行呢,0
2,2342687,家,决斗王者,132041705,力荐,2018-03-08,18:21:31,好看,0
2,2342687,家,微信用户,263040759,力荐,2022-10-15,09:35:25,封建社会也可拥有粉红泡泡,0
2,2342687,家,豆友豆友,264171325,还行,2022-11-22,15:13:41,还不错,0
2,2342687,家,巴萨★罄竹难书,202636238,力荐,2019-09-09,20:34:45,一部良心的压抑剧，实在是太压抑了，不想多说！欢迎大家看看，不错的电视剧，演技也爆裂！最后说一句2019年了，现在的拍的他吗什么剧呀！,0
2,2342687,家,玲琅,203675409,推荐,2020-11-25,13:41:03,这种剧， 适合看不进去书的人看哈哈哈哈哈哈哈哈哈哈，拍得挺好的,0
2,2342687,家,繁星,159529629,推荐,2017-04-10,08:33:44,还是挺经典的，值得一看。,0
2,2342687,家,Totoro,211886888,力荐,2020-03-11,22:56:18,家，对每个人来说都是不一样的存在吧。有的人一直都生活在幸福美满的家庭里，父母知书达礼，家境殷实吃穿不愁，这样的人无疑的幸福的，也是幸运的。当然还会有不那么幸运的，家庭没有给予太多，不能给他除了最基本的物质支持之外的任何东西。这样的家会让人又爱又恨吧，可是恨又能恨什么呢，恨他们没有接受好的教育，恨他们没能挣更多的钱提供更好的条件吗，这些能怪他们吗，只能怪自己运气不好吧ヽ( ￣д￣;)ノ,0
2,2342687,家,明翊,219157893,推荐,2020-07-20,12:59:08,改动有点大，有几个人物不够饱满，有几个人物台词比较一般。差强人意吧，看在原著的份上打个四星。,0
2,2342687,家,苏打小小围🙃,173474698,推荐,2019-03-02,18:20:15,黄磊黄奕，演的真的很多啊，和现在判若两人的感觉,0
2,2342687,家,吃吃吃,214539579,推荐,2020-05-29,12:46:35,不错哦,0
2,2342687,家,Teresa,47462784,推荐,2010-12-30,18:36:13,虽然仍有些不尽如人意的地方，但是国产电视剧翻拍经典著作这样也还算差强人意啦~~梅园、落花、湖光、雾气、箫声...，这些细节都处理得悲凉而凄美，一点也不粗糙匆忙~~演员也都很到位，尤其喜欢李小冉的梅表姐~~,2
2,2342687,家,bluesky,1288951,,2012-05-21,13:52:40,没看过原著，画面很精致，人物置景道具无一不美。黄磊太适合了，活脱脱旧社会走出来的文人，隐忍、儒雅,1
2,2342687,家,浅夏风干了伤,160138135,力荐,2017-04-10,16:33:22,一段对往事，对封建制度的追思。,0
2,2342687,家,浪漫之花,154595072,力荐,2017-05-16,14:31:21,无比压抑,0
2,2342687,家,Hanaちゃん,aloysiababy,很差,2010-01-18,11:25:49,黄磊好丑,1
2,2342687,家,不知道。。。,53769560,力荐,2011-11-07,16:19:07,难得的好剧，不忍心再看一遍，那么多美丽的女子就这样逝去。就像梅开头说的，幸福之于她是那么的遥远,1
2,2342687,家,闽中客,56427848,力荐,2017-07-08,08:26:15,高中时语文老师在课上放过这片，大学想起来要看的时候已经找不到片源了😂,0
2,2342687,家,风飒木萧,245721640,力荐,2022-08-17,14:23:50,这个真的把那种大家族的压抑和痛苦拍得好真实……看了难过,0
2,2342687,家,叮咚呢喃,171435784,力荐,2022-08-28,13:10:36,太悲惨了！看完最后一集五味杂陈。黄磊老师表现的很好，演技真好。这部着重描写觉新的感情生活，瑞玨是觉新不幸中的万幸，她带给觉新疲惫生活的温暖和支撑,0
2,2342687,家,豆友216131327,216131327,推荐,2020-06-16,22:43:46,还不错,0
2,2342687,家,Sの饭,summer4525,推荐,2014-07-27,16:52:50,李小冉真特么漂亮！！原来黄磊和陆毅是演这部片子呀 小时候看了全然忘记了 这两天陪我妈又重新看了一遍 我妈说黄磊演技真好 说剧本写的真好 我说不就是一些封建社会的一些爱来爱去的破事么 用得着哭么....,1
2,2342687,家,晓灯宝,57677967,力荐,2015-04-09,14:35:13,这剧拍的真心好啊，我是去看＃王丽坤＃的琴妹的，到后来可心疼梅表姐了，人这样美，命这样苦。。。（ps李小冉演的很好.又ps坤儿的琴妹和郑国霖的觉民是这部杯具里唯一的甜，泪目）,1
2,2342687,家,懂棒棒宇宙,woaisuxiaoyan,推荐,2011-10-17,00:29:27,這劇把封建勢力的醜陋嘴臉勾畫的徹底！真別以為夾槍帶棒虛偽惡毒背後說人壞話就害不死人！三四五姨太絕對良心被狗吃了！但傾巢之下安有完卵，高家倒了她們又能有什麼好處？黃磊演的真好，看的我真是恨鐵不成鋼！他敢不敢哪怕只說個不字？如此好劇沒幾人知道，宮那種天雷狗血劇卻大紅特紅，道理何在啊！,2
2,2342687,家,千与,Annabelle-iLive,还行,2013-05-20,21:20:19,老师让看的是原著结果还是看了美女云集的电视剧··陆毅你顶着一张大叔脸演小少爷我也原谅你了，，居然还逼死了我的鸣凤··TAT#看得感觉自己得了心脏病#,1
2,2342687,家,一根藤上七个瓜,192992625,推荐,2019-03-21,13:46:03,居然还不错~~~,0
2,2342687,家,啊哈你猜我是谁,178273017,力荐,2018-05-17,11:15:58,给满分，质感太棒了,0
2,2342687,家,山野的风,185534252,推荐,2018-10-11,10:15:39,虽然改编得不符合原著，但里面演员集体颜值高，喜欢李小冉的梅表姐,0
2,2342687,家,Huang Xianqian,209964150,推荐,2020-04-23,13:38:47,"2020.04.22（三）～2020.04.23（四）
中无略，看完",0
2,2342687,家,一霜一叶一秋,1540219,,2009-06-01,13:56:23,记得很小时候看过陈晓旭那个版本的家，后来又看了原著，以前喜欢觉慧，现在也许会不同了,0
2,2342687,家,抹茶,155268833,推荐,2020-08-24,20:57:55,还可以,0
2,2342687,家,子安呐,226000090,力荐,2021-03-06,17:38:31,梅，瑞珏，鸣凤三个无辜女子的逝世让人惋惜！封建家庭礼教的残害就是这些悲剧的祸根！最后觉新含泪挥手与觉慧告别时，我一时泪涌，这个可怜可悲又可恨的长房长孙啊！,1
2,2342687,家,p&p,208572407,,2019-12-28,08:14:58,2019.12 mark,0
2,2342687,家,•泡芙限售錄•,228097368,还行,2022-04-25,18:06:44,小时候看过,0
2,2342687,家,尹十三,169870304,推荐,2020-01-02,08:40:45,看了之后，为里面的人物爱情感到很可惜。为他们之后的反抗精神觉悟感到很开心,0
2,2342687,家,空空宝,52699183,力荐,2014-06-06,23:38:47,亲戚就是用来比较，计较，扭曲的。家庭就是用来约束，感化，回报的。没有一个时代是真正意义的自由。即使有超前意识，身体也不是自由。因为有社会亲戚家庭的相克。自由只能是相对。,0
2,2342687,家,热带岛屿,102476598,力荐,2020-10-21,08:21:03,大哥懦弱但也有自己的无奈，一个家庭若全是反抗者的话那就散了，如果没有大哥的忍辱负重三弟也没办法过的那么轻松了，不过活出自己的人生还是比较快乐的啊～,0
2,2342687,家,且把年华赠天下,175914340,推荐,2018-07-26,16:06:45,那个社会太过愚昧，人就显得如此渺小。,0
2,2342687,家,Amyi,160710079,力荐,2018-11-03,12:41:37,不错，特别是薛佳凝的演绎。还有不知为啥，看到黄磊想笑。,0
2,2342687,家,阳光明媚,160425637,,2020-12-25,19:10:41,看过。,0
2,2342687,家,子必,148818760,推荐,2019-07-04,11:14:25,看完我才去把巴金的家春秋看了一遍 真的挺反应当时社会现状的 很感慨吧 挺残忍也很现实,0
2,2342687,家,慢慢漫漫,264022595,推荐,2022-11-07,23:48:03,乐观是希望的明灯，它指引着你从危险峡谷中步向坦途,0
2,2342687,家,学刘,73171073,推荐,2019-11-07,23:38:42,喜欢,0
2,2342687,家,蜡笔小新i,180130786,推荐,2018-07-27,13:43:34,最可惜是觉民，可以深刻挖掘的角色却几乎没有什么戏分。悲情过多渲染，情节有点拖,0
2,2342687,家,大桃子,179701218,推荐,2018-07-27,00:24:33,　高家是一个封建的大家族，在奉行旧礼教的高老太爷主导下，身为长房长孙的觉新被迫放弃和表妹梅芬,0
2,2342687,家,self,57969667,,2012-11-03,13:16:27,家,0
2,2342687,家,柴子,151774134,力荐,2021-02-16,03:48:26,深刻！20集的剧真是良心啊,0
2,2342687,家,揣着怀表的兔子,144925734,力荐,2021-09-05,21:41:21,气的像条疯狗，哭的像个傻逼,0
2,2342687,家,小葱拌豆腐,zzyyffdd,还行,2014-08-22,17:51:36,还行吧，没有拍成40集真是谢天谢地。李小冉在剧里的扮相不算很美，难道为了表现梅表姐的悲剧性所以用了那么老气横秋的服装和发型么= =,0
2,2342687,家,聊,184930057,,2018-11-24,21:55:00,闭路高清电视剧,0
2,2342687,家,justdea,201829643,推荐,2019-08-21,23:41:24,现在看依然会让我哭的很惨,0
2,2342687,家,coconut,52734404,力荐,2012-07-11,20:18:14,很棒，虽然和剧情和原著有出入，但是拍出了原著的精髓。,0
2,2342687,家,清檬,181338436,推荐,2018-07-21,16:12:03,有点偏离原著，但全剧集结了众多演技派演员，有我喜欢的李小冉，黄磊，所以还不错。,0
2,2342687,家,December,173769780,推荐,2019-09-06,14:57:08,现当代,0
2,2342687,家,OneTwoThree,207138949,较差,2020-10-17,19:45:53,豆瓣高分剧分组受害者，被迫和家人一起看完，选角演员比较合适，某些台词仿佛村妇吵架,0
2,2342687,家,小猪真2,51881280,力荐,2014-08-03,15:28:35,我个人是非常喜欢的，我中学的时候看得，现在依然印象深刻。鸣凤死的时候我刚看完书，带着书里面的情感跟着鸣凤一起哭，看完电视还在哭，父母在家，躲到被窝里接着哭，那天心情糟透了。,0
2,2342687,家,蓝之若星,52583077,,2011-12-07,10:05:03,好像看的不是这版 ？,0
2,2342687,家,小树,73313347,,2018-04-06,14:48:17,"不想看【Blue】【家】【黄磊】【16G 21集】【4DVD5/ISO】【国语软繁字】【台版】
5000B",0
2,2342687,家,芝士西瓜,198993737,推荐,2020-02-16,13:01:35,原来这个也是汪俊导演的，电视剧选角其实不错诶。黄老师很适合觉新！,0
2,2342687,家,忘了你的眼睛,147592945,力荐,2019-08-24,15:45:23,梅和珏都是那个时代的悲剧 李小冉和黄奕真的都好美 看的时候高二 看完难受好久,0
2,2342687,家,喵,160778529,推荐,2019-06-28,20:09:57,浓浓民国气息的电视剧，当时好喜欢陆毅和薛佳凝这一对,0
2,2342687,家,游历之魂,49878513,推荐,2021-05-17,11:27:55,真是文艺得不得了，黄磊、陆毅、李小冉，也是满满的回忆。,0
2,2342687,家,心生四季,238781059,推荐,2021-06-03,23:08:17,封建家庭牺牲品,0
2,2342687,家,豆友ArXqz78cs4,246865104,推荐,2021-10-02,19:14:32,那个时代的大家庭就是那么压抑,0
2,2342687,家,NO ONE BUT YOU,bravemma,推荐,2018-05-14,02:45:45,珏的善良是美的，梅的留恋是美的，觉慧的上进是美的，觉新的隐忍也是美的。,0
2,2342687,家,W,178115737,推荐,2018-05-06,20:16:16,演员阵容非常强大 经典中的经典！！强推…故事是封建时代的那种 悲剧吧。,0
2,2342687,家,青山,66084601,力荐,2012-11-09,16:26:57,青春毕竟是美丽的东西,0
2,2342687,家,野鹤闲云,2461589,力荐,2009-10-28,22:19:37,这部戏让我重新认识了黄奕，演的很好；黄磊简直就是觉新，完美,0
2,2342687,家,Wintermärchen,ritaqu1118,推荐,2012-11-12,09:43:11,很奇怪这么一部大牌明星云集的经典为什么很多人都没有看过。。。那个时候就开始喜欢王丽坤，喜欢琴这个角色。,0
2,2342687,家,zoeey_27,215326908,力荐,2020-04-26,17:21:35,很久以前该剧的制片公司朋友送的DVD，当时就看的眼泪汪汪。后来B站也有了，重新看了一遍，看到鸣凤死了珏死了又哭的不行。这样的名著只需要中规中矩的拍下来就能够震撼人心了。,0
2,2342687,家,九凝,178640346,推荐,2018-06-03,22:49:08,难得的好剧,0
2,2342687,家,豆浆粉,178138751,推荐,2018-05-02,12:30:58,家春秋的书都看了，这个电视拍的真的很压抑，难受,0
2,2342687,家,Monica大萌子,68883959,推荐,2015-07-24,08:25:40,还是不错的 话剧版更好看,0
2,2342687,家,小楼可暖居,263752209,推荐,2022-11-28,18:26:40,好看好看好看,0
