page_index,movie_id,title,username,user_id,rating,date,time,comment,useful_count
0,2342687,家,苗犬,fancheyu,推荐,2010-06-04,19:57:19,"受不了那大家庭的压抑
虽然都是熟面孔，可突然间觉得不认识了
黄磊演的真好",18
0,2342687,家,不爱™,myhyukie,力荐,2009-05-12,10:33:12,縯員陣容絕了 沒有一場戲是多餘的 經典至極,59
0,2342687,家,刘云行,160184060,推荐,2017-04-30,19:31:06,黄磊年轻时候很适合民国风电视台，形象好，演技棒。黄奕造型蛮好看，表现出彩。,14
0,2342687,家,秋天的黛西,MademoiselleXie,推荐,2014-03-06,21:45:26,Cry me a river。,12
0,2342687,家,紫雨轻丝,wdnrainbow,力荐,2008-04-03,05:20:41,配乐很好。黄磊的表演很到位。黄奕的表演很惊喜。,38
0,2342687,家,四壁雪,51389476,推荐,2013-05-30,22:16:04,虽然当时哭得七荤八素，但还是小说更经典~鸣凤长得太现代了，陆毅演技赞一个~,10
0,2342687,家,熊猫猫猫熊,ailuwan,推荐,2011-01-15,13:50:09,纯粹为了黄磊去看的，李小冉的梅表姐和她以前演的那些苦情圣母没有什么区别，腻死了。薛佳凝的鸣凤好娇小好柔弱，二弟三弟等也八错啦。还有黄奕，觉得她怪怪的。加了一些淋雨，跪雪，狂奔的戏，哈哈,5
0,2342687,家,幸福的泡泡@,37670547,推荐,2010-10-24,22:08:02,悲~~~,0
0,2342687,家,草木有嘉名,takedake,还行,2008-12-17,08:49:41,小冉的梅表姐真美,26
0,2342687,家,小若同志,79109261,力荐,2017-04-27,20:58:52,"这曾是我高中看了一半而弃了的书，不为啥，就因为觉慧太理想主义看的我不舒服。对于电视剧，觉慧还是一样不现实看的我想打他。
黄老师贡献的演技让我感动不已，几乎每集都有哭戏而且集集都能让你感受到他的痛苦与无奈。
又入了黄老师的坑了。",11
0,2342687,家,烈焰红唇龙,lovehans,力荐,2019-08-11,00:37:14,与原著中大致上保持一致，还是改了很多细节以及一些人设的地方。例如瑞珏提出离开成全梅和觉新是当着梅说的，而不是大太太。这样人物的性格就更加立体和丰满。其他改动也大都有张冠李戴之举，不过无碍。梅和觉新在书中着墨不多，可依然看得人爱恨缠绵。演员选角问题不大，都正当其时，较好地还原了书中的大事件，也合理的给出了自己的价值观。李小冉的那种温婉动人的气质，为戏剧增色不少，哈妹的鸣凤怎么看怎么像四凤，黄大厨的懦弱形象看得人气不打一处来。本身原著其实写得不算特别好，然而时至今日，依然有类似的悲剧上演，让身处大家庭的我，每每看到梅病故之后，都几欲泪下，难以自己。,1
0,2342687,家,(๑⁼̴̀д⁼̴́๑),145577008,推荐,2018-07-25,22:54:07,……几种截然不同的情感总是左右拉拽着她，使她犹豫不定,2
0,2342687,家,当叔叔的年龄,60764117,力荐,2015-04-15,00:18:23,封建氛围浓厚，薛佳凝黄奕给人惊喜。,2
0,2342687,家,婉刷刷,72233881,推荐,2014-06-07,18:15:22,初二看的巴金先生的原著，结果当年就出了电视剧不过那时候没时间看，最近重看了书就把电视剧找了来看，感觉还不错，黄磊陆毅不是要参加了爸爸去哪儿2么哈哈哈,0
0,2342687,家,Wan,wanziphoto,力荐,2009-10-17,21:09:31,"不禁为那个年代相爱的人而悲苦,煽然泪下",1
0,2342687,家,轩芪,guyuxu,推荐,2010-10-20,15:15:39,长短适中，演员不错,3
0,2342687,家,花果山望妻石🎩,babaria,推荐,2015-02-21,04:50:00,虽然原著是很小的时候看的有些记不清，但感觉剧本出入挺大的，黄磊的觉新演得最好最像，其他的老爷太太少爷小姐们也都演出了特色，难得的国产佳剧。大表哥和梅表姐的感情戏太多了，尤其到后面婆婆妈妈搞得太长了,4
0,2342687,家,Shamrocker,3601961,力荐,2009-12-22,00:10:59,演员们很用心，质量很高的一部作品了,2
0,2342687,家,末三,Feola,推荐,2009-05-09,19:38:21,反封建礼教的原作变成了悲情戏，现代化的不错，但剧作仍显拖沓,0
0,2342687,家,五月微蓝,xzf1982,推荐,2008-01-10,11:57:47,那个社会太过愚昧，人就显得如此渺小。,3
0,2342687,家,苏晓晓,143290078,推荐,2018-07-26,07:02:37,强大的演员阵容,1
0,2342687,家,小红帽,jiajiaaixuexi,力荐,2015-04-19,07:13:48,鸣凤哭惨我了,1
0,2342687,家,#木鼓鼓🌈#,BigLuLu,推荐,2013-02-07,14:11:39,觉新可看。,0
0,2342687,家,柯不悔KOKIKA,1828898,较差,2010-02-18,18:45:59,没劲,1
0,2342687,家,纳穆卓可,stefanie1112,推荐,2009-12-20,18:13:19,还算值得看。黄磊很赞，李小冉虽然漂亮，但是演技不感恭维。看见黄奕总觉得她还是还珠里的疯婆子·,2
0,2342687,家,半城风月,92463984,还行,2018-07-26,00:25:23,最喜欢鸣凤，她是个好姑娘。,8
0,2342687,家,ᥫ᭡້໌,Kylin-2015,还行,2017-03-24,12:24:59,还不错,3
0,2342687,家,OLEO,171701755,推荐,2019-08-24,22:38:13,好久没播过家族年代戏了,0
0,2342687,家,112bc,67395160,推荐,2012-12-21,11:07:26,总体而言，这部剧拍的还是不错的。黄奕、黄磊、李小冉所饰演的角色还是比较到位的。值得一看。,2
0,2342687,家,tangmm,tangmm,推荐,2015-02-20,14:04:16,我了个乖乖！三兄弟当年颜值不要太高啊！！！可惜配音不太好。,0
0,2342687,家,一滴沥青,strawberryBER,推荐,2016-04-16,20:37:50,时代、家国与个人命运的关联，想说挣脱不容易。,1
0,2342687,家,Rosina,56505302,推荐,2023-01-15,21:15:26,跟书即有一样的，也有改编的，戏剧冲突更大，也更有看点了。结合着书看，美中不足，选角上，感觉觉慧和觉民都有点老，没有少年的样子。其他大家族的人选角都很贴切。,0
0,2342687,家,人淡如菊。无奈,vitamisa,,2008-02-26,13:58:41,还不错拉,0
0,2342687,家,不高興,53406458,还行,2019-12-26,11:32:00,黄奕真是太好看了,4
0,2342687,家,yoyo,yingjingqiong,推荐,2011-10-27,10:11:28,黄老师饰演的老大。唯唯诺诺的。入木三分啊。,1
0,2342687,家,颜良辰,ushi,力荐,2008-05-22,17:25:37,哭得是死去活来。,0
0,2342687,家,烟视媚行,2092765,推荐,2020-07-28,16:49:14,真的太苦太悲了，真的无法具体说出来这戏里谁更苦，每一个都是一汪苦水。,0
0,2342687,家,littlewine,4592364,推荐,2014-08-31,23:13:29,整得像觉新的传记。觉民和琴刻画得太单薄了些。梅渲染得太腻，文字给我的并不是这种感觉，鸣凤的形象与我最初印象中的不附，印象中她是个隐忍而刚烈的女子，是我最初看原著最喜欢的人物。多一星是给黄磊的。人都是被苦果给胀死的…,3
0,2342687,家,Joelle,joestelle,,2009-02-10,00:08:41,看着里面的王奕，我就想到李小冉，果然后来李小冉就出来了。那一幕两个人定定地互看，我也定定地看着屏幕。说实话，李小冉给人的感觉太类似了，就这样。一说话，就更空了。,3
0,2342687,家,我是菜花,lanmaotu,力荐,2009-05-27,15:12:06,敬爱的巴金爷爷~,0
0,2342687,家,叶籽猫,59408815,推荐,2019-12-16,22:58:49,从某种意义上来说，巴金有点像低配版的曹雪芹。同样是一个鼎盛的家族，有钱有势有地位，人口众多关系复杂，身不由己。不同的是身处不同的时代背景之下，呈现的人物思想是截然不同的，曹雪芹讲出世入世，巴金讲旧封建新思想。旧时代的人是很苦的，女性只有更苦。爷爷的父权至高无上，像一座封建主义的大山，把每个人的人生都压平碾碎握在自己手中，没有人可以对他说不，尤其是旧时代的女性，除了告诉自己“这是我的命”，还能拿什么抗争呢？！汪俊真是一个神奇的导演，早年竟然拍过这么多好作品，而且选的还都是现在演技圈儿有演技的演员。黄磊演得真好，窝窝囊囊又身不由己的样子让人哀其不幸怒其不争，黄奕当年真好看~电视剧也良心，21集就把故事讲完了，清清楚楚明明白白的。,2
0,2342687,家,汐葉ღ,TheAir,推荐,2019-04-07,23:31:31,万恶的旧社会。天啊，爱上觉慧。整部剧每个人的演技都在线！跟现在电视剧比，精湛到惊人！封建制度与礼教吃人，映衬着当下时代，仍然是鲜明的。“独立的个体”与“家”的对抗。明轩尽管懦弱，但被“家”所禁锢的灵魂被压迫着。之前感觉只有老太爷不在了，便会获得自由，却不是的，封建礼教的余孽却是怎样也铲除不去的，所做的恶仍是源源不断的。,0
0,2342687,家,time刚刚好,127834554,力荐,2020-10-22,17:30:06,看到黄奕演瑞珏，一开始感觉她肯定演不好。印象中她还是那个活泼的小燕子，没想到演的真好，一点没有过去角色的影子，感慨这才是真正的好演员。,3
0,2342687,家,方舒逸,34949120,还行,2017-03-02,18:30:12,看了两三集，电视剧把原著里的长辈一代人刻画地流于表面，平面单薄，最起码钱太太不会这样害自己的女儿，周氏也不是这样不顾儿女死活的人。《家》的内涵在于探究封建残酷与人性懦弱的根源，每一个父辈都不是完全的傻子，他们自私自利，善于玩弄立场；高家的妇女也有很忠厚的一面，她们也都是受害者,4
0,2342687,家,宅拾叁,gongzitian,,2020-02-22,19:58:11,疫情期间响应号召在家陪我妈系列。太惨了，满嘴仁义道德，一肚子男盗女娼。,0
0,2342687,家,蜉蝣渡海,56392220,推荐,2015-07-02,17:19:49,演员找的很对味，剧就成了一半，民国味。,0
0,2342687,家,Journey。,bewarm,较差,2010-04-13,20:22:36,唉  ……,0
0,2342687,家,白手套警长猫咪,193940700,力荐,2021-12-19,23:39:24,200年没看过能让我痛哭流涕的电视剧了，巴金笔下的女性角色是真善美的化身,1
0,2342687,家,䟇鑄㩭,yizhuxiaoxiaoyu,还行,2021-12-11,11:32:15,转接挺突兀的。陆毅还是愿意接一类角色，不愿突破自己，可惜演员自身的条件了。郑国霖蛮帅的，可惜一直没什么资源。,0
0,2342687,家,洁酱,4132580,还行,2013-07-25,12:09:36,原著是经典，电视剧基调不错。,0
0,2342687,家,domoto nana,80856544,力荐,2016-02-28,16:25:19,良心五星，2007年时电视已经是越来越娱乐化，拍成这样已经很不错，选角也好，只是陆毅更应该演觉民。场景太精致，不像是当时还很闭塞的蜀中天府，更像是发生在江南大户人家的感觉。,0
0,2342687,家,Angie,24639587,推荐,2019-01-24,18:16:36,基本忠于原著，最大改编就是觉新的性格上没有小说里那么懦弱，一开始也反抗过，大概这样更符合他原本也是进过学堂，有过出国梦的青年，只是在现实生活中一点点的妥协，最后连自己爱的女人都保护不了,0
0,2342687,家,陶可宸,67586472,推荐,2017-06-28,23:45:24,关于这个故事，鸣凤始终是我最喜欢、也最具震撼力的一个角色，她的身上有些数千年来一般无二的奴性，所以她从头至尾都爱的那么卑微，她心仪那个男子，但她始终是不敢越过主仆的界限，她始终柔柔的唤他三少爷，唯一的一声觉慧，却是在他听不到的远处，在她生命终结前唯一的一次大胆放肆。,1
0,2342687,家,长烟皓月,yutaindweiba,推荐,2012-03-05,14:36:15,名著改编，是最偶像的名著电视剧,0
0,2342687,家,同路客，,qxq,,2010-06-30,19:07:32,没看完,0
0,2342687,家,钟婉匀,64629682,推荐,2017-08-11,13:42:28,当时那些人的演技，个个都是在线的。,2
0,2342687,家,默默_笨貨,michelle918,推荐,2011-05-09,09:40:59,先看的书，再看的电视剧。挺好的，些个演员都还不错。,1
0,2342687,家,虫虫虫虫虫虫虫,96202932,推荐,2018-07-26,21:41:23,对原著改了比较多。黄奕和黄磊表现相当不错。陆毅演大愤青觉慧显老了，特别是对比觉民。最可惜是觉民，可以深刻挖掘的角色却几乎没有什么戏分。悲情过多渲染，情节有点拖沓,2
0,2342687,家,尘光,hidetree,,2019-07-19,19:06:24,也不算看过 看过几个镜头……简直是琼瑶剧啊……,0
0,2342687,家,雨馨儿,lty900221,力荐,2011-10-15,12:00:46,这么好的剧居然没上星怨念啊,0
0,2342687,家,娜娜柯里昂,nozomi_CAT,力荐,2022-09-28,22:40:24,小时候可爱看了，找个机会再刷一遍,0
0,2342687,家,鱼尾喂喂喂,162757060,力荐,2023-01-29,13:11:24,"看完几天了，竟然忘记标记了……
说写观后感也一直没有开始，越来越懒了",0
0,2342687,家,夜飲東坡醒復醉,167130505,推荐,2022-02-24,17:01:03,远古电视剧的感觉，剧情很扎实，汪俊你有本事再照这套阵容凑齐再拍一部电视剧你就是剧王！王丽坤，李小冉，薛佳凝，黄奕，啧啧啧，这阵容,0
0,2342687,家,rainywalnut,rainynut,推荐,2022-01-13,19:11:56,满嘴的仁义道德，满脑子男盗女娼,0
0,2342687,家,哐哐,13099470,,2009-12-26,18:26:51,八错！！,0
0,2342687,家,qianyu,qianyu,推荐,2008-02-03,16:59:21,一边吃饭一边看电视剧的习惯,0
0,2342687,家,afterlife,152974156,力荐,2018-11-04,08:46:52,里面的演员阵容十分强大了,1
0,2342687,家,江雨霏,51106372,力荐,2013-01-27,18:12:03,冲这些演员也得给五星啊，巴金的剧本金不换啊，俊男美女真好看啊，故事是批判封建礼教啊！,0
0,2342687,家,隋风,152928633,推荐,2018-08-08,14:16:56,原著真的是杰出的存在，使这部剧拥有很高的档次。那时的影视环境，才让我们知道什么称得是好的影视作品。,0
0,2342687,家,凌雨枫pro,145941391,还行,2016-08-25,18:11:26,因为看不下去书，无意中发现了这部同名电视剧…竟然都是大咖…冲着李小冉看的，黄奕也不错哈哈,1
0,2342687,家,芹泽的烂伞,55738944,还行,2014-05-17,20:47:18,最后一集戳泪，瑞珏好惨。黄磊演得不错。,1
0,2342687,家,火辣辣,159116110,力荐,2017-07-15,22:09:32,好感动又经典的一部,0
0,2342687,家,mollymolly,66025844,还行,2018-04-02,03:59:13,编剧把原著拉低几个段位,1
0,2342687,家,easonwang23,57143181,力荐,2021-01-13,23:30:07,总体是精品的，黄磊的演技是一大亮点，把觉新的不抵抗和痛苦演绎得鞭辟入里。剧情上有一定程度的改变，主要是梅和觉新的情感戏吃重了，几乎贯穿全剧，略显拖沓。觉慧作为小说里的第一主角，在这里弱化了，有点可惜。几场重头戏没有太拍出来，比如过年划船，烟花，老太爷死后的事。时不时高度还原原著的台词和情景又让人惊喜，再加上配角们真心演技不错，值得一看。,1
0,2342687,家,雪落香杉树,173104226,力荐,2019-07-03,22:29:21,多了很多书里没有的情节，增添的非常。,0
0,2342687,家,阿白,bqdqbqdq,力荐,2015-06-27,05:07:12,想起在武大宿舍里读这本书的时候默默地流泪，现在再看这个故事还是一样默默地流泪。出国这么多年我还是像之前一样被家的概念困着。觉新的困境在于他太在意别人是怎么看自己的，这点我也一样。然而觉民会被两个弟弟爱戴，被两个爱人爱慕也正是因为他是一个会照顾别人的感受的人。在意别人的看法与在意别,1
0,2342687,家,月亮偷偷在改变,154243632,推荐,2021-09-21,07:34:47,不是魔改，还好，爷青回2333,0
0,2342687,家,kikizhu,kikizhu,还行,2008-01-27,13:23:56,有我喜欢的演员 演我喜欢的原著 可是却把故事原本的精髓破坏了个彻底 没有斗争没有反抗没有革命难道一切都只是为了爱情？？？,0
0,2342687,家,貓之,3763981,还行,2021-02-17,01:12:36,除了黄磊李小冉和薛佳凝，其他人都塑造得太脸谱化了。陆毅真好看，30岁演这个角色还是很有少年感，李小冉好抗老，现在还是这个样子。,0
0,2342687,家,Rose Prufrock,84527951,还行,2020-05-13,12:45:59,红楼梦真是任意抽取一段都能再写成一本小说，贾宝玉变成渣男就是金燕西，变成传统孝子就是高觉新，变成进步青年就是高觉慧（但是陆毅演得太差，让我第一次如此讨厌一张这么帅的脸；相比之下，黄磊连揣着手踱步的样子都像极了角色）。最喜欢的是鸣凤，她才是让”多情公子空牵念”。另外看到大表哥抱着大表姐的尸体痛哭，想到了呼啸山庄，大概古今中外对于爱情悲剧的想象都是相似的。只是西方悲剧人物都是作天作地害人害己，中式悲剧则是能忍则忍，忍着忍着就开始咳嗽，咳着咳着就归西了。,1
0,2342687,家,皂君庙小弟,1851027,,2012-10-15,16:41:44,2012.1015,0
0,2342687,家,咕咕,fox618,推荐,2020-10-20,20:55:47,跑步机上看完。拖沓可以用倍速弥补。看多了对原著熟悉了还是很经典非常有时代特点的。,0
0,2342687,家,格格好萌,134542917,推荐,2016-04-01,07:31:26,看的时候哭的死去活来的  感人啊,1
0,2342687,家,_八卦鹊子,meworld,推荐,2021-01-31,22:37:25,天呐。看这个剧真的得抑郁死,0
0,2342687,家,阴影演出者,soporkk,还行,2009-03-15,18:57:21,还是看书比较爽   只是一直很喜欢黄磊,1
0,2342687,家,泽漆,paradisekid,力荐,2008-04-19,16:14:46,黄磊爸爸和陆毅爸爸的合作一部片子，当年他们的表演真的打动我了,0
0,2342687,家,穆子衿,155602014,还行,2017-05-05,10:17:08,演员阵容算是不错了，演技也还可以，剧情也挺OK的，单数总觉得少了一点什么。,1
0,2342687,家,雨夜,156065957,推荐,2020-09-28,21:57:01,挺不错的片子，现在这样的片子好少了,0
0,2342687,家,○Ⅴ○,Viccore,推荐,2010-03-08,17:11:52,深情即是一桩悲剧,0
0,2342687,家,_daffodil,1626356,力荐,2012-01-27,11:52:05,喜欢，很有感染力的表演，买碟收藏了,0
0,2342687,家,解压,astridchan,推荐,2019-06-10,19:27:32,诶突然想起来小时候跟爹妈一起在江苏卫视追过……当时觉得里面人长得都还不错啊。不管原著还是电视果然我都喜欢觉民,2
0,2342687,家,U,3680251,还行,2021-11-17,22:09:41,"大哥误解大少奶奶，伤大少奶奶的心；三弟误解大哥，伤大哥的心。都是报应啊，女人果然在最底层(￣▽￣"") 李小冉太适合苦情戏了！高家是真有钱啊，败了21集还供得起大学生。",0
0,2342687,家,曼靑,3335015,较差,2013-07-02,09:46:18,記得之前看過一句話 如果伱最近覺得煩躁不安的話 那麼要不就是伱很久沒運動 要麼就是伱很久沒看書了。現在的生活很積極 每天堅持運動 回家洗完澡看一集這部電視劇就接着看書。但是 真的是好平庸的一部電視劇。巴金的家世和曹雪芹很像 這部也有很明顯模仿紅樓夢的痕跡。拖沓得要死 思想衝突根本沒爆發。,1
0,2342687,家,mdhu,zishi22ww88,推荐,2019-06-27,20:10:23,黄奕不错。,0
0,2342687,家,愿今朝,zcwzcw789126,推荐,2016-07-25,14:45:20,陆毅依然很陆毅，不管演什么都一身凛然正气的陆毅,0
0,2342687,家,花生酱,peanutsheng,推荐,2011-06-24,18:12:58,那时候看了这个去选了老瞿的选修课…当时好像很喜欢陆毅-.-,0
0,2342687,家,清泓,qh7777777,还行,2021-10-28,19:40:43,本来该给四分，拍得很精良。但…一时代之观点带时代之局限性界限性阶段性或难避免。可怜的瑞珏、可怜的鸣凤。,0
0,2342687,家,江湖骗子领导层,158027634,推荐,2018-07-26,11:10:46,剧情先不说，光这些演员就能撑起一片天。,3
0,2342687,家,momo,58076791,推荐,2020-05-18,16:10:34,跟小说很贴近 整体都非常好 除了陆毅太出戏了,0
0,2342687,家,水中茱萸,1842148,推荐,2015-01-11,17:32:37,不超过四十集的电视剧是业界良心，不超过三十集的电视剧是良心中的良心，二十出头的电视剧是多快好省的好东西……,1
0,2342687,家,低头路过,Insects,推荐,2016-01-08,00:36:22,感慨万千，没继续拍春和秋实在太遗憾了。黄奕惊喜。,0
0,2342687,家,江仙*响姐,2158612,还行,2008-08-21,18:24:03,给三星完全是看在黄磊的面子上,2
0,2342687,家,江江,wajwq781202,推荐,2021-02-27,21:10:23,不错，把原著改过的部分反而更合适，梅和瑞珏成了主角，也棋逢对手样的通情达理。觉新比二弟弟戏份多，也没那么懦弱遗少。,0
0,2342687,家,尔惟盐梅,96853710,推荐,2020-12-07,20:27:23,郑国霖适合。黄磊只演出懦弱而无谦和文雅。陆毅太稳重端着，完全不是觉慧那样的天真可爱的弟弟。,0
0,2342687,家,老子就是老子,yuhuihui,,2010-04-23,16:51:56,我痛恨的不是父母，而是父母他们所反应的精神体系。,0
0,2342687,家,啊O,sunwukong.326,还行,2022-06-26,20:50:38,那会儿就是守在电视机前踏踏实实看剧 现在成了回忆。,0
0,2342687,家,霏宸,140376084,推荐,2016-12-31,16:57:02,这个电视剧很早之前看的，还是演的不错的！很还原巴金先生的原著，每个人都有自己本身的形象特色，不错！,0
0,2342687,家,Sofia  鬱鬱,37276813,力荐,2012-07-13,14:04:54,"补记
",0
0,2342687,家,Zeu | 紫发阿朱,zhz1208,,2015-02-24,20:33:55,一声叹息,0
0,2342687,家,一路有你,159192051,还行,2017-06-08,16:05:55,值得看的，浪漫中演绎悲情故事。封建大家庭制度害了多少人。,2
0,2342687,家,星空下的哲思,dandelion13,还行,2012-05-03,20:22:36,面目全非的改编。。。,0
0,2342687,家,凉风有心,134534855,还行,2015-11-13,15:42:33,比较合格的翻拍剧。但更喜欢原版的角色。,0
0,2342687,家,chunchun5169,61127618,还行,2018-06-24,14:14:58,作为原著党觉得改编在作品内涵表达略显不足  琴和觉新这一对主要新民主青年刻画得太过单薄  鸣凤和觉慧形象与角色气质不符  陆毅没有热血的少年感  李小冉是我想象中妹表姐样子 但是梅和觉新感情戏刻画太多显得婆妈,1
0,2342687,家,燕辞归,157566194,,2018-10-24,18:20:25,鸣凤投湖前的自言自语，巴金做了好几次改编，定稿是“三少爷，觉慧”，短短五个字，便显示了鸣凤心理的变化，“三少爷”三字，仍是封建主仆关系思想的表现，“觉慧”便是自由平等爱情的体现。,3
0,2342687,家,顾俏乜,66428405,还行,2017-07-27,23:28:35,看着故事的结尾，觉慧兄弟之间的别离之情，深受感动。,1
0,2342687,家,Nemooo,deartintin,还行,2014-09-22,22:04:06,矿工和他的妻子，毫无违和感(°_°),0
0,2342687,家,羊闯闯,137068866,还行,2017-04-07,16:36:07,重补了一下小学时期看过的小说，现在仍珍藏着，倒是许久没有翻过了，经典改得挺好的，当时就觉得大少爷的悲剧是值得深挖的。现在去看这部剧觉得打光实在是差，但也更近真实的感觉，说实话打光差是检验人靓不靓的唯一真理，所以年轻的陆毅是真帅啊，黄奕也是美的，其它人总觉气色上相比这两人差了些。,0
0,2342687,家,恨情歌,raohui5,还行,2009-08-21,01:13:35,其实不大喜欢这片子,0
0,2342687,家,·,x4242,,2021-11-25,04:01:50,跟妈妈一起看的 还记得,0
0,2342687,家,momo,182021683,较差,2019-09-18,23:19:54,没有年代感,0
1,2342687,家,tk,2514274,推荐,2017-09-30,00:01:48,看了《家》，觉得《雷雨》小打小闹。可怜鸣凤，连死都想到了，怎么没想到逃？最后老三逃了，他竟然是这个家里第一个想到逃的。,0
1,2342687,家,杀神,147754395,还行,2022-04-08,09:20:07,只有两集,0
1,2342687,家,土豆丝炒肉,136238103,力荐,2016-06-13,12:37:22,经典，整体都很好,0
1,2342687,家,左手画右手,126543651,力荐,2017-11-05,03:42:39,"你我皆凡人。
社会，环境，制度对人潜移默化的影响是巨大的，如果不满意，需要主动求知与自我救赎。
每个人都不一样，也都一样。
如果想真正不一样，请走在时代前面。",0
1,2342687,家,sshkk,NMYKYSTD,力荐,2021-08-07,00:42:23,原著超级好看 剧虽然有改编 但是整体的氛围 基调是没变的 看剧哭了好多次 挺无奈的,0
1,2342687,家,口十,1898824,,2008-10-08,15:11:23,相爱却不能相守,0
1,2342687,家,逃离地球,205966009,推荐,2020-11-27,10:15:05,每一个人的死都是对封建礼教的无声控诉，经典,0
1,2342687,家,夏2333,174825302,力荐,2018-06-02,10:09:58,都是喜欢的演员 对角色的完成度也很高 ,0
1,2342687,家,momoo007,76580587,还行,2022-08-01,13:18:13,"看了原著来的，有小说在那里剧不会太难看，可是有些部分改编还是略逊。尤其是大少奶奶知道明轩和梅芬的过往硬是要把老公让给梅芬，这里就太圣母了吧！大少奶奶本来是非常贤妻良母的传统女性，原著中她非常关心梅芬对她很好，剧中改编就太过了。
用的来说这还是一部很良心的剧，全员演技都不错，可惜弱化了二少爷和琴表妹的线。3.5星
",0
1,2342687,家,橘子,xiangnv,推荐,2014-06-17,22:39:45,我得了一种一天看21集电视剧的病。下次应该看看巴金原著。,1
1,2342687,家,酥皮,155555854,力荐,2019-03-29,16:43:58,没有当年觉慧他们的反抗就没有今天的我们啊 女性的悲剧一以贯之在上演啊,0
1,2342687,家,曲家大妞,212475559,推荐,2022-12-07,19:11:41,只能说万恶的旧社会,0
1,2342687,家,优优肥,143116413,力荐,2021-04-21,12:14:23,鸣凤死的时候，真的很怒,0
1,2342687,家,光而不耀,203658212,推荐,2020-07-17,16:05:18,很好看，演员也选的好,0
1,2342687,家,小辰辰,ZillahTiptoe,推荐,2015-06-03,14:31:52,还好那个时代过去了,0
1,2342687,家,多肉葡萄,126497418,力荐,2021-11-28,22:46:49,原著就超爱了，这版电视剧的展现我个人觉得非常满意。,0
