page_index,movie_id,title,username,user_id,rating,date,time,comment,useful_count
1,2342687,家,mandycandy,173241311,推荐,2018-12-25,12:05:23,当年的电视剧全是演技派啊，就是不喜欢配音。不知为何不喜欢老三,0
1,2342687,家,花非花雾非雾,152319171,还行,2017-05-18,19:39:23,原著很精典,0
1,2342687,家,请叫我飞爷,102127624,还行,2019-11-26,09:03:13,两星给黄磊一星给巴金。另外得寄刀片给编剧。好人都死了……,0
1,2342687,家,芝士三连,flynms123_,还行,2018-02-20,12:30:49,"没有看过原著，只是觉得这部剧的服装、布景、道具、场景、构图非常精致讲究,而且颜值很高啊，挺良心的～",0
1,2342687,家,严肃的小T,83529025,推荐,2020-03-28,13:29:44,当初看原著的时候虐的不行，电视剧改编还原度挺高，同样挺虐的，导演很用心了,0
1,2342687,家,铁扇子,145573977,还行,2022-04-21,15:54:38,……把个反封建名作演成肥皂宅斗言情剧是想把巴金老爷子气活过来。这算什么？逆练《家春秋》？,0
1,2342687,家,月夜,53479008,还行,2014-07-31,23:19:25,煽情了点，觉新和梅的情感戏印象深刻，有空看看原著。,0
1,2342687,家,刘小仙兒,225476153,推荐,2021-06-15,04:24:55,家，什么是家，何以为家，,0
1,2342687,家,糖炒栗子,79560195,推荐,2014-07-20,17:31:44,封建制度对人的残害，生活在现代幸福多了,0
1,2342687,家,Cristal,152519737,很差,2022-12-18,15:07:57,拍得啥，比起原著，俗了一千倍。,0
1,2342687,家,哒哒哒～,200378310,力荐,2020-05-08,08:52:56,很久之前看过这个剧，感觉这个剧就是基调就很悲惨，揭露了当时的社会,0
1,2342687,家,淡茶织小姐,48783751,力荐,2018-11-12,21:22:22,有好几场戏是看哭了的，压抑而难过。最后觉慧离家，站在船头，有风吹过，岸上站着原说不来却赶来送行的大哥觉新，看到此才觉得透了口气。觉新的隐忍懦弱、觉民的绵软摇摆、觉慧的叛逆坚定，不囿于那个时代和家庭，或许在任何时代、任何抉择里都看得到这些身影。,0
1,2342687,家,暖橙,1143327,力荐,2020-09-04,16:41:10,小学教材里就具有超强存在感的名著。毕业多少年了，才看，还是电视剧……情节也太惨了吧……善良美好的女性都是青年一代，而且基本都死了……梅表姐，瑞珏，鸣凤……除了一个表妹。为了铺垫青年一代男性的抗争与出走，巴金把善良的女性都写死了。有些羡慕巴金那一代人，有明确的反抗目标，也有信仰。忠于信仰，勇于突破并按照信仰而生活。我们呢？我们的不快乐？不幸福？我们能有多理解？又能有多大的勇气去抗争？,0
1,2342687,家,农场麦片,58162408,推荐,2014-10-29,07:56:24,虽然改编了，但还是值得看的。,0
1,2342687,家,苦瓜 2020,213882124,推荐,2021-04-28,21:33:54,剧情内容很厚重，节奏不拖沓，演员也都演的很好！,0
1,2342687,家,鸿雁于飞,206446933,推荐,2021-01-29,23:24:53,好看。书是看过的，剧很贴原著，服化道都很不错。,0
1,2342687,家,人间值得,126751405,还行,2022-04-30,19:40:52,和我想象中的家不太一样,0
1,2342687,家,云卷云舒,154511660,力荐,2017-09-06,03:05:56,鸣凤死的这场戏演得入木三分，剧情和音乐不自觉把自己的情绪代入了。眼泪就顺着眼角滑下，等看完才发现自己也跟着哭了。还有瑞珏死的时候，觉慧走的时候巨戳心窝。,0
1,2342687,家,秋水怡人1124,210452950,推荐,2022-03-04,16:06:51,那个年代的大家庭感到好愚昧好让人窒息！为那个年代年轻人的相爱心痛！这部剧阵容还挺豪华！李小冉的梅表姐太让人心疼了！黄奕扮相温婉演的也挺不错！黄磊那时还挺瘦，演民国大少爷一点也不违合！,0
1,2342687,家,细数余年,197244032,推荐,2022-06-30,06:19:29,看过，还行,0
1,2342687,家,北尽,199976806,推荐,2019-10-01,08:46:27,这部剧特别好，我看哭了真的。人物鲜活，剧情也好。,0
1,2342687,家,7334妈妈,208015838,推荐,2021-02-17,20:34:22,很好看,0
1,2342687,家,夏鲜,52047376,推荐,2021-04-27,22:03:23,"鸣凤让我哭的稀里哗啦
和橘子红了一样的，灰扑扑的暗。压抑的透不过气。",0
1,2342687,家,南晚,162664472,推荐,2021-12-21,11:12:46,从头到尾的悲剧,0
1,2342687,家,三味,63823465,力荐,2020-05-14,21:04:15,满腔慨叹。现在的生活是多么来之不易，经过多少代人的奋斗。旧时生活真没有小说中的美好，所以说穿越回去做什么。,0
1,2342687,家,El futuro,152116742,力荐,2020-05-22,22:45:12,太好哭了呜呜呜呜，梅、珏这辈子太苦了，黄磊还是有演技的，最后一集送走觉慧那里太感人了呜呜...,0
1,2342687,家,玩球大龟,120982708,力荐,2016-11-17,23:35:10,哭得我肝肠寸断…,0
1,2342687,家,🐯,147486363,推荐,2021-01-20,06:04:50,说实话和书不咋像,0
1,2342687,家,甜贝元宝,222098765,力荐,2021-11-29,21:41:41,好看，里面演员演技都很好。,0
1,2342687,家,月亮之上520,212236063,力荐,2021-04-07,07:20:25,基本上都是我喜欢的演员啊,0
1,2342687,家,温馨2020,227263585,推荐,2021-07-22,17:25:49,这部剧演员阵容强大，好看的剧,0
1,2342687,家,青草更青处,2632946,力荐,2015-08-18,06:22:52,好看，就是太悲情了。里面的女主个性都很讨厌。,0
1,2342687,家,周周,197351562,推荐,2020-07-24,22:26:39,比老版差点,0
1,2342687,家,酱酱,183901757,推荐,2019-03-12,16:36:13,竟然不记得戏里有黄奕，黄磊汪俊合作了好多剧啊，都不错,0
1,2342687,家,SHINee中本悠太,191419914,推荐,2021-08-21,21:56:42,"鸣凤和珏那两段真的看哭了😭😭😭
就是觉慧有点太理想主义和激进了，不够体谅明轩的无奈。",0
1,2342687,家,霓妍,203681616,推荐,2021-08-10,09:05:32,经典，好看,0
1,2342687,家,雪之之0510,238225933,推荐,2022-01-11,20:34:39,看得让人窒息，那个年代太压抑了！幸好不生活在那个年代！黄磊那时还没胖，演觉新还是不错的，李小冉的梅表姐也颇有神韵，就是跟觉新之间的关系太拖拉了！还是书描述的好！,0
1,2342687,家,鼠鼠,rockbanana,推荐,2019-12-22,10:29:47,"宇宙唤醒我们爱情的需要，可是又不使爱情得到满足。
高觉新这样的热血青年虽然幼稚无力，可我们的先辈就是这样抗争过来的。",0
1,2342687,家,梅兰竹菊,206445486,推荐,2020-10-14,13:40:22,很不错，都是实力派演员，男帅女俊养眼,0
1,2342687,家,你的小宝贝,204672818,力荐,2020-12-26,16:44:52,把那种沉郁的基调拍出来了,0
1,2342687,家,赖小P,lai315,还行,2008-06-10,15:14:51,好像还没全看完～,0
1,2342687,家,shdi,179774861,推荐,2019-05-09,23:58:16,黄磊老师真是我见过的中年男演员中演技最好的了。,0
1,2342687,家,啵啵的GG,bjyx1833,较差,2022-10-19,21:26:38,不喜欢这种剧情，看着让人抓狂！！！,0
1,2342687,家,dudnagabr,wearllllt,力荐,2020-05-18,17:06:43,"在小破站看完了。整部戏很压抑，但是镜头构图很唯美,比起这些年烂片，制作很精良。最重要的短，21集，一两天都看完了。",0
1,2342687,家,沧笙踏歌,204187659,推荐,2020-07-21,13:20:30,黄磊年轻时候很适合民国风电视台，形象好，演技棒。,0
1,2342687,家,.,259839685,还行,2022-11-24,21:11:52,……几种截然不同的情感总是左右拉拽着她，使她犹豫不定,0
1,2342687,家,巧克力味的春天,197659760,推荐,2019-10-28,20:52:57,汪俊导演真的好会拍家庭剧 现代剧 感情很细腻,0
1,2342687,家,卑微的花生米,245120862,推荐,2022-11-15,16:38:21,这版真的比较还原书的噻,0
1,2342687,家,来塞个,201702148,还行,2020-08-05,10:17:43,"塘中的月色并不均匀；但光与影有着和谐的旋律，如梵婀玲上奏着的名曲。
等我睁开眼和太阳再见，这算又溜走了一日。我掩着面叹息。但是新来的日子的影儿又开始在叹息里闪过了。
",0
1,2342687,家,豆友221492211,221492211,推荐,2022-02-11,23:51:10,经典之作！经典翻拍！演员演技在线！故事情节发展吸引人！值得推荐观看电视剧！,0
2,2342687,家,粉色信笺,234053832,力荐,2021-10-19,22:14:40,真好，黄磊演明轩了。是因为大哥是黄磊演的吗，好心疼⊙﹏⊙黄磊眼睛好圆好可爱,0
2,2342687,家,不可说,212795474,推荐,2020-06-10,23:47:59,高家三兄弟在一家之主高老太爷的蛮横专制下发生了一系列的不幸的故事，话外音我还是蛮吃黄老师年轻时的颜。,0
2,2342687,家,蛋挞达人,Iiaryh,还行,2020-05-04,02:48:48,黄磊真的不适合演戏啊 越看越做作 年轻时候就能让人觉着作,0
2,2342687,家,小豆芽,205986255,推荐,2020-02-02,18:28:37,配乐很好。黄磊的表演很到位。黄奕的表演很惊喜。,0
2,2342687,家,豆友210515184,210515184,力荐,2021-07-23,07:49:45,李小冉演的梅芬温文尔雅，气质卓越，真是太美了,0
2,2342687,家,三儿爷,184616893,力荐,2020-09-23,08:29:49,现在看，演员演技真好。,0
2,2342687,家,parachute,lastip,推荐,2013-04-13,15:26:21,黄奕好美，王丽坤好美，黄磊滴溜溜的大眼睛，只有陆毅假惺惺。,3
2,2342687,家,悦光逐影,204201762,力荐,2020-05-28,10:19:26,看过很多遍的家，春，秋原著，然后再看电视剧，有些剧情都能帮演员先说台词了。,1
2,2342687,家,笑笑姑娘的db,177939632,力荐,2018-08-27,23:45:49,个人觉得还是不错的,0
2,2342687,家,第一拽姐叶澜依,194957485,推荐,2022-05-11,19:16:11,不错,0
2,2342687,家,泡芙.,225052739,还行,2021-08-22,21:16:29,和奶奶一起看的 看的好压抑。。,0
2,2342687,家,梦里花落知多少,211222321,还行,2020-04-28,20:41:26,最深刻的，一个是忧郁、怯懦、总是心事重重的觉新，一个是冲动、充满激情、直肠子又带有大家公子纨绔之气的觉慧，还有贤惠、大度、善解人意的瑞珏。中后期觉新的“绅士帽”配得非常好，显示他已经开始变成一个绅士，开始认命。而且中后期黄磊常常将双手交叠放在身前，一副唯唯诺诺且局促的样子，很能凸显人物的精神状态。剧中其他人都会穿布鞋，但觉慧始终穿的都是皮鞋，倒是很衬得出他特立独行的性格。陆毅的长相真的是适合演这种脸谱化的正义的化身，但是也正因如此，这种角色没有复杂的性格，没有多少让演员发挥的空间。,0
2,2342687,家,棉花糖,187964282,力荐,2021-12-22,20:43:03,感情真丰富，剧情连续紧凑，与现在的电视剧相比真的高质量👍以前的旧社会有这么多牺牲品，看着真让人心酸😔但是也激发的人们的觉悟,0
2,2342687,家,PEACE,184583943,力荐,2022-12-26,20:33:38,"病中看完，不敢哭怕水泥鼻再次凝固
这才是给人看的剧吧，现在拍的剧动不动又臭又长又没营养，不断刷新观众下线，相较之下，那个年代的观众更幸福",0
2,2342687,家,李钰纨,182081057,力荐,2021-02-05,20:57:07,那时的人生和婚姻都是一场没有选择的豪赌。觉慧和鸣凤的感情在这森严的牢笼里纯真而动人。禁锢于“家”中的善良之人不够现代性的原因就是不够“自私”。,0
2,2342687,家,荷叶苍苍,162484902,力荐,2021-07-20,14:13:46,经典,0
2,2342687,家,lovepath,138649608,力荐,2020-05-05,21:51:35,时代意义深刻,0
2,2342687,家,余小冉YR,169693426,力荐,2019-02-26,17:57:27,爱奕❤️,0
2,2342687,家,水煮肉片,214137303,推荐,2021-10-25,15:58:10,她是一个颇有意思的矛盾体，既热情又阴郁，既高傲又自卑,0
2,2342687,家,慢煮生活,30907083,力荐,2019-04-25,22:22:49,再次回味，高三的时候通宵达旦看的，剧里主要角色的性格特征被演绎的很像，准备看完电视剧看巴金的同名小说,0
2,2342687,家,重九,211111616,推荐,2022-08-01,22:30:45,台词很书面化 也很小说化 我真的蛮喜欢瑞珏 可能我身体里住了个男的 对这种贤妻良母善良美貌的老婆无法拒绝 有时候能理解觉新 但他在瑞珏的死上应当负首要责任,0
2,2342687,家,一片好牛排,204170819,还行,2020-02-03,13:27:38,好看细腻很精彩,0
2,2342687,家,星辰大海NANA,113977398,推荐,2022-12-22,18:44:11,每次看到半中间,0
2,2342687,家,wuhong0528,192885257,推荐,2021-05-23,09:52:37,压抑,0
2,2342687,家,劳拉西泮,gywmdshwt,力荐,2020-06-11,13:35:07,"最后一集觉新和觉慧的聊天以及觉慧离家很感动
虽然这部剧跟原著比有些改动，有的我很喜欢的地方也没拍，但总体感觉很好，很有层次感。看完让人恨的牙根疼。
演员选的也很棒，黄奕真的是颜值巅峰啊。
另外这部剧好多听墙角的镜头hhhhh",0
2,2342687,家,沔水以南,157963565,推荐,2018-12-24,14:18:19,原著党还是看作品就好了，毕竟影视改编是二度创作。,0
2,2342687,家,nono,180794122,,2022-03-08,19:40:22,补标 为了王丽坤、黄奕补的剧,0
2,2342687,家,豆友x6M1InaoAw,250159878,推荐,2023-01-08,21:30:51,曾经的黄磊是多么俊俏，现在就是个厨子,0
2,2342687,家,在水一方,227112990,推荐,2021-03-14,21:34:04,"人物演绎的十分到位,很好",0
2,2342687,家,朽月,197755571,推荐,2020-11-23,14:19:09,部分情节改动感觉有点奇怪 演员、布景以及整部剧的氛围还是很原著的 挺有感觉～,0
2,2342687,家,一块钱豆腐,213362058,推荐,2020-11-02,15:54:04,不错啊，一点都不拖泥带水，演员更是演技派，这样的电视剧才是王道,0
2,2342687,家,温馨2022＃XX,227233095,推荐,2021-07-22,17:15:31,黄磊演的戏好看，他有那种文弱书生的气质。,0
2,2342687,家,煎茶,173775587,推荐,2020-01-26,19:17:15,略文艺，但以前的电视剧真的好看，演的很自然，台词也好,0
2,2342687,家,桃之夭夭的兔子,240445629,力荐,2022-01-06,09:30:45,看过，好看，温馨,0
2,2342687,家,夜兰绫华心海,218531946,较差,2022-08-05,19:36:48,家庭民国剧总有一种忧伤的基调,0
2,2342687,家,Katie,43673689,,2010-12-30,16:32:22,看完不禁感叹我们生活在一个幸福的年代。,0
2,2342687,家,无所谓好坏,219612625,推荐,2021-03-02,18:37:18,黄磊老师的演技真的很棒，这类剧总是让人看的无可奈何，太现实？,0
2,2342687,家,Moon_Z,50910085,推荐,2020-04-04,17:25:27,由巴金老先生的《家》而改编的电视剧，虽然知道那个时代的封建礼教，但对于梅芬真的没有好感，觉得三观很有问题，一直在吐槽…梅芬 瑞珏 鸣凤，包括大哥都是封建礼教的牺牲品…最后一集，老三终于离开了这个家，看着大哥最后还是跑来送他，就潸然泪下了，大哥说自己做不了的事 老三可以去做，哎…,0
2,2342687,家,打西,190030034,力荐,2019-09-19,21:41:43,围绕高家的故事，高老太爷为代表的封建旧思想。觉新矛盾懦弱的性格，接受了新思想但被封建家族旧思想所打败了。觉新梅表姐相爱但家族不允许，娶了瑞珏。觉民觉慧是新思想代表，觉慧喜欢鸣凤，但鸣凤跳湖自杀了,0
2,2342687,家,BangTigger,145561868,力荐,2021-10-13,13:44:53,众生皆苦。以前的电视剧情节多紧凑呀，现在的简直注了整个大海,0
2,2342687,家,法宝酱,175296700,推荐,2019-04-12,23:46:15,比原著加了一些戏剧性的冲突，总体不错。,0
2,2342687,家,孑然一身、,147223608,推荐,2020-05-20,01:00:33,以后有空要看一看原著…鸣风结局也太惨了吧，三兄弟中觉慧太过理想主义，大哥的婚姻生活是那个时代大户人家的缩影？那个年代多少有情人最终难成眷属…可现在这个年代又能好到哪里去呢？,0
2,2342687,家,yzxa1416,yzxa1416,还行,2021-08-10,06:40:52,个人觉得黄磊老师还是比较适合民国时期的造型,0
2,2342687,家,wzq 沙漠之洲,216641186,推荐,2020-09-07,22:08:48,对原著改编了不少，黄磊和黄奕表现的不错。觉民这个角色本来可以深刻挖掘，可惜在剧中戏份不多，悲情渲染过多，情节稍显拖沓。,0
2,2342687,家,不要过于关注我,251727129,推荐,2022-03-15,21:42:43,黄磊和陆毅早期的剧真的还不错,0
2,2342687,家,大侠爱江湖,183345910,推荐,2020-05-10,15:51:03,"悲剧
要懂得反抗",0
2,2342687,家,徐徐李,217896816,推荐,2021-02-03,22:48:40,黄磊自带书卷气，演民国书生很合适。,1
2,2342687,家,双影,148153283,推荐,2019-04-29,23:36:27,演员都是好演员，选角真的挺到位的，尤其最后一集的黄磊情绪出来得刚刚好…但是编剧强行给明轩他们仨加那么多狗血的内容，良心真的不会疼吗？？,0
2,2342687,家,绯色雪影,166159719,还行,2018-09-09,23:53:03,看过小说，这个版本都是选用的当时还很年轻的演员，感觉还可以。,0
2,2342687,家,勾萌,171442142,推荐,2019-04-01,13:39:33,看了10集。中规中矩。,0
2,2342687,家,Only plus,194231139,力荐,2022-11-27,23:34:27,五星给郑国霖演的觉民，是我心中的觉民了,0
2,2342687,家,明之,156764045,推荐,2019-10-08,14:53:29,比较忠于原著，差强人意吧,0
2,2342687,家,昨非,195324280,力荐,2021-06-08,13:14:53,岂一个悲字了得……,0
2,2342687,家,libt,140730035,还行,2021-06-23,22:48:12,好压抑阿 看的我难以接受 黄磊是演的好 但真的看不下去,0
2,2342687,家,樱田晴川,70487962,力荐,2021-05-01,22:52:20,一声叹息,0
2,2342687,家,昭＆珵,76207947,力荐,2021-03-14,00:42:11,改编作和原作差距还是挺大的。不建议考试的同学参考电视剧，一定要看原作啊！以及，觉民好可爱呜呜呜。,0
2,2342687,家,朝哥,225342989,推荐,2021-09-29,19:45:37,几个人都挺符合原著,0
2,2342687,家,小喵,214654751,推荐,2021-02-04,12:43:34,喜欢黄磊，民国公子太贴合了。巴金的家展示了那个年代家庭族中的状况。,1
2,2342687,家,是个人,225742741,推荐,2021-04-19,09:35:56,"哈姆莱特式的犹豫，内心的矛盾和搏斗是""家""的人物中最丰富和最激烈的。",0
2,2342687,家,斯诺登的眼镜,143365270,力荐,2020-06-17,10:31:28,江苏高考文科必读文学之一，高三时看这本书就很喜欢，电视剧对书里内容还原度挺高，十三年前的国产剧还是很靠谱的，演员都很务实，黄磊的演技堪称教科书般,0
2,2342687,家,打烊,261488600,推荐,2022-10-01,09:48:29,虽然当时哭得七荤八素，但还是小说更经典~鸣凤长得太现代了，陆毅演技赞一个~,0
2,2342687,家,努力的小蜗牛,Jutta1314,力荐,2019-12-09,18:30:20,"因为想和《京华烟云》对比一下，周末赶着看完的。《京华烟云》认为婚姻重要的是在于两个人智慧地经营。《家》对封建婚姻的批判性更浓，呼吁青年们勇敢地进行反抗。但是老三反抗的背后却是大哥牺牲自我的支持。探索是困难的，人生的选择也是困难的。最最同情大哥，一辈子牺牲了自己的理想，爱情，虽然活着却每日忍受着生活的煎熬。
还有，封建大家庭的人情关系真的是很凉薄。真情真的太太太宝贵了。",0
2,2342687,家,兔兔的耳朵,213976213,推荐,2020-08-05,15:48:00,拍的还挺好的，这些演员也都不错,0
2,2342687,家,人间飞雪,198072735,推荐,2020-07-03,07:41:58,不错,0
2,2342687,家,老邓,213747902,还行,2021-05-27,20:45:08,虽然原著是很小的时候看的有些记不清，但感觉剧本出入挺大的，黄磊的觉新演得最好最像，其他的老爷太太少爷小姐们也都演出了特色，难得的国产佳剧。大表哥和梅表姐的感情戏太多了，尤其到后面婆婆妈妈搞得太长了,0
2,2342687,家,W,215393855,还行,2021-05-09,23:40:27,还可以,0
2,2342687,家,菲儿0824,207104784,推荐,2020-06-06,08:22:38,名著，还是蛮喜欢李小冉！,0
2,2342687,家,请检查网络设置,189967423,推荐,2019-06-23,08:20:04,和妈妈一起看的。,0
2,2342687,家,佛系网友🥰,262104601,推荐,2022-12-14,07:15:24,黄磊的觉新演得最好最像，其他的老爷太太少爷小姐们也都演出了特色。,0
2,2342687,家,甜心硬汉,184906545,推荐,2019-06-14,20:11:03,黄老师真的是个眼睛大的小胖子,0
2,2342687,家,呆瓜,172547572,推荐,2018-04-16,10:23:20,好看的电视剧！！！！支持黄磊,5
2,2342687,家,momo,138170630,推荐,2020-11-25,15:14:34,封建思想在那时这么顽固，但最终还是新思想胜利了，觉慧这样的人是多么难得啊，没有这些青年人的反抗哪有我们今天呢！旧家庭旧礼教让善良隐忍的人成了牺牲品，让庸俗无聊者苟活，让恶人继续作恶制造悲剧。这样的家是该被打碎了,0
2,2342687,家,彦逸,222526015,力荐,2021-01-24,12:47:09,这部戏绝了，超级喜欢,0
2,2342687,家,语冰🌙,195967849,推荐,2020-03-16,15:53:32,高中看的。,0
2,2342687,家,Zain al-Rafeea,181477751,推荐,2019-07-01,16:55:05,好看的，每一个景致都好看，导演真得好会拍,0
2,2342687,家,xsh7639,126076700,力荐,2019-05-10,10:59:54,演员阵容真的太巨了，每一个人的颜值和演技都在线。剧情毫不拖沓，完全没有国产剧注水的通病。感觉这种电视剧是用来怀念国剧的黄金年代的。10年前，没有滤镜，没有抠图，呈现的都是最真实的状态。再也回不去了。,0
2,2342687,家,豆友212759057,212759057,推荐,2021-03-04,16:32:28,好看，经典。,0
2,2342687,家,夏茉,199134335,推荐,2019-09-05,22:49:26,家是避风的港湾，是你困了倦了的栖息地！有家就有爱！,0
2,2342687,家,香水湾,213942844,力荐,2020-10-31,18:04:56,看过老版的，孙道临老先生那版，特别喜欢，那种气质和书中描写特别吻合，黄磊版的也很不错，更现代一点！都很棒！,0
2,2342687,家,芒果西米璐,200366653,力荐,2020-11-29,13:45:58,封建礼制真的吃人，很幸运我们生活在这样一个和平且文明的年代，这个年代虽说是风平浪静但也暗流涌动，每次都有一种热血想去为社会做出贡献，希望自己以后可以越来越勇敢，坚强和善良。,1
2,2342687,家,疯魔般的追光人,198041099,推荐,2020-06-04,11:23:51,家春秋三部曲好看！这个电视剧也好看！演员阵容好！,0
2,2342687,家,飞雪,209353536,力荐,2021-06-06,18:04:49,原著太经典了，剧能拍成这样很不错了。,0
2,2342687,家,网络ID一个太阳,233411700,推荐,2021-03-23,13:30:31,好片,0
2,2342687,家,破滚滚,76099821,力荐,2019-04-20,21:59:35,我真的难以忘怀的就是这部剧了，带着悲情色彩，但是人物都很鲜活,0
2,2342687,家,阿橙子宁,Orangesfish,推荐,2020-02-26,20:42:49,国剧考古到这里，不得不感叹《家》的演员阵容太强了，黄磊的觉新真的非常可怜可悲可叹。,0
2,2342687,家,赵赵,220158105,推荐,2022-02-20,18:02:48,上学的时候看过这本小说被剧中人物的性格描写非常喜欢💕几个主角个个都有自己鲜明的时代色彩。他们所处的时代决定了他们悲情的命运，只有打破封建思想的旧观念，砸碎束缚人的枷锁才能有新的希望和未来。现在已是现代文明的时代，仍然要有开拓精意识创新能力才能成就一番事业,0
2,2342687,家,奶茶,69746047,力荐,2020-12-16,22:05:34,黄磊演技很好,0
2,2342687,家,遇见兔子的时光,232215527,推荐,2022-06-14,22:36:25,在那样的背景下，好多事都身不由己,0
2,2342687,家,呸,202889281,推荐,2019-10-06,23:07:30,黄磊那时候看着好年轻啊,0
2,2342687,家,、元气满满,210168547,推荐,2020-04-27,22:24:09,好想有个家啊，很写实的一部剧 喜欢陆毅太帅了，演技又很棒！,0
2,2342687,家,Conquer,232415648,还行,2022-08-15,18:01:19,大表哥和梅表姐的感情戏太多了，尤其到后面婆婆妈妈搞得太长了,0
2,2342687,家,SheliaLiu,ldqshelia,力荐,2016-04-04,13:11:23,特别特别喜欢黄磊那种隐忍的表达,1
2,2342687,家,就是一辈子,Y200609090717,还行,2022-08-22,20:38:13,首先是觉新，相比原著电视剧在前几集加入了一些新梅恋有关的剧情，但是这不代表就可以让觉新变成一个愤青好吗？那种疾言厉色的状态恐怕连觉慧这样的二愣子青年都做不到吧！黄磊越是演得有爆发力，其实越显得这里的剧情有多荒诞。因为觉新骨子里不会是这样的人，他最深入骨髓的气质就是忧郁，一种窒息般的忧郁,0
2,2342687,家,少一点秋意,253410675,还行,2023-02-08,00:11:30,黄磊年轻时候很适合民国风电视台，形象好，演技棒。黄奕造型蛮好看，表现出彩。,0
2,2342687,家,木耳饼饼贴,25797244,力荐,2012-04-07,19:23:17,唯一从头到尾看完 看过很多遍的电视剧,0
2,2342687,家,甃彤,188290916,力荐,2021-04-30,08:43:51,才发现黄磊演了这么多的老舍,0
2,2342687,家,[已注销],184348048,推荐,2020-09-18,13:33:58,我有话不能说 有感情不能表达,0
2,2342687,家,傻少年要长大,197435604,力荐,2019-08-27,12:54:01,这部真的很好看😭看得我很压抑,0
2,2342687,家,咖啡豆小饼干,210576375,推荐,2020-10-13,20:37:17,家之浓厚却又厚积而薄发，家之清淡却又回味无穷。,0
2,2342687,家,万花满楼,142231174,推荐,2016-10-08,12:32:44,不错，演技上没有特别的槽点。陆毅黄磊颜值多加一颗星。,0
2,2342687,家,无可奈何,228976825,推荐,2021-01-30,17:00:54,看这部剧是冲名著去的，特别想看看梅表姐是不是很漂亮，还不错，发现黄奕演民国时期的人更有韵味。,0
2,2342687,家,林,210592315,推荐,2020-03-13,21:51:22,好看👍,0
2,2342687,家,david pqc,152521025,还行,2017-05-19,19:28:33,一般般，真的只能说是一般般,0
