page_index,movie_id,title,username,user_id,rating,date,time,comment,useful_count
0,1305690,阿飞正传,寒枝雀静,93124222,推荐,2017-12-22,22:00:51,B /  今年最后一部。目前相对不喜欢的一部墨镜。对“无根”状态的刻画被限制在了相对狭隘的格局里，放不开。/  二刷依然不是很喜欢也究不清不喜的点在哪。或许是本应通过情绪漫漶产生隔离感的故事被过分清晰的叙事越俎代庖而真的产生了隔膜，又或许是多人物的交错以及略显刻意的爱情时空结构让人难以深入某一人物的情绪中。影像值得逐个镜头细品，文本也有广阔的空间解读，但却没有那种感性的沉迷与被操纵的冲动。到今天才意识到那几个雨林的镜头似乎正是在模拟那种“无脚鸟”的主观视角，作用类似于cmbyn中旅行时行进于山路中的颠簸镜头。,18
0,1305690,阿飞正传,纤纤,158629236,推荐,2018-06-26,19:52:59,这个阵容，这个故事估计就是绝唱了。,11
0,1305690,阿飞正传,Comel,Comel.Dyx,力荐,2008-09-13,19:57:49,【2】对浪荡子的完美演绎，其举手投足之间都带有不羁的态度，客死异乡是最好的结局,11
0,1305690,阿飞正传,TWY,terenceyibo,推荐,2018-06-25,22:04:20,“香港尚盧高達”，还是很喜欢这样一个完全绕着明星的魅力展开的简单的故事的，有着很令人动容的情感气息。,11
0,1305690,阿飞正传,巴伐利亞酒神,darkwood,推荐,2018-03-17,14:56:20,热带丛林中的那一列火车，一出生便死去的无脚鸟。90年代的一张张脸，有的已经模糊，有的仍旧不老。,12
0,1305690,阿飞正传,哪吒男,nezhaboy,力荐,2018-06-26,17:38:36,是这样的,6
0,1305690,阿飞正传,乔小囧,ourorz,推荐,2013-04-01,04:08:12,无脚鸟早已经死过了，可该记住的我永远不会忘的。,8
0,1305690,阿飞正传,X,158679347,推荐,2017-06-27,13:54:48,可以看出张曼玉的演技那时候还没有炉火纯青,10
0,1305690,阿飞正传,风蚀蘑菇,EmeraldKinoko,推荐,2014-01-13,06:51:07,阿飞这人啊，身如浮萍，生性凉薄。这种人放到现实中就是个混蛋，不折不扣的渣男。但哥哥冲你笑着勾勾手指，是我我也立马沦陷，事后绝不后悔——没什么理由，有些长着好皮囊的人渣生来就是受上天宠爱的,20
0,1305690,阿飞正传,草莓__三月,152762782,推荐,2017-03-18,22:56:16,无根鸟本就不能落地，终其一生都在飞翔。,11
0,1305690,阿飞正传,肖浑,xiaojia86,推荐,2016-12-01,18:42:17,十年前看那次影像效果太差，终于看了清晰版的，看完后脑子里依然是一团迷雾。,14
0,1305690,阿飞正传,Kylin,148695878,推荐,2017-01-01,19:13:21,也许他心里 也在等待着能让他落地栖息的岛屿,14
0,1305690,阿飞正传,渡口无边,particles,推荐,2015-06-27,19:51:33,昆汀曾说：早期王家卫是受戈达尔影响的，如此叙事大于故事的表达方式尤甚。很潮湿的电影，欠爆、低饱和、肆意的视觉光谱，无根的人，不如意的人生。来日的，问昨天便可知；难料的，是这心没法知。期待中；渡过一生散聚，明日灿烂，还是暗淡的去。,14
0,1305690,阿飞正传,朝阳区妻夫木聪,Invisible___,推荐,2018-06-29,03:27:33,很多时候我觉得自己都是旭仔，只有面对你的时候我才觉得自己成了苏丽珍。,16
0,1305690,阿飞正传,SydneyCarton,SydneyCarton,推荐,2013-08-19,00:17:53,相见恨晚，比东邪西毒好太多，要是多一点闲言碎语和无语，少一点“无脚鸟”这种大尾巴狼，我会毫不犹豫刷五星的。,9
0,1305690,阿飞正传,Trillian,triciamcmillian,推荐,2018-06-28,23:58:17,旭仔的爱不在苏丽珍也不在咪咪，而在那个不肯回头亦不可追寻的母亲。戈达尔式的实验性影像套了情节剧式的爱恨，粘稠湿润的雨水激发的敏感情欲，被追求被抛弃和被物化的女性。,15
0,1305690,阿飞正传,darkcat,darkcat,推荐,2018-06-25,18:18:25,厉害的对手戏在旭仔和养母,22
0,1305690,阿飞正传,Lies and lies,kidneytopo,推荐,2011-09-19,20:51:49,阿飞塑造得比一般王家卫电影人物要立体一些。张国荣和刘德华有没有一点像里维斯和菲尼克斯！！,7
0,1305690,阿飞正传,豆瓣1160,JuvenL,很差,2011-04-16,00:35:27,喜欢张国荣，但本片实在太差了 几乎没有值得回味的地方,356
0,1305690,阿飞正传,兮称,shoegazerbaby,很差,2014-02-19,22:11:09,及其讨厌这种小资又自恋的文艺片，无脚鸟故事也是仿照白兰度的The Fugitive Kind,41
1,1305690,阿飞正传,SundanceKid🌈,rudygiraffe,力荐,2018-06-27,18:22:07,多年前看的时候还不知怎样去关怀另一个人。沉甸甸的绿，灰蒙蒙的蓝，那些鸟儿掠过的丛林，那些人经历了的雨后燥郁，情意都像大色块般饱满，人人都是见到了的，但问起来也不知稀释后哪儿有踪影。你说你不要停下，但从此以后，他的电影里尽是下一个阿旭下一个苏丽珍,2
1,1305690,阿飞正传,森雲,firehill.blog.s,推荐,2007-11-26,16:06:34,20171228重看。若干年后，不知道华仔记不记得电影里张国荣的那句台词——有一天我飞了，你可不要自卑,8
1,1305690,阿飞正传,Der,hansean,还行,2017-10-30,22:56:07,看这部90年代初的作品，有种莫名掉入王家卫宇宙的感觉，现在要说分清看过的那几部都分别讲了什么，分不清，都很朦胧，很湿润，好像都一样，奇妙的感觉。补完了目前想看的王家卫电影，暂告一段落。,7
1,1305690,阿飞正传,又又,wxs723,推荐,2010-09-21,22:32:56,无根鸟 哥哥 张小姐,2
1,1305690,阿飞正传,内陆飞鱼,veverlee,推荐,2007-12-17,17:57:31,最早看碟，百老汇香港影展，大银幕上看这个片子太享受了……,4
1,1305690,阿飞正传,波澄酒,Cherry.Pluto,力荐,2011-04-20,02:31:09,这部电影惊艳了我。张国荣穿着破旧的白色背心，在夏日里对着镜子听着留声机跳舞。他咬张曼玉的手指，是我对性的第一次认识。梁朝伟换了一块又一块的表。他们消失在彼此的人生。,3
1,1305690,阿飞正传,精神少女王绥👧,141860787,力荐,2016-12-02,00:26:28,所以梁朝伟是干什么的？！,5
1,1305690,阿飞正传,小也羊子,puhongyu,力荐,2014-04-05,12:19:23,每个女人都曾喜欢过一个像阿飞这样浪荡的男人，但不是每一只无脚的鸟死前都会永远记得这一分钟。,4
1,1305690,阿飞正传,萌萌哒,88112581,推荐,2017-05-23,10:37:25,张国荣好帅，然后如果是中二时期我可能会给更高分,4
1,1305690,阿飞正传,随意,149851566,推荐,2017-04-08,19:56:59,自习课看的电影，可能教室的投影仪太差，看的不甚清楚，但还是看的津津有味,6
1,1305690,阿飞正传,HelloDoris,mokikiyo,推荐,2012-08-15,22:07:11,王家卫和张国荣果真是装逼鼻祖！,2
1,1305690,阿飞正传,合纥,2252653,推荐,2008-11-16,23:52:59,还是照样很浓王氏文艺味的片子，电影的配乐很好听，和电影的气氛结合得很好（曲子有点似曾相识）。最后梁几分钟的镜头和整部电影在情节上没有关系，反而成了最大特色。,1
1,1305690,阿飞正传,老罗Lazzaro,lazzaro,推荐,2013-03-30,22:41:56,三连观影之一。节奏之慢，王家卫式风格，经典的台词，值得反复揣摩。,3
1,1305690,阿飞正传,全都是风,Losersclub1958,推荐,2018-06-27,03:32:00,正经看的是大屏幕上的重映版。对台词完全免疫；但似乎更迷恋于王家卫的强烈风格感。张国荣的表演最为可惊，颓废与危险到噬骨。最后，有两位相伴而来的白发老年影迷，28年前他们是我的年纪吗？,2
1,1305690,阿飞正传,喝醉的小熊軟糖,calypso29,推荐,2014-06-19,11:39:20,刘德华在最后的火车上问他，“欸，你还记不记得去年四月十六号三点你在干什么？” 张国荣说：“她告诉你了？”听完这句话我就潸然泪下了……其实他都记得，只是不愿意说出来，这样让两个人都能更好过点。【话说刘嘉玲居然还有这么少女感十足的时期啊！】,4
1,1305690,阿飞正传,emillyhom,146643109,力荐,2018-06-30,15:30:38,哥哥,4
1,1305690,阿飞正传,Muto,muto,力荐,2018-08-09,11:51:34,嘀嗒嘀嗒的时间在《阿飞正传》里是一只没有脚的鸟，它不停歇的在原地打磨也让王家卫的光影世界实现了质的飞跃。然而于此谈论所谓的爱情还为时过早，因为作者在那句听上去浪漫实际上无比煎熬的一分钟之内探讨是自己当下的身份。但几段爱情小插曲安排的又是极为狡黠和精彩，在你记不清“曾经”何时开始何时结束的时候下一场“邂逅”又准备登场了。,4
1,1305690,阿飞正传,田废久必生,amilelee,力荐,2016-06-23,20:04:01,大部分片子和这个片子的关系就像张学友和张国荣的关系一样,6
1,1305690,阿飞正传,静子,85252361,推荐,2017-04-08,23:25:36,那时的王家卫，张国荣，怀恋,4
1,1305690,阿飞正传,庸爻儿,d_minor,推荐,2021-06-16,08:36:35,@ Made in Hong Kong Film Fest | 往锁queue里再加一篇。在能听懂的上海话和听不懂的粤语里寻找一个注意点的平衡。如果能把这个世上的渣男都查找替换成破碎的阿飞，这个世界会不会稍微好一点？,1
1,1305690,阿飞正传,雷克雅目黑,satoshidamon,还行,2012-07-09,17:56:12,给王家卫一桶屎他也能搅出文艺味儿来，这回装逼装过头了我吃不惯这一套。里面有个bug是房东给了刘德华206的钥匙结果他开的是204的房间= =+，别告诉我这跟2046有什么隐喻关系,4
1,1305690,阿飞正传,狷介有乌青,kidcby,推荐,2007-01-14,18:25:51,【无敌老港片】,2
1,1305690,阿飞正传,含笑半步颠,filmcan,力荐,2010-09-10,20:26:03,鳥的故事有點做作。,2
1,1305690,阿飞正传,湄湄迩,rebcca,力荐,2008-05-23,21:05:35,无脚的小鸟 还有热带丛林中决绝而去渐行渐远的背影,3
1,1305690,阿飞正传,Настя,44987965,推荐,2020-10-12,00:01:20,看起来薄情的人 其实全都记得,2
1,1305690,阿飞正传,木柵永樂町,35778815,推荐,2019-11-06,17:08:50,太經典了！！！（編劇課 易智言老師反復提到這部，王家衛後來拍的都可以在這部裡面找到影子… ）,3
1,1305690,阿飞正传,柴斯卡,stscar,,2020-11-08,00:05:04,重看。东南亚的湿热从镜头里溢出来了。人生刻骨铭心的萍水相逢。“去年四月十六日下午三时，你在做什么？我一个朋友总是问我。”“你喜欢她吗？”“没有，朋友而已。”“如果你再见到她，请告诉她我都忘了…这样对大家都好。”“可她说不定把我也忘了。”但明明都还记得呢。,9
1,1305690,阿飞正传,铎奇,delmar,推荐,2014-04-26,11:13:20,张曼玉刘嘉玲二十多年前就开始抢男人了，为什么不直接来一发，最后end up with each other.,3
1,1305690,阿飞正传,夏多先生,xiaduosan,力荐,2020-10-19,13:55:58,"太酷了，真的，从头到尾每个镜头都让我着迷。
忘不了片头片尾镜头扫过热带雨林时的背景音乐，为了这个镜头，有机会一定会去一次菲律宾。",8
1,1305690,阿飞正传,Grey灰,4363723,力荐,2013-01-30,23:24:00,13.1.30:“看来我真的不适合看文艺片诶，又完全没看懂。。。不过张国荣真是绝代风华呐！”18.6.27 重映：13年写下那个评论的我是SB,2
1,1305690,阿飞正传,小川,channelallan,推荐,2008-02-22,17:54:13,差一点，拿不到五颗星,2
1,1305690,阿飞正传,南夏,156189005,力荐,2017-03-14,12:58:33,很棒，好看，看后心里面很舒服,3
1,1305690,阿飞正传,淡水无香,145706644,力荐,2016-05-21,11:29:18,影片中张国荣成功塑造了一位孤傲叛逆的浪子形象，精彩传神的表演让他成功摘得香港电影金像奖影帝桂冠，实致名归。,5
1,1305690,阿飞正传,Santé,trueGugi,推荐,2018-06-28,22:24:31,刘嘉玲太正！灵动可爱！能屈能伸！张曼玉剩一张高颧的脸。旭仔就是love disable。谁都是最爱，谁都不爱。,3
1,1305690,阿飞正传,♬ CaR,misscar,力荐,2018-06-25,21:37:20,王家卫拍出的都是那些人最好看的样子。很难想象这是快三十年前的电影。,2
1,1305690,阿飞正传,翠蝶🌸羽生✨💫,174056261,推荐,2018-06-19,15:07:46,王家卫的电影总是很特别，有点现实，有点阴暗，有点压抑，看完后心情会比较沉重，但是这就是现实这就是人性。,4
1,1305690,阿飞正传,饱肚师叔,joyjoy2,推荐,2012-11-02,14:22:10,谁都可以嫌弃你习惯没有你 但是你自己必须接受这样一个你这是逃不掉的＝。＝,2
1,1305690,阿飞正传,pengguangyi,pengguangyi,很差,2010-08-28,16:37:01,烂片,4
1,1305690,阿飞正传,Yes张嘉乐，三月是春光明媚的,yes.it_is_you,推荐,2012-01-30,15:48:29,我只是很浅显的看懂了两个女人被甩的过程，最后的梁哥哥是什么意思？,3
1,1305690,阿飞正传,Sabrina,15401327,力荐,2015-03-24,09:44:56,因为有了张国荣，王家卫就有了自己的风格。,1
1,1305690,阿飞正传,体育学院学会计,electronic,推荐,2018-06-26,22:59:17,九十年代的合成器配乐电影，不管调情还是打杀都一言不合就蹦迪，可爱。另外，刘德华真的很适合演喜欢教人做人的角色啊，张口闭口“做人最重要就是xxx”。,4
1,1305690,阿飞正传,lurker,4041788,很差,2010-02-16,12:45:43,实在看不懂..,3
1,1305690,阿飞正传,回忆与否之,148860881,力荐,2018-06-28,12:21:13,第一次看“阿飞”是什么时候，我记不大清了，只记得那时看得并不顺利，因为看的还是影碟，播到中途突然卡碟了，就被迫放弃了，之后一段时间也就忘记了。我第一次看王家卫是看《东邪西毒》，因为年轻，阅片量也少的关系，这部片子盘踞内心的首榜很长一段时间。直到我再看“阿飞”时，已经是对电影略有了解的人了，也因为“东邪”的缘故，我的期待很高，而它，那只无脚的鸟，丝毫没有令我失望。所有的一切从这里开始，所有的一切在这里结束。对于无脚鸟，我是敬畏、是惊叹，更是恐惧。我知道自己的局限，因而也做不到像他那样。他说他一开始便已经死了，可我觉得不是，因为我还在太多太多的地方见到他。他和他们，都挺耀眼的，无论开始，亦或结束。后来偶然看到一句诗，觉得很适合他:“那固执的背后 是满身的伤痕 掩不了的 是它的眼神 那眼神 孤傲的灵魂”,3
1,1305690,阿飞正传,万靖游,80932579,力荐,2018-06-27,21:30:32,终于重映的时候看了。王家卫最厉害的不是拍了阿飞正传，而是找了杜可风，以及一群现在的超级大腕一起做了个只属于他自己的梦。另外想不到董玮是这个电影的动作指导......,1
1,1305690,阿飞正传,橘猫爱吃鱼,169089788,力荐,2018-07-11,14:13:26,90年代经典港片，演员表演细腻，人物刻画入木三分。,4
1,1305690,阿飞正传,叉叉小箭猪,rollin,推荐,2009-12-31,05:23:38,梁朝伟疏头发,2
1,1305690,阿飞正传,doudou,50135797,力荐,2018-07-02,17:53:49,最惊艳的还是摄影。大荧幕上的大特写，摇晃的镜头，皮肤上的薄汗，狭小的房间，撕心裂肺的声音和磅礴的大雨，一切都饱含有太强烈的情感。,2
1,1305690,阿飞正传,砚小朵™,eiris,还行,2018-06-25,21:48:47,老片重映能不能做下修复，画面暗到不行，音效一言难尽。有意思的是，与记忆中的那部片子感觉完全两样，大概是因为我终于能看懂王家卫的运镜、调度和剪辑了。极压迫的双人关系镜头调度，忽略事件时间线卡着情绪点走的剪辑方式，其实并不闷，流畅且有感染力，在90s果然是不明觉厉的存在。,2
1,1305690,阿飞正传,barcamay,rmay,推荐,2012-04-15,01:17:09,我听别人说这世界上有一种鸟是没有脚的，它只能够一直的飞呀飞呀，飞累了就在风里面睡觉，这种鸟一辈子只能下地一次，那一次就是它死的时候,3
1,1305690,阿飞正传,Lin Nashty,177973991,力荐,2022-01-15,17:45:39,"22.1.15 上影香港电影展重看。
哥哥身穿白色背心舞着自由，伟仔梳齐头发整装待发",4
1,1305690,阿飞正传,0932313,mihalin,力荐,2008-05-01,14:17:21,the hotel,0
1,1305690,阿飞正传,amelin,145491130,推荐,2017-07-27,18:27:12,啊 张国荣跳舞好骚气啊,4
1,1305690,阿飞正传,一路有你,159192051,推荐,2017-05-06,23:54:10,只有哥哥演的浪子渣男，但是却恨不起来他。,5
1,1305690,阿飞正传,冬瓜,senor,力荐,2019-10-11,02:57:56,张国荣不愧为巨星之中的巨星。,5
1,1305690,阿飞正传,мая,25911106,力荐,2020-12-06,19:17:36,9，奠定王家卫风格的电影，虽然电影让邓光荣赔的一踏糊涂，现在在看王家卫承诺的枪战戏，其实董玮设计的还挺不错，后面爬房顶还挺有难度的。整体上基本上可以说王家卫一辈子拍的其实都是阿飞正传，无根的漂泊感，颓废下的情欲，关于寻找和归宿的主题，富有潮湿感的热带风情的音乐和影像，张国荣奉献了应该是华语影史90年以来最特别一个男主角的形象，看他跳舞真的太享受了。,9
1,1305690,阿飞正传,Prufrock的情歌,54332107,推荐,2016-12-11,10:54:08,相逢不过匆匆路过 来去好像一场梦 殖民主义的孤儿 你的心又在哪儿呢,5
1,1305690,阿飞正传,张未来,weilaipsalms,力荐,2010-04-05,00:47:02,最喜欢的王家卫片儿,2
1,1305690,阿飞正传,枚多梨酱,seaseaseagreen,力荐,2018-06-26,22:07:06,"窗外面飞过几十个小镇、几千里土地、几万个人，我怀疑我人生里面唯一相遇既机会
已经错过咗。
",2
1,1305690,阿飞正传,大大大大笨兔子,43498037,较差,2018-06-25,16:02:45,对不起，我看不懂王家卫,5
1,1305690,阿飞正传,鬼腳七,pedant,推荐,2013-12-28,21:43:34,阿飞也有江湖，阿飞也有宿命,2
1,1305690,阿飞正传,ONON.E,147374118,推荐,2018-06-28,11:01:04,我喜欢刘嘉玲那个角色  聪敏懂得什么时候低头 却还是陷得太深来不及收手 ,5
1,1305690,阿飞正传,血源2出了吗？,italy369,推荐,2010-02-01,20:00:31,4.5 这是飞片儿。。。。听觉满分。。。。。“要记得的总归记得的”,4
1,1305690,阿飞正传,隐二,chinb,,2008-03-22,23:04:15,星宿满天 各司其位,3
1,1305690,阿飞正传,jj73浅之,asano,力荐,2006-10-08,13:31:57,相隔12年再看，居然还是看哭，历久弥新。年轻的爱情世界啊，那么卑微又执着，真是迷人，明知折磨却选择更为痛苦地去对抗，看得我羡慕又怀念。突然枪战那场戏有点飞，当年的casting太好了，每个角色都那么那么可爱,1
1,1305690,阿飞正传,Qing,130208116,推荐,2017-01-22,15:55:08,这个阵容换着花样演电影都看不烦的,4
1,1305690,阿飞正传,双晚,181723763,还行,2021-09-19,00:54:41,B. 初见雏形的王家卫，但对于段落之间“感觉流”的操纵，还远没有未来的沉着魄力。在绿色构成的幽闭空间里，完成焦躁的情绪拼贴，电影本身也像它说的无脚雀一样，迷失在了这种紊乱中。,3
1,1305690,阿飞正传,Çhromosome,Chromosome,推荐,2011-07-26,10:38:44,哪有梁朝伟啊！？,2
1,1305690,阿飞正传,张翔森,zhangxiangsen,推荐,2022-01-15,00:25:49,梁朝伟出场的镜头是续集的伏笔，但，由于《阿飞正传》票房惨淡，续集流产，于是，这个桥段便成了累赘。,2
1,1305690,阿飞正传,穿馬甲的大狒狒,150990188,较差,2018-07-02,23:31:24,贡献了一张电影票，还好只要九块九。年代感是真的有，上海话是真的难听，张张刘刘是真的嫩出水，张国荣的撩妹技术是真的服气，文艺范儿也是真的感受到了，我也是真的理解无能…可能很年纪和阅历有关？不知道还能说啥，正好最后的结束和球赛有关，还是赶紧回家看球吧…,3
1,1305690,阿飞正传,爱情海,157237265,推荐,2017-05-07,14:19:01,是孤独照就了旭仔放荡不羁，随意和放纵。,3
1,1305690,阿飞正传,张老实,citizen82418,还行,2016-01-09,16:39:52,学习，可能将来会用到,8
1,1305690,阿飞正传,jessiezayns,jessiezayns,推荐,2018-06-25,21:43:18,王家卫的片子 我看不懂 但在菲律宾上楼的那个长镜头 挺有趣的,2
1,1305690,阿飞正传,①④,babylon14,力荐,2013-06-22,23:24:28,大屏幕上看好赞！！！,1
1,1305690,阿飞正传,bird,yihuiw,力荐,2012-12-18,06:45:15,所有人的脸。都青。（六年后影院重温 潮湿的巷道 执迷的无往之爱  旭仔自以为有飞翔的机会）太小说，太性感。,2
1,1305690,阿飞正传,U 兔,rubbitU,力荐,2010-10-20,13:27:20,我以为我看过这个片子，原来之前没有~一张张熟脸，但直到梁朝伟出现我才觉得突然才是认识的人。王家卫把每一个人都拍得美坏了。故事那么流畅，一点没有后期的刻意。如果7年之前我看这个片一定会哭，但现在我哭不出的。虽然很多电影中的角色相爱，但真正讲爱情的片子并不多，这是其中一部，而且还不错,3
1,1305690,阿飞正传,Tone调的悲伤,14161941,推荐,2018-06-25,15:56:45,世间再无张国荣,7
1,1305690,阿飞正传,UrthónaD'Mors,HiddenParadise,推荐,2018-07-03,16:42:58,"去年四月十六号三点你在做什么？
她告诉你的啊
要记得的我永远都会记得。",2
1,1305690,阿飞正传,傅踢踢,fudatou,力荐,2016-06-13,11:41:40,不回头的浪子，在常情里的人生,3
1,1305690,阿飞正传,下大垅,xiaojinlovelhy,力荐,2017-10-18,15:32:02,22岁第一次看张国荣的电影，也是第一次看王家卫的电影，看完之后觉得很压抑，然后一路上会思考很多问题。我想这就是一部好电影吧。,1
1,1305690,阿飞正传,陈轮,49673811,力荐,2012-09-06,20:22:22,哥哥是天生的戏子！,3
1,1305690,阿飞正传,䒳,dusk.xiyang,推荐,2017-03-10,22:16:04,还真以为自己是鸟啊。死傲娇之传。天王天后如此绮丽，风华正茂的年代。,2
1,1305690,阿飞正传,6:48,queenie39,力荐,2017-04-08,20:35:08,王家卫把张国荣最有魅力的特质全拍出来了,5
1,1305690,阿飞正传,艾伊达Ayda,146074764,推荐,2017-04-07,23:50:03,以前我以为有一种鸟从一开始飞就可以飞到死的一天才落地，其实他什么地方都没有去过，这只鸟从一开始就已经死了。,6
1,1305690,阿飞正传,橘 きよあき,yushi517,,2016-04-29,12:36:32,"2015-09-13 
我接吻去了 没看清",5
1,1305690,阿飞正传,Metaphor,144309115,力荐,2018-06-29,23:34:52,"潮湿绵长的雨季和棕榈林
无脚鸟和Leslie眼角眉梢都是戏
御用摄影杜可风偏爱的缝隙光影
透过闷迫的长镜头
与agfa胶片泛青的颗粒
还能够看见你该是有多幸运

#墨镜港片迷醉之夜",6
1,1305690,阿飞正传,醉舟,lavitelloni,推荐,2013-04-03,15:01:12,最后的一幕，令人有一种读博尔赫斯小说的感觉，真是奇妙的感觉。王家卫电影中的感情讲的是错过。只有错过，才有不舍，遗憾，延续。,3
1,1305690,阿飞正传,Odair,yizilee0715,力荐,2018-07-15,19:58:22,无脚鸟哪里也没有去，因为它早就死了。,1
1,1305690,阿飞正传,白马啸西风,autumnday916,推荐,2014-10-10,00:52:52,我和华仔的看法一样 所谓无足鸟的句子 拿来骗骗无知少女就行 说的自己都相信了 此人不是傻叉就是傻逼,2
1,1305690,阿飞正传,沉默の玩,chenmodewan,力荐,2017-08-12,12:12:07,重看。意义这样东西是不存在的，也没什么可找的，能留下些念想就好。,2
1,1305690,阿飞正传,Tangent,3529919,推荐,2015-12-28,19:14:52,同一个苏丽珍，阿飞不想要，周慕云得不到。,4
1,1305690,阿飞正传,虾坨坨艺仔,yancm,还行,2015-05-13,14:51:22,不喜欢王家卫，不喜欢一切沉闷而不流畅的影片。但是这片子看到好多年轻的容颜，刘德华那时候真是一个帅小伙。,2
1,1305690,阿飞正传,南京刘经理,89098041,推荐,2020-11-29,22:29:19,和我爹一起看的，我爹：这电影我年轻时和当时的爱人看的，刘嘉玲好美，现在没有那么好看的女演员了，也没有这样的好电影了，我的爱情也不在了！时代变了。（我：？？？,7
1,1305690,阿飞正传,伊豆,yidoudou,力荐,2008-01-24,11:47:02,电影里的很多台词，都被后来用作对哥哥本人的诠释。我觉得倒并不一定贴切。因为王家卫是独一无二的，而哥哥亦是独一无二的。谁能真正了解另外一个人呢？//20180625电影院重映打卡——她为了谁不再愿意想起“那一分钟”，而谁又为了她傻傻等在午夜街角的电话亭。,2
1,1305690,阿飞正传,Joy R.,lesliejoy,力荐,2013-03-25,15:29:06,对于＂世界上有一种鸟是没有脚的，它只能一直...＂这句话，以前只是有种朦朦胧胧的理解。之前看了一位网友写的影评后，更加深入理解了。 其实这个世上 亲母可以抛弃你、养母也可以离开你，其他所有人都可以不管你，只有你自己不可以抛弃你自己，若你太累，只能放弃自己生命来作为休息喘气的代价。,7
1,1305690,阿飞正传,飞行官小北,Francyslio,推荐,2010-11-28,19:49:22,美人儿。,2
1,1305690,阿飞正传,咸蛋超人,bll_bug,推荐,2018-06-28,21:55:22,洒脱到不在意身边的人，是不是自私到只爱自己。,1
