page_index,movie_id,title,username,user_id,rating,date,time,comment,useful_count
0,27180974,浴血广昌,涂涂涂～航西安,145694042,较差,2018-08-01,11:46:52,奉旨交差？,89
0,27180974,浴血广昌,针眼画师,51266657,力荐,2018-08-10,11:38:23,必须好评，我爷爷就是老红军，特别尊重他们那一代人。,46
0,27180974,浴血广昌,Monday......,167200257,,2018-08-01,11:13:23,大家都别骂了...拍这种片子根本不为票房.这是上级传达的政治任务！拍烂不怕，不拍犯错。奉旨烧钱.....,193
0,27180974,浴血广昌,carend,139688483,力荐,2018-08-18,16:11:25,我觉得挺好看的啊……一星过分了,28
0,27180974,浴血广昌,CRITIC,147492398,很差,2018-07-30,14:44:55,我们并不是反感红色，只是恶心那些披着红色外衣的劣质作品而已,334
0,27180974,浴血广昌,殒命个,99564931,还行,2018-08-04,12:01:03,你不喜欢导演可以，不喜欢演员可以，不喜欢特效可以，但你不能说恶心这种剧情，因为这些剧情是先辈用血肉书写的，历史就是历史，你可以不红不专，但是你不能否认革命先烈的奉献。,36
0,27180974,浴血广昌,河南Dj阿旭,162316928,很差,2018-08-01,04:36:03,不尊重历史不还原历史的作品都是垃圾,206
0,27180974,浴血广昌,野客,132292462,,2018-08-01,15:36:07,想讲述“中国的红色政权为什么能够存在”和“在错误路线下仍然维护中央权威的军队”，但电影讲述的模式跟“抗日神剧”没有区别，空洞的革命+恋爱、突兀的军民关系、虚浮的历史情境、无休止的炮火硝烟，我把这种艺术表现模式视作形式主义+历史虚无主义。,25
0,27180974,浴血广昌,kasy,150439711,力荐,2021-01-30,14:37:56,至少最后赖家留下了一个伢孙,0
0,27180974,浴血广昌,从依壑,149014355,较差,2018-08-22,03:03:48,难怪红军要进行长征，因为他们在34年广昌丘陵遭遇了一支装备着35年生产的中正式步枪，35年引进的M35钢盔，以及37年抗战苏联援华的T26轻型坦克，和租借条款中美对华援助的福特汽车的可怕国军，虽然他们战胜了来犯之地，但是因为扰乱了正常历史线，位面力量要修复历史，所以王明 博古 李德所领导反围剿最终失败了，位面之子花帅最终还是修复了历史！,52
0,27180974,浴血广昌,linxuan,54983933,推荐,2018-08-01,18:00:01,革命先烈永垂不朽！,20
0,27180974,浴血广昌,隔云端,88425462,推荐,2018-09-12,16:21:11,打一星的过分了，这电影和抗日神剧是完全不一样的，很严肃的表现了战争的残酷和民不聊生，特别是展现了错误决策下明知失败却仍然冒着炮火前进的悲壮。感情戏也很含蓄，在那个战火纷飞的年代就一个拥抱都很感人。还是希望这些反映革命先辈浴血奋战的严肃作品不要因为对政治任务反感而打低分吧，毕竟这部电影对zg也没有无脑吹对决策失误也是直接表现。,5
0,27180974,浴血广昌,阿默沫,MonicaSXY,较差,2020-10-02,18:48:42,在这国庆假期里中央六套播这种两党不合时期的“战斗”片，是不是有什么暗示……ಠ_ಠ,1
0,27180974,浴血广昌,芷菲鱼,10162011,较差,2018-09-14,17:37:12,就战争场面还值得一看。人物主线弱得不够串，钢盔坦克完全不尊重历史。特别时至今日，内战题材完全不讨喜。当然拍得最差的是《建军大业》，香港导演加小鲜肉不是来捣乱的简直是来搞笑的。,0
0,27180974,浴血广昌,鹿鹿鱼鱼,yuaryant,还行,2018-08-11,18:56:37,emmmm，政治任务完成得不错,4
0,27180974,浴血广昌,繁花将尽,nancyrither,还行,2019-04-23,10:36:46,还可以，拍出了高虎脑战役的残酷，也是长征的起点。,1
0,27180974,浴血广昌,Orlando,147673090,很差,2018-08-02,08:29:05,国军和国党也是中国人！,61
0,27180974,浴血广昌,苏斯洛夫,47034969,较差,2022-08-25,22:09:25,血战没体现出来，在主题以外的事情上着墨过多。,0
0,27180974,浴血广昌,HarperYug,161704364,较差,2018-08-12,11:35:43,好一部主旋律的电影。,0
0,27180974,浴血广昌,灿子,qidai12yue,推荐,2022-10-10,23:07:24,革命先烈永垂不朽,0
0,27180974,浴血广昌,半睡的猫猫,84355290,很差,2018-08-01,10:24:28,"趁八一这么庄重的日子，上这种喜剧片，合适么？
建议国家出几个写实的军人片。在现在这个浮躁的社会，军人还算是清流。而且我军创建还是很正大光明的，没必要为了体现正义合法，而胡编乱造。",43
0,27180974,浴血广昌,木·子鱼,121136115,还行,2018-08-12,09:47:08,又有红剧可以推荐活动看了,2
0,27180974,浴血广昌,御花园的主人,glandlord,较差,2018-08-09,16:04:31,我本来对这影片没什么意见但是想到要写观后感，对不起…看来也不是什么好片子,2
0,27180974,浴血广昌,微暗的火,163690904,很差,2018-08-10,22:26:16,可以刷票房，请别刷好评,22
0,27180974,浴血广昌,Nemo___,Yukimura___,还行,2018-09-13,00:30:30,单位组织看电影的第二场，因为前一场《信仰者》的触动，使我决定在晚上9点钟依然留下来继续看第二场，我们单位只剩我一人在电影院继续观看，也不知道上场电影能给他们在今后的工作中带来什么实际的改变，好吧，我知道不会有任何改变，依然撸起袖子假大空。回到正题，这部电影比信仰者就逊色不少了，初看以为是中国版的《拯救大兵瑞恩》，也是独苗存活系列，电影中一些不太现实的开挂情节和一些浅浅的情愫部分让人稍感不适，看得出来部分段落是在学习国外战争片已有的情节，但是处理的比较生硬（尬），三伢子牺牲那段稍有感动，五伢子、护士与国军那段处理的....可能是为了过审吧，总之不喜欢。虽然电影有美化我党的部分，但客观来讲电影本身绝对不能算烂片，国产黑和主旋律黑并不提倡，但每个人都有评判标准，求同存异，我觉得这部电影总体来讲：还行。,1
0,27180974,浴血广昌,狂飙柔情,69025447,推荐,2020-10-29,21:17:48,"1 对战场的激烈、慌乱、残忍、惨烈、瞬息万变和血肉纷飞这些细节表现得够劲儿。
2 战争的残酷，革命的艰难，百姓的支持，初心在这里。",0
0,27180974,浴血广昌,瓜子人,33290727,还行,2018-08-02,17:32:24,估计这电影票房全靠我市了。,3
0,27180974,浴血广昌,Chearyl,57032095,推荐,2021-10-08,18:52:23,不错其实,0
0,27180974,浴血广昌,Thriller,163715546,很差,2018-08-19,22:54:47,一天天没事跑出来洗脑，你觉得你骗的了谁？,20
0,27180974,浴血广昌,晃晃悠悠,1531818,很差,2018-08-20,17:35:06,只有昧着良心的人才能导演出演这种电影。,14
0,27180974,浴血广昌,李夸父,48604788,较差,2018-09-01,00:41:31,"20180831 新华银兴
部里组织教育，给vip厅加一星",0
0,27180974,浴血广昌,黄大豆,tonhyuk3507,很差,2018-08-06,16:56:00,中心八一组织观影，忘记自己怀着小馒头了。 ,10
0,27180974,浴血广昌,Stfind,161583160,还行,2018-10-23,11:52:18,五伢子成长记。,0
0,27180974,浴血广昌,雨芒,76583939,,2019-03-08,16:17:58,看看这犹如小学优秀作文一般的简介就知道拍的是什么货色了,1
0,27180974,浴血广昌,好像一段呆木头,87820457,较差,2020-10-02,23:13:39,长征前反围剿作战的时候，牵制敌军，诱骗佯装主力的部队，你们都是英雄。只不过本片是在歌颂想象中的那些形象，主创根本不信，完成任务罢了,0
0,27180974,浴血广昌,千夜灬恋歌,146473563,很差,2018-08-23,22:01:40,在影片里1934年中国政府为了学习汉景帝攘外必先安内的错误做法，下了极大的力气不但穿越时空装备了大量未来武器，还大力保障军用储备，政府军人手一枪，弹药充足，坦克开道，军车代步，颇有摩托化的雏形，在拥有如此巨大优势的情况下在广昌中国政府军还是以2626人巨大代价击毙击伤5000余枪支弹药匮乏的敌人，充分证明了中国军事委员会委员长蒋中正的政策是错误的,13
0,27180974,浴血广昌,老天使,27622305,较差,2020-10-29,21:53:46,特像美军洗直升飞机,0
0,27180974,浴血广昌,伯昏,142831011,较差,2021-05-01,20:11:13,不知何以然，如何能讲好故事,0
0,27180974,浴血广昌,晴空,139015526,很差,2018-08-01,14:04:06,导演怎么说也是拍过龙之战的  怎么还拍这么烂的电影,13
0,27180974,浴血广昌,六元李美,44802446,还行,2018-08-15,18:39:40,院线，广昌。其实战争场面还是不错的啦，就是剧情比较弱。冲着我爸的群演生涯我觉得能值三星半。,3
0,27180974,浴血广昌,[已注销],48631051,还行,2018-10-05,21:45:38,幸福生活来之不易，在无可依靠的时候更容易产生爱情。,0
0,27180974,浴血广昌,章打结,151368747,很差,2018-08-20,00:22:56,这片子真牛，都一个月了，天天不多不少二百万上下的票房。,7
0,27180974,浴血广昌,你管,2922533,推荐,2018-08-22,17:11:19,支持大抚州 自己的电影  制作精良,2
0,27180974,浴血广昌,Fuji Syusuke,159449595,很差,2018-08-01,21:38:44,现在的编剧和导演真的还知道什么叫历史么？,10
0,27180974,浴血广昌,一剑,2009762,很差,2018-08-25,08:33:37,怎么说呢，还是不说了，,5
0,27180974,浴血广昌,红夜星火,168032121,很差,2018-08-15,08:50:08,还能说些什么？,2
0,27180974,浴血广昌,张国荣,174589962,很差,2018-08-03,14:36:30,感谢革命先烈为了信仰，不畏艰苦、不怕牺牲，换回我们今天太平的日子,3
0,27180974,浴血广昌,正版一衣带水,79149597,,2018-08-10,11:48:20,拍这电影，一通爆炸冒烟点火的，就想问问环保部那怎么通过的,0
0,27180974,浴血广昌,贝贝9503_48148,150553825,较差,2018-08-03,19:13:15,虽然是福利片的，但是能不能拍的稍微用点心。这种片花钱雇人都很少有人会浪费这个时间。一个星给暴力血腥残酷的现场，还原的还算真实，一个星就当做票钱吧。,2
0,27180974,浴血广昌,安静的山茶花,84922944,还行,2018-08-13,17:15:18,剧情太散而且真实性不足，比较缺乏深度。,0
0,27180974,浴血广昌,DramaEva,173103349,较差,2020-08-10,12:31:01,哎五伢子就是来捣乱的,0
0,27180974,浴血广昌,Mus劉寅,135650574,很差,2018-08-13,02:52:09,大清亡了，日本翔了，能好好拍战争片吗,2
0,27180974,浴血广昌,时光待我如旅人,154528194,很差,2018-08-01,19:26:01,铁血柔情？别几把扯淡了。,4
0,27180974,浴血广昌,rune1121,41036146,很差,2018-12-23,12:49:03,中华俄国议会共和国，成立于1931年10月江西瑞金，仅仅在918事变过去后不到3个月。1932年2月，伪满洲国成立。两国对国民党反动派成南北夹击之势。。之前真的没通气？？？,2
0,27180974,浴血广昌,AUZOE11,fantasticFancyZ,还行,2018-09-20,12:51:03,单位组织看电影。自己人打自己人为什么拍的这么起劲？？？？跟打僵尸一样。,1
0,27180974,浴血广昌,BAzINGA,155729531,很差,2018-08-01,22:50:03,完全不尊重历史，也没有展现出我们的军人风采。拍这种教育片干嘛不拍好一点，让更多的人看到呢？现在质量不行，又有多少人会去影院看呢？,7
0,27180974,浴血广昌,对方正在输入...,155479190,很差,2018-08-31,16:46:24,21世纪都快过去20年了，大陆的导演还在热衷于内战题材，丢人,3
0,27180974,浴血广昌,武器大师,167128929,很差,2018-08-03,19:07:39,国军也是打鬼子的英雄，却一直被边缘ob者嘲讽,5
0,27180974,浴血广昌,李头涛子,170529919,较差,2018-09-17,22:51:17,学校组织看的，电影还是老毛病，不说了；但观影体验很棒，坐阶梯教室里和同学起哄，不用挨批；这部电影竟然还有一点点基情和虐单身狗的场景；不过男女主都死了真的狗血，没意思～,1
0,27180974,浴血广昌,维多利亚的咪咪,54519295,很差,2018-09-11,07:04:50,给五星的收了谁的钱了？把转账记录拿出来看看,2
0,27180974,浴血广昌,花忆冷,43459920,还行,2018-08-08,20:04:25,作为大抚州人民还是要支持,1
0,27180974,浴血广昌,捕风虚空,162718552,较差,2018-08-01,23:15:18,相当赞的抗战影片，我一直好奇当军人不准拍电影后抗战片该怎么拍出那种战争场面，本片用另一种视觉给我了答案,3
0,27180974,浴血广昌,有志青年,168057232,很差,2019-03-09,11:12:43,真尼玛不要个逼脸，2018年8月份上映的，现在都2019年3月了，还有排片，还没下映，你还不如重新放文革那会儿的样板戏呢,3
0,27180974,浴血广昌,涅凤,53316188,较差,2018-08-29,19:51:07,党组织教育,2
0,27180974,浴血广昌,狗,171465600,较差,2018-09-22,11:51:17,"战争场面非常真实
丑化国民党的场面看的很不舒服
学校组织全校学生看的，算是政治任务吧。
",0
0,27180974,浴血广昌,不能独处的女人,101860430,较差,2018-09-29,09:41:24,其实还行，坐在最后一排偷偷抹眼泪,0
0,27180974,浴血广昌,轩辕漱河,54807057,很差,2019-01-13,03:39:55,very bad,1
0,27180974,浴血广昌,Agamemnon,138724776,很差,2018-08-22,01:15:17,又一部魔幻现实主义打黑扫恶失败的电影....都21世纪了，都21世纪了！,1
0,27180974,浴血广昌,当坐道场,191024988,较差,2022-12-29,19:02:20,"委座开会要求国军整肃军纪，爱护百姓？？？？这是什么神剧(ㅇㅁㅇ川连基本史实都不顾了！
一将无能累死三军，临时中央人菜瘾大，最后用十万红军和数百万苏区百姓的命给他们买单。
红军扩军，直接给各营扩军一千的任务，必须完成（实际很困难）只能硬拼，不能改变任何战术。想起工作以后的各种阴影，让你去送死不讲理啊。
五伢子人菜瘾大，非要当兵，去了部队直接吓傻，还不愿意回家，唉。
五个孙子，看了一半，已经死了三个了，不知道最后能不能留一个。部队能这么干嘛，小孩子不懂事，部队首长也不懂事啊，非要让人家死绝吗？
三伢子的春天来了，不知能否善终。",0
0,27180974,浴血广昌,恶魔的呼唤,73192399,很差,2018-09-07,14:42:40,侮辱历史,1
0,27180974,浴血广昌,书翎,191176158,很差,2021-09-23,20:47:42,学校按着头看的,1
0,27180974,浴血广昌,hyy,212938112,很差,2022-09-20,21:41:35,什么垃圾，侮辱历史，侮辱英烈。,0
0,27180974,浴血广昌,神乐,4524238,较差,2018-08-13,13:55:17,小何医生跟三伢子说 我在高家脑等你 我心里一紧 心说完了,1
0,27180974,浴血广昌,zolker,52014785,很差,2018-08-30,22:48:21,例行,0
0,27180974,浴血广昌,西兰花,88243971,,2018-09-29,20:49:16,为了完成工作任务来看这部电影，还坐得住，就是那个战士徒手掰断刺刀的瞬间把我惊呆了。,0
0,27180974,浴血广昌,吐司吐的丝,64720551,还行,2018-08-05,13:46:00,好奇看了一眼，其实拍的还行，抛开内战正确与否，战事里人为草芥的真实感对我来说其实比战狼要好。另外，拍摄地为我的家乡，山清水秀，东西好吃，接天莲叶无穷碧，欢迎大家来广昌看莲花。,1
0,27180974,浴血广昌,阿司皮林,48916211,很差,2018-08-09,21:22:06,公司组织看的爱国电影，拍摄手法其实还好，但是剧情实在恶心人。,4
0,27180974,浴血广昌,神圣的羊驼,155888784,很差,2018-08-01,17:29:08,开始格局还挺大 结果越拍越小,2
0,27180974,浴血广昌,star猫咔f♥xd,48642745,较差,2021-02-19,23:09:42,这个题材的片总能赚到我几滴泪，但是真的无法理解为什么总需要有个女性圣母地不允许红军或好人杀残存的敌人，然后再挣扎中被人家开枪毙了？！！！只剩这种表现手法才能实现所谓的升华吗？求求了，尬得我四肢蜷缩,0
0,27180974,浴血广昌,tier,153201673,还行,2018-07-24,16:22:57,看了点映，来自广昌原住民。,1
0,27180974,浴血广昌,夕暮,47964408,还行,2018-08-24,12:51:00,唱响红色主旋律，不忘革命先辈的浴血付出。,1
0,27180974,浴血广昌,邬峰想雕刻啊,WuXFeng,还行,2020-10-02,19:11:13,抗日电影也没这么激烈，打老蒋打这么激烈，为了突现红军？,1
0,27180974,浴血广昌,打倒列强除军阀,172805308,很差,2018-08-01,23:15:44,棒，太棒了！这真是我暑假间的最牛逼的电影，不看简直亏了,6
0,27180974,浴血广昌,吃鲸！,163868614,很差,2018-08-27,14:01:50,少一点类似的劣质作品吧真的。这样下去人民记忆里的红色都是这样严重垃圾的电影要历史干什么？,3
0,27180974,浴血广昌,小蚊子兮兮,47827131,还行,2018-08-20,12:29:03,很小的一场战役，伟大历史革命主旋律纪录片。,0
0,27180974,浴血广昌,གཡུ་མཚོ། 玉错,181458244,,2019-11-11,22:08:16,翻译挣咖啡钱…,0
0,27180974,浴血广昌,lofty11,161676495,很差,2018-08-22,23:08:07,意料之中的垃圾玩意,0
0,27180974,浴血广昌,叫我宝贝好吗,167580420,很差,2018-08-01,22:30:57,抗战片看多了后就腻歪了,4
0,27180974,浴血广昌,花小猪,153126225,很差,2018-09-02,18:39:46,这电影，呵呵,0
0,27180974,浴血广昌,梅菲斯托,209934502,很差,2022-06-21,12:33:19,不要再消费内战了。又不是打日本畜牲，拆了百姓的祠堂还要炸了百姓的百年老桥，导演和编剧真是傻叉。,0
0,27180974,浴血广昌,我改个名吧,151625133,很差,2020-08-06,15:10:42,烂的一塌糊涂，我给一分都不足以表达我的愤怒,1
0,27180974,浴血广昌,爱看电影的老灯,220383176,很差,2021-06-05,20:35:34,看见片头八一电影制片厂特亲切！可上来就拿着大砍刀冲向坦克，然后血浆四溅。。。晕๑_๑打败仗没关系，用用脑袋。。。,0
0,27180974,浴血广昌,失真,182469905,很差,2018-08-22,00:04:33,是时候给韭菜们洗洗脑了。,0
0,27180974,浴血广昌,糖精,137938845,很差,2018-08-20,09:18:00,不能打负分吗,1
0,27180974,浴血广昌,Ayin,120166641,较差,2018-09-22,10:35:58,组织全校一起看的 热热闹闹的场景 我却觉得孤独,0
0,27180974,浴血广昌,陈默,141695358,还行,2021-02-06,23:19:37,看到一半我只想说 五伢子你就是来拖后腿的吧！,0
0,27180974,浴血广昌,天下罢唱,174057690,很差,2018-09-05,09:44:24,相信我，明年的8月1日还会有此类型片上映~,1
0,27180974,浴血广昌,你这个呆子,170722425,还行,2018-09-13,13:06:12,跟组织去看的，其实也没那么差。三伢子死了我有点心疼，何医生其实不用死的，剧情还是弱了点。,0
0,27180974,浴血广昌,安安安安安啦！,143022970,很差,2018-08-01,21:09:15,这部电影太烂了！！！,1
0,27180974,浴血广昌,alucard0333,238631600,还行,2022-06-21,12:36:17,cctv6出品。。。正好午饭时间看了一会。。女主死的太冤。。,0
0,27180974,浴血广昌,今天开始做馍王,51277204,很差,2020-11-07,23:52:53,居然在微博看见有人拿这部片子踩八佰（手动点蜡,1
0,27180974,浴血广昌,月光尘埃,Angela220,很差,2018-09-18,01:05:50,单位组织看的三场爱国电影里最难看的一部了…为了剧情冲突（煽情）强行弱智的桥段真是让人受不了。,0
0,27180974,浴血广昌,Stephen Wu,180736975,较差,2018-08-01,10:14:14,既然是历史纪念片，拍的符合历史一点好不，至少拍好点啊。感觉这是在借革命历史在消费观众啊？,2
0,27180974,浴血广昌,SamoyeD-Boy,155625157,,2021-06-05,20:38:49,卢秋红演的何书瑶牺牲的好可惜 | 其实也可以看成是中国版的《拯救大兵瑞恩》，最后只剩五伢子活了下来，连准嫂子都为他牺牲了。,0
0,27180974,浴血广昌,L,168568703,很差,2020-01-25,14:06:19,学校推荐去看,0
0,27180974,浴血广昌,醉墨染,207784651,很差,2020-05-27,10:19:13,这片还有1亿票房，也是可以了,0
0,27180974,浴血广昌,冰雪魔鳕,197865383,较差,2022-06-23,22:36:08,真正的先烈永远比电影里的角色更加有血有肉,0
0,27180974,浴血广昌,Watson,156976406,很差,2018-08-04,11:38:17,恶心的情节,1
0,27180974,浴血广昌,风影两相随,174187627,还行,2018-08-05,13:30:33,战争场景血腥度是够了，真实性不足。剧情比较散，缺乏深度。,0
0,27180974,浴血广昌,Ner92,126020981,较差,2021-01-28,15:44:04,明明是一个正能量红色电影居然拍成穿越剧。国军装备这么精良，日本人居然还敢进犯我大中华，简直是蚍蜉撼树、以卵击石、螳臂当车、自掘坟墓，历史时间线一下在这部电影里全部崩盘了，估计在在导演的时间线和科技树里应该广岛长崎的原子弹是国军投的。,1
0,27180974,浴血广昌,顾得白,172619275,较差,2021-09-28,19:50:30,我所能做的也就只有去书里翻看对这段历史的描写，也许不尽其实但值得了解。,0
0,27180974,浴血广昌,关念ヅ,Gnblink,较差,2018-09-24,14:40:07,虽然学校组织的，但没有想象中烂，一分有点过分噢。拍摄手法很成熟，一看就是科班出身拍的。演员也还可以。至于为什么内容这么空洞，剧情这么俗套，....。,1
0,27180974,浴血广昌,啾啾啾啾啾,121874467,较差,2018-08-17,09:36:36,一个死活不让炸桥最后自己炸了桥的顽固老头，看了我都想打人,0
0,27180974,浴血广昌,煎饺大王,139071710,很差,2018-12-16,11:16:07,烂就一个字，哪里都烂,0
0,27180974,浴血广昌,山矾与余,210412772,较差,2022-12-29,19:39:33,😅,1
0,27180974,浴血广昌,旼穆😉,174513098,很差,2018-08-03,23:50:18,这么烂的片子活该没有排片,1
0,27180974,浴血广昌,热热热,168251679,较差,2018-08-12,12:41:15,太多类似情节，腻了,0
0,27180974,浴血广昌,天下熙熙,141676717,很差,2018-09-19,18:25:46,0分！！什么烂片.美化战争、丑化人性。有些人眼里看到了“正义”。但相信更多人看到的是中国近代史的荒诞和悲凉！,1
0,27180974,浴血广昌,笔杆怪兽,156432623,很差,2018-11-17,23:10:59,学校组织看的，只能说，红军真不容易。,0
0,27180974,浴血广昌,永恒的瞬间,179935134,很差,2018-09-13,18:59:51,学校组织去看的，全程想吐，这么烂的片子，你觉得有意思吗？,0
1,27180974,浴血广昌,雨过天晴,183769025,力荐,2018-08-28,18:53:32,看过这部电影，拍得真好！,2
1,27180974,浴血广昌,建丰,183574552,力荐,2018-08-25,09:39:40,单位组织看的，拍得挺好。电影有丰富坚定的革命信念，也有坚若磐石的革命情谊，从时代发展进步中，我们砥砺前行，不畏艰辛，紧跟时代步伐，继承革命意志，值得回味！,3
1,27180974,浴血广昌,醉人醉语,181530624,推荐,2018-08-02,17:11:31,战争很残酷，和平很珍贵，珍惜现在的美好生活。在八一看到这样的电影，向军人们致敬！,1
1,27180974,浴血广昌,尧勇,183940482,力荐,2018-09-01,12:39:43,是一部很好的红色影片.值得大家观看.,0
1,27180974,浴血广昌,九三,183791611,力荐,2018-08-29,09:09:46,好看,0
1,27180974,浴血广昌,豆友183919283,183919283,力荐,2018-08-31,20:15:52,红色体裁，好电影,0
1,27180974,浴血广昌,张小靓靓,184030188,力荐,2018-09-03,08:52:38,“长叹息与掩涕兮，哀民生之多艰。”银幕上，回眸那段惊险而又激动的岁月，我感受到了那个时代的气息，点点滴滴。随着先辈的足迹，让我仿佛也置身其中了。那个年代，在江西老区把自己的孩子送去参军，都不抱着生的希望。而他们却义无反顾的做了，只为了一个信念，只为了和他们一样的劳苦大众能过上太平安定的生活。“人民”在大是大非面前，是团结的、奋进的、经得起磨练的。,0
1,27180974,浴血广昌,昨夜星辰恰似你,183752661,力荐,2018-08-28,13:19:50,剧情很棒，值得一看,4
1,27180974,浴血广昌,想想,183844459,力荐,2018-08-30,10:45:39,展现的是国共战争的故事，为民族之兴亡而奋斗。,3
1,27180974,浴血广昌,小宸,183169373,力荐,2018-08-19,16:03:54,很好的一部电影，战争题材的，我个人还是比较喜欢,1
1,27180974,浴血广昌,考拉💭爱糯米团,184032359,力荐,2018-09-03,10:10:21,必须好评，江西发展得越来越美X，越来越好,0
1,27180974,浴血广昌,a  little more🔆,183760926,力荐,2018-08-28,16:01:17,不错的电影，主旋律电影！！👍👍,2
1,27180974,浴血广昌,符号逻辑,183205287,力荐,2018-08-19,16:19:57,陪我妈看的，很有历史感的电影，我妈妈很喜欢看，5星,7
1,27180974,浴血广昌,无语QAQ,209649724,很差,2020-01-25,01:16:19,辣鸡,0
1,27180974,浴血广昌,扎西才让(廖老师,203502847,力荐,2020-05-18,08:52:37,拍的比建军大业好，小成本（7000万）已经很不错了！值得推荐,0
1,27180974,浴血广昌,昵称.,180807725,,2018-08-29,21:03:56,回顾历史。,0
1,27180974,浴血广昌,穿真引线,173436145,还行,2018-08-15,15:47:39,胜利，是由无数的牺牲构建的。影片中对战争带来的残酷流露无疑。,4
1,27180974,浴血广昌,乂,183690324,力荐,2018-08-27,10:38:02,必须好评，特别尊重老红军那一代人。,7
1,27180974,浴血广昌,豆友183754877,183754877,力荐,2018-08-28,14:14:58,我们不能忘记先辈,5
1,27180974,浴血广昌,小希萌,183750981,力荐,2018-08-28,12:44:08,这个影片看的热血沸腾，心潮澎湃，想一下我们现在幸福的生活是多么得来不容易。,5
1,27180974,浴血广昌,嘟嘟,183537387,力荐,2018-08-31,20:26:29,很有意义的主旋律战争片，支持,0
1,27180974,浴血广昌,豆友小鱼,183558017,力荐,2018-08-31,19:24:25,战争场面很真实,0
