page_index,movie_id,title,username,user_id,rating,date,time,comment,useful_count
0,27119292,大三儿,茱茱,piggyjane,较差,2018-08-21,09:14:35,真的不太能代入的擺拍...,1
0,27119292,大三儿,lixunhuan,1083626,推荐,2018-08-22,14:25:06,虽然有摆拍之嫌，但胜在接地气儿又幽默，国产纪录片往往爱拍苦大仇深的题材，这种充满人情味儿烟火气息的纪录片值得赞赏。,2
0,27119292,大三儿,LoudCrazyHeart,72086305,很差,2018-11-08,12:45:20,结尾大三儿留给父亲的“遗书”写道：为了去趟西藏找同学借了6千块钱，万一自己出意外希望父亲能把这笔钱还上。还叮嘱千万不要埋怨别人，都是自己的决定。你自己去完成自己的梦想，然后把借钱的残酷现实留给别人来负担，这是不负责，是幼稚。而且这种对父亲的不理解非常根深蒂固，既然觉得自己是父亲的心病，了却心病的方法不止一种，你选择不给父亲任何说明的方式，我觉得过于自私了。这跟你身心有疾患有关吗？,2
0,27119292,大三儿,瘸猫仙,1468571,力荐,2018-08-22,20:43:47,光看318国道的美景都值回票价了，更何况还有有意思的人和事儿呢。,2
0,27119292,大三儿,郑撕撕,zyj19950411,推荐,2018-07-19,17:55:39,前面半小时有点太散，之后逐渐渐入佳境。可能插入的一些镜头和音乐的铺排让整个电影纪录的属性被削弱了，虽然的确可以煽起情绪。而且侏儒患者想要去看珠峰本身就是一个挺有戏剧性的前提。普通观众应该还蛮喜欢的。,2
0,27119292,大三儿,Frances,YD15527720820,还行,2018-08-20,20:52:49,和肖能 第二次看电影睡着。,1
0,27119292,大三儿,余小岛,missixyujun,还行,2018-08-20,22:23:13,就纪录片而言，摆拍的痕迹，双机位摄影，配乐放大化，采访式的表达，都不太合格。。但是胜在人物的有趣和精彩，真是天生的优秀题材。身材矮小，却内心强大，不卖惨不说苦，从一个普通人的角度来做一件想做的事，很真实、很好。小人物也可以闪闪发光。,2
0,27119292,大三儿,无机客,tensor,推荐,2018-08-20,13:52:46,有感人段落，插曲挺好。对大三的老父亲最想落泪。希望三儿能再成熟一点，戒烟，少买彩票，别让老父亲帮他还借款，最后，如果可能的话，带老父亲再回一趟四川，甚至考虑长住那边。说实话，三儿其实还有机会去西藏，老父亲撒手人寰后，顶多是骨灰回到故土了……,1
0,27119292,大三儿,与碟私奔,1305791,还行,2018-11-06,22:03:34,考虑考虑去一生一次的地方,0
0,27119292,大三儿,薇羅尼卡,zishuiyilan,还行,2018-12-03,09:29:25,导演意图有点大的“伪”纪录片，因此没有旁白的部分明显好看很多。三儿的梦想实现了，多好，至于那些非要胡乱bb的人，给他们一个国际化的手势吧🖕，然后平平安安回家来。,1
0,27119292,大三儿,局外人psy,59739922,还行,2019-01-26,12:26:15,热评说的没错，导演电视纪录片制作思维很重，部分镜头摆拍明显，而且时不时的金句总结，有过度灌鸡汤嫌疑，生活的深度也挖掘不够。除了这些看的时候还是内心暖暖的，常常会心一笑。大三儿是个眼里有光，心里有数，干事有谱的人。,3
0,27119292,大三儿,鱼剑,yujianmovie,较差,2022-04-26,19:14:03,姿态和视角都是平等的，但拍摄思路和方法上感觉有些做作…,0
0,27119292,大三儿,雪,1282175,,2018-11-07,08:22:10,高高兴兴朝圣，平平安安回家,0
0,27119292,大三儿,季轩,3588917,还行,2018-11-05,00:19:52,快速的剪辑和大量的内心独白，其实是对影像的不自信。如果不把它当成个电影看待，想到大三儿这个人物，真诚而亲切，又觉得这片挺好。,1
0,27119292,大三儿,汪金卫,longzheking,还行,2018-08-14,23:24:28,人物类纪录片。讲述东北小城赤峰，一个身体条件特殊的小人物努力完成去西藏之梦想的故事。既反映出东北工业厂子衰落的社会背景，也记录了一群被大众忽视群体的生活和心态。并且隐隐透出主人公家庭往事中的沉重悲剧与负担。但导演没有深挖这些，而是选择展示励志与正能量。主人公普通而平凡，其朴实真挚的话语、乐观执着的信念确实动人。电影前半段剪辑略碎，煽情音乐画蛇添足。或许是导演此前主要拍电视纪录片的缘故。三星半,0
0,27119292,大三儿,突击君,150146177,力荐,2018-11-12,00:34:30,朴师傅再为该片升华《空帆船》，已经足以说明此片的价值了，像是水一样，在我们的平常的生活中不足为奇，甚至浪费她，然而到了沙漠我们又感到她的金贵，渴望她、赞美她是生命之源。能将这世间之悲之惨化作平凡，还能戏谑调侃之人，应称之为巨人。,2
0,27119292,大三儿,苏黎世的列车,christan1987,推荐,2020-01-18,16:16:35,“他们结婚对我一点没有刺激，爱情这种东西可遇不可求，我想要的对象是那种，她也是完美的女人，我喜欢她，她喜欢我，早上我们各自分开去上班，晚上回家之后我们一起说话聊天，饭后我们一起出去遛遛弯 散散步，她会用感情温暖着我，我也会用我的一种感情去温暖她，哪怕日子过得清淡，我和她也能携手看夕阳。这种感觉，或许我试过，或许我也动过心，只能说有缘，没有结果，”------大三儿,0
0,27119292,大三儿,[已注销],158849931,较差,2018-11-07,14:44:58,感觉导演和大三儿之间没有形成一种应有的契合度，像档电视台的访谈节目而不是纪录片。充满设计感的剧本框架，旁白猛灌鸡汤，去西藏的故事也没有很打动我,1
0,27119292,大三儿,Chris  一切由无聊开始,sniperchris,推荐,2018-10-08,14:19:19,感觉整个片子的拍摄素材并不多，而且拍摄时间也不长。所以前半截，只有很少的场景，很多的自述，仅有的材料被努力剪辑起来，想让观众感觉到还算丰富。后半段很有意思，主角也是自带喜感，自带剧情。这个旅程可能真正的成本也有人掏钱吧，看到汽车赞助商。大三儿自己的魅力被很好的展现，无意流露出的东西反而成为片子非常珍贵的点。导演很有数，片子节奏也被推动得很好，都像剧情片了。,0
0,27119292,大三儿,别闹,146527967,力荐,2018-05-20,18:42:08,敢动，感动,5
0,27119292,大三儿,小A,AngelinaAnne,推荐,2018-08-27,22:09:59,大三儿这人挺有意思，说话一直甩梗。赤峰人独特的口音也增色不少。素材对了，形式上不用很花哨也能做出有意思的纪录片。之前看邵攀大侠的BIKE与旧电钢也是类似的感觉。,1
0,27119292,大三儿,Panda的影音,PandaMovieMusic,还行,2018-11-15,13:48:06,因为「朴树-空帆船（电影《大三儿》灵魂宣传曲）」而观影！→ 朴树不要版权费为导演录制宣传曲。—— 创作背景：佟晟嘉表示，电影的主人公大三儿是他自己的发小，他有着中国当下很多人面对的处境和可能性，这让他萌生了以大三儿为主人公拍摄纪录片的想法。而对于去西藏的故事，佟晟嘉表示，一开始他们并没有想到要去，只是突然生出这样的念头。当时就想，去得成可以拍，去不成也可以拍，因为无论如何，这都是大三儿的生活。他就是想把对世界的看法传达给能接受、能懂的人。拍摄地点：从内蒙古赤峰，到西藏布达拉宫，再到珠穆朗玛峰大本营，历时4年，跨越5000多公里的行程和每天15小时的拍摄，导演佟晟嘉最终记录下主角大三儿真实的心路历程。,0
0,27119292,大三儿,支离疏,zntoborges,还行,2018-11-06,15:18:48,不太行，是导演的感受问题。大三儿怎么文绉绉的，也许导演给设计过台词。还是不少生硬的人为痕迹。,2
0,27119292,大三儿,Jeannels,jeannels,较差,2018-08-19,17:48:02,2.5。导演掩盖不住一颗想玩摇滚的心啊，于是把这趟旅程拍成了MV。抒情过头，编排过度；梦想万岁，质感廉价。,0
0,27119292,大三儿,大圆满,bigbigoal,较差,2018-09-01,21:37:23,这部片子的核心是大三儿试图冲破重重“阻挠”去西藏，但是，导演刻意隐瞒了后来有了赞助商的事实，核心直接被摧毁了。甚至片末大三儿在自己遗书里提到的借了别人6000块钱才能去西藏变得毫无重量，借与不借，似乎都是可能的。既然导演已经介入被拍摄者生活，大方承认帮忙找到赞助又能怎样，拍我一个片子，圆你一个梦想，总好过对核心事实的刻意隐瞒。,2
0,27119292,大三儿,大隐于是,130687315,还行,2018-11-11,23:14:29,题材好，拍摄剪辑都很不好。主人公的精神值得嘉许，但是电影真的不好看。,1
0,27119292,大三儿,451½°F™,wanger0619,还行,2018-12-11,20:19:02,看一个「身残志坚」者前往西藏「圆梦」的纪录片，在平和细腻的情感下有一丝讽刺「正常世界」的狡黠，恐怕更多是观众对于自己「心灵」的某种映射，鸡汤或者反鸡汤如今对于很多观众都极度敏感，容易造成单纯的生理反应和过分解读，其实最简单的解读就是最好的方式。,0
0,27119292,大三儿,林大俊,linxiaoge,推荐,2018-08-20,17:03:59,"想起十六岁的时候站在十渡蹦极跳台底下，那时候我眼睛已经八百多度了，我爸我妈我三个人都特别纠结，虽不是生死大事，可对于高度近视来说跳一下就是人生一件大事儿,万一视网膜脱落呢？脱落了手术不一定能贴回去。总之就是站在那里看了一个多小时，后来放弃了。今年夏天又去了一趟十渡 站在蹦极跳台底下，眼睛已经1300度了。有些事那时候不做以后确实是更没机会做了。我是这样理解大三儿的",1
0,27119292,大三儿,子戈,philaro2009,还行,2018-08-22,19:53:11,"大三儿不信命。
虽然嘴上没说过，但做的事，都是不信命的。
他的两个哥哥，都死于车祸。可他却要驾车行驶近5000公里，去西藏。
他在赤峰的工作，是清扫阶梯；他到拉萨，是要登上通往布达拉宫的阶梯。
他是个有身体残疾的矮人，却一心想去最高的珠穆朗玛峰前。
没有人觉得他会成功，可是最后，他成功地从西藏回来，又过上了从前的生活。",1
0,27119292,大三儿,abru,nilreb,还行,2018-09-16,09:43:25,不像纪录片,1
0,27119292,大三儿,巴喆,jeffersontang,推荐,2018-11-12,17:11:45,好多时候我都不知道我为什么出发去那里，大概只是因为那里是远方。7.6,0
0,27119292,大三儿,不忘,49057955,推荐,2018-08-26,22:01:36,谁都有想做的事儿，感谢支持自己给自己力量的人，而不是那些问自己“为什么要这样”的人。,0
0,27119292,大三儿,超人叔叔,chaorenshushu,推荐,2018-08-16,23:13:56,抛开怜悯和窥伺 用一个平视的视角展现这场独特而又平凡的公路之旅,0
0,27119292,大三儿,huyouyou,huyouyou,推荐,2018-11-24,15:34:45,我觉得陪大三儿的那位瘦瘦高高的朋友是真朋友，他刚开始其实并不想去，但是去了之后，却是一直在照顾大三儿。#20181124,0
0,27119292,大三儿,那一抹无名的红,60803592,推荐,2018-11-09,16:17:37,"之前有读过一篇南方周的记者李慕琰写的关于这部纪录片的文章，主要视角应该是导演佟晟嘉的，文章里叙述了纪录片的缘起，拍摄过程的艰苦困难等等。老实说文字内容比影像故事内容有意思得多，感兴趣的都应该看看原文，https://media.weibo.cn/article?id=2309351000354293687080268175

片子里主视角当然是叶云，反倒文章里提的不多的阿皮、朱朱都显得特别起来了，就是你会觉得他们也挺特别的，叶云反倒没什么出乎意料的。除此之外就是各地风景，赤峰，文章里有过介绍，一对比实拍感觉就出来了，路上的风景确实对得起这么多人的向往，然乌湖那段文字让人震撼，也好美。

片里人物其实都挺丧的感觉，但真的，就像看完片子后朴树说的“哥们儿来个烟，这东西有劲儿啊，有劲。”",1
0,27119292,大三儿,阿朽,fuxiu,还行,2018-08-20,21:13:32,大三儿活得明白，电影配乐滥用不喜欢。,1
0,27119292,大三儿,下大垅,xiaojinlovelhy,还行,2018-08-20,19:09:27,我比较务实，在经济能力和身体情况没那么好的情况下，不会去西藏旅游。很多人在歌颂男主有直面生活的勇气，我觉得他有点儿不孝顺。,3
0,27119292,大三儿,弓田,133480668,还行,2018-05-28,22:15:11,看的时候感染于北方人的语言幽默 享受精致的配乐 但总觉纪录电影设计的部分过浓 一部市场和纪录中和的作品吧 其实有很多可以有咂摸的点 但是影片的表现忽略了很多,2
0,27119292,大三儿,叶落尽,id27149,推荐,2018-11-09,22:31:36,老天爷的眷顾，希望永远只是一缕光，不存在普照,1
0,27119292,大三儿,啸杨,xy5377,还行,2019-01-28,15:09:47,拍个纪录片镜头切那么碎,1
0,27119292,大三儿,赵鹏飞,120076971,还行,2018-08-19,15:02:51,大三儿是个很有趣的人。作为低成本作品完成比较好。但是配乐和字幕都有问题。导演说补拍的场景一概没用。但不少地方仍非常刻意。导演作为大三儿朋友参与影片很多，很多细节之处对于不了解大三儿的陌生人看不太友好。,1
0,27119292,大三儿,Shing Chen,53781076,还行,2019-02-21,21:53:31,一直在当故事片看的某人路过。纪录片最怕的就是故事矛盾点不够，拍成了流水账。大三儿最特殊的地方还是他的体型，可是并没有发挥太好，更多是导演对特殊人群的一次关注罢了。另外音乐用得也太少，对故事情感推进不够。,1
1,27119292,大三儿,废物时钟,fduhaoye,推荐,2018-05-27,23:16:42,剪輯聲音都很不錯，不煽情，表達溫和克制。三哥日常的生活大概也真的寡淡無奇，這一場期待已久的自駕遊，堪稱傳奇，他的樂觀和局氣，他的堅持和勇敢，令人動容。生活仍要繼續，家長裡短，庸常瑣事，可他依然，樂呵呵的一往無前。,3
1,27119292,大三儿,米凹,birdp,推荐,2018-08-23,10:58:09,赤峰总能出人才,1
1,27119292,大三儿,承泽明,4075446,推荐,2018-08-25,21:42:06,拍的有点散，但足够克制，想讲的事情也特别简单：患侏儒症的“大三儿”的进藏之旅。观看过程中，感受到了“大三儿”来自身心方面的压力而几度落泪。其实这些问题在普通人身上同样存在，也因此让我对“大三儿”由衷地敬佩。,0
1,27119292,大三儿,Daaaaantje,2646417,推荐,2018-08-22,14:04:37,看着大三儿品着自己的“普通”人生，不期而遇的感动。可能每个人都有个想去的“西藏”，但不是每个人都像他拼命实现了。生活不是比惨，去他妈的不幸！,0
1,27119292,大三儿,L.L,xiubei,推荐,2018-11-04,21:50:11,安安静静的一无所有.,0
1,27119292,大三儿,煮海,75183792,推荐,2018-08-24,21:16:07,不知道为啥，看这片儿中间哭了好几次，看着看着就想起我爸，想起和同学去稻城亚丁时候他高反。大三儿身边有这么一群实在人真是好啊！,1
1,27119292,大三儿,Διογνη,52061916,还行,2018-08-22,20:31:38,追求意义，大概只有人了,1
1,27119292,大三儿,负暄,59215037,还行,2018-08-22,19:01:47,一个理想化的人。是啊，人人都有理想。,0
1,27119292,大三儿,O型血,UloveWo,,2019-02-19,19:51:05,既然活着，就要真真切切、扎扎实实。https://www.bilibili.com/video/av38784096高高兴兴上班，平平安安回家。https://www.bilibili.com/video/av29264821我从不祸害人，我只是用力地活着https://www.bilibili.com/video/BV11T4y1E7fW,0
1,27119292,大三儿,樱桃小阮子,kate101,推荐,2018-08-21,20:53:29,一个非常简单的故事，一个“侏儒”想去西藏，去成了的故事。在三个人的影厅，为自然的镜头语言，恰得其所的空镜头，连贯成娓娓道来的关于生活的吉光片羽而有些心动，拍出了那么些电影性和文学性啊，难得。,0
1,27119292,大三儿,doherty,asdoherty,推荐,2018-08-26,19:35:43,从筹划到出发的节奏控制得很好 前段平凡的生活和日常对话也并不觉得暗淡 后端的旅程精彩但心酸 多次看哭 有摇摇晃晃的人间的感觉 不是一种态度 但都有种洒脱的劲头 虽然努力的营造成就感 可是依然越看越绝望 太艰难了,0
1,27119292,大三儿,虫虫席地而趴,171044551,力荐,2018-06-08,17:22:35,"“大三儿把苦难当做朋友，而不是敌人。”“我拍摄了很久才知道大三儿要去西藏，但就算他不去西藏，片子也照样拍得成，他有可能组织工友去北戴河，也可能努力评上劳模，一切都是未知的，这也许就是纪录片的魅力所在。”
佟导交流现场的经典语录。",5
1,27119292,大三儿,曼仔,Erman-Wei,推荐,2018-08-22,13:50:45,电影本身节奏可以再利落一点，但是大三儿这个人和电影试图叙述的事儿还是很动人，加一星。那么多承受着生活，努力快乐的人啊TUT,1
1,27119292,大三儿,深情的艾老师,AstridL411,推荐,2020-06-18,04:55:04,不祸害人 不需要净化,0
1,27119292,大三儿,牛三牛,shuimudeyu1990,还行,2018-12-18,20:13:30,大三儿，真高，佩服。片子的设计感太强了，剧情和情绪全靠画外音和音乐往上怼。,0
1,27119292,大三儿,突然粉碎,4051316,还行,2018-08-16,21:38:05,人到中年有这么一帮不离不弃的好兄弟，羡慕三儿哥，不是平民史诗，不是励志故事，没有歌颂没有赞美，只是真实记录了小人物的大梦想，他在红山向往雪域高原，普通人追梦别问前路有多难，谁还不是走一步看一步P.S.前一小时节奏略拖沓，素材取舍欠妥当，但是看得出导演与主人公有的是真感情,1
1,27119292,大三儿,Chapelle L.,SoyQueenaTse,还行,2019-02-04,00:51:51,3.5 沒有歧視 不需要同情就好 但是難啊！,0
1,27119292,大三儿,阿之,45105691,推荐,2020-10-31,11:56:30,挺真诚的，有被感动到，但叙事需要打磨,1
1,27119292,大三儿,kakakarl,zhanyakui,还行,2018-05-30,20:05:44,看的过程中，不断想起自己骑行西藏的经历。想做的时候就要去做这件事，只不过这个大三儿的身体稍微特殊一点。,1
1,27119292,大三儿,张春[阿卡纳],arcana,力荐,2018-11-28,22:00:14,一个本来可以煽情的题材，却表现得非常克制。它把一个特殊的人，平常地去表现了。大三儿有特殊的困难，但它也可以是任何困难。任何一个人，面对着困苦的生活，还能不能满怀希望和温情，富有活力地生活下去，不虚度此生呢？这的确是每个人都在面对的难题。而这里有个真实的人，真实地回答了这个问题。这种片，一旦流出泪来就会觉得自己上当了，被蛊惑了，因为转念一想他也并没有做出什么伟大的事，但故事克制地流动着，真实在心中就留下温暖。在一个人500小时的日常生活素材中梳理出这样一个故事不大容易，不知道导演是从什么时候起，决定把片子剪成这样一个梦想之旅的故事的。我代入进去想一下觉得这可能是这部片的创作里最难的部分。希望有机会去问一问导演这个问题。,1
1,27119292,大三儿,专程路过,zhuanchengluguo,推荐,2018-11-12,13:36:39,作为纪录片，导演的态度还是及格的，剪辑帮了大忙，崔健和朴树亦有贡献。心灵净化与否都是扯淡，写遗嘱不忘还钱才是真的。,0
1,27119292,大三儿,长久云,inkzhu,力荐,2018-09-01,13:56:05,轻松彼此照顾的旅程,0
1,27119292,大三儿,绿豆儿,3558905,还行,2018-08-22,20:57:18,"西藏并不神圣，并不能净化心灵。对于三哥来说，西藏是他心中一直向往的地方，就像对其他人来说，心中向往的可能是云南，四川，又或是罗马，新西兰，北欧……不是西藏。西藏跟其他地方都一样，它只是部分人心中向往的一处。
有想法就去做吧，出发吧，去一次你想去的地方，是西藏也好，不是也行。",2
1,27119292,大三儿,倔强的小哈,89337748,推荐,2018-08-24,22:45:12,这应该是看过的最让我感到亲切的电影了，好多地方都认出来了，电影院里的同乡们也都于此津津乐道。,1
1,27119292,大三儿,亮马河畔,47928438,推荐,2018-08-27,22:37:55,"二刷《大三儿》，依然哭笑痛快。
公平这种事还是不要提及的好，不然失望太多。抗美援朝老兵，从四川到内蒙，思乡与落叶归根，言语都不足道也。你非说不是可以怎样怎样，那得真到自己，个中滋味才能了解。
人呐…啧…不说了👋
看之前还觉得去西藏没什么，被人说滥了，后来才意识到对于一个矮小症患者体征心肺功能来说的困境，连朋友都万分谨慎。（不过还是觉得，体检之后可以每天锻炼跑步增强心肺功能，为何不主动出击？",0
1,27119292,大三儿,段郎RockDuan,rockduan1987,推荐,2018-09-04,18:52:03,大三儿实在不是个普通人，他有超出自己形体的高大的灵魂。,0
1,27119292,大三儿,卧龙岗上卧只猫,74145154,还行,2018-08-27,22:14:33,纯洁心灵：逐梦318,1
1,27119292,大三儿,门儿包,leiii,还行,2018-12-01,01:04:27,挺好的，这么一个特殊又普通的主角，这种韧劲。导演拍的一般了。,0
1,27119292,大三儿,随易,elildz,推荐,2018-08-31,02:53:12,没最后关于朴树的介绍和采访部分，可能就三星,0
1,27119292,大三儿,达瓦里希,devillolita,推荐,2019-06-02,12:03:10,有梦想并付诸实践总是好的！人家又没祸害人，很纯洁！,0
1,27119292,大三儿,通叔,47983459,推荐,2019-04-27,23:13:52,选择自己想要的，没有那么难，也没有那么容易，坚持，有时候走向成功，有时候走向死亡，但，这不就是坚持的意义吗？,0
1,27119292,大三儿,昱235,46839109,力荐,2018-08-19,16:53:24,愿意给这片子满分。生活给大三儿带来了成熟、幽默和真诚，别人口中的拉萨成了自己释放的追求的一个目的地，它美得可以让大三儿继续努力活着。与朱朱的同理心，也是别人所无法做到和理解的，他们状况差不多，对幸福、生活的理解也相近。片子中对家庭的展现，也是真实的动容。正如朴树所说，需要安慰，努力活着。,3
1,27119292,大三儿,井戒,draco1892,推荐,2018-08-19,14:26:40,7⃣️其实去西藏是拍摄半年多被大三儿提出来的，却给了这个片子一个很好的主线，也可能是头重脚轻感的原因之一。印象最深还是大三儿和朱朱的情谊，人生最难遇到理解，理解所以过命。不用太伟大，不祸害人就行。,0
1,27119292,大三儿,西西弗的幻影,49318064,推荐,2018-11-30,21:57:47,这就是生活,0
1,27119292,大三儿,｜,127814151,还行,2018-06-04,00:11:44,3.5星。真是同感 我当时去西藏也是思想斗争不断 后来是导演制片来聊天 讲纪录电影概念 尼克尔斯的回归作品本身 又延伸 界定不了界限时身处一种感受时就是真实的。a7s2和黑卡拍25w预算的院线片 大家都很棒 “三儿是一个站在生命终点往回看的人”,4
1,27119292,大三儿,天外飞青,63531003,推荐,2018-11-11,20:21:41,在别人异样的眼光中生活是很艰辛的。这纪录片透出了关怀，我观察到大三说到起自己二哥出车祸走了的时候，这是老天的眷顾……。所以，给予他们的关爱也许可以支持一个残疾人勇敢的活下去。珠峰之行，就是一个生的追求。我们人生由许许多多的追求，推动着年轮的增长。大三也是在用生命证明自己在人世活过了。,0
1,27119292,大三儿,小袁同学,tonyyuanyue,推荐,2020-12-12,21:45:04,每个人都有数，这是三儿的数吧。对于很多人来说，这是一个闲暇之余的小小愿望，但对于三儿来说，这是一个大大的愿望，甚至还可能为此赔上性命。可人活着，总需要前面有光，总需要一些东西让自己激动不已，每个人都不喜欢平淡如水的生活，可是相比于冒险，也更多人选择了平淡如水的生活，因为对他们来说，平淡也是一种幸福。可是对于三儿来说，平淡也未必是幸福，只是不断忍受生活的不堪，命运的不堪，他如许许多多悲催的人一样，也有希望，这个希望就是中彩票。中彩票很远，去西藏很近，所以他要去西藏。这一趟要是见马克思了怎么办？他做好了准备，于他来说，这世上还有什么让他留恋到比实现愿望更值得的东西？没有。让我感动的是，恰恰是这些命运不公的人最为善良，三儿自问无愧于心。健全者追名逐利，不少干了见不得人的勾当。人间正道是沧桑啊！,0
1,27119292,大三儿,将与明,sichouzhilu,还行,2018-08-26,20:54:33,反思了下发现最大的感触并非主人公和电影本身，而竟是三儿和阿皮的友情…我梦想成人之后友情最好的状态，应该是你运气好有能力就过你的富日子，我命不好有点懒就过我的穷日子，当我们在一起时，只吹牛逼，永不谈论金钱和利益，因为世俗在我们之间毫无地位，维系我们的永远都只有那曾经最最纯粹的陪伴…,1
