page_index,movie_id,title,username,user_id,rating,date,time,comment,useful_count
1,27119292,大三儿,冷淡鸡。,ew94kmd,推荐,2018-08-28,04:22:03,前半段有些拖沓，进展较慢，进藏后全速推进，渐入佳境。对着大三儿的镜头，大部分都是尾随、平视甚至仰拍，这点很好。用和父亲吃饭来点明影片进程。大三儿有一帮好朋友，真好。看完想去西藏。,0
1,27119292,大三儿,都尼玛神马玩意,143967534,还行,2019-10-06,20:01:33,相当牛逼。整个观影感观像拍珠峰的那个镜头：缓慢的不对劲，有说不上来哪里不对劲。普通又干净的灵魂，有股子坚韧感人的力量在里面。,0
1,27119292,大三儿,gunknown,gunknown,,2018-12-26,04:12:22,真的很多时候还不如三哥,0
1,27119292,大三儿,四月物语,movieview,还行,2018-11-19,20:30:37,1080#一个身体比较特殊的男主非要去西藏看看的纪录片，在珠峰回顾这一生，值了。果然有马自达探路者赞助，算帮三哥圆梦吧，挺好的。大伙都应该去试试。,0
1,27119292,大三儿,金刚大笑,Gunshy,推荐,2020-02-11,22:00:44,表现得很自然，话也讲得实在，从他身上我看见我认识的和遇见过的一些人，他们的趣味和梦想我一点也不感冒，甚至正是我站在自己这方面要强烈批判的东西，可这不妨碍我为他们的状态而感动——朴素的，没有大道理讲，因此透骨地真实。,0
1,27119292,大三儿,杨三疯,y3f,还行,2018-08-21,23:48:06,每个人都是生活的矮子。当你听到朴树一句“我迎着风”的歌声被加持感动的时候，对一个同样有短板的纪录片，同样三字辈的杨三疯愿意给大三儿加分。去他妈的洗涤心灵，我只愿去我想去的地方，干能完成的事情，不做自己的矮子，大三儿牛逼。,0
1,27119292,大三儿,勇敢的心,57382119,推荐,2019-01-04,23:50:51,树立个小目标,0
1,27119292,大三儿,Y,JIGEMI,力荐,2018-06-08,01:15:16,在看《无缘社会》，最近出了太多让人沮丧的新闻，越是这样，越想念大三儿那个温暖的旧世界。,3
1,27119292,大三儿,淡淡245,drewjet,推荐,2018-08-21,14:50:45,可以再真实一点。几段对藏区景色的评论/解说比较突兀，应该保持叶云全程自述。既然已经用时间倒错的方式剪辑了，也标注了时间，那剪辑本身足以替制作者解说了。,0
1,27119292,大三儿,キサラギ,sylvansea,推荐,2018-08-20,20:46:05,「姥姥，我要去西藏，你保佑我。」,2
1,27119292,大三儿,冷水浴缸,sherry106,很差,2018-08-26,02:57:45,。。。看完回味了一下感觉就是个微博鸡汤故事片吧，导演就差给这个纪录片署名个编剧了。。,0
1,27119292,大三儿,枫林挽秋,snoopyyer,较差,2018-08-21,09:08:04,圆不楞登，设计感明显。,2
1,27119292,大三儿,康熙队长,heathlon,还行,2018-11-18,23:29:04,乐观。他的朋友对他真的好。,0
1,27119292,大三儿,Rose,1794478,力荐,2018-07-28,22:53:25,有的人活着，却自觉深处炼狱；有的人看似拮据卑微，却骄傲而阳光。想做的事，没有什么能阻挡，哪怕要留下生死状。500小时的生活，浓缩成106分钟的感人诗篇。人比云美，情比山高，爱比湖深。佟导本人也充满人情味和豪爽劲，言语真挚诚恳，会继续关注后续作品。,3
1,27119292,大三儿,猫儿腻,maoerni,还行,2018-12-09,20:37:21,一种关注,0
1,27119292,大三儿,追,wait2000,推荐,2018-11-10,16:58:41,努力活着,0
1,27119292,大三儿,沙漠厨房,everisle,推荐,2019-04-25,07:44:22,比剧情片更像剧情片的纪录片，看来真实生活是否无趣，都要看你如何看待,0
1,27119292,大三儿,粘粘,49893816,还行,2019-08-07,06:24:50,执念想去高处看看,0
1,27119292,大三儿,一二三四卌,145905723,还行,2020-06-23,06:50:34,“大”三儿是一个侏儒，他过了大半辈子的梦想就是去远方一趟，西藏就是不二的选择。平淡且艰辛，纪录片呈现了他梦想实现的全过程。旁人看来，一路伴随的友谊才是沿途中最耀眼的风景，照彻了灵魂。,0
1,27119292,大三儿,康斯坦丁,3087252,还行,2018-11-28,20:42:31,温馨，挺好，充满了善良和友谊。可是作为纪录片，结构有明显问题，故事也讲得不够动人，好多摆拍的感觉,0
1,27119292,大三儿,madaoooo,masaikejun,还行,2018-08-18,23:11:55,纪录片里的多机位目的是补充，而不是刻意展示，多处刻意的剪辑实在有点电视台故事片的感觉。片子讨巧还是在叶三身上，纯洁心灵之逐梦西藏，最真实又单纯的思想确实能打动人,1
1,27119292,大三儿,Rocky,2663023,推荐,2018-05-17,21:46:28,当大三站在珠峰前时，那个画面非常有意义,3
1,27119292,大三儿,三都 主,wplee,推荐,2019-04-22,23:15:24,活的够清清楚楚的,0
1,27119292,大三儿,冰激凌,3303823,力荐,2018-08-26,18:37:01,同样是30年代生人，参加过战争，之后的境遇相差这么大，生而为人却没有人性没有尊严，活到那么大岁数也只是行尸走肉，看到电影里的一家人，在对比其他，这世界有公平存在吗？老天会开眼吗？,0
1,27119292,大三儿,ChangKeChih,zhanggezhi,力荐,2018-08-11,17:35:10,交織理想、友誼、親情的紀錄，渲染人生的意義！太棒！感動朴師父免費為影片提供全新「空帆船」mv ⋯ ❤️,3
1,27119292,大三儿,纽纽特,otwNoNer,推荐,2018-05-26,22:25:46,2018.05.26@SHVFS 能看出导演拍电视纪录片的功力，是否适合大银幕见仁见智。人物丰富但不丰满。喜欢成段的soundbite，言语的诙谐撑起了全片。,3
1,27119292,大三儿,10点半的飞机,onlyblueoasis,推荐,2018-08-28,12:39:57,大三儿有几个好哥们儿，这也许是他悲惨生活的唯一安慰吧。命运有些不公，但他活得这么向上，挺好,1
1,27119292,大三儿,棒棒泥购美病🐧,madlaxxoo,还行,2019-03-20,04:18:44,我在赤峰考过1年的试...北京西站出发，硬卧。考试结束后要么回昌平要么去通州。,0
1,27119292,大三儿,小人仔,47716516,力荐,2018-06-07,22:56:08,难受,2
1,27119292,大三儿,雷斯特雷波,Aimwalker,较差,2018-12-23,23:01:15,呃。。不管怎么说，去个西藏并没有这么大一事儿吧？,0
1,27119292,大三儿,海燕🍑,lucy1234,推荐,2018-11-07,11:59:28,至少我是没有他那样的勇气的。,0
1,27119292,大三儿,中文版,zhongwenban,推荐,2018-11-12,22:05:13,看见背着三哥到然乌湖的时候，感觉到友谊的珍贵！,0
1,27119292,大三儿,遙遠,YvetteFeng,推荐,2019-03-03,23:34:09,莫名因为大三儿想去西藏...然后看了看评论，我不是一个人,0
1,27119292,大三儿,裸踝,luohuai,推荐,2019-01-10,00:11:09,调性莫名其妙地和大佛普拉斯很像啊。,0
1,27119292,大三儿,银河系梦游,milkriver,推荐,2018-11-12,16:01:46,中国就应该多拍这种实实在在的电影，少拍那些西游抗日什么的，那些都假到不行。并不一定就现实题材，我说的是态度上的实在，这个电影明显不是奔着钱来的，赚钱是其次，重要的是表达。而中国太多电影完全就是奔着钱去的，内容浮夸花哨，一点都不真诚、不实在,0
1,27119292,大三儿,杨重,4135120,推荐,2018-08-23,01:20:58,值。肯定比那些大量出现花里胡哨的所谓“娱乐片”要值多了。,1
1,27119292,大三儿,米九十,13778623,力荐,2018-04-20,20:35:48,一个残疾青年的西藏梦，串起来的其实是一个充满不幸却温暖感人的家庭、几个并不伟大却算得上靠谱义气的朋友、一群身体上有缺陷但精神丝毫不亚于常人鲜活的残障人士的生活故事……人物立体、节奏舒服、细节得当，真实幽默、笑中带泪的一部佳作。,6
1,27119292,大三儿,Vitamin E,60675005,推荐,2018-06-06,21:14:40,片子成功的三个要素：三哥的故事好，三哥(和周围的人)会讲故事，三哥没有倒下。2018/6/6华侨大学新闻与传播学院,1
1,27119292,大三儿,Mr.T-Bag,wxsbeyondi,力荐,2018-08-31,13:17:44,感觉还是挺好的，现实生活就是这样，平淡中带点惊奇。人生短短三万天，多经历多尝试没错的。至少老了的时候唱起《my way》问心无愧。,0
1,27119292,大三儿,ABEL,suzihan,还行,2018-11-08,22:46:48,平淡真实又有亮点,0
1,27119292,大三儿,geua,xiongmaooooo,还行,2018-11-20,18:15:15,“三十年前我来看我姥姥，现在我来看我大哥我二哥还有我母亲。”,0
1,27119292,大三儿,朴九月,pushusep,力荐,2018-11-18,23:59:00,不容易。西藏一行真的不容易，何况是他。其实我觉得导演的表现手法真的很棒，一点点地铺出故事来。是纪录片也是故事片。,0
1,27119292,大三儿,Stay alive❤️,ironCC,推荐,2019-01-07,15:35:45,有阿皮这样的朋友太幸运了。日子虽然苦，但知足常乐~去西藏也不是为了净化心灵，就是想看一看不同的世界吧。还是要说有朋友真好π_π,0
1,27119292,大三儿,暴殄天物,3275817,还行,2019-04-26,10:54:13,身残志坚 疑问的是 这个纪录片是真实记录 还是有提示的,0
1,27119292,大三儿,生活甜蜜的邮差,MessPostman,推荐,2018-08-18,20:48:24,7.5/10。通过对大三儿的拍摄，其实完成了极为特殊的影像价值。,1
1,27119292,大三儿,deus,solowingpixy,推荐,2018-08-25,18:06:16,成年人的生活里没有容易二字。模糊了虚构与真实的界限。,0
1,27119292,大三儿,紫凝残月,ziningcanyue,力荐,2018-05-21,20:45:00,有幸在北影节期间看了点映。平凡小人物的片子不好拍，很容易就落入痛苦人生和批判的窠臼，可大三儿和他的朋友们因彼此理解而做出的温暖举动，都让我笑中带泪。导演因为触动而拍摄记录大三儿，大三因为被拍才坚定去西藏。导演观察和记录大三儿，我观察导演拍摄大三儿这件互相成就的事儿~神奇,3
1,27119292,大三儿,常安,85290371,力荐,2018-12-02,21:46:49,坐在西安229公交车上，那时候229还没有换新，车门每次开关都会很响，我那次在省体育场下车的时候，车门咣当的非常有劲，有劲儿。,1
1,27119292,大三儿,不舒服斯基,wingkuen,还行,2018-08-27,14:27:43,人物是个好人物，但进藏这事说透了，本身就不成立。如果非得让它成立，那试试把人物旁白拉掉五分之四，把那个阴魂不散的电吉他配乐全部拿掉，所有双机剪辑改为单机，踏踏实实，踏踏实实地做个短片。。,1
1,27119292,大三儿,叶落深秋,4401259,还行,2018-08-19,15:44:20,"一个不普通的普通人完成梦想的故事 
是不是可以用身残志坚四个字来形容？虽然他的梦想需要朋友来完成 虽然家里有80岁的老父亲担忧 大三儿依然义无反顾的走上了追逐梦想之旅 没敢在导演交流会上问出口的问题 大三儿他说自己不祸害人 如果真的西藏之行出了问题 是不是祸害朋友？祸害老父亲呢？",0
1,27119292,大三儿,Laluo西,135354552,推荐,2018-08-22,21:00:39,只是活着肯定不够，还要有梦想有尊严地活着。,1
1,27119292,大三儿,阿疼,sevendaylife,力荐,2018-03-21,16:54:10,赞扬当下普通人的故事，一个身高1米1的普通人去到海拔5200的珠峰大本营。愿望得以实现，却又回归普通生活。比较新鲜的讲述方式和角度，推荐。,6
1,27119292,大三儿,小飞侠彼得、潘,pt1012866012,推荐,2018-11-09,18:04:06,"真诚的对待生活的人，永远值得被尊敬。
大三儿是个平凡而又不平凡的人，进藏之路，是一个平凡人的小梦想，当雪山高原呈现在眼前，除了被眼前的人间盛景惊艳，也会让更多的人觉得，在俗世的生活中，停留下来的惊艳，是我们疲惫生活的小确幸，这等待着你我去触碰。
平凡人是这个世界的大多数，我们默默无闻，尽力的活着，真诚的爱着。",1
1,27119292,大三儿,爱影,46000832,推荐,2019-06-04,16:31:48,这样走了 这样活着 慌了神 没了混,0
1,27119292,大三儿,衡Isabella,62117223,还行,2018-11-28,00:07:42,没有那么多意义，有的不过是努力活下去。心有所向者，无所畏惧。,0
1,27119292,大三儿,老生_,149047996,力荐,2019-01-14,01:32:48,9分 真实 善良 原来所有人都在思考 我也要去趟布达拉宫,1
1,27119292,大三儿,陈韦同,yiakron,很差,2019-07-06,15:19:50,总拿电影去谈理想。美的地方看不出美，写实的地方看不出写实。说白了就是一个人完成了自己的进藏梦，他普通的就是个普通人。和我们自己自驾穿过318有什么两样？梦要有，你偏说三儿的进藏梦比我的进藏梦更珍贵？对不起，恕不接受！,0
1,27119292,大三儿,大心,1658796,还行,2020-02-17,16:05:27,这一辈子活得，挺费劲。,0
1,27119292,大三儿,Pirouette,pirouette,推荐,2019-01-03,15:31:09,比估计的好,0
1,27119292,大三儿,今日立冬,jinrilidong,力荐,2018-11-10,14:48:50,别看小，很标准。大三儿活的艰难，活得明白，还能聚拢人气儿，厉害。这片子剪辑有意思，像纪录片又不像，看完滋滋有味。,0
1,27119292,大三儿,尘埃眠于光年,47845902,还行,2019-07-31,22:42:36,一个纯粹的灵魂,0
1,27119292,大三儿,世之介,xudeya,还行,2018-11-08,01:25:23,我觉得剪辑节奏刚刚好，太慢了也没啥看头；一个侏儒想去拉萨的故事/,0
1,27119292,大三儿,Ricky,minor69,力荐,2018-11-04,16:13:26,导演有丶东西，前半的五味杂陈和后半的一往无前。总得准备好了,0
1,27119292,大三儿,豆包子齁儿咸,buqianjiu,还行,2018-08-30,01:35:08,看到一句影评说的好，道德绑架的触角不能伸向电影。你拍边缘人群的电影，不能绑架大家一定要贡献眼泪和电影票……你不能一边高高在上的同情大三儿是残疾人，所以他的借钱完成的执着的西藏行的梦想就算做特别棒的了不起，另一边又要求他不要自卑要自立自强，不矛盾的好笑么？！身为一个46岁的成年人，连跟84岁老父的正常良性沟通都没有，还得靠出门后要朋友帮忙婉转的跟老父说明目的地，并且哪来的勇气觉得自己特别牛逼特别讲究的给老父留遗言要求万一情况出现由老父来代替偿还欠债？！好歹暂时偃旗息鼓了几乎所有人都忙着辞职去奔向诗和远方的风潮过后，万一电影带来又一轮的为了梦想不惜一切的恣意妄为，怎么办？！我愿意把你当正常人，正常的成年人，那请大三儿哥你别把自己惯成巨婴行不行？！,2
1,27119292,大三儿,洋葱,yzone,推荐,2018-11-20,21:54:57,看到想哭,0
1,27119292,大三儿,Aorta,Hennessy_,推荐,2018-08-24,12:09:42,3.5有设计感，但是细细碎碎的东西连起来才突然发现他和我们都有一些，或者一个念想。那些文字让我一开始就觉得这不是伪死之旅吗，果然吧，你要是真想做什么，说不定会在所不惜。那段对话，看着看着居然就很想哭了。,0
1,27119292,大三儿,Lethal  Point,72525353,推荐,2021-09-01,18:33:28,没有宏大叙事，只展现个人坎坷命运。不矫情、不抱怨，接受现实，勇敢向前，至于他到底是去西藏还是海南岛并没有那么重要……,0
1,27119292,大三儿,David的便筏,257817450,,2023-02-04,00:57:22,上大学大三的时候在导演的高校巡回展映会看过。当时这种类型片子看的少，影毕，印象中只记得虽然觉得调性沉闷，但耐下心来看完还是觉得蛮特别，身边的同学们问了很多让我偷笑的弱智问题，导演回答时的表情很有趣。,0
1,27119292,大三儿,莫末、,whereshallwego,力荐,2018-12-02,02:00:40,估计像我这样的人永远都去不了了吧？突然在想山是不是也爬不了了？哈哈哈，//“四十多岁的人了，也差不多啥都懂了”不论你多大，在大人眼中永远是小孩，两次丧子之痛让这个老人撑下去唯一的动力就是三儿了吧？//终于看到成片了，奈何我们这不上映，,0
1,27119292,大三儿,热水瓶已满,57861553,还行,2020-05-08,11:24:42,6.6 因为朴老师,0
1,27119292,大三儿,cless1987,41566646,推荐,2019-03-20,09:59:41,准备出发，全程XXXX公里！谁说小人物没有梦想的，人家坚持了并且完成了，就是牛逼~,0
1,27119292,大三儿,你虎哥,57460299,还行,2018-08-16,16:53:00,进藏以后特别好，平实有力量。,0
1,27119292,大三儿,amie-Y,2979692,推荐,2018-08-20,23:56:09,"反差~标题Mr.Big和大三儿本人1.1m身高。逐渐发现他为人的成熟和大气。梦想不止想想而要坚定地去做，单靠自己做不到的要有念力让别人帮助自己做到。
筹划藏行的铺垫过程，叙事很克制，没有对家族悲剧的过分煽情。从父亲的嘴里说出他的成熟，从驴友的语气里透出对他的钦佩，而他是否对老父说出自己要去西藏，直到他在路上才揭晓。
真正的『藏行记』开始后，配乐有点喧宾夺主，而摄影也不算惊艳。但悬念一直在他的“生死状”怎么立和他的身体是否扛得过高反历险上了。而有关心灵净化的对话实在刻意和煽情了。
20180820@百美汇",1
1,27119292,大三儿,arale,aralebox,推荐,2020-01-27,07:12:43,即使A，B，C... 大三儿还是亲眼见到了珠穆朗玛峰，这是个温暖的故事,0
1,27119292,大三儿,Stevie,Gerrard_8,还行,2018-08-25,17:35:31,很难判断这是一部剧情片还是公路片，前半段剪辑有点乱，后半段出发去西藏开始渐入佳境。喜欢大三儿这样坚强乐观的人。,1
1,27119292,大三儿,东北偏北,37256787,推荐,2018-11-07,00:16:11,一米一的巨人！,0
1,27119292,大三儿,我去两千年,LukeJoyland,还行,2018-08-12,17:25:47,"麻蛋谁他妈不想任性一会儿就这么个心愿你非得给我成了不可
拍一部纪录片送给三叔这心意谁不想有这么一邻居
朴树成中年大叔了还特马性感
等人来祸害我  我不祸害人
你觉得受到净化了嘛就看一部电影哪至于蟹蟹赠票",2
1,27119292,大三儿,芷宁,1511195,推荐,2018-08-16,16:59:38,整体呈现得朴实无华，凝练厚实，又不乏幽默诙谐。一次旅途，漫漫修行，躯体可以受限，但灵魂更可以纵驰，三哥已俨然是最高大的大三儿。看到在如今普遍的浮躁快捷之下，还有人在坚持拍这样的影片，颇感概。,1
1,27119292,大三儿,洛梦蝶,luomengdie,推荐,2019-01-22,21:54:34,“去西藏”这件事，上到油腻中年，下到文艺青年，都津津乐道、口口相传，以至于成了某种符号性的存在，别人吹的牛逼有多少出自初心，多少发自炫耀，多少是为了给别人看不得而知，但是之于大三儿，联系到他的生活，却更有“诗和远方”的典型性，因为现实的残酷、苦闷和不堪，以及他作为侏儒的缺陷所带有的边缘人群的非正常视角，所以“去西藏”才更寄托了“知其不可为而为之”的悲壮，而无论是描述他这个愿望的背后有多么艰难，还是实现这个愿望的过程，以及大三儿本身乐观、真诚、豁达甚至带有幽默的性格，都是很能打动人的，一定程度上称得上“个体的史诗”。包括他身边的各色人群的刻画也是栩栩如生，即便成片有粗糙和刻意之处，甚至有点电视专题片的痕迹，但是纪录片往往胜在角度和人物，前提立住了，就成功了一半。,0
1,27119292,大三儿,sinyo,155019963,力荐,2018-09-11,22:24:28,三哥，谢谢你。,1
1,27119292,大三儿,Muto,muto,还行,2018-11-07,21:51:54,大三儿的眼界同构了《大三儿》这部作品的眼界。所以“正常”的观众会不自觉得带着偏见来“Judge”现实中的人物以及他那些“好高骛远”的梦想，因为对于三儿来说所谓的正常才是异类。但影片最终选择了他每天都在净化的楼道以及他四十多岁的感悟作为主角，这也让电影的议题由人变成了路。时间从冬转夏，直到去了西藏与广而大的外界真正发生接触和互动三儿才意识到歧视并非来自观者的目光而是源自他渺小而自卑的心理。导演试图将两者间的这种差距强行拉平，然而问题却在于“导演”的介入。最终越活越纯洁的三儿挥一挥手势也仿佛是个《巨人》的样子。,0
1,27119292,大三儿,zygma,1717741,还行,2019-06-04,21:46:27,人生总需要哪怕一次的“自不量力”，哪怕一次的“眼高手低”，活出精彩！,0
1,27119292,大三儿,Wait,3618040,还行,2019-04-30,13:42:07,小身板小愿望，实现起来不容易。他这帮朋友还是挺好的，不论是同病相怜的，还是其他，都对他抱着善意。他父亲真是不容易，两个能顶门立户的儿子，都车祸了，这个三儿，老儿子老儿子，这真是老儿子啊。算是挺真实的吧。,0
1,27119292,大三儿,Seymour·X ㍿,lvpi,还行,2018-08-19,16:31:02,讲“去西藏”的影片就三星封顶吧。,0
1,27119292,大三儿,桃子乐,62943026,还行,2018-08-21,19:26:05,想到的是穷人做着中彩票的梦，而在中国彩票事业就是一个笑话，普通的人做着普通的梦，但命运的天平始终只会向一边倾斜。,0
1,27119292,大三儿,圆山中庸,wildwood,推荐,2018-11-17,20:55:11,人活着真难，想要活得有点骨气，更难！,0
1,27119292,大三儿,MxkWicked,71573163,推荐,2019-01-09,22:36:03,小人物也有大能量，挺好。,0
1,27119292,大三儿,秩秩斯干,149700388,力荐,2018-09-05,22:23:28,感动，喜欢佟导,0
1,27119292,大三儿,阿孝咕,49424641,推荐,2018-09-02,12:27:32,进藏总动员，顺便看一眼珠峰，有两代人的隔阂，也有好哥们的仗义。一窥中国小城老百姓平凡生活中的悲伤和梦想，诗意和远方。,0
1,27119292,大三儿,河流底层,fernandosong,推荐,2018-11-12,10:59:15,一阵辛酸，或许觉得稀松平常的事情，在别人的世界里又不一样。每个人我的生活都不足为外人道。,0
1,27119292,大三儿,孤独的肖师傅,48981541,还行,2018-12-28,15:05:19,有一段被感动到了，现在居然想不起情节了……,0
1,27119292,大三儿,Meng～,135270359,还行,2018-08-24,21:54:46,一句“我没什么需要净化的”给一颗星。,1
1,27119292,大三儿,拾荒者,75063932,还行,2020-03-08,21:30:56,有梦想谁都了不起。有亲戚，有朋友，认真的活着，不祸害别人。,0
1,27119292,大三儿,囧叔,tassadar,推荐,2018-08-26,13:14:53,有力量的纪录片。制片人大峰的坚持值得尊敬，替大三儿吆喝一声，排片不多，能看就看吧,0
1,27119292,大三儿,玉娇龙,66339819,推荐,2018-06-02,00:34:56,三哥这个人很有意思，越看越有味的那种。叙事比较散，是个关于人物的记录，而不是事件的记录。搞明白这个，就不会觉得无聊了,4
1,27119292,大三儿,虛擬碳水膠囊,Satornusy,推荐,2018-08-22,23:34:00,"@萬達影院/第一次在影院觀看紀錄片，第一次感受到齒瘋話的魅力，第一次在螢幕里看見熟悉的街景和商鋪，雖然有種不真實感，但卻異常親切。
/大三兒這個人，在我初中和朋友結伴上學的路上時總是會遇見，他就一個人默默的站在馬路牙子上，偶爾叼著一根煙，看著來來往往川流不息的車輛，有些酷，還有一些孤獨。
/誰說小人物的生活就不是一出好戲了？",1
1,27119292,大三儿,无姓之人,137959803,较差,2018-12-04,01:03:15,有设计感，特别是对话的时候。对可能会出现问题做了很多铺垫，其实什么事也没有，和正常人一样。其实想到了行走距离，因为完成这件事并不只是因为对梦想的坚持，还有两个愿意陪伴的好友，两个。,0
1,27119292,大三儿,Yomi,49558005,推荐,2018-11-16,16:38:53,其他人的生活,0
1,27119292,大三儿,晚点末班车,kkjoy2617,推荐,2018-08-21,22:03:21,国际标准手势,1
1,27119292,大三儿,小约翰,47478051,还行,2018-11-19,00:29:56,我居然在巴黎影迷放映会看的……好诡异,0
1,27119292,大三儿,栗子侠,49413948,推荐,2018-07-07,23:33:35,三哥人格魅力大于纪录片本身,1
1,27119292,大三儿,咚咚tomato,AkiraShirosawa,还行,2018-08-23,21:09:07,3.5以平时的视角观察一个残疾人的进藏梦想，不净化心灵真的太好了。前面比较粗糙琐碎，进藏后节奏渐好，摄影还需要再做打磨。,0
1,27119292,大三儿,9,142133091,推荐,2018-08-26,21:14:39,我爱这艰难又拼尽了全力的每一天,1
1,27119292,大三儿,邹以默,amelie722,力荐,2018-08-19,19:55:59,真不错！整个分寸感拿捏得正合我心意！,1
1,27119292,大三儿,yeqilin,yeqilinb,力荐,2018-11-09,21:15:37,本来觉得挺无趣的生活片，看的很有感觉，引发我对生活，对我现在的很多体会，很多感想，想明白了很多事儿,0
1,27119292,大三儿,沉静的心,56800841,推荐,2019-08-05,14:12:26,去西藏对他来说就是一生中很重要的事情了。都要珍惜眼前的生活，身边的人，要往前看。,0
1,27119292,大三儿,欧阳,45024406,还行,2018-11-06,21:54:16,3.5,0
1,27119292,大三儿,elwing,snowchong1984,还行,2019-04-10,20:44:27,没看完，为导演的情怀点赞,1
1,27119292,大三儿,大罗,Gu_li,推荐,2018-09-19,21:37:22,其实很一般的，大多是常人的碎碎念，不过，好在我喜欢碎碎念……,0
