page_index,movie_id,title,username,user_id,rating,date,time,comment,useful_count
1,1301465,纯真年代,抛弃,148406699,推荐,2022-03-11,13:51:27,"配乐一流，原著里最喜欢的结尾，男主在楼下眺望阳台回首往事那一幕，或许是时代所限的技术原因吧，电影画面感觉还是很突兀(爱乐之城的多年回首永远难忘)，但转身离开的背影，飞起的那片鸽子，衬上伤感绵长的配乐，还是令人唏嘘良久。
（PS.选角方面个人不太理解，Madame Olenska的面相或许有点太过于成熟？May也不像原著提及的属于本爱运动稍微偏壮一点点的类型啊，配上薇诺娜·瑞德的颜和身材，电影很难让人不同情和怜惜May）",1
1,1301465,纯真年代,寒冰魔孤,tenniszbl,推荐,2010-12-19,13:21:12,果然Innocence啊……我期待了许久的阴谋论最终也没有出现……,0
1,1301465,纯真年代,本初老儿,alacrity516,力荐,2007-10-19,01:53:35,人的一生如此恍然，一刻放弃了的某些，今生都不会再拥有。好残忍的电影，好残忍的人生。,0
1,1301465,纯真年代,很仙的侠女,13826202,推荐,2009-09-28,13:39:54,"gossip girl里面有这个剧目的演出，我觉得这个片子拍得很好看。
得不到的就是好的，男主人公阻止了自己去见女主人公的脚步，把这份期待带进坟墓。",1
1,1301465,纯真年代,球球,52160425,推荐,2011-12-10,20:10:57,又是一堆被封建落后思想拆散了的苦命鸳鸯。结局，30年后纽伦不敢面对自己的挚爱，默默离开的背影，是一种解脱还是更深的煎熬。奥斯卡影帝20年前竟然这么风流倜傥，认不出就是血色黑金里油老板了。。。,0
1,1301465,纯真年代,小鱼@苏樱,xiaoyusuying,推荐,2008-06-07,00:39:55,西科赛斯的华丽剧？很华丽。米歇尔非佛那个美啊,0
1,1301465,纯真年代,浮生若梦,nodane,力荐,2020-04-29,13:14:17,"I can't love you, unless I give you up.那个时代的爱情隐忍又炽热，May用女人独有的智慧保全了自己的家庭，Newland在木已成舟的情况下选择做一个好父亲好先生，而Ellen选择退出不属于自己的感情成全了别人。也许如果当初Newland鼓起勇气，至少还有两个人能得到幸福吧，又或许私奔以及背叛让他们一生都活在愧疚之中，依然无法获得幸福。",1
1,1301465,纯真年代,minyee13,minyee13,还行,2007-11-25,01:46:30,我甚至 连爱情都不甚了了,0
1,1301465,纯真年代,旺仔流奶,63663780,力荐,2021-12-29,09:32:18,"两个女人，每个人都通过不同的手段得到了自己想要的，而男主…大概率会被冠上“呵，这就是男人”的“美名”。他得到了自己不想要的，想要的是自己得不到的，可想而知，他的后半生是何等压抑和寡欢，最后的抬头仰望和转身离去，就像油尽灯枯，代表了彻底的死心和释怀。
一次次被 Daniel Day-Lewis 的演技折服，他的肢体和表情，恰如其分诠释着男主人公心中的渴望和内心的挣扎，在配乐的气氛烘托下，令人着迷。
片名叫做《纯真年代》，可有一人是真正的“纯真”？
",0
1,1301465,纯真年代,april,aprillose,力荐,2010-09-14,12:11:16,"如果不能和所爱的人在一起，如果一生不是为自己而是为礼数为体面而活，人生将是多么的空虚和苍白

I can't love you until I give you up!”",0
1,1301465,纯真年代,勇敢的毛毛,EdithMonkey,较差,2010-06-10,10:07:12,是我看的那个版本有问题还是本身就这么多旁白啊  快被叨叨死了,0
1,1301465,纯真年代,战马空肥,52600336,推荐,2011-12-27,00:36:41,描写社会对他们造成的压抑感太少，不足以彰显出当时社会对他们个人造成的纯粹属于个人的影响，看的是翻译片，台词太差，三人演技相当不错，特别是艾伦。,1
1,1301465,纯真年代,🐰🐰🌟,usagibaby,推荐,2013-07-04,00:10:07,很凄凉的电影哎。扩大了深情的限度，其实连纽伦自己都不一定看清楚了自己的真心。我不喜欢这一种现实的弱化。不过画面都好美，食物也好看（应该也很好吃的！）服装也是美啦。但是讨厌我该先看小说的！烦人,0
1,1301465,纯真年代,金鱼@ed,jinyuji,推荐,2013-12-02,18:44:54,"对winona 的过分喜欢影响了观影感受,所以觉得高潮并不在夕阳下Ellen的背影。而是May死后儿子对Newland说母亲一直知道他们这段感情。May一直隐忍着,婚前给予Newland选择的机会,这份纯真美好,Winona演绎真的再合适不过了啊。男主角十分虚伪,厌恶规则,却无胆量挣脱,还拖了个人陪葬",3
1,1301465,纯真年代,小疯nn,4515876,很差,2010-07-17,10:09:28,好无聊的故事 nelen到底为什么会爱上allen啊 都没有交代 从头到尾都只有痛苦和克制 好无聊,1
1,1301465,纯真年代,Woodring,woodring,,2017-08-04,23:13:39,假装淡定的暗潮汹涌，都是明白人~话说，还挺，马丁·斯科塞斯的，跟Barry Lyndon前后看两者动情程度和冷热温差感好大~,0
1,1301465,纯真年代,匹咔咘,xy0417,推荐,2011-06-30,01:19:41,胡歌喜欢的男人是不错 可他演的那人不行~Winona居然不是女主 而且显得那么多余,0
1,1301465,纯真年代,chinachhp,60981829,还行,2019-12-15,13:29:33,"服气了！明明是小三勾引渣男出轨，结果被导演拍的一个凄美。
明明就是绿茶婊+白莲花+渣男的组合，结果我竟然有点觉得白莲花心机，可是白莲花什么都没做错：婚前让未婚夫考虑清楚，结果结婚一两年了老公渣男想跑，白莲花只好给绿茶婊表姐说自己怀孕了，这是基于那个时代背景下的，女人离婚以后没啥好日子过。渣男和绿茶婊都太虚伪！又要偷腥又要装的深明大义。
--2019.12.14 Edgartown",1
1,1301465,纯真年代,弥呀,daphneleaf,推荐,2010-02-28,04:34:55,非常非常非常exquisite的片子。不得不说，Daniel的眼神太要命了。当然，这剧情更要命……,2
1,1301465,纯真年代,黑稻子,heydzi,还行,2010-06-26,20:18:27,从开始到结束，所谓深情，更像一个笑话。,0
1,1301465,纯真年代,Wennie,Wennie,推荐,2008-05-06,14:32:22,红玫瑰白玫瑰的故事，谁又比谁单纯谁又比谁复杂。,0
1,1301465,纯真年代,茉琉,nangle,还行,2011-05-20,18:47:47,马丁拍得很好，DDL演得也很好，只是这个故事实在喜欢不起来,0
1,1301465,纯真年代,肉包兔纸,1938099,推荐,2007-11-25,15:49:52,"她站在阳光下,他站在她身后,他们都知道对方的存在.他们的心很近.但是他们身体的距离.永远只能这么远",0
1,1301465,纯真年代,Adrian,Adrians,还行,2009-01-13,09:24:29,not my style。。。,0
1,1301465,纯真年代,阿草,Soushi,推荐,2010-12-22,09:11:52,说是说最受不了这种调调的电影，结果后半部分居然真被弄得无比伤感。忍不住看了两遍，各种细节戳人阿，as much as a man can be,0
1,1301465,纯真年代,没有眉毛的猫,2360623,还行,2009-11-21,20:47:47,不喜欢导演以一种赞美的姿态去刻画一个内心闷骚性格懦弱的男主角,0
1,1301465,纯真年代,...,Monkeyking615,推荐,2013-12-15,08:31:15,"Newland never deserves the love of May. May is the perfect girl, wife and Mom.",0
1,1301465,纯真年代,卷卷sher,56607068,推荐,2012-05-15,22:02:53,两个不要脸的还觉得委屈！偷情多可耻啊！薇诺娜太美了！,0
1,1301465,纯真年代,鱼,mayhsu0619,力荐,2011-01-31,16:05:39,有的时候真的很难分的清楚那些局外人到底是观众还是编剧。,1
1,1301465,纯真年代,极圈里的燕鱼,72002197,还行,2017-09-05,22:55:49,布景、打光、服装、动作和旁白都十分精致和考究，节奏慢得就像是舞台剧；交响乐、圆礼帽、歌剧包厢、宅邸舞厅……整部电影每一处都充满了庄重高贵的传统与仪式感，再现了那个年代美国的上流社会风貌。但故事却还是很平淡乏味。,1
1,1301465,纯真年代,澹~,ginsu,推荐,2014-04-19,18:39:33,Daniel Day Lewis 老年扮相更帅气。 Michelle Pfeiffer的嘴唇和舒淇的嘴唇一样让我看的难受。,0
1,1301465,纯真年代,SundanceKid🌈,rudygiraffe,还行,2016-09-20,17:23:32,May的纯真保护她不受伤害，Ellen的烈和被时代阻断的自由向往，让她做出了最多牺牲。只有男人尚有老来深省的余暇，女人们都被年代的洪流推向所谓天堂或是地狱。爱情不是电影表现最好的一面,2
1,1301465,纯真年代,卯起来唱沙哑歌,2332162,力荐,2010-05-01,09:52:40,这是一部怎样将欲出轨的老公挽回的教育片。,0
1,1301465,纯真年代,杨文理,2446648,力荐,2010-09-01,00:32:52,可以埋怨世俗，可以埋怨造化，但始终最应为这份悔意负责的，还是你自己......,0
1,1301465,纯真年代,饥饿艺术家,hackey,力荐,2010-02-10,21:45:39,NYC第五大道中世纪的爱情又内敛又闷情，DDL除了是神人之外也把一个人对爱情的保质期延长至很久很久。,2
1,1301465,纯真年代,小霞君have fun,echozjx,力荐,2013-06-10,01:21:48,谁都没有错，那些暗涌，敏感细腻，带着秘密活到老，唉。恋物控会喜欢的一部电影，那些古典的物件，闪闪发亮。,0
1,1301465,纯真年代,龙舌头🌈,amore019,推荐,2021-05-01,18:47:03,4.2星。美国人自己的半生缘故事。一个要离婚离而不成，一个即将新婚，他们之间的爱情要如何才能冲破层层阻碍呢，男主的处理方式很文艺，温柔而含蓄，故事的最后呢，希望他的心里没留有任何遗憾，她的也没有，希望如此。,0
1,1301465,纯真年代,大树,3042601,还行,2012-08-11,23:46:39,不明白为什么电影名会是《纯真年代》，我不认为这样的爱情是纯真的。分明是将偷情延续成婚外情。最纯真的那个人却成了爱情的牺牲品。,0
1,1301465,纯真年代,琉璃不想动脑筋,liuliliuli,推荐,2011-01-23,21:19:40,"悠长而又缓慢的电影格外适合感冒中人看了睡，睡醒接着看。
选角非常合适，某些段落非常优美。",0
1,1301465,纯真年代,まるい,marurui,推荐,2008-06-19,13:57:05,"很爱 很感慨 念念不忘（08-06-19）
再看 减一星..(10-01-19)",0
1,1301465,纯真年代,小雨,Raininginging,还行,2012-11-15,21:17:49,中文配音加讲解吐了有没有。。,0
1,1301465,纯真年代,Paradox,XuKyle,力荐,2014-06-01,16:39:41,画面美，细节上将十九世纪末二十世纪初的纽约还原得到位。然伊迪丝·华顿当年获知纯真年代将要改编成话剧时，曾在一封信中提到当时之上流社会皆操英腔，显然这点电影并未很好复原。阿切尔的自我牺牲归根结底是因为他无力反抗传统，而艾伦与他在这方面截然不同，最终导致了一生的悲剧,0
1,1301465,纯真年代,Alice,xingren912,推荐,2011-05-21,16:39:34,情节并没有太出彩，可是每个远景亦如一幅精致刻画的油画，无声地叙述着主人公的心境。很是喜欢这样的情感表达方式~,0
1,1301465,纯真年代,白乐寒,bearia,推荐,2021-07-08,22:17:37,华顿笔下的男人都纯洁得可爱，软弱得可恨，永远走不出自己身周的浓雾，这种人的爱情是致命的,1
1,1301465,纯真年代,geek,31316178,还行,2012-02-25,01:11:57,因为看的国语版，减一星,0
1,1301465,纯真年代,Sico,2863758,推荐,2014-02-16,16:31:31,一人能忍，一人能让，白百合与黄玫瑰都做了妥协。至于心外有幽情之人，情愿凝望帆船驶过灯塔，情愿多年后于窗下转身，时机已过，却至少保齐回忆里一份Innocence & Beauty。一窥十九世纪的纽约风貌，如花美眷，似水流年。场面调度、镜头处理都很美妙，歌剧即视感。,0
1,1301465,纯真年代,胖茶壶,qingjiaorousi,推荐,2011-01-07,22:02:13,为什么他们最后没在一起啊？！不过这确实是最好的结局，大团圆不属于艾伦，她守着自己才是最好的归宿。,0
1,1301465,纯真年代,画瞳,40027917,力荐,2010-06-25,10:09:02,没想到这是斯老头的作品，年代气息好浓。,0
1,1301465,纯真年代,伏伏伏伏伏的馍,69364200,推荐,2018-03-08,19:22:31,感觉男主真正爱的其实是自己，对公爵夫人的爱也只爱上了他所不能，孤芳自赏自怨自艾，将过错推给世俗却不知自己正是无比世俗的一员，以贬低而怜悯的目光看待妻子，却不如妻子的。半分通透，活在自我精神世界之中扮演一个可悲可怜的戏剧性的人物，只是在一厢情愿的唱独角戏罢了。,3
1,1301465,纯真年代,子虚乌有亡是,ossianshiwo,还行,2013-01-22,13:43:17,小三想上位？正室还是母凭子贵啊。,0
1,1301465,纯真年代,昔日月影,rushuijingmi,推荐,2010-01-02,23:33:48,经典的台词，唯美的画面，不知道是不是爱情的故事。,0
1,1301465,纯真年代,心玦,anshangwennuan,力荐,2011-11-20,02:41:04,I can't love you until I give you up ,0
1,1301465,纯真年代,六只小狗,37521902,推荐,2011-04-22,22:54:55,如果当时你真的转身了，结局还会一样吗？暮年的相见，不如怀念。,0
1,1301465,纯真年代,巴巴罗莎蠢猫脸,barbarossa1753,推荐,2011-09-14,18:48:05,爱情是这世上最狭隘之物，容不下这么些挤拥的人，它是只有离开你才能获得的那缕空气。待得白云苍狗转瞬经年，待得真相大白红颜鹤发，我们却不必在一起，因我们始终在一起。一个背影，此世意难平，你说什么都过去了，唯独沧海过不去。,1
1,1301465,纯真年代,欧阳珺琦,illusion7,推荐,2014-03-28,02:26:56,刘易斯淡而优雅，米歇尔不羁又风情，薇诺娜的美干净天真。又是红玫瑰与白玫瑰啊，但三个人相互之间的感情都是善意纯真的。有些秘密知道没有说，最后你才体会到这种深情。sigh,0
1,1301465,纯真年代,时时刻刻,3128756,力荐,2009-02-14,16:46:05,阳光下，她没有回头，镜头永远定格在那一刻。,0
1,1301465,纯真年代,Tiffany,tiffany_xu,推荐,2013-12-27,13:43:42,白玫瑰变成米饭粒，红玫瑰就成了朱砂痣。只有女人才看得最清楚：I can't love you unless I give you up.,0
1,1301465,纯真年代,好大一张饼,mayaaasun,还行,2010-08-06,10:56:46,所以电影是想赞颂男主角的出轨和克制是么，这他妈就叫纯真年代了是么,0
1,1301465,纯真年代,9楼2座,3184101,力荐,2012-04-06,02:55:09,馬丁大叔早就應該憑藉此片拿最佳導演獎！,1
1,1301465,纯真年代,多动症大人,21888893,推荐,2013-01-24,23:43:16,我操！！最恨男人劈腿好吗！！当初要结婚的人是你自己说的！！结婚后说是may束缚了你！妈逼你和may表姐偷情还自己怪may!在你心里想你自己妻子死掉来成全你和你小三的时候，敢不敢不要这么自私！！may一直知道实情！最痛苦的是她好吗！别他妈在那儿装伤感了！,0
1,1301465,纯真年代,粵語殘片,EvanChouu,还行,2012-02-02,11:28:48,看过那么多老马的片子，这部《纯真年代》是唯一让我看得蛋疼的一部。除了片中富丽奢华的布景以外，我真不知这样的三角恋有什么看头。真不敢相信这是“a film by Martin Scorsese ”！,0
1,1301465,纯真年代,Dita,nicate,推荐,2010-07-26,08:07:07,"魂牵梦萦的是美人飞花。有的时候错过就是一生。脑残富家女我恨你！！！！！

“I can't love you until I give you up!”",3
1,1301465,纯真年代,王清纯,nevertouchwyl,力荐,2013-01-14,22:06:32,她就是要他永远得不到，就要他记一辈子她的好～ 所以她是一个多么狠的女人,0
1,1301465,纯真年代,梦里诗书,57542378,力荐,2015-09-10,11:14:55,《纯真年代》与马丁·斯科塞斯惯有的写实风格作品有着很大不同，作为一位大师的自我突破之作，唯美的镜头质感与爱情命运的交织，精致华服与人物塑造的考究，将观众带回了19世纪的纽约，呈现出着斯科塞斯眼中带有时代性的纯真年华。,0
1,1301465,纯真年代,猪头山太子,4714682,力荐,2011-07-13,00:25:56,深情即是一桩悲剧，必得以死来句读。,0
1,1301465,纯真年代,roja,roja,推荐,2008-04-21,14:26:50,还记得自己看这部片子时的场景，在大学的电视机可以收到隔壁楼某间宿舍的电视机的信号，某天对面那间宿舍在放这个，然后我们宿舍4个人就这样看完了这部经典。,0
1,1301465,纯真年代,四月姑娘,salomenini,力荐,2011-02-07,21:41:05,"Everything is labeled, but everybody is not. 瑞德美使了！！",0
1,1301465,纯真年代,栀子英,zhiziying,还行,2008-11-18,06:25:41,画面美，故事拍摄的太不暧昧,0
1,1301465,纯真年代,奔奔山,benben321,还行,2009-11-28,15:20:15,心魔难束，却又欲爱不能，还是叫心外幽情更好。调子很幽雅，却有些拖沓，人物内心的挣扎再激烈些就更好了。,0
1,1301465,纯真年代,小霸狂,maomiwang809,力荐,2009-04-01,21:26:03,三个璧人。感动。Pfeiffer的声音真好听。alone,1
1,1301465,纯真年代,Callvados,42291551,推荐,2017-12-04,06:01:34,She never asked me. He gave himself a single chance. She must turn before the sailboat crosses the LimeRock light. Then he would go to her. 1400,0
1,1301465,纯真年代,Xingxing ZHANG,suogu,较差,2021-07-21,19:00:24,看演员和服化道就好了。絮絮叨叨的解说词，无聊的上流生活，一边求婚一边调情拖沓冗长的感情波动Get不到。,0
1,1301465,纯真年代,HarperDie,1591741,推荐,2018-04-18,17:41:00,锦衣玉食培育出的玛丽苏男主人设，在斯科塞斯的视角里本应更具黑色意味，但为纪念父亲而作，显然视角变得柔和许多。三角关系毫不新鲜，可薇诺娜·赖德的角色太特别，不谙世事外表下，隐藏着不受干扰的理性。众人皆沉溺纠葛，唯她独醒。没有抱怨，效果却比咆哮猛烈得多。DDL只要出现，就腿软想瘫倒。,6
1,1301465,纯真年代,Paper Planes,haishou,推荐,2010-12-20,22:54:50,引自iceblade“纽约红楼梦”。颇古典的题材，Martin Scorsese却用了很多让人出戏、更前卫的手段来来干扰观看的注意力。画入、画出、层叠、出圈、画内音时大时小……更不用说华丽不露斧凿痕迹的长镜头。调动声画元素的技巧绝对牛逼，教科书电影。唯一的缺憾是旁白带动叙事太多。,1
1,1301465,纯真年代,人家还小,wagalimaxida,力荐,2011-01-29,23:03:39,男人从不担心他的未来，直到他找到一个妻子；女人常常担心她的未来，直到她找到一个丈夫。曾经有一次出轨的机会摆在我面前，我没有珍惜，直到失去后才追悔莫及。,0
1,1301465,纯真年代,逃离豆瓣倒计时,Shea1997,推荐,2018-12-11,16:59:13,总觉得隽永感不强（所以对角色没有感觉），这方面好像英国拍的比较让人印象深刻。,3
1,1301465,纯真年代,Lumentza,49674457,推荐,2011-03-01,13:44:13,大学时候看的，好朋友当成经典推荐给我，我的期待值太高，看过觉得也没有那么好嘛。而她也觉得我强烈推荐给她的不怎么样，哈哈哈！我们互相残害了对方的经典。,0
1,1301465,纯真年代,Cherry。,34035222,还行,2013-04-28,21:54:42,可以改名叫<红玫瑰与白玫瑰>莫,0
1,1301465,纯真年代,Isa,laylatheghost,还行,2014-01-24,17:53:53,从服装到表演到摄影弥漫着一股富人味儿。。斯科塞斯真是特别能引人入胜啊。流畅，严谨，动人，像一支完整的舞。男女主角关系的处理上有点略矫情了。。,0
1,1301465,纯真年代,五月微蓝,xzf1982,推荐,2017-05-01,22:06:42,表面纯真的人腹黑起来才更可怕吧，到最后有点同情男主，上流社会的人有时候也挺可怜的。不过这剧也挺现实的，现实里很多人就是爱着一个，却和另一个结婚生子度过一生。PS：没想到老马还拍过这种上流社会的时代剧。,0
1,1301465,纯真年代,Baby penguin,228306050,还行,2022-11-03,23:48:56,《廊桥遗梦》性别转换版。故事本身没有问题，问题在于男主爱上的人是未婚妻的表姐，这种设定本人无法接受。你可以去爱一个陌生人，一个完全无关的人，爱上未婚妻的姐妹，oh come on cut the shit，你的世界就这么小吗？ 如此一来，对于这位未婚妻来说，相当于同时被两个人背叛，一个爱人，一个亲人（姐妹），这太残忍了。开场纽约上流社会的豪宅让我眼花缭乱，上一次看到这么奢华的布置是在卢浮宫。 服装考究，可以作为摄影师参考影片。 所谓“纯真年代”指的是什么？ 是未婚妻的纯真吗？ 婚前她让男主再三考虑，婚后发现男主移情，用孩子挽救婚姻。总有像她这样一辈子纯真的人，活在各种保护下，以为世界和她的家庭一样是个童话。 我嫉妒这种人。大表姐在海边的背影像一幅画，可以仿拍。 和廊桥遗梦比差的多。,1
1,1301465,纯真年代,Don't Panic!,fastkill,力荐,2016-12-16,23:23:06,古典、迷人、沉郁，节奏缓慢但又张力十足，锦衣华服美轮美奂下是汹涌的情感，无论哪个方面都无可挑剔，十足大师范儿。,0
1,1301465,纯真年代,Rosina,56505302,较差,2020-05-30,13:08:23,"旁白太多，不是我的点…（当然这可能是这一类影片的一种惯用拍摄手法。）诚然，我们不能用现代的爱情观和教条来限制以往的爱情，但是我们不能控制自己，用自己的道德观来批判这种明知不够爱却仍要结婚，结了婚又后悔，后悔又吃吃不下决断的懦弱男性。
第2次影评又认真看了纯真时代，结果发现这部剧确实有意思，剧中表面最纯真的人实际上心思最深，表面离经叛道的人却纯真的为了亲人和爱人，放弃了自己的爱情，远走他乡。男主角也并非那么自私，他只是被社会习俗压得无法决策。",0
1,1301465,纯真年代,只一人,atthecaryworld,力荐,2009-10-22,22:23:43,压抑的纯真年代，社会的压力就是这样透过最亲密的人传达到你的身上，就好像May对于Newland。Newland和Ellen像是这个世界里唯二的在玻璃窗上看到自由的苍蝇，彼此依恋，甚至想要一起冲破玻璃。但终究还是屈服了。,0
1,1301465,纯真年代,小水,xiaojiong,较差,2014-06-14,21:32:12,美版半生缘，前一个半小时雷得风中凌乱，丹尼尔·戴·-刘易斯演得一炮污还自我感觉爆好，剪辑也是乱七八糟，但是最后半个小时突然有了点noir的味道，反而把整个全面跑偏的戏统一了起来,2
1,1301465,纯真年代,クマのプーさん,BonnieWinnie,力荐,2009-03-22,15:08:25,虽然给五星，但还是比不过原著,0
1,1301465,纯真年代,Yuya,Yuya1987,力荐,2008-01-21,16:04:42,不敢再看第二遍，因为实在让人太伤心,0
1,1301465,纯真年代,Downing,2033595,力荐,2007-11-25,00:36:15,缓慢的节奏将这场看似悲情惋惜的爱情演绎的如此动人，犹如悲剧一般。,0
1,1301465,纯真年代,Miss Bee,vivisnbb,推荐,2014-06-02,23:11:38,这是一部看似唯美但其实很反映现实的电影，也可以形容为得不到的永远在骚动，但其实男主用一个遗憾可能换得了一生的平静幸福，这其实是大部分easy模式人生的样子，想说说梅，我想她是人类大智慧的代表吧，Innocence是表象，说她无趣真是大错特错，只是这样的人，有时也让人有点害怕啊。,0
1,1301465,纯真年代,容安,fishandtree,推荐,2010-06-05,23:36:20,不管婚前那姑娘多单纯多无知，婚后她的本能将你牢牢拷住。小子，你死定了。,1
1,1301465,纯真年代,不爱™,myhyukie,较差,2021-07-19,05:45:21,不行看的我恶心 一对渣男女 男的舔脚已经令人生理不适了！诺娜好美好灵 两星都给她,3
2,1301465,纯真年代,李子鲤|Lilith,plumcarp,,2008-06-28,19:06:31,没有看的很仔细，相比现在的好莱坞电影，我还是喜欢沉静的镜头运动，现在的电影镜头很灵活，不灵动。其他的，人物刻画细致……废话！,0
2,1301465,纯真年代,doublevie93,3226958,还行,2011-07-28,23:46:19,没有小说好看。情节几乎一模一样，可感情走向上差很大。小说里感觉allen和newland是被束缚了住的真爱，may是美丽贤良空洞无趣，而且应该是高大的希腊女神式的~薇诺娜那么娇小清新美貌，菲佛压不住啊。小说看到结尾哭了，看电影没什么感觉，平实优雅。p.s.纯真指的不是任何一个人吧,0
2,1301465,纯真年代,万物静默如谜,156401178,力荐,2020-01-01,21:46:32,实在太感人了，真的好想哭。大家都是以自己所要坚持的方式去爱人，如果仅仅把其中所不能的关系当做社会规则的束缚，完全不能忽略还是那个最纯真的承诺，为了爱而爱的年代，为了永恒，每个人都以一种沉默庄重的方式在回应他们所不得不面对的情感。整部片子都呈现了一种整体性的结构性的古典美感，演员的演绎让这种美生动起来，大爱。,1
2,1301465,纯真年代,爱看书的小咪,180668719,推荐,2022-03-09,21:35:18,不知道原著描写的是不是和电影一样，电影里真的很不喜欢艾伦这个角色，说她独立，有反叛精神，不在意世俗眼光，但是欲情故纵，顾影自怜勾引自己的妹夫就让很无语，我甚至不知道她到底是不是喜欢男主，更觉得男主只是她想展现自我的魅力的一个试探，并不是真的想和他在一起。男主对她的爱可能也只一种对上流社会一层不变规矩的反抗吧。,1
2,1301465,纯真年代,樱桃肉丸子,18420290,力荐,2011-02-22,19:19:54,"我喜欢类型的片子，古典、优雅、含蓄而深情。 
",0
