page_index,movie_id,title,username,user_id,rating,date,time,comment,useful_count
1,1301465,纯真年代,邝子约,kjh123frog,力荐,2017-05-14,12:13:33,冷冷的旁白创造了间离的视线。剧场式的推镜、聚光、恢复、拉镜与戏剧演员的粉面相对照，附加了一层讥讽的隐喻。那无目的的长镜头，那些画，那伪造成长镜的时光飞逝的蒙太奇，表达出人虚度的人生本意。爱情是真的，伪善也是真的，每个人都很厉害，每个人也都不是那回事。马丁斯科塞斯是一个真正的导演。,2
1,1301465,纯真年代,溅溅D小雨,159034594,推荐,2022-03-22,23:13:22,人的贪欲啊，社会地位 家族名誉 前程面子 老婆 情人通通都不想舍弃。偷情就算了，还希望老婆死掉。庆幸吧，你还得到了你老婆的爱。他老婆不该被谴责，她之前捍卫了她的婚姻啊。男人在婚前是有选择的，只是他不愿意为了爱情抗争，权衡利弊之下。,2
1,1301465,纯真年代,Stella,dakotazheng,力荐,2011-05-10,16:30:19,当时的薇诺娜真是美以及Michelle真的是一位非常有魅力的古装演员,0
1,1301465,纯真年代,Superhat,hsuperhat,推荐,2014-11-17,00:20:49,故事和画面无可挑剔，Lewis、Pfeiffer真是了不起的演员，在狭小的情感流露中蕴藏滚滚能量。因为永远不能发生却永恒纯粹的爱，他吞下了她递到嘴边的毒药。她最后一次垂下眼帘、他最后一次凝望，几乎撑破心脏。遗憾Winona怎么看也不像俗妇。缺几处胶片，跳帧，部分翻译不合情，不相信是资料馆做出的事。,0
1,1301465,纯真年代,人煽人嗨,3032632,推荐,2008-10-09,16:53:57,第一次看的时候还是录像带呢。看到最后才觉着很感动。可能没有得到的爱情才最刻骨铭心。,0
1,1301465,纯真年代,lulu,lucindacinema,推荐,2010-06-14,01:08:51,没有逃过经典的厄运，依旧不知道它想干啥，所以验证了不能在看电影前看太多介绍的真理。而且，那种看似深沉，其实我觉得就是没事儿找事儿的爱情压抑片，真的不太适合现在社会，不过，各有所需嘛，马丁还是发挥了正常的水平，不过更偏爱他的动作片,0
1,1301465,纯真年代,三七,narcissus_iris,推荐,2018-03-03,17:53:40,Michelle Pfeiffer那么美,2
1,1301465,纯真年代,Evangeline8,4097674,还行,2013-10-20,15:03:36,"嘿^MScorsese拍此类型,真下好几年功夫！我几次和他见面&交谈^都感觉他的睿智幽默*能量*不愧我大天蝎。so从不屑和只能凭借我双生火焰~才在各名利场作秀的低级模特..即使能见到这些大虾*没内涵思想都无法与人家对话~有入场券又有毛用呢?LOL 此片的幽情隐藏，劳资是绝壁不会让之在现实中上演！",0
1,1301465,纯真年代,徽柔Orchid,32131802,,2016-02-03,21:26:53,费了大力气才找到片源。这么多行尸走肉，不以为意，却将鲜活的生命无情扼杀。无敌破坏王上场的时候好的坏的都没有分别，全部消失不见。,1
1,1301465,纯真年代,jo,oojooo,力荐,2009-06-05,19:58:16,这部电影让我爱上了3个主演，爱上了华顿，爱上了压抑的爱情。大爱~,0
1,1301465,纯真年代,picnic,picnicskins,推荐,2016-12-21,22:58:47,梅，真·大Boss啊。想想也觉得，一个没有工作，活着就是为了相夫教子的女人怎么可能对老公的变化毫无察觉。表面看是个俗气的大小姐，但是射箭那场戏能说明一切啊，这个女人的隐忍、专注力和执着是最拔尖的。这样的女人我宁愿将一生埋没在她的黑洞里。,1
1,1301465,纯真年代,ilia,ailiilia,推荐,2012-01-11,12:11:09,比起原著，远为黯然失色。在我眼里艾伦是黑发的。另外两人比较像，梅也太美了吧,0
1,1301465,纯真年代,O盐盐er,Oninia,力荐,2006-12-09,18:53:36,There's a kind of love belongs to the Age of Innocence,0
1,1301465,纯真年代,蜉蝣渡海,56392220,力荐,2013-11-10,16:38:14,有时经常会忘记，虽然美国的历史短，但是也是有恪守传统礼仪保守的时期。所谓的纯真年代就是那个传统的年代，在婚姻方面人们要找门当户对的，婚姻不允许失败，更不用说是离婚，爱与不爱都得过下去，那些想走在时代的前面追求自由和爱情的人们最终会在无形中被打败，撤退。,1
1,1301465,纯真年代,levitating,levitating,推荐,2006-12-16,03:13:30,斯科塞斯的另类唯美之作，隐忍如斯，究竟谁才是谁的缺憾?,0
1,1301465,纯真年代,crescentmoon,marilyn9l,力荐,2009-12-14,20:21:55,暧昧真是不留痕迹。华丽的布局、服饰、细节、美食、生活……女人越不主动越能吊人胃口，恩，真理~为什么要带着遗憾一直到老呢？,0
1,1301465,纯真年代,凉水,crpily,推荐,2012-11-26,12:24:20,义无反顾的倾心，流浪在爱情边缘的纯真。玻璃窗反射的夕阳光芒照亮他的脸庞，往事也渐渐历历在目。一瞬光华，竟也可以点亮整个生命。见还是不见，一生的爱与痛都就在风中颤颤巍巍的摇曳着，就像结尾他的背影一样。剧情故事不是我喜欢的类型，但是结尾拍的太美。布景服装太精致。,2
1,1301465,纯真年代,福特佳,47664573,推荐,2011-11-26,17:33:02,电影就像19世纪的女装一样精致、考究，导演非常用心，可是在处理三角关系上缺乏表现力。导演给一星，米歇尔·菲佛和丹尼尔·戴-刘易斯给一星，诺威娜·赖德的美貌给一星。,0
1,1301465,纯真年代,好运锂,iuheuxnehc,推荐,2010-03-29,00:15:54,"虐啊，in fact the innocent ones are those who mean to be, suppose to be but lost it",0
1,1301465,纯真年代,crystal53451,crystal53451,推荐,2022-02-05,20:46:55,因为时代不同，电影里人物都很克制，但又不能彻底克制住，导致两位主角藕断丝连互撩了整部电影。三人关系虽然都没说穿，但三个人都心知肚明。男主最终一辈子痛苦的原因不正是女一女二爱他的理由之一吗？现实一直是很残酷的，想要脱离时代背景前卫地过一生、还不伤害他人是很难的。三个人但凡有一个人更出格一些，电影走向就完全不同了。演员真够养眼，DDL的眼神演得真好。虽然这部片子主旨有关自由与道德，但不想对角色做太多道德上的评判。人总会渴望得到得不到的东西，像看廊桥遗梦一样，我会想如果他们真的在一起，会幸福多长时间呢？男主很文艺，爱诗歌爱艺术，还有一个场景他在看浮世绘画册，而浮世绘恰好大大影响了印象派。海滩那个场景像是加了滤镜，很印象派，契合当时流行风潮：印象派从法国红到美国。,0
1,1301465,纯真年代,JulyChan,JulyChan,力荐,2006-12-06,15:24:23,捍卫爱情的纯真与压抑爱情的纯真，明知是错还要相爱，明知失守还要挽留。最难忘的最后一幕，老去的他远望窗口那一位老妪。纯真年代已随风逝。,1
1,1301465,纯真年代,跳跳张,Allina,还行,2006-01-31,04:20:47,当年我多喜欢那小说……这片拍的……真是……,0
1,1301465,纯真年代,泽琛ZZC,58568708,力荐,2014-01-11,15:47:09,真爱一定是没能伴随你一生的那个人，她埋在心底，直到永恒·。,1
1,1301465,纯真年代,啊砸,moviefun,推荐,2013-06-03,23:40:45,怎么说呢，这样的题材其实是那时候已经是被拍烂了吧，在转场的时候老马丁对于当时纽约的绘画，书籍，甚至吃饭的餐具还原的极为精湛，艺术品抢了电影的大部分风头，显得故事更为的平庸，到头来在结尾部分还是被感动到了。这样对于节奏的控制力只属于老马丁,0
1,1301465,纯真年代,张果粒-Zy,165357223,很差,2022-03-31,13:28:20,原谅我的社会主义核心价值观无法理解这种搞破鞋的电影。那个时代好像就是这样子的，安娜卡列尼娜，生命中不能承受之轻等等等等，当时看来是摆脱封建家庭的桎梏，寻找真爱，可现在看来不就是出轨么。果然，时代造就电影。,2
1,1301465,纯真年代,友邻广播,mikaLynn,推荐,2013-08-15,01:02:17,Zeit der Unschuld，woman should be clever as May,0
1,1301465,纯真年代,narcissus,2557882,还行,2011-12-17,23:55:51,他儿子倒是和他妈一样聪明。PS：年老了也不调整下声音,1
1,1301465,纯真年代,luer..一串字母,luerdelphic,力荐,2020-03-15,22:20:59,有种很矛盾的感觉，很喜欢这部电影的文学气质和年代感，但前面一直对剧情很排斥，直到后半部分才渐入佳境。开始看的时候在想，这是毛姆老师写的狗血婚恋剧么？作者为什么要这样对读者施行PUA？不过在音乐、画面和演员们风平浪静下的歇斯底里的表演中，渐渐沉浸其中了。,0
1,1301465,纯真年代,把渣害,LilyKingcjgg,还行,2010-06-28,16:53:10,其实我不懂这戏除了画面美之外还有什么值得吹捧的,0
1,1301465,纯真年代,Fantasy,FantasyDuan,推荐,2011-08-24,11:21:39,拍惯了与世界为敌题材的老马丁第一次让自己的主角对现实妥协。一个斯通见惯的三角爱情片被老马丁点出了时代的神韵。可怜的主角在社会习俗大众审判下既没有得到自己心爱的人，也没能在自己老婆生前明白她的牺牲。为了维持时代表面的纯真，有情儿女们熄灭了心中的爱苗，遏制了内心深处那份真实的不纯真。,29
1,1301465,纯真年代,焦糖爆爆D,50787142,力荐,2019-11-17,23:22:50,"婚姻果然是爱情的坟墓。老纽伦默默离去的背影太令人辛酸，两个炽热灵魂终生无法靠近，岂不白活？梅一个提前透露并不确定的怀孕消息的小心机，就把他们天人永隔。心疼艾伦。
斯科塞斯送给父亲的故事，难道他父亲就是纽伦？纽伦说，没想到懂他放弃了自己最渴望的东西的人竟然是梅，有些感动。这样是表面上看起来对大家都好的选择，事实上只有当事人在承受内心煎熬。影片对爱情与婚姻剖析得深沉，丹尼尔·戴·刘易斯的演技也绝对对得起三座小金人，bgm很烘托悲情氛围，片中人物服饰、建筑软装尽显70年代美国上流社会的奢华。没想到马丁·斯科塞斯不但灰色幽默、黑帮、悬疑拍得好，对于情感刻画也能如此细腻深入，更期待看到他的《爱尔兰人》了。",0
1,1301465,纯真年代,慕詩,147190792,推荐,2017-08-19,09:32:31,好精致，音乐动听，红玫瑰白玫瑰都那么美。,1
1,1301465,纯真年代,非想,muoke,推荐,2021-02-15,17:16:26,19世纪的美国上流并不纯真，贵族的声色犬马，充斥着虚荣、虚伪、虚华，贵公子、红玫瑰与白玫瑰的故事成了一股清流，爱情因为隐忍而伟大着总是文艺创作的理想状态。薇诺娜·瑞德完美无缺的白玫瑰形象是“因纯而真”，纯洁、天真，innocence是无知也是无邪；米歇尔·菲佛敢于反抗世俗的红玫瑰特质，又有成人之美的高品格，是“因真而纯”，真实、纯粹，innocence是清清白白。丹尼尔·戴-刘易斯水边遥望倩影，灯塔与夕阳下粼粼波光，好似了不起盖茨比心中的绿光。人生的纯真时刻意难平，便纵有千种风情、更与谁人说？热烈激情的红玫瑰为他人留一顷碧海蓝天，单纯赤子的白玫瑰为自己编织一缕红尘醉梦。整个故事没有人受到实质的伤害，这就是纯真之所在吧。,0
1,1301465,纯真年代,阿门,1042464,还行,2008-02-12,10:51:02,看宠大的场势应是史诗电影 但却只花费在一场三角之恋中 导演精益求精的态度值得赞赏,0
1,1301465,纯真年代,ChrisKirk,58244021,推荐,2018-04-18,16:17:58,享受孤独的前提是拥有陪伴，接受爱情的前提是拒绝亲吻，是纯真背后的空洞无言，人人都身着千篇一律的假面，在传统底线附近徘徊期待着凌迟的刺激快感，喘气吸入如活埋后的厚重尘粒，内心早是斑斑狼藉外表却是自律到底的精致，最后楼下徘徊神似“见到你之后就会变回老样子”的文字感官，DDL柔情似水。,0
1,1301465,纯真年代,Butler,Butlerliu,推荐,2009-06-02,08:50:28,太长了，刚开始没劲...,0
1,1301465,纯真年代,hildgard,2403833,力荐,2008-10-24,08:49:12,那段时光。。。。。。,0
1,1301465,纯真年代,大佑,yoyoangela,还行,2013-05-29,01:16:07,3.9 都是些甚么人啊...看得我頭暈眼花氣呼呼的....不過不知道為什么馬丁的長鏡在這么古典的片子裡盡然味道跟黑幫片的感覺完全不一樣....＝＝,0
1,1301465,纯真年代,Mathilda,Mathilda,推荐,2007-10-31,00:54:10,虽然戴刘易斯是我讨厌的少数一个演员之一 但是瑕不掩瑜啊。。,1
1,1301465,纯真年代,jingkids,1522799,推荐,2011-09-03,12:00:57,#k片小白鼠#old fashion的东西，却常常有点东西留在心底,0
1,1301465,纯真年代,曼仔,Erman-Wei,推荐,2018-07-13,00:02:21,老马丁的导演技术没的说，纯熟又漂亮，但真的是电影风格即导演，比如李安也压抑，但是无论理智与情感还是断背山，都有冲破束缚的时刻，而纯真年代啊，真的就是……“幸福”就是一辈子谨小慎微压抑自我。整个片子都没有那么难过，但是最后那一眼，真的是看的我眼泪夺眶而出。,3
1,1301465,纯真年代,猫猫-,33505904,力荐,2011-03-30,14:19:42,"最近看片真是太不仔细了
",0
1,1301465,纯真年代,蘑菇猫会吐泡,foreveryoung01,还行,2013-04-18,17:21:13,再唯美经典的影片都能被央视配音版毁得一塌糊涂！！,0
1,1301465,纯真年代,yamamaya,yamamaya,力荐,2014-04-22,21:25:27,唯美，那是欧洲的矜持与新教戒律束缚着新大陆贵族心灵的纯情到发疯的年代，may的死就像是那种纯真与空洞的消亡，得不到的永远是最美的，而错过则需要用一生来凭吊（真想不出ms可以在拽霸酷暴力片外拍这种，也是个老妖,1
1,1301465,纯真年代,梦里的花,164252860,推荐,2021-10-06,15:37:35,7.8。论一个太过美好的女二会使男女主于世不容的深情显得如何的不动人。毕竟是你主动追求人家的，而且人家婚前也给过你机会了，你自己没把握住总不能让人孤儿寡母过一世吧。还有这片把薇诺娜拍得太太太漂亮了！以及女主角是不是得罪了服装组，这片她一点也不漂亮欸。。。,1
1,1301465,纯真年代,yum,yumm0590,还行,2008-09-10,16:08:06,基本还是可以归类在女性题材的，与当时保守作风有强烈冲突的女主。虽然MF演技了得，但太碎的卷发还是让我经常从戏里跳出来,0
1,1301465,纯真年代,苦苦苦苦,likuku,力荐,2020-02-16,11:02:51,"精巧的戏剧化，人物间微妙细致，主角们演绎的自然到位，华丽的画面，时不时让摄影机镜头以现场参与者的第一人称视角长镜头进入，很有沉浸感。片尾打出字幕，导演将此片献给自己父亲，这才想起是斯科塞斯导的，没想到他拍爱情文艺片也相当厉害，之前只当他是黑帮爷们片专业户。
2007-11-23 标记想看，2020-02-16 临晨一气呵成看完，标记了十二年的深坑了，终于填了。感谢进来给我力荐此片的好友，否则可能这个坑只会越来越深。或许拖了十二年后才看也是好事，二十来岁毛头小子很可能难以理解这片微妙的好。“真诚待人待己，女人们很强大又智慧，千万不可小视，要尊重和尊敬她们”",0
1,1301465,纯真年代,了不起的花轮君,ishtarie,推荐,2014-06-28,13:53:20,婊就一个字。你真以为跟她一起过了就幸福了啊，呵呵，别傻逼了，要吃多少苦头都不知道。,0
1,1301465,纯真年代,虚弱橙,oranjeruud,推荐,2017-06-08,22:05:07,青年Winona Ryder美得惊人！但结尾把之前那种悬而未决的开放性给取消了，略可惜。,2
1,1301465,纯真年代,红皇后,yican,力荐,2020-12-13,20:06:03,大导演就是出手不凡，可甜可盐，你很难相信这是《爱尔兰人》的导演，因为片子是如此细腻优雅，回味悠长，不动声色的长镜头，隐晦的交谈，微妙的讽刺，偶尔铺陈的细节，让你和男主一般慢慢领悟，三位主演都是尤物，都尽到了本分，不多不少，比较完美的电影，这个世界有纯真的年代吗？这恰是个世故的年代，只是人有纯真年代，可是谁是纯真的呢?世故是世故者的通行证，纯真是纯真者的墓志铭。可是起码纯真之人拥有更为坦然的内心，坦然面对无尽岁月。,0
1,1301465,纯真年代,嵇澹,Eucatastrophe77,推荐,2021-07-22,17:47:19,红黄玫瑰繁花锦锻的浮华色彩覆盖衰朽裂隙，两种选择以抗争姿态象征从阶级内部反抗直捣系统的野心，终究臣服于现实，瓦解于时间。激越旋律为生命流逝降调，眼神流转的低语宁静无波，流言蜚语行使道德裁决，声色缭乱掩盖谋杀操演，共谋者无需开口审判，流亡人心知肚明返乡是再度放逐。而她作为纯真年代的挽歌，盲目至白至亮仿佛镀金时代美国一句易碎隐喻，被隐去的视角成全幻想迷楼也以神化空无沉没男性叙事。她拒绝窥视续写和他篡改记忆创造的永恒达成双联默契，回忆神龛如愿封存，他与自己逃避的虚伪和解，禁锢美其名曰纯真，隐忍被文饰为怜悯，如同老之将至时分给荒唐岁月蒙上一层朦胧的纱，他见她们于石雕柔荑，于画中仕女，真正贪慕垂怜的却是倒映执念光洁表面，身披荣光的圣人一般的往昔自我，只有当现世的窗关上，灯塔下的人才能在白日梦境里回头。,1
1,1301465,纯真年代,Tender,70890847,较差,2020-04-06,17:25:07,马丁拍黑帮片都觉得冗长琐碎，还敢拍这种题材...,2
1,1301465,纯真年代,西木的风,4668466,推荐,2018-04-10,07:52:58,20年代纽约上流社会的众生相，华丽精致的笔触下是对人性深处自私与贪婪的大胆探究。“纯真”年代中年轻人的青涩和简单只是外表，好在结尾的转折充满了善意的光彩。整体优秀且细节出彩，但是斯科塞西的女性角色仍显不够细腻。,0
1,1301465,纯真年代,琳琅满目,1031591,推荐,2007-06-22,18:22:31,the ending part make me so depressed,0
1,1301465,纯真年代,冯恩特,50179666,还行,2023-01-21,06:15:44,若以其价值所在定性，与其说是爱情电影不如说是反映当时上流社会的景观电影。原本以为旁白的声音出自艾伦或梅，突然联想到《小城之春》，也是某特定时空的三人爱情与家庭纠葛，加神旁白。然而并不是，这里的旁白只是旁白，比小城之春俗多了。当然该片的演员还是极好的，外形养眼。这种电影所谓的时代感强在何处，不仅在美术或者台词，更多的可能是人物的内在逻辑。如果现在再拍这样的爱情片，观众已经很难接受人物的想法和行为了。最后10分钟有点生硬。,0
1,1301465,纯真年代,毛球,beachbay,力荐,2010-03-22,06:27:35,除了马丁大叔关公战秦琼的使用施特劳斯，其他都很好,0
1,1301465,纯真年代,only,serena-only,力荐,2010-02-13,09:01:12,"掩盖的纯和遮蔽的真。
每每想到他的脸，怅然。",0
1,1301465,纯真年代,吴地越人,JoyceJB,推荐,2007-08-07,21:22:18,苦恋死守是爱，懂得体谅亦是爱，两情相悦是爱，倾心单恋亦是爱，相爱却无法相守是悲剧，相守却无法相爱是更大的悲剧！,0
1,1301465,纯真年代,薯条先森,Sataaaaaan,力荐,2011-10-08,13:25:23,多年以后 他来到她的楼下 坐在长椅上 脑海中出现的一直都是最美好的她 原来他们的爱无需表达 所以 他站起来 缓缓地走过了那条街道的尽头,0
1,1301465,纯真年代,喵小星,ovosophia,推荐,2013-09-10,02:05:40,故事很美 场景 音乐都很美 可惜故事没讲好。又是一个明明深爱却注定错过一生的悲剧，注定？不过都是一次次的错过和选择这辈子他们或许也就牵过几次手，吻过两次，而最后却也是没见。不太明白怎么就相爱了的，不过梅倒是个有趣的人物，都说她纯真，她或许就像个漂亮的娃娃，可最后好像一切她又都明白。,0
1,1301465,纯真年代,秋天的黛西,MademoiselleXie,推荐,2015-03-05,01:54:37,他只是在楼下遥望着艾伦的窗口，年轻时代的艾伦灿烂的笑容在纽兰的心中如鲜花绽放，他终于明白他一直在心底保存着他最美好的记忆，生怕它被岁月的流逝所淡化。他和艾伦的爱是一种在心灵和灵魂上的爱，遥远，而又亲近，无需表达，尽管不那么喜欢这一段感情。被他认为“那么深情又那么缺乏想像力”的梅，却了解他所有的秘密。,2
1,1301465,纯真年代,梦溪,wind_whisper,推荐,2010-06-22,19:05:34,怎么也想不到这是martin scorsese的片子。。太无奈太心碎的爱情了,0
1,1301465,纯真年代,听见流星的声音,130822019,推荐,2020-02-13,23:42:49,本片改编于伊迪丝沃顿的曾获得普利策文学奖的同名小说，马丁斯科塞斯试图拍摄一部制作上美轮美奂，在技术上完美无瑕的古装爱情片，结果拍出与其风格不同的拘谨作品，在华丽的包装下确实一度复活了十九世纪七十年代的纽约，但叙事手法有点绑手绑脚，演员虽然表演精湛，但全片缺乏情感的纽扣，显得冷淡许多,1
1,1301465,纯真年代,Koi,jasilydu,力荐,2011-10-24,17:25:22,may由起初的天真少女到怀孕挽留自己的丈夫，拯救婚姻，没有将自己的怀疑公诸于世；“可爱？她以前可不是这样”ellen从前离经叛道的性格和行为；newland对当时上流社会虚假的逃避，对ellen的着迷，已经妄想与之私奔......因为这些，才使得一个完全有可能以“化蝶’悲剧收场的故事，显得真实，纯真！,0
1,1301465,纯真年代,right,48859861,推荐,2022-01-16,02:02:18,…世間安得雙全法是吧。又想要循規蹈矩的安全，又羡慕離經叛道的自由，Newland野心不小。他對Ellen的“真情流露”，仿佛實在把自己脫了疆的綺念歸咎於對方——都怪你太可愛了，是不是有點裏番味兒了。明明自己也在勸她不要離婚裏面摻了一脚的。Ellen和May看上去更像是”傳統“和”名聲“，當然還有錢，的犧牲品，她們所能依賴的只有（支持自己的）家族，或者丈夫，所以Ellen順坡下驢，May也用了些手腕。全員惡人。| 薇諾娜太美了，她笑起來仿佛所有百合都開放。雖然DDL也挺帥，但是人物實在是…,0
1,1301465,纯真年代,Antares | 青空,IF.Cathy,,2014-01-19,20:30:13,豆瓣简介写的是个屁，颠倒是非黑白。就是这部戏让薇诺娜移情别恋？她和德普分手都快二十年了。。。,1
1,1301465,纯真年代,花二刀,a100600,,2014-06-14,22:10:45,唯美浮华的配图朗诵，悔恨投错时间胎。,1
1,1301465,纯真年代,逍遥乐,226204151,力荐,2022-12-14,18:40:16,要么违反道德并因此被社会唾弃；要么遵守规则，看着自己的激情在内心慢慢灭亡！爱过就爱过了，所有的真爱都来自于情不自禁，所有的分手也都是极其自然。不该爱，不能爱，及时回头。像不像林徽因的情史？否则又要被推到风口浪尖，成了被人诟病一辈子的人。结局丹尼尔·戴-刘易斯的理智，应了林徽因的这句话：情出自愿，事过无悔。,1
1,1301465,纯真年代,eyHanAKo,72993383,推荐,2014-02-17,03:57:00,一段終生遺憾的感情，看兩個小時電影，或讀幾日小說故事，還可以承受，若要親身經歷，太沉重了。一方面慶幸自己生於戀愛自由的世代，同時亦慨嘆現今歷劫不渝的愛已難尋。,0
1,1301465,纯真年代,小鱼脆饼,xialuoweiming,较差,2010-03-07,00:34:59,纯真个头~猥琐男的装B之作········,2
1,1301465,纯真年代,gucci7228,gucci7228,推荐,2010-05-02,21:18:48,青年时期拥有的一份最纯真、无私的爱情，却始终未能承蒙机缘的眷顾，在经历了若干次错失的时机之后男主人公最终未能免俗的接受了命运的随波逐流，在体面却苍白的无爱婚姻中恪尽职守直至妻子离世的若干年后，方才知道令自己错失真爱的真正原因，此时幸福的记忆以无力面对时间的磨蚀，留存于心方可释然。,0
1,1301465,纯真年代,闪电杰克,4403160,很差,2014-06-16,17:00:49,#17th SIFF#第二场《纯真年代》：经过4k修复后的Winona Ryder有了一双更美的剪瞳。但就影片而言，老马花哨的运镜和刻意的用光显然与这部熨帖的美国小说有些格格不入，而大段大段画外音的原著诵读简直犹如催眠曲般破坏了视听语言的美感。不是电影不好，而是它与老马的气场完全不合。,0
1,1301465,纯真年代,chrissy,alele,推荐,2009-01-08,00:40:44,上课看的，“他，是世界上最优雅的男人”...扑哈哈~,0
1,1301465,纯真年代,Chaall,lmyyeer,力荐,2020-02-10,02:54:13,爱情片天花板。她怕他着凉，他却想她去死，老马说这是他最暴力的电影。,1
