page_index,movie_id,title,username,user_id,rating,date,time,comment,useful_count
0,30208007,藏北秘岭·重返无人区,Eileen,duduelien,推荐,2018-08-31,22:10:37,"#藏北秘岭·重返无人区# 关乎藏区的片子我都是很投入的去看的，这部也不例外。从纪录片艺术表现性来说，整个过程有点混乱感觉。但是致敬摄制组带来普若岗日冰原的绝美风光！非常美！很感动！单就这点就很值得看。95后的导演，支持有想法的年轻导演！

题外话，在这部片子里，藏族男人和汉族男人放在一起对比还是挺明显的，那就是藏族男人轮廓分明，歌声自然，很MAN，而汉族男子同样的户外着装，总给人感觉，肉。哈，大家别骂我，真的感受。",1
0,30208007,藏北秘岭·重返无人区,渣叔,zhashushu,还行,2018-10-18,23:27:07,羌塘不接受情怀和理想，只会检测你的准备和意志,3
0,30208007,藏北秘岭·重返无人区,0402152,BlackSage,还行,2018-08-29,12:21:45,"当无人机撞山的那一刻，我就在想“这一切，真的结束了么？”这个念头一直纠缠着我，制片人在影片中痛哭流涕说着“尽力了”，航拍没有完成，不过能够环绕冰川一周，无人伤亡已经是不错的结果。而导演子君得知无法再继续登顶的时候，那神情似乎不甘又有些迷茫，子君的父亲--一名登山探险家想要登上十三座8000米高的山峰，不幸于第十一座蒙难。这一次的经历，也有着一位少女追赶自己父亲的情感。放映后子君向我解释道，在无法登顶的那一刻，她感到了自己的渺小，也许今生也难以赶上，但也感受到了一些东西，父亲属于大山的那一部分。
我一直在思考，人类或者灵魂的本质是什么，在探索世界真实的过程中，一直伴随着迷茫，有过沉沦，也有过顿悟，有过暗无天日的阴霾，也有过蓝天白云的秋爽。真实到底是什么呢？我只知道那不是我的幸福，至少现在不是。",6
0,30208007,藏北秘岭·重返无人区,fifi.li,schoolgirlhihi,很差,2019-06-13,07:04:50,一部纪录片没拍美景 一直在拍自己遇到了哪些困难 团队一直在因为困难吵架 我醉了 女导演为了自己的情怀搭了这么多条命 不要再拿西藏来表达情怀了 受不了,2
0,30208007,藏北秘岭·重返无人区,木头人,64681893,还行,2020-09-05,12:41:19,16台车，几十个人，有点旅游团出行的感觉，坚持看完，说实话并没有被感动,1
0,30208007,藏北秘岭·重返无人区,段郎RockDuan,rockduan1987,还行,2018-09-05,19:34:47,"感慨于这帮人的勇气和心性，再度被羌塘的绝美风光震撼。
然后过于煽情的配乐和叙事，虽说是真实细腻的，却破坏了一部西藏纪录片该有的冷静。
一场伟大的失败，倒也可敬，鼓励一下吧。
致敬导演子君的父亲，子君很坚强也很美丽，期待下一部作品。",0
0,30208007,藏北秘岭·重返无人区,冲田总悟,148933548,还行,2018-09-02,19:22:26,风景真美,0
0,30208007,藏北秘岭·重返无人区,莲叶何甜甜,164664591,较差,2018-10-20,16:56:28,实际两星半。当这群人走进了无人区 ，这片土地就变成有人区了。夜夜高歌舞蹈，可能是对精神和士气的一种鼓舞，但是老是放这样的镜头，真的很破坏大自然的那种宁静与神秘，让人丝毫敬畏不起来，只觉得这群人是破坏者。这部片子感觉更像是一部无人区纪录片的花絮，只是穿插了一些大自然的景色而已，实际上就是导演和制片人？的追思之旅，强行代入这种情感，看了有点说不出来，一方面这种感情对不同的人表现形式也会不一样，代表的意义和程度深浅也不一样，另一方面评论这种感情似乎都会被冠上道德尊重的帽子。不论是拍还是看，这种纪录片，又觊觎嗅到自然的一丝力量并对之敬畏，又渴望赞赏人类的一次“壮举”，实在是个矛盾体。敬畏的来源之一就是不了解，个人觉得以后还是不要拍这种纪录片了，少一点自我欣赏的颜色，也让这片土地真正成为无人区吧。,1
0,30208007,藏北秘岭·重返无人区,苦丁茶,2502187,还行,2018-09-05,11:33:12,素材很棒，很艰险，看到信念的力量。但整体的思路不够清晰，要么就记录、不介入，要么就明确表达的方向，可惜了，导演小姑娘太年轻了，文艺的旁白，缺乏代入感，领悟也略单薄了。,1
0,30208007,藏北秘岭·重返无人区,北落北海,valleytramp,较差,2018-09-01,12:06:22,想法不错，整个队伍太业余了，这座山接近性差，但攀登难度并不难，难以理解最终没有登顶，只能怪队伍业余。为导演的父亲加颗星,4
0,30208007,藏北秘岭·重返无人区,湖绿鬼兮,siriusvicky,推荐,2018-08-29,11:17:02,看之前以为是个风光纪录片，BBC那色儿的……看完了发现是个过程纪录片，有点像《侣行》，有点像个超长大花絮里面插了点正片。导演很可爱也很成熟，21岁就能去跟团拍纪录片非常厉害啊，片后交流会气氛轻松，得以窥见90后正在成长的一代电影人的状态，很欣喜。,4
0,30208007,藏北秘岭·重返无人区,方多病,80993583,还行,2018-10-21,19:47:06,乱扔东西，居然还拍摄下来炫耀，差评！,2
0,30208007,藏北秘岭·重返无人区,天问,teven,推荐,2019-09-14,23:15:36,"【2019· 一蓑烟雨任平生】一个登山家的女儿，通过一次写实藏北无人区探险纪录片，来灵魂告别离世5年的父亲。
不是登极过的探险者，又怎能理解和体验当事人的心境。
山与极限依然在那里，我们搁放灵魂的高处！",0
0,30208007,藏北秘岭·重返无人区,沙里寨的沙里飞,loxetine,还行,2018-10-22,12:50:20,怎么说呢，自我感动取之便捷吧。,0
0,30208007,藏北秘岭·重返无人区,荒野大漠骑士,imak,很差,2018-08-31,15:45:50,这拍的到底是什么 只能算是主创的自我感动吧 ,11
0,30208007,藏北秘岭·重返无人区,Hachiko,andert,还行,2018-10-21,16:32:34,若只看关于景色的干货，还是不错的。,0
0,30208007,藏北秘岭·重返无人区,无涯子抵制修音,62734087,很差,2018-10-19,00:31:19,我来过。。可能没有人来过。。。怎么样呢？你来过又怎么样呢？开车宿营上那干嘛去？有任何意义？除了画面漂亮还有什么？坚决反对这种毫无意义的冒险行为。。。而且只要政府愿意高原直升机一下就能上去玩航拍。。。最逗的是无人机撞山以后居然没有备用的。。。。然后放弃登顶拍摄。。。克服重重困难都快到最终目标了。。。居然因为飞行器没有备用就失败了。。。。我都不敢相信。。。望大家引以为戒。。。听说投资3000W拍这片。。。还要一帮人玩儿命。。。有病。。多弄点吸氧设备就没高原反应了吧。。。。片尾曲《母亲已老》挺好听的居然被我盲听出陈冰。。。,3
0,30208007,藏北秘岭·重返无人区,慧達君,unknown2825,较差,2019-02-23,00:28:00,作為記錄片不及格,1
0,30208007,藏北秘岭·重返无人区,AmberJCZhao,AmberAqua,较差,2021-08-23,19:43:02,矫情的部分真的太多。可能对于几位主人公来说，这真的是感动心痛至哭的壮举，对于作为观众且不是没去过高原的我来说，内容真的太松散了.,0
0,30208007,藏北秘岭·重返无人区,🐓🐤🦜🙉🦆🕊🦢,55826006,较差,2018-08-28,22:01:38,马丽华在《藏北游历》里描述的情形得以重现，在这寂寞的藏北冰原上，藏族以唱歌和舞蹈来排遣心中的对亲人的思念，司机师傅们开起车来也是无惧死亡。但是纪录片的真谛呢？职业登山家父亲与女儿的故事，在其中穿插，效果见仁见智,0
0,30208007,藏北秘岭·重返无人区,不得命可不敢,herink,还行,2021-08-25,08:48:01,别扭，多多少少有些被绑架的导演和情感。,0
0,30208007,藏北秘岭·重返无人区,宋淼,qibadao,还行,2020-04-13,14:30:15,景色是真美，可惜让人看到的除了感动自己，别无他物。也许是因为，感动自己，就是人类最根本的动力，说起来实在可笑。,0
0,30208007,藏北秘岭·重返无人区,鱼闲卿,mulin_111,还行,2019-04-19,23:38:45,一开始我还满怀着敬意开始看，谁知越看越觉得不对劲。从第一位肺水肿的摄像开始，我就不知道说什么好了。无论是那些文艺肉麻的旁白也好，还是追逐梦想的所谓执着也好，我完全一脸麻木地看完。冰洞里也不知拍了个什么，四十几个人一路拍下来，除了登主峰那段和记录日常，我都没懂还拍了什么？到最后无人机撞山就匆忙结束，我甚至觉得无语。开了二十几台越野车，都不会带两台无人机？,1
0,30208007,藏北秘岭·重返无人区,云中鬼,indierat77,推荐,2018-09-03,20:27:20,真诚且感动，,0
0,30208007,藏北秘岭·重返无人区,白起,62658818,力荐,2018-09-01,20:06:01,整部纪录片真的是大大的开拓了我的眼界，没有想到冰川的场景这么令人震惊。,2
0,30208007,藏北秘岭·重返无人区,打雪人,168207672,还行,2018-10-24,17:56:26,两分给作品，一分给勇气。,2
0,30208007,藏北秘岭·重返无人区,coma,123789390,推荐,2022-02-09,18:48:45,好几次激动落泪,0
0,30208007,藏北秘岭·重返无人区,寡狗,143049789,推荐,2018-10-17,14:15:36,不要问什么意义，作为观众绝大多数这辈子不可能亲历，他们去过，把影像带回来，这就是意义。,0
0,30208007,藏北秘岭·重返无人区,F,65682579,推荐,2018-09-15,22:48:59,评分太低啦，这是一部很好的纪录片。,0
0,30208007,藏北秘岭·重返无人区,牛三牛,shuimudeyu1990,较差,2018-10-22,10:02:59,不容易。但更多的是自我感动。,1
0,30208007,藏北秘岭·重返无人区,豆豆,3108800,推荐,2018-08-30,09:31:41,#0831藏北秘岭：重返无人区# 影片中主人公的梦想没有能实现，但影片得以在院线公映，能够在大银幕上呈现，让看到的我们还有更多的他们有了梦想，重拾梦想，或者愿意迈开一步，开始去寻找梦想，是具有了一种普世情怀和价值的意义的。感谢促成该片的所有人，感谢豆瓣X盗梦观影团！ 希望可以有更多人用少刷一场碟6的钱和时间去关注这部影片以及片中的那片土地，动物和人们。,2
0,30208007,藏北秘岭·重返无人区,一根曲木,59334722,很差,2021-07-01,22:42:36,粗制滥造到极点了,0
0,30208007,藏北秘岭·重返无人区,祸害~活千年,41927171,很差,2018-11-16,20:35:20,首先，电影本身没有问题，设置组自嗨的都有点膨胀了，很多问题处理的太过于刻意，为了记录而记录。然后，大自然好好的在那里，导演非要情怀的找各种理由去打扰它的宁静，无人区的美就在于没有人。最后，穿越无人区带17台车，这些车的费用才是最值得炫耀的资本。,0
0,30208007,藏北秘岭·重返无人区,葱,heybanana,很差,2018-09-04,21:10:22,太烂了 拿别人的生命开玩笑 旁白透着一股疼痛文学的风味 没有信息量可言 本地人值得尊敬,5
0,30208007,藏北秘岭·重返无人区,西南城角,nwu0530,还行,2019-03-28,20:47:18,西藏羌塘无人区的景色迷人而又令人畏惧，景色优美壮观是当然，既然是无人区，片中人的故事也基本上是剧组自身与令人敬畏的自然相抗争的展现了，但故事主线不是很清晰，记录自己与记录自然相交错，人的活动比重稍多，还没打动观众就先把自己给感动了，个人觉得此纪录片还能更好些。景色画面太壮观了。,0
0,30208007,藏北秘岭·重返无人区,Olivier,47557992,较差,2019-06-08,23:11:35,导演制片的各种不专业性，让本来很好的主题，丧失了几乎百分百的观赏性。,2
0,30208007,藏北秘岭·重返无人区,桃叶渡,28404716,还行,2019-03-29,14:44:00,亮点是这是第一部尝试环拍普若岗日冰川的纪录片，虽然无人机撞山，队伍登顶失败，并没有真正完成拍摄计划。缺点是逻辑主线缺失，剪辑像凌乱的流水账。,0
0,30208007,藏北秘岭·重返无人区,萧绪,WangJiaXu,推荐,2018-08-31,11:11:48,真实的感情对纪录片很加分，子君的旁白很棒，无人区也很容易让人向往，取景很赞 拍的都是琐碎的小事 真实 但对长途苦旅的挖掘似乎不够深——没有刻画出清晰的感情谱系，从称谓间看到文化隔阂。平凡的给自己的勇气，看到最后蛮感动的。少一个灵魂,8
0,30208007,藏北秘岭·重返无人区,Franz,FranzCheng,还行,2019-04-24,14:00:27,纪录片不一定非要展示真善美，但也绝不是适合展示你们一盘散沙的乱象，组织管理混乱,0
0,30208007,藏北秘岭·重返无人区,水彩游侠,rosetraveller,还行,2021-02-16,21:35:15,对雪山与自身皆估计不足的一群人～有点四不着调,0
0,30208007,藏北秘岭·重返无人区,YU,168782447,较差,2018-08-31,16:09:04,感情纪录片？,3
0,30208007,藏北秘岭·重返无人区,Max,150627313,还行,2018-10-25,00:46:54,有点过于敷衍了，只能是作为一个西藏旅行纪录片，说探险感觉牵强，拍摄主题不清晰。自然条件虽然摆在那里，但是精神力量不是来源于母亲，危难时候想起了爸爸妈妈，浮游半生更多的是自己内心的强大。,1
0,30208007,藏北秘岭·重返无人区,雲無憂,xiyang0101,较差,2018-11-20,21:26:07,你们自己感动就好，拿无知无畏出来在全国人民面前招摇装X就别怪招人骂了,0
0,30208007,藏北秘岭·重返无人区,小不靠谱丶,gx1364,较差,2018-08-20,16:29:15,不知道一部拍摄失败的电影是怎么能上映的，好好拍景不好吗？人物对话完全是负分。还缺乏经验和计划，准备也不充分，全靠藏族人帮忙。实话说是对自己的不负责任。,8
0,30208007,藏北秘岭·重返无人区,恭喜瑶梦想成真,80223329,很差,2018-08-31,14:06:00,替盆友打个星 委屈他在电影院坐半天,1
0,30208007,藏北秘岭·重返无人区,低代槇生,RacekKublov,较差,2018-09-01,13:08:03,《藏北秘岭：重返无人区》：以后参考豆瓣评分之前，绝不轻易尝试文艺片了，最怕文艺片团队装逼和自恋。高中时地理老师讲，高原上踩一个脚印，几十年后去看还在，因为生态环境极其脆弱，一旦人为干预轻易不能恢复（这个案例姑且待考证），所以一直以来都觉得登雪山是破坏生态而满足自己探索欲、冒险欲的事，对所谓“征服x峰”之类不仅无感，更觉得是对x峰的打扰。不过个人爬爬也无可厚非（当然如果有人认为无可非议甚至值得鼓励请随意），还组几十人的团队拍自己登山过程的九死一生和成员的不专业，失败了大家抱在一起安慰“我曾经来过”，还是拍了作为登山社团内部资料自己留个纪念就行了，就别配上恢弘的古典音乐做成MV在电影院放了。,7
0,30208007,藏北秘岭·重返无人区,王大虾,junjie1210,很差,2019-10-02,21:51:45,流水账作业，竟然叫电影,1
0,30208007,藏北秘岭·重返无人区,棒棒泥购美病🐧,madlaxxoo,很差,2019-03-24,19:52:14,这片真是...外卖还没来...片子用64x速撸完了......（努力找好评还是狠狠的失望.......,0
0,30208007,藏北秘岭·重返无人区,长得很可爱,139226945,力荐,2018-08-20,16:10:52,纪录片往往能带给人更真实的震撼与意想不到的收获。在这个浮躁的市场环境里，中国电影的纪录片市场前景不好，也很难指望有多少投资商愿意投拍纪录片。但这部纪录片真的很棒，拍摄手法细腻 无人区触手可及。中国最大的无人区，最孤独的地方。,7
0,30208007,藏北秘岭·重返无人区,爱米粒,43475648,推荐,2020-11-12,19:10:03,藏北羌塘无人区，藏区雪山⛰️，永远那么神圣。那年的布达拉宫转经，是因为放弃一段错爱。我曾在佛的面前许过愿，世间安得双全法，不负如来不负卿。,0
0,30208007,藏北秘岭·重返无人区,清颍桥,banker,较差,2019-07-21,22:13:35,无聊，没看的价值,0
0,30208007,藏北秘岭·重返无人区,Edwin,cj_show,很差,2019-01-05,02:57:18,太一般了，没内容。,0
0,30208007,藏北秘岭·重返无人区,夜雨剪春韭,xiaoxinzei,推荐,2022-06-30,21:40:31,前往羌塘普若岗日冰川之旅，纪录片真实记录一群人，风光只是作为背景点缀。,0
0,30208007,藏北秘岭·重返无人区,混账,56177384,推荐,2018-09-01,13:52:02,人 一辈子都在找自己和这个世界的联系,1
0,30208007,藏北秘岭·重返无人区,weakish,WeakishJiang,较差,2019-03-05,00:15:19,剪辑和旁白是灾难，风光还是不错的,0
0,30208007,藏北秘岭·重返无人区,JUST现在的你,156216285,较差,2022-08-27,12:47:38,地球被人类破坏的还不够吗？为什么要去打扰她？,0
0,30208007,藏北秘岭·重返无人区,白马狗熊,Pemako_Chung,很差,2018-10-18,00:57:33,评价只有两个字，垃圾。还以为关于羌塘的纪录片，其实是一帮矫情的人在羌塘玩自拍,2
0,30208007,藏北秘岭·重返无人区,我为歌狂,33974088,很差,2018-10-18,19:44:44,一星给景色,1
0,30208007,藏北秘岭·重返无人区,秋楓,105806250,较差,2018-09-02,00:21:30,羌塘无人区近30万平方公里，平均海拔5000以上，穿越羌塘真的是每个爱冒险爱穿越人的梦想，但危险也是无法估计的，落单奔跑的牦牛、狼群、零下三十度以下的超级低温、刺骨的寒风和冰雪、海拔5000以上的低氧，再这样的自然环境下，人随时都可能有生命危险。说回电影，导演是二十一岁的小女孩，为了追寻父亲的足迹，加入队伍，完成对普若岗日冰川的主峰拍摄，片子剪辑混乱，无任何逻辑，缺少中心思想，就像是片花和彩蛋，我知道导演和剧组拍这个片子吃了很多苦，但电影就是电影，是给观众带来娱乐和欣赏，不是为了纪念自己攀登的过程，缺少观赏性，你可以像《七十七天》以完整冒险故事的方式来呈现，也可以像《冈仁波齐》以纯路人的角度来体现，总体还是比较失望的，慢慢来吧毕竟导演还小，电影风景很美，满天繁荣让人很向往,2
0,30208007,藏北秘岭·重返无人区,Kaehakii,69205822,力荐,2018-08-28,21:32:51,心怀敬意，热泪盈眶，自然面前人类渺小也伟大，谢谢你们把这珍贵影像记录下来,6
0,30208007,藏北秘岭·重返无人区,明光暗影,145849529,较差,2020-04-18,14:39:34,大量航拍镜头，场面恢弘壮观，不过素材有些散，剪辑有些乱，风格有些割裂，主题有些多而杂，更像幕后花絮而非正片，2.5星。。。,0
0,30208007,藏北秘岭·重返无人区,貓兔子,angela871226,力荐,2018-09-02,08:58:14,很喜欢这种纪录片,1
1,30208007,藏北秘岭·重返无人区,爱影,46000832,推荐,2018-10-18,08:23:13,飞云 星棋,0
1,30208007,藏北秘岭·重返无人区,剪刀手索索非非,csiyan,很差,2018-10-18,14:23:06,蛮好的题材，拍得那么无聊也是需要功力的。,2
1,30208007,藏北秘岭·重返无人区,🌸🌂小果实大太阳♓,147504019,还行,2018-08-31,11:06:43,导演带着一群人冒死完成的自我感动，但是我作为观众却一点也感受不到，三星都给羌塘无人区的壮美景色吧,5
1,30208007,藏北秘岭·重返无人区,金剑,58973558,推荐,2018-09-01,18:27:04,看过后很有感触，导演和演员都辛苦了，让我们了解了无人区！,0
1,30208007,藏北秘岭·重返无人区,处理器,lomo-omol,很差,2018-10-22,21:28:21,这可能是我近两年看过的关于西藏的电影中最烂的一部了,0
1,30208007,藏北秘岭·重返无人区,豆豆的丈夫,40237768,较差,2018-10-28,00:03:44,影像挺珍贵，知道你们不容易，都放在片子里说出来就不专业了，那就不是什么纪录片，只能是自己留着吹牛逼聊情怀的纪念片了,2
1,30208007,藏北秘岭·重返无人区,磨盤臉小妞兒,ichvermissedich,还行,2019-10-16,22:55:55,这纪录片看得让人尴尬 引路人确实是汉子 但也真没拍出啥好看的景色来,0
1,30208007,藏北秘岭·重返无人区,河流般的忧郁,170169639,还行,2019-04-26,10:50:33,一群疯狂、牛逼又勇敢的人沿着可可西里与羌塘两个无人区的接缝穿行，佩服！只是影片中的影像缺乏磅礴大气的壮美和震撼的冲击力。再有，片名中的“重返”很别扭，明明是首次，为何要叫重返。,0
1,30208007,藏北秘岭·重返无人区,早阳飞,4215662,推荐,2018-08-31,19:19:05,景色确实很美。不知道记录重点是什么，我看出来一个女儿对父亲的追思，一个蔡总带人去无人区的不容易，另外一个就是景色巍峨。其他的就没有了，隐隐觉得应该还有点什么的，没了，所以会想，换个厉害一点的导演会不会不一样。人性冲突之类不太多，就是合家欢探险。,6
1,30208007,藏北秘岭·重返无人区,焉知,48342724,较差,2018-09-03,10:17:24,我看的那场只有我一个女生和两个中年男，我相信他们俩买票的初衷跟我一样，都对那片无人区心驰神往，无奈电影呈现出来的更多是风景花絮和情感片，最奇怪是进入无人区这么多补充物资都备了，最重要的拍摄设备居然撞坏了就拍不成回家了？？,6
1,30208007,藏北秘岭·重返无人区,北纬三十四,199726212,较差,2021-02-15,15:29:05,自我感动,0
1,30208007,藏北秘岭·重返无人区,空空,gameace,较差,2018-10-24,07:39:18,女大学生导演的作用就是为游记提供一点煽情。如果说它是越野游记吧，又没有陈震、韩路、张新宇那种专业性；如果说它是电影吧，通篇都是花絮，又没有可欣赏性。浩浩荡荡，一二十辆普拉多+皮卡，最后感动了导演和演员。,2
1,30208007,藏北秘岭·重返无人区,猫舍钉子户,susberry,较差,2020-11-18,15:57:24,纪录片花絮纪录片？？,0
1,30208007,藏北秘岭·重返无人区,夏日远行客,SummerTravelers,较差,2018-10-23,10:12:50,我们都曾在年少时扮演骑士，但如今却嘲笑英雄，在神话湮灭的时代里，唯有一颗伸展不息的心，才能给平凡以伟大的勇气。,0
1,30208007,藏北秘岭·重返无人区,辵兔,jerrymartin,推荐,2019-07-04,20:35:40,我觉得还蛮好看的···,0
1,30208007,藏北秘岭·重返无人区,芥子书屋,47819631,还行,2020-08-05,14:15:08,煽情过于强行，旁白鸡肋,1
1,30208007,藏北秘岭·重返无人区,卅丁,yyy1240,还行,2018-11-03,10:27:52,讲故事的功力还有待提升，现在的成品有种长篇vlog的即视感。但是景色真的美得令人窒息了,0
1,30208007,藏北秘岭·重返无人区,补阙,xiaobiaoliu,推荐,2018-09-09,16:10:36,其实，从纪录片的内涵来看，这并不是一部合格作品，只是镜头所指确实是个极美的天堂，还是你我触不到的天堂，像我这样的宅男，更不可能去到，所以为其中的美景倾倒，尽管故事性差，尽管看似儿戏，尽管人物塑造并不成功，但是我仍然喜欢它。,0
1,30208007,藏北秘岭·重返无人区,丛林之王大Tina,Tina01181023,还行,2019-01-05,12:15:11,风景有几个镜头挺美，大型vlog。内核里有对情人的感情，也算难能可贵了。,0
1,30208007,藏北秘岭·重返无人区,潇蔚,154064165,还行,2019-03-28,19:14:06,"2022.8.4竟然是再刷，洗涤灵魂。
俗世中有时候太多的选择，其实就是没有选择，于是向这片古老而神圣的土地叩问！",0
1,30208007,藏北秘岭·重返无人区,小川   靜,156315362,推荐,2018-10-17,23:27:00,大自然的奥妙使许多人前仆后继前去追寻，可一般的自然天成也造成人类无法轻易接近。一段艰辛旅程，许多人相继病倒，也许没能完成当初的目标，留有少许遗憾………这就是人生。很庆幸自己在家就能见到这么多人辛勤努力的成果。没有光害的天空真的很美。,0
1,30208007,藏北秘岭·重返无人区,hualala71,hualala71,推荐,2018-10-20,22:04:56,一部业余探险者女儿的不及格户外视频作业。完全看不到有价值的信息。露脸最多的投资公司中视影业总经理,0
1,30208007,藏北秘岭·重返无人区,狐狸,49021923,还行,2019-05-05,09:50:03,风景终将会保存，可来过的人终将会逝去。说不出这部电影怎么好，也说不出怎么不好。来过就已经很不容易，何况那些影像。,0
1,30208007,藏北秘岭·重返无人区,鱼头仙人掌菠菜,78873355,力荐,2018-09-04,21:33:00,不是拍出来，你们根本看不到。不要以为自己坐在舒适的沙发上啃着瓜就可以否定别人所做的一切。没有亲自经历过的键盘侠照照镜子，看看你们张牙咧嘴的吃相，太可笑了,3
1,30208007,藏北秘岭·重返无人区,苏纳嘉,2118177,还行,2019-09-05,23:57:59,星空很美，既然是无人地就不要去打扰了。,0
1,30208007,藏北秘岭·重返无人区,KO'd,madbug,很差,2021-10-11,18:38:15,拍的什么几把玩意儿，3倍速播放老子都看不下去,0
1,30208007,藏北秘岭·重返无人区,99bu88,146386153,很差,2021-05-21,16:35:54,嘿！来看看饺子饺子大饺子！,0
1,30208007,藏北秘岭·重返无人区,Double ki,136804998,较差,2018-12-06,22:31:00,真能装  像被一个油腔滑调的厚脸皮渣男强奸了,0
