page_index,movie_id,title,username,user_id,rating,date,time,comment,useful_count
1,30208007,藏北秘岭·重返无人区,句号先生,83402717,还行,2018-09-06,16:46:17,"《重返无人区》上映了，看这部电影，那些关于西藏的记忆涌上心头：色林错,双湖,班戈,野牦牛,藏野驴,藏羚羊。 熟悉的那片土地，熟悉的那个普若岗日冰川，一切那么近又那么远，仿若昨日。
摄制组想完成环普若岗日航拍的壮举，可是在大自然面前只能选择放弃。每一分每一秒都是拿命在赌，穿越东温河，九小时往返360公里运送肺水肿的队员，开着车门，随时准备跳车，这一段会有很多人落泪吧。
西藏，是一片神奇的土地，有人在这里得到，有人在这里失去。
今年五月，我也来到了普若岗日冰川，世界第三极，这片土地于我而言意义非同一般，历史的沧海桑田，在这里就是一小块冰而已。
何时能再走一遭？我心中的西藏
",0
1,30208007,藏北秘岭·重返无人区,对方正在输入...,209295756,力荐,2020-08-16,17:57:29,"杠仙这不好那不好，不是电影，不是纪录片，导演存在感少。
虽千万里，吾往矣。确实有这样那样的不好，没去过藏北得人，永远不知道环境有多恶劣，其他的也许风景比他拍的更好，但是环境并没有体现的这么淋漓尽致。
不要说藏北，24天的318我见到了塌方，泥石流，七月份遇到了大雪。
藏民巴桑真的太有味道了，有时候我们遇到这些事情，并不一定比他们做的更好。
更不要说这份勇气，我有这份钱，也许我会拍拉萨，拍墨脱，做后期，也许也许。
但是藏北无人区，真的不是说说而已，就算做了万分充足的准备，也没人知道究竟会发生什么，我觉得这部片子值得这个分数",1
1,30208007,藏北秘岭·重返无人区,药命的悲‖挨,CH3OH,还行,2022-08-15,21:48:20,2星➕1星给永远都不可能去亲眼看的无人区,0
1,30208007,藏北秘岭·重返无人区,如是,64394425,很差,2018-10-18,09:06:52,我知道拍摄不易，但是也不用在影片里如此表现吧，看不下去,0
1,30208007,藏北秘岭·重返无人区,Dhyana,16572486,很差,2018-11-27,15:15:28,技术都不合格,0
1,30208007,藏北秘岭·重返无人区,大熊,72911321,还行,2018-09-02,00:01:36,说实话，除了景美之外，其他都一般，刻意营造的感动，晃的人头晕的拍摄，虎头蛇尾的剧情。这是有钱人的游戏，不要搞得多么崇高，我有钱也可以这样玩！,4
1,30208007,藏北秘岭·重返无人区,Weiß,mongly,较差,2021-11-19,13:50:32,数年前听闻此片后就和身为物理学家的G神半严肃半认真地把“十人穿越羌塘”当作一道题目来解。我们做了很多测量，迭代，在谷歌地图上练习线路标记，拉取能找得到的一切地质气候信息，收集观测体能数据，反复增删修改药品物品清单，不惜运用专业数据库和职务之便设计和改造一些装备，G本人甚至独自前往周边县城机车+徒步摸索情况……至今也不过是纸上谈兵，计划和预算越精确，付诸行动的希望越渺茫。但是，但是，但是，好多年过去了，依旧没有对劳师动众深入险境怀抱远大目标却只带一部无人机的匪夷所思的行为释怀。直到今天在自家巨幕和索大声效的帮助下重现此片才明白了一切。很少会用“失败”一词描述电影，虽然探险记录片的成败是有明确定义的。那姑且把它看成是对“失败”，对“遗憾”，对人类热衷于不惜代价来自我感动的纪录吧。,0
1,30208007,藏北秘岭·重返无人区,Olivia,OliviaZ,还行,2019-08-21,21:26:51,看看自驾西藏之路，导演只有21岁是没想到的,0
1,30208007,藏北秘岭·重返无人区,陈鱼,133766510,还行,2021-12-29,12:05:05,也是语文课看的,0
1,30208007,藏北秘岭·重返无人区,winter,44592079,力荐,2018-09-04,13:31:40,给子君,1
1,30208007,藏北秘岭·重返无人区,候鸟,156072511,较差,2020-10-27,14:34:28,只是不想自己被不可能这种道德绑架了。这个纪录片的思路主线一点都不明确，就是走哪录哪拍哪，只是刚好拍的是无人区，才会这么备受瞩目，相当于自己旅行的纪念片。记录当时的自己，当时的心情。如果这个导演以后还有其它成熟作品，他回过头再看，会再去一次好好梳理思绪吧。（浪费了一个好题材，没有好好道德绑架我。）,0
1,30208007,藏北秘岭·重返无人区,阔千,112253852,很差,2018-10-22,18:56:52,导演是女主角，制片人是男主角。。1，这不是完整、好看的纪录片。2，这不是完整好看的故事片。3，这不是完整好看的科普片。真不知道这样的片子能不能算电影。喝酒、自嗨、诉苦。导演兼女主戴着口罩坐在后排。。干嘛呢你！,1
1,30208007,藏北秘岭·重返无人区,瀚之,VHavel,很差,2019-08-13,23:15:18,太装了,0
1,30208007,藏北秘岭·重返无人区,Jiemi,48290447,很差,2018-09-08,14:55:35,不是打个“95后女导演”就可以掩盖本片的幼稚，是不是对记录片有什么误解？,3
1,30208007,藏北秘岭·重返无人区,envision,kid719,较差,2019-07-17,13:56:37,一群猎奇的人，为了去羌塘无人区打破个纪录，完成什么人类首次，然后自我感动着。。。想象一下，一百年前，陈渠珍率领一百多个人，穿越的就是这样一个恶劣环境，最后剩了七个，对自然永远敬畏啊。,0
1,30208007,藏北秘岭·重返无人区,DETACHMENT,159790625,很差,2019-10-01,14:05:59,不精彩花絮,0
1,30208007,藏北秘岭·重返无人区,凡客雅宝,aspirin2,力荐,2018-10-21,14:52:27,至少他们努力过 ,0
1,30208007,藏北秘岭·重返无人区,糯糯红薯丸子,59104662,较差,2018-08-31,20:29:13,因为一群人的勇气才加的一星，自嗨式的自我感动。不能因为拍摄艰难，就把艺术要求降低吧，卖惨可以的话，大家以后要不要都靠卖惨获得认可？！叙事凌乱，音乐太过，想要强行感动观众……比《七十七天》还要不如~~,6
1,30208007,藏北秘岭·重返无人区,东门吹雨,180734617,很差,2022-03-29,18:58:31,纯属无病呻吟，就是旅个游，还带着这么多车，这么多人，还说是探险。还不如今日头条上的自驾游的惊险。还敢拿出来放映。太假了,0
1,30208007,藏北秘岭·重返无人区,天要下火,167846852,较差,2020-09-04,21:41:59,没市场的纪录片，流水账一样，没有重点也没有突出啥的,1
1,30208007,藏北秘岭·重返无人区,腹有诗书气自肥,130926122,较差,2018-10-20,13:50:43,两星给所有参与人员的辛苦付出，但片子真的太差了！对不起。,1
1,30208007,藏北秘岭·重返无人区,Martin,3923065,较差,2019-04-17,08:03:10,真是不能理解这作的意义。特别是没有感情线一上来就高反的那几位,0
1,30208007,藏北秘岭·重返无人区,好多多,65348390,很差,2018-12-08,20:31:26,完全不合逻辑，太冒险了！别学,0
1,30208007,藏北秘岭·重返无人区,巧克力易化,qiaokeliyihua,还行,2018-09-07,19:56:34,介于故事片和纪录片之间吧，如果说纪录片那么缺少了客观的记录，反而像是一种主观自述，过渡渲染情绪了，如果说是故事片的话缺少故事情节和基本的发展脉络。勇气可嘉，风光很美，但效果一般。,1
1,30208007,藏北秘岭·重返无人区,angel0205,3534571,较差,2018-10-21,18:10:39,看了二十分钟觉得很无聊，一个纪录片总是用宏达的音乐做背景本身就说明了你的心虚。领队在那说自己贵州的，像回到故乡的感觉真是俗不可耐。导演21岁能操作这么个项目，而他爹死了？真有钱！在这么个他们宣称无比困难的地方，镜头换得如此频繁？甚至送人去急救还有高空俯拍，佩服！,0
1,30208007,藏北秘岭·重返无人区,抱一,134153531,推荐,2018-09-10,23:24:43,那个牦牛，那条狼，给高傲的人类，一个反思的机会，在自然面前，它们远强大于人类。第三极，是秘境，是丰碑，更是隐秘的情愫。,0
1,30208007,藏北秘岭·重返无人区,想不到,3278968,还行,2020-02-26,21:53:23,其实严格说来不算纪录片，片段也比较凌乱，但是冒着生命去拍摄，就算讲述拍摄的过程吧，这种难度也值得三星。,0
1,30208007,藏北秘岭·重返无人区,EKS,willin,很差,2018-10-23,21:01:21,有钱。任性。,1
1,30208007,藏北秘岭·重返无人区,AZWayne,60307113,较差,2018-10-17,22:55:31,现在去西藏寻找自我的导演的年纪越来越低了。,1
1,30208007,藏北秘岭·重返无人区,sanyo1527,52044633,很差,2018-09-01,10:40:48,片子有多烂就不说了，这种东西还能技术过审？,0
1,30208007,藏北秘岭·重返无人区,iFan,47588877,很差,2018-10-23,08:48:51,一部毫无诚意的伪纪录片，无人区就是个噱头，完全感觉不到他们对大自然的敬畏！太傻逼了！,2
1,30208007,藏北秘岭·重返无人区,不系之舟,wusuoyou,很差,2020-08-31,19:26:10,想看“藏北秘岭”是什么样，结果看到的是“重返”。,1
1,30208007,藏北秘岭·重返无人区,Steve,120891738,较差,2019-01-19,19:42:39,实在看不下去了，矫情做作，从头到尾强调高反，寒冷，牦牛，狼群，实在不理解最后为什么痛哭？导演如果把这些困难提一下，主要强调高原的原始之美，大自然的鬼斧神工，以及形成的自然科学一定很好看。,0
1,30208007,藏北秘岭·重返无人区,Hansen,hansening,力荐,2019-02-12,21:06:49,真实勇气,0
1,30208007,藏北秘岭·重返无人区,水音。,Celialiguo,还行,2018-11-04,23:29:59,论朝圣不如冈仁波齐，论亲情不如转山，论内心的救赎不如莲花，论风光大片不如77天。缺乏灵魂和内在支撑。只看到一群人在不知为了什么的砸钱，说实话，不要可以给我呀～,0
1,30208007,藏北秘岭·重返无人区,狂飙柔情,69025447,还行,2018-12-26,22:39:30,茫茫的雪原，给人意外的震撼。建议有自我心结、无病呻吟的城市人观看，面对自然地浩瀚，你会觉得人生的小心结算什么。,0
1,30208007,藏北秘岭·重返无人区,Interesting,panfangjie,还行,2020-03-10,00:31:09,哈哈哈哈哈哈自我感動的紀錄片無疑了，哦，應該是花絮！然後摻雜著別人拍的羌塘風光構成了一部不知道目的的電影。嗯，從紀錄片本身說，這太業餘了，我也可以拍啊。不過我佩服玩命去無人區的這種折騰精神，畢竟我這輩子也不會去的，所以能看羌塘風景真的要感謝那些工作人員。人類迷惑行為已經見怪不怪了，因為自己也常做一些不可理喻的事，不管電影中的人物是為了懷念父親，或者是追逐小時候的記憶，這些都是他們自己的癥結，不要再禍害他人了，去一個地方就只是單純的去，不要加上意義！因為你會發現，當你到達目的地時對於你的心靈根本不會有任何改變！改變自己的方式從來不是外在的。我就奇怪了，當地人完全可以完成的事人家根本不值一試，倒是外面的人蠢蠢欲動的趕去無人區找嚮導，然後失敗告終，請問為什麼？還有一個問題，就不能開個直升機過去拍？,0
1,30208007,藏北秘岭·重返无人区,内蒙Artiste,162603289,较差,2022-01-18,21:32:43,混乱。,0
1,30208007,藏北秘岭·重返无人区,Archer,132170349,推荐,2018-11-04,14:50:56,就为这种勇气和毅力，4星还是值得的,0
1,30208007,藏北秘岭·重返无人区,Ariel的小马甲,58723728,很差,2018-10-21,11:05:10,无语 这样也叫电影吗？,1
1,30208007,藏北秘岭·重返无人区,晕船家,166245344,推荐,2018-09-01,16:20:59,俺觉得这个片不太好打分，以纪录片严苛的标准，这部片子应该略显青涩，拍摄技巧和故事线都不够完善；要说是探险记录，打分的话又不太合适，那么艰苦的环境能够记录下来就已经不错了。但作为对生活在城市里的年轻人的一次心灵洗涤，还是很有意义的，不看他们的生活记录就体会不到在恶劣环境下人的真实感受。没有故事线反倒更真实自然，很感谢这个团队带给我的震撼，也祝福他们能够平安归来，希望这些人有机会能再次重返普若岗日，在完成自己梦想的同时能为岭外的人再次呈现一场视觉盛宴。（不是商业化的片子，就不能以商业化的眼光去评判~,1
1,30208007,藏北秘岭·重返无人区,青烟岭,DJwithly,推荐,2018-08-31,22:52:10,为勇气点赞！片子拍的艰难，景色很是好看。,1
1,30208007,藏北秘岭·重返无人区,杨花落,yanghualuo,很差,2019-08-07,00:52:32,有钱人的毕业旅行就是不一样啊，能致敬一回爹还能上映捞笔钱。剧情的傻吊之处就不再多说了，我就想知道在剪片子的时候难道导演和制片这俩人不尴尬么，出现这么多问题你们真觉得只和无人区的恶劣环境有关？就你们这个补给水平，那些穿越的人羡慕都来不及吧。,0
1,30208007,藏北秘岭·重返无人区,麦子,btone0808,还行,2018-10-19,15:36:32,大陆的探险人群越来越多，这方面的影像片会越来越多，总归是好的尝试，无论是探险的勇气，或者是拍此类片的勇气，都值得鼓励，希望中国的探险队伍和探险纪录电影越来越专业。,1
1,30208007,藏北秘岭·重返无人区,L先生,156438110,还行,2021-02-17,02:42:11,还不错,0
1,30208007,藏北秘岭·重返无人区,rinyuki,190464742,还行,2020-08-02,01:07:58,"总得来说很感激将羌塘景色以及无人区的经历展现给公众。
槽点:片中台词说道这是花絮，所以正片呢",1
1,30208007,藏北秘岭·重返无人区,grindonurface,41487487,很差,2021-08-30,16:38:45,"要不是只有你显示“免费播放”，我会看你？
做运动用，听个响",0
1,30208007,藏北秘岭·重返无人区,流离先生,68634054,较差,2019-09-01,16:11:53,各种想表达的东西太多，没有get到重点。重点显示一个主人公就好了。,0
1,30208007,藏北秘岭·重返无人区,嚯啊,144279192,还行,2022-10-23,18:34:54,无人区是诱惑的,0
1,30208007,藏北秘岭·重返无人区,无何有,2258517,很差,2019-11-17,17:16:26,什么玩意，情感基调莫名其妙,0
1,30208007,藏北秘岭·重返无人区,SoundofSilence,xubeisi,还行,2019-01-26,23:24:58,这怎么感觉像综艺节目呢,0
1,30208007,藏北秘岭·重返无人区,曜世,48854353,还行,2020-02-02,15:20:22,藏地太美，希望永远没有人去打扰她的宁静。,0
1,30208007,藏北秘岭·重返无人区,458008k,73599294,很差,2018-10-26,23:47:26,感谢剧组🙏，以负面的角度展示了如何拉大家一起花样送死...咱们中国还是人多，真的不惜命，这要真送了人头，可能前言的铺垫就更加真实反面了吧，哈哈哈,1
1,30208007,藏北秘岭·重返无人区,鲤鱼,50241225,还行,2018-09-04,17:47:38,在科技越来越便利的当下，随手输入一个目的地，能检索到数以百万条的相关信息，但总还有一些地方，人类未曾踏足，但心之神往。,0
1,30208007,藏北秘岭·重返无人区,德君,2286189,较差,2018-12-08,15:20:04,片子节奏很乱，剪接有时候很跳，整个片子就是一部花絮，没有正片儿... 一帮蠢蛋干了件超越自身能力的事，那么好的景色，被这帮蠢蛋给破坏气氛了...,0
1,30208007,藏北秘岭·重返无人区,头人,126924969,很差,2018-10-19,22:39:27,拍了个啥,0
1,30208007,藏北秘岭·重返无人区,理易封,42325900,较差,2018-11-03,21:14:37,单纯背景音，偶尔看到画面还可以，结尾这首歌……,0
1,30208007,藏北秘岭·重返无人区,momo,47218840,还行,2019-06-18,23:04:51,两星，给风景加1星。看到中途，我以为是一部拍无人区自然纪录片的花絮电影，然后一查才知道这就是正片。what！如果这就是正片，那作为公路纪录片，这素材和剪辑也太废了吧。没有体会到什么情怀和敬畏之心，到达冰川后一种到此一游的感觉，内核太浅了，还没有导演父亲的几段录像回味大。,0
1,30208007,藏北秘岭·重返无人区,野客,132292462,较差,2018-09-13,17:35:47,纪录片不像纪录片，电影也不算电影，更像一场披着“羊皮”的真人秀。对羌塘的地理人文的展示面很浅，对家父足迹的精神追寻也很薄，在混乱的剪辑中，只剩藏区图景掩盖着一切。,2
1,30208007,藏北秘岭·重返无人区,liancang1,187318685,推荐,2020-04-05,13:54:32,一路上风景的瑰丽，车队人员的窘迫，配乐的大气。但是片花在眼前呼啦呼啦的闪现，这种骚操作也是第一次见，不过也算见识到了之前如此景象的航拍是如何完成的。,0
1,30208007,藏北秘岭·重返无人区,江湖骗子Toby,huangqii,推荐,2018-08-28,22:39:37,观感有点奇怪。。。剪辑的混乱。。没啥主线。。字幕多，配乐太满，画外音太文学。。。为西藏的美和拍摄不易加星。。,2
1,30208007,藏北秘岭·重返无人区,念念,80317889,,2019-06-06,18:43:59,更多是记录行程 不是风景,0
1,30208007,藏北秘岭·重返无人区,十,155025318,很差,2020-01-29,07:07:15,因为和她看的所以记录一下,0
1,30208007,藏北秘岭·重返无人区,OLEO,171701755,较差,2018-10-18,23:44:05,并未get到他们兴奋痛快乐的点  难道是我没爬过难以感同体会!音乐还不错  导演还年轻加油！,0
1,30208007,藏北秘岭·重返无人区,urt茶茶,charmoncwm,还行,2019-01-02,21:39:27,敬佩吧,0
1,30208007,藏北秘岭·重返无人区,拖,64570355,还行,2018-09-03,14:29:41,回望故乡星海茫茫，就是一部宽释童年，与过去和解的片子,0
1,30208007,藏北秘岭·重返无人区,曹将,caojiang,推荐,2018-09-01,11:22:29,全场就两个人。可能是因为去过两次西藏，对这片土地心存敬畏，有代入感，很感慨。,0
1,30208007,藏北秘岭·重返无人区,梦幻泡影🤐,131706187,还行,2022-02-08,20:42:05,"旁白太尴尬了
美景拍得太少
自驾游结束得莫名其妙！",0
1,30208007,藏北秘岭·重返无人区,不二蘑菇君,35175792,力荐,2018-08-31,22:50:09,我妈说 只有有情结的人才会看这个电影吧 很多东西是感同身受的 对西藏的向往 畏惧 及征服后不能言语的激动,1
1,30208007,藏北秘岭·重返无人区,一个人的国王,1091711,较差,2019-02-10,01:04:14,一星给风光，一星给导演他爹以及导游,0
1,30208007,藏北秘岭·重返无人区,.ミドリ 六 子.,FRANCE.z,还行,2019-12-14,12:27:34,感觉和这个女的没多大关系,0
1,30208007,藏北秘岭·重返无人区,芊墨临曦,141123480,推荐,2018-08-31,19:30:14,缺点：毕竟是第一次导片子，很青涩。背景配乐有点不搭，和主题呢有点偏离。因为你这个主题是记录，而不是流水账。           优点：很真实，不做作，情感真实。风景瑰丽大气。作为去过双湖行政区的人，我知道有多难，能到冰川下就已经竭尽全力了。,1
1,30208007,藏北秘岭·重返无人区,英克雷的翡翠,85259413,很差,2023-02-03,00:09:40,可燃垃圾,0
1,30208007,藏北秘岭·重返无人区,田悦,tianyue,还行,2021-09-16,20:30:02,lonly planet ,0
1,30208007,藏北秘岭·重返无人区,killer,152932687,还行,2019-04-05,10:56:17,在大自然面前 人类不过是沧海一粟 每个人的追求都不一样 有的人永远在路上,0
1,30208007,藏北秘岭·重返无人区,Loniko,49081433,还行,2018-12-16,23:27:13,勇气可嘉,0
1,30208007,藏北秘岭·重返无人区,行者 段,78942726,还行,2019-03-15,23:55:00,"还凑合吧，不是太烂。
这帮人的身体不太行啊，我那年单骑109，啥病也没有啊",0
1,30208007,藏北秘岭·重返无人区,北疆的胡杨,51283005,推荐,2022-02-10,15:08:25,"这种冒险精神，是令人崇拜的，生死协议，还有开着车门是为了遇到紧急情况随时跳车逃命。记得骑行77天留下的是羌塘的图片资料，这次是影像资料。为人留下很珍贵的资料。
零下四十度左右的低温，为我们留下了这么珍贵的影像资料，就值得三星了。
无人机再多准备两台，是不是就不会留下遗憾了。
",0
1,30208007,藏北秘岭·重返无人区,云心鹤眼,yxhy,还行,2018-10-21,19:51:58,风光不错,0
1,30208007,藏北秘岭·重返无人区,大理,65329885,还行,2018-09-02,15:56:35,emmmmm看得我有点尴尬，三星给勇气和大自然吧,3
1,30208007,藏北秘岭·重返无人区,桃瑞丝,99283109,较差,2019-03-03,23:29:28,感觉是导演和编剧的大型拍摄花絮，主题凌乱，共鸣感低。在西藏无人区纯净又暴烈的大自然面前，预期会看到人类对大自然的敬畏之心，但剧中更多是体现出众人想挑战自己勇闯无人区的荣誉感，甚至不惜让别人冒着生命危险来实现自己梦想的一点自私。而且当遇到狼群时，众人不停警示后勤管家要迅速撤离，但他居然还悠然坐在椅子上，事后还大笑说吓死宝宝，实在让人觉得无知又业余，真是无知者无畏。,0
1,30208007,藏北秘岭·重返无人区,答案,answer1980,还行,2018-11-01,08:04:36,2.5星，其中1星为藏北绝美风景。,0
1,30208007,藏北秘岭·重返无人区,光影屋,135703439,推荐,2018-08-28,22:28:44,开头几个藏区镜头可谓是大气磅礴，颇为惊艳。整个纪录片围绕环绕和登顶普若岗日的过程展开，过程之艰辛，环境之恶劣，绝非常人所能承受，让人不得不佩服主创人员的决心和毅力。,6
1,30208007,藏北秘岭·重返无人区,akdklyx,80062653,推荐,2019-02-21,10:59:19,那些打低分的键盘侠，请你们也在海拔五千米的高山上生活工作一段时间试试，虽然片子有的地方有点故作矫情，但是换作是你，如果你克服了缺氧、高反、有可能一去无回的旅程，你完成了一件很少有人能完成的事，你不会为自己感到骄傲和热泪盈眶吗？,0
1,30208007,藏北秘岭·重返无人区,Amber,tianamber,还行,2018-11-05,20:59:02,"纪录片。团队业余，队员不称职，雇佣的登山向导的意见常常被领导否决。剪辑差劲，煽情刻意，以及假想的自我救赎。能被氛围打动，我来过了，“那些很冒险的梦”。还有对登山家父亲饶剑峰的怀念。


",0
1,30208007,藏北秘岭·重返无人区,东到海,173953809,推荐,2020-02-09,19:15:51,确实是花絮，没有刻意煽情，不要故意诋毁,0
1,30208007,藏北秘岭·重返无人区,海右风歌,34657548,推荐,2019-01-21,23:29:32,很有兴趣的领域,0
1,30208007,藏北秘岭·重返无人区,1986114,165370765,还行,2018-09-05,18:14:16,宁可只看风景,0
1,30208007,藏北秘岭·重返无人区,少 年 不 二,64473872,推荐,2018-10-18,19:35:31,当面对大山大河的时候 我依旧热泪盈眶,0
1,30208007,藏北秘岭·重返无人区,盐渍小凤梨,bessiexu,较差,2018-10-27,23:24:50,菜鸟驴友旅游纪录片，记录生活的点点滴滴,1
1,30208007,藏北秘岭·重返无人区,没故事的人。,desperado91,较差,2019-06-20,14:01:46,无人区不是谁的信仰，无人区是让人敬畏的大自然。但是他们到达了，难能可贵。,0
1,30208007,藏北秘岭·重返无人区,小小岛,40723257,较差,2019-03-03,21:59:47,导演那么年轻，拍摄还是有点稚嫩的。那边太美了，团队不咋专业，向导还不错。两分给风景以及勇气。,0
1,30208007,藏北秘岭·重返无人区,梵高先生,152098833,推荐,2018-10-16,22:11:55,敬佩又向往,0
1,30208007,藏北秘岭·重返无人区,冷眼看剧,155737409,还行,2018-09-04,16:33:47,味道不对。,0
1,30208007,藏北秘岭·重返无人区,iCami,fantasw,很差,2018-09-01,22:33:48,风景拍的很好。,0
1,30208007,藏北秘岭·重返无人区,刘 先生,67352190,较差,2018-10-24,22:41:28,你就带了一个无人机啊,2
1,30208007,藏北秘岭·重返无人区,Terry Gu,31335200,还行,2019-03-03,17:43:52,剧本与剪辑都是硬伤，太线性起伏不够。导演与制片镜头太多，没有必要。,0
1,30208007,藏北秘岭·重返无人区,bzfdu,bzfdu,较差,2018-10-18,21:08:37,那么辛苦到了普若岗日，风景是极美的，结果拍的真的是杂乱。。,0
1,30208007,藏北秘岭·重返无人区,达斯汀•德尼罗,62962732,还行,2019-04-23,09:42:40,电影也好、纪录片也罢，至少有这样一群人敢于去挑战大自然，用影像记录下来这些画面，值得吹一辈子,0
1,30208007,藏北秘岭·重返无人区,短笛,162509320,较差,2018-10-20,23:01:19,一星给风光摄影，一星给藏族向导,0
1,30208007,藏北秘岭·重返无人区,开心小脚丫,71776922,很差,2018-10-22,04:09:19,看开头还是满期待的，可是越看越觉的这哪里是记录片啊！就是拍摄这帮人冒险去羌塘的片子啊,0
1,30208007,藏北秘岭·重返无人区,Henry,9246761,还行,2018-11-18,00:33:49,片子还有点粗糙，但拍摄的过程很值得尊敬和鼓励,0
1,30208007,藏北秘岭·重返无人区,飘着扔,79745413,还行,2019-09-07,12:56:44,去干嘛呢？这叫啥类型的纪录片，就是个片花啊！20190907,0
1,30208007,藏北秘岭·重返无人区,想想cathy,cathy_59,很差,2018-09-06,18:54:31,1.实在对不起纪录片这个词。2. 我知道那个男的是在藏地呆了很久的人，但我很奇怪，一点也感受不到他怼藏地的保护，只有觉得自己是人类的第一次多么多么了不起。,2
