page_index,movie_id,title,username,user_id,rating,date,time,comment,useful_count
1,4864908,影,甄子,41378347,推荐,2018-09-18,13:29:19,看完之后觉得超级丧，心里特别堵……导演真的是为了风格不顾一切，好在成片非常有质感，虽然故事确实还挺简单的。孙俪美出了新高度，还好片子里的几个人都还算会演戏，甚至包括关晓彤。跟导演聊了40分钟，“梦想”“工匠精神”“热爱”频频出现，简直是灌鸡汤一把老手，感恩他不断尝试不断创新。其实很想去看下《影武者》了。,49
1,4864908,影,brave,coco-cookies,推荐,2018-09-29,23:42:56,"八分吧，完成度很高的电影了，人物虽然少但是故事也算圆满的讲完了，留给观众的想象空间挺大的。
加一星是给邓超的影子封柏的。
水墨画真好看，每祯停顿都好看，捞仔的配乐做的也是真的“扣人心弦”了。
关和三石弟弟还需要成长啊，郑凯多少还是有点尬，最佳演技在吃番茄酱吐泡泡的阶段。
国师还是国师，没变，牛掰。
嗯，邓超不错。
最后，动作片不是3D好良心啊！",40
1,4864908,影,波波维奇,pingguohongle,还行,2018-10-03,15:52:31,画面挺美，视觉享受，故事讲的一般，超哥分饰两角演的不错。,6
1,4864908,影,小鹿,135669992,力荐,2018-09-11,12:30:03,年度最佳，我喜欢电影里太多得让我意想不到。喜欢中国水墨和非常巧妙的阴阳元素。在多伦多看到一部这样浓郁的中国风电影，我为中国有张艺谋导演而骄傲。收敛，克制，却振奋人心。,107
1,4864908,影,罗夏,yxs19840602,较差,2018-09-30,23:55:39,长城+黄金甲+英雄，戏渣大集合，胡军和王千源的一丢丢戏份根本救不了表演灾难，剧本毫无深度可言，国师自以为是的水墨画美学不过是城乡结合部的发廊水平,13
1,4864908,影,庄子周,89394084,力荐,2018-09-30,10:18:30,很难想象是张艺谋的照片 水墨画中的中国博弈故事 一定要去电影院观看 画面太中国了 ,34
1,4864908,影,大头绿豆,bighead,较差,2018-12-31,21:36:16,就像看了他的开幕式和各种「印象某地」，满足了眼睛却感受不到任何心理波动，所有的电影语言都很低幼的水平，所有的情节都是故事会水准。他明明有能力调动行业里最好的编剧资源，却一次又一次给我们这些空洞虚妄的东西，要么是他吝于在剧本上花钱或者花时间，要么是他可能压根没有能力辨识剧本的好坏。郑恺的表演是剧中不多的亮点。,10
1,4864908,影,valkyrie,50628660,力荐,2018-09-29,12:32:04,"其实明显的缺点还有有，但我认为瑕不掩瑜！可以说是运用国风元素的正确姿势。无处不在的水墨元素、书法、太极、琴瑟，抛却了鲜艳色彩和人海战术的张艺谋用最简练的黑白交出了唯美的画卷，不愧国师之名！
比起以往画面有余情节不足的大片，这次讲述的故事有了很大的进步。飘逸的景色中是阴暗的斗争，受控于人者最终控人生死，邓超的表演令这两个角色更加鲜活。",47
1,4864908,影,leafalone,leafalone,还行,2018-10-19,21:59:02,前半个小时只值一星，后面挽回了点儿。摄影当然满分，无须赘述。演员最大惊喜竟来自关晓彤，青春感是有的。伪装成电影的戏剧，但台词过差，和人物、故事完全割裂，所以也不是好的戏剧。国师在视觉外的审美就像大学才开始读古诗词的青年，奇技淫巧，无法收放自如，更谈不上高明。格局，没有。年度MV巨作。友圈评价甚高，应是我该反省了。,2
1,4864908,影,ZeonGin Sou,dkjune,力荐,2018-09-30,19:55:03,国师的范儿。美学如《英雄》，形态却已成水墨。本子若干瞬间都颇有徐浩峰的感觉。有限的色彩里，展现出“太极”的可能。前一小时与后一小时是两个极端，本尊和影子之间的博弈，光与影的对立，前者端得满溢仪式感，后者狂得刀刀到肉，工整令人折服。PS：邓超比《烈日灼心》更进一步，每一个细胞都在阴郁与丧病中分裂，对飚到窒息，但还是少拍点综艺好，过度消解气质。,3
1,4864908,影,NickyROி,boynicky,推荐,2018-12-01,23:21:42,和以前的浓墨重彩比 这次水墨处理的并不深刻对叙事来说帮助并不大 人物故事相对简单 但视觉呈现上确实可以再进一步简化 提炼精华 如果能再多一些水墨色彩的变化 也许效果会更好 不管你们怎么骂 张艺谋就是现下最好的中国导演,3
1,4864908,影,小汪,valkyries,还行,2018-10-01,01:54:00,导演总喜欢让镜州把他的心里话说出来，先是在被捅一刀的时候让他自我介绍，讲下他八岁离开母亲balabala（哇如此痛的时候还能说出那么多话真是厉害），再莫名其妙对女主大喊我到底是who！是怕观众看不懂他内心的痛苦嘛？一切都要靠嘴说，前半段话剧似的。之后嘟嘟永远是我的嘟嘟、特洛伊木船进城、百只牡蛎翻滚靖州大街也是很新奇好笑。片子的试听我很喜欢，吴磊腰斩关格格更是出气，但总有股被逼看跑男的感觉呢，咳，该让陈赫演那奸臣啊。,10
2,4864908,影,姨妈的鸭,yimaxxduck,推荐,2018-10-04,12:35:11,就我不想因为是张艺谋所以给低分。,12
2,4864908,影,LEのn个晴天,119316126,推荐,2018-12-15,07:59:53,自豪的是，这是一部纯正中国电影，是只有中国人才能写意和完全领会的创作，独特于全世界的中式美学气质令人沉醉。水墨风格潇洒飘逸，那场邓超孙俪三人在雨中脚踏八卦图一整套以伞破竹的动作行云流水大气十足，试问哪个国家还能有这样的文化积淀能够创作出此等风骨的艺术作品。子虞这个角色让人又多认识邓超一分，郑凯的主公也让人眼前一亮。关晓彤暂且及格并不令人讨厌，吴磊就……一言难尽。邓超孙俪在一起的这三个角色，于我有种奇异的感受，多年前的迷恋依旧印象深刻，祝愿幸福的心意也总随流言蜚语游走，艺术创作与现实会诡谲地相互穿插影响呢。不足就是有些台词实在太白，影响美感。,2
2,4864908,影,what'swilliam,52286623,还行,2018-10-01,16:31:00,3星半。不能再高了。商业版《刺客聂隐娘》混点《英雄》。1.故事还是不够丰厚，画面精致有质感，但相比之下我更爱陈凯歌的华丽。2.演技排名：郑恺孙俪邓超＞王景春关晓彤＞王千源胡军＞吴磊。郑恺孙俪赢在完美融进故事，胜在天然。邓超胜在角色设定敬业精神和疯癫。关晓彤的角色讨喜，吴磊有点太孩子气。3.以伞为兵器很有趣。4.每个人做任何选择都是有目的的，人们得到一些东西就得付出相应的代价和风险。,2
2,4864908,影,伯樵·阿苏勒,yuanzhigao_0,还行,2018-09-28,20:50:05,《沛国的麦克白》…,6
2,4864908,影,朱熠,joyeejoyee,还行,2022-05-17,23:16:52,谁能想到这个片子里最不招人烦的竟然是关晓彤,11
2,4864908,影,陪戎校尉,onlysunshine18,较差,2018-12-02,20:21:22,乱七八糟的烂片，张导演的片子也只能在特效上找点噱头了。整部电影浪费时间。,2
2,4864908,影,康夫,wenmangk,还行,2018-10-02,13:09:04,用力，繁杂,3
2,4864908,影,saya1749,saya1749,力荐,2018-10-24,01:09:59,人们总说张艺谋的色彩无人能敌，于是他为了证明自己讲故事的能力这次把颜色去了，效果就是一开始我以为是回忆呢…黑白滤镜呢……后来全片下来我以为自己色盲了………再有就是只有黑白的服装为啥有种路边摊货的感觉…完全看不出质感…故事我觉得还好……导演一定是受了特洛伊的启发！,1
2,4864908,影,袁牧,yuanmu,还行,2019-01-06,19:36:20,也许是因为黑泽明的《影武者》已经达到的高度，张艺谋在拍这部电影时，只能选择在视觉上追求极致的风格化，以求另辟蹊径，所谓水墨风格在摄影上难度很大，但和中国画讲究留白空旷意会的趣味，似乎没有什么联系，八卦古琴纸伞之类的中国符号又犯了葱当海参烧的毛病。因为权谋的东西在国产电视剧中已经开拓的很不错了，所以这个故事讲得不咸不淡，必须抱着练伞之类的情节，简直和武侠里必须ML才能排毒的桥段一样俗套。,1
2,4864908,影,Eternal,40429939,很差,2023-01-29,19:19:04,以前为国人挣脸，高看你，以后，呵呵,1
2,4864908,影,临时昵称,snowbusy,,2018-09-27,23:29:05,个人觉得《影》在有点传承《菊豆》的意思，精神上的弑父罕身份焦虑，窥视引发的情欲罕道德焦虑，之类的。国师啊国师，有点重回赤子之心的意思，激烈的情绪找回来一点，然时光荏苒，角色突围的方式很不同了。一时间，俺也想不清楚自己的立场,7
2,4864908,影,九個9,jiuge9,推荐,2018-10-01,20:11:38,视觉效果还是迁就市场了，一以贯之黑白片可能更具风格。写意和写实，生活和生命，谁说电影就一定要立人物有故事，你可以看小说，我也可以看画。,2
2,4864908,影,顾一,163050072,推荐,2018-10-02,18:16:00,每一幕看上去都像一幅水墨画，整体色调很冷,3
2,4864908,影,反山,chahuzi,推荐,2018-09-30,21:31:56,给四星没毛病吧？这美术这画面这摄影这服化道设定，美的。邓超非常抢眼，故事也足够暗黑有劲，配乐很有窦唯的范，格调没问题。那些武器的用法很有想象力但也略出戏，张艺谋还是爱玩奇门遁甲，想象力丰富。,1
2,4864908,影,瓦力,cyrus_wong,还行,2018-09-30,21:28:22,《长城》花式蹦极队仍历历在目，《影》钢伞爆旋战车再次闪瞎双眼，《长城》架空大宋热气球手榴弹横空出世，《影》架空三国氧气罐惊人亮相...尼玛，再次感受到当年《十面埋伏》和《黄金甲》带来的雷感槽点，少出现些这类玩意我相信观感一定更好。视听层面惊喜连连，但在“替身”故事框架下就远低于预期，几乎每个反转都不意外。,5
2,4864908,影,章子怡,101634770,力荐,2018-09-21,23:43:49,（0921/吐槽电影院提前场）如果说中国电影需要一个专属于自己的风格，目前做的最好的应该是张艺谋和侯孝贤。,70
2,4864908,影,江海一蓑翁,batongyang,推荐,2018-10-01,17:23:44,张艺谋就是张艺谋，把一个人们耳熟能详的《三国演义》里的荆州故事，空置时代与具体历史场景，转化为一个关于权力、感情与身份认同的终极寓言。黑白基调的水墨画影像，用心讲究的武打、兵器与场景设置，与叙事丝丝合缝的古琴主打音乐，在视觉与听觉的形式上，老谋子可谓做到了极致。而在人名、地名的命名上，其设置也跟影片的主题一般，一语双关，意蕴丰富。几位主演的表演，同样可圈可点。如果不是扮演沛国主公的演员太过出戏，整部电影堪称完美。,5
2,4864908,影,叔是,WSSWHL,推荐,2018-10-04,00:13:51,做减法的国师你们还不习惯，这是最接近《英雄》的电影。《英雄》是繁缛的《罗生门》，《影》是《罗生门》的《影武者》,1
2,4864908,影,.,155812786,较差,2018-10-01,01:44:55,一流镜头+三流剧情+四流台词+五流反转,14
2,4864908,影,Salines,171283935,力荐,2018-09-20,20:37:37,满分评价，从故事到美感无可挑剔，邓超孙俪胡军演技一如既往，郑恺让人惊喜，关晓彤也让人惊喜，果然演员还得靠好导演调教，吴磊在胡军面前更显青涩，演技一般,108
2,4864908,影,猪大腿,pigbigleg,力荐,2018-12-17,14:00:46,年度华语佳作，多给一星支援豆瓣分数。十分怀念《英雄》时期的张艺谋。黑泽明的《七武士》《影武者》自然要补；城中战应当是有致敬《十三刺客》吧。老谋子此番真是各方面大超预期。,3
2,4864908,影,Rábano,157536192,推荐,2018-10-01,00:45:21,"8.1/10
是一部非常适合在大银幕观赏的电影吧。
初看完的感觉是头皮发麻，只是听着那种血肉横飞的声音我都会吃手手emmm，动作戏第一次破刀法那里有惊艳到我，至于战争戏嘛……挺好笑的，破城有点儿戏了，格局还是不大呀。
吹爆阴阳美学，作为一个女性观众，关注点是衣服和屏风真的太好看了啊……那种水墨画的感觉（我词汇比较贫瘠）场景设计的真好看，尤其pick本片的核心，八卦阵。
邓超认认真真演戏起来真是不错，本片有震撼到我的地方就是两个邓超对戏的部分了，郑恺太浮夸了，这个角色挺适合关晓彤的，感觉还可以。磕爆兄妹线。
第三幕的不断反转其实很容易猜到，没什么惊喜。故事还是让人觉得不过瘾，没什么新意吧，有点为了形式美学服务的感觉。
反正最近各位大导的回春我还是最喜欢妖猫传hhh（是不是口味清奇）",6
2,4864908,影,唐朝,petertang,较差,2018-09-30,15:44:40,无意义的传统文化概念，莫名其妙的山水意境、阴阳八卦。就像是去听一个前朝遗老大谈中国传统文化多么适应现代社会，多么具有前瞻性，多么丰富具有人性深意，实际上是在刻意树立自信，内里很虚，经不起推敲。,14
2,4864908,影,sTill-Life,yystilllife,推荐,2018-10-14,22:43:31,就像张艺谋自己说的，电影的本质是戏剧，这部影片非常透彻地展现了这一理念。水墨画风让人眼前一亮，黑白光影，风水流转，人心沉浮，恣意挥洒，是值得称赞的美学尝试，也是对电影表现形式的一次拓展。美中不足在于张艺谋的经验似乎限制了他的想象力，创作的整体感觉偏向程式化，在大的感觉铺开之后没有办法再更深入地给出更多惊喜细节。,2
2,4864908,影,mister.z,128731929,较差,2018-10-01,15:28:24,张艺谋还是一样地矫揉造作，灰黑白的景物，人物都是穿灰黑白的衣服，画着灰黑白的山水画或者书法文字，真是够够的，再怎么美也审美疲劳了，况且也不美。故事这次编得还可以，没有很蹩脚。杀人的时候有点血腥，飙血都有呲呲呲呲声，太夸张了。,5
2,4864908,影,*******,slowerlearner,,2018-09-30,23:01:04,“爹，那是太极图，小心有诈！” “哼，故弄玄虚！”#讲个笑话#,5
2,4864908,影,筱酱，,164811253,还行,2018-12-08,21:05:46,这预告片很给力啊。张艺谋这个颜色用的真的好！,0
2,4864908,影,awumbuk,61625379,很差,2018-09-30,21:27:57,一坨水墨色的屎。完毕。,7
2,4864908,影,灰色堡垒,hanqiu1995,还行,2018-09-30,21:40:28,确实是根据三国故事改编的，只不过有点颠覆：郑恺演孙权（深藏不露）；邓超演周瑜（都是都督，而且精通音律）；孙俪演小乔（在里面叫小艾），关晓彤演孙小妹（实际上是许配给了刘备）；胡军演关羽（他的刀也是八十二斤，和青龙偃月刀一样），吴磊演关平（在里面叫杨平）；王千源演吕蒙（白衣渡江也在）；王景春演鲁肃（在里面叫鲁严）；镜州就是荆州。,1
2,4864908,影,doteveryi,Y1yssm,较差,2022-01-01,15:33:05,用电影台词来评价：故弄玄虚，装神弄鬼。,4
2,4864908,影,姬长安,lhlqzhuge,还行,2018-09-30,12:32:36,平庸的剧本，晚进场半个小时循环看下一场竟然觉得前半个小时也没什么可惜错过的，尤其是台词没有此时此刻恰如彼时彼刻的心知肚明，一定要把所有的台词填满不留空白，没有一句台词值得反复琢磨，让我觉得这帮人权术不过尔尔&莎翁舞台的表演风格并不是邓超般几近刻意的区别子虞和境州，演影子其实更应该演即使不同状态下的相似，反而郑恺略带荒诞的人性化才真的对了张艺谋要拍出的莎翁味&终于知道孙俪为什么不适合上大银幕了，在张艺谋极致的镜头下，第一，没味道，跟自己老公的那欲迎还拒有略带犹豫的情感张力都让人没啥脸红心跳，第二，看起来胸大背厚到水墨质感的服装一点都不飘逸&就是你不用抱太大希望也不会多失望的一般片，不是文艺片。,7
2,4864908,影,LMPP,qinrenyang,很差,2018-09-30,22:32:47,尼玛，说电影好的是拿钱了吗？,4
2,4864908,影,花雕一壶酒,113274139,推荐,2018-10-03,17:19:52,最开始都有点坐不住了，但好在各方面渐入佳境，剧情虽老套，但能和水墨风黑白灰画面做到不违和，也很难得了。短板就是有的角色讲台词会出戏。。。巅峰绝对绝对谈不上，但相较张导近些年的几部大制作来说，很不错了。,0
2,4864908,影,HACHI,hachinn,推荐,2018-10-04,12:20:49,孙俪真好看啊啊啊！水墨场景太棒了！,2
2,4864908,影,殇潮|Enigma,freddy_xu,,2018-10-11,18:06:54,都经过这么多部了，剧情依然提不成，美术也依然是亮点，至少比陈凯歌的夜总会式审美强多了。但演员底子新老一交替就看得出啥叫世风日下了，现在还是郑恺竟然演的最好，以后就变成吴磊当台柱子了，可怕。以及某些偶像没了滤镜原来就长这样吗，国师的镜头真是照妖镜。,1
2,4864908,影,牛顿的甜Apple,149908080,推荐,2018-09-11,12:12:15,"中式暴力美学 & 中式腹黑学
张艺谋又一次带着中国作品走向世界
不过在多伦多国际电影节和外国人一起看表示外国人的笑点真的好奇怪
不过这个尺度啊 在国内上映会不会被剪啊...",82
2,4864908,影,solate,hisolate,还行,2018-10-03,00:43:07,张艺谋确实是一个好的美工，在某种需要高浓度寓意的时刻，他能找准那个最精确的喻体，比如说奥运会的大脚丫子。但是，论到要好好的讲一个故事，这真不是他擅长的了。从美术形式上来说，影并不比英雄更出色。比起他想致敬的偶像黑泽明，为了悬疑而悬疑，为了反转而反转，影简直就是又臭又长的裹脚布了,2
2,4864908,影,好好,157767550,很差,2018-10-01,15:04:54,国师近几年的作品总给我一种Mv的感觉,4
2,4864908,影,靳以斯,dierightnow,推荐,2018-10-01,00:49:58,我喜欢境州和小艾的感情线，从前期暧昧到吻戏再到床戏，步步升级，能感受到那个氛围；我喜欢捞仔的配乐，古筝与长啸，都督和小艾的一场合琴戏好想再看300遍；我喜欢里面的动作戏，以阴克阳，以柔克刚，虽然表面，但场面大起来，镜头摇起来，气势恢弘；我喜欢电影的色调和服饰，黑白水墨，避免高饱和度色彩浓化人的眼；我喜欢电影从头到尾潮湿的天气，湿湿嗒嗒，雨声配乐！我不喜欢三个演员，关晓彤、郑恺和吴磊，这三人像是从现代穿越到古代的人！违和感好强。,3
2,4864908,影,夕梨,76287806,还行,2018-10-04,15:27:25,故事情节差了点，张艺谋的画面一绝,7
2,4864908,影,外苏,suh5213,推荐,2018-09-28,22:12:44,这电影找个冷清的影院看最好了，人一多容易笑场，张艺谋的好都感觉不到了。,21
2,4864908,影,银河小姐,yinhexiaojie,推荐,2018-10-01,18:59:48,我相信都督直不起腰完全因为太饿了！！！,3
2,4864908,影,刘康康,46843344,还行,2018-12-11,11:17:08,美术挺好，权谋写得还是太想当然,11
2,4864908,影,秋䒕墨,61327238,推荐,2018-09-22,00:38:32,不同于黑泽明对日本历史进程感慨的大，亦没有武田信玄那种武将家族成王败寇的强，张艺谋在黑白水墨诗画中聚焦的则是替身本身命运的小，而这其中更是他对人性的思考。如同片中太极图上的阴阳两级，王和都督的关系，都督和替身的关系，每一个人物都不是单立而起。一动一静，是刀对伞的亦刚亦柔，一空旷一逼仄，是男人对女人的至阳至阴。如同老谋子口口声声说的艺术动作片，《影》当真把东方美学的艺术和中国武侠的动作展现出来了其返璞归真的精髓。,63
2,4864908,影,李湘,leexiang,很差,2019-02-25,00:37:57,一言难尽。,3
2,4864908,影,知名不具,105417000,较差,2018-10-07,23:11:50,如果导演是个路人甲的话三星，以国师之资历资源拍成这样，两星都有点嫌多。,5
2,4864908,影,天马星,cinestar,力荐,2018-09-30,21:36:44,以山水入画，朴素而又奇绝;以刀剑叙事，写意却不晦涩。有的影片用高超的影像讲述平庸的故事如《英雄》，有的影片用平庸的视听讲述非凡的故事如《归来》，这一次《影》终于成为一部影像叙事的真·电影，每个构图、镜头、调度、配乐无不相辅相成汇成一派，为这乱世中小人物的命运低语倾诉，形式与内容的完美结合，看得我头皮发麻。2018年最让我震撼的是斯皮尔伯格和张艺谋两位老导演依然老当益壮，迸发出孩童般的想象力，可亲可敬！,6
2,4864908,影,惧色,j_s2003,推荐,2018-12-06,23:13:03,4.5 天师登峰造极,1
2,4864908,影,MaggieQ,156904513,力荐,2018-09-11,11:58:50,多伦多电影节看完首映，这绝对是我看过最血腥的国产片，不知道在国内还能不能上。整部电影除了黑白就是血色的红。前面铺垫那段我还想吐槽这黑白除了画面好看还有啥用，后来才知道老谋子果然别具匠心啊。本来还有点担心郑恺，结果发现他的形象特别适合这个角色，就是看起来特别玩世不恭，我都没想到他会反转。邓超和孙俪更不用说，演技封顶。唯一缺点就是前半段关晓彤就是个捧哏的 演技又略逊色。但是瑕不掩瑜，剧情一转再转，人物也很丰满，画面更好看，8.0以上预定。,97
2,4864908,影,韦斯安徒生,80797429,推荐,2018-09-28,11:21:33,是张艺谋的回春亦是张艺谋的自白。讲述一名被迫为权力代言的提线木偶的抗争故事，然而当影子成为了真身，是否还会甘愿回归平凡？黑白水墨风，其实也是另一种“浓墨重彩”，这很张艺谋。“伞”兵攻城一段，充满想象力，又是华语影史前所未见一眼铭记的动作场面，这很张艺谋。在人与人的关系之上，永远还有强烈的政治表达，对“身份”一事分外执着，这也很张艺谋。很久没机会说这句话了，我爱这个张艺谋。,36
2,4864908,影,左儿,lefter,较差,2019-01-15,18:07:50,台词差，故事幼稚想当然一贯。影像不管多做作，美还是美的,4
2,4864908,影,浅野忠信,LincolnSixEcho,推荐,2018-09-28,10:59:30,实拍才能出真知，角色个个都透着不死之身的潜质。,33
2,4864908,影,请叫我DJ,148009459,还行,2018-09-25,00:29:54,我真的不觉得八个人的电影能有多好的剧情 🙁,14
2,4864908,影,❤小巩俐❤,yuminshuiqi,推荐,2018-10-20,19:01:58,（看完。意犹未尽。）和朋友聊天，说年到三十，才通过谋女郎们卓尔不群的形象，意识到张艺谋的审美远远地把我们和时代抛在身后了。张艺谋用作品留住了他一早就洞悉的美的力量，而我们年轻时对此一无所知。中国导演里至少找不到第二个比他有说服力的，所以无论如何，不黑他。,4
2,4864908,影,阿豚,atun,很差,2018-10-02,13:58:24,难以想象张艺谋至今还要靠大段台词来强行交待故事；对白一如既往的生硬；美术上，不管多努力都摆脱不了“土”感；故事的价值观散发着僵尸味道，永远都是“有一盘大棋”；张早期的影片还是很有生命力的。,8
2,4864908,影,Pincent,Pincent,推荐,2018-09-28,21:22:34,7.8《江湖儿女》有主动向世界观众介绍“江湖”的概念，而《影》则在强调“阴阳”相争的理念，是在符号、性别、兵器、动作风格、人物形象设计上都有体现的，并和真身与替身、主体与影子的相生相克关系结合探讨，核心还是人心的阴谋算计，真与假，大的政治诉求与小人物的处境。一定程度上借鉴致敬了黑泽明《影子武士》的设定并延续了《英雄》的美术追求与严肃性。涵盖八卦、水墨、围棋、古琴、草书、竹林的东方阴阳美学执行得还算较为统一，黑与白之间是亦正亦邪的灰，通篇雨水的外景给人心增上一层迷惑。有《一代宗师》珠玉在前，摄影上倒不如期待，但工业水准还是不会拉到后腿，表演上也有一些亮点，但还是觉得过于通俗明确了，但结尾二十分钟的腹黑阴暗还是让人很兴奋地看到一些经典日本武士电影的感觉，透过面具那一望的设计还算有趣。,26
2,4864908,影,brennteiskalt,brennteiskalt,还行,2019-03-18,02:15:11,张艺谋仿黑泽明之作的美术和摄影乍看起来真是叫人挠头，浮夸浅薄，不中不西，非古非今，关键还很丑。然而随着影片进入到政治性的最后一段，另一种解读可能渐渐浮上台面。倘若我们愿意，可以把整部电影看做是(故意)失败了的“中国神话构建”。影片中本尊与影子的区别不在于真和假，而在于名分和权力。所以剧情框架里孙俪的所谓“最艰难的决定”其实一点也不难，看看她的眼睛，她早就知道了。某种意义上，这才是这部电影里最中国的东西。,3
2,4864908,影,团小纸,skymoto,还行,2018-09-30,15:24:56,都2018年，张艺谋还在复制自己大师的壳子，黑色用的并不比红色高端什么，距离黑泽明也差了几百年的莎士比亚，演员都是减分项，对张艺谋要求总归该比别人高些。结尾的地方说是留白，在我看来还是入世大于出世，缺了大气,9
