page_index,movie_id,title,username,user_id,rating,date,time,comment,useful_count
1,30140571,嗝嗝老师,Bumpa,bumpa,推荐,2018-11-22,21:38:06,“དགེ་རྒན་ངན་པ་ལས། སློབ་མ་ངན་པ་མེད་དོ།།”ཞེས་པའི་ཚིག་སྐྱ་ཙམ་པོ་ཁྱེར་ནས། དགེ་རྒན་དང་དགེ་རྒན་གྱི་ཕྱག་ལས་ལ་དམའ་ཕབ་པར་བརྩོན་གྱིན་འདུག་མོད། དོན་དུ་གློག་བརྙན་འདི་ནི་དགེ་རྒན་གྱི་ཕྱག་ལས་གུ,1
1,30140571,嗝嗝老师,唐朝,petertang,还行,2018-10-09,10:47:39,“差”学生遇到好老师，反转人生的老套路。贫民窟的孩子在私立学校被区别对待，自暴自弃，剧情相当理想化，对人物命运着墨不多，只注重于用老套的反转情节，升华人物，推进剧情。适合在印度电影院伴着三哥的掌声和欢呼声(自High)观看。,0
1,30140571,嗝嗝老师,Tom Light,xhlaxhla,推荐,2018-10-22,08:52:53,上海提前观影会，恭喜女主角晋升为母亲。虽有夸大戏谑的成分，印度电影的人文关怀，值得我们学习。魔都观众的英文也都很好，还有会Hindi的。,0
1,30140571,嗝嗝老师,"杉小爱|好姑娘,咱们走起来",OneiLulu,推荐,2019-06-23,17:27:20,同是摸着石头过河的发展中国家，他们的创作人一直在告诉我们，不是有钱就堆出真善美，就能架空现实营造虚伪的感动，《嗝嗝老师》扎实、贴地、诚恳的故事主线，依然是孱弱的国产电影匮乏的，在嬉笑、温情背后，它对现实的关照依然硬朗、坚韧，贫富差距，阶级壁垒，性别歧视，教育资源等问题，都是挡在师生面前的一堵堵无形之墙，怎么拆除，能不能拆除，就见仁见智了。,0
1,30140571,嗝嗝老师,秋天的黛西,MademoiselleXie,还行,2019-01-14,01:58:13,印度对于对于社会题材故事片的把握相当工整成熟，节奏多是平铺直叙直接外向，因为太工整和太成熟，在一腔感动之后，反而流失了一些深刻辛辣，要不要再多一点新鲜的套路？还是我太贪心。,0
1,30140571,嗝嗝老师,tonight,lian0070,还行,2018-11-04,22:26:47,不是锥子脸，看着好舒服,0
1,30140571,嗝嗝老师,Sissi,Sissi17,推荐,2018-10-21,18:27:01,7分。印度电影总有许多鸡汤给你，泪水和欢笑之后，贫民窟还在恒河水的一侧安然不动。,1
1,30140571,嗝嗝老师,🍑Polaris.J,jumengyi,较差,2022-05-19,01:45:31,"No.26
好套路…！好鸡汤…难受",0
1,30140571,嗝嗝老师,#Bennis@Liang#,154343042,还行,2018-10-07,21:51:47,不了解电影中老师得的那种病，但是电影中的呈现我感觉抽搐太过频繁影响观感.        整体的呈现有些夸张，但主题蛮好的.（不要轻易放弃他人，改变的路上很艰辛）,2
1,30140571,嗝嗝老师,懂棒棒宇宙,woaisuxiaoyan,还行,2018-10-13,00:38:33,展现了贫富阶级固化的社会问题，仅是展现了而已。结构全都是公式，剧情全都是老梗，虽然把这些都塞得舒服且温暖，但还是从哪方面看，都只是一部还行的片子而已。,0
1,30140571,嗝嗝老师,西瓜大侠女,iloveperfect,推荐,2020-05-06,23:54:31,前年的片子了还以为去年的，也是恰逢爱奇艺春季在线北影节（5.1-5.5）补一下大银幕。对在香港🇭🇰看到的《我的破嗝Miss》这翻译印象特深！看到前一半我都不舒服想打嗝了！虽然学生们有些转变过于简单直接也有艺术套路，但还是可以给高分一点。今天看了两部印度电影让我有些想念双脚真实踏过的那个印度了（尤其午餐盒带入感强烈），不知道疫情下的那个国度的人们尤其非富贵阶层是否还好。都是老百姓呀！最后女主退休还挺煽情的，但一查应该不是原型美国人有的。不知美版如何，但印版敢拍贫富教育差别对待的题材就是比我们进步！想起知沟理论，但这些贫民窟孩子唯有受教育才是唯一出路。家严说中国电影怎么就拍不出人之间最本质的真实情感交流。本想昨天爱奇艺在线影展最后一天看，延到今天了。爱奇艺App投屏居然还有“中场休息”环节,0
1,30140571,嗝嗝老师,十三影,241656243,还行,2022-05-12,05:57:19,"1.其实真没必要设定一个反派老师.，我不知道印度国情如何，至少我活这么多年，没见过跟学生有仇，整天想着开除学生的尖子班老师，踩一捧一大可不必..
2.尖子生也是自己努力出来的，差生可以努力变好，但没必要贬低本身努力的学生.
3.印度老师真牛批，全科带班主任的老师！
4.印度电影的魔力，什么都能用爱情来讲，剧中最强冲突就来自于，小伙子在暗恋对象面前丢了脸！
5.如果看过《放牛班的春天》《超脱》《地球上的星星》《死亡诗社》，这部电影基本大同小异，可看可不看.",0
1,30140571,嗝嗝老师,Jerry,mrjerryzheng,推荐,2020-02-06,23:37:43,10.30 嗝嗝老師Hichki @ 深圳一方城GCV影院 （用阿菊的會員積分換）,0
1,30140571,嗝嗝老师,清晨稻田,70565824,力荐,2018-10-13,22:23:55,这个电影讲的是一个有缺陷的老师拯救了14个自暴自弃的调皮捣蛋的差学生，喜欢老师的鼓励式教育，把枯燥难懂的知识用生动形象的方式表现出来，让学生对学习产生兴趣，教学生直面恐惧，做出改变。老师也接受自己的缺陷并能拿来开玩笑。这样的老师太理想化了，现实中大多是A班的老师，能不歧视差生的算不错的了。那就自己做自己的老师，自己做自己的北极星，鼓励自己，并相信自己，接受自己的弱点并做出改变。,2
1,30140571,嗝嗝老师,梵天丸,51943547,较差,2018-11-05,18:46:56,剧情硬伤多到没法入戏没法共情。,1
1,30140571,嗝嗝老师,拂袖斋客人,skysnow5201314,推荐,2019-03-05,15:00:25,虽然知道是怎样的结局，还是为这样的故事感动。一个好老师应该就是这样吧，无论怎样都不轻言放弃，不是破罐子破摔，而是死马当活马医。,0
1,30140571,嗝嗝老师,在路上,164244773,推荐,2018-10-13,23:12:53,带娃看了《嗝嗝老师》，娃说好看，说为什么我们拍不出这么好的电影？又说咱们的校园剧……切！印象中这几年从《我的神》、《摔跤吧爸爸》、《猴神》、《起跑线》、《神秘巨星》、《苏丹》……一直在带娃看，也从没失望过。虽然只是部套路陈旧的逆袭商业片，但推荐带娃观影，满满的正能量哈！,3
1,30140571,嗝嗝老师,壹淼淼兮,46212180,推荐,2022-11-07,09:27:10,20/28,0
1,30140571,嗝嗝老师,华盛顿樱桃树,49213881,还行,2018-10-08,21:17:21,印度人真的太会写故事也太会讲故事了，还是丝毫不差的丈量，情感表达也恰到好处，厉害到什么程度呢，最后两分钟无台词的镜头，都能看哭你。,2
1,30140571,嗝嗝老师,声色画报,24274750,还行,2018-11-29,21:23:27,故事的缘起比较独特，我也是第一次听说这种病，看了前20分钟就能知道后面的故事脉络。演员们发挥都比较出色，很放松和投入，幸苦主演要一直抽搐，还有一个亮点就是孩子们怎么捉弄老师，新花招层出不穷。,0
1,30140571,嗝嗝老师,NICOLE,KATHLEEN285,力荐,2018-10-19,22:14:09,很感人且有意义的教育片 推荐老师和学生们观看 可以从中获得现在社会缺乏给予学生的平等教育理念 ,0
1,30140571,嗝嗝老师,ReMinD,49761291,还行,2021-12-21,22:35:08,翻拍我是第一名 所有后看的都没有那么精彩。,0
1,30140571,嗝嗝老师,西祠,3007182,推荐,2018-11-24,21:06:16,外面没有别人，只有你自己。讨厌的，嫉妒的，愤怒的，都是与阴影的一种斗争与化解。,0
1,30140571,嗝嗝老师,非/cat,wdxc999999,推荐,2018-10-12,23:37:44,出乎意料的好看。不得不再次感慨宝莱坞怎么可以把狗血套路拍得观众眼泪都出来。女主角的抽抽相当逼真，结尾小朋友20年对比也让人惊艳。不过这次没有歌舞注水，片长相对其他神片感觉票价应该打折才对。从教育视角折射贫富差距，对于知识改变命运一说，以及对阶层流动的刻画，很让人动容。推荐学生观看,1
1,30140571,嗝嗝老师,对你爱不完,140638723,还行,2018-10-14,16:45:48,三星半，印度电影只要不拍什么科幻类的太空电影，就能说的过去。,1
1,30140571,嗝嗝老师,橘兮。,lilanning,推荐,2018-12-01,15:40:00,看哭了 别人家的老师,1
1,30140571,嗝嗝老师,小鹿,151465389,还行,2018-11-06,09:18:24,"有过之前的[放牛班的春天]所以，剧情的铺展都是看似似曾相识的感觉。
最让我感触颇多的几个瞬间～贫民窟的孩子家长们抢着去打水、老师带着孩子们吃大餐，狼吞虎咽、A班的学生故意泄露错误考题……尤其是所谓的A班学生做出那种事，再看看今天从小学到大学，老师、辅导员身边的“红人”，可怕，太可怕了",1
1,30140571,嗝嗝老师,资深低阶路人,92775477,还行,2020-02-02,05:02:19,太热血,0
1,30140571,嗝嗝老师,是王帅傅,4453050,较差,2020-11-16,22:24:18,俗不可耐,0
1,30140571,嗝嗝老师,请叫我腹黑,metkee,推荐,2018-10-15,13:48:26,电影告诉我们“好的老师都是真正爱学生的，天生带着拯救差生的使命感”，为什么从小到大就没有遇到这样的老师。天朝的老师大都是“你们不要给我惹麻烦，最好可以取得优异成绩让我发光”。,0
1,30140571,嗝嗝老师,星河,58582021,推荐,2018-10-17,21:09:09,有几个值得一说的点，1.女主家庭条件很好，能支撑她的学业2.提供了一个思路，教育别人是容易的，因为没有损失，学习是困难的，会丢分3.除了问自己为什么，更应该问问自己为什么不4.片尾的歌词有意思，眼泪珍贵不要随便流，愤怒使心脏失明，将恐惧内化成力量5.如果能帮助到别人，还是有意义的。6.印度女性总让我想到大地之母的形象，可能是因为形体圆润结实有力量感不似亚洲干瘦或者欧美系的头小，也可能是眼神里尽是以苦难为底色的包容善心。,1
1,30140571,嗝嗝老师,李湘,leexiang,推荐,2018-12-01,09:09:31,印度电影对老师行业的反思。每一个学生都有发光点。老师应该去发现不同学生身上的亮点。不是培养千篇一律的学生。,0
1,30140571,嗝嗝老师,铁臂阿童lu,Ech000000000000,推荐,2018-12-07,19:46:20,形神俱佳的老套鸡汤，印度的优秀电影都是这样，会好好讲故事，各种调度也都不出差错。,0
1,30140571,嗝嗝老师,只手撕天,34161257,还行,2018-11-26,21:18:57,一个连吃鸡都困难的国家非逼人喝鸡汤，贼齁,1
1,30140571,嗝嗝老师,马不办,dengyixiajiuhao,还行,2018-11-27,01:17:07,这个类型看得有点审美疲劳了,0
1,30140571,嗝嗝老师,萤木C,cazze,推荐,2019-01-13,21:45:40,第二幕的低谷缘由和第三幕都编得挺好的，合情合理又能打动人,0
1,30140571,嗝嗝老师,kakakarl,zhanyakui,还行,2018-10-12,18:23:14,3.5。印度版《叫我第一名》＋《极道鲜师》＋《放牛班的春天》。主要是因为家访时有个镜头看见了窗户里的电脑，觉得最后一段25年后来得又急又赶……,1
1,30140571,嗝嗝老师,hitlike,hitlike,还行,2019-02-20,11:11:36,可以看，但所有的情节都几乎从同类影视剧里看过了。片尾曲好听。,0
1,30140571,嗝嗝老师,横丫肠,fightim,推荐,2019-01-01,21:54:11,蛮温暖的，虽然艺术美化严重。其实古板老师说的才是真理：卓越不是乐趣，而是刻苦。,0
1,30140571,嗝嗝老师,WilliamOsborne,157548945,还行,2018-11-01,09:24:10,7/10，以为会是《叫我第一名》的套路，后来变为印度独有的教育问题,0
1,30140571,嗝嗝老师,阿楞,155494518,推荐,2018-10-12,20:42:30,印度崛起啊  电影都这么上道,1
1,30140571,嗝嗝老师,十八爷,withmydog,还行,2018-11-30,21:21:01,印度电影这几年在喜剧、励志题材上套路已经比较成熟了。煽情可以再克制一点，过度煽情其实是一种矮化。每个人都可以成为最好的自己，只要遇到对的老师，只可惜这个愿望最终也只能是个概率问题。,0
1,30140571,嗝嗝老师,野百合终生美丽,68399606,较差,2022-10-27,07:20:00,"原版一个温情励志故事，被宝莱坞改成了一碗毒鸡汤。
只有主角的人物设定（患有妥瑞氏综合征，且是一名优秀教师）出自原版，其他几乎都是原创，或者叫本土化改编。
一众人物脸谱化严重，俗套的差生逆袭故事内核，过多的刻意煽情。原版故事核心“妥瑞症”居然还被弱化。
9年级，相当于初中生吧。一帮从小就不爱学习的学生混子，靠一名优秀教师的感化与帮助，就能在半学期内成绩飞升？甚至还有一个考到年级第一？？中国编剧都不敢这么写。他们不是小学生，学会九九乘法表就能考满分，他们学的是函数、物理、化学。可能巧了，这帮孩子都是天才。那9A班都是蠢才呗？勤勤恳恳学了几年，还不如一帮学了半学期的混子？
若是中国翻拍按这个剧本，会被网友喷出翔。",0
1,30140571,嗝嗝老师,？,167465104,很差,2018-11-05,19:32:38,尴尬的不得了,1
1,30140571,嗝嗝老师,tcv,vct,还行,2018-12-04,18:39:43,印度电影太下饭了。。。这部没有歌舞，好评。不过始终有种奇怪的感觉。看到有短评说印度电影揭示了苦难，却往往大团圆解决，麻痹观众，感觉有理。,0
1,30140571,嗝嗝老师,二月雪,fu1252,力荐,2018-12-08,11:50:42,催泪，克服缺陷有多难,0
1,30140571,嗝嗝老师,塔别妞,cheliqing,还行,2019-04-18,18:03:51,即便是俗套，印度电影都能把它们用出趣味和温情。,1
1,30140571,嗝嗝老师,淡定,64086111,力荐,2019-07-11,00:37:44,大陆版,0
1,30140571,嗝嗝老师,very moment,144600865,还行,2018-12-26,20:18:36,有感动的点，但整体太模式化理想化。,0
1,30140571,嗝嗝老师,鹰婕,chenyj,推荐,2021-05-08,10:19:11,遇到好老师是一生中无比幸运的事情,0
1,30140571,嗝嗝老师,pyw,36441429,推荐,2022-08-01,22:16:35,虽然觉得现实里不可能，但还是喜欢这类的片,0
1,30140571,嗝嗝老师,琉璃氏约尔凡格,joelfeng,推荐,2018-12-03,21:55:10,根据《front of class》改编，後者又根据真人真事改编。,0
1,30140571,嗝嗝老师,🌩️水系林雷🌩️,TAO3423347007,力荐,2018-11-03,00:48:01,第二次在电影院流泪，完全预期之外，本以为会很俗套，没想到却会感动到，可能太现实了，而且大家的演技却都好好。,1
1,30140571,嗝嗝老师,刘晨辉,163956915,很差,2021-07-22,22:37:09,"角色设定就有问题，所有顽皮的孩子都是没被发掘的天才？只要稍微努力，轻松赶超尖子生？年轻时不近视，退休就带上近视镜？是不是太刻意了？事实上不管电影如何励志，我似乎也不会让这样的老师教我的孩子。所有人都是圣母，说9f班差，难教其实并不差。你去看看电视剧谢文东就知道什么才是真正的差生。所有角色都无疑是最优秀的，唯有马图尔老师是个傻逼。这种电影居然也能有好评
和十七岁的天空比起来这就是个垃圾
校长可以说独具慧眼，单其他老师居然不排斥她？其他学生居然对9f班也就这种程度？设定完全站不住脚。父亲好心介绍银行工作，所有人都对马图尔耐心友好，但马图尔是怎么对家里人的？白眼狼🙄狗东西，这种人学习再好不懂得知恩图报。",0
1,30140571,嗝嗝老师,承泽明,4075446,推荐,2018-10-14,23:57:53,1、改编自经典励志电影《叫我第一名》，但和原作相比更多揭露了有关印度社会的诸多问题，如阶级矛盾、社会歧视等。2、最感动瞬间是学生对老师的深情表白，“你是我的北极星”。3、影片情节俗套，但其中许多成熟的本土化改编方式却值得国内电影人学习和借鉴。,0
1,30140571,嗝嗝老师,HAN YUE,181044148,力荐,2021-11-17,03:34:26,【264/166】电影讲述的是一个双面励志故事～不仅老师励志，学生更励志。虽套路简单，但足以赚足观众的眼泪💧！这部电影真正印证了那句话“天下没有教不会的学生，只有不会教的老师”。同时，9F班的14位学生以及这位嗝嗝老师的故事很好的告诉了我们“身处若弱势的他们需要付出多大的努力才能不让自己坠入深渊”的道理！！！,0
1,30140571,嗝嗝老师,小飞侠3799,flyingbria,力荐,2019-02-10,01:04:25,"2019.2.9. 德里飞坡县
充满收获地累了一周，回程路上这次屏幕没坏，但耳机是坏的。于是在听不到声音就看字幕的情况下从头哭到尾。和放牛班春天啦死亡诗社等不一样的是，女主去学校上班，学校里的情况，学生的情况和家长的情况，简直就是我的field work的翻版。太感同身受了，于是一上来就能感受到她太不容易了。我时常觉得Delhi always makes me a worse person before making me a better person.这等艰难的环境下Naina姐姐既目标明确初心不改，又有坚定有趣的执行力带领学生一起进步，甚至真的深入贫民窟家访着开家长会……也是很多德里的老师校长们在hostile的体制和环境下make a difference的缩影了。皆大欢喜的结尾确实有点理想了，但最底层的人们生活已经如此的艰难，真的需要一些泡泡不被戳穿吧。",0
1,30140571,嗝嗝老师,哗啦啦,hualala,还行,2018-12-01,20:08:25,尊严是修养来的，站在屈辱的反面。,0
1,30140571,嗝嗝老师,武奕虹,170441996,较差,2023-01-04,23:13:18,"纯鸡汤文，不知道想拍出来麻醉谁。各种设置也不符合印度实际，可能是为了推向国外所以美化了些吧。
很生硬的模仿着西方的架构，穷人家孩子成绩不好本质上根本就不是爱不爱学习的问题，我想我们身边的人就足以给出答案。
很假很套路化，及格分都不想给。",0
1,30140571,嗝嗝老师,Janie,55300712,力荐,2018-09-30,00:33:31,"讀書的時候總是那麼美好
好像只要努力什麼都可以得到~",1
1,30140571,嗝嗝老师,swan,swan93,推荐,2018-10-16,19:02:42,印度快跑，不要管我们！,1
1,30140571,嗝嗝老师,卡帕,karpper,还行,2020-02-10,01:37:51,我喜欢那个菠萝蜜的比喻,0
1,30140571,嗝嗝老师,O型血,UloveWo,,2019-02-06,20:56:05,https://www.bilibili.com/video/av46266435好老师https://www.bilibili.com/video/av35367883本来想去电影院看的，但是与我的时间有冲突，排片太少了，只有夜场。https://www.bilibili.com/video/av41751135,0
1,30140571,嗝嗝老师,兔猻咬你耳朵尖,MoiNightingale,推荐,2018-10-13,20:54:41,3.5，還是比同類型的《五個小孩的校長》差一點，太勵志太熱鬧了，只專注於學校的教學歧視，對在處於貧民窟的學生家庭那裡會遇到的阻力有些忽略，不知道是不是地域文化原因，這點《五個小孩的校長》做得還蠻好。不過女主真的一看就很親和，比楊千嬅像老師23333,0
1,30140571,嗝嗝老师,已注销的Asuku,5838069,,2019-02-19,21:13:30,瞟了几眼，太理想化了。,0
1,30140571,嗝嗝老师,Sam,RedDemonMo,推荐,2021-11-16,22:28:09,剧情一般，但堂妹的演技，顶！,0
1,30140571,嗝嗝老师,一只特特呦,142540464,还行,2021-02-07,20:10:26,"“没有差学生，只有差老师”好大一碗鸡汤。
毫无任何新意且流于表面的励志，无脑使用生活化开放的教学，虚假的因材施教，又偶然的发现天才。
恶意来的都太俗套，善意来的都太幸运。
但作为类型片，大众观感会比较好。
我觉得最好的一句话反而是“卓越从来不是有趣能换来的”。",0
1,30140571,嗝嗝老师,懦弱者的托词。,ZY-Monster,推荐,2019-06-02,16:01:11,其实是个非常套路的电影，基本上就是《叫我第一名》那个故事，但是还是可以打动人，而且印度本土化做得真的很棒，加入了印度的一些社会问题。一个敢于真正审视自己国家问题的国家，才会有解决问题的可能。,0
1,30140571,嗝嗝老师,暴脾气的唐抓抓,52539615,力荐,2018-10-12,23:52:48,一波三折的故事，打动人的剧情，大女主的设定，看哭了好几次。妈耶，阿三电影牛批！,1
1,30140571,嗝嗝老师,格子,1162708,推荐,2018-10-12,23:47:03,老师带领差生取得成绩并不稀奇，最后一番男老师为优等生承认错误才高级。教育，到最后教的不是输赢、不是分数、不是阶级，而且价值观、真善美、独立和自我意识。印度电影真是部部有水准，瞄准贫富差距真敢说，其实经济发展不那么快也有好处…,1
1,30140571,嗝嗝老师,evenback,89709568,很差,2018-11-05,06:15:11,超级难看啊。。。为什么现场还有女生感动的热泪盈眶,1
1,30140571,嗝嗝老师,我是直的,i-am-straight,还行,2018-12-11,19:26:04,1、印度女教师版叫我第一名 同是患有抽动秽语症的教师题材 印度的这部也不差 据说翻拍 难怪剧情基本一样 不过印度这个环境再加上女性元素在当地会更吸引人吧2、看了几个印度片子 当中的女主角每每受挫 都是她们的妈妈在背后支持和鼓励  只是觉得在对女性不友善的大环境中 母爱真的是最棒的安慰,0
1,30140571,嗝嗝老师,林中行人,lzxr,还行,2020-01-06,00:38:56,励志的背后其实可能需要万倍的努力。,0
1,30140571,嗝嗝老师,杏子,souryour,较差,2018-10-25,21:06:01,幼儿园教师集体观影，不能请假，还要写观后感，本人一点都不感动，剧情太俗。,1
1,30140571,嗝嗝老师,吴异.nova,waitingbaby,力荐,2018-10-14,17:11:47,题材不新，但是本地化做的很好，再次反映社会现实了。引进公司也不好好剪一下，中场的Intermission和片尾的大一堆比如Zee的印度公司Logo都没有被剪掉…哈哈哈,0
1,30140571,嗝嗝老师,海子,haizi1983,推荐,2018-10-13,11:42:14,影片里既教书又育人是真正的教师，特别是能育人的老师是体现教师精髓的大师级老师，使学生考出好成绩反而容易些而现实中能教好书，使学生考一个好成绩，考进一所好学校已实属不易。,0
1,30140571,嗝嗝老师,Entrop1e,vincent910203,推荐,2018-10-17,11:13:46,印度也在不断向「用电影改变国家」的方向前行啊 放牛班加歌德加各种阿甘情怀,0
1,30140571,嗝嗝老师,龙光彪,42772706,推荐,2018-11-10,07:53:34,非常感动，哭。看到一些评价，说对贫民窟猎奇、没有坏学生只有坏老师太绝对了之类的。这电影关注点是教育，不是印度的阶层差异，，根据我有限的教师生涯和学生生涯，没有天生的坏孩子，一个孩子的成长定型，家长老师起的作用最大，而家庭对学生的影响，恰恰是本片弱化的，虽然很穷，但是没有展现出来家暴之类的坏家长。。一部电影盛不下太多主题，这部电影真的是很好了。。妥瑞氏症，不要带有色眼镜看学生，很好了。,0
1,30140571,嗝嗝老师,UnforgetMemory,148839064,很差,2022-11-30,20:24:50,阿三 叫我第一名,0
1,30140571,嗝嗝老师,影子的影子,yfqc24pippo,还行,2020-11-23,00:13:50,就很老套的故事，温情向也没太打动人，但是女主演太难了，给她加一星,0
1,30140571,嗝嗝老师,郑先生,183033421,较差,2018-10-13,22:12:04,真的不值7分，整个剧情反复出现大同小异的波折，孩子调皮恶作剧被骂，老师原谅，然后孩子下决心变好，可是又犯错炸毁展品，老师又原谅，后面考试作弊未果，被举报作弊，学籍开除，老师还是包容，直到最后“”坏老师”良心发现，还他们清白，三次波折就太拖沓了！太模版化，看了开头就猜到的结尾！,2
1,30140571,嗝嗝老师,Michele,Michele19,还行,2020-02-11,20:33:22,7.0 完成度是很不错，对社会底层生活的现状也略有描写，最后反派老师的弧光也出来了，一般来说教会学校的校董的权重会比较大，在这里面有缺失。,0
1,30140571,嗝嗝老师,柠檬不好吃,83244806,力荐,2018-11-29,16:50:02,虽然很鸡汤，但很喜欢最后男老师背锅的态度,0
1,30140571,嗝嗝老师,流浪的独角兽,tangxinhao,还行,2018-05-18,17:57:22,印度版的《一个都不能少》《放牛班的春天》,2
1,30140571,嗝嗝老师,赫恩曼尼,62675594,推荐,2018-12-07,22:17:06,神还原《叫我第一名》，除了把男主换成了女主，不知道是不是买了改编权。最打动人的还是教育阶层、教育平等问题，学生和老师彼此信任，互相成全。印度直面现实的电影总能戳中泪点，虽然这部的煽情节奏太过模式化。,1
1,30140571,嗝嗝老师,瓜。相信这个世界很变态。,melonsa,还行,2018-12-30,22:54:24,没有原版好。,0
1,30140571,嗝嗝老师,绿毛水怪,127299151,还行,2018-10-29,15:41:46,印度电影看多了就有一种大饼卷一切的套路感,0
1,30140571,嗝嗝老师,少年赵里昂,57338332,还行,2019-09-16,15:04:09,普普通通，乏善可陈。整个电影看下来很流畅，但故事就我个人而言没有多打动人，所有的起承转折都太死板了。放在几年前可能会打动到我吧。不过还是能看，喜欢印度电影或者励志片的完全值得一看。,0
1,30140571,嗝嗝老师,LIAR,liarsliar,力荐,2019-02-03,20:44:06,印度人真了不起,1
