page_index,movie_id,title,username,user_id,rating,date,time,comment,useful_count
0,26944582,雪怪大冒险,同志亦凡人中文站,3540441,推荐,2018-09-23,10:24:45,打破偏见和恐惧的是真相而不是白色谎言，很寓教于乐的动画片。原声有点洗脑，男主我觉得好像贝爷啊。PS这故事竟然发生在喜马拉雅山麓的中国一端，大雪怪智斗我国武警的那段戏不知道国内上映后会不会删～,278
0,26944582,雪怪大冒险,桃桃林林,qijiuzhiyue,还行,2018-10-06,18:47:23,好莱坞的动画总是会塞进不少道理，而且都是很好的融入到故事当中，倒是非常适合小朋友。就像这部，仍然会告诉你不要守旧啊，要包容其他族群啊之类的话题。最有趣的点还是大脚怪与小脚人类互相的误解与恐惧，以及由此产生的笑料。中间那首rap倒是非常独特的。,164
0,26944582,雪怪大冒险,朝暮雪,lingrui1995,还行,2018-10-22,12:37:33,"动画版《幸福的拉扎罗》，画面精美，剧情也不落俗套，不但不低幼反而充满隐喻。
雪怪下山的片段绝佳，吃豆子的创意很赞，甚至解释了“为什么雪怪和人类都说英文，但他们无法交流”的bug，这点很用心。
“石律永远是对的”影射盲目服从，“你根本想不到他们有多好骗”讽刺十足，“如果我不是敲锣雪怪，那我是谁”引发对生命的思考，“在他们眼中，我们才是怪物”更是产生《黑镜》版的细思恐极，最后又以“让他们知道真相，好过用谎言来保护他们”升华主题。
PS：男主的手机充电五分钟，录像两个月。",88
0,26944582,雪怪大冒险,月光满兜,edgeoftheunknow,推荐,2018-09-30,08:57:33,国王唱rap和城中追逐戏这两段很棒,135
0,26944582,雪怪大冒险,kylegun,2265138,力荐,2018-10-25,21:24:16,轻松愉快雪怪敌托邦：以国民安全为由，靠闭关和谎言下的集体劳动维系空中楼阁国家机器的存在；想搞大新闻的西方记者，被说着普通话的警察关入囚车。为Common配音的雪怪领导人谎言治国有理rap给足满分,57
0,26944582,雪怪大冒险,伊夏🪀,JoGreen,推荐,2018-10-20,14:00:25,结尾太理想化了 但还是骗到了眼泪,102
0,26944582,雪怪大冒险,亵渎电影,zhangzongqian,还行,2018-11-16,00:11:33,住在中国一端高山上的雪怪一族，他们的历史非常有寓意，特别是他们站成人墙直面武警的时候，只是现在这种美好的结局，我们就假装是片方为了过审而拍的特供版吧。,31
0,26944582,雪怪大冒险,突然粉碎,4051316,还行,2018-10-15,21:22:58,以为是低龄幼齿动画，没想到是欢乐温馨版《神秘村》，村长很嘻哈，主角们看起来毛茸茸暖和和，特别适合秋冬观看（对不起牙叔宝爷，一句词也没唱对的Under Pressure让我一秒忘了原版，愚民手段太讽刺，网红心酸谁人知，民主法制教育要从娃娃抓起，能上映已经烧高香，结尾还是略显刻意了,22
0,26944582,雪怪大冒险,七海,Madonna-Holic,力荐,2018-09-29,21:50:24,Love it Love it Love it!就一个槽点喜马拉雅山脚下的村庄能是那个样么。。。。,15
0,26944582,雪怪大冒险,神仙鱼,eric_iiw,还行,2018-10-22,20:30:10,没注意看售票信息错看成了国语版，但也能看得下去并且觉得有趣，只是唱歌的部分也用中文实在是没法听。将人与雪怪的身份倒置，一来讽刺这“小脚怪”确实作恶无数是个怪物，二来是让人换位思考更容易理解自己做了什么。但只能说它还是拍给孩子看的童话，寓教于乐，所以最后隔阂化解得那么轻松，所以一度铺下“你不知道他们有多好骗”“真相在权力面前毫无意义”“知识就是力量关键在于你怎么利用它”这些让人以为会带有暗黑政治隐喻色彩的梗也一齐被乐观得吹散了。只希望现在的孩子们以后会明白吧。但其实基本没这个可能。ps.雪怪面对的人类是中国人。pps.看到LBJ出现在演员表里吓一跳。,13
0,26944582,雪怪大冒险,段郎RockDuan,rockduan1987,还行,2018-10-30,11:06:24,"很套路的欢乐动画唱片
就是把人类想的太美好了，不可能的，人类就是最卑鄙的生物
村长的Rap真棒",9
0,26944582,雪怪大冒险,mondenawait,3884732,推荐,2018-10-31,18:22:56,rap叙事够6 看到有评论说山脚下的是中国 其实 山脚上的才是中国吧,65
0,26944582,雪怪大冒险,林西拿,milukulam,推荐,2018-09-29,11:35:01,「我已經學會了如何睜著眼睡覺。或許，眼前的你們只是我的一個夢。」,53
0,26944582,雪怪大冒险,独行侠杀手阿何,RockerHo,推荐,2018-10-26,23:54:08,雪怪和人类和谐相处。人类男主好可爱，和雪怪莫名有CP感。片中竟然出现了两首我的饮歌！詹皇竟然有配音？村长那首Rap很过瘾。做人必须要敢于质疑和挑战权威，推翻不顺应时势的保守传统，残酷的真相总比谎言好一百倍。首领带头造假用谎言蒙蔽民众还声称这是“为了他们好”的设定，嗅到了一点戳中中国的政治隐喻。山脚下的霓虹灯城镇美若梦境，还有不少中文招牌，竟然还有说中文的中国人……（所以到底是个什么地方？）,26
0,26944582,雪怪大冒险,顾老肉,cindycoo,还行,2018-09-14,13:33:55,我们钱宁果然配音的角色也是胸大无脑啊，以及强烈怀疑詹姆斯来湖人是为了学科比进军好莱坞。整体喜剧性还不错，设定也算有趣，但是无论是主角还是反派，转变都太突然了，结尾也很仓促。stone keeper给众雪怪洗脑，用蒸汽建造云防火墙也是非常讽刺了……,14
0,26944582,雪怪大冒险,朝阳区妻夫木聪,Invisible___,还行,2018-10-21,21:46:57,看的时候根本不敢多想，稍微多想一点就会觉得：卧槽这故事是不是太敏感了一点，愚民政策是在影射某国嘛！这片子怎么过审的……,8
0,26944582,雪怪大冒险,虾坨坨艺仔,yancm,还行,2018-09-30,17:54:41,最喜欢突然rap起来那一段，颇有点进击的巨人的味道（？）,6
0,26944582,雪怪大冒险,你虎哥,57460299,力荐,2018-10-15,15:35:27,雪怪和人类交流障碍的设定太有想象力了！以及老雪怪那段rap惊为天人！（二刷回来感叹道：中文版rap也非常屌,12
0,26944582,雪怪大冒险,张咏轩Wayne®,55617091,推荐,2018-12-11,11:35:47,看片过程大冒冷汗，这明显的政治隐喻当初是怎么过审的，真相于权利面前毫无意义，还有愚民政策明摆影射…好在电影用寓教于乐的手法，可爱丰满的动画形象，把严肃的母题不动声色的揉进这个雪怪角色里，软化了说教，抚平了尖刻，然后用温暖的故事教我们要消除偏见，融化隔阂，无论是误会还是成见，最后都用一场合家欢来收尾落幕，将那些暗黑的隐喻色彩用乐观和团圆一同吹散，虽然结局完美的过于理想化，但这还是最高级的诉求表达，一片歌舞升平，还能有成人向的深刻思考，很难得。★★★★,18
0,26944582,雪怪大冒险,恶魔的步调,Len.,还行,2018-10-21,11:52:21,高峰乌托邦之第三类接触,6
0,26944582,雪怪大冒险,JoeyLu陆柏宇,lubaiyu,推荐,2018-10-21,10:51:13,一定要看中文配音版，绝对惊喜，绝对物超所值！！！,23
0,26944582,雪怪大冒险,风中奇缘,62345168,推荐,2019-01-15,21:09:19,歌曲是真的棒，大冬天正需要这种歌舞动画，跟着主角，唱唱跳跳，身体都暖和了。剧情里融合了房龙《宽容》里的故事。,2
0,26944582,雪怪大冒险,橘猫爱吃鱼,169089788,推荐,2018-10-22,07:29:01,剧情感人有内涵，歌曲很有感染力。,3
0,26944582,雪怪大冒险,everwalze,3595121,推荐,2018-10-30,00:13:08,总体不错，中间村长反转说他自己编造谎言的时候比较惊喜，但村长的第二次反转和人类握手言和比较牵强。怪物很可爱。,2
0,26944582,雪怪大冒险,秋陌离,burningdays,推荐,2018-10-08,06:19:40,好笑的动画，和疯狂原始人一个意思,2
0,26944582,雪怪大冒险,vivian酱,54193222,力荐,2018-10-30,09:53:44,一部关于人类和雪怪的小故事。温馨又搞笑。孩子们看看挺好的~~,1
0,26944582,雪怪大冒险,清晨稻田,70565824,力荐,2018-10-21,23:13:38,不沟通不面对相互看对方都是怪物，对未知的恐惧和排斥，喜欢最近看到的一句话，反正命都会没有的，何不活的胆大点。外国的电影鼓励提问，探索，勇敢，好奇心，挑战权威，输出的价值观不要太正了。恐惧未知，不要自己吓自己。外国的动画都这么深刻了，咱们还在追姑妈,4
0,26944582,雪怪大冒险,饮歌,35790692,还行,2018-10-21,22:28:12,难道生活在山顶的雪怪不就是生活在天朝的我们吗？被一层人为的云雾蒙在鼓里，周而复始的生活着。我觉得这分明就是一部同志片，一大一小的couple组合要萌死谁呀。要不是结尾太敷衍，应该值得更好的分数。,2
0,26944582,雪怪大冒险,1968小金,tongchu,力荐,2018-10-21,14:45:56,和女儿一起看的。她给打9.9分,1
0,26944582,雪怪大冒险,椒盐豆豉,mfcndw,推荐,2019-03-15,07:29:13,飞机上看片都有加成，虽然画面平庸人设平庸煽情平庸搞笑平庸音乐平庸，揭晓雪人村秘密那段还是觉得设定挺酷的。,1
0,26944582,雪怪大冒险,豆友144045833,144045833,推荐,2018-10-20,19:43:28,很搞笑又很有意义的好莱坞动画，雪怪很幽默，很适合带小朋友一起看，整部电影笑点很多，温馨而且有意义，这是一部有教育意义的好电影,2
0,26944582,雪怪大冒险,嘟嘟熊之父,duduxiongzhifu,较差,2018-10-25,13:56:39,我站老村长，人类一定会把大雪怪都杀死的。所以这故事影射不到我Dang，顶多影射一下杀光印第安人的欧洲殖民者。,48
0,26944582,雪怪大冒险,云之心,yzy92188,推荐,2018-12-09,23:28:38,“我们觉得他们是怪物，他们也觉得我们是怪物，这不会因为躲藏改变，我们必须交流……”故事的寓意和中间的rap很棒，但是看似完美的结局也太过于理想化了……,1
0,26944582,雪怪大冒险,sjun,58376934,推荐,2018-10-30,11:42:28,c超喜欢村长的那段rap，振聋发聩,1
0,26944582,雪怪大冒险,LoudCrazyHeart,72086305,还行,2018-12-09,22:29:41,如果雪怪们继续因为人类带来的伤害感到恐惧，选择不去了解人类，继续隐匿自己的行踪，就会成为封闭环节，而这一环节终有一天还是会打破。所以结尾大团圆式的采取了积极措施。原创歌曲挺朗朗上口的。,1
0,26944582,雪怪大冒险,xx,173893000,推荐,2018-10-20,19:22:53,特效不错，剧情也蛮搞笑的，小朋友挺喜欢的。,2
0,26944582,雪怪大冒险,点金,cyeon,推荐,2018-09-23,00:26:28,歌舞儿童电影 里面有很多梗 可以全家一起观看但是每一个做企业转型和变革管理的人看了应该都会很有共鸣 所有发生必有原因 要改变必须从找到根本 电影的结局还是很适合小朋友观看 因为现实不会这么进行 更贴近现实的怪兽与人类相聚的电影应该是金刚- 不管怎样 先抓住再说 抓不住就干掉它,2
0,26944582,雪怪大冒险,Nemooo,deartintin,还行,2018-10-21,21:07:16,国家机器制造云雾意在掩盖真相(｡•́__ก̀｡)你无法想象他们有多好骗……,3
0,26944582,雪怪大冒险,陈晏慈,149748526,推荐,2019-04-12,21:57:38,危险，源于未知,1
0,26944582,雪怪大冒险,天马星,cinestar,推荐,2018-10-21,22:27:34,今年目前为止最好的动画制作，对于成人影片中关于愚民的「社会机器」与残酷的「种族歧视」的隐喻都引人思考，对于儿童影片中可爱的雪人与欢乐的歌舞都足以寓教于乐。,1
0,26944582,雪怪大冒险,糯米团子,154370180,推荐,2018-10-30,10:56:48,很有趣，想法很赞，说出真相会让同伴不舒服，但是真话永远都比谎话有意义。雪怪和人类的相处，双方都觉得彼此是怪物，见面就要死磕。但其实，达成理解和沟通会变得更加美好。,1
0,26944582,雪怪大冒险,豆豆,138728415,推荐,2018-10-30,09:24:07,“国家用机器制造出云层，将真相掩盖在云层之下，以保护之名制造恐惧和谎言。我们所生活的世界，只有极少数人真正的了解。”,4
0,26944582,雪怪大冒险,sssssss,52484586,推荐,2018-12-09,22:49:24,中间意料之外的长老之所以制造一系列看似愚昧的法制却是为了保护自己的族群 知识就是力量，可你要用这个力量做什么，有时候寻找到真相却是如此残忍 作为动画作品最后结局还是强行搞了个人怪和谐大团圆  现实哪有这么美好 设定是在西藏吧看到好多中文标牌,1
0,26944582,雪怪大冒险,极圈里的燕鱼,72002197,推荐,2019-04-12,21:58:29,涉及的道理渊远深刻，探讨的深度直抵人心。“无知是福”“你已经叫醒了他们一次，不要让他们再次陷入昏睡”台词也都耐人寻味。国配团队精湛出色，各色动画审美疲劳的歌舞中突然一段极其押韵深刻的说唱简直令人惊喜万分。中国元素终于不再低幼，能够巧妙地呈现。村长带领米果参观幻境，教他维护谎言，这在《雪国列车》中也有过展现，如果认同了那就是一个责任和地位的交接，现实中也一定会这么做的，不过动画要美满而不是残酷。人类天性如此，天性就是生存。,2
0,26944582,雪怪大冒险,发条饺子,beifeimm,还行,2018-12-31,15:37:51,毛茸茸的巨型反差萌、傻白甜的政治隐喻，不仅让大人小孩都各得其乐，还安安全全的上架了国内院线，最黑暗的情节也被村长那段哭啦猛C的雪山黑帕化解了情绪，看完好想买一个雪怪大抱枕。ps：中文版的原声歌词翻译得好生硬。,1
0,26944582,雪怪大冒险,发条橙,Duansiyu_1996,还行,2018-10-21,20:18:20,非常的寓教于乐啊，友情与冒险，爱和正能量。如果不想被谎言蒙蔽双眼就更应该努力去探索真理（电影的寓意甚至有些细思极恐）。在我看来，好莱坞动画电影的魔力就是：在非常轻松愉悦的语境下潜移默化的让观众，尤其小观众明白一些人生真谛与道理。在一种让人很容易接受的氛围下，笑过之后有思考，这才是主创们的初衷吧。,4
0,26944582,雪怪大冒险,kakakarl,zhanyakui,推荐,2018-10-24,21:51:16,简直就是在讽刺政治统治。但是动画里真好，结局太美好～,5
0,26944582,雪怪大冒险,MaxHorowits,jeanbapt,力荐,2021-03-17,00:50:34,求真的必要与美好！现实残酷，但胜一直过活在谎言中。虽然有些过于理想主义，但还是大脚小脚的连结还是非常有爱啊！,0
0,26944582,雪怪大冒险,Die Katze,maynepaddy,还行,2019-01-23,13:10:02,基本就是把“大脚”梗反过来用到人类身上。例如帕特森被大脚用睡袋背上山的情节就是根据二十世纪初期一个淘金客在英属哥伦比亚的遭遇改编的。,1
0,26944582,雪怪大冒险,云霄飞车手,qmpzt,推荐,2018-10-20,00:03:38,大脚怪的传说是欧美世界小朋友最好奇的怪物之一，故事直接以大脚怪的视角展开，整个社群遵循古老的石经，不信有小脚人类存在，其实矛盾围绕着能否质疑权威这件事，把一个严肃的母题揉进可爱的雪怪形象里，软化了生硬说教，另一件事是我们如何消除偏见，看到跟自己物种不一样的生物，本能退避，害怕做出防御姿态，最后通过交流来融化隔阂，消除人类隐藏心底的偏见，本故事的意义。好在讲述好玩，可惜看的银幕不够大，3D眼镜很烂,3
0,26944582,雪怪大冒险,纤纤,158629236,还行,2018-10-22,08:20:30,可爱真实的雪人，相互好奇的两方人，很适合小孩子。,3
0,26944582,雪怪大冒险,深夜声噎,sfroompp,推荐,2018-11-03,18:01:14,前面挺有趣的哈哈，音乐性也不错对歌唱没有抵抗力，后面瞌了会导致没有看到有没有中国边境警察出场。,0
0,26944582,雪怪大冒险,Chuck,Affinity,推荐,2018-12-30,05:52:33,比较简单的剧情，立意挺好，保护环境，不要为了好奇心和利益而去屠杀别的物种。,1
0,26944582,雪怪大冒险,蓝抑郁剂Lily🌈,74672452,还行,2021-02-05,21:32:38,换个视角看世界立马不同,0
0,26944582,雪怪大冒险,请叫我腹黑,metkee,推荐,2018-11-02,22:29:13,这一片白雪皑皑的世界，其实挺适合放到圣诞档。感谢好莱坞的大部分动画片并不准备只给小孩看，更是为了那些带娃进电影院的大人们。,1
0,26944582,雪怪大冒险,生人回避,51911319,还行,2019-01-13,22:32:42,RAP部分不能更赞,0
0,26944582,雪怪大冒险,生生鸟,125739150,还行,2018-12-09,21:36:34,故事走向越来越成人化，然后被一个草率的大团圆毁了,1
0,26944582,雪怪大冒险,瑶瑶,phoebe627,还行,2018-12-20,12:15:16,不同种族需要互敬互爱，比较适合儿童的动画,0
0,26944582,雪怪大冒险,Panda的影音,PandaMovieMusic,推荐,2018-10-19,01:27:02,2018.03.12→2018.10.19：《雪怪大冒险》国语配音版有把电影里的歌曲翻唱过来，甚至还贴心地配上了歌词字幕，真是给力！＆ 有时候真希望我能拥有自己的电影院，这样就能在密钥生效的第一时间观看我期待不已的电影。也能在大银幕上重温自己喜爱有加的电影。—— 2018年10月19→24→25→30日，影院四刷《雪怪大冒险》完毕！国配+原声看罢，坐等将来再看台湾配音版+给小朋友们推荐放映观影！—— 2019.01.12：妈妈，生日快乐！＆ 拖了好些日子，终于如愿初次给小朋友们放映《雪怪大冒险》了，也顺便完成了看台配国语版的计划。……看到电影中的部分片段，回忆起之前在影院观影的经历，莫名让我有些想流泪。,2
0,26944582,雪怪大冒险,[Deleted],roseinthedark,较差,2018-09-28,12:11:47,动画电影加入歌舞元素常见，这一部好看的在于不仅仅是opera，甚至加入了rap，而且它成功的塑造了让人觉得很新鲜的雪人王国；只是这全片连雪怪都讲英文（不讲话同样可以做动画片主角，参见Wall.E 和How to Train Your Dragon，以及今年上映的 Sgt. Stubby），“反面角色”的警察在最后拎出来偏偏设计了中文配音，潜意识里对雪怪迫害的锅就推给中国人了？这感觉并不太好；而且喜马拉雅山下一幅东北雪乡的模样...看着很奇怪但这也不能较真了；至于其他值得一提的是，雪怪没有鼻子....最后，片尾有掉牙的小彩蛋,20
0,26944582,雪怪大冒险,小林多糖,155802244,力荐,2018-10-21,18:39:51,好莱坞动画片已经讲得这么深了啊。每个人都是大机器里的一颗螺丝钉，闻到了讽刺的味道。这片三观太正了，引起舒适。赞达雅唱歌真好听。看动画片都哭，我是什么沙雕。,1
0,26944582,雪怪大冒险,5691,five691,推荐,2018-10-20,14:13:55,寓意很好～,3
0,26944582,雪怪大冒险,g1823,61282710,推荐,2019-01-10,22:56:02,钱老板唱歌，喜马拉雅山下中国的地盘，做的不错,0
0,26944582,雪怪大冒险,龙皇,145516659,推荐,2019-03-23,19:45:01,中国元素不少，但许多汉字用错了；特效不错，故事很温馨，结局很童话。,0
0,26944582,雪怪大冒险,谢谢你们的鱼,reave,还行,2018-10-21,20:37:29,剧本挺好的，两个世界的视角，对于真相与谎言的探讨，自我意识与既定规则的抗争，华纳自己原创的CG动画总是会加入很多现实意义的思考而不仅仅是寓教于乐这么简单，但是就整体的观赏性上来说确实还是差点意思。效仿迪斯尼的歌舞让影片的节奏相当不稳定，甚至有时候还能产生强烈的脱节感，当然，主要也是因为歌曲并没有那么有记忆点，也就是部还可以看看的好莱坞主流动画吧。,1
0,26944582,雪怪大冒险,快乐时代,79605736,还行,2018-12-07,13:32:01,整体非常一般 华纳在动画电影方面有可能永远不能和迪士尼再次平分天下了 有一半以上的成功商业片是新晋黑马电影公司传奇合作的项目 包括明年的死侍皮卡丘 华纳动画电影的底裤是五十年代经典兔八哥不知道什么时候会拿出来赢回一点市场,1
0,26944582,雪怪大冒险,猴紙瓦力,crayonmonkey,推荐,2018-10-21,16:13:02,今年確實是好萊塢動畫小年，華納動畫工作室的這部作品口碑差不多能上年度三甲了，儘管裡面的笑點沒有一個能比得上他們上一部獨立作品Storks裡狼那幾段（尤其是追逐戲合體變形那一段當時可是笑趴在電影院裡半天起不來的），配角刻畫筆墨也不太足，後半段略顯倉促，但是整體故事更流暢了，有四、五段迪士尼式一言不合就唱歌的橋段炒雞棒，叫人忍不住抖腿晃腦袋（不影響他人的那種），而最後那種老掉牙的Cliché煽情戲碼也能勉強騙人擠出半滴眼淚來。對了，這部影片怎麽過審的，感覺很多話都很值得被和諧啊=w=,4
0,26944582,雪怪大冒险,空语因明,godi,推荐,2018-12-24,08:04:21,now  you  know,0
0,26944582,雪怪大冒险,黑眉下的绿眼睛,2718689,力荐,2018-10-19,21:26:12,不只有勇气去追寻真相，还应该有勇气面对真相，这样的主题大人孩子都应该看一下。最后雪怪和人类打破偏见试图沟通的场景不禁让人联想到现实社会，如果童话不只存在于童话之中该有多好。,4
0,26944582,雪怪大冒险,臭魚本魚,63412313,还行,2018-10-24,10:14:05,娱乐性一般般，听听歌还不错,1
0,26944582,雪怪大冒险,Angie,24639587,力荐,2018-10-01,12:26:42,Rap那段很赞，结尾小感动，觉得是在电影院才能呈现的效果。ps：你在电影院看的第三部电影，没睡着,3
0,26944582,雪怪大冒险,Suri,suriwoo90,推荐,2019-07-30,08:32:33,夏日消暑片。到山脚下的设定是在中国啊，中文字，汉语和藏族纹饰。人类是小脚怪，设定好可爱。用动画讲道理，打破隔阂挑战权威，好看易懂也不低幼龄，村长rap666啊。,0
0,26944582,雪怪大冒险,LORENZO 洛伦佐,vividtime,还行,2019-12-05,05:43:17,中国旅游宣传片。,0
0,26944582,雪怪大冒险,女神的秋裤,movieater,还行,2019-01-02,11:01:11,简单，轻松，搞笑，也有些套路和平庸,0
0,26944582,雪怪大冒险,说什么图灵,memorymare,推荐,2019-10-01,13:16:12,比较商业，还是挺欢乐的，主题也是相互理解，很好,0
0,26944582,雪怪大冒险,轻灵真实,2475703,力荐,2018-11-16,22:20:44,惊才绝艳,0
0,26944582,雪怪大冒险,冰镇西瓜橘子水,65400706,推荐,2018-12-09,22:41:19,钱老板唱歌居然这么好听 要是雪怪形象再可爱点 票房应该会好很多吧,0
0,26944582,雪怪大冒险,杰诺拉泽,ivanovski,,2020-03-03,09:52:29,，。。。,0
0,26944582,雪怪大冒险,刘小青,liuqing2009,还行,2019-02-20,13:51:26,陪闺女看,0
0,26944582,雪怪大冒险,夜观风,yeguanfeng,还行,2020-03-16,12:35:41,"预算：8000万
首周末票房：2304万
北美票房：8324万
全球票房：2亿1404万
上映日期：18.09.28-19.01.17
上映周数：16周
分级：PG
最高院线数：4131
北美最高排名：2
发行方：Warner Bros.",0
0,26944582,雪怪大冒险,外出偷狗,thomasneeson,较差,2019-02-04,17:09:48,智障,0
0,26944582,雪怪大冒险,巴别塔的光芒,46572945,力荐,2019-01-07,14:14:16,如此简单的剧情也能有深入的内核，太不简单了。,1
0,26944582,雪怪大冒险,本初老儿,alacrity516,还行,2019-01-07,06:01:28,居然要啥有啥，嘿！,0
0,26944582,雪怪大冒险,一個死槍槍,boe,还行,2019-05-13,04:18:00,這造型是長腿版的sulley+貓王嗎哈哈,0
0,26944582,雪怪大冒险,豆友1174140,nooneisthere,推荐,2019-03-23,12:34:02,动画片里面属于不错的作品,0
0,26944582,雪怪大冒险,黑色大丽花,Nahash,推荐,2018-11-04,11:16:18,片中的隐喻看着像《蝇王》，本来以为很低幼的，还算有点想法。,0
0,26944582,雪怪大冒险,Max,Killo,还行,2019-01-24,20:49:22,仔细想想我们就是那些雪怪，封闭在鸡形国，片中制造的浮云其实就是长城,1
0,26944582,雪怪大冒险,summerspark,98649165,力荐,2018-10-19,21:55:27,看这部电影让我想起在电影院看疯狂动物城的时候，并没有什么煽情的桥段，但是结局就是特别天真烂漫，为美好流泪了。当初是看预告觉得从雪怪看人类这个世界观设定太有趣了，看的时候也是雪怪和人类真的都好可爱。真心希望排片能更多一些。另外，村长中间的一段庄严的rap真的映像深刻哈哈哈哈哈哈。,4
0,26944582,雪怪大冒险,抠脚诗人,snokin,还行,2018-12-21,19:12:13,有点意思！,0
0,26944582,雪怪大冒险,Crazy Ivan,1153237,推荐,2018-10-22,17:21:25,GTS,0
0,26944582,雪怪大冒险,Ron Chan,RonChan,推荐,2018-12-16,19:30:37,歌好听。,0
0,26944582,雪怪大冒险,哗啦啦,hualala,还行,2019-01-01,17:39:18,井底之蛙做不得，天外有天，雪怪外有人。,1
0,26944582,雪怪大冒险,付玲,flowertide,还行,2021-07-30,17:35:58,结尾的时候垮了下来。想起了之前看到的一句话，在彼此相爱的过程中，人类才可以真正的和平。,0
0,26944582,雪怪大冒险,望潮,Budaphin,还行,2018-11-10,21:43:55,非常可爱的概念，在大脚怪眼里人类这种“小脚怪”也是可怕的存在，虽然中间有些地方比较低幼，让人有点困，但最后看到雪怪们拉着手走下山的那一刻还是感动到想哭。纯粹，干干净净。,0
