page_index,movie_id,title,username,user_id,rating,date,time,comment,useful_count
1,26944582,雪怪大冒险,洛梦蝶,luomengdie,还行,2018-10-23,21:26:36,所谓创新，未必是凭空创造一个前所未见的东西，只要改变观察的角度便会有很大的不同，你人类害怕野人大脚怪？其实大脚怪还怕你们呢？似乎就想起了东成西就里三个怪物说的，“人？好可怕啊！”。本片虽然基本是以大脚怪作为叙述主体，但实际上情感模式仍然是完全人类式的，传达的价值诸如走出舒适区、要保有好奇心、要包容多元、要消除成见、不要因循守旧，都是合家欢动画片经常要讲的大道理，但是完全寓教于乐，而酋长对村民思想控制的模式其实可以做蛮深的理解，痛陈革命家史的那段说唱很有料,1
1,26944582,雪怪大冒险,豆丁酱,52133820,推荐,2018-10-31,16:03:01,冲着雪怪大冒险的手游去的，但没想到还是呈现了一个低龄化的现象，情节过于老套，但不管怎么说，这种电影都给人内心以暖暖的力量，其中最大的出彩点就是rap加入进去，把讲道理通过这种方式传达可能更能让孩子们变得接受。,0
1,26944582,雪怪大冒险,iPhone X,90976874,推荐,2019-01-08,10:39:44,是我想多了还是这片有点蒸制银鱼？,0
1,26944582,雪怪大冒险,天命书生,53274308,推荐,2019-09-13,12:21:31,这个故事告诉我们闭关锁国的下场就是生产力停滞，所以都不敢说雪怪们吃什么，因为没得吃。一个语言交流的漏洞是雪怪有个EMS小组，你都有英语字母了，还不能和人类沟通？就算发音不同，可是字母一样啊。,1
1,26944582,雪怪大冒险,自燃，风月同天,nowandnever,推荐,2019-01-11,11:42:13,结局太美好了，但愿人间能如此……,0
1,26944582,雪怪大冒险,SHINe,36470321,还行,2019-02-03,11:30:57,设定不错，虽然看了开头就知道结尾了，但故事讲述的流畅生动有趣，阳光乐观还有深意，歌曲里村长的RAP最带感。喜马拉雅山脚下是美丽繁华的中国城镇诶～3.5,0
1,26944582,雪怪大冒险,张华弥,54056542,推荐,2018-12-04,09:46:11,西藏居民说话带港台腔好神奇诶。,0
1,26944582,雪怪大冒险,白rap与小笼女,58394414,力荐,2019-01-22,17:52:57,其实片名中Smallfoot指的是人类而不是雪怪翻译不够信达雅。Common就是知名说唱歌手啊喂。詹姆斯跨界表现可以。最后太理想化了，但因为是电影我喜欢happy ending所以无所谓。其实内涵很深啊……,0
1,26944582,雪怪大冒险,赵伯鼠zFy,zhaofuyuworld,推荐,2018-12-21,16:34:36,喜马拉雅山的居民中国元素很细节了。。结局很理想了。。我是奔着詹姆斯的配音来看的，却不知道配的谁。。挺好看的。。,0
1,26944582,雪怪大冒险,Artery,105015673,推荐,2018-12-07,19:08:22,故事新颖，剧情丰富，笑点很多，还混有很多中国风元素，这就是资本的力量嘛。片子的寓意也很深刻，谎言建立起的国家或者组织终究不能长久，人类的好奇心是世界前进的动力，是不能扼杀的。非常喜欢的一部动画电影，强烈推荐！,0
1,26944582,雪怪大冒险,三寿s,sanshous,推荐,2018-11-01,15:20:06,"我真的觉得国语版不错的，尤其国王的那段rap，居然比英文版更好听。
低龄人设+成人理念是美国动画的一贯风格，并且一直结合的非常好，我差点因为雪怪的低幼形象而放弃了这部电影，庆幸没有。
故事套路之中，但是也还是很有观赏感，四星推荐。",1
1,26944582,雪怪大冒险,欧富贵&LOL,wcngsjb,力荐,2018-12-11,05:58:50,话说这动画还真是成人向啊 长老开始那段rap的时候唱的我心脏一颤一颤的 差点就要哭出来了 最后站在一起真是嘤嘤嘤 结局做成这样不怪他们毕竟是面向低龄观众的动画片不然太黑暗了,0
1,26944582,雪怪大冒险,坚定躺平的锡兵,Stewart,还行,2018-10-28,17:44:35,没有奇观，没有激斗。角色立场之飘忽，显示他们自己也没有接受自己的人设。乏善可陈之作。,0
1,26944582,雪怪大冒险,马路口躺着条🐟,fishzero,推荐,2018-10-28,19:56:26,其实很神奇，整个电影的核心是走出统治者的谎言，唤醒真实，但动画片的结局却是编给小朋友看的谎言。LOL，美化和乌托邦总是必不可少的，村长rap一下子把前面的土摇风逆转了赞一个(/≧▽≦/),0
1,26944582,雪怪大冒险,Feem,133433124,推荐,2019-01-12,14:15:57,"希望与世界沟通的孩子们，
你们知道黑暗森林么？",0
1,26944582,雪怪大冒险,搭座木屋好不好,50919323,推荐,2018-12-07,00:30:45,最喜欢从双方的视角拍对方都像怪物 但其实都很可爱 我觉得胖J的英国腔声音真好听 适合配音,0
1,26944582,雪怪大冒险,S.Selina,2209318,推荐,2019-02-12,00:13:02,竟然过审了，吼吼吼,0
1,26944582,雪怪大冒险,圆山中庸,wildwood,推荐,2018-12-17,17:01:33,前20分钟：我是来看动画片的！我是来看迪斯尼的！我才不要鬼深刻和隐喻！后来：真香…转折得挺好，结尾没有过渡好，和谐得缺乏说服力。不过整体还是可以有，招牌合家欢。,0
1,26944582,雪怪大冒险,长翅膀的牛,58784233,力荐,2018-11-10,01:10:27,最近几年对美国动画很少失望，社会问题融到动画片里，老少皆宜，成年人的童话也就是这样了吧。保持对世界的好奇心，开放的心态，维护真实的勇气，而这同时又要做到维持平衡与秩序，这个故事说的我好喜欢。但最喜欢的还是我詹的配音，湖人总冠军！,1
1,26944582,雪怪大冒险,Wait,3618040,推荐,2019-01-21,13:41:00,姨妈期泪点真的低，看啥都哭，我也是无奈了。前几年玩过同款游戏，角色可爱，电影版更丰富，两种文明的碰撞，但也就动画片了，现实的话，与另一种文明的接触无比危险。,0
1,26944582,雪怪大冒险,zonovo,zonovo,推荐,2018-12-14,00:16:23,合家欢,0
1,26944582,雪怪大冒险,沸海鲸歌,96390757,还行,2019-04-02,19:53:18,作为一部全年龄向的动画电影探讨的主题挺深刻的，可惜结局的处理方式还是动画电影一贯的理想主义，三星半。,0
1,26944582,雪怪大冒险,leozac,137954890,推荐,2018-12-12,16:34:58,刚开始太傻白甜了，夸张的动作设定什么的，但还真的笑了，雪怪蠢萌又丑萌的蜜汁可爱...后面守石人那首rap我觉得把电影提高了不少，其实本来以为最后还是秘密终归秘密，这样的处理太理想化了，但是我也真的希望能美好一些啊，看到别人剖析的隐喻...有点难受啊，我还是get那些美好的点吧。,0
1,26944582,雪怪大冒险,于哈哈,onannan,还行,2019-12-18,20:39:23,还可以哦,0
1,26944582,雪怪大冒险,coolfax,coolfax,推荐,2019-01-18,20:16:22,和儿子一起看的，很欢乐的一部动画。,0
1,26944582,雪怪大冒险,鸡汁马,lomo5,推荐,2018-10-28,19:18:55,世界观如此之正！！简直是儿童哲学入门！,0
1,26944582,雪怪大冒险,多看电影爱电影,155985816,力荐,2018-10-20,14:36:31,超好看，很精致的动画片。两个娃都看的津津有味！,1
1,26944582,雪怪大冒险,lgowen,87502780,还行,2019-02-03,11:10:09,本片有关喜马拉雅山大脚怪雪人的传说。不过影片采用了不一样的视角。故事线并非采用人类视角。而是反其道行之，采用了雪人主视角。因此人类成了“小脚怪”。剧情非常欢乐，非常温情。适合全家人、全年龄的观众。同时影片的教育意义也扬正气促和谐。不同人种、不同文化之间若能平等相待，当然太平盛世！,0
1,26944582,雪怪大冒险,顾一,163050072,推荐,2019-04-15,19:34:28,或许所谓的怪物只是存在我们自己的内心中。,1
1,26944582,雪怪大冒险,浅橙,ailinqing,力荐,2020-03-03,20:24:32,轻松温暖。,0
1,26944582,雪怪大冒险,狐卿۩,bloodyfox,还行,2019-01-29,13:26:50,meh,0
1,26944582,雪怪大冒险,古耐ღ猫宁,MissLeft,推荐,2019-01-23,12:58:00,故事可爱暖心，唯独音乐够创新却缺乏共鸣痛失一星,0
1,26944582,雪怪大冒险,黑眼圈那么重,35085450,较差,2018-12-25,22:06:01,都是套路,0
1,26944582,雪怪大冒险,豆包儿,1446460,推荐,2019-02-26,16:50:08,看完才发现配音里还有詹姆斯。。。雪怪大冒险，这个译名太商业化了，smallfoot的韵味完全没有翻译出来。故事很老套，但是却很有趣。值得一看的动画片。,0
1,26944582,雪怪大冒险,ofelia11,128665149,还行,2019-02-03,20:03:31,全程盯着雪怪的脸型，奇怪之中带有熟悉的赶脚，bingo，好时kisses巧克力！,0
1,26944582,雪怪大冒险,明光暗影,145849529,还行,2018-11-05,15:42:14,有关不同种族的融合，有关闭关锁国与走出去，有关谎言与真相，有关权威的盲从与挑战，对于一部合家欢动画片来说，能有这个内涵很可以了。。。,0
1,26944582,雪怪大冒险,DZ12,siweiii,推荐,2020-02-14,23:51:55,可可爱爱的，剧情老套，可是，可爱就是王道xixi,0
1,26944582,雪怪大冒险,无为而治,151820885,还行,2019-12-21,23:35:39,乐一乐萌一萌。没有什么深刻的记忆点。,0
1,26944582,雪怪大冒险,蘇捌,cqyyAyy,力荐,2018-09-16,14:02:33,#BingTheater##LACMA#特别放映活动，全场大概有一半都是小朋友。要说套路老也可以，但还是羡慕这边的小朋友有这样好的动画片可以看。喜欢那只羊！,1
1,26944582,雪怪大冒险,刈戈,The_Land_of_Ego,,2019-06-20,14:58:33,雪怪的壁画不错,0
1,26944582,雪怪大冒险,南洋猪大仙,68738186,还行,2019-03-21,10:29:47,完全不是想象中的纯童趣动画片，相当有内涵，但要说有什么政治隐喻，那纯属理解过度了。结局还是太过于理想化，浪费了前面剧情的深度,0
1,26944582,雪怪大冒险,大罗,Gu_li,力荐,2018-12-02,23:31:22,我爱死这动画了！非常的搞笑，又非常的深刻！！,0
1,26944582,雪怪大冒险,红辣椒,13695982,还行,2019-12-07,09:32:26,没看进去,0
1,26944582,雪怪大冒险,文心孤竹,2633876,还行,2018-10-27,22:11:42,为什么小孩子那么喜欢看动画片呢？,0
1,26944582,雪怪大冒险,慷忾、激昂,201844811,推荐,2019-08-31,10:42:08,动画是个不错的动画，但是看到有人说里面有辱华的情节。虽然我不关注这些，但既然看到了，我觉得也不用太过敏感，毕竟背景就是喜马拉雅山,1
1,26944582,雪怪大冒险,正义B胜,imoviekobe,还行,2018-12-23,02:03:34,打发时间，行活儿。有一些细思极恐的东西。,0
1,26944582,雪怪大冒险,某四,grafa,推荐,2019-01-03,17:13:49,村长的Rap听了四遍，大陆、台湾、粤语、英语配音各一遍，全家在黑暗而神秘的气氛中骚柔地扭动起来【喂】,0
1,26944582,雪怪大冒险,V.,176122983,推荐,2018-12-21,08:34:30,"挺有意思的。
放低预期看电影果然可以收获惊喜。",0
1,26944582,雪怪大冒险,不姨妈的大白色,56492985,还行,2019-01-27,15:00:11,挺好的。,0
1,26944582,雪怪大冒险,JC加菲,1506430,还行,2018-12-30,23:54:56,剧情太简单，适合小孩子看。里面的歌曲还不错。,0
1,26944582,雪怪大冒险,木·子鱼,121136115,还行,2018-10-25,09:43:27,典型的寓教于乐的美国动画,0
1,26944582,雪怪大冒险,daodao125,155788363,还行,2019-01-02,20:35:10,看完这类超自然生物我总是回想 会不会真的存在哎,0
1,26944582,雪怪大冒险,桃花朵朵开,4868130,推荐,2018-10-29,21:23:11,小朋友说好看 特别是最后挖路那段 从对手变成朋友,0
1,26944582,雪怪大冒险,三月对我笑,148828870,较差,2019-01-27,10:26:40,"隐喻很浓，尤其我还在中国。但是缺点也不少。
1.情景设定还算有新意，但是故事依旧太老套，一看开头整个剧情基本就明了了。
2.结尾设置太理想化，那么快握手言和仿佛在逗我，也许结局停在那个小伙子被抓走会更好。
3.一开始全程英文(我本来还想吐槽在中国西藏好歹插点中国招牌啊），人类一开始捕捉雪怪，店铺开始出现中文名了，捕捉人也说中国话了...中国出现就是为了背锅吗
4.雪怪设计也太丑了",0
1,26944582,雪怪大冒险,他人之言,62762880,还行,2018-12-28,00:40:16,"雪怪吃雪长大的吗？动画形象是真的丑，美术中的丑之美？
并不喜欢全白的雪地。村长洞穴描述往事那个地方，还有山下村子的灯好看。村长黑人配音也挺不错，尤其洞穴rap描述往事。
全面主体是向外探索，但是后面揭示秘密后，变成了交流和谐相处。
联想电影 神秘村
掩盖真相保护村子这个好像早就有的故事。",0
1,26944582,雪怪大冒险,胡天柒月,seventhworkshop,还行,2018-12-05,11:09:49,还不错的。,0
1,26944582,雪怪大冒险,惟微不安為維安,li_chiao_chieh,,2019-01-02,19:52:25,可爱的陌生人,0
1,26944582,雪怪大冒险,About Deep Sea,tayforever1213,推荐,2019-02-11,14:05:41,里面的歌都很好听啊！,1
1,26944582,雪怪大冒险,羚羊的灵魂,clzleo,推荐,2018-12-06,20:12:05,动画版健忘村~,0
1,26944582,雪怪大冒险,蒙奇D,53550852,还行,2018-12-08,15:56:11,打发时间，轻松一刻。华纳兄弟出品的非常迪士尼味道的动画片，动不动就像公主一样唱歌那种。雪怪和人类因为不能沟通而产生的误会挺好笑的，雪怪的语言在人看来是咆哮，人的语言在雪怪看来是叽叽叽的老鼠叫这一设计挺有意思。山脚下的小镇应该是西藏吧，建筑风格又不像藏式，更像尼泊尔，但全是汉字呢。最后雪怪和人类相亲相爱在一起真美好，“骗骗”小孩子吧。,0
1,26944582,雪怪大冒险,孙学文,120213623,推荐,2018-12-04,23:00:02,如果非要过度解读的话其实是乳化了？,0
1,26944582,雪怪大冒险,cenduruila,141132037,推荐,2019-07-21,21:57:20,唯一扣星在于乌托邦结局，毕竟剧情太现实了最后来个大友谊总觉得有点不真实。双主角视角给我的感觉很不错，凭感觉这个风格和天降美食有点像，脑洞挺大，刚开始看简介还有点不是很喜欢，第一印象不好的情况下给我的感觉还挺不错，适合全年龄段。,0
1,26944582,雪怪大冒险,今皓闻,62802208,较差,2021-12-24,00:16:54,最近看了好几部“雪人”相关的动画长片。奇异生物闯入人间这个母题在好莱坞电影中简直泛滥，但历史和现实是西方殖民者对待弱势异族的方式与本片结局完全相反，总是这样演多少带些掩饰和美化的意味，他妈的故事还设置在珠穆朗玛峰中国侧，呵，更蠢的是某些豆瓣er又开始哀嚎了……,0
1,26944582,雪怪大冒险,江浙沪唯一土狗,159344894,,2022-11-07,10:47:35,20221107补标,0
1,26944582,雪怪大冒险,Iris,32776551,推荐,2020-01-21,10:31:02,虽然说教意味很明显，但不妨碍好看又可爱,0
1,26944582,雪怪大冒险,atangtang,3466681,还行,2019-04-19,22:26:43,这个结局人类做不到啊做不到,0
1,26944582,雪怪大冒险,SherlockYale,59669866,推荐,2018-12-06,20:50:26,这年头的动画片真是高质量。,0
1,26944582,雪怪大冒险,草莓女巫,doudoutu,还行,2018-10-24,16:15:04,角色设计合理且可爱 雪怪视角看到的小脚怪是个新鲜的设定 人物关系进展明确 雪怪村长隐藏的真相和人类用假雪怪救下真雪怪 两个反转挺好 台词双关 笑点足 辅助角色出彩 设计略丑 大长腿出戏 大概是预算的问题 场景有限 中间的rap惊艳,0
1,26944582,雪怪大冒险,小M,malu,还行,2018-11-08,22:37:18,来美国第一部院线电影。CMA，感叹一下，普通厅就是国内VIP厅的设施，可以躺着，舒服。满场都是小朋友，竟然不哭不吵。感动。,0
1,26944582,雪怪大冒险,Kara,akalakitty,较差,2018-12-03,21:15:52,最近好莱坞动画的剧本都像一个人拍脑门写出来的…雪怪下山,0
1,26944582,雪怪大冒险,黑天启,45881847,推荐,2018-12-25,23:04:48,电影里有很多中文的招牌，制片方没有中国公司？,0
1,26944582,雪怪大冒险,GALAXY,69361573,力荐,2019-01-08,17:04:26,很欢乐啊，看的时候一直咯咯咯咯笑不停。年龄越大越喜欢看动画片，是不是永葆天真的征兆。(●'◡'●),1
1,26944582,雪怪大冒险,少卿,43393053,还行,2018-10-27,15:16:45,一个人与怪物和平相处的故事……也许原音会好一点，买票不慎买成了国语配音版......毁了,0
1,26944582,雪怪大冒险,藤堂非,AshleyJo,推荐,2019-01-13,20:21:30,要真相，还是要假象？这是一个有意思的回答,0
1,26944582,雪怪大冒险,🦁,116539336,还行,2019-05-03,17:27:39,非常普通，也就是十分标准的好莱坞动画制作水准，没有花哨的画面，没有强塞的大道理，也没有过多的新颖，无非还是老调重弹的话题，敢于冒险，破除守旧，然后再在十分普通的剧情里加进一些原创歌曲，工工整整。,0
1,26944582,雪怪大冒险,哈呜,wangfunway,还行,2018-12-24,11:18:04,雪怪有Rap,0
1,26944582,雪怪大冒险,子夜,scorpio0077,力荐,2019-01-10,13:33:30,4.5星，三观很正，并不低幼，大人小孩都有得领悟，比较难得。,0
1,26944582,雪怪大冒险,茉莉,154705456,,2018-10-23,10:01:48,这么多年电影了，第一次看到竟然还有语言不通这个现实世界里的设定的。电影逻辑是外星和兽类和所有民族国家都用一种语言，看到竟然还有语言不通.,0
1,26944582,雪怪大冒险,Ruby,42724768,还行,2019-01-01,21:14:22,笑点还是有，人设太丑是硬伤。最后结局太理想主义了吧，真实的社会没这么和谐。,0
1,26944582,雪怪大冒险,拟和云,70245954,还行,2018-12-03,13:41:51,动画电影的教育意义,0
1,26944582,雪怪大冒险,豌豆大人,oscar892486279,还行,2019-02-13,18:36:16,rap还挺好听,0
1,26944582,雪怪大冒险,RUH.,X12158,推荐,2019-01-23,00:49:14,虽然是套路但还是看的有一番味道的,0
1,26944582,雪怪大冒险,山水,oakhui,推荐,2018-12-25,02:02:07,非常合格。我只希望即使我看过几万部电影了，还是会被这样的故事感动。,0
1,26944582,雪怪大冒险,vikawang,vikawang,还行,2019-01-20,20:39:23,小有诚意，还算凑合,0
1,26944582,雪怪大冒险,长袜子皮皮,fancypippi,还行,2019-08-14,12:03:15,一个乌托邦童话。,0
1,26944582,雪怪大冒险,羊男,suzichong,还行,2020-07-19,19:08:02,故事挺俗套的，但看着也不错。,0
1,26944582,雪怪大冒险,阿蚊,63824903,还行,2018-12-04,14:16:46,全戲以大腳八（Yeti）的角度看小腳八（Smallfoot）的自私和暴戾，人類自私地不斷排他，因恐懼而殺害無辜生物。此戲亦令我們反思應無止境地尋找真相還是適可而止。唔單止適合小朋友，我覺得更加適合大人，有溫情、啲歌又好聽，唯一敗筆是大團圓結局，反映不了真實。中規中矩，合格之作。,0
1,26944582,雪怪大冒险,梦之安魂曲,Makoto614,还行,2018-12-03,22:46:39,故事比较普通吧，但还挺有趣的。除了迪士尼和梦工厂，这部华纳出品的动画也还行。,0
1,26944582,雪怪大冒险,Zoe,74270112,推荐,2018-12-08,20:06:53,2018年冬的杭州初雪夜，窗外是白雪世界，电视机屏也是白雪世界，米戈爸爸教育米戈那段敲锣论很有意思，雪山下的中国小镇很美，种族之间的包容共生真的是非常happy ending啦～,0
1,26944582,雪怪大冒险,free,2410963,推荐,2019-02-07,00:57:33,很理想了,0
1,26944582,雪怪大冒险,1921,42787791,推荐,2020-06-08,12:28:07,比想象中好很多，出乎意料的惊喜！国语配音良心,0
1,26944582,雪怪大冒险,kooperl,kooperl,推荐,2019-02-25,20:54:45,怪物眼中人类也是怪物，以小见大，由此及彼，虽然相处没这么简单，但是道理就是这么简单。,0
1,26944582,雪怪大冒险,Jason,72020053,还行,2018-12-12,23:54:32,了解对方，永远是第一步。没存多大预期，但还有不少小惊喜。,0
1,26944582,雪怪大冒险,浪花快要沾湿我,30754768,还行,2018-12-17,21:44:41,结局像凯撒大帝那样就有2了.,0
1,26944582,雪怪大冒险,是心,121030948,力荐,2019-08-30,21:31:27,真理的确应该坚持，但是坚持真理的对象如果是人类真的不值得。,1
1,26944582,雪怪大冒险,swampthing,8119248,推荐,2018-12-08,16:17:22,还是当作一部动画片看吧~,0
1,26944582,雪怪大冒险,迷离君·°❀,pandalucia,还行,2019-01-29,00:12:51,可爱是可爱不过感觉没啥故事 - -,0
1,26944582,雪怪大冒险,🔒大家平安,jiutianforever,还行,2019-01-20,21:30:27,还行,0
1,26944582,雪怪大冒险,相遇天使,172710441,推荐,2018-11-06,09:57:09,雪怪挺可爱的，外甥很喜欢，正好治愈下我那颗烦躁又郁闷的心,3
1,26944582,雪怪大冒险,乏了的涎水,53058729,还行,2018-12-23,01:25:50,在我反应过来之前已经看完了。,0
1,26944582,雪怪大冒险,Alary,2387348,推荐,2019-11-09,06:59:26,作为一部动画片，故事和设定足够惊艳，构筑的世界是成年人才能看懂的，虚伪和侵虐被用一个彩色糖纸包裹起来。也正因为是动画片，可惜结局太仓促和理想化。,0
1,26944582,雪怪大冒险,可露丽,cloverllx,较差,2019-05-24,23:31:13,故事老套毫无新意。,0
1,26944582,雪怪大冒险,123,a123hjl,还行,2018-10-21,20:45:42,故事很小，但道理很深。,0
1,26944582,雪怪大冒险,豪妹儿,harbinkid,还行,2018-10-25,13:31:18,无知是福,0
1,26944582,雪怪大冒险,早川家三兄妹,tyx033333,推荐,2019-01-18,17:05:44,最后一幕要哭了,0
1,26944582,雪怪大冒险,Deepsea Baby,songzer,推荐,2018-10-22,17:40:50,@天山 觉得based on柏拉图《理想国》，当穴居人走出洞穴，见到光明、获得知识、见到新世界，便不会再回到黑暗。原声只有rap部分还行。最后又被打破历史偏见和歧视感动哭了！中国警方执法成了笑点。,0
2,26944582,雪怪大冒险,大夏,46522785,推荐,2021-01-24,14:05:25,意外，惊喜，好莱坞拍了一部中国名胜旅游动画片,0
2,26944582,雪怪大冒险,Fujihime Arashi,fengzaifei,推荐,2018-12-09,21:32:47,山上山下都是真实的中国。,0
2,26944582,雪怪大冒险,巧比,120527866,还行,2018-10-29,16:32:04,有点哲学意味 把雪怪这种都市传奇拿来写故事也很新鲜 只不过故事真的是太一般了 今天因为吃了点药 药劲儿上来有点犯困 几次差点睡着 故事缺少点起承转合 有点牵强 不过原声不错,0
2,26944582,雪怪大冒险,星魂,star1024,力荐,2019-11-17,23:13:18,"开场人类落入雪怪世界成小脚怪，怪兽效应反着来了。中间老酋长rap引出了黑暗森林法则。最后结局太完美，所以是不真实的。

很多场景实在太爆笑了，却处处引人思考，关于自然、人类、战争、环境、未来。。

结尾非常的成功，对小朋友来说，一个完美的童话。对想的更多的大人来说，这是多么讽刺而残酷，我们都知道，那不是真的。。",0
2,26944582,雪怪大冒险,Shelly,passerby-cyrene,推荐,2023-01-22,11:26:27,那个小脚怪的手机真耐用！,0
2,26944582,雪怪大冒险,小贝,beckham7,还行,2019-11-03,16:19:07,雪怪和人类刨除偏见坦诚相见的故事,0
2,26944582,雪怪大冒险,璐尔北,walkingtime,还行,2018-12-26,20:06:06,对雪怪社会的设定还是挺有寓意的，但还是不能忽略很多段落的冷场，倒是对人类主角从事视频行业挺感同身受的。另外，电影把故事背景设定在了中国的雪山村落，那些中国字写得真是蹩脚而搞笑。,0
2,26944582,雪怪大冒险,Strawberry Ju,rooob,还行,2018-10-19,22:12:03,好可爱的电影啊~ 希望出个游乐设施，米勾带着飞，还给塞个暖宝宝的那种ᑡ(⊙`‿´⊙)ᑞ。,1
2,26944582,雪怪大冒险,寂静牡蛎,chenyingxing,推荐,2018-10-17,21:30:24,老雪怪的rap厉害了。,1
2,26944582,雪怪大冒险,哈奇,34469098,力荐,2018-11-03,18:27:16,满分！满分！真全程无尿点，各种致敬，好听的音乐剧，好久没看到全程没有反驳的动画，Cordon配音最开始稍微觉得有点出戏，毕竟太熟了这声音，然后他一开始唱歌，就对上味了！！！还有整个片子的寓意（不剧透）感谢WAG！！,1
2,26944582,雪怪大冒险,客问,56976495,力荐,2019-05-11,22:28:48,意料之外得好看，一个俗套的开始和一个童话式的圆满结局，但是过程很不俗套，非常有新意，把政治隐喻和寓教于乐结合得很好，雪怪和人类语言不通的设定太好了！几段歌曲也很好听，平时都不大喜欢听动画里的歌曲的，这次很加分，而且中文版也完全不输。,0
2,26944582,雪怪大冒险,柒二Dr.Tobe,144582539,还行,2018-09-29,20:25:31,全方位成功的儿童向电影，所以剧情就算了……本来都想走了，但中间diss人性的rap相当摇滚且蒸汽！燃得我又老实坐了半个小时！,0
2,26944582,雪怪大冒险,师诗尸,shirleyly,较差,2018-10-22,09:14:09,音乐还行，但是离开电影就没法听了，故事也很套路，可能比较适合小孩子吧,0
2,26944582,雪怪大冒险,悄悄跑路,xujie891201,力荐,2018-11-03,19:20:06,做一个快乐的猪还是忧郁的人呢？,2
2,26944582,雪怪大冒险,人间洗具,57968508,还行,2021-08-15,22:32:26,发光蜗牛的世界设定很有趣。讨论的这个话题也很有趣，关于不同种族之间的沟通和误解，以及善意的谎言是不是对的等等。我对人性没那么乐观，所以结局虽然有点感动但也觉得太理想化和太简化了。还有一个缺点是，歌太一般了。,0
