page_index,movie_id,title,username,user_id,rating,date,time,comment,useful_count
2,26944582,雪怪大冒险,折翼的蝴蝶,103020260,力荐,2018-10-21,20:10:58,我看到了“种族的矛盾与化解”,1
2,26944582,雪怪大冒险,罗彬,rockyrobin,推荐,2018-10-03,08:50:07,基本对这类动画已经免疫，但这部胜在篇幅精巧/故事小但格局不错/加入新鲜rap元素/宇宙系配色太好看啦！对比前两天看的滴答屋，同样都是儿童片，简直天上地下,0
2,26944582,雪怪大冒险,贝克,31504897,还行,2019-02-09,16:32:49,传递正确三观的动画片，每个人都可以有推翻旧制的想法，很有教育意义,0
2,26944582,雪怪大冒险,很饱的贼,xiaochao919,还行,2018-10-23,10:36:31,看的是国语版，有点微妙。可爱的雪怪们，好想跟你们说，不要相信人类啊。,0
2,26944582,雪怪大冒险,大白臉WC15,tgpwc15,力荐,2020-02-13,21:39:11,我们缺失的好奇还有质疑，common那段讲故事点赞。,1
2,26944582,雪怪大冒险,一條魚佔滿了河,BlindwolfHyn,还行,2018-10-30,15:09:27,在很多年之前，參與過“無知是不是一種權利”的討論，在封閉的世界里，無知也許是一種權利，但是一旦真相打破了無知，真相就只會像黑夜中的光亮，即便閉上眼也仍會有白色的殘影縈繞。我喜歡開場，石規建立起的雪怪世界觀，我不喜歡結尾，幼稚的理想主義，雪怪下山不可能和平相處，被殺戮殆盡才合理，即便不要這麼殘酷的結局，那就讓兩個世界從此隔絕不復相見。PS.歌還不錯。,0
2,26944582,雪怪大冒险,mini1007,52845051,推荐,2018-10-27,09:51:34,可爱的怕人雪怪,1
2,26944582,雪怪大冒险,费米,fermit2,力荐,2018-11-04,16:04:42,很荣幸这是陪女儿在影院看的第一部电影。居然看哭了大人喔。寓意很棒，既然是儿童片，别指望阐述得过于暗黑。时代需要正能量，是反讽，也是勇气。,1
2,26944582,雪怪大冒险,Candy shop,candysunny711,力荐,2018-12-13,22:09:07,这个电影真的很棒，为什么没去电影院看！ps.猴子先生竟然从字幕里看到了勒布朗詹姆斯然后他就震惊了哈哈哈哈哈哈哈！！！,0
2,26944582,雪怪大冒险,flaming,66535614,还行,2018-12-08,16:05:03,故事太俗套了，虽然不喜欢歌舞类的动画，但是这里面的歌曲蛮好听的。,0
2,26944582,雪怪大冒险,┢落┦,14163854,还行,2018-12-31,12:25:58,前半段陈词滥调，中间一小段华彩，然后就又是好莱坞动画片的套路乱斗收尾。,0
2,26944582,雪怪大冒险,Katie,SuperKatie,推荐,2019-01-21,17:22:26,结局有点不能自圆其说的鸡汤，减一星，不过好好笑噢，哈哈哈,0
2,26944582,雪怪大冒险,Li,67888896,还行,2019-01-23,12:28:35,丑萌的画风，毛绒绒和雪都太real了~人类村庄的追逐戏很有趣，老雪怪的rap我真的服气哈哈哈,0
2,26944582,雪怪大冒险,木由,loyoyo_O,推荐,2019-09-28,05:51:40,电影是传递消息的媒介。,0
2,26944582,雪怪大冒险,楚小葵,61901113,推荐,2018-10-20,15:54:42,今天的第二部电影，有一个相同的微观世界梗，与世隔绝的乐土，发现祖先文明的秘密，世界观的崩溃与建立，最后重拾对于现在的信心。不过雪怪的完成度真的挺高，出于人本性的求知和种族矛盾，比较适合成人。有对于求知的鼓励，又没有过于严肃。结局比较合家欢，我更倾向于人类和雪人无法和解，毕竟北极熊和企鹅大象都是在动物园里的观赏动物。中间的小反转挺有意思，看似荒蛮无知，其实人类都是相似的，祖先一样，会仰望星空。,1
2,26944582,雪怪大冒险,____anybody,45940958,还行,2019-01-03,19:59:23,动画还得等迪士尼和皮克斯😯,0
2,26944582,雪怪大冒险,Beaverlike,Beaverlike,还行,2018-12-23,10:29:50,一路好想按快进,0
2,26944582,雪怪大冒险,浮生,198253248,还行,2019-09-07,14:43:56,雪怪都住在山上也挺好的，过了那么多年并没有什么不好,1
2,26944582,雪怪大冒险,猫球,EffixC,推荐,2019-01-17,22:18:43,歌好听,0
2,26944582,雪怪大冒险,大麻,marijuana-yama,还行,2018-10-23,19:11:56,这个世界所有的矛盾冲突都是源于对其他Ethnicity的不了解不信任。,0
2,26944582,雪怪大冒险,游人,1438842,推荐,2019-01-24,15:28:07,因为画风太丑，差点错过。,0
2,26944582,雪怪大冒险,小觞君,15146438,推荐,2019-01-19,18:43:33,没想到是歌舞片,0
2,26944582,雪怪大冒险,金刀紫渔,yuzhaozhi,力荐,2018-12-14,14:02:41,RAP简直就是太惊艳了！,0
2,26944582,雪怪大冒险,宇宙寿司馆老板,39663981,还行,2018-12-04,14:27:45,长老说唱是全片最高潮段落,0
2,26944582,雪怪大冒险,跳跳虎,165744255,推荐,2018-10-26,08:25:48,好萌的雪怪，还会怕人,1
2,26944582,雪怪大冒险,肚皮三层肉,jessico,还行,2021-10-16,19:15:32,标准剧本,0
2,26944582,雪怪大冒险,发呆中,douban2014nian,力荐,2019-03-02,20:42:01,"18.10想看
19.3.2看完",0
2,26944582,雪怪大冒险,垃圾侠,lwixjh,推荐,2019-01-06,22:18:00,寓教于乐的动画。片中的歌曲不错哦！,0
2,26944582,雪怪大冒险,猫巫S.k.,33158247,推荐,2023-01-22,22:29:26,雪怪们还是挺可爱的，在六公主看的国语配音也不错,0
2,26944582,雪怪大冒险,ryanmagic,Ryanmagic,力荐,2018-10-11,02:11:41,一言不合就开唱，非常搞笑。加一星给老詹，电影院里看到他出现在演职员表我很激动，同行的同事竟然都表示不认识。。。没想到老詹还会配音。,2
2,26944582,雪怪大冒险,dyhchuikb,2838417,推荐,2019-12-18,15:04:23,玻西为了雪怪伙伴放弃了事业翻身的机会，感人,0
2,26944582,雪怪大冒险,滴答滴,183552178,推荐,2018-10-24,20:44:49,可爱哈哈哈,1
2,26944582,雪怪大冒险,慕容七,19296065,还行,2020-05-05,15:32:57,把雪怪换成别的种族，再换上与这个种族匹配的场景与细节，然后你又可以开始另一部欢乐颂。这样流水线的片子少一部也没什么。,0
2,26944582,雪怪大冒险,颜良辰,ushi,力荐,2018-10-21,22:10:59,大人看有感触，小孩看也会觉得受教育，但欢乐都是一样的。正如这部动画里面的隔阂或误会，来自无法理解，交流有时候更重要的是开阔的眼界和善意的微笑。,0
2,26944582,雪怪大冒险,未洋chaos,caoxiaoyi93,推荐,2018-10-21,14:02:04,"买票的时候没看，买成了国语配音，但是所有歌曲甚至rap都国语化了，翻译得很贴地气很互联网化。rap和歌曲算是本片的亮点，最有意思的是雪怪喊人类“小脚怪”，而且雪怪角色设计十分之呆萌，反倒是男主有点丑。
电影里出现了很多中国元素，连网咖这种中国特色都出现了，很走心，五角楼阁也很古朴，整体画风鲜明好看。
结局有一点刻意，不过这也符合一般动画的特性，总之是一部很逗比又很合家欢的动画，值得一看。",1
2,26944582,雪怪大冒险,萝贝,135144049,力荐,2019-08-29,19:31:04,音乐很好听,0
2,26944582,雪怪大冒险,且隐杉木街,qieyin,还行,2018-09-29,14:14:26,追雪怪的几个警察说的居然是中文么。。。。,2
2,26944582,雪怪大冒险,杰哥哥,132081933,推荐,2020-02-26,11:31:43,很好看，放下偏见和怀疑，大家都可以！喜剧桥段真的耳目一新，很有创意！结局温馨！华纳的动画就是需要一炮走红，其实故事和创意都还不错！,0
2,26944582,雪怪大冒险,Hidee Moocher,58260318,,2019-06-25,02:21:53,飞机,0
2,26944582,雪怪大冒险,Voyager,Magellan,推荐,2018-10-15,08:41:35,保守党与自由党的战场……,0
2,26944582,雪怪大冒险,星痕,155847079,力荐,2019-03-29,14:15:34,同样是文明隔阂，还包含了以前被驱赶的历史，但是不是所有人都是坏人吧。善意的谎言和真相还是选择好奇和真相吧。动物记者心态的转变不错。寓教于乐，歌也很好听。,0
2,26944582,雪怪大冒险,蝌蚪往人,MarsOrMoon,推荐,2018-11-07,19:13:17,炸裂！看简介都不想看了，拖了两周才去看，没想到是个雪人版1984，虽然结尾“必须”皆大欢喜。靠谎言和恐惧维持的政权，两个文明的碰撞，发现颠覆常识的真相……如果在中间或者结束前十分钟结束，剧情会更加黑暗和成人，不过也不适合孩子们看了。,1
2,26944582,雪怪大冒险,kinkin,kinkin77,,2020-03-15,23:25:44,一般，陪孩子看的。,0
2,26944582,雪怪大冒险,无尽日光,62119584,力荐,2018-10-25,18:48:47,难得没有逻辑硬伤，非主流村长,0
2,26944582,雪怪大冒险,lemon_swagger,91095248,推荐,2018-12-08,21:40:55,三星半，诚意有余新意不足,0
2,26944582,雪怪大冒险,飘荡的果壳,72861793,推荐,2018-10-27,19:41:38,结局过于理想化,0
2,26944582,雪怪大冒险,༺❦熱憂༄ོ࿆,61648064,推荐,2018-10-24,23:38:51,笑死了,0
2,26944582,雪怪大冒险,Anderson.,TomFelton520,推荐,2023-02-11,09:09:30,这才是我梦中大冒险。,0
2,26944582,雪怪大冒险,蛮野,zxyxgrs,推荐,2018-12-03,21:17:11,人老了，看什么都想哭。配乐好赞。武警说汉语是不是映射点什么。。。,1
2,26944582,雪怪大冒险,Amiko。柒。,3514514,推荐,2019-06-07,17:43:55,小脚怪的叫声太可爱了！！！,0
2,26944582,雪怪大冒险,Da.,2560912,推荐,2020-02-10,19:37:02,bigfoot，smallfoot，和谐一家人，就像人类去到小人国～动画片是乌托邦最好的承载,0
2,26944582,雪怪大冒险,第7放映师,toddzhou,较差,2018-10-19,14:48:11,故事太无趣，动画人物造型也没有吸引力,0
2,26944582,雪怪大冒险,春色_禁柳,44834038,还行,2019-12-31,16:30:48,本来想看雪人大冒险，看错了。人设也太丑了，歌还可以，说教比较生硬，人物太标签。总之最惨的就是平民，领导两嘴一叭叭，说是就是，说不是是也不是。,0
2,26944582,雪怪大冒险,阿凝,158319836,力荐,2019-01-20,14:13:49,里面每一段音乐都非常好听啊，而且故事也超级温馨。,0
2,26944582,雪怪大冒险,JACKY,42738934,还行,2019-10-06,10:48:57,补：标准好莱坞工业流水线作品，歌舞升平、寓教于乐，各种创意小细节装到套路化模具中，完工！这就已经够国内观众津津乐道了，不得不说国产动画片差距还是太大了，无法满足国内观众的观影寻求。,0
2,26944582,雪怪大冒险,印月无痕,64278254,推荐,2018-12-27,20:58:57,玄幻而又带着教育意义，结局也很圆满！可惜现实…,0
2,26944582,雪怪大冒险,突啊,fvon73,推荐,2018-12-24,21:34:42,under pressure改编的太难听了,0
2,26944582,雪怪大冒险,孤立无援,173229624,力荐,2018-10-24,21:27:06,太纯真了，太有创意了，太欢乐了，暂时把耍流氓的现实世界抛之脑后,2
2,26944582,雪怪大冒险,一克,177899260,力荐,2019-05-18,09:13:21,和合适和小孩子一起看,1
2,26944582,雪怪大冒险,Fool,vivibhope,推荐,2019-02-24,16:05:01,某某大冒险，某某总动员这种早腻了，这部剧情倒没太俗烂，甚至有些成年人才能体会的幽微细节。配乐讨喜，三又二分之一星。,0
2,26944582,雪怪大冒险,离庭鹿,i800bu,推荐,2018-12-25,02:24:46,破除迷信，开悟致知。于20181224。,0
2,26944582,雪怪大冒险,慕名豆瓣FM而来,54693017,较差,2019-02-03,20:36:29,"本来还小有期待，想去电影院看的~结果很快就下线了~
终于在有空的今天拔草，太无聊了~所有的情节都在预告片里了。。。实在看不下去，浪费我的券~
唯一的亮点是村长的rap",0
2,26944582,雪怪大冒险,lulu,lucindacinema,还行,2018-12-23,19:19:08,不知道是不是看的是中国的版本，那个村庄里面那些中文的招牌呀，谁能给我解释一下“现场音乐”是什么意思吗？而且珠穆朗玛下面的村庄，是在尼泊尔吧，为啥是中文的招牌？太刻意了。回到片子主轴，并没有解决最根本的冲突，或者说压根儿没尝试正视这个问题，所以莫名的就大团圆结局了。就当个背景音听听吧。,0
2,26944582,雪怪大冒险,记忆错觉,TwinPeaks,,2018-12-08,20:14:59,2018-315,0
2,26944582,雪怪大冒险,不语,wangxiaofeng012,推荐,2018-12-07,17:20:11,这个世界当然不存在物种的实际平等性，但生而平等是一定的。我热爱这个缤纷的世界。,0
2,26944582,雪怪大冒险,包子,cano33,推荐,2020-03-27,20:06:59,从童话故事来讲就是有超多的一厢情愿，好比结尾处的和平，其实都有点奇迹感了。这是一部寓教于乐的作品，其实充满了很多的矛盾和选择。作为一个成年人我无法说哪种是好的答案，但是真的若有所思。站在雪怪的立场，和人类的相遇像不像去追逐爱情？有的人始终相信，有的人早就放弃了。还是单纯的看做童话吧，一开始大家都很善良，剩下的以后再说。,0
2,26944582,雪怪大冒险,好V大,61502300,推荐,2018-10-24,21:08:06,音乐和动画总能让人快乐，但教育意图太明显，让人不是很舒服。故事为啥不发生在尼泊尔？,1
2,26944582,雪怪大冒险,发际线靠后,198950107,还行,2019-11-17,15:45:09,BSC频道HD原声双语字幕，插曲难听到爆，角色换成大脚怪内容依旧美式娱乐。,0
2,26944582,雪怪大冒险,zebramaomao,35183435,还行,2018-12-06,03:06:59,隐喻也算看懂了吧 但是结尾是什么鬼 而且被摁着脑袋听了六首歌 我为什么要在动画片里看MV？！ 九十分钟里一直在想破头雪怪到底吃什么 演到最后也没交代 手机是怎么做到用两格电撑到影片结束的我已经不想问了 三星 半星给詹皇,0
2,26944582,雪怪大冒险,难遇,175636509,还行,2021-02-09,18:01:02,“小脚怪”的消息让雪人族陷入了恐慌，在雪村之外究竟存在着一个怎样的世界？“大脚怪”的事件也同样让人类陷入骚乱，体型如此巨大的雪怪是否会威胁到人类的生存？,0
2,26944582,雪怪大冒险,Hyades,Hyadess,还行,2018-12-28,12:32:34,毛茸茸好可爱！,0
2,26944582,雪怪大冒险,M-Gun,89723194,还行,2018-12-11,02:05:34,拆穿国家机器制造的谎言，一次绝命的尝试……,0
2,26944582,雪怪大冒险,老局长,162120504,还行,2018-10-23,19:33:55,可能因为儿童电影放宽了审查吧，老雪怪的谎言不就是暗示了当下么。,1
2,26944582,雪怪大冒险,芮灵翾,39180593,推荐,2018-10-28,00:32:19,面对陌生很可能恐惧，但是害怕之后呢？能不能让那份因为无从知晓的战栗情绪中很快冷静下来，试图去切实的认知……做得到吗？……努力试试吧。,0
2,26944582,雪怪大冒险,毛毛,31549897,还行,2018-12-12,14:49:35,后悔没带孩子去电影院看，前面唱唱跳跳的没准她会喜欢，但我很不喜欢。探讨的道理还算比较有意义，有点深刻，其实可想而知，以人类的贪婪和残忍，最终这帮毛茸茸的打怪物们肯定会被人类用各种方法弄灭绝了。看来我真是老了，研究生时候看这样的动画片还可开心可喜欢了呢。,0
2,26944582,雪怪大冒险,MiyaYu,yumiaowater,还行,2019-03-18,00:40:03,看的困死了，低幼向，剧情超级简单无脑。然而画风也不好看呀。。。,0
2,26944582,雪怪大冒险,城中日月,45551543,推荐,2018-09-29,10:17:08,音乐好听，预告片做的很低幼，没想到正片还算讲了一个有点深度的故事。Knowledge is powerful. What will you do with that power?,1
2,26944582,雪怪大冒险,枢木青鸟,183304352,力荐,2018-10-31,18:42:45,真的不要被《雪怪大冒险》的子供名字和弱智海报骗了，其实是个包含各种隐喻和影射的反乌托邦片啊…制作很棒，飞扬起的雪粒以及冲起的积雪特别到位，光效渲染也非常漂亮，场景构图非常有冲击力和引申寓意，山上的村庄比较童话，山下的城镇充满生活气息。插入的几段歌舞实在是太棒了，最精彩的是村长的那场rap，本以为会是男主和村长battle结果村长一开口什么事都没了，全方位的碾压，配合声光画面真的不能再有冲击力。真的塞进了不少东西，比如村子很1984的条款，还有暴乱，弱势人群游行，无良媒体的堕落还有对经济现状的控诉…我怀疑男主那段浮动利率是说次贷危机（？）大团圆结局，非常白左的全家欢，原声应该更棒，但是中配也非常出彩，比如老铁一类的接地气翻译和rap押韵都做得很好了,2
2,26944582,雪怪大冒险,Ethan,ethancollection,推荐,2019-08-28,22:42:41,妈呀，如果不是结尾有点太理想化，这个片子就牛逼了喔！,0
2,26944582,雪怪大冒险,Yahto,142756744,还行,2020-05-25,03:14:45,6.8/10，雪怪的第三类接触。,0
2,26944582,雪怪大冒险,De Ajacied,siemielu,推荐,2018-10-05,04:21:52,所以你們喜馬拉雅山下的村子說中文的嗎？中間講述傷心往事和蒸汽機那段rap好讚！LBJ說話加加攏有1分鐘嗎？,1
2,26944582,雪怪大冒险,九条尾巴,34882459,推荐,2019-10-10,22:30:01,"适合全家带娃一起看。要说深意，一贯是迪士尼和梦工厂风格，就是坚持、勇敢、不轻言放弃。画风很美，特别是中国的风景画得好美！然后生活气息的场景也画的好真实！
细节非常注重，不管是不是有人会看到的细节。特别是最后那一碗推过去的青菜，青菜就真的都跑碗的一侧去了。",0
2,26944582,雪怪大冒险,CMGS,CMGS,推荐,2018-12-09,22:31:09,看上去是尼泊尔的城市……然后都是中国风，还说中文- -,0
2,26944582,雪怪大冒险,RW,rouble-w,还行,2019-01-23,10:56:19,为什么走印度风的载歌载舞……故事情节很弱，雪怪造型难看，唯一养颜都场景就是亮晶晶的雪粒子了。,0
2,26944582,雪怪大冒险,越鸟巢南枝,48321125,还行,2019-04-05,12:29:38,虽然故事很套路，但依然很温情很欢乐。,0
2,26944582,雪怪大冒险,河屿,yq1ng,还行,2018-10-29,23:55:49,大户人家的小姐毛都是贵族梦幻紫   ,0
2,26944582,雪怪大冒险,荆棘,61215867,推荐,2018-11-13,02:15:57,结尾烂尾咯 可惜,0
2,26944582,雪怪大冒险,一座夏天垮下来,vivizhao,推荐,2019-10-12,01:08:01,Stonekeeper长老的rap也太带感了。,0
2,26944582,雪怪大冒险,夏日痴,xiababycy,推荐,2018-12-08,20:41:08,比恐惧更可怕的是好奇心。,0
2,26944582,雪怪大冒险,我亦鬼也,Baronera,力荐,2019-03-01,20:22:20,雪怪说的谎言好像在隐射什么，直到我看到那个在世界上几乎都有的某某城……,0
2,26944582,雪怪大冒险,寒小雨,ruolano,推荐,2019-11-09,14:45:17,最可怕的還是人類,1
2,26944582,雪怪大冒险,Evan,133040662,推荐,2018-12-08,12:28:25,还不错啦 有些地方挺一针见血的 但是你又叫不醒装睡的人 何必呢,0
2,26944582,雪怪大冒险,jimmy,53658480,推荐,2021-02-23,23:34:29,媳妇笑嘻嘻,0
2,26944582,雪怪大冒险,小芷,littlezhisandra,较差,2019-03-06,23:00:19,我还是支持他们活在自己的世界，起码都是美好的东西，安稳和平幸福的日子。外面的世界太可怕了,0
2,26944582,雪怪大冒险,K&L,52811117,推荐,2020-09-30,16:00:34,雪怪大冒险,0
2,26944582,雪怪大冒险,大象小妞。,49007027,推荐,2019-01-21,23:52:55,动画片还是很戳我。《Under Pressure》还是很好听。国王Rap那段也很赞。笑点在喜马拉雅羊和分析利弊的雪怪哈哈。虽然最后真善美很童话。但是还是要说一句，世外桃源美好啊，人性经不起考验。,0
2,26944582,雪怪大冒险,专业非认真刷片,137555231,推荐,2018-12-12,23:30:20,老少咸宜的动画片，近期动画最佳,0
2,26944582,雪怪大冒险,我也不知道叫啥,153066280,推荐,2020-06-18,22:32:01,笑死我了哈哈哈哈哈,0
2,26944582,雪怪大冒险,面包真好吃,simple4ever,力荐,2018-10-23,23:46:53,立意很有意思呀 音乐也好听 笑点也有的 还是动画片最解压 ,0
2,26944582,雪怪大冒险,锦灰,3441146,推荐,2019-01-13,12:00:08,我对动画长片一向有偏爱,0
2,26944582,雪怪大冒险,男高音书法家,Universe-Douban,推荐,2019-02-04,21:17:35,看完后耐人寻味，让人深思的优秀动画片，唯一不足是结尾稍显仓促。它表达了对人类的拷问，对谎言的诠释，对政治的无奈。。。等等,0
2,26944582,雪怪大冒险,まおう ねこ,neko419,推荐,2019-02-05,21:49:28,很可爱呀 雪怪下山那段笑死了,0
2,26944582,雪怪大冒险,null,sjzqzkn,力荐,2019-01-23,14:26:46,中间的支线，一点儿都不儿童啊……https://weibo.com/1927070524/HdgReqhvD,0
2,26944582,雪怪大冒险,马马马马儿,47043061,推荐,2018-12-05,09:29:02,不错啊，挺好玩的,0
2,26944582,雪怪大冒险,vvc,39014221,推荐,2018-10-22,23:08:04,8.0可爱的米果，香肠唇太性感了！把小脚怪背在胸前太可爱了啊！村长rap全篇最佳。轻松欢快的调调，消遣足矣。至于谎言和真相，随风去吧(⁎⁍̴̛ᴗ⁍̴̛⁎)20181022@闽侯中瑞影城正荣店,0
2,26944582,雪怪大冒险,silent_island,enclaved_island,还行,2018-10-31,06:39:40,居然听懂了20% 把自己感动死了 果然学外语 要从动画片抓起,1
2,26944582,雪怪大冒险,Lerota,2425322,,2018-10-07,10:36:30,adv screening@AMC 合家欢。小小的twist还有点意外，故事、节奏、喜剧桥段都做得不错。rap的部分肥常Hamilton😂 号召大家消除恐惧和偏见、善待包容异族还挺感人的。。。这算是政治教育片？还是动保教育片？,0
2,26944582,雪怪大冒险,吴地越人,JoyceJB,还行,2018-10-22,16:54:05,7.4  对动画片没抵抗力，对唱唱跳跳的片子没抵抗力，对唱跳欢快正能量治愈系的动画电影就更没抵抗力了。看得欢畅的时候，真想住进电影的世界里去。一生可以浓缩在一个半小时内，酣畅地过完。,0
2,26944582,雪怪大冒险,冰糖木耳,ClaireCheung114,还行,2020-04-03,17:41:23,How ironic :) 老雪怪的那段儿rap很带感呀喂！其他歌儿反而不是很抓耳…… 小城追逐戏那个突然游戏化的场景很有趣！城里的中文霓虹标牌真的太搞笑了，“停车很好”是什么鬼？？_(:3」∠)_,0
2,26944582,雪怪大冒险,人间情感观察员,68020726,推荐,2018-12-03,12:42:44,其实长老的rap才是整部电影的精髓啊。如果结局大家知道真相后决定还是藏在山顶就给五星了,0
2,26944582,雪怪大冒险,hayden,51501302,推荐,2019-01-31,13:33:23,"主题是挑战权威、传统、固有思想，探索未知，发现真理之后的迷茫、保护动物。讽刺了下以社交媒体为代表的现代科技。原谅我好多地方都笑出声了。语言不通的声音处理好可爱。虽然雪怪本身的画风并不讨喜。揭示为什么他们要住在云端之上，人类本性的丑恶，单纯雪怪们生活在一个巨大的谎言，为什么要愚民而求自保的真相也是把电影提升了一个高度，守石人那首说唱歌曲太震撼了。Knowledge不一定是power, 这是一个极好的辩题。差点给了满分，9分可以。",0
2,26944582,雪怪大冒险,小葱来玩儿,ycp,推荐,2018-10-22,11:30:30,美好，但是真实老阿姨很担心，这要是真实发生的话，雪怪很快就会被人类抓起来贩卖或者搞研究或者把居住地开发成旅游区之类的吧,1
2,26944582,雪怪大冒险,kerrysun,14406293,还行,2023-01-22,19:30:22,"大人在教孩子如何与异类友好，却忘了大自然的法则是弱肉强食，人类的历史都是种族灭绝的历史。
这样的政治正确只能在有相同的文明基础的人类民族之间可能发生，否则这只是一个童话。",0
2,26944582,雪怪大冒险,王二,kyo85,较差,2019-02-07,13:56:29,不是电影的问题，是我没有童心了。。。,0
2,26944582,雪怪大冒险,咫尺凌绝,xielingjue,推荐,2019-02-11,13:23:54,038号。开头很boring，差点看不下去，从波西和米果有互动开始就越来越有趣了，最后看到世界大同世界大爱的场景时好感动。,0
2,26944582,雪怪大冒险,汤姆横刀向天笑,lovelamfungfor,推荐,2018-10-20,21:41:28,比想象中好很多！,0
2,26944582,雪怪大冒险,玖墨,79506720,推荐,2020-04-16,16:56:54,教给孩子的 一定是最善良的。暗处的东西要怎么传授啊。明明都很重要。,0
2,26944582,雪怪大冒险,错儿笑一,yangstunique,还行,2018-12-14,00:56:04,无知不可怕，怕的是独自背负着真相，却不能告诉任何人。每一任守石人都是伟大的，他们并非为了统治，而是真切地在乎雪怪的存亡。,0
2,26944582,雪怪大冒险,JanuarySecond,nannan19890102,推荐,2018-10-21,13:14:37,故事发生在喜马拉雅中国山麓，所以你们是否记得高一英语课本有一篇文章就是讲喜马拉雅雪怪的故事，我清晰的记得，雪怪那个词是yeti……四颗星,0
2,26944582,雪怪大冒险,阿明2020,33693061,还行,2018-12-09,10:09:42,里面有首歌很好听😂,0
2,26944582,雪怪大冒险,hawua,45312368,还行,2018-12-06,21:14:05,偏儿童,0
2,26944582,雪怪大冒险,这个孩子,zhegehaizi,还行,2018-11-20,01:50:53,"这个尚可吧，陪六艺看，全片看完，其实我感觉她没看懂。回来跟外婆说不好看，全是怪物，有一些很小的人。
我在想那是很大的怪物和正常大小的人好不好。
剧情很流俗。",0
2,26944582,雪怪大冒险,SerBad,SerBad,还行,2018-12-21,12:39:35,温馨的一个故事,0
2,26944582,雪怪大冒险,花大叔爱电影,yangteng1107,还行,2018-12-22,16:03:58,那层云颇有深意，如果形象可以再可爱一点会更好。,0
2,26944582,雪怪大冒险,末  次  月  經,nodiamond,推荐,2018-12-06,19:44:42,真实的世界，比安全的谎言更重要,1
