page_index,movie_id,title,username,user_id,rating,date,time,comment,useful_count
0,27603669,为你写诗,鼎,T1ANZHU0,较差,2018-10-30,14:40:57,影片唯一的亮点是没有唱《为你写诗》！！！,52
0,27603669,为你写诗,王大根,diewithme,很差,2018-10-26,13:34:07,真实的《喂你些屎》，一堆中年猥琐男脱光衣服抖着肚子上的赘肉演大学生给你看，国产青春片未免也太伤眼睛了吧。谁能告诉我一部唯一噱头就是同名流行曲的电影，为什么出现了《古惑仔》主题曲、出现了超过气抖音神曲《海草舞》，甚至专门把孙楠从供桌上隆重请来演唱了一曲《不见不散》，却从头到尾没出现那首最关键的《为你写诗》啊？？,589
0,27603669,为你写诗,华盛顿樱桃树,49213881,很差,2018-10-24,00:43:46,为什么要当导演？为什么？导演比唱歌难多了亲。戏烂就算了，为什么要装嫩。,366
0,27603669,为你写诗,桃桃林林,qijiuzhiyue,很差,2018-10-26,17:35:31,一星半，挺无趣又欠缺逻辑的一个故事，反正胡闹一通就结束了。更大的问题还是表演，吴克群自己不会表演，也很难指导别人的表演，就，那样吧。新人女主形象还可以，不过需要跟更好的导演合作再看看。,173
0,27603669,为你写诗,看云,161350843,很差,2018-10-27,16:28:12,很久没有在影院坐如针毡了，要不是傻儿子要看……,34
0,27603669,为你写诗,团小纸,skymoto,还行,2018-10-23,23:33:48,毕竟唱了两个月的为你写诗，还为此感受了什么叫心酸，我就是赞美认真和努力，还是给吴克群加一些掌声吧，他尽力了。,60
0,27603669,为你写诗,喵老师2333,York29,较差,2018-10-23,20:55:03,根本就不是为你写诗，是为你写剧本。前面90%尴尬难看做作无聊老梗恶俗 但最后10分钟居然特么开挂用金手指修复了一切bug。这是种作弊行为啊吴导。突然起来rap那一段让我觉得可以跟遇见你真好竞争我今年看过的最难看电影NO.1，最后女主手表没电的时候我居然原谅了它。,53
0,27603669,为你写诗,风e梦,fengemeng,很差,2018-10-26,10:22:09,大型MV警告 4分钟MV扩大加强版！周董的路子真的不适合你，真的,43
0,27603669,为你写诗,天猫超市招财猫,159842300,很差,2018-10-26,10:56:08,年度十大烂片预定,44
0,27603669,为你写诗,梦里诗书,57542378,很差,2018-10-26,16:21:48,穿越的奇想，青春的纯爱，这些本都是《为你写诗》颇为不错的素材，然而对于初导电影的吴克群来说，他却将电影变成了一场灾难，完全不重逻辑的狗血堆砌，以及浮夸至极的演绎，都使电影且不谈拿什么来追忆青春，其根本无从让人产生任何的情感共鸣。,27
0,27603669,为你写诗,komori,i-1992,很差,2018-10-23,20:32:03,事实证明，不仅当年看过的碟，连听过的CD也要抱着吃口热shi的心情用电影票来还。吴克群就是想用这部电影证明当年《全能星战》后自己和孙楠没有不和！,19
0,27603669,为你写诗,穆子衿,155602014,较差,2018-10-31,23:42:30,"穿越不过的是时间，能够静止的是回忆。
可惜一部电影还不如那首几分钟的《为你写诗》。",9
0,27603669,为你写诗,深秋小屋dongdong,karylee,较差,2018-10-28,10:02:01,剧本是硬伤，角色逻辑关系是硬伤，结尾如MV拖沓，整体像学生作品。反而配角和路人演得比较自然真实有趣。,2
0,27603669,为你写诗,黄悦_,69475039,很差,2018-10-29,17:13:47,你们别笑 这已经是吴克群认为最好的自己了。起码值一星好吗！,14
0,27603669,为你写诗,candybi,152229096,推荐,2018-10-27,16:28:56,前面看到的是做龙套演员的男主得心脏病以为心跳到160能回到过去追女主，到梁祝才知道这一切只是个小剧场。蝴蝶和毛毛虫是伏笔，已经暗示了男主不可能成为演员。女主的录音笔虐到我了，电影后半哭的稀里哗啦。,11
0,27603669,为你写诗,大奇特(Grinch),grinch,很差,2018-10-26,15:17:23,当穿越已成家常便饭，编剧不再重视穿越的缘由和两组时间的差异，只是角色一厢情愿的行为和感情。那些笑料都是毫无节奏、毫无感情的堆砌。结尾很大Bug，在做明星的时空里她并没有剩下一年寿命啊…女演员其实不错，但是周冬雨的扮相+白百何的表演，连白式绝症（肿瘤君)都出现了，为什么不做自己？,16
0,27603669,为你写诗,长江以南,97121935,,2018-10-23,16:00:06,希望豆瓣出“不想看”标签，以及评论/原因,26
0,27603669,为你写诗,1~,49078026,很差,2018-10-26,10:27:46,就这一首歌还可以听，不知道哪里骗了些资方给你投资拍电影搞宣传,15
0,27603669,为你写诗,Panda的影音,PandaMovieMusic,很差,2018-10-26,22:54:32,《古惑仔》、何润东《轰云》、王心凌《微微一笑》、潘粤明《百夜追凶》……此片再一次证明了：不是有才华才能当导演，有钱有关系很多人都能当导演！……草蜢《失恋阵线联盟》……听到男女主角在教室里唱陶喆《爱很简单》的时候都想离场……戴佩妮《你要的爱》……孙楠《不见不散》……没想到颜如晶也(本色出)演电(lan)影(pian)了……《后来的我们》没使用《后来的我们》，《为你写诗》没使用《为你写诗》。,13
0,27603669,为你写诗,胡闹君,87069723,较差,2018-10-26,14:22:15,喜忧参半的爱情片，前半段喜剧部分很烂，笑点尴尬演技浮夸，一度想打最差评。但是后半段悲剧部分虽说俗套狗血，但还是有触动到我。从总体来说，配乐方面做的还不错，特别是戏曲rap对唱那一段还算特别。再加上王心凌张栋梁戴佩妮的客串，2星吧。,7
0,27603669,为你写诗,对你爱不完,140638723,很差,2018-10-27,11:27:55,想当年吴克羣还是想着要超过周杰伦，现在来看，他不仅在歌坛上没超过，在电影方面也没有超过。,20
0,27603669,为你写诗,口电影,162372623,还行,2018-10-25,14:57:23,"看的首映，作为吴克群的导演处女作，比想象的要好，这个电影的完成度还是比较高的。
女主有点周冬雨+杜鹃即视感，演技不错，本以为是偶像派结果是实力演技派。
前半部分向很多经典片致敬，只是导演想法过于多，想把很多要表达的都融入到这一部电影里，就有点大杂烩了。
后半部分有亮点，还是值得一看的～",27
0,27603669,为你写诗,KgBill,159004519,很差,2018-10-10,01:57:46,看这剧情像是山寨不能说的秘密，喂你些屎,14
0,27603669,为你写诗,Starry_小肆,141115309,还行,2018-10-26,18:43:43,一星半，比较难看，喜欢十二年的歌手，不推荐观看。电影大部分穿插旁白，剧情松散乏味，最后十分钟的鸡汤还行。,4
0,27603669,为你写诗,Viola,4547717,很差,2018-10-23,23:16:41,想听《为你写诗》的别去看了 毛都没有 前半段是各路过气段子抖音尬笑包袱大集合 后半段女主表演可圈可点但回天无力 孙楠笑点担当 本煜演技担当 表白父王！！！,12
0,27603669,为你写诗,今天早睡了吗,144528419,还行,2019-03-06,13:03:43,看到的大多打差评的人连电影都没有看完，这部片没有那么好也没有那么坏，人确实都是这样，太容易给一个人或者一个东西下定义。,3
0,27603669,为你写诗,着迹,60935275,很差,2018-10-26,16:01:51,不是 MV 加长了就足以称之为「电影」登上大屏幕。为你静止，为你石化。,11
0,27603669,为你写诗,李小庫,leeshiuan,较差,2019-09-02,23:43:18,刚看到开头的时候本以为是《夏洛特烦恼》的那种剧情 回归青春 重新放飞自我 然而实际却大大相反 每个剧情的跳转仅凭借着“心跳160” 而来回穿梭的镜头频率又那么高 间隔又那么短暂 影片必然会七零八落 在影片的结尾部分又过分的言情 套用梁祝的故事上演现代苦情戏 看不到回忆 也同样没有新意 一般般,0
0,27603669,为你写诗,麻油,Castored,很差,2018-11-05,18:04:29,【不能说的秘密】也不是那么好拍呀,7
0,27603669,为你写诗,✺◟(∗❛ัᴗ❛ั∗)◞✺,160795997,较差,2018-10-29,15:15:38,歌我还是挺喜欢的,5
0,27603669,为你写诗,金融橘子,154929135,还行,2018-11-19,13:56:59,剧情前面比较粗糙，后面很感动，要看到剧情的用心良苦，第一次导演可圈可点！,0
0,27603669,为你写诗,Echo湲,59106131,很差,2018-10-23,20:34:56,低低低低低配且不好笑版夏洛特烦恼，看完这个才想起开心麻花的好。我是做错了什么要看这个。,11
0,27603669,为你写诗,梦之安魂曲,Makoto614,较差,2018-11-13,22:54:59,“穿越的故事你见多了，但我保证这一个你没听过。”这个故事我确实没听过，但我看过类似的。故事设定与人物形象，和《不能说的秘密》挺相近的。穿越后的情节有点像《夏洛特烦恼》。表演浮夸，配音尴尬，台词没水平。女主短发神似周冬雨，和吴克群一点也不搭。优点就是出现了很多经典的歌。可到最后也没有出现《为你写诗》这歌。,2
0,27603669,为你写诗,Mr_腾小九,mr_littlenine,还行,2018-10-28,14:06:08,幸亏我没有提前离场 后面明显好于前面,4
0,27603669,为你写诗,Morning,qiweiming750,很差,2018-11-10,23:30:54,电影里有两场戏，一场是孙楠在乡村宴上对着淳朴老妈歌迷唱不见不散，一场是尴尬rap版的梁祝，台下都是一片生硬的较好，创作者自我陶醉，观众更加自我陶醉在自认为的欣赏中，这两场戏就是吴克群的判断，他以为自己的水平和自己的观众都是这样的。严格来说，这是一个从文本上就不高级的本子，桥段俗滥，吴克群演不出真情，更做不好导演，在该悬崖勒马的时候却感动了自己，执迷不悔的做了出来。判断是大于诚意的，这两者只要真正的努力都可以实现，但显然时间没有用在这里。,4
0,27603669,为你写诗,弓谷所長,misty-yy,较差,2018-11-07,00:47:43,"吴克羣还是去唱歌吧，大舌头为你写诗多好。
喜剧电影不能这样拍，虽然要搞笑，但不能俗套哦。",0
0,27603669,为你写诗,慕詩,147190792,很差,2018-10-29,09:07:09,无趣冗长，吴演技很一般啊。,2
0,27603669,为你写诗,bird,yihuiw,很差,2018-11-05,10:30:34,上映一周出资源……,2
0,27603669,为你写诗,枯木逢春,145403013,还行,2018-10-26,18:05:29,去看的时候，就放低了心态，几个朋友在一块搞怪挺好的，奔着这首歌得人不止我一个吧,4
0,27603669,为你写诗,云上,169028057,很差,2018-10-29,20:43:08,严格的虎扑网友：“阿猫阿狗都出来拍戏。” 吴克群：“我学了5年的戏剧。” 虎扑的直男们选择相信了……结果这就是5年戏剧的成果？  你要是下次再去虎扑，你会被怼的连包贝尔都不如……,5
0,27603669,为你写诗,刘晨辉,163956915,较差,2022-11-10,21:38:23,"片很烂，但是首富，花花这对夫妻很登对
你个臭流氓，gun滚
妻离子散，家破人亡
好好唱歌，别拍电影，洗洗睡吧",0
0,27603669,为你写诗,是Neko不是妮可,czpcxj1992,很差,2018-10-30,20:30:14,瞅了一眼票房，现在观众明显理智多了,3
0,27603669,为你写诗,Ricky,minor69,推荐,2018-10-27,20:48:38,得了心脏病，一个传染俩。蝴蝶减一星。首富演技最好。女主特像小S，以后会火。,8
0,27603669,为你写诗,阿默沫,MonicaSXY,很差,2021-07-31,09:11:37,胡闹、老套、不好笑、不好哭,0
0,27603669,为你写诗,Jorrow,48480567,很差,2018-10-30,12:44:21,吴克群中年不保,3
0,27603669,为你写诗,Dawn,156845911,还行,2018-12-02,19:02:37,其实还是蛮期待的，作为很喜欢的歌曲同名作品，不过作为处女秀来说，的确还是欠缺了很多，不过总体来说还是比较不错的作品,1
0,27603669,为你写诗,电影人小胖哥,96480798,很差,2018-10-29,12:44:51,烂片他妈给烂片开门——烂到家了,1
0,27603669,为你写诗,子皿与舟,haaaaaaaa,较差,2018-12-27,16:12:22,等了整部电影都没有等到《为你写诗》，演得最好的是如晶宝贝。麻烦大家不要觉得随随便便翻炒情怀就能赚钱，观众不傻的。,0
0,27603669,为你写诗,毛线和丝线,87020738,较差,2018-10-26,22:45:53,把男导演自己给感动坏了,3
0,27603669,为你写诗,TTse7en,84698699,很差,2018-12-08,01:05:42,可别给烂成一片废墟的国产青春片添砖加瓦了,1
0,27603669,为你写诗,少翘二郎腿,130610209,还行,2019-02-16,08:31:13,哈哈哈哈哈哈哈哈哈哈哈哈我笑了很久的！！！客串的几位衣服造型好像都不是按照原来来的，看着就…好好笑hhhhhhh,0
0,27603669,为你写诗,纤纤,158629236,很差,2018-10-31,13:17:42,吴克群还是唱歌吧，唱歌吧…留点我们能接受的东西。,1
0,27603669,为你写诗,神哥,62478064,很差,2019-06-07,15:34:31,鞋拔子脸演电影了。歌就那么两首。这电影……支持一下吧！,0
0,27603669,为你写诗,彩戏师wala,caixishi,很差,2018-11-26,22:23:15,女主是立体版的倪妮。穿越不过的是时间。能够静止的叫回忆。,1
0,27603669,为你写诗,Painkiller,day_dreamer,还行,2018-10-23,21:05:56,从电影的角度来说欠缺很多 但还是被一些点虐到了 再加上映后吴克群本人的解读和阐述 凭添了很多感慨 台湾艺人大多是温和细腻的形象非常圈粉 吴克群老师也是如此呢,9
0,27603669,为你写诗,恋丶你灬,150451634,推荐,2018-10-29,16:10:38,一个歌手就别来拍电影了吧   OK？,0
0,27603669,为你写诗,💃,119139214,还行,2018-10-27,01:18:48,"刚开始以为就是这样了…  后来原来那是男主写的故事…  
不评电影，就想说，为什么没有遇到一个可以为你付出一切的男生，年轻的时候没有，从此也不在可能。心酸。什么都可以不要我只要你一颗真心。确是最难的。",4
0,27603669,为你写诗,东莫卓羽,chenmuhan,较差,2018-10-29,17:02:18,喂你些屎。,1
0,27603669,为你写诗,站在埃菲尔铁塔,130238283,很差,2022-10-18,03:50:21,so bad,0
0,27603669,为你写诗,打不败的卜小小,97307876,很差,2018-10-26,22:52:50,吴克群如果你还能唱歌的话，还是回去唱歌吧。我不想承认我看过这部电影，我是被你的粉丝强行拉着去看的，你还是有真爱粉……,3
0,27603669,为你写诗,顾一棒,54045751,很差,2018-11-06,09:50:43,唱歌没比过周杰伦，拍电影还不如唱歌。,1
0,27603669,为你写诗,御宅の仙人,50588603,很差,2018-11-06,02:36:04,岁数大了要点脸好吗？为了圈钱不管不顾了吗？导演门槛这么低了吗？有这个功夫专心写写歌行吗？,1
0,27603669,为你写诗,kakakarl,zhanyakui,很差,2019-01-14,23:01:46,有的人居然可以用实力证明自己完全没有才华。,0
0,27603669,为你写诗,赵本三,129255339,很差,2018-11-07,23:29:14,你这辈子是超越不了周杰伦了 认命吧 把歌唱好电影就别碰了,1
0,27603669,为你写诗,康斯坦,piano27,较差,2018-10-26,15:30:23,当导演还是有门槛的，叙事也是需要学习的啊。热血和努力也远远不足以成功啊。,1
0,27603669,为你写诗,blanche,2326199,很差,2018-11-21,22:51:06,你还是好好唱歌吧,1
0,27603669,为你写诗,O型血,UloveWo,很差,2018-12-14,18:43:21,吴克群自编自导自演https://www.bilibili.com/video/av37530843豆瓣3.8分，票房1200万，《为你写诗》到底烂在哪？你知道吗？你演的很烂。https://www.bilibili.com/video/av43331591那些歌手拍出的毁三观青春片https://www.bilibili.com/video/av36991821,1
0,27603669,为你写诗,吴人用其语为歌,152682201,较差,2018-12-07,13:01:02,导演门槛真低,1
0,27603669,为你写诗,1127½°,5520945,力荐,2018-10-27,10:20:14,哪有什么回到过去，无非是我们活在自己编织的梦境里罢了。20181026 @ 时代联合影城 5号厅 包场,24
0,27603669,为你写诗,窗角雀,177150475,推荐,2018-10-28,22:08:56,被吴感动,3
0,27603669,为你写诗,23+7,164690961,力荐,2018-10-27,17:15:08,搞笑催泪。还不错，昨天晚上去看的，不知道是影院的问题，还是电影的问题，还是我的问题，这么大一个vip影厅就只有我一个观众，这待遇人生第一次。有种赢了全世界的感觉。,7
0,27603669,为你写诗,清雅戒奢,194286859,较差,2022-01-09,00:31:15,"看完“刘老师说电影”剧透来的，下面附上链接：https://b23.tv/IQCvKlW。
男主心跳过160，就可以穿越回过去，他穿越回过去，与心爱的女生邂逅，将自己心爱的女生追到了手（在男主生活的现实中，男主心爱的女生是跟男主的竞争对手在了一起），还顺便化解了和某社会人之间的矛盾，结果男主发现心爱的女生患有心脏病，之后不久，女生去世了，再转回现实这边，男主心爱的女生，其实根本就没有跟男主的竞争对手在一起，她早就去世了，所谓的心爱的女神和竞争对手在一起这件事，是男主给自己心爱的女生编的故事，感情这剧情也真是扯，这哪是为你写诗，这是为你写故事。",1
0,27603669,为你写诗,薛定谔之猫,53048177,很差,2018-11-09,22:41:20,出道时号称要超过周杰伦，现在歌不如周杰伦就算了，电影处女座也是差了十万八千里，是不是确实像电影里说的，有的人注定是蝴蝶，有的人注定是毛毛虫？还有那段尬唱rap，最多算喊麦好么……,1
0,27603669,为你写诗,阿尼塔,liangping,很差,2019-11-12,16:07:04,搞不懂到底什么意思。真穿越假穿越。假穿越就别人都不认识你。,0
0,27603669,为你写诗,陳大仁Octavia,128545960,较差,2018-10-26,22:17:42,我隐约记得这种“埋了梗也不是特别想笑，剧情毫无逻辑还看不懂想说什么但知道导演其实很用力了”的情况是上次我看张嘉佳的《摆渡人》首映。但我觉得那个还好点，可能是因为有金城武、梁朝伟、陈奕迅的颜…,3
0,27603669,为你写诗,A丫磊哥,119987393,很差,2018-12-20,22:57:11,幼稚。和杰伦的不能说的秘密还差十条街,1
0,27603669,为你写诗,豆瓣路人己,june.q,很差,2019-09-12,19:28:17,没有必要,0
0,27603669,为你写诗,朝阳区妻夫木聪,Invisible___,很差,2018-11-06,13:53:37,听吴克群念完了整部电影，从头到尾愣是没听到《为你写诗》这首歌，炒IP都不会炒，没劲。之前在豆瓣上送票都送不出去，结果一转头就出资源了。市场没有必要替导演的任性买单，希望各位情怀烂大街的跨界“导演”们记住。,1
0,27603669,为你写诗,草帽岳飞,44290871,很差,2018-12-25,22:36:41,和歌比差远了，让人失望的电影,0
0,27603669,为你写诗,人気小圆头🔒,aaaaaaaaaaa,力荐,2018-10-23,21:10:46,愿你不再有遗憾。,17
0,27603669,为你写诗,找自己,zhanmeichen,很差,2019-11-10,11:55:07,实在没看懂逻辑在哪，表演太用力了。看了四分之一弃掉。女主很像杜鹃。,0
0,27603669,为你写诗,徽柔Orchid,32131802,还行,2022-10-29,19:40:17,虽平淡，不狗血。分数太低，略亏心。然然很可爱。吴克群也真诚。如晶本色出演。,0
0,27603669,为你写诗,胡富威,177179084,很差,2018-11-05,17:58:33,不能说的秘密超低配版？？？,1
0,27603669,为你写诗,尼克胤,nickin,较差,2018-11-06,20:57:52,每当看到吴克羣我都在期待他下一秒唱出“为你写诗，为你静止，为你做不可能的事”,1
0,27603669,为你写诗,Michael_Yi,44397532,较差,2019-02-12,23:20:10,电影解说,0
0,27603669,为你写诗,HLDF爱Lee,155297091,很差,2018-10-29,16:30:55,为你些屎，为你X子，为你作不可能的死,1
0,27603669,为你写诗,不破万作,71610589,,2018-11-08,10:39:00,烂。,1
0,27603669,为你写诗,暗里著迷,121653622,还行,2023-01-03,13:26:36,无厘头调调，有点浮夸，有点跳戏，素材比较新，看得出吴克群是在用心琢磨的，拍得好不好是另一回事。分手合约5.8，恋空个智障玩意还在7分横跳，这部不至于3.7，真不至于。,0
0,27603669,为你写诗,尹地仇,caijiazhan,较差,2018-10-27,21:54:46,台词好尴尬啊，生怕别人不懂，中途睡着了，后来提前离场了。湛江悦都汇大地影院,0
0,27603669,为你写诗,cici=^.^=,ciciseti,较差,2022-12-03,09:46:32,1星，不能再多了……给歌1星，一共2星。,0
0,27603669,为你写诗,翰,170535639,很差,2018-12-07,08:01:56,滚！,1
0,27603669,为你写诗,嘟嘟熊之祖父,183536553,很差,2019-02-16,18:27:15,前半段抄周董的不能说的秘密，后半段抄冯裤子的非诚勿扰2，还给自己标榜是喜剧片！？吴克群你可别想着超越周杰伦了，能有周杰一半就行了,1
0,27603669,为你写诗,struggle LiLi,155775201,很差,2018-10-28,07:12:04,怎么说呢 在影院睡着两次 听说前两排的人在玩手机 中间的人哭的稀里哗啦 我坐在最后 睡着了 ,2
0,27603669,为你写诗,无为而治,151820885,很差,2022-09-13,12:34:25,虽然很烂没亮点也算不上电影，但是女主还行吧，挺顺眼的。没唱歌不错。一直以为要唱起来了。,0
0,27603669,为你写诗,流言,14123276,,2018-10-29,17:03:01,也不是很懂他们这些唱歌还不够，非得改成电影的,2
0,27603669,为你写诗,海怪幽灵,175453204,还行,2021-12-20,11:26:11,开头和结尾还行，中间的部分剧情和表演都挺有问题的，这已经是过去的老方式了。,0
0,27603669,为你写诗,约翰蓝侬的星空,hanchen8739,很差,2018-09-29,16:41:32,演而优则导，你演过啥？？？,6
0,27603669,为你写诗,weakish,WeakishJiang,很差,2018-12-12,20:05:25,蝴蝶效应被如此蹂躏……,0
0,27603669,为你写诗,放开那个猥琐男,152934649,很差,2018-10-28,16:03:47,典型的烂片,2
0,27603669,为你写诗,水蜜桃红茶,183546727,很差,2018-10-30,23:04:29,一个mv就能讲完的故事为什么要整成矫情的电影,1
0,27603669,为你写诗,我就自己看,161767660,很差,2022-04-29,09:22:55,那两年青春剧大热，整的每个写歌的都想分一杯羹，所以出了一大堆想靠歌曲情怀赚钱的同名烂电影,0
0,27603669,为你写诗,小鬼Bono,51033208,很差,2018-10-26,16:30:28,零散破裂的业余闹剧，且俗且尬，导演已经很认真了，再以电影的标准去评价也没啥意思了。,2
0,27603669,为你写诗,豆友80316403,80316403,还行,2019-01-11,16:08:25,“唱歌的人跑去拍电影，写歌的人开始不知踪影，每个人都开始宣布从影，老歌开始越来越好听”。从《我的自传》开始喜欢他，那个暑假把老吴的专辑翻来覆去的听得滚瓜烂熟。电影没大家说的那么糟糕，渐入佳境的一部电影，值5—6星，女主角长得很有灵气,1
0,27603669,为你写诗,BUC,150496100,很差,2018-10-27,20:24:58,中国影视作品中的原创好剧本好少啊，好的剧本也被翻拍给拍烂了，再不行就根据小说改编电影。现在就更有意思了了，拿歌名做IP拍一些豆瓣评分绝不会超过6分的电影，比如前几年有《栀子花开》，《同桌的你》今年有《后来的我们》，现在又有了《为你写诗》，而且据说《大约在冬季》也要拍成电影了。经典老歌给我一种晚节不保的感觉，一首好歌成就了一部注水片，电影情节和歌曲本身搭配起来就像放在微波炉里打过的榴莲一样怪异又造作。,1
0,27603669,为你写诗,最幸运的幸运,160473084,较差,2018-10-27,21:33:49,比想象好一些，可能是期待太低了；为了一首歌来看，结果没有听到这首歌有点遗憾……故事普通，但是感觉很棒啊，电影院那椅子居然是按摩椅，太舒服了😌！女主可能会火，男主看不出来是吴克群啊……支持一下下如晶,1
0,27603669,为你写诗,三世好人,baiyin2004,推荐,2018-10-27,22:09:13,这片不是穿越片，有些评论真是太过分了，内容都没明白就随便打分，完全是回忆呀，得影后只是他写的剧本，不存在逻辑上的bug。,6
0,27603669,为你写诗,木之本,55528815,很差,2018-11-07,17:32:47,果不其然是烂片，总有闲时下载看烂片的心情。还不如王力宏的《恋爱通告》，人家起码为电影而作了几首好歌的～而这部竟然用的歌都不是自己的，真是可笑。,0
0,27603669,为你写诗,暗物質正能量℅,49225161,还行,2018-10-24,00:42:37,并没有卖情怀 点赞/“穿越不过的是时间 能够静止的叫回忆”点出了故事的真相 如果你开始看这部影片 答应我 一定要看到最后 其实是一个还不错的故事 双线与嵌套 但也能很明显的感受到拍片不易与“求生欲”/ 再次感叹 台湾人好细腻 喜欢踩脚背上拥抱那段/女主像白百合,17
0,27603669,为你写诗,圣村酒保,59387630,较差,2018-11-07,16:19:10,诗呢？？？,1
0,27603669,为你写诗,鸳鸯与汽水,120794681,很差,2018-10-27,23:08:46,和朋友准备随便看个电影打发时间，事实证明以后还是不要这么随便了。,1
0,27603669,为你写诗,正义B胜,imoviekobe,很差,2018-10-26,17:38:49,真的不知勇气从何而来…我说的是出品方…,2
0,27603669,为你写诗,孟三哥,88345829,很差,2018-12-23,00:45:47,救命啊！！,0
0,27603669,为你写诗,拉拉祜是好孩子,angellovesu,很差,2022-10-19,16:08:59,我为大家看烂片2022-021：1.5~2倍速看完的，对不起大家，太难看了。,0
