page_index,movie_id,title,username,user_id,rating,date,time,comment,useful_count
0,27603669,为你写诗,sunhailun,64454341,很差,2018-12-17,14:30:31,这年头只要是人都能当导演了是吧？导演的门槛已经变成和房产中介一样低了，是个人有口气就能当导演拍片子！很好！来来来，这口屎你先给我吞下去！,0
0,27603669,为你写诗,一颗苹果,184333841,很差,2020-06-16,16:18:06,台湾的小清新类型片比较成熟，光线色彩用的很规范。但剧作比较老套，包袱单纯来自台词而且比较浮夸。,0
0,27603669,为你写诗,发呆中,douban2014nian,较差,2021-05-23,19:55:42,解说。吴克群是不是感动了自己？,0
0,27603669,为你写诗,大勇,59781320,较差,2020-10-15,23:31:57,故事构思勉强可以，要是表演不那么浮夸可能会及格，说到底还是脱离不了台湾偶像剧的套路。,0
0,27603669,为你写诗,輕輕,81763871,,2018-10-26,20:35:06,徹底脫敏。前半段真的，別人在笑我如坐針氈。能不能不要只顧著耍帥，能不能拍個像電影的電影，以前我看到他的視頻還會笑現在再也不會了。最後留下來看了片尾字幕「一直以來支持陪伴吳克群的圍裙們」——先走了我。不打分是我最後的溫柔。才華有限，真的好殘忍。還有就是，愛之深責之切吧,3
0,27603669,为你写诗,Empty,15923288,,2018-10-25,12:14:35,吴克群一直都是个对自己认知不清的人。当歌手的时候就觉得自己不比周杰伦差，现在看到别人一首歌捞钱成功，想着自己最火的歌也来捞一把，关键这歌也不是一个等级的。,5
0,27603669,为你写诗,Alec,zhaoxu1225,推荐,2018-10-28,13:46:55,感情分一星。心疼吴克群，真的是会的不会的都使了出来，前面三分之一有些尴尬，后面渐入佳境，挺好的。,3
1,27603669,为你写诗,蚊子是鸟,49147152,很差,2019-10-17,20:19:56,一分吧,0
1,27603669,为你写诗,我是魏尼好,158719675,很差,2018-12-29,05:37:39,喂你些屎,0
1,27603669,为你写诗,小明,KHAKILX09050904,很差,2022-08-06,23:59:54,炒冷饭接踵而至……,0
1,27603669,为你写诗,zz7,98590488,很差,2019-02-24,17:46:31,被标题党骗了,0
1,27603669,为你写诗,mini,158085933,较差,2018-10-27,00:06:37,开头和剧里各种明星本色出演客串给人一种强行怀旧的感觉。。吴克羣都快40的人了还穿个校服出演中二告白少年，台湾腔很出戏，本人脸部胶原蛋白流失严重，一笑起来就感觉各种猥琐。。对比年轻满脸胶原蛋白还长得有点像周冬雨的女主，违和感真的不要太明显。。剧情里很多细节都经不起雕琢，老套、浮夸、笑点尬，尤其是雨中男女主对峙的戏份更是加的莫名其妙。片尾转折生硬，感觉强行为圆而圆。最后，这部电影不应该叫《为你写诗》，应该叫《为你编剧》。,5
1,27603669,为你写诗,小柯真下饭,220984811,较差,2022-05-29,16:44:27,饿,0
1,27603669,为你写诗,AZWayne,60307113,很差,2018-11-24,23:12:48,歌手做演员很可怕，演员做导演也很可怕，比这些更可怕的是歌手做导演。,0
1,27603669,为你写诗,发财,171896261,很差,2020-07-18,01:05:56,吴克羣已经是华语乐坛巅峰期我最讨厌的人了 特别嘉宾竟然是孙楠 哈哈哈哈哈哈,0
1,27603669,为你写诗,西风烈123,67857029,力荐,2018-10-29,00:34:23,只为吴克群这首歌点赞！,1
1,27603669,为你写诗,念!,159468390,很差,2018-11-09,09:20:05,听歌吧 歌好听,0
1,27603669,为你写诗,木头人,25515233,推荐,2019-03-03,21:57:13,吴克群是得罪人了吗……电影挺有诚意的 看到豆瓣的低分感到震惊……,0
1,27603669,为你写诗,是小y啊,133489186,还行,2018-10-20,03:46:34,5分 吴克群来学校宣传的时候看的 前半段剧情有点尬为了搞笑而玩梗 后面结局补了一些bug 作为转行首作算还行了,0
1,27603669,为你写诗,山隹厷于,95819376,较差,2019-01-05,13:47:49,说实在的，如果不是如晶宝贝，这种片子打死我都不会看。两星，一颗给如晶，一颗给女主。女主好美哈哈哈。最后，乱七八糟一大堆，居然没有唱为你写诗？,0
1,27603669,为你写诗,菲菲te_765,drredhat,推荐,2018-10-28,20:56:03,在见面会上听导演说了，有些细节还是用心的，喜剧效果也好，可惜没有把为你写诗当插曲,1
1,27603669,为你写诗,麦子,btone0808,很差,2018-11-18,09:15:47,格局小了点，故事俗了点，桥段老套了点,0
1,27603669,为你写诗,斋藤飞鸟,54364801,很差,2018-11-09,20:37:11,写你麻痹！,0
1,27603669,为你写诗,风归云勉,173853388,较差,2018-10-30,22:28:13,本着业余的原则观影了本片并附带吴克群映后见面会～虽不饱期待但确实观感比想象中更差…如晶和佩佩的出境让本奇葩粉亲切感倍增，但却掩饰不了故事的硬伤，反复多次的穿让时间线凌乱且主次不分，始终没有切入重点，然后突兀的反转与煽情让人十分难受。最大的亮点反而是吴某在音乐领域的专业领域…所以还是不要随意跨界的好…以上,0
1,27603669,为你写诗,豆友166247363,166247363,推荐,2018-10-28,22:13:52,开头是喜剧，最后原来是深情的情诗，带点感伤带点遗憾和深深的眷念……青春总是令人感动，虽然青涩稚拙但是贵在真诚和忘我的投入。影片几乎看不出来是跨界导演，较成熟。,4
1,27603669,为你写诗,zzllc,178092377,推荐,2018-10-27,02:28:43,电影前面的确有些乱了，前面的部分好像落入俗套，逻辑和故事叙述的问题，但是看完后半段的解释让整个电影看的还是比较合理的。还有插曲不错，果然吴克羣的强项还是音乐。进步空间很大，我并不觉得吴克羣不用心，反而觉得不是导演出身的他做到这样不错了，可能是我标准比较宽。至少在我认为这不是部烂片，是合格的，6.5到7.0吧，仅是个人评价。,9
1,27603669,为你写诗,那些妄想,12388561,很差,2018-10-27,20:31:16,买票买错，硬着头皮看完，男主神经病叭,0
1,27603669,为你写诗,然,han962464,较差,2018-11-20,17:05:46,没有想的那么难看。穿越算是很俗气的套路，具体方式稍微有点心意。就是想用的太多结果乱七八糟，引用了太多热点，尤其是抖音。应该是跟米未合作的吧，没想到佩佩演技居然真的还可以，准备演戏了吗。主题曲还是好听的，还是适合写歌啊~,0
1,27603669,为你写诗,黄华小冉,158397082,很差,2020-01-05,19:10:28,可以打负分吗？,0
1,27603669,为你写诗,明铭虾条,130504366,很差,2018-10-29,12:10:36,"3.0/10
真·喂你些shi",0
1,27603669,为你写诗,爱笑的橘子,153379401,还行,2018-10-28,22:00:05,也许是放低了心态去看，所以觉得还凑合。剧情有点俗套有点中二，男主演技太差，女主倒还不错。看得出吴克群已经很努力了，插曲都还蛮好听的。,1
1,27603669,为你写诗,回首不再是少年,fengjianhai,很差,2022-04-27,00:34:56,0.0,0
1,27603669,为你写诗,七个梦,50490367,较差,2018-11-05,21:30:54,吴克群还来宣传了，有些地方真的尬，虽说处女作，但是真心差点意思，片名也是比较迷。穿越设定这个部分还能说得过去，具体后面怎么样呢，有点不尽如人意。好歹看完了,0
1,27603669,为你写诗,影评人 小陆,169109774,还行,2018-11-06,11:22:57,"#为你写诗#一部由吴克群自导自演的一部号称“十年之作”的一部现代剧情爱情片。影片剧情场景回归大学时代，由吴克群饰演的陈诗杰在心跳加速到160后意外穿越，在众伙伴的陪伴下，完成属于自己的奇幻穿越之路。几位主演间的互动逗趣十足，实力展现一群志同道合的朋友如何一起为爱犯傻。
剧情方面 影片值得一提的是，对于穿越方式进行了特别的设定，比起以往主角在不知情的情况下穿越回到过去，得知心跳加速到160就可以穿越的陈诗杰，在经历了穿内裤滑雪，自创咖啡混酒新喝法，高台跳水等一系列极限挑战之后，究竟会为爱收获怎样的结果，这种反套路的多重穿越又将如何展现，也等待观众们进入影院一探究竟。",0
1,27603669,为你写诗,京畿部长,152617426,很差,2018-11-11,17:56:07,女朋友选的，我看的强颜欢笑,0
1,27603669,为你写诗,南歌予忆,142866668,还行,2019-01-15,19:17:28,一般般，放在10年前绝对好片,0
1,27603669,为你写诗,向着南国,152355491,推荐,2018-10-27,19:37:30,"#时光她能不能回心转意

我会一直在这里

可是时光不言不语",1
1,27603669,为你写诗,粉色摩托飞宇宙,100062884,较差,2018-11-03,13:22:28,我特别记得我第一次看的时候被尬出了一身鸡皮疙瘩……,0
1,27603669,为你写诗,爱,167178788,还行,2018-10-26,20:20:48,将对逝去爱人的缅怀，通过穿越的故事情节，表达出来，其实并没有必要，只有最后那一段舞台上的rap，将情感直观的推进到观众面前，颇像歌剧的表达形式！只是在人物塑造上、情感的表达上生硬，缺少角色之间的那种羁绊！,2
1,27603669,为你写诗,思浩,178708079,还行,2018-11-15,10:31:19,其实不说拍摄手法演技等等，他的剧情，吴克羣想表达的那个点都还不错。好多人说没有为你写诗这首歌，但这部电影其实就是一首诗，并不是为了这首歌而来的噱头。这首歌也的确没有适合插入的场景。,1
1,27603669,为你写诗,Vermouth魔女,144041010,较差,2018-10-27,14:02:36,给晶晶家的背景墙,2
1,27603669,为你写诗,IdontCARE,longroadtolive,,2018-10-26,18:26:39,相信还是有一部分人会喜欢的。。。kind of weird。。。,2
1,27603669,为你写诗,半生桐,bwfqt,,2018-10-29,00:01:36,不算很坏的电影。真实和虚构的穿插是亮点。看评论只是感觉某瓣影评的素质又降了一大截。,5
1,27603669,为你写诗,yankuang151,138103621,较差,2018-11-01,09:10:57,吴克群把自己感动了的一部电影 影院有个姑娘哭的稀里哗啦 个人感受果真不同,1
1,27603669,为你写诗,Mmoon,143736085,较差,2018-11-01,18:23:08,看完了，前半部分演技真的不知道说什么好了，整个看完了也没什么感觉，一个群众演员为了追求学生时代的女神，患有心脏病穿越的能力和蝴蝶效应也不一样，其实他真的已经快死了都是幻觉。那个女神也有心脏病两人都死了我觉得。,0
1,27603669,为你写诗,7eightnine,174958770,很差,2022-03-22,19:42:32,不知道还算好听的一首歌为什么要有这么一部烂片的加持。不理解就是了。,0
1,27603669,为你写诗,穆阳,173552998,很差,2018-11-07,12:14:40,《梁祝楼台会2018》还是不错的~ 很明显的入门导演的问题，也是很多学生导演的很基础的问题~叙事很片段缺乏联系，并且洋洋自得的在片段里表现自己，因此就像很多人感觉的那样“胡闹一场就结束了”，也使作者自己也容易陷入到某种自我感动中。这种将表面的热闹和不合逻辑当做好看有意思，其实是对电影很基础的认识。挺适合给电影学院大一的当做反面例子看。有时间蛮想总结一下的,0
1,27603669,为你写诗,廖羽聿,150248228,还行,2018-10-25,00:28:18,"看的首映 咋说呢 第一次 确实挺稚嫩 吴克群很努力 但是电影确实不是努力就可以的艺术
愿意给及格分希望喷子少一些……",6
1,27603669,为你写诗,左灯右行,148969446,较差,2019-03-03,01:58:40,不知道讲了一个什么故事。。。,0
1,27603669,为你写诗,伯纳乌花园,171881382,很差,2018-10-28,13:26:44,比较糟糕的自编自导自演了 请来这么多看来导演人缘不错 没有太多的屎尿屁 还是欣慰了 新人女主不错,0
1,27603669,为你写诗,buddy,changjian22,很差,2019-02-23,09:06:35,好好唱歌不行吗？,0
1,27603669,为你写诗,木木 木木,46714793,很差,2018-11-24,18:19:06,女主角演的还真不错，周冬雨+白百合。可是，故事逻辑呢？？？你演技很烂你知不知道,0
1,27603669,为你写诗,周凯_ZK,137274092,很差,2019-01-17,21:26:12,吃饭下饭剧,0
1,27603669,为你写诗,七丫头,152517441,很差,2021-04-01,12:13:43,连短评都没有，继《栀子花开》《一生有你》又一歌曲改编的电影，一如既往的烂到家,0
1,27603669,为你写诗,子拉架奶,180852379,很差,2019-03-15,09:51:01,喂你吃屎,0
1,27603669,为你写诗,飞风,1810969,很差,2018-11-16,11:40:44,明明没有表演天赋还要狂秀自己的演技。自己导自己编。各种过气的老梗和刻意的搞笑段子。女主也不好看……真是不好看啊。全程尴尬……,0
1,27603669,为你写诗,Torres,174781586,很差,2018-11-18,21:54:50,真▪喂你些屎,0
1,27603669,为你写诗,邓肯又不肯,73011629,很差,2018-12-12,14:24:58,喂你些屎,0
1,27603669,为你写诗,王大盆w,81155457,很差,2019-02-12,23:53:59,吴克群在知乎上大谈特谈了一下这个电影…没想到这么难看…,0
1,27603669,为你写诗,已注销,cha1016,很差,2018-11-13,10:27:37,什么人都能当导演的今天 我应该也去傍个大款 也给我投资一部 被诅咒的汪素捐的一生,0
1,27603669,为你写诗,海歌,218346466,,2021-12-24,19:39:08,看了糟心啊。,0
1,27603669,为你写诗,zolker,52014785,很差,2018-11-03,17:42:02,就像女主说的太没想象力了，是找不到演员了吗，奇葩说的人都找来了，本煜戏份太少,0
1,27603669,为你写诗,尹天仇,173448089,很差,2018-10-31,09:56:32,喂你些屎🙃,0
1,27603669,为你写诗,一座城池,68864350,很差,2018-10-26,14:55:10,一个过气的歌手 带着自己恶心又难听的老歌 回来了 吴克群的歌就没一首好听的 搞的自己好很深情一样,3
1,27603669,为你写诗,日落四十四,59665595,很差,2018-11-07,22:02:21,不能更明显的看出来，才华是非常平庸了。,1
1,27603669,为你写诗,孤风落叶,133554912,很差,2018-10-27,16:37:20,2分,0
1,27603669,为你写诗,mmhh,1687635,很差,2018-11-26,17:55:37,故事情节太老套，热闹的太乱。龙套演员住院发现心跳超过160就可以回到大学时代，为了自己不后悔去追求女神小甄(已是影后)。每次在关键时刻心跳过速又返回现实。女主各种场合都爱轮滑，对着一只狗的遗像也可以痛哭，对男主很不客气。女主开小店的好友被黑帮老大欺压，男主计划让女主假扮孕妇碰瓷，增进了二人关系。大学演出男主和表哥竞争演罗密欧，男主说唱之后的表白，女主却病发倒地。女主先天性心脏病，不愿让朋友们知道，已经被男主打动。回到现实，原来男主写了本小说延长了女主的生命，没有所谓的穿越，都是小说虚构的。女主幸福的离开。,0
1,27603669,为你写诗,爱比死更冷,70421764,较差,2018-11-08,00:28:59,"导演: 吴克群
编剧: 吴克群
主演: 吴克群 / 周依然 / 周键铭 / 苏士为 / 仇佩佩 / 刘晨霞 / 颜如晶 / 张本煜 / 潘粤明 / 林美秀
类型: 喜剧 / 爱情 / 奇幻
制片国家/地区: 中国大陆",0
1,27603669,为你写诗,苏白,82522145,还行,2018-11-05,14:45:12,剧情是真的无聊 很多对不上 不能自圆其说 但是女主是校友 支持一下 嘻嘻,0
1,27603669,为你写诗,未来,22031277,还行,2018-10-23,22:50:14,歌呢？,0
1,27603669,为你写诗,JOKER,3414829,很差,2018-11-06,12:12:54,太他妈尴尬了,0
1,27603669,为你写诗,来自比邻星的H,151189116,很差,2019-09-24,22:43:44,你慢慢写吧，我去看其他的,0
1,27603669,为你写诗,醉与飞驰,48742842,很差,2018-10-26,19:17:05,未来中国的导演要比农民数量更多,4
1,27603669,为你写诗,不是耍猴的是誰,66363942,很差,2020-08-04,23:45:02,通篇充斥着吴克群想抱抱想疯了的尴尬,0
1,27603669,为你写诗,Chansuwa,63858929,很差,2018-10-27,00:11:16,年度最烂，好好的歌手不当怎么就想不开当导演呢？周依然要火！演技支持来自女主和流氓张本煜,3
1,27603669,为你写诗,木西,roiroii,很差,2018-10-29,12:03:39,为了颜如晶看的…实在不行,0
1,27603669,为你写诗,阿里阿里巴巴,wzwoody,很差,2018-10-27,13:57:25,不会拍就不要拍,0
1,27603669,为你写诗,幻游诗人,159914441,较差,2018-11-10,08:27:19,剧本其实可以很大胆一点，穿越来回，就应该学学蝴蝶效应嘛，什么都想改变，而什么都没改变，观众怎么可能喜欢？另外加那些无聊的段子和音乐一点意义也没有，像一锅恶搞的大杂烩。不过女主真的不错，像杜鹃和周冬雨的结合体。,0
1,27603669,为你写诗,iCami,fantasw,较差,2018-10-26,08:13:29,穿越不过的是时间，能够静止的叫回忆。,0
1,27603669,为你写诗,阿柏的奇迹,155919177,很差,2018-11-07,15:21:26,做反面教材都不太够格。,0
1,27603669,为你写诗,之乎者也.,130707590,很差,2018-10-28,21:19:05,好烂,0
1,27603669,为你写诗,┡枫逸轩┦,154207359,还行,2020-09-30,12:36:13,穿越不过的是时间，能够静止的叫回忆，寓意挺好，故事还行，可惜演技实在太尬了没，之前还挺喜欢吴克群的歌，以为他能一直红，挺可惜的。。,0
1,27603669,为你写诗,愤怒的瑞瑞酱,155674295,很差,2019-10-25,14:02:46,为你写片。,0
1,27603669,为你写诗,嘛哩嘛哩呗呗塔,146787535,较差,2018-11-11,20:17:33,"105.24min其实我觉得吴克群还是好好唱歌吧，演戏真的不行，不知道这里面说话是台词功底的原因还是故意而为之，我听着很怪，稍微有点笑点，但是很刻意，不太喜欢。
能请得到这么多有我童年回忆的演员出演说明人缘还是不错的，看到王心凌和张栋梁出现真的一阵感慨。
所以陈诗杰穿越回去不但没改写自己的命运，而是把黑小甄的命运回归原位了吗？黑小甄才是那个得了心脏病的人。其实乱的我没看懂吴克群要表达的时间线，女主长得跟周冬雨有点像。
用了很多bgm可是就是没用为你写诗这首歌，所以这个电影名字为什么还要叫为你写诗，这根本是演戏题材的啊，再不济也是为你演戏啊。",0
1,27603669,为你写诗,transformation,130564736,很差,2018-10-29,18:48:08,美好停留在歌曲,1
1,27603669,为你写诗,爱电影爱基德,167348781,较差,2019-12-29,21:27:30,不能成为男演员挺遗憾的，不唱为你写诗也挺遗憾的。,0
1,27603669,为你写诗,春风十里不如你,138063906,很差,2020-02-08,07:57:57,写点小学生作文得了。,0
1,27603669,为你写诗,远风尘,90696770,很差,2018-12-05,00:51:50,编剧你知道吗？所谓纯情男与绝症少女的爱情故事是多年前就已经无人问津了，你不要这么老土好吧。,0
1,27603669,为你写诗,kaka,34600215,很差,2018-11-17,16:51:23,垃圾中的垃圾，真的很少语言暴力了，但是这部电影真的是垃圾,0
1,27603669,为你写诗,小张,162443724,很差,2018-11-30,21:07:29,烂,0
1,27603669,为你写诗,夢、終會醒,192590836,很差,2019-04-24,22:20:48,烂片,0
1,27603669,为你写诗,links_31254,135720058,很差,2018-10-26,17:26:26,女主好像周冬雨啊,1
1,27603669,为你写诗,胖胖,121864194,很差,2019-04-03,17:28:53,什么乱七八糟,0
1,27603669,为你写诗,KID箫瑶君子,kidlee700,很差,2019-11-10,00:59:28,喂你些屎，哈哈哈,0
1,27603669,为你写诗,最爱PLA,69263659,很差,2019-05-03,11:36:35,没有诚意,0
1,27603669,为你写诗,bkpp是真的,162679211,很差,2019-11-16,15:09:10,喂你些屎。,0
1,27603669,为你写诗,凉风有信-姚,138577608,较差,2019-08-04,01:19:01,我错了，没看过、没看过。,0
1,27603669,为你写诗,肥嘟嘟的左卫门,78214422,,2018-12-07,00:46:30,标记,0
1,27603669,为你写诗,似水年华,xtun,很差,2018-11-04,18:52:36,烂啊，不是什么人都能当导演的,0
1,27603669,为你写诗,晚楽,lanpiero,还行,2020-05-05,01:17:02,为了吴克群的情怀 打个及格分吧,0
1,27603669,为你写诗,我我了了个擦擦,2894612,推荐,2018-11-11,10:48:02,为了kenji，为了纪念我曾经的美好，为了青春,0
1,27603669,为你写诗,旗虻,141678872,很差,2018-10-31,16:11:26,泡芙小姐2分的话 这个我给2.5好了 完全是因为看开机仪式现场图 被吴克群帅到了才来看电影的 我瞎辽,0
1,27603669,为你写诗,忧郁之海,135845762,较差,2019-12-12,20:31:16,电影叙事层次感太差，逻辑太过混乱。,0
1,27603669,为你写诗,翼影天翔,3851553,很差,2018-11-02,03:20:28,"吴克群导演声称边创作边修改……只能说这样功底的导演，投资方也不监督的么？还是就是放任自由

全片的摄影上看，就是MV摄影，一半以上是超越JJ.Abrams的耀眼太阳光效果，演技尴尬爆表，剧情编剧桥段无厘头到极致，甚至浪费了女主的演技，就是一部边演边带出bug的网剧

个人打分：3.5/10

年轻版的真难看……",0
1,27603669,为你写诗,捅主任,ibmpc586,很差,2020-08-31,17:21:12,能不能不把歌糊弄个剧本拿出来骗钱啊……,0
1,27603669,为你写诗,溜溜🐶,81736176,很差,2018-11-06,22:40:16,台词变成歌词都嫌,0
1,27603669,为你写诗,东方既白,oWhite,很差,2020-11-09,20:01:57,五分钟弃，还好当年没去电影院看,0
1,27603669,为你写诗,被子外面很危险,129355212,还行,2018-10-29,00:31:46,谢谢猫眼电影给我们带来的免费观影机会，导演人帅歌好听。很喜欢那句“穿越不过的是时间，能够静止的是回忆。”是我们读过的书，走过的路，遇见的人，才让我们成为我们现在的样子。过去一时半会儿回不去，我们能做的，只有让自己努力越变越好。（星星是给惊喜出现在观影现场的导演的）❛‿˂̵✧,1
1,27603669,为你写诗,momo,130629467,很差,2019-08-01,01:35:05,演技看的很尴尬，,0
1,27603669,为你写诗,人生一瞬 珍惜当,171912577,较差,2018-11-05,11:50:13,前面的一百多分钟只是为了最后结尾的铺垫，虽然故事很扯，甚至有些莫名其妙，当最后的字幕出现我觉的家庭的变故确实对这部电影的创作有很大的影响。我个人比较喜欢爱情片，对于剧中病床的那段戏我挺喜欢的，甚至有那么一些些的感动和眼眶湿润，那段戏之外的剧情就显得整个作品有点糟糕，无法评价。,0
1,27603669,为你写诗,灯火阑珊,173575808,还行,2018-10-31,21:10:30,前面节奏实在太慢，最后剧情扳回了一点分,0
1,27603669,为你写诗,chen 💋,175942836,很差,2018-12-23,23:59:28,好好唱歌就好,0
1,27603669,为你写诗,Why not,167496729,力荐,2018-10-28,17:32:37,感到青春就够了,3
1,27603669,为你写诗,AMEI,crankybross,较差,2018-11-08,12:29:22,也还好吧，就中规中矩，确实感觉吴克群很努力了,0
1,27603669,为你写诗,低调的华丽,152340758,很差,2019-01-15,01:55:47,喂你些屎,0
1,27603669,为你写诗,就叫我温森吧,82317477,较差,2019-02-13,12:54:50,哈哈哈 吃午饭随手点开看的，多亏当时没买票去看，不然孙楠油腻的三下巴可能会让我笑场，不是歌手不能拍电影，拍也别拍喜剧啊，又不会演 更别说教别人演啦。还有 情怀和蹭热点，流行和蹭热点都不是一回事的。,0
1,27603669,为你写诗,立方,184250494,很差,2019-03-09,22:32:20,喂你些屎,0
1,27603669,为你写诗,泰达希尔的星空,167396473,很差,2018-11-07,17:51:29,这年头什么人都能当导演了,0
1,27603669,为你写诗,vicky,126458182,较差,2019-08-28,22:27:06,有点牵强，改变过去然后把喜欢的人弄死了，这也太扯了，也没有挽救的方法，另外跟写不写诗也没关系，吴克群还是唱歌吧…演戏方面倒是还算过得去。,0
1,27603669,为你写诗,之薰,medusaY,很差,2018-10-27,22:40:10,令人窒息,0
1,27603669,为你写诗,我执,33612137,很差,2018-11-06,02:22:08,都能来捞一把的时代过去了。,0
1,27603669,为你写诗,往往都没有,241985468,很差,2023-01-14,14:21:00,消费情怀，消费这么经典的一首歌,0
1,27603669,为你写诗,人间清醒,162530860,较差,2018-10-29,19:31:11,两星给吴克群还了当年听的歌,1
1,27603669,为你写诗,已注销,honyo520,很差,2019-08-16,05:42:33,吴，你的戏份真的好多啊，开拍前吹，上映前吹，现在又吹。,0
1,27603669,为你写诗,heeeeeeeel,136312165,很差,2019-03-28,19:24:57,我讲一个笑话：吴克群是导演,0
1,27603669,为你写诗,一直喜欢你💕,184709937,推荐,2019-05-14,19:12:16,为你写诗为你停止,0
1,27603669,为你写诗,小强不面汤,53285819,,2018-10-27,18:44:43,唱而优则演，演而优则导，你不能跳过学习曲线呐,0
1,27603669,为你写诗,邮差,44587158,还行,2019-03-23,16:32:31,我觉得整体比较完整啊,0
1,27603669,为你写诗,嚯啊,144279192,推荐,2018-10-26,19:23:06,"穿越不过的是时间，能够静止的叫回忆。
你，会永远在我心底。
一旦出现，就赶不走了。",10
1,27603669,为你写诗,鐵鳥,173242613,力荐,2018-10-28,00:26:49,意外收获,3
1,27603669,为你写诗,切尔西,64317559,还行,2021-08-13,02:16:10,周键铭 苏士为 吴克群  为你写诗,0
1,27603669,为你写诗,松冈茉优酸乳,72779426,很差,2018-11-13,23:13:17,无耻之前，恶俗之后,0
1,27603669,为你写诗,苏阿喵,96067669,很差,2019-03-21,15:00:14,看了七分钟我开始怀疑我在看屎吗,0
1,27603669,为你写诗,best young,52144585,还行,2018-11-06,00:59:49,虽然比较中二,0
1,27603669,为你写诗,甜面儿酱,FilmYan,较差,2018-11-06,15:29:54,"这都是什么。。。。
片中rap好评",0
1,27603669,为你写诗,FF.C,156253891,很差,2018-10-27,21:19:23,连一星都不想打，我只想说一个字，那就是滚,0
