page_index,movie_id,title,username,user_id,rating,date,time,comment,useful_count
2,27603669,为你写诗,河间风景,87179728,较差,2018-11-06,12:51:11,幼稚,0
2,27603669,为你写诗,击败闪豆,60597045,很差,2019-11-18,18:52:12,不值得浪费时间,0
2,27603669,为你写诗,自然醒,126753759,较差,2018-11-10,11:30:45,大杂烩,0
2,27603669,为你写诗,蝎子1025,53902721,很差,2018-10-26,21:37:22,超级无敌烂片,2
2,27603669,为你写诗,露珠的心,126997921,较差,2018-10-29,11:38:48,尴尬的不是2.1而是没有评分...,0
2,27603669,为你写诗,黑色毛衣,146104542,很差,2018-10-27,22:20:51,烂就一个字我只说一次,0
2,27603669,为你写诗,真金白人,ohmyass,较差,2018-11-17,23:20:41,开头不行。,0
2,27603669,为你写诗,曼陀羅小姐,lofhoccnpakho,还行,2018-10-29,11:49:20,很搞笑 但是很奇怪的电影，确实等了很久的为你写诗 都没唱…,3
2,27603669,为你写诗,小不靠谱丶,gx1364,还行,2018-10-23,22:14:26,听到吴克群这个名字的时候我突然一愣，好像又回到了少年时期不知懵懂的学唱将军令大舌头。但看到电影里的他眼角的皱纹，暗淡的皮肤和疲惫的身子骨，我才意识到那是许久以前的事情了。虽然对于电影本身来说，有些不搞笑的笑点，不催泪的煽情和别嘴生硬的台词等一大堆问题，但对于我来说，这算对我少年时期的温情回忆，和对未来自己的鞭策。借用吴克群原话：青春终将逝去，愿你不再有遗憾。,6
2,27603669,为你写诗,卡卡#米米,174858942,很差,2018-11-10,01:33:48,不太懂为嘛这么多人都爱跨界做导演，其实这是一个高难度的挑战！,0
2,27603669,为你写诗,宠物叮当,44510778,很差,2018-11-16,19:42:32,无聊。一星给Rap,0
2,27603669,为你写诗,人间徜徉指南,188296379,,2021-03-12,23:23:41,有的时候，想法真的可以，只是个想法。,0
2,27603669,为你写诗,Joe,155102220,很差,2018-10-27,20:42:01,说实话，一分都不想给,0
2,27603669,为你写诗,闲云公子,154223713,较差,2018-11-18,00:51:31,导演是很努力，梁祝那段也很有新意，但是有些事情并不是努力就能做好的,0
2,27603669,为你写诗,洋2022,149577506,较差,2018-11-20,16:59:39,《为你写诗(2018)》 （2018.11.20） 3,0
2,27603669,为你写诗,晨钟暮鼓,157772944,很差,2019-02-18,16:44:34,别写了你写的不是诗,0
2,27603669,为你写诗,Burning,173793133,较差,2018-10-27,11:08:05,导演的门槛越来越低了，我竟然从头睡到尾，我那个场就我一个人，由此可见这电影有多无聊,0
2,27603669,为你写诗,小羊肖恩啊,180127418,较差,2018-10-26,13:31:44,女主好像周冬雨，又像杜鹃,0
2,27603669,为你写诗,沈鹭京,fanxiehong,很差,2019-06-29,08:10:18,影片除了最后15分钟还值得看一下之外，其他的简直是快进都觉得尴尬。拍电影和做音乐是两码事，为你写诗，也不一定得要有个足够夸张却完全无法说服人的故事。,0
2,27603669,为你写诗,請叫wo赵先生,170345666,还行,2018-10-27,12:06:15,演技有些浮夸，剧情有些扯。。。但还是很喜欢,0
2,27603669,为你写诗,夜行列車,mee2ashin,较差,2018-10-31,19:02:44,质量一星 参与了路演见到本人友情二星 歌手当导演还是不太容易…,0
2,27603669,为你写诗,🎥 TOZA 🎸,150238742,很差,2019-06-23,02:07:17,呕,0
2,27603669,为你写诗,Jane,jingyaoo,较差,2019-03-21,11:24:28,平淡,0
2,27603669,为你写诗,阿杜的万花筒,frank0618,推荐,2018-11-21,20:24:35,感动就好,0
2,27603669,为你写诗,艾卡西亚暴雨,181401473,很差,2018-11-05,21:56:52,求求你们不要拍电影好吗？？？现在是个人都能当导演了！,0
2,27603669,为你写诗,血小板女香,49751876,推荐,2019-02-02,23:48:18,还挺不错的,0
2,27603669,为你写诗,SC,153842937,很差,2018-11-07,13:13:44,故事都讲不明白，这诡异的旁白,0
2,27603669,为你写诗,愉快的小飛,189615466,较差,2021-01-27,21:30:20,一般,0
2,27603669,为你写诗,狐狸狐嘟,1546819,还行,2018-11-07,22:33:44,还行吧，细节差点，但是感情真挚，最后那里，哭了！,0
2,27603669,为你写诗,Jing,176321825,较差,2018-10-21,21:43:22,歌手做导演的门槛低到如此，随便一个烂剧本都可以称为盈利的工具。吴克羣今天来学校宣传时称自己两年没有任何新歌没有演唱会，只是为了完成自己的导演梦。一部这样不过脑子衍生的产品，真的需要付诸如此多的时间吗？我还是喜欢初中时mp3里那个为了音乐执着的吴克群。（下部执导别整个大舌头出来）,1
2,27603669,为你写诗,M,46247663,很差,2018-10-23,21:50:21,期待吴克群导演的大舌头 ,2
2,27603669,为你写诗,新宫,136321869,推荐,2018-10-26,22:26:06,第一次导演有些地方很生硬。3星其实还可以。鼓励再给一星,3
2,27603669,为你写诗,王小胖子,51443774,很差,2018-11-17,12:08:53,老梗，网络段子，不可忍受的是还有抖音段子。最关键的是歌也不好听。,0
2,27603669,为你写诗,要过纯纯苏特伦,125850617,很差,2018-12-02,19:05:24,天呀！！！我看了什么！！！洗眼睛去,0
2,27603669,为你写诗,玖玖玖玖玖玖,62079778,较差,2022-01-06,11:36:48,白瞎这首歌了。,0
2,27603669,为你写诗,听说,88982170,,2018-10-27,18:31:07,em ……,0
2,27603669,为你写诗,Icey,184214899,较差,2018-10-26,20:10:20,你以为这是部文艺片吗？不，你错了。,1
2,27603669,为你写诗,乙成,177565859,很差,2018-11-09,00:07:05,剧情很尬，由头到尾和《为你写诗》这首歌没有半毛钱关系，不穿越女主还能成为人生赢家，一穿越女主就得癌症死了，逗我呢？,0
2,27603669,为你写诗,我不是迷妹,154399049,很差,2018-10-23,20:22:27,好好唱歌不好么,3
2,27603669,为你写诗,桃然,171616363,较差,2019-03-13,14:16:07,矫情的让人浑身不自在，吴克群不好好出专辑做音乐干嘛要蹚演艺圈浑水，,0
2,27603669,为你写诗,敬之,170502639,推荐,2018-10-27,13:23:16,为你编剧～,1
2,27603669,为你写诗,娱乐惠,152606415,较差,2021-04-01,10:53:08,为你写诗 为你静止 为你做不可能的事,0
2,27603669,为你写诗,wuli龙龙,212194173,较差,2021-04-26,23:45:11,这是啥烂片？,0
2,27603669,为你写诗,杨哪吒,60217592,力荐,2018-10-29,08:06:55,可以说很惊艳了！剧情笑点密集不俗套，关键是电影叙事方法回味一下才发现是剧中剧中剧，真的很能演了。女主有点像李沁加杜鹃，蛮好看的！有个点被惊到：全程没出现《为你写诗》那首歌，吴克群是真的不想啃老本啊，厉害！,3
2,27603669,为你写诗,橘鹿,163056947,很差,2019-01-26,00:13:27,？？？？？？？,0
2,27603669,为你写诗,蝴蝶般的船,58915762,较差,2019-03-28,11:47:53,因为歌词硬写成一个剧本太牵强了……最后原来是一点剧本写的是未来，也算圆回来一点，可是前面半小时的drama表演真得让人想爆炸……,0
2,27603669,为你写诗,听枫,159945878,很差,2018-10-29,14:17:23,是个人就能拍电影了,1
2,27603669,为你写诗,叶然,yujun910925,较差,2018-10-26,22:08:05,其实想法是好的 单拍摄和剪辑节奏散的一塌糊涂 吴克群好是适合唱歌🎤,1
2,27603669,为你写诗,SherryResumed,149881591,较差,2018-11-05,06:54:31,既然可以拍出最后二十来分钟的水准，前边这么长的时间为什么要这么瞎来呢。笑点尴尬桥段过期人物聒噪体验劝退，想要喜剧跟感动都占齐结果只有长处被过于明显跟冗长的缺点拉下水。吴克群微博说自己是在用心拍一部好电影，只是输给了营销、市场、热度和流量。他说大家要有做傻事的勇气。可是我想说，做有一些事情，比如拍电影，试错的代价太过昂贵，极可能高到一个人没有办法自己承担。在这种状况下，面对已定的结果还在鼓吹“做梦”“犯傻”，这不是热血跟勇气，只是死鸭子嘴硬不敢坦然讲一句我水平有限我接受大家的批评。,1
2,27603669,为你写诗,吱吱喳喳,59112975,还行,2018-10-27,08:32:32,实在说不来，最后的半小时稍微好点，但是至少真的老套有无趣,0
2,27603669,为你写诗,vivian-H,144749508,很差,2018-11-01,11:36:47,施昊季度假回家请朋友吃饭送朋友回去路上追尾耽误了时间没有看到头，反正也难看,0
2,27603669,为你写诗,轻安居士,157349453,很差,2018-10-26,17:05:30,这电影叫过气歌手讨人嫌么？,1
2,27603669,为你写诗,南瓜头许言,68960048,较差,2018-11-10,17:09:02,这种片子本来根本不会看的，那天看到吴克群微博写了一篇长文抱怨自己电影拍的好可是得不到欣赏，所以就好奇看了一下，结果竟然这么烂！！我想去电影院看的人肯定会吐血的，竟然比何炅老师的 栀子花开 都烂……结尾有点反转意外，这也是唯一多给一颗星的理由。,0
2,27603669,为你写诗,刘健一,197922609,推荐,2020-04-30,22:43:27,"看到评分那么低加了一星，我觉得这是一部及格的作品。老吴快四十岁拍了一部献给自己妈妈的处女作，本子确实粗糙，但剪辑流畅、配乐也不错,新人女主真的演的可以，比很多小花都好，配角们也不出戏，可以看出吴克群是很用心的在拍一部电影，比起那些为了圈钱粗制滥造的电影，这部至少能感受到创作者的诚意，吴克群说这一仗他败得很彻底，哎，挺可怜老吴的…ps:很多人喜欢跟风打低分或者打高分，真挺没意思",0
2,27603669,为你写诗,让父母省心,119182855,推荐,2019-07-19,01:48:00,也许有很多理由可以说这是一部烂片，但故事表达的情感还是很令人动容，男主多希望得心脏病的是自己，每一个失去挚爱的人都渴望穿越回去，哪怕再看她一眼，再听她说一句话......,1
2,27603669,为你写诗,星星谷,129692395,很差,2018-12-11,22:03:43,吴克群的为你写诗，看着名字就知道是烂片。。。,0
2,27603669,为你写诗,Hamlet,191594068,力荐,2022-10-22,19:12:42,我觉得挺好的,0
2,27603669,为你写诗,海多盐,71612864,较差,2018-10-30,13:46:36,"穿越情节宛如智障……
最后又煽情了一把

",1
2,27603669,为你写诗,叮铃铃铃玲,198758284,较差,2019-10-02,19:26:57,歌好听，但电影就一般般啦。,0
2,27603669,为你写诗,FRIDA,115786627,较差,2020-12-07,20:59:30,为然妹儿多一星，吴克群怎么越看越像余文乐（跑）我觉得故事其实还可以吧，但就是很多段子拼在一起的感觉，会感到有些莫名其妙不连贯，很生硬,0
2,27603669,为你写诗,夹竹桃,206901391,很差,2023-01-18,21:01:01,补分吧，真的好烂,0
2,27603669,为你写诗,Tikoo,169643679,很差,2018-10-26,20:30:14,零分预定呢,2
2,27603669,为你写诗,总为浮云能蔽日,148748430,很差,2021-12-31,13:13:19,我也不知道，为什么我翻找了一圈能看到这部电影。看了22分钟后，及时止损。太摆烂了,0
2,27603669,为你写诗,Americano,80996852,很差,2018-11-27,11:29:35,史诗级烂片…吴克群老老实实唱歌吧,0
2,27603669,为你写诗,最初,163562356,很差,2018-12-13,22:21:42,不好看，浪费时间了。连搞笑的爆米花电影都算不上。,0
2,27603669,为你写诗,imfreak,48071171,很差,2018-11-19,23:20:23,16倍快进勉强看完，唱歌就好好唱歌，别跨界行吗？,0
2,27603669,为你写诗,rock&roll,14841567,很差,2019-09-15,16:42:07,前半部分真的尴尬，包袱不响，演技浮夸。,0
2,27603669,为你写诗,胸口碎大石、,155004711,很差,2019-05-06,09:54:25,唱歌都只这个鬼样子还跨界当导演，你以为你是周杰伦？,2
2,27603669,为你写诗,天天天晴。,60549577,很差,2018-10-29,17:29:30,什么人都能做导演系列。还好是免费的电影票。不过最后10分钟有点好看。,0
2,27603669,为你写诗,厉害的Cc,63928040,较差,2018-11-06,09:26:07,昨晚看到看到睡着了…,0
2,27603669,为你写诗,未妨惆怅是清狂,livewithoutyou,还行,2019-02-02,01:50:36,"可能是因为刚看了武林怪兽+天气预爆 感觉没想象中那么差。吴克羣实在太糊了 撑不起这样一部没啥内容的电影 演员选的都是些啥呀。
但还是让我感到想看下去的冲动  一是穿越情怀 二是想搞清楚到底在说啥。剧情虽然烂 但是情感方面还可以 真挚又笨拙感情 看得出自编自导的吴克羣 还是用了点心的。只是嘛 无论是创作剧本还是导演 都点需要天赋+努力。一星给吴克羣他真的很努力了 但是不是谁都能当导演的。一星给剧里的感情 虽然很乱 但是传达到了。还有一星是其他国产烂片真的太烂了 不能打零星 所以给它加一颗吧 至少比包贝尔之流强",0
2,27603669,为你写诗,FisherYYC🐟,176208734,很差,2018-10-29,20:03:23,当导演的门槛真底，有投资就行。,0
2,27603669,为你写诗,古宬,170333796,较差,2018-12-06,15:29:35,本来前面讲演技的事我还以为可以就演员的责任与工作谈谈呢，没想到最后还是狗血了。说真的，你前面整这么多一句轻飘飘的都是剧本就把一切都打发了，不觉得很失重吗？,0
2,27603669,为你写诗,磷火,181340821,很差,2018-11-22,13:14:03,为你些屎。像是在影院被人狂喂一个小时的shit。,0
2,27603669,为你写诗,一字顶一万字,156747538,还行,2018-12-08,23:10:30,故事其实挺不错的，结尾有峰回路转的感觉。可惜有些剧情实在是不怎么样，还莫名其妙塞进许多抖音神曲让人无语。不过女主演技挺赞的，全程碾压吴克羣。,0
2,27603669,为你写诗,Rrrrrrita,179334191,很差,2019-01-14,08:21:46,太尬了 无语,0
2,27603669,为你写诗,肆肆肆肆,45151671,还行,2018-10-28,16:11:30,和某人一起看的第17部电影,0
2,27603669,为你写诗,还是一件小棉袄,175290305,较差,2018-10-31,19:39:55,怎么说呢 是个彻头彻尾的烂片 但是不后悔看了,0
2,27603669,为你写诗,碧海蓝天燕尾蝶,82878845,较差,2018-10-29,23:10:49,电影只有一分 看到吴克羣 再加一分吧 今晚看了两部扑街电影啊,1
2,27603669,为你写诗,弱智青年翟二狗,140066823,较差,2018-10-27,19:51:41,起这个名字的意义是什么。消费我的情怀吗。,0
2,27603669,为你写诗,纪拾年,Stefi.,推荐,2018-10-27,17:27:28,我走得很慢，但是我每一步都走向你。/穿越不过的是时间，能够静止的叫回忆。,1
2,27603669,为你写诗,海淀影评媛,88373907,很差,2019-05-03,00:17:25,天。。太吓人了,0
2,27603669,为你写诗,Scavenger,130315581,很差,2018-10-29,19:53:14,喂你吃屎,0
2,27603669,为你写诗,迪亚特洛夫同志,xingchen31,很差,2018-10-26,19:13:44,为你些💩,1
2,27603669,为你写诗,迷魂TIME,152951420,推荐,2018-10-29,22:03:02,哪有什么回到过去，无非是我们活在自己编织的梦境里罢了。【看电影还是要吸收导演想表达的东西，看的出吴克群的自知和对电影的努力，很多人还是积点口德吧，我怀疑你们连灵魂都失去了。】,5
2,27603669,为你写诗,eric_FYH,154888777,较差,2018-10-28,11:10:30,各种网络段子的杂烩，真的辜负了我对他的期望。,0
2,27603669,为你写诗,不完美,83263069,较差,2019-02-17,01:17:29,前段普通，中间一度有点看不下去，后半段剧情反转有点意思。最后煽情其实有点小感动，但又有点拖沓了，导致有点矫情。其实看的出吴克群的诚意还是很足的，但无奈水平有限吧…,0
2,27603669,为你写诗,艾格尼丝🦄️,139681640,很差,2018-12-06,08:38:36,简直胡闹....,0
2,27603669,为你写诗,刘林,158048075,很差,2019-02-12,20:14:33,表示一下这就是垃圾中的战斗机,0
2,27603669,为你写诗,驴驴,49599539,力荐,2018-11-04,21:40:52,给五颗星是因为见到了导演本尊，还自拍了，哈哈哈，本人比电视帅，而且没想到一个歌手竟然电影拍的还可以。,1
2,27603669,为你写诗,在逃画家🤫,228237314,很差,2021-06-28,13:45:41,可以不要再出现这种没有任何含量纯卖情怀的电影了吗？况且这首歌也没有什么情怀,0
2,27603669,为你写诗,Ruiz,61391000,还行,2018-11-21,11:38:19,只是单纯支持下吴克群！,0
2,27603669,为你写诗,A n s e n,156109880,很差,2018-10-27,12:54:04,还能再烂点儿吗？圈钱无底线,0
2,27603669,为你写诗,我的20088,42304795,很差,2018-11-12,15:05:50,一坨臭狗屎,0
2,27603669,为你写诗,特兰克斯,147681228,很差,2018-10-28,18:23:33,烂片,0
2,27603669,为你写诗,达芬奇归来,152684385,还行,2018-10-30,00:45:13,穿越不过的是时间，能够静止的叫回忆。,1
2,27603669,为你写诗,与飞之七,152858299,很差,2018-10-27,12:49:30,一场看了想吐的闹剧，导演是谁想当就能当的吗，连学都没学过就学别人当导演,0
2,27603669,为你写诗,过冬天,175770740,很差,2019-08-02,17:21:07,歌还是好听的，片还是别拍了,0
2,27603669,为你写诗,难啃的鳄梨,50160926,较差,2019-07-01,13:53:38,不是所有青春里的歌都要再拍一部电影来重温的 好好听歌就行了,0
2,27603669,为你写诗,不是动物,159561318,力荐,2019-01-07,01:34:09,片子真心不太好，五分给他要站在巅峰的理想。,0
2,27603669,为你写诗,山甲,38604856,,2018-11-30,11:41:09,喂你些屎，喂你精子。这就是吴克群的浪漫,0
2,27603669,为你写诗,布拉町,188232833,还行,2019-01-19,14:27:40,"青春本就是烂俗的活，烂俗的过，烂俗的回忆再加一点烂俗的浪漫
我喜欢你…你怎么说？",0
2,27603669,为你写诗,七七喵,63716326,较差,2018-11-01,00:03:59,感觉电影里有好些梗都有点尬，但我个人还是蛮喜欢这首歌的，电影的话一般般，没必要去电影院花钱看了。,0
2,27603669,为你写诗,檸檬 Tea,159976673,还行,2018-12-13,22:13:51,完全无法令人有代入感的片子，剧情到人设都天马行空却无法把控，结局还真不如说这一切是男主的臆想更好~~~然后，它还真的就这样演了。把电影前1小时的各种漏洞和不协调的地方都转化为“恍然大悟”的感触。其实，我们就是电影里那位护士大妈，一直在被吴大导演“愚弄”着。遗憾的是片中还有很多细节无法自圆其说，存在硬伤。但作为首次执导，的确很不错。,0
2,27603669,为你写诗,天耳丶,189504823,很差,2019-09-28,20:47:05,写鸡巴,0
2,27603669,为你写诗,叁月拾肆,178156358,很差,2018-10-31,18:49:27,不好看,0
