page_index,movie_id,title,username,user_id,rating,date,time,comment,useful_count
1,27603669,为你写诗,朝阳门全智贤,84508285,很差,2018-11-09,09:32:49,看了五分钟就想关掉，这什么瞎几把剧情？？？？？？？？？？？？,0
1,27603669,为你写诗,-JasonHsia-,xiapeijie,很差,2018-10-27,16:24:39,歌手就好好做好自己本职工作。电影名叫《为你写诗》，我就是冲着歌曲想来看的，结果电影里没这首歌。剧情老套到我老弟都能猜到。。。。。。这片真的不用看，浪费歌迷感情。话说孙楠和吴克群（羣）不是在《全能星战》。。。。。。竟然还来参演了。6哦,0
1,27603669,为你写诗,3219,74887527,较差,2019-06-11,14:12:13,"周六晚 小雨想看个简单的。

最后，潦倒胡子喳喳，曾经的吴克羣。
Ps去年，你敢不敢再傻一次，还是不错的？",0
1,27603669,为你写诗,2047,wode2047,很差,2019-07-24,23:58:04,只有粉丝看的下去。,0
1,27603669,为你写诗,汤汤,edisonsunny,推荐,2018-10-28,14:19:40,能够打动人的情节就是真心，真心付出的电影就是好电影。为情怀打分三星，为细节惊喜打一星。,3
1,27603669,为你写诗,windy,178426722,很差,2020-10-06,09:32:33,看看影评就好了，应该是很尬的,0
1,27603669,为你写诗,soulmate,143255313,较差,2021-05-19,04:42:13,害，还以为结局是多大的反转呢，结果并没有,0
1,27603669,为你写诗,年度时光,118056050,推荐,2020-11-17,13:49:23,大纲还可以啦，导演功力不足乱七八糟的。星星全给最心水的女主,0
1,27603669,为你写诗,Immortal,119237925,很差,2018-11-06,10:12:04,看了吴导写的“彻底输了”的微博。刚开始还觉得他这微博很爷们，输的很坦荡。细看，竟然把锅推给市场和观众，美其名曰自己“不懂市场套路”，搞得像是为纯艺术献身的追梦者。若真为了圆艺术梦，票房好坏又有何干？像朴树这样追求艺术把日子过得清贫的艺人也不少，但没见过这么气急败坏的，像讨债一样。他这次还真是输的彻底，从电影到心胸,0
1,27603669,为你写诗,多余人日记,207004752,力荐,2021-06-18,23:55:06,为什么我想给满分,0
1,27603669,为你写诗,gago,cambiasso,较差,2018-11-03,23:29:22,没有最后十分钟估计就1星了,0
1,27603669,为你写诗,Yahto,142756744,很差,2018-11-16,04:58:50,1.5/10，这逻辑、这剪辑、这故事性，和他妈的电影名有鸡毛关系？,0
1,27603669,为你写诗,肖大柱,157513772,很差,2018-11-03,14:24:10,演员都当不好还来拍电影？,0
1,27603669,为你写诗,BAzINGA,155729531,较差,2018-10-28,22:50:10,女主还行。,0
1,27603669,为你写诗,Max,84966529,较差,2018-10-26,15:31:31,看完电影，气的我听了一遍为你写诗。一星给女主。,2
1,27603669,为你写诗,超级管理者,darkor2,还行,2018-11-04,22:36:12,开头太差了，后面圆回来还行，6分及格吧。,0
1,27603669,为你写诗,凯Run,155010824,还行,2019-12-15,21:46:04,很一般！,0
1,27603669,为你写诗,马Sweet,51008440,很差,2019-03-11,22:00:46,整个剧本混乱装疯卖傻，烂梗老梗齐上阵，毫无幽默感，演技浮夸也是很直观的问题。再也不黑商业喜剧片了，起码基本的拍摄手法没问题。,0
1,27603669,为你写诗,比翼双飞,183547067,很差,2018-11-02,20:05:29,为了圆梦什么的也太不把观众当回事了吧，还不如好好写首歌拍个mv,0
1,27603669,为你写诗,嘻嘻哈哈猫,141566768,很差,2019-05-09,22:08:49,为你写诗？不，是喂你些屎。,0
1,27603669,为你写诗,已注销,vvyomi,很差,2018-11-04,11:42:37,贩卖青春没意见，问题是你东西不好，卖不出去还怨我不买这就恶心了。我有一个xx梦。。。果然有梦想谁都了不起 😒,1
1,27603669,为你写诗,说好了不动情,205252701,还行,2020-03-24,12:23:37,还可以,0
1,27603669,为你写诗,🍊老狗,Silly19811202,还行,2018-10-30,20:30:41,还是挺有诚意的一部作品。可能本人太感性了，吴克羣的用心还是能感受到，不忍心打太低分。,2
1,27603669,为你写诗,秘逃小丸子,huxiaodie,很差,2019-07-01,10:06:27,为什么没有负分。。,0
1,27603669,为你写诗,bubu,littlevan,还行,2018-10-31,19:13:32,傻:),0
1,27603669,为你写诗,卡尔,157045291,还行,2018-10-29,10:59:23,还行吧，无功无过的一部电影，有很多其他电影的梗,1
1,27603669,为你写诗,奶猫,187455697,很差,2019-07-21,22:56:55,烂,0
1,27603669,为你写诗,爱小双,120799443,较差,2018-11-16,20:45:58,"虾米东西。。。一开始以为是模仿夏洛特
结果是超蝴蝶效应
然后什么乱七八糟 最后结局也是 扯淡。。。
女主也一般般",0
1,27603669,为你写诗,向暖 巴士﹏,52476794,还行,2018-11-07,16:46:14,起码我觉得吴导真的想讲一个故事 可惜没有主题曲,0
1,27603669,为你写诗,日常悠哉大王丶,130765036,很差,2019-04-10,11:20:14,虽未看，不影响一星,0
1,27603669,为你写诗,周先生,146468432,很差,2018-10-27,19:34:08,不想评价，导演是一个很神圣的工作，谁都能做。还有观众更不是傻逼。,0
1,27603669,为你写诗,ostrich,HuLiuJun,很差,2018-11-05,17:18:38,好好唱歌不好吗,0
1,27603669,为你写诗,段道玄,dukeduan,很差,2018-11-07,08:53:35,看了头五分钟。,0
1,27603669,为你写诗,还乐意先生,157106222,很差,2018-10-28,10:50:12,一辈子也就这么一首歌，拍个电影还得扯上这唯一一首代表作，这片能好看我倒着走路。什么阿猫阿狗都跑来拍电影，实在是对电影的不尊重。,1
1,27603669,为你写诗,小透,81775805,还行,2018-10-27,23:26:56,还是能感受到用心，其实并不是穿越剧，还是有点儿感人的～,3
1,27603669,为你写诗,这个真没有。,vivianh,很差,2018-12-01,01:56:12,我tm做错了什么要给我看这种垃圾？？？,0
1,27603669,为你写诗,🛫️,135127676,,2019-05-16,17:33:51,一首歌都可以扩充为电影了 试问还有什么不可能,0
1,27603669,为你写诗,SUYI,183911553,很差,2020-02-28,18:38:16,好好唱歌吧,0
1,27603669,为你写诗,bskufk123,54336102,很差,2018-11-12,01:03:18,喂你些屎,0
1,27603669,为你写诗,上好嘉,87589449,较差,2018-12-09,18:41:54,没看懂,0
1,27603669,为你写诗,GabyAllen,61965920,力荐,2018-10-26,22:55:25,为巴掌哥打call,4
1,27603669,为你写诗,小圆圆要搞事情,122557401,很差,2020-01-24,16:21:32,为什么不好好唱歌要来排电影……,0
1,27603669,为你写诗,红辣椒帕布莉卡,gardeniasky,较差,2020-07-15,13:09:17,嗯，周依然挺好的…,0
1,27603669,为你写诗,十号风球女士,146892725,较差,2019-11-09,17:04:12,女主非常神奇，看海报我一直以为女主是周迅，看了片子发现不是，然后女主可以即像白百合又像周冬雨。。。脸盲患者非常不友好的片子，挺四不像的，但不至于一星,0
1,27603669,为你写诗,毛二叔,104646596,很差,2018-11-25,13:42:54,感动哭了,0
1,27603669,为你写诗,SX,1831746,还行,2018-11-07,11:16:42,这绝对是北京卫视跨界喜剧王拍的吧 人差不多齐了,0
1,27603669,为你写诗,牧有意思,121185122,很差,2018-10-12,18:11:05,用了奇葩说班底竟然还没有奇葩说小剧场好看，唱了好几首抖音神曲竟然一遍为你写诗也没唱,3
1,27603669,为你写诗,大鱼酱籽,G_MMei,很差,2022-12-07,22:34:17,自导自演忙活几年，去看了他本人来长春做宣发的外表，像极了当年考研即将失败的我。,0
1,27603669,为你写诗,az,152573613,还行,2019-05-02,22:25:56,看完并没有觉得很烂，比预期好多了。,0
1,27603669,为你写诗,ᯤ,153366683,很差,2019-02-13,08:45:54,这个穿越有点懵,0
1,27603669,为你写诗,伯克利,189778546,较差,2019-06-03,11:00:09,无脑,0
1,27603669,为你写诗,皓月当空,173632889,很差,2018-11-08,20:58:42,歌手还当不好，这么多年也出不来一首好歌，就不要玩跨界了。电影市场火，都想趁机捞一把？观众又不傻，洗洗睡吧，5年拍出这样的电影，只能说明你实在太差了。,0
1,27603669,为你写诗,遇到困难睡大觉,168172931,还行,2018-10-28,11:56:17,"  故事很俗气，整部片子像MV,但是我哭的稀里哗啦。开头有些乱理不清思路，莫名其妙的笑点，让我感觉很尴尬，到后期终于清晰了思路后，故事并不怎样独特，但是想一想：已经知道这个时空里再也没有最爱的人。真的突然心痛。",1
1,27603669,为你写诗,H左手牵右手H,182981231,很差,2020-03-17,16:28:56,喂你些屎。。。,0
1,27603669,为你写诗,momo,74310109,还行,2020-02-18,22:35:12,呜呜呜太不容易了,0
1,27603669,为你写诗,charles·彧,xingjiyu,很差,2018-11-03,09:15:05,什么阿猫阿狗都来拍电影了,0
1,27603669,为你写诗,莞尔的笑,171821832,很差,2018-11-01,17:42:18,不是所有转型的歌手都是好导演…,0
1,27603669,为你写诗,肥宅掌门,feizhaizhangmen,还行,2022-05-11,13:34:01,之前看的，记得好像还挺搞笑的哈哈,0
1,27603669,为你写诗,Anarchy,55311844,还行,2018-11-05,20:40:13,看了他的微博以后决定还是鼓励一下吧……其实能看得出他的努力，看得出他不想靠ip圈钱的心，但是作品是真的不行啊……作为烂片都不够好笑，就是很单纯的没有生活没有逻辑。,0
1,27603669,为你写诗,朱门三子之父,113543995,很差,2018-11-18,21:33:05,烂的发笑,0
1,27603669,为你写诗,iwillseeu,135186452,推荐,2018-10-26,20:39:44,衝著劇本idea 多給顆星,2
1,27603669,为你写诗,起风了,163873099,很差,2018-10-27,00:06:37,喂你些屎，喂你精子,1
1,27603669,为你写诗,猫的熊,157302673,,2019-01-05,18:31:16,你写你🐴呢,1
1,27603669,为你写诗,蛇吞象,78251966,很差,2018-12-18,15:29:39,自己给自己编了顶绿帽子，牛逼,0
1,27603669,为你写诗,@devin@,huizhidong,还行,2018-10-27,17:45:50,结局还不错哦～,1
1,27603669,为你写诗,一点寒冰气,luoleinusa,很差,2018-12-06,19:26:46,我一直觉得这歌很烂，没想到拍成了电影，更烂,0
1,27603669,为你写诗,厦门拉拉兽,39877849,还行,2018-11-16,20:21:30,剧情虽然很烂，但是歌很好听。,0
1,27603669,为你写诗,小鹏鹏kway,141720095,很差,2020-09-22,14:24:08,辣鸡,0
1,27603669,为你写诗,憾生,132009017,推荐,2018-11-05,18:38:00,我觉得可以。比《从你的全世界路过》好看。,0
1,27603669,为你写诗,Fynkatz,63530594,还行,2019-09-01,19:35:20,本来2星 多一颗星给“我敢”,0
1,27603669,为你写诗,☺️Suki冰兒,133130108,很差,2018-10-30,15:57:57,起因莫名其妙，為愛的否定莫名其妙，結尾的莫名其妙...搶救室的門只能裡面開關！[發呆][發呆]這是個啥🙄🤨電影嗎？最後想說「吳克群大哥您還是好好唱歌吧」,0
2,27603669,为你写诗,空空依,153464699,很差,2018-11-04,22:45:58,圈钱不要脸,0
2,27603669,为你写诗,天上掉下个橘猫,95563057,很差,2020-02-01,19:34:39,音乐都还没搞明白，又来祸害电影，果然什么阿猫阿狗都能当导演,0
2,27603669,为你写诗,沉了,changer5,很差,2018-11-06,00:10:40,真的很难看,0
2,27603669,为你写诗,王恣今,melon618a,还行,2018-10-27,14:04:06,完全不出彩……一星鼓励关节……,1
2,27603669,为你写诗,是花酱呀,Diana_Z,较差,2019-03-05,20:17:56,剧情是挺尬的，可是怎么办就见不得分离还是骗了我一些眼泪。╯^╰,0
2,27603669,为你写诗,FAN非凡,143556614,很差,2019-02-04,23:23:37,为你些屎,0
2,27603669,为你写诗,Melanie,171096779,很差,2018-11-12,01:52:38,来洗钱了。毕志飞导演接班人。,0
2,27603669,为你写诗,姜蕙真,70344546,较差,2018-10-26,20:47:32,多一颗星安慰你一下，导演,1
2,27603669,为你写诗,姜姜波,87905288,很差,2021-09-06,05:45:23,怎么会有这么难看的电影怎么会有这么难看的电影怎么会有这么难看的电影。。。,0
2,27603669,为你写诗,万乐,163616204,较差,2019-10-08,19:38:20,本来坚持感情线会还不错，可惜还是被资本绑架了，加入太多一点不搞笑强行联系剧情的废戏，冲淡了情感，冲烂了电影,0
2,27603669,为你写诗,没有如果。,140548588,很差,2019-01-29,15:57:55,你还是好好唱歌吧,0
2,27603669,为你写诗,阿狗狗狗狗,59988098,很差,2018-11-05,16:29:59,这一颗星喜欢女主。,0
2,27603669,为你写诗,口水东,61229226,很差,2018-12-15,23:16:32,大杂烩，虽然很努力，但尬且烂,0
2,27603669,为你写诗,💤,178175250,较差,2019-01-19,00:20:01,看的有些吃力，不明白导演要表达什么。,0
2,27603669,为你写诗,过雨之后,139157697,很差,2018-11-06,02:11:12,前女友为我唱过这首歌，现在我他吗好想曰她,1
2,27603669,为你写诗,风灵飞影,68298761,很差,2018-11-06,08:41:55,一颗星给王心凌,0
2,27603669,为你写诗,魔力ESP,140610874,较差,2018-11-07,15:33:38,本片客串的大咖没有变成明星集合！感情的处理很好，尤其是一部爱情片，居然没有吻戏，最后的病房共舞，很感人！总体来说不能说好，也不是很糟！,0
2,27603669,为你写诗,再度重相逢,123876252,很差,2018-10-22,17:51:47,"吴克群，真为你担心，你真有勇气，当年你那首歌就""为你写诗""四个字基本上快唱完整首歌！现在是~咋了，缺钱了？",0
2,27603669,为你写诗,丨摆渡人。,137213922,很差,2018-10-30,09:14:25,滚你妈的 给你吃屎,0
2,27603669,为你写诗,阳光下的水藻,154932884,较差,2018-12-07,13:06:11,情怀分。,0
2,27603669,为你写诗,初恋是条狗,72371496,很差,2018-10-28,18:06:55,还没看，也不会看，名字取的真好，不只是烂片的堆头，还喂你些屎。老子用广东话来对付你，叼你老母。,0
2,27603669,为你写诗,Elvis.,Elvis-lx3,还行,2019-06-27,06:05:14,不管是什么样的故事，总有触动到我的点。,0
2,27603669,为你写诗,Seven here...,Tene,推荐,2018-10-27,01:34:41,心跳加速，再傻一次，吴克群同期的青春故事，砰然。音乐好听。细细回味。,6
2,27603669,为你写诗,Kevin Wayne,164508030,较差,2018-10-31,21:41:31,非常非常平庸的电影，前半段的烂就算后半段有闪光之处也拉不回来，见到了吴克羣本人，所以加一星,0
2,27603669,为你写诗,juerbuyu,61005092,很差,2019-03-23,22:32:22,你知道吗，你演得很烂,0
2,27603669,为你写诗,草长莺飞,179733713,较差,2019-02-19,21:51:03,挺喜欢《为你写诗》这首歌，不过同名电影拍出来的效果有点差了。,0
2,27603669,为你写诗,baochen,172742990,较差,2018-11-03,11:26:39,"显然转型不成功
但我觉得有这个尝试的勇气
还是很值得鼓励",0
2,27603669,为你写诗,💥,159336636,还行,2018-10-18,13:39:27,没什么惊喜，但还是某一段剧情发展中给邻座的陌生人递了纸巾。 跟《为你写诗》那首歌好像也没什么关系……,0
2,27603669,为你写诗,魏 丞. 志 Zz,150569248,很差,2018-11-07,21:23:10,吴克群自己看着不尴尬吗。希望你跟我们说实话,0
2,27603669,为你写诗,晴天,184429360,还行,2018-10-26,17:24:03,给吴克羣一些掌声吧，希望他加油,1
2,27603669,为你写诗,Mei彩静,177264947,较差,2019-09-16,19:19:19,好尴尬的剧情，两星不能再多了。,0
2,27603669,为你写诗,风卷残云,113424392,很差,2018-11-03,22:28:43,唱歌去，好好地拍什么电影？,0
2,27603669,为你写诗,mademoisesin,justkillmesof,很差,2018-11-05,21:49:55,喂你些屎,0
2,27603669,为你写诗,chen陈海,131095944,很差,2018-10-28,00:41:28,坑钱 骗感情,0
2,27603669,为你写诗,第七只鱼。,171478801,较差,2018-11-03,19:13:43,不是每个歌手都可以当一个好演员。,0
2,27603669,为你写诗,漂亮废物,157939911,,2018-10-28,01:10:04,真拿观众不当人啊，这种电影从名字就告诉了你，我就是要坑你的钱，我就是要恶心你，无语。,0
2,27603669,为你写诗,小彬同志,2229655,很差,2018-10-26,18:42:46,唉…干嘛这样,1
2,27603669,为你写诗,昔风不止,183797192,很差,2019-01-03,20:54:02,求求你别拍电影了，主角给自己带绿帽的剧情笑尿,0
2,27603669,为你写诗,kaki,166406113,较差,2018-11-01,20:44:10,"结尾救回来一点
克群梦做完了，好好唱歌吧。
因为因为你的歌声我已记住你",0
2,27603669,为你写诗,童甄,61533583,很差,2018-12-19,23:28:41,看不下去，辣眼睛的青春片，一群大叔还扮学生…为你写诗？写nmlgb…有多远滚多远。,0
2,27603669,为你写诗,阿瓜酱煮碗面,i-ynw,很差,2018-11-12,10:43:57,虽然吴是我的男神呀，但是……电影……真的……老吴啊，还有可能好好写歌嘛？,0
2,27603669,为你写诗,協昉,154964439,很差,2020-03-01,11:49:28,王心凌加一星,0
2,27603669,为你写诗,火火火龙,170807196,很差,2020-01-29,18:11:58,什么东西？,0
2,27603669,为你写诗,罗罗,147113834,较差,2018-10-31,15:37:47,什么鬼？！年度十烂又到位一部,0
2,27603669,为你写诗,厚切牛舌,127112404,很差,2018-11-03,08:38:11,什么人都想来圈钱……恶心……,0
2,27603669,为你写诗,Moment,63958669,较差,2018-11-08,19:45:24,还是比较喜欢 唱着《为你写诗》的吴克群！,0
2,27603669,为你写诗,vasa,137820936,还行,2018-11-26,03:27:03,有如晶的电影 好认真看了 还是忍不住在听到“小甄昏迷了一周”的煽情时刻开始搜索“人昏迷是否需要排泄”   但 我还是昧着良心,0
2,27603669,为你写诗,阿鹿曦,167563495,还行,2021-07-14,15:44:40,"黑小甄短暂的生命里拥有了永恒的爱情。
为你写诗，浪漫憧憬，美好的幻想，跟《赎罪》讲述故事的办法差不多，不同的是《赎罪》是为了赎罪，用书让男女主角的生命延续。差了点质感。
意外发现吴克羣演得很好，电影歌曲好听，加一星",0
2,27603669,为你写诗,请用原相机,50415878,很差,2018-10-26,20:05:50,这点钱干啥不好,3
2,27603669,为你写诗,方布,35346123,还行,2018-10-28,11:02:54,前期的笑料很一般，剧情的安排与其说一波三折不如说什么鬼，但到后面煽情的时候同去的追求中女生居然泪目。。好加1星，还有吴克群的大舌头和旁白真的是。。,1
2,27603669,为你写诗,lulu123,69803958,较差,2018-10-31,23:40:21,最好笑的是孙楠了吧，满脸横肉,0
2,27603669,为你写诗,好好地,144889235,较差,2018-10-23,21:23:43,东拼拼西凑凑，左抄抄右学学，然后再摞上一堆微博上看来的过期梗。吴克群说有人说他的电影是加长版mv他不服，可不是嘛加长版mv也没有这么又臭又长的啊！我可求求你了好好唱歌不行吗！,1
2,27603669,为你写诗,维也纳有🍭,173932702,还行,2019-05-19,17:10:19,还以为是真的为你写诗，反转用的挺好的，最后竟然看哭了，唉人老了泪点低啊,0
2,27603669,为你写诗,反方向的钟OvO,176490976,还行,2018-10-30,01:04:55,可惜了还是没法超越当年同样题材的周杰伦导演处女作《不能说的秘密》,1
2,27603669,为你写诗,银河,130458735,较差,2018-10-31,12:23:06,只能说吴克羣的导演秀并不成功,0
2,27603669,为你写诗,文艺女神经,182071253,很差,2019-03-06,07:48:01,以为是一首歌,0
2,27603669,为你写诗,歌者丶,161871864,很差,2018-10-30,12:35:30,哈哈哈哈,0
2,27603669,为你写诗,傲世,148695298,力荐,2019-05-05,04:47:19,支持吴克羣,0
2,27603669,为你写诗,呆鸟,danielzhou776,较差,2019-04-21,13:10:08,飞机上随便看看,0
2,27603669,为你写诗,呵,175880085,力荐,2018-10-31,18:17:48,"虽然整个影片没有想起那句歌词那首歌
可是，全篇都是我为你写的诗呀
吴克羣好帅啊",0
2,27603669,为你写诗,啟灮。,xwzx1999,较差,2018-10-23,21:54:23,【国贸百丽宫首映】不及格，笑点过于老套，看的时候全程尴尬，结尾拖沓。剧情经不起推敲。女主神似周冬雨，看在以前喜欢吴克群的歌的份上加一星，（吴克群真人挺帅）,0
2,27603669,为你写诗,漫步零度热带,129205674,很差,2018-11-10,00:35:35,老生常谈  优酷vip竟然还得6元  蜜汁自信,0
2,27603669,为你写诗,谭屁儿,49246032,还行,2018-10-29,01:09:46,就是反套路，比一般的傻逼片要好一点😂,0
2,27603669,为你写诗,且听风吟,169074619,很差,2019-08-24,15:22:00,为你写屎,0
2,27603669,为你写诗,🐱,HPPPPPP,较差,2018-10-31,10:01:50,吴克群是死骗子，居然敢拍着胸部保证自己拍的不是烂片。。,0
2,27603669,为你写诗,谌悟午阳,148318162,较差,2019-02-13,01:22:08,5,0
2,27603669,为你写诗,Jason Sun,175317983,较差,2018-10-26,16:25:59,"看这部电影完全是出于对《为你写诗》原歌曲的喜爱，还有就是胡彦斌的推广曲
算是为了情怀吧
作为一个跨界导演
也没什么要说吴克群的
毕竟第一次拍电影
能看得出用心，加油吧
不过多说一句，可能真的唱歌更适合吴克群
这种偶像剧还没有主题曲感人",1
2,27603669,为你写诗,VE,162314399,很差,2018-10-30,12:19:58,"吴克群傻逼
请了这么多水军也改变不了傻逼的事实。",0
2,27603669,为你写诗,滑稽果果,153976867,还行,2018-11-07,21:40:49,也就这样吧,0
2,27603669,为你写诗,恶魔害羞了,130287626,很差,2018-11-07,23:19:37,什么玩意儿🙄，没有这部电影，吴歌手在我回忆中还是美好的！,0
2,27603669,为你写诗,王大乐,wangdale,较差,2018-10-30,17:43:34,哎 其实后面的歌还是可以的 真的 你好好唱歌 我还是买账的 不过是中奖的票加见面会 也不计较那么多 多一星是给歌的,0
2,27603669,为你写诗,南国,167308149,很差,2018-10-28,22:16:49,恶心，一星都嫌多，浪费我二个小时，剪辑混乱，毫无逻辑，演技尬舞，呵呵呵，什么猫猫狗狗唱几首歌演几部戏都可以拍戏当导演了，呵呵呵圈钱的垃圾玩意,0
2,27603669,为你写诗,朝阳刘亚仁,88173487,很差,2018-10-27,02:48:30,尴尬到令人发指，感觉这是一部二十年前的段子集合作品。,1
2,27603669,为你写诗,毛哥的世界,166150200,很差,2018-10-27,22:08:55,吴克羣太能装逼了，可惜实力实在不济撑不起他的野心，这片负分都不值,0
2,27603669,为你写诗,以後,173362426,很差,2018-12-10,20:41:20,戏都没他妈演明白就当导演？,0
2,27603669,为你写诗,豆友91218636,zzzbabycat,很差,2021-02-18,16:46:47,其实吴克羣人还是蛮好的，路演时极谦逊，不忍心说他什么。但电影烂就是烂，多一分同情分都不能给啊。,0
2,27603669,为你写诗,recolle,164041529,很差,2018-11-05,21:00:33,印象中他也只有这首歌了。电影都要蹭这个热度。垃圾,0
2,27603669,为你写诗,不是江湖,137451502,,2018-10-26,10:33:43,小潘居然有在,0
2,27603669,为你写诗,景挥（单机版）,82075101,较差,2018-11-22,20:53:29,我就问一句，名字叫 为你写诗，结果电影演完都没出来这首歌？？？,0
2,27603669,为你写诗,冰镇可乐气泡水,182071294,较差,2020-06-04,23:07:40,这首歌我挺喜欢 毕竟也是青春的记忆 但是电影吧就不说了 反正挺尬的 而且剧情也不咋的 全程都没怎吸引到我,0
2,27603669,为你写诗,女神的二叔,190040384,很差,2020-01-12,16:47:02,吴克群还是回家唱歌吧,0
2,27603669,为你写诗,乱来的,1967079,推荐,2018-10-28,17:31:00,女主角气质很好 ，很像烂片，不过，吴克群，应该演的很爽吧。很难得的！大家不要刻薄,3
2,27603669,为你写诗,小萌萌,182839879,很差,2018-10-28,22:40:34,吴克群真是完蛋了,0
2,27603669,为你写诗,蓝,3172592,较差,2018-10-27,17:18:06,本来想打一星的 看在女主的份上加一颗吧 有点烂 慎重,0
2,27603669,为你写诗,issugar,114513399,,2018-11-03,09:22:03,比想象中好,0
2,27603669,为你写诗,Affogato,54895027,很差,2022-10-07,02:38:47,本着支持的心态来一看这部片子，最多给一颗星。你在影视行业积累不足，就自导自演拍片，整部片全是雷啊。还是好好做音乐吧,0
2,27603669,为你写诗,百战天虫,160616409,还行,2019-01-12,23:38:51,吴克羣好好写歌吧，不要再这么折腾自己了,0
2,27603669,为你写诗,往来无白丁,159620548,很差,2020-08-08,14:07:34,各种老梗，男主难看，女主也不好看，看得莫名其妙。,0
2,27603669,为你写诗,下一秒，聽见,183649118,很差,2018-11-03,10:41:33,好好唱歌不好吗？怎么今年都拿老歌来炒新剧呢。《后来》还算是成功的！《为你写诗》就打脸了。,0
2,27603669,为你写诗,李赛文,lidifei,很差,2018-11-04,21:19:19,这就是所谓5年的电影？5年干点什么不好！人生有几个五年 ！这不是浪费生命吗？没这个脑子圈钱 就别趟这浑水,0
2,27603669,为你写诗,no one,147498830,很差,2018-11-07,21:23:35,不是哥，你能节奏慢一点吗。什么乱七八糟呀！闹得玩呀！重点不是《为你写诗》吗？全程就没有放过哇，萧全：海草舞，孙楠：不见不散是什么操作，原谅我情商低，真理解不了。一星,0
2,27603669,为你写诗,咪子是大王🐣🐣,171515743,力荐,2018-11-09,21:11:12,前面虽然很狗血 但后面又能自圆其说，整体还是有可看性的，能看出来吴克羣还是有一些想法的，客观的说，不至于这么低分也不至于被评论区骂这么惨，最后客观完了想对吴克羣君说一句：年轻人 别沮丧  享受过程 看淡结果  圆了导演梦 你就是赢家,0
2,27603669,为你写诗,天空之城,144405694,还行,2018-12-09,16:49:23,前面表现的太差，后面确实不错，女主演技，颜值还可以,0
2,27603669,为你写诗,侧耳倾听,138486228,很差,2020-05-06,17:32:04,无厘头的剧情，男主为女主整个心脏病来穿越,0
