page_index,movie_id,title,username,user_id,rating,date,time,comment,useful_count
2,27110363,名侦探柯南·零的执行人,萤木C,cazze,,2018-11-12,10:03:12,不是一般地乱来。。。,0
2,27110363,名侦探柯南·零的执行人,小y,littley,较差,2018-11-11,22:14:28,也不知道看了点什么东西。。,1
2,27110363,名侦探柯南·零的执行人,Yolanda,sara127266,还行,2018-10-06,10:44:15,真的太无聊了。。。。,0
2,27110363,名侦探柯南·零的执行人,KerrySong,56009790,力荐,2020-06-06,16:44:33,2020-3月：看完2018柯南剧场版《零的执行人》。,0
2,27110363,名侦探柯南·零的执行人,小敏吃掉小敏,min_1224_child,还行,2018-11-12,18:34:28,为什么无人机都出来了柯南还是小学生？安室说自己的恋人是这个国家的时候，简直战狼附身,0
2,27110363,名侦探柯南·零的执行人,花都满,fashion.y,推荐,2018-12-25,12:09:30,看得出监督是有野心的，期待后续表现,0
2,27110363,名侦探柯南·零的执行人,文森,whyudidthistome,较差,2021-12-10,04:25:52,【2.0】虽然这么说很可笑，但这一部真算得上是柯南系列动作戏的巅峰了。安室透的飙车和柯南的踢球大法离谱到，黑暗组织看了都要立即宣布解散的程度。,0
2,27110363,名侦探柯南·零的执行人,摩溆mousy,mosescroco,推荐,2018-08-29,01:05:46,这部还是很好看的，推理部分基本环环相扣，感情线不少暖心的细节，最后十分钟反重力飞车和旋风足球的设定一旦接受也就习惯了嗯……,3
2,27110363,名侦探柯南·零的执行人,tiiiiin,tin,较差,2018-08-30,22:05:17,吹得没边了，烂得也没边了。,0
2,27110363,名侦探柯南·零的执行人,Luoceanlau,183296933,推荐,2018-10-17,03:55:13,非常非常让人受用的无人机+网络安全+公检法国安教育片。紧跟时代潮流渣日本黑NASA 一改之前的劣质美国大片风。人物线条有粗游戏 哀酱超美超可爱 安室透超帅 资源高清好评。柯南手机5G网络狂拽酷炸。值得去电影院一看，记得提前科普日本公检法系统。 ,1
2,27110363,名侦探柯南·零的执行人,私房歌,y328675858,较差,2018-11-12,09:47:50,动画版已经被我闲置了好多年没看了，貌似又多出了不少的常规角色？柯南已经不再是推理人了，更像是个动作巨星了。,0
2,27110363,名侦探柯南·零的执行人,WilliamOsborne,157548945,较差,2018-10-29,22:41:19,继续动作片，柯南先速激、碟中谍一步玩到了太空。这种单薄的剧情做sp就好还整成剧场版丢人。,0
2,27110363,名侦探柯南·零的执行人,猫本樱,173722417,还行,2018-09-03,21:55:12,已经变成每年的惯例，食之无味，弃之可惜。,2
2,27110363,名侦探柯南·零的执行人,会花光的金子,2712953,还行,2018-10-18,23:47:11,安室开飞车这个技能出现以后，以前柯南骑滑板飞天入地都显得合理了…那个写出“我的恋人是国家”的编剧，你出来咱们聊聊…,0
2,27110363,名侦探柯南·零的执行人,Woody,IncredibleWoody,还行,2020-06-13,23:37:09,科幻程度与日俱增……整体在近几年的剧场版中还算可以，当然跟早期的是没法比了……★★★☆,0
2,27110363,名侦探柯南·零的执行人,lcc,lilianlai,还行,2019-04-15,09:26:08,我要看本格推理！,0
2,27110363,名侦探柯南·零的执行人,O型血,UloveWo,,2020-02-10,08:37:45,https://www.bilibili.com/video/av35959120,0
2,27110363,名侦探柯南·零的执行人,南极没有北极熊,kid131,还行,2018-09-01,16:18:34,安室透：“我的恋人是国家”，这么符合社会主义核心价值观的电影不上映一下吗：）,1
2,27110363,名侦探柯南·零的执行人,镜中猫|51neko,neko51,还行,2018-11-13,00:14:04,"这脑回路清奇的剧情。。。柯南小足球的威力越来越巨大，安室的车大概是外星来的。
以及一年一度哀叹新一的声音又老了一圈，已经不是技巧可控了。。。",0
2,27110363,名侦探柯南·零的执行人,旧约,148380708,推荐,2018-11-11,14:35:47,安室透帅爆！飙车燃爆！,1
2,27110363,名侦探柯南·零的执行人,苏TT✨ ✨,bayronsu,较差,2018-11-17,01:45:37,......为了情怀，去他的情怀,0
2,27110363,名侦探柯南·零的执行人,阿满的草莓,tamako,还行,2018-12-16,10:12:34,不好看呀。这个凶手太简单了,0
2,27110363,名侦探柯南·零的执行人,Character、,161358924,还行,2018-11-10,09:04:01,多1分为了我的新兰党执念不能再多,2
2,27110363,名侦探柯南·零的执行人,Merov Mugatu!,merovingianeven,很差,2018-12-06,21:25:01,我就是为了看最后的动作大片去的，一星给小哀炸毛,0
2,27110363,名侦探柯南·零的执行人,今日店休,joycesxq,还行,2018-11-12,03:35:45,3.5 最后10分钟最好看 前面设定感觉很尬。最后部分配上音乐和其他观众的氛围，理想主义的甚至想哭。,0
2,27110363,名侦探柯南·零的执行人,towine,49578533,较差,2018-12-24,09:12:22,拜托不要再拍了，赶紧结束吧，过几年情怀都卖不了了，圈钱也圈够了吧,1
2,27110363,名侦探柯南·零的执行人,东莫卓羽,chenmuhan,还行,2018-11-26,22:33:04,青山刚昌对主角脸有着深深的执念，不管是工藤新一，还是服部平次、怪盗基德，以致安室透，长得都跟同胞兄弟是的。安室的那句 “我的恋人，就是这个国家啊！”才是本片的最爆点，还是期待下彩蛋里明年的基德新篇吧！,1
2,27110363,名侦探柯南·零的执行人,Delphinus,3958326,还行,2019-01-03,07:38:54,2018,0
2,27110363,名侦探柯南·零的执行人,图书馆馆长,kyoto,还行,2018-11-10,23:37:34,"实不相瞒我的名字就是国家
这部剧情比唐红好多了 get到了安室的帅点 
加入了对政法系统的思考，也可以说是爱国教育片了。蜗壳现在完全转型成为好莱坞英雄片了，连着吐槽了这么多年后已经内心毫无波动，只当做爽片来看了。",1
2,27110363,名侦探柯南·零的执行人,karenlin,48666472,还行,2018-12-01,21:15:09,3.5/5,0
2,27110363,名侦探柯南·零的执行人,D,danieldl,很差,2022-09-10,22:04:17,啊难看爆了赶紧完结吧,0
2,27110363,名侦探柯南·零的执行人,綿菓子14,mashimaro_14,很差,2018-11-09,02:56:42,真的是每年创新低，可能也怪我搞不懂日本的警察检查公安制度，也不知道剧中的制度到底是真实还是瞎编的，整个剧情无比难理解，全程费力跟节奏仍然一脸懵逼，期间还要被各种柯南的超现实主义雷到，已经不是科幻两字能解释的了，甚至连奇幻都抬举它了，感觉纯属制作组的肆意狂欢，为了搞大场面大主题真的是何止面子，连脑子都不要了。和零也没有多大关系，完全是噱头，真的是非常失败的一部。,1
2,27110363,名侦探柯南·零的执行人,276088996649,beiwei30du,较差,2019-01-29,20:09:13,哭咧咧的毛利兰，也是小学生吗？球王工藤的恋人是毛利兰，罪犯大叔的恋人是231，战狼安室的恋人是这个国家……爱情片的最后结局，也一样需要工藤球王一脚定乾坤！,0
2,27110363,名侦探柯南·零的执行人,浆糊骗子,xslidian,还行,2018-11-08,21:07:20,调动情绪+秀科技 抓紧赶超漫威啦 至于推理是什么能吃么,0
2,27110363,名侦探柯南·零的执行人,漫漫云端,Xing107,还行,2018-10-23,13:17:26,"某检察官仇恨公安警察权利＞公安检察
一心以为自己的""协助人""被公安审讯时逼死
继而对公安警察实施了一系列的的恐袭
最后发现一切都是误会 人没死 还叛变了🙄
二次元的世界就可以肆意开挂吗🙃
我差点就被前半段忽悠得以为这次真的是要静下心来玩推理
(虽然这次的故事主线有点沉闷)
结果果然我还是太天真
现在不开挂都不好意思说这是柯南剧场版😒
PS.看的韩语版 到底是哪些人配的音 难受死",0
2,27110363,名侦探柯南·零的执行人,Daimao呆毛,62945649,较差,2019-01-08,23:39:23,唉，一言難盡,0
2,27110363,名侦探柯南·零的执行人,K.H.,175166238,推荐,2018-10-03,11:28:23,让我明白了为什么日本乱。,1
2,27110363,名侦探柯南·零的执行人,吸螺,XTY29,很差,2018-11-17,17:51:06,“日本战狼”安室透。,0
2,27110363,名侦探柯南·零的执行人,very moment,144600865,很差,2018-12-23,13:54:44,推理基本为零的科幻动作电影。“公安警察系统”理解无能。,0
2,27110363,名侦探柯南·零的执行人,为老不尊,47758659,还行,2018-11-09,19:26:35,现在真的把柯南当特工使了！😔,1
2,27110363,名侦探柯南·零的执行人,大麻咧空啪,60119202,推荐,2018-11-19,22:45:05,透子真是男友力爆棚，小梓超市那场戏也是超级可爱，就不吐槽柯南最后那一脚神射了，ED居然是福山叔唱的，完美~,0
2,27110363,名侦探柯南·零的执行人,缚床灵团子,LK-Garden,较差,2019-03-18,14:26:57,沙雕大制作，尼玛拍四驱兄弟哪??,0
2,27110363,名侦探柯南·零的执行人,aikon008,140318051,较差,2018-11-16,23:12:48,敢黑掉NASA 小日本膨胀了,1
2,27110363,名侦探柯南·零的执行人,獭上尉,51446771,推荐,2018-11-13,21:01:04,柯南剧场版在动机扯淡化，阴谋巨大化，足球万能化的道路上越走越远了……加上公安这个主题，真 名侦探邦德。四分给安室透那句话。,1
2,27110363,名侦探柯南·零的执行人,夏木,hevibe,较差,2018-12-27,20:13:51,为什么要浪费时间……,0
2,27110363,名侦探柯南·零的执行人,保小罗,53082027,较差,2018-12-16,20:50:43,知乎上有个问题是“为什么你越来越讨厌毛利兰了？”有个答案是“我不止越来越讨厌毛利兰，也越来越讨厌新一了，越来越讨厌基德，服部了，因为他们越来越无所不能了。”他们已经能把手伸到太空了，下次是不是要和银河护卫队合作了？,0
2,27110363,名侦探柯南·零的执行人,Alec,143433332,较差,2018-11-15,19:31:57,各种不符合物理定律的夸张情节我就不说了，为什么故事逻辑、动机也乱七八糟的。炸会场到底为什么啊？要是人家公安直接当事故结案了，你不白忙活了。把毛利抓进去就为了让柯南帮你破案？！搞卫星这事儿跟前边炸会场、物联网袭击，完全就是两件独立案子嘛。这剧本是编剧喝多了写出来的吧，东拼西凑乱七八糟。,0
2,27110363,名侦探柯南·零的执行人,张腾森,52470011,还行,2018-11-17,10:53:29,柯南都从翻盖换触屏手机了，为什么还没长大呢？霓虹国民小学生果然是永远年轻的23333；安室透那句“我的恋人就是国家”怎么这么主旋律？？,0
2,27110363,名侦探柯南·零的执行人,wister,wisters,推荐,2018-11-11,21:11:16,在毒液和柯南之间毅然选择了柯南，就是这么铁粉！不过我十分好奇，柯南的足球连返回舱都可以怼，阿笠是用什么材质做的...,0
2,27110363,名侦探柯南·零的执行人,幼银,annsniper,较差,2018-12-28,23:03:26,？？？？？,0
2,27110363,名侦探柯南·零的执行人,醉饮狂歌,48902013,还行,2018-10-17,05:56:56,前半部分是更趋于真实向，包括解释了日本的司法系统，但是诡计太简单了，几乎没有推理，过程也比较无聊，后半部分的动作部分就太胡闹了，让几个小学生操纵无人机就敢跟卫星对撞？还有最后反物理开车已经太超过显得荒谬了,0
2,27110363,名侦探柯南·零的执行人,APTX-4869,41640054,较差,2018-11-11,07:07:08,卧槽是真的难看……逻辑没有也就算了动作戏在前作已经这么的气牛顿了的情况下还能更扯……ed也是难听……下作基德又要出来躺枪了呢,0
2,27110363,名侦探柯南·零的执行人,Danny,loveirina,较差,2019-06-30,21:50:48,柯南应该又名“缩水情人”吧。,0
2,27110363,名侦探柯南·零的执行人,Peoic,134552572,还行,2018-11-19,04:40:11,"柯南 : “我以前就一直想问了，安室先生有女朋友吗？”

安室透 : “我的恋人是这个国家。”

啊啊啊啊怪盗キッド明年见！！！",1
2,27110363,名侦探柯南·零的执行人,陈小桃,adel,较差,2018-11-12,06:48:54,打一星是赌气，多一星是给情怀。,0
2,27110363,名侦探柯南·零的执行人,william,145525446,较差,2018-11-23,21:49:02,"晚上八点，在长宁区一个废弃的购物大厦四楼的破败小影院里看的。二号线乘到北新泾站，完美世界影城北虹店（原17.5影城）。黑漆漆的广场上将近百人的老头老太以固定间隔排列着，一边挥动双臂，一边列队前行，仿佛人体构成的贪吃蛇伴随着音乐缓缓蠕动。
关于电影，去看之前就知道豆瓣评分只有5.8分了，不过据说本片在日本的评价挺高，好奇之下，30元就被花走了。作为柯南片，缺乏福尔摩斯式的推理过程，一众警察倒是如同苏格兰场那样无能，犯人还是运气好碰巧发现的。不过本片也有优点：比起同期在国内上映的《神奇动物2》，这部《零的执行人》有更多的魔法在里面。
差点忘说了，片尾居然还有彩蛋，扣分",0
2,27110363,名侦探柯南·零的执行人,小飞侠3799,flyingbria,较差,2018-12-27,17:37:40,看到一半居然能睡着orz...,0
2,27110363,名侦探柯南·零的执行人,马不办,dengyixiajiuhao,还行,2018-08-30,21:35:57,柯南已经成为一种情怀,0
2,27110363,名侦探柯南·零的执行人,谢拉特,209675281,还行,2020-03-18,11:06:29,这部是柯南剧场版最不好看的，没啥推理剧情，堪称动画版速度与激情,1
2,27110363,名侦探柯南·零的执行人,Departure陆离,60812524,力荐,2018-11-09,23:15:37,对不起，脑残粉是有脑残粉的尊严的！但是2019年求求你不要再让小兰做傻白甜了好嘛！救救兰尼酱！,1
2,27110363,名侦探柯南·零的执行人,绿毛水怪,127299151,较差,2018-11-14,12:10:46,零的执行人这名字谁想的？这么羞耻,0
2,27110363,名侦探柯南·零的执行人,琦玉,meosaka,力荐,2018-05-13,00:29:52,啊我恋爱了，爱上安室了。。。,3
2,27110363,名侦探柯南·零的执行人,弥香,tulip221,推荐,2019-01-04,14:34:13,11.11看,0
2,27110363,名侦探柯南·零的执行人,哗啦啦,hualala,还行,2018-11-11,20:18:55,物联网反恐，挺超前，5G网络还没到来的情况下，很神奇。,0
2,27110363,名侦探柯南·零的执行人,木木,elinli00,还行,2019-11-19,10:34:05,孩子们，世界就靠你们守护了啊。。。,0
2,27110363,名侦探柯南·零的执行人,多串,tsunaxd,较差,2018-11-13,22:49:32,你将浪费你生命里的两个小时,1
2,27110363,名侦探柯南·零的执行人,suvenee,suvenee0715,还行,2019-03-05,18:50:43,嗯，看过……,0
2,27110363,名侦探柯南·零的执行人,Fractures丶,177165556,还行,2018-11-10,18:16:54,牛顿的棺材板按不住了,1
2,27110363,名侦探柯南·零的执行人,hanabi,68732725,还行,2018-11-10,23:30:01,日本动作巨星——柯南的年度新片,1
2,27110363,名侦探柯南·零的执行人,核蛋Klakt,klakt,较差,2019-02-08,20:58:29,想象力爆棚没关系，关键是文本和镜头都很敷衍。,0
2,27110363,名侦探柯南·零的执行人,省省省话,77395747,推荐,2018-11-11,22:35:42,本来要无脑打5星 但想想之前的作品这部确实没有那些高度 别的都还好 但能控制地球以外的东西有点扯 开车开成这样有点扯 踢足球踢成这样有点扯 没别的问题 安室在说完只爱国家时有点圈粉 柯南不顾一切保护小兰一家更是圈粉 坚定不移新兰党 期待有基德的下一部,1
2,27110363,名侦探柯南·零的执行人,Bt,59260003,较差,2018-11-12,07:49:54,从动机来讲，简直是莫名其妙有点夸张了…从手法来讲，一个小角色可以搞瘫痪半个日本，入侵NASA控制卫星？我的天…从推理来讲，好像并没有推理好突然就迎面碰到了凶手然后抓住了…剧情有些点也挺打动人，场面依旧宏大炸炸炸…但真的有些扯,1
2,27110363,名侦探柯南·零的执行人,MaclovenZD,MaclovenZD,较差,2018-12-04,22:05:23,犯罪动机、视觉特效、动作特技、全员参与...该有的都有了，就放编剧一马吧【代入感差，但是票房高啊明年还得看呐】,0
2,27110363,名侦探柯南·零的执行人,NoEnoughPants,NoEnoughPants,,2018-12-28,06:35:29,什么鬼剧情,0
2,27110363,名侦探柯南·零的执行人,空思,szeze,很差,2018-11-15,09:28:18,每年看一部让人昏昏欲睡的剧场版，算是对这部动画最后的支持了。老而不死是为贼！,0
2,27110363,名侦探柯南·零的执行人,大劈叉,49946239,还行,2018-11-21,22:13:25,柯南在剧场版越来越喜欢踢一脚来结束战斗了。,1
2,27110363,名侦探柯南·零的执行人,少年阿尔弗雷德,AreafradRichard,还行,2018-12-24,06:28:00,我还是直接看TV版来得更紧凑些 另外小五郎和妃两个人无限接近离婚的分居但又保持联系却生活互相独立且不失牵挂其实也是一种很好的生活方式 很现代,0
2,27110363,名侦探柯南·零的执行人,中堂的世界,66168101,还行,2018-10-20,18:48:09,如此正能量的动作神剧一年一部，剧场版已经彻底沦为汤姆克鲁斯式的《碟中谍》系列...每一部不来点爆炸好像都对不起制作经费。而本作最骚操作的是安室透...车技是跟藤原拓海学的吗？《速度与激情》正好需要补充一位日本籍成员了...看结尾彩蛋，明年换成怪盗基德篇了？,0
2,27110363,名侦探柯南·零的执行人,momo,zgl94259559,较差,2022-10-27,14:38:29,……片尾的kido sama最好看,0
2,27110363,名侦探柯南·零的执行人,随遇而安,1487998,还行,2018-11-14,01:01:03,柯南已经变成超人了，而我们只能看个情怀了。结婚后的三轮的首看,0
2,27110363,名侦探柯南·零的执行人,青山戚戚蛙,qitianlin,很差,2018-10-20,02:19:02,我已经过了看柯南的年纪好久好久好久好久了,0
2,27110363,名侦探柯南·零的执行人,披着人皮的鬼,ghostinyourskin,较差,2021-10-08,17:58:34,案件与激情,0
2,27110363,名侦探柯南·零的执行人,▲Lan1.,lan1orchid,还行,2018-11-11,21:51:18,除了结尾依旧如常的烂，但是整体前半部的节奏和内容都比前几部好多了！说实话每次在电影院听到“我是高中生侦探工藤新一…”都还是会感到蜜汁鸡冻…,2
2,27110363,名侦探柯南·零的执行人,花果山望妻石🎩,babaria,较差,2018-11-12,11:14:27,安室透:我的恋人，是这个国家。这种台词是怎么写出来的啊。。。片尾曲居然是福山叔？？,0
2,27110363,名侦探柯南·零的执行人,Rita,JM4628,很差,2021-06-22,20:07:24,"“拼上性命也要守护的东西?”那你妈的怎么不拼你自个儿的命，要诬陷无辜者入狱?毛利平时可待你不薄。而且就算抛开一切来讲，身为公安，不为人民办事反而陷害无辜百姓锒铛入狱。就因为觉得自己比百姓高贵自己得留在监狱外边办实事?照您这说法那只要有才能杀几个日本首相也可以不追究责任是吧?不愧是你啊小日本。
风间和降谷真他妈一对人渣。不愧是小日本的废物警察。
毛利兰人设也塌得差不多了。又没用又势利。出了事找工藤找妈，人家帮不上就开始说人冷漠没人性，倒打一耙。请问兰小姐您除了哭哭啼啼喊麦以及不分场合恋爱脑耍脾气以外还会些什么?
日下部人挺不错的，正直。
日本公安内部自己出了岔子死了人，要普通市民来背锅赎罪。甚至还伪造证据。真他妈牛逼啊。",3
2,27110363,名侦探柯南·零的执行人,铅纸鹤,152377964,较差,2018-11-10,19:10:00,你们不要喷了，人家的爱人是国家,0
2,27110363,名侦探柯南·零的执行人,U'si,adarkhole,还行,2018-11-25,13:22:25,一星给信仰,0
2,27110363,名侦探柯南·零的执行人,efuchan♡,natsukitohno,推荐,2018-05-29,15:07:11,这一弹意外的好看，主要还是因为有帅气的安室桑加盟本科幻动作系列大片(｡･ω･｡) 而且这一弹我哀戏份迷之多，沉稳冷静技术宅，真 工藤先生背后的厉害女人。另外明年是Kid様！期待惹，相约明年,0
2,27110363,名侦探柯南·零的执行人,吃菜不吃呱,139066724,还行,2018-09-02,19:27:02,比去年的好很多，虽然都是躺在病床上看完了。但放心，会去补票。“我的恋人是国家”他到底经历了什么,0
2,27110363,名侦探柯南·零的执行人,雪中来客,58342614,还行,2019-09-19,02:50:50,安室透这刀片超车，骑火车，超过火车的车技，也就得亏是日本新干线吧，不然中国高铁的话，就算是柯学也不存在前期可能性。(柯南，重新定义柯学),0
2,27110363,名侦探柯南·零的执行人,なにもいらない,54105418,,2018-12-01,14:47:59,wtf,0
2,27110363,名侦探柯南·零的执行人,aicbgyihai,aicbgyihai,很差,2019-02-08,19:45:51,。。。。。。。。。。。。。。。,1
2,27110363,名侦探柯南·零的执行人,Astoria,164401919,还行,2018-11-10,14:42:30,推理部分真的好弱，兰的人设也怪怪的...除了定番的大楼爆炸还有炸弹改变探测器轨道、足球踢炸探测器碎片...嗯，好柯学。还有，这算是日本粉红电影吗,1
2,27110363,名侦探柯南·零的执行人,小羊仔,Godless-doll,力荐,2019-08-24,17:11:45,这部推理和柯南侠的部分都刚刚好了,0
2,27110363,名侦探柯南·零的执行人,夢裡花落,xqyamour,较差,2019-01-08,22:37:26,在突破物理学极限胡说八道的路上越走越远了…,0
2,27110363,名侦探柯南·零的执行人,寡狗,143049789,较差,2018-11-09,23:44:33,走过路过不错过的剧场版年年有，却一部不如一部，作案动机理由牵强，手段手法离谱，居然还顺便卖个腐：公安检察官和协助人的关系绝对不正常，如今柯南早已经沦为动作言情套路无公害小学馆作品，没有凶杀没有阴暗没有斗智斗勇没有惊心动魄邪恶诡计，靠卖卖人设插科打诨充充门面，博士各种黑科技，少年团各种不发育，结局各种苦衷情有可原，没有本格推理没有暗线铺垫，每逢危机到来观众早已麻木到没有一丝紧张波澜，核心人物一个都不会死，简直合家欢到不行，没有一丝破案的快感、反转的愉悦，动作戏突破天际违反物理法则，柯南各种装逼单枪匹马虎胆龙威，唯一能看的也就是最后实景拍摄的东京配着福山雅治的ED，以上。,0
2,27110363,名侦探柯南·零的执行人,龍爺,longbookstore,较差,2020-04-28,11:20:40,难看死了……,0
2,27110363,名侦探柯南·零的执行人,殊聿,58668533,还行,2018-11-11,23:42:55,这是我第一次进影院看柯南剧场版耶！观感真是一言难尽，感情变幻是迷之尴尬。。。说爱上就爱上，说背叛就背叛，说自杀就自杀，说复活就复活，没有180迈的汽车迈不过的坎，也没有阿笠博士解决不了的难题。让我们忘掉科学，忘记常理，静静的看着日式超级英雄耍帅。,0
2,27110363,名侦探柯南·零的执行人,maymayHoliday,zoroom,较差,2019-01-06,19:26:19,比上次看的向日葵好不到哪儿去...也许应该放弃看柯南电影,0
2,27110363,名侦探柯南·零的执行人,阳阳,133519616,较差,2018-11-10,14:46:30,只喜欢推理的柯南，不喜欢超级英雄柯南,1
2,27110363,名侦探柯南·零的执行人,Jerry,133486802,还行,2018-11-18,19:08:21,说实话啊，柯南剧场版开始一年比一年水了！这部依然没什么惊喜，剧情一拖又拖，而且不像从前结局你根本猜不到那样！结局又是一颗球拯救世界，还踢出龟派气功的既视感！总之看的坐在电影院打哈欠，唯一的惊喜应该就是怪盗基德的彩蛋了！,2
2,27110363,名侦探柯南·零的执行人,紫霞小姐,lostdreams,还行,2018-11-12,15:18:16,牛b哈度,0
2,27110363,名侦探柯南·零的执行人,空空空,64832297,推荐,2020-10-14,22:40:37,因为不喜欢安室透，所以迟迟没看这部。怎么说呢，推理依然不多，但是居然还有23333（已经这么低要求了）动作场面很大，局铺得也很大，公检警这些权力派系斗争的设定，不适合小朋友看了吧？我还以为会有酒厂的戏份呢，这么大场面，结果是一个人搞出来的…协助者或者执行人这个设定还是有点意思的，包括最后柯南和零背向而行，一个低沉男人的歌声响起多少有点情怀，无间道这些。但是在柯南里我只能接受柯南开挂，基德勉强，小兰和平次偶尔一次也行，接受不了你安室透OK？零这牌面，啥信息都给你，开车那家伙都得开外太空的挂了。凭什么抓毛利，还不是你自己没本事？零的CV我也觉得怪怪的。园子真好，看到柯南小小一个去质问零却无果，新一你算什么男人！橘的配音居然是上户彩，上户彩在TV版里可出现过诶。强行给少年侦探团镜头，博士小哀强到拯救一个国家,1
2,27110363,名侦探柯南·零的执行人,駄目人類,sakulawyw,还行,2018-12-12,11:58:00,开过高达的男人就是不一样,1
2,27110363,名侦探柯南·零的执行人,奔跑的不锈钢,conan575,还行,2018-11-17,13:00:59,再这么下去可以拍个柯南大战异形了,0
2,27110363,名侦探柯南·零的执行人,无耻哈尔皮,jinj_1991,较差,2018-11-13,21:33:09,"我的恋人是国家,日本战狼安室透",0
2,27110363,名侦探柯南·零的执行人,goldenday,goldenday,推荐,2019-08-22,22:46:25,小朋友看应该会觉得没什么意思。,0
2,27110363,名侦探柯南·零的执行人,clownRapture,140757218,较差,2018-11-16,17:15:14,日本战狼,1
