page_index,movie_id,title,username,user_id,rating,date,time,comment,useful_count
0,27110363,名侦探柯南·零的执行人,油焖茄子,sxe,较差,2018-11-10,01:20:44,"当柯南说出""物联网""的瞬间，对不起我没忍住在影院里狂笑出声，惹得后排一起跟着笑... 下一步是不是要大数据了🙊",3
0,27110363,名侦探柯南·零的执行人,新机拉奶,belindayin,较差,2018-08-29,12:30:00,剧情强奸脑子 韩语配音强奸耳朵 ,19
0,27110363,名侦探柯南·零的执行人,木西,roiroii,还行,2018-11-09,12:30:47,好像已经不再对剧场版抱有会像摩天楼、十字路口、十四番那样感动和精彩的期待了…,2
0,27110363,名侦探柯南·零的执行人,Cup_,142544987,还行,2019-02-11,12:14:10,"后续剧情应该怎么走心里没数么…？
黑暗组织是不是太温柔了…？
卧底是不是太多了…？
案件的恐怖元素是不是太少了…？
Cnm的动作戏是不是太多了…？
爱你才骂你 希望你能变好",2
0,27110363,名侦探柯南·零的执行人,隔壁的蓝,1163376,推荐,2018-06-06,12:13:20,比前几作要稍微起色点，全剧的紧张感处理地相当好，还把低龄化要素缩减了不少,8
0,27110363,名侦探柯南·零的执行人,第七大陸,Wz12118,较差,2018-11-13,12:57:40,秋名山安室透,6
0,27110363,名侦探柯南·零的执行人,shinshin,soyawu,还行,2018-11-10,16:50:59,日本第一车神安室透，炸烟花那里我真实鼓掌了哈哈哈哈哈哈哈，知道为什么这版票房高了，肯定安室透迷妹刷的，除了安室透搞的大场面很帅以外，没啥好看的，剧情稀烂,4
0,27110363,名侦探柯南·零的执行人,tehom,hashmal,,2019-04-24,00:03:15,这次ゲスト是上户彩啊,1
0,27110363,名侦探柯南·零的执行人,落叶琵琶虾,177580368,较差,2018-11-24,02:32:31,一年比一年平淡了，感觉每年看只是习惯。,6
0,27110363,名侦探柯南·零的执行人,方冉儿,rimiya,还行,2018-11-13,15:22:12,有一波四驱兄弟➕美少女战士的感觉。推理性可以说是很渣了。越来越不喜欢小兰的人设，傻白甜。永远是“新一...爸爸...柯南”。布美都比她要有贡献于剧情。,6
0,27110363,名侦探柯南·零的执行人,Molly,tyougei,还行,2018-10-16,12:35:46,想念基德,1
0,27110363,名侦探柯南·零的执行人,mulder,mulder.jr,很差,2018-10-21,17:06:45,太生硬了…事先把期待调成了陷落系列的东京篇，没想到还要更傻缺,2
0,27110363,名侦探柯南·零的执行人,蜉蝣,lephemera,较差,2018-11-08,21:51:50,再也不想看见安室透！还我赤井！,9
0,27110363,名侦探柯南·零的执行人,谢谢你们的鱼,reave,很差,2018-11-09,22:38:11,柯南，一个比巨石强森还厉害的男孩子，我呸！,4
0,27110363,名侦探柯南·零的执行人,焚紙樓,80722428,较差,2018-12-01,00:02:00,2014年推銷iphone，2018年推銷無人機，阿笠博士的發明則愈發乏人問津。嗚呼！,2
0,27110363,名侦探柯南·零的执行人,長島冰茶,waldo0121,还行,2018-11-10,20:49:07,拍再烂也去看系列,2
0,27110363,名侦探柯南·零的执行人,nothing传叔,chuanshu,还行,2018-10-16,20:53:48,该片最多2星，但转念一想，这不就是村上春树所谓“高度发达的资本主义社会”的最佳写照吗？不但戏里如此，柯南几十年如一日做小学生靠踢足球拯救日本，戏外也是如此，编导们几十年如一日杜撰这些掐分掐秒的反转再反转的套路（包括卖萌），就这样还是几十年如一日有人买单，，，虽然犯睏，最认真看的一段是公安“协助人”科普，。。。,2
0,27110363,名侦探柯南·零的执行人,植荷,181529436,还行,2018-11-20,17:00:08,已经太多年没看柯南了，居然出现新的人物了，不过精彩与否我都不那么在意了，我只想它早日完结,3
0,27110363,名侦探柯南·零的执行人,麦子麦子酱,yuliamelody,较差,2018-11-15,22:25:56,和国家谈恋爱的伟光正已经堪比战狼了 柯南这是要变身动作巨星了吧,5
0,27110363,名侦探柯南·零的执行人,千寻亿选,2574034,,2020-07-04,16:03:42,一路看过来，这个系列已经慢慢摆脱推理标签，走向惊险动作系列。虽然口碑一般，但票房屡创新高，制作者是了解观众的喜好的，爽片才是正道，每年看柯南电影也成了日本观众的一场盛典。安室透在这部剧中抢尽了风头，还喊出了片中最强的台词,0
0,27110363,名侦探柯南·零的执行人,piggy,37832420,还行,2018-11-03,04:20:03,每年看柯南已经成了习惯，每年失望也成了习惯。柯南已经几乎成为圈钱的工具。像贝克街的亡灵一样有趣的作品已经不可能出现了。,3
0,27110363,名侦探柯南·零的执行人,灾星下的男人,wellwells,还行,2018-09-01,21:03:18,魔法师柯南使用火球术救场的画面可以入选2018年度超级英雄精彩瞬间了。,1
0,27110363,名侦探柯南·零的执行人,贝塔先生,yahooor,较差,2018-10-13,12:37:10,犯罪动机总是让人“感动”……,8
0,27110363,名侦探柯南·零的执行人,兰 希,nancy-chan,推荐,2018-11-17,16:31:55,虽然已经不看tv版了，但剧场版每年还是要追一追的，特别近几年都会在国内上映。陪伴着我从豆蔻到成年的故事，无论如何心里都有它的位置。格局铺得很大，最后也很好地完成了，每次警界的戏份都很喜欢，这次剧本的立意想表达的意思都很好，大场面在电影院看都很过瘾。,2
0,27110363,名侦探柯南·零的执行人,放开那只路易吉,61653646,还行,2018-11-09,13:25:45,动机太扯了,1
0,27110363,名侦探柯南·零的执行人,火龙果不耐受者,flower21,较差,2019-09-16,15:05:54,新的都出了，我才发现去年的没看,2
0,27110363,名侦探柯南·零的执行人,蒙莎,1557889,还行,2018-11-09,23:41:23,GAY里GAY气的，牛顿看了会沉默，NASA看了会流泪,3
0,27110363,名侦探柯南·零的执行人,胖丁桃,3497932,较差,2018-11-12,16:30:59,复仇者柯南之速度与激情，只看过剧场版的我特别想知道这位安室透是何许人，我的恋人就是这个国家啊——嗯？这位少年你想对你的国家做些什么？！朋友们，网上已经出资源了，咱就别去影院浪费钱了。,2
0,27110363,名侦探柯南·零的执行人,大地,72677574,还行,2018-11-27,22:41:13,柯南剧场版还是要看的，虽然已经是动作片了。而且前期真是巨型无聊。只有对柯南的爱，忍住了普通婆婆妈妈电视剧的节奏,1
0,27110363,名侦探柯南·零的执行人,传说北美狗鱼,52396951,推荐,2018-11-10,14:21:25,随着时代发展，柯南真的是与时俱进了太多。物联网袭击像《看门狗》，卫星撞地球像《天地大冲撞》，东京大瘫痪甚至像《艾斯奥特曼》倒数第二集。剧情还不错，夹杂个人感情带来的复杂派系争斗，背后有利益，更多的是个人价值观的冲突。飞车冲下大楼似曾相识啊，通往天国的倒数计时？科幻动作甚至武侠片我都认了，但是也别成为超级英雄片吧？,4
0,27110363,名侦探柯南·零的执行人,KID Y,youhuan121,较差,2021-04-19,22:08:39,5.0其实场面设计的还可以，一些分镜还是能看出想法的，就是这个剧情实在是离谱的没法再离谱了。,1
0,27110363,名侦探柯南·零的执行人,吃主儿,2112561,较差,2018-11-03,23:46:57,动作电影都不敢这么拍,2
0,27110363,名侦探柯南·零的执行人,某J。624,june4cat,较差,2018-11-14,00:17:47,被一个万年死忠拉去看，然后在我感慨柯南怎么变动作片了时嘲笑了我，又在我回头想说好基时迅速开口：你别说。,1
0,27110363,名侦探柯南·零的执行人,JYUUI,65706627,较差,2018-11-10,00:16:55,"堪比业火向日葵的智障大作，安室的帅气度不及漆黑噩梦的一半。
别的不吐槽，吐不过来了，就单说一下那句看起来仿佛很in的我的恋人是国家这句台词，讲道理这台词其实应该很帅气，嫁给国家这种声明总是让人觉得这个角色充满人格的魅力，例如伊丽莎白一世。
但这句台词出现在全片莫名其妙在一个劲澄清安室的女性关系的桥段之后，比起提升安室人格魅力，倒不如说更给人一种官方在疯狂解释安室没有bgcp请各位粉丝安心的感觉，因此并没有什么感动只让人觉得突兀且苍白到搞笑...",2
0,27110363,名侦探柯南·零的执行人,{莫热},xztiya,推荐,2018-06-26,10:18:55,柯南M22，剧情紧凑、互相窃听的戏码让我们见识到了另一个和柯南平起平坐的男人安室透。樱井武晴之前担任编剧的M17、M19、M20三部戏都糟透了，这次难得回归到水准以上。电影最后十分钟安室透飙车+柯南的道具发威，我突然意识到夸张性已成为系列独特传统的一部分。期待M23的新加坡之旅。2018年6月GV观影,4
0,27110363,名侦探柯南·零的执行人,三日月雫,nicoleyue,推荐,2019-06-30,02:25:20,看到最后终于知道安室为啥是日本战狼了，我的恋人是这个国家ˊ_>ˋ一边吐槽一边笑着看完了，飙车那段我真的很担心柯南会吐了_(:з」∠)_日本战狼真的帅啊！！！,3
0,27110363,名侦探柯南·零的执行人,JoeyLu陆柏宇,lubaiyu,推荐,2018-11-10,00:06:07,这是我看过的最精彩的柯南剧场版！,1
1,27110363,名侦探柯南·零的执行人,LORENZO 洛伦佐,vividtime,较差,2019-05-31,07:36:21,真可怕，真敢编。,0
1,27110363,名侦探柯南·零的执行人,Kowloon Tong,Michellekids,还行,2018-11-10,17:45:30,我的恋人 是这个国家 哈哈哈 ,2
1,27110363,名侦探柯南·零的执行人,Sailor Meow,catvoldemort,还行,2019-05-26,15:07:24,［我的恋人是国家］，这不是吴京的台词吗，话说柯南才是end credit scene鼻祖,1
1,27110363,名侦探柯南·零的执行人,蓑笠翁,75889502,较差,2018-11-10,10:04:26,我还以为安室要说他的恋人是他的车车,4
1,27110363,名侦探柯南·零的执行人,The Wanted,abbyabbiesendoh,还行,2018-11-17,13:27:25,M22，没抱太大希望，最近主线也不清楚了，看到妃和小五郎还是很开心的,0
1,27110363,名侦探柯南·零的执行人,发条橙,Duansiyu_1996,较差,2018-11-11,18:14:07,第一次在电影院看柯南，挺无聊的，和小时候的画风不太一样啊，类型杂糅，几乎摒弃了引以为傲的重推理特色，完全就是按好莱坞动作片模式拍的特工片啊，不伦不类的，不过也能看出来借鉴了其很多热门大片。喂！你的初心呢？！不如改名叫《名特工柯南》吧！,1
1,27110363,名侦探柯南·零的执行人,451½°F™,wanger0619,很差,2019-09-18,14:38:13,彻底放弃推理，走近年来风靡日剧的「大场面惊悚动作」+「忠奸人的心路历程」，只是柯南这个偏低幼向的动画中的各种人设与此类型完全不搭配，才会出现极度低能和反智反逻辑的剧情推进，甚至可谓是魔幻的超能动作片。,0
1,27110363,名侦探柯南·零的执行人,水星人阿嘭嘭,sherrypeng0204,较差,2018-11-10,14:42:07,为何不让安室透和赤井搞基，反而要让他说出“我的恋人就是这个国家”这种羞耻的台词！结尾动作戏再一次超越了反牛顿巅峰，编剧算你狠。。。“我们都是小侦探的协助人呀”柯哀发糖好甜！,2
1,27110363,名侦探柯南·零的执行人,马上到站,liyudong,较差,2018-11-15,14:04:00,柯南（新一）还没有明白吗？就因为有你在身边，小兰才会随时陷入危险啊！,1
1,27110363,名侦探柯南·零的执行人,张博,139273582,还行,2019-07-10,00:19:38,关注网络犯罪了，可是身为检察官造成这么大的损失，理由也太牵强了吧。,1
1,27110363,名侦探柯南·零的执行人,ibelieve,ibelieve,较差,2019-01-05,23:58:15,没有怪盗基德的剧场版都不值一看。,0
1,27110363,名侦探柯南·零的执行人,刘小青,liuqing2009,还行,2018-11-10,00:02:24,套路,0
1,27110363,名侦探柯南·零的执行人,非编码Postdoc,QKeenACl.,力荐,2018-12-03,02:36:27,打五星完全为情怀...实际真心不好看！总算是福山雅治ED加一🌟！！,1
1,27110363,名侦探柯南·零的执行人,踢迩达,tildali1214,还行,2018-11-11,02:38:16,我jiao得这不是推理，这是特技片+一点主旋律。,1
1,27110363,名侦探柯南·零的执行人,Ying_0111,53021898,还行,2018-11-09,17:59:17,我也真的没想到能听到“我的恋人是这个国家”这样的台词。安室开车技术突破天际233,1
1,27110363,名侦探柯南·零的执行人,Syfannn,syfan,较差,2018-11-21,21:11:30,一不喜欢黄毛，二不喜欢黑皮，三不喜欢戴眼镜的，国民老公安室透占了两项。前四十分钟太无聊了，家国大义也莫名其妙，不好好探案搞什么呢。,0
1,27110363,名侦探柯南·零的执行人,微喵的兔姑娘,dianxincha,较差,2019-02-25,16:19:15,柯南系列越拍越无语(¯―¯٥),0
1,27110363,名侦探柯南·零的执行人,Mellr,proths,还行,2018-11-17,22:57:18,为了你我甘愿与整个世界为敌。为了给你报仇，哪怕牺牲掉再多的人我也愿意。检查长对231的那感情那明明是深沉的爱啊。,1
1,27110363,名侦探柯南·零的执行人,西四小二,singorcry,还行,2018-11-11,12:59:39,虽然一直长不大，但时刻紧跟时代变化，甚至走在时代前面，比如物联网攻击。,2
1,27110363,名侦探柯南·零的执行人,跑_真的跑不动,bedlamsocks,较差,2018-11-09,18:00:06,不行 我要回家看贝克街的亡灵了,2
1,27110363,名侦探柯南·零的执行人,荆棘,AlohA0407,很差,2018-11-11,10:45:04,前面无聊到困的睡着，结尾一句“我的恋人就是这个国家”，吓到差点从沙发掉下去… 这是柯南吗哈？？,1
1,27110363,名侦探柯南·零的执行人,猫泰萌,Psycho_L,还行,2018-11-12,22:39:23,同样是飞车戏 我开始怀念通往天国的倒计时 兰的勇敢 哀的冷静 那时足球还不能迎击飞行器 只能击碎玻璃保护当时最想保护的人 而已,3
1,27110363,名侦探柯南·零的执行人,hexdiad,58972281,较差,2018-11-11,14:04:48,我对于足球踢卫星，一百万亿焦耳的脚力表示完全不能理解。,1
1,27110363,名侦探柯南·零的执行人,Ｍ．,meifyrt,还行,2019-08-24,20:16:45,职业病1/3就看出来了IoT和动机。嗯，大场面的事已经见怪不怪了，柯学，懂的。本集我们接着看到了我女朋友的爸爸就是我爸爸，他的事就是她的事就是我的事，狗粮杠杠的。把所有人疏散到一个塔里这flag估计看电影的小朋友都懂。好基友为了洗衣机把车开成那样了，最后还说什么我的恋人是国家，那一个意味深长的停顿难道不就是表白么（不用来腐国我也是这么想的，hmmm,0
1,27110363,名侦探柯南·零的执行人,沈辛成很枯燥🐝,krisshen,较差,2020-04-29,21:31:00,“我的恋人是这个国家”…这话太牛 标记一下…,2
1,27110363,名侦探柯南·零的执行人,來福家的嘯穹,Yichun_D,还行,2018-11-09,22:26:43,动画我是追不动了，不过每年的剧场版再烂也是要看的，反正一年比一年反人类，柯南已经不是以前那个柯南了……本次重点！安室透还没有女盆友！但不排除他有男盆友呀诶嘿嘿(￣∇￣)安室透的手指加一星，那个动作简直太撩了啊啊啊啊啊啊下一部基德粗线超期待！,1
1,27110363,名侦探柯南·零的执行人,坂田仙,bantianxian,还行,2018-10-13,20:20:57,前面一小时可以直接睡过去 没有安室的部分要多无聊有多无聊,1
1,27110363,名侦探柯南·零的执行人,微霄,asukay,,2018-11-10,21:52:35,安室说他的恋人是国家，真是非常核心价值观了，根正苗红。,1
1,27110363,名侦探柯南·零的执行人,Stay alive❤️,ironCC,还行,2018-11-11,20:11:32,脱离主线很久了，哈哈哈，虽然槽点太多，安室透的恋人是国家也太emmmmm行吧~双十一和基友一起看也还蛮开心的，明年是KID~可以期待一下,1
1,27110363,名侦探柯南·零的执行人,安布的英国时间,ambrosia.levine,较差,2018-11-09,23:41:09,不是，我说，看完一个礼拜就忘记剧情了，到底是剧情太渣还是我记性太差？,1
1,27110363,名侦探柯南·零的执行人,咸蛋煮稀饭,156461979,还行,2018-10-16,23:07:37,安室：我的恋人是这个国家。真是很正能量呢,1
1,27110363,名侦探柯南·零的执行人,yum,yumm0590,推荐,2018-10-25,13:13:16,"被前两年的剧场版拉低了预期，所以选择跑步的时候顺便看，态度潦草至极。似乎没有那么""强行""""刻意""，出场任务比以前少，故事线也简单，爆点都是英雄动作戏。还挺适合不用思考的状态的。算是触底反弹制作了吧，加一星。",0
1,27110363,名侦探柯南·零的执行人,小檠的罗宾熊,amemiki,还行,2022-04-05,01:20:20,四角恋引发的闹剧（bushi😑羽场的配音听着有点棒读特别出戏。。。影像合成是拿阿笠博士家墙头当绿幕吗emmmm全片不论对公安形象的塑造还是阿姆罗个人（表白不算。。。）的描写，都没有印象深刻的点，矛盾冲突只流于表面；至于犯人和他的动机弱爆了好吗😂现在对剧场版的期待只剩下看柯哀互动（喜欢服部平次也能塌房是我万万没想到的😑最后的动作戏。。。呃。。。阿姆罗救柯南完胜柯南救小兰。。。另外妃英理对毛利lsp如此长情也是我万万没想到的🌚,0
1,27110363,名侦探柯南·零的执行人,阿怪,zcs1222,还行,2018-11-11,22:47:40,燃是燃，但感觉柯南剧场版越来越鬼扯，安室透飙车那里是去偷偷学了杂技吗？？？,1
1,27110363,名侦探柯南·零的执行人,地瓜的包包,56955441,推荐,2018-11-10,13:44:22,"二刷回来，心疼小五郎背锅侠。中国市场口碑不好有很大一部分原因是搞不懂日本公安部和协助人的关系吧，国情不同没有共鸣。检察官对二三一的感情恐怕不一般，为了你我愿意与全世界为敌。另外现在全宇宙最强的男人是柯南还是巨石强森？
",1
1,27110363,名侦探柯南·零的执行人,Lithium,135914847,很差,2018-11-12,01:42:37,什么傻逼玩意。堪称抗日神剧，剧情逻辑动作逻辑全都没有，用脚写的剧本，做画崩坏，掉帧，最后生生被傻逼给逗笑了，,1
1,27110363,名侦探柯南·零的执行人,依西比,47873866,较差,2018-11-16,23:42:23,2018 11 14 和jhb看的 难得来看下柯南剧场 真是支离破碎 看完了也没明白到底为什么要努力吹日本公安警察 为什么2018年了建筑和室内的场景绘制这么vintage……各种粗糙建模贴图和渐变色……,1
1,27110363,名侦探柯南·零的执行人,Mamacita117,139657634,很差,2018-10-21,15:33:37,我这个柯南的粉丝都不好意思护犊子了，一个侦探片连最基本的脸面都不要了，推理全靠大脑特效加音效，连死个人这种尊重都不见了，一个手机就能控制卫星实施精准打击地面目标，一个小学生一个足球就可以让导弹级别的攻击偏离轨道，就算我当你神仙打架不管逻辑，那——我的恋人是国家，元太光彦步美，守护国家的重任交给你们了，这种逗比台词是谁想出来的？一个国家的安全需要一群小学生守护？时代不同了，柯南也需要与时俱进了，再守着已经枯朽的木，定是不可雕啊。,2
1,27110363,名侦探柯南·零的执行人,烈焰红唇龙,lovehans,还行,2019-03-25,23:34:20,我的爱人是国家，笑尿。,0
1,27110363,名侦探柯南·零的执行人,火火：警cha,hs1127,推荐,2018-11-14,17:13:42,柯南要飞起来了。。hohoho,0
1,27110363,名侦探柯南·零的执行人,烏滌非,bogjebote,较差,2018-12-08,22:41:39,論柯南劇場版的多拉馬SP化。,0
1,27110363,名侦探柯南·零的执行人,elizabey,linsuhby,力荐,2018-11-27,23:26:41,我对《零的执行人》有一种看美队三一样夸也不行骂也不行一言难尽的感觉……不过这次揭露真相的时候确实完全猜不到……虽然我很喜欢降谷零/安室透这个角色但仍然不认为为了让爆炸立案就伪造嫌疑人的行为是正确的，名柯正片人设别往剧场版这个走不然他警校四个兄弟大概能气活过来……除了部分稍微太扯的特技镜头我觉得全片都很好。就……零执的后劲儿蛮大的，现在还想吹……鉴于樱井武晴以往编剧的贵柯剧场版都非常牙白我有理由相信是立川让拯救了这一部……（等我去补一补他的其他作品看是不是这样的）（立川导演救救绀青之拳吧我现在还真不想贵柯糊）,0
1,27110363,名侦探柯南·零的执行人,Aorta,Hennessy_,还行,2018-11-09,16:04:38,2.5格局真的好大…反物理定律可以说是很爽了。而且安室透单身啊！！！！！！！！,1
1,27110363,名侦探柯南·零的执行人,叽叽,lvhobbitdarren,较差,2018-11-11,14:24:38,之后在毒液里也看到无人机，还以为是柯南续集。,1
1,27110363,名侦探柯南·零的执行人,空欢,178351079,较差,2018-11-13,22:46:09,牛顿:柯南里面的引力不归我管。,2
1,27110363,名侦探柯南·零的执行人,一小片,yujinwen,还行,2018-12-17,11:55:43,片尾的真实场景让人印象深刻，物联网恐怖袭击有点时髦哈哈哈,0
1,27110363,名侦探柯南·零的执行人,超人叔叔,chaorenshushu,还行,2018-10-16,00:23:26,无人机显威 飙车太疯狂,0
1,27110363,名侦探柯南·零的执行人,少年游罐头,108328665,还行,2018-11-13,13:22:06,为情怀看的。。到最后真的被愚蠢笑傻。。。下一集柯南要去大战哥斯拉了吧。。。。,1
1,27110363,名侦探柯南·零的执行人,安蓝·怪伯爵𓆝𓆟𓆜,along,还行,2018-12-22,09:54:24,基德要来啦,0
1,27110363,名侦探柯南·零的执行人,Grace云端,144131193,推荐,2018-11-09,22:57:57,"安室锅锅炒鸡撩！
贡献了一段热血车技以后“我的恋人是，，，”差点没忍住在电影院吹口哨～
哈哈哈哈哈，，，",1
1,27110363,名侦探柯南·零的执行人,贡丸猩猩,66331142,还行,2018-11-10,18:01:52,在影院当安室透说“我的恋人是国家”的时候都没有人笑？！我憋笑的要岔气了好嘛！,1
1,27110363,名侦探柯南·零的执行人,雪之哀,sherho,还行,2018-11-10,20:55:42,日本战狼名不虚传，我还是更喜欢关西那个小黑皮,1
1,27110363,名侦探柯南·零的执行人,墙上的寻人启事,sludge000,较差,2018-12-17,13:02:27,Hello？是想开辟柯南宇宙吗？,1
1,27110363,名侦探柯南·零的执行人,鸡块,cangzhenwsl,较差,2018-10-28,15:49:12,啥玩意儿啊？这还能有好评吗？毫无逻辑，炸个警视厅需要入侵NASA吗？？直接炸不好吗？？那么大阵仗就为了这么无聊的事？Hello? 完后整个国家的命运就掌握在民间发明家和小孩手里？另外真实的烦死安室透这个角色了，可以让他死掉吗？,3
1,27110363,名侦探柯南·零的执行人,Berlinda,135327014,较差,2018-11-24,23:21:54,第一次到电影院看名侦探柯南，看完我只想说：太TM扯了！一个警察，为了他的“协助人”（我理解的大概类似于卧底之类的角色）报仇，搞出了一场恐怖袭击，搭上了那么多人的性命，扯上了美国航天局，还要让航天器坠落，毁掉整个警察厅，结果被三个小学生玩无人机拯救了。整个阵仗如此之大，最后他说他是为了心中的正义（中途晃了下神，不知道记错没有），问题是那个卧底其实根本没有死，噗！真是够够的了！还有最后安室的那句，我的恋人是这个国家，更是扯出了天际！飙车戏我已经无力吐槽了！怎么？名侦探柯南想向动作片发展？！我一直以来的概念是，剧本不管怎么乱编，主线必须是成立的，是符合逻辑的，没有这个前提条件，你想阐述的主旨就算再真实再感人也得不到共鸣，没有什么鬼用！,1
1,27110363,名侦探柯南·零的执行人,广目无双,67962053,力荐,2018-11-19,21:46:58,史上最高调卧底，没有之一。车技高超，一个打着四份工的男人......,1
1,27110363,名侦探柯南·零的执行人,🍀again 😸,a371623866,较差,2018-12-18,10:04:03,安室透降谷零【樱井武晴求放过】战狼版的发言  还我黑衣组织 【琴酒 ：我的恋人是这个组织】,0
1,27110363,名侦探柯南·零的执行人,したっけの意味,174557505,力荐,2018-11-10,00:40:37,并没有，上映之前听闻的那么差，起码比前几部好，向日葵和11人前锋，老老实实垫底。。。,2
1,27110363,名侦探柯南·零的执行人,一一,takumiya,较差,2018-11-27,18:04:32,咩哈哈哈哈,0
1,27110363,名侦探柯南·零的执行人,乾坤z,zhuream,还行,2018-10-17,21:36:13,所以，黑衣人组织，真正做业务的人员还剩几个…,1
1,27110363,名侦探柯南·零的执行人,粪海狂蛆,yibaiwushitian,很差,2018-11-15,16:41:15,2B少年轰轰轰,0
1,27110363,名侦探柯南·零的执行人,Vermillion,43627642,推荐,2018-11-11,17:49:53,已经是这几年比较好的一部了 （安室透居然还是单身,1
1,27110363,名侦探柯南·零的执行人,秋熙,sakuras1412,,2018-11-15,20:56:59,年度土味情话（冷漠脸,0
1,27110363,名侦探柯南·零的执行人,特立独行的猪,144921929,还行,2018-11-09,19:27:28,明年柯南会不会射日……,2
1,27110363,名侦探柯南·零的执行人,Saudade,108605652,较差,2018-11-13,11:01:07,这已经不是悬疑推理片了，动作片也不敢这样拍，只能是超级英雄电影才能这样反物理飙车了。安室透就是日本战狼！,2
