page_index,movie_id,title,username,user_id,rating,date,time,comment,useful_count
1,27110363,名侦探柯南·零的执行人,大罗,Gu_li,还行,2018-08-29,02:14:35,为什么配音阵容全换了？？听着尴尬，让人感觉这已经不是柯南了……,1
1,27110363,名侦探柯南·零的执行人,宅拾叁,gongzitian,还行,2018-09-07,09:55:26,柯南竟然真的有推理！,0
1,27110363,名侦探柯南·零的执行人,潇湘风筝,shmily-1987,推荐,2018-04-15,20:28:32,个人更喜欢去年的画面美感，今年宇宙什么的可能男生会比较喜欢。安室那句国家就是恋人我都喷了好不好。上户彩配音还不错。,3
1,27110363,名侦探柯南·零的执行人,CL,CaptainL,较差,2019-03-28,19:18:51,这个动机真的。。。不过竟然被安室帅到一下。。,1
1,27110363,名侦探柯南·零的执行人,Asa,59053296,较差,2018-11-09,21:18:06,安室透人气这么高是因为他爱国吗？,1
1,27110363,名侦探柯南·零的执行人,L²,Alcor,,2018-11-08,04:50:43,只能有一个黑的人 还我服部平次！,1
1,27110363,名侦探柯南·零的执行人,周沐君,mujun_soc,还行,2018-11-09,22:26:27,感觉高山南的声音也开始苍老了。,2
1,27110363,名侦探柯南·零的执行人,Fran,genggeng,较差,2019-03-06,22:08:41,在去程飞机上看一半睡着惹…回程接着看…,0
1,27110363,名侦探柯南·零的执行人,布拉德痞特儿,63785743,较差,2018-11-21,19:54:32,剧场版已经越来越夸张了，柯南的滑板、安室的驾驶技术可以甩世界冠军好几条街了。还有这越发高端的剧情元素让我实在消化不了，我只想安静地看柯南推理。。,0
1,27110363,名侦探柯南·零的执行人,但丁的方舟,47701435,还行,2018-12-10,01:35:23,场面细节越来越夸张毕竟也不是陡转而是渐变。除了动机牵强，手法含混，推理弱化……比起之前的剧场版，这部倒不算固步自封、强行年货。它又用上了一些不太能马上搞明白的新概念，当然也升级了事件。个人最喜欢的一直是初中专门买DVD的6、7两部，多次放进光驱安静观看的快乐至今未忘。然而看着一些其实二十多年没变过的桥段，比如末尾新兰精神连线，比如一发足球解决案件或拯救世界，比如片尾曲会放现实参照的实景影像……突然在想，比起柯南的变化，变得更快更大更多的，明明本来就是看柯南的我们啊。。恰恰由于它一直存在从未中断，便成了最佳参照物，当从中再找不到曾经的感觉和心情，每年的第一反应就都是吐槽。人的本能却总是会盯着外物、避开自己的。也突然觉得，明年再看柯南剧场版的时候，也许我就会既无期待也无不满，完全释怀与纯粹了吧。,1
1,27110363,名侦探柯南·零的执行人,Escape Master,140627006,还行,2018-10-17,01:17:51,原以为没有比柯南的滑板技术更反物理了的 知道我见识了安室透的车技,1
1,27110363,名侦探柯南·零的执行人,L.SCAT,duoduo600,还行,2018-11-12,00:59:15,三分给情怀。,1
1,27110363,名侦探柯南·零的执行人,Fleurs.哼哼,56922790,还行,2018-11-14,20:07:28,期待阈值太低，居然感觉还凑合，毕竟从小立志是长大成为工藤新一的啊。,1
1,27110363,名侦探柯南·零的执行人,zhtfan,63141473,还行,2018-04-14,23:26:15,动作场面依然火爆，而一如既往的“草菅人命”是近几年的剧场版最让我不舒服的地方。推理方面乏善可陈，动机中二，人物无论老幼基本都偏热血幼稚型，已不是脸谱化可以涵盖的了。这么多年下来，剧场版早已脱离本格推理，坚持走商业大片的路线，其结果是票房越来越好了。这就是现实。,8
1,27110363,名侦探柯南·零的执行人,夏日扬帆,dennisummer,还行,2018-08-02,22:23:26,ANA，五星航空，飞机上就有新剧场版，英文字幕一知半解又怎样，反正主要是冲着超人柯去的……,1
1,27110363,名侦探柯南·零的执行人,很好很会吃米,howlongisyoyo,较差,2018-11-12,20:55:44,什么鬼东西,0
1,27110363,名侦探柯南·零的执行人,不要关注我刷屏,76496998,较差,2018-11-10,14:45:55,糟糕的台词糟糕的爱情（即便这样，滚筒洗衣机和安室的cp，还有羽场和日下部的cp，我嗑爆,1
1,27110363,名侦探柯南·零的执行人,sleepingbeauty,stephy0627,较差,2018-12-29,21:30:03,看了半天没看懂而且这次动画有点糙啊,0
1,27110363,名侦探柯南·零的执行人,馒小头,manxiaotou,还行,2018-10-07,14:27:41,看的韩语配音的 听的很难受了 但是其实也没有特好看😂可能我对这种剧情不敢兴趣吧 多来点和哀兰的互动不行吗,1
1,27110363,名侦探柯南·零的执行人,NARUMI,cxy007,,2018-11-11,10:45:22,凉风版,0
1,27110363,名侦探柯南·零的执行人,⽄⽄计较,atreides1030,还行,2018-11-10,21:39:08,波本似被京神附体：“我的恋人是这个国家。”（…）基本可以当成全员逗哏的喜剧来看。没有用足球直接击落卫星，差评。,2
1,27110363,名侦探柯南·零的执行人,咖喱娜,galina,还行,2018-12-29,12:53:30,“我的恋人，是这个国家！”哈哈哈哈哈哈哈哈哈哈哈哈哈哈哈哈哈哈哈哈哈,0
1,27110363,名侦探柯南·零的执行人,腻歪,cyishere,推荐,2018-11-12,22:00:06,不愧是成熟的创作团队，故事一如既往地环环相扣，几乎没有废笔。那些说什么物理原理的就算了吧，柯南从来都是不是写实派，否则「柯南」就不存在了不是嘛。,0
1,27110363,名侦探柯南·零的执行人,Akai,65608346,,2018-11-03,16:05:39,老了老了，不能看柯南了。柯南长不大，可我是真老了。就当看着玩，回忆杀吧。,1
1,27110363,名侦探柯南·零的执行人,醉梦·聊生,69807491,还行,2019-03-02,22:07:59,破案兼名词解释，公安警察与公安检察，事故与事件，协助者，网络操控电器制造袭击，安室兄的车技威炸天，最后柯南那一脚凌空抽射也拽到不行，可乐那些被蒙在鼓里的孩子以为玩无人机结果成了大救星，说明协助者无所不在，也万万不可或缺。,0
1,27110363,名侦探柯南·零的执行人,一口一个小饼干,71586138,推荐,2018-11-17,22:43:55,站在二次元的角度来看真违和，但是如果把环境替换成好莱坞电影呢，再说了，要说难看，哪一部都没向日葵难看，除了231和律师的感情线要扣一分，其他的我都要怒赞，我要吹爆安室透！还有，没有最后时刻生离死别的老梗真是太好了！ps:感觉好像不经意间cue了99.9刑事律师。,1
1,27110363,名侦探柯南·零的执行人,仰望星空不好吃,xinziai,较差,2018-10-20,11:50:39,黑人问号？？？,0
1,27110363,名侦探柯南·零的执行人,电个爆炸头,73046958,较差,2022-09-13,02:46:07,为了那么一点点日常段落还在坚持看新的柯南剧场版的我实则是在追索童年夏季的影子，它一晃而过。,0
1,27110363,名侦探柯南·零的执行人,柒色。,vinvinky,较差,2018-11-17,17:03:04,柯南版速度激情么？,1
1,27110363,名侦探柯南·零的执行人,仁慈的父,Sundancer,推荐,2018-10-02,15:26:44,我都已经把剧场版当作动作片看了，果然，本片堪比天空的遇难船，90分以上的动作片，75分以下的推理片，60分爱情片，节奏超快且紧张，飙车肾上腺素飙升，在电影院看的揪心。英里果然对小五郎还是有感情的，小五郎没睡也是新的展开模式。总之，反物理学柯南也是剧场版的传统了，无力吐槽。,2
1,27110363,名侦探柯南·零的执行人,Link,souryu,较差,2018-11-12,01:36:35,剧情过分了。另外rx7已经不是第一次在柯南剧场版出现了(・∀・),1
1,27110363,名侦探柯南·零的执行人,R·WALKINGDEAD,Ringeril,较差,2019-09-27,00:09:02,我缓缓打出一个？,0
1,27110363,名侦探柯南·零的执行人,纤纤,158629236,较差,2018-11-14,15:59:46,没有啊…柯南破不了的案子，就是不要女朋友…,1
1,27110363,名侦探柯南·零的执行人,堤,65576339,推荐,2018-10-13,22:37:52,来自美国的技术恐惧，来自内部的恐袭威胁，科普日本司法制度并再现了国家紧急状况下的政府运作与世相反映。真实与正义的龃龉还是能做出一些文章的，比较期待后续安室与柯南的直接冲突。2023.1.12重看，确实是剧场版里作者性最强的一部，期待M26.,0
1,27110363,名侦探柯南·零的执行人,极圈里的燕鱼,72002197,较差,2018-11-09,23:01:46,场景之间割裂感很强，每一段都想做成大片，却给人感觉是各自为战，又生硬地加进来很多故弄玄虚的文艺和意识流，结果就弄得像是三流动作片和国产青春片的结合体。无论是台词还是剧情都很牵强，少年侦探队的父母可能是幕后投资人，强行加戏份无敌尴尬，既然上升到保卫国家这个层面了就别让孩子们往前凑合了，他们真的爬不上去。主打的动作场面倒是挺燃，也还好我是纯文科出身，要不然看出更多违反物理的地方也许会更不得劲。影厅中的最高潮居然是来自下集预告中基德一闪而过的身影。不过影院气氛是真棒，笑声和惊呼声此起彼伏，散场时也有很多惆怅和惋惜。很久没有排长队检票进场的电影了，第一次坐在影院第一排，第一次银幕完全黑掉才起身，第一次起身离开时回头发现居然还有整个影厅的人陪自己。这张票，敬陪我近二十年的柯南，也敬我自己。,0
1,27110363,名侦探柯南·零的执行人,有必要,candyandclouds,推荐,2018-11-14,10:41:55,不知道为什么看得超开心一路爆笑，全部的梗都分毫不差被猜到。出现了安室：哦，又能看见我们透透飙车了嘛！！出现个大楼：哦，这个楼肯定要被炸。出现了峰会然后又出现个会掉进东京湾的卫星：哦，这个卫星肯定要去砸那个峰会。但是一点也不担心，因为唯一能拯救东京的，是一个外表看似普通小孩，实际却身怀三十六项绝技的，超级英雄柯南！（背背佳没有出场太残念了，我想念万能背背佳！,6
1,27110363,名侦探柯南·零的执行人,Suito,Suito,较差,2018-11-11,21:25:52,看完我表示只想砍死樱井武晴，这都编的什么沙雕剧情啊。。,0
1,27110363,名侦探柯南·零的执行人,Vision Rich,66768802,还行,2018-11-09,20:49:21,"在日本，每个公安都有自己的执行人；在我们中国，国安局的执行人应该就是朝阳区人民群众啦！
这一部柯南剧场版中，柯南成功挽救了NASA宇宙卫星坠毁的危机，那么下一次，他会在火星扭转乾坤吗？让我们拭目以待！",2
1,27110363,名侦探柯南·零的执行人,蓦兰,146132050,推荐,2018-11-05,17:24:34,我算是明白规律了，不管你们谁是凶手，小兰都会遇到危险，然后再转危为安…,1
1,27110363,名侦探柯南·零的执行人,风间隼,fengjiansun,较差,2018-11-12,22:45:22,换了导演，风格也有所变化。中间关于公安部的讲解简直太繁琐了，最后的飞车大场面大概是为了让观众票有所值。柯南飞脚踢爆太空船货仓的一瞬，正式进化到超级英雄。,2
1,27110363,名侦探柯南·零的执行人,浮生若梦,nodane,很差,2022-04-11,14:14:06,只想说妈的智障，避难非要哪里高去哪里，不用问nazu天鹅号返航路线，反正小兰在哪里它就飞哪里，不飞新一也硬要把它炸去那里，然后再英雄救美。编剧永远不知道见好就收，如果停在橘自白那里故事就已经很完整了，非要为赋新词强说愁，有病。,0
1,27110363,名侦探柯南·零的执行人,laurenⅢ,listenmumu,较差,2018-12-17,05:24:37,自从国语换了配音就变成了原声和配音都看不下去的情况……,0
1,27110363,名侦探柯南·零的执行人,憨大仁,51342796,还行,2018-11-12,10:48:44,柯南版速度与激情,0
1,27110363,名侦探柯南·零的执行人,娜娜莉,2548698,推荐,2018-11-09,22:00:40,推理约等于没有，然而又有什么关系呢？get到了安室透的苏点嘻嘻,1
1,27110363,名侦探柯南·零的执行人,郁郁,liangyuyu,较差,2018-05-03,21:23:10,柯南越来越流弊了,1
1,27110363,名侦探柯南·零的执行人,沉默,champloo,还行,2018-11-09,16:56:06,柯南这部案情一般偏下，事件比案件精彩。片尾的实景影像好过正片…片尾曲好听，但是没汉化(￣ε(#￣)可看可不看的…彩蛋之后预告了19年基德主角的剧场版,0
1,27110363,名侦探柯南·零的执行人,TheAnglesWept,66172556,较差,2018-12-16,02:35:24,额,0
1,27110363,名侦探柯南·零的执行人,Ron Chan,RonChan,较差,2018-11-10,14:13:03,真的不知道该说什么了，太没柯南的感觉了！,0
1,27110363,名侦探柯南·零的执行人,把我关起来,142383045,较差,2018-11-10,01:46:45,?,0
1,27110363,名侦探柯南·零的执行人,鹤喔,uniking,较差,2018-11-23,01:10:29,怀念那个总在关键时刻刺穿毛利小五郎的柯嬷嬷。,1
1,27110363,名侦探柯南·零的执行人,基努里维斯基,andersoneo,较差,2019-01-05,23:18:51,继续无止境的违背物理学。打卫星还打了两次，第二次就是硬加上的。既然前面已经明确了样本的坠毁地点，而且已经进行了疏散，在即将脱离控制的情况下将样本的轨迹改变到一个不确定的地方，杀伤力岂不是更大？脑子呢？,0
1,27110363,名侦探柯南·零的执行人,九品铲屎官,JingLoo,还行,2022-11-20,20:49:50,我的恋人是这个国家!,0
1,27110363,名侦探柯南·零的执行人,希锐亚,xxxcjr,还行,2018-11-16,22:31:01,开头还行，但是在结尾强行反转再反转就没意思了，有画蛇添足之嫌。如果把它当动作片看，它的动作画得并不好。,0
1,27110363,名侦探柯南·零的执行人,无事公,64225096,还行,2018-12-01,01:14:15,https://movie.douban.com/review/9793907/,0
1,27110363,名侦探柯南·零的执行人,眯着眼的偎灶猫,60664918,较差,2018-10-14,22:34:06,基本跟悬疑没啥关系。。。我的恋人是祖国什么的，算是尬聊了吧？😂,0
1,27110363,名侦探柯南·零的执行人,Kello,Luna_apo,力荐,2018-11-11,14:33:52,这就是law school special version嘛,1
1,27110363,名侦探柯南·零的执行人,某某,35420141,推荐,2018-09-03,15:55:20,柯南近期的剧场版有在进步，故事内容丰富，情节相对紧凑，但还是达不到贝克街的亡灵那个程度，故事情节里出现的科技真的算是与时俱进的！,2
1,27110363,名侦探柯南·零的执行人,陈永仁,1563045,很差,2019-01-06,08:45:48,推理、动作都不行了，决定直接卖角色,0
1,27110363,名侦探柯南·零的执行人,人民南路壹号,60911277,还行,2018-08-28,17:55:17,今年的柯南80%的文戏，虽然动作戏依旧夸张，不过有推理剧情智商在线也算难得了。唯一觉得意外的是之前看纯黑以为安室透只是一个孤立无援的公安小卧底，没想到这次竟然权利这么大，话说你和警方联系这么紧密就不怕被黑衣组织发现吗？,2
1,27110363,名侦探柯南·零的执行人,小柚子×旅行家,2713839,较差,2019-07-03,10:17:34,反物理的又一杰作。答应我，牛顿棺材板大家一起来帮着按，好么...,0
1,27110363,名侦探柯南·零的执行人,多看电影爱电影,155985816,力荐,2018-11-14,16:03:37,对日本的司法系统挺有了解的，很不错，挺好看的！结尾也是一如既往的温情！,1
1,27110363,名侦探柯南·零的执行人,Silvyu,silvio0924,较差,2022-05-15,07:20:04,"这一部真是有史以来最离谱的一部了……赛博朋克风了属于是
要是日本公安部都是这个德行，那日本和autocracia也没什么区别",0
1,27110363,名侦探柯南·零的执行人,口袋_肥力士,yukiyuko,较差,2019-06-23,21:10:19,现在的柯南剧场版明明就是日版的反向手撕鬼子风。越来越难看==,1
1,27110363,名侦探柯南·零的执行人,hello1810,57618345,力荐,2018-11-14,08:11:34,柯南安室在一起算了，这也算是拯救国家啊。,0
1,27110363,名侦探柯南·零的执行人,朝阳区妻夫木聪,Invisible___,很差,2018-10-15,23:30:57,观众朋友们大家好，一年一度的柯南侠大型粉丝见面会到此结束，我们明年再会。（从来没想到我也有给柯南打一星的时候，两个小时不知道自己看了个啥，立川让首次监督的剧场版甚至都没法用扑街来形容。）,2
1,27110363,名侦探柯南·零的执行人,momo,37472433,还行,2018-12-09,22:31:19,建的那么好看可以炸一炸，这个弧线可以滑一下。炸了但没滑，滑板少年没有充分利用场地啊。,0
1,27110363,名侦探柯南·零的执行人,QQ虾,lbb0712,还行,2018-11-10,23:34:27,安室怕不是日本战狼吧 2018.11.10 16:55 长沙中影星美国际影城万家丽店,1
1,27110363,名侦探柯南·零的执行人,♬暮光♪,121335945,力荐,2021-12-12,15:43:54,以独立的动漫电影来说是好看的，最后五分钟的商业化动作戏过于明显，还好樱井武晴这部没有过度刻意拗人设,0
1,27110363,名侦探柯南·零的执行人,"✿, Sillage",sillage_dm,还行,2018-11-10,00:05:33,我大柯南已经厉害到要飞出地球了  哈哈哈哈哈   期待明年的有我基德～,1
1,27110363,名侦探柯南·零的执行人,THELMA,44529408,还行,2018-08-31,16:04:08,越来越有同人和中二气息，仿佛看了一部杰拉德.巴特勒的《xx陷落》系列电影，连水准也都不相上下。无比怀念两位已在天国的编剧。,0
1,27110363,名侦探柯南·零的执行人,地铁里的季风,chengxiao_zhang,还行,2018-11-13,22:02:42,恋人是国家，这么中二的词也会出现。飞车飙得连特技演员尝试无数次都做不到啊,0
1,27110363,名侦探柯南·零的执行人,一勺司米酱。,summer907,推荐,2018-04-14,23:51:06,最近研修太累了，做进椅子就睡着了……2018414 toho新宿 会二刷,2
1,27110363,名侦探柯南·零的执行人,巨星泡饭,redvon,还行,2018-11-13,22:54:30,天真的孩子们。。。要不是柯南未成年，我觉得他想自己去开那台跑车。。这部都已经跟太空有关了，我觉得下一部可能要上天。。,0
1,27110363,名侦探柯南·零的执行人,Anondot,anonymousor,很差,2018-11-17,18:53:16,再也回不到贝克街亡灵的高度了，敷衍了事完全不走心,0
1,27110363,名侦探柯南·零的执行人,鹌鹑之丘白桃挞,cozy421,还行,2018-11-10,00:34:19,二十年柯南深粉混入只有三个高中女生的下午场观看，大银幕体验良好，近十年剧场版最令人诟病的“悬疑推理向→特工灾难向”的问题在出色的视效衬托下，显得不那么突出了。动作场面依然遵循了“柯南反重力原则”，进入推理解谜环节后，剧情反而沉闷，没有强烈的新兰爱情线，不太满意。片尾曲是泥轰万人迷福山雅治叔词曲唱作一手包办的，仅听完ed便值回票价，何况M23发布预告中，有！基！德！,1
1,27110363,名侦探柯南·零的执行人,小熊饼干流眼泪,sophie125,较差,2018-11-23,00:58:51,这部讲的是阿笠博士的奇怪发明救了日本。P.S.安室透暗恋柯南到这个地步了，心疼小五郎叔叔。,0
1,27110363,名侦探柯南·零的执行人,stknight,stknight,较差,2020-11-05,00:16:40,剧场版第22部，这集炸的挺早,0
1,27110363,名侦探柯南·零的执行人,daodao125,155788363,还行,2018-11-27,13:54:30,柯南：360行行行都行,1
1,27110363,名侦探柯南·零的执行人,恶隐息烙,misink,还行,2018-10-23,23:11:22,编剧你吃顶了吧，虽然是动画也不用搞成魔幻片吧。柯南这个系列真的得收了，一部部剧场版什么鬼，目标观众到底是什么人啊角色关系成人向冲突趣味子供向,0
1,27110363,名侦探柯南·零的执行人,不如归去,blueether,较差,2019-05-25,23:57:53,……逻辑感人,0
1,27110363,名侦探柯南·零的执行人,__酉卒 目艮__,jaymi,较差,2019-02-02,10:19:36,鸡肋,0
1,27110363,名侦探柯南·零的执行人,我不是大哥哥,dagege,还行,2018-12-24,21:50:20,柯南估计有16块腹肌吧，不然怎么在高空中失重下，还踢出那么有力的球！,0
1,27110363,名侦探柯南·零的执行人,BIBI,140434240,还行,2018-10-04,12:41:23,有向日葵垫底，这场算好看的。安室真的很帅就是脸黑了点，恋人是国家这种台词真的是太扯了，所以安室不能有cp吗？最后车技秀得Dom都要羞愧。反派三观真感人。每次看到柯南反物理的足球跟滑板我就脑子疼。甚至很期待毛利这个sb坐几天牢。,2
1,27110363,名侦探柯南·零的执行人,(눈_눈),erika-3104,还行,2018-10-13,17:30:54,我的恋人是国家.....,0
1,27110363,名侦探柯南·零的执行人,叩歌,62604143,较差,2018-08-31,15:00:50,1、警察与检察院内斗，搞了个无间道双卧底，那么拙劣能不能别拉上柯南；2、电影时长将近两小时，破案只用了几分钟，案件复杂度还不如番剧，剩下半个小时是无视物理的“拯救世界”，我都明白这个套路了。,0
1,27110363,名侦探柯南·零的执行人,Vermouth .,lanshinoda,较差,2018-11-17,22:41:57,睡着了,0
1,27110363,名侦探柯南·零的执行人,日出可以,75828017,较差,2019-01-16,00:57:44,以前只是情节尬，现在连台词都开始尬了,1
1,27110363,名侦探柯南·零的执行人,Brightsun,32251971,还行,2018-09-11,21:24:41,柯南速度与激情,2
1,27110363,名侦探柯南·零的执行人,瑾朵朵,jinduoduo,还行,2018-12-22,23:10:22,以前还会惊叹：【我操什么鬼？！！！】现在已经哈哈哈哈的当喜剧片看了,0
1,27110363,名侦探柯南·零的执行人,基本是我,4290435,还行,2019-02-11,18:36:06,看不进去。,0
1,27110363,名侦探柯南·零的执行人,阿右,mixvango,还行,2018-11-20,23:43:04,大型日本公务员之警察检察体系科普力作，ps山口胜平的声音已经不是少年，还以为换人了诶，柯南再坚持几年，cv都要换了啊喂,0
1,27110363,名侦探柯南·零的执行人,木笔,102259472,较差,2019-01-31,21:36:14,现在的剧场版几乎没什么推理了，就是各种秀特技、玩情怀，一声叹息。,1
1,27110363,名侦探柯南·零的执行人,慢慢,aseatu,还行,2020-06-08,16:18:56,动作片和透子宣传片,0
1,27110363,名侦探柯南·零的执行人,失忆的鹿芒,132841407,推荐,2018-11-11,22:33:29,"安室！新男神！
这刻意安排的剧情😂不过确实很不错啊
彩蛋，基德成功抢走所有关注",1
1,27110363,名侦探柯南·零的执行人,呐,52075541,还行,2018-11-13,20:57:53,万万没想到看了个007…以及回忆里的小哥哥真是XFXY的男人啊（bushi。小五郎夫妇高甜，美航局锅从天上来，你们自省自己的公检法体系为啥要拉上人家背锅…,1
1,27110363,名侦探柯南·零的执行人,Superhat,hsuperhat,很差,2018-11-10,22:59:21,可怕。专业术语狂轰滥炸，徒有其表，内里全无逻辑，空洞因此根本展不开。中二也得有个度吧。,0
1,27110363,名侦探柯南·零的执行人,噩梦枕头,winter-h,较差,2018-11-10,18:50:46,柯南踩的不是滑板，是牛顿的棺材板；同样，安室透开的也不是车，是编剧残缺的脑洞。推理破案啥的维持近年的水准也不用提了，就恭喜一下柯南又开发了随身地对空导弹吧，武器库越来越丰富了。,0
1,27110363,名侦探柯南·零的执行人,二次元屎宅逗逗,sakura-dango,推荐,2018-11-10,20:10:29,笑得不能自己……,1
1,27110363,名侦探柯南·零的执行人,伊夏🪀,JoGreen,还行,2018-11-13,20:49:13,核心故事太弱了……大场面也有点刻意……,0
1,27110363,名侦探柯南·零的执行人,养喵千日,194803555,还行,2020-08-23,18:23:23,炸高楼轮船已经满足不了了，开始炸卫星了，怀念以前剧场版的质量，现在找不到这种感觉了,2
1,27110363,名侦探柯南·零的执行人,福玻斯,65529304,很差,2018-11-14,23:53:07,之前每年都在骂静野孔文。今年看了立川让执导的柯南剧场版，我决定向静野孔文低头认错。,0
1,27110363,名侦探柯南·零的执行人,小小,xiaoxiaomogu,较差,2018-12-16,21:06:46,真是愁死我了……不给一颗星算给自己一个台阶下。,0
1,27110363,名侦探柯南·零的执行人,南條艾草,yeshunjia,还行,2018-12-16,21:48:34,剧场版二十二,0
1,27110363,名侦探柯南·零的执行人,小蓝酱,50281371,还行,2019-10-05,21:39:07,试图探讨公安警察和公安检察官之间的冲突纠葛，主题挖得深，但剧情太扯了，竟然靠遥控飞机上的炸药就能改变航天器的运行轨迹，最后还来个足球一脚拯救全员，实在过于夸张了......柯南剧场版一部部越来越脱离现实，不是名侦探是魔术师吧,1
1,27110363,名侦探柯南·零的执行人,NuurJannah,NuurJannah,还行,2022-02-25,20:54:45,唉还真是无趣……ごめんね我对日本公安司法啊这些可没什么兴趣……以及果然是樱井武晴！！又以及 大概只有日本人会觉得祖国是他的恋人吧……整体而言不好看 如果不给柯南面子大概只能打1星,0
1,27110363,名侦探柯南·零的执行人,居无间,juwujian,还行,2018-11-01,18:28:49,柯南看得太少，觉得这部还可以。算是个政治片，有科普成分。对于“协助者”，写得还挺丰富。推理部分比较弱，而且最关键的地方，都在第二幕解决完了，并且给了一个“最后一分钟营救”。第三幕居然再来一次“营救”，就与推理脱节，动作戏再精彩，也属于硬来，没啥剧力。,0
