page_index,movie_id,title,username,user_id,rating,date,time,comment,useful_count
2,27621546,小狗奶瓶,风随心动,166422971,还行,2020-06-04,18:22:06,狗狗还是挺可爱的  虽然剧情一般  但是还是被狗感动了(´;︵;`),0
2,27621546,小狗奶瓶,玛卡巴卡的推车,96922908,还行,2018-11-13,16:58:36,不知道为什么国内的爱宠片总是差了日本一点力度 ,0
2,27621546,小狗奶瓶,seve,173434050,,2018-02-03,14:51:34,算是中国版的人狗奇缘吧 狗狗的演技还是很不错的 分别的时候那一回头惊了,0
2,27621546,小狗奶瓶,俊成,193293827,力荐,2021-01-07,00:40:39,很好的电影,0
2,27621546,小狗奶瓶,。,72102149,力荐,2018-11-28,17:41:01,五星给狗狗,0
2,27621546,小狗奶瓶,四胖,209950489,力荐,2022-04-11,19:43:07,四分给奶瓶，一分给剧情。,0
2,27621546,小狗奶瓶,意,260400019,还行,2022-08-04,10:26:40,当时看这部电影的时候哭的稀里哗啦的，奶瓶就一直在等它的主人回来接它，幸好等到了,0
