page_index,movie_id,title,username,user_id,rating,date,time,comment,useful_count
0,27204895,进击的男孩,2046,168844076,较差,2018-12-03,21:36:14,情节不连贯，人物感情不细腻。槽点很多，有一些经典电影的梗，有笑点，但反而让人更出戏。,12
0,27204895,进击的男孩,已注销,163186206,力荐,2018-12-08,14:02:16,看到有李艾，然后就选了这部电影，还可以，拼搏努力坚持，都是我缺少的。加油！！！,12
0,27204895,进击的男孩,weakish,WeakishJiang,很差,2019-02-09,22:42:59,进击的烂片,3
0,27204895,进击的男孩,绿酱啊,lixiaolving,推荐,2019-01-03,21:10:21,三星给电影，一星给大表哥的线下努力。电影很好笑，仿佛看到了大表哥对生活对音乐的热爱。庞瀚辰真的好适合啊！唯一不足是电影衔接有些生硬，仿佛要讲的很多，希望能够拍成系列剧，一定要是庞瀚辰呀，他真的很适合！,3
0,27204895,进击的男孩,蟹不肉,153914660,力荐,2018-12-17,17:01:48,电影不错，学校点映的时候看的，比想象中好很多，虽然没有流量明星，但电影整体和个人的感觉很励志很正，有笑点有泪点，顾好和秦笑分手的时候，我旁边的女生哇的就哭了…,4
0,27204895,进击的男孩,怕冷的白熊,157190708,较差,2018-12-09,18:44:06,少东家内部组织看的青春电影。全是古早梗，当喜剧看吧╮(╯▽╰)╭  。❶第一个梗这个片都没有评分是因为没人看吗哈哈哈哈 ❷演员的演颜艺在屏幕上停留好几秒 我还是喜欢唯美画面 _(:зゝ∠)_ 男主失恋了喝完酒对着镜头吐，一把鼻涕一把眼泪的看的特清楚。❸但是bgm来得很及时╮(╯▽╰)╭  ❹大量的旁白就像昨日青空 ❺还有破产姐妹同款咖啡店的场景,4
0,27204895,进击的男孩,湛如,46653633,较差,2018-12-21,11:49:47,Emmmm?,2
0,27204895,进击的男孩,Amarantine,149353193,,2019-08-04,15:18:29,補記。印象中大概是2017年底或是2018年初看的。時值高中學校校慶，導演作為優秀校友回校做報告，在學校禮堂播放了這部影片。影片本身…恕我直言，慘不忍睹。觀影體驗近乎災難，幾度想要逃走但班級老師學校領導都在邊上，只好耐心熬到結束。但導演性格是真的很好，聽他說來影片也確實費了壹番心思，覺著還是給校友留個面子，不打分了。不過說真的，導演您還是別拍電影了，其實您更適合做主持人。,2
0,27204895,进击的男孩,大脸的小二,59188148,,2018-12-07,11:59:17,拍同志片会好些！,6
0,27204895,进击的男孩,沐棉,anyalone,推荐,2018-12-07,14:21:03,插曲真的还挺好听，一看就是小成本制作，胜在故事还是很接地气，跟我们大学时光还是很像的，无非就是小爱情，小梦想，但是对一生却影响深深，师姐爱师弟~的姐弟恋设定很喜欢~发现李艾还是很会演戏的~男主眼熟小生~电影超预期~三颗星给电影一颗星给导演~,14
0,27204895,进击的男孩,Cardon,41051783,力荐,2018-12-08,15:37:01,看出来国产电影的进步和新生代演员的努力,5
0,27204895,进击的男孩,cnmua👄,167695653,力荐,2018-12-08,18:37:08,男主还蛮帅的 去看了一下微博  微博的照片一言难尽 镜头不知道为啥全程离得很近 连嘴唇干的起皮了都看得到  非常细致哈哈 然后虽然剧情有点老套但依旧能勾起我谈恋爱的想法 然后笑点也还行 还能体会到重复的魅力 少东家孵化大电影 疯狂打call 最后  我要大声喊出来 顾好 我喜欢你,3
0,27204895,进击的男孩,温暖,172519305,较差,2018-12-13,16:30:29,没什么深刻的东西，就像是学生的阶段性作业,2
0,27204895,进击的男孩,北方的海星,52097131,力荐,2018-12-11,19:20:51,太好看了,2
0,27204895,进击的男孩,长梦未央,164845744,力荐,2018-12-09,20:11:03,看到导演了,2
0,27204895,进击的男孩,왕서기,uniqueaaron,还行,2019-02-06,13:51:28,在‘移动电影院’看完这部李艾的电影，女神最真实的一部电影～,1
0,27204895,进击的男孩,奶兴,185096434,推荐,2018-12-18,15:59:13,没有老套的情节，比较小清新，也很温暖，也有点搞笑，那个老姐姐洗澡那里是真的真的很好笑，笑死人了都😂。导演第一次拍就这么厉害很棒啦，未来会越来越好，加油😊😊,2
0,27204895,进击的男孩,莫非杰,mofeijie,还行,2018-12-09,23:08:04,能拍出来就不错了吧？看了好些很深沉的电影，看看这个就简单一乐，简单不伤脑。在这个类别里面，倒不算好。,1
0,27204895,进击的男孩,困子,137972606,很差,2018-12-08,15:18:50,什么玩儿,6
0,27204895,进击的男孩,嗯,189578462,力荐,2019-01-03,22:20:59,"
  
   刚开始是因为李峙的客串去的，排片不多，可谓是一波三折。还好，最终还是看到它了。
    秦笑是大顾好一级的学姐，他们相遇在广播台，学生时代细腻又敏感的小心思终于在顾好做了一次秦笑的大英雄之后有了定局。毕业后残酷的现实和一次次的误会让分手这个词出现在了这段关系中。
    几年以后，相互还爱着，恰好有了走进你在的城市的理由和面对现实的勇气。当然，结局皆大欢喜。
    爱情啊，它会跌跌撞撞的来，在你没有任何准备的时候，只是，希望你，任何时候都不要放弃变成更好的自己，去追赶它，为你们的爱情创造一个永远在一起的理由。
    美好，伤痛，向上，所有年少的爱情里有的都表达的酣畅淋漓。算是为数不多的没有校园欺凌，没有堕胎，没有车祸的文艺励志片。少年，阳光，远方，荷尔蒙。热血澎湃吧。",2
0,27204895,进击的男孩,xxxxxxx,142062026,较差,2018-12-10,22:24:11,一分给男主 一分给导演的卖力演讲,3
0,27204895,进击的男孩,哥布林鲨不努力,68502689,还行,2018-12-09,21:38:15,傻逼似的男主，校园气氛不浓，基本都是给笑点,1
0,27204895,进击的男孩,瘾,190217809,力荐,2019-01-18,12:49:15,最开始接触到庞瀚辰饰演的角色是《为了你我愿意热爱整个世界》里面重情重义的韩东，和这部电影里面饰演的顾好有异曲同工之处，都是重感情，会一直坚持去守护自己心中的那个人。这部电影给我最大的感触不是作为青春剧情里面的恋爱情节，而是他们每个人努力奋斗的过程，可能是与自己经历的有关系吧，当我看到他们一个个为了自己的梦想所做的一切努力真的让人有一种说不出来的感觉。不过的确，现实生活中就是这样，没有一个人可以一帆风顺的成功，总得做一些不起眼的职位，干一些自认为卑微的事情。不过，请不要放弃，要相信自己，不断努力，不断进击，最后总会有你想要的结果。所以，做一个进击的人，永不放弃。,2
0,27204895,进击的男孩,土豆百吃不厌,165183665,较差,2018-12-13,16:35:21,其实吧，我觉得这电影就是属于拿钱练手那种,4
0,27204895,进击的男孩,咕噜咕噜,188766164,力荐,2018-12-16,17:25:26,无堕胎，无车祸，无癌症，只是在叙述青春里一个个平淡而真实的故事，有感动，有欢笑，喜欢顾好认真追梦的样子，喜欢贾涛的搞笑幽默，这个世界的我们啊，没有那种勇气去追逐自己喜欢的东西，而电影带给我们的，除了感动和泪水，还有那份对内心深处的渴望，喜欢就去做啊，管他最后是什么结果，不遗憾就好,2
0,27204895,进击的男孩,是否在发呆,188753351,力荐,2018-12-16,12:15:37,"因为很好，所以很喜欢呀，看过两次了，第二次还是忍不住笑了，也很感动，很喜欢这个结局，开始以为两人要错过的。
很可怜的是它和海王撞档期了，票房不高，不过真的是一部很好的影片呀！
最喜欢的一句话：喜欢一个人就开始变得很低很低，低到尘埃里，然后开出花来。",2
0,27204895,进击的男孩,小旋旋,190228167,力荐,2019-01-18,17:02:36,昨天晚上看的，感觉导演好厉害，看哭了好几次，人生就是要敢爱敢恨，为了自己喜欢的哪个人努力拼搏，不论结果是什么，只要努力过了就不会后悔，看他俩分手的那一段我想起了我自己，哭的撕心裂肺。为了自己那个他，不是也要去拼一把吗，不拼怎麽知道结果，万一结果是好的呢结果很差努力也也不后悔！,2
0,27204895,进击的男孩,_Jongkhurun_,141827023,推荐,2018-12-17,15:12:53,"电影给三星一星给庞瀚辰。
是个很有年代感的青春故事，类似回忆录的形式，节奏非常快所以前期舒服后期情感需要爆发的时候过于平淡。
如果最后不是happy ending我会很喜欢吧。可惜最后的确是。",2
0,27204895,进击的男孩,好的鸭～,188231617,力荐,2018-12-08,09:59:58,"一部朴实又真诚的电影，在电影的搞怪中慢慢看出自己的影子，会笑着笑着便若有所思，最终感慨原来如此。
是啊~我们一生中在不断地遇见，但却也在不断地错过，所能做的也只有珍惜你所珍惜的，做你想做的，等到若干年后，回首往事，可以坦荡地说声：“没有后悔过。”",5
0,27204895,进击的男孩,_傻九,182039266,推荐,2018-12-26,23:07:51,"路演对于主创来说真的特别辛苦
但是多辛苦我相信也是值得快乐的
很庆幸没有错过你
最后还有一个微笑和拥抱",2
0,27204895,进击的男孩,11511,186055303,力荐,2018-12-10,20:22:10,大学时代姐弟恋，追求播音主持的梦想，痴情和误会百出的情侣而分手，进击的男孩提升自己与学姐翘翹的距离，最终重新收获了爱情还成为一名电影编剧加著名主持人。,2
0,27204895,进击的男孩,客,179951123,推荐,2018-12-07,22:56:48,相比今年其他的青春片还是值得一看的。,3
0,27204895,进击的男孩,人海浮沉,170683431,很差,2021-04-07,23:49:19,真的有点差，怪不得匆匆下线，找了好久的资源，好失望，要看的就去咪咕影院APP看吧，真的太差了，实在不想评价了,0
0,27204895,进击的男孩,豆瓣转运大神,lianhuawang,推荐,2018-12-08,09:23:39,给李艾~~,2
0,27204895,进击的男孩,花恋,188231650,力荐,2018-12-08,10:44:44,即使不是专业的导演，但导演那真挚的感情让我真的很感动。这部青春片怎么说呢[坏笑][坏笑]剧情虽很简单，不像专业的导演拍的（真的不是专业的），但导演对电影的热爱打动了我们，再有就是为了支持一下我的庞瀚辰大男孩[玫瑰][玫瑰],6
0,27204895,进击的男孩,喜欢kiko的圆儿,190225155,力荐,2019-01-18,15:57:12,大学里纯挚的友谊，纯洁的爱情，单纯的梦想，还有数不清的欢乐的记忆。电影中的顾好和秦笑都是有梦想的年轻人，大学毕业后实习的压力，感情中的误会……反映了当代大学生很多的现实问题，电影通过幽默诙谐的形式向观众展现出来。,2
0,27204895,进击的男孩,风筝与风,188385210,力荐,2018-12-07,20:17:14,看了电影，青春很美好，有暗恋，有勇气，有误会，最终男主鼓起勇气追到了自己的爱情，皆大欢喜，在这冷冷的冬天让人心中暖暖的，希望现实的人们也能不留遗憾，勇敢说爱,6
0,27204895,进击的男孩,祭酒''大人,188423120,力荐,2018-12-08,16:09:16,作为新锐导演风格与大导演不同，导演曾说过有人喜欢他的电影就好，的确电影也足够励志，你足够的优秀才配得上足够优秀的恋人。,4
0,27204895,进击的男孩,江南垆月,161004142,推荐,2018-11-29,12:36:47,"《进击的男孩》很有嚼劲的口香糖
       导演说，电影十二次致敬经典。我没看出很多，但《破产姐妹》的部分真的很打动我。餐厅门打开响起的背景音乐，破产姐妹标配的姜黄色服务生衣服。很想真的就在街边推门而入遇到Max跟Caroline。就算只剩一顿饭钱，大概也有重新开始的勇气。
      常规思维：急速驶来的大巴车➕孤独的穿着白婚纱的新娘=车祸。电影打破常规，来一场大巴音乐会🎼很意外，又好像在讽刺那些老套路。
      行走在冬夜的冷风中。嗯，我们大多数都走在冷风中，恰巧，此刻是冬夜。
      毛织专业考研的老姐姐、换了四个男朋友的胖女孩、不断扑粉不断白眼的精致女……都是闪闪的亮点。

",10
0,27204895,进击的男孩,小小室,187867480,推荐,2018-12-07,22:04:41,一部很真实的电影，导演有诚意，主演庞瀚辰有演技够真挚，算是青春片里不一样的类型，可能你就在这个片子里很真实的存在，爱情也好，友情也好，平淡着却让人揪心。顾好的好就是因为他的青涩，成长是一个过程，我们都在经历，不要因为胆怯而失去，而不敢表达，青春就要为爱情勇往直前，才不会错过，也不会后悔。,5
0,27204895,进击的男孩,狗狗饲养员,149340015,还行,2021-06-06,14:31:51,补标一下！当时导演还来我们学校宣传来着hhh是抽奖抽到的电影票🤭,0
0,27204895,进击的男孩,梨涡酒,186398498,力荐,2018-12-10,20:37:26,有笑点，有泪滴，一幕一幕，像极了自己的过往。那个曾经为梦想不顾一切奋斗的自己，我想你们也会感同身受、值得观看,2
0,27204895,进击的男孩,豆友190659280,190659280,推荐,2019-01-27,19:23:21,这部电影看过之后，男主确实是个满满正能量的男生，可以为了自己的梦想去努力拼搏。懂得自己需要什么，敢爱敢恨。我们的倔强，是我们曾经过往青春里对抗世界的法宝。那倔强陪我们走过生命的斑驳，那倔强给我们追求梦的放肆。生活中的我们，也必须努力奔跑，你想要的才会有机会拥有。,1
0,27204895,进击的男孩,沫,188399896,推荐,2018-12-08,00:38:27,两点:一:男主误会女主后，提分手那场景，印象深刻，感觉的到那种撕心裂肺的痛。  二:女主委屈要揍男主场景，女主表现出来了那种爱恨的情感。 总体来说，不错!  支持许导!人生谁能说的准，但是努力总会有回报的，不看低自己不轻视他人，加油!,4
0,27204895,进击的男孩,小横道,tzy1994game,较差,2019-06-02,23:11:45,两星给主角的演技，这个剧情崩了。,0
0,27204895,进击的男孩,档次,188385048,力荐,2018-12-07,19:54:29,天很冷，电影院里面看的一会笑一会流泪，听到在一起，在一起看感慨万千啊想起自己的学生时代,6
0,27204895,进击的男孩,讨厌一切方的,3540154,很差,2018-12-19,01:33:22,因为有包文婧 所以打一星 有种天赋叫 一看见就烦 太装了 ……而且演点适合自己的 综艺不会算数没文化大妈啥的……别祸害电影……青春片一群加起来百岁的老人……是不像别人的青春片……青春在哪里……,1
0,27204895,进击的男孩,不要忘记,186920198,力荐,2018-12-10,21:13:25,非常棒的青春电影，每个人都有的自己的大学生活，都有自己的小美好，惊喜不断，很值得一看！,1
0,27204895,进击的男孩,本一,188389932,推荐,2018-12-07,21:28:17,一部出乎我想象和意料之外的好看电影，虽然已过了青春年华，离开大学生活多年，但看完还是非常有感触和感悟的！是部好片子！值得去看！个人觉得非常适合学生们去看，会感触更深！不错👍,5
0,27204895,进击的男孩,jiang,188387818,力荐,2018-12-07,20:47:17,去电影院看的，觉得非常棒，让人轻松，没有那么多套路，剧情也不俗套，又青春又搞笑,4
0,27204895,进击的男孩,№1杀生丸№1,41484658,还行,2019-04-08,15:51:12,这个参与了制作。内容不多说。导演人很好。,1
0,27204895,进击的男孩,慢慢体会,186921314,力荐,2018-12-10,21:19:46,看了这部电影仿佛看到了曾经的我们，曾经的小美好，曾经的悸动涌上心头，真的很感人。,2
0,27204895,进击的男孩,牛仔女,187570373,力荐,2018-12-10,23:20:38,很不错的一部青春剧，很感动的故事。让我回忆起了很多校园时代的事情。多想时间能倒退回去,1
0,27204895,进击的男孩,豆友188408535,188408535,力荐,2018-12-08,10:34:43,挺不错的片子，一开始以为是小套路电影看了之后发现真不是,4
0,27204895,进击的男孩,雪晴,188388623,力荐,2018-12-07,21:17:08,电影讲述青春岁月，实现理想，有笑点也有冷点，我很喜欢。,6
0,27204895,进击的男孩,淅沥沥风,163812312,较差,2018-12-07,23:01:29,190块就这？,1
0,27204895,进击的男孩,墨,184298245,很差,2018-12-07,16:23:25,真的尴尬,5
0,27204895,进击的男孩,一个悦己,168906653,,2019-08-10,13:10:02,通过小观观知道这部剧的，听着他说台前幕后的故事，看到电影名的第一眼就很感兴趣，虽然这部剧没有什么明星流量，但是我觉得能够演出那种真实感。二十几岁的我们要成长的代价太大了，亲情友情爱情都有太多的问题，相信在看这部剧的时候都会有自己的答案，期待庞瀚辰的蜕变，有时候成长就是一瞬间的事，希望我们在这个瞬间来临之前，厚积薄发，不辜负自己，也不辜负身边的人。,1
0,27204895,进击的男孩,淡予,187653591,力荐,2018-12-10,22:27:01,看了后，心里面想起了很多以前大学时的事情。很感动,2
0,27204895,进击的男孩,永恒^O^Pearl,173766771,力荐,2019-01-03,22:23:47,一部真实感超级强、青春励志成长型的好电影，也许有些场景切换、后期特效还没有那么成熟，但是青春本来就是不断的尝试中成长起来的，青春是我们就是稚嫩的，略显不成熟的，正是这个，这部电影才难能可贵，我们在不断磕磕绊绊中变得更优秀，把我们的青春在电影中刻画的淋漓尽致。,2
0,27204895,进击的男孩,生生不易,188366811,推荐,2018-12-07,19:51:34,穿毛衣入水的画面太有魔性，用包袱堆积起来的青春励志偶像剧，想去放松心情的可以去看一看，哈哈旁边的姐姐已经笑出猪叫了,5
0,27204895,进击的男孩,Drinking,188366768,力荐,2018-12-08,11:00:44,很有意义的片子，值得欣赏？,4
0,27204895,进击的男孩,祁叶牂牂,185008577,还行,2018-12-07,20:07:26,前面很后面差别超级大，很明显导演想玩梗，但是没有玩起来，自己挖坑把自己埋了，后面比前面精彩，整体6分，及格吧,2
0,27204895,进击的男孩,hua551166,184076610,力荐,2018-12-07,19:45:10,终于等到电影上映了，电影直接带我重温了校园生活，自己曾经也那么有过那样又哭有笑痛苦并快乐的青春年华，非常真情实感，两个人在一起不要因为误会而吵闹分开，缘分不易，经营生活一样不易😜 ,6
0,27204895,进击的男孩,刘丽,128511556,力荐,2018-12-19,21:15:21,一部比较另类的青春文艺片（喜剧片），躲过了传统校园剧“堕胎、出国、车祸”几大雷区，看似平淡的故事里也许藏着你我的青春，总是在你想抒情的时候突然抖个包袱，不过结局我觉得要是be会更好,2
0,27204895,进击的男孩,豆友199805925,199805925,还行,2019-08-02,18:39:54,虽然有庞瀚辰，但是吧，拍的还真的不是很好看,0
0,27204895,进击的男孩,小怪兽,49575700,力荐,2018-12-07,21:39:16,朋友推荐的电影，虽然名气不大，看完之后还是挺惊喜的。前面要笑岔气了，尤其是吕杨上三轮车的时候，笑点还是挺多的。里面的配乐，很多都挺喜欢的。不同的风格，值得来看一看。,6
0,27204895,进击的男孩,二凤,184084835,力荐,2018-12-07,22:07:28,一个精分的电影，笑着笑着就哭了，前半段老姐姐泡温泉，吕杨上车，笑疯了；后半段青春的敏感、自卑造成的错过，又引起共鸣，幸好是个喜剧结局~~就当是我青春的另外一种结局吧,5
0,27204895,进击的男孩,黄河,187502106,推荐,2018-12-10,21:18:38,这部电影感觉很好，很有回忆的感觉，电影教会了我们如何去爱，感触更深，一时半会出不了戏～,4
0,27204895,进击的男孩,doubanying,190545209,推荐,2019-01-25,11:19:19,"有情节，有感情，不狗血不拖沓。
剧情不再重复青春剧的经典部分，由其自己发展，很推荐",1
0,27204895,进击的男孩,街尾守候,184507666,力荐,2018-12-07,21:16:26,"梦想依旧是你  我们的青春从未逝去！
一起哭泣、一起欢笑、一起感动、一起回忆！！！给导演10分，给我们10分，给青春10分，给梦想10分，给未来10分！！！",5
0,27204895,进击的男孩,嗷呜,186307256,力荐,2018-12-07,20:43:41,真的很惊喜，许添导演的处女作都已经这么棒了，真情实感的期待更多的作品。这部电影在笑点中密布着温情，最后的反转特别让人感动，另外庞瀚辰好帅哦🌚,6
0,27204895,进击的男孩,半生缘,187554922,推荐,2018-12-10,22:24:52,很真实，想起了我的学生时代，看到后面被感动哭了,2
0,27204895,进击的男孩,璐璐的大鹿,145146442,力荐,2018-12-07,10:52:39,一早的排片，也是让人欲罢不能，但我还是去看了。答应导演一定会二刷，这是一部好的青春片不狗血，正青春！被导演的真诚所吸引。,8
0,27204895,进击的男孩,随便,187756829,还行,2018-12-07,08:43:35,还挺不错的，建议大家可以观看,3
0,27204895,进击的男孩,美味人生李霞,184088016,力荐,2018-12-07,19:37:14,"刚刚看完，很励志的一部电影，有笑，有泪，有感动，不由的想起自己的学生时代，爱就大声说出来，不要错过和遗憾
",6
0,27204895,进击的男孩,豆友188380743,188380743,力荐,2018-12-07,18:20:50,青春的故事，爱情是主旋律，初恋的苦涩和美好都在剧中感受到，属于小清新范儿～～,5
0,27204895,进击的男孩,Evazhang,81638714,力荐,2018-12-07,18:22:36,在学校看过点映之后，今天又去电影院二刷了，依然被剧情所感动，笑中带泪,5
0,27204895,进击的男孩,小观观,184047725,力荐,2018-12-07,18:23:06,那个换了三个男友的姑娘 我很佩服你,6
0,27204895,进击的男孩,豆豆浆335,188388728,力荐,2018-12-07,21:02:59,好看,6
0,27204895,进击的男孩,Hugo,147254473,推荐,2018-12-07,23:32:09,一部真实的青春片，找寻自己的青春,3
0,27204895,进击的男孩,veggielaine,157047220,很差,2018-12-16,16:51:47,没有电影感，更像综艺节目,0
0,27204895,进击的男孩,小杰,181480489,力荐,2019-01-25,16:58:02,好看,1
0,27204895,进击的男孩,邓圆圆,82460439,推荐,2018-12-07,21:00:02,剧情虽然平淡，但却贴近真实而有感的生活，有哭点有笑点，让我又青春了一把，遗憾那些错过，也感谢那些错过，才会有现在更好的自己！推荐，值得去看看～建议不要和大片比，这是个很特别的电影！,5
0,27204895,进击的男孩,a林阿疯,171391557,力荐,2018-12-10,17:46:12,错过，只为了越来越好然后自己遇见更好的你，不过人生不一定有那么多兜兜转转，一定要，拐弯口回头，要不然就来不及了,2
0,27204895,进击的男孩,辉仔,186221846,力荐,2018-12-12,01:15:21,挺用心的一部作品，有那么一瞬间触动了心底的最柔软处，特别真实，没有狗血，平平凡凡的青春各位动人，看见了自己的影子。导演加油，拍出更好的作品，票房不重要，重要是忠于内心。,2
0,27204895,进击的男孩,超越保我不挂科,188722563,力荐,2018-12-15,19:04:04,"不知你是否在电影中看见你自己

平凡的生命中平凡的故事",2
0,27204895,进击的男孩,.。。。。,157831336,力荐,2018-12-15,11:40:15,一部很好的电影，很真实，电影外许添导演的努力，他的精神很值得学习。,1
0,27204895,进击的男孩,mirWang,187563277,推荐,2018-12-10,23:05:38,演员很不错。剧情也很励志。喜欢,1
0,27204895,进击的男孩,忘了我们-,171060485,力荐,2018-12-14,20:10:44,"真实
简单
一部关于青春成长的电影
有笑点有欢乐
也有遗憾和感动
每个人的青春都有自己的故事
不管结果如何
它都见证了我们的成长",1
0,27204895,进击的男孩,波兹丁丁鹅,79217751,力荐,2018-12-08,11:46:16,满满正能量,3
0,27204895,进击的男孩,绮轩,qixuanxiaoze,很差,2021-07-26,09:15:42,剧情可以忽略，只听金曲串烧就行了，被片尾那一大长串鸣谢学校单位给惊到了，几乎网罗了全国各大学的学校电台。,0
0,27204895,进击的男孩,豆友189771661,189771661,力荐,2019-01-08,11:41:03,好看！,1
0,27204895,进击的男孩,用户64787647870,188716405,力荐,2018-12-15,17:06:04,真的很好的，励志，有自己的想法，也特别真实，可能有些还会有自己的触感,1
0,27204895,进击的男孩,小圆圈儿,188739573,力荐,2018-12-16,00:18:37,"人的一生会经历许多的事情，错过也是常有的事情，错过一些人、错过一些事，但很多人和事错过了真的就是一辈子，无法挽回。

电影《进击的男孩》是一部青春校园喜剧片，是成千上万年轻少东家的代表，他们的成长，有欢笑、有泪水、有拼搏、有感动。他们真挚地努力着，成为更好的自己，只为遇见更好的你。

我们都曾错过，错过一些人，错过一些事。一直无法说出口的喜欢，一次次的努力、勇气、曾在一起、不在一起，都敌不过造化弄人的错过。

这一次，不再错过你。💕",1
