page_index,movie_id,title,username,user_id,rating,date,time,comment,useful_count
0,27204895,进击的男孩,自嘲,177032340,还行,2018-12-08,21:17:51,标签我实在想不出来贴切什么，这部电影看在导演的份上给7分吧，电影一开始给我感觉很懵逼，不知道在演什么，套的太多了，其次，玩的梗很突兀，感觉很不自在，连贯性完整性还行，男主演技可以，的确 说它是喜剧我确实也笑了，感动也有，总体来说，比以往的烂片要好得多。（第一次写这个，）,3
0,27204895,进击的男孩,Pikachu,188735843,力荐,2018-12-15,23:06:59,用心做事，青涩到成长，是顾好，也是许添。加油，大表哥！,1
0,27204895,进击的男孩,阿声,121239479,力荐,2018-12-20,21:53:49,有些电影，说不出哪里好，就是怎么也忘不了。这部电影，不那么像所谓传统的电影，不矫情，不说教，很有趣，从头笑到尾却自然真挚。然后音乐实在太好了。是很难得一见的小清新。,2
0,27204895,进击的男孩,大庞0410,142764356,力荐,2018-12-31,17:26:43,成为更好的自己，只为遇见更好的你。看过电影之后，有一种说不出的感觉，但是眼睛已经湿润。错过一次不要紧，千万不要再错过了，世界之大，人海茫茫，能走到一起，真的是一种缘分。珍惜身边对自己好的人，真心对待和自己相处的人！,1
0,27204895,进击的男孩,amy,127326692,力荐,2018-12-07,21:56:01,在电影院里笑出了猪叫声，很多经典的桥段。我是学传媒的，在这部电影里，更能看到自己的青春，也羡慕秦笑，顾好，那些勇于追梦的人。,3
0,27204895,进击的男孩,仁又雄,188432905,很差,2018-12-08,19:29:36,看完男主的演的爱情，我再也不相信爱情了，因为这演技真的让人无法信服。,2
0,27204895,进击的男孩,西装小帅帅。,149587887,力荐,2019-01-17,21:27:16,是我喜欢的青春片，一起加油，一起进击！！,1
0,27204895,进击的男孩,小帅，,166594603,很差,2018-12-09,15:07:36,本来一分都不想给，但它让我想起了……,1
0,27204895,进击的男孩,微光,lgoodsmile,力荐,2018-12-17,10:03:07,写自己的故事，做优秀的人，成就优秀的作品。,1
0,27204895,进击的男孩,_没事别瞎说话,167768290,较差,2019-03-23,22:30:49,演技真的尬，剧情也老的很,0
0,27204895,进击的男孩,fancyie,45834402,力荐,2018-12-13,01:18:57,真挚细腻的感情，让人笑中带泪,2
0,27204895,进击的男孩,张在宥,218450324,力荐,2021-10-02,15:41:15,喜欢庞瀚辰的阳光 演技很自然 一个宝藏男孩,0
0,27204895,进击的男孩,rcocoo,180288045,推荐,2019-01-17,10:19:26,真的还挺好的 没有很假,1
0,27204895,进击的男孩,,188390206,力荐,2018-12-07,21:27:49,这样具有前瞻性的影片，不会被在时间长河中暗淡，而只会熠熠生辉，因而可以被称为经典。,2
0,27204895,进击的男孩,兔八哥,188389165,推荐,2018-12-07,21:13:13,无意间选看的一部电影，抱着消磨时间的心态去的，没想到却是一部让人又惊又喜的青春电影，笑中带泪、破涕为笑形容它最合适了！真实的青春、真实的故事、真实任性的电影！,0
0,27204895,进击的男孩,uu,188422143,较差,2018-12-08,15:44:13,男女主非常不正常，情节太多bug，李艾不应该演这部戏,0
0,27204895,进击的男孩,fresh echo,188394347,力荐,2018-12-07,22:46:15,走进电影院，离开嘈杂的世界，沉浸在影片里。读大学的我们，或许正在经历着这些，年少无为也请不要自卑，不要错过一生所爱，所谓山海长，那也是与你在一起。为电影打call，为导演打call。,4
0,27204895,进击的男孩,龙哥的朋友,188386879,力荐,2018-12-07,20:27:27,看到故事真的感觉很好，没有太多的套路，有的只是更多的真情，从中让我学会了一定不要错过，导演加油真心很棒,2
0,27204895,进击的男孩,🍥,177487551,很差,2018-12-08,15:45:22,感觉剧情杀马特？？,3
0,27204895,进击的男孩,Wangr 💡,171077613,很差,2018-12-08,00:11:02,这个青春片，挺青春的,3
0,27204895,进击的男孩,苦逼游泳教练,177508557,很差,2018-12-07,14:10:35,情节不连贯，感受到满满的浮躁气息，剧情突兀，演员玻尿酸。,1
0,27204895,进击的男孩,Shawn商恩,57327536,推荐,2018-12-09,22:09:48,半自传体电影，电影本身轻松活泼，贴近生活，结尾多重反转，令人期待。,3
0,27204895,进击的男孩,中另乌,188429289,很差,2018-12-08,18:21:50,男主唯一的优点就是名字还挺好听……顾好，真的，顾好你自己吧，因为我看完已经全身都不好了…,1
0,27204895,进击的男孩,gnisud,168690927,很差,2018-12-08,14:59:26,看着玩 听个响,0
0,27204895,进击的男孩,一生须臾,174156064,较差,2018-12-10,17:08:09,一般偏下水平，不值得买票观看。,0
