page_index,movie_id,title,username,user_id,rating,date,time,comment,useful_count
0,25863024,仙球大战,糯米丸子,127908787,很差,2017-06-30,06:07:10,何老师，求求你了，回去好好主持节目吧,1146
0,25863024,仙球大战,K1,42425815,很差,2017-06-30,10:14:44,我的脚趾头说它用屁眼看都知道这是部烂片，如果超过4分它就切！,795
0,25863024,仙球大战,凉拌培根,OshimaWatson,,2017-06-29,22:37:54,年终十大烂片预定,563
0,25863024,仙球大战,Pukii,57107264,较差,2017-07-29,04:46:11,我就想问一下，为什么？！为什么要拍一部这样的电影出来？注定了不可能有票房，纯招骂，不会有任何正面意义的啊！为什么要拍一部这样的电影出来？？？我无语！刘镇伟当导演，可是，就算是90年代的他，在一个月时间内赶出来的香港搞笑烂片，也比这部拍得好啊！1星给惊声尖笑级别的特效。总之烂！,47
0,25863024,仙球大战,冰镇西瓜橘子水,65400706,很差,2017-06-29,18:28:33,刘镇伟加快乐家族成员 双重灾难 只恨没有零星 一星请笑纳,772
0,25863024,仙球大战,Gabriel,gabrielsung,很差,2017-07-01,18:05:35,没有零星不科学，坚持拉我看这种片子…这个女友不能要了…,505
0,25863024,仙球大战,朝暮雪,lingrui1995,很差,2017-07-05,16:24:39,"1.豆瓣评分太不靠谱了，竟然2.7分？时光网只有1.1分。
2.这帮人祸害了《西游记》，终于开始对漫威下手了。
3.这是国足被黑得最惨的一次。
4.足球：我到底做错了什么要被你们这样玩儿？我宁愿没有被发明出来。
5.五毛钱特效见过，一毛钱特效也见过，充话费送的特效还是头一回看见。
6.跪求漫威把他们告破产。",451
0,25863024,仙球大战,斑斑点点,153950189,较差,2017-07-03,19:46:24,太雷人啦,4
0,25863024,仙球大战,二月鸟语,p2165,很差,2017-06-29,15:57:22,贵圈热钱真多~,360
0,25863024,仙球大战,EVA_征服天堂,46180980,很差,2017-06-30,03:15:18,赶午夜场，朋友请客，看到40多分钟就找借口拍拍屁股走人了！自从刘镇伟来大陆捞钱开始，就没拍过一部正常的！阿sa和阿娇 一年三部电影！不要想质量有多好！,228
0,25863024,仙球大战,有心打扰,kejinlong,很差,2017-06-30,23:51:17,终于在大银幕上看了一回快乐家族，嗯，看一次就是永别。,169
0,25863024,仙球大战,Panda的影音,PandaMovieMusic,很差,2017-07-22,20:39:28,有的片子差，有的片子傻，有的片子雷，有的片子烂……而这个片子又差又傻又雷又烂……,93
0,25863024,仙球大战,Marcus,79695986,很差,2017-06-30,17:15:56,刘镇伟也太TM天马行空了吧，剧情扯得够离谱，台词更是浮夸无比。场景越到后面越雷人，最后那个特效巨low的N手观音是个什么鬼，密集恐惧症都要看到吐了，接蹴鞠的场面简直就是在模拟挖矿游戏吧，还有那一群山寨的超级英雄，国产片可以不要再玩这些梗了吗，太恶心。何老师，是时候停止作妖了。,127
0,25863024,仙球大战,张咏轩Wayne®,55617091,很差,2017-06-30,15:44:28,历经了三番四次的改档撤档，就知道是个什么玩意儿，刘镇伟再次用他烂俗的审美辣了观众的眼睛，用天雷滚滚的意淫故事挑战了观者的生理极限，完全山寨级别的制作，从画面构图到演员的表演无不如是，后期包装和场面制造完全是糊弄苟且的水准，尴尬的抠图和初级的动画临摹，就连网剧的制作格局都比这个好,121
0,25863024,仙球大战,桃桃林林,qijiuzhiyue,很差,2017-07-19,08:50:26,山寨特效与继续自我消费,67
0,25863024,仙球大战,依萍暴富了吗,131023951,很差,2017-06-30,00:19:44,刘镇伟这几年到底是有多缺钱啊，拍的什么鬼啊。,75
0,25863024,仙球大战,kingkongofkhan,kingkongofkhan,很差,2017-07-29,09:13:09,保卫地球就靠本片了，再凶的外星人都得看到上吐下泻,33
0,25863024,仙球大战,Syfannn,syfan,很差,2017-06-13,16:06:10,刘镇伟还不如王晶呢,46
0,25863024,仙球大战,谢谢你们的鱼,reave,很差,2017-07-02,16:23:01,刘镇伟已经到了自己30年前的梗都不会拍的地步了，其实原本是一个不错的创意，但是这杂乱无章的故事，不断在减分的试听、剪辑，糊弄的配乐和配乐，里面的梗稍微用点心处理都不会尴尬成这个样子，最后只能给一星，这个题材还是去让三池崇史玩吧。,29
0,25863024,仙球大战,王大盆,4871375,很差,2017-08-05,20:14:15,除了Twins 其余全部枪毙谢谢,27
0,25863024,仙球大战,柯里昂,pirealwei,很差,2017-07-18,18:08:50,为凑年度十烂而看，瞄了5分钟实在看不下去了，可怕,11
0,25863024,仙球大战,——,127449662,力荐,2019-04-04,19:03:41,"确实是烂片。
Twins合体很感动。
为阿娇给5星，希望以后接好片，状态越来越好。",3
0,25863024,仙球大战,jessica,159269744,较差,2017-07-02,22:43:19,虽然喜欢何炅，但是这部影片真的欣赏不来，这种天马行空的喜剧真的有点low,6
0,25863024,仙球大战,芥末蘸酱,FrankWasabi,很差,2017-07-01,17:45:31,不踢球的部分比踢球的部分好，雷神不找徐锦江演不应该啊！,27
0,25863024,仙球大战,骑呢星人,34482289,很差,2017-06-30,22:34:10,2017/06/30 秦奴刘镇伟私通番邦芒果军团公然打劫当年先帝周星驰打下的江山。,20
0,25863024,仙球大战,豹米花,6914518,很差,2017-08-20,12:49:46,哎，尼玛我都不知道看了十分钟就看不下去了是不是叫看过，我真的不是在亵渎电影，我感觉是被他妈的这部烂片亵渎了,9
0,25863024,仙球大战,ピラミッド,62902695,很差,2017-07-29,21:51:55,毋庸置疑 这片子是用来洗钱的,34
0,25863024,仙球大战,阿瓜,1653421,很差,2017-07-29,00:20:43,广电总局不作为啊  这片怎么能过审,18
0,25863024,仙球大战,她她电影,herfilm,较差,2017-07-01,00:28:29,这一次，国足终于拿下了世界杯,12
0,25863024,仙球大战,m89,duzhouchi,还行,2017-06-30,13:40:57,虽然特效跟横漂的演技一样屎，但我觉得5块8真的是值回票价了，所以给三星。应该是从贺岁档调过来的，还保留着许多合家欢的痕迹。毕竟是对香港电影有特殊感情的人，不忍心再对刘镇伟说什么重话了，那些抽水桥段就当做是迷影元素吧。千手观音守龙门的设计挺有意思，但不知火舞就真的不知所谓了。,95
0,25863024,仙球大战,Indecent time,51061132,很差,2017-07-23,12:52:17,哈哈哈哈哈哈哈哈哈哈哈哈哈哈哈哈哈哈哈哈哈哈哈哈哈哈哈哈哈哈哈哈哈哈哈哈哈哈哈哈哈哈哈哈哈哈哈哈哈哈哈哈哈哈哈哈哈哈哈哈哈哈哈哈哈哈哈哈哈哈哈哈哈哈哈——这些都不是我在看这片的时候发出来的,15
0,25863024,仙球大战,小山生桂枝,ssryyr,很差,2017-08-16,09:14:37,在微博看了电影简介和片段忍不住来打一星了，刘镇伟太恶心了！,5
0,25863024,仙球大战,本清,3149827,较差,2017-07-29,09:24:28,如果是以八十年代港片的水准来要求的话 中规中矩 可惜已经是二十一世纪了 抱歉 对不起这么大的投资啊,2
0,25863024,仙球大战,回忆与否之,148860881,很差,2017-07-27,18:15:16,最变态的是右上角还显示在爱奇艺看这片得付费5元。,6
0,25863024,仙球大战,鬼腳七,pedant,很差,2017-08-13,21:35:40,刘镇伟估计是先想到“八仙战漫威”这个点才开始写剧本的，也就只有这个想法有点水准（虽然也做得一塌糊涂,3
0,25863024,仙球大战,Jorrow,48480567,很差,2017-07-19,19:33:14,在电影圈，整个世界电影史上，还有比刘镇伟更不要脸的导演吗？,8
0,25863024,仙球大战,万物皆有淋,74966541,很差,2017-07-03,18:47:58,烂片flag：有快乐家族成员参演的电影,13
0,25863024,仙球大战,Minimalismer,99550697,很差,2017-08-16,04:45:56,预估不会上5分，不要问我凭什么，凡是有快乐家族或者导演是刘镇伟的电影，闭着眼睛打一星，绝对冤枉不了！,3
0,25863024,仙球大战,Hushnore,chick_rock,很差,2017-11-16,02:32:24,敢信不？这里面演得最好的人居然是刘镇伟！贯穿始终的时势梗居然散发出一种不接地气的惊悚感。,3
0,25863024,仙球大战,旅途人生,140581573,很差,2017-07-19,07:04:46,电影比不过超级英雄，那就在自己的电影里YY吧！简直看不下去！千手观音守球门，何某还仿孙大圣！真是服了奇葩造型！至于故事根本没有！年度烂片top10的实力选手,5
0,25863024,仙球大战,обломов,glim,很差,2017-07-29,09:45:01,kneeguo足球都比这个搞笑,1
0,25863024,仙球大战,decidels,42600622,,2017-11-29,23:34:44,這電影涵蓋了所有的爛···,2
0,25863024,仙球大战,空语因明,godi,很差,2021-01-03,13:51:58,复联和x战警首次联合作战，结果被者行孙和八仙打败收服。这就是为什么我们现在看不到复联和X战警联合作战的最大原因了。,0
0,25863024,仙球大战,枯藤和老虎,1891500,很差,2017-07-18,22:13:43,什么鬼,1
0,25863024,仙球大战,风无痕,162483101,很差,2018-08-04,14:01:00,垃圾 烂片 恶心 垃圾 烂片 恶心 垃圾 烂片 恶心 垃圾 烂片 恶心 垃圾 烂片 恶心 垃圾 烂片 恶心 垃圾 烂片 恶心 垃圾 烂片 恶心 垃圾 烂片 恶心 垃圾 烂片 恶心 垃圾 烂片 恶心 垃圾 烂片 恶心 垃圾 烂片 恶心,3
0,25863024,仙球大战,程小挑,cheng4496,很差,2017-07-26,01:09:11,何炅出演 必属烂片,2
0,25863024,仙球大战,天麒麟宣殿,Sunho,,2017-07-23,22:48:25,音乐：胡伟立,0
0,25863024,仙球大战,无优无律,154737590,很差,2017-07-01,07:18:09,这部电影我有两个疑问，到底在演什么？真的有人去看吗？,20
0,25863024,仙球大战,云图,64011512,很差,2017-07-27,22:43:37,有快乐家族 有twins  所以是烂片,1
0,25863024,仙球大战,飙雪璨阳,50667944,很差,2018-07-19,15:58:50,刘镇伟的成名真的只是偶然吧，如果没有王家卫和周星驰，恐怕如今没有人会知道还有这么一号人物。其实大家大可不必苛责这位充满充满奇思妙想的人，他曾经助力王周为我们造就了许多经典，如今，或许是不甘寂寞，或许是情怀难逝，更多还是资本驱使，才会不断的炒冷饭，不断的恶搞经典，佩服这位雷剧之王！,2
0,25863024,仙球大战,苏妄言,159673853,很差,2017-08-18,19:19:04,刘导，要点脸真的那么难吗？给齐天大圣留条活路行不行？漫威管你借钱没还要这么黑么？,2
0,25863024,仙球大战,大罗,Gu_li,很差,2017-07-06,00:56:47,影片最后，导演借演员之口说的那句，无厘头嘛，大家呵呵一笑就好了……也就呵呵吧！,4
0,25863024,仙球大战,李小庫,leeshiuan,较差,2017-08-02,00:30:49,无论何时都不应低估一部喜剧作品的能量与价值 同样也不应高估一部娱乐产品的质量与内涵 喜剧作品与娱乐产品有本质上的不同 走心的喜剧作品经得起推敲 有思想 有主旨 有符合时代特征想要去表达的东西在里面 娱乐产品其实往往是拼凑大于了创作 套路多于创新 整片主旨模糊 最终思想也只是归于一个牵强肤浅,1
0,25863024,仙球大战,阿七,75999153,很差,2017-07-23,16:29:26,广电出了各种条例办法封杀各种经典电影。这种踏马翔一样的电影反而顺利过审。除了继续搞金庸元素，搞周星驰元素，现在还开始搞漫威了。这种模仿抄袭的垃圾为什么能过审。。。还好观众给力，不像前几年是个片都贡献几亿。,5
0,25863024,仙球大战,彩戏师wala,caixishi,很差,2017-07-24,00:06:12,烂片典范,1
0,25863024,仙球大战,一只特特呦,142540464,很差,2022-11-12,15:32:25,"很他娘的离谱，好久没看到这样的视频了。
都知道90分钟大概率烂，这片甚至凑不到90分钟。
我去刘镇伟导演，一股港片味。特效不行，动作指导不行，摄影我去短视频水平，致命慢放，台词尴尬，演员也不行，背景扯犊子太震撼了。
",0
0,25863024,仙球大战,怀山鹿,domire,很差,2018-12-05,00:26:05,快乐家族+痴线刘镇伟，五分钱密集恶心特效，山寨抄袭造型桥段，毫无诚意的烂片王中王，呸,0
0,25863024,仙球大战,饕餮,182411167,很差,2018-09-24,16:36:19,钟心潼，杜海涛，何灵，黄晓明，而且还有简介，这部戏基本凉了,2
0,25863024,仙球大战,寝室不就寝,161180112,较差,2017-06-30,00:23:03,无力吐槽,18
0,25863024,仙球大战,资深低阶路人,92775477,很差,2022-02-06,01:34:06,刘老师,1
0,25863024,仙球大战,blanche,2326199,很差,2019-12-31,22:53:50,看到导演和主演就知道是烂片了,0
0,25863024,仙球大战,格林童话,56906475,很差,2019-10-03,14:45:19,烂片是我的快乐源泉,0
0,25863024,仙球大战,三日,kpcloud1314,很差,2017-07-19,19:56:47,负分,2
0,25863024,仙球大战,无敌疗愈,151163394,很差,2017-07-20,18:43:31,刘镇伟真以为自己还是能导出大话西游的人啊恐怕大话西游是找别人代导的吧真以为我们会拿血汗钱去看你这个翔一样的电影真是搞笑希望广电总局禁止这些圈钱导演拍烂片浪费中国市场中国烂片扎堆和外国能比吗屎一样的电影怎么没有负分,1
0,25863024,仙球大战,六弄奶茶廳,56789007,很差,2017-11-07,22:28:00,靠杯，整個就是拷貝山寨水貨，劇情是複製少林足球，還拿慢威的人物做山寨版，美国队长、金刚狼、绿巨人、暴风女、镭射眼、雷神、蜘蛛侠、霹雳火、狼人，真不知道慢威知道後，有什麼感想，雖然幾乎都是特效，而且臨時演員又多，不過這種無離頭的故事不就是看完，看完不就看完了，哈哈一樂就沒了,1
0,25863024,仙球大战,刘白,CZ918,很差,2022-03-05,21:41:35,豆瓣最低分也有2分真的是很给面子……,0
0,25863024,仙球大战,ILM,3167300,较差,2017-10-09,01:20:41,烂片，一星半，虽然算是讲了一个故事，但是太没节操了，还不好看,0
0,25863024,仙球大战,O型血,UloveWo,很差,2018-11-18,20:56:12,绿巨人、暴风女、雷神、金刚狼、美国队长？https://www.bilibili.com/video/av12688642特效太差了。这是喜剧片呀，完全乐不出来，笑点在哪里。https://www.bilibili.com/video/av13386253,0
0,25863024,仙球大战,firdbire,68841518,,2018-12-19,21:43:16,有的电影，看个海报就不用考虑了，还不死心，看看卡司也基本可以确定，这就是收智商税的了,0
0,25863024,仙球大战,Morning,qiweiming750,很差,2017-07-22,22:00:20,感觉像是老不修的心态来做个电影了。这就是一部分电影人的心态，找个熟手，什么都能攒，不管怎样把东西做出来，就是好的了。就结果而言比王晶的那些更可怕。王晶还有那些越来越不如意的晶女郎，但是是新血，以及赚得盆满钵满时请出巨星，twins要沦落到争抢何炅，邓丽欣被撵为配菜，这一代港女要被毁完,1
0,25863024,仙球大战,慕詩,147190792,较差,2017-07-24,09:11:58,服道化真的太不走心了，造型就很出戏，两星是看在何老师的面子上。,1
0,25863024,仙球大战,Yuruky,yuruky,很差,2017-07-19,00:08:15,我相信苍天有眼,2
0,25863024,仙球大战,清雅戒奢,194286859,很差,2022-01-24,19:02:50,看完“刘老师说电影”剧透来的，下面附上链接:https://b23.tv/nI56k3f。,3
0,25863024,仙球大战,圣墟,152833029,很差,2017-06-30,20:07:26,有一个快乐家族的成员就够扯的，更何况是四次方,16
0,25863024,仙球大战,有志青年,168057232,很差,2018-09-15,22:50:40,我的个神呐，这片子竟然还有1.7%的观众给打五星，思来想去究竟是什么人？盲人？精神病？最后得出结论，是快乐家族那几个傻子，能将自己的品味保持到十多年不拍一部超5星的电影，认为这电影值五星也不奇怪了,3
0,25863024,仙球大战,独宠你一人,165337459,很差,2018-05-10,16:19:27,要扑，心疼何老师,1
0,25863024,仙球大战,洛水之渊~~,30852407,较差,2017-07-19,16:35:40,讲真这是近些年刘镇伟唯一还算有点看点的片，算网大水平-开头抢球的动作设计相当好，决战百姓小女孩为国守门的立意也很好，也有零星笑点可惜其他都是一塌糊涂，片尾旗袍娘真他娘毁三观,0
0,25863024,仙球大战,浆糊骗子,xslidian,很差,2017-07-03,01:14:01,漫威完败 不论片中片外,4
0,25863024,仙球大战,祸害~活千年,41927171,很差,2017-07-20,13:02:58,为什么还有给高分的，问世间谁还能把电影拍的这么烂演的这么差，集合了这么多明星，认真一点也不至于把电影拍烂吧，事实证明他们很认真的把电影演砸了。,0
0,25863024,仙球大战,泥骨垃希凯骑,49298896,很差,2017-08-10,11:21:46,如果真有负分的话真的会评，快乐家族绝逼是电影界毒药,6
0,25863024,仙球大战,__那个谁。,deadmona,很差,2018-01-22,10:50:06,我后悔我好奇心爆棚去看了这部被吐槽成2017年最烂片的电影，一分送给勇敢的自己。片子一分都不值，整部电影都太辣眼睛了。,1
0,25863024,仙球大战,叶间光辉,195668693,力荐,2019-07-26,18:57:21,我对后面踢球吊打漫威很是赞赏……@张x宇。评分改成五星,1
0,25863024,仙球大战,hungry,dbhungry,很差,2020-03-30,00:45:40,傻x快乐家族8310这一套闹哄哄的无厘头已经不流行了啊技安你个过时老土,0
0,25863024,仙球大战,水牛山少主,38810904,很差,2018-07-10,09:56:06,查查这个片子的制作单位吧，看完片子，我感觉这片子洗钱的意味太明显了,2
0,25863024,仙球大战,谶,doubanjrn0001,很差,2021-04-03,13:23:15,？？？密恐福利,0
0,25863024,仙球大战,布袋里的猫,Nathaniel,很差,2017-07-28,22:35:12,妈的智障,5
0,25863024,仙球大战,黑芝永不衰,62837123,很差,2017-06-30,08:39:19,我知道你们很努力啦！但是还是要打一星噢，我也不会去电影院看的啦！,10
0,25863024,仙球大战,无聊,150948299,很差,2017-07-03,11:22:19,天知道我是多庆幸这部片子是用网盘快进看的啊,2
0,25863024,仙球大战,野百合终生美丽,68399606,很差,2022-09-05,18:50:08,"为sa而看。
前30分钟，勉强还算是个借古讽今的无厘头故事。后30分钟，直接烂穿地心，负分。
2014年拍的，2017年才上映，这中间经历了啥？花3年时间做五毛特效吗？
2014年，快乐家族还没有被人人喊打，经常组团到影视圈捞金；马丽还没有火，只能演一个丫鬟。
sa娇在这部烂片里都挺美的，尤其娇。",0
0,25863024,仙球大战,纤手破新橙,xj121166836,很差,2017-10-30,18:25:21,有快乐家族就可怕。,2
0,25863024,仙球大战,路人一枚小深酱,deepkid,,2022-07-11,21:14:18,这个电影好可怕，，，，,0
0,25863024,仙球大战,152****5540,74333195,很差,2017-07-08,16:57:05,你别说，从《嘻游记》开始，何老师的电影一直保持着统一的水准。十几年如一日，也不容易。,2
0,25863024,仙球大战,张兮兮,53145042,很差,2018-07-25,10:27:19,难看,0
0,25863024,仙球大战,Hitomi,108194668,很差,2022-02-21,00:40:07,我不希望在大荧幕上再见到快乐家族的任何电影了。刘镇伟你不会觉得自己很幽默吧。把功夫足球的梗炒了10几年还拿来炒。把功夫里面的娘娘腔又搬出来用。你是不是没了周星驰不能活。那你把周星驰请出来不好吗。,2
0,25863024,仙球大战,虫子哥,58129051,很差,2022-05-29,23:10:36,神马丸益！看到大家的评分，我放心了,0
0,25863024,仙球大战,木木三又二,83538603,很差,2017-08-17,16:17:18,我尼玛！！！妇联都来了。。2分,1
0,25863024,仙球大战,歹喜虎,138059484,很差,2019-09-19,22:03:13,甘恁娘鸡掰……,0
0,25863024,仙球大战,leslie1991,42477053,很差,2020-03-06,14:16:18,香港一些导演，总是将8090年代那种电影的套路，拿到现在来，以为多请点明星，加点无厘头的元素，瞎拍一通就会有观众买账。但是时代不同了，当年的电影，现在拿出来看，就是烂片。,0
0,25863024,仙球大战,晓思丽英,141280799,还行,2017-11-20,03:12:46,518,0
0,25863024,仙球大战,初犬,chuquan,很差,2017-12-25,00:47:26,我想看踢球啊！说好了踢球的为什么总是不踢球啊！,0
0,25863024,仙球大战,秋槿色海棠,7509548,很差,2017-07-18,23:11:55,何老师。。。。,0
0,25863024,仙球大战,李老八,150532300,力荐,2017-07-19,17:35:32,拍的非常好，顶，支持中国电影，有希望了,3
0,25863024,仙球大战,快乐卟卟,155672072,还行,2017-07-04,23:42:39,本来的初衷就是为了让人开心，只要好玩就好，大爱何老师。,1
0,25863024,仙球大战,cilei,4545627,很差,2019-07-26,11:42:30,刘镇伟近些年的片子水准下降严重，加上快乐家族那就烂片的巅峰之作了！各种拼凑的天外飞仙一样的角色，尴尬或者低档的笑点，实在还不如看快乐大本营，最后跳舞的CG蜂腰肥臀妹子是什么鬼？,0
0,25863024,仙球大战,熊杰No,XJRick,,2021-05-30,10:00:20,打卡,0
0,25863024,仙球大战,梁眼看电影,movie-liang,很差,2018-02-01,14:56:56,实际上，本片的最后十分钟就其cult质感和脑洞的飞跃性来说，是刘镇伟近几年的作品里比较难得一见的,1
0,25863024,仙球大战,叶不羞的嘲讽脸,148387562,很差,2017-07-01,13:44:44,太能扯了，可怕,1
0,25863024,仙球大战,黑翼群狼,71974219,很差,2017-08-13,13:14:48,一星，妥妥的,0
0,25863024,仙球大战,better me,157597700,很差,2017-07-22,23:36:25,垃圾,0
0,25863024,仙球大战,mingming1988,54107765,很差,2020-03-20,13:02:46,不得不说，真TM有创意,0
0,25863024,仙球大战,夏染,49983396,很差,2017-06-30,20:49:24,越看到后面越雷人，尴尬症都要犯了,7
0,25863024,仙球大战,洋葱,yzone,很差,2017-07-25,20:30:12,中国神仙对战美式英雄，真是够了,0
0,25863024,仙球大战,茴香包子,150033117,较差,2017-07-02,17:34:47,烂片该有的它都有了，教科书呀,5
0,25863024,仙球大战,春垓,horadric,很差,2017-07-23,17:52:05,渣渣渣,0
0,25863024,仙球大战,NNnnNN,teechy,很差,2017-07-23,19:46:54,最后一次。。。。,1
0,25863024,仙球大战,skyline,1250982,很差,2017-07-25,21:29:47,刘镇伟不断刷新自己的下线，快乐家族又一次证明只要出演必属烂片的铁律,1
0,25863024,仙球大战,自燃，风月同天,nowandnever,很差,2018-01-03,22:16:46,看完哈哈一乐都很难，天雷滚滚,0
0,25863024,仙球大战,天涯.........,127225715,很差,2017-08-11,23:45:32,做人不该这样,0
0,25863024,仙球大战,赵伯鼠zFy,zhaofuyuworld,很差,2017-07-24,15:46:10,白瞎了一众明星。。刘镇伟应该是给这些明星洗脑说拍一部内地版的东成西就，结果高估了自己的实力，江郎才尽后的他很难有翻身之作了。,0
0,25863024,仙球大战,豆瓣酱,119806823,较差,2017-07-01,14:13:36,片是真烂，何老师还是好好主持综艺节目吧,7
1,25863024,仙球大战,永恒星鲈鱼,z286424115,很差,2017-08-21,15:59:25,电影讲述古代中国人和美国超级英雄踢蹴鞠，中国人赢了的故事。编剧敢写导演敢拍，扬我国威爱么拆尼斯！有梦想谁都了不起，推荐给热爱战狼的粉丝们。,3
1,25863024,仙球大战,StanlyGK,84250012,很差,2017-07-02,14:07:31,恨谁就带谁去看系列,6
1,25863024,仙球大战,爱哭的女王,159467414,还行,2017-07-10,10:33:49,为了何老师打的三分，不喜欢，不好看，搞笑的部分一般，没有深意,0
1,25863024,仙球大战,Dickov,119313484,很差,2017-07-01,14:25:45,何老师，我是您的歌迷。。。。。,1
1,25863024,仙球大战,哔哟哔,61150890,很差,2017-07-19,19:15:43,我以性命担保的烂片,0
1,25863024,仙球大战,猫咪,142536551,很差,2018-12-28,09:00:37,名字很大气，内容很无语。一堆乱七八糟的人物乱凑在一起。,0
1,25863024,仙球大战,Kevin,87199816,,2018-01-19,15:20:42,快乐家族友情出演,0
1,25863024,仙球大战,简兮,betterwong,很差,2017-07-31,15:33:27,一星都嫌多！,0
1,25863024,仙球大战,欺霜傲雪,49872790,很差,2017-09-30,08:42:58,阿家的诶就这个，阿家的吴长不高了。,0
1,25863024,仙球大战,momo,127589017,还行,2017-06-30,10:29:54,twins合体啦,3
1,25863024,仙球大战,Fuji Syusuke,159449595,很差,2017-12-03,13:30:33,好想给零分。,0
1,25863024,仙球大战,lain,2567602,很差,2017-07-22,13:59:42,国产片从最贫民的烂片到虚有其名的大制作烂片片到明星效应甚至男神女神撑起的烂片片到强行使用传统IP的烂片齐上阵对抗美国电影入侵的yy电影，恐怕是这十年政治最正确的电影了。话说用人家的形象给版权了没？其实挺好的，这十年电影圈自欺欺人歌舞升平的击中展示，很有历史意义。,1
1,25863024,仙球大战,The sail,45329533,很差,2018-02-16,23:07:16,快乐家族烂片保证。那些花钱进电影看这种电影的都是在犯罪！,0
1,25863024,仙球大战,榆兮奈若何,150934220,很差,2017-07-10,22:08:56,坐在电影院里的我觉得购票的时候一定是脑子抽了,1
1,25863024,仙球大战,jeffchuwei,jeffchuwei,较差,2018-06-03,15:19:13,刘镇伟为什么要在这条路上坚持这么久,0
1,25863024,仙球大战,不許動,47190086,很差,2018-08-26,02:25:00,哈哈哈，看到分类灾难片真是笑出来了。有才的人真多,0
1,25863024,仙球大战,楚留香老臭虫,musa5,很差,2018-03-20,18:26:25,刘镇伟终死于特效,0
1,25863024,仙球大战,安仔大kuma,stompbabe,,2019-03-26,19:27:34,我。。。错。。。了我为什么要复制全页链接，下了个球。何炅还画眼线，娘滴很。特效是1毛钱做的。,0
