page_index,movie_id,title,username,user_id,rating,date,time,comment,useful_count
1,30304994,奇异博士,阿豆,157771214,力荐,2022-06-06,06:42:17,哇哦 one of the doctor stranges太邪典了 好玩 ,6
1,30304994,奇异博士,僵尸不美,meijiangshi,还行,2022-06-24,08:19:52,啊奇奇怪怪,1
1,30304994,奇异博士,小鱼,45339694,推荐,2022-05-08,10:02:02,I am entertained,1
1,30304994,奇异博士,张咏轩Wayne®,55617091,推荐,2022-05-06,14:50:40,疫情三年最棒的科幻片，场面宏大，细节考究，延续第一部穿梭时空和宇宙的特性，这回借America Chavez的超能力更加肆无忌惮，想象力和执行力齐飞，特效场面给足经费，尤其旺达作为反派，更需要天马行空的创意投入，这回恐怖大师山姆雷米坐镇，风格突变，宇宙世界充满暗黑元素，更有导演经典系列《鬼玩人》的致敬画面，丧尸版奇异博士出笼，多元宇宙的神鬼齐集，以及重度黑化后旺达的凶神恶煞，令整部电影富有诡谲耸动的观影效应，在漫威宇宙里也难得再现接近R级水准的惊悚穿插，终局之战后又一次大批量超英的牺牲，战后PTSD应激效应的惨烈，让人印象深刻，但有一说一，导演的水平和风格，完全撑住了这次文本的孱弱和原漫画改动删减的问题，比如旺达的强大和自刎难顺理成章，博士强做配，America沦为工具人，莫度的含糊处理。,8
1,30304994,奇异博士,River Run.,Hofnburn,推荐,2022-05-06,15:26:47,彩蛋有点吓人哈,6
1,30304994,奇异博士,Getaway,GeTaway23L,较差,2022-05-08,09:12:07,旺达实惨,6
1,30304994,奇异博士,TouMing櫃子,Ophelia1022,较差,2022-12-01,11:07:50,@2022-06-30 13:14:52,0
1,30304994,奇异博士,张淼杰,61051130,还行,2022-05-07,12:57:35,一般般,3
1,30304994,奇异博士,Robert Downey J,200191953,还行,2022-05-06,11:36:39,对于美国小姐这个新人物，漫威塑造的不够立体，如果新生人物更加饱满会有助于新人物挑起大气，利于漫威未来发展。而且作为打开多元宇宙的这部电影，到底开启了什么？旺达作为焦点人物就这样割啦？,16
1,30304994,奇异博士,阿丽虾,61282100,力荐,2022-05-16,18:26:28,尽管我不快乐，但是也为不必经历那些痛苦而感激。,11
1,30304994,奇异博士,大洋洲,130004835,还行,2022-05-06,09:18:46,2.5，多元宇宙的开启算是漫威影业的里程碑吧，但这并不是漫威最正确的一步，他们并没有完全处理好多元宇宙的异同和博弈的能力，以至于现在每部新作看起来都无趣至极，只能通过其他宇宙人物的集体降智而理顺剧情，最后就是丢了西瓜，捡了芝麻。奇异博士第一部还是爽的，第二部只能说平平无奇，全靠些惊悚恐怖的元素提升观感，Doctor Strange彻底沦为工具人，人设方面没有任何进展，Wanda在剧集里要复活丈夫，在电影里要寻找孩子，最后的情绪转变也不够充分，还要卖波劳力，美强惨本惨无疑了。,22
1,30304994,奇异博士,NarvikAustin,7632975,力荐,2022-05-06,15:31:01,为了让恐怖效果加倍，伊丽莎白奥尔森硬是化妆成了维拉法米加… ,7
1,30304994,奇异博士,Tonyjiang,Sherlock1227,还行,2022-10-17,14:11:44,莫名其妙的剧情,4
1,30304994,奇异博士,Lavinia,conanwansui,推荐,2022-05-10,09:01:00,这不是奇异博士2是猩红女巫1，奇异博士在自己的独立电影里打了个大大的酱油战斗力不行不说最后的心理战还是靠的是阿麦丽卡的大招。好看是好看但是太tm惊悚了。X教授出场的时候简直沸腾了这是什么跨世纪梦幻联动！可惜转眼被旺达拧脖子总有种不孝女旺达弑母的感觉23333... 旺达演技大赞贡献了好多泪点～另外法师和法术攻击终于站起来了嘤嘤嘤！！！,9
1,30304994,奇异博士,独居老人莫里斯,83047631,还行,2022-05-09,06:11:04,蜘蛛侠的成功就源于大众妄想的情节都实现，因此这部的败笔就是我们想看的多元宇宙钢铁侠没实现。其实都是在讲旺达，却还把旺达的妆画那么丑。给接盘侠导演加颗星,3
1,30304994,奇异博士,巧克力维他奶,69694769,推荐,2022-05-06,13:58:03,Wanda老婆好帅55555第四阶段最好看的一部了（和Christine每个宇宙都be怎么那么惨……,5
1,30304994,奇异博士,观察机,85335516,还行,2022-05-07,09:34:17,经典恐怖片元素大集合，每一幕都可以name that movie，对于MCU来说是个新选择。Wanda风头很劲，几乎忘了这是奇异博士主场。,5
1,30304994,奇异博士,№ nickname,189670497,推荐,2022-05-07,10:53:22,老爹说，要用魔法打败魔法。,3
1,30304994,奇异博士,Parity,191096149,推荐,2022-06-22,18:32:21,"4-
奇异博士之你幸福吗
假如？之人玩鬼
绯红女巫之妈的多重宇宙

第一幕节奏凌乱，第二幕仿佛开了倍速，单看剧情让人哈欠连天，但第三幕疯狂终于不再仅限于视觉呈现，终于有一个铺垫完整的惊喜设计。剧本无力吐槽，光照会弱不禁风，但若是补天而成，也有几分错进错出圆成的快感。

视觉上乱得有想象力，奇异博士系列就该如此。诚实的体感让我认为这是漫威一坨又一坨s后做出变化的最爽的作品

宿舍显示屏外放和舍友一块看，也有点电影院的感觉

",3
1,30304994,奇异博士,萨丽,sa_li,推荐,2022-05-05,09:14:12,还挺有惊喜的， 5/4 preview @ AMC,13
1,30304994,奇异博士,vsjvegzh,83061848,还行,2022-05-08,13:09:08,虽然魔法系的东西很吸引人，可是真的好无聊啊,7
1,30304994,奇异博士,Cosine 万一,Cosine.K,力荐,2022-05-06,12:46:30,这个巨型刀片给我刀哭了，不要再折磨她了🥹要是能在影院看该多好啊漫威能不能不要再作了？,7
1,30304994,奇异博士,Gogo,ruo619,推荐,2022-05-14,20:35:42,挺好笑的,0
1,30304994,奇异博士,burckyhuang,191374591,还行,2022-05-06,12:44:08,特效看得头都晕了 旺达之前那么正派的形象这里面更个鬼一样…真是疯批妈妈的多元宇宙,12
1,30304994,奇异博士,斑马,141037312,推荐,2022-05-05,15:30:38,心疼旺达,8
1,30304994,奇异博士,Mr.kevin,202904694,推荐,2022-06-23,22:17:41,据说这部反派是绯红女巫,11
1,30304994,奇异博士,TK,57565659,推荐,2022-05-16,13:46:31,甚至当惊悚片看也可以,0
1,30304994,奇异博士,yellowcut,132703781,还行,2022-05-10,06:56:32,漫威战力成谜,1
1,30304994,奇异博士,Vince,129732283,力荐,2022-05-10,08:51:56,特效真的赞👍 故事虽然老套但为了将各种魔法效果串起来也算不错了！很有想象力的作品！,2
1,30304994,奇异博士,怪味小胡豆,zz_lucy,还行,2022-05-14,10:47:17,hmmmm这个绯红女巫编剧真的没有处理好,1
1,30304994,奇异博士,Heinrick,69955423,还行,2022-05-08,15:16:30,那些不愿放下的人最后都成了漫威宇宙的反派了吧,5
1,30304994,奇异博士,Kugratteiseyae,230501362,推荐,2022-05-05,16:36:40,谢谢你 旺达 不论是黑化还是丧尸化都如此美丽,18
1,30304994,奇异博士,玫瑰玫瑰我爱你,120592140,,2022-06-06,05:36:34,属于要么不看要看一定要去影院看的电影,4
1,30304994,奇异博士,是玖月啊,36191105,还行,2022-05-19,16:44:35,看完就觉得怎么说呢，每个人都有遗憾，都想要完美，可是选择了就不能后悔,2
1,30304994,奇异博士,Rachel小姐,rachelff,推荐,2022-05-23,07:02:42,呜呜呜呜Wanda my Wanda,7
1,30304994,奇异博士,Simon,simonhuangzhe,推荐,2022-05-06,08:09:36,节奏很快的同时居然保留了一些空间来发挥雷米的恐怖片特色，甚至中间很黑色幽默地出现了动画式的打斗，很鬼玩人了。PS:一定要留到最后看彩蛋。,3
1,30304994,奇异博士,Leo,191287270,推荐,2022-05-05,16:51:58,"7.5）我不觉得最后的""嘴炮感化""是什么败笔，我甚至觉得这是最好的方式。
拜托，这是电影宇宙，不是漫画宇宙，而且也点明了是616主宇宙。它没有办法像漫画的大事件一样抹除一个编号宇宙，就算可以操作类似的重启宇宙行为，但是现在也还时候未到吧。所以在把旺达推上了战力天花板的前提下，收束这条线就需要更引出更高的战力角色，显然这部的体量已经容不下了，而且这是奇异博士2，又不是旺达1，所以后续的布局还是要考虑奇异博士。
最后，旺达这部里做的所有事都是基于她母亲的这个身份，在她最爱的孩子面前展示出了最凶残的一面，到这儿就意味着她只能结束这一切了。唯一的遗憾是我以为那句universe的台词是旺达的，结果不是。
奇异博士可以开启另一条线了，更好奇的是漫威到了这一步后续的计划应该很多吧，别搞成大杂烩就好。",1
1,30304994,奇异博士,ceci,1531878,还行,2022-05-06,14:15:11,我还以为我在看恐怖片，旺达从镜子里出来那块我以为我看到了贞子。丧尸史蒂芬出场我以为我看到了夜王。现在超英片真不用去管剧情如何了，特效还是非常精彩的，看了个上午特价场打发时间还不错。,4
1,30304994,奇异博士,豆友219597848,219597848,还行,2022-05-08,09:01:48,"7.3分吧，也许是我期待太高了，看完有些失望。本该是MCU下一阶段的奠基之作，结果成了混乱的多元宇宙闹剧，干脆直接拍成个恐怖片得了。论剧情不如复联4紧凑，论致敬还不如三蛛同框。老X教授辛苦了，又死了一次。幸好卷福和旺达没让我失望。
这片应该母亲节上映。总结：终究是母性拯救了世界",4
1,30304994,奇异博士,junojunojuno,130144497,还行,2022-05-07,10:58:54,漫威版贞子寻子记+行尸走肉 Rachel依旧好美 ,6
1,30304994,奇异博士,猪大勇,shushibi,推荐,2022-06-25,23:26:34,剧情老套但是漫威粉狂喜🥹,0
1,30304994,奇异博士,small orange,195670209,还行,2022-05-16,18:04:29,看到光照会还是很惊艳，女巫大杀四方，现阶段除了雷神凤凰应该没有人可以和她抗衡。瑞秋还是那么美！,1
1,30304994,奇异博士,諸行無常,tumi_ex,推荐,2022-05-10,07:44:55,Sam Raimi能不能出这样一版Director's Cut，开头就这样：奇异博士和旺达，王，美国妹妹一起开车前往一个林中小木屋度假...那么问题来了，车谁开？,2
1,30304994,奇异博士,苏简希ai装死,boweidasabi,推荐,2022-05-15,01:28:51,可怜的小旺达只想做个妈妈,0
1,30304994,奇异博士,亚亚,iloveyouidiot,还行,2022-05-14,20:27:01,2022實體電影第一場：很不錯的爆米花電影，適合週中下班去看，沒有這些視覺效果的電影估計會睡著。同事的評價挺中肯“不是不好看，但是不是期待的Dr Strange”。,1
1,30304994,奇异博士,月球上的人,sungokong,还行,2022-05-12,14:58:32,漫威电影宇宙第四阶段终于支棱起来的一部。逻辑合理，叙事流畅，在越来越复杂的角色背景中承接过去与未来，用恐怖片的手法呈现（比隔壁DC温子仁的海王处理得更好）。绯红女巫真不愧为欧米茄级别的变种人，无论惊奇队长还是至尊法师在她面前也只是个杂兵，最后也没有被打败而是被劝服。,4
1,30304994,奇异博士,平井桃,207621405,力荐,2022-05-10,07:07:33,好想wanda的一切 好喜欢她 还有我的strange 为爱也要打5分。（这次特效打戏都做得爆炸好）,3
1,30304994,奇异博士,漆皮狼,43712380,,2022-06-28,01:33:08,这季会有更多情感戏吗？,0
1,30304994,奇异博士,灰色幽默,188258757,推荐,2022-05-16,18:28:10,"好看是好看,但我的瑞秋更好看",7
1,30304994,奇异博士,momo,131369134,推荐,2022-05-07,11:01:12,旺达鲨疯了,1
1,30304994,奇异博士,起司玉米,3731229,还行,2022-05-09,23:26:12,多少有点闹着玩的感觉,3
1,30304994,奇异博士,J,195379902,推荐,2022-05-23,04:54:11,3.5 stars,2
1,30304994,奇异博士,玩胶佬Alex,alexzhang2000,推荐,2022-05-10,09:28:38,剧情还是漫威那一套，依然没有让我有什么强烈的情感波动，不过娱乐性还是很强的，从头到尾几乎都在砸cg烧钱。然后还有点克苏鲁，鬼片，丧尸片的元素，就是jump scare在其中一段剧情简直是滥用有点影响观感。整体运镜还是看的很舒服的，不愧山姆雷米居然在某些镜头上让我有种在看老超英电影的感觉。另外就是那几个剧透出来的角色完全就是炮灰并且可以被替代，浅骂一句联动就完事了要什么剧情😅再说点题外话，不知道为啥感觉这片3D效果还比不上贴片的阿凡达2…,7
1,30304994,奇异博士,四五六七,113414299,还行,2022-05-08,13:13:18,剧情一般，看得出来导演应该玩得比较开心。,4
1,30304994,奇异博士,电锯克里斯,169712339,推荐,2022-05-14,19:02:04,作为恐怖片迷，我很喜欢这部电影。好过《英雄远征》，远超这两年的漫威电影水平，导演水平不赖。,1
1,30304994,奇异博士,Bayes_Dan,faithfung,推荐,2022-05-09,05:59:16,恐怖片元素太经典了，深得我心～ 和Wanda的剧衔接也不错,1
1,30304994,奇异博士,混吃等死的废物,180483475,还行,2022-05-06,12:34:42,"本质上是一部以魔法与平行世界为载体的公路片，美国小姐的形象就像是魔法出租车，让旺达和奇异博士二人通过面对另一个世界的自己来修补内心的缺口
旺达与梦中的美好家庭，奇异博士与错过的克里斯汀，都是被美好粉饰过的疮疤，凭空消失的五年让我们失去了至亲（猫、子女、爱人），这种后疫情口吻加上梦中的多元宇宙（我们会梦到逝去的人，但他们会活在另一个宇宙中）给了人们一个逃避主义入口，旺达的疯狂与博士的偏执都是失去亲人后的PTSD写照，而最后的和解则更像是一个安慰剂（他们去的地方虽然没有我们，但会有人爱他们，放下吧）
PS:旺达对战光照会更像是“五月广场母亲”倾泻对专制男权的愤怒（他们的傲慢夺走了我的孩子）与LGBT家庭形成了本片左派表述，但背景板中大量出现的亚裔和远东多神教符号的眼魔入侵配上后疫情口吻可不太友好",10
1,30304994,奇异博士,钢椒,162268423,力荐,2022-05-06,16:23:08,奇异博士2：疯狂的旺达杀戮宇宙,5
1,30304994,奇异博士,。,248886280,力荐,2022-05-06,10:31:15,绯红女巫1,6
1,30304994,奇异博士,King,162387773,还行,2022-05-05,15:01:33,So cult and so much drama that I hardly believe this could be a marvel movie lol,4
1,30304994,奇异博士,看剧达人,203859413,还行,2022-05-10,00:16:49,我挺喜欢奇异博士这个人物设定，但是多元宇宙搞得我头晕……,1
1,30304994,奇异博士,。倏橘,46365473,推荐,2022-05-14,21:40:29,导演对恐怖片有什么执念，第一次见漫威融合这个元素，还挺新颖。不过用多了也烦，甚至有点想笑。,0
1,30304994,奇异博士,何必认真呢,Immafrady,推荐,2022-05-15,09:54:59,看完了枪版。剧情上感觉很完整，至少整个故事都讲好了，没有说啥很刻意的转变，这点好评（因为最近的漫威电影感觉故事都怪怪的），等正式片源出来了再二刷吧～,1
1,30304994,奇异博士,wbullet,50391993,推荐,2022-05-08,09:01:53,Wanda Maximoff，从出生就没过过一天好日子的终极悲剧角色，虽然漫威的低端处理方式还是把她沦为了plot device，但她依旧是最吸引我的女性角色类型：原生的悲惨和为爱燃烧造就的极致疯狂（Strange和Christine——我的House和Cuddy完美代餐！cnmcnmcnm,12
1,30304994,奇异博士,长泽雅小美,130725928,还行,2022-05-06,12:29:42,could be better,2
1,30304994,奇异博士,杜鵑,154591365,还行,2022-05-10,02:58:32,雷米親自拍的雷米彩蛋電影，屍變招牌鏡頭，evil me，地獄魔咒式結尾被彩蛋稀釋蠻讓人不悅，多重宇宙梗比蜘蛛人好上太多，但情節趕趕趕趕到有點失神⋯⋯中間FPS好像有換，連文戲也是，看完眼睛非常疲勞⋯⋯,1
1,30304994,奇异博士,徐徐森森,xuaoling,推荐,2022-05-15,00:38:28,果然是导演的风格，旺达的形象确实杀人如麻。奇异博士远程控制丧尸奇的时候，百鬼噬身的特效如果是用来拍仙侠片就好了。,0
1,30304994,奇异博士,Simon,151063870,力荐,2022-05-10,02:37:58,词穷，真的只有牛逼沃艹可以言说。故事其实很简单，但由于缤纷多彩的场景和彩蛋层出不穷，导致观赏性大大提高，里面的好多场景都堪称经典，国外的影院里会出现一阵阵惊呼，WTF！是的，是真的惊喜。另外，绯红女巫的戏真的可以和博士比肩，甚至犹有胜之，可以称之为《奇异博士2之绯红女巫大杀四方》。里面的彩蛋太多，以至于需要专业影评人长篇大论一番才行，总之，强推力荐！！！,3
1,30304994,奇异博士,奈亚托菲斯,164564670,还行,2022-05-06,14:20:51,旺达寻亲记，相对于三蜘蛛同框，已经不错了。漫威在复联4之后算是走了一步大的，这部续集线索很多，也很杂，特效和部分镜头设计巧妙，动作戏也不错，唯一不足的就是剧本的节奏，前面过于松散，导致进入中期开始疯狂加速，旺达的人物矛盾还算可以，抛开恶意植入那啥广告的因素，勉勉强强也说得过去，中等偏上的水平吧,4
1,30304994,奇异博士,清水和豆腐,chidoufuma,还行,2022-05-09,23:23:35,说真的 这种电影拍第一部就够了 挺好的 非得整二 看的下面这么多人还在拼命写影评看着更难受了 ,1
1,30304994,奇异博士,Iker,Ikergzy,力荐,2022-05-14,23:24:36,"Black Bolt: 🤯, Mr. Fantastic: 🍝",0
1,30304994,奇异博士,☆lu❤lu★,superEmiLy,力荐,2022-05-15,16:55:22,影院效果很棒,2
1,30304994,奇异博士,秋庭怜子,98362865,推荐,2022-05-10,05:59:21,这不是多元宇宙，这是魂穿。而且这是恐怖片吧,3
1,30304994,奇异博士,一只迷茫偷懒鸭,41787565,推荐,2022-05-10,00:14:51,人活得久了真的什么都能见到，实在没想到有一天我会因为看了漫威而做噩梦……看之前还是哎呀归根到底漫威都是合家欢we're family 啦，看的时候：贞子爬出电视、丧尸追赶、魔鬼缠人、突如其来地冒头、直白地追杀超级英雄……我还是个孩子真的吃不消。导演不愧是拍恐怖片出身的，恐怖吊诡悬疑惊吓元素样样齐全，尤其是看着曾经如此理智慈祥的角色突然入魔，结结实实的心理阴影。虽说全片逻辑上有点乱，来不及认真解释便又赶去下一个场景，不过画面上和剧情独特性上面可以给个不错的分数，就是很好奇后面的电影如何衔接。,2
1,30304994,奇异博士,拉bt,151114983,推荐,2022-05-08,15:29:35,有几个地方有潜行者那味了,2
1,30304994,奇异博士,SteadytheBuffs,Sherlock.B,还行,2022-05-10,04:09:59,啊啊啊Wanda！(Also Captain Carter!),0
1,30304994,奇异博士,添添吃不饱,173991006,力荐,2022-05-05,17:20:54,"旺达这个巫婆怎么能这么厉害(o^^o)
缺点就是没想象中那么疯狂
感觉奇异博士有点鸡肋
全程旺达自嗨真的很爽
恐怖片风格很喜欢！",15
1,30304994,奇异博士,setns,252653660,还行,2022-05-08,13:09:36,博士越变粤菜，连个章鱼怪都打不过。,11
1,30304994,奇异博士,周子舒心上钉,146088684,推荐,2022-05-06,10:02:35,有点惊悚片效果，x教授真-客串，卡特是个惊喜但是盒饭领的太快🚬旺达要早有这战斗力灭霸在她手下大概走不出三个回合。期待博士3,4
1,30304994,奇异博士,歇斯咖喱,elisha_gai,推荐,2022-05-09,22:51:24,呜呜呜旺达好惨啊呜呜呜呜，奇异博士还是一如既往地帅啊我的天……I love you in every universe 真的给我狗眼都亮瞎了。这部还可以，有点次元壁打破的感觉，还夹杂了丧尸元素芜湖。,0
1,30304994,奇异博士,陌上零花,4713987,还行,2022-05-10,00:52:39,好敷衍的剧情哦，，，其他宇宙的神奇先生卡特队长惊奇女士x教授的酱油也太齁嗓子了，，，，仿佛美剧搞笑篇，倒霉旺达又洗不白了，，一黑到底吖，还不如看漫威剧集带感,1
1,30304994,奇异博士,calendar,94151298,推荐,2022-05-10,02:48:41,奇异博士大概是两部单人电影间隔最久的一个吧，第一部好像是2016年，等啊等终于等来第二部，但这部到底是奇异博士单人电影还是旺达单人电影…其实故事有点单薄，有点为了编而编，视觉效果还是很厉害，恐怖片风格也算是漫威的新尝试。奇异博士和Christine的对手戏还蛮喜欢的，Rachel好甜，I love you in every universe。,0
1,30304994,奇异博士,yupian,yupian,推荐,2022-05-08,11:00:08,happy Mother's Day you all.,5
1,30304994,奇异博士,crystal,4456648,推荐,2022-05-09,05:24:19,导演风格非常明显的漫威作品，汇集很多经典恐怖元素，是一次大胆尝试。某人刚说完配乐不错随即又来了一段音符大战。,3
1,30304994,奇异博士,Mogwo,140175882,较差,2022-05-08,15:22:23,太过正确，无聊至极,9
1,30304994,奇异博士,渭川,weichuan,力荐,2022-05-06,14:51:36,i love you every universe！打算再看遍奇异博士1,0
1,30304994,奇异博士,时蓝,154444442,力荐,2022-05-09,23:11:26,诡异中有一点猎奇 但在超英片里确实很惊艳,1
1,30304994,奇异博士,Gil-Estel,166792576,还行,2022-05-06,14:15:43,"其实有点失望，还是更喜欢奇奇第一部。这部有点没头没脑，向恐怖风格的尝试还是有点子不适。但是真的心疼steven，每个宇宙都不能和爱人在一起。
I LOVE YOU IN EVERY UNIVERSE. ",3
1,30304994,奇异博士,苹果玛,94782987,力荐,2022-05-10,05:42:48,奇异博士永远不让人失望！！一层哥特惊悚美学的皮底下是恶龙和深渊的故事，一直觉得奇异博士是漫威宇宙最值得好好挖掘的角色,2
1,30304994,奇异博士,饭晚吃不子胖赵,ZZT0509,还行,2022-05-06,16:18:12,除了特效和创作自由外，全是空洞无灵魂的玩意…,3
1,30304994,奇异博士,Higtub,72093505,力荐,2022-05-06,15:09:13,漫威会了，流行文化大杂糅加点老ip点缀下，这套还能玩十年,0
1,30304994,奇异博士,勾陈一,linyoung,推荐,2022-05-09,23:40:01,漫威黑暗版多元宇宙系列，太多配角的加入，可惜剧情看下来好混乱，沦为爆米花电影，画面也多了几分恐怖，最后为了卷福加一星。,0
1,30304994,奇异博士,蔚蓝的海盗旗,34139361,推荐,2022-05-07,12:48:31,MCU已经开始转型恐怖片了😂,2
1,30304994,奇异博士,微信用户,254522619,力荐,2022-05-06,09:25:20,fan service on point,1
1,30304994,奇异博士,包菜丝全自动,82090302,推荐,2022-05-14,11:39:06,虽然一度以为自己在看丧尸片！但是好看的！,1
1,30304994,奇异博士,anay,216418561,力荐,2022-05-18,16:55:14,看完了，好喜欢这个美国小姐，旺达这个反派塑造的绝了，从不理解到最后的释然，奇异博士与克里斯汀的爱情也好感动啊。,4
1,30304994,奇异博士,素素,168767316,力荐,2022-05-15,07:37:08,好喜欢这种妖异迷幻的感觉，不过横向的第三只眼实在是太难看了……,3
1,30304994,奇异博士,馬峯,173365087,推荐,2022-06-27,02:09:29,啊?,2
1,30304994,奇异博士,zuo,175920440,力荐,2022-05-12,04:22:13,这是恐怖片吧……不过巨好看,5
1,30304994,奇异博士,St.hanshaugen,sjndbl329,推荐,2022-05-14,23:00:27,整个故事里所有人除了Wanda 都毫无计划，情节推进全靠意外，应对的方法全是打架，各种打架，翻来覆去的打架，这个故事如果能换成Wanda视角应该能好很多吧。,1
1,30304994,奇异博士,chewpinn,chenxijessica,推荐,2022-05-18,14:11:50,最近Multiverse电影真多啊。论好看还是Into the spirderverse第一,2
1,30304994,奇异博士,OiShii,137993858,还行,2022-05-06,06:50:46,部分段落极佳，但凑到一起就显得乱/血腥恐怖元素挺含蓄了，但还是很难想象有那个爆浆镜头还能被分级成12A/旺达是一天正常日子都没过过啊…….,5
1,30304994,奇异博士,纯k自动连网,stephanie5uu,推荐,2022-05-15,02:49:28,场次正好和FA Cup决赛撞了，看完电影发现比赛居然没完，开始点球了，立刻跑进隔壁pub看了紧张的结局。在另一个宇宙里可能90分钟内就定胜负，完全一个错过哈哈,0
1,30304994,奇异博士,理直气壮江湖骗子,211605456,力荐,2022-06-24,14:33:28,奇奇奇奇,5
1,30304994,奇异博士,whis,whiskii,还行,2022-05-09,05:54:03,最近太多多元宇宙,1
1,30304994,奇异博士,易安,51504811,还行,2022-05-15,03:08:18,离大谱中又有点逻辑 装逼中又有点被帅到了,0
1,30304994,奇异博士,davidsoon,74538885,推荐,2022-05-14,21:28:50,挺搞笑的,0
1,30304994,奇异博士,夏琏玖。,cornel1a,推荐,2022-05-23,08:34:45,脸盲的我以为Witch和Christine是一个人lol,4
1,30304994,奇异博士,般木般木,banmubanmu,推荐,2022-05-15,00:09:29,看过《旺达幻视》的，都会心疼旺达。从西景镇到多元宇宙，都不过是幻梦一场。,0
1,30304994,奇异博士,废物喵神李二狗,32777865,还行,2022-05-14,19:37:07,这是啥？都是同行衬托得好？,0
1,30304994,奇异博士,≧▽≦蚊米,Gmosquito,推荐,2022-05-10,05:04:16,虽然看出了恐怖片的赶脚，但逻辑太强让人信服哈哈哈哈哈,1
1,30304994,奇异博士,高田,TAKADA,较差,2022-05-18,13:10:25,看得太累了,3
1,30304994,奇异博士,Bodhi,Cros,还行,2022-05-06,17:28:57,俗烂剧情，为了家庭为了爱,15
1,30304994,奇异博士,3dayslater,ShendowGreen,还行,2022-05-08,10:27:21,疯狂丧尸,2
