page_index,movie_id,title,username,user_id,rating,date,time,comment,useful_count
0,30304994,奇异博士,Lexlo,189050142,力荐,2022-05-05,16:02:38,正如二十年前托比版蜘蛛侠定义超英电影形态山姆雷米再次用个人擅长的恐怖原素开启疯狂多元宇宙纪元。个人风格极强的充满怪异黏糊糊视觉恐怖生物辅以巨大冲击力让人惊呼，本尼和奥妹表演也把人物冲突发挥到极致，王不愧是新人气王哈哈。终于迎来了著名的智商天团光照会（可惜没我托尼）卡队等人每次出现都是巨大欢呼。真正意义上突破mcu模式不仅是恐怖原素各种死亡也完全意料之外的惨烈，女巫已经让我有“世上再无变种人的压力”情感丰富探讨人战胜诱惑与自己和解战胜心魔，第四阶段大胆创新尝试风格仍在继续。最后一很多人期待的靓汤版平行铁人现在的消息是计划改动把他放日后了，我们静待。期待老婆奥妹日后回归,111
0,30304994,奇异博士,咯咯精,gegejing,推荐,2022-05-05,16:27:35,二郎神，我不入地狱谁入地狱，僵尸收小鬼，碎偶像破心结，砸出个未来，后半部分可真棒，想跟雷米进行一些文化交流。,51
0,30304994,奇异博士,厨房守护者,4038094,推荐,2022-05-05,16:16:16,"奇异博士2:绯红女巫1
不堪一击光照会、夷陵老祖史传奇",67
0,30304994,奇异博士,走饭,148423315,还行,2022-06-27,02:24:39,还有x战警的教授，出乎意外算是彩蛋了吧，不过剧情有点牵强，绯红女巫莫名其妙的黑化后又莫名其妙的变好了,36
0,30304994,奇异博士,Mr.CLEVER,225658507,较差,2022-05-16,17:05:36,对多元宇宙的描绘很保守，一点也不疯狂，奇异博士的剧情太僵硬太尴尬，开头一个小怪打那么久，战力很迷,58
0,30304994,奇异博士,finfins,81920498,还行,2022-06-27,02:15:49,想看情绪稳定版旺达,40
0,30304994,奇异博士,Leo,209636973,很差,2022-05-09,00:00:09,2022最期待,43
0,30304994,奇异博士,Gwendolyn婳,152461214,力荐,2022-05-18,14:00:57,真的爽！出了中间一段wanda追逐戏太像恐怖片了有点不敢看，其他都超棒！！🎵攻击这个太炫了….不管是想法还是最后的声音设计都完美！！,33
0,30304994,奇异博士,Elope,180326786,力荐,2022-05-10,09:05:04,大制作是真的牛 全程无尿点 但是也是真的惊悚🥹旺达的结局也是真的难受😢,38
0,30304994,奇异博士,Echwill,s935462178,力荐,2022-05-06,16:09:07,"太过惊喜，完全超出预期。比英雄无归好一万倍的剧情，泪点次数仅次于复联4，叙事风格视听效果绝佳，无数让我泪目的场面（大概是好久没看过如此良心的漫威电影了）旺达第一次dream walking孩子叫他妈妈直接一秒入戏，卷福跟奥妹的演技在科幻电影里也得到了证明，I can do this all day 美队粉狂喜！！！ 
",35
0,30304994,奇异博士,时局,198193305,推荐,2022-05-04,18:18:12,从此打开了多元宇宙的大门。,89
0,30304994,奇异博士,Leon Winters W,adakenndy,还行,2022-05-15,07:17:02,"6/10，多元宇宙讲述了什么故事，又是另一个宇宙的旺达想要自己的孩子，然后就不惜牺牲别人的生命企图复活自己的孩子的命，最后看到主宇宙的旺达和孩子其乐融融的氛围放弃了执念，等等，这不是电视剧旺达幻视的重复2.0吗？所以为啥叫奇异博士2？盘点下我不喜欢其他缺点:
1.另一个宇宙的复仇者光照会，和黑化版旺达交手不超过十分钟团灭，就这？
2.光照会的首领居然是X教授！更可怕的是X教授居然打不过黑化版的旺达，万磁王点赞。
3. 我希望这部电影能有奇异博士自己的故事，而不是整几个僵尸造型就是“黑暗”。这个系列电影院看确实很爽，但是自从复仇者4完结以后，简单的打架爽显然已经不能满足观众阀值。",20
0,30304994,奇异博士,看電影的人,52889164,推荐,2022-05-05,17:33:20,不同于以往的Marvel，血腥残暴看着真是太爽了！开始黑化吧…漫威宇宙！！！,76
0,30304994,奇异博士,吞只河马,54263187,推荐,2022-05-05,16:06:03,人物动机一如既往地孱弱，剧情走向也七拼八凑不大顺畅，旺达的黑化入情入理但是细品就全是漏洞，我还是觉得她爱幻视胜过孩子，不懂为什么会把母爱作为她彻底黑化的icon。但是特效和打戏确实厉害，山姆雷米的惊悚片路数悉数发挥，黑化旺达以及黑暗奇异有几个镜头看的人毛骨悚然。也能看出漫威在初代逝去之后想要探索MCU新发展的心思，比如多元宇宙，光照会，LGBT等等，但这部电影塞得太多，难免让人有些吃不消（倒也没有说英雄无归好的意思），贪多嚼不烂，建议慢慢来。几个克苏鲁的镜头和卡玛泰姬居然颇有几分徐克技术武侠的风格，笑得。总体来说不错的，胆子小的（我）就白天看吧。,31
0,30304994,奇异博士,一块炸鸡,174996132,推荐,2022-05-06,16:17:13,超英到现在的看点就是能在多大程度上进行推陈出新，这部奇异博士虽然没有那么颠覆，但是恐怖元素的植入还是挺带感的。最后Strange对Christine 的告白看得有点泪目了。,36
0,30304994,奇异博士,亚洲锅王,43779652,推荐,2022-06-27,02:13:40,"3.5，特效酷炫，恐怖氛围不错。居家白衣旺达跛脚追人的压迫感很强，又是致敬闪灵跛脚斧头哥了。博士丧尸版很有想象力，多元宇宙闪过的这么多镜头又是累死特效系列，还有漫画版的宇宙吐槽。
缺点就是剧情转折有点生硬，搞定旺达的方式就是那俩孩子这个思路老套，一开始就能预见。表演方面斯特兰奇可圈可点，耍帅严肃两不误，1v1黑化版的自己也不错，可惜博士的女友的表现让我出戏，也就i love you in every universe Get了一下。被旺达秒杀的超英们有点酱油，X教授都被秒了555不能接受。片里还有一些设定有点zz正确的刻意感，不是很舒服扣分。",24
0,30304994,奇异博士,Annetta,141773055,推荐,2022-05-07,13:01:52,好了 寡姐走了 wanda也🈚️了 漫威终于也在我心里rip了 2008-2022,54
1,30304994,奇异博士,杰特法尔,Jeff1831308316,力荐,2022-05-14,22:31:45,这部电影扩张了MCU的多元宇宙，本尼和奥妹的演技再次得到提升，透过两位主演的表演极具代入感，不管是文戏还是武戏都非常具有戏剧上的张力，视觉特效还是一如既往的优秀，疯狂而又有野心的一部佳作，可以视作是一场刺激又惊悚的旅行，导演的把控力使得本片剧情紧凑、严谨，恰到好处。,7
1,30304994,奇异博士,玻璃虾,20948479,推荐,2022-06-06,14:34:29,8/ 使命召唤开了僵尸模式这个头儿，就一发不可收拾了,14
1,30304994,奇异博士,二墨,ermo2046,还行,2022-05-10,06:21:43,3.5🌟里面元素多的令人发指……不过好歹也是一部法师对巫师的电影，想象力画面感还是很棒的。问题就是太杂乱。最大的惊喜是X教授…旺达最后顿悟的时候戳中我的泪点，为影片提升0.5🌟,5
1,30304994,奇异博士,忘尘,224322988,还行,2022-06-03,15:47:28,恐怖片，不是特效片，经费烧的不够,4
1,30304994,奇异博士,LESLIE,188562418,力荐,2022-05-05,16:03:47,魔法组的神仙打架谁不爱,38
1,30304994,奇异博士,Absinthe,3753878,推荐,2022-05-12,15:24:11,真的是一切皆有可能，粉红女巫变老妈，奇异博士变二郎神。,7
1,30304994,奇异博士,chlorophyl,hommie331,推荐,2022-05-18,17:32:17,从蜘蛛侠3过来，发现奇异博士和王都记得spider man?? 那蜘蛛侠3演了个啥？？,5
1,30304994,奇异博士,JellyMoon,80149039,还行,2022-05-10,00:43:19,在电影院里看恐怖丧尸片我真的会谢,8
1,30304994,奇异博士,库库小狗,76667119,还行,2022-05-20,18:34:47,一直很想知道有谁打得过猩红女巫,6
1,30304994,奇异博士,日🌞月🌛星🌟辰,201631532,推荐,2022-06-06,05:37:37,如果我不是女巫粉可能只会打六分 剧情后半段还是有点小感动打戏枪版肯定比不了院线的效果 平心而论没有那么烂也没有那么好,8
1,30304994,奇异博士,雞白,63278789,力荐,2022-05-07,10:14:16,拍成R级恐怖片会更好,16
1,30304994,奇异博士,zhang 2nd,zhanger,推荐,2022-05-06,14:08:36,喊了这么久，多元宇宙终于在这一部真正展开了。就好像灭霸对于《复仇者联盟3》的意义，猩红女巫这次是真正的主角，实力碾压各路超级英雄，有几个甚至是一招秒杀，场面各种残暴不忍直视。山姆雷米作为B级恐怖片爱好者，又过足了瘾。一个疯狂的母亲，即使再怎么乱来，还是让人恨不起来。太伤感了,5
1,30304994,奇异博士,hohohoho猴,141981005,推荐,2022-05-06,11:43:51,网盘见的第五部漫威电影，obviously不会是最后一部。惊悚元素拉满，导演比较好的融合了个人风格与制片人要求。但整体节奏太快了，很多段落为了赶进度都处理的很草率。作为一部奇异博士的独立电影几乎看不到博士的弧光（除了多了一只眼睛）。wanda好美，独立电影gkd,15
1,30304994,奇异博士,黎明名,168576406,推荐,2022-05-06,15:48:50,恐怖电影风格，节奏不拖拉，各种jump scare，前面旺达使用梦游巫术的部分颇有一些邪典气质。奇异博士和美国小姐第一次穿过多元宇宙好像乱入了动漫里的场景，还有绯红女巫从镜子里扭曲着身体钻出来，性转的超级英雄团体光照会(被全灭了，除了莫度)等等，印象比较深。另一个宇宙的文明看起来还是那种旧制度+高科技的搭配，其中NPC面对一个明明已经死亡的奇异博士在活蹦乱跳还能进行调侃是不是不合我们这个宇宙的常理呢？另外关于恶魂、附身尸体等等设定可能是在电影之外有补充？,4
1,30304994,奇异博士,HALYANG H L1H,176588508,还行,2022-05-06,15:46:32,"观感不好  很赶 把神奇先生黑蝠王x博士秒掉真的很无语  粉丝期待了那么久结果战力渣渣真的很伤人的 前半段旺达战力爆表最后被逃亡的美国小姐嘴炮打败  战力崩坏
不是疯狂多元宇宙 是逃亡多元宇宙 很漫威流水线  特效多 电影院看着会很爽 全篇你快乐吗 你不是真正的快乐～一点意义都没有",22
1,30304994,奇异博士,酷布Coolbu,Coolbu9,力荐,2022-05-14,21:22:54,很好看，就是枪版声音画质不怎么好,3
1,30304994,奇异博士,以地之名,crazytan,还行,2022-05-07,10:04:45,太拉垮，只能当作惊悚片看,6
1,30304994,奇异博士,小木,153217402,推荐,2022-05-15,11:09:20,全片核心：母爱的力量是无敌的,3
1,30304994,奇异博士,海边的曼彻斯特,202031282,还行,2022-05-08,09:26:14,相比近年其他漫威电影剧情确实有所进步，比较新鲜，旺达就和闪灵的精神病一样，亡命杀人狂,3
1,30304994,奇异博士,Chris,140020834,力荐,2022-05-08,10:28:41,唯一的不满是旺达竟然完全是反派了，竟然没有别的幕后黑手，这以后旺达还能出现在MCU吗,4
1,30304994,奇异博士,Kusaki.,152522022,还行,2022-06-23,01:34:38,建议立法禁止MCU染指616宇宙。,4
1,30304994,奇异博士,脱脱,deley,力荐,2022-05-06,10:22:38,周四下午首映场看的，虽然之前预告里有一些蛛丝马迹，但还是跟着现场观众一起对每一个惊喜欢呼,9
1,30304994,奇异博士,在线自闭老王,206651195,推荐,2022-05-18,18:19:48,说不上好不好看，但是真的……很凌乱…,6
1,30304994,奇异博士,正在输入···,ACM906876602,力荐,2022-05-06,09:13:08,旺达的打不过奇异博士吗？不见得。旺达输是因为身边有一些叽叽喳喳的小鬼儿让她分心啊！,9
1,30304994,奇异博士,已经注销,tengmac,力荐,2022-05-15,00:23:10,你幸福吗？你幸福吗？你幸福吗？,5
1,30304994,奇异博士,⠀⠀⠀⠀⠀⠀⠀⠀⠀⠀,204901005,推荐,2022-05-16,22:00:43,Wanda真的牛逼，只能自己劝自己死，剧情还可以，只是博士变二郎神我有点难以接受,4
1,30304994,奇异博士,瓦尔德迷鹿,52216539,还行,2022-05-23,04:28:14,有点失望。编不出反派来了，故意让旺达黑化？平行世界的梗有点被用烂了，旧瓶没装出新酒来。,18
1,30304994,奇异博士,stanza,stanza,力荐,2022-05-05,17:06:53,哈哈哈幹有必要這樣嗎這個類型要加上「驚悚」吧Sam Raimi有夠欠揍電影院裡大概有我的尿,37
1,30304994,奇异博士,睿希 Sophia,173663874,力荐,2022-05-12,16:02:20,故事进入了多元宇宙，但感觉越来越儿童化了…但特效真的很棒呀，期待影院还能上映…,9
1,30304994,奇异博士,宋宋宋小凤,167085927,推荐,2022-05-06,09:36:33,旺达:  We are family.！,5
1,30304994,奇异博士,八尾阿呆,Demix9,还行,2022-05-07,11:02:45,…我到底错过了什么。超级英雄电影从什么时候开始变成恐怖片了？ 关于反派，这位女士，那么喜欢孩子的话现在自己去生一个也来得及。,27
1,30304994,奇异博士,Lumity,63920700,力荐,2022-05-06,15:38:21,我爱山姆·雷米,5
1,30304994,奇异博士,雕刻时光,fuckingfilm,推荐,2022-07-04,22:21:25,如果没有DJYSB，可以说是一部不错的爆米花，导演当恐怖片来拍了。之前咋没发现绯红女巫魅力这么大呢！！,0
1,30304994,奇异博士,TheoryofWu,159561133,推荐,2022-05-06,11:45:44,4.5。买成4D的票了椅子摇得头晕/旺达（已黑化）vs奇异博士（已黑化）/黑化的旺达感觉可以扣死我,7
1,30304994,奇异博士,西野鱼竿,209055036,力荐,2022-05-06,11:28:57,"“Stephen, are you happy?”",14
1,30304994,奇异博士,加加酱油,62717714,较差,2022-05-09,05:48:34,刚看完。故事太单薄了。结尾最后那一幕真的没想到。也没想到最大的boss和结局（奇怪？为啥是ta）——至少比蜘蛛侠3好看啊！哈哈哈哈哈哈哈——但美国小姐太工具人了！,11
1,30304994,奇异博士,SaoirSe,44923935,力荐,2022-05-14,21:09:19,谁能告诉我猩红女巫为什么那么美？？？！！！我大喊老婆（破音） @新宿toho,1
1,30304994,奇异博士,是海妖呀,154185386,推荐,2022-05-06,13:55:51,不引进谁吃亏，已经一目了然了，赶紧偷着乐吧,12
1,30304994,奇异博士,Fatigue,181354668,还行,2022-05-22,16:51:59,我吐了，这电影太太太太磨叽了。,12
1,30304994,奇异博士,火钳刘明,228645693,力荐,2022-05-17,22:48:02,脑洞巨大，吸收了不少what if的情节和设定，好评。本片简直是中华文化输出的例子啊，圣殿设计，打斗场景，哪个看上去不是八九十年代武侠片的影子？就因为一个街边报箱要封杀这部漫威大片？电影审查的人大概没看懂？虽然惊恐场面多，但骨子里这是个浪漫片，主题是爱。Wanda的母爱泛滥到多元宇宙都承载不了，为了孩子可以不顾一切。而Dr Strange 虽然在结尾说出了多元宇宙最强情话：“I love you in every universe” ，却没有在任何一个宇宙里和Christine有happy ending，有点遗憾。,10
1,30304994,奇异博士,楚翰彻,141744320,还行,2022-06-22,22:27:07,对桥段和题材钻研的琢磨可谓达到近些年漫威之最了，尽管核心人物理念和《尚气》如出一辙，但就想象力呈现和娱乐效果来说，这种马戏团般的应接不暇确实让流水线叙事版显得没那么碍眼了。PS：诺兰曾经借小丑之口说到：你以为我会将哥谭的命运之战寄托在你的花拳绣腿上吗？十余年来，漫威给出的答案，都是肯定的。,0
1,30304994,奇异博士,Parker Li,139788361,推荐,2022-05-06,12:20:11,【YVR-5th】个人而言，是漫威宇宙最重要五部甚至前三部的电影。这种重要性体现在类型片的选择和表达上。当然了，超英片有的问题它都有（故事逻辑，战斗力混乱），该有的彩蛋也有（新的人物介绍，继续拓展宇宙边界），但不同于以往乖宝宝一样的导演执行，这次能看出Sam Raimi（毕竟大导演呀）的个人风格 鬼玩人。随着第一代演员的离去，越来越多对续集电影的排斥和对超英片大同小异的指责，这时候漫威能拿出一部这样的作品（当然，奇异博士不是它们的王牌），就算有试水的嫌疑，也是值得表扬的。而且wanda的支线和自己的电视剧连接紧密，大呼过瘾；而哪怕没看过WandaVision也不影响理解。支持,3
1,30304994,奇异博士,明安,61212508,推荐,2022-06-22,21:41:00,恐怖片的拍摄手法啊，好玩,1
1,30304994,奇异博士,告水月肖,171274180,还行,2022-05-05,17:15:26,还行 差强人意吧算 缺点就是为了剧情削弱人物的塑造让人觉得人设太干巴巴 还有一些降智和战力失衡  优点是视觉效果,34
1,30304994,奇异博士,失落大白i,197994849,推荐,2022-05-09,23:42:42,"最终还是妥协于枪版。。
旺达黑化是肯定的，但是没想到黑化得这么简单粗暴，毫无弧光。最后醒悟也极不具说服力。好不容易塑造的旺达这个曲折的角色是玩废了。我倒觉得漫威是真不想要旺达这个角色了，即便有那么多的前作来塑造。经此一役旺达再怎么洗白也满是槽点。漫威真的脑瘫。个人看法，强烈希望被打脸。还有白幻视被cue要到猴年马月了。
838宇宙真全员工具人，包括后来的黑奇，一开始真以为是what if的通天黑奇。草草登场草草领盒饭。迪士尼撩拨了一下粉丝，收割了一波情怀，宣誓了一些主权。Christine838你的宇宙都那样了，还回到那个工具人宇宙干什么？光照会都团灭了。她还没得知838奇的真相。去616就会有两个她也不合理，但可斡旋至少比现在好太多。通篇都有对其的感情，最后难道就想表达《英雄都是孤独的》？",3
1,30304994,奇异博士,ysc,206286808,力荐,2022-05-07,12:46:00,作为爆米花电影，剧情和逻辑方面很不错了，不像蜘蛛侠3那样有剧情衔接太差。奇异的特效也确实是好看，另外还单独加上了丧尸元素。反正就像是吃肯德基一样，晓得没营养、流水线生产，但偶尔吃一次也还是很舒服。唯一的缺点就是，猜都猜的到博士最后会被眼魔附身，要不然怎么继续拍3呢🫢,10
1,30304994,奇异博士,Luigi,75849450,推荐,2022-05-14,23:43:05,比预想要好，难得的是还能看到一些导演的自我表达，惊悚元素（肢体扭曲、jump scare、血浆的运用、追逐戏）太出色了，甚至都感觉这至少是个PG13的电影；另一个宇宙的复联出来之后开始像美队3的内战了，只不过可惜各角色实在是太工具人本色，结局估计很难让漫画迷信服；其实也是旺达幻视续集，旺达的苦、执着和放手，也算是漫威宇宙里难得的人物刻画。,1
1,30304994,奇异博士,Jeenyyyy✌️,anatomyart,推荐,2022-05-07,13:02:57,旺达和英国队长有点太好看了.....喜欢一些帅姐姐。宇宙穿梭那块儿的过渡看起来很烧钱的样子。,20
1,30304994,奇异博士,Callvados,42291551,推荐,2022-05-06,12:57:29,对神告白Time will tell how much I love you之后强力回应告白：I love you in every universe. ,0
1,30304994,奇异博士,xiajy333,134796814,力荐,2022-05-20,19:45:37,“I love you in every universe.”感人。不过在每一个平行宇宙的结局都不好，都娶不到Christine Palmer🙃,14
1,30304994,奇异博士,张老师。,211692974,推荐,2022-05-07,13:01:24,我对你的爱遍布多元宇宙,11
1,30304994,奇异博士,Stevesense,201155021,还行,2022-05-05,14:50:11,有些乱七八糟的，而且结尾三只眼太狰狞吓人了 我都快忘了那种脸演过可爱的卷福,12
1,30304994,奇异博士,翟墨子,zhaimozi,还行,2022-05-18,15:03:26,第一部有视觉奇观，第二部和其他漫威超英没任何区别了。,3
1,30304994,奇异博士,敌动我就跑,88775652,力荐,2022-05-12,14:55:22,名字可以改成猩红女巫虐爆多元宇宙。,7
1,30304994,奇异博士,momo,82599115,力荐,2022-05-12,15:45:15,地球这个是最好（帅）的博士,9
1,30304994,奇异博士,水行海王,191357939,还行,2022-05-08,17:06:34,有伊丽莎白奥尔森必看,1
1,30304994,奇异博士,豆友191656442,191656442,还行,2022-05-06,17:34:37,真够猎奇的😅,9
1,30304994,奇异博士,北纬三十四,199726212,推荐,2022-06-23,21:32:44,看跟谁比，跟《蜘蛛侠3》、《毒液2》、《黑寡妇》、《尚气》这些比的话，那还是好很多。,9
1,30304994,奇异博士,Hashiku,67502742,还行,2022-05-05,14:58:46,3.5   很漫威同时又不那么漫威,13
1,30304994,奇异博士,Themetaphor,156413203,推荐,2022-05-09,23:47:31,多好的编剧和演员啊。漫威的野心真大啊。（多好的手表广告！,1
1,30304994,奇异博士,•᷄ɞ•᷅,61259227,还行,2022-06-03,21:36:19,算是漫威电影里独树一帜的带有恐怖元素的电影吧 但是真的难看 谁懂就是那种看完和没看过差不多的感觉……漫威你再这样下去会失去我的 btw I love you in every universe 结果转头就在彩蛋里遇到了真爱 男人啊,9
1,30304994,奇异博士,朝阳lilili,211332515,力荐,2022-05-10,09:40:31,博士帅呆了,10
1,30304994,奇异博士,半导体,126955234,推荐,2022-05-06,16:10:10,建议改名 猩红女巫之奇异博士2……郎神,17
1,30304994,奇异博士,加勒比的大盗,173492652,还行,2022-05-06,16:11:10,奇异博士与哈利波特的梦幻联动…,5
1,30304994,奇异博士,momo,199516316,还行,2022-05-10,08:44:27,有的片段很恐怖。。剧情一般。。为旺达留下鳄鱼的眼泪。。,4
1,30304994,奇异博士,MrSunnyChen,149910333,,2022-05-07,10:12:30,比蜘蛛侠好看太多，许多致敬场景可圈可点，自复联四以（包括复联四）来第一部让我没有感到那么混乱以及无聊的漫威电影,5
1,30304994,奇异博士,退役卖钢枣子哥,206375115,还行,2022-05-07,11:14:34,???我看了一部丧尸加鬼片,10
1,30304994,奇异博士,Joe,hashtable,还行,2022-05-09,05:11:34,哈哈哈哈好特么一个类型片大杂烩~~ 新超英片的想象力匮乏程度再次刷新认知。。。,2
1,30304994,奇异博士,chenchenchen3,145780432,还行,2022-05-15,07:14:04,依旧是败于剧本的一部MCU 故事衔接在旺达幻视之后 可旺达整个人物心路历程衔接非常不流畅 就感觉刚治好的病又犯了 两个MCU最有故事性有心理创伤的角色 居然放在这么套路且没有深度的剧本 部分镜头特效动作调度不错 导演看得出恐怖片经验丰富 但MCU还是没能放开 恐怖氛围刚烘托好就草草结束 什么时候漫威才能放手玩一把 别把电影搞的即不疯狂也不多元,7
1,30304994,奇异博士,寺。⛓️🔒,2078214,推荐,2022-05-15,00:09:55,标题应该叫『奇异博士：疯狂丧尸』,0
1,30304994,奇异博士,柚子,cucaoxu,较差,2022-05-23,09:02:03,拍成恐怖片，是几个意思呢,13
1,30304994,奇异博士,wuel,83814718,还行,2022-05-08,09:14:49,一如既往的没有引进，似乎钢铁侠一死，那个本该链接我们宇宙的mcu就消失了，取而代之的是一个妄图侵略我们宇宙的一个不合理混乱又混沌的多元宇宙，这大概是重启宇宙以来mcu最为黑暗邪恶的故事，所以说“知识是人类进步的阶梯，书中有一切”,5
1,30304994,奇异博士,Ejour,Ejour,推荐,2022-05-10,01:46:38,恐怖片吧,1
1,30304994,奇异博士,Joey,119396267,力荐,2022-05-06,16:42:49,"近几年漫威最好的一部电影了，节奏算挺快的，该有的惊喜也都有了，有些点挺有创意，就是有些角色领盒饭太快了，光照会成了客串。全片满满的恐怖片元素非常带感。

竖琴真牛，丧尸奇异真帅。
and “I love you every universe.”",10
1,30304994,奇异博士,小黑马,186706311,力荐,2022-05-15,02:49:16,我他妈直呼卧槽 太吊了 整部电影的节奏可以称得上完美 奇异博士的人物塑造又上升了一个层次 那句我在每个宇宙都爱你真是绝了 用音符打斗的场景是我最喜欢的片段 是一部看完想直接二刷的电影,22
1,30304994,奇异博士,IINH,60439740,力荐,2022-05-06,15:45:56,比前几部都好看，你还是可以相信sam rammy的,5
1,30304994,奇异博士,量子,livingston,推荐,2022-05-09,23:23:28,I love you in every univierse。如果没有你，即便成为了多元宇宙最强者，又有什么用。,1
1,30304994,奇异博士,失去梦想的柴犬,193521385,还行,2022-05-06,08:06:24,整体肯定是及格的，而且没有那种判死刑的雷点，不过不能细想，唉，只能说是生不逢时，前几周的eeaao同样是母爱（泛），这显得太鸡肋了,3
1,30304994,奇异博士,mоmо,ustr,还行,2022-07-23,21:46:06,装比博士2，爆米花片看着爽就行了。,0
1,30304994,奇异博士,Karupisu🌈,69730287,还行,2022-05-05,17:02:38,看到导演以前的作品，我就觉得那难怪了。that explains a lot,15
1,30304994,奇异博士,恐怖食人大火鸡,53738611,力荐,2022-05-18,13:09:55,【B+】节奏很快娱乐性也不错，分镜设计和转场太有山姆雷米那味了。旺达在说话时会时不时看向观众来表现多元宇宙这个设定的Meta设计是神来之笔。不喜欢的地方是光照会的塑造实在是失败，最搞笑的是惊队的肉体素质那么强居然弱石，还有全片都在赶剧情完全没有给旺达的情感下足够的笔墨，导致情绪扁平，后面的转折也让人觉得非常平淡。标题叫疯狂多元宇宙，本来以为会去到很多有意思的宇宙，结果也就展现了两个宇宙，这点来说挺失望的。,3
