page_index,movie_id,title,username,user_id,rating,date,time,comment,useful_count
1,1401261,遊戏规则,大熊星座,63046201,推荐,2018-11-23,07:05:36,“罗曼蒂克消亡史”,0
1,1401261,遊戏规则,张熊熊,kinglilychou,推荐,2017-06-16,00:09:10,导演是奥古斯都雷诺阿的儿子，果然名师出高徒，构图运镜调度都稳的一米，炫技的意图昭然若揭啊。一边是宴会厅里的歌舞升平，一边是狩猎场上的决断杀戮。上流社会里从来就没有任何道德可言，就如同男女之间根本没有什么友谊存在,0
1,1401261,遊戏规则,全声波频道D,colorfulake,推荐,2015-07-28,20:18:30,太让人难过了,0
1,1401261,遊戏规则,douban,circumnavigate,,2013-02-18,21:59:24,没看懂怎么好,1
1,1401261,遊戏规则,薯片只要原味的,4587293,推荐,2014-08-04,10:08:21,和喜欢的人要不当情人，要么隔得远远的。所谓“做朋友”可以安慰一时，但却是埋下炸弹，不知道什么时候，就像看见一颗红嘟嘟的樱桃一样，忍不住扑上去一口吞下。 @2014-08-04 10:08:21,1
1,1401261,遊戏规则,zy,74353904,力荐,2016-12-19,23:54:47,古典叙事流畅自然 多场戏和对白看似闲笔 却在道出作者观念同时塑造着上流社会和闯入者的群像 整个基调在喜剧 闹剧中切换 最终 喧嚣俱寂 悲剧上演  重现了上流社会经受挑战却又堪堪维持的状态 雷诺阿的调度 景深镜头 诗意黑色的氛围和气质彰显了其文学修养和作者性 故后世才颇受新浪潮推崇,1
1,1401261,遊戏规则,秦丰禾,49612534,还行,2013-10-26,19:58:08,这真是情人和老公，小三和原配和谐共处的典范啊。前面看似闹剧百出，不可收拾，最后突然复归原位，就如生活有时貌似杂乱无章，实则背后自有我们看不见的千规万序。,0
1,1401261,遊戏规则,dorayaki,kxxdhdn,推荐,2022-05-01,21:55:45,打猎和宴会不愧是最适合刻画上流社会的场景（调度真好…4K修复音质不太行 #leChampo,0
1,1401261,遊戏规则,豆腐脑敢死队,body_electric,推荐,2018-09-04,22:32:33,敏感的心，忠诚的心。凡是爱所到之处，谁能逃避？不要这样痛苦。想要改变难道是罪吗？丘比特有翅膀，它不也是一掠而过吗？ 106分钟版本,0
1,1401261,遊戏规则,嵇澹,Eucatastrophe77,力荐,2022-01-08,01:48:13,悲喜剧，游戏过程越喧闹就凸显丧钟报时后的寂静越荒寒。超越凡俗的爱神之翼诗句作引，贵族消闲图景夜色浓处华美和荒诞两面的伪善本色极尽讽刺。谎言是通行阶级社会楼上楼下唯一的规则，穿梭复杂空间的运镜勾勒歌剧叙事般情节夸张的起承转合，拍摄群戏的调度之精确堪当影史范本。狩猎的残忍杀戮变作厅堂间索命追逐，脱去高尚和低贱的外衣，人面下的原欲的兽性何其相似，而裁决生死的误会仅赖衣装的身份区别扭转。天之骄子，民族英雄的虚名包裹着一颗草草陨落的情痴之心，狼藉满地的雉鸡标本早早预示纯真的闯入注定如奢华乐章的错拍，最终成为密闭圈层消化而后排泄的小小波动，这个怪诞的游猎世界才能继续相安无事地安度余生。星光划过天际，人间秩序如常。谋杀了无判决，枉死的血泪被恶棍的君子法则掩去，真爱许诺比滑稽表演更像儿戏，他们把这叫做风度。,0
1,1401261,遊戏规则,Black Yoko,81515621,推荐,2019-12-31,11:16:05,除了导演雷诺阿，亨利布列松也在里面演了个酱油。,0
1,1401261,遊戏规则,Cardinal,163158607,推荐,2022-02-11,03:34:16,【B+】歌舞片。,0
1,1401261,遊戏规则,Anubis,anubis666,力荐,2018-05-04,21:59:15,厉害的，只是略聒噪  P.S.我从不脸盲的看这片看到40分钟只认得那条狗。。。被烦到了,2
1,1401261,遊戏规则,Jupiterian,82502528,力荐,2016-10-05,05:57:54,这么好的片改天要好好写写影评,1
1,1401261,遊戏规则,Grey Pigeon,silky_wang,力荐,2014-10-06,01:05:22,刷片的路啊，阻且长。,3
1,1401261,遊戏规则,影呆,63870964,推荐,2019-06-21,09:17:01,室内空间调度炫技，的确赏心悦目，话痨让人略心塞，字幕看不过来…,0
1,1401261,遊戏规则,西蒙柯克,simon_wout,力荐,2011-12-26,16:20:15,可以和任何一部杰出的短篇小说相媲美,0
1,1401261,遊戏规则,Evil freedom,evilynq,还行,2016-12-16,22:33:37,看结尾其实也不算喜剧，挺讽刺的,0
1,1401261,遊戏规则,麥爾斯,milesaway,推荐,2012-07-15,01:32:36,从<大河>到这部<游戏规则>，让·雷诺阿被认可的原因我也看得见，可就是无法深爱。嗯...一定是因为我还不够有文化。,1
1,1401261,遊戏规则,荒也,huangye3,,2013-11-25,16:27:45,双重四角恋。,0
1,1401261,遊戏规则,WilliamOsborne,157548945,推荐,2019-08-02,15:18:57,各个阶级的腐败，伪善面具的佩戴，不停遮掩的谎言，群魔乱舞，游戏规则，地狱人间。,0
1,1401261,遊戏规则,Sabrina,15401327,力荐,2015-04-05,19:58:59,对男女之间友谊，爱情，金钱，地位等等，进行的一次实验性作品。到最后也没有给出结论，这当然是很正常不过的。,0
1,1401261,遊戏规则,伏伏伏伏伏的馍,69364200,还行,2019-01-23,18:31:25,果然飞行员是最大输家,0
1,1401261,遊戏规则,Catete,mrsmsr,推荐,2020-04-27,07:06:38,传话中的世界第二的电影 神调度 但剧情在现在看来过时太严重了 女主长相谜之出戏 看了介绍才知道原来某个男配就是(小)雷诺阿本人,0
1,1401261,遊戏规则,弓长忄享,36941035,推荐,2015-06-30,22:29:14,B+,0
1,1401261,遊戏规则,大漁,lameshang,,2012-12-05,06:33:21,没看懂，真生气,0
1,1401261,遊戏规则,Yolanda,sara127266,力荐,2011-01-31,19:02:12,不要穿他人的外套。,13
1,1401261,遊戏规则,张无慢,53557492,力荐,2018-09-28,11:04:25,运动量所构成的康德式宏伟,2
1,1401261,遊戏规则,巾城,j_lazy,力荐,2016-08-28,20:42:19,镜头调度的典范，电影表示方式的先驱。杰作。,0
1,1401261,遊戏规则,拾贝壳的猫,hzsxd1986,还行,2010-08-18,22:23:34,"“你可以面对仇恨，但你无法面对厌倦”。
打猎时一方人成网赶猎物，一方在对面用枪。
妻子和丈夫的情人协定互相帮助，谅解，以留住同样喜欢的男人。
“每个人都在撒谎，医药书，我们的政府，电台，电影，还有报纸。”
男女移情。
",0
1,1401261,遊戏规则,刹那。,79381337,推荐,2022-01-29,11:54:32,法国人的伦理关系真乱啊,0
1,1401261,遊戏规则,老李,leeyzh,推荐,2014-11-23,14:14:59,中规中矩，可惜没耐心细看。,0
1,1401261,遊戏规则,KitschMax,Jimmy_z,力荐,2011-11-20,22:53:11,不同阶层，竟然如此相像。流动的摄影，精致的调度，悲喜交叉，混乱荒诞。,0
1,1401261,遊戏规则,渭川曲,75021019,力荐,2021-11-07,21:49:45,终于看了,0
1,1401261,遊戏规则,octopus,NoodlesKid,力荐,2019-05-21,01:16:51,看雷诺阿和看雅克塔蒂的观感相同 我的天竟然还可以这样拍电影 我的天他们真是天才 我的天自己只是个幼稚园学生 我的天,1
1,1401261,遊戏规则,夜郁,50734827,力荐,2022-12-20,21:49:59,A++ 2022修复版，绝对杰作！影史奇观,1
1,1401261,遊戏规则,今生、唯爱,72520254,还行,2020-03-28,16:31:33,"我到底做错了什么
这两天看的几部黑白经典片
怎么全是荒唐到别人家男人就像罂粟
大家一起出轨一起找野狗",0
1,1401261,遊戏规则,焦糖爆爆D,50787142,推荐,2021-01-22,21:40:26,"最后死的，刚好就是多出来的最该死的那一个。能说这是意外吗？还是巧合？或许只是规则。除非有十足的把握，否则进圈只是送人头。规则一：猎物圈起来打，瓮中捉鳖。规则二：即使背后再淫乱，表面上也要让大家看起来彬彬有礼、尽显大家风范。
前厅演出后院追杀的戏调度很强。",0
1,1401261,遊戏规则,spaceman,spaceman,还行,2007-05-19,21:52:28,杰作？,1
1,1401261,遊戏规则,Véronique,j520qqin,力荐,2007-10-21,22:21:11,故事让雷诺阿讲起来总是这么一气呵成的过瘾有底气,1
1,1401261,遊戏规则,Millie,millie,还行,2008-10-30,19:36:09,那个环境中，没能认真看,0
1,1401261,遊戏规则,手机动,50541914,推荐,2011-04-16,14:58:59,看懂需要做笔记,0
1,1401261,遊戏规则,Jacques,jamesgqy,推荐,2012-10-23,10:51:17,细节处处有情趣，这就是法国电影。片子中那种古典情调，在雷诺阿之外的电影中很少看到，所以我觉得自己还没看懂他的片子。但是，法国人的机智并非让每个人都喜欢，我所钟爱的法国导演就只有拍喜剧的塔蒂。,0
1,1401261,遊戏规则,自闲,46603644,力荐,2014-05-23,22:37:37,摄影场面调度真是运用自如，二三十年代上流社会的“最后晚餐”，悲喜交加的闹剧，谎言是核心，正如台词说到“时代就是这样”,0
1,1401261,遊戏规则,喵的薛定谔,131426889,,2022-04-11,12:40:56,10260人评8.4分,0
1,1401261,遊戏规则,四相公,taonick,力荐,2013-05-27,11:57:50,任何一个场景的存在都以其自身为目的，我们可以感到，它是作为独立个体进入导演考量中的。而导演在处理它的时候，也将它看做自成一统的有机体，就像园丁面对他的一株玫瑰。可以参照《电影是什么？》P72，第二段的分析，看看雷诺阿在有声电影时期是如何考察和沿袭默片时期的最丰富的源泉的。,1
1,1401261,遊戏规则,cliosong,cliosong,力荐,2016-07-23,23:59:27,（9.0）我的影史百佳可以更新了。,0
1,1401261,遊戏规则,maycat,dancenowashin,还行,2013-04-30,17:03:08,过于古老了不适合我，还是听老师讲故事梗概有意思。。。,0
1,1401261,遊戏规则,克里斯托空,dabingxiaojie,力荐,2012-02-15,09:07:54,认真你就输了,0
1,1401261,遊戏规则,河淼,Brad_King,力荐,2013-07-14,23:48:35,当之无愧,0
1,1401261,遊戏规则,小叶榄仁,anyuzhi,推荐,2011-12-07,23:02:33,“那是我们那个时代的特征，每个人都在说谎”,0
1,1401261,遊戏规则,孙维拉,LonelyVirus,力荐,2022-09-27,11:19:29,补标；同让·维果的亚特兰大号是法国诗意现实主义最富盛名的两部代表作，其实我觉得德国导演茂瑙的日出颇有法国诗意现实电影的精髓和雏形。,0
1,1401261,遊戏规则,听见流星的声音,130822019,力荐,2019-04-28,20:48:47,导演让雷诺阿用熟练的长镜头，冷眼旁观这些被大众崇敬的社会精英，他们如何因为偷情，争风吃醋等等各种龌龊不堪的事迹而奔走于楼上楼下，追逐相斗，丑态毕现。导演用一种具有诗意现实主义的摄影机告诉了观众这样的真相：伪装和说谎就是这个社会阶级内部必须遵守的游戏规则。,0
1,1401261,遊戏规则,haylin,1694092,推荐,2016-11-19,21:02:16,终于看完整了这部影史上非常著名的作品，群戏的调度真的好炫目，and the ending…,0
1,1401261,遊戏规则,KAPO,kapocyj,力荐,2014-02-24,17:15:44,好一个八方割据 群魔乱舞的宴会狂欢 好一个曲终人散 虚伪无聊的告别,0
1,1401261,遊戏规则,徐达多,jafkxc,推荐,2010-03-08,13:09:58,“这是那个时代的特征，每个人的生活都建立在谎言之上。”,0
1,1401261,遊戏规则,应用层协议,liuheng0826,较差,2020-03-22,02:41:01,一幅巨婴群像，直指当时法国上流社会的空虚伪善，但主题上的指向却难以遏止地泛化为观感上的空洞与乏味，抱歉我实在无法在度过了极为沉闷无聊的100分钟之后，依旧大肆赞叹影片的调度、摄影或诗意云云，以彰显自己对影史的熟稔和尊重。这个本子要是交给布努埃尔翻拍一遍，可能会更有意思些。,0
1,1401261,遊戏规则,Lynchman,khjoe,力荐,2014-04-22,00:15:44,神作。几乎每段剧情都经历了一次精准的超级调度，而合在一起又是一部如此完整的作品。丰富的阶级群像和假爱之名的虚伪情感纠结在110分钟内清晰铺展，39年就把电影推向这种可怕的高度，应该也只能证明雷诺阿无与伦比的天才。,0
1,1401261,遊戏规则,≌菩提风花,catiou52r,推荐,2021-02-16,04:18:54,人性输给了动物性 ,0
1,1401261,遊戏规则,殺死金毛玲,148746927,推荐,2022-12-22,13:58:49,命中注定的牺牲 意外的另一种解释,0
1,1401261,遊戏规则,划船出海,manyfish313,推荐,2021-10-11,16:26:06,8  观感很像《资产阶级的审慎魅力》。后半程皱着眉看他们的混乱关系，宴会闹剧太吵了点，不过调度真厉害。找不到人帮忙脱兽皮，人人说谎我们为什么不呢？除了打猎和聚会只剩偷情的贵族，开枪打死人像平常事，明天谁还记得。,0
1,1401261,遊戏规则,takyo,32806849,力荐,2015-09-30,12:35:50,天啊 多么像《了不起的盖茨比》我爱那个年轻人,0
1,1401261,遊戏规则,发条辰,166652050,推荐,2021-07-18,16:17:01,法 国 诗 意 现 实 主 义,0
1,1401261,遊戏规则,Emanuelle,anniehoneys,还行,2016-06-06,07:37:23,时隔三年，大银幕重温一遍才发现，剧情基本都忘光了。@whitney,0
1,1401261,遊戏规则,红袍修罗,hpxl,还行,2019-01-04,11:31:43,①一则亦庄亦谐光怪陆离的人性寓言②喜欢那段骷髅舞，黑色背景，黑色衣服，白色骷髅图案格外鲜明③戏谑处理雇工的感情争执闹剧加深了主题的阐释④游戏规则不仅仅适用于上流社会，也同样适用于我们，否则只有像飞行员一样被淘汰,0
1,1401261,遊戏规则,O型血,UloveWo,,2020-09-02,17:42:48,80年前的这部喜剧灌出了影史最毒的鸡汤https://www.bilibili.com/video/BV1Tb411W7N5,0
1,1401261,遊戏规则,莫小巧,lvmocho,力荐,2020-02-14,18:52:54,一刷粗糙，系统总结雷诺阿时细看。混乱喜剧背后并不可笑的淫靡（谁跟谁都有一腿），以虚伪为核心的社交界游戏规则。舞台演出一幕单看也足够杰出。长廊和大厅的景深调度，大空间横移运镜控制下的舞台式丰富调度。,0
1,1401261,遊戏规则,Joon,43216565,力荐,2015-10-19,22:00:09,“敏感而忠诚的心啊，谁在责难轻薄的爱情，停止你粗鲁的抱怨，这岂是变心之罪？丘比特身负双翼，难道不是为了飞翔？”骷髅戏那里实在做得太棒，用灯光揭示欲望。类型居然还是喜剧。,0
1,1401261,遊戏规则,Lies and lies,kidneytopo,推荐,2016-03-16,20:46:38,上行下效，罗伯和马素的关系令人玩味。此片相较La Dolce Vita有个缺陷是，闹剧在银幕时间上没有到达过量的程度，显得有点过分干净工整。,0
1,1401261,遊戏规则,愚者,61268751,,2013-07-07,16:39:33,"故事有点意思,但我想我很长一段时间都不会再去看二战前的电影了.",0
1,1401261,遊戏规则,MacGuffin,clockrabbit,力荐,2013-05-17,17:03:06,教科书式场面调度,0
1,1401261,遊戏规则,红与橙,147781548,推荐,2019-06-08,17:32:52,"舞台戏转闹剧的调度令我拍手叫绝，黑色的结尾使我瞠目结舌。
我不觉其讽刺，是因为我深谙这游戏规则。",2
1,1401261,遊戏规则,Octopus,47378879,力荐,2018-01-27,22:42:51,景深和移动摄影。,0
1,1401261,遊戏规则,踢你小腿骨,kickyourleg,力荐,2010-12-02,02:33:55,2016 w yt,0
1,1401261,遊戏规则,loup,karax,力荐,2011-02-19,21:11:00,我喜欢！,0
1,1401261,遊戏规则,九七,zr97,,2010-11-27,21:40:29,没办法忘掉那个能够自控地爱的男人，清醒又在愿意的时候迷狂,0
1,1401261,遊戏规则,feifeiRun,HERE,推荐,2018-09-13,19:53:23,“越是熟悉自己的工作，越是倾向于采用与银幕相适应的景深镜头做场面调度。”,0
1,1401261,遊戏规则,半弦月,3547067,推荐,2016-08-22,13:04:11,第一遍看觉得so so，但想了想狩猎场的隐喻，结合最后妥协反而逃过一劫的讽刺感，还挺有韵味的。很多人提到调度，我最喜欢片中的平移镜头，有些梦幻感。单场摇镜貌似没有过多服务叙事,0
1,1401261,遊戏规则,水木清华,53937055,力荐,2019-04-18,18:12:47,哇哦哦。很棒电影，我们可以在电影中看到爱情和婚姻中的形形色色的人。,0
1,1401261,遊戏规则,我叫张躍名,43842293,力荐,2013-02-01,16:29:57,排列组合的鼻祖！！！影史十佳果真  10.0,0
1,1401261,遊戏规则,jose leigh,fayerk,推荐,2012-01-02,22:23:01,本以为是一场乐观的闹剧，最终白忙活一场。,0
1,1401261,遊戏规则,格林童话,56906475,较差,2020-01-21,20:47:01,静不下心,0
1,1401261,遊戏规则,woniu2048,woniu2048,推荐,2020-03-10,19:35:11,雷诺阿调侃男女情事可谓细致入微，滥情也是情，和忠贞无关，一时的热情就想天涯海角的私奔，一语的不合就退避三舍移情别恋。终究是自我的游戏，逃不过现实中那一枪后的形单影只，还是收拾好自己，远离自定义的爱情王国。,0
1,1401261,遊戏规则,嗓嗓,qinqincatkissma,较差,2012-04-16,09:29:45,补录。,0
1,1401261,遊戏规则,碧水寒山夺命鸟,johnnietomay,,2013-05-26,23:45:54,有个罗伯特在朱利和克里斯汀娜之间的后景的表情变化想到《小城之春》。。,0
1,1401261,遊戏规则,junepig,junepigpku,推荐,2013-06-19,21:14:55,雷诺阿的影像风格一览无余。导演的亲自出演也很有趣，尤其是细看剧照—那双眼睛正是我们熟悉的～只是对这种爱情闹剧的“游戏规则”理解不能。。。,0
1,1401261,遊戏规则,马赛克,crims,力荐,2014-01-28,08:02:00,"Le Nozze di Figaro; sublime camera movements; a sharp satire of class, manners, bourgeois mores, as well as human nature",0
1,1401261,遊戏规则,花儿洒洒,huaersasa,还行,2012-01-02,16:51:30,飞飞的爱，看的人昏昏欲睡,0
1,1401261,遊戏规则,泰坦,taitan,还行,2018-11-07,17:11:32,奢华空虚而虚伪的阶层,0
1,1401261,遊戏规则,小  斑,wavyiyi,力荐,2012-03-28,22:43:37,场面调度多样：多中全景、摇镜头；强调景深。杂糅关系体现时代,0
1,1401261,遊戏规则,女魔头,nvmotou,力荐,2019-01-20,23:32:35,穷人把爱情当作生命，富人将爱情视为游戏。,0
1,1401261,遊戏规则,lOoK At mE,182739905,力荐,2022-09-21,23:12:45,走廊的调度真的恐怖，低开高走的典范，到最后所有的碎片化情节都融在一起，慢慢就了解规则了,0
1,1401261,遊戏规则,yoshimi,yoshimi,力荐,2020-05-04,11:16:56,其实克里斯蒂娜也是一个天真的人,0
1,1401261,遊戏规则,啊呜,iiawu,推荐,2010-07-25,00:17:37,上流社会从来都没有道德。,1
1,1401261,遊戏规则,木山豆睿,52189374,推荐,2022-09-18,11:32:45,不得不说还是黑白片看场景调度比较有感觉。法国人的情人文化耐人寻味，原来非排他的爱里也会有牺牲，poor André死前最后的话竟是试图相信友情，孰料人心险恶呐。,0
1,1401261,遊戏规则,gua,1071826,还行,2008-05-28,14:40:06,好複雜的男女關係呀！知道編得有心思，就是很不喜歡那堆亂放浪的人物。,0
1,1401261,遊戏规则,爱吃梦的小怪兽,3768964,力荐,2012-10-10,10:43:44,罗曼蒂克。,0
2,1401261,遊戏规则,汤米,wjscxx,还行,2012-11-26,23:17:25,上课看睡了，改天重看一遍,0
2,1401261,遊戏规则,海鸥riki,162238817,,2022-06-02,21:17:49,不再站在道义的上风,0
2,1401261,遊戏规则,Nightwing,donnil,力荐,2015-11-03,23:49:44,初中看睡过去了，没留下一点儿印象。如今真觉得精彩，让观者升级为上帝的室内群戏经典 top nominee,0
2,1401261,遊戏规则,按时对话法,64326764,力荐,2016-01-24,16:51:41,剧本太好 狩猎场景印象深刻,1
2,1401261,遊戏规则,晚晴,tiannvnv,力荐,2010-09-25,08:07:45,危险的天使，不过也是天使。,0
2,1401261,遊戏规则,得失淡然的狗,148973294,推荐,2020-04-10,23:53:28,以后二刷再说，这论文太烦了,1
2,1401261,遊戏规则,德勒兹的倒影,138841949,较差,2022-09-02,07:20:04,无聊粗糙。影史地位这么高可能是大宴会的多人场面调度比较超前吧。,0
2,1401261,遊戏规则,葡萄柚,CaptBastard,力荐,2018-09-26,03:50:17,羞耻感缺失 所谓用“规则”维系着的上流生活不过是一场接着一场的闹剧 爱跟不爱都是脑门儿一热的事,1
2,1401261,遊戏规则,澹~,ginsu,推荐,2011-10-01,17:27:10,剧情是比较传统的古典文学式。 法国上流社会的风气是男女各自备有一位情人。默认但不可公开，否则既是丑闻了。 而只有保有原始纯真之辈才会带着自己单纯的热情不顾一切投入自已的爱情之中。,0
2,1401261,遊戏规则,腐花儿,54231597,还行,2017-11-07,13:11:35,我爱上一匹野马，然而我并没有一片草原。,0
2,1401261,遊戏规则,阿蕭,aries23,,2015-02-05,12:37:21,熱熱鬧鬧 7.8,0
2,1401261,遊戏规则,劳永逸,antennnnnna,,2014-06-28,14:55:57,“我们有自己的最爱，却不拒绝其他人”。最腹黑的就是导演了。,0
2,1401261,遊戏规则,sheepfield,lamber,还行,2012-04-06,20:39:26,又是字幕问题-04/06/12\欠优雅-11/08/14 at Anthology Film Archive,0
2,1401261,遊戏规则,阿珂kk,JONI-K,力荐,2012-04-13,23:11:03,奥克塔夫看着很眼熟，原来真的是导演自个扮演的。上流社会的谎言、欺骗、空虚、虚伪展现的淋漓尽致，虽然有点荒诞，却不得不承认这就是现实。还有当时社会的群像，从贵族到平民。他们各自的生活，情感经历。,0
2,1401261,遊戏规则,J,avivalovestory,力荐,2015-12-23,15:04:23,结尾太喜欢了，短短五分钟尽显人世丑态,0
2,1401261,遊戏规则,丁一,2434887,,2013-05-04,18:10:09,观影盘点期，看过留脚印,0
2,1401261,遊戏规则,mandyzyx,63569379,,2019-09-27,21:27:19,你永远无法知道会发生什么；没有期待也没有失望；谎言继续；,0
2,1401261,遊戏规则,小墨MO,moxiaolou,推荐,2012-02-19,08:15:52,这部巴赞眼中的名片并没有打动我。它流畅的电影语言的确让人惊叹，其中舞会表演部分骷髅和光束那里尤为精彩，几组人物关系在连贯的长镜头中一一呈现，反应了导演绝非一般的调度能力。场景的纵深感很强，人物在画面中总是很忙碌，因而造成模糊重点的效果，更需要观众动脑参与。好一出讽刺的法国闹剧。,0
2,1401261,遊戏规则,躲猫猫社社长,XI123,力荐,2019-03-07,04:04:18,目不暇接,0
2,1401261,遊戏规则,ilia,ailiilia,推荐,2014-08-22,09:09:05,其实我并不懂,0
2,1401261,遊戏规则,cwmao,48541726,力荐,2021-06-26,13:39:17,不遵守规则的人像🐰死去。贵族阶级与农民阶级的镜像对称关系。所有的场面调度都牛逼到不行，pan拍的太好了。混乱的男女关系不管在哪个阶级都一样，但游戏的规则不同。,0
2,1401261,遊戏规则,唯唯,150450954,,2022-04-18,00:05:51,景深镜头 场面调度,0
2,1401261,遊戏规则,穿山,Link0406,力荐,2019-03-21,16:35:12,"“如果明天法国毁灭，只剩下这部电影，整个国家和文明仍能依此片重建。”——理查德·劳德。
“首映是个灾难，右派视内容为睥睨贵族，中间派觉得它堕落不明所以，左派则以为它是堕落法国的隐喻。他们都对了也都错了。”“在雷诺阿的世界里，所有的人性都值得颂扬，但所有的人性也是千丝万缕纠葛不清的。”",2
2,1401261,遊戏规则,Tho玛斯,hzpl,力荐,2011-09-04,18:16:00,对意外的新定义,0
2,1401261,遊戏规则,捂脸难,52760317,推荐,2014-04-22,21:28:52,同阶级的人会彼此原谅，不必追究了。,0
2,1401261,遊戏规则,宠物的丝绒纸杯,158023184,力荐,2017-02-24,21:19:33,难以复制的经典～深焦镜头令人印象深刻～,1
2,1401261,遊戏规则,潘老师,172531426,力荐,2022-11-09,21:12:50,《游戏规则》的好，其实是很显而易见的，超自然的场景调度，熟练的人物走位，剧情上更是讽刺了二战时法国上流社会的虚无缥缈，滑稽荒诞的故事走向，在这部电影中，能看出后来很多部电影的雏形和影子,0
2,1401261,遊戏规则,Pni,98805258,力荐,2022-12-23,19:10:26,飞行员、偷猎者、不能自力更生的音乐家，最后悉数出局。不属于城堡体系的人就像流感病毒，欢闹之后也只能被免疫系统打败，变成一口浓痰 黏腻地、裹着唾液离开它的宿主。 形式决定内容，规则决定游戏。,0
2,1401261,遊戏规则,不自律会死星人,184337410,还行,2022-10-03,17:50:27,你也爱她吗？贵圈真乱,0
2,1401261,遊戏规则,JoshuaLi,enchanted13,力荐,2016-07-10,12:00:22,大银幕重温，35mm，要在较短的时间内通过对这些角色的鲜活塑造来展现出上流社会人际关系的微妙规则以及复杂的角色间关系发展与转变，并通过高效稳健的调度将这些内容置入大景深运动长镜头中来组成一部有着精彩群戏以及神经喜剧外表但内涵却极为丰富而具有讽刺性的电影，所需要的精力与天赋是巨大的。,1
2,1401261,遊戏规则,啊砸,moviefun,力荐,2013-02-17,15:57:15,最后他所深爱的人，毫不理会他的死亡，唯有他真挚且间接照成他死亡的朋友的愧疚，倒数第二幕，两个伤心的人握手，说到祝你好运，剩下一群是是非非无关事己的贵族，剩下他们曾经深爱的女人。,0
2,1401261,遊戏规则,林檎,1039236,,2012-06-22,12:18:41,"""she is a society woman and society has rules."" and the rules are: 1) ""why can't ordinary people lie?"" 2) he speaks of his heart when he should not, so when he is killed others speak for him of ""a new definition of accidents"". *Bourgeois mansion serves as a microcosm of society*",0
