page_index,movie_id,title,username,user_id,rating,date,time,comment,useful_count
2,26289138,李雷和韩梅梅,圆夕,122688721,较差,2017-08-29,17:36:03,嗯，有可取之处，就是少男少女之间那些小悸动，那些小心思还挺讨喜的，但是大部分剧情、对白以及整个故事的完整度都不是很好吧，没法给高分，但是也可以一看打发时间。,1
2,26289138,李雷和韩梅梅,TADA,156484465,较差,2017-06-11,13:17:15,不知道拍这个电影的意义在哪里,0
2,26289138,李雷和韩梅梅,云逐月,84111260,较差,2017-12-27,19:43:44,一部本可以拍出《初恋这件小事》的小清新电影，因为硬要嵌上初一课本李雷和韩梅梅的low英文，想想吧，高中还在my name ...nice to meet you 是什么鬼？还有，“为了组乐队，牺牲马丽丽”的桥段也是狗血得不要不要的,0
2,26289138,李雷和韩梅梅,斯文看客swain,150884519,很差,2017-06-25,09:06:53,这个电影的所有人员都无耻的坦荡荡，李雷韩梅梅都可以拍电影？,0
2,26289138,李雷和韩梅梅,盛世中华,79108534,很差,2017-06-18,10:37:47,幼稚，,2
2,26289138,李雷和韩梅梅,天上仙女脸着地,157588803,很差,2017-06-24,12:50:12,额，我是来证明不是水军刷分，是真的低,0
2,26289138,李雷和韩梅梅,八爪,4454692,很差,2017-08-13,03:58:07,这部电影蠢到就像考试的时候给你一个学霸的试卷让你抄，不但没抄及格，连名字都抄错了。毫无年代感，不是初一课本，《情非得已》以及四版人民币就是李磊和韩梅梅的年代。还有一堆莫名其妙毫无逻辑的剧情……演唱会对嘴有没有，为什么还要贝斯？无线电的彩蛋WTF！心疼朋友的9.9……,0
2,26289138,李雷和韩梅梅,快乐时代,79605736,很差,2018-07-24,23:06:24,这就是标准的三无电影,0
2,26289138,李雷和韩梅梅,pauper,41158884,很差,2017-08-18,21:26:09,故事是根据蒋小涵的话剧版改编的么？李雷留下无线电时真的以为电影ending的想骂娘，结尾交代了几位主人公的现状，颜值担当魏华跟谁好了？那男的没印象...《情非得已》后的彩蛋，韩梅梅发现李雷留下的爱情密码，远在美国的李雷的无线电发出了韩梅梅的经典对话，拯救了电影。,0
2,26289138,李雷和韩梅梅,momo,157109306,,2017-06-14,22:37:12,不是很能get…,0
2,26289138,李雷和韩梅梅,马甲,kiddyzheng,还行,2017-12-26,23:45:00,也还行吧 略尴尬,0
2,26289138,李雷和韩梅梅,鲁比科,gingerlea,还行,2017-11-15,22:14:53,没学过李雷和韩梅梅，片子确有硬伤，但是分数还是太低了，豆瓣的政治正确有点可怕。,0
2,26289138,李雷和韩梅梅,锡勒朱徳·岱钦,110170249,很差,2017-06-10,15:38:37,最近好多年来各种强行讲述青春校园故事的电影讲的都绝不是大多数的我们的青春校园故事，真不知这样的凭空无根据意淫究竟有什么好处呢？,0
2,26289138,李雷和韩梅梅,dreamboat,chanelv,很差,2017-06-14,16:34:28,嘻嘻嘻,0
2,26289138,李雷和韩梅梅,Moment,suiyun0207,推荐,2017-06-14,22:19:38,普普通通简简单单的纯，我们一起看的第四十部电影。How are you?,1
2,26289138,李雷和韩梅梅,独自东西,1592129,很差,2018-12-23,23:32:08,能负分吗哈哈,0
2,26289138,李雷和韩梅梅,小白熊⫍⃢⃢👁━👁⃢⫎,169906455,较差,2021-06-02,09:52:29,外国同学挺好看的,0
2,26289138,李雷和韩梅梅,桃花岛闭嘴岛主,yoyoinlove,较差,2017-10-18,19:54:30,李雷长得神似我高中学霸，一直出戏！最后那段表演尴尬得我只好快进。,0
2,26289138,李雷和韩梅梅,聚羽成翼,S7vv,很差,2017-06-17,04:55:25,巨烂。导演杨永春编剧肖李任颐杨永春陈林骆平主演张子枫张逸杰。,0
2,26289138,李雷和韩梅梅,lcy_,157930709,力荐,2017-11-19,14:15:55,跟心中的很大差别，特别是前半段，脱胎换骨的李雷出现后，竟然是韩梅梅花痴与追求，一点相处的铺垫都没有。这学习时期则是快速略过，后半段的好点,0
2,26289138,李雷和韩梅梅,寒冰之凌,185046114,较差,2022-08-26,06:55:50,一般,0
2,26289138,李雷和韩梅梅,白脚花狸猫,mokong19881110,很差,2017-06-15,11:47:17,听说短评可以打0星,0
2,26289138,李雷和韩梅梅,己注销,189624252,较差,2021-07-23,18:08:58,要不是张子枫，我都以为看的是大陆高中版的流星花园…..,0
2,26289138,李雷和韩梅梅,雪夜独行,37940948,,2017-06-24,00:08:30,什么？导演不是杨永信？！,0
2,26289138,李雷和韩梅梅,已注销,5566664,较差,2017-09-06,23:51:56,剧本有些烂了，尬的不行，很无聊。但摄影，选角，打光很棒，给几个小弟弟小妹妹点赞,0
2,26289138,李雷和韩梅梅,苻苼,148354178,较差,2017-06-16,12:55:33,尴尬。。。。。,0
2,26289138,李雷和韩梅梅,啤酒花,73810570,很差,2017-10-08,21:43:27,105.以情怀赚票房的国产烂片。IP、牵强的年代感、被讲烂了的初恋。动心、追、没在一起、多年后释怀，十八线编剧骗钱能不能有点诚意？？？,0
2,26289138,李雷和韩梅梅,习得性拖稿猫,64001823,很差,2020-02-20,12:54:11,cctv6能不能放点不蠢的片子,0
2,26289138,李雷和韩梅梅,暖气烤江湖骗子,lingoapple,很差,2017-06-14,20:37:41,导演求仁得仁,0
2,26289138,李雷和韩梅梅,阿拉古斯古,fengzhilianlian,还行,2020-04-19,19:08:43,还行吧，感觉有点时空错乱🤦‍♂️,0
2,26289138,李雷和韩梅梅,张雪     爱彩铅,148783583,很差,2017-06-11,22:15:38,那么好的IP又被浪费……一大帮人较劲脑汁想赚钱，可是没有人爱电影，没有人懂电影。太可惜了……,0
2,26289138,李雷和韩梅梅,Stone咚,shishuyue,很差,2018-08-09,19:42:10,这个李雷好娘啊,0
2,26289138,李雷和韩梅梅,zorro628,157202507,较差,2018-08-31,04:02:43,李雷和韩梅梅这可是以前英语课本学的热门人物！于是看看到底拍的什么！结果发现被骗了！完全就是挂名的，蹭热度！一般般的校园爱情剧！女追男，韩梅梅追李雷的故事。里面很多回忆倒是真的！,0
2,26289138,李雷和韩梅梅,豆瓣豆瓣,135403425,较差,2018-09-14,20:19:14,本来想打三星，结果来个十年后还加隐形笔，烂尾,0
2,26289138,李雷和韩梅梅,轻舞飞扬,158887942,较差,2017-06-10,16:11:12,各种拼凑，剧情平淡无奇，脑洞太大。,1
2,26289138,李雷和韩梅梅,athena,42785643,很差,2017-08-15,15:07:05,奔四的人来看自己的青春。可看了半天，还是没认出来这到底是哪一辈的青春。。,0
2,26289138,李雷和韩梅梅,九夏,50994268,很差,2017-06-09,14:57:30,就你们拍的这坨玩意，能骗个3000万就已经不错了，钱都已经骗到手了还想怎么样？当了婊子还要把贞洁牌坊也立起来？这导演我见过，一副傻样，以前我还以为导演只是为了骗钱，现在我明白了，导演不是想骗钱，她是真的傻，还以为自己拍出了一部了不起的杰作呢,0
2,26289138,李雷和韩梅梅,海盐,115223509,较差,2017-10-02,19:00:05,男主嘴唇好厚啊，女主喜欢男主表现的好明显啊，居然那么久才察觉出,0
2,26289138,李雷和韩梅梅,好运芒果冰沙,Maydayfirst,较差,2018-04-07,21:16:43,呵呵呵。,0
2,26289138,李雷和韩梅梅,⚆ᴥ⚆,papi189,很差,2017-06-14,13:56:47,送1星吧，不用谢～,0
2,26289138,李雷和韩梅梅,鱼鱼菲菲,153908341,较差,2017-06-10,10:15:51,还挺喜欢张子枫的，青春可爱的，就是剧情太糟糕了。,0
2,26289138,李雷和韩梅梅,受伤鸽子往南飞,jet92,很差,2017-09-09,12:30:03,都不好意思说自己参与过这垃圾，看了五分钟尴尬到大小便失禁。,0
2,26289138,李雷和韩梅梅,ageanxiao,50191563,很差,2017-10-17,22:46:39,为一个男孩犹豫选择文科还是理科，片子虽烂，总有戳中的，十年好快……,0
2,26289138,李雷和韩梅梅,Ginger,Jechina,较差,2017-06-14,13:39:04,忽然想起自己的高中时代，没有生病的同学，没有乐队，没有给暗恋的男生递情书，唯一期待的是每个周六的午后，应该是阳光正好，是和好友从食堂走回宿舍，聊着天，期待着放学回家。时间如水，毫无波澜，但那是我真真切切的青春年华，时至今日，我仍然无比怀念。,1
2,26289138,李雷和韩梅梅,春雨洗过太阳,50960697,较差,2018-08-09,19:59:04,还是有一些笑点的,0
2,26289138,李雷和韩梅梅,daodao125,155788363,很差,2017-06-14,22:34:01,提前给《三年高考五年模拟》打榜~,1
2,26289138,李雷和韩梅梅,左宜右有,57697460,较差,2017-10-16,00:45:23,觉得……尴尬啊……,1
2,26289138,李雷和韩梅梅,七元,littlerow,很差,2017-06-09,19:36:26,我的天啊！网大还是电视剧啊！从头到尾都尴尬到爆炸！ps：因片方耍流氓两星改一星 特么在电影院里看到屏幕后方群演集合等走位，我真是第一次见！缩画幅都不懂，你还真没拍过片！别说什么是部电影！恶心！！！,1
2,26289138,李雷和韩梅梅,CobraCB,CobraCB,很差,2017-08-16,04:23:32,感觉可能也就emoji大电影可能会比这个更荒唐些,0
2,26289138,李雷和韩梅梅,将军请息怒,elyseen,还行,2017-11-02,09:46:58,演Jim的小帅哥长得挺不错的,0
2,26289138,李雷和韩梅梅,My pleasure.,147484783,很差,2017-06-23,21:26:48,颜值一点都不高,0
2,26289138,李雷和韩梅梅,WJL·CQNU,144648723,很差,2017-11-26,13:03:44,人的反应完全不对，导演不是说这是她亲身经历的吗？完全不是人在生活，是演员在演戏。哎 好气吖～。如果拍得正常点，或许还好点点。,0
2,26289138,李雷和韩梅梅,滢风听酒,239982677,很差,2022-08-22,19:52:01,不明所以，不知所云。,0
2,26289138,李雷和韩梅梅,锵锵,170866827,很差,2022-05-15,02:34:02,补标 谢谢,0
2,26289138,李雷和韩梅梅,momo,62953833,很差,2017-06-14,17:29:22,看了几集，真的不好看……完全不吸引人，跟一众青春网剧 最好的我们，上瘾啊之类的完全不能比…,0
2,26289138,李雷和韩梅梅,妖孽丛生,153907121,很差,2017-06-10,10:12:48,其实演员还不错啊，就是表演这样的剧情太羞耻了。,1
2,26289138,李雷和韩梅梅,发条追不上的橙,mfuugejin,,2021-04-04,21:02:52,只是想补标一下张子枫的电影，具体剧情忘了。,0
2,26289138,李雷和韩梅梅,翻开,frankfankai,很差,2019-02-05,23:22:54,毁童年,0
2,26289138,李雷和韩梅梅,燕尾蝶,156014382,较差,2017-06-13,08:19:53,情怀拯救不了，青春题材已死。,0
2,26289138,李雷和韩梅梅,星河几里,Comyet,还行,2017-08-25,17:05:27,到头来才发现原来是浦发银行的广告,0
2,26289138,李雷和韩梅梅,Pentecost,3832465,很差,2017-08-13,05:18:18,……我高中英语老师真的为了面子，给我们做过他出的期末试卷三次……是三次……我都会背答案了！然而两个班都没人听课啊有屁用啊,0
2,26289138,李雷和韩梅梅,法兰西特派员,linbinchi,很差,2017-08-21,22:54:25,抱歉我学的是danny和jenny,1
2,26289138,李雷和韩梅梅,似火年华,d20160925,力荐,2019-04-06,20:59:59,还挺正能量的吧,0
2,26289138,李雷和韩梅梅,2B钢笔,aiyawocaonima,还行,2017-06-14,21:39:50,想起当年学校晚会上的这首歌，当时做的视频惊艳全场了，梦想煤管，我当时跳breaking，一直觉得这首歌不错，虽然是徐誉滕唱的。觉得有必要把这个在好好拍一个动画片，没想到现在拍成电影看个片头就行了。,0
2,26289138,李雷和韩梅梅,Adeline,69068951,较差,2017-06-19,00:36:10,现在的人，为了钱什么都能改，什么都敢改,0
2,26289138,李雷和韩梅梅,霍真普洛兹,12042017,很差,2017-06-14,23:26:43,看到导演处处哭诉喊冤，觉得好电影被网友恶意刷低分好无助的样子，在微博上的种种弱智言论，觉得这智商能拍出这样的烂片，应该是正常发挥。,0
2,26289138,李雷和韩梅梅,ben,83807726,很差,2017-06-14,19:24:28,我来证明我不是水军的！,0
2,26289138,李雷和韩梅梅,Jamyang zangpo,103806148,很差,2019-09-04,18:40:21,男主的嘴唇就不应该做主演！！！！？,0
2,26289138,李雷和韩梅梅,哎呦浅笑梨涡,153573280,较差,2017-06-28,12:03:33,为什么把回忆拎出来拍，那么拍好一点也行啊，真是……,0
2,26289138,李雷和韩梅梅,猫崽三岁,68679677,很差,2017-06-15,13:11:36,"电影是用来看的，不是用来炒作的。
",2
2,26289138,李雷和韩梅梅,哔哟哔,61150890,很差,2017-09-14,13:18:49,浪费演员了,0
2,26289138,李雷和韩梅梅,D伯爵,Popdai,很差,2017-08-16,14:18:32,前面不错，揭发老师的情节后就成乌托邦了，孩子看的片子还加撸管搞笑，必须一星。还有张子枫要减肥了，有前途。,0
2,26289138,李雷和韩梅梅,圭小臬,34888785,很差,2017-06-20,15:06:14,快进五分钟看完都觉得浪费人生,0
2,26289138,李雷和韩梅梅,少女N,52489598,很差,2017-06-09,22:48:16,直到那个补习班英语老师出来之前我都还挺喜欢的，大概是我上学的时候真的就是这样吧，终于没有老黄瓜刷绿漆的高龄演员来演学生了，可惜后面拍的太飞了，飞的没边儿了，结局一出全场都懵了，哈？经费不够了？,1
2,26289138,李雷和韩梅梅,后知后觉,1449535,较差,2018-07-31,09:03:59,到后面开演唱会我觉得就开始崩了,0
2,26289138,李雷和韩梅梅,已注销,156033548,较差,2017-06-12,19:57:14,非常一般，青春片拍好很不容易,1
2,26289138,李雷和韩梅梅,HandsomeWang,ROMAN10,很差,2019-01-12,20:28:06,最后这送个胆机是啥意思。。我家的胆机死沉，女孩根本抱不动。扔病例等情节，太做作了吧。十年后。。这十年，什么都没发生。。女主角是所有同学里最不好看的尤其最后盘头的造型。前边的情节，稍微有那么一点点纯真，但是纯真并不是那个年纪里的重心，电影里一点没有，本来想给两颗星的，如果少20分钟,0
2,26289138,李雷和韩梅梅,欺霜傲雪,49872790,很差,2017-07-22,10:21:03,矫情的傻逼导演听说还想声讨豆瓣，醉了。烂片还有脸了？,0
2,26289138,李雷和韩梅梅,半绊_,suiaieran,很差,2018-01-16,19:07:18,不好看，男主的嘴唇好出戏……也都是老梗,0
2,26289138,李雷和韩梅梅,半暖时光,138414558,还行,2017-06-10,21:33:28,还可以,0
2,26289138,李雷和韩梅梅,4点蚊怕水,charlielee,还行,2017-10-08,00:33:29,如果不是我们那个年代有点共鸣，觉得真的很假,0
2,26289138,李雷和韩梅梅,Fly free,shi518a,较差,2021-11-30,15:18:50,"那时候子枫妹妹还没有现在这么瘦……
普通青春烂片……

2021.11.30在宿舍",0
2,26289138,李雷和韩梅梅,丫丫布^念兒,ywx100407,,2018-10-19,12:46:27,没有用这个教材,0
2,26289138,李雷和韩梅梅,染尘,159296242,还行,2017-06-11,00:20:19,李雷和韩梅梅这个片名纯粹只是噱头，实则还是流水账一样没有新意剧本老套的普通青春校园片，帮同学筹款的温情戏份过于做作。勉强的命题作文。值得一提的是电影真实反映了在那个年代补习班乱收费的现象。几个演员的表演还是挺不错的。给张子枫加一星。,0
2,26289138,李雷和韩梅梅,郭小鸟👿,71880075,推荐,2017-11-09,22:09:32,21521……用来回忆青春是足够了～ ,0
2,26289138,李雷和韩梅梅,#鼠宝#,SummerRyanShu,很差,2017-06-14,16:31:49,跟风一下,0
2,26289138,李雷和韩梅梅,说明书,54273337,很差,2018-02-03,02:12:33,还真是，不要脸啊,0
2,26289138,李雷和韩梅梅,蒙蒙,194249439,还行,2021-06-21,18:28:15,2017年6月陪奶奶看的，奶奶在电影院呼呼大睡。,1
2,26289138,李雷和韩梅梅,U型锁再立功,GunCN,很差,2017-06-15,17:41:02,可以给0分吗,2
2,26289138,李雷和韩梅梅,一座没人的小岛,yixiaomian,,2017-08-10,19:40:50,我喜欢男主。剧情-1,0
2,26289138,李雷和韩梅梅,tiggfdruifffju,48183944,很差,2019-03-03,20:16:48,好屎。,0
2,26289138,李雷和韩梅梅,godszoe,ZoeGH,很差,2017-06-09,23:18:05,最后的结局看的我尴尬症都犯了。“你在仰望星星的同时，别忘了它也在注视你呢。”,0
2,26289138,李雷和韩梅梅,可你不愿意,miaoyan,很差,2017-06-14,16:55:46,这波撕逼我站豆瓣,0
2,26289138,李雷和韩梅梅,一万,159229329,较差,2017-06-11,19:38:35,这名字就很尴尬,0
2,26289138,李雷和韩梅梅,发电机,36687305,很差,2017-06-14,15:10:14,导演强行给自己加戏，负分滚粗。,0
2,26289138,李雷和韩梅梅,文森从牛A到牛C,najovia,很差,2017-06-14,21:29:01,现在的一些导演真是越来越不要脸了！,0
2,26289138,李雷和韩梅梅,昆汀“,215488229,很差,2021-10-06,22:12:06,补,0
2,26289138,李雷和韩梅梅,Cactus,cactus_hee,很差,2017-12-02,20:36:52,不小心陪我弟看了这个片……男主的嘴唇真的很像香肠，哈哈哈。,0
2,26289138,李雷和韩梅梅,Tribal MoLight,139684745,还行,2017-06-10,22:48:42,现在看电影要求放得低，好些个自己觉得还不错的电影一来豆瓣看差评满天飞，看电影只不过想到电影院放空一下脑袋。摆渡人也是，众口难调吧。这个电影的客群是90到95的人，也是因为这个年龄层次的人尚未成功所以10年以后没写太多，不在这个年龄层次的体会不到日渐苍老的90后也开始怀旧的情怀。,0
2,26289138,李雷和韩梅梅,糊乱的张贴,56277834,很差,2017-10-03,08:27:25,太厉害,0
2,26289138,李雷和韩梅梅,木易,hexiaoxiong,较差,2017-08-19,21:29:41,有些小情节还是让我的少女心荡漾啊,0
2,26289138,李雷和韩梅梅,木采落,lesile,还行,2017-10-17,20:27:55,纯纯滴爱。 然后都不得二终。,0
2,26289138,李雷和韩梅梅,陈海棠,138240899,推荐,2017-09-01,22:38:38,分这么低？！我觉得超好看啊 /爱了十年？可女主已经戴钻戒了啊…,0
2,26289138,李雷和韩梅梅,蛋形矮胖子,72783700,很差,2017-06-20,11:17:17,我高一也发起过联名弹劾英语老师，很冲动很热血，影片可能比较适合五六年级学生的心思，下一个是应用题里把牛奶喝一半又灌满的小明么，我觉得我胃有点抽，为写观点看的，能不能报工伤啊,3
2,26289138,李雷和韩梅梅,佳璇,32742608,较差,2017-08-11,23:50:57,好无语,0
2,26289138,李雷和韩梅梅,元宝宝,152434281,较差,2017-07-14,14:50:54,这样的青春片就是浪费资源！一点意义都没有。,2
2,26289138,李雷和韩梅梅,夕月木,xiyuemu26,很差,2017-06-14,15:49:06,咋啦？还想威胁阿北？阿北是豆瓣的阿北，豆瓣是我们的豆瓣。,1
2,26289138,李雷和韩梅梅,與世無爭,163255712,还行,2017-08-09,17:22:16,喜欢电影的某些台词。。,1
2,26289138,李雷和韩梅梅,小祖宗已上线,MartinaChen,还行,2019-02-27,01:30:56,真的挺一般哒,0
2,26289138,李雷和韩梅梅,火蓝舟云,199045774,较差,2022-05-31,11:10:23,补。3。看着像零几年拍的。。。,0
2,26289138,李雷和韩梅梅,下雪的晴天,80457179,还行,2017-08-10,14:35:13,虽然故事是快进看完的，虽然故事真的讲得很烂，但我真的是很喜欢李雷这个演员这个型的男孩呀，看完了睡了一会儿，醒来就沉入巨大的悲伤了。明媚发光单纯的日子，终是远去了。,0
2,26289138,李雷和韩梅梅,落落无沉,54996761,还行,2017-08-13,22:33:01,电影的套路还是很明显，老师办补习班的梗其实在很多片子中都用过了！电影是拍给20岁以下青少年，对于看过很多电影的豆瓣青年，过于幼稚了。推荐给喜欢淡淡情愫懵懂感情的人儿~可以快进看,0
2,26289138,李雷和韩梅梅,小怪兽,37924507,很差,2018-01-14,23:39:26,硬编也是很辛苦啊,0
