page_index,movie_id,title,username,user_id,rating,date,time,comment,useful_count
0,27661976,无迹可寻,秦小皇影音疯刊,dongxuanlan,很差,2018-02-14,09:51:30,可惜了宋洋这个好演员，还是别选悬疑故事片演了，好好回去跟徐皓峰拍武侠动作片多好！,20
0,27661976,无迹可寻,叨叨怒掷狗头金,zhywith,,2018-11-03,22:22:51,电视猫显示豆瓣评分8.3是怎么回事…浪费时间,5
0,27661976,无迹可寻,对你爱不完,140638723,很差,2018-02-10,15:33:22,无逻辑可寻。,9
0,27661976,无迹可寻,обломов,glim,很差,2018-04-20,21:42:21,这个故事说明在你囶骗保很难？,4
0,27661976,无迹可寻,麦兜兜,140218517,很差,2018-11-03,22:38:49,哪个狗日的在电视猫上标的豆瓣评分8.3分，浪费劳资那么长时间，草泥马！,5
0,27661976,无迹可寻,飙雪璨阳,50667944,很差,2018-05-15,17:12:22,一个做警察失败的保险调查员在调查一宗杀夫骗保案后自杀骗保并成功将受益给了杀人犯的故事。是不是很奇葩？更奇葩的是这还是带着悬疑感拍成的一点也不恐怖的恐怖片，而且全片没有一个好看的镜头，没有一句值得记住的台词，至于影片讲了什么，无论我怎么脑补，仍然无迹可寻呀！难道是一群神经病的故事？,3
0,27661976,无迹可寻,小智,72136793,很差,2018-02-13,01:00:35,楼上五位去影院观看的朋友，辛苦你们啦,6
0,27661976,无迹可寻,风间藤,ateng1018,很差,2018-02-10,12:48:20,今年看的第一部烂片。音画不同步，全程无感，剧情尴尬，毫无亮点。,5
0,27661976,无迹可寻,彩戏师wala,caixishi,很差,2018-04-23,22:14:08,神经烂,2
0,27661976,无迹可寻,假笑girl,2161666,较差,2018-02-10,20:27:55,点在哪？,0
0,27661976,无迹可寻,Oak,ygyoak,很差,2018-05-13,21:37:38,水军能不能专业点？还没上映就说喜欢看？,1
0,27661976,无迹可寻,Stboo,beattywell,很差,2020-03-04,15:40:19,没奢望是中国版的幻影凶间，但也不想看一个连故弄玄虚都不努力的骗保故事。,1
0,27661976,无迹可寻,西门大官人,ANPANG,很差,2018-12-04,10:07:12,居然是上映的，以为是网络电影,2
0,27661976,无迹可寻,棠,51264332,还行,2019-02-06,14:14:03,抑郁症自杀也正常，否则就为了写受益人是王医生而自杀，就牵强了。男主好像不只有抑郁症，还有狂躁症。亲戚小孩看的时候只有一个问题，就是男主为什么要裸体？小孩的角度果然不同,2
0,27661976,无迹可寻,SuE,eyrehuang,很差,2019-01-17,16:00:26,幸亏没去电影院看，我怕我会哭晕在电影院,2
0,27661976,无迹可寻,是lily呀,Lily_D,还行,2019-05-03,16:57:10,挺好的主题拍得咋咋呼呼的,0
0,27661976,无迹可寻,海盟洋溢,haiyangLi,很差,2018-08-24,12:00:20,简直无逻辑可寻，可能连导演自己都拍迷糊了吧，故事讲不好还乱加感情线，最后稀里糊涂收场,1
0,27661976,无迹可寻,elwing,snowchong1984,很差,2018-09-08,19:57:02,看了《暴裂无声》，腾讯视频联想推荐，看了10分钟弃，乱七八糟不知所云。腾讯视频的联想算法真够烂的。,1
0,27661976,无迹可寻,志,151281852,很差,2018-11-11,23:18:53,浪费时间，电视猫上竟然给到了8分，黑,1
0,27661976,无迹可寻,绝对零度0o,abso0ozero,还行,2018-06-24,18:27:56,只有发生在自己身边的时候，才会觉得真相的重要。,0
0,27661976,无迹可寻,巭孬嫑闹嫑怣嘦,qq369535660,很差,2018-02-10,10:51:19,一个卖保险没素质精神的精神病和一个骗保大姐的故事！冒充警察和警察医院大喊大叫的没素质电影！,2
0,27661976,无迹可寻,Dong,4626538,很差,2018-02-14,22:12:14,我的宋洋啊………,3
0,27661976,无迹可寻,蜻蜓队长,44159787,很差,2018-02-09,10:03:59,有人黑过我账号吗？这种垃圾电影我怎么能看,1
0,27661976,无迹可寻,33姗姗君,151992854,力荐,2019-05-02,23:06:23,一如既往爱宋阳,0
0,27661976,无迹可寻,子都,61329392,很差,2019-01-11,16:55:46,"首先，因為電視貓來的麻煩點一下有用。謝謝。
本片是神片！真的！！全程又尷尬又睏，這酸爽我都不知道我是怎麼撐過來看完滴！！真棒，我心中永遠的第一，應該後無來者了(片名跟類型也是一絕！)。",1
0,27661976,无迹可寻,斯坦利•赵,1001195,很差,2018-04-21,11:11:02,是不是后期配音的缘故，很多地方的音画都不同步。剧情也是够糟的，可惜了宋洋。,0
0,27661976,无迹可寻,栋成溪就,70338323,很差,2021-07-07,11:54:09,毫无逻辑。,0
0,27661976,无迹可寻,嘻嘻弗斯,Zero0919,很差,2018-05-06,15:25:51,垃圾,0
0,27661976,无迹可寻,竹乐喆,37412559,很差,2018-05-30,10:05:08,垃圾,1
0,27661976,无迹可寻,北人字,127899402,较差,2018-05-29,18:15:35,我这是看了什么。。。,0
0,27661976,无迹可寻,逍遥叹,dkingm,推荐,2019-10-10,15:16:36,算不上恐怖惊悚，也算不上烧脑，单纯从剧情来说 其实也不算复杂，但是却可以给我们一些提示，李郁的自杀有其抑郁的因素 却也失去了他自杀的意义。,0
0,27661976,无迹可寻,平昭,153199964,很差,2019-11-15,01:15:11,烂成这样真的无法容忍 故事都没讲明白 一惊一乍故弄玄虚 我为了宋洋生生熬了八十五分钟 我太难了,1
0,27661976,无迹可寻,麦子,btone0808,很差,2018-04-24,13:43:26,虺文忠大战尹志平，哈哈，几个印象挺深但又不常见的演员，很期待他们在悬疑剧里的新台词、新表情包，这也算新收获。,0
0,27661976,无迹可寻,lpu9,3526210,很差,2018-02-10,16:11:35,一个骗保的破事凑一个半小时真难为导演了,1
0,27661976,无迹可寻,香火兄弟,gw150080,较差,2019-01-21,21:51:43,看不下去啊……,0
0,27661976,无迹可寻,Strangerant,155138041,较差,2018-04-21,08:34:22,浮夸。最后的丧命完全没有必要。李郁啊李郁，你用性命唤醒了她的良知，你又将法律置于何地。,0
0,27661976,无迹可寻,青铜爬不出来,162560019,很差,2019-04-09,01:53:06,在国航的航班上看的，一头雾水！实在是差，都不知道在说啥。,0
0,27661976,无迹可寻,轨迹,3135431,很差,2018-12-09,15:22:48,垃圾,0
0,27661976,无迹可寻,EvilGoblin,64996012,很差,2018-08-05,16:30:27,我追求的真相支离破碎，掩藏在人们的心里，当你竭尽全力把它们重新找到，拼在一起，却发现它沉重不已，成为你，无法承受的痛。,0
0,27661976,无迹可寻,蘑菇小姐,37210878,很差,2019-04-09,18:53:51,幸好看了开头觉得太差了，来看了下豆瓣,0
0,27661976,无迹可寻,王木川,jielunxiaoxin,较差,2018-06-25,17:18:17,确实无迹可寻，毫无逻辑。没认出男主是《暴烈无声》里的，看着好年轻。,1
0,27661976,无迹可寻,老司机阿飞,142216129,较差,2018-04-26,20:34:43,还行啊在看,0
0,27661976,无迹可寻,我是连长,140311454,很差,2019-11-01,16:46:28,陪我妈看的,0
0,27661976,无迹可寻,爱比死更冷,70421764,较差,2018-04-26,23:24:37,"导演: 张帆
编剧: 许植坤
主演: 宋洋 / 淳于珊珊 / 连凯 / 李晓红 / 蒋一铭 / 林琪 / 武振素
类型: 悬疑 / 惊悚
制片国家/地区: 中国大陆",0
0,27661976,无迹可寻,阳光散落在脸上,65044455,较差,2018-06-15,22:17:55,剧本有很大的问题，拍摄的十分割裂，前半段惊悚不足，后半段无聊有余，逻辑性较差。为宋洋多加一颗星。,2
0,27661976,无迹可寻,_不才,56156366,很差,2018-05-03,13:42:09,保单受益人什么时候可以填写非亲属了…,1
0,27661976,无迹可寻,与飞之七,152858299,很差,2019-01-21,13:36:20,烂的细碎,1
0,27661976,无迹可寻,千生诗,92875885,较差,2018-11-28,19:15:57,浪费我时间他买的,1
0,27661976,无迹可寻,蛋壳,53159773,很差,2019-04-15,12:18:34,有负分吗？又一次刷新了我对于烂片的认知，只有更烂没有最烂，我是多无聊在飞机上看完了竟然,0
0,27661976,无迹可寻,当年情,135462080,很差,2018-05-19,17:23:33,通过某公众号推荐的了看完一脸困意 打着悬疑的噱头 强行故作弥彰闹鬼渲染恐怖气氛 然而整部电影看完昏昏欲睡，完全不知所云。男主应该是，骨质酥松，一部电影摔倒了三次。剪切很不到位，有些人物出现的，莫名其妙，没来由的自行去挖掘所谓的真相 最后死的也莫名其妙，烂片。,0
0,27661976,无迹可寻,Halo,81093499,较差,2018-10-31,22:13:48,"故弄玄虚，你也得把故事画圆了。
突如其来的结局，令人措手不及。
互无关联的人物情节，主要是为了故弄玄虚来辅助的？还是导演的表述太跳跃？",1
0,27661976,无迹可寻,失眠者的梦,113046611,很差,2022-01-30,20:45:34,不好看，希望宋洋能演好的作品，他的演技是可以,0
0,27661976,无迹可寻,JeromeLoo,jeromeloo,很差,2018-10-24,00:24:02,演技太烂,0
0,27661976,无迹可寻,吸血小猴子,36700724,很差,2020-05-29,02:07:22,不知道导演要讲什么！,0
0,27661976,无迹可寻,z,153903690,很差,2018-04-27,12:47:58,仿照富春山居图的宣传片？可以放出来的时候安邦都挂了,0
0,27661976,无迹可寻,桃然,171616363,很差,2019-06-27,20:35:53,连凯是缺钱了吗，虽说是配角，可也不能不看剧本啊，这什么玩意,0
0,27661976,无迹可寻,超爱白色连衣裙,180234481,很差,2020-05-22,12:51:39,节奏慢，剧中人物脑回路很奇怪，拍得太碎，以至于到最后都形不成一个很完整的因果关系和人物关系链，只能理解个大概。男主表演还不错，连凯怎么老演烂片？,0
0,27661976,无迹可寻,刀疤雯yoyo,61144979,很差,2019-07-26,21:02:28,电视猫为何评分8点3分？？真的浪费时间。。,0
0,27661976,无迹可寻,啾啾,140138015,很差,2018-04-20,12:53:09,难看,0
0,27661976,无迹可寻,选择恐惧振,138637409,,2018-04-18,13:47:23,宋洋还拍过这种烂片啊,1
0,27661976,无迹可寻,nicklaw_mcfly,127692895,很差,2018-11-15,23:47:59,？？？？？,1
0,27661976,无迹可寻,mikeknight,115485157,很差,2020-08-07,03:55:14,佩服那156人点“想看”的,0
0,27661976,无迹可寻,Rt,159135566,很差,2019-06-29,01:56:47,真的太烂了,0
0,27661976,无迹可寻,飞扬童话,59345957,很差,2020-02-14,16:11:29,好尬。,0
0,27661976,无迹可寻,汪建波,149642151,较差,2018-11-28,21:38:55,很一般的片子，剧情不连贯，有硬伤,1
0,27661976,无迹可寻,岁岁合欢,62696029,很差,2019-03-04,12:26:16,被某个APP8.3的评分欺骗看了部漏洞百出的剧= =,0
0,27661976,无迹可寻,含莲,Layzyx,很差,2020-10-13,22:42:21, 最后还自杀了  男主脑壳有坑吧   我去    。。。什么鬼  还给凶手赔付   牛逼,0
0,27661976,无迹可寻,不害不我,200065935,很差,2022-09-19,22:32:10,太差劲了,1
0,27661976,无迹可寻,小永远,82812036,较差,2018-10-25,22:40:26,不好看,1
0,27661976,无迹可寻,后窗,148854453,很差,2018-04-26,17:19:24,本片的亮点就是无迹可寻，除了墙上的画又几分诡异，其他剧情跟惊悚和悬念毫不搭边，男主半裸画面几个意思？没有肌肉，还干吧瘦，导演是想吸引些女观众吗？本来觉得片名比较正常，万一还看得过呢，我就看了，结果……,1
0,27661976,无迹可寻,杜少卿,159530972,很差,2018-07-18,11:51:52,心疼宋洋,0
0,27661976,无迹可寻,在新的秩序里面,70069606,较差,2019-06-09,14:28:47,呜呜呜我再也不想看小耿演烂片了,0
0,27661976,无迹可寻,偶尔笑出声,255551168,很差,2022-04-04,15:29:05,敬业的喜欢裸露上身的保险调查员神经错乱的故事。故布迷阵，故弄玄虚，故作深沉。一个多小时浪费下来，一个不落的烂片基本手段，一脸懵逼。,0
0,27661976,无迹可寻,龙神、 修尔,201711277,很差,2019-08-16,21:39:58,渣,0
0,27661976,无迹可寻,.,215141118,很差,2020-08-23,18:53:00,没看过这么烂的片,0
0,27661976,无迹可寻,喝茶的鱼,173590151,很差,2018-02-14,22:56:53,毫无逻辑可寻，全靠音效死撑,0
0,27661976,无迹可寻,我是小迷弟,190134198,很差,2022-11-28,19:14:50,？？？？？？？？？？？？？？,0
0,27661976,无迹可寻,一鸣大师,181643964,很差,2019-03-23,22:46:03,"要不是电视猫显示豆瓣8.3我真不能看着电影。
这是我看过名字最符合逻电影评价的电影。",0
0,27661976,无迹可寻,代玉林,176141122,很差,2018-04-22,22:33:16,没剧情没逻辑的烂片，浪费大爷时间,0
0,27661976,无迹可寻,LJ.Z,175726912,较差,2019-03-04,18:18:50,为了悬疑而悬疑，不知所云,0
0,27661976,无迹可寻,。。。。,175857667,还行,2018-08-03,12:07:18,三星给演员，果然是国产恐怖片啊。。,0
