page_index,movie_id,title,username,user_id,rating,date,time,comment,useful_count
2,26602933,绑架者,JL,juerlain0612,力荐,2017-03-31,20:52:23,黄立行no.1,1
2,26602933,绑架者,老猫,MarkFong,还行,2017-05-13,22:55:51,反正，反转的情节我都猜中了。,0
2,26602933,绑架者,zonovo,zonovo,较差,2017-06-04,17:24:23,算了吧~,0
2,26602933,绑架者,豆瓣酱,119806823,较差,2017-04-01,07:05:27,老徐对黄立行是真爱，这么多人陪他走秀,1
2,26602933,绑架者,沉山泥🐇,popopo,较差,2017-05-29,14:05:01,剧情铺陈太弱，黄立行一出场就猜到人物关系。,0
2,26602933,绑架者,B,tsebb,很差,2017-07-07,04:28:39,根本看不进去 什么鬼 无聊透顶,1
2,26602933,绑架者,lesley,carmen8212,较差,2017-05-30,21:48:19,前边一直采拍摄地，中期猜老徐号称主演何时出现，最后还在猜这警察制服和国旗是哪里的标志…剧情嘛，一开始就参透了,0
2,26602933,绑架者,"★Napoleon,",Liliuokalani,还行,2017-08-06,16:00:19,明道呕吐,0
2,26602933,绑架者,大仙,hdx1991,较差,2017-05-24,12:32:28,白百何基本体现了我国警察的战力水平。,0
2,26602933,绑架者,习惯被忽略,jimmy037,还行,2017-11-29,00:25:11,其实吧，前面设计得还行，从失忆到层层追查，悬念节奏保持得不错。逃跑设计得也非常合理，打斗戏上处理得挺不错，水平属于中上等。可惜结局洗白得太突然，就让黄立行保持黑道得身份不是比警察来得更好嘛，还有，大人器官不行了用小孩的移植？逻辑性在哪里？广电总局站你旁边让看着你写得啊？,0
2,26602933,绑架者,车伽些,sensenv,,2017-07-16,11:22:51,？？？？？,0
2,26602933,绑架者,皮卡丘Casper,JJJJonathan,较差,2017-04-04,17:43:35,难以理解这部电影 像个半成品 不过徐静蕾在这个电影里面 给了白百合好多个影后时刻 白百合一个也没抓住,1
2,26602933,绑架者,特写蒙汗药,ecnumeng,很差,2017-03-31,12:18:50,老徐静蕾才女拍了一部侮辱观众智商的片子！,10
2,26602933,绑架者,天涯.........,127225715,很差,2017-06-01,09:55:47,徐静蕾拍动作片？全片有一种无法散去的正宗的山寨感。,0
2,26602933,绑架者,鸟倦知还,131849470,很差,2017-04-02,23:00:30,老徐贡献了黄立行的肉体，然而并没有什么用。,1
2,26602933,绑架者,凯特芒果,173511468,很差,2022-04-15,01:53:06,神特么绑架者，一般都说绑匪，电影也是稀烂，装杯的文青什么的很烦人,2
2,26602933,绑架者,suejet,suejet,很差,2017-05-27,16:03:40,浪费时间的，仅供吐槽的。生吞活剥，强拼硬凑，漏洞百出。 2017-05-27,0
2,26602933,绑架者,夏夜飞行器,bizichuxue,较差,2017-04-01,17:29:55,确实很差,1
2,26602933,绑架者,苦苦苦苦,likuku,较差,2017-04-02,23:07:11,额…开始还好，野外半山冒出个红色电话亭开始出戏…天台“我想做个好人”TM太尴尬了，影院里连邻座小哥都提前几分钟猜到这台词了好吗…片尾表彰会也是满满大写的尴尬…老徐之前的作品都还挺好，这部是怎么了？,0
2,26602933,绑架者,雨中的猫,1298987,较差,2017-04-05,18:19:44,电影就讲了一件事：你们看我男人多帅,1
2,26602933,绑架者,阿呆同学,153453290,还行,2017-04-14,23:19:39,全程看黄立行的肌肉就好了,0
2,26602933,绑架者,赵伯鼠zFy,zhaofuyuworld,还行,2017-05-14,15:15:35,反派太单薄了。让整个剧本都很单薄。除了黄立行，其他人的演技也都崩盘。,0
2,26602933,绑架者,纸佬,1719577,很差,2017-05-13,23:04:46,混乱的剧本，查个案子除了互吼就是煞有介事的分析，王立行就耍帅就好了是吧。,0
2,26602933,绑架者,H,33456055,,2017-10-10,21:33:58,飞机上没播完,0
2,26602933,绑架者,C T T,CTT696,还行,2017-05-18,00:14:20,剧情 叙事节奏 演技 都太弱了……,0
2,26602933,绑架者,曾海绵🌈,allenzn125,较差,2017-05-25,15:54:27,内地女性导演拍动作片是真不行，全程只有大写加粗的尴尬。文戏全程失控，几位演员真是台词演技全面掉线；打戏毫无创新，甚至很难看。徐静蕾是多么痴迷黄立行的身体啊？自己享受之余还给观众们创造福利，够大方！,0
2,26602933,绑架者,大心,1658796,较差,2017-10-31,14:05:19,关掉声音看吧，会好一点。,0
2,26602933,绑架者,咖喱乌冬,123029780,较差,2017-05-26,12:18:01,白百合气质大相径庭，警匪悬疑只存在于剧照中,0
2,26602933,绑架者,C_Q,deasil,较差,2017-05-14,17:11:45,有什么推理和逻辑吗..,0
2,26602933,绑架者,獨要,65870018,还行,2017-08-28,17:46:34,演技最好的是明道.可惜戏份被删..最烦感的就是在台湾拍的刻意去模糊背景..四不像.看了一半就能猜出结局..,0
2,26602933,绑架者,Miss_滋,zi,较差,2017-05-14,08:44:09,老徐在70后中算是走了先锋路线，真实洒脱不做作，于是占领了个才女的名号。才女这个尴尬的词儿，在90后和真人秀当道的年代，反而是做作了。,0
2,26602933,绑架者,如小果,ruxiaoguo,还行,2017-04-05,23:13:19,前半部分节奏感很好，后半部分几乎是靠bug撑起来，明道绑架儿童为了姐姐的肾源？儿童肾源移适合成人？为什么不直接绑架成人？,0
2,26602933,绑架者,全面回忆,Total-recall,很差,2017-09-18,22:56:11,老徐的导演水平从处女作开始就不高，随后虽然拍片不多，水准那是直线跳水。不但不该尝试商业片，而且更不该屡次尝试风格各异的商业类型片，最悲催的是非得爱老黄那么明显，情商跟着专业水准一路下行。,1
2,26602933,绑架者,靳以斯,dierightnow,较差,2017-04-01,12:41:09,结局天台对峙的一场戏真的好烂。徐静蕾厉害，集齐港澳台。创造一个无政治社会。,1
2,26602933,绑架者,雅 罗 米 尔 。,tingsnowy,推荐,2017-06-14,11:17:34,挺好的呀 怎么分那么低,0
2,26602933,绑架者,绿海,lvhai,还行,2017-05-18,22:01:54,原本还挺期待 看完什么也没记住,0
2,26602933,绑架者,Eva艾菁,liuaijing,较差,2017-04-03,08:24:49,老徐第一部警匪片，剧本没大毛病，对于她这种拍换了文艺片的人，就算很不错了，但是并不推荐看。黄立行裸体镜头的意义在哪里，并不知道。,1
2,26602933,绑架者,毛利桑,152135826,较差,2017-07-16,19:41:49,尼玛，搞到最后绑匪竟然是警察,0
2,26602933,绑架者,mee,meepann,较差,2022-04-09,23:40:06,黄立行帅的，白百合啥玩意。。,0
2,26602933,绑架者,bearyao,beary,较差,2017-05-22,01:47:58,完全不知所云 给黄立行的肌肉加一颗星,0
2,26602933,绑架者,泽泽泽泽泽,bo1985,还行,2017-03-31,15:40:53,白百何演的还不错，可能是做了妈妈的缘故，能体会到女儿丢了歇斯底里的心情，而且几个眼神真的很动人，黄立行在里面可以看到徐静蕾真的是带着爱在拍他，其他人都是为他服务的啊；而且里面台湾综艺咖太多，分分钟出戏，最后明道的反转理由牵强,2
2,26602933,绑架者,何詩詩,dearpucca,,2022-02-13,21:47:06,最好看的是打戏，一招一式好像样,0
2,26602933,绑架者,小托,xiaotuo,较差,2017-04-02,19:24:21,梁天转过身的瞬间才是全片的高潮。,2
2,26602933,绑架者,罗西基,34901213,较差,2017-03-31,23:11:12,二星，老徐这是有多爱自己的情郎啊，哪怕错漏百出智商离线也在所不惜……,0
2,26602933,绑架者,momo,54004746,还行,2017-05-17,23:59:34,冲着深爱的老徐，感觉拍的差火候没有逻辑很幼稚应该就是因为老徐她真的是个直白的人吧，不玩虚的，所以悬疑犯罪，她真不适合，拍不出来味道，她自己都感觉得出来,0
2,26602933,绑架者,六元的小凶许,146154423,还行,2017-03-31,17:14:11,5/10，这种电影里最好的搭档朋友什么的只有两个结局一个是死一个是大反派所以结局完全意料之中，失忆梗怎么也玩不过杰森伯恩，剧情bug太多也不用一一说明了…最后结局国产特色。白百合还是适合苦情戏，扮严肃扮不起来耍横一点也不狠，黄立行口音太出戏了…总的来说太过一般没啥亮点,1
2,26602933,绑架者,吃个大香瓜,toutoulan,较差,2017-07-26,17:37:42,几处打斗场景就还不错,0
2,26602933,绑架者,文白,46815070,较差,2017-03-28,12:14:33,2.5，在明道和结尾的双重打击下，电影终于垮掉了……,11
2,26602933,绑架者,玲娜贝尔尔,Ether99,推荐,2017-09-28,23:40:01,这种片子以后能不能不要加感情线了= =！,0
2,26602933,绑架者,elwing,snowchong1984,还行,2017-06-01,00:13:47,好的电影，剧情是核心，演员是为情节助力的。徐静蕾的片子为何总有一种现象，演员是核心，剧情逻辑乱七八糟。,0
2,26602933,绑架者,仙女蕊,44335994,较差,2017-05-15,20:58:37,剧情有点突兀，表演节奏摄影气氛都生硬，没有代入感。白百合开车就开车，突然戴个墨镜是闹哪样。20170515,0
2,26602933,绑架者,momo,152697813,,2017-06-27,22:57:09,感觉老徐纯粹在为自己的男朋友圆电影男主角梦......,0
2,26602933,绑架者,Sherry,26540404,较差,2017-05-13,13:51:17,老徐老黄你俩快结婚了 别再秀恩爱让观众买单了,1
2,26602933,绑架者,娄知县,79394514,还行,2017-03-27,08:53:28,三星半，开场不久后就意外，节奏氛围都在线，故事完整有逻辑。演员有时感觉用力，动作戏比文戏好看，比导演之前的商业片好看。,2
2,26602933,绑架者,黄人王中王,SB714995200,还行,2017-05-22,12:33:56,黄立行的屁股～～哈哈,0
2,26602933,绑架者,宅达拉压马路,81897833,还行,2017-04-09,17:33:53,友人问我看完的感受，我说了句，跟看完《有一个地方》感受一样。她说怎么会一样，一个爱情片一个动作片？对，就是这样。,0
2,26602933,绑架者,枫丹白露,2354646,还行,2022-05-01,17:41:15,幕后真凶早就暴露，反转也有点牵强，不过黄立行的确很有男人味儿,0
2,26602933,绑架者,天生是明星,xutangjunzhe,还行,2017-05-14,09:29:05,生硬的反转。,0
2,26602933,绑架者,"偏执狂,我只触过奇迹的手",paranoiaman,较差,2017-04-01,21:20:22,两天看了三部犯罪类电影，《绑架者》垫底,0
2,26602933,绑架者,云淡风清,valentian,较差,2017-05-28,10:17:20,真的除了男主角一身肌肉充满荷尔蒙外，我没有看到其他。。。,0
2,26602933,绑架者,雪中春信,160808136,较差,2017-07-02,14:03:26,白百合演技负分,0
2,26602933,绑架者,高筱筱,3783693,很差,2017-05-13,23:51:40,明道真心不容易啊，最应该给的镜头，最能交代剧情转折的镜头，都被老徐剪了，只为了给黄立行凑足一部完整的奔跑的男庞友,0
2,26602933,绑架者,刀下找糖,63332743,较差,2017-05-18,22:24:13,明道演的好尴尬,0
2,26602933,绑架者,金敏丧,76153086,较差,2017-03-31,20:23:11,从“才女徐静蕾”到“女徐静蕾”需要几部电影的时间，一部《绑架者》足以让你不再抱有任何希望。白百何的咆哮加上黄立行的苦逼角色和蹩脚普通话再加上明道不知所云的变脸，毫无悬念地产生出爆笑的喜剧效果，看完本片的我一脸懵逼，梁天招谁惹谁了？,3
2,26602933,绑架者,Seven_Ling,131148712,还行,2018-05-15,05:36:46,结构比较奇怪，中间看不下去…,0
2,26602933,绑架者,hexdiad,58972281,推荐,2017-05-16,11:02:01,"神秘的城市，没有城市特征。
绑架警察的女儿，黑帮确实智硬，找配型怎么就要用抢的。
库里都没有，就开始自摸了？
请得起黑帮，还不如直接去问问能不能买到……
犯罪动机有问题之后，发现内鬼找人帮忙，答应的人也很智低吧……居然还帮忙圆谎……警察搞得很奇怪。",0
2,26602933,绑架者,Xc,xc0418,还行,2017-05-21,02:38:17,导演最后就出现几秒钟，还是美的不可方物。,0
2,26602933,绑架者,muzilang,muzilang,较差,2017-04-01,21:00:10,好幼稚的剧情,2
2,26602933,绑架者,一叶知秋,144288224,较差,2017-04-04,11:51:04,徐静蕾才尽了,0
2,26602933,绑架者,九段,123645823,推荐,2017-04-02,22:37:51,我给个八分，给黄立行，因为演的很好，以兹鼓励。但白百合的表演确实不到位，没有入戏的感觉。整部电影最致命的是故事本身，槽点实在是太多了，逻辑混乱不合理。剧本这么不合理实在是太不可思议了！,1
2,26602933,绑架者,WhaThaF,sinfulwolf,还行,2017-05-17,04:30:56,还行吧没有说的那么烂啊,0
2,26602933,绑架者,BIOTD,subaru244,还行,2017-04-06,19:51:44,大家不要这样好嘛 其实黄立行还是很有腔调的 徐静蕾很懂他的点 故事？不要谈了 看看白百合over的演技,0
2,26602933,绑架者,桃花朵朵开,4868130,很差,2017-04-01,06:18:27,脱离了爱情片傻白甜小清新的白百合演技也就那么回事  剧情逻辑有问题啊,1
2,26602933,绑架者,鲁大师-鲁提辖,luwenhui,较差,2017-08-05,02:26:44,明道越看越像一直大熊猫，而且这个警队黑警最终BOSS几乎就是登场五分钟就暴露身份了好嘛…白百何大呼小叫神神叨叨比较惹人烦。讲真，这部电影纯粹就是老徐给男朋友量身打造的写真视频啊！,0
2,26602933,绑架者,zoe,3571623,推荐,2017-05-25,12:45:47,还不错，每个人演技都还在线。找记忆也算有点悬疑，明道的演技竟然不错，矛盾性格演绎的挺到位。白百何的大嗓门有点腻味。,0
2,26602933,绑架者,鸟倦飞,niaojuanfei5566,推荐,2017-05-17,12:13:47,电影给人希望,0
2,26602933,绑架者,大B哥,talk_to_death,较差,2018-10-08,20:52:58,黄立行个人写真,0
2,26602933,绑架者,月亮先生,edwardtroy,很差,2017-05-17,09:25:30,看完后对徐静蕾的“才女”称谓产生了怀疑。,0
2,26602933,绑架者,胡天柒月,seventhworkshop,很差,2017-04-01,22:42:27,为老徐想想原因吧，为了架空背景，把城市川蜀和香港的混合体，看得真是尴尬死了。故事套路放十几年前都不新鲜，角色刻板而浮夸，白百何全程大呼小叫，深得马景涛真传。,1
2,26602933,绑架者,思生活私生活,XINGZOU1984,较差,2017-04-10,16:40:53,毫无逻辑可言，除了黄立行的身材，再无看点。,0
2,26602933,绑架者,懿罂,29987721,较差,2017-04-04,20:40:37,剧本的悬念经不起任何推敲，全靠巧合撑着。表演更是灾难。,1
2,26602933,绑架者,微雨艳,150424813,推荐,2017-03-31,20:58:47,还不错呀！为什么评分这么低？只是结尾俗了些呗！但是故事情节，打斗场面，都不错，环环相扣，干净利落，真实不夸张，三个主要人物的角色都很出彩！明道的角色反转很意外，没想到！白百何的警察造型酷，这个路线的她还比较喜欢。尤其喜欢上了白百何的腰，瘦瘦的汗衫，空空的腰！最近就爱别人的小蛮腰了,3
2,26602933,绑架者,Michael_Yi,44397532,还行,2017-05-30,14:20:58,谷阿莫讲电影系列,0
2,26602933,绑架者,共此灯烛光,wangmusi,还行,2018-01-11,15:33:56,黄立行还是不错的，比明道好。,0
2,26602933,绑架者,虚位待华年,131189459,很差,2017-06-07,14:58:21,白百何和明道互相咆哮尬戏的时候可以说是非常爆笑了。,0
2,26602933,绑架者,蠢小白,secretsea,还行,2017-04-08,13:20:16,乏味，老套。冲白百何去看的。,1
2,26602933,绑架者,岚小壹时光琐碎,ukimuknow,较差,2017-04-15,18:55:10,天台飙戏我真的尴尬癌都犯了……本来一般在电影院看的话气氛烘托下…看他们演的激动自己看着都快笑出声了的尴尬……也是没sei了…港台腔真是不适合吵架,0
2,26602933,绑架者,大金牙呀！,51711938,较差,2017-04-09,15:44:28,首映发布会。主要逻辑太差。,0
2,26602933,绑架者,白驹过隙云淡风轻,65075320,还行,2017-08-02,22:07:57,补番，前面还不错！！,0
2,26602933,绑架者,阿斯巴拉,libin1012,较差,2017-05-26,02:15:39,有港片的味道，但是却少了港片的魂儿。,0
2,26602933,绑架者,冲田总悟,148933548,较差,2017-04-08,17:56:21,白百何太用力,0
2,26602933,绑架者,ceci🍰,169092759,很差,2019-07-13,20:21:18,完全看不进去！白百合拍这个嗓子估计挺累的,0
2,26602933,绑架者,Zoe,wincywincy,还行,2017-05-13,22:39:15,应该改名叫《我的男人好帅》，纯纯纯女朋友视角。,0
2,26602933,绑架者,hedgehog,hedgehog,较差,2017-07-24,10:26:55,明道的表演也实在是太浮夸了……徐静蕾把黄立行拍得很帅,0
2,26602933,绑架者,金属,1493686,很差,2017-05-16,23:46:30,有钱任性徐静蕾，离开王朔拍警匪。台词尴尬动作水，失忆爱情小魔鬼。,0
2,26602933,绑架者,Miss kikii,27750809,还行,2017-09-19,21:07:05,黄立行的身材确实好，演不了坏人，果然是卧底，不太喜欢白百合的电影了，还是徐静蕾好看,0
2,26602933,绑架者,不瘦不改名的札,behindlies,较差,2017-04-04,18:07:01,讲真 两星全给明道 能不能给黄立行配个音啊 ,0
2,26602933,绑架者,V.CAT,v.cat,较差,2017-06-14,11:54:23,100%被缴械的警察实在叫人心如止水。,0
2,26602933,绑架者,骑呢星人,34482289,还行,2017-04-02,00:08:37,2017/04/01 中规中矩，寻找记忆的剧情紧凑，后面感觉略为崩坏。,1
2,26602933,绑架者,碧傅凯,92032476,较差,2017-03-31,16:25:38,大家不要浪费钱了,7
2,26602933,绑架者,小鱼窜访豆瓣,croath,还行,2017-10-06,17:11:31,需要打磨一下啦...情节再连贯一点就很抓人心啦...,0
2,26602933,绑架者,mondenawait,3884732,较差,2017-12-20,22:43:53,感觉是老徐给内人量身定制的一部动态个人写真233333,0
2,26602933,绑架者,蜀黍酱,62942210,很差,2017-07-14,22:22:48,滚,0
2,26602933,绑架者,好人,A110110110110,很差,2020-05-06,14:08:36,狗屎,0
2,26602933,绑架者,已注销🇨🇳,princesssyn,很差,2017-08-29,19:34:56,明道都开始演坏人了，可这故事不禁推敲啊,0
2,26602933,绑架者,幕天席地,119429128,还行,2017-04-14,09:44:05,一直都很欣赏黄立行，给三星吧,6
2,26602933,绑架者,瞳°不乖,apple.tong,较差,2017-05-16,11:29:21,好没用的女警啊...导演的人怎么会是坏人...明道太憋屈~~,0
2,26602933,绑架者,Rumpleteazer,44006704,很差,2017-05-15,21:09:22,老徐为了凑这个片长 费老鼻子劲了,0
2,26602933,绑架者,hungry,dbhungry,很差,2017-06-21,19:40:01,稀烂的剧情，稀烂的人物。这是什么狗屁故事1！,1
2,26602933,绑架者,acasia,justlikeheroin,,2017-04-05,19:29:07,动作场面拍得干净，整体节奏特别舒服，故事简单了一点。,0
2,26602933,绑架者,胡阿忧,onlineforever,还行,2017-05-19,09:54:38,故事非常不错，可惜台词/演技真的很一般。卧底的剧情被刷新了呈现方式，可是失忆是怎么找回的呢？整体来说，剧情紧凑，台词、表演漏洞都不少；很多情节都表现只能看到“剧情需要”而没有所谓的表演和表现。还有，整部剧里剧情都很紧张，基本没有什么轻松悠闲的环节，这个控制必须给个赞。,0
2,26602933,绑架者,SUmmEr,sophie.sue,推荐,2017-05-18,17:27:30,神秘女人老徐对黄立行说：我有一部电影要拍，拍好点儿！,0
2,26602933,绑架者,黑白有离,59689060,还行,2017-09-11,22:51:12,不想说还行  加一星给黄立行吧,1
2,26602933,绑架者,Yan,rouyan,较差,2017-04-05,08:56:33,有好几幕  白百何的演技真是太尴尬   最后导演还要专门搞得很型出来走一场  哎  故事太简单了,0
2,26602933,绑架者,美貌大王,53983458,较差,2017-04-01,19:30:34,剧里的黄立行和明道参加奥运会估计就没刘翔什么事了,1
2,26602933,绑架者,齊楊森,kylinacy,很差,2017-04-25,20:27:16,老徐能不能不要为了她男人把电影毁得七零八落。,1
2,26602933,绑架者,梵🌈,jill426,较差,2017-04-01,10:59:43,老徐把这样一个复杂的角色毫不犹豫地交给自己的男朋友来演，只能说明一点就是她只想在全国范围内大规模地秀一次恩爱，好的，你男朋友屁股很翘我们看到了,1
2,26602933,绑架者,尹地仇,caijiazhan,较差,2017-04-04,20:02:50,第一次在湛江爱华广场看电影，清明放假从家里过来的午后。发现我和黄立行很像很像，难道我真的那么帅吗？,0
2,26602933,绑架者,棠,51264332,推荐,2019-06-08,14:57:54,黄立行一开口说普通话，我马上出戏，之后好多了，三个主角黄立行演技最好；明道在天台上的演技不行；白百合演技还差点，吼的时候不走心；李玖哲还演戏了；情节极其紧凑，基本不给观众喘息的机会，全是高潮。凶手失忆这个点，我觉得很新鲜。徐静蕾当导演，你不用担心结局不是happy ending。评分怎么低？,0
2,26602933,绑架者,sonic monk,corpse_929,较差,2017-10-20,20:04:05,梁天：“你造吗”。我？？？？？？,1
2,26602933,绑架者,ᥫ᭡້໌,Kylin-2015,很差,2017-04-02,19:05:14,今天徒弟跟我说，现在回看《无极》，竟觉得不错了。。。可见现在的片子之烂,10
2,26602933,绑架者,oliweiya,80782532,较差,2017-07-05,19:47:04,徐静蕾给男朋友拍的电影，没观众什么事,0
2,26602933,绑架者,大罗,Gu_li,较差,2017-04-04,12:49:23,徐是不是就喜欢看（拍）黄立行裸啊方便啊等私密？？——徐这次的意淫是过火了啊，在我们和谐盛世，是不可能发生这样大规模的枪战的！第二，这部片子很可恶，在于徐逼着我们看她宣传和炫耀她男友，然后还要收钱……,0
2,26602933,绑架者,陈轮,49673811,较差,2017-04-02,17:06:39,1.开头那一段追逐戏很爽，让我想起《男儿本色》，然后果然跟《男》一样虎头蛇尾。2.不考虑口音问题最不行的居然是白百何。3.从一开始没有身份又受过特殊训练，就会想到卧底啦，何苦折腾那么多，对白还那么白痴。4.对老徐来说，算是一次有意义的尝试。5.这片也许剪成一小时电视电影还不错。,1
2,26602933,绑架者,李九弟Jody,apple_jody,还行,2017-03-31,21:13:00,看了开头，我以为这是一部立志于改变国家的电影，我以为这是一部塑造主动女性形象的电影，然而...从白百合抓了黄立行开始，整台戏朝着迷之情节的方向发展。很可惜，是个有潜力的本子，尤其是嫌疑犯失忆的设定下。想模仿香港警匪与台湾黑帮片，但在爱情片的矫情里，两头都没沾上。,1
2,26602933,绑架者,缺角大齐,50307645,还行,2017-05-14,15:10:23,除了动作戏部分其他地方还不行，剧情啊，细节啊还需要提高，陆然没立住，配角集体酱油，黄立行戏份太多，白百何的角色我宁愿换成台湾的女演员至少还算是个好看的花瓶，题材还是不错的，不要求到达谍影那种凌冽、冷峻的写实风至少也要比现在这种个人秀也好吧。只能说导演不行，尤其是拍爱情片的徐静蕾,0
2,26602933,绑架者,已zhuxiao,yueyuebetty,,2017-04-01,23:51:13,徐静蕾是真爱黄立行。很多逻辑不通与台词尴尬的地方，但前面勉强能看，真凶揭开后完全放飞自我了。,0
2,26602933,绑架者,邹以默,amelie722,还行,2017-04-02,19:41:29,三星全给黄立行的帅酷,2
2,26602933,绑架者,低端youyidifi,54762005,很差,2017-04-03,19:30:12,大银幕留给白雪的时间不多了,0
2,26602933,绑架者,舒农,shunong,较差,2017-04-02,01:08:08,徐静蕾的才华大概也不在导演上吧......希望《宫里的日子》有朝一日可以被个靠谱的导演拍出来。,0
2,26602933,绑架者,牧,lightwings,很差,2017-05-17,16:43:52,觉得挺差的，内容很空洞，白百合的演技全靠嘶吼发疯,2
2,26602933,绑架者,Queenside,83363637,还行,2017-03-31,23:09:35,黄立行的裸背、明道的反派戏、老徐的包都是亮点！,2
2,26602933,绑架者,子墨无言,hnnyzxh,还行,2017-05-14,22:52:02,通常失忆的多数都是警察或者特工了！这是我多年观影总结出来的经验。再多说一句：貌似有黄立行的地方就会有徐静蕾，是不是这样啊？,0
2,26602933,绑架者,9号風船,jcviola,较差,2017-04-08,00:29:36,同期上映的三部电影不知道为啥就这个票最便宜，所以去看了。看完感觉这么便宜的确是有原因的🙃,0
2,26602933,绑架者,格兰菲迪,138539376,较差,2017-08-16,20:59:09,黄立行很帅  没了,0
2,26602933,绑架者,爱丶安静,38248181,较差,2017-05-13,00:42:47,这是一场爱的表演秀，这是一场黄立行的跑酷动作秀，毫无电影即视感啊，不过作为打发时间的爆米花电影还是很OK的,0
2,26602933,绑架者,Jonas,Jason.Su,很差,2017-10-21,22:40:37,看评论说一星给点点的电子表哈哈哈哈,0
2,26602933,绑架者,张,yan7478,还行,2017-03-31,22:28:57,几位著名的男导演都是部部戏有自己的爱人，女导演为什么不可以？女人就是要活成徐静蕾，爱谁拍谁，爱拍什么拍什么。,3
2,26602933,绑架者,神神叨叨二百五,herrysummer,较差,2017-05-29,16:39:37,徐静蕾说，我男朋友的屁股好不好看，好看就得了。要什么剧情,0
2,26602933,绑架者,薇城胤希,43632851,较差,2017-05-14,13:42:31,明道最后的反转演的不错，黄立行有一具美好的肉体，演技每部差不多,0
2,26602933,绑架者,此间有城,123572075,较差,2018-02-04,16:31:09,“陆然，你他妈的就是一个混蛋。”——我突然串场到了《失恋33天》的白百何的同名同姓的前男友了。,0
2,26602933,绑架者,明若凡,3427459,推荐,2017-05-13,22:35:03,老徐新作，警匪片，内地无间道，别具一格的创新。演员个个都出色，但是相互之间略微尴尬。杨乃文的《逃兵》好听,0
