page_index,movie_id,title,username,user_id,rating,date,time,comment,useful_count
0,26602933,绑架者,吴momo愁,33793455,较差,2017-03-31,20:52:33,国家应该立法禁止徐静蕾导演电影了。,985
0,26602933,绑架者,喂喂,sspp,还行,2017-03-26,23:50:06,看完老徐的《绑架者》我只想说：黄立行跑步太他妈帅了，看了这么多年电影电视，没见过一个跑步这么好看的，简直就是跑步标准姿势教科书，别问我为什么关注的点是这个。【捂脸】,463
0,26602933,绑架者,La Bambola,wentaoxie,很差,2017-03-31,23:21:44,"黄立行对徐静蕾说：宝贝，我身材怎么这么好，我都想操我自己了。
徐静蕾带着爱慕的眼神回答：我也这么觉得的！要不然我给你拍一部个人写真电影吧！你在里面要尽可能的多洗澡，这样才能展现你性感的身体。哦！对了，你这倒土不洋的普通话我每次听着都快高潮了！一定不能找人配音！
于是就有了这电影。",1407
0,26602933,绑架者,朝阳区陆依萍,50060410,较差,2017-03-27,15:08:19,黄立行好帅啊啊啊啊啊啊啊啊啊啊！！！！全程都在流水，想舔黄立行全身，直到休克住院！至于，脱离小妞电影的白婊何女士，演技也和唐嫣，杨幂什么的差不多，就不要标榜自己是大艺术家了....#真心羡慕徐静蕾，但电影真的很难看#,792
0,26602933,绑架者,大奇特(Grinch),grinch,还行,2017-03-26,22:13:43,老徐拍动作片是可以的，只可惜剧本打磨稍欠火候，反转也能预料到。冤家男女因共同目标捆绑在一起，寻找身份即寻找女儿，悬念就此牵引。黄立行的线要比白百何扎实许多，他是情节的驱动力，白百何则代表老徐的女性视角。手铐情节联想起《39级台阶》，惊险之余还时常插科打诨。,83
0,26602933,绑架者,minjie,minjielu,推荐,2017-03-31,18:25:25,黄立行身材真的很棒，中午看完的片子，现在脑海还能完整的回忆出全裸和半裸的清晰画面。中间那段镜头缓缓推向黑帮大佬佝偻的身影，我以为一回眸的会是潘长江老师~~,77
0,26602933,绑架者,桃桃林林,qijiuzhiyue,很差,2017-04-01,17:15:44,表演全员崩溃，连白百何都非常奇怪，明道更是像个灾难。剧本似乎是想做一些悬念出来，结果自己就先垮掉了。整部影片的风格都非常奇怪，台湾的、内地的各种混搭。徐静蕾的作品是一部不如一部了,413
0,26602933,绑架者,瓦力,cyrus_wong,很差,2017-03-28,16:34:40,太直白，反转都提前透掉，毫无惊喜悬念。男主用物件找记忆半天没进展推进极慢，莫名其妙动作戏倒不少，以致情绪也是断裂的，最后脑袋一撞记忆回来了，编剧真懒。白百何警官威风八面可每到关键时候准被抢枪，嫌犯黄立行屡屡抢枪得手，一到冲突戏就抢来抢去太傻了…看老徐的电影从来不会觉得她是才女。,396
0,26602933,绑架者,你虎哥,57460299,较差,2017-03-26,19:10:37,“偶连偶记几都不记得记几是谁偶怎么机道你拟额在哪拟！” 黄立行傻二狗一样的表情配上标准闽普和白大姐只会瞪眼睛抖下巴的尬演两股力量碰撞在一起竟然迸发出强烈的喜感！值得鼓励！好久没看喜剧了！,610
0,26602933,绑架者,唐小万,imecstasy,较差,2017-03-27,16:48:04,就不说各种剧情bug和架空的警务系统了，看到女警押着嫌犯到荒山野岭，居然有一个美美的英伦风红色电话亭等着他们……老徐还是比较适合拍爱情片吧。,555
0,26602933,绑架者,nocarsgo,dychou,较差,2017-03-28,17:24:56,白百何真是災難啊....,353
0,26602933,绑架者,南悠一,Allan.Vr,很差,2017-03-27,16:36:14,呵呵。又名《黄立行样男子の享用指南》,281
0,26602933,绑架者,支离疏,zntoborges,,2017-03-26,17:51:31,提前看片就不打分了。徐静蕾这么剧烈的转型完成度还不错，没有大bug，不是很吸引人但也能气息顺畅地看下去，最后明道的表演有些夸张了，剧情收得也不完美。一些细节做得不错，黄立行受伤后脸蹭到玻璃上还有汗水，这细节见心思。不是惊喜，也不是烂片。支持一下徐静蕾。,56
0,26602933,绑架者,空空的天空,48506740,还行,2017-04-04,16:31:26,白百合就是个枪套子，随身携带，但时刻为别人准备着。。。。,17
0,26602933,绑架者,次等水货,wudaoxing,还行,2017-04-01,02:43:58,用三个字给大家剧透下，无间道。,23
0,26602933,绑架者,Criminal001,59550305,较差,2017-03-31,00:07:05,白百合得马景涛真传…… 隔着荧幕闻到的尴尬,243
0,26602933,绑架者,名井南不南,151784886,较差,2017-03-31,00:04:26,老徐已经不是过去的老徐了，但是这个片子让我知道了他有多么爱黄立行，看起来就像是一个带着爱的个人宣传片,217
0,26602933,绑架者,安东,smokey,较差,2017-05-14,19:28:18,尽管傅明老人谆谆教诲，但多年之后，贾志新终于还是走上了犯罪的道路。,48
0,26602933,绑架者,齊克斯尼力佐飛,VinKhan,还行,2017-03-31,23:21:59,徐静蕾这个台湾媳妇手指拗出不拗入啊，不仅取景在台湾，连演员阵容除了白百合几乎都是湾湾的，但是后面又给他们重新配音，实在搞不懂。这个平庸到连槽点都不值得吐的剧本拍出来也是平庸到一塌糊涂，结尾居然还硬塞感情戏，可怕。,23
0,26602933,绑架者,白宗木尔,66650981,推荐,2017-04-01,12:14:22,1⃣️有黄立行啊2⃣️整个剧本双线并行拧麻花叙事还是很赞的除了后面有些散了3⃣️前半段很赞，两人为了各自目标绑在一条线上，情感脉络逐步推进比较好4⃣️明道陆然角色的戏份有些过了，目标动机太随便了些5⃣️真的把黄立行拍的man帅man帅的，宽肩细腰大长腿翘臀面面俱到呀6⃣,61
0,26602933,绑架者,W之芮,172395036,还行,2018-01-13,16:37:43,演员演技不错，制作用心，不足的是电影的剧情新颖度稍有欠缺，接下来会发生什么很多都能猜到，总体来看还OK,25
0,26602933,绑架者,小鬼Bono,51033208,较差,2017-03-27,00:24:28,中段开始收不住，结尾稀里糊涂“滑”到纯爱片上。只有黄立行一个人物不算很垮，白百何漏出柴火妞儿的一面时方觉这个角色捋顺了。其实吧，片子好多地方真挺逗儿的，比如镜头缓缓推向黑帮大佬佝偻的身影，一回眸给你眯缝小眼儿的梁天儿～,109
0,26602933,绑架者,喻鸣,mufanxuanji,较差,2017-03-30,21:11:38,女警员找被绑架的女儿，罪犯找丢失的记忆，可惜悬疑设定并未带来引人入胜的解谜效果，警察罪犯双层卧底缺乏有效铺垫，以致揭晓时只觉得生硬和索然无味，配以两个台湾腔的雷人台词更是觉得好笑。不过老徐确实在个人类型探索中走更远了，尤其是把老公拍那么酷帅。今晚活捉金主王思聪。,49
0,26602933,绑架者,请保持高冷,148179414,还行,2017-03-31,14:00:36,喜欢白百合，她的演技特别自然，这次的角色虽然跟以往很大不同但也hold住了,8
0,26602933,绑架者,柯里昂,pirealwei,较差,2017-03-29,12:08:48,很套路的犯罪片，故事勉强能看下去，虽然后面的反转属于意料之中，但是作为犯罪片，动作戏也太不走心了，全然像是为黄立行量身定做的solo片，脱吧脱吧不是罪。另外非常心疼白百合，全程游走于两个操着台湾腔的男人之间，演惯了小妞电影的她突然转型确实让人不太适应，起码外形上还是不够硬朗强悍。,52
0,26602933,绑架者,水心,shuixin7,还行,2017-04-03,22:51:03,黄立行很有得卖啊！,3
0,26602933,绑架者,清风,145999149,很差,2017-03-31,17:53:06,白百合只适合小妞 徐静蕾真爱黄立行,180
0,26602933,绑架者,托尼·王大拿,Zizou_Vam,很差,2017-03-31,20:25:21,尴尬，托尼·斯科特的尸体都拍不出这么腐烂的电影；另外，这套近未来架空美术设计也太敷衍了，拿旧版曼城队徽做警局标志，给没给授权费啊？,85
0,26602933,绑架者,华盛顿樱桃树,49213881,较差,2017-03-31,21:57:47,老徐是感人的呀，毫不吝惜男友的肉体，各种脱给广大观众欣赏。,24
0,26602933,绑架者,hzjfrog,68799111,较差,2017-03-30,21:51:53,混乱的视角使得无论是女主的内心折磨还是男主身份的神秘感都只算做了个样子，更把漏洞重重的情节和搞笑的台词暴露无遗。,32
0,26602933,绑架者,申由己,f021,较差,2017-03-31,23:31:21,台词对白，弱智到无力吐槽，黄立行靠出浴镜头，各种镜头特写为徐静蕾招揽人气，白百合简直就是女版马景涛，声嘶力竭好像磕了药，明道就是个布娃娃，内置有限台词，根据需要播放。斯柯达汽车助力《绑架者》，特写镜头不少。最后，我想说：TMD剧组穷到警察制服都不能弄套合身熨平的么？皱的不像话！,17
0,26602933,绑架者,谋杀游戏机,hexiaoqin,还行,2017-04-02,23:00:42,比想象中好，第一次觉得徐静蕾拍的片能看，动作戏都不错，悬疑和反转剧情有bug但基本能自圆其说，土法炼谍影重重，还算一部合格的国产商业片。但背景不知是有意架空还是设定混乱，环境被抹去地域特征，人物写繁体字，演员们一口浓郁的台湾腔，会让人出戏。老徐对男友是真爱，无死角拍他如何帅,3
0,26602933,绑架者,会笑的昨天,138576790,还行,2017-04-17,19:18:31,第一次觉得徐静蕾拍的片能看.,2
0,26602933,绑架者,𓆡𓆝𓆟𓆜𓆞𓆝𓆟,frances-6,较差,2017-03-31,23:22:41,（徐静蕾的电影也就看看画面和热闹，美景美男美女耍酷，基本没什么内容。）没诚意，敷衍塞责，就靠男友出卖色相了，明道为了姐姐这理由根本站不住脚哄小孩吧。最不喜欢白百何劲劲儿的、事事儿的、装得屌屌的谁都不放在眼里那股无法无天的嚣张范儿，顶讨厌。两星最多了，江郎“才”尽。10元都不值。,17
0,26602933,绑架者,SELVEN,SELVEN,较差,2017-03-31,23:40:24,48/100 看完“绑架者”后我心中回想起三大疑问：1，为什么犯人要杀死人质？那他干嘛还要劫持人质？难道他不知道杀死人质后筹码就没有了吗？2，为什么才女花钱给李淳甚至梁天配音，却不给一说话就严重出戏的黄立行配音？3，编剧对“谍影重重”是有什么误解吗？为什么借鉴的如此不走心？,16
0,26602933,绑架者,字母君,78164697,较差,2017-03-31,13:57:49,北京大妞黄小仙台湾寻女记。徐静蕾对黄立行真是真爱，整部电影除了他没人能帅过十秒，她也很明白观众真正想看的是什么，换着法子让他脱脱脱。李淳是来当吉祥物的，手枪是拿来互相抢着玩的，徐静蕾自己客串的时候不尴尬吗？故事后半部分跳跃得让人怀疑是不是还没剪完就赶鸭子上架拿出来上映了。,24
0,26602933,绑架者,哪吒男,nezhaboy,较差,2017-05-15,13:54:07,陆然，从前任到内鬼专坑白百何。,10
0,26602933,绑架者,shininglove,2849243,较差,2017-05-14,23:35:41,白雪因为小狼狗脏身，徐静蕾让老狼狗湿身，都是狼狗惹的祸，建议立法禁止狼狗裙带。,6
0,26602933,绑架者,旺仔 小馒头,zepwhen,推荐,2017-05-17,21:23:11,好一部“我是谁”的反转戏码啊~ 别说啊黄立行好适合演专业杀手！那几段跑酷帅的不行 不过也不能看太久 这张脸不禁看哎 白百合不管演啥我都觉得尬尴 大概是现在电影老喜欢后期植入配音 表情和声音太违和 演技就打折了 剧情还行吧 徐静蕾导演感觉想拍的文艺?李玖哲打酱油怎么回事?,0
0,26602933,绑架者,木头Lala,lalalin,较差,2017-03-29,22:56:55,老徐除了《一个陌生女人的来信》再无佳作。,48
0,26602933,绑架者,马路鹅,2814149,较差,2017-04-01,16:48:27,其实，这个故事存在的意义是？白百何又一次证明了自己根本没演技——灾难啊！！！,20
0,26602933,绑架者,私房歌,y328675858,较差,2017-03-31,14:04:42,反转来的太快，而且代入感和解释几乎都没，刷的一下失忆男就变警察。另外，人家梁天正经的北京人，你硬是要给来个台湾腔是几个意思？,24
0,26602933,绑架者,科林,Colin_Wang,还行,2017-03-28,00:11:16,勉强给个及格分，看一半猜到结尾（其实不是猜 是剧情直接抖出来的）……动机突兀牵强，就算关键镜头给了4秒多钟还是太硬，明道最后的表演也太过。谈几点好的：节奏把握不错，无尿点；白百何演得还行。,29
0,26602933,绑架者,伊昔,littlecbaby,还行,2017-03-31,18:36:45,"撞一下就失忆再撞一下就恢复记忆。
老徐对黄立行是真爱啊。
把黄立行的各种美好展现的淋漓尽致。
果然爱得越深就越知道对方什么时候最性感。
而且黄立行和女主没有任何肢体接触。
很有私心嘛。[偷笑]

黄立行奔跑姿势太好看。
就没有比他跑的更好看的男演员了。
而且又露翘臀。",11
0,26602933,绑架者,bird,yihuiw,较差,2017-04-01,01:32:48,看了许多电影之后，许多电影就不必看了。,26
0,26602933,绑架者,李小庫,leeshiuan,还行,2019-09-19,22:29:41,一改徐静蕾此前最擅长的爱情文艺小片风格 深度玩起了香港经典警匪片的路数 虽然学的有模有样 但不得不承认 徐导还是有些太放飞自我了 结果努力中呈现的却是力不从心 稍显凌乱的剪辑 不但打乱了故事流畅性 使演员原本到位的表演也被割裂 从而使一些情感点的铺排 戏剧冲突的发生 都缺乏足够力度和合理性,0
0,26602933,绑架者,Hachiko,andert,较差,2017-04-01,19:09:14,有一种剧本，每当剧情已经走不下去，回天乏力的时候，其中的一个主要角色就如“天降雄兵”一般，搏命般的推动着剧情【硬】着头皮往前走，这次担当重任的是白百合，至少有三次，莫名其妙的起到了如此般重要的作用。,8
0,26602933,绑架者,安贞里,140835094,很差,2017-03-31,11:39:52,女人看的三级片,53
0,26602933,绑架者,Die Katze,maynepaddy,还行,2019-09-20,15:38:41,合格的类型片。,0
0,26602933,绑架者,深夜声噎,sfroompp,还行,2017-04-02,15:38:02,原来是在台湾拍的呀，那就好很多，这次轮到大陆演员各种违和了，明道目瞪眼睁的好假，黄立行的国语被老徐调教得好奇怪啊，洗澡戏和老徐这个上头加一星，i want that kind of body too!,1
0,26602933,绑架者,豆瓣路人己,june.q,较差,2017-03-25,14:30:24,白百何视角出发，明显是女导演的做法。作为了大陆人，把城市，警察等所有设定架空，拍了一个内地片不像内地的，港片又不像港片的犯罪嫌疑片，全程奇怪，一开始还算及格，后面越来越尴尬。#白百何作为警察，全程被人抢枪，这可行？黄立行全裸后背很性感，但是李淳看起来更可口。,27
0,26602933,绑架者,一灯,day999818road,,2017-07-20,18:14:33,别看,0
0,26602933,绑架者,ヾ羫白の亾℡,37793571,推荐,2020-07-19,11:29:09,不难看啊。该有的都有,1
0,26602933,绑架者,m89,duzhouchi,较差,2017-03-31,17:54:29,“轩瑜市人民政府警察局”...我也是醉了。如果真是徐静蕾作品，那可就一夜回到解放前了。外景地是台北，人物是中国大陆，故事是香港二流警匪片+好莱坞三流动作片，剧作和制作上的滥味隔着屏幕扑面而来。而且第一次觉得白百何的演技这么捉急，还不如导演家属黄立行呢...,12
0,26602933,绑架者,树上的女爵,65844601,,2017-04-01,17:28:47,你偶尔也需要kill time，这种轻松猜出反转的电影，绝对是智障人生的一种鼓励。保持对白百何一贯的好感，但昔日男神明道沦落至此，愚蠢浮夸的演技，不管是深情还是狰狞的表情，都令我浑身不适。黄立行上给我生动一课: 人靠衣装，以及，脸蛋远没身材重要。醒悟到受虐居然是我的至深性幻想。,2
0,26602933,绑架者,FUA,122971558,较差,2017-04-02,17:57:12,真爱不是要把你捧在手心，而是要把你捧成华语动作明星,8
0,26602933,绑架者,小川叔,blueriver007,较差,2017-04-03,16:10:50,两星给黄立行的肉体，白百何的鼻子已经堪比阿凡达。开始的一句周丝儿，有种皇家警察的即视感，明道的马甲除了装逼就是定性的了本剧的小言主题，取景大部分在台湾吧？小卖店都是繁体字。,3
0,26602933,绑架者,大蒂茎蕾,45251073,很差,2017-03-31,21:55:26,求国产罪案片别他么反转了，脑子不够用你把逻辑撸直了拍还不行吗？,51
0,26602933,绑架者,RYZ,Ricky925,较差,2017-03-31,20:15:29,情节描写全面失控，演技配不上人设就是这么个结果。全片配乐都比演员台词声音大，难道是导演嫌弃台湾腔吗？照葫芦画瓢的《谍影重重》和《无间道》，结果只学了个皮毛。,11
0,26602933,绑架者,ka,ka420,很差,2017-04-03,23:53:32,一星跪求徐静蕾退出电影圈🙏,54
0,26602933,绑架者,荔枝超人,richer725,很差,2017-03-28,12:51:01,才女徐如果喜欢犯罪悬疑片自己在家看看碟就好了；喜欢男朋友的脸蛋和身材自己在家看个够就好了，真不必秀出来尴尬人。,15
0,26602933,绑架者,梦里诗书,57542378,较差,2017-03-31,08:34:19,没有一个合理的逻辑构思，只是用套路化的失忆绑架拼凑而成的《绑架者》，很难让人从那俗套的故事中感受到何般悬疑力度可言，而电影在动作戏上虽不可谓不多，但很多时候其实都并无从去调动观众的情绪，终只不过是成了男主黄立行一场耍帅的走秀。,22
0,26602933,绑架者,品客,inameless,较差,2017-05-26,11:59:36,风格制作大方向什么都对。但被徐静蕾拍出来后就什么都怪。怪异感的源头有两个：一，主角个人情感大于剧情，白百何的苦情戏基本占据了开篇人物塑造的一半，她丢了孩子关我屁事，我们要看她的反应动作啊！二，薄弱的阴谋反转放在喜剧片没问题，但在本片里就显得小儿科了，还不如直接拍个硬汉类电影呢。,2
0,26602933,绑架者,影毒肥佬,FK621,较差,2018-02-28,18:19:13,DVD 東抄西抄 5/10,1
0,26602933,绑架者,团小纸,skymoto,较差,2017-03-31,23:43:40,最近看多了美剧和港片想自个也拍一个顺便晒男友的作品，徐静蕾应该拍的是电视剧而不是电影。,4
0,26602933,绑架者,小天狼星,smart-ass,较差,2017-10-07,20:22:58,白百何的伤心看上去都不伤心 加上剧情鬼扯 故弄玄虚 呵呵呵呵呵呵 黄立行还是挺帅的呢,0
0,26602933,绑架者,米姐起飞,gucci122,还行,2017-04-07,18:59:15,比想象好欸。为黄立行身材和台湾街景点赞。但是白百何小姐的演技用力过猛实在是出戏～,0
0,26602933,绑架者,sabrina,4775119,较差,2017-04-03,23:20:42,明道是在演话剧吗？那做作的台词和表情真是尴尬满分。情节也特别零散，老徐不太适合拍这类需要一鼓作气的题材。这是要抄袭波恩的身份吗？全程只觉得黄立行的肉体还能看。,3
0,26602933,绑架者,小侠来了,rocchow,较差,2017-04-02,12:04:32,看到这么多人吐槽，我就放心了,3
0,26602933,绑架者,在你身体里冲刺,60648596,很差,2017-04-04,08:57:58,现在不知道导演圈怎么兴起的一种说法“导了烂片之后被骂不是我导的烂，而是我被人黑了”。尤其这话从一直就没导过什么能看的电影的徐静蕾嘴里说出来，就更可笑了。看完之后影院散场，一个厅出来的大爷指着嫌疑人X献身的海报说：“诶！咱看的是这部电影吗？这电影真好看。”,28
0,26602933,绑架者,Jay傑囝,44842743,很差,2017-04-01,08:59:15,看到白百合被骂到扑街就莫名开心 演技最被莫名高估的女演员,30
0,26602933,绑架者,汪金卫,longzheking,很差,2017-03-31,23:22:28,全片靠白百合的大喊大叫、黄立行的美式国语以及没完没了反反复复的闪回软趴趴地拖延支撑着。要不是几场动作戏还能看，真是要昏昏欲睡。细节无比敷衍，经不起推敲，反转莫名其妙。这片是不是徐静蕾为秀男友肌肉而拍的？还有，葛优能演黑帮老大，不代表梁天这种贼眉鼠眼的也能演啊！太出戏了！一星半,21
0,26602933,绑架者,1先森,lumins,很差,2017-03-31,21:12:50,很少能看到好电影需要具备的要素要什么没什么的作品了，为中国影迷在院线只能看到这样的电影感到悲哀。,13
0,26602933,绑架者,Panda的影音,PandaMovieMusic,较差,2017-05-16,22:56:57,⒈以前还蛮喜欢徐静蕾的，尤其是当我知道第一次看CCTV-6《魔法公主》的国语版她给珊配音，然而《杜拉拉升职记》算是分水岭，从那以后对她越来越路人了；⒉白百何这咆哮式的表演看得我都觉得有些尴尬；⒊比黄立行、明道让我比较惊喜的是李淳也参演了；⒋故事和动作设计挺差劲，但超预期的有点血腥暴力。,0
0,26602933,绑架者,X,Gothicsx,还行,2017-03-31,17:01:36,不错，黄立行帅,4
0,26602933,绑架者,ariel,1633981,很差,2017-03-31,13:06:40,其实我也是个警察，“你要记住你是个警察”，“因为我是个警察......”。警察一定是全片中出现第二多的词了。黄立行不说话时很酷，一说话就出戏，他才是绝对主角吧，主要戏份都是绕着他展开。好几场动作戏，特别是码头枪战，都挺凌厉的。可剧情实在是太弱了…有种过家家的儿戏感。,16
0,26602933,绑架者,张咏轩Wayne®,55617091,较差,2017-03-31,12:04:57,“无间道”式的卧底游戏，“我是谁”的记忆寻找，过时老套的警匪悬疑片，清一色台湾通告艺人混脸熟，黄立行的表演和台词功底是鸡勒，莫名其妙的打斗戏份，站不住脚的人物动机，整部电影在极其混沌的剧情和过度啰嗦的间奏下完结，真相失去了力量，质感水到不行，完全是导演私心送给黄立行的个人展示show,12
0,26602933,绑架者,starry night,45345251,很差,2017-04-02,20:13:38,一星给大量戏份被删的明道，黄立行和白百何的演技真的是被吃了吗？白百何的角色感觉超级奇怪，对白糟糕，全程尿点，完全没有逻辑，破烂的山顶上还TM有一个英式电话亭，我真是醉了,10
0,26602933,绑架者,谢谢你们的鱼,reave,很差,2017-03-31,22:29:34,无fuck可说,11
0,26602933,绑架者,обломов,glim,很差,2017-05-15,20:49:03,梁天出来的时候我突然开始脑补龙平了，然后一直没看进去,0
0,26602933,绑架者,Yome,yome,很差,2017-04-04,23:17:57,徐靜蕾和你的男友一起原地爆炸吧...,8
0,26602933,绑架者,摩诃曼珠沙华,cn_panda,较差,2017-04-11,09:39:15,徐导你这是要泡黄立行啊....,0
0,26602933,绑架者,莫愁,minhom,较差,2017-05-30,13:16:39,神TM搞错大魔王和男主角。失忆也是说失就失，记忆说回就回#谷阿莫,2
0,26602933,绑架者,浩子菌,Manhope888,较差,2017-05-16,18:56:29,没想到你是警察，好棒棒哦（音浪太强行走的荷尔蒙），脸瘫的孩子她妈女警官之买马景涛后现代主义表演，你们俩都好棒棒哦！（PS：没想到这么烂）,1
0,26602933,绑架者,huyouyou,huyouyou,还行,2017-05-23,19:06:05,黄立行是卧底，我倒是第一时间就猜出来了。但是，白百何如此不像一个警察，是我无法预料的。好在，动作打斗还行。#20170522,0
0,26602933,绑架者,常喜,50687127,较差,2017-04-04,09:17:18,台词还是不够生活化。,1
0,26602933,绑架者,GAKI,kingdajiangyou,较差,2017-03-31,21:43:41,说白百合演技有所提高的是捂着良心说的吗？李淳都比她演的好吧,12
0,26602933,绑架者,海山·野火,yiuta,较差,2017-05-26,14:10:07,看到才女新作每分每秒都写着“平庸”二字，真的好心痛。徐静蕾近几年的生活状态大家也略有所致，悠游自在，所以忍不住猜想，搞创作，不殚精竭虑是不行的吧,1
0,26602933,绑架者,木西,10241572,较差,2017-03-27,16:38:39,才女的评价要危险了,23
0,26602933,绑架者,厦门雷少,vincentjones,较差,2017-05-13,13:01:24,"简直一无是处：女主Hold不住这个题材；现在的台湾腔只让人觉得Low,它还来二个；故事不知所云；题材老旧不吸引；都市题材没有都市感觉，好歹来个配乐萨克斯啊",1
0,26602933,绑架者,Anastasia,an491033958,,2017-05-29,00:36:34,老徐专门为男朋友拍的,1
0,26602933,绑架者,pomelo,3741660,较差,2017-04-03,22:04:01,如此弱的剧本居然撑了90多分钟,2
0,26602933,绑架者,僵尸不美,meijiangshi,很差,2017-05-13,21:41:17,我看是白百合你自己太嚣张了，演什么都是白百合，太差了演技，真没见过这么差还这么拽的。徐静蕾是宇宙终极嚣张。想给半颗星。,1
0,26602933,绑架者,年逝,nianshixx,,2017-05-14,11:51:40,黄立行多丑啊。,2
0,26602933,绑架者,Michael JZ,49145944,较差,2021-07-03,14:25:00,和家人一起看的 好尬啊 逻辑 剪辑 表演都有问题 剧情的大走向都没问题 很90年代 2000年代好莱坞 很港 但是细节都好尬 说不好听就是拙劣模仿 ,0
0,26602933,绑架者,傻乐的猫,stupidcat7652,很差,2017-05-20,09:44:32,辣眼睛……,0
0,26602933,绑架者,小涛,happyelf,很差,2017-07-18,02:01:12,这拍得什么鬼呀，老徐彻底堕落了，这电影里有无数警匪片的痕迹和外壳，却里面似乎空洞无一组，只有白百何的制服和黄立行的身材。,1
