page_index,movie_id,title,username,user_id,rating,date,time,comment,useful_count
1,26602933,绑架者,冬日暖阳,3510245,较差,2017-05-14,22:40:53,竟然一本正经的来一个如此无聊的电影。所有的情节都老套极了，像20年前的搞笑港片，还偏偏要披着认真的外衣。品味太差,0
1,26602933,绑架者,woaini浮尘,woaini25257758,较差,2017-05-16,13:33:32,难看。。。。。。,0
1,26602933,绑架者,染尘,159296242,较差,2017-08-31,23:35:42,老徐拍给黄立行的,1
1,26602933,绑架者,慕詩,147190792,还行,2017-07-31,00:14:14,剧情毫无悬念不说，总体有点拼凑，冲白百合去的结果给我看男性果体做什么哦。,0
1,26602933,绑架者,杰欧大王,2657246,还行,2017-05-14,18:17:08,套路太多，但对于快销的商业片，三星吧，至少能看下去,1
1,26602933,绑架者,雪,160477482,较差,2017-07-16,14:23:51,帅哥还是帅的。,0
1,26602933,绑架者,利比亚悖论,49285015,很差,2017-08-13,17:06:02,老徐，还在练手吗？,1
1,26602933,绑架者,找自己,zhanmeichen,还行,2017-05-27,16:13:16,差点因为白百合没看，看完觉得还可以。只是后面反转的有些弱。,0
1,26602933,绑架者,musclekai,kevin918,较差,2019-07-09,16:54:32,黄立行真帅,0
1,26602933,绑架者,momotea_Summer,Su33er,还行,2017-05-30,14:06:10,剧情很令人捉急，明道会跳反在发现有内鬼的时候就猜到了，但是黄立行的洗白太强硬了，而且他的闽普实在太出戏。还是李淳在这里萌萌地很可爱。,0
1,26602933,绑架者,脆,angelikahh,还行,2017-04-03,10:11:09,“大家快来看，这是我男人，屌吧？”哇噻，好屌啊。,1
1,26602933,绑架者,xiaohui,xiao_hui,推荐,2017-07-02,22:00:15,看的挺爽的，拉一下分,0
1,26602933,绑架者,音乐影画,2721960,较差,2018-09-09,01:25:00,大boss一开始就能猜到七八分。。,0
1,26602933,绑架者,浅蓝深蓝,2727701,较差,2017-04-03,14:53:35,黄立行每一个细胞都散发着荷尔蒙,0
1,26602933,绑架者,Der Vorname,57235976,还行,2020-02-10,15:52:34,演员的选择是成功的，可惜的是电影有些烂尾。铺垫太过漫长，导致案件的侦破一笔带过，匆匆作结。,0
1,26602933,绑架者,小小菩提树,75310522,很差,2017-04-01,14:59:48,简直是灾难，站住，我是警察，我要开枪了。    和剧情一样，水的一比...  还有，别凑普通话不标准的台湾人了，听口音都烦。,2
1,26602933,绑架者,王脱盐,wtt0553,还行,2017-06-20,00:16:31,其实我觉得没有那么差，三星半有的，及格的商业片,0
1,26602933,绑架者,等地球爆炸,1493589,较差,2017-05-13,23:55:19,一点也不流畅，太多硬伤。但是片尾曲杨乃文的逃兵不错听 ：）,0
1,26602933,绑架者,逸蓝,xinxinniannian,较差,2017-07-16,18:01:41,平平……,0
1,26602933,绑架者,愿雨飞扬,93438147,很差,2018-03-01,20:31:51,演的好尴尬,0
1,26602933,绑架者,猫蹬鬼跳,65058790,力荐,2017-03-31,20:03:22,徐静蕾可以为了黄立行不要才女的名头，我当然也可以为了黄立行打五星！！黄立行真是太帅了！！,9
1,26602933,绑架者,莫空,allenyoung1205,较差,2017-04-26,02:26:19,一星给老徐一星给黄立行的身材,0
1,26602933,绑架者,start,44549599,较差,2017-07-13,22:40:03,怎么就莫名奇怪反转了....,0
1,26602933,绑架者,❤放下那包子,akijjq,较差,2017-05-18,09:02:50,掐脖子举起来好厉害！白百合的扮相蜜汁有徐静蕾的feel，可能是因为有打戏才不自己上吧。剧情不咋地，蜜汁口音也太多了,0
1,26602933,绑架者,騃子,61324870,较差,2017-03-31,20:55:11,白百合的演技支撑不了这部动作片，电影节奏拿捏不到位，但是黄立行好帅，作为一个男人都觉得帅,1
1,26602933,绑架者,AnnaOverloaded,jovie,较差,2017-04-01,00:07:36,真以为跑酷然后抄东西近身搏一搏搞失忆泛滥手持拼命晃再乱七八糟剪快剪碎就以为自己能变保罗绿草地么？演技台词情节都尴尬得只能笑抽抽，白白浪费黄先生大半场时间一直在卖肉的辛苦了。梁天儿出场全场最high点。,1
1,26602933,绑架者,Vera理想,Vera_Lee_0915,还行,2017-07-30,17:15:06,三星给小K…………,0
1,26602933,绑架者,最后的穴居人,klzj,较差,2017-05-14,21:38:13,我来吐槽一下这位“才女导演”，还是回去导文艺片吧。。这个外强中干的女警，除了不合时宜的粗口，枪被抢了多少次，还有娘炮+可悲的反派，最后觉得反派实在太pathetic……整个剧情比白百合还要平。唉，也就是黄立行凹造型还可以，所以美女导演还是去导偶像剧吧！,0
1,26602933,绑架者,飙雪璨阳,50667944,较差,2017-09-21,14:20:42,又一部风格混搭失败的电影，越往后推介就越能刚觉到编导的力不从心，偶遇梗、宾馆刺杀梗的重复运用都能明显感觉其黔驴技穷，直至草草收场，最终也没能把前面挖的坑一一填上。故事讲完了，故事的来由却成了永久的谜。白百合的表演糟糕得一塌糊涂，全程处于咆哮、鲁莽和运气中，可惜了黄立行的卖命演出。,0
1,26602933,绑架者,死的蚊,stevenliou,较差,2017-04-09,18:33:38,徐静蕾的导演功力，黄立行白百合的演技，都不足以驾驭这部电影。一个有潜力的故事，被生生拍成了一部索然无味的偶像剧。可惜。,0
1,26602933,绑架者,Algernon,43044929,很差,2017-07-19,20:14:38,新剧情－回忆闪回－新剧情－闪回－闪回－推理－结局－继续闪回－happy ending ,1
1,26602933,绑架者,栗子侠,49413948,很差,2017-03-31,10:45:58,徐静蕾真的很爱黄立行。,5
1,26602933,绑架者,局外人psy,59739922,还行,2017-05-14,19:01:02,徐静蕾心有余而力不足，哪哪都有欠缺。结尾黄立行身份的反转，真的是让人觉得突兀，有点硬转的意思。不巧妙，真的不巧妙。,0
1,26602933,绑架者,MonicaNoColor,72791717,较差,2017-08-20,23:26:54,黄立行很帅 最后反转来得很尬 而且之前就知道明道是反派黄立行好人了 就想看是怎么反转的 结果太尬 白百何演技尴尬 表情哭笑不得 角色也歇斯底里没有逻辑 反正总觉得不对劲,0
1,26602933,绑架者,zhln,80276904,还行,2017-07-25,20:26:02,老徐的第一部动作电影，应该捧场的。影片的题材老旧，是香港二十世纪初的题材，而且已经被拍烂了，现在怎么拍也没有那种感觉了。黄立行最后怎么就成了卧底了，影片中最大败笔，主角一定要是一个好人，一个完人。,0
1,26602933,绑架者,Nikitaa,zajm,还行,2017-04-04,12:58:22,漏洞百出，就是秀男友的戏,0
1,26602933,绑架者,MENG°,just_nomadic,还行,2017-05-12,23:18:43,给所有的打斗,0
1,26602933,绑架者,runnytone,33737020,推荐,2018-01-29,10:03:01,"白百何：前半段1分，后半段4分，结尾0分；
黄立行：身材演技4分；
明道：后半段惊喜4分。
结论：徐静蕾真爱黄立行。",1
1,26602933,绑架者,爱思考的鸭蛋黄,Celine_Young,还行,2017-05-22,11:23:59,失忆男子携手失踪女孩的警察麻麻勇斗歹徒，耶，惊不惊喜？意不意外？,0
1,26602933,绑架者,北欧以北,lisacat611,还行,2017-05-16,01:56:32,道明演技太次了吧,0
1,26602933,绑架者,nydzy,64879433,很差,2017-07-15,08:30:41,难看,0
1,26602933,绑架者,朱古力,zhuguli0613,较差,2017-04-03,17:39:15,除了动作，整个电影有点欺负我们没看过美剧。表演本身好尴尬以及设定的环境很乱来。意思都能明白就是尴尬。实在没得选择你不纠结合理性和意义的话，打戏是值的，不推荐。,0
1,26602933,绑架者,大师兄学长,1978347,还行,2017-05-22,22:43:40,故事很好，只是老徐导演商业片不会讲故事。,0
1,26602933,绑架者,段子宇,duanziyu,较差,2017-04-01,20:00:32,「2017.04.01」1.台湾腔太出戏了，全配音会好许多2.白百何不是不适合调查这个案子，她是不适合演这部电影3.明道黑化起来估计连他自己都不相信。4.如果没有黄立行，这片估计完了。,2
1,26602933,绑架者,方以因,shenfeiyan,很差,2017-05-13,10:29:56,一部强行警匪的电影。整个片子没有节奏，大段大段的铺垫没有意义，结局也没有感受到翻转。故事很薄弱，也许我能看成是 黄立行 的个人传记片？我也没get到颜值、演技。都喜欢拿失忆做文章，但没几个做得好的,0
1,26602933,绑架者,猫儿腻,maoerni,较差,2017-04-08,18:13:44,老徐的老公裸体记录,0
1,26602933,绑架者,TADA,156484465,较差,2017-09-10,18:55:31,黄立行:我很帅,0
1,26602933,绑架者,𝓉𝓊𝓌ℯ𝓇𝒾,tuweri,还行,2017-11-09,22:42:43,也不算有逻辑硬伤，只能说逻辑略简单。黄立行露臀还是蛮帅的。（评分：7.0，日期：20171109）,0
1,26602933,绑架者,StatisticalBot,be_rising,很差,2017-03-31,14:23:31,烂得瞠目结舌……看来导演的访谈水平和导演水平完全无关……开脱口秀吧导演，别拍电影了 #看电影没带kindle非常失策#,0
1,26602933,绑架者,画图渣刘某,94150665,较差,2022-01-03,13:34:06,看着贼出戏，紧张不起来,0
1,26602933,绑架者,月河,meme501,较差,2017-07-01,00:43:35,剧情极其智障混乱，白百何神烦黄立行贼帅。,1
1,26602933,绑架者,levitating,levitating,很差,2017-04-06,00:34:17,开篇还OK，后面一路扑街。悬疑完败，演技完败。,0
1,26602933,绑架者,抹茶抹茶,82544439,还行,2017-04-02,19:28:14,徐静蕾拍了一部电影来秀老公:),2
1,26602933,绑架者,Jafe,40932911,较差,2017-03-31,22:42:10,台湾班底+白百合的电影，为什么除了3个主演其他全部换成大陆国语配音，感觉好不搭！有几个手持近身镜头，营造了很好的紧迫感，但是太晃了！故事本身没有太多新意，还故意制造巧合时间点来增加气氛，结尾太突兀，悬念的解开太突然，结局更是太主旋律，实在无法满意！,0
1,26602933,绑架者,何睦,46734045,较差,2021-05-20,22:08:49,《谍影重重》+《无间道》+倒卖器官老梗。剧情顺畅，节奏畅快，反转眼前一亮，就是白百合的表演实在是不像警察也不像丢了孩子的母亲，像是大家都欠她钱一样。如果不是融了这么多剧情和梗，应该能更好一些些～。,0
1,26602933,绑架者,冰镇西瓜橘子水,65400706,很差,2017-03-31,20:01:55,这么无聊的剧本为什么要拍出来。。。,4
1,26602933,绑架者,Vicky,Vicky_Jiang,较差,2017-07-17,23:15:32,老徐花样秀恩爱的MV，通篇就在讲快来看我男人多帅，身材多好，啊，白百合你这么丑不怕他看上你，就演个女主角吧，哦还需要一个过气男演员衬托一样过气的男朋友，那就明道吧，演个坏人，镜头少一点，最后能删的镜头都删了，然后我可要化的美美的出镜。可惜了明道，过了偶像期就一直在努力，时运不佳。,0
1,26602933,绑架者,陆雪琪,145280606,很差,2017-03-31,13:05:10,剧情不流畅，感觉缺点什么,2
1,26602933,绑架者,游走的兔子,2366316,很差,2017-03-31,13:56:28,黄的口条太出戏，电影的反转像没反一样，打戏多的莫名其妙。就是一部展现肉体的写真片。主要特价票8块8，不然从不看徐导的电影。现在更确定了这个想法。,3
1,26602933,绑架者,鲷鱼烧,53619368,还行,2017-04-02,17:11:34,31号 第一部,1
1,26602933,绑架者,海盟洋溢,haiyangLi,还行,2017-06-12,16:28:16,给三分吧，剧情有时候显得太空洞了，经不起推敲，最后也没有交代清楚，难道点点从影片开始一直关在密封柜里一直到影片结尾还没被饿死？,1
1,26602933,绑架者,拾间集,46225547,很差,2017-07-16,17:27:37,全程不知其所云。。连一个连贯的桥段都没得,1
1,26602933,绑架者,皮卡丘与精灵球,145845632,很差,2017-10-06,23:20:27,要被热评笑死了😂一句话：票房和评分还算对得起这质量吧。,0
1,26602933,绑架者,车瑞茜,xiaozhuoya,较差,2017-05-18,10:56:05,"一部剧情不在线, 主演演技集体下线的烂片..",0
1,26602933,绑架者,雷斯特雷波,Aimwalker,较差,2017-06-22,00:34:51,白百合还是演傻白甜吧。。。这演技也太悲了,0
1,26602933,绑架者,暖暖,zhoujialin,较差,2017-05-14,01:18:48,一星给明道；一星给白百合,0
1,26602933,绑架者,豆瓣上的嗅嗅,67619742,较差,2017-04-02,16:28:29,白影后的人情片，就算要转型也找个靠谱的导演啊，起码水平得在二流吧。老徐是一流生活家，二流演员以及三流导演。好了，知道她很爱她男友并很大方分享。又看到安叔的儿子在打酱油，加油吧。台偶出身的演员经得起大银幕考验的也就那几个，但明道不在其中，有资质的问题也有资源的问题。不推荐。,0
1,26602933,绑架者,skaz,volantisff,较差,2017-05-16,12:59:47,全程尴尬,0
1,26602933,绑架者,fw郑景仁,189213308,较差,2021-01-19,22:26:06,黄立行加明道，简直太油了，白百何你也不容易,0
1,26602933,绑架者,小凯,mariahbfly,还行,2019-01-08,23:02:35,"最后的反转我不能接受，居然他妈的是卧底，在逗我吗？？？
好了，黄立行的屁股是可以加一星的。
希望徐静蕾能多让她老公出来卖肉，再接再厉，争取露鸟。",0
1,26602933,绑架者,发条.西.,orangesee,较差,2017-05-18,02:51:34,像这种干嘛都提不起劲的夏天，最适合看无脑荷尔蒙电影。,0
1,26602933,绑架者,罗生门,2504153,较差,2017-04-23,12:22:44,徐静蕾还是不要轻易尝试武打片的好。。,0
1,26602933,绑架者,奉誟劇場,ComeNPlay,还行,2017-10-26,13:22:18,徐静蕾进步明显 ,0
1,26602933,绑架者,地瓜的包包,56955441,还行,2017-06-24,15:40:38,其实只想给3星的，因为白百合多加一星，黄立行脸是真长阿，身材也是真好啊，戏份也是真多阿。明道的戏听说被删了，难怪最后反转那么突兀。,0
1,26602933,绑架者,听风,155623485,很差,2017-03-31,17:57:57,别看。。。,0
1,26602933,绑架者,ˊ梅賽德斯ˋ,81336001,还行,2017-05-30,17:22:18,黄立行出镜的第一秒我就知道他是个卧底，这是个俗套的故事,0
1,26602933,绑架者,锡罐头,tianchuan,还行,2019-01-03,23:21:58,倒也不像评分这么差，除了剧情反转存在漏洞外，徐静蕾第一次拍摄动作片有这个水准其实已经合格了。悬念设置具备可看性。,0
1,26602933,绑架者,Sparks,138609241,很差,2017-05-31,20:08:33,白百合第一次台词这么出戏，还有最后那个杨念变成警察卧底?这反转的太差强人意了。明道在这里的反派演得不错，如果可以把湾湾腔改掉的话，说不定刚来可以在内地混很好。,0
1,26602933,绑架者,奶奶徐,KAYXU,还行,2017-04-04,20:43:58,故事是可以的但是台词真的太让人出戏了，以前觉得白百合的演技也没这么差啊。,0
1,26602933,绑架者,Amy,advender,还行,2017-07-01,23:39:55,黄立行还是挺有型，就是剧情太小儿科了，明道怎么就变态了，牵强,0
1,26602933,绑架者,Penny!!Penny!!,47795407,很差,2017-05-17,00:42:48,集尴尬症之大成者。所有演员，所有，包括李淳，根本没有演技。剧本只有个外壳。视角模糊不清。,0
1,26602933,绑架者,翟天临,133414880,还行,2018-02-27,15:58:23,开头知结局系列，逻辑有点牵强，但不算烂片。对明道的印象还停留在天国的嫁衣？现在才见识到他的帅还有演技，特别是结尾痛苦接近变态的复杂感,0
1,26602933,绑架者,方悄悄,1783224,较差,2017-04-04,11:16:44,这个主要的问题是实在看不出白百合对她女儿有一点点关心了，完明道简直爆笑，我反正是笑场了,2
1,26602933,绑架者,tonya~,cornyu,还行,2017-04-12,06:45:31,老徐拍这类型片子算合格，前段剧情也不错。男朋友黄先生身手好又帅，白百何就没办法分庭抗礼了。懂拍片拍出男友的魅力并赚钱，老徐女友力max,1
1,26602933,绑架者,喵老师2333,York29,较差,2017-03-31,20:18:51,差一口气。很黄立行的电影。,0
1,26602933,绑架者,梁眼看电影,movie-liang,较差,2018-01-26,19:58:27,反转之后的部分差不多可以说是把整部电影前面辛辛苦苦营造出的好感给彻底毁了,0
1,26602933,绑架者,一定是那个球球,65948183,很差,2017-10-07,09:58:26,怎么看怎么乱，不完整，没什么逻辑，转来转去，悬念出来，也没有给人感觉惊喜，从头到尾没有什么期待，似乎也就很平静的结束了。没有什么着力点,0
1,26602933,绑架者,暴殄天物,3275817,较差,2017-07-24,09:31:30,镜头拍的太乱了！,1
1,26602933,绑架者,Kitty,45384993,,2017-04-03,23:48:27,只看了最后五分钟，因为把结束时间看成了开场时间……,1
1,26602933,绑架者,龙随云,longsuiyun,还行,2017-05-15,01:14:45,比起其他的国产电影来说，勉勉强强还是能3星的,0
1,26602933,绑架者,左子楚,zuozichu,很差,2017-05-20,22:17:51,对打动作和白百合的演技一样尴尬，能秀跑酷就不能找个动作指导。长发的黄立行太像黄渤了，男二号的偶像包袱好重，一星给露肉。,0
1,26602933,绑架者,丹莫罗的冷峰,3906030,较差,2017-04-02,18:45:46,全片充满了违和感…堕落的老徐成功加入了“导演爱老婆”俱乐部…,1
1,26602933,绑架者,披金戴银王大花,voilet6,较差,2017-05-14,20:56:55,我的天哪竟然是一部偶像言情片啊，瞎了我的眼,0
1,26602933,绑架者,视觉植物,trees0330,推荐,2017-04-03,18:58:24,可以的！黄立行的身材可以的！,1
1,26602933,绑架者,三太子,KQueen,,2017-05-28,17:41:35,每周一部烂片助睡眠,0
2,26602933,绑架者,马尔代夫,maerdaifu,很差,2017-12-26,11:10:00,大晚上的看完这电影之后，憋了一肚子的气想给个大大的差评，打开豆瓣之后，发现这破电影4.7的评分，我就很放心的去睡觉了，顺便还搜索了一下，原来这个全程谈不着演技，一脸上写满了我是二傻子的女人就是白百何，我去，这也能当演员，看来老徐也就那么回事了，挑的演员不靠谱。,0
2,26602933,绑架者,茸雀雀爱吃糖,163446182,还行,2017-12-18,15:58:23,2-3星吧，绑架者指的是黄立行啊，从开始的他去绑架白百何的女儿（假绑架），后来失忆找回绑架的记忆,0
2,26602933,绑架者,张小九,10351194,较差,2017-04-03,22:25:51,老徐真大方，专门拍一部电影和大家分享男票的美色，光冲这点我都不会吐槽，要啥自行车啊！,1
2,26602933,绑架者,low-sat phobia,55455640,较差,2017-04-02,21:09:05,演技是尴尬的……,1
2,26602933,绑架者,阿Sam,76692295,还行,2021-06-12,11:40:47,补标，黄立行有型哈哈哈,0
2,26602933,绑架者,三毛,echosanmao,较差,2017-10-09,18:47:11,为黄立行的屁股加一星,1
2,26602933,绑架者,张兮兮,53145042,较差,2017-05-27,22:10:53,谍影重重版亲爱的。没什么看点。剧本还不算极差。最后又无间道。白百合和黄立行和这部电影都格格不入,0
2,26602933,绑架者,儇舞天下,zoesun,还行,2017-08-05,21:10:49,我觉得徐静蕾故事讲的还行～,0
2,26602933,绑架者,ღClaire,lolita822,,2019-06-24,14:53:23,brief,0
2,26602933,绑架者,愤怒的瑞瑞酱,155674295,很差,2022-03-16,17:01:49,好看不了,0
2,26602933,绑架者,CHEVALIER..C!,36321216,较差,2017-07-31,04:24:53,白百何作为一个特警分分钟抓狂各种怼人真是烦死了,0
2,26602933,绑架者,SUNSAD.psd,SUNSAD,很差,2017-05-15,13:09:13,导演真的不知道自己拍得有多烂么……惊喜的是李玖哲居然客串诶,0
2,26602933,绑架者,抵达深眠,lightisme,较差,2017-05-15,15:52:27,明道黑化得好生硬靠边站！ 黄立行的身材！黄立行撒尿！黄立行好帅！黄立行跑步！黄立行动刀动枪！黄立行换装！黄立行洗澡！ 看完了好想fuck他怎么办！FUCK不到 好伤感！,0
2,26602933,绑架者,不要钱,58819021,很差,2017-07-26,01:20:50,一星半,0
2,26602933,绑架者,红藕香残玉簟秋,127437486,较差,2017-03-31,08:40:27,演员不错，但是徐静蕾当导演真的是一言难尽,5
2,26602933,绑架者,何小刀,hebangchun,还行,2017-04-01,00:04:57,稀里糊涂、逻辑混乱的剧本看得毫无头绪，但个人真的好喜欢白百合在里面的造型。,1
2,26602933,绑架者,我有个猫叫招宝,50890146,推荐,2017-03-31,21:33:49,四星，一颗给黄立行的脸，一颗给黄立行的腹肌，剩下两颗给黄立行的屁股，左边一颗右边一颗，不能再多了。,3
2,26602933,绑架者,Hawa,hawa1214,还行,2017-04-12,18:15:18,不理智给黄立行三星 ,0
2,26602933,绑架者,柳媚花娇,jc919,很差,2017-12-28,22:30:43,明道和白百合片尾飙演技，最终明道胜出,0
2,26602933,绑架者,momo,130451028,较差,2017-03-31,16:27:28,前面还好，后面就崩了。花絮里明道挺拼的，好歹看他剧长大，两星吧,2
2,26602933,绑架者,萨丽,sa_li,较差,2017-05-16,21:30:59,看不下去，看得出明道是个很用心的演员,0
2,26602933,绑架者,夏染,49983396,较差,2017-04-01,21:37:26,看完只有三个感觉：徐静蕾hold不住犯罪片，整个剧情是逻辑崩坏的；徐静蕾对黄立行是真爱，黄立行的打斗戏很帅气；白百合，或许更适合小妞电影。,1
2,26602933,绑架者,钝刀,135843569,还行,2017-08-05,13:55:07,徐静蕾的心思都花在男朋友的穿着上了,0
2,26602933,绑架者,欢小欢,2758443,较差,2017-03-31,22:43:50,两星给黄立行的翘臀（哎今晚也是睡不着了歪,1
2,26602933,绑架者,mvlege,69856173,较差,2017-07-20,20:03:52,镜头不流畅，有时又晃得人眼花。最后楼顶戏太浮夸。,0
2,26602933,绑架者,叶杉,2224375,还行,2017-03-31,21:35:56,几个场景和摄影技术做得不错，有个梗不得不说，一个男人小便时朝进来的人笑了一下，这太匪夷所思的了吧。,1
2,26602933,绑架者,多宝,ruandaji,很差,2017-05-15,10:00:14,简陋的演技，简陋的场景，简陋的镜头语言，全片的高潮加起来都没有明道在天天向上和钱枫掰手腕子的几秒钟精彩。,0
2,26602933,绑架者,云雀宝宝,55714302,较差,2017-05-13,20:12:52,明道这个人真是一个奇人，我见过没有明星命强行当明星的，明道算头一号,0
2,26602933,绑架者,窦。,31645646,还行,2017-03-31,18:51:29,徐真的信不过,0
2,26602933,绑架者,一光年,kuangk,很差,2017-06-23,16:23:03,看不下去呢。白百何每次演警察都好难看。。对徐静蕾这次很失望，很喜欢她以前导的电影的阿……,0
2,26602933,绑架者,Ryeland,ryeland,很差,2017-07-21,18:20:48,该说什么好……,0
2,26602933,绑架者,Nefelibata,147635242,很差,2019-07-16,13:13:25,徐静蕾为了满足自己看爱人耍帅的愿望,1
2,26602933,绑架者,这世道,7798390,还行,2017-06-12,13:51:37,既然黄立行是警察，他为啥要绑架女孩！黄立行跟老徐在一起普通话好了很多呢！,0
2,26602933,绑架者,毒手,haywire,很差,2017-05-13,16:22:35,蠢到让人乐不可支呀。,0
2,26602933,绑架者,月夜枫,49835483,很差,2017-04-03,21:22:56,徐静蕾真不行,1
2,26602933,绑架者,朝涯,liyue86,很差,2017-04-04,11:56:16,徐静蕾就没拍过好看的电影，做电影要有起承转合，没铺垫，没思路怎么会好，学学古人作诗有四法：起要平直，承要舂容，转要变化，合要渊水。,1
2,26602933,绑架者,原草,139680069,还行,2017-03-31,20:35:20,此片唯一可观之处是黄立行洗澡、打架和裸奔……,2
2,26602933,绑架者,春垓,horadric,很差,2017-05-15,15:32:14,额，不懂为啥要做不擅长的还不好好准备,0
2,26602933,绑架者,所有团的团长,42927631,很差,2017-05-19,19:32:10,表演出戏，剧情跳脱，让人看完的欲望都没有。,0
2,26602933,绑架者,阿瞒冲起来,caocaoa,很差,2017-07-15,19:02:40,可以骂人吗？傻逼！！！！话说女警察的枪很好抢啊,0
2,26602933,绑架者,酒随意,150092021,较差,2017-06-09,16:35:38,给两颗星足矣！,0
2,26602933,绑架者,茶博士,27518977,很差,2019-06-02,22:03:25,徐静蕾不宜当电影导演。,1
2,26602933,绑架者,淡了你就加点盐,willmeal,还行,2017-10-02,13:43:18,比想象的好,0
2,26602933,绑架者,也离,flowermoon,还行,2017-05-24,17:57:44,1.黄立行的身材让他从二分飞跃到八分（光看外形 不知道性格几分）2.白百合这脸好容易显老 小女孩一看就不是亲生的 3.明道了解后一直觉得萌萌哒 但戏份好少 4.电影很多莫名其妙的地方…很多人已经吐槽过了…但难看程度不是超级高 另外 演技不行…很勉强的凑合…,0
2,26602933,绑架者,青九九,48087510,还行,2017-04-01,23:05:57,加上了明道才三星。。。这个片子 真的 不怎么好看,1
2,26602933,绑架者,slipknot,42857942,推荐,2017-04-08,21:31:38,如果把背景放到香港可能会好一些吧！架空的。徐导不走言情走悬疑了。,0
2,26602933,绑架者,Aaron,yangziqiang,力荐,2017-04-01,12:07:21,片子好，演技好，还求啥？,1
2,26602933,绑架者,童熙,tongxi7,还行,2017-07-18,13:33:42,还可以没有那么烂 拍文艺片的又玩警匪动作片 觉得整部电影就是徐老师觉得黄同学身材太好 不拍动作片露一露白瞎了 拍着玩吧 人家也是活明白了,0
2,26602933,绑架者,超越边界,rainycats,还行,2017-05-17,02:05:06,除了黄立行没一个演的好的，特别白百合演的好烂，还有那个长官。,0
2,26602933,绑架者,NigelCrane,nigelcrane,较差,2017-03-31,20:32:30,上天给了你一个正点的男朋友之后或许还会给你一些才华把男朋友拍得超正点，但再多一点都不会给了；看到男神成功圈到老徐这个头号粉丝我只有热泪盈眶,0
