page_index,movie_id,title,username,user_id,rating,date,time,comment,useful_count
1,26840300,食人岛,Bonnie,154619462,很差,2016-12-04,10:49:16,真是一部好电影，不用看就知道,0
1,26840300,食人岛,Fantasyy,161406420,很差,2017-07-19,14:04:55,垃圾……当喜剧看,0
1,26840300,食人岛,callous,128111921,很差,2016-12-13,15:03:59,我能一颗星都不给吗！我真是日了狗了！！！！！,0
1,26840300,食人岛,郭顺DB,160565234,很差,2017-05-06,17:14:59,不要看我这一星，我是奔着负分滚粗来评价的！可惜没有负分！烂透了！,0
1,26840300,食人岛,春三十爷,82814422,很差,2016-12-29,22:15:33,不用看给一星,1
1,26840300,食人岛,Andy,154557676,还行,2016-12-02,20:56:04,还好，一般啊,0
1,26840300,食人岛,夏磊同学🚗💨💨💨,154581660,,2016-12-03,13:15:04,别人给得票，我做了好久思想斗争才去，去了其实也就是证实一下我最初的想法，无论导演，演员，编剧，都是电影界的耻辱。,2
1,26840300,食人岛,胡江6169461405,161887422,很差,2017-05-28,19:27:53,对国产恐怖片结局来说，本就没有任何悬念，不是精神病做梦，就是意淫，就拿这部食人岛来说，早就猜到结局肯定又是国产惯用套路，我特么还看完了，演员烂，导演烂，评分不用说了。,0
1,26840300,食人岛,☆か浅笑、薰衣草,158115498,较差,2017-02-21,17:25:03,一般般，结局没看懂,0
1,26840300,食人岛,无名先生,154986687,,2016-12-13,14:26:31,想看免费,0
1,26840300,食人岛,香蕉你个不拿拿,214519102,力荐,2021-12-28,16:44:36,在老姨家看的，刚开始挺可怕的，最后好像就一个女主活下来了，大结局好像信息还在往下传，还会陆续接到短信会上岛上，这应该是告诉我们，短信千万不要全部相信,0
1,26840300,食人岛,SUOLON,160026632,较差,2017-05-02,13:44:31,我是不是看了假的恐怖片，不想吐槽。,0
1,26840300,食人岛,Choi..,174687042,很差,2018-05-03,17:22:26,b站刘哔观光团，心疼杜旭东老师，一句话剧演员去拍这种垃圾片,0
1,26840300,食人岛,风止,149346396,很差,2017-09-07,19:04:08,不好看。恐怖元素是有的；剧情不太合理。,0
1,26840300,食人岛,安之,241778330,推荐,2021-07-12,00:12:54,之前跟朋友们一起看的，内容没太大印象了,0
1,26840300,食人岛,桃然,171616363,很差,2018-01-26,19:32:39,看面相这个叫杨凯迪的女主肯定欲望特强,0
1,26840300,食人岛,书浧.,242878895,很差,2021-08-13,02:50:31,抽了几本烟都想不通为什么不能给0🌟,0
1,26840300,食人岛,y7k,216068098,很差,2020-05-10,00:39:50,真烂真假啊，原来真有烂到笑的...,0
1,26840300,食人岛,ゞ天舞う薯片,207097666,还行,2019-11-24,13:02:14,恐怖元素较多,0
1,26840300,食人岛,东西鱼,195088434,很差,2019-08-29,09:45:54,太烂了,0
1,26840300,食人岛,xswl,219364119,很差,2021-02-16,10:01:32,看过最无语的一部电影了，特效假，不恐怖，就怪离谱的。,0
1,26840300,食人岛,我是你爸爸,182870993,很差,2018-08-13,12:30:32,一般般？马虎象！比前两部电影“白云桥和怨灵地下室”好看多了！比电影“恐怖笔记”好看一点！不过比电影“诡咒”差一点！,0
1,26840300,食人岛,李雅婷,183960267,很差,2018-09-07,15:35:06,不想承认看过这部影片,0
1,26840300,食人岛,楚慈.,180759991,很差,2018-07-07,19:26:42,日墙…,0
1,26840300,食人岛,瞒.,zyling060324,推荐,2022-08-05,09:05:07,《食人岛》当时是小学看的有点久远了哈哈哈哈。当时和几个女同学害怕的不行，但是现在看去，这部电影也没那么恐怖，主要的是有点不真实，但是整体还是跌宕起伏的。,0
1,26840300,食人岛,datedz,188215511,较差,2018-12-05,23:26:07,快进着看完，居然看完了。给个两星吧没，居然不是精神病或者幻觉。不明白那个岛上的猥琐男是什么人设，没动机的完成着导演要求的剧情。,0
1,26840300,食人岛,王顺,155543040,很差,2018-02-11,21:46:37,我能说脏话吗？,0
1,26840300,食人岛,正华,196381612,较差,2019-05-12,20:03:55,特效和剧情实在不敢恭维。。。,0
1,26840300,食人岛,So丶Much💕,206925841,很差,2019-12-22,21:24:03,三观全毁，人都不好了，重要的是我看完了。崩溃，一个星期没缓过来,0
1,26840300,食人岛,豆友215602995,215602995,,2020-04-24,06:57:08,还可以 感觉不是很恐怖 也就一般般吧,0
1,26840300,食人岛,阿翊,220948832,很差,2023-01-25,00:27:26,一星是我给你留的最后尊严，收着吧。拍得挺好以后别拍了,0
1,26840300,食人岛,nkh个性,168981220,很差,2017-10-31,17:40:54,就只有封面好看，剧情太无聊,0
1,26840300,食人岛,Lei Lei,236590622,很差,2021-04-19,19:48:52,难看这个电影一点都不好看。,0
1,26840300,食人岛,摸头杀,103166658,很差,2018-03-29,23:52:17,及其胆小的我，觉得这个特别不好看,0
1,26840300,食人岛,ฅʕ·ᴥ·ʔฅ,clover8888,很差,2020-12-22,21:10:16,2020-02-13（爱奇艺）,0
1,26840300,食人岛,宅仔,184956753,很差,2019-01-23,15:54:19,其实吧  我没想到 这么烂  对不起 我不应该吃shi,0
1,26840300,食人岛,END,acdlokmks,很差,2022-08-07,19:25:37,求一双没看过的眼睛,0
1,26840300,食人岛,野有蔓草,183988220,很差,2019-02-14,10:59:10,和爸爸吃完午饭闲着没事打开电影频道 然后就浪费了生命中的一个多小时,0
1,26840300,食人岛,憨憨网友张九月,185654743,很差,2019-02-12,20:50:03,我可能是看了假的恐怖片。。。。。,0
1,26840300,食人岛,文刂士心甬力.12,168483192,很差,2017-10-21,12:37:32,一星都给多了,0
1,26840300,食人岛,🍯.,235650765,较差,2021-04-11,17:55:17,不好看,0
1,26840300,食人岛,超级小桀,218350435,很差,2020-06-20,17:51:13,醉了醉了醉了…………,0
1,26840300,食人岛,今晚要早睡,swyifan333,很差,2021-08-05,01:09:37,那些年看过的烂片之一。,0
1,26840300,食人岛,RAY,266642809,很差,2023-01-22,21:47:00,你的剧情先好弄好先😍,0
