page_index,movie_id,title,username,user_id,rating,date,time,comment,useful_count
1,26820836,八月,旧书君,pengyuan,推荐,2017-04-21,10:00:09,被迫改制的国企工人、床上奄奄一息的老人、为孩子进重点中学四处求助的母亲、如偶像般崇拜却入狱的混混、南北方甚至毫无差别的夏天。真实又直白的缅怀、令人眩晕。,0
1,26820836,八月,坍塌,miaohengla,推荐,2017-08-25,22:16:50,The Summer Is Gone.（看了几张剧照，感觉做成彩色或许是个不错的选择。）,1
1,26820836,八月,阿树崽最摇摆,Swangshu,还行,2017-04-07,03:56:29,说不上来，看的时候就觉得有点乏味和刻板。那时候还不知道这片子后来会得奖，也没有拉高期待值。现在，更是了。印象里全是细节，又什么可爱都没留下。,1
1,26820836,八月,寡狗,143049789,还行,2022-08-31,20:05:21,八月最后一天，看《八月》故事性不强，张小雷百无聊赖的夏天，青春懵懂，脖里挂根双节棍，大院大厂到处溜达，游走在众多大人中间，游泳证上呼和浩特的戳，电视里宣传着国企改制，一瞬间被打破的铁饭碗，导致的社会矛盾激增，游手好闲的青年，打着路边的台球，寻着衅滋着事，电影院里放着陈强父子的《爷俩开歌厅》，门上贴着崔健的《一无所有》，到处一片90年代特有的痕迹和景象，黑白的画面很多的构图都美极了，甚至有段致敬《天堂电影院》。,0
1,26820836,八月,文白,46815070,还行,2017-03-24,13:09:30,2.5，浓浓的怀旧情绪，但无论是时代还是迷影都点到为止浮于表面，更像是一次个人化的回忆吧……,1
1,26820836,八月,忘,catslut,还行,2017-03-27,12:42:08,小时候总以为自己是旁观者，从盛夏暴雨里穿身打马而过，并不牵动一丝一毫喜怒哀乐。没有察觉，那段童年末日，自己失去了最后的安宁，即将开始漫长的漂泊,2
1,26820836,八月,林摸鱼,kakaitachi,推荐,2017-04-27,12:16:15,昨天转的一个广播拿来形容挺合适的：日语里“夏天结束了”这句话，绝对不能用字面意思理解，里面包含了多少不可言说的含义，那是一夜长大的意思，那是恋爱无疾而终的预兆，那是青春消失殆尽的季节，那是从梦想跌入到现实的分界点，那是失去童真变成大人的夜晚，也是人生从充满期待的未知陷落到无可改变,5
1,26820836,八月,vesperos,MaoGuGuQiu,较差,2017-03-25,12:13:43,只是一些片段式回忆，谈不上是电影情节。这种first影展系抒情片真是要看吐了。,1
1,26820836,八月,齊克斯尼力佐飛,VinKhan,还行,2017-06-19,14:17:02,小孩演得很好咩？恕我看不懂。,0
1,26820836,八月,matchbox,matchbox,推荐,2017-03-26,16:12:19,细腻又琐碎,0
1,26820836,八月,特写蒙汗药,ecnumeng,推荐,2017-03-29,12:13:36,其实是给三星的 同天又看了金刚 金刚给三星 那这部八月需要多加一星鼓励 现在大陆影片评分很难给啊 八月这样的情怀怀旧处男作 诞生了又一位贾科长那样的DJ 最感动是片中片里那部他爹哭得稀里哗啦的吕丽萍的遭遇激情,1
1,26820836,八月,Kubrick2001,68061879,还行,2017-03-29,00:34:20,好好在不堆砌符号的平实 这是普通人体验里的九十年代 没有后来者评价的风云诡谲每个家庭只是在过自己的日子 坏在黑白没必要和生活流的毫无冲突 看上去像家庭录影带缺乏是枝裕和点连成线的感性,1
1,26820836,八月,流光,4160960,力荐,2017-03-27,20:28:56,完全被击中！是我见过对那个时候最抓住了细节和气韵的还原。那样真实又那样蕴藉，在影院大梦一场不忍醒。,1
1,26820836,八月,山上风下,nieblalan,,2017-03-26,14:05:09,浮生若梦，在黑白光影里我和小雷一起睡着。,0
1,26820836,八月,年逝,nianshixx,还行,2017-03-25,12:10:37,全程尴尬。影片很努力的用了很多符号来竭力营造年代感。物件和大环境都不错，可惜几乎每个演员都是一副当代人在“演”的尴尬感。如果把剧照都单拎出来做个摄影展倒是会很有时代感，人物都比较空洞。雷妈身上一点点的家庭妇女气都没有，分明就是一个当代文艺女青年。很多情节细想都不合逻辑。,0
1,26820836,八月,AlanX,itsalan,还行,2021-07-31,23:14:09,90年代社会变革背景下的家庭故事。从镜头语言到剧情叙述，还是有些僵硬和不自然，扁平化的叙述角度从一个孩子的视角出发，流水式地记录这个静中有变的夏天，所收获的感触只是一些怀旧和致敬而已。,0
1,26820836,八月,Don't Panic!,fastkill,推荐,2017-05-18,22:43:22,没有看出拍成黑白片的必要。怀旧和回望社会动荡的忧伤。整体还算细腻，但演员表演很有些问题。小孩的一些言行不大像小孩。剧情松散，所以人物塑造应该特别重要----可是人物并没有完全立起来。结尾一定是模仿阿巴斯吧。,0
1,26820836,八月,мая,25911106,推荐,2017-12-02,12:50:45,7.5，半自传性质，献给国营制片厂的电影挽歌，算是德格娜《告别》的姊妹篇，相比之下告别的情感更丰沛一些，而《八月》的时代记忆和编导手法更纯熟一些（声音设计真的棒），个人更喜欢告别，不过确实有很多侯孝贤和杨德昌的影子，这批内蒙古影人值得期待,0
1,26820836,八月,十一伏特,stlark,还行,2020-12-13,16:10:46,对九十年代华北城市的生活状态拿捏很准确，可总不能全片都是状态，没有情节冲突。用黑白片拍，还有一些迷影情节，可片中电影院放映的电影原本是彩色的，九十年的电视机和照片也都是彩色化了，拍成黑白的反而显得不合时宜。另外，前期有些段落的感觉不是从黑白摄影出发，是彩色转黑白的，偶尔会出现亮部过曝，室内夜景的光线也没有特别布置，到后半的光影运用稍微好一些。,0
1,26820836,八月,老饿狼,2310397,力荐,2018-12-21,16:34:29,少有的记录那段历史的动人之作。,1
1,26820836,八月,烈焰红唇龙,lovehans,推荐,2017-07-20,16:47:17,夏天的记忆，国企单位，迷影，还有懵懂的童年往事。 几场梦境特别有意思。,0
1,26820836,八月,小枫,fadefeng,较差,2021-08-10,07:04:32,几年前看过一半，当时觉得镜头设计不错，结果现在一看完全不是那么回事。几乎是导演个人自传体电影，拍出来居然还这么悬浮。内容倒是凑活，主要是拍的感觉不对，黑白的设定更像是对做旧效果不足的一种掩盖。即便如此依然没能拍出那个年代的感觉，看起来像是个架空世界的故事，结合如此特定时代的剧情，几乎无法入戏。,0
1,26820836,八月,III🌙,catherine33er,较差,2017-03-26,16:17:24,幸好没装逼去参加导演交流会什么的，和看<黑处有什么>同等厌恶的感觉。刻意的年代符号，和<城南旧事>一样想用小孩儿的视角去表现大环境，然而功力不够就变成流水账了。没有任何代入感，宣传也别打什么亲情牌说献给带上父辈一起，我爸百分之一万看不下去，而且片里明显妈妈对孩子更用心识大体吧？,1
1,26820836,八月,厦门雷少,vincentjones,还行,2017-04-26,07:03:26,我看的不仔细，觉得很无趣啊。小孩的视角电影出来过很多次，以前还有一个讲亚运会的。,0
1,26820836,八月,叽里呱啦,CainChan,还行,2020-06-08,16:41:16,补标：这是看了就会忘的一个夏天,0
1,26820836,八月,hedgehog,hedgehog,力荐,2017-04-02,12:00:17,不温不火，徐徐道来，日常生活，平淡真诚。献给一切都是“一无所有”的童年时光,1
1,26820836,八月,二 天,summerleft,推荐,2017-03-27,19:29:35,最丧的是怕吵到前面的观众没哭够 回家路上碰上无数和张小雷一样大的放学少年,1
1,26820836,八月,Aretha,Frisbee,推荐,2020-11-18,22:50:51,电影如果是记忆，它必定是记忆这片大海被阳光普照下的波光粼粼，是尘土飞扬中的诗，也是淅淅沥沥雨中的伞，我借着它看到曾经人性的过往……说实在的被打动了,0
1,26820836,八月,花儿果果,iorl,还行,2017-03-24,16:29:18,“我曾经以为日子是过不完的，未来是完全不一样的。现在我就呆在我自己的未来，我没有发现自己有什么真正的变化，我的梦想还是像小时候，唯一不同的是，我已经不打算实现它了。”——王朔,1
1,26820836,八月,豆友49124084,wh0404wh,推荐,2017-03-24,16:29:59,感觉同类型片再怎样拍也超不过杨德昌的牯岭街了。。,1
1,26820836,八月,zhln,80276904,推荐,2019-01-25,21:57:54,影片全程黑白，很有代入感，一下子就到了那个年代。然后就一直想找到人物的原形，这人物有原形吗？,1
1,26820836,八月,豆友104310668,scripting,推荐,2017-06-06,14:22:07,很平静的生活流的电影,0
1,26820836,八月,失控的蘑菇,earthquakes,还行,2017-03-25,21:48:50,对一个桥段有共鸣是晓雷在玻璃窗户外面瞎挥手做鬼脸，跟吃了兴奋剂似的，我小时候最爱这么干，尤其是屋里大人都特别着急特别严肃的时候。另外觉得这个电影名字可以翻译成《Prodigal Summer》,1
1,26820836,八月,多不利登,toprak,很差,2018-05-20,13:51:37,2018052 一星平庸,0
1,26820836,八月,大黑骡子,daheiluozi,还行,2017-03-25,16:24:33,被时代洪流裹挟的家庭，没什么青春感。国企改制工人下岗，在我心里，此主题已被前阵子看的双雪涛霸占了。迷影精神奖，这次可能重点落在了迷影上吧,0
1,26820836,八月,忘我洗澡,runqueen,推荐,2016-11-06,21:52:46,《八月》。坐在放映机旁，一直被它不停散发的热力烘烤着。片子还行，但是感觉怀旧的东西有点太多，缺乏节制。不过摄影好喜欢。最后，导演的裤子非常紧，总感觉长期穿这种裤子要不孕不育。,1
1,26820836,八月,开飞机的舒马赫,146618111,力荐,2021-04-14,15:42:22,"家里的氧气瓶，是太姥姥最后的希望；
街边的桌球摊，是小混混厮混的江湖；
破败的电影院，大片开始收费了，那是亡命天涯，熟面孔都不能免票入场；
静谧的大院里，国企开始改革了，那是新的征途，老员工都要靠能力吃饭
那是属于我的无忧无虑的夏天，大人们在为我的重点初中忙碌，而我却只惦记三中的校服好帅。慵懒的午后，拉小提琴的小姐姐，古惑仔的三哥一遍遍出现在我的梦里。
这是一部导演的私人影像，就像那八月的昙花，带着遗憾和忧伤，远远逝去；
这又是一部属于80后的集体记忆，夏日午后的蝉鸣鸟叫，挥手告别的亲人模样，平淡悠长。
或许黑白影像加上缓慢的节奏，太过清淡沉闷，但是随着岁月的流逝，那些童年的记忆不就是这样静静地出现在我们的梦中嘛",1
1,26820836,八月,RiverCheung,river_cheung,推荐,2017-03-27,21:09:54,非常怀旧的电影，十分具有时代气息和生活气息，细节之处见真实，歌曲引发时代的回忆。但真的是略散漫，总觉得各方面都还差点火候。7.8,1
1,26820836,八月,绯色_神仙,77869650,力荐,2017-07-16,22:03:04,喜欢，和我的口味。,0
1,26820836,八月,正在,augusttt,推荐,2017-03-25,20:10:16,特别是到姥姥家拍大合照那会儿之前，国企改制版《一一》。这么说肯定不好，但是金马奖给了这部年轻导演的处女作，应该是对他试图承袭台湾新电影的价值观和试听特色的肯定。有模有样，从隔壁房间拍，从远光灯反面拍，从门缝拍；有死亡但不拍出死亡，有大悲痛却着重于细节处，就是侯和杨呀。,0
1,26820836,八月,西决,c541223724,推荐,2017-04-25,02:36:35,喜欢，近年来表达厂矿子弟回忆童年与父辈往事最好的一部，黑白色调淡化了夏天的浮躁，情节简单而从容不迫的印证了时代的烙印，迷影情节和背景声效特别棒。,0
1,26820836,八月,Otocolobus,clementinetsu,推荐,2017-03-27,16:05:09,挺喜欢的。同样是讲国企改革，比少年巴比伦强得多。看到昙花那里想到了“爸爸的花儿落了，我已不再是小孩子”。看了太多点评反而不知道说什么了，就这样吧。（看的时候楼下似乎是个5D体验厅，可能在放金刚骷髅岛，搞得跟地震了似的,0
1,26820836,八月,Dr.夕阳,yhwov,还行,2017-03-25,23:17:48,堆砌的太过了，情绪就很难出来,1
1,26820836,八月,後進青年王舒克,hyperconscious,力荐,2017-03-25,00:20:56,很写实很诗意,1
1,26820836,八月,与碟私奔,1305791,推荐,2017-04-23,22:57:06,金马奖电影，值得一看吧，一年到头很少看【黑白片】,0
1,26820836,八月,Zoe,zoedark,推荐,2017-03-26,20:07:03,老人和成年男子的眼泪总是让人泪目～,1
1,26820836,八月,虎折,cosmopolite7,还行,2016-12-05,08:52:33,三星半。娴熟而舒服，稍显贫瘠了些。,0
1,26820836,八月,酸的馒头,QueenBMsCC,还行,2017-03-27,20:25:40,"“让你妹妹玩一会儿啊。”
“妈我吃不下了。”“还有多少啊？给我看看。就这一口，吃了吧。”
还有那夏日里的雷阵雨。
最后我终于也穿上帅气的校服，系上和三哥一样的皮带。",1
1,26820836,八月,冯凝,oldragontomb,较差,2017-03-26,20:41:45,只有情节，没有故事。编剧全程不在线。,0
1,26820836,八月,之遇,40523064,力荐,2017-10-08,20:49:06,好的电影就像一杯好的龙井，喝过之后，回味无穷。《八月》里的童年，父亲，母亲，三哥就像梦醒睁开眼后的那个深呼吸，回忆一直弥漫在周围的空气中，久久不曾散去。,1
1,26820836,八月,说什么图灵,memorymare,推荐,2017-03-26,21:27:55,文艺片，结构很散，要说童年，也就一点吧，跟自己的童年相似点不太多。,0
1,26820836,八月,星嘎努斯嘎,11936204,推荐,2017-03-26,22:37:03,我想起我小时候 想起了好多细细碎碎的东西 又遥远又软绵又硬邦邦,2
1,26820836,八月,Eggplant Hater,lywaits,推荐,2017-03-29,17:00:14,感谢他安安静静、老老实实地讲记忆、讲时代。,2
1,26820836,八月,安短,cradlelang,推荐,2017-12-30,21:16:49,作为同样有着单位大院童年生活的我，真是感慨万千——“改制”真的是一个非常复杂的话题。小的时候，真的就在某个夏天，突然发现生活里的一切都不一样了，但也是从那个时候开始，时间开始过得飞快。（PS：还是叫《昙花》更好）,0
1,26820836,八月,徐州丰县艾丽卡,cld104123,还行,2017-03-30,17:57:11,以重构一种记忆的角度来说是挺不错的。但仅此而已如此形式化又有些显得尴尬。,1
1,26820836,八月,安逸竹雪,Anyizhuxue,还行,2017-03-29,08:25:31,昨天看的，看完有点想家了。片中放电影的那个 标准放映厅，小的时候我们也去那里看电影。觉得影像很好，但自己不太喜欢这种比较散文化的电影。,0
1,26820836,八月,picnic,picnicskins,还行,2017-03-27,20:22:19,黑白影像之下有对生活的还原，艺术来源于生活，但是还没有超越生活，意旨还不够深刻。爸爸的演员很有戏～,0
1,26820836,八月,苏莫,yaohuadong,较差,2017-05-06,21:38:27,说它根本算不上一部电影也不为过。,1
1,26820836,八月,"""eMily""┆rehab",emilycou,力荐,2017-03-31,19:53:49,瞬间回到了小时候…导演用心良苦…美术道具都很到位…小演员很有灵气…爸爸那个角色也不错,0
1,26820836,八月,Xingxing ZHANG,suogu,还行,2016-12-16,21:49:10,没怎么看懂。。。,0
1,26820836,八月,九命猫@victor-eyes,OldCatMiMiMi,推荐,2017-03-24,22:06:46,如果是小说的话，大概是我想写的那种。虽然有些刻意突出下岗，但大厂子弟生活就那么几件大事，结尾比万鸟朝凤、少年巴比伦那种好日子都不在了的陈旧气要好。有点像会做梦的杨德昌。。。好怕小朋友玩双节棍打着蛋 = =,0
1,26820836,八月,宅拾叁,gongzitian,较差,2017-05-07,17:13:02,怎么比我的童年还无趣。,0
1,26820836,八月,安宕宕,42873514,推荐,2017-03-24,17:28:59,每个镜头都很考究，固定机位平拍中看到丰富的层次感，可容纳的空间很大，场面调度也好。时代感很强，不仅是服化道场景，内里的人情世故拿捏精准，小区生活细致入微，台词和生活全部贴近，典型的八零后记忆。小雷妈妈演的很自然，爸爸有点文青气质，小雷为啥台词那么少……,2
1,26820836,八月,strongman,SM0916,力荐,2017-03-30,00:43:33,我的童年,0
1,26820836,八月,麻木粮姜,zhulinzhao,力荐,2017-03-25,01:04:04,新现实主义杰作 老家属院什么的拍得太美了 最喜欢三儿被捕那场戏 灯光效果致敬了里德的“third man” 还有哥几个坐着吃火锅唱歌那场戏 空镜节奏把握得好 让人想到小津晚年的秋刀鱼之味 配乐像苏联电影 最大惊喜是在大银幕上看到了mc kigga…,0
1,26820836,八月,二道贩子,reeboir,还行,2017-03-26,21:59:23,难得诚意十足,0
1,26820836,八月,幻游火車,44511403,推荐,2017-03-27,23:00:36,俯视着过往的生活，好像坐在当初看《如梦之梦》的莲花池，周围都是一个个绕圈的身影，无论是生活还是生命都是无止境的往复轮回。摄影很美，每一帧画面无论结构还是光影都值得截下来学习研究；小演员很有灵气。若要简洁总结这部片，我想借用陈丹青这句“已是花香满径，乱风生生不息。”,1
1,26820836,八月,椒盐,194331395,推荐,2021-04-18,17:55:37,4.5 听完映后交流，我断言导演如果走不出这种纯粹依靠记忆的创作模式，那这部作品可能也就是最高峰。电影是散文式的结构，被“去中心化”过后的叙事很有自己的想法，两幕剖杀小羊取羊粪的梦境极其准确地点到了那个模糊的隐喻，也就是在生机勃勃的夏天，整个家庭和所有成员所失去的东西，那种惆怅的感觉拍的极其精准且不拖沓。国企改革那段岁月我连听都没听过，但是却也能进入这部电影的空间，仔细一品味才能感受到导演在整个空间里对声音的把握，很好地塑造了气氛，没有过于煽情，也没有过于生疏，我对这类导演基本都是没有抵抗力的。希望导演越做越好，期待之后的作品，有机会等几年再去听一听他的交流，我觉得他应该也必须走出这种被动的创作方式。,2
1,26820836,八月,地下诗人,AndreBazin,还行,2017-08-23,23:16:18,處暑，暑止也。 八月觀《八月》 The summer is gone 過譽 配樂不合時宜地喧賓奪主過猶不及 《天堂電影院》《櫻桃的滋味》 小時候小鎮街沿上擺滿了檯球桌我還打贏過一個大人可以用手擺球 高貴的頭顱 用學業生涯規劃和游泳一千米告別這個夏天 布鞋,1
1,26820836,八月,杨小槑,76238756,还行,2021-06-19,22:48:32,影片以其轻柔的笔触，鲜明的现实主义格调，沿着导演的童年往事，以低级位的的少年视点，叙上一段淡淡的黑白怀旧影像（彩拍调黑，一定程度上弥补了摄影短板）。叙事上则是将几个故事线交叉剪辑（老爹的长处），透过种种与大陆市民息息相关的民生问题，相信即使是没经历过那个时代的观众也能引起对家人、朋友、生活环境不同程度的共鸣。关于怀旧的描写与视听结构，多是些具有时代气息的道具、金曲以及电影人常有的电影记忆，摇摄、标准镜头、声音设计、叙事节奏也太戏仿台湾新电影了。,0
1,26820836,八月,有位女士,51420447,力荐,2017-03-25,20:51:46,就是一个琐碎又平常的八月，时间流逝，生老病死。像打开了时光机，看到了爸爸妈妈年轻的时候，他们也有快乐、痛苦，有和我们一样的理想和“高贵的头颅”，据说梦就是没有颜色的，那这就是个回到过去的梦了吧,1
1,26820836,八月,亮马河畔,47928438,,2020-01-09,22:37:41,我记得我写过评价啊？用孩童容易断线视线和记忆掩盖自己的能力不足 拍给自己看的没必要拿到大银幕收割票房,0
1,26820836,八月,霾桑 等108个人,steammoonsnow,还行,2018-04-10,22:16:25,1小时10分钟处，斗蛐蛐的镜头，错用了三只尾巴的蛐蛐（就是多了产卵器的母蛐蛐）。最重要的，结尾致敬“我们的父辈”——no，应该是“你们”的父辈。,1
1,26820836,八月,octopus,NoodlesKid,推荐,2021-02-20,19:40:03,更像是导演的私人映像，却看到了一个时代的影子。手高眼低的父亲，里外维系的母亲，满嘴假客气的大人们，家里和家外构建出截然不同的两个世界。,0
1,26820836,八月,retnuhreed,xingmahao123,,2017-05-01,13:44:24,感觉 有点堆砌 偶尔有那么几个地方觉得 对 就是以前的样子 但没往心里去,1
1,26820836,八月,Sabrina,15401327,力荐,2017-06-28,23:19:43,还好，这段历史还有人记录。,0
1,26820836,八月,Jeannels,jeannels,较差,2017-03-22,21:23:51,局部还行，整体不行。,1
1,26820836,八月,[已注销],yangcht,推荐,2017-03-30,21:06:04,喜欢,0
1,26820836,八月,SoundsSad,66831677,力荐,2017-04-03,12:05:45,2015年11月《山河故人》之后在影院里看到的第一部自己蛮喜欢和满意的在大陆院线大银幕上映的华语电影,1
1,26820836,八月,第四公民,milan07sheva,较差,2017-11-10,10:29:08,特点就是特点，问题就是问题。,0
1,26820836,八月,最爱百年孤独,1240037,还行,2017-04-28,22:12:27,很明显想表达一段比较有特点的时代记忆，只是故事过于松散和个人化，缺乏深度。但作为处女作已实属不易，毕竟甩很多院线片几个大街。影片多有台湾乡土电影和日本家庭剧的印迹，表明导演应该也是一个迷影导演。,0
1,26820836,八月,Reaper,dkjcdk,还行,2017-03-25,21:05:59,非常私人的讲述，可以看作是导演对那个夏天日记的影像化。,0
1,26820836,八月,小6羊,min6,较差,2017-10-25,18:42:27,没有儿童视角的儿童片，太多的符号堆砌，完全没有共鸣的集体追溯。,1
1,26820836,八月,yo,yo911217,推荐,2020-02-17,00:31:22,童年生活的暑假，拍的挺真实,0
1,26820836,八月,蘑菇安,mushroomann,推荐,2017-03-29,22:17:20,别别扭扭的摆头电扇吹着溽热的风，葡萄藤上的叶子被阳光照得发亮，暴雨前涌动的雷与云彩，傍晚路灯下嬉笑怒骂的打牌声，满是漂白粉味儿的露天游泳池，街边的小台球台子和充斥着烟味儿和满地瓜子皮的小放映室…黑暗里明亮又羞涩的笑脸，是那昙花一现的夏天。,1
1,26820836,八月,#∞#,46070875,较差,2017-03-26,15:01:30,最后二十分钟  情绪才真正到位——前提是能忍受之前的散碎 生活类电影最重要的是观众能移情 而碎片化叙事最难做到的正是移情 不是简单还原儿时生活观众就能感动的 素材是不少 内在情绪却空缺 导演还要加油啊,1
1,26820836,八月,一百万海豹,48961907,还行,2017-03-24,14:53:19,12岁小男孩的视角，工厂大院随时代渐渐衰败，零星地很真实。小孩子总是跟在后面，看到大人们之间的矛盾 焦躁 隐忍 等等片段，看到，却不能懂，长大之后将记忆中的影像回归时代中才理解。虽然没有我的童年，不禁感慨年代之间的更迭无声无息又翻天覆地啊，短短二十年，已经久的像半个世纪前的事了。,1
1,26820836,八月,沈一泓,40153329,较差,2018-03-16,10:47:50,又是一部年代戏流水账,0
1,26820836,八月,小山生桂枝,ssryyr,推荐,2017-03-25,20:44:40,喜欢那个妈妈。“人，不能低下高贵的头颅。“”抬着吧。“,0
1,26820836,八月,云间漫步,55337005,推荐,2022-12-02,21:40:07,1）80后对1990s的追忆，麦田中挂着篮球网兜的自行车，孤零零地，随着音乐的流动，惆怅的感觉慢慢渗入观众的内心，最后一家三口从小港穿行，妈妈和孩子给去打拼的父亲送行的画面很触动人；几次饭桌的呈现也挺有代表性；但全程黑白似没有必要，如果是彩色的，把握好色调，可能对影像的印象会更好；2）以一个童年个体的视角侧面反映时代巨变带给普通人的迷茫、失落、纠结、不安和惆怅；3）相比黑白呈现，片中的音乐、声效给人更深的印象；下岗、改制对已经长时间身在体制中的普通人是不易的，巨变特别考验一个人的生存能力；4）如果影片停在送行那里，感觉会更好的，后面的部分反而有点削弱了主题；5）小演员选得出色，小小年纪很有故事感；,0
1,26820836,八月,波吃曼,bananation,推荐,2017-03-30,08:05:14,很碎片的黑白片，让自己又想起了多雨的那个夏末。本地排片只有一场，急匆匆的还去还错过了开头，个人是很喜欢这种叙事方式的，好像清水煮白菜里加了薄荷，很奇妙，回想起来就像做梦一样,1
1,26820836,八月,sheepfield,lamber,较差,2017-04-03,01:13:18,不顺眼-03/17/17 at MoMA,0
1,26820836,八月,安獭獭,red.,较差,2017-05-01,11:37:29,巴赞有本书叫“电影是什么”。,0
1,26820836,八月,颜落寒,yanluohan,还行,2017-04-23,04:00:02,旧时光是那么温柔，又那么易碎。,0
