page_index,movie_id,title,username,user_id,rating,date,time,comment,useful_count
0,26820836,八月,桃桃林林,qijiuzhiyue,推荐,2016-07-23,22:10:36,三星半，导演对90年代初那段回忆的重现还是很有味道的，甚至带出了我的各种记忆。国营工厂时代的结束，不但是那个年代的成年人，对那时的孩子其实影响也很大。影片碎片式的记忆了很多童年的往事，情节并没有非常集中，而是很松散的汇编在一起。故意隐去很多关键情节，却没有影响剧情进展，这个不错。,384
0,26820836,八月,谢飞导演,114515320,还行,2017-02-15,19:09:21,优点是对生活的尊重及捕捉视听形象的执着；缺点是编、导、演掌控的青涩。依我的观点FIRST不应颗粒无收，金马又评价过高。但评奖从来是具体评委们在特点地点、时间的表达，无可厚非。新导演要稳得住，坚持该坚持的，提高该提高处，迅速地投入下一个实践。记住，头三部作品是你一生创作历程的关键。,1579
0,26820836,八月,哪吒男,nezhaboy,推荐,2016-10-23,12:18:08,写给父辈失意的诗，昙花会开的，我们可能不会了。哭了三次，鸡皮疙瘩一次。,281
0,26820836,八月,同志亦凡人中文站,3540441,还行,2017-03-31,16:45:21,小演员让我想到少年张震，导演学特吕弗的意味很明显。从“路边野餐”到“八月”，我们的青年导演似乎总不懂得怎么把剧本写得高于生活，他们以为只要把生活的枝桠剪下一段就可以直接插进电影的花瓶。——这叫偷懒。,484
0,26820836,八月,胤祥,yinxiang,推荐,2017-02-21,07:52:15,比起侯孝贤可能更像杨德昌加上[压路机和小提琴]的老塔，但就算语言是借来的，记忆和情感却是极为真挚的（不仅是内植，我甚至觉得这部影片会有一种反向的内植哦）。把内蒙厂还原成国企，并选择了那个关键的时刻，这简直是电影史的神来之笔。影片声音设计极为有想法。等上映了一定要去影院再刷一遍。,140
0,26820836,八月,CharlesChou,CharlesChou,力荐,2016-12-08,21:59:42,超越了言语表达的范畴——昙花开了，大家都合影留念，那样转瞬即逝又无限重复的一个夜晚，舞池的灯光扫过他百无聊赖昏昏欲睡的脸，是当下又是历史，是现实又是回忆，是终有一天逃离后又希望在梦里被遣返的乡愁。,125
0,26820836,八月,Chris  一切由无聊开始,sniperchris,推荐,2016-12-23,19:29:16,想起黑处有什么，但黑处很外行，让人尴尬，而八月非常好。八月有自己的气质，节奏，品位。有一股文艺气息，看得过程非常舒服。那些情节和对话虽然没有做到特别精致和自然，但在同期的比较中已经能完胜了。希望看到更多这种气质的电影。,74
0,26820836,八月,小A,AngelinaAnne,推荐,2016-12-24,16:53:31,小孩看待体制和家庭变迁，不想搞清楚为什么，也不想批判谁，就是觉得这段日子挺美好，有点忧伤。长镜头配忧伤的旋律很有艺术范儿。P.S.经导演本人确认，片中的“老云”说的就是蒙古族著名导演塞夫。,35
0,26820836,八月,西楼尘,xilouchen,还行,2016-09-24,18:11:52,小城是会变的，分账片再也没法免票入场、画海报的被迫转行刻字、剪辑师低下高贵的头颅离家当场记；小城又是不变的，升学仍需金钱和关系、亲人终会放下芥蒂、夏天依旧那么燥热。声声吆喝带回九十年代，大环境下人心惶惶，小雷爸对着空气无物之阵地挥拳，却无处对抗与挣扎。穿上三中校服，八月好似昙花。,601
0,26820836,八月,丁一,2434887,还行,2017-04-29,22:43:39,"文艺电影四大俗，
彩色结尾黑白片，
片名不肯马上出，
固定机位长镜头，
怀旧金曲串串烧，
八月四俗此俱全~",228
0,26820836,八月,木卫二,MovieL,较差,2016-07-24,10:00:42,内蒙古电影制片厂输送FIRST标配。以小孩去写大人的小大人视点，最后变成了突兀存在（一度跳到了「钢的琴」等），泛滥着文青影青的20世纪末感伤，也生吞了小孩子应有的童真稚气。情怀大过天，也不能掩饰影片本身的无力。喜爱看「出租车司机」的孩子他爸分明就是真人版桃姐，这个可以加分,264
0,26820836,八月,kulilin,kulilin,推荐,2017-03-24,12:39:04,用程蝶衣的话说，这个导演是懂戏（电影语言）的。几个镜头值回票价，不堆砌符号，小演员好。,21
0,26820836,八月,亵渎电影,zhangzongqian,还行,2017-03-18,12:14:26,之前看过，标记一下，印象最深的是它的声音做的非常棒，用耳朵听仿佛就能回到那个过去的时代。每个时代都有自己的声响，当下的孩子以后拍他们的童年，肯定就不是我们那时候的声响了，只需要竖起耳朵，这片子就是满满的怀旧气息，声音这点做的很加分。,179
0,26820836,八月,frozenmoon,1233038,还行,2016-07-18,20:07:37,80后献给自己童年记忆的散文诗，对于自己父母一辈年轻时的回望。它其实并不那么优异，有些过于散淡。对于那个年代社会转型时对人心的触动，很多都没能表达清楚。但很少有人去这样描述那个时代。这算是一次不太一样的回望角度。,57
0,26820836,八月,xīn,caesarphoenix,力荐,2016-07-26,17:47:51,夏日里雨水淋湿又蒸腾起的迷梦，打开“如此这般三十年，一夜之间大厦倾塌”处的温存时刻。隔着距离的小心翼翼的梦回，梦回青春、集体与社会主义。,81
0,26820836,八月,九尾黑猫,LadyInSatin,还行,2017-03-27,15:15:11,现实题材容易遇到的局限，就是需要相同的生活环境才能引发的共鸣。真正可以跨越文化障碍的电影，首先是有艺术性，其次是普世的情感，人类共有的悲喜剧。这个有点拍小了，充满琐碎的矛盾与混乱，没有抓住任何清晰的脉络。导演希望保留儿童记忆中的世界，但毕竟这已经经过情感和时间的重构了。,22
0,26820836,八月,seabisuit,seabisuit,推荐,2016-11-26,00:17:28,这几年first里边最喜欢的一部，致敬父辈迷影元素，儿时的记忆正如这样散碎模糊，琐事也像昙花一样开在了心里。国营制片厂改革由主任改叫经理想起了诸多那个时代的变迁，不只是儿童视角，最后我也从他爸爸看到了自己。塔洛摄影的黑白影像，提名的出色声效设计让观影仿佛回到那个夏天。导演映后见面场，祝去金马多拿奖。,31
0,26820836,八月,水怪,shuixia1825,推荐,2017-03-24,08:07:33,沐浴着苏俄集体主义的回光返照，追寻一段历史缝隙的动物感伤。八零后一代青年极为本能地致敬父辈与自我立传的范本。张大磊在一个疯狂奔袭的年代沉思冥想，寻回了通往过去的时间密码，并且以极具感染力的形式穿透银幕，直抵内心。,24
0,26820836,八月,袁长庚,yuanchanggeng,推荐,2017-03-25,22:00:50,取巧时代，假面黑白，四两拨千斤，算是新导演的精明之处。我相信张大磊说的，他拍这片子，不是为了怀旧。九十年代之所以可爱，无非是因为，今天太让人疲倦。我跟他一样，也想找回父亲母亲叔叔阿姨哥哥姐姐和夏天时的操场,21
0,26820836,八月,zitsunari,qiaotaizi,推荐,2016-10-23,12:27:19,感人！年代感出色，但有两个bug：广场舞、路边摊大妈的衣服,21
0,26820836,八月,LOOK,2049622,较差,2016-12-08,22:57:58,比较像学生作品。几个比较明显的瑕疵：小孩这个角色如果全部拿掉整部电影也是成立，九十年代初转制改革对工人带来的冲击力是肯定有伤到骨肉的痛感，影片中始终弥漫的却是感伤化的小情小调，这是视野问题也是缺乏社会历史洞察力的表现。一拍艺术片就用黑白片的方法实在也是看疲倦了。2.5,195
0,26820836,八月,内陆飞鱼,veverlee,力荐,2017-03-26,00:09:36,很喜欢，自然，流畅，娴熟，细致，有人情味，大大超过预期值，第一部片子完成度就这么高，已经很厉害了，《爸妈不在家》之后最喜欢的80后华语导演处女作，五星鼓励，70一代在向着商业大规模妥协的时候，80后这批人，慢慢出来一些能沉住气的人了，熬出时间的味道了，不错。,33
0,26820836,八月,小本,shanjijian,推荐,2016-10-23,12:32:58,虽然我大部分个人记忆从95年才开始，片中对整个八十年代至零零年代的追忆，加上如同 一一 一样的男主角无忧无虑地看着大人所遇：下岗、改革、升学焦虑、离别、和解…,11
0,26820836,八月,欢乐分裂,flowermumu,还行,2017-03-27,14:32:52,“绿树阴浓夏日长，满架蔷薇一院香。”夏日只拍动一下它既短暂又贪婪的金色羽翼，就飞快地逝去了；90年代在记忆里似乎是个空白期，永远停伫在夏日的芬芳沉静里，那时黄昏透明，明亮异常，少年心事不识愁滋味，在时代洪流中不知所踪；一首清新隽永的散文诗，略青涩。,17
0,26820836,八月,隔壁LEO在唱歌,RiverPheonix,推荐,2016-11-26,13:19:46,导演的处女作，总是怀旧的，也总是用情最深的,10
0,26820836,八月,麦兽兽,zsuhht,还行,2017-03-27,15:46:29,我觉得小磊他妈长得像麦兜他妈…,15
0,26820836,八月,游牧人·芳汀,melody1971,,2017-03-25,17:47:10,#电影院# 绝不能为眼前事业单位一时的铁饭碗迷惑，学好技术即使失业了也能东山再起。但是导演控制了情绪，没让爸爸下岗后的悲伤情绪在大荧幕上蔓延，毕竟是孩童视角，孩子的世界还没有体会成人谋生的艰难。一个人在电影院看的，感觉文艺片还是需要有像辛树芬般气质的演员才能更好的看下去，我需要美。,9
0,26820836,八月,Panda的影音,PandaMovieMusic,推荐,2016-12-04,17:27:52,金马奖最佳影片，可惜，和监制万玛才旦的《塔洛》一样，薄弱的故事情节还是没能让我将身心足够沉浸在黑白影像之中，但《八月》多少还是勾起了些许我的童年回忆，这有增加我对影片的好感。P.S.：观影时最大的惊喜竟然是来自片尾字幕的「其他演员」：台球案 xx xxx xx 游泳池 xx xxx xx xxxx …… 好逗！,13
0,26820836,八月,老袁,yrsyl,还行,2017-04-25,00:27:17,拍电影的好坏如果用射击作比喻，1-10环都在靶上，都有点意思，电影的好坏之分是看谁用更精准的桥段、视听、表演去无限逼近靶心。个人感觉《八月》是一部打上了靶却离靶心有段距离的作品……,14
0,26820836,八月,梅雪风,mxf1978,推荐,2017-04-02,16:08:30,这是最近我看过的声音最为丰富的电影：商贩的叫卖、邻居的歌声，楼下的骂声，街坊的打牌声，台球入落的声响，闹钟的嘀答声……它们让画面不再是平面的，它成了一个磁场，一个不动声色的黑洞，带你暗暗潜入那个少年敏感的内心，一切隐晦而又惊心动魄地发生， 而他只能懵懂无知却又洞若观火地无能为力。,10
0,26820836,八月,破五,132778991,推荐,2017-03-06,15:42:29,真的看到小时候夏季巷子里的场景，小孩们的追逐、打闹，大人们的夜下的乘凉，人影交错！没有为了画面的美感克制这种场景的表现。姐弟间的救济、佛唱机里的唱经、床边的轻泣、为生存的远走他乡，让我的童年历历在目！,12
0,26820836,八月,seamouse,seamouse,推荐,2016-12-09,00:03:56,最喜欢原创配乐部分，而不是那些对同时代的我都过量的怀旧歌曲。其中最漂亮的是一段从《亚麻色头发的少女》延伸出来的旋律段，好像是晓雷偷窥对楼姑娘拉此曲小提琴之后第一次响起。对这首德彪西神曲，以前在电影中运用最漂亮的是《关于莉莉周的一切》。所以《八月》的配乐是哪位高人呢？,13
0,26820836,八月,放开那个浪味仙,bettylwx,还行,2017-02-09,22:43:12,黑白的画面削弱了“八月”的暑气，细致的布景和迷影细节的致敬勾勒出一段记忆中的少年往事。比起去年的《路边野餐》，我更喜欢这个故事。三星半。,14
0,26820836,八月,恶魔的步调,Len.,还行,2017-03-26,18:11:12,有提到童年住事的，不过更像一个低配版杨德昌。春梦邻家女孩那段提琴听着像关于莉莉周的一切里的。没在沉默中暴发的出租车司机。,9
0,26820836,八月,兮称,shoegazerbaby,推荐,2017-05-05,01:44:08,把台湾电影学得有模有样，兼具自我表达的轻盈和人文关怀的厚重，前半部分琐碎闲散，坚持到后半部分却让人惊喜，九十年代初暖融融慢吞吞的人情社会在今天看来真是充满唏嘘，而开始高速发展后分崩离析的中国家庭又是何其多，以怀旧之名，叹现世之殇。,4
0,26820836,八月,水木丁,pinkonion,推荐,2017-08-23,23:33:27,这才是中国……,5
0,26820836,八月,林西拿,milukulam,,2016-11-23,23:29:39,明顯擁有審美和意識。欲言又止像小津，夢境、水和隱約笛聲像塔可夫斯基，構築畫面的思維像侯孝賢，廣播聲和歌曲像賈樟柯，結尾像阿巴斯。期待他下一部作品！,13
0,26820836,八月,影子的影子,yfqc24pippo,推荐,2017-01-08,18:53:32,还真的挺喜欢的，完全个人的表达和情绪。张大磊内心是一个极度浪漫的人，整部片子如他所说就是一场夏日午后的白日梦，弥漫着一股小布尔乔亚的慵懒。对于一个小孩子而言，改制的阵痛哪会有那么清晰沉重。不过不喜欢黑白的处理，彩色的梦不是更有趣？,10
0,26820836,八月,柏林苍穹下,chenchangxing,推荐,2017-03-30,19:36:59,时代的洪流，日常的涓流，沉淀成个体记忆的泥石流。改制、转轨、下岗……在时局的屏障下，后知后觉的又岂止于孩童？,5
0,26820836,八月,张,yan7478,推荐,2017-03-24,14:02:24,走了几次神，想到了杨德昌。《八月》是很冷静的抒情，一切都是淡淡的，不悲不喜，总感觉有些刻意。特别是小雷，大概只有和昙花在一起的时候，才是真实的。,4
0,26820836,八月,一只野鸡,newills,推荐,2016-12-11,20:30:00,金马奖也算实至名归，完成度不错，对那个年代的还原基本到位,6
0,26820836,八月,艾晨,satan163,推荐,2017-03-24,19:19:35,75分吧。可能因为南北有别，除了一些背景音乐，没啥所谓的童年记忆。就是看到一段生活。八月嘛，闷热，躁动。既不能像七月刚放假那样，悠哉肆意，又不知道将要面对什么样的九月。,9
0,26820836,八月,kakakarl,zhanyakui,还行,2016-07-23,20:47:40,#FIRST10# 导演说最初叫《昙花》，感觉更好一些。新导演都喜欢私人化的东西，与八月比较诗意的展现导演童年的回忆。《八月》以时间为名，很容易想到《我11》，但是剧情没有《我11》复杂和深刻。,9
0,26820836,八月,影志,tjz230,较差,2016-07-24,19:01:16,看到后面才知道故事发生地在内蒙，但是拍的感觉就跟南方一样，90年代的复古感，跟自己经历的一样，“我们还是出去下馆子吧” 简单一句家常话，真是好久违。结局致敬的段落跟去年的《告别》如出一辙，减分。,70
0,26820836,八月,五色全味,wusequanwei,推荐,2017-03-26,23:54:40,喜歡。相比有些人覺得它青澀，我反而覺得表演指導和細節處理都很細膩（除卻母親的casting不太盡如人意），感情亦很真摯,5
0,26820836,八月,南悠一,Allan.Vr,还行,2016-10-19,20:29:38,男主小朋友符合大多影评人对自己小时候形象的幻想，注意，是幻想：倔强、文气、从小就是直男、受电影熏陶的高贵人儿。三星半,11
0,26820836,八月,Naza,xqbnbzx1996,力荐,2017-03-24,18:56:13,这些影评人是真的智障,22
0,26820836,八月,盘子,zhaoxun69,还行,2017-03-27,20:10:01,我不是很喜欢所有“本来可以拍得更好看点但是我很有艺术追求所以就是涩得不好看”的片子。这种，和特别有张力的那种简洁，两码事。,6
0,26820836,八月,米粒,conanemily,较差,2017-03-19,22:36:21,这种全程孩童视角但始终格格不入的设定显然从牯岭街来的，但有视角还得有情感啊，杨德昌那种愤世嫉俗，真是学不来的。其实有不少值得发展的角色和方向但最终还是停留在这无变化的视角，于是只剩下当时的文艺中年和现在的文艺青年的顾影自怜。贩卖情怀的电影真的有点看腻味了...,60
0,26820836,八月,Lies and lies,kidneytopo,还行,2016-12-05,16:49:53,时间的省略和跳跃非常精妙。有不少兴味盎然的场面，不过处理还是生硬了一些。声音设计负分，后景的声音太清晰了。过载的声音一直在跟黑白画面打架。,5
0,26820836,八月,zzy花岗岩,3718831,推荐,2017-03-25,22:30:20,影片精准的把握住了九十年代国企改制背景下一个普通家庭及其周边面临的种种改变。尽管影片的情节并无太多共鸣，却自然而然的将我拉进自己的童年回忆中。儿童视角、固定机位、长镜头、黑白影画，导演打了一次成功的怀旧牌。孔维一很有灵气。PS：终于感受到了电影院包场的感觉~,5
0,26820836,八月,一只大鱼,alwaysforyou,推荐,2016-10-14,23:10:53,又回到盛夏的八月，晨梦中是不见的田野。大人们喝酒唱着歌，前路却感慨又困惑。都说改制是大事业，有人起就有人跌。结束了八月去上学，哪说的清怎多事且#记#,9
0,26820836,八月,余小岛,missixyujun,还行,2016-11-20,16:52:18,平淡琐碎，前半段基本没有叙事性，后半段才渐入佳境。。所有这种回忆性有年代感的电影，音乐应用都非常重要。。一首贴合的歌比上百个镜头都还有用。。。。,11
0,26820836,八月,嘟嘟熊之父,duduxiongzhifu,较差,2016-11-20,16:17:06,基本上是我能想到的拍摄私人回忆最为浅显和简便的拍法。旧物临摹，符号堆砌，但人物本质还是空心的。如同翻看一沓老照片，你能捕捉到时代的浮光掠影，但并不会因为它是泛黄的，而真的与照片中的人产生多少共情。电影重点突出的文艺中年那股怀才不遇的酸劲儿，实在是太夹带私货。,42
0,26820836,八月,翻滚吧！蛋堡,7542909,较差,2016-08-10,01:10:37,毫无新意不痛不痒的私人回忆，黑白完全没必要,36
0,26820836,八月,陶陶四,1418573,还行,2017-02-21,10:12:13,如何分辨一个导演没有叙事能力，和这是一部小情节电影或反情节电影,3
0,26820836,八月,汪金卫,longzheking,还行,2016-10-15,23:01:25,让我想到同样出自FIRST的《告别》，都与内蒙古电影制片厂的没落及父辈的失落有关。只不过那个是站在现在回首过去，本片是试图穿越到过去，从孩童视角观察、还原90年代中期制片厂改制时期的人事。剧情平淡，摄影不错。独特色调与黑白老片还不一样。拍个人记忆题材的片子总归差不了。个人更喜《告别》些,7
0,26820836,八月,Ocap,69290051,,2018-08-03,19:42:01,不说好不好，反正99%的时间里都找不到任何进入的理由。,5
0,26820836,八月,心生,itzhaoxiangyu,还行,2017-04-22,18:54:56,不喜欢结尾,2
0,26820836,八月,幻影刺客,tuxuan,推荐,2017-03-27,09:30:22,讲的是内蒙古电影制片厂的故事，在时代背景下，每个人在八月这样的稍纵即逝的夏天里，有的生活发生的巨变，有的生活暗潮汹涌。电影95%时间内是黑白的，画面灰暗、模糊、暧昧让人容易回到90年那个昏黄的年代，不由自主地怀旧起来，给这样的情怀多加一颗星。,2
0,26820836,八月,Tyger Tyger,tangweijie,推荐,2017-03-24,23:38:22,一部视听的散文诗作品，2017年度必看国片之一。怀旧，向父辈致意，这一切在导演张大磊那里，没有停留在时下已显疲态的“情怀”的层面，他让我们通过镜头结结实实地驻留在了上世纪的九〇年代，嗅到了它的气味。剪辑，音乐均可圈可点。,7
0,26820836,八月,猫司令,Queenie.Emika,推荐,2017-03-26,05:59:07,0318MOMA。我个人还蛮喜欢的。不刻意，不做作，拍得也舒服。,4
0,26820836,八月,发福的唐吉珂徳,b612,推荐,2017-03-31,15:34:58,细节——说不好听是碎片——的罗列拼贴出一个年代的人情世故。虽然仅仅只有一个夏天的片段，但是每一个看似简陋却细腻的画面都在讲述人心的坚韧、迷茫以及温情包裹的脆弱。那个宏大的叙事一直都悬在那里，作者似乎并不愿意去碰，又小心翼翼的把每一步走在它的阴影里。所谓美，即真。,2
0,26820836,八月,毛,SouthLateWinter,推荐,2016-12-07,16:39:54,3.5 sooooo classic 生活覆盖华北平原 忧伤浸透他的脸,2
0,26820836,八月,有心打扰,kejinlong,推荐,2017-03-26,17:59:07,日记本上的记忆，总是断断续续的，没有完整的故事，却凝结成完整的过去。,2
0,26820836,八月,弗里茨维尔,65585379,还行,2016-07-24,10:26:01,演员演得非常棒，配乐和整体气氛也很棒。但是怀旧的精工并不意味着这就是一部好电影。时代大变迁，在每个人身上留下了什么？我既没有看到挣扎，也没有看到像张导所说的父辈挣扎之后的妥协。有人给我说导演只想展示那种生活状态。好吧，太无趣。这是一部90年代黑白照片集，但不是一部成功的黑白电影。,5
0,26820836,八月,尘飞扬,134527565,还行,2017-03-24,17:25:21,谁能想到，小雷并非中国第一代留守儿童，三儿才是。,4
0,26820836,八月,yuan,yuannnnnnn,推荐,2016-10-23,16:31:35,私影像。导演对其童年／90年代初的一次回望。可能是2016年最好的华语电影。出于成本的捉襟见肘和对时代还原的必然，黑白影像可能是一个平衡之举。回忆之美像切割精细的钻石，是流逝的时光破碎之后的再拼接。孔维一表现出色，相较【一一】里的洋洋，有过之而无不及，值得一座金马奖。,4
0,26820836,八月,junepig,junepigpku,推荐,2017-04-07,21:33:41,大概因为与主人公年龄相近，觉得每一帧都看懂了，九十年代初的那些个季节里，有些人的生活被撕裂了，甚至好像中国人最后的诗意也随之消逝了。但我们的父母确实以惊人的韧性，度过了那样的时代。看得哭了，因为真的好害怕有天要和父母诀别。,3
0,26820836,八月,帕拉,58059498,还行,2017-03-30,23:50:34,导演琢磨好了摄影机前面的呈现画面，却把电影的延展性扼杀了。电影的入境出境方式刻意到我一直联想摄影机后的剧组工作，导演真的是把四面墙的存在感放到了最大，真的没法代入这个故事了。[B-],3
0,26820836,八月,远子,xiaoxiaodeyuanz,还行,2017-04-04,22:41:50,制作水平挺高的……退两年我大概会称赞，但我现在看不惯80后软绵绵的怀旧情绪。老得太快不是件好事。,8
0,26820836,八月,alfredo,nyserq,还行,2016-10-16,23:31:48,三星半，黑白攝影的效果沒想像令人驚艷，可能數位效果太清晰，覺得題材比較適合彩色但應該有難度，反而環境音效做足了力氣成為影片的基礎。聽說像童年往事一看卻有牯嶺街的影子，童年視角動機不明反而成人拿走了戲，影像鏡頭設計精細，敘事精簡充滿生活細節但文化背景不好看明白，沒感到情感的力道。,3
0,26820836,八月,谢谢你们的鱼,reave,推荐,2017-03-25,17:22:15,你能看到杨德昌甚至达内兄弟的影子，但是值得庆幸的是这是导演非常个人的作品，以家庭为切入点展现90年代初的社会风貌，那些在不断改变的和一直在留守的，整个叙事波澜不惊，没有刻意卖弄符号，更多的是相对冷静的回溯，当然拙劣的地方也是很扎眼。,6
0,26820836,八月,冰山李,ofo,很差,2017-03-24,17:59:48,没什么可谈的，韩红看了想打人,12
0,26820836,八月,好样的,49595588,还行,2017-03-18,12:32:31,八月到了还有不到一个月就开学了。收起双节棍戴上爸爸夜里偷偷放进来的皮带自己骑车去上学。上爸爸妈妈托关系找来的学校。看电影开始收费朋友小胖变得牛气哄哄似乎一切都在变。夏天就要结束了。有符号堆砌但还好不算过分。音效设计想法不错但是完成度真不敢恭维。,1
0,26820836,八月,焚紙樓,80722428,较差,2017-06-12,00:59:08,現實沒有蒼茫到黑白分明，就別用黑白；虛構沒有燦爛到五彩繽紛，就別用全彩。,6
0,26820836,八月,努斯,1890517,较差,2016-11-30,13:07:10,不好看！,18
0,26820836,八月,安德烈大叔,christopherlin,较差,2017-04-23,21:32:30,几乎是漫无目的地堆砌90年代时代与个体生活的符号，对国企改革真实影响的理解也非常浅，空有情怀和情绪，而无实质内涵，拍成两个小时的黑白影像意义不大，不如去看当年的真实记录影像，真是鸡肋作品。,9
0,26820836,八月,HoneyedKilled,82982606,推荐,2017-03-24,14:06:43,等了三个月的《八月》果然没让我失望，之前有太多次放映都错过了，首映这天终于看到了。果然只有对生活敏感的人才能当艺术家，用小雷的视角表达了对旧时光的怀念，非常细腻。近几年对那个时代还原得最好的电影，比《少女哪吒》《黑处有什么》好，也比《少年巴比伦》好。,5
