page_index,movie_id,title,username,user_id,rating,date,time,comment,useful_count
0,26820836,八月,SELVEN,SELVEN,还行,2017-03-26,21:14:04,68/100 “八月”是80后导演的回忆日记，它令人惊喜的还原了一代人在集体公寓群居时的众生相。和近期几部怀旧背景的影片堆砌情怀元素不同，它几乎不刻意，用精心编排过的带着焦虑感的摄影调度讲述社会巨变前人心的不安和憧憬。这样的方式与其说是一种私人化，不如说是一种不带任何野心的记录。,2
0,26820836,八月,小风一吹,little-wind,推荐,2017-08-12,14:35:46,终于到了八月可以看《八月》了，还真的拍出来北方夏天的暑气了。轮到八零后出来拍自己的童年了，有些像《童年往事》但缺些气韵。不得志的知识分子那份顾影自怜有些熟悉。没必要用黑白。,1
0,26820836,八月,姜大噪,WN-ninja,还行,2017-03-22,22:03:37,三星半，电影可叫《我12》，小磊全程旁观，生活化叙事，性和暴力是人类最初始的欲望。声音做的满了出来，处处所谓“时代的声音”像嘈杂的世界，不安静。,3
0,26820836,八月,57,also57,较差,2017-03-29,11:47:44,为什么我完全进入不了这部电影。幻灯片式的符号的怀旧。个人梦想这个切口完全是对逝去的集体生活一种曲解。反过来，想想今天的人们有多焦虑，就知道让谈论电影完全盖过转型时代的苦痛，有多轻巧和自我感动。甚至觉得黑白片的选择，不过是创作者无力把握真实在形式上的借口。,6
0,26820836,八月,岩井俊七,1815039,推荐,2016-12-05,22:32:42,男孩小雷的夏末，转型期的不安失落与强颜的期待，国企改制下岗失业，托关系走后门，宁静的时光，街坊夜里盛开的昙花，夏季最后的西瓜，里程碑意义首部分账片亡命天涯；最心动的是临别前昔日的好兄弟围着暖锅，酒酣耳热，即便没有马头琴，合唱蒙古族歌谣感伤泪下；平和的气质，浅浅的遗憾忧伤，挺有感觉,3
0,26820836,八月,U 兔,rubbitU,推荐,2016-12-09,16:24:02,比较喜欢。全片保持了一个很好的散文节奏，全景式的展现大院生活，波澜不兴潜流暗涌，没有刻意拔高或为了迎合而设置一些猛料，总体很舒服。演员演得真自然啊，台词没让人尴尬真难得。片中表现那个时代的非同步音轨翻译真是神奇，看得出迷影情怀。小演员太出彩了，蔫儿坏有可爱。勾起很多记忆。,6
0,26820836,八月,赫恩曼尼,62675594,推荐,2017-09-04,09:07:33,整部片子好像都在远远望着，演员也不“入戏”过深，疏离感始终在提醒我们：人惯于伤逝，然而回不去了。小雷和爸爸承包了所有的泪点。没有太多刺激感官的情节，但是依然很喜欢，大概是出于对那个人情味很浓的年代的想象吧。,4
0,26820836,八月,mecca,MECCA,较差,2016-12-13,08:28:06,12/05@电博 两星半。近年太多这类埋几个岁月梗讨共鸣的小清新回忆片，不知是一代电影人真的站了起来，还是行业衰败.... 或者也算一种对当下时代的逃避。是年金马奖，除了几处室外构图和摄影略出挑，只能视作制片厂遗少的强行自我解说与无用感动。,9
0,26820836,八月,董食肉,rouroudong,还行,2017-03-16,18:24:17,私人且具体,5
0,26820836,八月,艾伦不要抽筋,microzq,,2016-12-08,21:08:40,这片都能拿金马。呵呵,2
0,26820836,八月,刘浪,dyalan,较差,2017-08-09,00:33:56,太糟糕了，集体记忆的大剥削。没有人物，只有职业。往画面添完时代符号还不够，声音也要填得满满当当，而这种做法本身除了进一步强调时代性，大多没有任何意义却又无处不在（歌声与叫卖声）。八月的夏天，是新的浪潮席卷下的短暂过渡期，发生了很多事情，但又很无聊。,4
0,26820836,八月,宋不吃,NeverLate,推荐,2021-02-21,22:12:42,"1.直到蒙语的送别曲响起我才终于相信这不是一个发生在太原的故事，口音简直一样。2,所有的中国故事归根结底还是一个关于「爹」的故事，羡慕导演有这样的爹和妈。3,电影解释了在新中国审美、理想主义根本上还是属于特定审美阶层。4，虽然看哭了，但仍旧觉得金马最佳影片有点过誉，也明白了我导师说我的研究问题格局有点小是啥意思。",1
0,26820836,八月,隐,1169348,力荐,2016-10-19,20:25:22,电影展开的方式，也是我经常在脑海中回忆童年的方式。个人体验而言，日常生活往往被记忆过滤将“难忘”与“美好”存放在脑海中；这部电影则通过镜头的雕刻，将日常生活变作了一段段magic time。,8
0,26820836,八月,Clyde,chenhuayang,推荐,2016-11-30,10:05:46,1、我是在金马颁奖前看的，那时候我以为它会拿最佳新导演，但没有想到居然爆冷拿到了最佳影片。2、自传体，制片厂，九零年代，国企改制，情怀满满，其中，最特色的是制片厂这个标签，能有一个在制片厂成长的童年，何其幸运。3、黑白影像真的有必要吗？或是为了掩盖某些缺点？,2
0,26820836,八月,Hiina Kapsas,coywjs,推荐,2021-04-18,18:38:05,散文式的展开，几桩童年往事不经过高潮地流向结局，甚至没有结局。不可以去说什么，但八〇后结合自身经历仿佛能读出杂陈的五味。走街串巷的米面冰糕、磨剪子戗菜刀吆喝声，楼房平房杂居，国家单位家属区里熟口熟面的热络劲儿，再现了当年转私浪潮前的精神风貌。欧洲音乐在这样一个中国市民阶层故事中静静流淌而毫不突兀。希望有朝一日汉音乐能以这样的角色出现在电影里。,2
0,26820836,八月,愛永,aiyung,推荐,2017-04-01,12:00:15,曇花一現，方知時光珍重。,2
0,26820836,八月,云吞老丸子,mangomaluko,推荐,2017-03-24,22:50:01,从没有人说过八月什么话，夏天过去了，也不到秋天。但我望着田垄，土墙上的瓜，仍不明白生活同梦怎样的连牵。PS：勾起种种童年往事。,3
0,26820836,八月,jj73浅之,asano,推荐,2016-11-21,13:59:28,作为处女作很棒，美感和诗意都有，故事和抒情也到位。可惜今年有毕赣在前，才华上没有超越,3
0,26820836,八月,如,grbzywg,推荐,2017-03-28,21:23:10,我从来没期待过有人能把小时候家里邀请一大堆人来一起通宵看昙花一现的场景拍出来，连想都没想到过；如果不是看到这个场景，我大概已经把这段奇特的回忆忘记了,2
0,26820836,八月,what'swilliam,52286623,还行,2017-03-26,20:20:05,3.6星。1.这片子拿金马最佳略水啊。像《黑处有什么》的进化版。2.体现文艺性非得用黑白镜头么？3.碎片化散文化纪录片化但不会无趣，前提是你经历过90年代且那时你已懂事。4.非科班演员的优缺点是显而易见的。5.小人物吧，比较容易被打压，容易随波逐流，但是咋地都能活下去。,2
0,26820836,八月,四两白干,zhuzhuzhu1990,推荐,2017-03-26,15:07:59,厉害了,1
0,26820836,八月,TWY,terenceyibo,较差,2017-03-25,17:14:01,对于这样一部故事性相当之弱的生活流作品，还是非常考验导演的水平的，而本片尤其在前半段显得格外散乱拿不出重心，就如片中经常出现的那国配VHS的德尼罗一样生硬，于是在情绪上已经那些把无法产生共鸣的观众给隔离开了，虽然到了后半段好了不少，但也仅仅停留在有几场不错的戏这个层面上。,4
0,26820836,八月,文森特九六,ILWTFT,较差,2017-03-25,15:15:25,弱不禁风，山楂之味,3
0,26820836,八月,匡轶歌,rakumm,力荐,2023-01-28,16:26:00,《平原上的摩西》后劲太大了，意犹未尽的追完，立刻把《八月》扒出来看，过后几天还三不五时反刍几下。依旧感叹导演对演员的调教。好的演技，恰恰是做到“表演”的消融，“用力”就等于“多余”。中国人普罗大众日常的情感与心理表达，一向总是模糊、隐形和被极力控除的，蜷缩在言语的空白处，在遮遮掩掩的神色间，在轻描淡写的面孔下，在模棱两可、需要猜度的含糊态度里，真正的有效沟通是非常稀少的，往往淹没在繁琐无意义的生活浮沫里。而张大磊的镜头，就是还原这种被日常所淹没的东西，甚至还原这种“淹没”本身。每位演员咋就这么贴切呢。贴切到只有角色，没有了“演员”。董宝石、张晨…大小角色的诸多演员包括路人甲，在张大磊的手里个个像自然生长出来的，优秀得仿佛演技天才，连歌手出身的艾敬都合适而妥帖。十分好奇张大磊怎么办到的。,2
0,26820836,八月,Morning,qiweiming750,推荐,2017-03-25,19:03:26,很厉害。全然没有作秀的概念，人物是生长的，取视角而入题最怕就是为了情节服务。声音做得很好，掩盖了黑白的缺陷，倒是可以去掉那些多余的空镜，毕竟本身的东西已经很一气呵成了，这样技法的导演应该是什么都能拍的，他讲的是故事，并非展示一个概念。,4
0,26820836,八月,粵語殘片,EvanChouu,较差,2017-04-25,19:58:29,国企改制、工厂子弟、下海潮、企事业单位子承父业的接班制度、第一部引进大片《亡命天涯》等等，这样一个时代死气沉沉，同时又万象更新。谁也说不清楚时代的巨轮将要驶向何方。遗憾的是片中诸如此类的时代符号并没有更好地服务于故事。人物塑造也很单薄，尤其母亲一角，难以服众。隔靴搔痒式的时代读解,2
0,26820836,八月,皮蛋瘦肉粥,pidansolo,力荐,2016-10-01,22:53:26,很庆幸能在苏州艺术节能选放这部电影，看这个小男孩的八月仿如自己回到了小时候，可爱的老爸，坚强又通世故的老妈，组成了中国无数个在那个年代的家庭。真实而又温馨，叫人落泪。剧情温婉配上黑白的镜头一杯温热的黄酒，真的很想拉着那位羞涩的导演一起喝一杯呢。,6
0,26820836,八月,华盛顿樱桃树,49213881,还行,2016-10-20,00:31:13,生活的诗意和我们面前的远方，因为黑白影像都不再那么清晰。我认为黑白影像其实破坏了电影的情怀和质感，有些该绚烂或是该暗淡的瞬间，都统一的失去了颜色，也失去了味道。,2
0,26820836,八月,外外,2038558,推荐,2016-12-31,23:47:37,很难相信这么成熟流畅、老练自如的影像是出自一个30出头的导演之手，私人经验中的幽微之处准确传递，尽管并无令人叫绝之处，值得一看。,3
0,26820836,八月,綠  鴨,yujiaoji,还行,2017-03-27,20:22:57,好想要那个啄米公鸡钟哦,3
0,26820836,八月,一文字秀虎,120137624,较差,2016-10-23,12:15:24,“想法太多  线太乱  没表达清楚  一开始还以为是讲孩子的  线断了就不管了  又另起线  最后升格——献给父辈  倒是没看出来。细碎  无因无果  要做黑白就把剧情做好  反应时代感不靠故事不靠色彩就有点难看”,4
0,26820836,八月,老罗Lazzaro,lazzaro,还行,2018-02-19,23:48:56,梦幻的八月，真挚的年代，碎片化年代元素，怀旧风年代音乐。导演顺带表现出了自己的迷影情结。,1
0,26820836,八月,小楼。,4773109,还行,2017-03-27,10:42:36,片子拍的像电影散文，很多导演私人化的小情愫；但狂轰滥炸式的时代元素，稍有点儿做作轻浮，应该做些减法；很多连续大段的狂欢段落，配上音乐竟有点儿费里尼的意思，也可能我瞎，但导演思维挺好哒。现在年轻有才华的导演都在拍怀旧的、地域化的小艺术片，像某种风向，可以看到一个新的和而不同的代际。,2
0,26820836,八月,dirtyme,Tiny_Spark,还行,2017-03-28,22:25:16,作为一个八零后，的确是被一些场景细节点到了穴位，但这个节奏真的太松散太难熬了，太多既无美感也没什么意义的镜头一定就是好几秒，有这个必要吗？有这个必要吗？,1
0,26820836,八月,悠三岁,huitianyou,还行,2016-11-30,21:00:14,2.5 片段式流水账，工整也平庸。特意抓取了九十年代的符号和细节，但仅仅是堆砌而已，并不深刻更无从谈共鸣。,6
0,26820836,八月,喻鸣,mufanxuanji,还行,2017-03-23,00:44:52,也忆国企改制，刚好对应最近风靡豆瓣的贾行家一席演讲，个体记忆融入时代洪流，美好的日子总如昙花，那种特有的悠哉感无聊感也随着那个时代 一去不复返了。打破了类型期待，不错。三星半。,4
0,26820836,八月,igrɛkonze,lingyun93,还行,2017-02-22,01:09:10,满怀希望地打开却落了个尴尬的观后感 符号 全都是符号 显得刻意的地方不少 引不起半点共鸣 但在我的标准里又不至于两星这么差 不知道评审是怎么想的…,1
0,26820836,八月,超cute侠,3403686,还行,2017-03-25,23:05:48,利用黑白影像和具有年代感的物件营造怀旧氛围，最为出色的还是它的声音效果，蝉鸣狗吠极富生活气息，大大增强了九十年代质感。儿童视角还是缺乏了些童趣，旁观作用居多，并没达到时代见证的高度，这也是它虽剧情分散像侯孝贤早期作品，但精神凝聚度却又不足，优点在于情绪细节不错，有种秘而不宣的哀伤,2
0,26820836,八月,17950,chrisocean,力荐,2017-03-28,18:39:06,远超过期待，非常，非常，非常好。不管你是否经历过，都能在电影院做一场回到那个年代的夏梦。,3
0,26820836,八月,kylegun,2265138,力荐,2017-01-07,02:06:34,双截棍少年继承蹲班房的古惑仔大佬意志，棒打老师讨加分，亡命天涯富二代；当然，还有肚里掏出沙土的梦中之羊，隔壁楼的性感大姐；被出租车司机洗脑乱舞的父亲教导：不可低下高贵的头；留下一条皮带，取代了双截棍，黑白回忆也消失在父亲的彩色背影中。国企改制，厂区家属之彷徨，哭出来就舒坦了,6
0,26820836,八月,深夜声噎,sfroompp,力荐,2017-03-25,13:05:08,美。声音做得真好十分加分。小男孩的确很有灵气，想起了一一。男孩看会比较有感触吧，谢谢导演带我们回去九十年代，虽然是北方的九十年代，南方的男孩为什么也感涕零呢。大雨拍得真好看。,2
1,26820836,八月,豆友2174522,chequel7880,还行,2021-05-10,10:36:23,#柒捌捌〇看电影#看到的是体制变革下的百姓黎民，但里面熟悉的手法又让人觉得刻意且有距离感。,0
1,26820836,八月,猫变成鸦鸦,66962837,力荐,2017-03-24,11:04:01,这个我12 比那个我11好太多了 比黑出有什么也好不少  三哥的轮廓神似任航...  可以说是直扎我心了 first是不是瞎？,4
1,26820836,八月,贾小年,Joeroad,推荐,2017-04-24,13:13:29,电影发生的年代，小雷他们在那年夏天经过的事儿，简直跟印象中长我五六岁的大院儿哥哥一模一样，而那时我就是里面冒着傻气跟在后头的甲乙丙丁。,0
1,26820836,八月,猫助,Lolimio,,2017-04-09,22:37:52,百无聊赖的清贫岁月，人与人深刻的关系。,1
1,26820836,八月,朱熠,joyeejoyee,还行,2017-03-24,23:57:26,不是不好，只是看过《冬冬的假期》《一一》之后，并不会觉得有多了不起。,1
1,26820836,八月,平平无奇奇怪怪,Shahrazad,力荐,2017-03-28,13:37:09,这个电影好像一个无形的网，不知不觉就把你网住，好似一杯后劲儿十足的酒，刚喝的时候没有什么，喝完了醉得厉害，时代的氛围做的很好，非常有代入感，他们的烦恼是我们那代人都经历过的，尤其是平凡的工人子弟，每一帧画面都是满满的回忆，太亲切了，后半段一直泪流满面，整个脸都红了，想买蓝光了。,1
1,26820836,八月,一颗,heechen,推荐,2017-03-27,20:58:16,进口大片，亡命天涯，亡命天涯。,1
1,26820836,八月,苏黎世的列车,christan1987,推荐,2020-05-15,19:07:10,以孩童视角串联起九十年代下岗潮的时代记忆，全片没有一条主线，但是情感很真挚，有那么几处镜头真有侯孝贤的影子和脉络了，可惜的是，这电影跟我童年相距太远了，作为一个大山里长大的人来说，这种体制下的家庭生活实在是无法共鸣，而且我觉得父亲比儿子演得好多了，儿子似乎只是这个生活流下的旁观者，不带任何情感色彩，很中立，以为是一部童趣电影，结果是一个讲述父辈生活的电影，这点跟我的预期反差还挺大。,0
1,26820836,八月,道臣岚,51004773,还行,2020-12-09,23:32:36,补标记，记得看的时候那种共鸣感,0
1,26820836,八月,达文西,44028431,还行,2017-03-26,21:53:35,三星半。很私人化，不喜欢的就真不喜欢，自己投钱拍的片子真没必要去取悦大众。,1
1,26820836,八月,摩诃曼珠沙华,cn_panda,还行,2017-04-25,08:27:15,导演和我一样恐怕真的未必经历过这个...我们就在岸边感慨一下,0
1,26820836,八月,Eco,saluzi1987,还行,2018-01-01,19:14:05,整体太平，有意把时代背景模糊化处理，,0
1,26820836,八月,tiiiiin,tin,推荐,2017-04-29,22:36:47,像是短片拼凑起来的。,1
1,26820836,八月,假笑girl,2161666,力荐,2017-08-03,12:59:02,其实在没有分级和艺术院线的中国，在商业影院的大银幕上看着这样安静绵密的黑白电影，周围也并没有人中途退场，大家都很安静的在看。这种感觉真的比把自己放在一个小众的艺术圈子里圈起来要好多了。谁说中国的观众不懂艺术？好的电影大家都感同身受。,2
1,26820836,八月,居无间,juwujian,推荐,2017-03-24,23:58:33,从时代背景和内容上可与《钢的琴》作对照，《钢的琴》集中于父辈，重温旧日荣光；而《八月》更侧重于少年，以他的视角向父辈投以怀缅与不舍。影片由大量生活细节构成，采用了黑白摄影，这带来了一种带有距离感的诗意，也贴近于我们对于记忆的感知。之前种种相处细节，是为了假装搂上父亲的手。,3
1,26820836,八月,应许,sinkbridge,推荐,2016-10-14,22:01:51,"有距离感的摄影一度让我想起侯孝贤。
孩子和父亲都很可爱。
同样描绘时代转轨，钢的琴对铁西区进行变奏效果不凡，八月则刻意怀旧而显得闷。",2
1,26820836,八月,峰峰峰峰,58930883,较差,2017-11-06,19:48:25,那年八月，蝉一声长一声短，像裂开了点儿的散文~,0
1,26820836,八月,张翔森,zhangxiangsen,推荐,2021-03-26,03:09:22,电影是黑白的，最后转入彩色，是一个败笔，完全没必要。能够看出来导演拍摄电影的态度是端正的。通过小孩的视角讲述成人的故事。,1
1,26820836,八月,尘鸿,HeresyBreak,较差,2017-01-14,20:44:42,平淡如水，喝了一个多小时差点没把我噎死。不是把画面整成黑白就是怀旧，姜文用彩色都能拍出一百倍的年代感和深度。,2
1,26820836,八月,猫语猫寻,mymx,还行,2017-03-25,00:57:03,用道具体现时代印记，做的有些太过了，道具的存在感太强，总是把很关键的镜头放在道具身上，太过于想要体现年代感，反而失去了年代感，太过于注重共情反而失去了个性；想用孩子的眼睛去拍摄那个时代，但导演自己却总是出戏，叙述的把控上显的生涩；喜欢最后与现实和解的彩色结尾，又喜又悲,0
1,26820836,八月,游坦,Bebefore,较差,2017-06-17,11:58:48,不动声色有时行是个贬义词 你不能忽略故事的诚意 但也的确看不到  作为电影它呈现的趣味和fantasy,0
1,26820836,八月,茂树,hellomartin,推荐,2017-03-28,00:43:20,作为向老一代电影从业者的致敬之作，对国企改制、股份制过渡的经济背景进行白描，可以说是最有发言权的人在发言，邻里关系、家庭关系几乎捕捉到最细微处，跨代和解、地痞无赖，以粗砺感还原真实度，背景乐是追忆类电影中切入最自然的典型。观照精神世界的电影太少了，学一学侯孝贤和杨德昌，是极好的。,1
1,26820836,八月,阿朽,fuxiu,推荐,2017-03-25,12:49:53,选取国企改革的角度好，悄无声息的改变决定了不一样的命运。地面积水的倒影拍的很美。,0
1,26820836,八月,SingLesinger,singlesinger,推荐,2017-04-04,21:30:23,我的故事里是我的远行，以及与父亲再难重回的夏天。,1
1,26820836,八月,Q·ian·Sivan,Plumed__Serpent,还行,2017-08-17,21:34:24,"—— 被衝上岸的時光碎礫, 輕觸回溯舊日痕跡.",0
1,26820836,八月,一灯,day999818road,,2017-03-24,13:45:55,过誉,0
1,26820836,八月,梦游的鱼,mapple,还行,2017-03-25,21:06:55,感觉受台湾新浪潮影响比较大，剧情很杨德昌拍摄手法又很侯孝贤（散文化）。若让杨德昌来拍会更话唠，侯孝贤则会更纯粹简单。7分吧。看时不停想到杨德昌的牯岭街少年杀人事件和一一。上个礼拜给看完牯岭街的朋友推荐了一一，最后两部都给了五星。自己喜欢的东西也被人喜欢其实蛮开心的 ,1
1,26820836,八月,一條魚佔滿了河,BlindwolfHyn,推荐,2017-03-27,23:46:03,★★★☆寫電影易，寫生活難，相較金馬獎最佳劇情片，最佳原著劇本提名更有說服力。有些《一一》的影子，也讓人想起了《細路祥》，沒那麼經典，但是穿透銀幕而來的生活氣息卻讓人倍感舒服。不過，成也迷影情懷，敗也迷影情懷，情懷致敬太多有時候就反而失去了自己的模樣。,1
1,26820836,八月,杰诺拉泽,ivanovski,,2017-09-09,15:44:54,稚嫩。没有修辞术的怀乡病。不忍卒视。金马奖？额，。。。。,0
1,26820836,八月,第27章,tanxiaolin,还行,2017-12-30,22:06:04,金马喜欢这部片子，主要是这部片子太像台湾电影了，就是侯孝贤杨德昌那种文艺故事片。这部就是一个小城的一小段故事，比较精确地还原了那个特定年代下岗潮之中的中国人生存镜像。,0
1,26820836,八月,Joe,53997661,还行,2017-06-15,12:39:40,2017/6/14(三)18:40-21:30高雄市總圖7樓際會廳，映後導演座談，有錄了一部分Q&A，第一個發問的人問了很次腦殘的問題。,0
1,26820836,八月,干煸鸡丁,lxylxy326,还行,2017-04-13,00:03:26,裂开了点儿的散文。,1
1,26820836,八月,傅尔曼,75941536,力荐,2017-01-17,08:50:54,"黑白唯独不好的地方，是消解了炎热的感觉，但是从而得到的简洁，把画面变得很静，从而声音被烘托成了主角，就是声音勾起来很多共鸣。不认同有人说的去掉孩子电影依然成立，觉得电影就是被这3部分组合起来，孩童内心世界的游离，对外部世界的观闻，家庭环境的旁观。彼此衔接很好意境很妙。

",3
1,26820836,八月,Mumu,shawxx,推荐,2017-03-25,23:43:27,可能没有很触动，但是看得舒服。有意思的是终场，窸窸窣窣的无非“真文艺啊/画面好美/有点儿闷/略嫌做作/模仿×××……”，忽听两位老姐妹道：“……这么接地气……多像咱们以前……年轻人可能不太爱看……”哈，年上用“接地气”来形容这么一部年下眼里标准的“文艺片”，时间你又调皮了。,1
1,26820836,八月,狄飞惊,difeijing,还行,2017-04-24,16:02:04,拍部《童年往事》一样的电影一直是个人迷影的最高理想，感觉张大磊对侯导的模仿尚在得其形未得其神阶段，静淡远隔更多只是体现在调度技法上，缺少的反而是不动声色的深情，过分强调的孩子视角也如《我11》般累赘刻意，从对怀旧符合的呈现看，好像还不如王一淳敏感贴切，而这些显然更需要天赋和灵气。,1
1,26820836,八月,介意,65920647,推荐,2017-03-25,15:25:03,浮泛卻真實的場面話，情感很淡很舒服。家居生活和夢中氣氛很「四百擊」。另外，不得不說，被片場回來送信的小哥征服。,2
1,26820836,八月,旧风,karly1943,还行,2017-03-25,02:28:01,不懂为什么拿到金马奖的，虽然已经很不错，摄影，音效，镜头带着侯孝贤的影子。以孩子的视角看那个年代的风云变化，破碎而不完整的故事，镜头语言很美，老物件和背景让人沉浸很深，出了影院也没从那个夏天中出来，我们的父辈在那条道上走着走着就倒了。,1
1,26820836,八月,苏乏,maybeland,推荐,2016-07-26,17:59:13,以平实手法讲述了男孩在夏天一个月的故事，跟昨天的影片有鲜明对比，孩子的视角替代了导演或者导演在回忆他孩提时期的记忆，截取了受制于活动范围的有限空间内人物们并不完整的生活片段，平淡却深刻，旁观并自省,0
1,26820836,八月,砚小朵™,eiris,推荐,2017-06-22,01:51:36,静水深流。那年的八月，蝉一声长一声短，永不落幕的夏天。,1
1,26820836,八月,魔鬼的情诗,onlygillian,推荐,2017-03-23,11:43:27,我遥远的童年啊,0
1,26820836,八月,不长叶儿的树,der_Baum,推荐,2017-03-25,20:04:17,-人啊，不能低下他高贵的头颅！-抬着吧你！,1
1,26820836,八月,張子易,zhangziyi,推荐,2016-11-23,00:30:34,"整部片給人的感覺就是""沉穩""：鏡頭慢慢移動，人物慢慢建立，情緒悠悠出來。好幾幕家庭戲寫實得令我感動，想起自己家中的長輩故事。只是配樂做太滿，還是露了新導演的怯。金馬看到現在最舒服一場，推。",2
1,26820836,八月,Mignon松弛地,cowgirlfanny,推荐,2017-03-26,08:59:34,少年一场梦，像中西部版《一一》，克制不悲情不怨恨。有几处镜头处理亮眼。情节太散了，不知为何选择电影厂不具有普遍代表性的设定？,0
