page_index,movie_id,title,username,user_id,rating,date,time,comment,useful_count
2,26607693,敦刻尔克,乔治陈,1209836,力荐,2017-07-20,14:19:17,一方面有预料中的紧张、感动和血肉横飞。另一方面有意料之外的去繁入简、大音希声，在枪炮声里拍出了诗意。我认为是诺兰作品的新高峰，从鬼才到大师的里程碑。,10
2,26607693,敦刻尔克,握不住的灵魂,csp,推荐,2017-09-02,15:04:15,真是任性,11
2,26607693,敦刻尔克,乔峰,wankongkong,推荐,2017-09-04,14:16:43,求求你们以后打仗发明俩机器人，别再让人上战场了好吧！,6
2,26607693,敦刻尔克,vision,woshiex,推荐,2019-04-13,21:18:51,战争大逃杀，每一刻都令人窒息绝望，只有短暂的光芒推动着一切前进。打破时间线的相逢让重生显得更具有宏大的意义。,1
2,26607693,敦刻尔克,曼仔,Erman-Wei,推荐,2017-09-11,19:16:31,叙事很稳，也可以说中规中矩，但依然非常动人，情绪的细节处理得特别到位，所以还是很戳我QAQ 人道主义光芒真的太好哭了。,7
2,26607693,敦刻尔克,蝉鸣知了,neeplusky,推荐,2017-09-01,03:00:33,有细细的红线和黎巴嫩在先、战争片还能拍出什么新意和另类来、诺兰给了份你绝对舒心的诺兰式答卷、全片没有一个德军画面、开篇场面调度及人物几个逆光画面、看过1/3处都没有德军就看到盟军自己搞来搞去就会心一笑知道诺兰在玩什么了、结尾在似马利克又如上部星际穿越般手法的余韵收尾、另全片视听极佳,4
2,26607693,敦刻尔克,sarah🇺🇦,IAmSoVain,推荐,2017-07-31,19:22:08,也就那樣。。,1
2,26607693,敦刻尔克,彌張,xiyangwuxie,力荐,2017-09-12,19:34:27,后人不用再拍战争片了，比不过的，一直被汉斯季默掌控着心跳的感觉……无与伦比,2
2,26607693,敦刻尔克,很菜的蔡,26969266,,2017-07-23,22:11:16,小学学过顺叙倒叙插叙，诺兰向你展现“强行让你自己算时间轴”之瞎jb混叙,13
2,26607693,敦刻尔克,東郷柏,LordvonIberliy,还行,2017-12-06,23:07:48,7 单说片子本身是诺兰10年来最普通的一部 除了音效与多线叙事并没有太大亮点；空战与海上营救颇有看点 但竭力突出战争营造出的恐惧氛围与人在恐惧下为求生而展示出的脆弱显得过于浅显和唐突；最后的“胜利”宣言不论现实还是历史中都是不可缺少的自我安慰；古德里安和陆军们：就看空军装逼,3
2,26607693,敦刻尔克,L'automne,47974911,推荐,2017-08-07,02:25:24,情节非常简单，画面非常震撼，内底里涌动的人性让人心碎。有时候，家不是看得见就回得去的地方，而当你回不了家的时候，家为你而来。,8
2,26607693,敦刻尔克,PixelGirl,fayelee219,推荐,2017-09-02,00:39:28,配乐恐怖指数最高的梦之安魂曲终于下榜了,6
2,26607693,敦刻尔克,柏小莲,rougewell,力荐,2017-09-03,00:11:12,和《聂隐娘》一样属于那种我知道它们有问题但是更大的情绪与力量把我抓进去禁锢住动弹不得也无法喘息，我不能不为之倾倒或动容，击中我的审美点或泪点，不打高分简直就像是对我自己内心的背叛。,10
2,26607693,敦刻尔克,Mr.Hungry,Wait_decade,还行,2017-07-21,16:05:19,确实挺揪心到，除此之外真没惊艳到哪去，只感受到从军队很艰苦友军很英勇人民很配合三个角度描绘的一部爱国片，又简单又直接,10
2,26607693,敦刻尔克,Amushi,amushi,推荐,2017-12-07,10:59:53,A very good example of re/defining what is immersive.,1
2,26607693,敦刻尔克,科林,Colin_Wang,还行,2017-09-04,16:36:04,鹰击长空,3
2,26607693,敦刻尔克,null,sjzqzkn,推荐,2017-09-01,12:41:22,如果不去电影院，就不用看了。,13
2,26607693,敦刻尔克,钟螺,51984412,还行,2017-09-08,01:57:35,很不喜欢这个片，用嘣嘣嘣的音乐强行吊情绪，让我感到非常焦虑，好一似有人每隔五分钟凑过来跟你说掏钱吧老太太，真是要钱的追家来了。空战线还蛮好看的，水里捞上来掉下去捞上来掉下去就比较有完没完。而且这片子里黑头发穿军服的人太多了，根本分不清谁是谁。基本靠剪辑救命了。,8
2,26607693,敦刻尔克,冷杉,bigway,力荐,2017-08-22,16:44:22,在3D、CGI 和 VR “闪电战” 进攻下，诺兰用70mm胶片、实体特效 和 视听语言 拍了一部《敦刻尔克》，未来的胜利隐藏在其中。看的时候就觉得Sound很像 血色黑金 和 大师，猜想sound designer 可能是 Richard King，一看演职员表，果然。那为什么之前跟诺兰合作不用这个风格呢？20170816,4
2,26607693,敦刻尔克,波吃曼,bananation,力荐,2017-12-06,16:22:27,「A」错落的时空节奏给人一种妙不可言的观感，一百来分钟实在是太短了，汤老师露脸也才两三分钟。把拍宇宙片纵深广际的空间感放到了战场上，居然有奇异的化学反应。一望空寂的海面上轰隆发动机声和交响乐的变奏交杂，可以说非常具有视听审美了。最后总结的一句话惹：果然颜值高的都活到了片尾：）,2
2,26607693,敦刻尔克,RITA,RITABMW,力荐,2017-07-27,06:39:09,我以为要拍登陆 看了半天发现不对是撤退 然而哭是已经哭出来了 配乐卡司都满分 可诺兰总是让我有那么一丝莫名的遗憾,8
2,26607693,敦刻尔克,影评人 杉姐,aizai1895,力荐,2017-10-03,23:02:01,电影中每一个人物都很小，但却都能给人留下深刻印象。船上死去的小伙子、拼命逃生的法国人、最后敬礼的军官，甚至士兵归来后，英国的普通百姓都让人印象深刻。人物很多、但每一个都能让你记住，我想这就是诺兰的厉害之处。有气势、有眼泪、有掌声。,3
2,26607693,敦刻尔克,🦉像何首乌一样,llll916,力荐,2017-09-05,20:31:12,诺兰就是诺兰，拍电影游刃有余，理智知止，关照个体和细节，又能让人心潮澎湃。历史以这种形式留存，不令人厌恶。,4
2,26607693,敦刻尔克,东遇西,onegirl,较差,2017-12-06,08:57:09,一心讨好观众、一意传导普世价值的诺兰终究只能成为一名二流导演...,4
2,26607693,敦刻尔克,yihan1010,1609757,推荐,2017-09-01,23:24:18,极简主义三段式非均衡时间的故事，在结构上也能玩出与众不同的花样，摒弃了千篇一律只能倚靠大场面来吸睛的商业片模式，将视角压缩到极小格局的个体，却营造出了让恐怖片都能汗颜的临场感和紧张惊悚感，达到以小见大的效果，在这场近乎沉浸式体验的战斗、营救和逃亡中，只有生或死。（82）,2
2,26607693,敦刻尔克,Février,dianascb,力荐,2017-09-12,17:49:31,Cillian Murphy的角色問Peter，George還好嗎？Peter猶豫了兩秒，說還好。這個回答有如胸口一擊。,2
2,26607693,敦刻尔克,李阿斗,gailsylee,力荐,2017-07-21,04:40:36,诺兰表达自己的对于这场战役的切入点不同于一般的战争片，更多的侧重是求生和坚持。而我对于这段史实的空缺，造成了观影中难以有浓烈的代入感。即使，即使如此，还是被这种叙事方式和OST震撼到说不出话。这电影要有什么深刻内涵我说不出来，但是挺美的是真的，看完挺想去读相关记载也是真的。,13
2,26607693,敦刻尔克,胡如隐,92656679,推荐,2017-09-02,11:35:21,"电影弗兰兹里有一句台词：是我们这个年纪的人发动战争，却让我们的孩子们去战场送死。
主旋律果然给谁都拍不好，诺兰离艺术电影越来越远了。
",9
2,26607693,敦刻尔克,三,lsnake,较差,2017-09-02,10:41:16,虽然是有几个很煽的地方，但跟AMOL一个意思，书生少爷对战争从大到小即无知识又无理解，所以玩POV这种小聪明，人性哦关怀哦，空洞无比，导致Home都是突兀的，靠丘吉尔总结主题的结尾力量还不如半世纪前那部伦敦上空的鹰。,10
2,26607693,敦刻尔克,剑气凌厉的江南,moonflora,推荐,2017-08-17,03:52:11,看了这个片子我觉得我对英国还是很有感情的，虽然是冲着诺兰飞香港看的，一堆民用船在海上极力救援望着HOME的时候真的快要泪崩，是一种很复杂含混说不清道不明的眷恋依恋好奇憧憬向往欣慰。MURPHY木有什么发挥余地，,5
2,26607693,敦刻尔克,fro🌈t,inez,力荐,2017-07-21,13:13:42,主题本身已值五星。一部独一无二的战争片和一部独一无二的诺兰。一些对于这次电影叙事和配乐的尝试的批评也可以接受，但从细节到画面到主流价值观都还是卖得更胜一筹。#一次更深刻的brexit#,6
2,26607693,敦刻尔克,kylegun,2265138,力荐,2017-09-11,22:22:29,一周炼狱暗枪轰炸鱼雷沉船火海，一天英雄孤海崩坏白色谎言那就是家，一小时独行侠鹰击长空破釜沉舟玉石俱焚。最好和最坏的人性，第一人称写实目光，新世纪最佳战争电影,4
2,26607693,敦刻尔克,cao,caochao,推荐,2017-09-01,01:45:52,作为战争电影已经很好了，对我来说缺乏作为英国人的同情心,5
2,26607693,敦刻尔克,Carf,4340710,推荐,2017-09-02,13:55:19,人性的阴暗和光明都刻画的不错。要想活着头脑就要活络，不能别人让你下去等着就傻等，可是如果人人都如同两小伙，都内乱了。最后居然看出长征正剧的内涵，现在的撤退是为了将来的进攻，为最后的飞行员可惜。,1
2,26607693,敦刻尔克,版王,82096379,较差,2017-12-16,03:53:12,这么多跪舔诺兰狗？,8
2,26607693,敦刻尔克,核桃子,midochan,推荐,2017-09-04,22:15:06,感觉诺兰就是拿个小手枪瞄准观众精准地射出各种煽情台词，看完觉得他的红领巾越发鲜艳了。N次流泪的我还是很客观地要说音乐小点声台词再少点可以更高级。汤老师身高是谜。,3
2,26607693,敦刻尔克,Sandra J,LadySandra,推荐,2017-09-02,10:43:06,人活着就好 战争真的太残酷了 愿世界和平,1
2,26607693,敦刻尔克,康乐股长王紫菜,erin891211,推荐,2017-09-01,17:26:24,视听效果没得说，一声声枪响和大炮震得人心肝颤，到处都是狼狈和绝望。对三条不同长度的时间线并行持保留意见，好像是非常酷了，但会不会有点牺牲观感的流畅度？迫降的飞行员小伙子顶着一头高帅金发简直脱颖而出，阳光下滑翔着迎接命运的汤老师当然也是名场面。,3
2,26607693,敦刻尔克,Η²,hx2,力荐,2017-09-03,22:35:07,期待了一年多。看多数码超清，再看这部，开头觉得不清晰，但是色彩的浓烈逐渐显现，冷蓝色海滩红暖色火光，再次看到大光圈镜头下胶片夜间迷人焦外灯火同盗梦里楼顶那一幕焦外灯光，飞机滑翔落日超美。汉斯大神的配乐，紧张贯穿。多条时间线平行叙述独特，故事平凡结尾都仓促，但后劲很足。喜欢开船老头,0
2,26607693,敦刻尔克,哈哈哈哈哈哈哈,littlebeans,推荐,2017-09-03,12:07:44,说句政治不正确的话，比战狼不知道高到哪里去了,19
2,26607693,敦刻尔克,deepSong,60773482,力荐,2017-09-01,20:08:08,别人家的主旋律电影,15
2,26607693,敦刻尔克,渡口无边,particles,推荐,2017-09-03,19:26:37,压迫、冰冷、凛冽。熟悉的多维度交叉叙事去展开时间与空间，把故事做尽了减法，尝试用视听化的沉浸感去还原历史。于观众而言，是一次可以抛开思考的极简体验。它有的紧凑和压迫，几乎完全来源于铺满的音乐而非调度，太讨巧，这样可够不了大师。,5
2,26607693,敦刻尔克,喜北肉豆蔻,agina1106,力荐,2017-09-04,21:25:15,冲Cillian Murphy去的，昨天有个粉丝是这样说的：敦刻尔克的天上海里沙滩上，总能找到属于你的老公。各自心有所属进了影院，出门一对，发现记得最牢就是这批小年轻，连One Direction来跨界玩票的都演超棒。大英帝国果然盛产实力派，后生可畏,6
2,26607693,敦刻尔克,无底洞之星,idlefreddie,还行,2017-12-10,22:57:09,不吹不黑 三条线只有一条打动我 以及 配乐可以关掉吗 册!,2
2,26607693,敦刻尔克,琼斯黄,lengleng,推荐,2017-09-13,12:44:34,为什么我觉得这片子哪儿哪儿都好。啊一定是汤甜的双眼让我失去了理智。,7
2,26607693,敦刻尔克,春风绿江南,145709182,还行,2018-02-02,12:57:29,活着回家，难以置信。,4
2,26607693,敦刻尔克,CRIMSON,62665686,还行,2017-09-01,20:07:20,"-冷静地纪实也好，克制地叙事也好，但不能连故事都交代不清吧
-镜头一如既往地优秀
-人物形象扁平
-汉斯季默整耳欲聋的配乐强行推高潮
-如果不是imax杜比的视觉音响效果全片基本上没有留下什么印象
-不论是imdb烂番茄还是豆瓣知乎到处都是诺兰吹的身影
",15
2,26607693,敦刻尔克,吉吉,zhangjiji,力荐,2017-09-06,00:55:29,太绝望了，胸口像被打了一拳，深夜一个人在电影院哇的哭出来...,3
2,26607693,敦刻尔克,亲爱的猥琐猪,schlampig,推荐,2017-09-02,14:56:44,一种对胜利的定义是把人带回家，而不是带人去毁别人的家。没忍住耍小技巧，用镜头把一个冲突点分割成海陆空三线，虽然赢得一丝叙事波澜，但限制了对宏观的把控。单一色调和配乐反复让视觉横向伸展，营造血冲鼓膜的紧张感。敌“人”的消失让战争的非人性部分放大，更像救灾而非较量。,4
2,26607693,敦刻尔克,沈十六,shenshiliu,力荐,2017-09-03,17:58:45,目前为止，今年观影最佳。,8
2,26607693,敦刻尔克,sirius_flower,BillFlower,力荐,2017-07-21,10:21:36,除了季默过于煽情的音乐和过于爱国主义主旋律的结尾绝对是满分作品 可以说是西线无战事之后难得一次影像表现无事件性事件的佳作了 诺兰完全用电影的方式在imax银幕上展开了敦刻尔克的世界 一种没有希望就在沉闷中死去的无可救药之情绪 可以说远远超过激战的战争片了 小事件累加可以再降调处理,3
2,26607693,敦刻尔克,Pluto,Plutoyw,力荐,2017-09-05,00:25:22,很诺兰的地方，时间线混剪营造出悬疑氛围，最后用优美的滑翔镜头抒情。不太诺兰的地方，没有烧脑的故事情节，只有无限逼近真实的人物和状态。牛逼的技术始终是隐退在故事背后的无形存在，内容永远大于形式，不是史诗胜似史诗。,2
2,26607693,敦刻尔克,德小科,47351813,力荐,2017-09-01,23:17:44,这个时代的“主旋律”电影究竟是该歌功颂德、扬我国威还是该反思战争、反思动乱中的人性与呼唤和平。哪种更有凝聚人心的力量，诺兰给出了回答：撤退不是做逃兵，海面上飘来了无数小船的那一刻，即使民族信仰肤色不同，所有观众都能被“国家”这个概念所打动，这才是Dunkirk最高明、深刻也是伟大之处。,5
2,26607693,敦刻尔克,Singin'in rain,glorymanutd,推荐,2017-07-27,18:31:10,BFI IMAX果然名不虚传！视听效果极佳，尤其是音效，从头到尾太震了。诺兰的角度选的不错，一周，一天，一小时，这不是一部史诗战争片，而是以平实的角度来将观者带入战场，展现士兵，军官，平民的百态。个人觉得制作精良的没话说，只是多线叙事稍微有点过，而且诺兰的态度非常暧昧。,1
2,26607693,敦刻尔克,Biomass,Eversint,力荐,2017-09-04,19:13:31,为啥有人觉得平庸！,7
2,26607693,敦刻尔克,launcelot,3677383,力荐,2017-09-04,12:22:00,特别赞，特别美，故事讲的特别好。时间线没问题，只是为了把故事讲好的一个手段而已，短评里一群装x犯。,1
2,26607693,敦刻尔克,汀,parkxiahky,力荐,2017-08-06,15:15:05,“One Week. One Day. One Hour.”｜很真｜喜欢诺兰的脚本。歌颂汤老师，歌颂。｜又看到了一批英国的明日之星√,4
2,26607693,敦刻尔克,有寂,chesbasten,推荐,2017-09-01,22:33:48,试听的成功 叙事的失败,1
2,26607693,敦刻尔克,野次馬,RAKA,推荐,2017-09-04,11:11:48,完了，我对闪闪发光的金毛真是全无抵抗力。,4
2,26607693,敦刻尔克,仿真男孩哪吒,zuosan,推荐,2017-09-01,14:08:53,被剧透的命题作文。优缺点均是被音效支配太多。剪辑上多对比：船舱机舱渗水、坠机弃船、被救登岸和油尽迫降…人物百态对比，有士兵选择牺牲盟友，指挥官要留下共渡难关；有士兵选择掉头，民众选择支援前线；有人怕贪生枉死遭人唾弃，有人选择耗尽最后的燃油但不求功荣；但大多数人选择宽恕原谅和希望。,1
2,26607693,敦刻尔克,翱云,heizhenpeng,力荐,2017-09-01,21:12:16,【您看到了什么？祖国】【做得好；我们只是逃亡成功————那就足够了】,1
2,26607693,敦刻尔克,z e b u l o n,zebulon,推荐,2017-09-01,16:37:43,学好英文 练好游泳...BGM超好... 3.5...因为李安是5,6
2,26607693,敦刻尔克,路西法尔,luxifaer,推荐,2017-09-03,15:08:26,迄今为止最好的诺兰，他可以用最节制的镜头完成最大的效果营造,3
2,26607693,敦刻尔克,颜落寒,yanluohan,力荐,2017-09-08,17:34:41,无论表现的技术还是蕴藏的感情，都相当高级。全片透露着一种典型的英式的悲悯情怀。诺兰有着固执的骄傲和作为导演必须不断进阶的使命感，这是其他大多数电影人都无法比拟与企及的。IMAX画幅下的海和天空实在太美了～,1
2,26607693,敦刻尔克,Pincent,Pincent,力荐,2017-08-07,20:35:16,89/100 沉浸式的战争体验、制作精良细节丰富的冒险求生片，去奇观、去大场面、去历史观、去道德批判，甚至去戏剧化、去悬念，观众视角既是参与者又是旁观者，没有复杂的场面调度，营造压迫紧张的氛围重于叙事，线索如何交汇重于故事细节,6
2,26607693,敦刻尔克,FluorineSpark,fluorinespark,还行,2017-07-24,09:40:55,鸡肋鸡肋，食之无味，弃之可惜。,3
2,26607693,敦刻尔克,河狸,helizhanglao,力荐,2017-09-01,21:11:55,比钢锯岭更加真实的战争片，一个半小时毫无冷场，海陆空三线交叉叙述，而且时间单位不同，很诺兰！,2
2,26607693,敦刻尔克,李不贱,notbitchy,还行,2017-09-02,16:42:27,压抑到爆炸，60分钟出来想跳楼。最后30分钟捞了一下，还是缓不过来。,14
2,26607693,敦刻尔克,夜神月的猫,54998502,力荐,2017-09-02,23:42:35,最后半个钟很激动！男主就像超市结账排队，怎么讨巧都没用，唯独等来新开收银台！大面积的海、天、人和翻转倒灌的海面，加上低沉配乐，简直把人看得透不过气！导演让观众们陪着角色一起经历困境与绝望却始终留存一点希望，但只要坚持，就能等来曙光！就像最后丘吉尔说的，这是一次伟大的胜利而非逃亡！,2
2,26607693,敦刻尔克,浅。,echolee314,推荐,2018-05-07,13:09:14,满眼都是大海，至美之海，葬送之海。整部电影印象最深的是自发去救人的老船主，其他的人物都像浮光掠影，他们代表的不是自己，而是千万个像他们那样的人。,1
2,26607693,敦刻尔克,feeling,1494376,推荐,2017-08-14,16:49:44,从影迷角度看，电影语言纯熟，带入感强烈，以时间与音乐制造历史的紧张感无疑是成功的。而从普通观众体验出发，这种紧张感是不舒服的，我被压抑的情绪从始至终都未能获得彻底释放与宣泄。虽然汉斯·季默的配乐在激发紧迫节奏方面的作用更为显著，但是在舒缓情绪方面的努力却更值得欣赏。,2
2,26607693,敦刻尔克,狐狸修炼中,139060717,推荐,2017-09-04,12:53:41,战争中不仅有厮杀和战火，还有恐惧中的等待，等待死神，等待回家。战争中不仅有热血和怒吼，还有尽力而为，少一架敌机轰炸，多一艘返途舰船。战争中不仅有凯旋回朝，还有平安回家，还有力竭受俘。多一镜炫燃卖惨，少一镜全貌难观。空中一小时，海上一天，岸上一周，家就在对岸，家在向你驶来。。。,4
2,26607693,敦刻尔克,Irgendwann,ingwerstein,推荐,2017-07-27,19:43:42,"On a movie date with me in Ciné Forum, Orange, Provence.",1
2,26607693,敦刻尔克,冬季向日葵,xiangrikui,推荐,2017-09-02,23:23:40,那些没有说出来的话，没有讲出来的故事，比全部展露出来更让人伤悲。似乎是旁观者的角度，却并没有让人觉得置身事外，喘息是同频的，在想象中灾难与绝望更是无穷大。但因为是诺兰，并没有那么惊喜。窃以为整体不如《比利·林恩的中场战事》饱满，差了一点意思。,3
2,26607693,敦刻尔克,么什叫定决能不,lauraxue,还行,2017-09-02,21:40:16,战役里的众生相并不乏动人的个人之光，然而在突然转向宏大叙事之前大部分平铺直叙的时间都太清淡了太清淡了。Tom Hardy空军那条线简直就像刷了一个半小时还多的Instagram stock photo。话说汤老师的小飞机模型有卖吗？英国老毛衣和毛背心卖吗？,2
2,26607693,敦刻尔克,晓晓一,shaoyi,推荐,2017-09-02,18:57:35,果然危急时刻最能让英国人安心的还是一杯茶啊。,2
2,26607693,敦刻尔克,艾栗子,nopanic,力荐,2017-09-02,00:31:10,IMAX的大海太好看了，五颗星全给大海,5
2,26607693,敦刻尔克,逃课的日子,4233937,还行,2017-09-02,20:06:27,英国就三架飞机,12
2,26607693,敦刻尔克,mOco,mycage,推荐,2017-12-09,22:21:51,极大程度地削弱了故事性，在没有悬念的空间下靠着剪辑刻画了一场惊心动魄的大撤退。最棒的是三线的时间容度不同，巧妙地蒙太奇运用却让三者融合。,4
2,26607693,敦刻尔克,包子,travelbao,力荐,2017-09-04,23:29:49,喜欢片中对于人面对战争时巨大的不安全感的描绘，海陆空，每个地方都可以瞬间崩塌,8
2,26607693,敦刻尔克,Eve|Classified,evey42,还行,2017-09-08,16:58:46,觉得看了《老爸老妈浪漫史》三天大雪那一集的战争故事版。,4
2,26607693,敦刻尔克,lcsun,lcsun,还行,2017-09-03,18:14:32,a #brexit# film,3
2,26607693,敦刻尔克,lowai,lowai,力荐,2017-07-23,17:39:19,(1)难得没有黑人distraction(2)不很emotional赞; 没有queen & country那么明显的爱国主义(3)1 week/1 day/1 hr的叙事概念不错(4)数次离开海滩的失败尝试拍出来了很好(5)最后用士兵读报而不是播放churchill著名讲话挺意外(6)RAF到了海滩上空不合史实(7)开头传单为什么不用原版(而且真传单还是英法双语),6
2,26607693,敦刻尔克,江南开爷,hyk897573,还行,2017-09-04,15:31:46,中规中矩，没有什么跌宕起伏的故事情节也没有刻意煽情，可能历史题材的影视作品大家都知道结局，所以看的时候也没什么期待，去观看完全是因为导演是诺兰。全片全靠背景音乐带动，音乐比故事更让人紧张。隔壁一对小情侣竟然看睡着了？情侣来看这种片确实是走错片场了！,3
2,26607693,敦刻尔克,狐,ahu,推荐,2017-09-08,16:00:48,用灾难片的方式来拍战争题材，诺兰还是很有创意的。,1
2,26607693,敦刻尔克,FloriaZENG,53204045,推荐,2017-12-05,22:25:18,好过至暗时刻，但两部连着看体验感已经翻倍了。数次被大不列颠感动，即便是身处困境也有保持英国灵魂。以前觉得他们高傲，如今倒觉得这高傲中也有风骨。Btw，这三线叙事非常紧凑，有人反感音乐的铺垫？我个人倒觉得音乐和画面非常大程度增加了临场感，特别是表达溺水和船漏水时，有种可怕的窒息感。,7
2,26607693,敦刻尔克,之如,hovialy,推荐,2017-09-04,11:28:39,好得中规中矩而意料之中。,3
2,26607693,敦刻尔克,踢迩达,tildali1214,推荐,2017-07-24,17:05:38,在最写实的战争片中，诺兰玩弄的还是一个时间性的概念：一周、一天、一小时，三个维度的时间轴，最终交织在影片高潮的一个时刻。其中的Britishness更戳中英国人的泪点（尤其在Brexit之后的当下），男友看的时候偷偷抹泪半天。,4
2,26607693,敦刻尔克,mideastsptfire,overlysilly,力荐,2017-09-20,09:47:55,virtual reality without the headset 诺兰相比导演更像个pop artist了现在 因为本身是spectacle movie 几个对话多的角色/场景会显得melodramatic 大概就这一个缺点了,1
2,26607693,敦刻尔克,连城易脆,57298438,推荐,2017-09-05,08:46:48,确实充分利用IMAX厅的视听体验，尤其是飞机的轰鸣声给人带来了战争的那种压迫感，诺兰的电影基本上还是不会让人失望的，反而会意犹未尽，觉得电影有点短。只是英军习惯卖队友，诺兰作为英国人进行洗白也算人之常情吧。空战场面拍得确实不错。,7
2,26607693,敦刻尔克,糯木,35711522,力荐,2017-09-02,23:05:02,激光IMAX打卡，我喜欢。不太懂黑和吹之间的趣味。长评随后。（如果没机会写的话就剪视频嗯。）,5
2,26607693,敦刻尔克,Lisa Antipova,2968718,力荐,2017-09-07,23:39:34,觉得三条叙述线玩得没有什么意义。全程看脸（真好看啊）和衣服。脑子里想的都是苏联在二战中的损失。你们的漂亮小伙子撤回来了，苏联的年轻人可大部分都交待了。颜加一星，个人原因加一星。,3
2,26607693,敦刻尔克,ℓ,Sultenfuss1972,还行,2017-09-04,22:30:34,坐等有下载了，试试关掉声音看一遍啥感觉。结尾敷衍！！,2
