page_index,movie_id,title,username,user_id,rating,date,time,comment,useful_count
1,26607693,敦刻尔克,Helicopter,helicopter,力荐,2017-07-21,14:47:40,眼看钢锯岭这种把人当假体玩血浆游戏的神棍片被豆瓣er各种高分盛赞深刻伟大人性，就知道这部会变为（只写得出）140字逼格文的cinephile老师们的秀场。战争从不是某神某人，就是那么冷静和面目模糊，痛苦荣光都只是一瞬。IMAX 70mm代入式体验超～～棒！,5
1,26607693,敦刻尔克,dirtyme,Tiny_Spark,较差,2017-09-05,16:05:20,"多线叙事很稀奇吗？不用女演员很加分吗？汤姆哈迪不露全脸真的没人认出来吗？
谁能摸着良心告诉我这片子好在哪儿？！！",9
1,26607693,敦刻尔克,傻乐的猫,stupidcat7652,推荐,2017-09-04,21:31:37,"之于memento如同王家卫的《宗师》之于《东西》，都是对于年轻时创作的自我追溯（巧的是都是""时间""的主题。）结构玩花活从独立制作过渡到主旋律似乎有终于被认可的希望？德裔作曲得奖可能更大。",3
1,26607693,敦刻尔克,阅微草堂,jinkai719,很差,2017-09-05,03:18:57,"好的书，需要更好的读者才能品出其趣味――纳博科夫 

没有人知道百分之百的真相，真相是一个很虚的概念，只是事实加角度。

历史重要的不在于证据与资料，而在于解释权。",10
1,26607693,敦刻尔克,不流ᝰ,tuiblio,还行,2017-09-06,01:14:30,声响很大的战争mv。一些个体处境的细节还是挺好的。,5
1,26607693,敦刻尔克,油焖茄子,sxe,力荐,2017-09-01,01:43:54,"音效配乐赞到不行，从半程开始就默默流泪，听着隔壁妹子也在抽泣的声音，那种恐惧那种绝望，那种巨大的压抑感把我压得喘不过气来，看完后只想找个地方好好哭一下, 为那些所有死去的人, 也为我活在非战争期的幸运。谢谢诺兰~ 应该会二刷。",15
1,26607693,敦刻尔克,明安,61212508,推荐,2017-07-21,19:32:29,牛逼,31
1,26607693,敦刻尔克,#瞬间收藏家#,rex2xt,力荐,2017-09-03,14:41:16,"""WE SHALL NEVER SURRENDER.""感谢豆友科普，老船长原型是泰坦尼克号幸存者、一战舰长，海军上校后来阵亡在了敦刻尔克。非常克制、非常英国，就像那句下午好。滑翔想起《风沙星辰》，一个飞行在仪表数据之外还意味着浪漫主义的时代。一颗星给结尾那些可爱的普通老百姓&因为多线叙事沉了三遍的扫雷舰。",5
1,26607693,敦刻尔克,JOJOORC/Z,jojoorc,较差,2017-09-03,14:42:32,boring boring boring,8
1,26607693,敦刻尔克,宽松睡裤又如何,cheristorm,较差,2017-09-02,21:01:39,以诺兰自己为参考系打分。是诺兰最差的一部作品，乏善可陈，无聊透顶。,7
1,26607693,敦刻尔克,城南草木生,mydear1011,还行,2017-09-01,22:30:16,太吃力了。。,11
1,26607693,敦刻尔克,殇潮|Enigma,freddy_xu,,2017-07-21,19:17:13,前庭功能不好的或是有焦慮症的慎重選擇觀看。前半段鏡頭晃得午飯都快翻出來了…其实这部在整体观感上很接近Gravity，都是形式远大于内容的。前半段一股脑想完全感官轰炸，以这个架势下去其实1小时20分钟左右的片长最合适，完全不需要提到撤退的后方，但导演到了半途又好像有些犹豫想人文拯救下。,11
1,26607693,敦刻尔克,Leon Winters W,adakenndy,推荐,2017-09-02,00:16:32,不像电影更像纪录片，没有宏伟的战争，也没有刻意的煽情，感觉只有无尽的压抑和求生。诺神还是一如既往的高水准！给四星原因是IMAX2D真的好晕呀！快看吐了！诺兰你治好了我多年的晕飞机,9
1,26607693,敦刻尔克,古德达,LSDRauz,推荐,2017-09-01,17:08:58,配乐有些过了,10
1,26607693,敦刻尔克,西北偏北,47563229,还行,2017-07-18,09:19:09,awwww 可能上完班好累 中间一度睡着…一直打打打轰轰轰 背景音乐没有怎么停过 搞得人好紧张 时不时突然来几发子弹 幼小的心灵受到了伤害…幸好还有好几个帅哥 默默欣赏颜值 画面音效都很棒 感觉没什么高潮 整个像个纪录片…到最后真是就盼望着快点演完我要回去吃东西！@amc试映会,25
1,26607693,敦刻尔克,Q。,airan712,推荐,2017-09-01,12:01:27,电影从不一样的视角解读二战中的历史大事件，三个时间片段被拉扯交织，绝对是此类题材的上乘之作。配乐从始至终牵动人心，时而冰冷时而温暖，时而沮丧时而昂扬。★★★★,12
1,26607693,敦刻尔克,刀叢中的小詩,fengxifengxi,还行,2017-09-01,23:12:18,一週，一天，一小時；三條線，每條線三個人，三三得九。九為老陽，故此篇與女人無關。《易·乾》：「用九，見群龍無首，吉」；王弼注：「九，天之德也」；高亨注：「依古筮法，用九猶通九，謂六爻皆九也。見亦读为現。爻辞言：群龍現于天空，其頭被雲遮住。众人俱得志而飛騰，自为吉」，結局亦暢矣。,13
1,26607693,敦刻尔克,秋色波连波,qiusebolianbo,推荐,2017-09-13,21:58:11,三星半。我们猜测是剧组经费少，海滩才这么空。,9
1,26607693,敦刻尔克,吴松张,wusiyi,力荐,2017-09-02,01:01:20,我一直不相信一场撤退是值得赞颂的，但拼命活着就是伟大。谢谢诺兰。建议用《他们最好的》的相同故事不同视角来中和《敦刻尔克》带来的不适。,5
1,26607693,敦刻尔克,临时昵称,snowbusy,推荐,2017-09-01,22:38:02,音乐不停轰、人不断死、气氛不断窒息，就是不讲故事，诺神好自信，拍了一部纯官能感的电影。但我还挺喜欢的，战争片极端点比中庸好。另外感觉本片参考了《自己去看》和《孟菲斯美女号》,8
1,26607693,敦刻尔克,井戒,draco1892,力荐,2017-07-26,19:16:55,所有爱都献给汤姆 哈迪老师！其他人都撤退，只有他飞向敦刻尔克。全程只露眼，最后摘下面罩逆光下的汤老湿太好看了！配乐轰炸，全程沉浸式。170901二刷继续实力表白飞行二人组Tom Hardy & Jack Lowden,9
1,26607693,敦刻尔克,T.V.Zoe ி,T.V.Zoe,推荐,2017-09-02,00:06:11,讲真颜值高到我有分神 出来一个小哥就想一次卧槽好帅……没啥花样 配乐满到窒息 也符合这种压迫感 反战 清晰 没煽到我 但诺兰还真是喜欢悄咪咪的讲感情,10
1,26607693,敦刻尔克,周小凡,73742393,力荐,2017-09-01,22:33:59,喜欢的人会很喜欢。不喜欢的人会很不喜欢。,17
1,26607693,敦刻尔克,小烨,3984361,力荐,2017-09-01,22:16:18,没想到啊，挨过了海边的曼彻斯特，却栽在了敦刻尔克上面，又丧又温柔。太温柔了，看到了人性的光辉，特别喜欢他们成功撤退之后，火车站边上的老爷爷说“做得好”，主角说“我们只是逃生而已”，老爷爷回“这就足够了”。太温柔啦，喜欢喜欢，要二刷。,10
1,26607693,敦刻尔克,曳尾.avi,Daseingang-chen,力荐,2017-09-04,01:24:45,瞬间明白了为什么以前妹子都想嫁给飞行员,10
1,26607693,敦刻尔克,坚定躺平的锡兵,Stewart,力荐,2017-09-02,20:04:15,空中线耍帅，海滩线卖惨，民船线进入战场的时间最短，却贡献了最丰富的人性。乔治重伤时的告白，彼得两次截然相反的回答，都于细处感人。,7
1,26607693,敦刻尔克,邓若虚,ruoxudeng,力荐,2017-09-03,20:58:10,遇到一个故事，组织素材，研究一个公式出来，恣意选择最符合这公式特性的段落，调动一切线索或者想象将它阐释完整，并且让它在更广泛的微妙场景和情绪里同样适用。这简直是世界上最幸福的工作。这是《敦刻尔克》令人羡慕的地方。真好，诺兰可以越来越任性了，但对他来说，这种任性已经没有太大的风险。,13
1,26607693,敦刻尔克,fateface,4187023,力荐,2017-09-26,18:27:12,好看！把主旋律电影拍得那么惊心动魄，简直不能更赞了。,6
1,26607693,敦刻尔克,天下第一郭,glaciergr,力荐,2017-09-01,12:13:15,你还是诺兰牛啊！,24
1,26607693,敦刻尔克,萤木C,cazze,推荐,2017-09-02,13:16:13,结构玩得真厉害！时间线三合一和结尾的滑翔很棒！不是主流大片的叙事风格，重点在营造那种氛围，所以给一般观众的观感会不太一样,8
1,26607693,敦刻尔克,陈哈,weiwu,推荐,2017-09-01,19:02:59,在影院看过导演四部片，非要排喜爱程度的话，《星际穿越》，《敦刻尔克》《盗梦空间》并列，《蝙蝠侠：黑暗骑士崛起 》。撤退的士兵，空军三人组，来救援的群众三条故事线安排得当，讲述清晰。被很多人诟病的音乐太满，对我个人而言，挺好的，很享受。汤老师演一个牛逼飞行员，最后才露了下全脸。,14
1,26607693,敦刻尔克,余小岛,missixyujun,推荐,2017-09-05,13:31:53,海陆空三个视角，一周一天一小时三条时间线，从三个不同的视角看了三件事。从效果来说，这其实相当于讲了九个不同的事件。通过这样的手段把整个大撤退的宏大、复杂、混乱在有限的画面和时间内展现出来，非常成功，远比直接拍摄战场更加贴切。就凭这一点，对时间的理解，诺兰足以成为当代大师。,6
1,26607693,敦刻尔克,方悄悄,1783224,力荐,2017-09-10,14:01:38,就的确很好看，想不出不好看的理由。,13
1,26607693,敦刻尔克,路人Eita,wind_field,力荐,2017-09-02,01:44:51,面对战争这个宏大题材，克制而精致地观察，陈述，理解人性。更不必说精确得如同咬合齿轮的三条时间线。即便察觉被诺兰和汉斯季默精准地带向每一个情绪点，也心甘情愿。,8
1,26607693,敦刻尔克,寓目,46037668,推荐,2017-09-01,21:51:12,紧张的吃爆米花……紧张的吃爆米花……紧张的吃爆米花……紧张的吃爆米花……（累死了）……紧张的吃爆米花……呼………轻松的吃爆米花…大师就是大师……,20
1,26607693,敦刻尔克,39度风,45878950,力荐,2017-09-02,18:07:46,当你想哭的时候，你看见的是人性不是党国的旗帜。,16
1,26607693,敦刻尔克,甚小望远镜,Xuanguangge,还行,2017-09-01,18:03:31,下面请看一组联播快讯：大型资本主义核心价值观教育实践文献政论片《敦刻尔克》日前公映，该片根据历史事件拍摄，真实再现了英法联军历经两万五千里长征、成功抵达陕北革命根据地的壮阔史诗，讴歌了皇军将士不畏艰险、不怕牺牲、排除万难、夺取胜利的大无畏精神和革命英雄主义情怀。,17
1,26607693,敦刻尔克,小米=qdmimi,qdmimi19810920,推荐,2017-12-12,01:35:07,难于评价。感觉满是导演的自信和挑衅。他挑衅的不是普通观众的审美，而是挂载了各种百科知识后穷尽心力博取眼球的所谓专业影评人：“他怎么敢这样，他真的那样了，我得冷嘲热讽几句蹭蹭关注去！”,7
1,26607693,敦刻尔克,俺困,heyt,力荐,2017-09-01,21:50:11,对于二战迷来说，可以说是非常好看了，诺兰棒。,11
1,26607693,敦刻尔克,罗套套,rodinrodin,推荐,2017-07-24,07:44:56,整个观影就仿佛在玩单机角色扮演类战争主题惊悚游戏。有三个主角群和故事线可选，三个场景与任务可选。跟着所选角色一秒进入剧情，背景介绍没时间讲给你了你要通过发现道具自己感受。一旦开始走剧情，主视角就是你操作的角色视角（角色能看见什么你能看见什么，一点多的都看不到）。,11
1,26607693,敦刻尔克,Favillae,williampitt,推荐,2017-09-01,14:20:58,调侃版：汤老湿真乃皇家空军模范员工，一小时内承包了一周的Jerry，不管开轰炸机的还是开战斗机的。认真版：无论如何一小时打五机都太惊悚了。。。,9
1,26607693,敦刻尔克,JulyChan,JulyChan,力荐,2017-07-30,08:39:13,就着泰文字幕生咽，视听语言的震撼超越了情节，反正故事本身也是张明牌。尤其蜂鸣一般的BGM，仿佛希区柯克颠过来又倒过去。诺兰大神最爱的时间线不再烧脑打结，而是抚梳了大背景下的个体命运，给历史提供了一个平易近人的视角。没期待中精彩，但这部电影标志着他从“明星”向“导演”转变。,6
1,26607693,敦刻尔克,猫牙牙,44820713,很差,2017-08-31,18:15:37,敦刻尔克大逃跑，丢下法国盟友自己溜了,12
1,26607693,敦刻尔克,固力果guriko,tira7misu,推荐,2017-09-06,12:07:52,没有主角，都是英雄,12
1,26607693,敦刻尔克,恶魔奶爸Sam,Q598176297,很差,2018-02-23,12:03:51,沉闷的要死,7
1,26607693,敦刻尔克,biu~小太阳汪,52046119,较差,2017-09-02,20:09:53,我只想说什么鬼。。。欣赏不来这种片子，被这么多点赞的人给骗了，还以为是什么超精彩的,16
1,26607693,敦刻尔克,刘康康,46843344,,2017-09-10,01:00:35,完全没看懂这三条时间线的推进关系，不打分了。谁跟我解释解释？那条船怎么就是一天？飞机怎么就是一小时？,9
1,26607693,敦刻尔克,绿酱（买卡车,greensylviaq,推荐,2017-07-24,22:00:48,拍摄手法很好，很主旋律！看的时候后面俩人一有战斗机接近就开始在塑料袋里掏东西吃，咔嚓咔嚓的，搞得我差点说，哇，真的是牛，这音效都是4D的！,9
1,26607693,敦刻尔克,十一,162437187,力荐,2017-09-03,01:45:19,想宰了敦刻尔克的音乐负责人。,11
1,26607693,敦刻尔克,传奇☂,annabel828,推荐,2017-09-03,19:47:22,2017-9-2 什么样的男人是好男人？就是生活背叛了他，他遭到极大的打击和挫败之后，还能保有勇气，还能安慰其它被误解之人，还会对口吐愚蠢之言的人宽厚相待。,7
1,26607693,敦刻尔克,顾盼,171272098,推荐,2018-05-05,08:37:52,诺兰厉害。,5
1,26607693,敦刻尔克,风雨骑老师,windrainride,力荐,2017-09-02,22:00:59,诺兰水准回归之作，质量远超平庸的黑骑士崛起以及胡说八道的星穿。谁说战争题材就一定要宏大叙事？镜头即上帝，把英国士兵草芥般的命运打乱、剪断，前方一切未可知；英军没有冷锋，四十万人蜷缩在海滩上瑟瑟发抖，斗志全无，然而归乡列车的啤酒，就是对爱国主义最好的诠释。配乐融入故事极棒，年度十佳,8
1,26607693,敦刻尔克,峰峰峰峰,58930883,还行,2018-01-26,10:34:24,空中线耍帅，海滩线卖惨，大家坚持住，等着曙光来,4
1,26607693,敦刻尔克,大胃⃣麒⃣,Davidchili,还行,2017-09-02,12:45:17,实验这个万能幌子究竟是他老自己吹的还是各位不分青红皂白给他扣上的？,10
1,26607693,敦刻尔克,Die Katze,maynepaddy,还行,2017-08-16,13:36:19,托诺阑的福，可以买到精密复制的飞行靴了。。,11
1,26607693,敦刻尔克,熊阿姨,auntbear,推荐,2017-08-16,19:23:44,得再看第二遍，时间线看乱了。,14
1,26607693,敦刻尔克,寶麗金時代,41115422,较差,2017-09-02,16:04:47,都不如李安的中场战事。。,15
1,26607693,敦刻尔克,tata,tata0820,推荐,2017-09-04,09:31:26,海陆空三线穿插，没有女主角 没有明星脸的艺术战争片，汤老湿全片燃点，硬是把一个大家都知道的真实历史故事拍的充满紧张感，不容易……有的戏还是略显刻意和重复自我，五星是打不上去了，诺兰之前的院线片我都会3刷甚至5刷，这次没有二刷的念头了，不过诺兰依旧是好莱坞同代导演中最强的无疑,6
1,26607693,敦刻尔克,🌞娘卷卷🌙,zeroqq,力荐,2018-03-31,16:23:38,特别喜欢，即便是诺兰。看了花絮觉得了不起。,5
1,26607693,敦刻尔克,猫司令,Queenie.Emika,推荐,2017-07-24,04:39:22,配乐立了大功。比预期中的看起来要舒服，所谓的宏观叙事也不算是毫无人物。大撤退场面远不如第一次看《赎罪》时震撼。整体感觉是一部拍得很好的，有想法的好莱坞大片。,9
1,26607693,敦刻尔克,思路乐,153112416,力荐,2017-09-02,21:59:35,"【A+】目前年度最佳音效、配乐、场面调度和摄影。尤其是摄影，当飞行员空战时那副海天相接的画面出现在我眼前时，实在是太美了，美得我想哭、想跪、想当场给诺兰磕三个头。我当时怎么就控制住自己了呢？！
2020.1.5，重看，确实是诺兰最佳。前一小时按照“陆海空”的反复顺序叙事，通过三线巧妙的剪辑排序和时长分配，突出时间密度的差异。直到57分05秒，顺序突变为“陆空海”，三线正式开始交集，以海上那条线作为主轴，在极致的氛围营造中有序收回“陆空”线，这是属于诺兰视听和叙事层面的集大成之作。",8
1,26607693,敦刻尔克,伊苏林迪夜光蟲,robin83,力荐,2017-07-19,20:18:54,70毫米胶片刷完，大部分都是imax胶片，画质很胶片，故事角度和节奏控制很诺兰，这次音效设计特别牛逼，好像弹壳弹在脸上，并且汉斯季莫玩起简约风格，制作完全可以当做dark ambient来听，放个电影搞这么大排场，目前就诺兰了。,17
1,26607693,敦刻尔克,翠西 。o 0 O,Tracie,力荐,2017-09-02,11:44:58,第一次“体验”到什么是战争 枯燥的刺激 亢奋的麻木 无聊的恐怖…没有热血和热泪 一切都像尸体般冰冷 诺兰是一个想让世界变得更好的人 非常感动,10
1,26607693,敦刻尔克,执麦者,zhimaizhe,力荐,2017-09-02,23:01:27,胜利属于全世界，但是英雄却未必被我们铭记。,16
1,26607693,敦刻尔克,梅花牛,1910834,力荐,2017-09-05,21:55:18,要是我不晕飞机也不恐高的话，我也想当一个拉风的飞行员。,11
1,26607693,敦刻尔克,Amino,lostinfire,推荐,2017-07-21,08:50:14,战争片能剪出花儿也是服气。意识到这点的那一刹那，才醒悟到海滩上的士兵，船上的渔民，飞机里的汤老师，只是彼此的世界线在某个角度看恰巧重合了那么一瞬间，其实只是各做各的选择，各过个的生活。,11
1,26607693,敦刻尔克,綠  鴨,yujiaoji,推荐,2017-09-04,22:03:44,哭了好几回,5
1,26607693,敦刻尔克,杨大壹,shamankingygz,推荐,2017-07-26,13:43:06,彻彻底底的战争题材，算不算年度神片还是要看个人口味，比如我们边上一对大爷大妈看半截儿就走了。但必须肯定的是，多线叙事，节奏剧情，摄影音乐都汇成一句话，不愧是诺兰。,10
1,26607693,敦刻尔克,雪·法妮奥,trininottrinity,力荐,2017-09-08,14:28:31,飞行员打爆自己的座机从容被俘看得哭了算不算泪点低？,10
1,26607693,敦刻尔克,顆粒 Kori Song,kori,力荐,2017-07-20,22:05:49,配樂真的是絕了！一整年就這片可以打個五星了。,10
1,26607693,敦刻尔克,战将波舰金,fotox,很差,2017-08-16,05:55:50,夏梦一场。,6
1,26607693,敦刻尔克,Sabrina,15401327,力荐,2017-09-03,22:22:44,1. 我觉得那种三条线的提法，一小时，一天，一周，海陆空什么的，完全没有必要，非常影响观看，我一开始就避免被框住，看起来一点都不费劲儿呀。2. 特意去看了本城最好的效果，可是好像画面比较高，宽度没有出来，音乐完全推动情节，说诺兰受默片影响，我是赞同的。3。战争片是反思战争，不是热血动员,2
1,26607693,敦刻尔克,猫语猫寻,mymx,力荐,2017-08-06,00:09:20,突破叙事格式，突破战争片套路，很克制，英国人看了应该会很骄傲吧，这不是普通的诺兰，这是想要反应真实战场的诺兰，唉，拒看战争片的我还是忍不住看了，感动。,12
1,26607693,敦刻尔克,摩西不夜奔,imagefly,力荐,2017-09-03,11:04:53,神作，诺兰又让我感受到了久违的电影的巨大的美好。,11
1,26607693,敦刻尔克,朱熠,joyeejoyee,力荐,2017-09-02,00:55:49,我家诺兰就是有这个本事，一个两句话就能讲完的故事，愣是拍成了年度最佳,5
1,26607693,敦刻尔克,墓岛GRAVELAND,DukeMexican,力荐,2017-09-01,16:57:27,诺兰将战争片处理得与灾难片同质。德军在全片中没有实在地出现，他们有意与摄影机保持距离，或与外部世界同属“他者”。就这样《敦》在神秘而紧张的107分钟内构建了极简化的多线程叙事。甚至是一部“去风格化”的实验性作品。对白与结构被弱化。民族主义的政治性对抗悄然转化为个人—他者对立模式。,4
1,26607693,敦刻尔克,兔安叽,gegemoon,推荐,2017-09-02,19:14:18,优点很突出：人性的复杂，战争的惨烈，演员的表演。缺点同样明显：剪辑太烦了。诺兰似乎不知道怎么“好好”讲故事了，切得过碎的时间线和重复剪辑显得他对故事本身和观众的智商都没信心。如何讲好一个大家都知道结局的故事，应该和东木学学。但比起星际穿越，至少短了，还是多给一星吧。,11
1,26607693,敦刻尔克,撕撕撕,luka90123,,2017-09-05,15:52:32,前半部确实没有那种一贯的迎合观众，敬你是哥。只能说感谢诺兰李安这挂适合做教材的“标准电影”，在我做学生时一定程度上不设门槛地帮助了我去学习视听语言。但也是那个需要用电影对抗孤独等等的一开头，我学电影的目的并不为了做一个优等生。所以大概也只能像尊敬袁隆平钱学森一样尊敬诺兰了（认真的,10
1,26607693,敦刻尔克,小小鱼,ChalmersC,还行,2017-08-17,05:34:24,敦刻尔克+诺兰这样的组合一眼看上去就已经噱头十足了，可能正因为如此才导致期望过高失望过大吧。全片感觉是情节不够配乐来凑，看出冲奥野心想拍学院派却又无法放弃观众市场，拍得跟个四不像似的，音效太吵想睡到结束都无法 PS：很多诺兰NC粉和国内观众是压根还没看就在那好评吧,12
1,26607693,敦刻尔克,乔小囧,ourorz,力荐,2017-09-02,20:56:55,看完《敦刻尔克》，怀着无比激动的心情，打不着车。但我相信，我一定可以回到家的。 回到祖国。,11
1,26607693,敦刻尔克,黄小米,millettellim,推荐,2017-07-30,11:14:38,看时爽（因为hardy和rylance），看后毫无回味，诺兰没有这个德国配乐，还能行吗？,8
1,26607693,敦刻尔克,木一,siguryx,推荐,2017-09-03,21:22:07,诺兰到了这个档次诚然硬件都是最高配置，或许为了跻身伟大导演的行列，他也转向了战争大场面下人性刻画的题材，但无论是群像还是时间线还是求生意志的描绘都不突出，只是精致而已。最优秀的是他对“未知恐惧”的刻画，在HZ加持的音效下勾勒出了人类对命运的慌乱，略微跳脱了类型套路，仅此。,6
1,26607693,敦刻尔克,is4dog,is4dog,还行,2017-09-06,00:23:18,音乐好，碎片化的叙事完成了，画面壮美，剧本工整。诺大刚的一九四二一样的野心。情绪煽动性真够强，看得胸口闷，有个哥们跳海死了我一口恶气才跟着发泄出去了，才缓过来。,3
1,26607693,敦刻尔克,没有枪的牛仔,q962265267,力荐,2017-09-01,18:44:23,如果说这部电影80分的话，那么配乐将直接占到50分，它不可思议的将紧张的气氛在三条时间线内完美衔接，“看不到的敌人”被塑造得很成功。这离不开诺兰对节奏和镜头的把控。他不给你感动，不是让你去思考，他让你完全沉浸其中，你就是士兵中的一员，恐惧，满身伤痕，无所适从。而感同身受胜于一切。,5
1,26607693,敦刻尔克,Jorji Costava,alexiusplusplus,还行,2017-08-06,08:43:21,"cinematography真的没有话讲, 但是诺兰好像非常自恋于自己把挺好的故事讲得支离破碎的style. 有些电影是个迷, 观影的趣味在于琢磨导演的设计本身, 但是这不是那样的电影, 我一点也不想在心系撤退士兵的同时还要去问自己这是一周前, 一天前, 还是一小时前的事情.",2
1,26607693,敦刻尔克,t0psh1t,YthguaN,推荐,2017-07-25,13:33:32,个人英雄主义和群众路线的完美结合？,5
1,26607693,敦刻尔克,Medea,medea191112,还行,2017-09-01,11:53:06,我一边在幻想胶片该有多美，一边怅叹剪辑多么平淡。这不是刻意去戏剧化可以推托的，是叙事上的懒惰，用音乐来凑，是对于观众智商的不信任，用浅显台词来提点。,6
1,26607693,敦刻尔克,伪淡定小姐,some_Ji,力荐,2017-07-20,23:40:52,没有刻意但是太煽情了（褒义），明明不可能感同身受却哭花我一张老脸。为再一次没怎么露出下半张脸的老湿疯狂打call。诺兰真棒。寂寞大师真棒。音效真的绝了，坐在杜比IMAX厅里看得心颤，到最后几分钟才敢舒展开眉头。一百分。,15
1,26607693,敦刻尔克,季轩,3588917,推荐,2017-09-01,03:22:40,我佩服这部片子的勇气和对电影语言的探索，比我们的电影，走的太远了。但我个人不是太喜欢这部片子。我不知道在战争之中，头顶上有敌机飞来会是什么感觉，但此片的强烈的声效，某种程度上给人一种想象真实的机会。总的来说，片长太短，故事太弱，剪辑过快，场面不足，音乐太多。,5
1,26607693,敦刻尔克,The 星星,brokenjade,还行,2017-09-02,16:45:56,就算说诺兰卧室里贴满了汤老师裸照我都信。11跟他比差远了。,3
1,26607693,敦刻尔克,Don't Panic!,fastkill,推荐,2017-12-11,09:04:07,放弃人海战术而选择以点带面，从第一分钟就刻意营造压抑令人窒息的氛围告诉观众这不是一部打鸡血的常规战争片，对手全程隐形但又无处不在更令人恐惧，音效压迫性十足，没有看大银幕实在遗憾。,1
