page_index,movie_id,title,username,user_id,rating,date,time,comment,useful_count
1,26907450,麻烦家族,傻Ｂ骆驼,j23ju,还行,2017-07-03,00:38:42,生活哦，就是这样淡淡喜小小伤大大闹。人都是群居动物，能顾忌他人感受尤其是自己所爱之人最为重要啊。其实黄磊导得还可以呀，演员大多都很出彩。评分有点低了,0
1,26907450,麻烦家族,毒手,haywire,推荐,2017-07-01,17:29:40,如果没看过原版的，其实可以更高一点。老爷子进医院的时候，这边开始讨论追思会有点不合理。别的还都挺好的。,0
1,26907450,麻烦家族,楠汐,81513076,还行,2018-07-28,14:29:34,平平淡淡才是真，平淡中也要铭记感恩。,1
1,26907450,麻烦家族,格兰菲迪,138539376,还行,2017-10-08,18:15:25,前四十分钟比较好看  后半截节奏好慢？,0
1,26907450,麻烦家族,儇舞天下,zoesun,还行,2017-07-02,23:28:27,星星给李立群老师。。。。,0
1,26907450,麻烦家族,Monsieur Mao,43426398,推荐,2017-05-03,17:01:23,看的校园点映，基本上沿袭了山田洋次导演的精髓，落地和本土化做得尤其好，笑点也不俗。比较适合和家人一起去看。,21
1,26907450,麻烦家族,安狄,feandy,较差,2017-05-23,10:59:24,立不住，电视剧糟粕集合体。,1
1,26907450,麻烦家族,伊心,187677892,还行,2022-08-21,20:02:49,虽然是照搬的原版，但也还不错，就是演员选的太像电视剧精编版了，我是支持妈妈离婚过自己的新生活的，王迅海清这对欢喜冤家演的还挺般配的。,0
1,26907450,麻烦家族,初犬,chuquan,较差,2017-07-23,20:25:47,在国产电影里算是可以看的作品但是原著太过于优秀改编的又不走心也不贴近本土生活大家挑毛病给差评也正常。,0
1,26907450,麻烦家族,DarkMoon,79913220,较差,2018-08-03,21:29:34,"还是喜欢黄磊老师做饭 
一个加长版的家庭剧集",1
1,26907450,麻烦家族,镜子,4685277,还行,2017-05-12,11:01:06,14.05.17@cinema,0
1,26907450,麻烦家族,春垓,horadric,很差,2017-05-16,15:12:50,黄老师为啥要如此作贱自己呢，拍人家剩的，还不用心。,1
1,26907450,麻烦家族,阿瞒冲起来,caocaoa,很差,2017-07-08,00:18:02,那么好的菜给黄磊弄砸了,0
1,26907450,麻烦家族,这届我选东莞仔,51868250,很差,2017-05-11,13:12:41,电影拍成了情景剧…,3
1,26907450,麻烦家族,33米兰,79879080,较差,2017-09-25,21:04:07,海清和王迅不错，最大的问题是黄磊，剧本没问题，但太不符合实际了吧老爸急救了不开车打车跟着还在家扯淡，我都想进去抽他们，这帮傻逼还拍亲情片2017 9 25,0
1,26907450,麻烦家族,狮子青铜,privatebronze,很差,2019-03-06,14:43:55,只有李立群一位台灣演員在努力工作。,0
1,26907450,麻烦家族,格蕾曦的艾爾西,bselsie,较差,2017-07-29,17:11:49,黄磊还是别做导演了,0
1,26907450,麻烦家族,lesley,carmen8212,还行,2017-07-30,21:47:21,还挺有感触，三代人的婚姻生活，一辈子都在磨合，忍让对方。不过片子冲突感和转折点太弱，剪片也有点乱。,0
1,26907450,麻烦家族,B,tsebb,很差,2017-05-29,00:20:02,摄影差到令人发指，笑点尴尬。真的怀疑结婚生子后人个性巨变。看看现在的黄老师也就是上上综艺了。白瞎了李立群。,2
1,26907450,麻烦家族,阿菲猫猫,efeimaomao,还行,2017-07-06,00:38:59,其实这部电影要说的事情很典型，但是烂尾了。,0
1,26907450,麻烦家族,白眉鹰王,76236773,,2021-02-27,12:00:41,我直接去看老山田的原版难道不好吗？,0
1,26907450,麻烦家族,天涯.........,127225715,很差,2017-07-26,21:06:13,不如三流电视剧，李立群这么好的演员，被糟蹋成这样。,0
1,26907450,麻烦家族,安神补脑meng,beckyvsbecky,较差,2018-01-06,06:30:59,果然看不下去。。。。。。不过也许可以推荐给长辈。。。,0
1,26907450,麻烦家族,我老了怎么办,kevin13L,还行,2017-10-03,15:52:44,还行,0
1,26907450,麻烦家族,赵伯鼠zFy,zhaofuyuworld,还行,2017-07-11,10:44:47,黄磊的幽默感总让人出戏。不自然。但是温情的部分还不错，可惜也不自然。。。闫妮身材真好，比武林外传时年轻太多了。,0
1,26907450,麻烦家族,鸟倦知还,131849470,较差,2017-06-30,21:33:50,电影本身不难看，只是对原版的复制粘贴有点难堪。,0
1,26907450,麻烦家族,peeman,65154403,较差,2020-10-08,18:52:42,枯燥无味，几乎没有起伏和感情波动的影片。,0
1,26907450,麻烦家族,依萍暴富了吗,131023951,力荐,2017-05-11,14:02:48,二女儿和二女婿的婚姻正在经历七年之痒，各种不信任、不满意瞬间会引发连翻吐槽和埋怨，甚至升级为争吵和打闹。尽管他们没离婚，但是离婚已经被提过无数次。我觉得在电影的故事结束后用不了几年，他们俩就得分。,15
1,26907450,麻烦家族,乖沙皮,30219531,还行,2017-10-12,09:04:55,20171011 有点加长版广告的意思，各种可乐，外卖。。。,0
1,26907450,麻烦家族,胡二,hulangbaiyue,较差,2017-06-29,23:37:47,基本上就是照搬了，本土化的设计约等于没有；演员表演也是尴尬，好几个都是演技派啊。。。哎完全不懂翻拍的意义在哪里,0
1,26907450,麻烦家族,妮妮,153855002,力荐,2017-05-11,15:27:20,救护车上的何老师和小岳岳，你们确定是来救人不是来搞笑的？,6
1,26907450,麻烦家族,Duolake Yin,153854497,力荐,2017-05-11,15:08:45,孙莉饰演的家庭主妇真的是极品了，做事尽其可能的周到，但是即便这样，还是会有这样那样的不是和无奈。。。,10
1,26907450,麻烦家族,alice,38988172,很差,2017-05-16,16:25:43,佟掌柜身材真好,2
1,26907450,麻烦家族,井谷射鲋,venser,推荐,2018-12-30,08:07:49,快餐式电影。起码和老婆一起看过，笑过，感动过。,0
1,26907450,麻烦家族,童非童,Torence,很差,2019-05-26,23:25:56,其实有几个点本来是可以很触动的，但拍成了一锅粥似得家庭伦理片,0
1,26907450,麻烦家族,大志的小耳朵,139611792,还行,2017-07-01,22:24:37,故事比较平淡，感觉不适合拍成电影，就是电视剧的感觉。,2
1,26907450,麻烦家族,獨要,65870018,还行,2017-09-01,23:34:58,同类型不如苏友朋嫌疑人的翻拍..个人感觉黄磊的水平远不知如此....,0
1,26907450,麻烦家族,小鲸,1023218,还行,2017-10-18,23:25:39,好想采访一下黄磊中年突然垮掉什么感觉,0
1,26907450,麻烦家族,安安安安安啦！,143022970,还行,2018-08-05,19:23:36,还行吧！一般！！！！,1
1,26907450,麻烦家族,工藤新一的猴子,72626968,力荐,2017-05-11,13:58:37,哈哈哈，太搞笑了。家庭混乱到如此地步，最后还得老大来主持大局，真是有情有爱有家在啊！,15
1,26907450,麻烦家族,骑呢星人,34482289,很差,2017-05-12,16:00:53,2017/05/11全片都是浓浓的尴尬，本来是生活体裁但是导演拍得更加平淡如水毫无波澜，又长又臭，还浓浓电视剧味，更像场景剧而不是一部电影。经常场面是一两个人在说话而后面一群人在发呆的尴尬。而作为一部喜剧笑点真的尴尬到爆，诸如黄导一口刻意low爆的中英腔，真的不是什么人都能当导演,1
1,26907450,麻烦家族,小年左,yummyzuo,还行,2017-07-09,02:43:07,其实改得还好，日式家庭小尴尬都在的，也尽力本土化了，本子本来就好不会歪到哪去，可经典的败者美学的精髓还没抓到，有点像电视剧，但强点儿，像舞台剧多些。,2
1,26907450,麻烦家族,我为歌狂,33974088,很差,2022-04-12,20:27:35,原剧本就有点无聊，国产演员再不给力,1
1,26907450,麻烦家族,僵尸不美,meijiangshi,很差,2017-07-01,21:38:33,真的导演没有那么容易干，演员们不要再前仆后继的恶心观众了好吗我们本来就活得艰难,0
1,26907450,麻烦家族,X,158679347,较差,2017-05-18,20:36:43,黄磊是越活越回去了？,1
1,26907450,麻烦家族,彩心之境,120489754,很差,2020-07-31,16:17:29,不敢相信这是黄磊写出来的剧本拍出来的电影。,0
1,26907450,麻烦家族,李九弟Jody,apple_jody,很差,2017-07-15,13:45:47,味同嚼蜡，很难找到这么难看的电影。一般的烂片还有一些可能值得鼓励的优点，这部完全没有。我不认为黄磊老师是来捞钱的，但是看到一家n口住在那么大的house里，我觉得黄磊老师可能确实不太理解普通人的麻烦。,0
1,26907450,麻烦家族,如果如果l,61895291,,2018-05-07,11:08:15,没那么好看也没那么难看，不知道打几分,0
1,26907450,麻烦家族,⠀,pottqqq,较差,2017-11-24,12:14:38,这个老太太演的太差，台词跟念的一样,0
1,26907450,麻烦家族,幕天席地,119429128,还行,2017-07-04,12:16:37,抄袭严重啊，三颗星给演员,1
1,26907450,麻烦家族,行走的影碟机,82817700,还行,2017-05-11,21:19:00,电视剧感比较强，有一些比较搞笑的点，但是家庭温情这个角度讲述力度不够，稍显浅薄。,0
1,26907450,麻烦家族,柠柠,132706095,很差,2017-08-27,00:09:43,其实我觉得看完整部片子下来没什么感觉,0
1,26907450,麻烦家族,晃悠,huangyou,还行,2017-12-23,22:53:22,其实还过得去，就是放在电影中，显得张力不够。电视剧可能会好一点。毕竟日本原片的质感是非常出众的，国内感觉点都有，但就是体会不到那种情绪。可惜了。个人感觉是选角的问题。这个片子全部换成素人，可能整体评分能提高一倍。,0
1,26907450,麻烦家族,Aaron Quill,183788205,还行,2021-05-23,03:56:33,很简单的老夫老妻闹离婚的一件事，成为整个家族的麻烦，并且引出来整个家族的小矛盾。这种题材的电影让人觉得不像大陆片，更像台湾或者日本片，观后才发现本片的确翻拍自日本电影《家族之苦》。黄磊是一个好表演老师，以海清为首的演员在片中的小细节抠得非常细致，表达出的细腻情感也不错；但可能不是一个好导演，整部电影节奏一般。搞笑方面非常不错，何炅和岳云鹏的表现也很惊艳。家庭的温馨感觉也把握得不错，影片非常生活化，不太像电影，更像是讲述家长里短的电视剧。,0
1,26907450,麻烦家族,地球明明,songyuanming33,较差,2017-07-08,13:29:18,刚装了电视盒子的无聊的我,0
1,26907450,麻烦家族,一 | 一,lowsong-e,,2017-06-30,16:29:13,描了一个形,0
1,26907450,麻烦家族,裸吻鱼🍭,jemappelle651,较差,2019-01-05,22:53:28,12/365 烂透了 黄磊是要做什么 翻拍不是不可以 连台词都照搬就太过分了 国内的导演如此翻拍电影 心里不慌的吗,0
1,26907450,麻烦家族,天生是明星,xutangjunzhe,很差,2017-07-01,09:45:50,电视剧的赶脚。,0
1,26907450,麻烦家族,Frances,143511423,还行,2018-08-05,19:15:50,还行！！！！！,1
1,26907450,麻烦家族,大银河,zkxloveytt,很差,2017-05-11,23:04:59,我就想知道黄磊在暴走看啥片？还是暴走大事件里面？说的这个电影唯一的缺点就是笑点太密集，观众喘不过气？那么这就特么尴尬了，能让我笑一次？,6
1,26907450,麻烦家族,雪中春信,160808136,较差,2017-07-02,14:07:55,改的真的很烂,0
1,26907450,麻烦家族,ᥫ᭡້໌,Kylin-2015,很差,2017-05-18,18:58:42,翻拍？！,2
1,26907450,麻烦家族,大扣子恐惧症,2032988,较差,2018-08-08,23:52:16,为今晚的早睡奠定了基础,1
1,26907450,麻烦家族,˙˘˙,155603461,较差,2017-05-11,02:46:03,怎么说呢  没有想象中的好吧  黄老师还是不适合  有些地方笑点比较尴尬  整个电影比较倾向电视剧的风格,9
1,26907450,麻烦家族,羌笛杨柳,72023671,较差,2017-06-30,21:57:56,翻拍似乎没啥意义，但金庸的小说的确一直在翻拍。有点像电视剧！,0
1,26907450,麻烦家族,Restless Soul,kash_shuo,较差,2017-05-15,01:54:32,骚瑞磊哥，翻墙看的。你是个好爸爸，可能是个好老师，但是真的不是个好导演好编剧。挺庆幸是翻墙看的，如果花钱看，那对我心中你的形象打击可大了。,4
1,26907450,麻烦家族,大罗,Gu_li,力荐,2017-05-14,15:41:42,很不错，这里是中国家庭的碎碎念，是传统人家那些心思那些事……这是中国和谐社会的基石！！,2
1,26907450,麻烦家族,冲田总悟,148933548,还行,2017-05-11,20:52:44,珍惜身边的人,6
1,26907450,麻烦家族,胡天柒月,seventhworkshop,较差,2017-07-11,17:15:03,黄老师这片子玩得很无趣啊。,0
1,26907450,麻烦家族,希鲁鲁克的儿纸,36959484,还行,2017-06-29,17:49:26,不是烂，是出奇的平庸。没有任何亮点。,0
1,26907450,麻烦家族,桔子2017,16953697,还行,2017-10-11,19:36:10,还好,0
1,26907450,麻烦家族,日术人生,1867092,较差,2017-10-18,12:58:56,你要是很差也不是，这种日本格调的片子换成中国的皮套完全适应不了。中国人处理事情不会是这么内敛。,0
1,26907450,麻烦家族,李邦斯,libangsi,很差,2017-11-18,18:46:11,画虎不成反类犬。,0
1,26907450,麻烦家族,Zoe,wincywincy,很差,2017-07-03,14:15:16,冗长,0
1,26907450,麻烦家族,请保持高冷,148179414,还行,2017-05-13,23:34:53,故事一般，黄磊海清这对师徒合作挺多的了，演技倒是还不错的,12
1,26907450,麻烦家族,偶然香芋,LarryCC,较差,2017-08-09,21:58:49,我觉得演员还是应该保持一些神秘感，不应该过度消费，否则真是演什么不像什么。拍个长篇电视剧多好。,0
1,26907450,麻烦家族,大勇,59781320,较差,2022-03-10,12:51:28,《家族之苦》8.1分，《麻烦家族》4.5分，翻拍成电视剧都进不了省级卫视还敢拍电影上院线？,0
1,26907450,麻烦家族,微苒,weiranwei,较差,2017-10-03,12:06:26,莫名其妙的吵，莫名其妙的和好。明明该是细腻真实的电影怎么演的这么尴尬😅,0
1,26907450,麻烦家族,王筱驴,haymm,还行,2017-05-13,14:46:49,文远、台湾女孩、北京的杨树、电台节目，大概只有我这种似水粉能get到黄小厨的点。,0
1,26907450,麻烦家族,大金牙呀！,51711938,很差,2018-02-19,14:31:57,黄磊还是好好当老师吧。,0
1,26907450,麻烦家族,已注销🇨🇳,princesssyn,很差,2019-09-18,00:41:48,看了日版发现完全是个中文版，难怪小酒馆，打网球真是违和的飞起，直接配音版不好吗？//找了这么多演员却拍出这么烂一部圈钱之作，除了老两口演的还算不错，结尾升华的感情演的太到位了，其他就真的一言难尽，特别是最小的那一对演技尴尬的飞起，还凑了一个湾湾，违和的一塌糊涂。至于孙莉可能更适合话剧吧，电影真的不适合了,0
1,26907450,麻烦家族,對翀伍猩淼軍,234302285,很差,2021-12-19,21:06:56,全员不入戏，一星舞台剧。,0
1,26907450,麻烦家族,reneyoyo,1522607,还行,2017-05-12,17:00:46,国民媳妇儿海清，超级奶爸黄磊，都是我的菜，么么哒！,2
1,26907450,麻烦家族,文白,46815070,还行,2017-05-11,01:55:34,不功不过，可以一看，海清那个角色挺好。,2
1,26907450,麻烦家族,Rumpleteazer,44006704,较差,2017-05-11,20:29:01,您抄个作业也抄好一点嘛,2
1,26907450,麻烦家族,彤彤酱,17651949,很差,2020-02-13,19:47:23,这直接引进原版不好吗？翻拍都能成这样,0
1,26907450,麻烦家族,松子蜘蛛侠,luckyanc,推荐,2017-12-30,02:52:03,其实我觉得还行，没看过原版。片子很生活，有动人的感觉。,0
1,26907450,麻烦家族,醉卧浮生,zuiwofusheng,推荐,2017-05-07,14:22:12,影片中的每个人物都能在生活中找到影子，海清式的媳妇、王迅式的老公、黄磊式的丈夫以及李立群式的父亲，很容易产生人与角色的情感沟通。,18
1,26907450,麻烦家族,弘与合欢,muamu913,很差,2017-06-29,23:01:43,额，没看过原版，这版真的有点无聊,0
1,26907450,麻烦家族,王二小Secret,67655170,还行,2022-10-26,09:04:25,模仿。,0
1,26907450,麻烦家族,光明王后,133258798,较差,2022-01-15,16:56:35,对原版日本电影《家族之苦》的翻拍，但说实话你得做到本土化呀。,0
1,26907450,麻烦家族,Sunshine’s,166419801,推荐,2018-10-27,10:03:49,轻喜剧的基调透着现实的凉薄，一个人觉得不会走，一个人觉得会挽留，年轻人分道扬镳，老年人要个态度。我不管它是抄袭还是翻译，我看到的是中国社会普遍存在的敷衍，家里，医院，广场，公园无处不在。人这一生千万种可能，追名逐利亦或是感情至上都透着麻烦，真诚相待亦或是虚与委蛇更是截然不同，什么是对什么是错本就没有定论，结尾一句对不起来的不容易，特别不容易。,1
1,26907450,麻烦家族,小狐腻,56679873,还行,2017-05-19,14:43:39,对市场上几乎一边倒的批判不认可，就像对一边倒的批判《深夜食堂》不认可一样。我倒是觉得还可以，不要跟杠精一样，静下来问问内心吧。,0
1,26907450,麻烦家族,小水流桥,xiaoshuiliuqiao,较差,2017-05-19,11:55:54,感觉好像在看央八的电视剧，看了一半睡着了，有够无聊的,2
1,26907450,麻烦家族,果断未果啊。,53782984,,2017-10-03,10:50:06,零分。半星给黄磊孙莉,0
1,26907450,麻烦家族,醉暖如初,149090394,力荐,2017-05-12,11:42:15,黄磊不愧是有专业背景，又深得日本剧情片熏陶的才子型导演，虽然是第一次导电影，但是对很多社会问题的把握和观察都是相当细致和深刻的。,2
2,26907450,麻烦家族,懒人一枚,151026665,很差,2017-07-18,23:03:25,又是抄袭！！！中国编剧都是吃闲饭的吗？？？？！！！,0
2,26907450,麻烦家族,沧海一小生,157276889,较差,2017-05-12,09:44:47,黄磊老师为啥要蹚这浑水啊！,8
2,26907450,麻烦家族,喃 大 丢.ai,nannan,较差,2017-11-04,20:57:57,呵呵,0
2,26907450,麻烦家族,你要的水花,127570157,很差,2017-05-23,16:27:39,拍成电视剧可能收视率会不错。,3
2,26907450,麻烦家族,小九儿,cloudy20011128,还行,2017-05-23,07:24:38,不对比原作也不至于整段垮掉，但大儿子的人设及演绎确实垮了,0
2,26907450,麻烦家族,余思梦游仙境,yuyin1986,很差,2017-11-04,20:11:23,原版真的是传世佳作 没有对比就没有伤害,0
2,26907450,麻烦家族,陈轮,49673811,很差,2017-10-26,22:46:10,黄磊大概把翻拍想得太简单了吧。,0
2,26907450,麻烦家族,benjamin,k121,较差,2017-07-04,21:20:26,情节拖沓 空洞 没有美女= =,0
2,26907450,麻烦家族,William,43988581,较差,2019-05-19,15:41:38,拍这个干啥。。。,0
2,26907450,麻烦家族,撩乱的裸舞曲,stefanieren,很差,2018-05-26,10:41:34,没有对比就没有伤害，这些综艺节目大咖水平相当有限，没事请不要拍电影来消费大家,0
2,26907450,麻烦家族,阿怪,zcs1222,较差,2017-07-16,15:58:15,WTF,0
2,26907450,麻烦家族,kurapica,2805103,还行,2017-05-13,21:33:58,唉，期待太高.....,0
2,26907450,麻烦家族,吃个大香瓜,toutoulan,较差,2017-08-04,15:00:24,随便找几个明星撺个电影就能赚个盆满钵满的时代已经逐渐远去了……,0
2,26907450,麻烦家族,风吹屁屁凉,154677514,力荐,2017-05-12,16:26:16,起初还不怎么情愿，老公非要看这部小成本，不过看阵容倒是不错。看上之后也跟着角色欢乐起来，其间的家人重聚亲情再燃也是相当不错啊。,2
2,26907450,麻烦家族,爱新觉罗格格,130912934,较差,2019-04-05,12:55:18,寓义很好，有些搞笑过了,0
2,26907450,麻烦家族,帕格尼尼帕加尼,rococoman,很差,2022-01-06,20:18:33,烂片,0
2,26907450,麻烦家族,薇城胤希,43632851,很差,2017-07-04,23:28:01,黄小厨还是做菜比较厉害,0
2,26907450,麻烦家族,红辣椒,13695982,力荐,2017-05-11,15:32:26,老艺术家们这次本色出演啊，张伟欣准备闹离婚追求自己的自由，李立群被抛弃最后痛定思痛挽回婚姻,15
2,26907450,麻烦家族,满天星,156103949,很差,2017-08-14,11:44:22,什么都没有……,0
2,26907450,麻烦家族,为虾米呀,2369225,还行,2017-07-25,19:29:22,为什么要让大家花钱去看电视剧…… ,0
2,26907450,麻烦家族,🪨,Nutplanet,较差,2017-07-03,20:16:41,导演是一门综合才能，真的不是是谁都能拍。现在导演门槛太低了，求别浪费钱了,0
2,26907450,麻烦家族,哎哟喂啊呀,nycsubwayrider,较差,2017-06-21,13:30:44,味同嚼蜡……作为喜剧片没有足够的幽默，作为亲情片没有任何泪点，作为黄磊的导演处女作本应该遵从初心的影片却从头到尾透着一股子强烈的铜臭……我就想说，你们就这么作吧，反正现在资本来源坚挺，慢慢折腾……手动拜拜。,0
2,26907450,麻烦家族,冬瓜,senor,较差,2017-05-21,03:32:58,看的时候我一个人包场。看完感觉排片那么少、观众那么少，是有原因的。电视剧感浓厚。黄磊真是在电视圈混久了，早年那些在电影圈养成的灵气全没了。家长里短要拍好也不是不可能，可绝不是这样毫无张力的拍法。据说翻拍的是日本原版，且原版剧本还不错，但从这翻拍来看，完全看不出剧本的好来。,4
2,26907450,麻烦家族,笛咖尔,4685302,推荐,2017-05-14,20:37:15,95%的汉化，人设、美工、台词、表演。中国阿姨即使不跳广场舞，也不会去写作班吧……,0
2,26907450,麻烦家族,Grace,1178935,力荐,2017-05-12,09:20:29,任容萱还未过门就被这个奇葩的家庭中的每个成员的交流方式给惊吓到了吧，哈哈！,3
2,26907450,麻烦家族,宇宙熊猫王,83141101,较差,2018-10-28,11:53:15,像综艺节目,0
2,26907450,麻烦家族,茉小茉,2136360,很差,2017-08-08,09:45:40,故事没有张力，人物性格塑造失败，情感渲染不到位，黄磊这什么水平，完全不像一个电影学院教授。,0
2,26907450,麻烦家族,ricylovejoe,ricylovejoe,还行,2017-05-11,20:23:53,不出所料节奏完全是按照日版的来的。同时融入了挺多本土逗比元素例如外卖堵车一条龙。有两个最大不同比较在意。省略50字。。另外老太太的表现方式过度向日本主妇描红，太违和了。总体感觉此片不适合被翻拍成祖国版。日本的家庭模式和我们的相差如此之大。此片算是一个彻底的翻译版吧。,3
2,26907450,麻烦家族,索多雅,Emily0803,还行,2017-12-05,11:39:25,黄磊和山田洋次中间差了100部《深夜食堂》。,0
2,26907450,麻烦家族,王兆鑫,WZX775183446,很差,2020-06-09,22:20:20,"垃圾，连镜头都没选好，
变形严重，焦点模糊",0
2,26907450,麻烦家族,小台,littlet2010,较差,2017-05-15,18:36:42,这电影到底想讲个什么？对于大家族一起生活的记忆，只停留在幼时周末回到爷爷奶奶家聚会。现在中国有几家人是这样生活在一起的？计划生育20年黄老师你错过了哦？毫无共鸣的故事拍成中国版有什么意义呢？,11
2,26907450,麻烦家族,Yome,yome,较差,2017-05-14,02:01:45,一家的直男癌和套路 整部片子就只有台灣人說了兩句現代人該說的話...,0
2,26907450,麻烦家族,令狐葱,linghucong,,2017-05-11,12:23:33,这个应该是《家族之苦 家族はつらいよ》的翻拍吧？？,1
2,26907450,麻烦家族,无优无律,154737590,很差,2017-05-13,17:50:07,总有一种电视剧的家长里短搬上了电影荧幕的感觉，一点电影质感都没有,0
2,26907450,麻烦家族,格林。Green,2073233,很差,2017-10-06,21:55:27,太做作了,0
2,26907450,麻烦家族,此间有城,123572075,很差,2017-11-04,15:00:28,黄晓明，黄磊，靳东，杨烁，陈思诚，余文乐，那些油腻而又平庸的中年男人们。最后，还请黄磊老师别再翻拍日剧日影了！,0
2,26907450,麻烦家族,VVVG,42030874,较差,2017-08-22,19:07:06,神烦那个圣母般的角色,0
2,26907450,麻烦家族,SHINE,67727072,较差,2017-05-16,00:57:50,和家族之苦对比一下，真是差了不止一个档次。,4
2,26907450,麻烦家族,该南,shoushouvic,很差,2017-07-02,17:58:38,黄老师最近怎么了？是想证明自己的观影品味吗？那就默默的看电影好啦，何必翻拍呢,0
2,26907450,麻烦家族,不二,3435624,推荐,2018-05-20,23:29:26,也许家庭就是一次次麻烦又在解决的容器。,0
2,26907450,麻烦家族,虫蠹,15965977,还行,2017-10-03,10:04:37,看看可以，槽点较多,0
2,26907450,麻烦家族,珊瑚海,154018067,较差,2017-06-07,23:45:49,听说是完全翻拍的～就很失望啊～,0
2,26907450,麻烦家族,卡戎,CharonTJ,较差,2018-08-02,01:18:41,去年我竟然去电影院看得这片子，很尬，一起看的几个人都要睡着了。不为了影票哪能看完呀。,1
2,26907450,麻烦家族,平原上的漫游者,yezixiaoluoluo,较差,2017-07-05,01:28:17,没有好多人说的那么差 但是却是蛮无聊的,0
2,26907450,麻烦家族,大P™,1028676,较差,2017-07-04,23:08:17,枉我十几年前也是黄磊粉,0
2,26907450,麻烦家族,橘猫爱吃鱼,169089788,较差,2020-03-11,21:40:03,不是很搞笑，比较无聊。,0
2,26907450,麻烦家族,冬雪雪花儿,3804622,很差,2017-07-13,15:48:38,这是黄磊有笑有泪的电影吗，全程尴尬，不明白为什么拍出了这种作品,0
2,26907450,麻烦家族,老朱無電影不歡,1319405,很差,2017-06-30,02:48:42,简单拿来，只能露怯，没个三两三，岂敢执导筒，掌勺不完了么,0
2,26907450,麻烦家族,螞蟻,Kevorkian,很差,2018-07-23,20:03:24,不太像电影，更像是电视剧,0
2,26907450,麻烦家族,张洁洁,54608411,很差,2017-05-13,21:02:22,为大胃王打一星,6
