page_index,movie_id,title,username,user_id,rating,date,time,comment,useful_count
0,26907450,麻烦家族,冰川公爵,150884148,较差,2017-05-11,02:29:44,1 有快乐家族任何一人为烂片 2主演阵容为电视剧咖的多烂片 3导演为明星歌手主持人作家转行的多捞钱烂片 4导演业余不打磨原创剧本还选择隔壁国经典电影翻拍借鉴的绝对是毫无追求的烂片。现在，让我们看看，这部电影中了几条？,1572
0,26907450,麻烦家族,小鬼Bono,51033208,还行,2017-05-10,00:08:37,整体在描红、临摹，却也演出点儿本土特色。细节有至有缺，作为电影看瑕疵不少。可贵的是终于有部适合介绍给父母看的华语新片了。丰富市场的意义超过片子本身，我们的电影已经太单调，抛弃太多人了。,130
0,26907450,麻烦家族,柯里昂,pirealwei,较差,2017-05-11,18:58:26,电影本身没啥大毛病，因为剧情上基本是属于一刀不动的照搬，反而是几个演员的表现比原版差很多，完全没有体现家庭剧的精髓——自然，各种扭捏做作。看的时候一直在想，像这样几乎百分之百完全照搬式的翻拍究竟意义在哪，如果中国电影人连这种最日常的家庭剧都要用别人的剧本，那中国电影还会有未来吗？,657
0,26907450,麻烦家族,喻鸣,mufanxuanji,还行,2017-05-11,17:32:07,除了圈钱之外无任何意义的翻（zhao）拍（ban），美学和内涵皆未见任何突破，以为替换一下标签元素就算本土化啦？PS.人家日版完全仿照家庭结构按长幼排番位，冲突中心的老爹老妈打头，再红的妻夫木聪苍井优都本本分分排在前辈后面，哪像天朝影视圈活脱脱一个等级权力制度的化身。,22
0,26907450,麻烦家族,让保罗切小田,Mydearamy,,2017-05-15,11:24:26,本来准备给两星，对比去看了日版之后无话可说，原作的阅读理解都没做好就急着上手了，特别着急要交活的样子。如果拍成大年初一电视台播的三集迷你剧它应该会受欢迎得多，退回去看几十集的《似水年华》都比这像电影，往事只能回味唉。,16
0,26907450,麻烦家族,momo,fish_0507,很差,2017-05-09,01:07:25,人设请用心经营，否则总会有被消费干净的一天。我尊敬的艺人赚钱不多，也很少修饰自己博取称赞，他们用行动获得尊重。不是为了守住位子才搞笑，而是在这个位置应该带来笑声，来自一位节目形象是恶魔的搞笑艺人，这是最基本的职业责任感。付出多少努力，想要什么，无论嘴上怎么说，观众总有一天会知道。,929
0,26907450,麻烦家族,U 兔,rubbitU,还行,2017-05-12,09:26:14,抱着千万不要和原作比较的心态给了三星。真像个小品，为什么一定要生硬地搞笑呢，都是一帮好演员，就是不像一家人。小儿子和妈妈选得失败，完全没有表现出那种闷骚但坚强的气质。台词和情感转折太生硬了，估计会让没看过原作的人一头雾水。拍得不动声色，让你看了舒服，现在知道能做到那样都是功力。,4
0,26907450,麻烦家族,救死扶伤安嘉和,cloudcandy,很差,2017-05-11,08:24:05,把一部传世佳作借鉴成了春晚式曲艺小品。厉害了黄老师！,651
0,26907450,麻烦家族,深井俊二,3583217,很差,2017-04-24,17:21:38,全面抄袭，从人物关系，矛盾，性格，甚至对话，居住环境，色调，全面抄袭！,414
0,26907450,麻烦家族,桃桃林林,qijiuzhiyue,较差,2017-05-12,06:12:33,没有对比就没有伤害，有了老山田的版本对比，我感觉受到了很大伤害，这种电影有任何拍出来的意义么？,469
0,26907450,麻烦家族,LoVe,Veronicam,还行,2017-05-15,08:56:00,拍成电影有点坑 电视剧看看还行,1
0,26907450,麻烦家族,阿米,Lynn_C,还行,2017-05-12,07:00:27,这就是生活啊。。。小儿子那两口子看得我全身僵硬也是醉，黄老师的选角要提高啊,5
0,26907450,麻烦家族,王恶,kid007spy,较差,2017-05-09,21:43:12,从第一个镜头开始，扑面而来的电视剧风就刮起来了，黄老师实在是太会省钱了，做厨子偷方案，拍电影去电视台拷转场镜头。由于片子是翻拍，细节层面又有大导加持，所以黄老师怹做导演怎么样我们不得而知，但是明眼人都能看出来，他必然是一个令资方爱不释手的制片人。,339
0,26907450,麻烦家族,斯文看客swain,150884519,较差,2017-05-11,02:38:44,麻烦各大综艺把何老师 魏大勋 黄磊 岳云鹏等人圈住了，他们可以在综艺的舞台上绽放光彩，却是电影界的麻烦家族。同理谢娜杜海涛ab。,266
0,26907450,麻烦家族,李小庫,leeshiuan,还行,2017-09-01,00:01:26,作为黄磊执导的首部处女作 本片是一部充满着生活气息的家庭类型片 也是目前少有的类型 黄磊在国产化的改编上接底气十足 不管是子女对父母离婚事件的看法 还是在孩子的教育问题上 整个故事设定和人物设定都十分中国化 同时与中国时事热点话题相结合 都成功向观众展现了中国式家庭的相处模式 挺值得一看,0
0,26907450,麻烦家族,大奇特(Grinch),grinch,较差,2017-05-12,08:17:42,一味的原样复刻，既然翻拍，却不懂本土化的重要性，中国式的为人处事和城市感完全丧失。美术置景 人设完全按日版来，一点儿自己的发挥都没有，这样的翻拍有何必要？,110
0,26907450,麻烦家族,穆子衿,155602014,推荐,2017-05-11,14:29:45,虽然电影的结局有点仓促让我有点失望，但是整部电影却是让我笑中带泪，泪里含笑的看完了的。黄老师用他的人生经历为我们描述了一个与我想象中不太一样的家庭生活，然而这个家庭生活却更贴合实际。,35
0,26907450,麻烦家族,深夜声噎,sfroompp,,2017-05-11,06:55:48,错过一次看的机会，想想不打算再尝试看，以免玷坏对原版的好感。,3
0,26907450,麻烦家族,梦梦梦梦,155986723,还行,2017-05-15,21:30:27,剧本真的很重要，有的时候好演员也拯救不了，海清和黄磊挺适合演这种剧的，无奈剧本不咋的,9
0,26907450,麻烦家族,小崔,jianjian8888,较差,2017-05-09,22:26:29,黄磊你就好好上综艺节目挣奶粉钱吧。,92
0,26907450,麻烦家族,道臣岚,51004773,很差,2017-05-09,21:10:34,太可怕了…我笑点这么低的人一次都没笑出来,432
0,26907450,麻烦家族,次等水货,wudaoxing,很差,2017-05-11,10:47:03,把发短信换成打电话，把日本饭馆换成爆肚店，把日本鳗鱼换成北京烤鸭，这算毛的改编。演员表演上处处向原版靠拢，所有群演都是尴尬存在。还有啊，导演我问你，王迅出场骑着电动车追尾停着的汽车是表达个什么意思，还有孙莉对海清说爸妈要离婚，正常人都知道说的是自己的爸妈吧，海清竟问谁的爸妈。,401
0,26907450,麻烦家族,LOOK,2049622,很差,2017-05-11,16:31:48,与电影有关的每一个元素都是零蛋,249
0,26907450,麻烦家族,王大根,diewithme,较差,2017-05-22,14:15:07,黄磊可能就真心觉得这种为了让孩子上私立学校而“被迫”搬入京郊大别墅、二十多岁的年轻人随时可以在北京买套公寓从家里搬出来的家庭超能引起观众共鸣的吧，这片不食人间烟火到什么程度，里面甚至出现了【打电话订购百度外卖】这样的情节……,63
0,26907450,麻烦家族,慕,mumu1991,较差,2017-05-16,05:40:38,片子爛就算了，80年代到現在，李小璐她媽算是史詩級的花瓶吧。,22
0,26907450,麻烦家族,梦里诗书,57542378,较差,2017-05-08,20:48:19,不加思索的套般，使《麻烦家族》这一本源于日本家庭电影《家族之苦》的匠心之作变的索然无味，电影中国化的改编既没有能真正接住地气，尤为刻意的笑点也让其失去了原作中那股厚重的情感奠基，使之为人所见的不过是一场泛善可陈以家为名的闹剧。,32
0,26907450,麻烦家族,小猪大侠,2476748,很差,2017-05-11,14:13:57,说是电视剧美学已经是在称赞它了，镜头语言简直是情景喜剧级别的，原作底子好成那样能翻拍成这样也是真的很厉害。迫切的想知道黄磊老师这些年到底都遭遇了些什么。,209
0,26907450,麻烦家族,喵老师2333,York29,较差,2017-05-09,21:38:41,兰花弹烟灰的桥段多少年前就被别人用过了。拍得并不高明，变成了情景喜剧。看完后骑着个车去旁边的大董鸭买了个烤鸭汉堡吃。心疼电影里那两只精品烤鸭。,19
0,26907450,麻烦家族,团小纸,skymoto,较差,2017-05-11,17:53:48,大约只是想拍一部电影纪念一下自己幸福的中年生活吧，情景剧系列，山田洋次照着画不只是缺了神连形都不像。,25
0,26907450,麻烦家族,圈地自萌,92074608,很差,2017-04-28,19:25:10,到我们学校首映，黄磊老师来了，但电影感觉像个小品或者综艺。。。。。不太像个电影😂 看得人昏昏欲睡。。。。。,154
0,26907450,麻烦家族,字母君,78164697,很差,2017-05-11,00:04:05,"黄磊对本土化的理解大概只停留在土化的程度上，技法就更无法评价了。
所有角色都至少年轻了十岁，奶奶如女王君临般高冷，其他人又刻意模仿原作的夸张风格，极其别扭。至于足球和百度外卖的改动……不合国情干脆就删了吧？小儿子夫妇成酱油，怀疑导演根本没看懂原作设置他俩职业的用意。",85
0,26907450,麻烦家族,阿暖,phoenix43,较差,2017-05-13,18:47:31,能把这部电影改编成这个样子，肯定既不懂母亲，也不懂家族。,17
0,26907450,麻烦家族,二月鸟语,p2165,很差,2017-05-10,05:20:42,前几天还和朋友聊天谈到对一部翻拍片来讲，首先考虑的是本土化和落地的问题，然后我觉得还有就是翻拍的意义，然而这部翻拍片在这三个问题上我都没找到答案，之前不是翻拍《深夜食堂》么？啥时候上呢？现在出了《家族之苦2》，是不是要接着翻拍《麻烦家族2》呢？电视剧导演转电影导演还是要从短片开始,169
0,26907450,麻烦家族,车瑞茜,xiaozhuoya,较差,2017-05-12,10:12:37,"我以为这会是个家庭轻喜剧, 结果没想到有些像场生硬的闹剧; 对黄老师的期望很高, 所以一直在等待该片的高潮, 直到黑屏了出字幕了, 我才相信, 这部电影其实更像个无数场景拼凑在一起的小品、话剧.. ps.很爱黄老师, 但是看他说着夹杂英文的台词, 不觉得好笑, 只觉得很过却又反而显得,  不高级..",13
0,26907450,麻烦家族,shirly,65336732,还行,2017-05-11,23:49:37,感觉是黄磊喜欢的题材，于细节处见真情。整部片子我看得感触不太大，偶尔还想打打瞌睡。倒是老妈一边看一边感慨，“这老爷子和你爸真像，回去我也要和你爸离婚！”我ʘᴗʘ,3
0,26907450,麻烦家族,Hachiko,andert,较差,2017-05-14,14:48:55,即使搬出了娱乐圈的小半壁江山，还是真差劲。剧情照搬最忌讳的就是毫无头脑的无本土化复制粘贴，不仅刺激了观影人群，也让喜欢原版的观众受到了伤害。最大的问题是，能明显感觉场景感，没有烟火味，没有生活气息。,13
0,26907450,麻烦家族,Asa,FinalHome,很差,2017-05-15,09:50:06,差，不是情节差，因为情节就是完全翻拍，差在…毫无本土化！！！！！毫无精神内核！！！！！黄老师自己生活过得太好了是不是？自我感觉太良好了是不是？那就回到非诚勿扰四大名助上去怼人，话剧舞台上灯光聚焦，电视剧里众星捧月，还有微博上的女儿光环家庭光环厨房光环，不要随便拍电影！不要拍电影！,48
0,26907450,麻烦家族,浮生若夢,kevindreamfly,很差,2017-05-14,09:28:36,没才华就不要硬装，人设很累的。想骗钱就直说，编故事多麻烦啊。一个电影学院的老师拍出这种东西，不知道那些学生是不是要被恶心死了。,62
0,26907450,麻烦家族,江湖遠人,esunchien,还行,2017-10-09,22:29:59,感觉并没有传说中的那么差嘛。,1
0,26907450,麻烦家族,CharlesChou,CharlesChou,很差,2017-05-15,00:44:32,可以说是《家族之苦》加上国产黄酒在胃里拌出的呕吐物了。,43
0,26907450,麻烦家族,东东,1344334,还行,2017-05-16,11:07:29,没看过原版。李立群没的挑剔。我觉得母亲这个角色是最难演好的，这里完成度确实也一般。年轻一对没存在感，王迅和海清中规中矩。黄磊现在演啥都一个样，不知道怎么在电影学院当老师的。整体总觉得差着一口气，感觉黄磊这个导演没有把控好。回头有空去看看原版。,3
0,26907450,麻烦家族,亚来,c19,较差,2017-05-11,14:48:12,把建立在日本家庭妇女文化基础上的《家族之苦》翻拍过来，不先解决文化转换的问题，就变成了现在的直男癌家庭宣传片。,12
0,26907450,麻烦家族,MISS BELLA。B,lanxiaomiao,还行,2018-08-08,08:05:29,奔着烂片去看的，结果还可以,1
0,26907450,麻烦家族,幸运+++,liuanan0606,还行,2017-05-12,16:41:46,黄磊的英语太好笑了！！除了黄磊，大家的演技都有点尴尬。最后飞奔的狗是怎么回事，一脸懵逼😂😂😂😂,0
0,26907450,麻烦家族,豆瓣上的嗅嗅,67619742,较差,2017-05-11,23:05:59,当看到何老师的客串时就知道这片妥妥的又为何老师的烂片指南针地位垫了块砖。黄大厨烧烧菜卖卖爱妻人设就可以了，导演工作就交给更靠谱的人吧。不推荐。,17
0,26907450,麻烦家族,静待花开,2123968,力荐,2017-05-11,11:55:59,海清现在总演那种爱动手的媳妇，是不是考虑以后接一部功夫片，正儿八经地当一回侠女得了。,41
0,26907450,麻烦家族,Line,lline,很差,2017-05-14,22:09:12,这要是说用了心 那恐怕也是没心了,31
0,26907450,麻烦家族,viennavirus,viennavirus,很差,2017-05-12,20:26:38,连布景都照搬还拍他干嘛呢，做菜的黄老师？,46
0,26907450,麻烦家族,momo,130451028,力荐,2017-05-11,14:47:07,好久没看到李立群的作品了，逗乐的同时会让人有一股淡淡的辛酸，想起咱们的父母到了暮年，不知道会不会也很孤单。,30
0,26907450,麻烦家族,哔呣咣啵の哸啐,bxg555,,2017-05-14,14:14:15,照抄剧情加塞段子，塞进去的段子大多都刻意，但却是维持国内观众看下去的重要调味，起码我看的那场饭后黄金场次，大人小孩老人笑声此起彼伏。中国这么多吃完饭看个电影的观众，能有几个是看过原作的呢？这个群体根本不被鸟。照搬只能说是聪明，加段子也是聪明，专业或尊敬，不存在。,6
0,26907450,麻烦家族,。草帽児 。,1859998,推荐,2017-05-11,16:57:45,黄磊当年自编自导自演《似水年华》，用现在的话说，牛逼炸啦！,23
0,26907450,麻烦家族,VILLAGE,RAIN11,推荐,2017-05-11,19:47:58,黄磊在片中那种凡事都很急、所有耽误时间的事都觉得麻烦的状态，真的是好典型哦。现代都市里的成功人士，还真是都有这种病态。,20
0,26907450,麻烦家族,蓝色港湾,1020346,推荐,2017-05-11,21:17:07,孙莉绝对是被黄磊给耽误了的影后哇。,10
0,26907450,麻烦家族,Holly,holly_xu,很差,2017-05-11,19:07:33,无。聊。得。要。死。。。。。。,46
0,26907450,麻烦家族,kakakarl,zhanyakui,较差,2017-05-15,08:08:17,家庭很日式，不能落地中国，而且演员们，也比日版差很多。不能这样照搬原版，把好牌打得有点不伦不类。,7
0,26907450,麻烦家族,有一个大头,T-Hsuan,很差,2017-05-03,23:00:12,电影院的影厅不是用来放电视剧的 李立群老师艰难地独撑大梁看的都让人于心不忍,41
0,26907450,麻烦家族,李亦亦,Gladys_C,很差,2017-06-07,21:25:57,我现在都觉得黄磊做饭都不一定好吃。,18
0,26907450,麻烦家族,゛ Poetry゜,61276700,较差,2017-05-11,21:53:27,电视剧感+直男，很不舒服的观影体验。,13
0,26907450,麻烦家族,离离塬上草,147353927,力荐,2017-05-11,13:57:46,看得出，黄磊以及制作团队相当认真，《麻烦家族》绝对是情感给力的良心之作。,36
0,26907450,麻烦家族,小柴,supernever,较差,2017-05-13,17:33:15,黄磊就是个过气文青，加上爱做菜，有女儿，家庭看起来和睦，演过文化人，本身也是老师，就搭上了人设的顺风车。不然平心而论，黄磊的戏路和演技都蛮局限，之前的文艺片连糊几部，早就过气了。但是不甘平淡，非要导演，非要翻拍，一下就泄了底。,10
0,26907450,麻烦家族,邈邈,ellaescloris,很差,2017-05-15,00:53:52,太可怕了，黄磊这样鸡贼圆滑的人，没有看到半点乐趣，不用心。,20
0,26907450,麻烦家族,年逝,nianshixx,还行,2017-05-12,21:07:19,倒是比想象中好 想象中应该是一场巨大的灾难…    总之是很莫名 其实还不如不翻拍 好好自己写一个有中国特色社会主义的故事（够了闭嘴）,2
0,26907450,麻烦家族,monica喵,4314650,力荐,2017-05-11,17:17:56,一开始我还以为小儿子找了个韩国演员来演呢。后来经朋友提醒才知道他其实是吉林那边的。难道有朝鲜族的血统？哈哈哈魏大勋,23
0,26907450,麻烦家族,Vince♫,kicker10,还行,2017-05-17,09:32:17,送快递那一段，没有拍出原版的笑点，缺一口气,1
0,26907450,麻烦家族,桃白,54823212,力荐,2017-05-11,21:41:25,李立群扮演的老头好前卫 我爸要是敢这样 早被老妈废了hhhhhhh,5
0,26907450,麻烦家族,私享史,Uvo,较差,2017-05-15,14:44:21,电影没毛病，但能把原版那种充满了生活情趣和人物关系的平淡翻拍得乏味和肤浅到只剩平淡，以至于导演本人要写长文亲自解读人设，可见翻拍得多么失败。暂时没想明白问题出在哪里，也许有如新手和老手同样创作一幅画，看上去都有模有样，其实新手在各个要素处理上都差了些，合一起差太多。,7
0,26907450,麻烦家族,傻不傻666,52269752,力荐,2017-05-12,22:13:47,《麻烦家族》用幽默手法讲述严肃故事，好笑又温馨的家庭喜剧。有日版在前，加上接地气的本土化改编，吵吵闹闹、温暖走心。,5
0,26907450,麻烦家族,大黑骡子,daheiluozi,较差,2017-05-15,20:23:18,特意去看了原作再来打分，真的差。黄磊怎么变成这样了，这片给我的感觉是他根本没看明白原作，该改的不改，不该改的瞎改，纯圈钱。还给自己加那么多戏，我心里温柔多情的黄磊，现在成了一个演喜剧无比尴尬的死胖子,13
0,26907450,麻烦家族,_latsy,101747409,较差,2017-05-15,13:45:48,"黄老师那么聪明个人能不知道电影咋拍？生活毕竟是柴米油盐，家里又添新娃，搞点没内涵的翻拍商业片，甚至不用多思考剧本，拍完就跑，多赚了些奶粉钱，多多毕竟上的也是双语学校啊。youtube看着看着就睡着了,倒是和猫一起睡了个午觉。",8
0,26907450,麻烦家族,康报虹,kangbaohong,较差,2017-05-18,16:51:25,黄老师不仅对不起自己多年积攒的人气，更对不起20%的高排片量。看着山田洋次的《家族之苦2》在豆瓣上高达8.7分，黄老师却既没有改又没有编、仅仅将片名改成中文，最后抄了一个不及格的成绩。,11
0,26907450,麻烦家族,西楼尘,xilouchen,很差,2017-05-17,22:31:27,儿时学书法老师严禁我们描红，因为这是一个误区。原版电影笔锋遒劲或者锋利，你把它再描一遍意义何在？本来的日式温情细腻，变成了北京五环的堵车而已。原版喝饮料订外卖只是更方便中国式植入罢了。电视剧的拍法就算了，连调色都这么加青非主流。从立项开始就是一个鸡贼的主意，何况力有不逮画虎类犬。,19
0,26907450,麻烦家族,[已注销],oovoov,很差,2017-05-18,15:16:17,我觉得这样的电影，拿原版然后抠图换成演员表里的脸就可以了，没有必要再拍一遍。,20
0,26907450,麻烦家族,filmchild,48295646,很差,2017-05-15,09:27:58,翻拍很少吃力又讨好，还把处女座押在翻拍上，勇气可嘉。拿电视剧的方法来拍摄电影，又是勇气。影片喜感不足成了闹剧，不深沉、不内敛、不含蓄，反而是做作、浮夸、夸张。影片不是输在技法上，而是情怀上。当年山田翻拍小津的《东京家族》，最后的那抹亮色，是不同于小津的温暖，这才是情怀。没有就别拍,16
0,26907450,麻烦家族,汪金卫,longzheking,较差,2017-05-11,23:34:31,基本是对《家族之苦》1:1的完全翻拍。人设、台词、家庭布局甚至部分分镜全部照搬。简直太不思进取。所有演员的表演都比原作差很多，如同拙劣的模仿秀，浓浓电视剧感。原作中的日本小酒馆文化生硬地搬到中国，违和感很强。添加的笑点也很无趣。苍井优角色变台妹更是莫名其妙。真不如引进原作配音得了,13
0,26907450,麻烦家族,24city,movie24city,较差,2017-05-31,11:26:16,这真的是个非常日式的故事，根本就不适合翻拍，原版其实就略冗长，全靠人物塑造和对细节的把控才能让这个琐碎故事大放光彩，而国内大部分导演恰恰缺乏这种对“小”的控场能力，以为完全复制就能拍出原版的味道，以为加几个生活场景就能本土化，这种自信的投机没意思，这种翻拍也没意义。,2
0,26907450,麻烦家族,真田柳,50452335,力荐,2017-05-11,16:18:54,黄磊导过的电视剧有《七日》、《似水年华》、《夜半歌声》、《天一生水》，对比现在的电视剧，相当有范儿好吧。他的艺术眼光很独哒。,19
0,26907450,麻烦家族,韬子@Tower,jiangtower,,2017-05-22,23:18:59,黄老师你还是干好你的本职工作做饭下厨比较好。一个厨子你说你拍什么电影啊。你当心灵导师这事就已经很跨界了，再当神算子这个工种就已经明显专业不对口了。现在又开始拍电影。你的人设本身已经有点看不懂了。好好和孙莉姐过日子，当好一个好厨子，别有事没事往电影圈跑，你的厨艺更重要，真的，以上。,2
0,26907450,麻烦家族,豆友4395275,sai27,很差,2018-05-16,18:33:51,非常不明白为什么要翻牌家族之苦，山田洋次集大成致敬之作，开场2分钟婆婆妈妈节奏尽失，虽是一个剧本。但却成了裹脚布电视剧，我看看到底能有多差，比我想象的差的多。,1
0,26907450,麻烦家族,京海唯一白莲花,129783136,较差,2017-05-12,09:07:12,烂,9
0,26907450,麻烦家族,笛辣,56156777,很差,2017-05-15,09:05:30,就是把40集的典型家庭伦理剧压缩成了一部电影,8
0,26907450,麻烦家族,cissylu,cissylu,很差,2017-05-11,12:54:00,烂！,23
0,26907450,麻烦家族,夏染,49983396,较差,2017-05-12,22:10:03,相比原版来说逊色太多了,9
0,26907450,麻烦家族,红藕香残玉簟秋,127437486,较差,2017-05-11,08:47:06,黄磊呀。。,46
0,26907450,麻烦家族,十个斗的眼窝浅,melodygxl,很差,2020-04-19,11:58:01,跟课代表抄作业都不及格，服了！人家可是拍了三部了都！,0
0,26907450,麻烦家族,品客,inameless,较差,2017-12-19,22:35:03,电视电影,0
0,26907450,麻烦家族,舒农,shunong,很差,2017-04-20,23:01:54,闫妮是本片唯一美好的存在，想拥有。,10
0,26907450,麻烦家族,T.V.Zoe ி,T.V.Zoe,较差,2017-10-02,03:39:20,哎……太没有电影感了 连一般日剧sp的质感都够不上  山田洋次有多仁慈 黄磊就有多自负  这个故事其实是苍井给的 搞成这样🙄🙄🙄,1
0,26907450,麻烦家族,溫開水,50398793,较差,2018-07-30,17:18:25,求放過,1
0,26907450,麻烦家族,George663,49125983,较差,2017-05-11,00:04:15,一部浓缩版国产伦理电视剧，剧情太过平淡，戏剧性欠缺，对家族之苦的复刻流于形式,9
0,26907450,麻烦家族,Panda的影音,PandaMovieMusic,较差,2017-07-10,23:30:14,有了对比就产生差距：虽然《家族之苦》里过度舞台戏剧化的夸张表演让我有些不满，但与山田洋次出色的场面调度和分镜设计结合之下还是把我逗乐了蛮多次，而黄磊翻拍的《麻烦家族》各种别扭的本土化细节让我嫌弃，也让原作存有的温情和搞笑沦为尴尬和难笑，剧场钢琴调音求婚一场戏引起我的各种不满……,0
0,26907450,麻烦家族,不码字,suxudong,较差,2017-07-02,12:53:11,我也想过六十岁的时候离婚，然后分开各过各的,2
0,26907450,麻烦家族,唐小万,imecstasy,还行,2017-05-09,22:53:57,全片最讨人喜欢的角色就是台湾妹子了吧，黄磊这个角色真是韩红看了想打人。只能说翻拍了一个好剧本，但接地气总有些让我不舒服的地方。最后的莉莉玛莲好评。,3
0,26907450,麻烦家族,彌張,xiyangwuxie,,2017-10-17,18:33:59,怎么最近净看些烂片，对了李小璐她妈不知道当年怎么出名的，比小学生背书还生硬,0
0,26907450,麻烦家族,莫戥衘,62888853,较差,2018-11-18,15:34:55,……一言难尽。感觉这片子的幕后花絮可以剪成一季综艺，叫做《烂片的诞生》。,0
0,26907450,麻烦家族,zhang 2nd,zhanger,很差,2017-07-07,15:23:38,妹子说，开头还行，越看越烦，累，无聊,0
0,26907450,麻烦家族,鹅岭懒人,crasher,很差,2020-12-25,01:45:18,什么垃圾，几乎一比一照搬，越来越讨厌黄磊,1
0,26907450,麻烦家族,阿默沫,MonicaSXY,较差,2021-08-05,00:42:12,这片的导演编剧真省事，剧情不用编连人设也不用想，反正《家族之苦》没有特别的日本本土风情照搬到中国家庭就完了。,1
