page_index,movie_id,title,username,user_id,rating,date,time,comment,useful_count
2,26907450,麻烦家族,scarly,scarlywoo,很差,2017-07-06,07:09:53,浓浓电视剧风格，走位像舞台剧....以前很喜欢黄磊，当年那个等等等等的他已经冲晕在金钱和名利之中。那个儒雅的他，也已经变成咄咄逼人，振振有词，充满教条主义的老师。黄磊老师这么忙着挣钱，是想儿女移民国外吗？,0
2,26907450,麻烦家族,吃瓜公主,dearruby,很差,2020-08-06,23:51:41,丢了魂，光有一个咣当的空壳。,0
2,26907450,麻烦家族,Sodayui,sodayui,推荐,2017-05-15,04:09:54,"没看原作的情况下我给4星，可惜毁就毁在基本照搬了原作。虽然电视剧感浓厚，至少本片没有拿低俗当笑点，没有无病呻吟的青春疼痛，没有卖肉吸睛的暴露镜头，李立群老爷子的演技也依旧~
PS：看着老太太还有孙莉演的大嫂为了家操劳了一辈子被当做理所当然。。作为女性，只觉心酸。",1
2,26907450,麻烦家族,摩羯座的猫,bjmiss,很差,2017-05-11,12:14:01,电视剧的水平。,4
2,26907450,麻烦家族,开心快乐每一天,154292831,推荐,2017-06-05,23:49:42,剧很生活化，就像身边家庭的故事，尤其是一对老人的生活太接地气了。感同身受，不错。黄磊的导演处女作，及格了。,0
2,26907450,麻烦家族,yrhf,42264701,较差,2018-05-30,09:47:38,珠玉在前，模仿都不知道怎么拍也是醉了。。。多给一星吧，毕竟老头老太太还不错,0
2,26907450,麻烦家族,celalian,46359852,还行,2017-08-04,22:14:05,其实吧，真心没看出来什么东西，这电影拍下来有什么意思，莫名其妙的离婚，莫名其妙的和好，黄磊再这么下去，人设崩完了,0
2,26907450,麻烦家族,听故事的人,137065019,还行,2017-05-14,17:24:45,片子比较松散，但是像发生在身边的琐事，具有真情实感。,2
2,26907450,麻烦家族,仪歌,yigedejia,还行,2018-09-09,00:05:25,有些刻意不够生活，演员演技还是在线的，就是有点怪怪的,0
2,26907450,麻烦家族,大空,4247692,较差,2017-05-11,21:36:20,在老太太撕掉协议书的那一刻我觉得这电影完了。,6
2,26907450,麻烦家族,小Aileen,merrylin_fu,很差,2017-05-24,03:23:15,一星给牛二,3
2,26907450,麻烦家族,鸟仔,smellingcat,还行,2017-11-10,02:11:59,说情景剧质量的，是没有看过《我爱我家》么？,0
2,26907450,麻烦家族,了了,47144686,还行,2017-05-20,12:20:38,比起《似水年华》，黄磊失去的不只是灵性，还有文艺感甚至韵味，更像是《似水年华》的故事里刘若英从没出现过。,0
2,26907450,麻烦家族,pengbin197,pengbin197,较差,2017-05-19,16:09:49,看得都要睡着了，只取样式没有得其精髓翻拍片通病。,0
2,26907450,麻烦家族,coie,vinacoie,较差,2017-07-21,00:34:57,亦步亦趋地搬过来，可是人物丢了原版的可爱。,0
2,26907450,麻烦家族,元气少女himiko,lotusmomo,力荐,2017-05-14,23:17:24,魏大勋真帅！,0
2,26907450,麻烦家族,豆友131384864,131384864,还行,2017-05-11,15:57:32,生活本不容易，总有令人应接不暇的矛盾和烦恼压得人喘过气来,0
2,26907450,麻烦家族,一條魚佔滿了河,BlindwolfHyn,较差,2017-10-19,00:13:24,《家族はつらいよ》多好，撲面而來的生活氣，自然生動的幽默感，真摯動人的情感。但是毫無本土化的複製黏貼，令本片與中國國情距離遙遠，前述的優點全都不見蹤影，電視化的表演讓電影顯得充滿廉價感，最後，生硬的植入廣告將影片的圈錢性質暴露無遺。,0
2,26907450,麻烦家族,O型血,UloveWo,很差,2018-01-18,09:32:06,黄磊翻拍日剧《深夜食堂》，差评、低分。翻拍日本经典电影《麻烦家族》，不接地气，依然差评、低分。这是一个多么失败的导演呀。和《家族之苦》没得比，差距太大了。角色完全不真实，不像一家人。李立群很适合演这种角色。https://www.bilibili.com/video/av12637440,0
2,26907450,麻烦家族,小黑no-white,74585644,较差,2018-07-30,23:14:29,生翻，甚至很多台词、情节还没翻译好。,1
2,26907450,麻烦家族,M,ladadadadada,较差,2017-08-08,20:34:16,没有比较就没有伤害。,0
2,26907450,麻烦家族,你是2B我是铅笔,3969752,较差,2017-07-08,21:57:57,看评论说这也是翻拍的？？所以最近黄老师都是这个路数吗？还是喜欢向往生活里的黄老师，以及似水年华里的少年。,0
2,26907450,麻烦家族,Lululun𓅪,38850585,还行,2017-11-07,13:48:02,没有看过《家族之苦》的表示单纯看这几个演员还是可以随便看看的，剧情就忽略吧,0
2,26907450,麻烦家族,帕里克吃布洛芬,leisurelee,较差,2018-03-15,16:08:16,没有那么差，但观感特别差的原因是，照搬，没有本土化。,0
2,26907450,麻烦家族,狗富贵,130069436,较差,2017-09-15,10:02:58,剧情有问题，李立群演的还是不错的。,0
2,26907450,麻烦家族,calendar,94151298,较差,2017-12-25,08:55:21,也太难看了…但是魏大勋的几套冬季男士穿搭貌似还不错？#迷之关注点#,0
2,26907450,麻烦家族,米多多,deliciousss,还行,2017-11-26,22:36:28,黄磊身上糟点少，主要他身边都是一群很棒的人，无论是受他影响而变得优秀，还是他自身魅力所吸引而来的优秀的人，不出现原则问题，他会是我唯一支持的内地男演员了,0
2,26907450,麻烦家族,碳水达人宋小宝,120787443,还行,2017-07-09,12:36:30,给三星，生活不正是这样鸡毛蒜皮的小事一点点堆积成大矛盾了。没看过原版不比较，很多剧情多余。岳岳真是迷之体制，做配角就能承担所有笑点。不是很喜欢黄磊，但给孙莉大勋岳岳还有软萌萌的台湾妹子加一星。,0
2,26907450,麻烦家族,玉麒麟宋哪吒,songxiaozao,推荐,2017-05-11,16:26:11,汉化得相当成功，当下还有谁敢拍大屏幕的家庭电影？李立群老师演技真是超神。,7
2,26907450,麻烦家族,无见解,king925,很差,2017-07-04,09:02:19,抄袭《家族之苦》，抄袭剧其实一分也不配得。,0
2,26907450,麻烦家族,黑白,47821373,力荐,2017-05-11,14:15:01,妮姐这句话超级经典：你哪儿都没做错也不代表你就是个好丈夫…,14
2,26907450,麻烦家族,诸葛钢铁,64740791,较差,2018-02-12,10:05:53,到底是有多难理解，现代中国和日本韩国的生活习惯，人文素养，社会氛围是有天差地别的。这一大家子里没几个是正经中国人。,0
2,26907450,麻烦家族,SENSE8,3560989,力荐,2017-05-11,20:22:46,所有的麻烦都是不经意间，所有的感动也都是亲情所致，不经历风雨怎么见彩虹。分分合合过后才见真情。,3
2,26907450,麻烦家族,白茅,68984410,较差,2017-07-02,21:53:51,2.0。戲挺適合黃磊導，可惜導得形神俱散，沒有導演風采，其功力和何炅的《梔子花開》難分伯仲。,0
2,26907450,麻烦家族,我没哟,121627094,还行,2017-05-15,11:39:22,导演的第一部电影可以围观一下其朋友圈。据说是翻拍的，但是感觉翻拍的意义不大。为什么不能好好找个原创剧本来拍呢？,0
2,26907450,麻烦家族,季霖,joincaroline,很差,2017-05-26,23:52:31,据说是翻拍《家族之苦》；我没看过后者，也都觉得这部片子并没拍好，两部都看过的观众那感觉就更别提了。想了想还是给了一星。全片也就觉得李立群和魏大勋的角色还有些印象，孙莉和林丛的角色也还好，其他角色的设定...尤其是奶奶，真心看得不习惯。影片基调很平，没有出彩之处，差点看不下去了。,0
2,26907450,麻烦家族,Jinsui,2504247,还行,2017-05-15,17:34:16,一看就知道是小成本电影，品质感非常差，但是有原日本版的基础，剧本不会太差。片子的演员阵容和宣发看起来不错，回本不成问题。但是黄磊老师啊，观念怎么觉得有退步呢……,1
2,26907450,麻烦家族,FRUITYBURSTS,lunamu,较差,2018-01-11,21:10:23,果然是翻拍... 浑身上下透着一股没有本土化的味道,0
2,26907450,麻烦家族,三罐啤酒,51888216,较差,2017-06-30,13:02:15,"——他不爱我。
——爱?妨碍的碍吗？",0
2,26907450,麻烦家族,阿依,151573222,很差,2017-05-16,16:15:16,垃圾,0
2,26907450,麻烦家族,吕中中,147949568,还行,2017-07-01,00:27:03,中国需要提出这样一个问题的电影，但是后劲不足，搞笑的太故意，不过黄磊老师的眼光还是很犀利，就可以一下找到生活的问题,0
2,26907450,麻烦家族,乔希拉,irisyours,较差,2017-07-16,19:41:32,演技差太多 群戏没有对手戏的感觉 海清和王迅演得很活 黄磊夫妇像纸人 人设没有本土化啊看起来就是大写的尴尬,0
2,26907450,麻烦家族,槑槑,148376167,较差,2017-05-12,11:44:56,不懂本土化的重要性，中国式的为人处事和城市感完全丧失。美术置景 人设完全按日版来，一点儿自己的发挥都没有，这样的翻拍有何必要？,0
2,26907450,麻烦家族,斯比瑞特,xiaobenma,还行,2017-07-01,10:09:53,其实完全照搬的， 不知道为什么评价都差别巨大。可能故事背景文化稍微不同。看日韩人听了对方说话之后，不回话好像习惯了。但换成中国人就别扭。还有日韩印度人好像肢体表情比较自带喜感。中国电影如果没有对白的时候好像会很空，所以必须用台词填满所有时间才行。好像也只有赵本山那伙人还有点这技能,0
2,26907450,麻烦家族,糯米丸子,127908787,力荐,2017-05-11,14:11:08,不管是怎样性格的两个人，只要在一起相处久了，绝壁都是会有问题的，所以，怎么去相处才是最关键的。,20
2,26907450,麻烦家族,独之孤,140016610,很差,2017-05-12,18:47:54,其实很有必要拿这部作品去深入探讨当下“翻拍热”的一些意义和潜在问题。借鉴是需要本土化的，否则就真的与“抄袭”画上等号。连人设，台词都会如此雷同，即便抛开劣质的表演和强加的对比，节奏和配乐等也是凌乱不堪。后辈认为黄老师作为新晋导演的一员，真的需要学习很多。,1
2,26907450,麻烦家族,绿小草,zxyang,很差,2017-09-30,17:11:41,难道是因为两倍速的原因 觉得啥都没说就结束了,0
2,26907450,麻烦家族,Grand Enough,25982397,较差,2017-06-30,20:35:48,毁了深夜食堂 又毁家族之苦 黄磊这人设是彻底崩了,0
2,26907450,麻烦家族,蓝色啄木鸟,73056364,较差,2017-05-15,09:36:28,扑街了，连很迷向往生活里的黄磊的老姨都说不好看，也没啥亮点!,6
2,26907450,麻烦家族,390348839,62094946,较差,2017-05-11,21:09:15,请不要用老龄化出现的问题当强硬的热点捆绑，一点也不顺理成章。,1
2,26907450,麻烦家族,查理狗崽子,83389859,很差,2017-05-11,22:43:51,您神算子的“智慧”都用来骗观众的钱了，真行啊！,11
2,26907450,麻烦家族,专业非认真刷片,137555231,较差,2017-07-01,23:09:47,改编日韩某片吧……,0
2,26907450,麻烦家族,水光潋滟,138601913,力荐,2017-05-12,09:26:44,少年夫妻老来伴，不赞成老太太这个岁数了还闹离婚，人家老头也没啥大的过错，对她也不错，不能因为那些所谓的理想化的东西就离婚吧。,1
2,26907450,麻烦家族,巴别塔的光芒,46572945,很差,2017-06-30,19:08:49,无论是翻拍还是原创，此类型片都走进了一个死胡同，说不思进取还是好听的，其实就是骗钱。,0
2,26907450,麻烦家族,一自夂,65124379,还行,2017-05-11,22:05:15,"看开头觉得还行啊，就觉得结尾好突然，当然也许这就是家庭的片段在哪里结束都是正常的吧。
",0
2,26907450,麻烦家族,Kazia,ice_pudding,较差,2017-08-12,02:18:57,缺少电影感，拍得像小品，然而如果是大导演这就是一种风格，在熬出头之前最好不要这么做。电影里的房子是不是在哪部电影里见过，真的就是一直想不起来【强迫症翻到吐发现应该是重返二十岁的那个房子。内涵很易懂，但是现在应该有更高级的东西被创作出来，然而并没有。,0
2,26907450,麻烦家族,彭太太,31465038,还行,2017-05-14,22:58:02,像我这样偏激的人竟然觉得挺好看、黄磊这个文青当爹之后当厨子、骨子里的劲儿还是文青. 恩爱恩爱没有恩哪有爱,0
2,26907450,麻烦家族,梅林,2340389,较差,2017-05-11,23:54:30,完全复制日版，将剧情的平淡松弛也全学了过来，一点创新都没有。演员照搬原版人物的演法，日式生活气息较重，长子黄磊存在感太低，女婿王迅成功抢戏，所谓中国地气接的不明就里，只是一次不完全克隆品。,0
2,26907450,麻烦家族,梅梅七七小发发,37567847,较差,2017-11-26,11:15:03,哎呀妈呀，这种谷歌翻译式的翻拍真的太尴尬了，中国哪有这么和谐的家族啊，黄老师明显不懂人间疾苦呀，三弟和三弟女朋友也和《家族之苦》里差太多了吧，看得我几乎崩溃！！,0
2,26907450,麻烦家族,紫罗兰,CCLOVEFF,力荐,2017-05-11,17:07:58,家庭会议那段，简直像是《人民的名义》里的升常委扩大会议，针锋相对矛盾四起啊，哈哈哈。应该取名叫《家庭的名义》啊哈哈哈哈。,6
2,26907450,麻烦家族,Meow_see good,58371683,很差,2017-05-13,09:55:03,黄磊作为电影学院的老师，拍成这样不感觉到惭愧吗？！,7
2,26907450,麻烦家族,kzkr,kazuki_,很差,2017-07-01,11:45:52,毫无意义的翻拍 除了李立群 其他年轻演员较日版根本没法比 尤其魏大勋这个逼 黄磊已经在山田洋次原作基础上弱化了二儿子的戏份了 结果还是特别糟糕 这角色还敢叫文聪 真他妈是对妻夫木聪莫大的侮辱,0
2,26907450,麻烦家族,六神花露水,151260774,力荐,2017-05-11,15:29:16,两个人走到一起的时候看对方哪儿都可爱，但相处久了，也许当初觉得可爱的地方都一无是处了，这就是最现实的婚姻。,4
2,26907450,麻烦家族,jinwen1515,jinwen1515,较差,2017-05-18,14:07:49,演员功力都不错 可惜拍的太肤浅 不是我们不懂老年人和平淡的生活 是导演的表现手法过于糊弄或者说本身就拍不出那种深刻厚重的感觉 比如摔跤吧爸爸 不用宣传 自带光芒。,1
2,26907450,麻烦家族,梦之安魂曲,Makoto614,较差,2017-06-30,20:52:58,没有真实感。和日版同样的故事，翻拍出来怎么差那么多？！,0
2,26907450,麻烦家族,荍麦,50103837,较差,2017-05-12,15:57:06,天呐！从第一个镜头就开始让人觉得反感，完全照搬日版剧情和台词，毫不讲究的运镜和音乐，随意煽情，叠加“中国式综艺”笑点的包袱…李立群的表演方式甚至带了些中年黄磊的感觉～完全不知道这样的电影拍了干什么！？也没有什么中国元素～,5
2,26907450,麻烦家族,旅途人生,140581573,很差,2017-06-30,08:56:54,完全复制翻拍麻烦家族，本土化也不成功，尤其是房子也都雷同，餐厅也相似。相反，麻烦家族真正暖心的细节倒删减不少，护士女友的作用淡化，所以故事推进也不如日版严谨！不过也就最后还算添加了一些故事。但比起缺点，还是微不足道,1
2,26907450,麻烦家族,K&L,52811117,还行,2019-06-08,17:19:44,麻烦家族,0
2,26907450,麻烦家族,slartibartfast,alonenemy,较差,2021-01-10,11:19:47,演员撑起来的喜剧，前面足够欢乐，但是这结尾真的是让人哭都来不及，问题就这么睡几觉就解决了？如果是平实的生活哪有这么多模板化的喜剧表演,0
2,26907450,麻烦家族,大脸猫,162267061,很差,2019-02-09,17:51:59,住在京郊别墅，就这个设定，这个就不及格,0
2,26907450,麻烦家族,老虎,tigerzty,还行,2017-05-11,20:25:13,还行，比我想象的好，没有低级刻意的笑料，算是诚意之作。,1
2,26907450,麻烦家族,无为而治,151820885,还行,2017-07-09,22:17:35,这部电影，真的没有共鸣之处，就是一群人在随意“冲突”，再“冲突”。还是要“冲突”。请问你们的点在哪里呀。这真的是一个家庭吗？感觉不出来。就是一堆人在“闹事”“相互埋怨”。并没有觉得有出彩的地方呀。大家思维逻辑不在同一个世界，想分开了，最后被一个不经意回想，唤起了当初的爱。曾经。,0
2,26907450,麻烦家族,SASO,bodysun,较差,2020-03-29,18:34:45,。,0
2,26907450,麻烦家族,Shing Chen,53781076,较差,2017-07-02,18:08:05,故事本身的冲突爆发的不太合适，激烈程度不够。家庭戏可以设置的偏生活化，但是不是我们看电影就想看到假的生活状态。日本和韩国的一些家庭剧，胜在了氛围节奏营造和情感烘托营造。这部电影想做成喜剧，又想做家庭温馨，虽然分开做都做不好，但一起做更糟。看完像看电视剧。,0
2,26907450,麻烦家族,momo,157109306,,2017-05-11,01:12:04,黄磊老师做演员是很优秀的 做导演还是不评价了 还好影片演员演技都在线 ,11
2,26907450,麻烦家族,来自土豆星球,3967315,还行,2019-02-06,21:22:01,还真像黄磊说的……很平，但也不是仅仅平能概括的，有些为了特意搞笑而作的点……让人感觉不舒服,0
2,26907450,麻烦家族,年少影追,qrh2010,很差,2017-05-18,15:46:04,第一次看到黄磊要翻拍山田洋次的《家族之苦》（取名《麻烦家族》）的新闻时，我心想黄磊老师心可真大啊，作为一部处女作，说不好是勇于挑战高难度，还是拎不清给自己找麻烦，事后证明作为一名登山爱好者，刚要学爬山，咱也不能直接挑珠穆朗玛峰不是，一向号称睿智“神算子”的黄磊，这次真是失算了。,5
2,26907450,麻烦家族,八爪,4454692,较差,2017-08-01,03:38:16,看完才知道原来是照搬日本的《家族之苦》。既然是照搬，剧本就没有问题，问题就在于如何“国有化”。本片舞台剧味很浓，估计这是黄磊拍片的原因之一。而选角和角色的演技上却层次不齐。海清和王迅一组融入度最高，台湾的李立群甚至任容萱也颇“应景”。反而黄磊本人在打哈哈，张伟欣更是漂在了片外。,0
2,26907450,麻烦家族,柯不悔KOKIKA,1828898,较差,2017-08-13,01:59:13,我第一次觉得黄小厨演技是如此的差，，，全片真的是靠李小璐妈妈清丽而遗世独立的气质和李立群老师不着痕迹炉火纯青的表演风格在支撑。孙莉倒是也还合格，，，海清和王迅能不能演什么都市井气息过于浓郁？不过还是好喜欢李立群老师在小区踩小自行车的段落,0
2,26907450,麻烦家族,XY㍿,snowandrain,较差,2017-07-03,20:59:10,就算根本没有日本的原版来作对比，这一部也不好看啊。黄磊今年太砸招牌了。,0
2,26907450,麻烦家族,好吃的酸黄瓜,63681438,还行,2017-05-11,19:31:34,大勺没有不碰锅沿儿的！再亲近的人也会有摩擦，再团结的家也会有麻烦。当然，亲情和爱却是永远都无法冲淡的。好喜欢《麻烦家族》的赶脚。,3
2,26907450,麻烦家族,玛卡巴卡,125834925,推荐,2018-08-08,20:44:03,电影适合两口子相互依偎在被窝里看。说到底还是离不开沟通。,1
2,26907450,麻烦家族,落雨纷纷,68666799,力荐,2017-05-13,09:47:17,没想到黄磊的老“处女作”这么出彩，温馨甜蜜中透露着不可调和的矛盾，激烈的冲突里夹杂着家庭式的温暖，为黄磊老师点赞。,2
2,26907450,麻烦家族,大唐盛世,57288434,还行,2017-07-08,20:53:26,画质:★★★★；音效:★★★★；演员:★★★★★；情节:★★★。,0
2,26907450,麻烦家族,出云,16951821,很差,2017-12-13,22:31:12,我…我…没看完……,0
2,26907450,麻烦家族,(空地),130603884,较差,2021-03-28,14:08:20,差一大截,0
2,26907450,麻烦家族,icecream,49550156,很差,2017-07-15,20:27:49,什么鬼？,0
2,26907450,麻烦家族,Chupa Chups,89434002,较差,2017-05-15,14:19:11,和妈妈一起看，摊手┑(￣Д ￣)┍,0
2,26907450,麻烦家族,Aspartao,david0819,很差,2019-02-03,22:10:03,临时组的一家人吧，生硬，尴尬,0
2,26907450,麻烦家族,花先森的猫,49644803,很差,2017-10-27,23:43:46,看了十分钟。至少前十分钟的剧情个人很不喜欢。抱歉。实在坚持不下去了。,0
2,26907450,麻烦家族,呂堅果,54081289,力荐,2017-05-11,14:15:43,忽然感觉随着自己的长大。对父母的理解越来越少，啥事都有点利索当然的感觉，简直应该反省。,5
2,26907450,麻烦家族,丝丝sisi,130406437,推荐,2017-05-12,09:18:27,支持黄磊老师！,4
2,26907450,麻烦家族,NSFW Fans,3988346,很差,2017-11-24,18:47:35,奋力坚持看了不到二十分钟，尴尬和虚假连连，要命的是还揣着个自以为有趣和欢乐的奇怪架子在所谓强行接地气。明白了，就算不是翻拍就是原创，那也改不了低劣。电话色喘、低胸走光、睡衣夫妻，“你妹”热词，小馆喝酒，京郊别墅，无一样不失真且鄙俗，非得如此，连累得本来烟火气十足的演员都看着恶心。,0
2,26907450,麻烦家族,水房,jamesgu,推荐,2017-05-12,22:24:09,导演在做足生活内容的同时，还不忘博大家一笑，摆脱了无厘头喜剧的套路，融入了诙谐幽默的表现手法，使故事更加欢乐逗趣，在笑闹中展现出家庭生活常态，很容易将观众代入到角色中来。,0
2,26907450,麻烦家族,爱美丽姐姐,ameliefei,还行,2017-05-19,23:58:53,家长里短，婆婆妈妈，平淡无奇，包袱不够，落入俗套，唯有黄磊人缘果然是棒棒哒！,0
2,26907450,麻烦家族,KevinX,KevinXu1009,较差,2017-07-02,20:31:01,最可怕的 就是照搬了 再没有任何值得指摘的地方了,0
2,26907450,麻烦家族,Momolog,momolog,,2019-02-10,19:14:38,#trainmovie,0
2,26907450,麻烦家族,不认识我这很好,78254965,很差,2017-10-06,23:52:59,我以为有啥新意或者格外好笑呢。然而淡死了。也没有感到家庭温馨的感觉，观感和普通都市家庭连续剧差不了多少，由于篇幅的原因故事还不如连续剧有趣。人设也没有特别突出的地方-----由于是期待过的，果断一星。生气。浪费票钱。,0
2,26907450,麻烦家族,思凝,151287336,还行,2017-06-10,00:46:28,没看过原版，和妈妈一起看的，反而我比妈妈看得开心。像是在自家看电视，像是一出小品。看似缺乏深意，但这便是生活。,0
2,26907450,麻烦家族,巴里问道,frnong,很差,2017-10-13,12:37:42,看了日本的原片，家族之苦，把3星改成1星了，唉，黄老师原来我还挺喜欢的。,0
2,26907450,麻烦家族,Aeolus,CBSYling,还行,2019-08-12,23:50:59,感觉分数有点过低了，没落地，中国人演日本事儿的感觉。但故事核其实是抓人的,0
2,26907450,麻烦家族,线条,yetmeaningless,很差,2017-07-04,00:42:53,黄磊真糟蹋他媳妇儿,0
2,26907450,麻烦家族,@花皮球@,huapiqiu,较差,2019-01-09,00:30:17,这是什么鬼东西,0
2,26907450,麻烦家族,老张啊。,qiangqiangzhang,较差,2017-05-16,10:22:11,在电影院看了两集当代电视剧。,4
2,26907450,麻烦家族,坐电梯上厕所,57811727,还行,2017-05-14,12:22:57,老少皆宜，就是看一乐呵，挺逗的,0
2,26907450,麻烦家族,憋扯我,142626908,很差,2017-07-22,17:07:30,好烂,0
2,26907450,麻烦家族,athena,42785643,较差,2017-07-04,19:28:04,演技有，立意有，情节太差。,0
2,26907450,麻烦家族,小蚂蚁,138188046,还行,2018-12-24,11:53:14,节奏有点散，故事有点浅，演员还不错。,0
2,26907450,麻烦家族,我只是个路人,142210452,较差,2017-05-16,16:37:05,太难看了，如果这种家长里短的剧情拍成电视剧还会有大妈喜欢看，但是电影在一两个小时之内还是不适合这种平淡，戏剧冲突不突出的剧情,0
2,26907450,麻烦家族,杨三月_,143228826,很差,2017-05-11,15:11:44,"全员都演的跟闹着玩儿似的，特别是小璐妈。笑点尬点傻傻分不清，神算子还是别作妖了，好好拍戏上综艺秀秀聪明才智算了，这么好的题材翻拍成这样。从名人一个个倒在导演这个角色上来看，导演真不是谁都能当的…
特想看看日版解解尬…",2
2,26907450,麻烦家族,明明_Andy,81706773,较差,2018-04-18,16:14:44,闫妮那条线是用来客串的吗？,0
2,26907450,麻烦家族,假面Vic小飛俠,euphoriavicc,很差,2017-06-29,23:00:07,黄磊也太把自己当回事儿了,0
2,26907450,麻烦家族,Bounce l,61855461,很差,2018-02-03,15:15:24,好不热闹的家庭剧，一般般也就那样,0
2,26907450,麻烦家族,Young_To,youngtoo,很差,2017-05-15,11:04:02,还能再差一点吗 中国家庭有中国家庭的特色 改一下剧本 好好拍拍中国家庭的烟火气一定会很有意思 一味照搬照抄就真的没有意思了,6
2,26907450,麻烦家族,2007.5.22,64243172,还行,2017-07-20,22:40:47,李立群真厉害,0
2,26907450,麻烦家族,MAYHOW,hwq0809,还行,2017-05-11,21:11:16,冲黄磊指导去看的，很早老妈也关注到这部电影。记得有一次看《向往的生活》有一期黄磊的学生们造访，第二天一大早他与一个现为大学教师的学生爬后山时的一番谈话，心想如果有一位这样亦师亦友的老师何等人生幸事。这部电影挺写实的，并不是一开始自以为的搞笑电影。,0
2,26907450,麻烦家族,寒冰之凌,185046114,较差,2022-07-15,00:09:36,一般,0
