page_index,movie_id,title,username,user_id,rating,date,time,comment,useful_count
1,26826398,杀破狼·贪狼,梅林,2340389,还行,2017-08-17,22:55:07,市长：最近少女心喜欢粉红色。林家栋：别说话，射我。贩卖器官老大：领龙套的钱，打BOSS的戏。托尼贾：护身符送别人，自己只好领便当。吴樾：我的存在是为了正三观。古天乐：凭啥吴京挨了子弹啥事都没有，我挨了一铁钩就得拐着腿走路？,13
1,26826398,杀破狼·贪狼,H.C.McTang,macrossduck,还行,2017-08-20,19:36:03,这个时候应该寻求天朝使领馆的帮助,0
1,26826398,杀破狼·贪狼,宇木光澜,qisan73,还行,2017-08-19,22:18:27,最近觉得自己开始喜欢看打戏，我我我😢总的来说比较流畅，虽然故事的本底有点扯淡，但冲突处理，情节设置上都挺棒的。古天乐演技棒棒哒！但我喜欢那个泰国警察啊！一些逻辑存疑可以忽视。,1
1,26826398,杀破狼·贪狼,哦米葛,40373499,力荐,2022-02-19,13:09:31,古天乐看到女儿尸体那段演技太炸裂了。结尾处女儿那段对白很感动。,0
1,26826398,杀破狼·贪狼,一日看尽长安花,155069623,还行,2017-08-17,02:23:38,动作戏非常好看（但是偏少），但是剧情BUG太多，还有就是打得最好的托尼贾戏份有点少（算小小的剧透，托尼贾跟反派头目那场打斗个人觉得是最精彩的），只是便当领得太随意了。最后算小小剧透一下，我要是古天乐饰演的那个角色，我就把林家栋饰演那个角色最在意的东西毁灭掉，这才是对他最大的报复。,8
1,26826398,杀破狼·贪狼,L。sT,tinas,推荐,2017-08-25,17:20:14,运动指导满分！古天乐的表情情绪满分！,3
1,26826398,杀破狼·贪狼,望仔放弃减肥了,lltflyx,推荐,2017-12-02,12:31:13,古天乐这片子里演技很棒啊，尤其是两场认尸戏和最后听心跳的戏，完全展现了一个父亲浓烈而复杂的情绪。最后的不杀，我认为纯粹是因为不舍得。虽然不是重点，但女儿太作了。,0
1,26826398,杀破狼·贪狼,胡桃园咔嚓女王代表老柴咔了你,musichellsing,还行,2017-12-12,20:55:46,主题本来很好，可惜结局来了个温情的狗血。善良死了就终是死了，上一集托尼贾还救回了女儿，这一集古天乐的女儿直接被黑市器官链条杀害，杯吹之余，古天乐还要为此埙命，然而觉得故事到这里结就好了，偏要弄一个古天乐女儿遗言宣讲生命平等并且吴越的孩子出生之喜…这就很过分了。,0
1,26826398,杀破狼·贪狼,橘色番茄。,49248736,较差,2017-08-19,13:53:43,剧情bug到难以直视 可能是没请编剧吧,5
1,26826398,杀破狼·贪狼,波波维奇,pingguohongle,推荐,2018-10-13,20:37:53,故事并不复杂，但影片是好看的，喜欢古天乐的表演。,1
1,26826398,杀破狼·贪狼,七彩云男,izaijin,推荐,2017-08-24,14:49:11,挺惊喜的。古天乐尤其赞,2
1,26826398,杀破狼·贪狼,边城玫女,coffeeshe,还行,2017-10-29,11:56:09,落日港片最后的余晖。看到开头，你就能猜中结局。精彩的地方在于两场打斗，托尼·贾的泰拳，吴樾的双刀。拳拳入肉，刀刀见骨，这两段的确很精彩。吐槽一下，你确认那是泰国警察崔杰？而不是泰国反贪局长陈海？这位陈海一亮相，我心想要遭，肯定会出车祸死了。结果等了半天，他老婆出车祸死了……,1
1,26826398,杀破狼·贪狼,huyouyou,huyouyou,还行,2017-11-03,08:51:39,一切都是为了打斗服务。#20171102,0
1,26826398,杀破狼·贪狼,深夜的阿斯伯格,35827809,还行,2017-12-16,13:58:56,警匪片总是喜欢用《月亮代表我的心》残暴黑暗与温柔阳光反衬么？那么多年过去了，乐跑还是一点都没变，再也不能演少年了，不过黑人不显老嘻嘻。这部剧情太弱了，人物也少。我知道下部林家栋演主角嘛！,0
1,26826398,杀破狼·贪狼,开膛手贝塔,nipperbeta,还行,2017-08-19,17:34:38,文戏竟然比武戏还多。天道好循环，现在大家都开始向着老杜的宿命论调看齐。三部里面，这一部的剧情最优。不是为打而打，已经很不错了。,3
1,26826398,杀破狼·贪狼,殇潮|Enigma,freddy_xu,推荐,2017-09-03,14:57:08,打得其實挺好看的，但是真的每個角色都已經突破人體機能的極限了，看得人好累,1
1,26826398,杀破狼·贪狼,荆棘,AlohA0407,推荐,2018-03-27,05:11:07,打戏很好，但是反派好像有点弱。很像飓风营救，可惜最后没有奇迹。古仔真卖力……不知道没孩子的人怎么做到如此真实的表演的……超级好演员！,0
1,26826398,杀破狼·贪狼,Enjoy_時光機。,enjoy614,推荐,2018-10-15,21:51:51,《杀破狼之老夫的少女心》。剧情乏善可陈，但打斗场面实在精彩。黑古拿奖之作，演技可以！2018.10.15,1
1,26826398,杀破狼·贪狼,garychan001,43002828,还行,2017-09-01,00:12:06,故事其實可以，古天樂角色的內心矛盾是殺破狼系列中最有深度的一個,1
1,26826398,杀破狼·贪狼,木偶,1333942,还行,2017-10-24,11:37:15,杀破狼这种动作片系列的重点在于打斗，这一部洪金宝的打斗设计很赞，让古天乐，吴越，托尼贾三个人的打斗风格鲜明。至于故事，这一部比较丰满，但还是很弱，不过不要要求那么多了。,1
1,26826398,杀破狼·贪狼,穆如初,44652353,还行,2017-08-19,21:02:26,有痛点有节奏点。但故事略单薄陈旧了。吴樾蛮酷。,0
1,26826398,杀破狼·贪狼,榴莲大侠,54837226,推荐,2017-08-21,23:59:46,被旁边的单身妇女的连声“OMG”闹得出戏，哈哈哈哈哈哈哈哈哈,3
1,26826398,杀破狼·贪狼,渡桢,79279948,推荐,2018-04-17,01:42:24,拍得四平八稳，动作设计出彩，看得很爽！,1
1,26826398,杀破狼·贪狼,香简凝缘,4052965,推荐,2017-08-21,22:46:18,古仔演技爆棚！对于我来说，剧情有点太血腥了，好多镜头都不敢看啊！还有啊，感觉这是一部反泰国旅游宣传片吧！看了都不想去泰国旅游了，海边走着走着就被贩卖人体器官的人掳走了呀！,5
1,26826398,杀破狼·贪狼,她还没有死,deathnroll,力荐,2017-08-22,01:45:07,一部冷硬的动作片 暴戾的气质随处可见 拳拳入肉 刀刀见血 什么？你还在乎情节？出门左拐瞧瞧别的哪个厅放的电影比它更真实 我的城市二十二可没排片 敢不敢把故事背景设置在大陆呀？,7
1,26826398,杀破狼·贪狼,一個死槍槍,boe,还行,2019-05-20,10:14:31,這打戲竟然看出了一種解數學題的感覺~,0
1,26826398,杀破狼·贪狼,烈焰红唇龙,lovehans,推荐,2017-08-19,20:58:12,古天乐的影帝演出，托尼贾太可惜了，吴樾嗜血双刀帅爆！,11
1,26826398,杀破狼·贪狼,quai,quai,力荐,2017-08-18,23:32:49,杀破狼还是叶伟信导最合适，反正统、反高潮，在你以为最后一战即将来临，古要大开杀戒的时候戛然而止，终于又有了杀1的感觉……郑保瑞保祥瑞保平安，如果不是有古的那个阴鸷角色，杀2的丰富度也会低很多，而且商业电影有了小孩子，基本也就定基调了。,8
1,26826398,杀破狼·贪狼,思惟凝胶,2246961,推荐,2017-12-15,20:14:12,Life is limited. Just accept it. 作为小人物，再挣扎也没有用。,1
1,26826398,杀破狼·贪狼,海生,KenzoLiu,推荐,2017-08-18,20:51:26,有谁能够决定谁的生命是否有价值？但是被天灾夺走那些人又如何呢？其实命运的开端由他们夺走的初始已经决定了，当杀戮开始之后，任何事都已经走向了最终的毁灭。,0
1,26826398,杀破狼·贪狼,小溪笑嘻嘻,ravinenoravine,还行,2018-05-09,01:05:24,前半段和结尾段都抓人，抵不过仍有一些陈词滥调的情节和故意炫技的花哨。喜欢两名主角父亲关系的映射。DI真的好丑啊……,1
1,26826398,杀破狼·贪狼,甦醒 Nostalgia,52460978,较差,2017-10-21,22:39:47,没啥新意，类型片模仿的好罢了，动作设计出彩，古天乐演技卖力。《飓风行动》的父救女，以及政治阴谋这些套路都很眼熟，也就结局比较反套路还挺暗黑，合格的爆米花。,1
1,26826398,杀破狼·贪狼,Asayake,4601528,还行,2018-07-10,11:30:36,且不说心脏手术是不是这么做的，泰国本来就是个相对穷、腐败、乱的国家，你大街上随便搂几个人就得了，简单方便快捷，非弄个外国人搞成国际事件。一群幕僚都是智障？都夸古天乐的那段高潮戏，反正我一直跳戏。整个片子还是合格的,1
1,26826398,杀破狼·贪狼,冰仔,sleeplessBing,还行,2017-08-21,00:38:40,初看以为是吴镇宇，细看以为是化妆成吴镇宇的吴京，最后看豆瓣的演职员表才知道是吴樾……,1
1,26826398,杀破狼·贪狼,冒,zaijianyici,还行,2017-08-25,00:03:39,手拿菜刀砍电线，一路火花带闪电，三星不能再多,1
1,26826398,杀破狼·贪狼,小谢耳朵。,90971839,还行,2017-08-20,17:07:49,剧情老套，漏洞挺多，最完美的结局应该是警察局长在屠宰场就一枪干掉古天乐。,4
1,26826398,杀破狼·贪狼,默语生,yeun,还行,2017-08-19,01:06:04,剧情太平，大部分时间节奏并不像打片。有限几场打斗承袭前两部硬朗风格，也有标志性的片刀对劈，可惜古天乐实在不算打星，动作戏基本靠快剪，吴樾和托尼贾完成任务。结尾竟然没黑化，转进到温情戏，有些浪费。挺想看古天乐杀光大宅所有萝莉徒留死老头一人苟活的完美结局啊。三星。,6
1,26826398,杀破狼·贪狼,Kipu real,142474097,推荐,2017-08-21,21:58:33,八分，最近看的比较好看的电影了，剧情紧凑我跟着走。缺点：前期父女之间感情线交代太少，后期全靠古天乐一人演技实在难以共鸣，可怜我杨过一人醉！另外主角光环真的有点过分啦！！！！有一段杨过被勾住腿拖着走，我都叫出来了！金宝叔叔指导的动作果然棒棒哒！八分，推荐观影～,5
1,26826398,杀破狼·贪狼,爱在午夜降临前,48436897,还行,2019-02-05,20:25:36,人呢？如果只是看到眼前的，就算你去到多远，天空有多宽阔，看的东西还是那么窄。,0
1,26826398,杀破狼·贪狼,zzy花岗岩,3718831,还行,2018-01-19,21:36:37,动作戏仍然是本片最大的亮点，托尼贾戏份太少很可惜~,1
1,26826398,杀破狼·贪狼,琧婯,cloudlandlord,推荐,2017-08-24,11:40:31,打得还可以，文戏总是这么扯。。我以为结尾是直接把心挖出来带回家呢，不过这结尾同样ok。古天乐有多次特写·镜头眼睛睁得都快掉出来啦,0
1,26826398,杀破狼·贪狼,白夜💫💫,49095617,还行,2017-08-17,21:56:09,看过一二部，感觉不是很喜欢，这一部倒看进去了。前半部分类似于飓风营救，动作设计略浮夸，感觉每个人都会轻功和气功。结局有点烂尾，迷雾揭开太容易，主角却付出了太多无谓的打戏，最后还屈服于权力，无语。吴樾倒是有着莫名的吸引力，可能是发型略清新。,8
1,26826398,杀破狼·贪狼,公知亲妈火化师,46356952,推荐,2018-10-23,19:24:19,白衣小女孩被抓走给很有权势的老者续命的故事，港片看内涵，多给一星,1
1,26826398,杀破狼·贪狼,西决,c541223724,较差,2017-12-16,09:56:00,结局还成,1
1,26826398,杀破狼·贪狼,Mushroom,MSY,还行,2021-11-06,21:03:46,金像奖对古天乐真是苛刻，今时今日才让古天乐拿了最佳男主。对于出道即巅峰的演员来说，如果没有办法超越原来的自己，世人只会越来越无所谓。好在古天乐无论状态和演技都保持得真的很好，对很多演员来说这是非常不容易的功课。,1
1,26826398,杀破狼·贪狼,黑猫,1418514,还行,2023-01-21,16:02:50,守护不了自己的女儿，就守护别人的…那一刻有小小感动,0
1,26826398,杀破狼·贪狼,薇啸,aafeier,还行,2017-10-20,22:05:18,古天乐在里面又帅又演技了得。,0
1,26826398,杀破狼·贪狼,某J。624,june4cat,还行,2017-10-30,22:46:56,三星半。三部里唯一一部大boss动脑不动手的。项少龙跟公主再续前缘是最大的彩蛋，虽然我最爱的是善柔。,0
1,26826398,杀破狼·贪狼,晚醒醒,47443727,还行,2017-08-18,22:09:03,为了凸显古天乐能打，给他配的都是小弱b😂，不过打戏和演技都很在线啊，感觉都是自己亲自上的～结局太不过瘾了，要是改成cult片结尾就爽了,3
1,26826398,杀破狼·贪狼,芍药,cherrybomb212,还行,2017-08-19,21:06:54,还行，很简单的故事，自从谜底被揭晓后，就没啥劲了。把市长的线隐掉更好。太直白了，没有悬疑，也没有什么危险性。演员打得累死了，我看得一点都不激动。,3
1,26826398,杀破狼·贪狼,西西里亚,xdy1990,推荐,2017-08-23,07:57:00,结尾稍微有点烂尾，市长大别墅怎么都没有安保措施任由人进出的？在打斗动作、剧情、深度方面完爆战狼。ps.名字取得太土了，差点因为名字而抵制去电影院看,3
1,26826398,杀破狼·贪狼,mymike,mymike,推荐,2017-08-19,19:54:40,剧情非常黑暗，承袭了杀破狼系列的一贯气质。不过第二部好歹还算有个比较光明的结局，这部就是纯黑暗了。前作让张晋几乎红得发紫，这部不知道能不能让千年老二吴樾焕发第二春呢？,1
1,26826398,杀破狼·贪狼,旺仔 小馒头,zepwhen,推荐,2017-10-30,15:47:36,像是天朝版的极速追杀 男神为了一条狗 屠了一个帮 因为狗代表着思念 古天乐为了女儿 追了政治势力 因为他只剩下女儿 故事走向果然真实 像别人推荐我看的时候也是这样介绍的 片尾那一枪毫不含糊大快人心 杀破狼的风格一贯如此~,0
1,26826398,杀破狼·贪狼,笙歌,pipesong,较差,2017-08-17,23:53:43,今晚院线归来，不吐不快，本片剧情单一，bug满满，古天乐用力过猛，从头到尾用瞪眼表现内心戏，动作戏累赘枯燥，结局也让人内心OS...,11
1,26826398,杀破狼·贪狼,17950,chrisocean,较差,2018-04-21,20:24:12,…爽快度几乎没有，我是在看文艺片么？算了香港文艺片这十几年的水准大家也知道……,1
1,26826398,杀破狼·贪狼,北欧以北,lisacat611,推荐,2017-10-23,23:35:21,真比某狼好很多。,1
1,26826398,杀破狼·贪狼,超cute侠,3403686,较差,2017-10-22,14:54:24,剧作完全不能看，倒卖器官算是炒杀破狼2的冷饭了，古天乐寻女主线也是老掉牙的要命，反派露脸机会太少，未能构成正邪对峙的张力，勉强看看洪金宝的动作设计吧。,2
1,26826398,杀破狼·贪狼,MY BMM,2471325,还行,2017-10-30,21:45:03,古天乐应该会入围金像影帝,0
1,26826398,杀破狼·贪狼,Mr.杨,yyangquan,还行,2017-08-24,23:43:49,1>2>3，说动作戏好看的极有可能没有看过隔壁的战狼2，还有些神经病竟然报复性地说比战狼2良心得多，呵呵，你眼睛是瞎了吗？战狼2真是树大招风啊~,0
1,26826398,杀破狼·贪狼,徐州丰县艾丽卡,cld104123,还行,2018-02-08,00:56:08,要是最后能听到三声枪响，我倒觉得还不错的。不知是不是稍微有点在学边境杀手，总之对比下来不怎么样。长得贼像拉莫斯那个人真的好贱,0
1,26826398,杀破狼·贪狼,影启缘末,48934135,还行,2017-11-14,22:31:35,只是不明白这些剧情没有联系的电影为啥都叫杀破狼,0
1,26826398,杀破狼·贪狼,张星翰,213246713,还行,2021-11-23,01:33:59,贩卖人体器官-黑社会与警察勾结-警察与腐败官僚勾结-正义警官屡遭威胁损失惨重-孤胆英雄牺牲自己成全朋友-父女情-兄弟情-亲情-拳拳到肉,0
1,26826398,杀破狼·贪狼,Iris Chen,chenxiangnan,推荐,2017-08-18,23:04:49,看完好压抑，憋了一股气，要发泄的样子。,5
1,26826398,杀破狼·贪狼,巴喆,jeffersontang,还行,2017-10-21,21:21:56,剧本扎实节奏流畅，难得的剧情合理，当然结尾还是理想化了。动作镜头拳拳到肉，尤其泰拳的使膝用肘真实流畅，暴力感十足。你只要对比一下托尼贾和古天乐的动作镜头就会发现专业和业余的差别，当然古天乐支撑了文戏全场。《杀破狼》系列的动作设计在我心中一直都是满分。7.1,1
1,26826398,杀破狼·贪狼,Jason_波波,fxiaobo,推荐,2017-08-21,02:11:25,看之前以为是部动作片，实则是催泪压抑亲情片。和前两部有种隐隐的关联，编剧和导演貌似走起了一报还一报的套路,1
1,26826398,杀破狼·贪狼,刘康康,46843344,还行,2017-10-30,22:04:45,屠宰场砍刀大战还是不错的，但真心比不上《杀破狼1》里面吴京球场那段耍刀戏，吴京作为动作演员真是没说的。这部差就差在动作演员都没啥爆发力啊，2好歹还捧红了张晋，3则只让托尼贾打了个酱油。不过3的文戏比2强点，2里面杀破狼就真的出来一头狼，为编剧的没文化感到悲哀……,0
1,26826398,杀破狼·贪狼,宅拾叁,gongzitian,推荐,2017-08-19,21:46:09,吴越也打开了。林家栋如果是一个特别能打的反派的话这片子就帅炸了。请不要怀疑，托尼贾是真打酱油。中国护照到底不是万能的，妹子们出国旅游还是要提高自我保护意识才行啊。,2
1,26826398,杀破狼·贪狼,Superhat,hsuperhat,还行,2017-08-28,01:59:04,血腥过头，打太多，嘎嘣脆……于是现在破不了的案还有敏感社会议题都可以放到东南亚去拍……故事核心还是非常老套。吴樾大概是冻龄，感觉从出道这张脸就没老过。他的打法跟目前所有的华语片武打男星都不一样，不帅气不潇洒不称霸，很虎很猛，视觉很疼。演技全程在线，托尼贾点彩。三星半,0
1,26826398,杀破狼·贪狼,GaryKooooooo,GaryKoo,力荐,2017-08-26,19:50:06,正！,1
1,26826398,杀破狼·贪狼,更深的白色,moredarkwhite,还行,2017-10-24,21:14:53,确实好久没看过这么好看的动作戏了，文戏也有追求，可惜香港主创玩这些哲学宿命之类的上档次主题就显得中二气太浓。,0
1,26826398,杀破狼·贪狼,萧遗憾,s8648690,还行,2017-08-23,07:55:13,父爱如山,0
1,26826398,杀破狼·贪狼,鸟鸟弗斯,dnarna_vicky,,2017-12-18,15:52:01,5.1 看见托尼贾是特别出演便有种诡异的感觉，居然。。。充满温情到让人绝望。。。,0
1,26826398,杀破狼·贪狼,布拉德痞特儿,63785743,推荐,2017-10-21,21:46:32,首先我想说的是这部片的色调太阴冷了，无论是剧情，还是暴力的打斗都给人惊悚片的感觉。动作设计很有洪金宝的个人风格，拳拳到肉很过瘾。虽然这只算是一部勉强及格的剧情片，但看到片尾古天乐对失去女儿的心痛，还是被感动了。最后想说的是古天乐还是有希望被提名的。,0
1,26826398,杀破狼·贪狼,傷心龍舞,iml5,还行,2017-11-05,17:36:00,并没那么好看，之前被吹捧得过了吧,0
1,26826398,杀破狼·贪狼,阿暖,phoenix43,还行,2017-11-07,15:10:37,文戏真的是亮点，但是结尾太弱了，不如停在古天乐倒在女儿身体上。,0
1,26826398,杀破狼·贪狼,.,65052284,较差,2017-08-28,09:19:18,垃圾,2
1,26826398,杀破狼·贪狼,大刚,foofights,较差,2017-10-21,17:31:04,相当失望，比2要差一截，不仅是打戏上的设计和玩法。叶伟信的文戏拖沓而无趣，老派的好警察和脸谱化的boss，领便当的托尼贾莫名其妙，幕后boss换器官这种梗实在是够中古。寻人这条线不断在消耗时间，导致从焦躁麻木到哭哭啼啼的古天乐的表演，既不如黑社会也不如龙虎榜,3
1,26826398,杀破狼·贪狼,Rush_of_Joy,77320515,还行,2018-04-17,06:51:24,市长级别的要颗心脏，应该有很多不招摇的方式吧，何必硬踢警察之女这块铁板……古天乐动作戏干净利落，问题是动作设计和现代警察身份有点不搭，几个反重力的鹞子翻身也太浮夸了。故事从一个小时后开始有意思了，可惜吴樾在帮手/对手身份抉择时还不够挣扎，对政治 警察和其他黑暗面的展现也是点到即止,1
1,26826398,杀破狼·贪狼,Mallory,mallory,还行,2018-06-03,01:41:59,又回到冷兵器时代，打斗拍得真好看！,0
1,26826398,杀破狼·贪狼,猫小珥,achering,推荐,2017-10-22,00:06:32,本以为没有吴京没有甄子丹 这一部会打的没那么精彩 没想到古天乐的打戏还是很不错的 吴樾也不愧是武英级武术运动员 另外一提的是古天乐近年来演苦大仇深的角色都发挥不错 可是演喜剧片总是选片不慎啊,0
1,26826398,杀破狼·贪狼,浮生若梦,nodane,还行,2022-07-07,04:20:12,第一部吴京是毒枭手下的杀手，许多警察命丧其手，第二部他是深受毒瘾困扰的卧底警察，身份暴露被黑恶势力追杀；第二部古天乐是强取亲弟弟心脏的贩卖器官组织头目，第三部他是女儿被贩卖器官组织夺取心脏并杀害的警察，三部连起来看，又像是暗示宿命和轮回，杀破狼是一种死命格局，通常象征着结局的残酷，这一部的结尾更是一黑到底。,1
1,26826398,杀破狼·贪狼,yuanhan,jinyuanhan,还行,2018-12-28,22:15:29,古天乐文戏固然可观，打戏实在缺乏说服力。,0
1,26826398,杀破狼·贪狼,蟒蟒一巨,75652747,推荐,2017-08-18,15:55:03,这也许是古天乐演得最好的一次，角色塑造上的缺失愣是让古仔极具感染力的表演给撑起来了，好几个长时间的特写镜头演得都很有层次，虽然动作戏方面吴樾要好很多，但古天乐显然才是最出彩的那个。电影的故事本身并不算出色，但是讲得和拍得都很好，只是结局两场戏的衔接有些没做好，显得有些仓促。7.5/10,5
1,26826398,杀破狼·贪狼,Hiroki,Yanira1992,推荐,2019-06-28,13:50:52,杀破狼的主题是父爱如山吗，又来,0
1,26826398,杀破狼·贪狼,有有,160754679,推荐,2017-08-17,15:33:49,文戏煽情，各个演技派感情拿捏非常到位。武戏精彩，吴樾，古天乐，还有托尼，近身格斗真的是很精彩，推荐推荐,23
1,26826398,杀破狼·贪狼,李三七呀,146046928,推荐,2017-08-19,00:50:10,"打戏太酷了   尤其天台那一场
剧情也挺抓人  有种宿命论的感觉",1
1,26826398,杀破狼·贪狼,逍遥隐月,zhupeng1115,推荐,2017-08-17,21:20:46,古天乐演技爆表,8
1,26826398,杀破狼·贪狼,sea,2270098,还行,2017-08-26,13:37:00,剧本漏洞很多，一部分动作比较好看。不相信是爆裂的续集，否则二十丧友三十丧妻四十丧女他比豆瓣还丧...但是看到小叶子的名字，熟悉的配方熟悉的味道，还是看得相当愉快。,0
1,26826398,杀破狼·贪狼,Lan~die,Lan.die,还行,2018-01-18,20:34:32,剧情和动作戏安排得当。,1
1,26826398,杀破狼·贪狼,派老湿,Esther314,推荐,2017-10-22,16:41:01,打戏很好看 这种片子就不看什么故事了吧 故事也是为了给打戏铺路的 吴越打戏很好看 ,2
1,26826398,杀破狼·贪狼,图啦啦,woaijianghu,较差,2017-10-21,01:10:24,文戏武戏都不太能理解，香港直男电影只知道邓丽君和蔡琴么,1
1,26826398,杀破狼·贪狼,大只,bolu616,还行,2017-08-17,12:58:17,人间道不过修罗场。,5
1,26826398,杀破狼·贪狼,Joe,nonoknows,推荐,2017-08-18,09:30:25,这部电影告诉大家：一，开车就好好看路；二，出国旅游别一个人在外面乱转。,4
1,26826398,杀破狼·贪狼,彌張,xiyangwuxie,,2018-09-07,21:13:43,集体学泰语？结局很现实了,0
1,26826398,杀破狼·贪狼,火火：警cha,hs1127,推荐,2017-11-03,20:28:00,"打戏真是棒！！！古仔这部是影帝了。------20171103
果然是影帝了，还是三个！！！---20180417",0
1,26826398,杀破狼·贪狼,南赫,54150368,还行,2017-08-20,15:45:25,两位男主才是真爱啊！吴樾唱：“你问我爱你有多深，月亮代表我的心～”古天乐凝望着他，嘴角上扬。,1
1,26826398,杀破狼·贪狼,新希望,thenewhope,推荐,2017-08-19,15:02:57,负能量满满，高温天气的情绪降温利器,5
1,26826398,杀破狼·贪狼,菲氏葉猴,beijingbing,较差,2018-06-28,19:15:59,女儿被绑架，立即掏出中国护照并说：犯我中华者，虽远必诛！我的背后是一个强大的祖国！！！ 歹徒吓退，全剧终。,1
1,26826398,杀破狼·贪狼,淋,75215757,推荐,2017-08-17,22:58:35,前期担心主要是在换血的吴越，结果个人表现和观众接受度都不错，这个系列够带劲啊！,7
1,26826398,杀破狼·贪狼,Selene,frostshuang1989,力荐,2017-08-17,02:20:53,這部戲古叔叔打得相當不容易了，還有我們吳樾叔叔，那一個接一個的托馬斯全旋後空翻，瘋狂爆燈！！！這部戲告訴我們小姑娘們爹總會踏著七彩祥雲來救我們的，要撐到他來嗚嗚嗚。,37
1,26826398,杀破狼·贪狼,王洛伊德,2422659,推荐,2017-08-20,03:15:09,没有皆大欢喜的结局，才是真正的现实,4
1,26826398,杀破狼·贪狼,豆友83908392,marcoromero,还行,2018-02-02,04:28:33,6.4 托尼·贾的出场太少，估计观众们还没看过瘾就拿便当了。动作场景一向是叶伟信的拿手好菜，在飓风营救的快速模式下，《贪狼》让观众们观摩的是一场动作盛宴。尽管背景不在大陆，制作组们可以为所欲为，但人物设定一直在克制，没有放开去腹黑。,0
1,26826398,杀破狼·贪狼,白,2593618,推荐,2017-08-20,09:55:39,悲剧,0
1,26826398,杀破狼·贪狼,弓谷所長,misty-yy,推荐,2019-09-03,22:32:57,剧情很平，打斗很硬！,0
