page_index,movie_id,title,username,user_id,rating,date,time,comment,useful_count
2,26826398,杀破狼·贪狼,深深的蓝,flxl,推荐,2017-08-17,17:32:18,确实少了场终极大战的感觉剧情比上一部更简单些。不过结局很虐也有点意料之外情理之中。旁边两位女士前面只捂眼睛后面拿出纸巾擦眼泪。最后听完结尾的月亮代表我的心走出影厅有种梦醒的感觉。,9
2,26826398,杀破狼·贪狼,左眼看电影,nicdone,推荐,2017-08-27,16:03:01,文戏和动作戏都很精彩，吴樾也应该混出头了。托尼贾便当领的太快了,1
2,26826398,杀破狼·贪狼,四月天,iamxiaoqi,推荐,2017-08-18,19:38:06,古仔演技不错。以后少接点烂片了。,4
2,26826398,杀破狼·贪狼,高压电,kick-my-ass,较差,2018-04-19,00:20:54,拍这么一难看的飓风营救,2
2,26826398,杀破狼·贪狼,井上多罗,38310657,推荐,2018-04-30,14:23:52,其实我觉得拍得还挺好的，比杀破狼2要好一些。,0
2,26826398,杀破狼·贪狼,苏菲的唯心世界,58937537,还行,2017-09-01,07:52:54,看得特别过瘾，吴樾的打戏很好看，剧情也紧凑，而且剧情挺反套路的，没有让某些角色强行活下去，整个电影又黑又丧，看得很过瘾。但是好想张晋继续拍！！！,1
2,26826398,杀破狼·贪狼,Ringo,RingoYeung,,2018-02-18,19:22:50,打戲還是需要專業人士...不然感覺特別尷尬...楞胎楞,0
2,26826398,杀破狼·贪狼,不如不遇倾城色,AriesW322,还行,2017-10-10,22:23:57,对敌人的仁慈就是对自己的残忍,0
2,26826398,杀破狼·贪狼,清风剑,john737,推荐,2018-05-02,00:57:32,好残酷。。。tony 贾真的死了，女儿也死了。。。,1
2,26826398,杀破狼·贪狼,TUO,bigandbig,较差,2017-10-31,22:11:22,古天乐的打戏没法看。,2
2,26826398,杀破狼·贪狼,Gemini,LevantWong,推荐,2017-12-25,20:17:43,牛逼,0
2,26826398,杀破狼·贪狼,梦羽灵泉,38012408,推荐,2017-08-19,07:42:01,优秀的港式动作片,4
2,26826398,杀破狼·贪狼,高好云上,fion5,力荐,2017-10-22,11:46:36,疯 狂,0
2,26826398,杀破狼·贪狼,☁,54772042,推荐,2017-08-22,19:24:09,看完也没懂跟贪狼有毛干系.一星给抡锤子一星给割喉一星给爆头一星给你失去的和她失去的不多不少刚刚好.,2
2,26826398,杀破狼·贪狼,djj,djj11,较差,2018-05-05,09:29:15,太多想说的：1、天道有轮回，苍天饶过谁。古天乐在杀破狼2里贩卖器官，在这部里就轮到自己女儿被挖心而死。2、结局又是全灭（除了吴越一家代表希望，市长不知情加女儿心脏在），致敬第一部。3、所以说，千万不能去国外自由行！4、这样黑泰国，其旅游业打击不小吧？有部门起诉吗？,2
2,26826398,杀破狼·贪狼,白日梦枕貘,speak,推荐,2017-08-24,20:17:08,很沉重，人性的黑暗挣扎矛盾，一直提着心看完，主角还是死了。不过这名字什么鬼，叫什么狼的还以为是垃圾片。。。,0
2,26826398,杀破狼·贪狼,发条J,JEFFKANG,推荐,2017-10-25,19:58:53,故事有点浅，古天乐演技有提高了，打戏也不错，但是越到后面越乱，托尼贾可怜的客串。反派太差了。,0
2,26826398,杀破狼·贪狼,Athrun,kinkhappy,推荐,2018-05-18,11:13:05,这个系列的动作戏非常饱满出色，看得非常过瘾，同时还有合理的背景故事和人物塑造,1
2,26826398,杀破狼·贪狼,朵云,duoyun2,推荐,2019-02-17,20:00:54,够黑暗的,0
2,26826398,杀破狼·贪狼,易老邪,ljgyhj,较差,2017-10-09,17:59:15,平庸至极、毫无新意，全片没任何亮点，也没任何看点。感觉这《杀破狼3》不过就是编导直接把《杀破狼2》的剧本拿来删繁就简略作修改后又重拍了一遍而已。1星半。,2
2,26826398,杀破狼·贪狼,50455210petter,petterzhang,还行,2017-10-21,21:36:30,武打有点拖沓，剧情有点硬伤。古仔面部表情8分,0
2,26826398,杀破狼·贪狼,葱葱,lyh198553,还行,2017-11-08,05:30:19,看一次就好的爆米花电影,0
2,26826398,杀破狼·贪狼,魂,78957039,很差,2017-08-18,16:05:32,【47/100】最搞笑的是杀破狼这个系列越烂，豆瓣分数越高,5
2,26826398,杀破狼·贪狼,kiki204629,kiki204629,还行,2017-12-16,22:27:59,古天乐好拼！麻麻说她看这样的电影心情不太好。赴泰国旅游是不是太热了，这可以降降温。,0
2,26826398,杀破狼·贪狼,sheeparker,sheeparker,还行,2018-03-10,13:17:06,这打斗戏很有90年代金庸剧的感觉,0
2,26826398,杀破狼·贪狼,英英美代子,melpeipei,还行,2017-08-21,12:52:52,连港片都要去泰国取经了吗……,0
2,26826398,杀破狼·贪狼,麦麦吃啥都不胖,maimaibupang,推荐,2017-09-08,14:28:29,打戏精彩 略拖沓,0
2,26826398,杀破狼·贪狼,Ex,1055848,力荐,2018-12-22,23:33:29,古天乐的女儿正处青春期，怀了小男友的宝宝后，被古天乐拆散，她一气之下到泰国投奔小伙伴，却不幸被器官倒卖组织抓去，成为市长欢心的人选。泰国警察吴樾即将当爸爸，他陪着古天乐寻找女儿……吴樾的同事托尼贾挂了，古天乐最终找到的是女儿的尸体，为了保全吴樾的家庭，他在黑势力面前选择了自杀20181222,0
2,26826398,杀破狼·贪狼,Singin'in rain,glorymanutd,还行,2018-04-19,22:55:38,成了香港版《飓风营救》了，古天乐演的的确不错，影帝实至名归，就是动作戏比较尬。。。也不能怪他，毕竟不是专业出身，托尼贾倒是专业，死的未免太惨了点。。。看得出导演想剪出一些东西来，但是功力比较有限吧。,0
2,26826398,杀破狼·贪狼,Akwan,51480816,还行,2017-08-27,15:21:47,a sad story。 《拳霸》之后托尼贾没什么好片啊，这次出来变大叔了。,0
2,26826398,杀破狼·贪狼,萤火虫子,onlyYH,推荐,2017-08-19,11:44:04,剧情很丧很颓很暗黑，表演上发现了吴樾这颗星星，非常期待他和张晋合作互殴。国产电影打星真的是一块极具开发价值的市场。,5
2,26826398,杀破狼·贪狼,阿柴,wywmzyq1916,还行,2017-11-28,12:23:56,不同的角色看到不同的角度，我看觉得父亲的粗暴管束是悲剧的根源，老爸看则觉得真是个熊孩子。,0
2,26826398,杀破狼·贪狼,eros,iear,推荐,2017-08-22,18:23:43,很黑很飓风营救。,0
2,26826398,杀破狼·贪狼,__酉卒 目艮__,jaymi,还行,2017-10-24,23:47:26,动作不错，情节就胡编吧。,0
2,26826398,杀破狼·贪狼,𝗟𝗼𝘂🍅,louis15yao,推荐,2017-12-20,12:24:13,"结局唔套路,月亮代表我的心好深情,小催泪.",0
2,26826398,杀破狼·贪狼,在下不耐烦,heyowl,还行,2017-10-23,20:38:22,前面还不错，后面就....,0
2,26826398,杀破狼·贪狼,babynana,babynana,还行,2017-08-18,00:56:49,三星半，比前作专注于打斗，多了情感的分量。,0
2,26826398,杀破狼·贪狼,Ada,adawong1026,还行,2018-04-21,21:53:24,内心戏增强版飓风营救，为古仔拿影帝专业打造,0
2,26826398,杀破狼·贪狼,小烨,3984361,力荐,2017-08-20,21:00:07,人如鸿毛，命若野草。古天乐这一次该拿影帝了吧，这么多年了，“古天乐拿影帝”已经加入“有生之年系列”了，希望金像奖看到古仔吧。,5
2,26826398,杀破狼·贪狼,Red,redqian,推荐,2017-08-20,13:00:35,除了最后市长厅外居然没有任何保安这个大bug外，总体还不错。洪金宝和吴樾负责武戏，我古负责文戏和泪点，打戏只是顺带～演技，不需要证明,4
2,26826398,杀破狼·贪狼,慈悲鞋底,dpeng,推荐,2018-04-01,00:22:10,好像当李小龙面对现实社会问题一样,0
2,26826398,杀破狼·贪狼,韩梦想,13301536,还行,2017-11-22,17:24:27,能看，剧情是夸张了点，但是清楚，明白，文戏在线，几场打戏漂亮，虽然比不上1，但是标准，风格还在，这个系列是明显的虽然日渐平庸但绝对够格的院线片。,0
2,26826398,杀破狼·贪狼,Kevin,199038620,还行,2023-02-06,03:28:46,补标，剧情完全忘记了,0
2,26826398,杀破狼·贪狼,坐等1900,wsqabc,还行,2017-10-22,15:42:44,古天乐无论是演技还是外表 都觉得他在找女朋友。。。导演也没给足成女儿长大后和父亲的互动 以至于古天乐的角色在父爱这块有点突兀 更加别提突然冒出来的警察身份了 吴樾的打戏看起来很过瘾 但气质完全不适合演泰国警察 以及 这片对人类腿伤之后的身体状况是不是有什么误解 为什么林家栋的角色会说中文,0
2,26826398,杀破狼·贪狼,热夜之梦,matianmeng,推荐,2017-08-19,09:54:57,单从电影的角度来说，此狼质量完胜最近大火的某狼。剧情，演技，人物，甚至动作戏都强于战狼2。战狼2的票房神迹除了电影本身的亮点，更多是在国产电影保护月，建军90年庆，中印冲突激起的爱国舆论和解放军支持拍摄的大背景下完成的。占尽了天时地利人和。顺大势而为才能站上巅峰。投资亦如此吧。,19
2,26826398,杀破狼·贪狼,农民老郑🌈,zhengshuashua,推荐,2017-08-20,15:05:56,太暴力太黑暗太残忍太绝望了！但是很好看！古天乐简直奉献了同等类型片中他最精彩的表演！又及出门旅游真的要分外小心。,4
2,26826398,杀破狼·贪狼,Tom Light,xhlaxhla,推荐,2017-08-21,19:10:56,"周末看了，原汁原味港片。甩出《战狼》一条皇后大道！
继洪金宝，甄子丹，吴京，张晋后，又浮出新打星吴樾。古天乐提前预定香港金像奖影帝！",1
2,26826398,杀破狼·贪狼,Ying_0111,53021898,还行,2017-12-13,23:39:09,对比第二部，反派少了类似张晋那种又黑又狠又强的人物。没觉得惊心动魄，或是有什么干净利落又帅气的打斗戏。P.S：前几天看杨丞琳当了外婆，今天又看见古天乐差点荣升当外公了……,0
2,26826398,杀破狼·贪狼,阿树,braxin2007,较差,2017-10-23,00:47:06,費勁用剪接來證明敘事的宿命性，還不如花多點心思把劇本做得豐滿點,1
2,26826398,杀破狼·贪狼,2006-03-19加入,1121217,,2017-08-21,07:30:22,（少儿不宜作品。血腥）,0
2,26826398,杀破狼·贪狼,傅尸水,foolshop,推荐,2021-05-05,04:33:14,结尾可以,0
2,26826398,杀破狼·贪狼,注水龙,76569409,还行,2017-08-17,13:56:40,整部电影动作戏实在不多，但都保质保量。托尼·贾追凶和屠宰场大战是最精彩的两场戏。想要复制杀破狼1的悲怆宿命结局，但终究是徒劳。过多的文戏实在是不能调动情绪，但古仔的演技实在精彩，林家栋也吸引了我的目光。杀破狼系列是最有前途的动作片系列，我希望像这样一直拍下去。,7
2,26826398,杀破狼·贪狼,蜉蝣,36537385,较差,2017-12-24,13:27:37,最有打斗感是tony jaa在天台和反派的打斗，其他好弱鸡。故事最后没有穷途末路的史诗感，吴越只是在外面傻等，整体观影体验好多不足，古天乐的亮点只是在见到女儿的那场。,1
2,26826398,杀破狼·贪狼,萨哩鹿,28216718,推荐,2017-10-23,23:43:06,我以为我会快进，但是没有。这是一个父爱的故事~父亲为了救女儿孤身犯险，最后为了救别人的妻女，牺牲自己。最后没有杀市长，大概是想让自己女儿的心脏继续跳动吧,1
2,26826398,杀破狼·贪狼,我爱沙尘暴,42295837,还行,2017-11-25,13:46:40,同类片太多,0
2,26826398,杀破狼·贪狼,龙芊芊,59346346,推荐,2017-08-17,20:58:44,永远超越不了第一部，没甄子丹啊,5
2,26826398,杀破狼·贪狼,来了个豆子,54880973,还行,2018-01-14,18:24:09,"打戏看的肉疼，真的，古天乐最后为什么自杀？
还有时间轴不老对的。第一次古天乐带着去小屋时女儿还活着，隔了一天又被宋回肉场了，然后在这之前做了心脏移植手术的市长已经醒来回家，不是感冒好吧，当天开肚子就回家，没有排异反应，编剧比较脑残",0
2,26826398,杀破狼·贪狼,食野之苹,68840016,还行,2017-12-25,01:05:17,常规动作情感戏，古天乐的表现还不错，最后复仇结尾也还不错，但也仅此而已了。,0
2,26826398,杀破狼·贪狼,La,121891012,推荐,2017-10-20,20:38:42,打得过瘾，没想到托尼贾的角色居然那么早领盒饭，吴樾打戏也精彩。古仔演技炸了，后来找到女儿那里我都快哭了,2
2,26826398,杀破狼·贪狼,东北洪常秀,Zazai,还行,2017-08-18,18:48:43,托尼贾的打戏可以用“酣畅淋漓”来形容，如果托尼贾演古天乐的角色，那一定全程高能，可惜草草收场。古天乐的拳脚中全景看很生硬，即便快节奏的镜头剪辑往回找补也略显老态。,3
2,26826398,杀破狼·贪狼,鱼剑,yujianmovie,还行,2017-08-18,00:25:40,剧本层面上和前两部差太远了，看得索然无味，动作设计的确采用了很多MMA元素，但没什么创意。。,1
2,26826398,杀破狼·贪狼,Joyce,Dreamer.Chen,还行,2017-08-21,13:45:38,我的妈！虽然也不太喜欢战狼，但是说比战狼好很多的，你们良心不会痛吗！故事整个虎头蛇尾！大BOSS原来这么容易就死了？！反而和那个老外死磕！从场面来讲比不上战狼，从故事来讲比战狼好一些！里面好几个演员都是参与湄公河的，比湄公河差了不止一点两点,3
2,26826398,杀破狼·贪狼,旎,3548043,还行,2018-04-17,11:29:26,昨晚看完片才知道古天乐昨天也得了最佳男主，实属不易。古天乐还是演技很棒的～,1
2,26826398,杀破狼·贪狼,小指甲,3509282,力荐,2017-08-19,23:56:56,我的男神竟然演戏演到外公这个辈分了……从头绝望到尾，古仔的哭戏太揪心了,3
2,26826398,杀破狼·贪狼,华盛顿樱桃树,49213881,推荐,2017-08-18,21:52:35,这种丧了吧唧故事灰暗的电影好适合我，动作戏实在是爆，太有节奏感，新颖而痛快。血腥暴力得超出想象，全程带有痛感。只是贪狼这个名字我还以为是跟贪污相关的故事呢。,0
2,26826398,杀破狼·贪狼,洛啟言,vissonelee,还行,2017-12-25,02:49:10,如果半路沒殺出個程咬金的話，那古天樂應該可以封帝了…,0
2,26826398,杀破狼·贪狼,一十一,53659864,推荐,2017-12-31,16:34:53,剧本上的问题，顶多也就是一个中等质量，打斗倒是很精彩。而且也有意外惊喜，古天乐竟然也可以变成优秀的动作演员,0
2,26826398,杀破狼·贪狼,泡泡泡芙,paopaopaofu,还行,2017-08-20,19:43:21,和战狼一样，打到视觉疲劳，看着累。,2
2,26826398,杀破狼·贪狼,空思,szeze,推荐,2017-11-15,09:37:54,文戏和武戏都很棒，古天乐拿着枪悠闲的走进市长住宅过于突兀。希望这个系列能一直延续下去。,0
2,26826398,杀破狼·贪狼,mark,1215748,还行,2017-10-20,23:57:23,沉重版或者说丧版的飓风营救，但这里玩深刻真的好吗？是不是有点太憋屈了，完全不解气，谁的生命更重要，也没讲清楚啊？！,0
2,26826398,杀破狼·贪狼,[已注销],song-lu,推荐,2017-12-24,20:40:44,比第二部好很多,0
2,26826398,杀破狼·贪狼,tonight,lian0070,较差,2019-12-03,22:53:52,所以泰国真的很危险啊……,1
2,26826398,杀破狼·贪狼,拂袖斋客人,skysnow5201314,还行,2017-09-04,11:15:31,父亲不要干预女儿的爱情，即使你是警察。女儿置气不要随便离家出走，即使你父亲是警察。司机（特别是女司机）开车不要回头聊天。自己的护身符（特别是手链）不要赠送他人。,1
2,26826398,杀破狼·贪狼,天然,DrStrange,推荐,2017-08-21,22:47:18,动作设计真的挺好的，感情积聚也挺到位的，非常到位的类型片，国产类型片工业化最有希望的应该是动作片,2
2,26826398,杀破狼·贪狼,梁威是条狗,lw514,推荐,2017-12-24,10:38:37,古天乐演技还是杠杠的,0
2,26826398,杀破狼·贪狼,魍。,wang0926,还行,2017-08-18,18:19:55,(有剧透)三星半，打得好痛，动作片本身挺满意的，另外开车还是要注意安全，不要随意和驾驶员聊天。你看不聊天，就不会出车祸，妈妈就不会死，孩子就不会早恋，就不用堕胎，就不会去泰国，就不用一家全没了。所以还是一句话，开车要注意安全。,3
2,26826398,杀破狼·贪狼,姽婳火焰,nang,推荐,2017-08-23,23:11:49,杀破狼系列算是香港动作电影里比较喜欢的。古仔老了，小时候我超喜欢他白白净净的样子，自晒黑后他火了我也不觉得帅了……大眼睛双眼皮的人真的不适合老去，老了眼睛会有点散神，浮肿感。这几年越来越喜欢林家栋这样的演员，只要他在就有戏，你就得忌惮着他。海报也是做得很港味，有繁华时期的年代感。,1
2,26826398,杀破狼·贪狼,wizard,wizard,还行,2017-08-22,23:57:13,打得一般，最后这两枪开得干净利落不废话算亮点，但是剧情有点太跳脱了,0
2,26826398,杀破狼·贪狼,某C,ColaBB,还行,2017-08-21,20:17:26,从作品本身来说，是这个系列三部里，剧情最流畅和完整的，但是梗实在太老，看得毫无悬念，唯有大哥大的动作设计还是那么好看，利落干脆又略带传统韵味。演了无数大侠的古天乐，竟然第一次真身上阵开打，有些镜头看起来也是很儿戏，感情戏把握很好。林家栋和托尼贾饭盒都领的很突然，吴樾的配音非常别扭,0
2,26826398,杀破狼·贪狼,孟克柔🌈,bluegatecrossin,还行,2017-08-17,19:31:27,看吴樾演得这么卖力 给三星吧,0
2,26826398,杀破狼·贪狼,呱唧呱唧,MaccyLiu,还行,2017-08-26,16:40:58,确实有被吴越圈粉 古天乐已经老到我叹息的地步 看完以后我姑总结两句 不许再去泰国旅游&要回去看点开心的东西 题材本身就很压抑 结局又很。。。不过确实最后一枪爆头爽上天 但依然很悲哀,0
2,26826398,杀破狼·贪狼,今生、唯爱,72520254,还行,2019-01-09,20:56:43,古天乐明明刀挥舞的还不错，为什么往别人身上招呼的时候偏偏只用脚踹？说好的强龙不压地头蛇也是假的，主场作战的托尼哥第一轮就被淘汰了。结局只杀一个，没有快意恩仇，不满意,2
2,26826398,杀破狼·贪狼,饮茶先啦,220718234,还行,2022-11-10,11:48:17,古的凶残手段和私人动机,0
2,26826398,杀破狼·贪狼,嗨呆客要出门玩,hendrik2076,推荐,2017-08-22,18:36:59,三星半 虽然有bug但是古天乐演技不错了……剧情怎么过审的，这么黑真的好吗,3
2,26826398,杀破狼·贪狼,龙皇,145516659,推荐,2017-12-06,20:46:10,剧情节奏不错，演员打戏都很到位，只是男主光环太强，一个人秒那么多手，他什么时候成为特种兵了？ 当年超喜欢郑雪儿在《寻秦记》中扮演的赵倩公主，可惜当年未能牵手成功。时隔二十年终于结为夫妇，还有了一个爱情结晶，可惜结局太惨、太惨。希望他们下一个结合能够幸福美满。,0
2,26826398,杀破狼·贪狼,花和云,chanelKing,推荐,2017-10-21,13:10:43,普通人生活的幸福需要父母辛勤在外打拼挣点一日三餐；很多幸福表面上是理所当然，其实都是践踏在他人的白骨上窃取而来。为父爱感动。,1
2,26826398,杀破狼·贪狼,summerer,tosummer,推荐,2017-08-20,22:43:10,好久没看血腥又让人欲罢不能的电影了，动作戏真的是揪心死！文戏也处理的不错。我觉得自己越来越相信宿命论了~大团圆不受用，非得死光才觉得：啊，这就是真实且丧的世界啊。,1
2,26826398,杀破狼·贪狼,CottonGarcía,40234006,,2022-01-31,15:03:05,哎，虐。,0
2,26826398,杀破狼·贪狼,隔岸之雨,searchforriver,较差,2017-11-01,19:01:19,并非每个人都适合演爸爸 也并不是每部救女儿的电影都是飓风营救,1
2,26826398,杀破狼·贪狼,竹傲风,mengqingjiao,推荐,2017-11-06,20:25:38,本来就各种不爽各种不开心，又看了如此一部不爽的电影……,0
2,26826398,杀破狼·贪狼,不见蝴蝶不见君,butterflyChan,推荐,2017-08-21,09:14:09,好看的，古天乐把一个狂躁症爸爸演的很好，全片屏蔽一些bug看起来很过瘾，而且不是常规牌，看到女儿的尸体出现的时候，就觉得嗯，导演还是很残忍了。片尾过瘾。,2
2,26826398,杀破狼·贪狼,口不一,43556775,还行,2017-08-23,21:45:07,飓风营救失手版。。。杀破狼这个系列第一部之后主题已经走偏，保留这个名字只是单纯为了蹭IP，好在打斗的风格未变，但也未见有突破。,1
2,26826398,杀破狼·贪狼,左小煮粥,Hepburng,还行,2017-08-19,03:59:02,爸爸都女儿的情感观正不正确，对女儿的影响差别会很大。,0
2,26826398,杀破狼·贪狼,金影,68332314,还行,2018-02-17,15:28:17,又一个宿命！这次的七杀、破军、贪狼分别由古天乐、吴樾、林家栋主演。,0
2,26826398,杀破狼·贪狼,tangmm,tangmm,还行,2017-10-22,18:47:25,好惨的故事，虽然最后也没讲古爸爸复仇搞出大动静，但那个一枪爆头还是挺爽的。打戏里头托尼贾牺牲前那段，以及砍刀大战都不错，但也没有上一部惊艳的程度。,0
2,26826398,杀破狼·贪狼,梦飞扬,53238292,力荐,2018-04-15,21:29:49,古天乐我欠你一张电影票，金像奖欠你一个影帝。吴越演技越发纯熟了，配得上最佳男配角奖，洪金宝宝刀未老啊，动作戏很精彩,0
2,26826398,杀破狼·贪狼,夜郁,50734827,推荐,2017-08-27,22:43:33,惊讶之作。剧本做得很用心，当然bug也有，不过能够把结尾做成那样还在中国上映本身就是一件壮举。故事很紧凑，节奏不错，场面也看得过瘾，这么大尺度能过审，不分级对小朋友真的好吗？ps：死人脸的古天乐终于有突破了，前半段有点用力过猛，后面好了不少，有机会冲影帝了？,0
2,26826398,杀破狼·贪狼,别惹小白兔,83493113,推荐,2017-08-17,17:58:34,3.5. 这个系列总是以各种巧合来编织起所谓悲凉的宿命论，其实很不喜，不过这回也是首次觉得文戏比武戏好看。跨境飓风营救+政治阴谋云云的已不新鲜，但在国内大银幕上看还算惊喜，父女戏工厂戏结尾戏都不错。比较有趣的是：古仔竟在一部打戏中呈上了近年最佳表演？！,12
2,26826398,杀破狼·贪狼,陈珍,EggPlant629,推荐,2017-08-17,19:51:27,古天乐演技很棒。,3
2,26826398,杀破狼·贪狼,只想不上班,142226302,推荐,2017-08-20,12:49:34,杀破狼系列高品质啊,1
2,26826398,杀破狼·贪狼,吞云吐雾狮子兔,zbar1234,较差,2017-12-20,12:44:12,假装很宿命，假装很黑暗。古仔其实整片的表现都很尴尬啊，居然还有人说好。。。,3
2,26826398,杀破狼·贪狼,_在云端_,44638992,推荐,2017-08-18,22:47:14,因为这个结局我给四星，如果你完全去玩儿《飓风营救》的套路的话最多也就三星。,4
2,26826398,杀破狼·贪狼,卡卡,63003387,推荐,2017-08-18,09:01:55,应该感谢由古天乐吴京吴樾在这个暑假带来的电影，使得华语电影终于回归到正常的男阳刚血性之气，而不是盈盈弱弱的花美男买萌卖帅，也许中国观众的审美就此改变。虽然整个剧情还是有不少bug，古仔在某些戏份还是用力过猛，但整体完成度还算扎实，不出意外的话，明年的金像奖古仔终于可以如愿获得影帝了,0
2,26826398,杀破狼·贪狼,Tron,4470248,很差,2017-08-19,16:53:39,难看的要死,4
2,26826398,杀破狼·贪狼,heyjude,giochen,推荐,2017-08-18,21:05:51,比战狼好看，动作戏拳拳到肉，古天乐在见到女儿的尸体之后到电影结束演技真的好棒！我给三星半吧，剧情有点像连姆尼森那部,10
2,26826398,杀破狼·贪狼,Messi,danielyangli,较差,2017-08-18,20:13:17,"The plot lacks credibility. For example, how did Louis Koo walk into Ka Tung Lim's house without being checked?",2
2,26826398,杀破狼·贪狼,抵黄高手阮春强,Mr_butterfly,较差,2017-11-16,13:23:50,为领导续命版飓风营救 好久不见郑雪儿,1
2,26826398,杀破狼·贪狼,邻舍的老花猫,yuantown,推荐,2017-10-23,21:40:57,虽说是番外篇，可同样的古天乐演了正反角，对比就出来了，反角出差，何况这部片两个动作演员，一个早挂一个陪衬，实在浪费。倒是很欣赏一贯黑暗的结局。三星半吧,0
2,26826398,杀破狼·贪狼,阿憨,119687406,还行,2020-10-02,00:53:47,港味纯正，动作精彩,0
2,26826398,杀破狼·贪狼,李湘,leexiang,力荐,2019-11-06,17:38:15,打戏非常精彩。,0
2,26826398,杀破狼·贪狼,我不是童男几,Yuenyuan,推荐,2017-08-17,21:22:06,杯具的结尾，才是真正的现实。人活着本身就是一件很残酷的事，无论是对自己，还是对别人。所谓的牺牲小我成就大我，也不过是一种人性，无关对错啊。但总归父爱如山嘛~我仿佛又看到了那个使着圆月弯刀的过儿，黯然销魂…林家栋寡站着也是帅，托尼贾死的太早拉，吴樾这回是man到家咯。,5
2,26826398,杀破狼·贪狼,无人应答,2349644,还行,2018-02-16,00:25:48,真没张晋打的帅，而且一味地了无新意追逐港味，就是一种退步。,0
2,26826398,杀破狼·贪狼,一只猫,59592907,,2017-09-04,23:47:20,故事太俗套了。古天乐的打戏很没个人特色。,0
2,26826398,杀破狼·贪狼,前夜,songzheng678,较差,2017-11-24,13:26:54,敷衍之作，用来衬托1、2。,2
