page_index,movie_id,title,username,user_id,rating,date,time,comment,useful_count
0,26826398,杀破狼·贪狼,roberccino,2080009,很差,2017-08-17,17:40:05,杀破狼·贪狼。比1和2差太远太远。文戏硬拗逻辑，碎片化，巧合化。武戏敷衍，完全没有任何亮点，同样的动作用到几处场景，并且自以为得意地慢放。强行悲剧，试图往1中的宿命感奔去，结果画虎不成。叶伟信和洪金宝老马失蹄。关键尚能饭否？！ 一星给大家的表演。,11
0,26826398,杀破狼·贪狼,头大脑仁小,xiaolan0401,还行,2017-08-17,15:39:25,古天乐也是悲催，总遇不上一个好剧本,13
0,26826398,杀破狼·贪狼,寓目,46037668,推荐,2017-08-20,13:14:56,能给那只看看什么叫拳拳到肉嘛？,4
0,26826398,杀破狼·贪狼,陈哈,weiwu,还行,2017-10-22,11:45:32,三星半，半星加给“正义没胜利”的结局。动作设计反而很减分，个个都会套路，一看就是设计好的，就没什么意思了，毕竟不是个武打片，也不是武侠片。,3
0,26826398,杀破狼·贪狼,黄悦_,69475039,还行,2017-08-29,08:52:48,古天乐贡献了年度最佳演技 但阻碍他拿奖的或许还是这影片的质量 节奏不好 前段线索交代剧情太冗长 再精炼一点就好了 结局也有种死不断气的感觉 高潮打完之后就应该爽快点结束了。洪金宝调教下古仔吴樾还有托尼贾都不错 至少看得燃 然而既然前面都那么血腥残暴了 为什么不能给个温情的结局呢？,2
0,26826398,杀破狼·贪狼,桃子酱,1671693,还行,2017-08-19,00:58:48,及格线作品。情节较单薄想要撑满整部电影略吃力，故而牺牲了节奏试图用剪辑来充塞。动作设计一般，古仔演技有进步，细节bug有。整片质量比之第二部逊色。亮点在一对荧幕情侣的铜矿看得我好鸡冻！！,7
0,26826398,杀破狼·贪狼,米粒,conanemily,还行,2018-07-05,10:35:40,泰国警方和政坛被黑到伸手不见五指，这个器官贩卖团伙真的不用体检一下就在大街上随便抓人的吗？剧情十分单细胞，连个支线都没有，当然了，重点是一场接一场的动作戏嘛，几个拳皇打得确实过瘾，相比起来古天乐就显得花拳绣腿并强行主角光环了，结果他还拿了影帝…🤨,2
0,26826398,杀破狼·贪狼,grace-xhu,172649395,还行,2018-02-28,18:59:40,在网上偶然间看到，就去看了，总体还算满意，王千源的那个角色虽然不是正面人物，但是很出彩。,30
0,26826398,杀破狼·贪狼,静待花开,2123968,较差,2017-08-17,22:07:43,古天乐的打戏不如吴京，本来以为有吴京的，有点失望,18
0,26826398,杀破狼·贪狼,放开那个浪味仙,bettylwx,推荐,2017-08-20,23:56:30,虽然有些套路，但确实挺好看的。打戏很过瘾，文戏也不输。古天乐和林家栋都贡献了优秀的演技。想去看这个系列的前两部了~,9
0,26826398,杀破狼·贪狼,十一伏特,stlark,还行,2017-08-22,22:22:08,香港泰国的警察和土匪都是练家子出身吗，打起来都是套路感十足，放在当代警匪片中看有些别扭，精彩有余，真实不足。剧情线的剪辑也显粗糙，不是那么严谨。对了，泰国黑社会都不用枪的吗，这样都敢出来混，真行。,1
0,26826398,杀破狼·贪狼,viennavirus,viennavirus,推荐,2017-08-19,23:35:30,还好武指是三毛，动作干净，不像李忠志想法有限就只好飞来飞去，光哥又酱油。雪儿和古仔在叶伟信电影再聚首居然是以这种方式。剧本着急上火，像直接拿大纲就拍了。无论如何哪方面都比第二部好得多。,8
0,26826398,杀破狼·贪狼,seamouse,seamouse,还行,2017-08-25,01:44:46,逻辑，尤其是结尾剧情，非常草率和乱来。但整体的黑色基调做足做透了，也符合预想中非常不happy的ending。武打没创意，但合乎心理节奏的剪辑，让整个过程非常爽快。,2
0,26826398,杀破狼·贪狼,周宏翔,i383781057,推荐,2017-08-21,01:39:23,古天乐的演技越来越好了，不过林家栋在电影里的人物形象太单薄了,8
0,26826398,杀破狼·贪狼,siji小猪头moli,sijimoli,推荐,2017-08-19,20:32:21,这只杀破狼比战狼好看，情节紧凑，抓人心魄！,23
0,26826398,杀破狼·贪狼,到哪哪倒龙经理,bloodlove,还行,2017-11-04,03:27:50,除了三巨头不经意的偶遇那场外，其他的剪辑都有些生硬和硬凑的味道。而即使是这成为亮点的偶遇，也比杜琪峰的类似处理差远了,1
0,26826398,杀破狼·贪狼,沈园清客,142844686,力荐,2017-08-19,19:48:38,很不错的动作加文艺片，古仔太帅了,4
0,26826398,杀破狼·贪狼,深水怪,151848881,推荐,2018-06-05,20:26:45,悲情的父亲,3
0,26826398,杀破狼·贪狼,拐了,ryblur,推荐,2017-08-14,23:01:20,好看，娱乐性不如2，但打的刺激，剧情虐的大胆，今年华语院线主流商业片目前最佳。,48
0,26826398,杀破狼·贪狼,Indecent time,51061132,推荐,2017-08-19,10:34:10,吴京得是开了多大的外挂才能在《杀破狼2》里大团圆结局；托尼贾看到上一集的反派以后不久就嗝屁了；演技担当打戏不行，打戏担当没演技空间；古天乐《毒战》都没法提名，看好这次再陪跑,13
0,26826398,杀破狼·贪狼,核斗,youngfire,推荐,2017-08-15,17:29:33,预期是托尼·贾大杀四方，成为动作戏担当，没想到他贡献一出精彩的搭戏就挂了。后面古天乐和吴樾撑起了动作戏，原来吴樾也是拿过多次全国及世界级武术冠军的，泰拳的狠劲、武侠的招式很好的展现出来了，看得非常过瘾。文戏偏弱，知道个故事线就足够，全身心投入动作戏的欣赏中。看完许久，还感觉到肉疼,63
0,26826398,杀破狼·贪狼,獨孤求敗,no1guangming,推荐,2018-11-02,11:30:59,不会看第二遍了，丑恶的政治，丑恶的市长.....,1
0,26826398,杀破狼·贪狼,2koo,Jericho,推荐,2017-08-20,17:53:11,可惜反派太弱鸡。,4
0,26826398,杀破狼·贪狼,连城易脆,57298438,推荐,2017-08-20,16:26:55,难得看到古天乐这么能打，但是表情还是特别神经质。吴樾是个不错的演员，希望未来能有更多的代表作。托尼贾死得有点早呀，略可惜。整体感觉还算不错，看多了电影，反而觉得古天乐两场认尸戏和阴差阳错的车祸戏特别令人唏嘘。期待中国未来有更多值得回味的系列电影。,1
0,26826398,杀破狼·贪狼,一张疯子照,TZ4651,力荐,2017-08-18,00:01:53,谁再说朱古力乐不会演戏真的生气😤！殓房那场戏直戳泪点，全程心痛古天乐！一如杀破狼系列的拳拳到肉！值得一赞，林家栋：天地不仁一词强烈震撼到我，将结局带来另一种思考！最后，绝望结局，轻轻地表白广电局过审！💯,12
0,26826398,杀破狼·贪狼,突然粉碎,4051316,推荐,2017-08-09,17:53:41,古天乐版《飓风营救》，普通人的生命难道就没有价值吗？这大概是古仔离影帝最近的一次，文戏动情不输林家栋，武戏动拳不输托尼·贾，为古仔雪儿CP重聚打call，吴樾跑酷追凶实在太帅,34
0,26826398,杀破狼·贪狼,悠哉,48777275,较差,2017-08-18,23:35:39,所谓的演技，和感情处理部分，显得有点多余了。小boss显得很弱智，大boss戏份不足（以为会有一场精彩的价值观辩论）。作为一个父爱片，情感铺垫苍白。作为一个剧情片，剧情太简单。,10
0,26826398,杀破狼·贪狼,妖精往哪跑💨,78200693,很差,2017-08-20,01:09:57,1颗星给古天乐,7
0,26826398,杀破狼·贪狼,已注销,165379620,推荐,2017-08-18,11:19:20,看简介以为是父亲千里救女的俗套剧情，但是电影看完完全改观，到结尾黑暗巅峰，权利面前，命如蝼蚁。剧情走心，演员走肾，觉得古仔又完成一个突破，十分值得一看。,13
0,26826398,杀破狼·贪狼,Nie-Rong,72472811,推荐,2017-08-20,04:43:45,片子不错，就是结局压抑。很多人在评价的时候提到并贬低战狼2，所以你们在证明战狼2是一部你们特别不喜欢却无法无视的电影？是50亿票房让你们耿耿于怀？那个说战狼2搞得你无片可看的豆友，请问你家是断网了吗？这个世界不可能处处如你所愿，当你在表达喜欢的时候如果还不忘吐槽，那你的快乐很少。,25
0,26826398,杀破狼·贪狼,九命猫@victor-eyes,OldCatMiMiMi,推荐,2017-08-20,22:50:21,精神敏感期看这部，我入戏太深，感觉自己一度承受不了古仔的心痛都快坐不住了，果然编导帮忙做个了断。佛教因果轮回命运观。配角性格弱更烘托古仔的文戏和林家栋的奸。武戏流畅得都有问题了，但音效拳拳到肉，感觉好疼哦,3
0,26826398,杀破狼·贪狼,国产凌凌期,62917415,推荐,2017-08-17,23:19:13,扎心了，老爸。之前感觉贪狼莫名其妙的成了杀破狼3，有蹭ip热度之嫌，完成度还是不错的。前四十分钟铺垫稍显无聊，而后天台对决和屠宰场刀战，悲情基调命运弄人的结局又让电影风格回到正轨。可对我这种去看打的人来讲太不够看了。不过吴越终于在类型片里得到扶正。个人排名杀破狼1>杀破狼2>贪狼。,14
0,26826398,杀破狼·贪狼,Morning,qiweiming750,较差,2017-08-24,13:11:57,两星半。古天乐可以拿一个提名，但是短板在于角色不够丰富，单场戏过长。他和托尼贾实在是把吴樾夹在中间有些尴尬，演得不好，打得方面也没有呈现更多的个人特色，这类生猛的戏还是需要像张晋那样表现欲强的。文戏基本就很差了，信口开河一般不假思索的写下这个故事。ps.这是又拆散古仔和雪儿一次？,4
1,26826398,杀破狼·贪狼,闲人,5054748,较差,2017-08-18,10:28:06,没有动作明星，你拍什么动作戏？,4
1,26826398,杀破狼·贪狼,卜卜,3193100,较差,2017-08-27,13:13:49,我觉得不行,2
1,26826398,杀破狼·贪狼,陆壹,June_1,推荐,2017-10-21,03:21:27,中国版飓风营救？？？ 古天乐被封印了吗 怎么没表情？？？,1
1,26826398,杀破狼·贪狼,申由己,f021,推荐,2018-04-17,23:57:16,虽然终于成了影帝，古天乐还是差点，至少就本片来说，感觉还不如林家栋偶尔闪现的几个镜头有份量，要真能称得上影帝的表演，我更愿意选择《毒战》中的古天乐。,0
1,26826398,杀破狼·贪狼,洛木,70161783,推荐,2017-08-21,00:14:55,少有的续集依然如此出色的电影，古仔一个非武打演员都被调教得有模有样，虽然有替身，但是已经很不错了。再有就是吴樾和托尼贾以及克里斯的打斗简直太帅了。当然，剧情也是扣人心弦，故事讲好了，人性“贪”的一面被揭示得很深刻。,3
1,26826398,杀破狼·贪狼,深夜声噎,sfroompp,还行,2017-08-17,23:33:42,最后竟然这么软，好吧整体也不太硬，各种细节都不太认真的，贪字何在只看到导演顾着省钱，故意的？可惜高不成，B不就的感觉。,7
1,26826398,杀破狼·贪狼,豆瓣酱,dbjv5,还行,2018-01-04,00:12:30,结构完整，看点在吴越,0
1,26826398,杀破狼·贪狼,daangel,daangel,推荐,2017-11-21,22:42:54,黑化版《飓风营救》，开挂的老爸毕竟还是少数。（杀破狼一如既往的黑暗）,0
1,26826398,杀破狼·贪狼,HuiTsung,HuiTsung,推荐,2017-08-30,10:12:02,岳父拿女儿挟持女婿（谁跟女儿更亲？），古天乐被铁钩弄残废一眨眼康复9成，诸如此类的bug有很多，但不妨碍观感。当古天乐拉开女儿尸体时顿觉这系列的悲怆感得以维系，能一绝到底也是本领，文戏比前两部要细腻，动作戏相对弱化了。 讲真，合拍片能在17年保持这水准而且pure港产feel已经少之又少。,2
1,26826398,杀破狼·贪狼,Lonely,47461599,还行,2017-12-16,01:38:04,6.0/10 分。打戏合格，但也没太多的惊喜。关键是剧情太扯淡了。。。林家栋这样的年度最优秀员工到底为了啥呀，居然杀人抢心脏无偿送老板。。。就算是基情真爱都没这么用心吧。。。虽然有个别的亮点，但总的来说，第三部和第二部比第一部差太多了。。。,2
1,26826398,杀破狼·贪狼,唔破司,oopsisme,还行,2017-08-19,01:26:26,古仔动作戏真的不行,2
1,26826398,杀破狼·贪狼,嘟嘟熊之父,duduxiongzhifu,较差,2017-08-28,21:56:59,非常掩人耳目的套路，但还是套路，所有人物的塑造都极其表面。,3
1,26826398,杀破狼·贪狼,听霜书生,29442857,还行,2018-12-26,10:30:34,多处牵强以推动剧情。,0
1,26826398,杀破狼·贪狼,xīn,caesarphoenix,推荐,2017-08-17,23:47:50,万达CBD店2017.8.17.9:20pm,2
1,26826398,杀破狼·贪狼,刀叢中的小詩,fengxifengxi,推荐,2017-12-01,21:04:25,某种时候，我也有一种近似于剧中父亲的感觉。那种偏执，那种坚持，那种血涌，那种自毁，那种遇事不顾一切把一切搅得个天翻地覆的勇气和决心。对不起，最后我失败了。,1
1,26826398,杀破狼·贪狼,半只文人,45498823,还行,2017-08-20,20:46:27,血腥度够了，动作戏还差点，洪金宝的动作设计越来越不耐看了。剧情一般般，“宿命感”的表现不如前两部。个人还是最喜欢杀破狼2。另外，始终搞不懂为什么要叫“贪狼”？,1
1,26826398,杀破狼·贪狼,朱熠,joyeejoyee,还行,2017-08-17,23:15:47,在动作戏的层面，在杀破狼序列里是垫底的,3
1,26826398,杀破狼·贪狼,Panda的影音,PandaMovieMusic,推荐,2019-04-21,22:22:40,1.在《反贪风暴4》上映之际，想起去年古天乐首次拿香港金像奖影帝的《杀破狼·贪狼》还没看，于是就决定看下这个系列；2.古天乐在片中不仅动作戏卖力，哭戏也用力，看他如此努力，所以评委们让他在金像奖也获得了胜利；3.这个父亲救女儿的故事联想到我看得更爽《飓风营救》；4.《贪狼》的动作戏与前两部《杀破狼》对比，感觉并不够出彩，血腥暴力指数也不及前作；5.对他们来说，他们要的才是真相，有需要，每一个人都可以被消失。…… 对与错，怎么分辨？谁能肯定，谁的生命才是最重要？……,0
1,26826398,杀破狼·贪狼,Monica,121017430,还行,2017-08-15,10:20:32,古仔的打戏和其他几位比起来太弱了...为林家栋爆灯！！！,7
1,26826398,杀破狼·贪狼,摩诃曼珠沙华,cn_panda,还行,2017-10-27,07:47:17,有前作垫底，打斗场景威亚的痕迹太明显了。双方都是软手软脚的感觉。本来是拍飓风营救的视角吧，结果就是个宿命论。谁的生命最重要？当然是我自己的啦,0
1,26826398,杀破狼·贪狼,🪶,Jarry_yang,较差,2017-08-18,03:43:17,替身拍的这么明显也能在豆瓣得好评，真是难以想象其它同档期影片,10
1,26826398,杀破狼·贪狼,三四,sansi,,2017-08-20,23:41:27,为黑古贡献点票房。（永恒·宝龙）,2
1,26826398,杀破狼·贪狼,蓝格子,bluegrid,推荐,2017-09-02,11:13:46,蛮意外的一部，打斗戏很精彩，市长家安保bug，最喜欢撞车的那一场戏，很多事情明明有机会，但就是会错过。,2
1,26826398,杀破狼·贪狼,承泽明,4075446,还行,2017-08-18,23:27:34,动作戏不错，有几场戏甚至到了cult级别。但这个剧本感觉很怪，有些想当然了。,3
1,26826398,杀破狼·贪狼,县城中学教员,149542050,力荐,2017-08-22,12:29:38,半殖民地半封建社会的现实。奴隶渔民，血汗工厂，政府主导的色情/人妖行业，纸醉金迷的上层买办阶级。看完以后我想把每一个泰国中产阶级的脑袋剁成蒜泥,5
1,26826398,杀破狼·贪狼,chan,chzzh,还行,2017-10-22,22:15:11,看托尼贾部分就行了,0
1,26826398,杀破狼·贪狼,偏时差,ananpsc,还行,2017-08-28,20:54:33,一個為了給長者續命的故事,2
1,26826398,杀破狼·贪狼,鱼闲卿,mulin_111,还行,2018-04-17,10:43:11,完全没有低谷高潮低谷高潮这样的起伏转折，只是一路平铺直叙走向越来越绝望的结局，中间以精彩的动作戏穿插，典型的动作片剧本。古天乐的表演确实很细腻准确。,1
1,26826398,杀破狼·贪狼,丽地呼声,120672970,力荐,2017-09-03,21:42:02,动作设计给力，就是取景不在香港，不爽。,0
1,26826398,杀破狼·贪狼,哈卡,mother_rose,还行,2017-08-18,18:00:06,吴樾的表演太差， 把面瘫古衬托成影帝了都,3
1,26826398,杀破狼·贪狼,迷宝,bixiongzz,还行,2017-08-22,20:52:14,古天乐好像再怎么演得好，也还是有种中规中矩的感觉~,2
1,26826398,杀破狼·贪狼,梅岭藏殊梅长苏,54153810,还行,2017-08-20,17:56:51,古天乐好点帅！,1
1,26826398,杀破狼·贪狼,Chris  一切由无聊开始,sniperchris,较差,2018-01-11,17:31:01,整体是走残酷路线的，但整体上脱不了普通港片的水平。托尼贾打了一场架，就打酱油了。古天乐动作戏都分解了，因为他没法做连贯，没法全身动作都做。整体上没什么意思，港片味也不浓。很多静的灯光都比较假，都太亮了，很平板。,1
1,26826398,杀破狼·贪狼,得儿然,DerRan,还行,2017-08-19,16:43:04,国外总是那么黑暗,0
1,26826398,杀破狼·贪狼,容貌焦虑主理人,ymm,还行,2017-11-13,14:20:15,必须分级，这片太暴力了。项少龙终于和雪儿公主在一起了。,0
1,26826398,杀破狼·贪狼,狄飞惊,difeijing,较差,2017-10-24,23:23:01,不用甄子丹也顺带着弃了托尼贾乃至吴樾，不得不说叶伟信勇气可嘉，之前的几部作品，他的导演地位已经悄然让位于甄子丹的动作戏了。但古天乐的表演就把人物和风格立起来了吗？只能说演得很用力，但其实也很表面，主要还是剧本差，没厚度也没张力，最终又折回到打打杀杀上来，导致两头都没做好。,1
1,26826398,杀破狼·贪狼,angel0205,3534571,还行,2017-08-20,22:08:54,哎，古天乐生气的样子越来越难看！挣扎半天，打了几场，淡如水。,2
1,26826398,杀破狼·贪狼,明天就现充,52143519,较差,2017-11-10,20:15:27,林家栋近年这种坏人演技真是炉火纯青了，古天乐的爆发戏不错，剩下也就吴樾和托尼贾的打戏能看看了……,1
1,26826398,杀破狼·贪狼,这是谁的shil,152927295,力荐,2017-08-19,15:33:49,古天乐好像又回到了原来的好片时代,12
1,26826398,杀破狼·贪狼,黑骨精,heigujing,较差,2017-11-14,10:18:50,俨然是港版的《飓风营救》，但是情感的推动力太薄弱了。打斗场面设计感太重，现场置景缺乏错落感，人为性太强。,0
1,26826398,杀破狼·贪狼,之晨,129911592,推荐,2018-02-19,00:51:32,"辛苦遭逢经半生，干戈寥落贪狼星。
天地不仁风飘絮，身世浮沉雨打萍。
人生自古谁无死？留取丹心照父亲。",2
1,26826398,杀破狼·贪狼,君心可晴,3199619,还行,2021-10-06,20:37:31,打戏没有突破，都是别人玩剩下的，不是功夫演员的古天乐真的是所有人中的软肋，打的效果最差。……情节实在太烂，烂到不能烂，不知所谓。……演员，古天乐真的老了，那眼睛快赶上甲亢的李连杰了，想想他年轻时候的颜值，唉，毕竟是70年的。其演员看着都要比古天乐演技好，毕竟眼睛是心灵的窗户，肿眼泡的古天乐也只能一声叹息。……想想李连杰，没有肿眼泡的时候，可是凭借《投名状》拿过影帝。,0
1,26826398,杀破狼·贪狼,灰色堡垒,hanqiu1995,推荐,2017-08-17,18:14:13,《杀破狼》系列，连《导火线》在内，应该是国内整体水准最高的动作片系列了。吴樾终于主演了一部动作大片，很多人可能都不知道，他和李连杰、赵文卓、张晋一样，都达到了中国武术运动员的最高等级——武英级。叶伟信的回归让本片黑暗程度完爆《杀破狼2》，如果剧情再扎实点就好了，7.6。,16
1,26826398,杀破狼·贪狼,石头摇篮,3064233,推荐,2017-08-23,21:59:44,剧情虽然简单，但文戏打戏追逐戏都好看。古天乐的演技，是真牛。,4
1,26826398,杀破狼·贪狼,Hey,3183520,力荐,2017-08-15,18:11:44,打斗场面很精彩，剧情也很吸引人，结局出人意料又情理之中！林家栋的演技还是那么棒！没想到会这么好看啊，这个系列有望打造成经典！,12
1,26826398,杀破狼·贪狼,布莱克,e3e,还行,2017-08-21,14:30:48,看完后又回去重新看了1根2. 相比这部来讲，太差了。,1
1,26826398,杀破狼·贪狼,Memento Mori,oldwhom,推荐,2020-07-20,20:05:15,吴樾，帅。古天乐从90年代起我就觉得他演技很好，只是作品太多不经常出彩。这部给我的感觉是真走心了。林家栋演技绝了，演配角都能把主角的风头盖过去那种绝。托尼贾打戏好看，就是人设很魔幻。,0
1,26826398,杀破狼·贪狼,诸葛福媛,36523777,还行,2017-12-27,15:54:01,故事线有点弱，但这个系列一直如此。打戏一如既往精彩，好多镜头都来回看了好几遍。希望吴樾将来能走的更好,0
1,26826398,杀破狼·贪狼,杰诺拉泽,ivanovski,,2019-03-26,20:52:40,就像中国男足 你以为很烂的片 在后来的对比中都竟然还不错 我草了。,0
1,26826398,杀破狼·贪狼,虾米爱学习,xiaoxia_Mars,还行,2017-08-17,18:42:37,香港导演编剧怎么了，现在拍的警匪片压抑得100多分钟找不出一个情绪爆点，基本上所有片子最后都要喂观众一口屎，主要突出一个，大写的“惨”字！说句题外话，从泰囧到唐探，从杀破狼23到湄公河行动，中国编剧终于找到了广电审查的法外之地，于是，泰国警政军都快被他们日烂了。,14
1,26826398,杀破狼·贪狼,传奇&蝴蝶,ADmoviemtime,还行,2017-09-06,14:23:46,全片最精彩的打斗在中场天台上托尼贾阻击外国佬大反派，动作够猛够劲，托尼贾的泰拳功夫依旧霸气生猛，中场就挂了真的非常可惜了（没过瘾回看杀破狼2去）吴越的表现还可以，谈不上惊艳。主角古天乐的武打动作明显感觉是做做样子而已，一点也喜欢不起来，他的美好回忆依然停留在神雕侠侣杨过上。,2
1,26826398,杀破狼·贪狼,小明和王猫,oomG,还行,2017-10-23,06:36:18,太惨了…古天乐都长成刘青云了,1
1,26826398,杀破狼·贪狼,一灯,day999818road,推荐,2017-10-22,20:56:28,巧合的都是宿命 故事像2 精神像1,0
1,26826398,杀破狼·贪狼,背包上学上成驴,25795086,推荐,2017-08-18,22:54:00,好看 满意 叶伟信越来越沉得住气,3
1,26826398,杀破狼·贪狼,亲爱的猥琐猪,schlampig,还行,2017-08-24,21:40:23,三场打戏质量是有的：天台一对一，屠宰场单刀赴会，砍刀群魔乱舞。由于伏线明显得不算伏线，所以谁生谁死基本都料到，少了一点悲愤。也不知道为何发生在泰国的负面故事那么多。古天乐审黑警那里，出戏到《黑社会2》。,1
1,26826398,杀破狼·贪狼,LoudCrazyHeart,72086305,较差,2017-11-12,22:53:25,乱就一个字,1
1,26826398,杀破狼·贪狼,格里高尔,storyof,还行,2017-08-24,13:27:09,开头人被命运席卷，迷途惊心，羔羊动人，但神神叨叨内容过少，不足以令观众沉沦。遗憾不是b级片，压抑和释放都不够彻底，打斗真实感太差，拳刀枪的杀伤力忽高忽低，时有时无，也是动作片通病了，严重缺乏力量的层级和平衡设置，尤其厌倦追打这种老套戏码，漫长，荒谬，和情侣的拉拉扯扯一样没完没了。,2
1,26826398,杀破狼·贪狼,###疼,hellojeff,还行,2017-12-22,00:16:13,古天乐开始飙演技了。洪金宝的动作指导真系质量保证啊，吴樾和Tony Jaa的动作部分也是杠杠滴！！！这部杀破狼3者对戏没前两部多，围绕在贪狼这个命格，中间三者撞车的同镜头为叶伟信杀破狼宿命论做了一个很好的铺垫。水准之作，比第二部好一点，文戏可以，角色入戏，动作戏也很棒。,0
1,26826398,杀破狼·贪狼,cliosong,cliosong,还行,2018-01-01,23:17:15,（6.5）抛开系列惯例和东亚特有的悲观，本片风格上可以和John Wick划作一类，叫做“现代武侠”。影片中笼罩着一种超自然的氛围，不管是脱离现实社会的组织、随时随地开挂如常的角色还是高潮时无视理智的选择。不同的是John Wick的枪战更有意义，本片的拳脚秀更偏形式。,0
1,26826398,杀破狼·贪狼,寒狐传媒,Smeagol,推荐,2017-11-04,23:33:56,3.5星。打得不错。,0
1,26826398,杀破狼·贪狼,第27章,tanxiaolin,推荐,2017-12-24,22:16:27,非常原汁原味的港片，不比前两部差，古天乐演技真是炸裂，下一届金像奖影帝应该给他。,0
1,26826398,杀破狼·贪狼,曼靑,3335015,较差,2017-10-29,19:07:58,之前连「想看」的mark都没有做，今天无意之间看见豆瓣的分数居然都已经有7.3了，就忍不住看了一下。完全是中国版的「飓风营救」。有意思的是，电影上映的时候就是我去芭提雅旅行的时候，但是总感觉电影里的芭提雅和我去的 不是同一个芭提雅。被黑诊所非法替换心脏这种桥段，怪不得要去国外拍了。,1
1,26826398,杀破狼·贪狼,余小岛,missixyujun,还行,2017-08-20,19:59:29,有点浮于表面了，把恶的一面简单化。车祸那场戏非常微妙，人人都为了自己而做出一些越线的事情，要是能够围绕着这场戏展开逐步深入该有多好。。,7
