page_index,movie_id,title,username,user_id,rating,date,time,comment,useful_count
2,26882327,血狼犬,卑微的工具人,71814599,推荐,2017-06-21,01:17:18,最后狗狗跟狼战斗 死了之后 看哭了 ,0
2,26882327,血狼犬,ZN,50744737,还行,2017-09-12,12:23:52,音乐使用十分不专业、创作、编曲、配器完全是陕西风格、而该片地点设定是新疆天山、、、故事情节过于朴实而显得无华、且简单、平淡、无味、,0
2,26882327,血狼犬,心里只有工作,159796849,还行,2017-05-19,23:44:39,狗的部分太少，结尾仓促。,0
2,26882327,血狼犬,洋2022,149577506,较差,2017-08-23,15:15:50,《血狼犬》 （2017.8.23） 4,0
2,26882327,血狼犬,金金金拾钻石,151934651,还行,2020-02-18,18:38:19,蓝波和天山的风景很配哦,0
2,26882327,血狼犬,九月,83411107,,2017-06-25,10:53:01,没重点,0
2,26882327,血狼犬,liu2008wer,81739877,,2017-05-04,19:48:16,又是疯狗电影,0
2,26882327,血狼犬,十三,149057008,还行,2017-07-12,16:51:44,剧情过慢，不太吸引人，一般吧。,0
2,26882327,血狼犬,酒馆老猫,149551139,还行,2018-09-25,03:39:03,一个护林员与忠犬蓝波的故事，狗哭是怕狼，狼哭是怕人，人哭呢？可能是怕狼和狗都没了,0
2,26882327,血狼犬,痴痴,2278436,还行,2017-04-29,22:03:25,从最初的举办人猎杀狼到最后被狼围困，不得不让人杀狼，这是一种无奈。其他的，诸如狗的忠诚，家庭的人物之间的关系，都是平常的。电影有些细节，比如男配角杀狼不杀幼仔，孝顺父母，还是影片考虑到的，也为后来他的转变做了铺垫。,0
2,26882327,血狼犬,七夜,qiye7707,较差,2017-10-02,19:15:18,乱七八糟的,0
2,26882327,血狼犬,Hhhhh,146027112,还行,2017-05-19,20:15:54,虽然片名是叫血狼犬，但狗的部分太少，其实是借狗讲人的电影，总的看下来还是有很多闪光点的，只不过导演技术不行，结尾过于仓促。,0
2,26882327,血狼犬,吾亥,ganster,很差,2017-06-20,20:20:35,白瞎狗了。最尴尬的就是演员哭的一逼，我在找泪点的路上…,0
2,26882327,血狼犬,Rose罗,loersan11,较差,2017-04-25,14:01:13,故事会央6电影,2
2,26882327,血狼犬,王绪光,199077868,力荐,2022-05-08,23:20:04,剧情，演技都不错,0
2,26882327,血狼犬,豆友205310533,205310533,力荐,2020-07-01,16:07:57,看了之后，发自内心的感动了我，我相信同样也感动了很多喜欢狗的朋友，我从小就喜欢狗，狗真的很通人性，狗永远是人们最忠诚的动物，为了主人可以奋不顾身，哪怕自已把命搭上牺牲了，也要保护自已的主人。黄宏演技太赞了！最后所有狗冲上去保护主人真的太感动了，蓝波死的时候哭的稀里哗啦的，我们一定要好好对待狗。,0
2,26882327,血狼犬,Heono,78846848,很差,2017-10-02,20:27:11,"好题材拍的稀烂
CCTV6能不能放点儿好看的👋🏻",0
2,26882327,血狼犬,难陀愚公,58547608,还行,2018-05-09,08:58:57,一个字“乱”！,0
2,26882327,血狼犬,Overdose,122369503,还行,2017-05-19,18:40:45,狗的部分太少，其实是借狗讲人的电影，还是有很多闪光点的，导演技术不行，结尾仓促。,0
2,26882327,血狼犬,中原飞鹄,113474515,还行,2017-06-21,23:59:07,剧情不足虽有，但是总体上还是可圈可点，几处确实出彩,0
2,26882327,血狼犬,lyj1123,140728570,还行,2017-08-28,23:44:34,看过之后，有感人之处，但是并不深刻，而且很多情节的突兀和不知所云，让人感到会很出戏。,0
2,26882327,血狼犬,浮尘道,145120911,还行,2017-05-07,22:12:22,"家重要还是狗重要？或者说家重要还是爱好重要？这个度过了也就不美好了！
整体这个片子还能看吧！个人认为似剧中人物的养狗、爱狗算是有些过了，因此把片子的整体水准降低了，痴迷打游戏、打牌和剧中的养狗对于家庭来说还有多大区别？ 不论什么爱好导致家庭破碎、人人不喜的时候就该是反思的时候了！",0
2,26882327,血狼犬,张巨天,Zjt888888,推荐,2019-08-23,21:58:27,故事很好，这绝对是一部低估了的片子 至少7分,0
2,26882327,血狼犬,精靈のJae,50081676,力荐,2017-04-21,16:00:04,只单纯的说电影，从情节到演员还是不错的！总比那些明星烂片强多了！有可可西里和狼图腾的影子…有喜有悲…对于喜欢小动物的可以说是催泪弹…挺不错的电影…对于电影背后的商业问题不谈论…,13
2,26882327,血狼犬,老孙,103799540,很差,2017-08-29,22:23:18,关键是什么鬼不是鬼 模棱两可都算是夸赞 关键根本就是小品也不如啊  莫名其妙无厘头啊 点都不够能坚持到  不是说意犹未尽 是完全够不到意思,0
2,26882327,血狼犬,名不名,53229667,推荐,2019-05-19,13:26:20,作为一个复杂的客体，实在很难讨喜众人。这联系啊，唯一不变的是善意和忠诚，如此看来，择一只狗就够了,0
2,26882327,血狼犬,老虎凳,11235583,较差,2017-10-10,20:36:47,爱狗人士的故事，最后狼狗大战，居然野狼惨败,0
2,26882327,血狼犬,z,153903690,较差,2017-06-26,13:37:16,还算凑活，比小鲜肉好，看到最后才知道是黄宏。    搞得全家倾家荡产的爱好。。。。有啥意义,0
2,26882327,血狼犬,好！,11271122,力荐,2017-04-27,14:25:41,花了50元看的，想说 这不是快餐娱乐电影，而是生活,2
2,26882327,血狼犬,三多少女,vivid_zhao,较差,2017-04-23,22:47:58,电影名和电影内容完全不搭界…,1
2,26882327,血狼犬,背心,mr_rko,还行,2018-05-17,07:46:47,CCTV-6看的，黄宏主演，天山景色不错。,0
2,26882327,血狼犬,千浪,84009392,推荐,2017-06-24,16:14:25,男人为了心爱的女人会改变自己,0
2,26882327,血狼犬,晓晓鱼,joanne_do,还行,2017-08-29,10:24:46,朱狼狗更符合这个片子，取个血狼犬的名反倒拉低分，咳咳,0
2,26882327,血狼犬,Coconish,141853465,还行,2019-05-19,00:23:32,私心想给五星 爱屋及乌罢了 ,1
2,26882327,血狼犬,胖胖,37229624,还行,2017-12-04,13:36:05,拍的很朴素，漏洞也很多，但比那些小鲜肉们圈钱的片子拍的要好太多了。黄宏演的老朱很到位，狗狗们演技很棒，至于蓝波为啥从金毛变狼狗了…可以忽略。最后狼与狗大战的场面很壮观，结尾的话令人深思：狗哭是怕狼，狼哭是怕人，人哭呢？可能是怕狼和狗都没了。”,0
2,26882327,血狼犬,Pandora,yeqiuke,力荐,2017-10-15,13:08:20,文章结尾写着：没有为拍摄伤害任何一只动物！,2
2,26882327,血狼犬,沉默927,157825697,推荐,2017-08-30,08:16:17,大多数时候 大多数人还真没有狗有人性,0
2,26882327,血狼犬,Zhu.x.f,169325447,推荐,2019-09-17,16:03:47,整部电影整体来说还不错 刘所长跳舞那段真的很败笔 完全没有必要啊 ,0
2,26882327,血狼犬,kiddy,yx19946100,还行,2017-09-04,18:09:45,不知道想表达啥，就是人爱狗，狗为人死……,0
2,26882327,血狼犬,Marvelous#,zky0231,力荐,2017-08-26,23:41:56,比同题材的忠爱无言好看，虽然那个也感到到我了,0
2,26882327,血狼犬,George663,49125983,较差,2017-04-22,00:36:50,剧情太老套了,2
2,26882327,血狼犬,曼沙,177467547,较差,2020-04-21,19:13:00,那老头好烦,0
2,26882327,血狼犬,错过青春的孩子,151397034,较差,2018-02-03,09:33:41,剧情勉强可以，演技嘛也就那样,0
2,26882327,血狼犬,blue,6023981,推荐,2017-04-26,19:37:47,狼狗大战让人挺揪心的,0
2,26882327,血狼犬,不具象,151144174,,2017-04-21,23:31:19,有人说这部戏里面的动物真的有死的？一听说这个就不想看了,1
2,26882327,血狼犬,可爱的酒壶,148005394,还行,2017-05-19,18:21:39,结尾有点仓促，喜欢狗狗，其他的地方还不错😄,0
2,26882327,血狼犬,凌枫,240570000,还行,2021-06-30,01:26:38,.....,0
2,26882327,血狼犬,无人与我立黄昏,140736035,推荐,2017-08-23,22:06:46,不疯魔不成活。,0
2,26882327,血狼犬,一粟,197165561,还行,2021-08-14,19:24:10,2.5,0
2,26882327,血狼犬,胖虎,143778110,力荐,2018-01-17,19:41:16,跟我爸在家看的，电影频道，黄宏演技满分。,0
2,26882327,血狼犬,陌生的瞳孔,47013733,还行,2017-10-09,21:41:44,都是一群执着的人。,0
2,26882327,血狼犬,三流,172904141,还行,2018-10-19,07:23:59,全片前面跟后面感觉就是两片子，狼狗大战三十秒，前面都是生活片，绑架表白就是真爱？这么爱狗的一个人不应该更爱家人吗？。。。,0
2,26882327,血狼犬,NaNa酱,138818350,较差,2017-09-29,18:18:12,除了尴尬……不知道说什么好。,0
2,26882327,血狼犬,糖纸,gzcats,推荐,2017-04-22,08:06:56,【2017.04.21/哈艺科韵店/No.63】国内拍摄的人与忠犬的故事，但放在忠犬蓝波上的笔墨还是少了点，片名叫《血狼犬》，但重心还是在剧中的人物上。果戏的出现有点莫名其妙的生硬，坏人的洗白有点无法解释的突兀。给一大群忠犬加两星，希望如影片结尾所说，此片的拍摄没有伤害任何动物。,3
2,26882327,血狼犬,柠檬,lemonangle,较差,2017-07-23,20:37:37,狗挺好,0
2,26882327,血狼犬,喜庆的大娃娃,42235321,还行,2017-04-13,14:18:19,真心感觉编剧有点混乱，摄像有点用力过猛存在感太高了，服美很棒，演员给力也还可以。别的故事上可能导演想表达的点多了点，感情线出来前的前半段还不错。感情戏出来就。。像个智障了。。,5
2,26882327,血狼犬,翾翛,72397976,较差,2018-11-18,00:34:47,两星给狗,0
2,26882327,血狼犬,苍耳,143955774,还行,2018-05-26,14:40:08,很多感人的地方啊，不要太较真。,0
