page_index,movie_id,title,username,user_id,rating,date,time,comment,useful_count
1,26882327,血狼犬,kino洛基,33571719,较差,2017-08-23,23:15:29,对人和狗的情感羁绊述说得太浅太平淡 结尾又要故作深沉 ,0
1,26882327,血狼犬,吃红薯放臭屁,47681702,还行,2017-06-14,09:48:35,搞不懂少数民族的脑回路，而且完全偏题了么，血狼犬好可怜老被冤枉挨打,0
1,26882327,血狼犬,pianoboy,59102621,较差,2020-12-26,14:50:07,浪费了我人生的一个半小时,0
1,26882327,血狼犬,大力无穷嘟,82924929,还行,2017-11-19,00:08:58,口音学的不像 不过『狗哭了，因为怕狼。狼哭了，因为怕人。人哭了，因为怕狼和狗都没了。』挺难过的,0
1,26882327,血狼犬,老一,48548563,较差,2018-08-10,19:58:57,我怎么还看了这部戏,0
1,26882327,血狼犬,Hello_水先生,181983384,较差,2018-12-08,22:45:02,部标,0
1,26882327,血狼犬,真哥斯拉,163293448,还行,2017-08-08,09:19:26,人物太生硬了，剧情也很乱，为🐕和黄宏老师加两星,0
1,26882327,血狼犬,沐昜,77423135,很差,2017-04-30,19:42:13,这电影逻辑，叙事方式，我服。,0
1,26882327,血狼犬,失格,151929641,推荐,2017-08-06,00:45:23,太感人了...,0
1,26882327,血狼犬,小雀斑,73259473,推荐,2017-08-30,00:06:30,蛮好看,0
1,26882327,血狼犬,自觉一表人才,elsen,还行,2017-04-27,17:58:23,狗戏不足，人戏不稳。,0
1,26882327,血狼犬,crescent.,dengyue,,2019-08-29,20:29:58,？,0
1,26882327,血狼犬,雨天凉,lty0218,推荐,2022-11-18,18:59:03,电影语言讲得很好,0
1,26882327,血狼犬,~纯白色调,79256726,较差,2020-02-08,18:17:38,剧情略显简单。,0
1,26882327,血狼犬,极恶之狼,52428120,推荐,2019-02-22,19:15:25,还可以 张彪这人塑造得有点矛盾 整体来说来说可以的,0
1,26882327,血狼犬,SHOW  HOLE,49168685,推荐,2017-04-22,23:51:50,不敢和狼图腾比，还是很有欢乐和温暖的,1
1,26882327,血狼犬,寂静时候不欢喜,80778295,还行,2017-04-24,20:15:26,虽然名字叫做雪狼犬，但是片中对犬的描写不多，感觉导演也不是想表达人与犬的关系，云里雾里，有点太乱了，看不出导演的想法。,0
1,26882327,血狼犬,乌尔禾,52336873,较差,2017-04-22,23:03:12,两星半，不是烂电影，但是不合口味。,3
1,26882327,血狼犬,心软如纸,57659076,还行,2017-06-20,22:38:18,无法理解爱狗要牺牲家人的心，第一次了解新疆风情,0
1,26882327,血狼犬,yokyo,44468873,还行,2017-04-24,11:03:01,故事不错，拍的差强人意。。衔接不是很好。,0
1,26882327,血狼犬,尼莫0330,146017989,力荐,2017-04-27,22:14:47,感人肺腑，蓝波不要走,0
1,26882327,血狼犬,INTO1-逍遥散人,178640531,较差,2018-11-16,21:59:38,电影频道播了顺带看了一眼，只能说导演想讲的故事有点多……结果一塌糊涂,0
1,26882327,血狼犬,著名演员,152020035,很差,2018-11-13,23:41:05,写了3000垃圾,0
2,26882327,血狼犬,大胖熊和小白兔,zoye2v2,较差,2018-05-16,19:32:27,看了想你吃狗肉,0
2,26882327,血狼犬,横扫硬核,156940587,很差,2017-12-07,00:05:43,明显质量和故事都不好,0
2,26882327,血狼犬,不知道起什么ID,142638644,很差,2017-04-24,22:39:22,没明白电影内容和电影名字有何关系，再者不太明白短短一部电影为何要塞这么多可省略的剧情进去，导致电影连个重心都没有。,1
2,26882327,血狼犬,狮子猎手,143517881,很差,2017-08-19,00:21:36,没觉得好看,0
2,26882327,血狼犬,小哆啦有心事,186350460,还行,2022-07-22,15:22:42,其实还可以，评分略低。。。,0
2,26882327,血狼犬,宝妮昵,58777523,较差,2017-10-02,21:13:57,我为何会错误打开看这部片子…………,0
2,26882327,血狼犬,一只不听话的猫,144332079,还行,2017-08-16,22:39:01,想拍好一部电影，下苦工，耗时间，表演真挚，可是基础是建立在好的故事上的。这故事要情节通畅，转折合理，情感铺垫，而不能随心所欲强加上去。希望以后会更好吧，期待。,0
2,26882327,血狼犬,avril,43473856,还行,2017-04-22,21:42:20,跟狗狗有关的都没啥免疫力，朱老狗养狗护林护狼，花尽所有钱得罪所有情，最后还是他的狗群奋力和狼搏斗保住了他，还有那一直在和他家斗的张彪为了爱情不顾一切的把狼打死，被判了刑。爱情亲情信念...还想说的是，居然在刷票房啊，买票时候明明全场只剩4个空位，最后实际看的人不过10人...,2
2,26882327,血狼犬,阿一土憋,38044585,很差,2017-06-19,16:24:48,太多看不懂，想不通，不合情理，只说最后老朱家中数只土狗与野狼的终极PK，目测敌我双方数量是一比一，结果竟然以土狗损失一员，全歼野狼结束，好比是土民兵全歼了特种兵的感觉，我大天朝土狗如此强悍……还干吗要养军犬警犬？,0
2,26882327,血狼犬,梦里霓裳飞,18803080,推荐,2019-01-02,10:30:17,年末月初，一直想去影院看贺岁片，只是下雪天的夜晚出门需要勇气和陪伴，无奈在家里开了空调，和尾巴一起看了新年的第一场电影《血狼犬》，缺少影院的特效和声效真的是失色很多。2019，开启影视阅读之旅。,0
2,26882327,血狼犬,Tli71！,130462428,较差,2018-11-02,12:19:54,我想跟导演说一句:影片的氛围和观众的情绪，不是靠那些尬音乐瞎渲染出来的…能不能省省,0
2,26882327,血狼犬,堇色,136947047,推荐,2017-04-25,09:47:39,狗，人类的朋友,0
2,26882327,血狼犬,东方太甲,jarsmart,较差,2022-11-26,14:41:09,题材很高，但是完全没有主题！,0
2,26882327,血狼犬,曦月_air,airbaby_,力荐,2018-01-06,17:16:39,结局真的是够了,0
2,26882327,血狼犬,Formosante,formosante,还行,2017-06-15,22:28:47,根据真实事迹改变的题材不错，但拍的水准有点欠佳，典型的心有余而力不足，狗狗和演员们的演技都很在线，总的来说比那些无聊的圈钱小鲜肉好看的多。,0
2,26882327,血狼犬,磨叽陌,yxm8854,很差,2017-06-28,23:09:38,把狼拍的太凶残，难道主题不应该是人与自然和平相处么，狗是好狗,0
2,26882327,血狼犬,聆聆,1167276,很差,2017-08-21,07:10:14,电影名字起错了吧？狗的戏份也太少了。另外，为自保勾引对方、看了次跳舞就对仇人之女爱得死去活来、离了婚莫名其妙去照顾瘫痪的仇人之母…唉，就觉得新疆自然景色真不错,0
2,26882327,血狼犬,凯凯茜,70438751,推荐,2017-04-28,23:01:16,影片带给我许多感动，中间泪目好多次。也许会忘记当初触动我的是什么，但是不会忘记那一刻的心情。,0
2,26882327,血狼犬,花痴,152893823,推荐,2017-06-04,20:25:26,不知道为什么我喜欢看这种电影，比那些你情我爱的更让人感动，动物与人之间的那种纯粹感情，真是让人可歌可泣。喜欢蓝波，加油，你是最棒的。,0
2,26882327,血狼犬,冬天要吃烤红薯,165719961,推荐,2019-09-21,00:05:01,题材很好 人物塑造的挺真实的 ,0
2,26882327,血狼犬,寒塘鹤影,158961799,还行,2017-05-19,21:17:48,狗狗是得罪哪位大咖还是导演了吗哈哈哈戏份好少啊,0
2,26882327,血狼犬,ChiaTeaW,148098612,较差,2018-11-16,20:53:38,CCTV6,0
2,26882327,血狼犬,MomoZoe,AudelRom,还行,2018-02-16,10:42:54,风格粗粝，表演很不错，但剧本奇怪，人物转折也奇怪，最无辜的就是狼了，狼到底犯了什么错（手动扶额）,0
2,26882327,血狼犬,陈小玉酱,46793847,还行,2017-04-22,20:00:04,好想要蓝波这么一只狗陪伴,2
2,26882327,血狼犬,一点寒冰气,luoleinusa,推荐,2017-09-13,18:14:50,剧情有点慢，故事讲的拖沓，讲述的感觉像是九十年代的故事会，但是还讲差了,0
2,26882327,血狼犬,林风锈,Exodiar,还行,2019-11-04,19:05:32,尚值一观。,0
2,26882327,血狼犬,永不开封的汽水,48266623,较差,2017-06-19,13:55:29,主人公是社会上爱狗人士的真实写照,0
2,26882327,血狼犬,S.,127841033,较差,2020-07-17,13:32:53,两大男主演技1星，狗1星，其他，无,0
2,26882327,血狼犬,阿烦是小狗,sth2die4,很差,2020-10-14,13:02:00,人物、情感感觉都是断层的😣😣,0
2,26882327,血狼犬,Lee,66094043,还行,2017-06-19,07:16:57,黄宏不光会演喜剧会演小品，也会演感情戏，剧情一般，训狗那段比较喜欢，张彪爱上了大女儿神马鬼？坏人转化有点太快了,0
2,26882327,血狼犬,就是个说书的,149875300,还行,2017-06-30,01:55:08,风格粗犷，新疆味道很赞,0
2,26882327,血狼犬,康晶,148726568,还行,2018-02-16,09:21:21,在电影频道看的，和不久前看的忠爱无言一样，讲的都是狗狗。但相比来说还是差太多。,0
2,26882327,血狼犬,M能能M,150236253,较差,2017-05-04,16:48:56,还行，预想之中的样子,2
2,26882327,血狼犬,王小三,mewangxiaosan,还行,2021-08-26,21:50:11,黄宏老还会秦腔，，来了一段单童,0
2,26882327,血狼犬,骆白白,45379540,还行,2018-01-11,17:57:41,所有的忠犬都逃不过为主牺牲的命运 狗不要面子的啊,0
2,26882327,血狼犬,🍁,129331314,很差,2018-01-17,19:36:51,为了狗就可以不尽一个父亲，丈夫的责任！这种价值观的电影真的是垃圾,0
2,26882327,血狼犬,青山翠色,3264047,推荐,2017-07-29,23:56:46,难得的中国好片！西北雪景极之壮美，深沉辽阔，每一个风景的镜头都犹如水墨画。,0
2,26882327,血狼犬,coco,155243145,较差,2017-05-19,14:58:47,虽然是借狗讲人的事，但是狗的部分也太少了，其实还有不少亮点但是都没有展示出来，失望,0
2,26882327,血狼犬,圈圈全,129533847,很差,2018-11-13,20:58:02,上天山上摘雪莲 喀纳斯湖抓水怪 彪哥的爱轰轰烈烈啊,0
2,26882327,血狼犬,特立独行的猫,jwwwt1126,还行,2017-06-25,14:35:30,冲狗来的,0
2,26882327,血狼犬,小婉是只猫🐱,68015443,较差,2017-06-19,16:45:38,………,0
2,26882327,血狼犬,MAKOTO,135914048,还行,2018-01-07,16:31:48,很朴实很民俗，狗狗好好。,0
2,26882327,血狼犬,沐婉,miqingye,还行,2018-07-05,15:20:53,哎，狗子最后牺牲了,0
2,26882327,血狼犬,秋天的猪,nizhenhua1981,较差,2017-07-20,22:40:28,你说说这个同样是拍狗的电影，你想要表达什么，感动？忠诚？最后弄个四不像,0
2,26882327,血狼犬,狐狸千歲,48943856,力荐,2017-06-15,11:53:43,演员全程演技在线，最后的结局引人深思。当你一心保护的东西伤害到你的时候，该怎样选择？,1
2,26882327,血狼犬,顾猫宁,44667873,很差,2018-01-27,21:41:53,这部戏应该是《雪，狼，犬》……太散，不知所云，没有重心，情节生硬。,0
2,26882327,血狼犬,李逍遥,49329705,很差,2017-11-13,16:11:24,CCTV6特供剧情片，立意是不错的，但是很多地方毛病一大堆，哎，不说了,0
2,26882327,血狼犬,白狼杰洛特,26514879,较差,2017-08-18,22:59:06,还是假大空了点，名字跟内容关联不上，剧情也很突兀。,0
2,26882327,血狼犬,辉辉,142258806,还行,2017-08-25,21:34:21,还行,0
2,26882327,血狼犬,大宝法王小海君,caoxiaohai,还行,2017-10-07,11:32:52,毕竟各个视频网站都免费播了，剧情急转弯太多，有点懵。,0
2,26882327,血狼犬,烟波月,175959483,还行,2018-08-24,23:00:05,还可以，支持一下吧,0
2,26882327,血狼犬,雪鬼,132360488,较差,2017-09-24,11:11:06,2个小品演员，玩的深沉。故事太突兀了，一般人理解不了。,0
2,26882327,血狼犬,一天到晚不纠结,84718715,推荐,2017-06-25,20:26:25,烂尾了。四星送给黄宏的演技。演的真好！,0
2,26882327,血狼犬,十一,140170906,还行,2017-04-23,10:39:32,三星全给狗狗,0
2,26882327,血狼犬,小狼,xiaoang_0528,推荐,2017-10-28,20:13:31,开始看得还好，越到后来越没兴致,0
2,26882327,血狼犬,莫莫,1838937,力荐,2017-06-17,22:06:42,真是很奇怪这么好的片子为什么那么多人给差评，发现崇洋媚外在电影上也有体现，国外的片子就给好评，不论好坏，可是大陆片子给差评的就太多，就因为纠结片名不管多好看居然也就给出一星，豆瓣现在真是基本没啥可参考性了，好多评价的就不能跟着自己的本心走吗,0
2,26882327,血狼犬,蓦然回首间,68949871,还行,2017-04-28,20:07:57,很受不了忠犬的剧情，每次都会哭,0
2,26882327,血狼犬,M的的M,76878171,较差,2017-10-07,10:07:44,我爸在看的时候瞟了几眼，尴尬,0
2,26882327,血狼犬,白马还是黑马,131925414,很差,2017-07-02,21:45:48,真烂,0
2,26882327,血狼犬,sas,163283145,还行,2019-07-03,17:10:10,补标,0
2,26882327,血狼犬,追逐繁星的Echo,EchoLi0629,还行,2017-06-23,10:00:58,和期待的不一样，但总体来说还是很感人的,0
2,26882327,血狼犬,丁小七,jiasil,推荐,2017-06-23,22:07:25,瑕不掩瑜。一堆差评真心莫名其妙。,0
2,26882327,血狼犬,傻乎乎晚安,161135332,很差,2019-01-21,21:11:05,简直是对观众和狗智商的侮辱,0
2,26882327,血狼犬,Sunflower,61912536,还行,2017-09-13,23:03:18,故事其实不错，最后的犬狼大战很震撼，就是风格实在太粗粝，许多情节的过渡缺乏铺垫，所以也就少了丝丝入扣的动人的感觉，更用心一些就好了。,0
2,26882327,血狼犬,含章可贞,zhenyu1989,推荐,2017-06-16,23:56:21,"剧情和表演有些儿时八一制片厂的味道，
比时下小鲜肉们表演强太多了！
剧情虽然有些老套，一直有种沉闷的无法说出来的隐隐的痛！但是这就是人性，这就是生活。
值得一看！",0
2,26882327,血狼犬,起个破名愁死了,139839821,较差,2017-06-15,14:58:17,天山风光很好，演的比较尴尬。谁告诉我孙涛那个伪床戏和老二洗澡有什么意义？,0
2,26882327,血狼犬,七月是你的谎言,97335811,还行,2017-07-09,20:29:43,电影重心和血狼犬根本没多大关系，不是说狼，而是在说狗和人！还不如改成牧羊犬或者蓝波！反正最后一幕把狼全部杀死虽然无奈，但是真的觉得好没重心，不知道到底讲啥。。。。。。,0
2,26882327,血狼犬,阿尔吉侬,123996471,推荐,2019-03-16,23:51:55,为毛我觉得挺好看的，评分那么低😂😂😂,0
2,26882327,血狼犬,金瑞,njr921008,还行,2020-04-21,19:59:53,狼，狗，大战。太血腥了。,0
2,26882327,血狼犬,6号楼酸脚王,37094002,还行,2017-07-08,20:26:21,不出意料狗死了，黄宏大叔演得不错，只不过一开始对这片子的立意抱了更大的幻想，没想到就是一个平凡中不见激情的作品,0
2,26882327,血狼犬,临澜,122212283,很差,2018-11-16,22:04:58,尬的一批,0
2,26882327,血狼犬,疫情退散,165246612,较差,2020-04-18,12:01:03,  嗷！没有对比就没有伤害,0
2,26882327,血狼犬,一瓶核桃露,56072564,还行,2017-07-11,19:12:22,为什么非要把狗演死？！？！？！！！！！！,0
2,26882327,血狼犬,う转身の即逝,163689052,推荐,2019-12-31,19:19:04,会装逼的文青太多了，这么个性鲜明，你们都是吃屎长大的吧,0
2,26882327,血狼犬,漠西与LYDIA,13271937,推荐,2019-02-16,14:53:16,2019.2.16,0
2,26882327,血狼犬,John,zxyzm1989,较差,2017-04-27,14:50:09,孙涛广场舞全片唯一亮点,0
2,26882327,血狼犬,绿毛水怪,66492479,推荐,2017-07-10,01:10:45,电影虽然叫血狼犬但确实电影的主角是人而不是狗，但这并不妨碍我给他打四星，因为新疆实景真的太美，前面五十分钟可以打到五星，后面故事到结局故事有些牵强，四星！,0
2,26882327,血狼犬,Sky85224,46453605,还行,2017-06-25,21:25:05,一直在注视着天山美景，原谅我忽略了剧情……,0
2,26882327,血狼犬,芒果冰,171134282,推荐,2022-02-05,23:27:32,新疆人真的觉得太亲切了，除了孙涛老师之外，其他人都在努力地学习本地口音。拍狼不是一般剧组敢的，老家这边来过好几个剧组多数都是用军犬来演的狼。这片子还是非常用心的，如果故事线再打磨打磨会更好。,0
2,26882327,血狼犬,。,100329734,还行,2017-10-03,22:26:21,看了个尾巴演员全都不感冒，我要那个叫蓝波的犬!,0
2,26882327,血狼犬,wowo,50002134,很差,2017-07-02,11:52:40,拍狗的片，人太抢戏了,0
2,26882327,血狼犬,欧阳念念,niannianoly,较差,2017-09-14,19:16:04,这剧情有点侮辱狗了,0
2,26882327,血狼犬,月亮上的摩天轮,destinations,还行,2017-06-25,14:27:36,虽然觉得有些像儿童片，教育孩子们要热爱动物，但也反映家庭琐事、生活压力以及做人良心的一系列问题。黄宏演得不错！,0
2,26882327,血狼犬,你的男孩,173567930,较差,2021-07-14,21:04:42,可惜,0
2,26882327,血狼犬,Ayase,99180332,较差,2017-10-01,10:15:40,在家看完表示很开心没花钱去影院看,0
2,26882327,血狼犬,余声,TinyLens1990,还行,2017-06-18,19:15:30,看开头觉得还不错 后面就...   不喜欢太生硬刻意的,0
2,26882327,血狼犬,阿飞,129809320,较差,2022-11-19,19:15:22,剧情关联性不强,0
2,26882327,血狼犬,irrirrirrirr,irrirrirrirr,力荐,2017-06-26,06:31:30,根据“西北犬王”的真实事迹改编。,0
2,26882327,血狼犬,陪你过漫长岁月,138725168,较差,2017-04-23,02:29:11,不好看，请不要和八公比,3
2,26882327,血狼犬,北方小辰,158237405,力荐,2017-06-19,22:48:43,很温暖又很悲伤的故事，狗狗很可爱,0
2,26882327,血狼犬,A瑞得泰电工胶布,189044138,推荐,2019-11-10,01:10:42,真实,0
2,26882327,血狼犬,阿狸宁静致远,37793108,很差,2018-04-06,20:34:43,有一眼没一眼随便看看依旧看出尴尬癌,0
2,26882327,血狼犬,冰清®,135534020,还行,2017-08-24,20:16:15,剧情欠丰满，演员演技还不错,0
2,26882327,血狼犬,maggie,50036217,力荐,2017-10-30,17:28:56,喜欢黄宏,0
2,26882327,血狼犬,金将军,82813052,力荐,2019-10-03,18:54:40,狗比人干净,0
2,26882327,血狼犬,季清言,138671780,很差,2017-04-24,22:45:32,不喜欢,1
2,26882327,血狼犬,Roy木易,51002009,较差,2017-06-24,12:25:40,风景很美，人物很朴实，表演其实没啥毛病，剧情有些跳跃，最后狗狼大战算是是本片高潮，但看到镜头特写狗狼撕咬搏命，人躲在车里。。。就这样吧，要是以彪子和丛丛为主线拍个敢爱敢恨的片子会好看得多吧。。。,0
2,26882327,血狼犬,钟馗-倫,ZKlun618,较差,2018-09-10,21:56:00,一般吧，没什么亮点！剧情很普通，故事全是因为男主一个人的个性导致转来转去的，没什么意思。,0
2,26882327,血狼犬,小祖儿,158271369,推荐,2017-05-01,23:24:13,还是蛮喜欢这类题材的电影的  可以去看的  主演爱狗  和狗狗的忠诚很感人  但是总体感觉有点乱  剧情上中心不明确,0
2,26882327,血狼犬,沛君,copious,很差,2017-04-24,12:20:12,剧情松散缺乏逻辑，跟狗联系极少，不好看,3
2,26882327,血狼犬,甜甜有个福气妈,104315937,较差,2017-06-18,23:03:10,蓝波小时候和我现在收养的小狗特别像，除了毛色深浅，长大了不会真的是狼狗吧？？？,0
2,26882327,血狼犬,谜鹿,43299277,较差,2017-07-23,09:32:40,不是重点讲狗啊 乱七八糟的,0
2,26882327,血狼犬,Paylor,159308749,较差,2017-06-04,04:59:09,片名和内容不搭,0
2,26882327,血狼犬,MiAo米奥酋长,1777832,较差,2017-06-30,16:08:18,大陆拍动物题材想打温情牌却永远不走心，不如别难为这些阿猫阿狗了,0
2,26882327,血狼犬,tree new bee,Doul,推荐,2021-03-31,21:58:46,陪家人在电影频道看的，有6-7分。剪的有点问题,0
2,26882327,血狼犬,叮叮当当,142141958,较差,2017-10-08,20:26:52,剧情没什么深度可言，但狗狗还是蛮可爱的，黄宏演这么个护林员，也是辛苦他了，造型很逼真。,0
2,26882327,血狼犬,呆滞稻草人,126935559,力荐,2017-10-03,13:04:38,这片咋了评分这么低，除了剧情有些松散。中间方言还是食物都很贴切实际，朱老狗养狗没钱的艰苦看着也挺让人揪心的。首条评论言下之意最后是现实也杀狗了吗？,0
2,26882327,血狼犬,一,140466116,较差,2019-02-08,19:51:41,好多无意义的空镜头+最讨厌“圣父”，星星全给狗,0
2,26882327,血狼犬,张痴痴,56250024,很差,2017-10-13,22:02:50,卖爱狗人士的情怀,0
2,26882327,血狼犬,薯片。。,135136033,较差,2017-05-03,16:51:41,真的一点意思也没有啊,0
2,26882327,血狼犬,孙奇,145112315,还行,2017-08-30,21:01:55,节奏好乱,0
2,26882327,血狼犬,110ck,88358215,较差,2017-07-05,19:02:13,国产片表现人和动物之间的感情看着总是那么硬，不柔和，总感觉不会表达，东西，叙事又不会讲故事。,0
2,26882327,血狼犬,minivbear,121702064,推荐,2017-06-16,21:41:32,这片子还行吧，就是孙涛一张嘴满满的春晚小品即视感，那个张彪变的也太快了，就跟没找过女朋友似的，按说他的年龄不应该这么样啊，那个朱丛在这么偏远的地方跳这种风格的舞蹈我也是醉了，不管剧情如何表演如何，就看着新疆天山的美景也能加一星吧,0
2,26882327,血狼犬,豆友233,212462963,还行,2021-01-06,15:56:04,〈血狼犬〉看后的感想，人狗情未了，蓝波对主人的忠诚，护林，环保，值的看有教育意义！,0
2,26882327,血狼犬,清越,nanfengzhiyi,较差,2019-02-03,20:57:04,以为是狼和狗为主角的电影……结果当然不是。故事不顺畅，转折莫名其妙，有些煽情很生硬。大山的风景真美，看着冰天雪地的真冷啊，护林员辛苦了。,0
2,26882327,血狼犬,心灰意冷的鬼,61834196,很差,2017-06-27,14:12:20,弱智片，是拍给弱智们看的。,0
2,26882327,血狼犬,resurgam,4464275,较差,2017-08-20,14:55:20,段子太多。支持国产电影，加一星。,0
2,26882327,血狼犬,Álfheim,Roupeyek,较差,2022-02-13,14:32:35,（4/10）剧情人设都是一团糟，唯一可以看看的就是狼犬大战吧，观影途中差点睡着。,0
2,26882327,血狼犬,Shel,shelq,很差,2017-06-25,08:27:22,滚,0
2,26882327,血狼犬,长期不在线,150397517,较差,2017-04-22,18:31:40,要不是因为讲狗，阿歪肯定要睡着了。,3
2,26882327,血狼犬,宋有鱼,Murphymolly,还行,2017-06-20,17:09:02,实力搞笑,0
2,26882327,血狼犬,真不是我没6,60078527,还行,2017-07-30,20:01:45,前半段其实不错，最后的衔接太牵强了，放狗就人也不合逻辑。如果是拍蓝波叫人来救后回去独自战死，可能更让人触动。,0
2,26882327,血狼犬,90年代回忆,129444695,力荐,2017-10-02,19:16:44,天天只知道跪舔你洋爸爸！,0
2,26882327,血狼犬,武奕虹,170441996,较差,2018-12-20,09:05:08,很无聊的片子。,0
2,26882327,血狼犬,网上邻居,56610046,较差,2017-04-22,12:40:55,近些年不少小众国产片质量还是不错的，所以一开始对这部片子期望挺高的。但是看完真心一般，情节跳跃，逻辑混乱，主题不明确。,2
2,26882327,血狼犬,安徒,89368721,还行,2017-07-17,23:15:58,我就记得黄宏他老婆把簸箕扔到黄宏头上的时候，他说“吓死我了，你以后要是这样会吓死我的。”哈哈哈,0
2,26882327,血狼犬,九龙,husir-god,还行,2018-09-05,02:18:55,［2018120］挺好的，我是觉着演的都挺好的。就是这片子不是给大银幕拍的，是给电视台拍的。应该叫电视电影。,0
2,26882327,血狼犬,笙花未白,139348963,较差,2017-05-22,19:16:07,没明白电影内容和电影名字有何关系，再者不太明白短短一部电影为何要塞这么多可省略的剧情进去，导致电影连个重心都没有。,0
2,26882327,血狼犬,Joanna,Joanna-o,还行,2017-08-19,16:25:17,三颗星给奔波的狗狗们,0
2,26882327,血狼犬,星期天,158745393,还行,2017-05-19,22:28:55,狗狗戏份太少为狗狗鸣不平，温情，总体还可以。,0
2,26882327,血狼犬,荏苒,46581567,较差,2017-07-22,16:50:37,首先必须说，这不是你们看到片名心中期待的那种片子。片名虽然叫《雪狼犬》，但是其实狗并不是主角，片子大部分时间说的是人。最后狗为了救实在有些莫名其妙的主角还死了……无力吐槽……看在演员还算卖力表演的份上给两星……,0
2,26882327,血狼犬,已注销,144719048,还行,2018-01-17,20:08:42,狗狗好可怜 雪地唱京剧那段还行,0
2,26882327,血狼犬,白白,196857513,还行,2019-08-31,23:46:57,狗演技不错,0
2,26882327,血狼犬,鲨鱼变成长颈鹿,74511386,较差,2017-08-22,10:29:14,主题凌乱，剧情松散，故事有点为了吸引眼球而卖同情感。有些人的恶和有些人的善是相辅相成的，故事的背景永远是人迹罕至的山林，其实这种片子也不容易拍好，毕竟前面横亘着《天狗》《忠犬八公的故事》等大山。,0
2,26882327,血狼犬,贪果失花,173366322,推荐,2018-06-24,00:08:15,巨喜欢了 就是张彪和朱丛对上眼那有点看不明白（为什么评分这么低555）,0
2,26882327,血狼犬,smile岁月静好,143363671,还行,2017-07-01,21:09:57,人与动物之间特别的情感表达完成得还不错。在最后营救中警察永远慢一步系列再现。,0
2,26882327,血狼犬,东野,72608324,力荐,2017-06-24,09:52:44,"接地气
好看",0
2,26882327,血狼犬,我眼神不大好使,97466216,推荐,2017-04-24,23:54:11,可我还是怕狗……,2
2,26882327,血狼犬,咖啡,137678761,力荐,2017-04-24,07:29:24,狗比人简单得多 ,1
2,26882327,血狼犬,她勇哥,141226298,很差,2017-06-22,21:52:39,剧情很乱，不知道名字根据什么来取的，跟狼图腾比差太多了,0
2,26882327,血狼犬,ASUKA天下第一,230496711,推荐,2022-09-11,08:30:18,看哭了,0
2,26882327,血狼犬,蘇工,foolishand,还行,2017-06-26,15:56:34,本来可以多好的一个故事啊，多好的一群演员啊，咋拍成这样啊...,0
