page_index,movie_id,title,username,user_id,rating,date,time,comment,useful_count
2,26387939,摔跤吧！爸爸,一首歌,56925729,力荐,2017-05-19,12:13:50,是真的很好看，可惜爸爸帮女儿们揉脚的那一段被剪了。很多人说爸爸独裁专制，忽略了爸爸答应的一年期限。,4
2,26387939,摔跤吧！爸爸,黑道少年沈來迟,Danilelavoie,力荐,2017-05-12,15:35:26,近期看的电影中，就这一部看得百爪挠心，哪怕知道情节走向会怎么发展，也还是感动到不行。即使不基于印度国情，一个父亲能爱得如此强制又理智，已是佳片。,2
2,26387939,摔跤吧！爸爸,c h u n+,zzjacy,力荐,2017-05-31,08:44:00,其实我国的运动员成绩再好也不是天上掉下来了。完全可以拍一些这么接地气又感人励志的片子，少一些作秀吧。,4
2,26387939,摔跤吧！爸爸,貓小三的意思其實是如果先生,2473154,力荐,2017-05-13,02:22:04,还是得有劲儿。还是有劲儿的、有脂有肌有力量的身体比所谓的身材（无论是流行过的白瘦的还是流行着的健身房身材）好看多了！,4
2,26387939,摔跤吧！爸爸,妖魔鬼怪快离开,134137735,推荐,2018-08-08,15:35:01,"很好看的一部电影，虽然是摔跤题材但是同时又真实的反映出了印度女性的社会地位，大部分10+岁就可能要嫁人，没有自己的事业， 像吉塔和巴比塔这样的竟算是异类了，为自己生在一个平等社会感到庆幸，体育题材很容易让人热血，看完之后难免心潮澎湃，爸爸虽然爱自己的女儿们，但是他也不顾女儿的意愿强迫她们学习摔跤以继承自己的理想，看到最后我也没有搞清楚摔跤究竟是吉塔自己热爱的事情，还是因为父亲的期盼，国家荣誉，或是为提高女性地位而加在她身上的责任。
当然看片的时候不会想这么多的，至少散场时我自己满脑子想的都是这电影真好看。",10
2,26387939,摔跤吧！爸爸,bunny17。,35605638,力荐,2016-12-27,20:53:53,很棒,16
2,26387939,摔跤吧！爸爸,反游猫鱼,itest,推荐,2017-05-13,19:39:03,发短评的目的并不是针对电影，去否认导演和故事本身。我的目的是给观影者，特别是父母们提个醒：在感动之余需保持独立思考，不要被情绪裹挟，谨慎去对待电影输出的教养方式，它有自身的局限性，不应该把它成为一个佐证，去证明自己的教养方式。,4
2,26387939,摔跤吧！爸爸,郑在起床,dingxiang_4537,力荐,2017-05-13,19:09:07,原来摔跤是这么惊心动魄的运动！又哭又笑紧张刺激，太优秀！可以二刷原声！,6
2,26387939,摔跤吧！爸爸,麦田夜莺,shininglai,推荐,2017-05-13,21:38:49,从印度国家和女权意识来看是五分电影，在我们眼里看，这样的内容太过说教和主旋律，最多三分。好吧，多一分给阿米尔汗，四分。,3
2,26387939,摔跤吧！爸爸,思郁,ygy8245,推荐,2017-05-19,23:48:31,摔跤也能这么美。按照毁结局系列演绎，如果这部电影由中国拍完全不一样，因为爸爸不会因为摔跤而失业啊，国家体育总局养着你呢，这就不会有后面让女儿实现自己梦想的故事了,6
2,26387939,摔跤吧！爸爸,周游雪场,3285194,力荐,2017-05-14,23:43:52,成熟的商业电影作品，成不了史诗，离经典还差一口气。但是也没必要去苛责这么多了。我觉得应该允许用商业化的讨巧来贩卖历史进步的情怀，这是一种方式，触及尽可能多的普通人的方式,6
2,26387939,摔跤吧！爸爸,迷开狼,56075288,推荐,2017-05-07,16:59:50,"《摔》所呈现的既不是男权女权，也不是父权，而是在成长过程中两代人的摩擦和亲情。成长是残酷的，也是幸福的，痛并快乐着。
",3
2,26387939,摔跤吧！爸爸,海伦,xw0525,力荐,2023-01-16,02:37:04,用别人看得懂的方式来输出自己的文化,6
2,26387939,摔跤吧！爸爸,倒长的树,sunny.de.sky,推荐,2017-05-20,19:24:32,"1阿米尔汗自己成立的公司
2男权严重，从父亲的梦想，到自己的梦想。
3哪里都有有关部门，也许现实更黑暗
4大英联邦
5现实可能更黑暗。
6三傻里面的同学，是卖小吃的。",3
2,26387939,摔跤吧！爸爸,可怜的病痛患者,zhangziyuan,力荐,2017-05-14,22:42:49,视觉上是非常好的，很成功的商业片，就像很多豆瓣9分以上的电影一样，不见得是大师级的神作，但肯定是会触动最大多数群众神经的，再加上大家好久没看到好电影了嘛。,9
2,26387939,摔跤吧！爸爸,百城千世子,vividance,力荐,2017-05-05,23:03:26,①对体育赛事从无兴趣，看完本片突然理解那些狂热的体育粉了。 ②当印度靠这样的真实题材改编电影激励无数底层人民的命运时，我们十年内也拍不出这样的作品，评论还在为是否女权正确撕个没完。,8
2,26387939,摔跤吧！爸爸,只为遇见你,174084296,推荐,2018-04-07,14:33:17,阿米尔汗是个好父亲，电影非常有教育精神一个字赞。,7
2,26387939,摔跤吧！爸爸,椒盐豆豉,mfcndw,推荐,2017-07-24,15:09:29,艰难，成长，挫折和励志拍的恰到好处，关键是摔跤场面还拍的很棒。有点遗憾的是主体思想似乎是有点游移发散了，很多人觉得是女权，作为算个女权的人看着很多地方又觉得别扭。另外吉塔和队友到底是有没有一腿……,3
2,26387939,摔跤吧！爸爸,GAKI,kingdajiangyou,力荐,2017-03-17,10:20:11,印度国歌一响简直泪崩，爸爸一句你是我的骄傲再次泪崩,22
2,26387939,摔跤吧！爸爸,青木瓜之味,63730928,较差,2017-04-20,20:11:19,标签逗我呢，还女权，这是一部彻头彻尾宣扬男性极权的片子，三观不正，作为传记电影中规中矩，不要相信IMDB印度片的评分你懂的！,6
2,26387939,摔跤吧！爸爸,破皮儿蛋,popierdan,推荐,2017-09-13,09:41:26,运动场面拍得最好的电影，剧情其实一般,2
2,26387939,摔跤吧！爸爸,7酱™,maxineY,力荐,2017-07-09,15:08:50,意外的看见了未删减版，真诚的好，填充了很多细节，人物更饱满。,2
2,26387939,摔跤吧！爸爸,OhMyTotoro,express2047,还行,2017-05-05,18:47:39,剧情俗套，阿米尔汗是唯一的主角，两个女儿不过是肉靶子而已，她俩从排斥摔跤到认可摔跤的思想转变僵硬，人物塑造流于表面，对体制的讽刺很直白浅显，为讽刺而讽刺。兼任国家队教练的导演本人，不论执教水平还是执导水平都是够差的。另外，影片里的女权终究还是被戕害了,8
2,26387939,摔跤吧！爸爸,嘀嗒嘀嗒嘀嗒,142089894,推荐,2018-01-31,08:25:58,阿米尔汗选片质量一流，我很感动于父女之间的亲情，但始终让我不能打五星的原因是：到底该不该把自己的梦想强行绑架给孩子？,74
2,26387939,摔跤吧！爸爸,优优,174786377,推荐,2018-04-04,12:21:25,阿米尔汗演的爸爸让我很感动，对女人教导让我看到了一个爸爸的用心,10
2,26387939,摔跤吧！爸爸,豆友1102543,iamin-yu,,2017-07-16,14:06:04,不是传统打败了现代，而是因材施教打败了流水线。,1
2,26387939,摔跤吧！爸爸,大 象,kevinfilm,,2017-08-18,14:06:42,很一般吧,3
2,26387939,摔跤吧！爸爸,土豆兔,172654476,力荐,2018-01-19,20:44:27,"是我喜欢的体育题材，拍的太让人惊讶了，从""我的神""开始觉得阿米尔汗能在自己的国度里去关注社会问题，又能有所改变，电影也是有力量的",35
2,26387939,摔跤吧！爸爸,突突突。。。,lowkey7,力荐,2017-05-06,21:45:26,等待时机，让你的对手露出破绽。,5
2,26387939,摔跤吧！爸爸,竹叶卷心,139406622,力荐,2018-04-06,22:28:58,超级好看！大女儿小时候漂亮长大也好好看啊！比赛很燃，最后父亲没有出现在比赛现场这个设定很棒了,9
2,26387939,摔跤吧！爸爸,麦子麦子酱,yuliamelody,力荐,2017-05-07,23:29:42,最欣赏阿米尔汗的一点就是他为消除阶级不公和提高女性地位作出了不少努力（包括他那档《真相访谈》节目，做得很好，推荐）。这部电影非常燃，我旁边的女孩子一直在叫好鼓掌，仿佛身临其境看比赛。和《银河护卫队2》同档期好吃亏，但不妨碍它是部值得看的片子。,8
2,26387939,摔跤吧！爸爸,很好很会吃米,howlongisyoyo,推荐,2017-05-10,18:25:57,非常规矩工整 也的确鸡血 听我一句劝 看看印度人 体育片就不要谈恋爱,3
2,26387939,摔跤吧！爸爸,十一伏特,stlark,力荐,2018-02-22,01:28:09,先不论其他，单就摔跤竞技的动作场面拍摄得每次都极为带动观众情绪，那就已经是优秀体育题材电影了。叙事节奏感也极舒服，小到每一次比赛、每一句、每一分数的获得，大到全片前后两部分的起承转合，长达160分钟丝毫不见拖沓。阿米尔汗前后身形体重差别之大，女演员们表现摔跤动作之专业，令人敬佩。,2
2,26387939,摔跤吧！爸爸,发福的唐吉珂徳,b612,还行,2017-05-29,16:05:46,“主旋律”的有些吓人。最低层次的“女权”吧。最后那句以你为豪的句子还是重归父权的定义。而且，最关键的是：一定要赢。如果抛开这两个点，整个影片还是很舒服很好看的。,3
2,26387939,摔跤吧！爸爸,顾俏乜,66428405,力荐,2018-05-18,22:57:04,竟没认出来是兰彻，热血又感人的片子，阿米尔汗相当的敬业了。,9
2,26387939,摔跤吧！爸爸,蒙莎,1557889,力荐,2017-05-05,22:21:22,打1星的都是垃圾╮(╯_╰)╭,7
2,26387939,摔跤吧！爸爸,潘驴邓小闲,175255131,力荐,2022-07-22,15:31:37,印度的女人没地位，没有自由意志，片子看似讲述女孩也能有所成就，但起因还是为了实现爸爸的愿望，但再进一步想想，她们的未来能有什么可能性呢？她们的朋友14岁就被家里安排嫁给一个从来没有见过的男人，摔跤作为她们出人头地的职业也算是一条捷径，毕竟爸爸是全国的摔跤冠军，而她们只有在功成名就的时候才能有更多的自主权，说到底穷就没有那么多的选择，何谈自由意志。,10
2,26387939,摔跤吧！爸爸,阖昔,1645277,力荐,2017-06-05,22:29:53,对印度女性地位方面感受不多。着眼点在大女儿的成长过程，大闺女之所以有阵子老输，一个是因为新教练没有因材施教，二因为她老爹的魔鬼训练其实主要锻炼的是意志力。这种竞技对战，拼的就是毫厘间的意念，能否在强攻下保持理智，能否在巨大劣势中保持镇定扭转局势，技巧之流在高压下啥用都没有。,3
2,26387939,摔跤吧！爸爸,阿五,140594033,还行,2017-05-07,13:39:00,被过度神化的温情励志片。且不说三观合不合，剧情设置其实很套路，缺少新意和惊喜。,6
2,26387939,摔跤吧！爸爸,风满蜃气楼,bearish,力荐,2017-05-07,20:22:49,太燃太好看了！矛盾与危机的设置和激起观众共情的点都很到位，看得我多次涌泪：感动、触动、激动，情感的细部又各不同。编辑和导演就像魔术师一样推动着剧情发展，想起日本王道少年漫，但这部电影隐含的东西又复杂得多。不是所谓的反父权或瓦解男权女权，而是呈现出权威之下亚洲民族家庭关系的复杂性,8
2,26387939,摔跤吧！爸爸,豆辛瓜辛,172055431,推荐,2018-01-28,20:31:29,电影很感人，里面的动作戏也很精彩。惊叹于阿米尔汗为了呈现更真实的人物效果，先增重二十八公斤，然后再花了五个月狂减五十斤，令人敬佩的演员。,57
2,26387939,摔跤吧！爸爸,于小师,fupies,,2017-05-06,15:41:11,女子运动小国，女子运动电影大国。依然未能取代Chak De! India在我心目中的位置。接下来要看的是辛度的传记片了吧。@天津百丽宫,1
2,26387939,摔跤吧！爸爸,若谷嘉父,KyobinJohnson,力荐,2017-05-09,10:00:27,你们说男权的，有考虑过大侄子的感受吗???,18
2,26387939,摔跤吧！爸爸,䒧尼玛德,esther89,还行,2017-05-13,21:12:20,燃是燃，换做5年前我会被感动，现在觉得，很棒哦，不过我知道更好的东西。,3
2,26387939,摔跤吧！爸爸,窦。,31645646,力荐,2017-05-07,00:59:51,我为小geeta站街！！！,10
2,26387939,摔跤吧！爸爸,称称,2174521,力荐,2017-05-15,14:06:21,前半部分不能说是一点不难受的，在想这样的父权也能被歌颂。后面被轻轻绕开，变成了为国争光和父亲深沉的爱。拍的还是很好看的，阿米尔汗现在都是印度之神了吧。摔跤比赛拍的很好看，让我第一次看懂了，并且全身心投入的观看。后来想了想，在印度的思想环境下能达到这个高度已经很厉害了。,5
2,26387939,摔跤吧！爸爸,2666,103113112,推荐,2017-05-21,15:59:16,"确实会看哭，超励志。
但是就是很商业很主流的电影。",1
2,26387939,摔跤吧！爸爸,★,Makoto-Ri,力荐,2017-05-29,23:08:59,4.5 等我爸那句「妳是我的驕傲」，目前我已經等到了26年，還是沒等到。,4
2,26387939,摔跤吧！爸爸,甚小望远镜,Xuanguangge,力荐,2017-05-09,22:59:43,印度儿女多奇志，不爱红装爱武装。,4
2,26387939,摔跤吧！爸爸,转场皇后💃🏻,july0707,力荐,2017-05-07,21:52:40,非常好看。觉得这片子反映了父权压迫，什么女变男的荒诞之类的，你们小学语文阅读理解都不及格吧。,13
2,26387939,摔跤吧！爸爸,shakespeare,67679297,力荐,2016-12-28,19:41:31,接近电影本质的人，拍出真正的电影，中国的社会问题为什么这么难拍出来，拍出一点点还要禁，很不解，希望多多向好的方面学习,43
2,26387939,摔跤吧！爸爸,🎏亚木,ynlyp,力荐,2017-05-17,16:25:06,其实很套路，但是放在印度的大环境下面，再看看演员们的努力，会由衷的觉得是一部很出色的电影！,6
2,26387939,摔跤吧！爸爸,novich,novich,还行,2017-06-13,16:29:54,带小朋友看了两次，小朋友的确喜欢。不过，再强调此片对印度女性的意义，对观影本身并没有什么意义，落到电影情境的本身，还是有几个地方尤其让人不舒服，两次剪头发，尤其是第二次；另一个就是国歌加冕后，父亲再追绶，国家和父亲叠在了一起。女性这种形态的成功，看起来还是很让大部分观众受用的。,2
2,26387939,摔跤吧！爸爸,A。,dearabbyabby,推荐,2017-05-13,20:43:35,很燃。,2
2,26387939,摔跤吧！爸爸,岩井俊七,1815039,还行,2017-04-30,23:07:58,三星半，貌似几百年没看印度片了，今天坐在印度一家三口边上看感觉略奇异，特别正宗的印度式浓鸡汤，单从电影本身来看实在太齁人了，人物形象也单一扁平化，不过有泪有笑，也有对印度女孩们处境的呼喊，现场的观众似乎比印度家庭更受感染，“爸爸，你这是赤裸裸的虐待，你比反派还要坏”唱词搞笑,9
2,26387939,摔跤吧！爸爸,喜喜,annabella,还行,2017-07-22,17:07:13,人民群众需要励志鸡汤，故事知道什么时候煽情什么时候燃。就是最开始的”父亲的梦想没实现就寄托在孩子身上“的观点让我深深厌恶。这故事成功了，当然怎么说都行，没成功呢？毁了两个孩子的童年。,9
2,26387939,摔跤吧！爸爸,杨三恨,54245479,力荐,2017-05-07,23:26:56,从吉塔去专业体育学院后把父亲摔倒，父权形象完全崩塌开始就非常担心会落入俗套，但阿米尔汗并没有，抛硬币的时候故事弧光开始，能让吉塔赢得比赛的不是爸爸的训练方法而是爸爸始终相信她能做到，父亲是主角女儿亦是，一个14岁就嫁人的社会女孩赢得世界冠军从社会价值到亲情温暖，这个故事讲的漂亮,7
2,26387939,摔跤吧！爸爸,兮称,shoegazerbaby,力荐,2017-06-15,11:20:04,由衷佩服宝莱坞，佩服印度对于电影的态度，能造就出如此商业与艺术兼得的完美电影，最后要大赞一下演员和摄影，剪辑,3
2,26387939,摔跤吧！爸爸,Tyger Tyger,tangweijie,还行,2017-05-11,17:42:50,看了，7分吧。。。制作上有不少值得我们的电影人借鉴之处，一部主旋律是可以拍得蛮好看的。再多，也就没有了。,1
2,26387939,摔跤吧！爸爸,1624,susimai,还行,2017-05-10,22:42:52,欸?开篇不是一直在说赛场抱憾的爸爸看到女儿有天赋所以要她们继承未完成的国家荣誉金牌梦 怎么被新娘姐姐一说成了爸爸是为了你俩不盲婚哑嫁做新时代女性的良苦用心了...好吧搅和下也当差不多吧 对体育局 教练 女孩当自强什么的都讲了些 对摔跤这项运动萌生好感 很硬的竞技性,3
2,26387939,摔跤吧！爸爸,bunnyvivi,bunnyvivi,力荐,2017-05-15,12:39:23,看完之後回家都開始搖著頭說話,2
2,26387939,摔跤吧！爸爸,麻酱凉皮,143179167,推荐,2017-05-05,13:03:46,阿米尔汗导演的片子都很不错,7
2,26387939,摔跤吧！爸爸,momo,50636713,推荐,2017-02-14,20:46:45,最近疯传的一部电影 觉得期待度好像过高了 不过在印度的环境下虽然此片美化父权 宣扬不摔跤就童婚女摔跤手却在向男人靠拢纠结在头发上也依然可以算有影响力的发声 根据真人真事改编是一次在印度环境下的突破与成功 是女权吗？不，是人权,4
2,26387939,摔跤吧！爸爸,zykmilan,zykmilan,推荐,2018-09-05,22:33:07,水准以上的运动励志电影，把摔跤真的拍得非常好看。不过确实整个故事起承转合都比较套路，没有什么大的惊喜，如果没有在国内上映，恐怕也不会拿到如此高分数。女权什么的其实很蜻蜓点水一带而过。我倒是看到了“业精于勤荒于嬉”，彷佛就是一部量身制作嘲讽懒惰如我的片子……,1
2,26387939,摔跤吧！爸爸,叶杉,2224375,较差,2017-05-09,04:43:36,这片子没什么啊，不知道那些叫着女权的人又在想些什么,7
2,26387939,摔跤吧！爸爸,弗蕾克丝,No.47,推荐,2017-05-06,10:32:16,父亲男权说实话我也烦，但相比14岁就嫁给一个陌生人从此相夫教子，要我我也会选摔跤的。,7
2,26387939,摔跤吧！爸爸,鸡,edisonlover,力荐,2017-05-19,21:38:27,为什么我觉得很多剧情分裂的点都不对：爸爸和女儿摔跤心脏病身亡，大女儿180转身后头部落地高位截瘫，大女儿和那个闺蜜mm搞百合。。。全都没猜对。。,3
2,26387939,摔跤吧！爸爸,雨宫萤,ayilacanoe,推荐,2017-10-27,19:18:58,表哥太逗了。小新娘说的那句“起码你爸爸真的为你着想，给你未来，而不是让你做家务，然后到了14岁就踢出去嫁人”让人动容。,0
2,26387939,摔跤吧！爸爸,橘枳,45257539,力荐,2017-05-25,15:52:25,看懂了摔跤并且觉得有趣！！这一项就值五星。,3
2,26387939,摔跤吧！爸爸,小小朋友,166707316,推荐,2018-01-21,23:53:04,虽然结尾有点熟套，但确实不乏为一部佳作，阿米尔汗，演出了一位真正父亲的状态，作为一名摔跤运动员的父亲，具有运动员赋予的坚持，执着的性格，认定了的事情不畏艰难的完成，最后完成的不仅仅是父亲的奖牌梦，更是深化到为女儿的未来进行拼搏。很有深意的一部佳作。,61
2,26387939,摔跤吧！爸爸,yupei,elaine429,力荐,2017-05-07,17:28:42,全方位优秀，不管是动作设计剪辑还是立意剧情结构。充分介绍和体现了摔跤这项竞技运动，人物塑造丰满，让观众对矛盾双方的情感都感同身受，更难得的是最后难关的设置让主人公完成了从被教导者到自我觉醒者的蜕变。说这是赞美父权的，请重看一遍。,6
2,26387939,摔跤吧！爸爸,picnic,1255711,,2017-02-20,08:56:55,对这部电影我有很多很多疑问，但有一点是肯定的，这够不上是一部女权电影。电影的叙述视角是男性视角，叙事人是男性而不是两位女主角。女摔角手先是父亲生命的延续，然后是国家获得荣誉的工具。除了不在14岁之前嫁人，她们自己有什么梦想呢？她们在比赛之外的喜怒哀乐呢？她们自己的故事呢？她们是谁？,7
2,26387939,摔跤吧！爸爸,直胖,chauyik,力荐,2017-05-14,20:18:27,好看！,2
2,26387939,摔跤吧！爸爸,卫卫卫,weishilei,力荐,2017-05-16,14:08:59,事实证明，一切鸡肋的职业，比如伟大的老师，伟大的编辑，伟大的制片人，都必须极端自私和自我，幸运儿都只是恰巧碰对了人而已,1
2,26387939,摔跤吧！爸爸,林子===,fuckeverything,力荐,2017-05-23,11:34:20,电影院回来又看了一遍160分钟足本，很多删减很影响原意，但删减后有利于排片，算是在可接受的范围内吧。在印度这样一个劝说女性要平静的接受强奸、荣誉谋杀可以无罪的国家，女性的基本生存权都无法保证，谈教育方法就是何不食肉糜。这部电影是进步的，对印度女性是极大利好，阿米尔汗真真印度良心,2
2,26387939,摔跤吧！爸爸,小东邪,29898737,推荐,2017-05-15,22:51:28,放到我所了解的印度国情下看，非常燃，喜剧的处理方式也很好。关于一些明显争议问题，电影自身也已经解答得比较完整。比赛场面看得人揪心，太喜欢大女儿少年时的样子了。,2
2,26387939,摔跤吧！爸爸,核桃子,midochan,还行,2017-05-10,09:47:52,前一分钟后面的观众还在猛踢我的椅背（证明这的确是一部扣人心弦的电影），片尾字幕一出灯亮全体走人，你国观众拔吊无情的速度可以说是让人相当服气了。,4
2,26387939,摔跤吧！爸爸,安达叔的纸片党,touch1986summer,力荐,2017-05-18,20:43:07,反复看依然会被燃到不自觉嘴角上扬跟潸然泪下，硬把爸妈拉到电影院看了一遍之后回来不停问我还有好看的印度电影么？电视盒子上了免费高清之后又看了一遍，一部充满了爱跟希望的超励志亲子电影果然非常适合牵引一家人。配乐巨提神，演员都很棒很敬业。,1
2,26387939,摔跤吧！爸爸,莫宁,morncello,力荐,2017-05-20,23:52:16,最让我感同身受的是女儿上大学后对自己满意、不再那么苛求，然后竞技状态下降。也许人生就是一个不断挣扎的过程，而不是去追求可以不挣扎的那个门槛。,5
2,26387939,摔跤吧！爸爸,思故渊,tiberium,力荐,2017-05-20,18:43:41,妹想到今年看到的最好的动作场面是一部摔跤电影。摔跤看上去比刻意设计的武打场面好看多了。,4
2,26387939,摔跤吧！爸爸,瑄小璧,woaixiaoyao5402,力荐,2017-05-05,21:52:57,虽然他们说这说那说主观意志...但我依然觉得我可能没资格评价. 因为，如果没有父亲的意志，她们的命运是笃定的，必然的，一眼忘穿的. 所以，纵然还是在所谓的偏见里，我还是要流着泪鼓掌. 之前看电影评价从来不往出放，这次本身哭的够失态也没什么丢人的了. ,3
2,26387939,摔跤吧！爸爸,純真的角,140772477,力荐,2017-05-27,10:08:00,其他输了的选手也有很多故事 只是他们不是主角,3
2,26387939,摔跤吧！爸爸,暖小團°♧,babe_now,力荐,2017-04-30,21:49:42,说女权主义的都是神经病吧，真的好看的电影不需要绿trouble,12
2,26387939,摔跤吧！爸爸,荞麦安娜娜娜,qingyunic,推荐,2017-05-19,23:46:20,温情、励志、燃、有趣，好看但也没到超好看的地步。感觉最大的问题是把爸爸神话地太完美了…我更喜欢这样的剧情：爸爸也会出错，然后和女儿共同成长，同时女儿也明白即使爸爸出了错，也还是伟大的最爱她的爸爸～p.s.几乎不看体育比赛的体育白痴被强行逼看了多场摔跤比赛…也觉得蛮精彩的～,2
2,26387939,摔跤吧！爸爸,车瑞茜,xiaozhuoya,推荐,2017-05-18,10:39:16,"自满和挫败的时候, “不要忘记, 你是怎样一步一步走到这里的”..",4
2,26387939,摔跤吧！爸爸,Standwith🇺🇦,Oceannagirl,力荐,2017-05-06,22:45:18,一定要看！,7
2,26387939,摔跤吧！爸爸,Nordic_,ckafka,推荐,2017-05-15,12:45:42,看完这部电影，以后奥运会什么的我也能看懂摔跤比赛了。,3
2,26387939,摔跤吧！爸爸,阿朽,fuxiu,推荐,2017-05-05,18:55:18,别提啥男性女性了，穷地方要拼了不就得吃苦么，大家都是天朝的hard模式过来的，还能不懂？扣分的是过度的脸谱化。,5
2,26387939,摔跤吧！爸爸,克里斯托空,dabingxiaojie,力荐,2017-05-07,21:03:10,看电影时我爸在我边上留下了热泪 我有一种预感他要送我去摔跤了,4
2,26387939,摔跤吧！爸爸,无人生还,Anastasiacat,推荐,2017-05-13,17:18:17,整个剧本结构堪称入门级商业电影教科书，叙事流畅，逻辑清晰，冲突层次分明。印度音乐与此类体育竞技题材相得益彰，节奏感非常好。,3
2,26387939,摔跤吧！爸爸,张敦厚,1189608,推荐,2017-05-05,19:30:59,真人真事不会降低剧作的难度，反而会天然生出许多障碍，在父女漫长的人生旅途中，选哪些事来写，是编剧需克服的第一难题，做到这一步，还要考虑故事的重点落在哪里，是女性地位，还是父女关系？本片选择了后者，毕竟是在印度，仿佛同情女性比挑战宗教神灵还难。那场父女摔跤的戏已足够惊世骇俗了。,11
2,26387939,摔跤吧！爸爸,资源人龙骧,1979217,推荐,2017-05-15,23:36:10,不推荐到电影院去看，中国版比原版足足删减了20分钟。WTF！,1
