page_index,movie_id,title,username,user_id,rating,date,time,comment,useful_count
1,26387939,摔跤吧！爸爸,吃瓜小能手,82191753,力荐,2017-11-13,12:09:47,印度民族的重男轻女现象，在某种程度上，很能引起国内观众的共鸣。阿米尔汗将一个心志坚定的父亲形象塑造的非常成功，包括年龄上的变化，都相当传神。两个女儿小时候和长大后演得非常好。这部电影中的选角，可以说是相当成功。,8
1,26387939,摔跤吧！爸爸,清秋雨薇MOMO,MOMOWOWO,力荐,2017-05-13,09:43:09,看的眼泪汪汪的，一个演员也可以通过自己的努力成为民族英雄。,14
1,26387939,摔跤吧！爸爸,好评返现一脚,145913413,力荐,2017-05-06,21:09:30,比中国得金牌还激动！,33
1,26387939,摔跤吧！爸爸,Lycidas,raquelycidas,还行,2017-12-30,21:52:37,和10岁的小表妹一起看，她正在辛苦训练游泳想成为专业选手，平时学校功课很重，几乎没有一天能好好休息，看完她悄悄跟我说：“姐姐，我妈妈就和电影里的爸爸一样。”我看着她，一时觉得难过得不得了。,8
1,26387939,摔跤吧！爸爸,火山上的一坨石,54973750,还行,2017-05-08,14:55:56,非常工整，我居然并没有哭……,10
1,26387939,摔跤吧！爸爸,布莱克书店,zhima12345,力荐,2017-05-08,22:29:34,很传统的励志片，看他们比赛虽然知道结果但依然感觉紧张激动，这就是竞技体育本身的魅力吧。,16
1,26387939,摔跤吧！爸爸,狷介有乌青,kidcby,力荐,2017-05-11,22:18:29,【2017.56】2017年上半年度最佳，热血与感动齐驱，荣耀与亲情并驾。,16
1,26387939,摔跤吧！爸爸,書衣偵探華斯比,Houseby,力荐,2017-05-08,22:42:27,非常好看的一部竞技体育电影，很好地科普了摔跤这项运动，看得人惊心动魄，太燃了。父女情、喜剧元素，安插得到位得体。让我想起上学那会儿，老爸逼我每天早起锻炼的情景。父亲常常把自己未完成的梦想寄托在下一代身上，如果你坚持下来，可能就会变成自己的梦想，乃至奋斗一生的事业。,6
1,26387939,摔跤吧！爸爸,建筑民工,musofan,推荐,2017-09-18,04:00:27,大叔开头肩练的太牛逼了，后面肚子又能跟皮球一样当演员真是辛苦啊。印度电影目前还在男女平等和民族主义这些基本价值观建立，中国电影已经各种奇幻都市骄奢淫逸了，龙象之争在即是不是也该有点儿危机感，毕竟是背负着几千万女孩的梦想去战斗，虽然还落后，但最后赢家总是他们啊。,4
1,26387939,摔跤吧！爸爸,Loewe,loewe82,力荐,2017-05-09,10:24:54,看完脑袋情不自禁晃起来,13
1,26387939,摔跤吧！爸爸,冬季向日葵,xiangrikui,推荐,2017-01-18,01:51:43,是好电影。热血，励志，正能量，有感染力。主演Aamir Khan先生是伟大的无可挑剔的值得尊敬的人。这部电影水准相当高。但又是一部普通的电影。享受过程虽然很重要，感受不到惊喜还是会觉得平常。,19
1,26387939,摔跤吧！爸爸,莲生,3323718,还行,2017-05-02,23:05:34,突然想知道如果中国人自己拍这样一部剧会有什么样的评价？会不会就有人说，这爸爸真自私，把自己的为国争光成为世界第一的梦想强加于女儿之类。不过，在剧言剧，励志是励志的，对印度这样的国家，意义尤其重大。只是希望如果以后也有国人拍消除偏见的电影，能够客观中立哦～,24
1,26387939,摔跤吧！爸爸,tiiiiin,tin,推荐,2017-05-14,20:26:25,"剧本前后略有分裂，所以引得论战一片。
过了结婚那个桥段之后，剧情非常流畅，非常引人。
拍出这种片子，算是修功德了。",6
1,26387939,摔跤吧！爸爸,TeresaK毒药,79646239,力荐,2017-05-14,19:32:40,观影时哭的大多是女生，并不是因为泪点低，更多是因为她们确实切切实实体验过上学时被是不是警告学习不如男生，求职时被HR质疑生育会不会影响工作，成为妈妈以后要为家庭放弃自己的理想...吐血推荐，也特别适合带孩子尤其女儿去看,13
1,26387939,摔跤吧！爸爸,yihan爱书橱,yummyhue,力荐,2017-01-04,17:06:17,实在看得过瘾！难得的一部不参杂爱情，剧情也不狗血的片。没有任何酷炫的特效，纯粹的摔跤，纯粹的力与美。电影主题曲的词和曲都绝了！俩闺女小时候被阿米老爸严训训哭时配的那段曲简直把我笑岔气。闺女长大后一招一式也不是盖的，完全看不出是演员在演呀。剧中配角也都各领风骚。印度片越来越棒啦！,73
1,26387939,摔跤吧！爸爸,蔓玫,rosecrimson,力荐,2017-06-14,20:29:28,很多吐槽的人都忘了一个最基础也最重要的人设：爸爸是天生的超厉害的摔跤冠军，本片所有情节都建立在“爸爸实力无敌”的基础上。所以有的观众看不出共鸣也很正常，毕竟不是所有的家长在强势背后，都有更强势的实力撑腰啊。,14
1,26387939,摔跤吧！爸爸,红皇后,yican,还行,2017-05-18,13:48:39,片子太长，爸爸太伟光正，所有的事情没有爸爸搞不定的，爸爸所做的一切都是对的，爸爸所想的要无条件遵从，不是片子不好，片子基础不错好看的励志片，但是如果想要拔高，抱歉，高度还很欠缺非常简单单调，昨天刚看完给人施行催眠术的电影，今天就看到了会给观众催眠的电影，选片也是很魔性哈哈。,8
1,26387939,摔跤吧！爸爸,水仙操,Uroboros,推荐,2017-05-14,20:07:30,中印作为文明古国，有着深厚的文化传统的同时也意味着沉重的文化包袱。男尊女卑，官僚主义，权威迷信，城乡差别，都需要一一破除。而梦想和竞技，最有感染力。结尾父亲的不在场，才是女儿真正的独立。2010新德里英联邦运动会。母亲节，正确性应让位于照顾对方情绪了＼_(･ω･`)ｺｺ重要！,7
1,26387939,摔跤吧！爸爸,少年夏不安,bluejiang,推荐,2017-12-29,23:15:21,虽然是假女权真父权的励志片，但真是拍的好啊，竞技场面拍得好紧张，但是训练这些重复剪辑有点太多，可以减减。,2
1,26387939,摔跤吧！爸爸,坦克手贝吉塔,sickrain,还行,2017-10-31,23:04:10,拍得很认真，但也很无聊,12
1,26387939,摔跤吧！爸爸,小A,AngelinaAnne,还行,2017-10-18,09:50:29,整体制作很棒。导得很流畅，歌舞也不违和。写得就一般了，尽管把女权、家庭、英雄主义、官僚主义、攻守战术选择这几个大点很全面地包含进来，但是剧情设计简单粗暴。,2
1,26387939,摔跤吧！爸爸,#瞬间收藏家#,rex2xt,力荐,2017-05-30,17:12:17,“你的对手不光是澳大利亚选手，更是所有瞧不起女孩子的人”。背景音乐的主题真好听。剧情本身一路猜到底，但是谁在乎！比赛的时候影院里好多观众在跟着鼓掌！PS看电影的路上看到两块并立的广告：一块是《神奇女侠》，一块是一个妹子拿着手机“某某手机拍人像更美”，看完电影会想起来真是百味杂陈……| PS 说本片直男癌、鼓吹父权的，为了符合你们的理解，这部电影得把80%的剧情都删掉 #doge,5
1,26387939,摔跤吧！爸爸,朱熠,joyeejoyee,较差,2017-05-15,16:50:09,女性解放议题植入太过生硬，让整个故事像极了一个极权父亲为了自己的梦想不惜牺牲下一代的自由，一路都在对父权的正确性进行不遗余力地鼓吹。那些被煽得颤抖的少年们，建议看下《比利·艾略特》，一个父亲如何从不理解儿子为何喜欢跳芭蕾直到为了儿子的芭蕾梦不惜与全世界为敌的故事，那才是正确的三观,15
1,26387939,摔跤吧！爸爸,饱,Grubby0126,力荐,2017-05-05,23:18:15,全程无尿点好看的滴屎！三观也绝对没毛病！要知道这可是印度啊！强行刷低分的我完全能理解。“我好歹一个豆瓣老文艺 怎么能轻易被这种阿三鸡汤片打动”赶紧收起笑擦干泪一分打起来，那么就从女权觉醒的角度切入好了！┐=͟͟͞͞(￣ー￣)┌ ,33
1,26387939,摔跤吧！爸爸,猪头妖怪,PiggyOgre,推荐,2017-05-08,00:12:15,好看。作为一部体育励志片，算不上顶尖，起码也是足够流畅周正了。拿三观说事的批评者，我想不是无趣就是狭隘吧，或索性两者兼有。套用单一的模型来简化真实的世界，不是一叶障目那又是什么啊？,10
1,26387939,摔跤吧！爸爸,秋天的黛西,MademoiselleXie,力荐,2017-05-15,21:00:46,“我倒希望能有这样的父亲，能为我的未来着想。以女儿身降生的那一刻起，我就注定与锅碗瓢盆为伍，终日操持家务。当我到了14岁，他们会将我嫁给我从未见过的男人，离开家里，减轻家里的负担。而你们的父亲，至少把你们当成女儿。他为你们挡风遮雨，与全世界对抗，就是为了能让你们拥有自己的人生。”,7
1,26387939,摔跤吧！爸爸,谋杀游戏机,hexiaoqin,推荐,2017-06-08,00:16:16,总算回国补上了这部凭借口碑创造票房奇迹的印度电影，真商业，真励志，真热血，真好看。有父亲望女成凤的用心良苦，有小人物在国家权威面前的妥协无助，有为国争光的主旋律，总之胜在情感真实，何况还有一群这么拼命不靠替身和抠图的好演员。这份诚意在你国电影里着实不多见了。,4
1,26387939,摔跤吧！爸爸,宇镭,gkwind,力荐,2017-05-29,00:45:07,其实吧，整个电影后半段最大的矛盾是，“当爸爸和国家队教练的意见不一致时该听谁的”，很显然，在后半段缺乏反派制造矛盾时，为了更好看的情节，教练被黑化了……,6
1,26387939,摔跤吧！爸爸,kiki204629,kiki204629,力荐,2017-01-28,22:48:26,很热血的体育传记片，印度女性地位在阿米尔·汉的《真相访谈》里可窥一二，就是这样重男轻女的国家，出来一个女子世界摔跤金牌，真是忒不易。我们真正的对手是我们自己，父权制衡下的女权在渐渐苏醒，虽然父亲强加自己的梦想给女儿们，可就是有了这个梦想的支撑，她们才可以改善地位，做自己想做的事。,21
1,26387939,摔跤吧！爸爸,喻鸣,mufanxuanji,推荐,2017-06-14,22:27:32,酱油也是油，套路也是路。我是不指望自己创造杰作了，出一本这样工整的教科书就很知足。,9
1,26387939,摔跤吧！爸爸,麦,timbbm,较差,2017-05-12,02:09:03,14岁就要出嫁的悲剧和一生都被霸权强行教育甚至摧残的最终结果区别很大吗？在男权社会制定的规则里获得狭隘的成功这到底是赞美男人还是女人？我想看到的是父亲能为涂抹指甲时的女儿说出我为你骄傲，而不是完成了父亲自私的梦想之后赐予的一句你是我的骄傲。,16
1,26387939,摔跤吧！爸爸,jagpumpkin,jagpumpkin,还行,2017-05-16,16:02:31,关于女权，在印度这个环境已经算是当头一棒了；至于父权，我是不知道把选择权交给小孩是要小孩选择什么，况且给的选项够多就是正确吗？有天赋不浪费，对付惰性就该祭出搓衣板。姑娘飒爽美（小时候大姑娘像小佛祖大起来小姑娘更耐看），阿米尔汗帅狠，小侄子呆萌，印度歌好听，但教练那段太蠢太刻意。,3
1,26387939,摔跤吧！爸爸,黄小毛,trap_exit,力荐,2017-05-08,19:15:49,就是很棒啊，讲什么三观的什么先要考虑国情吧,7
1,26387939,摔跤吧！爸爸,Mido,mido,力荐,2017-12-11,21:04:55,"技法特别纯熟的高燃片。从来就没有什么救世主，也不靠神仙皇帝。要创造人类的幸福，全靠我们自己啊。片子提供了很多可解读的点，甚至隐约着民族和解的影子。但是强行父权的各位是读书太多脑子读出病了还是读书太少随便拎个词就上了？

",2
1,26387939,摔跤吧！爸爸,荏苒,1427200,力荐,2018-01-14,14:47:23,这个片子要是不放在印度，可能给我的感动都不会那么大。我们知道她们的情况有多严峻，才知道他们有多勇敢。,2
1,26387939,摔跤吧！爸爸,木一,siguryx,推荐,2017-05-10,21:56:00,在励志套路中裹杂缓慢变革的种子。印度人看这个片子可能会尤为震撼，而在中国沿海都市年轻人里则会显得没什么颠覆性。但还是好片子，节奏把握得不错，尽管一切发展都在意料之中。,11
1,26387939,摔跤吧！爸爸,恶魔的步调,Len.,推荐,2017-10-08,21:36:47,另一个宇宙是姐妹大战,3
1,26387939,摔跤吧！爸爸,雪·法妮奥,trininottrinity,力荐,2017-05-25,20:56:04,感动到不知怎么说了，有个可以为孩子（无论男女）与全世界拼命的父亲真好。,3
1,26387939,摔跤吧！爸爸,谭不爽,fxxkthis,推荐,2017-05-11,15:00:53,好看，终于体会到怎么观赏摔跤了。那种要成为爸爸的骄傲的感觉特别触动,13
1,26387939,摔跤吧！爸爸,雪里花蕾,166750629,推荐,2018-03-18,09:11:31,这部影片体现了伟大的父爱，同时也体现了一个公民的爱国情怀，一个人忠于信念，坚持本心，不忘初衷，就一定会取得胜利，成就梦想。真的让人很佩服！阿米尔汗真棒👍为女儿们点赞👍,17
1,26387939,摔跤吧！爸爸,爱的镇魂歌,fenxinyu,推荐,2017-05-10,00:11:45,以印度国情下特有角度讲述了一个冲破不平等的金牌梦。服从安排本为改命，对摔跤的执着并非源自喜爱，而是出于回报沉重的期待，归根结底是父亲把私愿强加给女儿，这样被选择的人生，对女性价值证明方式还是有些狭隘。故事既是改编自真人真事，考虑到温情可能多出于电影的美化加工，现实只会更加斯巴达。,5
1,26387939,摔跤吧！爸爸,等风来离开你,108675266,力荐,2018-01-21,08:49:04,我特别能感受爸爸被她女儿击倒那一刻的感受。我也能感受到当爸爸被关在小屋里许愿那一刻的感受。强推。,97
1,26387939,摔跤吧！爸爸,RIC,ricchhard,力荐,2017-05-06,23:13:14,重要的事说三遍：还没有决定看这部还是银2的赶紧选这部；还没有决定看这部还是银2的赶紧选这部；还没有决定看这部还是银2的赶紧选这部,8
1,26387939,摔跤吧！爸爸,嗯,114340940,力荐,2017-05-08,17:09:50,为了看这部电影还买错票了。看完都晚上12点了。4星半吧。不知道豆瓣的女权看着这部片子有什么感想。我是真的认可父亲因为梦想断送了女儿的童年和成长,16
1,26387939,摔跤吧！爸爸,censored dump,saintdump,力荐,2017-05-09,23:00:06,泪目，电影本身可能有这样那样的问题，但这个故事太抓人，竞技体育令人窒息的紧张、残酷与优美在动作戏中淋漓尽致，人在这种挑战极限的过程中注入了大写性，不仅反哺民族情感，更重要的是把个人天赋实现为史诗。父女关系没有纠结在对抗里，而是被实现自我的共同目标升华，这才是正统的virtue啊。,9
1,26387939,摔跤吧！爸爸,峰峰峰峰,58930883,,2017-05-27,18:23:27,"青春摔跤两难全，剪发立志选择多。
生男生女都一样，女生可以玩摔跤，
男生也能做超模，挨揍的都是侄子，
世界充满了假象，爸爸都是为你好~",2
1,26387939,摔跤吧！爸爸,伊卡洛斯,nwwfewx,力荐,2017-05-21,12:38:23,很少能在电影院里与很多老人们一起看电影了,10
1,26387939,摔跤吧！爸爸,如小果,ruxiaoguo,力荐,2017-05-17,17:39:54,我觉得说爸爸三观不正绑架女儿的人，也太“中国人”思维了吧？这是印度电影啊，用人家的国情想一想啊，别特么用中国妇女解放的眼光去看一个印度爸爸。不能了无生趣早早嫁人的过一辈子的印度价值观没有任何错啊！最后，我也想要这样的爸爸！！！！！！,8
1,26387939,摔跤吧！爸爸,Howe,CUCA-Zoe,推荐,2017-05-15,19:49:19,没有特效，没有立体，没有超级英雄和外星人，成本却高达九千万，这说明值钱的不止是特效，还有时间，很多成本是隐性的，如果没有一年的训练，摔跤的场面也不会如此真实。真实是有力量的。,3
1,26387939,摔跤吧！爸爸,瓜。相信这个世界很变态。,melonsa,还行,2017-05-14,16:03:24,这片子最大的问题就是焦点模糊。励志是基调但不应该是内核，对于女性地位的动摇和女性力量崛起的描述点到即止，不知道应该理解为妥协还是这本来就不是影片的重点，如果是后者，整部电影的力度就会大大削弱。,8
1,26387939,摔跤吧！爸爸,西四小二,singorcry,推荐,2017-05-31,10:10:55,要把大道理包裹在纯粹真切的具体故事里，讲好一个故事，道理留给观众去回味。,5
1,26387939,摔跤吧！爸爸,南方,paranioa520,力荐,2017-05-08,02:21:57,银牌都是会遗忘的，只有金牌才会让人铭记。,8
1,26387939,摔跤吧！爸爸,Robin,robinwq,推荐,2017-05-08,11:21:02,带多多一起去看的，她居然差不多能坚持到最后，真不错！,4
1,26387939,摔跤吧！爸爸,逋·已休眠,145368457,推荐,2017-05-05,21:23:22,堂兄承包全场笑点～父亲确实是用女儿的人生实现自己的梦想，可是在那样的生存条件下，女儿们如果没去实现他的梦想，那么她们将要面对的根本不能叫人生，更何况她们到后来也是真心热爱摔跤这项运动了，站在最高领奖台上既是父亲的梦想也是女儿的追求了。ps 看每一场比赛我都在担心演员窝到脖子...,1
1,26387939,摔跤吧！爸爸,童。篱,2029060,推荐,2017-05-10,23:35:26,看完电影，先生说，你看跟印度妇女比中国女性多幸福。我回，幸福都是自己争取的，可不是你们中国男性赋予的,5
1,26387939,摔跤吧！爸爸,Tone调的悲伤,14161941,力荐,2017-12-22,19:18:26,电影看了太感动了，阿米尔汗真的是个伟大的演员，期待他的下部作,94
1,26387939,摔跤吧！爸爸,方洛洛,fangluoluo,推荐,2017-05-06,21:47:30,作为一个不爱运动的人，万万没想到一个摔跤的电影竟让我看得津津有味呀！更没想到的是，我还爱上了摔跤比赛。童年的戏份诙谐幽默，长大后的摔跤戏紧张刺激，2个多小时，竟然不觉得长。,15
1,26387939,摔跤吧！爸爸,申城少学汉,justinfu,力荐,2017-05-08,09:23:30,作为一个女孩的父亲，我看得数次落泪。,18
1,26387939,摔跤吧！爸爸,毛秃秃和胖咕咕,Nataliecarol,力荐,2017-05-09,03:16:27,伟大的主题，数次泪奔，再次向阿米尔·汗与片方致敬,4
1,26387939,摔跤吧！爸爸,水皮牛寺,foxduck,推荐,2017-05-06,17:41:41,你的胜利是为那些被看不起的女孩儿，为被认为一生只能与锅碗瓢盆相伴在家相夫教子的女性。真人改编励志片的传统套路，但是套在印度这个严重歧视女性的国家里似乎又有了它独特的意义。如同美国人拍种族歧视一样，一种全球化的政治正确，但愿能给印度女性带来一点点改善。好奇剪掉的20分钟是什么。,14
1,26387939,摔跤吧！爸爸,然悔悟,155618809,力荐,2017-10-10,17:33:02,真是燃爆了，像我这种不care体育的看摔跤比赛也能看出味道，佩服导演的剪辑、动作指导、配乐,8
1,26387939,摔跤吧！爸爸,⑦世蔷薇花,155582758,力荐,2017-05-24,22:54:12,有笑有泪，会戳中内心，最重要是阿米尔汗太敬业了！为这部影片付出了很多！先增肥再减肥从肥胖练成魔鬼！佩服！一部集结了父爱、家庭、人生、女权等情节的宝莱坞电影！,8
1,26387939,摔跤吧！爸爸,小米=qdmimi,qdmimi19810920,推荐,2017-12-05,01:06:51,就这么生硬，就这么招观众待见，你说怎么办吧。基本上给国内混主旋律圈的导演演员们上了教科书般的一课，爱国主义正能量片子不一定非得整得全程皆尿点。,1
1,26387939,摔跤吧！爸爸,Fleurs.哼哼,56922790,推荐,2017-01-23,21:40:04,抛开阿米尔汗这个印度国宝。剧情主线由反对性别歧视，打破专制，逐渐内化为自己戒除心魔为国争光的主旋律电影，还不忘扯一下号称全球最大民主国家的黑幕。没有常见的又唱又跳，就像咖喱里少了土豆牛肉，吃的时候抱怨老套没有的时候则怀念。最后再旁敲侧击一下天朝，你丫就玩吧，玩脱了,22
1,26387939,摔跤吧！爸爸,为君莞尔一笑,172864138,推荐,2018-01-27,11:59:40,很好看，父爱如山，这部剧很让人感动，很励志,39
1,26387939,摔跤吧！爸爸,欢乐海鹦乌娜,172739251,力荐,2018-02-04,18:18:12,这是一部让我三刷，特意带上妈妈和爷爷奶奶去影院看的影片，长达近三个小时，可是就是让你一秒钟都不想错过的电影，真的太赞了！故事朴实感人至深，主角的演技好棒，那几场摔跤场面激动人心，配乐太符合主题了，看得人心里怦怦跳个不停，真的是一部完美的励志体育故事片！！,73
1,26387939,摔跤吧！爸爸,仁慈的父,Sundancer,推荐,2017-05-21,21:14:40,意识形态非常正确的印度主旋律体育片。宝莱坞意识形态以讽刺官场为正确，这点跟我们的主旋律不同。比赛的情节抓人心魄，就好像在看真的摔跤比赛，拜这部片所赐，我第一次看懂了摔跤比赛的规则。,5
1,26387939,摔跤吧！爸爸,Yosemite,ushiyo_chan,力荐,2017-05-07,22:01:54,国内什么时候能有这么扎实的类型片，李娜传多好的题材，多半也是流产了。,8
1,26387939,摔跤吧！爸爸,砚小朵™,eiris,推荐,2017-06-02,02:11:43,听说管电影的大佬看完很生气，把贵国导演骂了一顿~,4
1,26387939,摔跤吧！爸爸,空瑾,164885227,力荐,2018-01-16,10:48:18,看哭了    虽然讲的是一个非常小的故事 但是却拥有着大情怀,77
1,26387939,摔跤吧！爸爸,momo,EG,力荐,2017-05-23,23:37:53,和菜头如果是认真的，那他真是不懂什么叫电影。估计漫画都看不懂。,6
1,26387939,摔跤吧！爸爸,Eco,saluzi1987,还行,2017-05-14,19:55:32,文化批评渗入电影分析的范本：文本分析、叙事学、女权主义、国族共同体、体制批判等。学院派电影研究者最爱分析这种电影了，至少我学院是。这种电影架空了影像本身的叙事能力，一切都靠故事本身来支撑，相比昨天看的盖里奇拍的亚瑟王，我还是喜欢影像本身有感染力的电影。,5
1,26387939,摔跤吧！爸爸,EL_CR,172422495,推荐,2018-01-29,11:04:41,就这部电影…太多人说好了…我当然无可避免的看了…是真的不错…有一种教育性质在…父亲和女儿…不错的故事…,75
1,26387939,摔跤吧！爸爸,泽帆,zhengzefan,推荐,2017-05-13,18:20:45,怎么看都是很好的商业片，冲突逐渐升级，笑点、泪点和燃点都有，大招憋到最后出，蜻蜓点水不刻意，很标准化。,11
1,26387939,摔跤吧！爸爸,猫呼噜,46912683,力荐,2017-05-15,13:09:37,不喜欢体育运动的我看得惊心动魄！,5
1,26387939,摔跤吧！爸爸,東方不親,pillowsinger,推荐,2017-05-08,09:50:52,影片贡献了“影史前十”级别的擂台战，可惜叙事者被主角立场所绑架。我并不否认强权意志在许多领域有着惊人的效率，但“一贯正确”的神坛一天不砸碎，一城一邦之公民，就永远无法步入真正的文明社会。我想这部电影若由李安来拍，抛开实情限制，大概会是这样：前半部分反民粹主义，后半部分反个人崇拜。,3
1,26387939,摔跤吧！爸爸,饕餮暴血,63140830,力荐,2017-04-24,00:45:43,拉分，首先不觉得在这看似漫长的170分钟里会留给观众时间思考关于三观的问题，每一场戏的连接，归功于剪辑，都非常优秀，几场摔跤戏是我近几年看过最好的体育戏份之一；其次，压根没觉得三观有任何问题，电影里所传达出来的反抗，勇气，拼搏和励志，已经好久没有感受到了,8
1,26387939,摔跤吧！爸爸,SHINE,67727072,推荐,2016-12-27,02:41:55,剧情节奏人物细节等都没毛病，看得酣畅淋漓。很不错的竞技励志片，没有像破风里面傻乎乎的爱情，但把亲情还有社会思考贴切地加在电影中，值得学习。,16
1,26387939,摔跤吧！爸爸,巴伐利亞酒神,darkwood,还行,2017-05-08,23:02:56,1.心事重重，没哭，没被打动 2.进攻是最好的防守 3.兵无常势水无常形，巴西必要时也打防反 4.一个解说员说，足球场上报复对手的最好方式，就是用进球让丫闭嘴 5.不好意思，这好像是个摔跤电影 6.体育比赛要配后摇啊，还是不喜欢歌舞,8
1,26387939,摔跤吧！爸爸,勾陈一,linyoung,力荐,2017-05-08,20:06:32,"好看！
番外花絮：目前已提前完成阿米尔·汗为拍片子的增重过程，还剩下练出腹肌=_=",15
1,26387939,摔跤吧！爸爸,外出偷狗,thomasneeson,推荐,2017-05-08,23:17:58,拼命配乐和慢动作好像哪里不对但确实非常爽，有删减也无所谓,4
1,26387939,摔跤吧！爸爸,吃瓜的小土豆儿,158929179,力荐,2017-05-10,13:57:16,对于这个歧视妇女的国家来说，这部影片的现实意义大于它的艺术，给满分激励一下,10
1,26387939,摔跤吧！爸爸,九命猫@victor-eyes,OldCatMiMiMi,推荐,2017-05-01,12:09:34,迟到二十分钟完美错过身材最佳状态的青年阿米尔汗。有机会二刷要刷那个169分钟版的。闷热的剧场紧张得一身汗。男性能接受的女性主义跟电影里的国家、民族主题一样是主旋律，客观上能为印度女人自强之路铺一小块基石，成千上万女性学摔跤，至少能微弱破解性侵问题,12
