page_index,movie_id,title,username,user_id,rating,date,time,comment,useful_count
1,26605946,毒。诫,鱼骨,42898955,较差,2021-04-10,23:06:05,无趣的传记片,0
1,26605946,毒。诫,北人字,127899402,较差,2017-05-22,00:14:30,可惜了演员和这么好的题材...,0
1,26605946,毒。诫,rina1001,63248334,很差,2022-06-18,10:42:01,渡尽劫波兄弟在，相逢一笑换发型。,0
1,26605946,毒。诫,泡咖啡的棉花糖,vvvxcom,较差,2017-10-07,12:48:56,少了内涵，我知道你想表达他要吸毒，和这个陈华人物。,0
1,26605946,毒。诫,狗鸡吧豆瓣,co1orful,还行,2017-07-27,00:07:42,叙事真是烂的可以。可演员太戳了妈的，_(:з」∠)_【主要是粤语听着很爽，虽然很多听不懂吧，cry】,0
1,26605946,毒。诫,虚位待华年,131189459,很差,2017-05-15,19:49:48,一个句号引发的惨案，就不该信纸巾的瞎逼逼推荐，难看到简直要怀疑人生。,0
1,26605946,毒。诫,睿mix,yayaye1206,较差,2017-07-26,18:05:31,看了三分之一吧，真的坚持不下去了～～,0
1,26605946,毒。诫,loto,39121054,较差,2017-12-31,10:25:08,你以为是毒枭黑帮片，结果突然画风转变成戒毒片；你以为救赎片，突然又变成了非诚勿扰。,0
1,26605946,毒。诫,小山,xysjou,较差,2018-05-26,14:23:55,拍戒毒的宣传片也不能这么敷衍吧。,0
1,26605946,毒。诫,阿森纳,57179724,较差,2017-07-14,22:05:53,也算是明星加金牌配角很多的一部戏，唯一主演就是刘青云，其他人全是配角，不过全废，在导演和这编剧下，没有一个有什么发挥，完全浪费了这一众演员！整个故事就是一个浪子回头，戒毒挽回爱情和兄弟情的故事，超级平淡没意思，我居然全看完真是佩服自己！,0
1,26605946,毒。诫,悟空是江湖骗子,104407173,还行,2022-05-22,22:27:15,味同嚼蜡，慈云寺十三太保之首的一生是跌宕起伏的一生，也是电影里面枯燥无味的一生。,0
1,26605946,毒。诫,豹哥,satopi,较差,2019-04-02,01:40:06,边吃饭边看，进度条到底时我以为剧情还没进入正题，一看都要结束了满脸？？？这究竟在讲什么？？夜用加长公益视频？,0
1,26605946,毒。诫,海布里天空,70954003,还行,2017-07-27,23:18:01,立意不错，题材不错，可是感觉很凌乱,0
1,26605946,毒。诫,有时间就看电影,128991169,还行,2017-07-12,12:24:44,一般。女主是败笔。故事也太松散了。九龙城寨不错。好题材拍烂了。,0
1,26605946,毒。诫,热水没有,littleD,较差,2021-01-05,01:21:23,白莲花传记,0
1,26605946,毒。诫,徐乐乐爱旅行,jashia,力荐,2017-09-12,15:50:00,看到一半。,0
1,26605946,毒。诫,沐晓白,wsc1986,很差,2018-11-25,20:51:47,以为又是江湖恩仇打打杀杀不得善终，没想到是烂仔改邪归正通吃黑白两道的故事，剧情还是太肤浅。,0
1,26605946,毒。诫,X先生,124379848,较差,2017-07-01,21:59:57,开头我以为是屌丝逆袭的枭雄片，看到中间我又以为是爱情片，后来我又觉得是教育片,0
1,26605946,毒。诫,煮鹤焚琴,48588455,较差,2021-02-05,01:29:32,这个片子我好像还是在电影院看的 天哪 我真的是太相信刘青云了,0
1,26605946,毒。诫,大号煎饼,64345409,还行,2017-07-07,13:22:02,张晋拍得不帅，难怪票房不行,1
1,26605946,毒。诫,云中谁寄锦书来,vitoice,较差,2017-07-28,01:11:49,看到了你的背叛，无赖，放纵；也看到了你的悔过，复立，向上。但是片子被剪了好多吧，没有努力哪有这么大的转折呢？青云兄，你越来越不会演了。,0
1,26605946,毒。诫,无优无律,154737590,还行,2017-05-13,17:48:30,香港电影确实落没了，但冲这主演阵容还是给个中等的分吧,0
1,26605946,毒。诫,c,ensummer,较差,2018-01-31,11:06:14,林家栋可以 很像个卖票的 // 张晋演猫仔 // 吟尽楚江秋,0
1,26605946,毒。诫,一壶好酒配热粥,159046019,还行,2020-03-09,11:10:57,又是一部超长的禁毒广告，不是加个点就能成为杜琪峰。,0
1,26605946,毒。诫,Amos,142952721,较差,2017-07-01,22:13:57,故事太单薄了，就看见刘青云一个人在演戏。,0
1,26605946,毒。诫,海市蜃楼,48164798,还行,2017-07-02,12:29:21,7.0  节奏叙事都很乱,0
1,26605946,毒。诫,档案君,104844658,较差,2021-02-11,15:03:34,云里雾里，白瞎一帮好演员。,0
1,26605946,毒。诫,隐隐,57093382,还行,2021-08-25,12:51:18,兄弟情只在首尾，很有感染力，像开头的茅坑烧蛋，结尾的边打架边磨刀，可是过程中大面积缺失，并且与戒毒主题看似一脉实则割裂，要拧成一股需在整个叙事中形成编织。另，看到那么多实力派老面孔是种惊喜。,0
1,26605946,毒。诫,新疆超人,51277324,还行,2021-04-03,16:34:01,这可是真·流水账，通篇事件堆积，平淡得莫名其妙。杰出青年讲述昔日堕落人生与诸多感悟。造型丑到贡献了有史最丑的刘青云、古天乐、林家栋等人。细节也特别糙，五年后林家栋穿一样的鞋子，古天乐穿一样的衣服。不过，客串的老港演员倒是真多。比较失望，前半部分时间点跳来跳去的毫无作用，剪辑生硬无比，而无论是兄弟情、爱情还是所谓的戒毒主题都没讲好，整体显得非常牵强突兀，全片基本上又是属于一手好牌打的稀巴烂的那种，唯一值得称赞的就是片中所有关于年代元素的运用。另外，刘青云和江一燕是签了绑定合同吗，老演一对，审美疲劳了都。,0
1,26605946,毒。诫,oliweiya,80782532,很差,2017-05-14,18:55:09,题材很好，卡司不错，导演不走心，一切白搭，失望,0
1,26605946,毒。诫,十寒,181794381,较差,2021-12-13,22:06:15,5，和线人证人比还是差点意思。,0
1,26605946,毒。诫,hmilyjue,70255132,还行,2017-11-05,21:56:28,欢快的看完了，对于打打杀杀兄弟感情我都可以接受，唯独不能认可让自己女人出去陪跳舞的男人，这种男人是不可能讲义气的。张晋演技在线，古天乐真的万年面瘫。。。喇叭裤等各种怀旧风可以看看,0
1,26605946,毒。诫,老朱無電影不歡,1319405,较差,2017-10-01,20:51:37,涉毒题材的合拍片就是死路一条，凑齐再多的影帝也翻不出新花样,0
1,26605946,毒。诫,wanderer,28540235,较差,2017-07-10,23:37:38,公益片为什么要拍那么长...,0
1,26605946,毒。诫,黑水仔,vanie,还行,2017-09-25,19:38:04,毒品祸害的不仅仅是吸毒者本身，还有身边所有人和事都会因为毒品受影响。,0
1,26605946,毒。诫,水妖,syloveyangying,较差,2020-06-23,18:25:26,？？？？,0
1,26605946,毒。诫,BruceH,52139895,很差,2017-08-20,09:45:03,真是混乱。真他妈可惜这么好的演员阵容。,0
1,26605946,毒。诫,灰豆大仙,polkadancing,还行,2017-09-10,19:07:52,人人为我我为人人,0
1,26605946,毒。诫,Melisa。,miyavikame,很差,2017-07-03,23:07:42,我……好像除了张晋的癌症妆就……找不出其他可以夸的部分了……,0
1,26605946,毒。诫,刘振华,132876200,还行,2022-01-17,20:31:58,本來以為又是一個大爛片，沒想到沒有那麼爛，及格吧！,1
1,26605946,毒。诫,乐孚伦,yuefulun,较差,2017-07-16,12:34:11,我爱刘青云,0
1,26605946,毒。诫,モチダンゴ,ninomiyatoma,较差,2017-05-12,12:21:49,"演员都喜欢，粤语版加分 
不过剧情确实很散，电影题材已经没看头了",0
1,26605946,毒。诫,金刀紫渔,yuzhaozhi,还行,2017-05-15,08:22:38,两星半。这是一个难得的故事，将风云传奇告诉了大家。这是一部无语的电影，将这么好的故事，哪哪都差了一些。如果说刘国昌是类型片的面壁者，可否能让杜琪峰或甚至是许安华来尝试下破壁人不可啊,0
1,26605946,毒。诫,听故事的人,137065019,较差,2017-05-14,17:29:32,老戏骨功力深厚抵不过剧本垃圾啊,0
1,26605946,毒。诫,安茼,51174673,较差,2021-11-04,15:30:18,黑也能变成白，真讽刺。,0
1,26605946,毒。诫,灯市街东口,135097965,较差,2022-06-18,09:05:50,还能看到达叔ㅠㅠ,0
1,26605946,毒。诫,c,1556361,还行,2017-05-17,22:14:16,被人骗了,0
1,26605946,毒。诫,阿杰,202060322,较差,2022-01-28,00:09:37,"混乱的剪辑造成的时间线乱七八糟而进一步引发的故事线不三不四是本片最大的失败之处！
导演的不用心使得本片最大程度上的不走心，本身作为一个传记片，而且还是根据慈云山太保之一茅趸华，弃恶从善，成为戒毒模范的故事以及算的上够传奇，可惜，在导演的折腾和愚蠢的剪辑下面，终成为了疑似烂片。
演员的演技在支离破碎的剪辑中，也进一步的支离破碎，可惜了一众演员！",0
1,26605946,毒。诫,游园惊梦,43153098,较差,2018-04-13,15:30:06,“补录”,0
1,26605946,毒。诫,狗哥,50831227,较差,2017-07-03,04:25:07,给个面子,0
1,26605946,毒。诫,fw郑景仁,189213308,较差,2021-12-12,09:57:14,就好像昨天在抖音上看到的禁毒短片一样，哈哈哈哈哈,0
1,26605946,毒。诫,flute,50527578,,2017-07-02,13:40:44,不好看,0
1,26605946,毒。诫,一首歌一支舞,156288411,较差,2017-05-19,12:33:05,阵容题材都是不错的，看完只剩失望了！,0
1,26605946,毒。诫,qirishufu,131445005,还行,2020-06-02,03:00:25,和摇滚从良歌颂祖国一样，无糖可乐其实含糖量更高。为什么香港导演拍抗日神剧，他就不懂，水土不服能拍好就有鬼了。,0
1,26605946,毒。诫,O型血,UloveWo,很差,2018-01-01,21:17:33,警察贪污，黑道横行http://www.bilibili.com/video/av15072750,0
1,26605946,毒。诫,norris,45319686,较差,2017-07-05,04:50:23,所以，這是在傳教？很無聊哦,0
1,26605946,毒。诫,"争渡, ‍爭渡",153196494,推荐,2018-07-24,16:34:48,其实蛮喜欢这部片子的。没想到张晋的演技也可以这么细腻。从大佬到杰出青年，虽然过程有些矫揉造作，人物塑造过于符号化，但是那种缓慢的叙事却让我对人物之间的感情留下了深刻的印象。,1
1,26605946,毒。诫,Godard,4651797,很差,2017-07-23,10:24:08,灾难剪辑，魔鬼叙事。论让观众无所适从、如坐针毡，毒诫 做到了！,0
1,26605946,毒。诫,姓亚名蒙,135077083,较差,2017-07-15,18:01:34,《星期X档案》加《铿锵集》，多一星是怀念那个曾拍和写出《童党》和《庙街皇后》的刘国昌跟陈文强，尤其后者，王晶说他只是个“执行者”，从90年代后期脱离一帮大编剧的作品来看，的确是这样。从此跟二位别过了~,0
1,26605946,毒。诫,Futako,zephyrus,较差,2017-07-05,10:57:40,时间很乱， 套路看起来也很无趣。,0
1,26605946,毒。诫,小东,tt2792654,还行,2017-12-08,00:50:30,挺有意思的，没有太大的反转，张晋有点神奇的，江一燕不错，还可以,0
1,26605946,毒。诫,JACK,msw0123,很差,2017-07-13,16:35:28,没有这几个演员香港电影已死，应当是怀旧片吧。华人无处不在的黑暗。,0
1,26605946,毒。诫,绿岛小夜曲。,ultravivi,较差,2017-10-29,18:17:06,比较烂，题材可以却排得混乱松散。什么时候港片也要主旋律了，以及江一燕的出现真的很让人出戏。,0
1,26605946,毒。诫,人生浪费指南,elvawang,较差,2017-10-01,16:58:40,2017-69,0
1,26605946,毒。诫,阿米,Lynn_C,很差,2017-10-01,20:28:55,我生气了。。。刘先生你还是买菜去吧顺便带上古邻居！,0
1,26605946,毒。诫,等待如果,cicitaotao,很差,2017-05-12,22:42:23,雪崩。差得令人发指。演员演技都在线，但故事太支离破碎，也不知道到底想表达什么，没重点，表现人物也都是刻板套路。江一燕那条线太做作。可怕。,1
2,26605946,毒。诫,笨小孩2-16,bxhOTZ,还行,2017-07-22,23:04:05,不是好片，但也不算烂。评分低了,0
2,26605946,毒。诫,icecream,49550156,很差,2017-08-26,20:14:04,看过的最差的跟毒品警察江湖有关的电影……乱七八糟……靠演技都救不了的剧情……,0
2,26605946,毒。诫,滚滚大王,atk914,很差,2017-07-12,21:51:47,看不下去的烂片,0
2,26605946,毒。诫,冯导,103164071,力荐,2017-05-18,21:04:58,四大男神，就值得四星了。穿喇叭裤的复古风，再加一星！,0
2,26605946,毒。诫,mandyzyx,63569379,较差,2017-07-01,18:12:07,两星半吧，全靠港星情怀撑完全片，时不时就会出来一个似曾相识的港星,0
2,26605946,毒。诫,印月无痕,64278254,推荐,2019-08-03,19:42:10,看名字，会让人以为是和毒战类似的动作犯罪电影，结果却原来是说的一群人改过自新的故事，也许这就是低分的原因吧。从年少轻狂，到中年危机，虽然经历比电影平淡很多，仍然深有感触…抛开烂名字和略显杂乱的剧情，故事还是很不错的,0
2,26605946,毒。诫,奇怪的窝瓜,187887268,很差,2018-12-03,18:17:59,补标,0
2,26605946,毒。诫,沉默的小皮,77186305,还行,2017-07-19,12:52:54,No.1577,0
2,26605946,毒。诫,阿依,151573222,很差,2017-05-15,19:49:19,卡司这么大，电影却这么烂,0
2,26605946,毒。诫,之晨,129911592,还行,2018-11-04,14:14:48,"5.4
以前的老港片像毒品一样让人欲罢不能，过了新千年之后就逐渐戒掉了，现在内心毫无波澜甚至有一丝想笑。",0
2,26605946,毒。诫,颠颠悠悠,121243022,较差,2020-04-03,08:53:53,烂片！快进这看的，浪费半个多小时！,0
2,26605946,毒。诫,水木清云,39771763,,2017-08-04,00:22:01,浪费两个影帝,0
2,26605946,毒。诫,dark,dark19,还行,2017-10-29,16:46:46,总觉得让句号当主角不是很合适。,0
2,26605946,毒。诫,梦之安魂曲,Makoto614,较差,2017-07-27,19:38:13,又是一部众星云集的烂片。,0
2,26605946,毒。诫,槑槑,148376167,较差,2017-05-12,12:47:41,新旧影帝齐聚，老牌港星背书，然而他的存在依然像片名中那个出挑又难看的“。”,0
2,26605946,毒。诫,南冠君子朔风前,62952735,很差,2017-07-10,01:45:50,无聊,0
2,26605946,毒。诫,魔鬼爱眼泪,StanleyCheung,较差,2017-07-09,10:14:47,看了1/3以为是江湖片，又看了1/3以为是教育片，最后1/3以为是文艺片。抓一手好牌打得稀烂。,0
2,26605946,毒。诫,摩羯座守护者,1962344,很差,2017-07-14,05:01:09,我没明白导演想要表达什么，浪子回头吗？还是告诉人们不要误入歧途,0
2,26605946,毒。诫,夕沉,leechenger,较差,2017-07-02,21:49:30,禁毒宣传片我也是醉了。刘青云的顿悟很不明显。。。,0
2,26605946,毒。诫,腐化的人生,2262916,很差,2022-05-09,19:18:45,讲的什么垃圾男人的垃圾电影，说的吸毒好像容易戒似的，卖毒品杀人放火还能洗白成烂好人杰出青年，真是误导观众。冲着古天乐看的，但其实演的就是个配角没几个镜头,1
2,26605946,毒。诫,专业非认真刷片,137555231,较差,2017-07-08,22:40:25,做过的坏事就可以一笔勾销？,0
2,26605946,毒。诫,蓝色啄木鸟,73056364,较差,2017-05-18,09:20:46,比较乏味，虽然都是老牌演技港男，但还是新瓶装旧酒，没啥滋味!,1
2,26605946,毒。诫,Obtson,Obtson,很差,2017-07-01,23:54:05,原始素材还不至于拿不出手，让整片垮掉的是剪辑。,1
2,26605946,毒。诫,巴别塔的光芒,46572945,推荐,2017-07-01,17:29:20,片值三星，但是评分太低，加一星，是怎么了？大家一点都接受不了正能量了？市民刘先生和林家栋的演技已到化境！另外断水流大师兄老成这样了啊！！！,0
2,26605946,毒。诫,阿七,75999153,还行,2017-07-03,21:18:46,香港回归以后曾经威风八面的黑社会大佬们开始做公交车，戒毒所等小本生意,0
2,26605946,毒。诫,狮子大人,58850320,较差,2017-07-02,10:55:48,这是商业片？太平淡了,0
2,26605946,毒。诫,且听风影,61944030,较差,2018-03-21,17:33:13,一部戒赌宣传片，没有波澜，像是流水账,0
2,26605946,毒。诫,-ap讨厌葱,Sprita,较差,2018-06-29,11:50:56,抱着看动作犯罪片的心看了一部戒毒宣传片,0
2,26605946,毒。诫,很饱的贼,xiaochao919,还行,2020-01-05,13:01:59,还可以吧，后面感情戏太多了,0
2,26605946,毒。诫,阵雨,guitarain,还行,2017-07-19,19:03:37,所以说这就是一部禁毒宣传片吗？,0
2,26605946,毒。诫,梅林,2340389,还行,2017-05-12,23:51:54,叙事结构太笨拙，高潮都没设计，将青春片、励志片和纯爱片嫁接在黑帮题材和兄弟情义上，甚至连韩剧里的癌症死和车祸死都用上了，感觉像是掺了耗子药的丰盛晚餐，菜肴五花八门，咸淡冷热不均，吃着吃着似乎发现猫仔和大嫂才是彼此的真知。,2
2,26605946,毒。诫,妖妖,daijiao1216,推荐,2017-07-07,22:55:40,虽然港片早已是下坡路，警匪黑帮什么的早就烂了，但是看完我还是满满的喜欢，整个好有年代感的画面，着装，发型及一切布景，那个时代的哥们老大，总会让我想起港片的黄金时代那个时候，故事还算新颖，光是刘青云，古天乐这几个影帝，必看的~~,0
2,26605946,毒。诫,Edward.Young,yyn,较差,2019-03-26,19:19:25,真的非常TVB，平淡无奇，不过细节还不错，前半部分比后半部分好很多。,0
2,26605946,毒。诫,安能事权贵,wuminlingzh,很差,2017-07-20,22:24:06,这个，算是90年代大陆风格的报告文学翻拍的纪录片吧,0
2,26605946,毒。诫,|(·_·) |·靖,herehe,推荐,2022-09-12,11:16:37,烂仔们的人生篇章，其实还可以，但是可能不符合预期，有刘青云，不够深刻，有张晋，不够爽，有林家栋，不够反骨仔，古天乐倒是正常发挥，这哥们演警察演毒贩演什么都一个样，一切中规中矩，虽如此分还太低了，五点几到六还是有的。,0
2,26605946,毒。诫,寒风晨夜,67426132,还行,2017-05-17,16:08:40,真的，看宣传片本以为会是一部激动人心的经费毒战片，没想到竟然是一部禁毒教育片，虽然戏骨们演戏依旧很有感觉，但是这剧情的硬伤很难弥补整部电影的不足，日本那一段更像是旅游广告。为什么觉得古天乐演戏已经越来越脸部僵硬？江一燕很漂亮啊，但是两人的感情戏也比较生硬，特别是后半段。,0
2,26605946,毒。诫,对儿勾,jj19king,很差,2017-09-24,17:26:02,演员一个比一个牛逼，拍出来的确实完整的一部SB。。。可惜了江一燕的五公斤眼泪,0
2,26605946,毒。诫,唔想郁本郁,blank-clover,较差,2017-05-13,11:29:18,2.5 是有经过剪刀手的缘故吗？叙事琐碎又不流畅，这里咬一口那里咬一口的感觉，而且为了凸显一些3d场景拍了不少无意义的场景画面。感情线也可有可无，感觉是为了进内地院线硬加的。本来是一个有些传奇的人物，拍得太平庸了,1
2,26605946,毒。诫,YANG.,xiaoyang2009,很差,2017-05-12,20:30:54,"该片真实定位-20禁。要查身份证，屏幕上大字注明。
我年轻我身体好，我没事吸个毒，当个老大，耍个流氓，砍个人，逼兄弟吸个毒，偶尔给女朋友当个皮条客……妈，你看我能戒，身体倍儿棒还有人爱。重点是，妈，我还能得个全香港杰出中年奖。翻滚吧牛宝贝儿…
看江一燕的，结果亲演了个林黛玉版玛丽苏",2
2,26605946,毒。诫,月球上的人,sungokong,较差,2017-11-26,21:34:29,流水账式的故事发展，虽然又倒叙又插叙，但依然掩饰不了剪辑的苍白。浪费了一帮好演员，硬生生把港产片拍成禁毒公益视频的感觉。,0
2,26605946,毒。诫,Floria,floriacheng,很差,2017-11-28,19:14:49,看预告片就觉得不怎样了，即便是有刘青云。,0
2,26605946,毒。诫,垣原,28377165,较差,2017-07-26,23:23:04,真是让人失望，浪费这么好的卡士。,0
2,26605946,毒。诫,煮烂雪糕,56792515,较差,2017-05-15,21:51:31,真是不好看，我要睡着了~,0
2,26605946,毒。诫,寻人启事,180642706,较差,2021-01-15,19:00:56,看到后面，我快进了，真的真的坚持不下去了。。。。,0
2,26605946,毒。诫,JACKY,42738934,还行,2019-05-09,07:54:09,补：应该不够及格，要没有一众明星撑着就是标准烂片，影帝们硬给拉到及格边缘。故事生搬硬套，风格莫名其妙，细节套路满满，演员尴尬演演。香港电影再这么骗钱，连大陆市场也要淘汰你了！,0
2,26605946,毒。诫,不能不说的秘密,inza9hi,较差,2017-07-03,10:04:38,有点无聊的公益片。,0
2,26605946,毒。诫,零落成泥,143534276,很差,2020-10-21,18:02:00,好久没看电影了，可谓是久旱逢烂片。,0
2,26605946,毒。诫,伍迪没有艾伦,2521351,较差,2017-07-09,21:38:21,叙事节奏可有问题？？,0
2,26605946,毒。诫,土伯公,scolo,还行,2017-08-13,20:41:45,"布景不错。
瘾君子浪子回头的故事本来就不好拍，还想玩非线性叙事。～呃～",0
2,26605946,毒。诫,港式冻柠茶。,mekka,,2017-09-01,00:50:58,那一束百合花。,0
2,26605946,毒。诫,东方小奕荣,29437323,还行,2021-08-25,22:15:41,香港六七十年代古惑仔的造型绝了！一边打架一边找地方磨刀笑死！感觉猫仔也喜欢江一燕，江一燕对猫仔也有感觉，只是碍于身份无法在一起，最终没能和猫仔见上一面。又见九龙城寨，没有牙佬和拳佬的九龙城寨，毒气熏天。,0
2,26605946,毒。诫,大师兄,3525505,较差,2017-07-05,19:30:27,这篇流水账应该没导演吧,0
2,26605946,毒。诫,我的充电器呢,71861591,推荐,2018-03-01,23:28:05,拉拉分吧 细节做得不错 1975年的时代特征和穿着表现的很真实 人物塑造丰满 历史香港电影平均水平,0
2,26605946,毒。诫,Shing Chen,53781076,较差,2017-07-11,22:24:44,看到都是老班底，以为会是一部老样子的关于毒品黑帮的电影，结果是一部这样的电影穿插回忆、励志的转正戏，都没有做好，看完让人印象很浅那种。,0
2,26605946,毒。诫,每逢,53619706,较差,2017-07-09,16:07:16,快进都看不完,0
2,26605946,毒。诫,苏小末,zhongshu,较差,2018-03-18,23:40:49,戒毒公益宣传片,0
2,26605946,毒。诫,巴里问道,frnong,还行,2017-07-09,16:22:22,说到底还是一部回忆杀咯,0
2,26605946,毒。诫,pauper,41158884,较差,2017-07-28,22:38:01,《古惑仔》变身《黑社会》，一点都没感觉刘青云是混出来的，还不如张晋的男配精彩（感觉他其实喜欢大嫂）和古天乐的客串...电影剪辑混乱，特效粗糙...,1
2,26605946,毒。诫,云淡风轻,131366965,较差,2017-07-04,21:42:11,套路。,0
2,26605946,毒。诫,天天感冒,2426372,较差,2017-07-26,23:28:29,好差劲！前面一段的时间极度混乱！基本就是一个戒毒宣传片。,0
2,26605946,毒。诫,🥗,whereareugoing,还行,2017-10-01,20:01:45,真的是部叙事体戒毒教育片 没想到刘国昌是这样处理人物传记电影的 然而一大堆最本色的香港演员聚齐 确实很少见了,0
2,26605946,毒。诫,扎木,amuer,较差,2018-07-25,13:39:20,本来可以给三星，造型太tm丑了，是没有假发厂商给赞助吗,0
2,26605946,毒。诫,我真不是大雁,ez2dier,还行,2017-07-31,11:56:59,感觉就是特技比较渣。,0
2,26605946,毒。诫,盛世中华,79108534,较差,2017-05-22,22:35:46,好好的影帝变成了烂片代言人了，唉,0
2,26605946,毒。诫,Ian,wuyan8392,较差,2017-07-13,20:13:37,这么多影帝都撑不好这部纪录片，说到底还是编剧太差。,0
2,26605946,毒。诫,利壁珈,3855057,,2017-10-07,16:04:59,古天乐和小李子一样，完全看不出年轻时有多好看了。男人残起来更可怕，一点看不出旧时模样。,0
2,26605946,毒。诫,格兰德河的火车,133569910,很差,2017-05-13,15:52:39,禁毒宣传片。,0
2,26605946,毒。诫,七夜,70603009,推荐,2017-08-19,13:21:46,给这造型几分,0
2,26605946,毒。诫,®菌小,casperstef,较差,2017-05-13,23:53:32,真人故事比电影更精彩……浪费了好演员，好故事～,0
2,26605946,毒。诫,大英雄,july0007,还行,2017-05-17,12:50:13,刘青云戒毒的原动力是江一燕吗 古天乐为啥跟刘青云这么好 林家栋和张晋为啥这么无脑这么听刘青云的话 做大哥和杰出青年凭的就是一张嘴吗 离开江湖说句话就这么多人听 警察大佬抢他媳妇儿是因为真爱吗 吃老鼠药抢救回来so easy吗 撞死古天乐的司机是巧合吗 吸毒的老伙计真让人可怜,0
2,26605946,毒。诫,ヾ羫白の亾℡,37793571,还行,2022-10-05,01:38:32,张晋这发型,0
2,26605946,毒。诫,白马窃玉,Darksand,推荐,2022-07-22,17:47:36,披着古惑仔的外衣，其实内核是忏悔和救赎。有不错的教育意义，兄弟情描写得也细致。打分肯定是低了，这片不及格也太离谱了。,0
2,26605946,毒。诫,糯米丸子,127908787,还行,2017-05-13,12:13:52,这种类型的港片真的看腻了，排列组合一样的演员和剧情,1
2,26605946,毒。诫,无为而治,151820885,还行,2017-07-06,01:31:17,很散很混乱很没有重点，节奏感木有。给我感觉就是一群人“自以为是”cosplay经典黑帮。有个镜头印象很深刻，张晋，在门内放下心笑了，那一刻，虽然我被他的牙齿震惊到了，吓到了，不过，那一笑确实是触动。题材，并没有发挥好。可惜。,0
2,26605946,毒。诫,Lacey,babyxy006,较差,2017-05-13,13:47:27,这个题材这个阵容拍成这样对得起谁！太让人生气了！！！故事讲不好，剪辑烂得也像屎一样，这个阵容怎么可以拍成这样！！！耀莱友谊路店居然有一场粤语排片，感动哭了，但是电影却烂成这样！生气！！！浪费我的刘青云！！！2017.05.12,0
