page_index,movie_id,title,username,user_id,rating,date,time,comment,useful_count
2,26605946,毒。诫,王小步,42987598,较差,2018-03-22,20:10:06,从吸毒古惑仔，到戒毒宣传大使，浪子回头啊，连失去的爱情都破镜重圆了。只是这电影，你拍它干嘛？,0
2,26605946,毒。诫,坚定躺平的锡兵,Stewart,推荐,2017-07-11,07:18:55,没传教的福音片，如果不是披着黑帮片的皮骗了很多观众进影院，得分应该没那么低。刘青云老得和角色气质不符，其他演员尚可。林家栋演李兆基好好笑，张晋的角色最出彩。当然，最好看是城寨，可惜出镜太少！,0
2,26605946,毒。诫,F.C.,fcleung,较差,2017-09-21,23:36:14,这剪辑白瞎了一堆好演员,0
2,26605946,毒。诫,鹿鹿酱 ♪,Lu1u,较差,2017-05-14,23:44:33,一星给刘青云一星给古天乐,0
2,26605946,毒。诫,Moonsorrow,shuangtofu,很差,2017-07-19,17:53:15,这几个影帝是不是没看剧本就来演了？还是政治任务？,0
2,26605946,毒。诫,拉拉祜是好孩子,angellovesu,还行,2017-07-09,17:35:24,真·流水账,0
2,26605946,毒。诫,purevirtual,35474492,还行,2018-06-17,02:00:48,还行 没那么难看 不过浅了一点,0
2,26605946,毒。诫,多喝凉水,146958359,还行,2018-02-18,13:14:17,香港黑帮片的黄金时代是真的结束了。,0
2,26605946,毒。诫,有个姑娘说,60029856,还行,2019-04-13,11:24:37,公益戒毒教育片,0
2,26605946,毒。诫,平昭,153199964,还行,2021-08-08,12:18:59,平庸无奇流水账一篇,0
2,26605946,毒。诫,心无所著,auld.lang.syne,很差,2017-07-23,15:07:54,香港人也要拍焦裕禄式的电影了？,0
2,26605946,毒。诫,@花皮球@,huapiqiu,较差,2017-07-12,12:09:52,浪费演员,0
2,26605946,毒。诫,年少影追,qrh2010,推荐,2017-05-16,14:20:21,毒。诫，不是简单的吸毒与戒毒，人生可能无法选择，所幸还有兄弟知己，影片把古惑仔还原到真实普通的一生，因此更具警醒意味......感觉还蛮不错的，以为豆瓣评分起码有个7分左右，却只有4.6，原因大多是剧情平淡无聊没有高......潮。,2
2,26605946,毒。诫,王二,kyo85,很差,2018-01-29,22:52:31,刘市民别再接这种烂片了好吗,0
2,26605946,毒。诫,八爪,4454692,还行,2017-07-11,14:26:39,慈云山十三太保陈慎芝监制，等于就是他的自传了。本片故事其实还可以，缺点就是主题不明确，剪辑比较乱。黑帮部分，戒毒部分，还插入了爱情戏，甚至还有一些毫无意义的支线。感觉都是点到为止，连鸡汤都没撒，没有重点。感觉就像是拿陈慎芝的日记本，翻到哪页就拍哪页，拍完了再强行按顺序衔接起来。,0
2,26605946,毒。诫,妖精的妄想,ayannagai,较差,2017-07-02,09:06:29,想做港版猜火车，最后却成了四不像，使命感不那么强好不好,0
2,26605946,毒。诫,夕凪,lavendan,很差,2017-05-13,10:28:26,辣鸡,0
2,26605946,毒。诫,Reading King,131681437,较差,2017-07-28,13:56:47,你搞成这样想还原七十年代风情，有没有想过造型多难看…,0
2,26605946,毒。诫,Jeff Liu,jebberwocky,很差,2017-07-16,01:31:33,法治频道的新拍法,0
2,26605946,毒。诫,YOYO草,1030614,较差,2017-06-19,18:10:46,我只觉得我被骗了~~这什么鬼~~整部不知道在说啥,0
2,26605946,毒。诫,蒋孝化,staytonight,较差,2017-10-21,10:13:18,2.5星吧,0
2,26605946,毒。诫,受伤鸽子往南飞,jet92,还行,2017-09-06,16:49:35,导演的自嗨回忆片，枉顾了投资人的钱,0
2,26605946,毒。诫,姝尹Y(^_^)Y,SY0516XY,还行,2017-12-22,01:12:31,老戏骨们的表演都不错，怀旧意味太过明显，叙事稍微有点散，但主题还是挺正能量的。,0
2,26605946,毒。诫,PhilLin,84597133,还行,2017-07-03,21:23:32,切勿功高盖主,0
2,26605946,毒。诫,讨厌下雨天,155606228,较差,2017-05-14,21:01:01,剧情实在不行啊,0
2,26605946,毒。诫,hello_hsy,93334070,还行,2017-05-17,00:59:38,我大概期望值过高了 没有想象中好看 其实前半段还不错 但是后面大半段总感觉是一个人戒毒之后感化他人的纪录片 略显拖沓与无聊 好几次都觉得该结束了还是没结束……忍不住吐槽,0
2,26605946,毒。诫,膘膘盹盹鹧鸪菜,3433774,推荐,2017-07-03,08:46:40,送你一株百合花,0
2,26605946,毒。诫,猫七,130501135,还行,2017-07-14,22:44:37,记流水账？,0
2,26605946,毒。诫,反山,chahuzi,较差,2017-08-26,15:51:14,确实是比较水。没有什么内容。,0
2,26605946,毒。诫,笑着流泪,3329918,还行,2017-10-01,14:37:03,我觉得挺好看的啊，虽然谈不上经典，但可以作为戒毒片,0
2,26605946,毒。诫,Moiunik,52584650,较差,2017-07-15,16:11:42,真人真事给一颗星。题材一颗星。,0
2,26605946,毒。诫,CobraCB,CobraCB,较差,2017-07-03,03:44:50,这种港式警匪片在没有什么新思路或者过硬的剧本之前一个都不期待了。,0
2,26605946,毒。诫,小白薯,zxman386,较差,2019-12-02,22:14:27,文有散文，片有散片。本作就是散片的杰出代表，几乎没有之一。事实上这个题材应该有故事可拍，但导演显然是不复当年之勇，竟然把这样一部人物传记片拍得如此平凡、混乱、零碎、流水账，镜头剪辑更是犹如凌波微步一般。全片的线索其实都聚焦于男主陈华，其他的小弟、情人、战友、对手、警察、大佬等等一系列人物都是配菜。主角前期毒瘾那么大，完全看不到一点悔改之心，然而从吸毒到戒毒的转变这最关键的一环，却让人看得有点莫名其妙，所以他后来那么坚定的帮助别人戒毒，这件事从根本上就不具有足够的说服力。至于江一燕这条感情线，处理得也很失败，无数台词尬到飞起。古仔和张晋的角色设定，无非是为了表现世事无常，江湖生死漂泊，但也无法引起共鸣。这些琐碎的素材完全可以拍一部TVB，然而放在一个半小时的电影里，就上下都不沾，还很难看,0
2,26605946,毒。诫,麻子,143101784,还行,2022-08-08,22:56:30,三个大咖撑起了一部不及格的法制片，要不然分数更低。,0
2,26605946,毒。诫,郑荆沙,sand123,还行,2018-03-12,19:08:00,3.5，香港的故事多是与毒品相关，总有讲不完的事件与人物，好像就一两个时期，淡淡的伤感。比起来大陆可讲的事情真是多，讲故事的能力或许更重要，又或者应该是市场规则和门槛练就了会讲故事的人吧，真是哪里都是江湖啊，LiveHouse也是！,1
2,26605946,毒。诫,Colourfish,2326490,较差,2019-05-04,12:06:45,有点力不从心,0
2,26605946,毒。诫,曾舜晞（老公版,Davis0923,较差,2018-02-20,14:53:45,好烂…… 但是吸毒真的太可怕了,0
2,26605946,毒。诫,Ada_Gorden,tonganda,还行,2021-06-27,22:11:57,2.5。太平庸，感觉剧本演员导演都是按部就班的工作……张晋很努力了，但是就是个配角，回天乏术。,0
2,26605946,毒。诫,BlackBird,27675083,推荐,2017-07-14,23:02:35,真实性非常高。,0
2,26605946,毒。诫,蓝欣勇,3952615,还行,2021-10-17,20:50:29,昔日古惑仔戒毒渡人，在____怎么看都是个神话啊。,0
2,26605946,毒。诫,momo,157109306,,2017-05-12,11:24:47,为啥港片这么喜欢拍警匪片缉毒片 很难有突破,3
2,26605946,毒。诫,Raen,raen,推荐,2017-07-02,21:59:35,我反而觉得还可以,0
2,26605946,毒。诫,D伯爵,Popdai,很差,2017-08-24,21:18:40,就是一个戒毒宣传片啊，没情节,0
2,26605946,毒。诫,田间箫鼓赛闲神,148975016,较差,2017-05-12,17:30:52,3.6。叙事碎片化，看似讲戒毒，却是把人生经历来了一遍。开头还让人有些许期待，但看了三分之一，就变了味道，琐碎和无聊充满了屏幕。后面唯一好点的片段就是张晋(饰演 猫仔)说的肺癌的那场。,1
2,26605946,毒。诫,一郁知秋,csee1121,还行,2017-05-13,15:08:37,演员演的蛮用心，不过电影实在没有什么说头。,0
2,26605946,毒。诫,ben,83807726,还行,2017-07-02,05:27:46,我觉得还不错啊，国语与粤语我切换看，感觉粤语更有味道，更能体现角色。虽然故事老套了点，但不至于那么低分吧,0
2,26605946,毒。诫,波塔斯基,CSO-Botasky,较差,2017-10-05,12:19:48,一个时代的结束，没有变得更好，也没用变得更坏。,0
2,26605946,毒。诫,读不懂的卡夫卡,138994203,较差,2019-07-21,15:01:05,2.5星吧，女主很漂亮，别的就没啥啦。,0
2,26605946,毒。诫,dear fiona,asukayoshioka,很差,2017-08-05,22:57:30,word妈 难看吐了,0
2,26605946,毒。诫,刷鞋大王,157380196,还行,2020-08-19,10:15:54,演员表大佬云集，就这？细碎的流水账叙事、平庸的人物经历、莫名的争吵纠葛，怪不得看起来像是一个蹩脚的公益戒毒片,0
2,26605946,毒。诫,明明_Andy,81706773,推荐,2017-07-08,14:29:56,有态度，其实偶尔受受教也没什么不好！可惜喷子们已无脑、朽木不可雕也！,1
2,26605946,毒。诫,kevin,kavin-zhao,还行,2017-07-21,21:16:17,港版老炮儿，不仅能平事儿，还能当杰出青年。,0
2,26605946,毒。诫,猫崽三岁,68679677,很差,2017-05-13,11:29:16,老的掉牙……别出来了,0
2,26605946,毒。诫,哔哟哔,61150890,很差,2017-07-11,22:43:47,什么玩儿应！哪个卖白粉的黑社会老大跟村姑一样畏首畏尾的！看着就生气！,0
2,26605946,毒。诫,skychang312,1397180,很差,2021-05-05,22:51:23,几个四五十岁的老菜皮演十几岁的小混混，怎么看怎么尴尬。,0
2,26605946,毒。诫,Yuimokin,Yuimokin,较差,2017-07-28,23:11:43,果然在内地上映的缺味道。,0
2,26605946,毒。诫,fifthsuperman,wjtwenzi,很差,2017-07-06,07:48:28,节奏太差，要讲的东西也没有讲清楚。,0
2,26605946,毒。诫,黑仔,10505493,很差,2017-05-20,11:38:30,讲的是boss的从良经历，没有啥看点,0
2,26605946,毒。诫,刚吒四太子,139550603,较差,2017-07-11,22:56:24,一个泥里的臭狗屎坐了五年牢成了社会大哥了！三个字～伪深刻！,0
2,26605946,毒。诫,冷暖色调,4876430,还行,2021-03-08,13:08:57,没那么差，就是画风一转变公益片有点怪异。,0
2,26605946,毒。诫,F,126775069,较差,2017-07-23,03:59:35,流水式记账 戒毒教育片 冲着豪华演员阵容来看 却不惊失望 一场高潮都没有 ,0
2,26605946,毒。诫,Feixiang,feixianggod,较差,2017-05-13,19:00:43,什么都想讲什么都没讲好，又臭又长不知所云，小银幕都嫌烂 4.0,0
2,26605946,毒。诫,鹿食蘋,muyanguoke,很差,2017-07-08,16:23:21,流水账,0
2,26605946,毒。诫,小飞侠,67232116,很差,2017-05-14,19:31:59,真·流水账，比自来水还自来水,0
2,26605946,毒。诫,夏洛酱゛,softgirl,较差,2017-07-19,14:28:42,张晋好像John depp！张晋好像John depp！张晋好像John depp！,0
2,26605946,毒。诫,欺霜傲雪,49872790,较差,2017-09-11,11:28:04,"为了在大陆电影院播放，这样的旋律也是够拼。
剧情真是够难看。",0
2,26605946,毒。诫,哒哒不怕困难,36664214,很差,2017-07-09,23:34:50,太无聊了……一群老年人，真的不要演古惑仔了好吗……,0
2,26605946,毒。诫,海岩,67125371,推荐,2018-02-15,13:15:00,刘青云的表演足够支撑这样的人物，其它配角也都是能独挑大梁的人物。但是和王晶的《追龙》相比，无论是场景风貌的还原还是人物内在的挖掘，都有不小的差距，刘青云所饰演的人物行为的转变牵强，有点强行怀旧和倒卖情怀的感觉，给人的共鸣之感不足。,0
2,26605946,毒。诫,笑看风云,53710607,还行,2017-11-24,15:22:10,还行，还算有点社会意义。,0
2,26605946,毒。诫,回忆跪在眼前,127197701,很差,2020-07-30,01:13:41,刘青云古天乐你们俩不要再骗我了。,0
2,26605946,毒。诫,Nice元宝,Levon,推荐,2017-11-19,21:04:22,人生就两件事，堕落和觉醒，堕落让人痛苦，觉醒也很辛苦。,0
2,26605946,毒。诫,星星草,64282213,推荐,2017-07-04,00:45:54,其中每一个演员的表演都堪称经典，江一燕，林家栋，张晋，古天乐，反而是刘青云表现相对而言欠佳。可惜的是这么好的一群明星，导演愣是煮成了一锅大锅饭，只能证明自己的功力欠佳。另外说一句，江一燕真的是太美太美了，整个大陆女演员中无出其右！,0
2,26605946,毒。诫,Like蓉,tangqueenqueen,力荐,2021-06-27,20:11:45,怎么评分这么低。题材值得五星好评。,0
2,26605946,毒。诫,彩虹骑士,76155478,较差,2017-10-07,23:04:18,有点跳跃,0
2,26605946,毒。诫,早餐供应,37779729,较差,2017-05-15,21:45:50,没有办法再说古天乐帅了，闭着眼睛都不行,0
2,26605946,毒。诫,🍰小白蛋糕🍰,156034578,推荐,2017-05-14,17:12:22,《毒。诫》茅趸华说“人生主要要做的两件事是：堕落和转身。”他们这些人在这里卑微的活着，像茅厕的蛆。可是，无论怎样，还是要活着。那些岁月里，茅趸华（陈华，是老大）、猫仔、喇叭，相依为命。由于电影是以零散的时间线和剧情，让本片看起来仿佛一个大型禁毒宣传片，让大家觉得看不懂、杂乱无章。,0
2,26605946,毒。诫,开心快乐每一天,154292831,还行,2017-05-12,18:31:57,典型的香港警匪片，需要突破,3
2,26605946,毒。诫,弃,laotougou,很差,2017-05-16,15:00:34,妈妈说不好看，确实不好看,0
2,26605946,毒。诫,MOMO,53740528,很差,2017-05-14,22:54:29,???,0
2,26605946,毒。诫,梨之雀静,141517310,较差,2022-11-28,17:36:59,花1个多小时看了个公益广告,0
2,26605946,毒。诫,kohkoh,fuxxmylife,力荐,2021-09-12,12:51:37,7.5有的 港片这几年真喜欢怀旧,0
2,26605946,毒。诫,创建快捷方式,59859119,推荐,2017-07-07,00:44:42,按正常我应该给三星，但是我太喜欢香港的警匪电影了，所以这部很将就的片都能认真的看。吴孟达大叔真是越老越有味，他的出场只有短短不足五分钟，但是我忍不住回放了好几遍。,0
2,26605946,毒。诫,Edward·F·Duke,139355214,较差,2018-06-21,15:00:22,多一星给九龙城寨。,0
2,26605946,毒。诫,Ni9ht_Kid,Night_Kid,很差,2017-07-01,17:17:07,以为是在这拍TVB 呢？！,0
2,26605946,毒。诫,海水,42306867,很差,2017-07-06,16:34:21,什么鬼,0
2,26605946,毒。诫,今天有没有瓜吃,168478662,还行,2021-08-04,18:50:02,为什么最后那个女人还原谅他，漂亮有钱还没老公，这不是神仙日子吗/get不到这种港式演技，看着演技都挺差，没用心的感觉,0
2,26605946,毒。诫,荷包蛋,127082757,还行,2018-06-05,22:45:49,大型戒毒宣传片,0
2,26605946,毒。诫,电饭锅,138869110,很差,2022-10-15,20:01:18,你不说我还以为是cctv拍的,0
2,26605946,毒。诫,默雨,moyujushi,较差,2017-07-01,13:24:32,平庸之作。倒是不預期地看到了吳孟達，真是病了，瘦得脫了核。,0
2,26605946,毒。诫,Sophie,ousophie,很差,2017-07-09,15:04:56,情節零散，好悶,0
2,26605946,毒。诫,反方向的钟,25533910,还行,2017-05-13,17:37:26,就是一本剪辑凌乱的流水账。我天乐哥的戏份哟，真是少的可怜。,0
2,26605946,毒。诫,哔啵哔哔啵睇吖,59385122,还行,2017-07-09,23:41:49,冲着几位老牌给点支持了,0
2,26605946,毒。诫,土狼,adolf_hanhan,,2017-07-09,14:40:26,猫仔肯定是喜欢大嫂，但是因为大哥所以从来没有表现出来..,0
2,26605946,毒。诫,可琦,19572932,较差,2017-07-14,23:28:34,好题材，但是真不怎么好看…,0
2,26605946,毒。诫,🐟漠然,53171772,推荐,2017-09-16,21:06:59,为啥评分这么低，有教育意义啊。,0
2,26605946,毒。诫,车聿方毒,74266497,还行,2017-07-22,14:11:42,平淡，传记类型，黑帮动作内容不是关键,0
2,26605946,毒。诫,ForVictoRi,155841956,较差,2017-05-13,16:25:05,不好看，情节太老套了,2
2,26605946,毒。诫,重玖.,king1099,很差,2017-07-30,21:08:31,传记也好，公益片也吧，确实过于平铺了。但人生便是如此，日复一日年复一年，发生的终归是发生了。。。,0
2,26605946,毒。诫,YiHong,dellacorn,很差,2017-05-16,01:09:00,2 给2分都是因为古天乐出现了。。。这剧本烂到绝顶,0
2,26605946,毒。诫,范沛水,63332056,很差,2017-07-07,15:07:14,戴个假发就能让60岁的刘青云回到16岁了吗？这个剧组请不起化妆师？,0
2,26605946,毒。诫,zorro628,157202507,还行,2017-07-25,19:23:22,以前自己吸毒，并带着弟兄贩毒，现在自己宣传戒毒。挺好的反毒题材。,0
2,26605946,毒。诫,十七。,below17,较差,2017-05-16,18:39:27,大荧幕，北京。莫名被张晋圈粉了，电影讲了一个别样的江湖。也许江湖本就不只有侠义，而是个混乱的世界。也许我们经历过的，就是我们自己的江湖吧。,0
2,26605946,毒。诫,春雨洗过太阳,50960697,较差,2017-09-30,18:19:47,故事连贯性和戏剧性不够吸引人，是一部中等偏下的片子,0
2,26605946,毒。诫,神龙斗士,174940438,很差,2022-04-02,23:02:04,我知道豆瓣评分只要不是主旋律都挺客观的，我知道5.0分的电影肯定是烂片，但我没想到的是竟然烂成这个样子，早知道花一百分钟去吃屎了都比这来的痛快,0
2,26605946,毒。诫,微谷,26318012,很差,2017-10-27,09:09:36,那么好的卡司，愣是看睡着了。,0
2,26605946,毒。诫,Garcia,2254775,还行,2017-07-20,22:00:04,摆烂的地方是挺摆烂，但是转变的味道没讲出来。。。,0
2,26605946,毒。诫,DoubleJoy,uoaoian,很差,2017-07-10,17:10:41,古天乐这样下去别想拿影帝,0
2,26605946,毒。诫,暗夜精灵,4415314,较差,2017-10-24,20:14:55,建议剪辑师站出来认罪。,0
2,26605946,毒。诫,Via~Via~,173713926,还行,2020-11-06,21:20:12,挺多老港片的老演员，整体不差，但给人感觉说教感有点重。刘青云影帝演技依旧在线，江一燕演得也不差，但总感觉两人CP感不强。可能是潜意识里觉得他们不是一个年代的演员吧。,0
2,26605946,毒。诫,快薯熟,jerrycristl,推荐,2017-07-06,22:37:25,几大影帝飙戏，兄弟情贯穿，江一燕好美…最后，张晋走的时候，确实扎心催泪…,0
2,26605946,毒。诫,优雅劏猪佬,48681369,还行,2017-05-10,20:40:13,【3S】人物传记却剪得流水破碎，处处到而无深，配角苍白手足情何挂心，“毒”没戒。,0
2,26605946,毒。诫,曹雨田,sylviabai,,2017-08-04,00:50:26,再次证明，如果编剧不知道要说什么，导演不知道要怎么说，那么笼络再多的明星也没有用。（嗯，我没打星，因为它一星都不值）,0
2,26605946,毒。诫,云水青天上,133101305,较差,2017-07-12,17:22:59,香港电影的辉煌时期还能重现么。,0
2,26605946,毒。诫,珊珊,3393540,推荐,2019-04-22,22:55:57,就电影而言，我觉得还可以。,0
2,26605946,毒。诫,zhuzicat,2463075,较差,2017-07-26,02:28:58,没诚意～,0
2,26605946,毒。诫,張某人12138,zlx19951108,较差,2017-05-15,09:40:19,烂片！浪费演员浪费题材，打2星，一颗默认的没办法，还有一颗给达叔，就这么多了。,0
2,26605946,毒。诫,不要不开心哦,155602622,还行,2017-05-13,09:47:32,剧情内容还行，总体一般。,0
2,26605946,毒。诫,xx59,38455611,,2017-10-16,13:45:33,里面那个劝刘戒毒的酱油居然是谭耀文，当年也是演过无数男一的小生啊~~~~~现在连名字都没资格出现了……,0
2,26605946,毒。诫,harvey少校,108693709,推荐,2018-01-26,16:01:45,结尾回忆年轻时候干架各种地方藏武器加分,0
2,26605946,毒。诫,留子尧,45789849,还行,2017-07-13,16:50:52,2017.7.13,0
2,26605946,毒。诫,etng,etng,很差,2017-07-09,23:05:41,专门登陆来打分的，一通乱剪的片子，浪费一帮好演员！,0
2,26605946,毒。诫,fwtzzl,fwtzzl,还行,2021-05-22,15:59:08,和谐的港片一言难尽。还好有泰迪罗宾的歌声和陈观泰，卢海鹏，吴孟达,0
2,26605946,毒。诫,痘瓣,12929078,很差,2017-07-09,16:05:07,垃圾,0
2,26605946,毒。诫,慎独,154327091,还行,2017-05-13,00:11:02,果然如我所料……,0
2,26605946,毒。诫,小武,93694286,较差,2020-04-01,20:25:51,东一点，西一点，从老港片零零散散凑出来的，可惜不是集百家之长，而是四不像。,0
