page_index,movie_id,title,username,user_id,rating,date,time,comment,useful_count
0,27076492,虎皮萌企鹅,Louis,4134812,还行,2018-03-17,13:28:12,老虎的儿子，金鱼的爸爸，虎皮企鹅拯救森林，很适合小孩子看。,6
0,27076492,虎皮萌企鹅,Niqa,Niqa,还行,2018-11-24,20:00:19,想象力还不错，毛发细节也处理得很赞，故事比较平淡,2
0,27076492,虎皮萌企鹅,织田集团副会长,2887850,很差,2017-09-18,03:19:48,非常无聊，可能只有小小孩儿喜欢,2
0,27076492,虎皮萌企鹅,小米=qdmimi,qdmimi19810920,,2018-07-11,03:33:50,总之CICI认为自己就是一只企鹅,0
0,27076492,虎皮萌企鹅,Panda的影音,PandaMovieMusic,还行,2018-05-19,14:50:59,努力用动画重拾我美好浪漫的天真。,0
0,27076492,虎皮萌企鹅,decidels,42600622,,2018-05-21,22:50:42,老虎的儿子是企鹅，企鹅的儿子是条鱼。这个设定也是很emmmm...被蝙蝠和眼镜猴狠狠喂了把狗粮｡,0
0,27076492,虎皮萌企鹅,胸口碎大石,24139618,还行,2018-07-11,15:47:41,功夫熊猫热带丛林版？比较喜欢那只螃蟹，尤其是闹钟功能。,1
0,27076492,虎皮萌企鹅,feeling,zyjj141,还行,2018-03-17,22:46:52,画风一般吧，讲了一个正义战胜邪恶的故事，很大路货呀,1
0,27076492,虎皮萌企鹅,兔安叽,gegemoon,还行,2018-05-23,12:54:39,角色挺可爱的，故事嘛……小朋友看看开心就好,0
0,27076492,虎皮萌企鹅,обломов,glim,较差,2018-08-11,17:50:15,说实话人设是很萌，但是一动起来，特别打起来就显得差劲,1
0,27076492,虎皮萌企鹅,段郎RockDuan,rockduan1987,推荐,2018-03-18,14:05:41,"哈哈哈哈笑死！
高质量的合家欢动画冒险片，笑点云集。
老虎妈妈，企鹅儿子，金鱼孙子……要不要这么搞啊！",213
0,27076492,虎皮萌企鹅,kiki204629,kiki204629,还行,2018-05-23,19:03:48,果然是丛林大乱斗！,0
0,27076492,虎皮萌企鹅,人潮拥挤,37979083,推荐,2018-03-10,20:05:54,和好朋友一起去看了，很喜欢这种色彩鲜艳人物鲜明的动画片。不开心的时候看虎皮萌企鹅，让你开怀大笑。,213
0,27076492,虎皮萌企鹅,会花光的金子,2712953,推荐,2018-03-09,04:00:52,有幸在安纳西看了首映，导演还给每人送了个杯子。一只以为自己是老虎的企鹅，这设定没谁了，总体非常好笑，算是法国的国民动画了。不过因为看它错过了安纳西看至爱梵高的机会也是一大遗憾,10
0,27076492,虎皮萌企鹅,秦娥夢斷秦樓月,54976290,还行,2018-11-19,16:08:31,没什么新意，就是开心。很有意思。,0
0,27076492,虎皮萌企鹅,穗尔Sybil,gruel_,还行,2018-03-17,14:13:31,这部电影反应的是跨物种恋爱吗？？,0
0,27076492,虎皮萌企鹅,冲田总悟,148933548,还行,2018-03-18,22:08:44,萌萌哒，剧情简单,1
0,27076492,虎皮萌企鹅,骑猪看夕阳,43244684,推荐,2018-03-13,11:23:30,通过这个片子，我觉得我做为一名孩子的家长做事是不够的，对于孩子还不够关怀。以后希望自己做的更好！,220
0,27076492,虎皮萌企鹅,独行侠杀手阿何,RockerHo,推荐,2018-03-18,18:03:01,两代丛林神兵大联合。配乐太好听了！一曲《Eye Of The Tiger》用得真好！很喜欢机智勇猛又可爱的小鱼鱼Junior。频频恶意犯傻的白痴情节让人大呼受不了，突如其来生硬多余又做作的爱情戏更是让人翻尽白眼！知道你们法国是浪漫之国但不至于这样吧？？！山洞过山车刺激过瘾，彩蛋捧腹大笑。,2
0,27076492,虎皮萌企鹅,陈轮,49673811,较差,2017-11-02,12:57:11,除了套路也没什么了。剧转影，交代也不够明确。,8
0,27076492,虎皮萌企鹅,假面骑士,154039834,推荐,2018-03-19,10:09:05,这部影片告诉家长，不要因为自己有过的挫折而否定孩子，人生的路都是要自己去走的，也许在你不认可的路上，孩子可以成长的很好。动画画面质感很好，设计立体感很强,2
0,27076492,虎皮萌企鹅,琧婯,cloudlandlord,推荐,2018-08-04,00:03:47,法国动画就是这么蠢萌生猛，鬼点子多多,0
0,27076492,虎皮萌企鹅,人间清醒,162530860,还行,2018-03-12,01:25:05,特效看起来让人有不适感 奇也怪也 ,1
0,27076492,虎皮萌企鹅,半个-lemon,38393493,力荐,2018-03-13,15:01:01,带孩子来看《虎皮萌企鹅》权当给孩子认各种动物了，因为动物都很逼真。,216
0,27076492,虎皮萌企鹅,vivi,vivifyvivi,较差,2018-05-20,08:13:46,get不到这个人设,0
0,27076492,虎皮萌企鹅,Serena,40687803,还行,2018-03-16,22:53:24,男人话我中意企鹅所以带我睇企鹅电影，其实对于现在的我来说，我觉得睇卡通片很无聊。但是，这电影里面的动物都弄得很逼真，隔着屏幕都想伸手摸摸毛茸茸的动物头，剧情都有点搞笑。男人居然买的是国语译制版的票，闷死我了。假3D,1
0,27076492,虎皮萌企鹅,卿启玮,32541723,还行,2018-03-16,12:27:11,三星半。设定很Funny！一只老虎的孩子是一只企鹅孙子是一条鱼。但是在动画电影水平好到飞起的这几年，也只能算70分的作品。,2
0,27076492,虎皮萌企鹅,雪,1282175,较差,2018-05-21,04:38:01,非亲非故,0
0,27076492,虎皮萌企鹅,笑一个吧,218967545,还行,2021-08-07,17:14:12,【虎皮萌企鹅】电视上看到的，也就一般，画面和剧情都没有吸引我的地方,0
0,27076492,虎皮萌企鹅,对你爱不完,140638723,较差,2018-03-16,12:41:22,平庸的动画。,4
0,27076492,虎皮萌企鹅,晴晏,1590605,还行,2018-03-18,18:26:00,朋友送的团体票，跟一群小朋友一起欣赏到了如今高超的动画技术，剧情还是不要指望成人会喜欢了。,0
0,27076492,虎皮萌企鹅,Painkiller,day_dreamer,很差,2018-03-18,15:38:30,唯一收获大概就是为了看个破动画片雪天出门并且脑内循环了一路的一剪梅,0
0,27076492,虎皮萌企鹅,lulujiang,48095309,还行,2020-04-27,22:24:51,"有段时间每周都陪小宝进电影院看动画片，看了一堆很一般、偏幼齿、甚至不太有意思的国产动画长篇。

虎皮萌企鹅，马马虎虎吧，动画形象其实除了看不太出是只企鹅的主角儿，其它还行。情节也比较低龄化，热热闹闹的成长故事，小朋友看得比较开心。",0
0,27076492,虎皮萌企鹅,盲盒游戏戒断中,chanel0214,还行,2018-03-18,18:07:44,虽然丛林大乱斗，配乐还挺恢宏。故事挺简单的，周末放松一下也挺好。 ,0
0,27076492,虎皮萌企鹅,Preston,3223982,还行,2019-11-18,05:52:07,陪孩子看了10分钟就要睡过去了，可孩子看得津津有味。故事bug很多，看着看着就会出戏，各种奇葩设定像是片子开头亚洲的老虎，南美的树懒（动作超级快），非洲的犀牛都一起住在丛林里，大家相亲相爱，肉食动物们也不知道平时吃啥？老虎的儿子是企鹅，未成年企鹅的儿子是条鱼。情节也超级无脑，看了10分钟就能猜到结尾了。第一次看到反派是考拉的，想起之前看得爱宠大机密里的反派是兔子，大概现在流行傻白甜做反派？唯一的惊喜是很少见的kiwi也出场了，但是熊猫没有出场，看来主创团队瞄准的是英语和法语市场，中国市场被忽略了吧？果然是傲慢的法国佬,0
0,27076492,虎皮萌企鹅,Kummerspeck,148465547,推荐,2018-03-17,13:22:37,3.17老鼠 他讨厌老鼠,1
0,27076492,虎皮萌企鹅,非本性,leeann2002,还行,2018-05-19,09:29:31,不好看。,0
0,27076492,虎皮萌企鹅,伏伏伏伏伏的馍,69364200,较差,2020-04-15,15:35:46,剧情也太无聊太蠢了吧，企鹅也一点不萌搞不懂这个设定的意义在哪里，最后所有人被抓企鹅不先去救人耗费了一天一夜给自己涂了个颜色真是无语。,0
0,27076492,虎皮萌企鹅,柠檬豆豆~,50720395,力荐,2018-03-15,11:18:03,对于喜欢看动画的我来说真的是很逗比了。设计角色不一样。让我对这个动画充满了喜爱,215
0,27076492,虎皮萌企鹅,小乔到手,MongleLin,推荐,2018-10-07,23:35:26,人设很俏皮……,0
0,27076492,虎皮萌企鹅,无聊,150948299,较差,2018-05-17,13:16:11,老虎的儿子是企鹅、企鹅的儿子是金鱼，加上偏执症考拉，你们高兴就好,0
0,27076492,虎皮萌企鹅,HiddenTrack,Kthe,还行,2020-04-15,19:18:10,太可爱了吧 ฅ( ̳• ◡ • ̳)ฅ。,0
0,27076492,虎皮萌企鹅,诗小微,tibetshine,推荐,2018-05-16,23:12:42,原来是一只涂成虎皮色的企鹅哈哈哈...,0
0,27076492,虎皮萌企鹅,1921,42787791,还行,2018-05-18,22:26:37,用心的也很精细 但是也没啥特别惊艳的 是一部适合小盆友看 可爱萌萌冒险动画～～,0
0,27076492,虎皮萌企鹅,Kya,Kya,力荐,2022-08-20,18:42:15,太有意思了，但看的是春山语版，全程靠蒙……,0
0,27076492,虎皮萌企鹅,无为而治,151820885,还行,2018-05-20,11:29:17,不知道重点在哪里。不过有些动物挺好玩的。,0
0,27076492,虎皮萌企鹅,神乐酱,moneylove,还行,2018-03-17,08:43:55,无趣，连我女儿看到一半都想走人，女儿三岁七个月,0
0,27076492,虎皮萌企鹅,越鸟巢南枝,48321125,还行,2018-10-20,22:36:33,好玩儿！,0
0,27076492,虎皮萌企鹅,梦之安魂曲,Makoto614,还行,2018-06-25,14:40:24,勉强三星，还算能看得下去。我还以为是中国的，原来是法国的。有点功夫熊猫的影子。,0
0,27076492,虎皮萌企鹅,魔力水族,47037959,还行,2018-04-03,21:30:05,萌萌哒,0
0,27076492,虎皮萌企鹅,人间情感观察员,68020726,还行,2018-05-19,14:12:38,一条纹企鹅带着一条条纹金鱼去见一只老虎，老虎说“你把我孙子带来了啊。”,0
0,27076492,虎皮萌企鹅,斯坦利•赵,1001195,还行,2018-05-19,10:50:38,很适合小孩子，甚至是大人观看，很欢乐。,0
0,27076492,虎皮萌企鹅,青年人电影协会,159457903,较差,2018-03-26,07:49:52,平白无趣,1
0,27076492,虎皮萌企鹅,是菜菜啊,caicai1005,推荐,2018-06-03,11:02:57,老虎妈妈，企鹅儿子，金鱼孙子，你不得不服国外人思维的不拘一格！,0
0,27076492,虎皮萌企鹅,harvey少校,108693709,推荐,2020-02-07,15:43:59,动物画风漂亮，功夫了得。,0
0,27076492,虎皮萌企鹅,超人,3544756,力荐,2020-11-13,13:50:21,小小虎非常生猛,0
0,27076492,虎皮萌企鹅,weakish,WeakishJiang,较差,2018-09-01,16:16:48,just so-so,0
0,27076492,虎皮萌企鹅,睡意昏沉,92737064,还行,2020-04-08,02:52:19,小崽还算喜欢，懒得挑剔了。,0
0,27076492,虎皮萌企鹅,小明,yaoyamin,力荐,2018-03-25,17:30:12,这部动画肯定是被低估了。在影院静下心来看，非常搞笑无厘头，角色特征明显。观影前看豆瓣只有6分，所以看完后特地打个5星，以示支持。,0
0,27076492,虎皮萌企鹅,milner,3753075,还行,2018-09-24,10:54:59,哄孩子还是可以的,0
0,27076492,虎皮萌企鹅,急先锋,vivacous,还行,2018-05-24,14:37:09,拍成动画连续剧，让孩子先看几年，还不错。,0
0,27076492,虎皮萌企鹅,JOY,65791600,推荐,2018-06-25,10:14:50,孩子很喜欢看,0
0,27076492,虎皮萌企鹅,cenduruila,141132037,很差,2018-06-01,23:21:24,不知道别人怎么想，反正这部动画电影一点也没打动我，动物人物编排的毫无逻辑，老套的英雄主义故事情节。,0
0,27076492,虎皮萌企鹅,羽兰真,2173168,推荐,2019-03-03,20:40:33,错过的动画片，好好看啊！不懂为什么评分这么低，是年纪老到看不懂动画片了吧？,0
0,27076492,虎皮萌企鹅,Hosszú alkony,96429395,力荐,2018-06-11,12:54:24,多可爱啊，分也太低了吧，拉高拉高,0
0,27076492,虎皮萌企鹅,Mephisto,54309117,推荐,2018-05-31,00:22:15,致敬中有新意，动物都很萌，除了主角，没见过这么吃藕的企鹅🐧,0
0,27076492,虎皮萌企鹅,豆豆的丈夫,40237768,还行,2018-05-21,00:23:07,"跟我念：
小企鵝    本領大
不怕困難救妈妈
妈妈是个大老虎
保護森林最威武
森林裡面動物多
誰有困難誰就說
說了大家來幫忙
人人都有好心腸
我幫你來你幫我
才是快樂好生活


",0
0,27076492,虎皮萌企鹅,Victoria,79565977,力荐,2018-05-23,00:22:05,小鱼超可爱 没水也能活哈哈,0
0,27076492,虎皮萌企鹅,bao,97478263,还行,2019-02-10,15:30:36,少儿影片还行,0
0,27076492,虎皮萌企鹅,听风,64038316,还行,2018-06-04,23:09:24,企鹅的设定还算新颖，不过总感觉有马达加斯加的影子，比较纯粹的童话故事，适合小朋友看。,0
0,27076492,虎皮萌企鹅,我劝你善良,155683072,推荐,2018-06-20,09:41:38,哈哈哈哈哈确实挺萌的  不错不错,0
0,27076492,虎皮萌企鹅,消逝的雪莉,sherryxiao,还行,2018-08-20,11:05:54,大主线毫无营养，但整个情节的幽默感元素还是在的。,0
0,27076492,虎皮萌企鹅,不羁的風,walqx5754559391,还行,2019-04-24,22:12:14,"3+
挺欢乐的一动画，制作与画风都不错，看着舒心。",0
0,27076492,虎皮萌企鹅,杜一无二,64193368,还行,2018-03-17,17:24:44,带女儿看的第五部电影。完全就是给孩子看的，即使是大反派考拉熊，也是萌萌的。片中最后致敬了碟中谍，也算是一个看点。,0
0,27076492,虎皮萌企鹅,麦子,btone0808,还行,2018-05-21,12:51:25,低幼动画，色彩辨识度挺高，国语翻译很一般,0
0,27076492,虎皮萌企鹅,樱瓷,152574882,力荐,2018-05-19,05:24:41,很有趣的动画电影，故事完整充满童趣,0
0,27076492,虎皮萌企鹅,AZWayne,60307113,还行,2018-05-29,15:11:58,故事很套路，但架不住丛林里珍奇保护动物的超级英雄情节太有趣。,0
0,27076492,虎皮萌企鹅,kakai,137004371,推荐,2018-06-13,20:59:10,还不错,0
0,27076492,虎皮萌企鹅,_在云端_,44638992,还行,2018-05-27,14:02:05,陪小朋友看,0
0,27076492,虎皮萌企鹅,泥鳅先生,53754213,推荐,2018-12-25,08:55:40,很不错,0
0,27076492,虎皮萌企鹅,王神爱,Sam-antha,较差,2018-05-18,00:47:07,不适合超过10岁的人看,0
0,27076492,虎皮萌企鹅,最幸运的幸运,160473084,较差,2018-03-18,00:15:56,第一次看VIP厅，沙发很舒服，电影大概只适合低龄儿童，虽然效果还挺好的～,0
0,27076492,虎皮萌企鹅,鬼,flen,还行,2018-06-11,10:00:56,怎么我第一个念头想到的是：树懒怎么可以跑那么快！！,0
0,27076492,虎皮萌企鹅,西部大镖客,135252700,很差,2018-03-10,23:33:27,有豹纹企鹅吗？,0
0,27076492,虎皮萌企鹅,Saudade,108605652,很差,2018-03-24,16:29:36,我是有什么想不通，才去看这电影啊！,0
0,27076492,虎皮萌企鹅,淘乐妤,48938261,还行,2018-05-24,11:39:57,脑洞大开才能理解这部电影。不能循规蹈矩，不然接受不了这一家子。,0
0,27076492,虎皮萌企鹅,莹小宝,benbenmuxi,还行,2018-03-29,16:12:36,孩子看的还挺开心，哈哈。我就是不懂一只企鹅画个虎皮就自以为是老虎了？还能当丛林护卫队的老大，虎皮斑的金鱼也成了老虎的孙子？呵呵呵~编剧的脑洞也真是大。,0
0,27076492,虎皮萌企鹅,dolphinfu,dolphinfu,推荐,2018-08-30,14:01:36,还不错，虎皮企鹅有点儿创意,0
0,27076492,虎皮萌企鹅,Mr.Underwater,30728544,推荐,2020-03-11,12:12:16,还可以，除了企鹅丑了点儿,0
0,27076492,虎皮萌企鹅,弹指就老,139323580,还行,2022-02-04,11:09:08,"虎妈好漂亮啊。
主角和他的小团队一开始不讨人喜欢。大猩猩是真的傻的可爱。
最后那段过山车666。",0
0,27076492,虎皮萌企鹅,Casey,5701817,推荐,2018-03-18,20:25:23,和小朋友一起哈哈哈 ,0
0,27076492,虎皮萌企鹅,小杨树,yjhxiaoyangshu,较差,2018-03-23,15:18:13,不适合小孩子看，不能建立正确的三观,0
0,27076492,虎皮萌企鹅,雪藏蜗牛壳,3510022,还行,2019-02-02,18:56:04,这只企鹅和他的同伴的设定真的一点都不可爱啊，老一辈英雄可爱好多，这祖孙三代的逻辑也是非常迷了，剧情毫无逻辑，结局就这么随随便便吗？！,0
0,27076492,虎皮萌企鹅,梁颂华,lsh1,还行,2018-05-23,19:24:32,意料之外的好看，没有什么隐喻，纯粹就是一部为了欢乐而欢乐的动画片，人物角色和小细节都挺可爱的。三星。,0
0,27076492,虎皮萌企鹅,SX,1831746,推荐,2018-05-21,16:11:08,不错 做的可以,0
0,27076492,虎皮萌企鹅,仓惶的鹿,Jimmyzhen,还行,2018-03-30,22:16:34,可以带小朋友看，不推荐成年人看,0
0,27076492,虎皮萌企鹅,飞风,1810969,还行,2019-04-06,20:44:45,法国的动画。制作特效不错，而且中文配音很自然。故事适合小朋友看，很多动物出现，很有知识面的眼界开拓的意义。非洲大草原的企鹅太逗了，哈哈！,0
0,27076492,虎皮萌企鹅,feu,bigfaye,较差,2018-06-24,14:35:13,对考拉产生了阴影,0
0,27076492,虎皮萌企鹅,派瓦罗蒂,189711605,较差,2020-01-02,09:36:01,严重怀疑本片是成龙导演的，胡闹。金鱼儿子简直就没有存在的意义，陆上水里两个维度为什么还要硬放在一起？而且不得不说抱歉的是，主角虎皮真的还挺丑的,0
0,27076492,虎皮萌企鹅,喵口咸榭=V=,42767182,较差,2018-05-19,16:07:00,啊……感觉想做成好玩的片子，但是梗都比较生硬啊…也许我没懂法国人的笑点？,0
0,27076492,虎皮萌企鹅,安静的山茶花,84922944,还行,2018-03-19,11:58:51,不开心的时候看虎皮萌企鹅，让你开怀大笑。,0
0,27076492,虎皮萌企鹅,万殊,lssl000,还行,2019-03-15,00:48:18,还挺搞笑的啊。。。,0
0,27076492,虎皮萌企鹅,键盘侠在四川,188069433,还行,2021-03-26,23:10:57,普普通通,0
0,27076492,虎皮萌企鹅,已注销,56136516,还行,2018-03-17,22:35:32,我想给1星的，但是一年级的小侄子说好看，一定要给高分，介于我后来睡着了，折中给个3星吧,0
0,27076492,虎皮萌企鹅,PANDA-MAN,55753594,很差,2019-10-09,22:29:01,动物们都和平共处了，他们都吃什么？大人看了没法接受世界观，小孩看了会歪曲世界观，这种片是给傻子看的吗？,0
0,27076492,虎皮萌企鹅,tongli7204,159476641,还行,2018-05-19,15:26:05,小孩子应该喜欢 动画里的英雄不再是老虎狮子 竟然是一只企鹅,0
0,27076492,虎皮萌企鹅,熊,bearkitty,还行,2018-03-18,10:43:05,一拖二，曲阳影都小孩也要票，画面和迪士尼不能比，剧情简单,0
0,27076492,虎皮萌企鹅,三环,138362461,很差,2018-05-20,08:25:28,我的妈呀，吓人,0
0,27076492,虎皮萌企鹅,Monster,89073293,,2018-02-23,18:54:39,不觉得萌，只觉得很恐怖，谢谢,1
0,27076492,虎皮萌企鹅,transformation,130564736,还行,2018-03-19,19:06:44,画面感很棒,0
0,27076492,虎皮萌企鹅,梦回llll,angelliuzhihui,还行,2019-11-23,22:05:41,Q盟Q盟地,0
0,27076492,虎皮萌企鹅,兑水茅台,88321187,还行,2018-04-01,08:32:11,带孩子看的，感觉还行。老套的剧情，受过伤害后固执的妈妈和初生牛犊不怕虎的孩子，年轻的总得先犯个错来证明老的正确最后再来一次年轻拯救年老。不明白森林里怎么会有企鹅蛋而且企鹅居然可以生活在这里。不过一只老虎有一个企鹅儿子鱼孙子也就没有什么不可能了。不要太认真，还是可以看的,0
0,27076492,虎皮萌企鹅,困难户,4542067,较差,2018-03-18,14:06:55,3d和2d没区别，孩子觉得恐怖，大人不觉得好笑，找不到法式幽默～已经目测了，能打5星的都是只有陪孩子才会去看电影的那种～,1
0,27076492,虎皮萌企鹅,挪威时间,luotime,还行,2018-08-05,18:09:28,陪优优看的，还行,0
0,27076492,虎皮萌企鹅,Reichen,52004957,较差,2018-03-18,18:49:11,故事实在太幼齿。而且老虎的儿子是企鹅，企鹅的儿子是一条鱼？！,0
0,27076492,虎皮萌企鹅,杯酒敬旅途,188988520,较差,2022-01-21,17:35:33,以前竟然吃着烧烤看完了,0
0,27076492,虎皮萌企鹅,俗人,yearsman,较差,2018-12-08,13:12:57,烂片！和喜羊羊与灰太狼一个模式！！！,0
0,27076492,虎皮萌企鹅,尚未懂事,172436381,较差,2019-04-29,20:53:32,也就米格尔可爱点，整体太无聊了这个故事，不适合大人看。,0
0,27076492,虎皮萌企鹅,想去这想去那,2997234,较差,2018-08-10,21:16:10,低幼适合,0
0,27076492,虎皮萌企鹅,豆友45413641,Chaos--FOUR,很差,2018-03-16,19:20:30,尴尬无比,0
1,27076492,虎皮萌企鹅,氧气77,64508591,还行,2018-08-28,13:50:32,剧情太俗套，适合给小朋友看~,0
1,27076492,虎皮萌企鹅,米个,47783369,还行,2018-03-24,20:59:43,巨幕厅，都是小朋友！哈哈哈哈,0
1,27076492,虎皮萌企鹅,亚亚*,221610396,还行,2022-01-04,23:47:44,故事一般，老虎、企鹅、金鱼之间的关系，前面看着挺奇特的。,0
1,27076492,虎皮萌企鹅,飂,sdotter,还行,2018-05-19,21:23:27,一般般吧，也不是特别萌,0
1,27076492,虎皮萌企鹅,买醉的川妈,28836316,推荐,2018-03-17,15:44:25,儿童动画片，剧情简单，整体没什么不好的，但是画质不是特别清晰，3D效果不是很明显，也没什么深刻的寓意，适合小朋友看。,0
1,27076492,虎皮萌企鹅,已然,63352744,还行,2018-07-03,08:39:01,陪儿子一起看的，勉强吧，没有太引人入胜的剧情。,0
1,27076492,虎皮萌企鹅,NANTOSEE,161268754,较差,2021-06-03,05:03:49,我不是很懂为什么我会含泪看完,0
1,27076492,虎皮萌企鹅,L,65337451,还行,2018-11-16,12:17:50,丛林功夫熊猫，不过老虎叫黑寡妇（娜塔莎）树懒叫钢铁侠（托尼）这个人设好跳戏啊 哈哈哈哈哈,0
1,27076492,虎皮萌企鹅,栖云峤,158280772,推荐,2018-08-17,22:54:24,挺萌的，eye of tiger很厉害,0
1,27076492,虎皮萌企鹅,可爱多兔宝宝186,151281010,推荐,2018-05-27,14:31:20,还不错，温馨成长片,0
1,27076492,虎皮萌企鹅,iceberg,130003821,还行,2018-06-09,22:51:06,一开始的画面还是满可爱，满有质感的，被吸引住了，但之后的情节比较老套，看起来就有些索然无味了。,0
1,27076492,虎皮萌企鹅,🤭,49992408,还行,2018-05-16,22:19:11,最好的设定是老虎妈妈有一个企鹅儿子，而儿子收养了一条金鱼为儿子,0
1,27076492,虎皮萌企鹅,浩克,104903420,推荐,2018-08-06,23:06:42,还不错看……,0
1,27076492,虎皮萌企鹅,pattiboom,pattiboom,,2020-01-06,02:31:55,大家都圆圆的怪可爱的。,0
1,27076492,虎皮萌企鹅,夜半三更,notgod512,推荐,2018-09-06,16:30:04,细腻的做工~配乐非常棒~欢乐中不忘成长教育~值得一看的动画精品~,0
1,27076492,虎皮萌企鹅,躺着减肥,71785984,,2021-01-29,20:06:42,动物不可爱，看到老虎放过坏人就关了，后面多半就是企鹅卖萌，坏人复返,0
1,27076492,虎皮萌企鹅,一只喵,1552796,推荐,2020-03-22,16:00:27,是好看的呀 虽然情节老套 但剧情连贯啊 哈哈,0
1,27076492,虎皮萌企鹅,Zhangzhan,150497523,推荐,2018-03-20,23:52:41,过目就忘,0
1,27076492,虎皮萌企鹅,哇哈哈真快乐,176158455,推荐,2021-03-29,17:09:02,跟家里小朋友一起看的，还不错,0
1,27076492,虎皮萌企鹅,白羽,176093043,较差,2018-06-09,10:45:54,英雄的成长故事,0
1,27076492,虎皮萌企鹅,哦嗨呦～,157569709,较差,2018-07-19,12:48:41,怎么感觉小金鱼比小企鹅还要萌？好像还会有第二部！很适合小朋友看的电影！收藏,0
1,27076492,虎皮萌企鹅,眼睛,luida,,2019-09-30,23:01:57,太逗了,0
1,27076492,虎皮萌企鹅,蠢萌的二哈,50051246,推荐,2018-03-15,19:18:56,对动画都很感兴趣啊，企鹅也是超级萌的，重点也特别逗啊，笑点多多，适合去看，放松心情,1
1,27076492,虎皮萌企鹅,赛伯乐,189449736,力荐,2021-09-08,17:12:27,涛山阻绝秦帝船，寒公彻夜捧金盘。法国完胜德国……欧罗巴第一，名不虚传…,0
1,27076492,虎皮萌企鹅,小强,138642685,还行,2018-08-30,21:12:36,一般般，适合小孩子看,0
1,27076492,虎皮萌企鹅,虎承谟,150232394,很差,2018-03-19,14:43:42,无耻，3.16放片，3.19才出评分，还好我没去看,1
1,27076492,虎皮萌企鹅,甜,174051092,还行,2018-06-21,22:54:03,还好吧 蛮好笑的,0
1,27076492,虎皮萌企鹅,亚眠,167331865,还行,2019-02-01,13:30:40,不明白我这个几十岁的人为什么要看这个动画电影？？？？,0
1,27076492,虎皮萌企鹅,sunshine,132844323,力荐,2018-11-25,17:52:24,超级好看，很多致敬的情节！有街头霸王的耗由根！还有碟中谍,0
1,27076492,虎皮萌企鹅,喵了个咪没有咪,62103801,还行,2018-05-18,00:30:11,讨厌英雄,0
1,27076492,虎皮萌企鹅,赛文的全麦切片,137432236,较差,2017-11-29,09:40:30,屎,0
1,27076492,虎皮萌企鹅,蔡徐坤,188459496,较差,2021-04-30,17:50:57,4.6,0
1,27076492,虎皮萌企鹅,遇上云,meetyun,力荐,2018-06-20,13:21:04,看的开心，画面也不错，哈哈,0
1,27076492,虎皮萌企鹅,豆友212010782,212010782,还行,2020-05-16,23:11:40,真•给小孩子看,0
1,27076492,虎皮萌企鹅,安逗逗,142370988,还行,2018-06-13,23:56:24,一般般吧，比起之前的马达加斯加还是差远了。,0
1,27076492,虎皮萌企鹅,胖子糕爱做梦,164278600,还行,2018-05-21,19:16:29,动物很细腻，故事一般般,0
1,27076492,虎皮萌企鹅,西门飞砖,154404375,推荐,2018-03-18,16:40:01,中规中矩，对得起票价。,0
1,27076492,虎皮萌企鹅,泡泡,174344038,还行,2018-12-08,16:06:23,两代丛林英雄战胜邪恶大坏蛋的故事，有代沟，有亲情，有理解。总体来说是给孩子看的动画。,0
1,27076492,虎皮萌企鹅,天外飞蟹,178411555,力荐,2022-02-11,23:35:57,《功夫熊猫》版《疯狂动物城》，山洞的桥段好像《夺宝奇兵2》《霍比特人：意外旅程》里的场景。整个故事编的不错。,0
1,27076492,虎皮萌企鹅,joblee,23452707,还行,2018-12-26,21:52:47,差点就看不下去了,0
