page_index,movie_id,title,username,user_id,rating,date,time,comment,useful_count
2,27076492,虎皮萌企鹅,99涛声依旧,175425681,力荐,2018-04-03,10:19:27,很好看，小伙伴们一起看吧,0
2,27076492,虎皮萌企鹅,晨风品牌攀岩,171066550,力荐,2018-03-14,12:20:28,这场华丽的冒险之旅也是很不错，新奇有趣的剧情设定，亲情和守护的故事很有意义,1
2,27076492,虎皮萌企鹅,betty,175470328,力荐,2018-03-17,13:24:29,好搞笑，虎皮企鹅很可爱，情节逼真，小朋友超级喜欢！,0
2,27076492,虎皮萌企鹅,静颖颖颖颖颖颖,146386906,推荐,2018-03-16,14:45:53,蛮好看的呀，带着小朋友去看的，本来以为大人回不喜欢，没想到我看的也蛮津津有味的呢哈哈哈,0
2,27076492,虎皮萌企鹅,壁咚,174706519,力荐,2018-03-18,16:49:03,无厘头的剧情，搞笑的台词。真的是太搞笑了哈哈,0
2,27076492,虎皮萌企鹅,清空,175124536,力荐,2018-03-18,00:10:23,属于动画的一场冒险，它会让你思考动物之间的种种金字塔关系，过程啼笑皆非,0
2,27076492,虎皮萌企鹅,笑看风云,174151572,力荐,2018-03-14,14:51:38,这是一部以丛林为主题，集萌宠、爆笑、冒险、成长、正能量等元素于一身的合家欢动画电影。,0
2,27076492,虎皮萌企鹅,xiuxiu,174870678,力荐,2018-03-20,11:25:12,良心制作的好片子，挺好看的，给五星,0
2,27076492,虎皮萌企鹅,雨一下就困😪,175568338,力荐,2018-03-18,19:50:10,虎企鹅Maurice的历险记，故事一个接一个的，很有趣，适合小朋友去看。,0
2,27076492,虎皮萌企鹅,做人要厚道,166679974,力荐,2018-03-17,12:51:27,电影超好看的，剧情很有意思，很值得一看，总之就是很好看。,0
2,27076492,虎皮萌企鹅,胡66,173741860,力荐,2018-03-17,13:29:22,很萌很好看，动漫形象很可爱，剧情设计的也很棒，总体很好,1
2,27076492,虎皮萌企鹅,胡88,175210243,力荐,2018-03-17,13:36:22,良心制作超级好看，笑点很不错哈哈哈很喜欢,0
2,27076492,虎皮萌企鹅,青蛙王子,175660535,力荐,2018-03-20,13:50:26,黑白的企鹅好看些。儿子看的很认真。很适合小孩看。不错的！,0
2,27076492,虎皮萌企鹅,毕竟是i小纯洁,152610912,力荐,2018-03-20,11:23:43,特别好的一部剧，剧情特别赞，强力推荐！！,0
2,27076492,虎皮萌企鹅,不错,175379957,推荐,2018-03-16,17:13:47,小企鹅们的勇敢经历，让我们不得不也学习他们的精神。,0
2,27076492,虎皮萌企鹅,栈道上的小船,175189750,力荐,2018-03-17,13:12:49,国外的动画片还是很有高度的，也不是我不偏向国产，只是真的不错，,0
2,27076492,虎皮萌企鹅,好好,171427355,推荐,2018-03-16,15:12:54,这部片子画风很好笑，满满的童心啊，色彩很鲜艳很好玩的感觉！,0
2,27076492,虎皮萌企鹅,福瑞迪,175024503,推荐,2018-03-16,15:16:19,电影的主角造型真的可爱。颠覆传统的黑白搭配。,0
2,27076492,虎皮萌企鹅,利拉德,175020364,力荐,2018-03-16,14:44:31,剧情轻松节奏欢快，适合全家人一起看的一部电影。,0
2,27076492,虎皮萌企鹅,晴儿娃娃,173429227,力荐,2018-03-16,17:37:40,真的好看，带着baby来看最适合不过了，很搞笑，我觉得又要走红一只虎皮企鹅了吧！哈哈,0
2,27076492,虎皮萌企鹅,Taylor,175515567,推荐,2018-03-17,17:08:46,带侄子看的 皮企鹅实在是太可爱了 侄子也很喜欢看 剧情还可以,0
2,27076492,虎皮萌企鹅,曾会,175658874,力荐,2018-03-20,21:51:03,画面感超棒，很励志里面的小动物都很可爱,0
2,27076492,虎皮萌企鹅,囧囧囧囧,168820977,力荐,2017-10-28,18:47:51,值得推荐的电影，故事情节很新颖，内容很精彩，来看看吧,2
2,27076492,虎皮萌企鹅,青柠,175520008,力荐,2018-03-18,16:11:05,很不错的动画，笑点很多。推荐一家人去看，动物都很萌,0
2,27076492,虎皮萌企鹅,平嘻王,173287921,推荐,2018-03-18,16:23:59,作为儿童影音还可以，但我更喜欢原版配音，原汁原味,0
2,27076492,虎皮萌企鹅,爱读书的小学生,175377949,力荐,2018-03-19,14:50:29,丛林小神兵们神勇非凡，情节励志，充满反转，就连反派都因为可爱能被原谅,0
2,27076492,虎皮萌企鹅,梅花香自苦寒来,172520149,推荐,2018-04-03,16:37:18,好可爱ớ ₃ờ,0
2,27076492,虎皮萌企鹅,飞机,173427448,力荐,2018-03-16,15:15:32,早就期待这部电影的到来了，今天看了真的很有意思。,0
2,27076492,虎皮萌企鹅,豆豆糖果没有糖,174526066,力荐,2018-03-17,12:52:26,带孩子来看《虎皮萌企鹅》权当给孩子认各种动物了，因为动物都很逼真。,0
2,27076492,虎皮萌企鹅,涂涂画画,175083129,力荐,2018-03-18,16:49:59,好看的动画片  真的欢乐得停不下来,0
2,27076492,虎皮萌企鹅,烟花易冷,175434738,力荐,2018-03-20,12:21:48,良心制作，个人比较喜欢看动画电影，这部是我的菜。,0
2,27076492,虎皮萌企鹅,鑫鑫龟儿子,175359109,力荐,2018-03-15,11:03:12,很适合让我这个九零后的大孩子看，整天上课的气氛都很紧张，看这部电影，真的让人很放松，还有莫里斯为什么从天而降呀😳,0
2,27076492,虎皮萌企鹅,大侦探,173589676,力荐,2018-03-20,15:54:16,我居然是和男朋友一起去看的，不过很满意。喜欢这样的电影。,0
2,27076492,虎皮萌企鹅,浪,1550607,力荐,2018-03-10,20:38:49,很不错的一部动画片！人物塑造很丰富，也很励志，教会孩子如何快速成长，独立生活！,1
2,27076492,虎皮萌企鹅,喜鹊,174732268,力荐,2018-03-20,15:55:48,看的是法语版的配音，很好笑。法语不亏是最优美的语言。很喜欢导演的叙事风格。,0
2,27076492,虎皮萌企鹅,金金,172102834,推荐,2018-03-14,12:41:24,开心的时候得看这部电影，不开心的时候更得看这部电影，因为这部电影真的是很温情，又爆笑，让你忘却烦恼,0
2,27076492,虎皮萌企鹅,福瑞迪,175143824,推荐,2018-03-16,14:45:55,如何教育孩子看的感觉自己需要调整心态l .,0
2,27076492,虎皮萌企鹅,上帝恩赐,174091915,推荐,2018-03-16,14:54:25,制作还是不错的，看了也挺搞笑，大人孩子都比较喜欢看！,0
2,27076492,虎皮萌企鹅,蛋蛋,173747140,力荐,2018-03-16,16:16:34,很适合宝宝们看，这场啼笑皆非的冒险很精彩。,0
2,27076492,虎皮萌企鹅,小煮佩奇,175022464,推荐,2018-03-16,14:46:33,这部轻松欢快，笑点颇多，到时候还要带小朋友再看一遍,0
2,27076492,虎皮萌企鹅,小花的幸福时光,173350921,力荐,2018-03-17,13:27:31,很好看，陪着家宝一起看的，有点寓教于乐，最主要宝宝喜欢看，很不错的温情动画片,1
2,27076492,虎皮萌企鹅,花开ヽ似水￠,174966541,力荐,2018-03-17,14:07:09,很好看，抽了个空和妹妹一起看的，小朋友应该更喜欢这种有趣而有深意的动画，制作效果很好。,0
2,27076492,虎皮萌企鹅,很闲的奥特曼,175512095,推荐,2018-03-17,17:07:19,很无厘头的设计很滑稽，也适合小朋友看，大朋友也可以看，很好笑,0
2,27076492,虎皮萌企鹅,意思,174049459,力荐,2018-03-18,16:21:19,很有趣，里面的小动物都很萌，很不错。,0
2,27076492,虎皮萌企鹅,with,175243167,力荐,2018-03-18,17:39:07,不得不说这是部良心的动画电影，添加了很多对孩子有益的情节。,0
2,27076492,虎皮萌企鹅,小白,174507697,推荐,2018-03-19,14:38:48,老虎的儿子，金鱼的爸爸，虎皮企鹅拯救森林，很适合小孩子看。,0
2,27076492,虎皮萌企鹅,糊糊,175196637,推荐,2018-03-19,14:47:55,好可爱德企鹅，动画人物特别好，很有意思。,0
2,27076492,虎皮萌企鹅,啊哈哈,175654497,推荐,2018-03-20,11:18:51,电影故事中有正义与邪恶的校量，有英雄，有爱，奉献，娱乐搞笑，很适合小孩子看,0
2,27076492,虎皮萌企鹅,小混混,175460837,力荐,2018-03-18,16:13:56,看完之后心情就好了 ，回头再看一遍,0
2,27076492,虎皮萌企鹅,156到底,175573651,力荐,2018-03-18,17:12:09,神奇的食物链，老虎吃企鹅，企鹅吃鱼，完美的食物链上的三只神奇的动物，为什么会成为祖孙三代，她们在茂密的丛林经历了什么？非常好看的一部卡通电影。,0
2,27076492,虎皮萌企鹅,逢考必过,175629083,推荐,2018-03-20,11:19:20,那些小动物真的很萌萌哒，适合和小朋友一起看，而且挺搞笑的,0
2,27076492,虎皮萌企鹅,金兆龙,175662295,推荐,2018-03-30,10:04:45,刘仪伟跨界做导演还是比较成功的,0
2,27076492,虎皮萌企鹅,十三,54658612,很差,2018-03-17,16:53:51,emmmm,0
2,27076492,虎皮萌企鹅,人来人往,175145674,推荐,2018-03-19,14:11:48,故事逗趣温馨又俏皮，虎皮企鹅就是一个欢乐的逗逼，带孩子去开心一下，很正能量的。,0
2,27076492,虎皮萌企鹅,小慧，,173866877,推荐,2018-03-20,13:42:12,可以让小孩子一边看动画，一边学习知识，还能让父母认识到自己的不足。,0
2,27076492,虎皮萌企鹅,旧景旅人.,174041524,力荐,2018-03-19,15:33:28,法国的动画片啊，可以说是很给力了，导演组在人物设计和细节上做的都挺不错的，点个赞！,0
2,27076492,虎皮萌企鹅,小许先生,174806385,,2018-03-20,18:00:32,真的挺好的,0
