page_index,movie_id,title,username,user_id,rating,date,time,comment,useful_count
0,26683723,后来的我们,不老仙妻,228112849,力荐,2023-01-15,10:07:05,我看完就是觉得我那天把spyxfamily看完就好了。我就是分心去拼了个乐高，就跟不上剧情了。说到底如果我再有钱一点就好了，我就可以改签飞机，这样乐高也能拼动漫也能看。我也不想暗戳戳的发一些东西给你看，我就是真的很难过。如果缘分能续费就好了/,0
0,26683723,后来的我们,木北.,236005564,较差,2023-01-15,10:03:56,没有共鸣,0
0,26683723,后来的我们,momo（隐藏款,224811511,很差,2023-01-15,03:42:48,这个剧情真的恶心我🤢,0
0,26683723,后来的我们,1453,179713238,推荐,2023-01-15,01:20:05,感情本来就是不可免俗的，有个结局就足够了。,0
0,26683723,后来的我们,摸一凹喵,199622327,较差,2023-01-14,15:47:39,挺矫情挺尴尬的，但是男主的父亲很感动,0
0,26683723,后来的我们,账房先生,228633200,力荐,2023-01-14,15:32:39,只有经历过的看了才能引起共鸣，才会觉得电影值五星。后半段看的我潸然泪下。有些人注定是要错过的，有些人注定只能放在回忆里，放在心灵的最深处，缘分这事，不负彼此就好，想要不负此生真的很难。但最遗憾的是我们连一个好好的告别都没有，都好好的吧，秋，I miss you，我是说，我错过你了…,0
0,26683723,后来的我们,楚山孤,YN6487,较差,2023-01-14,11:36:24,记得当初在电影院看到我想退场。,0
0,26683723,后来的我们,蕾呀蕾呀o,165115506,推荐,2023-01-14,00:15:36,很久之前看过。当时觉得好刀55555,0
0,26683723,后来的我们,试管里染污眼眸,Hlllllliissroa,较差,2023-01-13,16:28:56,为什么回忆用彩色,0
0,26683723,后来的我们,momo,244739105,推荐,2023-01-13,15:28:18,其实路途中走散才是人生常态,0
0,26683723,后来的我们,同志亦凡人中文站,3540441,还行,2023-01-13,05:37:40,分分合合，中国版蓝色情人节。故事很真实，但编排得可惜了...,3
0,26683723,后来的我们,柏拉图什么,126239867,还行,2023-01-13,02:57:59,有些台词太尴尬了…不过周冬雨演技真的太可了。,0
0,26683723,后来的我们,amanoaki,iynua,还行,2023-01-13,00:07:45,竟然出奇地适合冬季假期观看，好浓厚的春节气息。有些台词放在国产青春电影里看太珍贵了，有些又显得太刻意了。最喜欢的片段是男主研发的游戏获得成功然后赚大钱买房子，以及结尾父亲的那封信。（看完有点能理解韩国人为什么这么喜欢这部电影里的周冬雨了，短发特别有灵气，人设还有点像早期安生。）当两人决定花钱打车的那个夜晚，小晓把头探出车窗，大声喊着对北京和未来的期待，我脑子想的是：这种行为放在当时很令人动容，但如果是放在现在的环境下，会让我觉得脱离现实到想翻白眼。,0
0,26683723,后来的我们,Lying,144945537,,2023-01-12,17:53:42,本科看过，当时很感动的,0
0,26683723,后来的我们,玖快de_TOWI_,256488581,还行,2023-01-12,17:40:09,说实话这个电影并没有感动到我，主要是没贡献票房也就不打二星了,0
0,26683723,后来的我们,2potassium,pamelawangxy,还行,2023-01-12,10:46:21,台词有点尬…为啥letterboxd评分那么高,0
0,26683723,后来的我们,返老还童,180176745,,2023-01-12,00:46:08,前面剧本觉得还不错，可能是太爱周冬雨了。快递卖游戏那段居然看哭了，不知道是不是这几天情感积累了一波，还是被游戏加色彩的设定戳到了。“I miss you”，其实有很多浪漫真是在电影里学的，生活中会对一些情景感到欣喜也是因为某部电影拍出过它的美好。电影提供了一个美的视角，指引着我的生活。,2
0,26683723,后来的我们,afteglo,203164255,较差,2023-01-12,00:35:18,Boring ,0
0,26683723,后来的我们,大尾巴狸猫,174219416,还行,2023-01-11,16:26:23,一般,0
0,26683723,后来的我们,科尔司机的大饼,90141745,还行,2023-01-11,14:56:42,错过就再也回不去了 我们都在各自在自己的人生道路上行走,0
0,26683723,后来的我们,珈蓝婆娑,77155291,力荐,2023-01-11,01:52:20,喜欢小晓的笑容，真诚而美丽。,0
0,26683723,后来的我们,果汁分你一半,214272388,还行,2023-01-10,23:33:18,可是我们最终还是走散了……,0
0,26683723,后来的我们,Ustinian.,229568353,还行,2023-01-10,22:34:31,果然是年纪小不懂事，在影院看的时候哭的那个惨。。现在想想也没什么好感动的，错过才是人生的常态。,0
0,26683723,后来的我们,Mercurius.,176119115,较差,2023-01-10,16:02:34,好像是看过，但情节基本记不住了。所以总是有这么些个片子，听着觉着很熟悉，但什么都想不起来。（那就真的证明我不喜欢这个电影也并没有很感兴趣地看吧）来两颗星吧,0
0,26683723,后来的我们,小狗和月亮,251618472,较差,2023-01-10,07:51:27,和z在美国的时候把电脑放在饭桌上一起看的 结果尴尬到两个人都没怎么吃得下23333,0
0,26683723,后来的我们,輕輕,224006056,还行,2023-01-10,02:39:35,有点无聊 🥹看的zdy的第一部片,0
0,26683723,后来的我们,辣椒盐吃蛋糕,220567605,推荐,2023-01-10,01:24:24,在小熊家附近拍的,0
0,26683723,后来的我们,Janice,182368061,还行,2023-01-09,22:35:29,还在电影院看哭了 我真是。。,0
0,26683723,后来的我们,Echo,162234357,还行,2023-01-09,19:47:04,补打卡,0
0,26683723,后来的我们,水煮鱼刺,211437360,还行,2023-01-09,18:16:04,五月天的歌比电影动人,0
0,26683723,后来的我们,宇宙一小只,259861048,推荐,2023-01-09,15:23:19,"感受：压抑
“后来的我们不再是我们，后来的我们依然是我们”",0
0,26683723,后来的我们,My valentine.,213718667,还行,2023-01-09,01:07:53,我是永远会为错过掉眼泪的。,0
0,26683723,后来的我们,星酿酒,209512445,很差,2023-01-08,23:16:56,有病,0
0,26683723,后来的我们,:D,225927418,还行,2023-01-08,17:56:54,害。,0
0,26683723,后来的我们,屋顶橙子味_,232772621,很差,2023-01-08,17:03:03,分手原因我真是看不懂，他俩没事吧在那无病呻吟，还差点出轨,0
0,26683723,后来的我们,小bai,253825413,力荐,2023-01-08,16:31:55,后来的我们,0
0,26683723,后来的我们,chow,186735262,还行,2023-01-07,23:25:45,老婆真的倒大霉了，你真爱他一辈子不娶不嫁啊，口口声声说爱，实际上的行为又是:),0
0,26683723,后来的我们,东方小奕荣,29437323,还行,2023-01-07,23:02:26,以为会哭，但是没有。周冬雨很好，小晓也很好，旺前男友的好女孩，谁来珍惜你？到哪里找你这么好的人？,0
0,26683723,后来的我们,冰雪魔鳕,197865383,较差,2023-01-07,20:27:49,回忆,0
0,26683723,后来的我们,依怡苡弋,yiyiyiyi0929,较差,2023-01-07,18:43:32,看得让人很折磨。这是什么年代的爱情观和生活观？大学生想自己做游戏非得打零工？就不能找个大公司白天上班晚上自己设计？没钱没成功就不能有爱情？不能好好生活？想要既文艺又现实？但结果是既矫情又残酷青春。全片唯一感动的是父亲写的信。,0
0,26683723,后来的我们,为什么是猪呢,253183896,还行,2023-01-07,18:04:11,以前和同学一伙人一起去看的 看完觉得满满的遗憾 现在想想 其实对现任很不公平,0
0,26683723,后来的我们,著名奶茶品鉴家,178010984,还行,2023-01-07,15:54:25,三星给全剧最大泪点林父,0
0,26683723,后来的我们,秋,185417148,力荐,2023-01-07,08:12:00,我自己是看哭了，我也安利给了很多人看。后来的我们，都已不在。,0
0,26683723,后来的我们,Heejoor,201685804,还行,2023-01-07,07:22:10,一个台湾人拍大陆北漂人的情感经历，有些情节还是过于煽情拖沓，道具布景还是下了功夫，整体还是及格的。,0
0,26683723,后来的我们,14.,159653048,还行,2023-01-07,04:51:51,噗 前几年看哭的哇哇的 又刷了一遍 怎么毫无波澜… 台词像在念台词,0
0,26683723,后来的我们,Pomme,187196741,,2023-01-06,23:35:04,补标，没记错的话是被一个女孩拉着去看的,0
0,26683723,后来的我们,英英媛媛,166638457,还行,2023-01-06,23:15:08,祝你幸福，但希望我们永远不要再见,0
0,26683723,后来的我们,李99@,198532482,还行,2023-01-06,22:13:48,是因为后来 和青春里的ktv去看了这部刘若英第一次导演的电影～,0
0,26683723,后来的我们,pipihyun,163016222,还行,2023-01-06,17:36:07,后来的我们什么都有了，却没了我们。,0
0,26683723,后来的我们,咖易咖易kakak,173580974,力荐,2023-01-06,16:22:49,虽然评分不高，还是觉得很好看。兜兜转转只因你不懂我，而我最在乎你。,0
0,26683723,后来的我们,一个小月亮,34859931,较差,2023-01-06,04:57:14,台词太生硬了 不喜欢黑白的回忆片段太生硬 全片高亮还是壮壮老师最后的独白,0
0,26683723,后来的我们,大英雄,141270717,推荐,2023-01-05,22:41:36,2018年夏天的记忆。现在拿出来再看，感叹时间真的已经过去好久好久！,0
