page_index,movie_id,title,username,user_id,rating,date,time,comment,useful_count
0,30255216,您一定不要错过,满地黄花,Daisy-Walden,力荐,2018-08-04,13:33:18,包场电影：影片讲述了内蒙古民族电影70年以来的点滴，没想到这样的一个纪录片也让我流泪好几次。很幸运在这个炎热的夏季有机会随着小崔的讲解通过电影追忆历史，追忆蒙古族老一辈艺术家对于电影事业的奉献和执着。马背上的民族出了四个金鸡奖最佳女主，《悲情布鲁克》更是在当年获得了集体演员金鸡奖，还有通福、三宝和腾格尔等老师通过配乐赋予了电影灵魂。感谢小崔在这部片子上的辛苦付出，让我们年轻一代有机会了解这么多传奇的故事，欣赏到五、六十年代拍摄的万马奔腾的慷慨激昂的场景。这99分钟很有意义。,1
0,30255216,您一定不要错过,秦音无界,1120416,很差,2018-08-04,07:28:27,唉，這是把《电影传奇》的脸都丟尽了。,0
0,30255216,您一定不要错过,Q,56093617,还行,2018-08-04,02:06:43,"客气点打个3星。 
纪录片本身制作得实在不咋地，但片中介绍的内蒙古老电影都很不错，有些片断真的能看到热泪盈眶。印象深刻的、最喜欢的是《悲情布鲁克》，四个草原好汉在夕阳下边骑马边饮酒，策马奔腾，豪情万丈！那一幕实在太有感染力了！有机会会去找来看看！ 
",1
0,30255216,您一定不要错过,左胸上的吸盘,CFJ,较差,2018-08-03,21:15:33,勉强两分。其实这片子属于文献纪录片，很多人可能不熟悉这种类型，多看看电视会发现很多同类型。制作很糙，很多天外飞仙级别的水准：涂着粉色唇彩还多次出镜的男专家，大体按照时间线但实在没什么逻辑组织的各个电影的片段回放、弹幕一样闪过的那些得奖记录等等，不过片里关于蒙族电影的一些概括还是有启发的，比如蒙族电影相对维族藏族电影存在感强烈的民族主体性，各演职员的访谈无重点太随意，不过麦丽丝讲述断桥那场戏又一次让我感觉蒙古族人还是离动物远一点吧，这帮瘪犊子糟蹋动物时手黑的很，套狼虐马什么的，真他妈恶心。塞夫麦丽丝两口子的电影我90年代就看过，他俩跟冯小宁一样属于标准的土鳖电影人，手法过时且蠢。片里还介绍一部模仿《布谷鸟》的蒙族电影，看着太尴尬了,1
0,30255216,您一定不要错过,zci,iorizci,推荐,2018-08-03,19:56:40,结尾太仓促了，蒙古族的文化吸引人。,0
0,30255216,您一定不要错过,tabaoman,tony.w,推荐,2018-08-03,18:35:02,民族魂,1
0,30255216,您一定不要错过,双鱼,79411650,推荐,2018-08-03,16:42:03,满满的回忆，竟然有近百分之三十的一星，评分5.6，这斗的厉害。,0
0,30255216,您一定不要错过,拖拉机突突突,168424309,较差,2018-08-03,14:25:29,我还真想错过，，，,0
0,30255216,您一定不要错过,岑宣,122838759,推荐,2018-08-03,00:56:09,给1星的，不知怎么想。,1
0,30255216,您一定不要错过,不羁的風,walqx5754559391,还行,2018-08-02,23:08:21,"3
纪录片涨姿势，看到了很多不错的电影片段，了解了那些电影幕后故事，希望以后能有中国电影发展的纪录片。",0
0,30255216,您一定不要错过,声色画报,24274750,很差,2018-08-02,22:45:46,创纪录了，是豆瓣电影纪录片里的最低分。这算电影吗？把《电影传奇》电视节目选取蒙古专辑出来就推上大银幕？电影无罪，浪费上映机会。老崔已经疯了,2
0,30255216,您一定不要错过,鲁大师-鲁提辖,luwenhui,很差,2018-08-02,21:38:07,小崔不是还跟红通上的人有来往吗，怎么在这儿如此自恋地讴歌起自己的祖国自己的党了？这制作水准，电影算不上不说，电视节目都没人看。可怜了华谊兄弟冯小刚刘震云范冰冰，因为这么一部辣鸡电影当了小崔上头条的炮灰。,1
0,30255216,您一定不要错过,Stager (道士),Stager,还行,2018-08-02,18:11:10,电视纪录片。,0
0,30255216,您一定不要错过,美丽人生,179781115,较差,2018-08-02,16:56:35,你一定不错过，还是错过的好吧！,0
0,30255216,您一定不要错过,吴洪波,141348382,很差,2018-08-02,07:57:50,崔老师你就好好更新你的微博吧，你不适合拍电影,0
0,30255216,您一定不要错过,方明媚进城求学,yuemingwuying,较差,2018-08-01,21:50:27,纪录片不能只有情怀和致敬,0
0,30255216,您一定不要错过,Pp,3573351,较差,2018-08-01,18:41:06,这种根本不算电影，只能算个文艺记录节目，实在看不出有什么能感动观众的，只有圈子里的人自己回忆乐乐吧,0
0,30255216,您一定不要错过,捕快,47755926,很差,2018-08-01,15:13:06,做个内蒙古电影混剪估计都好看过这样的纪录片。,0
0,30255216,您一定不要错过,Kyo ㍿,kyostudio,较差,2018-08-01,10:06:31,内容非常好，但拍的也真是业余……,0
0,30255216,您一定不要错过,铁公鸡动画,59822585,推荐,2018-07-31,23:58:59,内容是真的好，片名减分啊！,1
0,30255216,您一定不要错过,Wester,69030381,,2018-07-31,22:10:02,"你们等一下，你们不觉得这个海报很像：
那个。。。你们。。。有没有。。。
吗。。",0
0,30255216,您一定不要错过,K,133231342,,2018-07-31,21:24:46,这不就是个电视节目吗？,0
0,30255216,您一定不要错过,llate,71390552,较差,2018-07-31,16:15:42,应该叫《小崔说电影》。错过就错过了,0
0,30255216,您一定不要错过,年,zoe13,力荐,2018-07-31,14:16:32,电影内外 天下大同  会感动不是因为情怀 只是要记得向前看而已。,1
0,30255216,您一定不要错过,灯塔,172965549,力荐,2018-07-30,22:32:12,让我知道了原来在港片盛行之前，国产电影也有辉煌的过去。但愿电影精神还有人能继承，让我孩子也能看到有精气神的电影,2
0,30255216,您一定不要错过,黄创,huangchuang,较差,2018-07-30,14:57:55,崔老师辛苦了，2星鼓励下吧,1
0,30255216,您一定不要错过,雪,1282175,很差,2018-07-30,06:13:58,我们一定不能错过的是种子,0
0,30255216,您一定不要错过,理易封,42325900,较差,2018-07-29,19:24:17,不行，真的看不进去，是电视访谈，本来以为能勾起对蒙古电影的兴趣，结果对这部电影的兴趣在看了半个多小时之后也被消磨殆尽了,0
0,30255216,您一定不要错过,云端飞火,163386779,还行,2018-07-29,19:11:29,让我更深入了解了蒙古电影，这个本身不适合去影院看，只适合想对蒙古电影以及发展历程看的，做为历史文献看，但披上一个很吸引人的名字骗观众进影院，只会得到更多的差评,0
0,30255216,您一定不要错过,Angelina,60137532,推荐,2018-07-29,17:18:42,后期剪辑是不是被审查掐东西了？？？,2
0,30255216,您一定不要错过,资深电影人,153755913,还行,2018-07-29,14:59:40,真心一般。这样片子不要上院线。直接上视频网站,0
0,30255216,您一定不要错过,莫特葵,32022704,还行,2018-07-29,02:14:35,被电影内容感动，片子本身确实有点儿out了。,1
0,30255216,您一定不要错过,年轻人不要信邪~,140462864,很差,2018-07-27,13:56:59,笑死了，崔永元一边喷转基因食品，一边卖天价不合格“放心食品”，还搞入会制，还放言平民百姓没资格吃他的特供食品，还一堆屁民捧他,2
0,30255216,您一定不要错过,lifelin45,156186213,力荐,2018-07-27,09:30:06,我觉得我站对了边,3
0,30255216,您一定不要错过,白小玥,2020541,还行,2018-07-26,23:20:13,内容杠杠的，其他的还不如电影频道的一集节目……,0
0,30255216,您一定不要错过,梦到内河,148406008,很差,2018-07-26,20:04:15,神烦崔，精神有问题赶紧去治。,0
0,30255216,您一定不要错过,風藍无殇,177266435,很差,2018-07-26,16:58:48,小崔失心疯看来是没治了,0
0,30255216,您一定不要错过,sphinxing,sphinxing,,2018-07-26,12:30:56,崔粉，你们在哪呢？赶紧救场啊，都5.6分了啊,0
0,30255216,您一定不要错过,挪挪,175552826,力荐,2018-07-24,17:40:03,非常喜欢！七十年蒙古族电影的礼赞。对马背民族的坚韧、勇敢、彪悍、深沉、胸怀，对草原与生灵的质朴之爱的精彩回顾，不乏史诗般的气度与恢弘。,0
0,30255216,您一定不要错过,FEFE,C.again,很差,2018-07-23,23:58:34,⚠️强行加入崔永元就是个烂片儿的预警信号了。,2
0,30255216,您一定不要错过,橘子咖啡,51554450,还行,2018-07-23,23:47:17,更适合放在电视上。就像崔永元的一部硕士论文,0
0,30255216,您一定不要错过,yf,173625424,还行,2018-07-23,21:10:04,认识了很多内蒙古好电影以及老一辈人的电影精神；蒙族也是世界历史上的一个奇观，曾经的欧亚之王在建国后迅速被同化；影响最深镜头：飞驰的骏马变成了脱衣舞台上的一个情趣玩物。看似夸张做作，但内蒙古现状却是如此，那些留在草原上的人也多半是好吃懒做，趁着旅游收入苟且。还有那一批在内蒙的上海孤儿，想拍。,1
0,30255216,您一定不要错过,刘小纯。,49448182,推荐,2018-07-23,19:40:56,了解了解,0
0,30255216,您一定不要错过,微尘,179130937,还行,2018-07-23,15:25:19,加一星情怀分,0
0,30255216,您一定不要错过,walgn,162666650,还行,2018-07-23,13:01:24,是因为崔永元，全程尬看完的，不然我只能打一分了！,0
0,30255216,您一定不要错过,电影爱好者。,171499319,,2018-07-23,09:57:39,其实我对《手机2》更感兴趣,0
0,30255216,您一定不要错过,rune1121,41036146,较差,2018-07-22,22:16:02,崔所有的举动都有极强的目的性和功利性，你视野放大一点，会发现和如今微商自我炒作和商品营销的手法是一模一样。。。唯一缺陷就是如今傻子比当年少太多了，但是还是基本够用，所以以后千万别笑话那些被死心塌地被微商坑的小姑凉,4
0,30255216,您一定不要错过,呵呵哒,181510035,还行,2018-07-22,17:15:38,比较年轻，看不太懂。,0
0,30255216,您一定不要错过,蓝小天,37308967,力荐,2018-07-22,16:54:06,这是纪录片，感觉不像电影。草原上的电影，娜仁花，记忆中老妈买的《大众电影》。后面的大爷看的好感动，这应该是我妈她们那一代的情怀。,1
0,30255216,您一定不要错过,想要一个女儿,141622459,力荐,2018-07-22,12:22:48,儿时的成长记忆涌现、对热血的民族、对饱满的生命力和电影人的责任感充满了敬意！,1
0,30255216,您一定不要错过,媛媛,168093134,力荐,2018-07-21,23:31:56,很好的纪录片，当时看完忘记写影评了，感谢崔老师拍这样的一部纪录片，让我们90后甚至00后的年轻一代有更多的认识,1
0,30255216,您一定不要错过,六条,93099672,很差,2018-07-20,22:26:02,呸！烂人。,1
0,30255216,您一定不要错过,evercryst,75736662,还行,2018-07-20,18:54:31,我支持崔老师，我买票看电影，但对一个80后来说，电影真心不怎么样，好几次我都快要睡着。6分，最多了。,0
0,30255216,您一定不要错过,pilo,57598902,还行,2018-07-20,14:06:30,前面感动了一把，后面差点睡着，这个看起来就是纪录类电视节目啊，不适合上院线吧,0
0,30255216,您一定不要错过,苏霍壹,4075628,较差,2018-07-20,00:42:38,内蒙题材电影纪录片，不错，不过没弄好,0
0,30255216,您一定不要错过,不要不开心哦,155602622,还行,2018-07-19,21:50:16,制作质量普通的纪录片，没必要院线。大半个世纪的怀旧和徳艺双馨的老艺术家，还有游牧民族都值得欣赏。,0
0,30255216,您一定不要错过,雨纪,76392548,很差,2018-07-19,18:24:14,这能叫电影？,0
0,30255216,您一定不要错过,VAN,141878857,力荐,2018-07-19,15:42:55,作为一个在外学习电影的内蒙人看的热泪盈眶,1
0,30255216,您一定不要错过,True Lies,76864578,很差,2018-07-19,13:46:42,豆瓣影评下面一堆无脑崔吹，反智到极点,0
0,30255216,您一定不要错过,YELLOWKNIFE,azeck,较差,2018-07-19,10:37:47,何必呢，这种东西弄个座谈会得了,0
0,30255216,您一定不要错过,Paylor,159308749,较差,2018-07-19,08:55:18,放在电视里播放可能效果更好。,0
0,30255216,您一定不要错过,xYxYx,ponloolly,力荐,2018-07-19,02:36:11,讲诉内蒙古电影发展史，佩服老一代艺术家，个人很喜欢,1
0,30255216,您一定不要错过,PaRaNoiD,suzhaoyang,还行,2018-07-19,00:59:08,诚然，这部片子可能作为口述纪录片在电视上播更能让大家接受一点，那些给差评的人应该是本身对电影的期望与崔永元的热点有所偏差。就单单拿这部片子来说，诚意十足，也让人敬佩，这种民族的力量和优秀的传统文化真的是根植于每个蒙古族人心中，这不正是我们这个时代人们所欠缺的么？对自身文化的认同感和自豪感，凝聚起了一代又一代人，这不就是我们的信仰吗！,0
0,30255216,您一定不要错过,孔想法师狗,180145708,很差,2018-07-18,19:31:53,崔化钠,0
0,30255216,您一定不要错过,哈哈哈,155353174,力荐,2018-07-18,15:03:21,支持小崔,2
0,30255216,您一定不要错过,stou,88654969,较差,2018-07-18,01:35:19,以后还是找个专业导演来拍摄剪辑吧，崔叔你就负责出主意把握主题方向,0
0,30255216,您一定不要错过,白金橘,128078029,力荐,2018-07-17,21:10:38,原来想象中的草原真实的存在过，原来我们也拍出了那么多好片子，喜剧的是得得奖还是国外的多，小崔谢谢你，让我有机会走进爷爷奶奶们的回忆里。,0
0,30255216,您一定不要错过,生涯,155539574,力荐,2018-07-17,13:44:47,拉一波,2
0,30255216,您一定不要错过,图书安利员,shuilingyuesha,还行,2018-07-17,09:50:24,不知道公映版如何，去年金鸡看的首映……内蒙人情怀加持，但……这又和崔永元有几毛钱关系呢,1
0,30255216,您一定不要错过,Jerry,130463798,较差,2018-07-16,23:32:11,纪录片本身一般般，不过倒是被种草了几部电影，觉得可以看看,0
0,30255216,您一定不要错过,ChaosCloud,142921420,很差,2018-07-16,12:32:10,讨厌崔永元,4
0,30255216,您一定不要错过,脑袋丨键盘,71369348,还行,2018-07-16,11:35:07,及格的纪录片，但是我觉得可以拍的更好。,0
0,30255216,您一定不要错过,啾啾桃,153985736,推荐,2018-07-16,10:23:26,有意义的蒙古电影史～,0
0,30255216,您一定不要错过,青雯人儿,151246794,很差,2018-07-16,09:10:50,闹半天是为了预热自己的纪录片，还真瞧不上这位崔先生了！,4
