page_index,movie_id,title,username,user_id,rating,date,time,comment,useful_count
0,25978207,那条河,Locky,226468245,推荐,2023-02-13,23:50:18,😭😭😭😭😭😭,0
0,25978207,那条河,呵呵！,150373340,力荐,2023-02-13,22:31:05,希望身边人一直都健健康康的,0
0,25978207,那条河,岚,168893340,,2023-02-13,20:58:18,我的心好像大润发的杀鱼刀一样冷了,0
0,25978207,那条河,Gezellig_,202767320,力荐,2023-02-13,20:57:44,【首看】,0
0,25978207,那条河,超hentai的樱子,258342274,力荐,2023-02-13,16:32:45,心疼,0
0,25978207,那条河,amélie_dlrr,147754729,还行,2023-02-13,13:44:28,太苦了这一生，才二十几岁已经不想拥有爱情了，一次又一次的伤害，也不羡慕这对，有毒,0
0,25978207,那条河,井果,242222415,力荐,2023-02-13,03:23:25,深夜听着势头正猛的雨声 逐渐被巨大的悲伤侵袭 亲爱的不要跨过那条江啊 泪水流也流不尽,0
0,25978207,那条河,豆友E_2eZk9WnA,250907358,推荐,2023-02-12,21:28:25,人在面对死亡时是多么无助。孤独好可怕。人生除死无大事,0
0,25978207,那条河,宓粒,151927045,力荐,2023-02-12,21:10:37,大概近几年我都没有勇气再看第二遍了，有些情绪就这样流进了身体里，然后从眼里流出，很难说清楚那种情绪究竟是什么，感动亦或是悲哀甚至还有恐惧和无奈，很多种情感交融在一起，在我沉寂已久的内心喷发，没有目的地，蛮横无理。,0
0,25978207,那条河,DONG,215810524,力荐,2023-02-12,20:42:44,“爷爷想念的时候也要忍住，我想爷爷的时候也会忍住。”,0
0,25978207,那条河,啊啊思琦,155492318,力荐,2023-02-12,16:04:43,这世间的爱情 本就很简单 骗自己的就是回忆 记着自己想记着的他 他也不是原来的他了 放他走吧 勉强不了不是吗 到老了以后简单的生活就是彼此 不应该有太多的勉强,0
0,25978207,那条河,Valkyrie,181517331,力荐,2023-02-12,11:10:40,从三十分钟开始一直哭,0
0,25978207,那条河,momo,226448321,力荐,2023-02-12,03:25:03,这才是爱情,0
0,25978207,那条河,兰牛碗杯,210479076,力荐,2023-02-11,21:44:39,爱意跨越一切,0
0,25978207,那条河,Azad。,199514319,力荐,2023-02-11,19:09:56,好好吃饭,0
0,25978207,那条河,月食,184253412,推荐,2023-02-11,17:27:38,很好哭😭😭😭😭,0
0,25978207,那条河,景致阑珊,156520860,推荐,2023-02-11,11:39:51,悠长人生和白首深情，都是岁月的善举❤️,0
0,25978207,那条河,悠陌酱i,187002762,力荐,2023-02-11,08:02:23,无数次为爷爷奶奶的爱情流泪,0
0,25978207,那条河,豆友212332955,212332955,力荐,2023-02-10,23:18:43,纪录片挺感人，B站的弹幕真烦人,0
0,25978207,那条河,嘻嘻西喜,224076357,力荐,2023-02-10,20:10:35,看完之后特别痛苦  旁观一个人变老死去真的不是一件容易的事  但是其实换个角度想想纪录片里的奶奶爷爷又何尝不是幸福的呢  老了之后还能保持一颗轻松愉悦的心真是难得  如果不能避免老去死去的话  那只能让自己的意识保持年轻了,0
0,25978207,那条河,你是我的禅,169893905,力荐,2023-02-10,18:13:41,相敬如宾，在一个四季分明的地方一起度过春暖花开，夏日蝉鸣，秋风落叶，白雪皑皑。就这样一起白首，这是多么幸福的一生啊。,0
0,25978207,那条河,marknzx,137426306,力荐,2023-02-10,15:12:08,生前内裤和内裤晾在一起，死了名字和名字刻在一起。到老了，所有的争吵不愉快都是过眼云烟。万幸自己没有选择一个可能大部分人认为“合适”的人，而是一个相爱的人。,0
0,25978207,那条河,煌煌阿栗,62841712,力荐,2023-02-10,13:04:50,再等等，会相遇的。,0
0,25978207,那条河,淮南枳,181156491,还行,2023-02-10,10:54:52,用一生呵护的爱情 质朴纯真 保持初心 一直幸福着 小不点…恭顺…对于独居的老人而言小动物真的是不可或缺的感情慰藉,0
0,25978207,那条河,🐳,230936098,力荐,2023-02-10,10:03:05,“当年我14岁，大雪纷飞时你来迎娶我。一晃眼七十多年，咱俩手牵手就这么过来了。而今又到了大雪纷飞的时候，你却不在了啊。爷爷啊，即便没有我也要好好过，脸要好好洗干净，要过的舒舒服服的。爷爷想我时要忍住，我想爷爷的时候也会忍住的。” 陪伴是最长情的告白,0
0,25978207,那条河,Sylvia,188182501,推荐,2023-02-09,23:38:49,在很想哭却哭不出来的时候，打开这部片像打开了我的泪水水龙头… 从爷爷突然开始气喘，晚上睡不着觉，不让奶奶关灯，半夜中醒来抚摸着奶奶的脸庞和头发，在这儿我就已经哭得泣不成声了… 如果很喜欢一个人，都会在ta睡着的时候认真端详ta的模样吧，可是如果知道这可能是最后一次，又如何让人不难过,0
0,25978207,那条河,现在想拉臭臭,130895494,力荐,2023-02-09,23:03:05,人的一生：生/////老病死,0
0,25978207,那条河,李狗蛋儿,142945145,推荐,2023-02-09,22:16:19,看完后内心无比平静，最令我羡慕的是垂暮之年还能有这样的感情，让我想起了当年在大学校园里见到的一对牵手散步的老人，是我理想中爱情的样子。,0
0,25978207,那条河,Tequila,venicebitchy,推荐,2023-02-09,17:22:24,当初看剪辑的时候哭得要死，现在看正片竟没有太大感触了，或许是已经预知了结局，又或许时长把我的情绪冲淡消磨掉了。,0
0,25978207,那条河,面喜杯,234055797,力荐,2023-02-09,13:12:02,这对爱情最好的诠释，两位老人互相理解，平淡的生活因为对方而有趣了，太美好了！,0
0,25978207,那条河,- 鞭子与提灯ッ,sijia_1997025,力荐,2023-02-08,23:19:30,“君埋泉下泥销骨，我寄人间雪满头”，哭死了。,0
0,25978207,那条河,Nancy,206194316,推荐,2023-02-08,22:43:37,"真美好啊
相信爱情，只不过不会发生在我身上",0
0,25978207,那条河,🎆,186763722,力荐,2023-02-08,22:31:18,哭到头晕，哭这份难得的感情，和对生老病死自然规律的无奈,0
0,25978207,那条河,i,158156755,推荐,2023-02-08,17:36:44,"当爷爷咳嗽以后就变成了奶奶走在前面领着他了。
结尾奶奶根本舍不得走，也许有爷爷的地方才是家吧。
",0
0,25978207,那条河,echo,176818299,力荐,2023-02-08,04:18:33,两个老玩童的快乐小生活，每个人都在接受最爱的人离开，或者先离开。,0
0,25978207,那条河,富士山下,201345195,力荐,2023-02-08,00:55:03,抚摸着膝盖的手是我爱你的最好证明,0
0,25978207,那条河,ふ,151866879,,2023-02-07,17:57:52,mm,0
0,25978207,那条河,小竹子,234041893,推荐,2023-02-07,15:05:45,人就像春天里的树叶，在夏天经历拍打，秋天就凋零飘落了。互相搀扶到白头是很幸福的爱情了,0
0,25978207,那条河,梦等屋,77282488,推荐,2023-02-07,14:07:09,能幸福走到白首的爱情，谁不爱呢？,0
0,25978207,那条河,木易。,188481972,力荐,2023-02-07,03:52:10,爱。,0
0,25978207,那条河,发条陳,lifepainless,力荐,2023-02-06,21:46:50,好羡慕啊。可惜我这辈子再也不能快乐起来了。,0
0,25978207,那条河,乖，摸摸头,230862268,力荐,2023-02-06,13:46:59,漫长的一生，有个人互相陪伴,0
0,25978207,那条河,不知道叫什么,165478648,力荐,2023-02-06,03:02:19,想哭的时候看看,0
0,25978207,那条河,树下听鱼,144303390,力荐,2023-02-06,00:58:08,“岂有生而不死者，岂有聚而不散者？”越长大才越觉得字字悲恸。人间的羁绊，难逃生离和死别，我要再爱身边的人多一些，再多一些。,0
0,25978207,那条河,小狗春天游泳,81469721,还行,2023-02-06,00:00:12,待到山花烂漫时，他在丛中笑,0
0,25978207,那条河,Corner Man,86023637,推荐,2023-02-05,23:49:24,很感人的一部纪录片，老奶奶和老爷爷生活中的点点滴滴让屏幕后面的我不知不觉间嘴角就露出微笑：老奶奶上厕所的时候，老爷爷就在厕所门口等着，唱着歌为老奶奶壮胆；在扫树叶和洗菜的时候，老爷爷就在旁边捣乱，和老奶奶玩成一团；老爷爷会摘下漂亮的花送给老奶奶哄她开心；每次出去，他们都一定会手牵着手；就连睡觉的时候，他们的手都经常牵在一起...这些片段中展现出来的真挚的爱太让人感动了。而后半段老爷爷身体变差，开始在生死线上徘徊的时候更是让人潸然泪下...不管多恩爱的恋人最终都会经历这个分别的时刻...最后老奶奶在老爷爷坟前说“我要回家了”，但是却三步一回头，最后直接坐在地上哭这一场景实在是太让人心疼了...不过他们这段75年的婚姻也是让人羡慕至极，“从那以后再没觉得孤单“，这份爱情真的太难得了。,0
0,25978207,那条河,w,219876789,推荐,2023-02-05,23:04:31,感情很真挚 现在应该都没有了吧,0
0,25978207,那条河,芥末汤圆,222935427,力荐,2023-02-05,22:33:26,最后五分钟，泪如雨下,0
0,25978207,那条河,豆友OmlMu2YWWY,265888130,力荐,2023-02-05,21:59:59,老小孩说的就是爷爷奶奶，她一遍遍提问，他一遍遍回应，眼里有了彼此，生活平淡却幸福，这就是爱情最好的模样，但后来小不点的离去，子女的吵架，衰老的无力……真实的打动了我，泪流不止，结尾奶奶的哭泣，深深共鸣，已不知如何细说。所以再看完后的第二天才写下这些感受。,0
0,25978207,那条河,宋子铖,200786137,力荐,2023-02-05,21:43:40,最沉重的爱，莫过于，一点一点看着对方渐行渐远，留下自己一人孤独地拥抱回忆,0
0,25978207,那条河,巨河马Éristel,162928229,力荐,2023-02-05,21:42:48,npy说五颗星，她哭爆,0
0,25978207,那条河,迅星,214830934,推荐,2023-02-05,20:21:23,其实比起泪点，笑点更多。老两口玩闹的时候就跟看到自己的爷爷奶奶在眼前一样，奶奶的童心特别足，爷爷都因此受奶奶感染。,0
0,25978207,那条河,Gotobedat11,usix,力荐,2023-02-05,17:57:49,人活一辈子究竟是为了什么,0
0,25978207,那条河,晶酱_酱晶,jeminiwang,力荐,2023-02-05,14:46:23,哭死,0
0,25978207,那条河,麦当劳星星罐头,70034154,力荐,2023-02-05,12:08:11,"我一直觉得，人只要善良，爱不爱的没那么重要。包办婚姻的爷爷和奶奶很难说当年是因爱结缘，但两个人都是太善良的好人，既然走到一起，就相濡以沫一辈子对对方好。
这俩人是哪怕快100岁了，都会把家里打扫一尘不染。住在江原道农村，家里没一点尘土。木柴整整齐齐码在墙角，衣服干净明艳，奶奶的蓝色小伞都带蕾丝花边。
生了12个孩子，6个或走失于战乱或死亡于疾病。老人预感自己将不久于人世，牵着手去集市上给孩子买保暖内衣，回家商量不管谁先走，天冷了，记得给孩子带衣服过去。
弥留之际，奶奶听说人会在火里重生，赶紧给爷爷烧几套干净衣服。又担心烧太多，爷爷路上行李太重。
因为他俩都是温柔善良的好人，所以才有这么温柔善良的人生吧。
那年冬天，你亲手娶我进家门；今年冬天，我亲手晒好你的寿衣。
76年的陪伴，下辈子再见。",1
0,25978207,那条河,蜉蝣般的运气,195134310,推荐,2023-02-05,10:33:52,相濡以沫，七八十年的相处，你在闹，他在笑，这便是爱情最好的样子了吧,0
0,25978207,那条河,Ricy,211121830,力荐,2023-02-04,23:10:32,平淡的爱情，后面哭了好久。,0
0,25978207,那条河,YXH,231765069,力荐,2023-02-04,20:59:28,"这是我们的以后
所以我们都要好好的
慢慢接受自己的普通与平凡
慢慢变老
一直在一起
下雨下雪都没关系
只要你在我身边
我们的爱会一直在
不要放弃
我在拼命的走向你
要牢牢抓紧我的手
抱紧我",0
0,25978207,那条河,致远,221874543,力荐,2023-02-04,16:18:11,爱的深沉,0
0,25978207,那条河,不想吃冰激凌,266612007,力荐,2023-02-04,11:47:44,"来世他们应该是一对信天翁。。。
最真实的爱情哪用得着那么多伎俩啊
现在也看不到这么至死不渝的爱情了",0
0,25978207,那条河,一块板砖,263197955,力荐,2023-02-04,08:47:35,人生尽头的静默和绵长柔情，真正的痛苦是没被诉说的，因为体会它们的人都选择了沉默不语默默承受,0
0,25978207,那条河,小俊没烦恼kkk,265728524,还行,2023-02-04,01:55:17,陪伴是最深情的告白，一起面对死亡是世上最美的勇气。生老病死人之常情，能淡定的面对死亡却不容易。,0
0,25978207,那条河,ZYFFF,214765154,力荐,2023-02-04,01:31:29,爷爷撑过了绵绵雨季，恭顺的宝宝在他身边转悠，仍爱着在战乱中死去的儿女。,0
0,25978207,那条河,深度,199850926,推荐,2023-02-03,23:37:24,晚上微弱灯光下的厕所再也不会传来爷爷明亮迟缓的歌声，奶奶再也摸不到爷爷温暖的大手，奶奶很疼的膝盖再也没有了爷爷的摩挲……人生就像一场花季，花开花落。娇羞可爱的奶奶遇见了善良温柔的爷爷，一起手牵手陪伴着彼此睡觉、吃饭、过生日、扫落叶、打雪仗、上山、去医院……爱情本没有那么立体，只是生活让一点一滴形象了起来。,0
0,25978207,那条河,Yeliz,Cy0146,力荐,2023-02-03,21:48:10,"哭得稀里哗啦
奶奶给死去的六个孩子买内衣物的时候，嘱咐爷爷要是他先走了记得带给他们，记得每一个人的名字，哭到泪崩
看着儿女因为赡养父母吵架甚至要动手的时候，两个老人在身后无奈心痛哭泣，儿女看不到只知道争个“谁照顾的更多更好”的输赢，好难受好难受
两个人去埋小不点的时候，依偎在一起爷爷抚摸奶奶的头的时候，奶奶上厕所要爷爷陪在外面不准他走要他给她唱歌的时候，两个人像小孩一样打闹的时候……怎么可能不为这样一份感情动容😭
",1
0,25978207,那条河,慕紫Rhealy,168859033,力荐,2023-02-03,19:49:46,愿有一人共白头,0
0,25978207,那条河,Yoo,144767616,力荐,2023-02-03,13:59:32,看完没了半包纸巾！！！！,0
0,25978207,那条河,Twilight,233537701,力荐,2023-02-02,22:06:53,爷爷先去前边引路，下辈子还要14岁就跟奶奶在一起，陪她扫树叶，牵她的手，为她唱歌，穿情侣装，下辈子也要那样幸福，不会走散的，一定不会。,0
0,25978207,那条河,！！！,244416114,力荐,2023-02-02,16:13:11,"14岁的时候她遇上了相守一生的人，观影中我看见了老年人中最幸福的相守，也是我心之所向的相守。看着年老的他们打雪仗，奶奶扫树叶，爷爷在捣乱，后来奶奶也开始捧着树叶扔向爷爷，看着奶奶洗着爷爷想吃的小菜，爷爷在高处给奶奶泼水捣乱，奶奶洗完菜回去，也拿出一个盆子朝爷爷泼回水去。他们之间的相处真在平淡的生活中感觉到那一点一滴的幸福。
他们从来没有吵过架，一直穿着情侣衣，奶奶上厕所很害怕，爷爷在外面给她唱歌。很喜欢看见奶奶凑近爷爷的耳朵说话，认真的看着爷爷。爷爷会认真的听奶奶的话，奶奶要他做的事情他都会去做。也许最终的走向是爷爷先去，但是我想他们这一生得一人陪伴到最后，已经是幸福。
",0
0,25978207,那条河,木 木子呀,Muziya0194,力荐,2023-02-02,09:50:20,“奶奶有一次说电视里的柿饼看上去真好吃啊，一转头找不见爷爷了，原来他跑去给奶奶买柿饼了”,0
0,25978207,那条河,荼毒,121540460,力荐,2023-02-02,01:17:38,"76年的相濡以沫～真的好幸福啊❗️
人老了，好像就要时刻为离别做准备，98岁的爷爷去医院，医生说：“人老了，就这么平安的过吧，吃什么药都没用了……”，看完没有感伤，也没哭，更多是羡慕，人生能得一人，相伴走向谢幕的时刻，真的太美好了，人生天地间，如白驹之过隙，忽然而已～",0
0,25978207,那条河,momo,209275688,力荐,2023-02-02,00:28:33,真实的纪录片的共情程度真的和架空影片有点不在一个level上 看完哭得头痛,0
0,25978207,那条河,逃跑的太阳,yangwenxing,力荐,2023-02-02,00:14:08,会想到自己的亲人，想到亲人离世的场景。,0
0,25978207,那条河,Natasha_ii,253145056,推荐,2023-02-01,22:06:50,感到很舒服，再平静，后叹息,0
0,25978207,那条河,是小李啊,265227001,力荐,2023-02-01,21:13:43,可能这就是爱情最好和最真的模样。14岁相遇，相伴79年，经历沧桑岁月，到老还是会像小孩子一样嬉笑打闹，玩树叶，打雪仗，而最重要的是互相愿意陪对方做这些事儿。在他们仅有的时间里，除了自己的老伴，没有其他任何顾虑和担心了，只是想时时刻刻陪伴着对方啊。后半段暴风哭泣，千里孤坟，一步三回头啊。感动之余，唯有羡慕。,0
0,25978207,那条河,扶桑花妹子,154346741,推荐,2023-02-01,20:03:06,养老真的是个问题，夫妻恩爱相互扶持才是真。妈妈生日孩子还吵架，唉，也是心酸,0
0,25978207,那条河,鹤冲天柳永,217446726,力荐,2023-02-01,17:44:14,"“爷爷如果想我要忍住不要哭，我想爷爷也会忍住不哭。”
千里孤坟，三步一回头。

感谢这部纪录片，我终于明白爱意不可用利益做计量，也不能把自己生活中的不如意发泄在爱自己的人身上。",0
0,25978207,那条河,妖精你往哪里走,3306920,力荐,2023-01-31,23:29:52,年前最后一个工作日，在小小会议室里哭到心碎。亚洲人缺失的’死亡‘教育，是真的不浪漫但很戳心,0
0,25978207,那条河,欧阳殉,177351107,推荐,2023-01-31,23:27:45,叹息之余，唯有艳羡。,0
0,25978207,那条河,🌊,200614898,推荐,2023-01-31,19:59:46,跳着看的，不能在一个场面停留太久，眼泪真的说不由自主的流下来，可能是我也代入自己了吧。想到了自己的爷爷奶奶爸爸妈妈，所有人都会老去，而青春却只有这么几年，好不公平。 上一个这么哭的电影还是忠犬八公… 无法想象70多年…这是一个什么概念。,0
0,25978207,那条河,@XMumu,180889069,力荐,2023-01-31,18:13:25,爱情的典范，硬朗的体魄很重要。爷爷你想我的时候忍耐一下，我想你的时候也会忍耐的。奶奶独自一人不舍得离开爷爷的墓，不停的回头回头，最终还是停下来放声痛哭，我也泪流不止！,0
0,25978207,那条河,吃鱼且没刺66,207356522,推荐,2023-01-31,17:11:08,2023.1.31,0
0,25978207,那条河,我会在,226567243,力荐,2023-01-31,02:38:30,人生必看,0
0,25978207,那条河,啊啊啊啊啊阮,232248474,力荐,2023-01-31,00:22:21,因为我今天本来就不是很开心，所以选择了这部电影看了一下。前面哭的太多了，后面分别的时候我反而平静，但是到最后我看到老奶奶一个人无助的坐在那里哭的时候，我在一次潸然泪下。,0
0,25978207,那条河,童忌失心,164842052,还行,2023-01-30,23:07:35,有点无聊……… 看了开头十几分钟和结尾爷爷去世的那一段，可能还没到看的年纪。每个人都是向死而生的，想象爷爷奶奶是自己，到老了能和另一半一直相濡以沫；想象爷爷奶奶是我的女儿，如果她老了也依旧能像她现在一样充满童趣，无忧无虑那我该多么开心。唯独想象不了爷爷奶奶是自己的父亲和母亲，无法拥有那种代入感，可能是在自己童年永远充斥着父母亲的吵闹声，以及父亲对母亲的嫌弃，母亲对父亲的抱怨。,0
0,25978207,那条河,初冬晚夏,172874984,推荐,2023-01-30,21:59:15,时常觉得爱是如此容易消散，却真能爱一个人一辈子吗,0
0,25978207,那条河,马马嘟嘟.,131502887,力荐,2023-01-30,20:40:57,"这世界所有的痛苦 无非就是生离死别
这一世没爱够的人 下一世还要遇见. 

“我从来都不怕死亡 也知道这天终将到来 我一直为这天做准备 可是我接受不了死亡把我们分开.”",0
0,25978207,那条河,TFBOYS-蔡徐坤,179816814,推荐,2023-01-30,20:22:16,爷爷奶奶穿着情侣装真的好可爱啊！或许现在许多年轻人都不如他们两个浪漫天真，不如他们爱对方爱生活。,0
0,25978207,那条河,LIACOLM,197599000,力荐,2023-01-30,20:13:05,九十岁还会一起牵着手散步，采花，打雪仗，唱歌跳舞……这样的人是遇不到了。,0
0,25978207,那条河,Neroli🍊,181882798,还行,2023-01-30,19:52:44,发现了 本人对这类题材确实不感兴趣…在满屏“哭死了”以及“好羡慕这样的爱情” 时我的心情只有无动于衷…感觉本人已经到了对爱情不再抱有期望的阶段🤯（纪录片拍的还是很好的 是我自己的问题 传统的爱情叙事已经不再能触动我了,0
0,25978207,那条河,今天也想见到你,81415356,力荐,2023-01-30,12:37:36,和喜欢的人一起看了这部电影。,0
0,25978207,那条河,林阁呈,Bellerreading,推荐,2023-01-30,11:21:15,他们有穿不完的情侣装，要一直牵着手啊,0
0,25978207,那条河,。,77900159,推荐,2023-01-30,08:29:50,这就是执子之手与子偕老，但不喜欢子欲养而亲不待这个场景，毕竟老爷爷98高龄了，大儿子此时此刻才哭诉以前做的不好！,0
0,25978207,那条河,采芹,147780133,推荐,2023-01-29,22:04:39,生命总是这样，但我不愿意接受最终老去这种方式,0
0,25978207,那条河,voldenuit,157249547,,2023-01-29,03:16:07,看来我是真的不喜欢平平淡淡的生活,0
0,25978207,那条河,一吨星,181414435,还行,2023-01-29,01:06:33,我共情的片段竟然是奶奶生日时儿女差点动起手来的争吵，害，氛围营造的再美好终究也逃不过家家有本难念的经。,0
0,25978207,那条河,Agoni～,260053449,推荐,2023-01-28,18:57:42,说实话，看完之前不知道怎么说这个电影，感觉闷闷的，爷爷奶奶的爱情很令人向往，可，儿女的做法也挺令人心寒的。有时候在想，人活着到底是为了什么,0
0,25978207,那条河,གཡུ་མཚོ། 玉错,181458244,力荐,2023-01-28,16:23:25,您14岁，雪花漫天飞的一天，你笑着嫁给了爱情，您89岁，大雪纷飞的一天，您哭着送走了一生的挚爱，漫长的一生，你们相濡以沫，让人再次相信了爱情… 从此没有人因为您怕黑而唱歌，没有人半夜摸摸您的耳朵，表达对您的爱，没有人按摩您疼痛难忍的膝盖，从此一个人，但不怕心里有他一生的爱意，且满满的…有那么多的子女，最后好像真正希望对方活久一点的只有彼此而已吧… 哭了几次 真的太难过了 … ,1
0,25978207,那条河,Kai,64768270,力荐,2023-01-28,12:06:36,在战乱吃不饱的日子，在生了12个孩子最后只剩6个之后，两位老人仍然对生活充满热情和爱。每天穿着颜色鲜艳的情侣装，干活时与对方嬉戏，捡了两只小狗养着每天都逗狗，每天牵着手谈着过了75年还不会退却的爱情。生而为人，很多事情是无法自己决定的，能做的只能是把生活过下去，让生活开出花来。,0
0,25978207,那条河,巴岛虾片,211833343,力荐,2023-01-28,04:12:23,「爺爺先去前邊兒引路了，他來帶路我就抓著他的手，穿上湛藍藍的情侶褲裙，黃色的上衣，手牽著手一起走吧。」,0
0,25978207,那条河,🍤,218394797,还行,2023-01-28,00:09:18,期望太高,0
0,25978207,那条河,归零超载,185901164,推荐,2023-01-28,00:01:18,这出戏，也名为你我他,0
0,25978207,那条河,憨人,173243783,力荐,2023-01-27,23:47:18,原来无奈和离别会伴随着我们的一辈子,0
0,25978207,那条河,只想听到你说,173204195,,2023-01-27,22:17:13,①山清水秀，风景优美，人也是。②哪怕再过50年，我也难对“死亡”释怀。,0
0,25978207,那条河,柠檬味的大贝儿,139167744,力荐,2023-01-27,21:39:30,感受到了爱情的美好,0
0,25978207,那条河,hhhgfssc,178193610,推荐,2023-01-27,18:01:28,能相伴至暮年的感情啊,0
0,25978207,那条河,六丑,174549024,很差,2023-01-27,16:56:57,假情假意,0
0,25978207,那条河,羊角蜜,130612478,推荐,2023-01-27,15:25:49,因为最近正好在看《一个人去死》这个漫画，所以以为自己一开始会很难进入。尤其看到中间那段子女吵架的地方，更是觉得窒息，这家庭真的太东亚了……不过看到后面爷爷去世那段还是哭了，导演想要的效果算是达到了，氛围烘托得很成功。真挚的情感果然还是很动人。,0
0,25978207,那条河,momo,166619222,还行,2023-01-27,15:20:57,看的有点困…,0
0,25978207,那条河,逻各斯,179798848,力荐,2023-01-26,21:15:40,哭得稀里哗啦,0
0,25978207,那条河,PatriciaL_U,225973976,力荐,2023-01-26,21:12:47,好深刻的纪录片 也许是我从小就看着爷爷奶奶相依相偎的幸福 又从小就缺失母爱 所以我一直对爱情保持怀疑 但是这部纪录片里就是真实的爱情影像 这份爱情是极其值得尊敬的 在他们身上看不见岁月磨灭爱的痕迹 但柴米油盐 家人吵架 病痛缠身这种现实的问题也一一浮现 他们年事已高还能打打闹闹 玩雪洒落叶 依偎着去医院去旅游团 在彻夜难眠的时候悄悄凝视她的面容 不舍 心酸 一下涌上了心头,1
0,25978207,那条河,稻草支架,230159898,力荐,2023-01-26,20:59:35,曹尼玛太好哭了,0
0,25978207,那条河,阡千陌,170855865,还行,2023-01-26,20:51:22,"2022.1.26
这样的相扶到老像奇迹一样，但是影片对这份奇迹的展现极度依赖我的脑补和想象。
《四个春天》只给了四星，它到不了，但也不止三星而已。",0
