page_index,movie_id,title,username,user_id,rating,date,time,comment,useful_count
0,25867012,追鹰日记,词不达意,247899922,推荐,2022-07-01,20:41:46,"鹰妈妈失去了她的英雄，鹰宝宝失去了他们的父亲。
    生存开始变得异常残酷，鹰妈妈只有能力养育一个宝宝，并把他培养成天空的王子。
    鹰妈妈忍痛飞离了巢穴，留下兄弟两个自己决择。聪明的鹰宝宝们感觉到了异样，稍显强大的哥哥终于把弟弟踢下了悬崖。
    曾经的小王子，从此遗落在亲人、巢穴和天空之外。",0
0,25867012,追鹰日记,豆友188234357,zm19940101,,2022-08-23,04:12:27,"学会与过去和解,学会与自己和解",0
0,25867012,追鹰日记,鹳鱼石斧,47477270,力荐,2022-06-16,21:28:30,爱是，在他受伤无助时传递余温，是他遭遇危险时赶来解厄，是千方百计激活他的天性，是牵挂着却放手盼他自由……小男孩真是美好的存在。败笔在，雕兄为什么要吃狐主任？两个动物都爱,0
0,25867012,追鹰日记,momo,183013464,力荐,2022-06-13,12:59:50,壮丽的风景和温暖的故事,0
0,25867012,追鹰日记,Myrain,141830057,推荐,2022-06-10,23:06:06,还行,0
0,25867012,追鹰日记,海怡TV,CHICHARITO_KC14,推荐,2022-06-07,19:00:36,很好奇动物的画面是怎么拍出来的,0
0,25867012,追鹰日记,王来福,3555700,推荐,2022-06-02,23:52:31,养过小动物的人都知道，她们都认得你。,0
0,25867012,追鹰日记,豆豆角,222488896,还行,2022-06-01,08:24:53,这和谐的场面，真好看。,0
0,25867012,追鹰日记,mary,214636118,力荐,2022-05-31,20:32:39,腾讯视频，动物题材温馨可人，爱了。,0
0,25867012,追鹰日记,新斯科舍下的蛋,88578435,推荐,2022-05-28,20:29:39,想过这样的生活 @2020-02-02 22:41:34,0
0,25867012,追鹰日记,唯它柠檬茶,NBCS,力荐,2022-05-23,12:53:10,唉。,0
0,25867012,追鹰日记,白原什么都没有,169556262,推荐,2022-05-11,20:02:10,鸟届的狮子 ,0
0,25867012,追鹰日记,susieshinely,4283594,推荐,2022-05-07,02:12:02,非常适合和家里小孩一起看的一部电影,0
0,25867012,追鹰日记,青苔,Talentstudio,力荐,2022-05-04,20:54:14,太喜欢。,0
0,25867012,追鹰日记,admin,shishusiqi,推荐,2022-05-02,21:29:08,风景绝美，搞得我都想抛弃一切抛弃阿尔卑斯山脚搭个窝棚过一辈子了。之前也看过一部海蒂与爷爷，也是阿尔卑斯山区的生活，风景绝美啊,0
0,25867012,追鹰日记,gracy,128260288,还行,2022-04-21,19:06:23,7 摄影极美 从鹰的视野俯瞰阿尔卑斯山,0
0,25867012,追鹰日记,Arielnevermind,174125386,还行,2022-04-21,18:40:02,风光有多壮丽，剧情就有多平庸,1
0,25867012,追鹰日记,Free Carrot,53401565,还行,2022-04-17,21:32:06,下辈子我也想做一只在阿尔卑斯山脉自由翱翔的雄鹰。,0
0,25867012,追鹰日记,我的荒謬,143225973,推荐,2022-04-14,14:04:21,鹰之路 TM蓝光,0
0,25867012,追鹰日记,天天快乐,248163940,还行,2022-04-09,19:50:18,看完后，第一次觉得老鹰如此cool，和娃一起当纪录片来看，阿尔卑斯山的风景一如《海蒂》里的美景，让人沉醉,0
0,25867012,追鹰日记,梦想家Lily,lily-monica,还行,2022-04-04,20:20:42,看了一场温馨版的动物世界~,0
0,25867012,追鹰日记,嘟嘟,198840530,推荐,2022-03-30,23:54:11,雄鹰习惯了饭来张口的日子，忘记了飞跃的本能，做走地鸡的日子实在太萌太可乐，,0
0,25867012,追鹰日记,御良,131645217,推荐,2022-03-27,00:47:23,好可爱呀！！,0
0,25867012,追鹰日记,犇犇,156171507,力荐,2022-03-25,23:02:22,适时放手，才能获得自由,0
0,25867012,追鹰日记,叙尔特岛沙滩椅,169220188,推荐,2022-03-24,13:21:30,阿尔卑斯山的景色真美！少年和鹰共同成长的故事，很温情的故事，很难得的角度，很清新的森林，很翠绿的画面,0
0,25867012,追鹰日记,陈童学,152728807,推荐,2022-03-23,22:53:39,敬畏生命，爱它就给它自由,0
0,25867012,追鹰日记,跳跳鱼,49589129,推荐,2022-03-23,22:47:26,这些镜头太美了吧～所有动物也都是有人性的 很温暖,0
0,25867012,追鹰日记,薛薛,217315576,推荐,2022-03-23,13:19:34,唯美的纪录片,0
0,25867012,追鹰日记,生更至力,201993349,推荐,2022-03-22,16:35:39,你要的星星，在哪呢？,0
0,25867012,追鹰日记,仓郡,4345004,还行,2022-03-21,14:16:34,阿尔卑斯山的绝美风光,0
0,25867012,追鹰日记,violetta0029,83389087,推荐,2022-03-20,22:49:20,让我想起了另一部有关少年、成长的电影，《给我翅膀》。阿尔卑斯山的景色是那么清冷，美丽。看了后记深刻了解了此类影片（有关动物）拍摄的艰苦和危险。,0
0,25867012,追鹰日记,有人喜歡藍～M,FIONAMOK,还行,2022-03-20,21:06:10,阿尔卑斯山美景如诗如画……,0
0,25867012,追鹰日记,Freya Sonor,156903673,推荐,2022-03-20,18:34:56,这美轮美奂的阿尔卑斯山风景 简直就是旅游宣传片 欧洲人太会拍人与动物的电影了,0
0,25867012,追鹰日记,幼儿园第一园霸,204745735,还行,2022-03-19,23:31:06,风景美如画，这辈子要和爱的人一起去看看这样的大山大川。,0
0,25867012,追鹰日记,紫茎泽兰,45926987,推荐,2022-03-19,21:19:35,希望与信念是个好东西。,0
0,25867012,追鹰日记,格雷西,2741071,推荐,2022-03-19,19:56:04,剧情薄弱，但是阿尔卑斯的风景真的太美了。看别人评价说当作纪录片来看，那倒是不错的。,0
0,25867012,追鹰日记,waterinwater,waterinwater,推荐,2022-03-19,17:28:09,为信念追求，不要放弃信心，不要放弃希望,0
0,25867012,追鹰日记,丫小丁,twetwo,还行,2022-03-19,12:55:10,风景很美，动物很可爱，拍摄有难度,0
0,25867012,追鹰日记,跑跑跑火车,151897699,,2022-03-18,23:49:31,太美了,0
0,25867012,追鹰日记,林雨,boylinyu,推荐,2022-03-18,23:48:48,在巨大自然面前，每个种群都是孤独的，都要活下去。忘记过去，选择自由，努力向前。,0
0,25867012,追鹰日记,Hermione,228495615,推荐,2022-03-18,23:46:14,"带剧情的discover纪录片
一为风景
二为动物
三为鹰与人
",0
0,25867012,追鹰日记,金嘤嘤,59544952,推荐,2022-03-18,22:44:35,/731/1202,0
