page_index,movie_id,title,username,user_id,rating,date,time,comment,useful_count
0,25867012,追鹰日记,神神叨叨的魚,165708730,推荐,2023-01-28,23:41:02,风光很美 各种小动物很可爱 不清楚是怎么拍摄的鹰的那些事情,0
0,25867012,追鹰日记,李荣春,lester.l.c,推荐,2023-01-25,21:20:07,童年.成长.雄鹰,0
0,25867012,追鹰日记,西西胡,168231364,推荐,2023-01-19,22:00:18,母鹰是哪里找的?介绍一下就好了。,0
0,25867012,追鹰日记,豆友7765350507,258850159,推荐,2023-01-10,01:09:01,"“告剔过去
相信命运可以改变
生命之书
由我们自己撰写”",0
0,25867012,追鹰日记,野云飞,79887691,还行,2023-01-08,22:58:54,画面确实不错，阿尔卑斯山风光片，剧情也就一星了,0
0,25867012,追鹰日记,真不是我没6,60078527,推荐,2023-01-05,19:47:41,真实拍摄和动物的镜头加一星，剧情很弱，父子线可以不要，孩子和鹰的链接也若有若无，反到是护林员和孩子链接还强一点，不过除剧情外，阿尔卑斯山实在是太好看了，摄影团队辛苦了。,0
0,25867012,追鹰日记,紫玥,213659899,力荐,2023-01-02,21:52:35,一个少年，一只鹰。震撼心灵的实地拍摄。相信命运会有奇迹。生命之书，由我们自己撰写！,0
0,25867012,追鹰日记,东方太甲,jarsmart,推荐,2023-01-02,10:47:25,老外总是能把这一类片子拍出哲学道理！,0
0,25867012,追鹰日记,Bluer,192852199,推荐,2023-01-01,22:47:40,挺好的一部动物与人的片子，我喜欢,0
0,25867012,追鹰日记,拥抱鳄鱼,HorusInYellow,推荐,2022-12-28,21:33:26,大自然残酷而不残忍,0
0,25867012,追鹰日记,棋崽崽,261184884,推荐,2022-12-28,21:10:57,阿尔卑斯山好美,0
0,25867012,追鹰日记,Yukino,216882806,力荐,2022-12-28,15:19:32,鼓起对抗命运的勇气，现在你自由了。,0
0,25867012,追鹰日记,weeland,weeland,推荐,2022-12-25,16:58:06,我们之间并没有好 缝隙还在,0
0,25867012,追鹰日记,丁香,79597767,推荐,2022-12-23,23:22:54,风光旖旎，动物世界真实可爱，每一个画面都可以做桌面,0
0,25867012,追鹰日记,Trick or treat,168522799,推荐,2022-12-20,15:25:40,剧情其实并没有什么亮点，但是摄影确实很不容易，风景一流,0
0,25867012,追鹰日记,无糖可乐不加冰,175158301,推荐,2022-12-17,21:09:41,"人类应该搞清楚
人类和所有生物一样
只不过是地球的共同居住者
与世间万物共享着一切
真正的尊重和自由
并不是违背天性的圈养
是懂得适时地放手 回归自然

历时几年的拍摄 影片的角度更像纪录片一样写实
少年与鹰的共同成长更显得真诚
少年最终取下亚伯脚环说永远自由那一刻
是令人动容的成长
人与自然和谐共生的最好诠释
致敬拍摄组历经艰难苛求真实的精神！",0
0,25867012,追鹰日记,风筝2013,146014639,力荐,2022-12-13,09:52:48,"实在喜欢阿尔卑斯山的风景……
鹰，被哥哥赶出窝，弱小的不能自食其力，被男孩救下来……
男孩，因为玩火，烧毁了家，烧死了妈妈，一直心里过不去那个伤，尤其是得不到父亲的原谅……
于是，鹰和男孩，互相陪伴，互相慰藉，互相玩耍，邻居大叔特别好，教会男孩训鹰，教会男孩勇敢，教会男孩什么时候该抓住什么时候该放手，终于，有一天，鹰和哥哥和解，男孩和爸爸和解，并各自成长，自由……",0
0,25867012,追鹰日记,郑shooting,84797127,推荐,2022-12-12,21:10:00,"开始还以为是纪录片呢
阿尔卑斯山脉的风景美如画
自然越是美丽越是残酷",0
0,25867012,追鹰日记,赵旭丹,198358525,力荐,2022-12-12,06:19:52,鹰的蜕变,0
0,25867012,追鹰日记,听海,53366599,还行,2022-12-10,19:25:51,剧情简单，当纪录片看。影片拍摄应该挺不容易的,0
0,25867012,追鹰日记,金色的东西,VAK9495969798,还行,2022-12-08,23:07:22,"男孩与鹰的邂逅
(1:37:57)",0
0,25867012,追鹰日记,可可,119116462,力荐,2022-12-08,15:05:18,成长就是永不放弃希望！,0
0,25867012,追鹰日记,你们都是幻觉,245675465,力荐,2022-12-08,14:22:32,大自然残酷又美丽，好多镜头在纪录片里都没有见过。,0
0,25867012,追鹰日记,你好哇,153573464,推荐,2022-12-07,16:01:51,出仓时间看这个，冥冥之中自有安排。心结的解开，需要相似的灵魂和境遇。我明白了为什么我喜欢看大自然和动物，他们如此真实，严格遵循自然法则。,0
0,25867012,追鹰日记,光明王后,133258798,还行,2022-12-06,22:13:12,光看影片名字以及出品方的名字（奥地利地球母亲工作室），就知道是个动保片。反正一本正经地说教，挺无聊的。,0
0,25867012,追鹰日记,吃吃喝喝玩玩,217825093,还行,2022-12-06,18:38:04,景色美,0
0,25867012,追鹰日记,mkiuytewqqsh,63917882,还行,2022-12-05,22:52:38,更像是风景片。拍得真美啊，还是真鹰拍得,0
0,25867012,追鹰日记,何金武,144497283,推荐,2022-12-05,21:57:11,四星全部给纪录片团队,0
0,25867012,追鹰日记,溪边的人,lzd95,力荐,2022-12-05,21:21:06,阿尔卑斯风光堪称绝世的壮美，鹰兄弟争斗的场景很难得，诚然故事线很细碎，但在这部电影里，人，本就不是主角。,0
0,25867012,追鹰日记,曾儿,205366163,推荐,2022-12-05,20:02:07,我是当纪录片看的。感叹于那样的拍摄环境。那得是怎样的专业和热爱。,0
0,25867012,追鹰日记,夏天的尾巴,xiaoxiaosudisco,力荐,2022-12-05,19:43:16,即使不是最漂亮的 最强壮的 最聪明的 每个生命都有权利活 和被爱（好想去阿尔卑斯山生活）,0
0,25867012,追鹰日记,呆呆,185655954,力荐,2022-12-05,17:02:47,阿尔卑斯山的风景，少年与鹰的成长，都很治愈,0
0,25867012,追鹰日记,Mia,46146656,还行,2022-12-05,12:39:00,景色绝美，让疫情中终日宅家的人更加向往远方,0
0,25867012,追鹰日记,大笨象西睿,171707539,还行,2022-12-05,10:29:21,有点像纪录片啊,0
0,25867012,追鹰日记,我是_Marco_是我,85440450,力荐,2022-12-05,09:38:30,画面很美,0
0,25867012,追鹰日记,子霖💙,122939101,还行,2022-12-04,22:03:25,1.主线是男孩和鹰的相遇和彼此各自都获得的成长，交叉剪辑。副线是男孩和讲述人护林员、父亲的矛盾（但有些刻意，讲得不极致）。2.鹰的前史：它的家庭地位、鹰王父亲去世、哥哥把它推下悬崖的过程，都是按照人的逻辑去进行的画面分镜讲述，是一个特色。2自然部分摄影堪称bbc自然纪录大片水准，是另一个特色。,0
0,25867012,追鹰日记,且相忘于江湖,36022989,还行,2022-12-04,21:35:28,人类部分的故事讲得支离破碎，摄影立大功。其实这个摄影水平不如直接拍成自然类……,0
0,25867012,追鹰日记,蜜糖馅饼,64535804,推荐,2022-12-03,20:30:32,好美,0
0,25867012,追鹰日记,可爱因子,209408780,较差,2022-12-03,20:25:04,阿尔卑斯山脉美伦美奂，把人物戏份去掉就值那个分数了。,0
0,25867012,追鹰日记,并非三月剧粉,200206159,推荐,2022-12-03,17:02:20,少年和鹰，少年和父亲，讲述人。梦换般真实存在的大山里，镜头语言，上演着，鹰和少年的成长与自我救赎。惊心动魄的动物世界，一个多小时，沉浸在他们的世界。片尾上了价值，人的一生不能失去信念，即使路途艰难险阻，也一定要负重前行，勇往直前。。。,0
0,25867012,追鹰日记,Herbert,190795858,推荐,2022-12-03,13:49:55,纪录片形式的电影，乏味的剧情，绝美的自然风景。,0
0,25867012,追鹰日记,德布罗意,260444057,推荐,2022-12-03,01:00:38,风景很好，不过剧情党劝退。,0
0,25867012,追鹰日记,神级博派,234747922,推荐,2022-12-03,00:23:20,风景片，治愈片。内涵不足，但拍的不错,0
0,25867012,追鹰日记,缰绳下的云和海,210130499,推荐,2022-12-03,00:17:58,雏鹰与少年，在壮美的阿尔卑斯，共同成长。人物情节简单，更像是一首优美的散文诗。,0
0,25867012,追鹰日记,猫,211760319,较差,2022-12-03,00:13:18,"风景很好，想去雪山脚下当个护林员，没了。
故事讲得向粑粑",0
0,25867012,追鹰日记,树语,15941963,还行,2022-12-02,23:59:24,叙述方式有点单调。景色挺好，然后呢？有点像动物世界。,0
0,25867012,追鹰日记,MondaySyndrome,189192535,力荐,2022-12-02,23:54:32,原来一部好的电影是不会犯母语尴尬症的；以为会上演一场鹰王大决战，被一句：勇气也是会被尊重的看穿了狭隘，动物中哪儿有那么多后宫戏。拍摄组经过里漫长的拍摄期，在长达四年中拍摄到了很多珍贵的镜头 好好看！两只鹰绝对最佳,0
0,25867012,追鹰日记,东子,145797338,力荐,2022-12-02,23:54:05,5星送给制作组。还有，我见识了鹰跑起来 那飒飒的小短腿，绝了。,0
0,25867012,追鹰日记,望道,239267502,推荐,2022-12-02,23:52:31,6台的晚间场电影都不错，这部唯一的问题就是“该隐”拍的跟反派是的，但大自然本身就是适者生存，亚伯是幸运的。该隐也没有错。,0
0,25867012,追鹰日记,dhdkcon,190455859,还行,2022-12-02,23:50:36,喜欢动物和景色，但除此以外都不太行,0
0,25867012,追鹰日记,SmallLady。,161296448,还行,2022-12-02,23:44:13,with 爸爸,0
0,25867012,追鹰日记,chen,169107506,还行,2022-12-02,23:02:45,感觉cctv好想让我们去关注大自然呢,0
0,25867012,追鹰日记,奈妃尔田田,209633181,较差,2022-12-02,22:50:13,好傻逼的开头😁,0
0,25867012,追鹰日记,未见得,151886021,还行,2022-11-30,19:25:11,纪录片式的。阿尔卑斯山脉比剧情震撼，动物比人类有灵性。,0
0,25867012,追鹰日记,湖北阿甘,185418662,力荐,2022-11-28,21:41:20,"这是一部令人震撼的电影，全部是实景拍摄，据说跟拍了6年。悬崖上，鹰捕猎大自己好几倍的羚羊，这一幕，是我印象最深刻的。

鹰翱翔天空，穿越众山之巅，这种特写镜头是如何取到的，太神奇了",0
0,25867012,追鹰日记,Keep.,155239747,推荐,2022-11-27,20:14:36,景色一绝 ,0
0,25867012,追鹰日记,gira,shirogane,推荐,2022-11-27,17:18:42,星星都是给金雕（以及其他动物）和风景的……想说叙事仍然跳不出雄性人类的惯性思维，圣经里兄弟相残的故事并不适用于金雕吧，而且你怎么知道一定是兄弟捏🙄,0
0,25867012,追鹰日记,李凌宇Lee,99049039,力荐,2022-11-27,16:22:33,鹰的成长，也见证孩子的成长,0
0,25867012,追鹰日记,彼夏凉初,127088712,推荐,2022-11-27,08:33:15,自然界物竞天择，人间大爱无疆。,0
0,25867012,追鹰日记,小疯子鲁锦锦,zong13012661680,力荐,2022-11-26,13:06:37,好看，很难拍吧，毕竟鹰不接受人的安排,0
0,25867012,追鹰日记,咸的香菜馅,232954843,力荐,2022-11-26,10:58:19,陪伴，成长，救赎，自由，延续。整部电影温馨治愈。,0
0,25867012,追鹰日记,树🍏,208392462,推荐,2022-11-24,13:42:19,在人的一生中，你要为你所信奉的东西而不停奋斗，绝对不能失望 也绝对不要对自己失去信心,0
0,25867012,追鹰日记,忘乎君,61722815,力荐,2022-11-23,22:42:56,"小鹰长成，需要教育和陪伴
但更多的是激发自身的力量",0
0,25867012,追鹰日记,爱读书的熊,bearlovebook,推荐,2022-11-20,19:09:39,不是电脑做的哇，那真挺好,0
0,25867012,追鹰日记,代表月亮消灭你,204058701,推荐,2022-11-19,08:53:23,这是一部互相救赎，彼此依靠的电影，男孩和鹰都在成长中进步，雄鹰必将展翅高飞，它有它的生活法则，男孩也明白了爱是放手，是自由的。,0
0,25867012,追鹰日记,John,149999910,力荐,2022-11-19,00:41:10,喜欢静谧的电影,0
0,25867012,追鹰日记,九尾啾~,183590316,推荐,2022-11-18,02:58:14,看到后面居然哭了~,0
0,25867012,追鹰日记,樱凝,264052568,力荐,2022-11-17,14:07:03,真的好喜欢这部，场景真实，记录实景,0
0,25867012,追鹰日记,莫挨老子,172503864,,2022-11-16,12:00:41,居然看过忘记了,0
0,25867012,追鹰日记,月与灯依旧,228201467,推荐,2022-11-16,06:23:37,六年拍摄，值得敬畏，专业精神值得学习。,0
0,25867012,追鹰日记,ssRomane,62119336,力荐,2022-11-09,20:17:47,Respect 拍摄团队,0
0,25867012,追鹰日记,今天开始金庸啊,yesung1206,力荐,2022-11-07,02:57:56,60/100 ,0
0,25867012,追鹰日记,不安分的兔子,42899314,推荐,2022-11-04,20:55:52,故事一般，风景太美了,0
0,25867012,追鹰日记,暖暖爱猫,263716224,推荐,2022-10-31,22:42:16,好片，逆境中求生存，不放弃不抛弃，前提是得遇贵人,0
0,25867012,追鹰日记,小娟心向王,213670344,还行,2022-10-29,22:33:12,这是一个男孩和鹰共同成长的故事，男孩救了鹰并教会了它飞翔觅食，鹰也教会了男孩如何成长，学会掌握自己的命运。他告诉我们，人也应该像鹰一样敢于拼搏。,0
0,25867012,追鹰日记,Zooe,142997182,还行,2022-10-26,16:49:27,风景好美,0
0,25867012,追鹰日记,汪小米,73244630,力荐,2022-10-11,00:40:07,能有一只隔三差五小聚一刻的雄鹰朋友真的不错~,0
0,25867012,追鹰日记,豆友LvoDOEmOq4,260549568,推荐,2022-10-07,19:40:14,可以,0
0,25867012,追鹰日记,侯磊,1140414,力荐,2022-10-04,23:45:06,好美。,0
0,25867012,追鹰日记,男高音书法家,Universe-Douban,推荐,2022-09-23,21:17:56,养一只鹰真的是太酷了，让它带着自己的思想翱翔于九天之上,0
0,25867012,追鹰日记,爱麦拉,money-,推荐,2022-09-22,17:08:15,人与动物的和谐相处，立意真的很不错,0
0,25867012,追鹰日记,刘畅,152188568,推荐,2022-09-21,10:09:08,摄影很美。,0
0,25867012,追鹰日记,海国烟波,191209899,力荐,2022-09-19,19:27:09,感受阿尔卑斯山的风情风貌，人与动物的亲密关系,0
0,25867012,追鹰日记,好小男,139864826,还行,2022-09-16,20:11:03,风景很棒，剧情稍弱,0
0,25867012,追鹰日记,培疯,peifeng,推荐,2022-09-11,00:59:38,虽然主旋律的部分滥俗，但纪录片的部分绝美。,0
0,25867012,追鹰日记,&j,209473510,推荐,2022-09-10,00:57:14,2022.0909 和爸爸一起看,0
0,25867012,追鹰日记,不听话的土司,164427911,推荐,2022-09-01,23:20:25,60年代阿尔卑斯山的四季。鹰也可以活到智慧老人让雷诺片中那个年纪。少年呢？至少拥有鹰的勇悍吧……视觉欣赏和情感感受都很到位。听着让雷诺的旁白，再想想碧海蓝天和里昂 ，时光啊……,1
0,25867012,追鹰日记,@花皮球@,huapiqiu,推荐,2022-08-31,13:23:22,"美丽的阿尔卑斯山风景，人与自然
拍摄手法像是纪录片",0
0,25867012,追鹰日记,sjndbfbkdkamwb,PierreYam624,推荐,2022-08-28,23:28:41,人与动物与自然,0
0,25867012,追鹰日记,米小之,243314163,推荐,2022-08-28,16:48:42,看风景嘛,0
0,25867012,追鹰日记,龙须糖,77677372,力荐,2022-08-28,10:54:41,喜欢这类人与自然的影片，取景地和海蒂和爷爷如出一辙,0
0,25867012,追鹰日记,MrKou429,146906296,推荐,2022-08-27,19:18:20,"2022年8月27日第一次观看。
综合评价了9分。
剧情是8分，演技9分，台词2分，画面2分，拍摄手法2分，音乐2分，点睛之笔1分。 ",0
0,25867012,追鹰日记,rachel5901,137895057,力荐,2022-08-27,15:22:29,温暖,0
0,25867012,追鹰日记,Duncan,152907773,推荐,2022-08-24,11:29:41,为你所信奉的东西一辈子奋斗,0
0,25867012,追鹰日记,大河马,166811120,力荐,2022-08-20,17:34:22,人与动物在大自然的和谐共生是我们向往的目标，影片拍摄的太美了！,0
0,25867012,追鹰日记,苗新禾,135424430,力荐,2022-08-16,00:25:11,大美,0
0,25867012,追鹰日记,fdice,fdice,推荐,2022-08-15,23:54:25,咱咋就没有人拍点这种温情脉脉的片子呢,0
0,25867012,追鹰日记,Joy,254338780,推荐,2022-08-13,00:06:55,风景太美了,0
0,25867012,追鹰日记,马儿的碎碎念,183942537,力荐,2022-08-11,23:27:12,他们的生活我的梦。,0
0,25867012,追鹰日记,BLUE,172761953,推荐,2022-08-10,23:23:54,很美很牛逼的拍摄，视觉享受,0
0,25867012,追鹰日记,人生如戏,204249702,推荐,2022-08-10,22:57:57,"阿尔卑斯山太美了！
2022.12.8刷！",0
0,25867012,追鹰日记,地念儿,157143990,还行,2022-08-09,21:09:28,如果没有演员的参与，这就是一部质量上乘的纪录片。但有演员的参与，就沦为了一部四不像。情节真的拖后腿，不知道导演怎么想的，花絮里看，这明明就是一个专业的纪录片团队啊……,1
0,25867012,追鹰日记,[已注销],orange1499,力荐,2022-08-09,12:44:43,"叔叔推荐的❤️
在你的一生当中，你要为你所信奉的东西而不停奋斗，绝不要失去希望，也绝不要对自己失去信心。",0
0,25867012,追鹰日记,梦在人间,sspsx,推荐,2022-08-09,00:32:05,风景很漂亮，故事还蛮简单的,0
0,25867012,追鹰日记,人在江湖,190738662,推荐,2022-08-06,21:17:10,拍得真好啊！看🦅在太阳下天空中翱翔，看虽然孱弱但天性不改的凶猛本性，用粗壮的爪子击退乌鸦狐狸，甚至跟大体型估计翻滚下山坡，皑皑白雪被冻得身上都是冰渣。很震撼,0
0,25867012,追鹰日记,末喜,xiweiliang,力荐,2022-08-06,13:20:59,生命轮回 ,0
0,25867012,追鹰日记,加菲猫,175619868,还行,2022-08-06,06:31:25,欧洲的故事片！,0
0,25867012,追鹰日记,废土剑圣老冰棍,187041151,还行,2022-08-05,20:47:38,纯看风景还行,0
0,25867012,追鹰日记,玄夜飞行,54264203,较差,2022-08-05,19:47:30,剧情太扯了，一星给动物，一星给风景。,0
0,25867012,追鹰日记,鸡丸美味,188639087,推荐,2022-08-03,22:44:44,前几天央六在放，正好看了看，像是纪录片，风景如画。,0
0,25867012,追鹰日记,凛兮鸭,221387074,推荐,2022-08-03,20:46:27,这部电影不仅情节紧凑，其中的风景更是美丽如画。电影开头壮丽的阿尔卑斯山风景令人惊叹，同时也感受到大自然独特的魅力,0
0,25867012,追鹰日记,xixixiu72,122252166,推荐,2022-08-03,20:17:49,台词不多。这种电影关注的是人与动物的相处和互动，把这点做好了就已经是佳作了。和重回狼群没有专业团队拍摄不同，这部剧明显是比较专业的导演和摄影团队，景色也美。但鸟类和哺乳动物相比，互动还是少了些。看了影评，里面的大叔是杀手不太冷的大叔，不过他在这是个次要角色，没有他，整个电影会单调很多。,0
0,25867012,追鹰日记,棱镜,156634228,力荐,2022-08-03,17:47:57,阿尔卑斯山的神级拍摄🎬,0
0,25867012,追鹰日记,Coldmonkey,65923580,推荐,2022-08-02,23:30:10,空战、宫廷阴谋、亲情、友情等等，在这部电影里都能看到,0
0,25867012,追鹰日记,Alysha,4340874,还行,2022-08-02,16:47:15,故事片与纪录片中间，鹰的成长过程拍得挺记录的，小孩与爸爸之间的情感挺故事的。,0
0,25867012,追鹰日记,木耳,246589288,推荐,2022-08-02,14:13:19,生命之书应由自己来书写,0
0,25867012,追鹰日记,橋,190868974,推荐,2022-08-01,23:59:35,Cctv6（2022暑假1,0
0,25867012,追鹰日记,Relaxxxxxx,174973540,推荐,2022-08-01,23:43:10,温暖，最后和好了就很好,0
0,25867012,追鹰日记,虞美人与大麦,195008540,推荐,2022-08-01,20:40:05,奥地利好美,0
0,25867012,追鹰日记,柚子,202255513,推荐,2022-08-01,20:05:56,拍的动物好真实，不知道是怎么拍出来的，好看,0
0,25867012,追鹰日记,right,48859861,推荐,2022-08-01,15:08:33,恬淡的半记录半剧情故事…节奏很慢很舒缓，不过捕食场面也有扣人心弦。寓言类的童话故事。,0
0,25867012,追鹰日记,路人七,151176888,还行,2022-08-01,13:32:19,风景美哭，剧情就……,0
0,25867012,追鹰日记,猫斯基,49958643,推荐,2022-08-01,13:31:08,奥地利旅游推介大片，雄鹰捕猎的珍贵画面，不知道如何拍摄。如果有幕后纪录片，我也愿意细细品看,0
0,25867012,追鹰日记,轻倚时光的路口,133573316,力荐,2022-08-01,12:56:48,cctv6播过好几次了，这次终于看完了。查了资料说此部影片拍了七年，确实值得敬佩 北欧风光 3名演员 两只鹰 被遗弃的鹰的成长 人类父子隔阂的消失 鹰兄弟之间的恩怨 寥寥数语的台词 空旷的北欧山脉，传递了好几个精神内核与人生哲理 适合一个人的时候好好的治愈电影。,0
0,25867012,追鹰日记,豆友bJhi1iuEYo,253376153,推荐,2022-08-01,09:15:35,四星致敬美丽的景色和摄制组！,0
0,25867012,追鹰日记,Erised,67744869,推荐,2022-08-01,05:49:28,不是给Ta自由，而是Ta本就是自由的，再见，我们一定会再见面。,0
0,25867012,追鹰日记,joker的女孩,183101827,推荐,2022-08-01,05:40:41,很棒很厉害,0
0,25867012,追鹰日记,桎火,133978729,推荐,2022-08-01,03:05:47,[视]cctv6，国语。自然纪录片元素，人与动物与自然，有其他动物，有惊险动作切勿模仿，风景不错,0
0,25867012,追鹰日记,优雅的沙雕,192800404,推荐,2022-08-01,00:29:07,多看动物世界，弱肉强食。,0
0,25867012,追鹰日记,飞雨,169889078,推荐,2022-08-01,00:20:27,拍摄者用心将大自然与人类共存拍的如此和谐。,0
0,25867012,追鹰日记,Robin-n,34180247,力荐,2022-08-01,00:13:38,鹰不可思议的强壮 画面绝美又震撼,0
0,25867012,追鹰日记,葵妹妹妹妹妹,132268143,推荐,2022-08-01,00:13:31,拍摄五年，多一星给精神,0
0,25867012,追鹰日记,美成妙成,2826239,力荐,2022-08-01,00:08:34,治愈。,0
0,25867012,追鹰日记,蔚蓝大海🍀,SASAMA,力荐,2022-08-01,00:05:24,狂野之美,0
0,25867012,追鹰日记,穿过寒冬,185011524,力荐,2022-08-01,00:04:55,好感动，2011年开始拍，大自然的野生动物，自然变化的天气，太美了！太牛了！,0
0,25867012,追鹰日记,☀阳阳☀,120365202,力荐,2022-08-01,00:04:08,唯美自然灯光,0
0,25867012,追鹰日记,暴风速递,Demonskin,推荐,2022-07-31,23:59:22,自然风光太美，看花絮里拍摄工作也是不易的。,0
0,25867012,追鹰日记,举个栗子,214829700,力荐,2022-07-31,23:57:33,四星给电影，再加一星给画面与制作,0
0,25867012,追鹰日记,三多里,41913236,推荐,2022-07-31,23:57:23,我们都要学着，从回忆中解脱。,0
0,25867012,追鹰日记,大官人,142937758,推荐,2022-07-31,23:56:05,值得一看,0
0,25867012,追鹰日记,我可能会发光,205421413,力荐,2022-07-31,23:55:43,"绝美的自然风光，艰难的拍摄，朴素的人与自然故事
ps：这个故事好哈萨克族，这个风景好新疆",1
0,25867012,追鹰日记,李永铭,225115469,推荐,2022-07-31,23:54:00,一只鹰的奋斗史,0
0,25867012,追鹰日记,木·才,48724442,力荐,2022-07-31,23:53:57,太美了,0
0,25867012,追鹰日记,vernoreal,192400024,力荐,2022-07-31,23:51:44,真的太神奇了，很多拍摄视角让人惊艳，不断地问如何做到的？,1
0,25867012,追鹰日记,恶毒女配标记版,157009392,还行,2022-07-31,23:39:04,更像个纪录片，挺好的,0
0,25867012,追鹰日记,怪话,142121510,力荐,2022-07-31,23:19:03,这个鹰真的不是真的吗？一点也不像特效，我感觉像在看动物世界,0
0,25867012,追鹰日记,令子,210711905,力荐,2022-07-31,23:12:18,非常喜欢的电影,0
0,25867012,追鹰日记,彩虹,213207663,力荐,2022-07-31,23:11:55,这个片子拍的真好，景色特别美，小动物太可爱了，男主人公特别自然，里边风景好好看,0
0,25867012,追鹰日记,骑驴找驴,neanderthal,推荐,2022-07-31,22:38:59,很好看的自然传奇电影，颇有点BBC自然大片的味道。从结尾处的拍摄花絮来看，整个设置过程堪比BBC自然大片。一些评论者小觑这片子的故事情节，其实这片子并不是讲人的故事，而是讲鹰的故事，就像法国电影《熊的故事》讲的是熊的故事一样。野生动物的故事往往比人的故事更精彩。顺便说一句，《熊的故事》演职员表中的第一位就是那头扮演大熊的叫做巴特的熊，本片的演职员表也应该把那两只鹰的名字列在演职员表中。,0
0,25867012,追鹰日记,鸿爪,zoneinair,,2022-07-25,22:59:33,短视频,0
0,25867012,追鹰日记,寻你,159899287,推荐,2022-07-17,23:20:57,"电影画面真美，那种让人一瞬间平和只需感受的场景。雷诺大叔的年纪越来越大了，就像在有限的生命里体会各种各样的人生与喜怒哀乐，真吸引人。
另：电影的英语很是清晰，符合我的听力。",0
0,25867012,追鹰日记,Re_Limsl,elvirakira,力荐,2022-07-17,22:45:14,鹰🦅的演技实在是太好了，摄影师也真的是好厉害，我看过的一部最好的动物电影啦！,0
0,25867012,追鹰日记,Bingo,189132930,推荐,2022-07-17,22:05:54,好好奇怎么拍摄出来的,0
0,25867012,追鹰日记,豌豆射手_Liou,142463881,还行,2022-07-17,16:38:48,更像是动物世界+风景片、画面精美，剧情非常突兀,0
0,25867012,追鹰日记,哆啦梦文,145990631,力荐,2022-07-17,16:26:24,致敬电影工作人员,0
0,25867012,追鹰日记,天姿高朗,156400615,推荐,2022-07-11,20:41:34,"分数：75
       唉！观后感慨……是电影植入了自然纪录片，还是纪录片植入了电影！但管它呢，不都是电影吗？
剧情“雄鹰与少年”拍摄配乐制作水平都不错，风景壮美，剧情简单朴素，看着心情好，适合作为家庭片观看。",0
0,25867012,追鹰日记,拖拉机宝宝,138420672,推荐,2022-07-07,14:28:15,谢谢越哥,0
0,25867012,追鹰日记,君君,210985682,推荐,2022-07-06,15:21:38,风景很美,1
