page_index,movie_id,title,username,user_id,rating,date,time,comment,useful_count
0,26774001,开学悸,小棍,27403984,很差,2019-01-26,13:51:19,短片的烂片，没有什么内容，不是恐怖片的样子,0
0,26774001,开学悸,tell him,tellhim,推荐,2019-01-21,21:25:02,相当不错！,0
0,26774001,开学悸,任亦然,35820716,还行,2019-01-18,22:26:39,年轻演员都不错,0
0,26774001,开学悸,恩诺,s475098026,较差,2019-01-12,14:10:07,国产恐怖片也就这样了 没有剧情 没有画面 没有演技,0
0,26774001,开学悸,猫屎一号,52911696,力荐,2019-01-05,03:37:04,我觉得还行啊。。算不错的国产电影了,0
0,26774001,开学悸,王木川,jielunxiaoxin,还行,2019-01-02,21:02:58,第一个故事还行，第二个不知所云，第三个意料之中。,1
0,26774001,开学悸,我的小鱼干嘞,69311501,较差,2019-01-02,17:53:37,伤疤和相见都还蛮喜欢的，两种风格，悬疑与文艺，友情与爱情。但是打分这么低的原因不是因为所谓的国产鬼片，只是故事太拖沓了，镜头不够流畅。,1
0,26774001,开学悸,y8jk,60256557,推荐,2019-01-02,15:06:12,一个女孩在自习室和一只鬼聊天，鬼告诉了这女孩2个鬼故事。最后这女孩发现和她手机聊天的居然是一只鬼。这部恐怖剧算是为数不多，国内比较靠谱的恐怖片。其实国内鬼片不是不行，而且受到不迷信的限制，处处受到捆绑罢了，大家应该给多点容忍。这部真算是比较不错了。,0
0,26774001,开学悸,玄天邪帝,51264317,还行,2019-01-02,14:12:31,国产恐怖片中真的算不错的了,0
0,26774001,开学悸,...,189363646,还行,2019-01-01,18:26:03,作为内地恐怖片还是不错的。由于某些原因，还是逃不出几个基本框架,0
0,26774001,开学悸,鲤鱼,40736682,力荐,2019-01-01,02:14:16,为RIE打call,0
0,26774001,开学悸,冻住冬天,164699593,较差,2018-12-31,11:45:15,至少是个用心拍的国恐 喜欢第二个故事,0
0,26774001,开学悸,旺财爱打架,185221291,很差,2018-12-30,17:06:41,不能再高了。。,0
0,26774001,开学悸,仙女下凡,127017750,较差,2018-12-30,15:42:42,第一个故事有点意思，第二个就不知道是什么鬼,0
0,26774001,开学悸,panxianxi,78265670,还行,2018-12-30,01:26:46,如果没有第二个故事这片就是1星 第二个故事真的是太暖心了 讲真这电影真的配不上第二个故事,0
0,26774001,开学悸,麦子,btone0808,还行,2018-12-29,17:37:31,几个年轻主演表现力还不错，几个关键氛围渲染的也可以，其实就一个自习室故事，夹了两个怪谈进去，逻辑说的过去，总体观感不错。,0
0,26774001,开学悸,浪味仙,dijianglin,很差,2018-12-27,15:15:01,放假吧太可怕了,0
0,26774001,开学悸,向上吧！少楠,125267371,还行,2018-12-26,17:31:13,挺好的，比很多国产恐怖强多了,0
0,26774001,开学悸,夏果冻,jelly-8,较差,2018-12-26,13:46:15,故事并不吓人，是所有的常见的集合体，比较无聊吧，不恐怖,3
0,26774001,开学悸,如花,171431753,还行,2018-12-25,23:53:15,非常的用心在拍，虽然有些套路，但是看到诚意，算是个欣慰。,0
0,26774001,开学悸,流浪的风丶,152414758,推荐,2018-12-25,23:12:09,五分的话可以3-4分，无聊还是可以看看的。,0
0,26774001,开学悸,无限盒子,92775261,力荐,2018-12-24,23:57:49,好看啊！！完全超出我对国产恐怖片的预期！！非洗钱，不卖肉，不把观众当傻逼，这三点就已经能甩一众国产恐怖片十八条街了…三个小故事的反转虽然不是特别新颖，但是也不简单，看起来很过瘾，而且镜头和剪辑处理的特别好，恍惚以为在看欧美恐怖片，一点都不粗制滥造，很棒了！！从海报就觉得有意思，没想到找到宝了…,3
0,26774001,开学悸,爱比死更冷,70421764,较差,2018-12-23,23:02:47,"导演: 高朋 / 刘鼎业
编剧: 高国斌 / 丁洁如 / 刘鼎业
主演: 秦语 / 曾淇 / 赵艺 / 曹晏豪 / 刘颖颖
类型: 惊悚 / 恐怖
制片国家/地区: 中国大陆",0
0,26774001,开学悸,诡谲少女A,173956756,推荐,2018-12-23,00:38:03,这部算是国产惊悚片里的上乘之作吧，比想象中好看很多。三个小故事都不错。《自习室》蛮恐怖的，女主那么晚还一个人在这种地方自习简直是作死啊。-。- 最喜欢第二个故事，很美很感人，配乐也很优秀。,1
0,26774001,开学悸,奶油炸糕,184339542,还行,2018-12-22,21:46:31,我觉得拍到这种程度已经算不错了 虽然第二个故事削苹果梗太老了 但是剧情还算特别 ,0
0,26774001,开学悸,怕瓦落地,81585815,还行,2018-12-22,15:59:47,其实还是不错的三个故事 虽然剧情老套 演技也还说得过去,0
0,26774001,开学悸,欧阳竹珣,146315970,还行,2018-12-21,18:55:58,比我想象的要好看！只是为什么恐怖片道主角永远都喜欢一个人在黑暗的阶梯教室学习，或是一个人留在澡堂洗澡？要是我一开始就不会干那么吓人的事情。不过音乐做的还是蛮吓人的,1
0,26774001,开学悸,瘦子才有说话权,4594336,还行,2018-12-21,14:18:46,国产恐怖片拍到这个水平算是超出预料啦,3
0,26774001,开学悸,无聊,150948299,较差,2018-12-21,12:15:10,证明一下自己下了、看了、删了，硬要选的话还是第一个故事好那么一点点,0
0,26774001,开学悸,留贻襄女,41309408,还行,2018-12-20,23:26:00,2018,0
0,26774001,开学悸,修道院里的歌者,87509929,很差,2018-12-20,16:33:08,这种不用思考的电影当零食看看,0
0,26774001,开学悸,赵伯鼠zFy,zhaofuyuworld,很差,2018-12-20,16:02:26,可以负分就负分,1
0,26774001,开学悸,little star,182937657,还行,2018-12-20,12:29:29,第二个故事不错,1
0,26774001,开学悸,嘛哩嘛哩呗呗塔,146787535,较差,2018-12-19,22:07:30,第二个故事相见的男主演过狮子王强大，还挺喜欢他的。这部我一直以为是台影，没想到原来是内地的，以前都是结尾告诉大家主角得了精神病，这部抛开被我们一直吐槽的神经病梗，而是在结尾设置了悬念变成oe的，其实我更偏向于那是人为。两个小故事的组成方式上院线感觉不喜欢，相见的海水那段特效真的假的不能再假了。自习室感觉作用只在于承上启下串联起伤疤和相见，伤疤里的友情其实是最常见的，没有勇气站出来坦白，只能在心里默默希望自己可以勇敢的挡在好朋友的面前，可是伤害早就酿成了。,2
0,26774001,开学悸,烂醉机长,169092446,很差,2018-12-19,21:11:48,烂,0
0,26774001,开学悸,杰瑞的胸肌,180401152,很差,2018-11-23,07:45:41,第三十七条觉得后面不会有人再来评价了吧。,6
0,26774001,开学悸,叫爸爸,185618847,很差,2018-11-21,21:06:32,有负分吗？,0
