page_index,movie_id,title,username,user_id,rating,date,time,comment,useful_count
0,22266126,王牌保镖,smellyfox,57771969,力荐,2022-12-18,11:42:14,嘴炮王，三缺一（布鲁斯威利斯）,0
0,22266126,王牌保镖,Denver.,137343805,较差,2022-12-18,03:07:28,看个闹热而已，没啥意思，打得倒是多，场景也平平。,0
0,22266126,王牌保镖,西颢之心,121419429,推荐,2022-12-18,00:29:25,很刺激很好笑，但是两位男主角的脸都不太符合人设，一个不够严肃，一个不够贱，说不定反过来更好呢,0
0,22266126,王牌保镖,李头涛子二号,216286628,还行,2022-12-18,00:18:12,"挺俗套的片子，无功无过吧
好几年前看的了，时间过得真快",0
0,22266126,王牌保镖,梦境汽水,129210199,力荐,2022-12-18,00:04:50,刚看完 好像来到婚礼现场了,0
0,22266126,王牌保镖,双休猫,shuangxiumao,还行,2022-12-17,22:42:59,整体来说还是不错的，枪战和打斗的场面还是可以的。只是我感觉不是那么好笑唉。,0
0,22266126,王牌保镖,谢瓜瓜,163028821,推荐,2022-12-17,21:07:16,get到了小贱贱的帅,0
0,22266126,王牌保镖,Zqc很无趣儿.!,zqc19950925,还行,2022-12-16,22:38:35,"第1739部,妈热法克侠和死侍的杀手保镖CP,真是越贱越逗越舒坦.",0
0,22266126,王牌保镖,黄金时代,163455728,推荐,2022-12-16,19:47:54,还不错，友情，爱情，枪战，飙车，搞笑,0
0,22266126,王牌保镖,NPC,nnnpppccc,还行,2022-12-15,23:46:47,中规中矩的好莱坞片子，看开头就能猜到结尾的爆米花电影，闲了看看还不错！,0
0,22266126,王牌保镖,番茄肉酱,197494999,推荐,2022-12-15,21:33:44,31,0
