page_index,movie_id,title,username,user_id,rating,date,time,comment,useful_count
0,26253737,非常父子档,micsal,102483777,较差,2023-02-09,15:27:52,强行煽情，还有他父亲那种表面功夫都不做的人是如何站到那个位置的，要是没钱的话，他父亲就是个底层家暴男,0
0,26253737,非常父子档,豆友jvAEHsNlYU,253902373,力荐,2023-02-07,01:06:39,还行吧,0
0,26253737,非常父子档,Lifeline🔅,251004347,推荐,2023-01-23,13:32:03,我觉得挺可爱挺萌的，也温馨有爱。,0
0,26253737,非常父子档,Blossom,195525741,力荐,2023-01-20,23:41:27,很好看啊，超级可爱的家庭剧啊。这个小孩也太可爱了吧！！！简直萌化了。聪明又灵动,0
0,26253737,非常父子档,一一,Ellvea,还行,2023-01-20,20:59:48,打卡,0
0,26253737,非常父子档,文无,203348732,很差,2023-01-20,01:12:36,打发时间,0
0,26253737,非常父子档,阿卡回到家,234315567,还行,2023-01-15,18:00:31,小孩很可爱,0
0,26253737,非常父子档,JeuneDanny,225930823,还行,2023-01-13,16:10:25,补标,0
0,26253737,非常父子档,迷途小书童,143576991,还行,2023-01-09,15:34:53,我觉得很好啊 有爱有情 温馨细腻,0
0,26253737,非常父子档,面壁者,244366284,较差,2023-01-03,22:59:05,电影设定很好，小孩很乖，但是拍的真烂，这电影但凡一个合格的商业片导演都能拍的很有趣，但是这拍的真尬。,0
0,26253737,非常父子档,依然在,17465899,还行,2022-12-31,22:02:00,前面挺好，后期烂尾。,0
0,26253737,非常父子档,大棉裤子,256200085,较差,2022-12-26,18:12:17,就是常见的不能再常见的套路,0
0,26253737,非常父子档,第一国际旅行,88974183,力荐,2022-12-24,21:48:16,好离谱的一个故事，最后男女主居然还????相爱了??????不过演技等各方面还都算在线吧，有关家庭，但是并不为了煽情而煽情，整个儿感情是有个递进的过程。是个可以当作自我消遣的电影。,0
0,26253737,非常父子档,RanY,256190563,力荐,2022-12-24,17:45:11,明明很老套的故事，可能是颜值和可爱才撑下来，老演员也是加分项,0
0,26253737,非常父子档,亮的豆瓣,158641874,还行,2022-12-24,11:59:35,这个导演没导过几部片子,0
0,26253737,非常父子档,黄杉,190326662,推荐,2022-12-19,21:13:39,有时候给一部电影打高分，跟剧本，跟演员毫无关系，只是你看的时候，正好觉得好看就行了......人就是这样。（最近因为疫情放开，阳越来越多，孩子已经一周没有上学了，一家人天天在一起玩游戏）,0
0,26253737,非常父子档,大白与小灰,153696496,力荐,2022-12-19,17:46:11,"很下鸡爪

小朋友也很可爱",0
0,26253737,非常父子档,深蓝,49601235,推荐,2022-12-19,17:31:35,李治廷被选中了,0
0,26253737,非常父子档,73号居民,jumin73,很差,2022-12-18,21:04:14,被电影解说骗来看的，看解说就够了。,0
0,26253737,非常父子档,阿鹿,152097185,较差,2022-12-17,21:13:11,帅哥美女萌娃，最后他俩有没有戏呀,0
0,26253737,非常父子档,佐罗丘,82817952,较差,2022-12-15,22:48:03,还可以啊,0
0,26253737,非常父子档,whisky,50803155,,2022-12-13,05:50:50,这个导演太恐怖了，电影里面那些暗戳戳的pedophilia是谁整的？❌拒绝pedophilia。李治廷真的不差，职业生涯没有代表作太可惜了。,0
0,26253737,非常父子档,拖拉机宝宝,138420672,较差,2022-12-12,19:20:53,难看,0
0,26253737,非常父子档,JuNno,173784434,力荐,2022-12-12,13:30:32,创意五颗星，内容也就三星不能再多了。,0
0,26253737,非常父子档,万年,72587876,力荐,2022-12-08,23:53:21,小朋友演的好,0
0,26253737,非常父子档,八卦小耳朵,252496176,力荐,2022-12-08,23:47:14,要说是爱情主题也太勉强了，反而是两代的父子情比较突出，石榴姐是放松气氛高手，吕中气质很好，但是刘松仁才是片子的主心骨，没有他这个电影就空洞了，李治廷过于年轻，只能狰狞没有温度,0
0,26253737,非常父子档,BORING东,169053893,较差,2022-12-05,18:58:21,演技、剧情都很老套/是小孩子在教你怎么做爸爸吧/狗头,0
0,26253737,非常父子档,花诰,156243878,较差,2022-12-04,17:05:11,单纯过来看孩子，有些电影的精彩只能停留在3分钟剪辑里面，正片真的又臭又长，凑时间而已,0
0,26253737,非常父子档,有事没事看电视,162928953,较差,2022-12-04,13:37:44,"女主是《再次十八岁》的主演，男主也帅，小朋友也可爱☺，演技也没问题。
但是，剧情很让人无语😑，想吐槽又不知道该说什么。   
这电影也就看看抖音和快手的短视频剪辑片段还行，看整部电影就算了吧，浪费时间……不知道想表达什么？父子情？",0
0,26253737,非常父子档,li1234,li2021,力荐,2022-12-03,21:53:38,好看,0
0,26253737,非常父子档,绿豆汤,53879443,还行,2022-12-03,00:26:06,可以看看吧。,0
0,26253737,非常父子档,Risen,193559215,推荐,2022-12-02,13:16:13,有一说一，文梅森这个童星真的很棒,0
0,26253737,非常父子档,温酒,207678033,推荐,2022-12-01,22:40:16,小孩子撑起来了整个剧，不过很多情节还有点问题，尤其是最后父亲来翻案，一点都不科学，好歹钞能力动用一下，让最后情节合理一点也好,0
0,26253737,非常父子档,Mio,156033544,还行,2022-12-01,20:34:09,娃很萌,0
0,26253737,非常父子档,抹茶慢品,149483375,还行,2022-12-01,17:33:53,蛮好玩的，有时间想看戏剧的话，是可以看看的~温馨幸福,0
0,26253737,非常父子档,nero,72258722,还行,2022-12-01,01:02:37,中韩联动小蝌蚪找爸爸 小演员表演很可爱。,0
0,26253737,非常父子档,伊藤葉,88303293,推荐,2022-11-30,22:35:21,搞笑又充满温情，很感人,0
0,26253737,非常父子档,Ailsa,171398231,还行,2022-11-30,19:43:37,内容搞笑成分还是有的，就是名字和内容不是特别符合,0
0,26253737,非常父子档,Oharri,175111238,还行,2022-11-30,19:26:34,短视频刷到了去看的  ,0
0,26253737,非常父子档,邓登登,178072152,很差,2022-11-30,15:36:10,标准的糟糕故事模板，悬浮的人物逻辑，李治廷生气起来五官都全在飞，真的很可怕！对了还有一个技术上的问题，版权法保护的确实只是表达，不是思想或感情，太悬浮了，导演对待自己故事的敷衍态度着实令人咋舌,0
0,26253737,非常父子档,nwkl,nwkl,还行,2022-11-29,18:45:29,小孩子还挺可爱的,0
0,26253737,非常父子档,友情客串人生,145520396,较差,2022-11-29,01:42:49,不找妈了找爸是吧？,0
0,26253737,非常父子档,面善_5减2加0,146043892,力荐,2022-11-29,00:36:09,我觉得很好啊 有爱有情 温馨细腻,0
0,26253737,非常父子档,小丑🤡,182205982,还行,2022-11-28,14:37:52,剧情框架挺好，就是细节很操蛋，还好有女主和小孩撑着，感觉重新或者多拍一下类似的电影电视剧“小蝌蚪找爸爸”，应该会蛮好看。。。,0
0,26253737,非常父子档,mo·钮枯禄姐,256276227,还行,2022-11-28,08:38:20,这个剧情题材拍过很多次了，一般，小孩子真的很可爱,0
0,26253737,非常父子档,_美邵女战士_,BriannaShao,推荐,2022-11-27,19:58:54,"超好看。
总评：是会【开1.25倍速+会看第二遍】的剧。",0
0,26253737,非常父子档,三川,204255632,较差,2022-11-27,01:47:53,怎么说呢，看着没啥感觉，有点强行父子情……,0
0,26253737,非常父子档,沈初,221377018,还行,2022-11-26,19:00:47,一般般，小朋友的演技很出彩。,0
0,26253737,非常父子档,星星,huxiaclaire,还行,2022-11-26,16:46:49,剧情一般 小孩子很可爱很讨喜 ,0
0,26253737,非常父子档,闲散小豆HOPE,247286530,推荐,2022-11-25,23:49:17,剪了吗？好像看着不连贯？小朋友怎么知道爸爸在中国咧？奶奶病倒了为什么要怪母子俩呢？我漏掉什么了吗？多一星给可爱的小演员的,0
0,26253737,非常父子档,我不聪明,183341987,推荐,2022-11-25,23:43:30,好看，这个小朋友真的太可爱啦！,0
0,26253737,非常父子档,养家糊口的猫巷,61257828,很差,2022-11-25,21:24:44,剧情尴尬到连小朋友都没有第一眼看到的那么可爱了…，感情发展也非常突兀…都是啥呀,0
0,26253737,非常父子档,kakakarl,zhanyakui,,2022-11-25,14:13:51,设定很韩国，财阀集团，聪明的小孩寻父。人果然是要长得好看啊，其实主角只一起相处了俩天，就看上去有了些感情～,0
0,26253737,非常父子档,无人街角无声拥,148131795,还行,2022-11-25,00:04:04,明明在中国，我硬看出来韩剧味,0
0,26253737,非常父子档,我与春风皆过客,174188743,还行,2022-11-24,20:57:17,6.2，从短视频来的，小朋友太可爱了。虽然电影质量不行，但我确实因为小朋友笑了，所以打个及格分吧。,0
0,26253737,非常父子档,Violette Ning,178943081,还行,2022-11-24,00:55:13,…当年在来福士看的 略无聊,0
0,26253737,非常父子档,奔跑的风,Twdrop,还行,2022-11-23,23:52:51,挺温暖的电影，我居然一直以为男主是王力宏,1
0,26253737,非常父子档,法令纹很重,48921152,还行,2022-11-23,21:43:26,电影还是电影，过于理想了。李治廷在里面的演技，有点点浮夸…,0
0,26253737,非常父子档,用剎娜問候浮生,174165061,推荐,2022-11-23,17:20:59,切入点还是合情合理的。‘’父子‘虽然交流全程障碍，但着实看着让人特别有温馨的感觉。满满童真和爱意的一部，心情灰色的时候推荐看一看。,0
0,26253737,非常父子档,拉拉西,30799618,较差,2022-11-23,02:25:49,想不明白拍啥就别拍，白瞎了小孩演的挺好,0
0,26253737,非常父子档,兰陵笑笑生,zwbember,还行,2022-11-22,22:08:15,男女主之间的情感联系变化，以及两代父子之间的情感沟通变化，太仓促 太突兀。否则会更好一些,0
0,26253737,非常父子档,克里斯托娃哈哈,240561230,较差,2022-11-22,09:36:43,一言难尽,0
0,26253737,非常父子档,那年盛夏🍭,WM20200716,还行,2022-11-21,22:47:42,题材还是很新颖的,0
0,26253737,非常父子档,macMoon,3452424,推荐,2022-11-21,22:21:36,别管什么剧本啦 就这一家三口的颜值还有什么可说的 ,0
0,26253737,非常父子档,若为情,54903981,还行,2022-11-21,22:07:39,还行。。韩国部分挺好，吕中老师虽然戏份少却是力压全场。。剩下的家庭却是妥妥的香港范儿。。,0
0,26253737,非常父子档,桔梗一三,miss__pzh,较差,2022-11-20,18:24:55,"一分给题材，一份给老戏骨们。
PS：跟找老爸有任何关系吗？",0
0,26253737,非常父子档,逮猪猎手陈飞宇,173938761,较差,2022-11-20,15:21:07,两星给这个有趣的小孩,0
0,26253737,非常父子档,.   LoweiC🏋🏻,186984422,推荐,2022-11-20,12:27:16,剧情很好，前一部分孩纸去找爸爸那一段很喜欢。,0
0,26253737,非常父子档,May,2520052,很差,2022-11-20,00:38:16,1.5倍速看完，好无聊的电影,0
0,26253737,非常父子档,赛文奥特曼,47041833,还行,2022-11-19,23:05:14,一家三口一起看，表示满意，很可爱，很幸福。剧情一般，合家欢，其他不必太在意。,0
0,26253737,非常父子档,番薯芋圆,231140710,还行,2022-11-19,22:37:31,我觉得这个妈妈演的很好。根本不老气，这才是妈妈应该有的样子。一个人从怀孕生子到抚养长大，然后还要工作。肯定会稍稍变得有点黄脸婆。难道还要找个打扮时髦的来演妈妈吗？,0
0,26253737,非常父子档,可乐加糖,152185102,很差,2022-11-19,14:36:44,女人和医生还不知道谁捐的，小孩已经找到了。牛,0
0,26253737,非常父子档,Xisuper,Xisuper,很差,2022-11-19,00:32:51,李治廷被选中了,0
0,26253737,非常父子档,醉熏的狗,139433224,还行,2022-11-18,13:39:24,温情但略显粗糙的小故事，消遣还说得过去,0
0,26253737,非常父子档,Hanne,51458050,还行,2022-11-17,23:04:36,要说是爱情主题也太勉强了，反而是两代的父子情比较突出，石榴姐是放松气氛高手，吕中气质很好，但是刘松仁才是片子的主心骨，没有他这个电影就空洞了，李治廷过于年轻，只能狰狞没有温度,0
0,26253737,非常父子档,space,167641076,较差,2022-11-17,22:52:51,这也太烂了,0
0,26253737,非常父子档,自由人,AiJun5211314,,2022-11-17,17:19:10,抖音,0
0,26253737,非常父子档,coffee,4277603,推荐,2022-11-16,16:04:55,好离谱的一个故事，最后男女主居然还????相爱了??????不过演技等各方面还都算在线吧，有关家庭，但是并不为了煽情而煽情，整个儿感情是有个递进的过程。是个可以当作自我消遣的电影。,0
0,26253737,非常父子档,duola,37324547,还行,2022-11-15,22:39:20,剧情还是挺平铺直叙的，韩国的小蝌蚪儿子远赴中国找爸爸，并在奶奶的力挺下似乎撮合了本来命运没有关系的爸妈。最有吸引力的当是小朋友的表演，真是十分可爱又机灵。触动的地方还是小朋友对父母团聚的最简单的期望和满足吧，也许对于早期的他们来讲，爸爸妈妈在就是最美好的世界，愿每一位大人都能保护好，并且尽量去满足他们这份不难做到的需求。,0
0,26253737,非常父子档,豆友zdryqi11QE,261240942,还行,2022-11-13,16:37:43,我如果有这么可爱的孩子就好了，还可以的吧,0
0,26253737,非常父子档,啥啊这是,226898470,还行,2022-11-06,15:45:50,周末闲着没事看完了，虽然从开头就能猜出结尾，但中间剧情有的还挺温馨的，就是开庭那里演的有点浮夸。不明白的是为啥那个小朋友会知道他爸爸是周力岩啊，后面明显那个医生和他妈妈都不知道啊，只有当事人金什么平知道的样子，是bug吗？那个艺术展真的挺有创意的，喜欢,0
0,26253737,非常父子档,老山黑妖,100578784,还行,2022-11-05,21:56:10,明明很老套的故事，可能是颜值和可爱才撑下来，老演员也是加分项,0
0,26253737,非常父子档,一碗面条,154326264,还行,2022-11-05,17:12:07,这电影唯一打动我的地方居然是里面的艺术创意，其余的都很一般。,0
0,26253737,非常父子档,Hanamichi,jiangziwen,较差,2022-11-02,17:08:50,美联航上的科幻片.... 而且还是2020年2月以前的科幻片 lol,0
0,26253737,非常父子档,李刚,238929862,力荐,2022-10-29,21:38:06,我觉得很不错啊，很温馨,0
0,26253737,非常父子档,心眼观世界,190191326,力荐,2022-10-28,22:02:24,女主好看，小孩儿可爱，挺温情的一部剧。男主还需加油。,0
0,26253737,非常父子档,YOYO,221673254,还行,2022-10-27,17:59:58,哈哈哈哈哈好搞笑！,0
0,26253737,非常父子档,强到令人震惊,190378565,还行,2022-10-26,20:16:15,小孩儿演技真不错啊,0
0,26253737,非常父子档,往事暗沉不可追,250801126,还行,2022-10-26,00:11:50,为儿子可爱的笑颜打个三星,0
0,26253737,非常父子档,知足,164924313,推荐,2022-10-25,23:02:39,还可以啊,0
0,26253737,非常父子档,希京,206006187,较差,2022-10-23,20:55:31,"很下鸡爪

小朋友也很可爱",0
0,26253737,非常父子档,不吃不开心,179158724,还行,2022-10-23,02:12:06,小演员好可爱！奶奶演的好好！就是剧情不知所云,0
0,26253737,非常父子档,芥茉小甜,168397621,还行,2022-10-21,22:15:53,小朋友很可爱,0
0,26253737,非常父子档,冲天小辫,85098364,较差,2022-10-21,15:13:07,二星只给文梅森，可爱精灵，爸妈两个演技垃圾，尤其男主。剧本垃圾，但是孩子太可爱啦,0
0,26253737,非常父子档,择遇,183426975,还行,2022-10-21,12:13:25,借精生子这个话题的确挺富有争议，父子之间的摩擦和融合，通过长辈们的演绎刻画出家庭当中的喜怒哀乐，剧本很接地气，节奏明快，作为一部中韩合作的作品，李治廷颠覆以往的形象。,0
0,26253737,非常父子档,路痴不迷路,250562300,推荐,2022-10-21,07:15:21,我也想要从天而降一个天才又帅气可爱的儿子,0
0,26253737,非常父子档,凝望,184401989,还行,2022-10-20,22:45:06,还行，那小孩最后给我看哭了,0
0,26253737,非常父子档,bloom,178872707,还行,2022-10-20,09:32:09,还行吧，喜剧片，小孩太聪明了,0
0,26253737,非常父子档,月半了一,164139015,推荐,2022-10-19,22:30:59,不至于这么低吧，我觉得6.5到7分合适,0
0,26253737,非常父子档,沉默不予,177996251,还行,2022-10-18,21:21:26,前面挺好，后期烂尾。,0
0,26253737,非常父子档,WHO,186535807,还行,2022-10-06,18:50:44,3分给这个孩子,0
0,26253737,非常父子档,湖人总冠军,186760616,还行,2022-09-25,11:01:54,整体还好，但是中间的一些戏剧冲突真的让人看的很难受,0
0,26253737,非常父子档,小明,190984591,推荐,2022-09-18,12:53:26,挺温情挺搞笑，在北京静默看的,0
0,26253737,非常父子档,这个人没名字,224193664,推荐,2022-09-16,19:34:43,小朋友好可爱啊！,0
0,26253737,非常父子档,晚安,261269642,力荐,2022-09-15,18:25:42,很好看，内容丰富多彩，值得观看,0
0,26253737,非常父子档,南马肠,YMJNanMaChang,较差,2022-09-08,02:58:47,不想做评价，我看过的电影数量中，踩雷的比例也会大一点吧,0
0,26253737,非常父子档,其叶沃若,macaronigerrard,还行,2022-08-21,20:44:27,小朋友的可爱一己之力拉到三颗星。老套的喜剧套路。吕中奶奶鹤立鸡群啊。,0
0,26253737,非常父子档,白昼,C23325,推荐,2022-08-14,22:20:26,帅哥美女萌娃，最后他俩有没有戏呀,0
0,26253737,非常父子档,大王,honey-wang,较差,2022-08-14,14:10:58,看完了。觉得好莫名的感觉。电视里在放。,0
0,26253737,非常父子档,董小姐,Miss_dyq,还行,2022-08-09,20:45:44,2020.12.13,0
0,26253737,非常父子档,会飞的鱼,231223684,还行,2022-07-25,20:28:26,面对这个突如其来的“儿子”，周力岩的态度是拒绝的，他根本没有做好做父亲的准备，更别提照顾这样一个古灵精怪的孩子了,0
0,26253737,非常父子档,林卝,maydance,还行,2022-07-20,00:05:26,小朋友演的好,0
0,26253737,非常父子档,luoluo,185347052,还行,2022-07-10,21:57:07,哈哈，这要是早几年拍应该就是另外一个故事了，一个小孩不远千里来找爸爸，下飞机之后就被拐了，然后孩他妈过来找爸一起寻子的故事了,0
0,26253737,非常父子档,金先生 .,182950149,很差,2022-06-17,03:06:18,烂俗的故事和刻意德善清真的都是我的雷点 一整个就是达咩住 不过小正太还是很可爱的,0
0,26253737,非常父子档,J,161938201,还行,2022-05-09,19:20:58,"中韩合作电影现在看来也是活久见了！！
文梅森真的是好久不见，童星代表，现在归于普通人生活了吧，一共就3部作品来着。",0
0,26253737,非常父子档,我是猪贩子,165450790,较差,2022-04-08,04:23:23,啥玩意,0
0,26253737,非常父子档,山上窄,178409968,推荐,2022-03-31,22:46:33,跟朋友聊到“捐精”这个话题，于是想起以前看过的这部娱乐片，原来这么冷啊，而且是内地上映的，还一直以为是韩国片2333，合家欢喜剧请摩多摩多,0
0,26253737,非常父子档,大钱的妖艳七,172766793,推荐,2022-03-08,14:38:11,没看之前光看简介觉得是一个烂片，看了之后觉得还可以。选角剧情人物都很好玩，是一个有很多笑点的喜剧。2022.0308,0
0,26253737,非常父子档,关尔巴拉巴拉,teirin,还行,2022-03-03,22:47:15,韩国演技自然，中国尬。除了奶奶老戏骨还不错,0
0,26253737,非常父子档,逍遥仔,171999993,较差,2022-03-02,15:39:44,只是看了一眼金荷娜，还有一星给小孩，我还是挺喜欢小孩子的,0
0,26253737,非常父子档,野野风啊,YF1110,很差,2022-02-25,21:39:12,就是常见的不能再常见的套路,0
0,26253737,非常父子档,just冲浪🏄🏻,yz999999999,力荐,2022-02-07,00:32:27,虽然不现实但好看,0
0,26253737,非常父子档,芒果流星雨,187336295,还行,2022-02-07,00:12:04,剧情就，嗯，怪～但小孩儿是真讨喜，好聪明好可爱啊,0
0,26253737,非常父子档,越跃,233439739,推荐,2022-02-06,16:11:13,很温情，挺不错的,0
0,26253737,非常父子档,黎,214532912,还行,2022-01-30,21:59:31,我觉得还行，能看  太久忘了,0
0,26253737,非常父子档,P小帕,2316831,推荐,2022-01-29,18:24:39,好看的，宝贝演技真的很棒，李治廷演技一般，金荷娜还可以。就是感觉太短了，估计拍成电视剧内容可以丰富。,0
0,26253737,非常父子档,黑伏特加,blackvodca,较差,2022-01-20,11:24:40,特别难看，好……难……看,0
0,26253737,非常父子档,前任遍地是,233426603,还行,2022-01-13,13:40:35,演技担当小朋友,0
0,26253737,非常父子档,有好梦的姑娘,65239385,推荐,2022-01-11,22:30:42,严苛的角度来说这个片从内容和演技说有点尴尬，但是从看可爱小朋友的角度来说，轻轻松松的可以加分,0
0,26253737,非常父子档,绿色绣球花,59036512,还行,2022-01-04,23:24:17,小孩演的不错，就是港台腔＋韩国中文，好出戏，就太奶奶一个演技在线吧,0
0,26253737,非常父子档,M林夕5699,FR5699,还行,2021-12-28,22:17:15,还可以,0
0,26253737,非常父子档,小qq,149018189,较差,2021-12-11,23:26:06,挺无聊的 就…和朋友傻傻的随便看看,0
0,26253737,非常父子档,豆豆子,243772882,还行,2021-12-08,12:02:32,故事太套路了，没啥亮点，全靠演员撑着,0
0,26253737,非常父子档,莉丽安欧尼,181930739,很差,2021-12-06,23:59:46,妖魔化了小孩儿，全剧也不知道要讲些什么，美艳喝醉后弄脏了衣服，一会说没有衣服换了穿了奶奶的旗袍，第二天就换了一套新的了。处处bug，没有重点，节奏乱，小孩笑得再甜也无法掩盖全片的这些软肋。看到一半弃了。,0
0,26253737,非常父子档,萨卡奇兵,140999083,还行,2021-12-05,16:02:22,最后那个快递员的表情真的靓了，哈哈哈哈,0
0,26253737,非常父子档,1amzz_,248482609,较差,2021-12-03,19:02:52,儿子找爹，乌龙很多，有些好笑。,0
0,26253737,非常父子档,卷卷,175909735,较差,2021-12-01,18:29:15,中间开车看女主看呆情绪变化也太快了。男主角演员挑的稍微有点差劲，鞋拔子脸真的太出戏了。,0
0,26253737,非常父子档,Chrish Lee,144228264,较差,2021-11-28,13:12:14,全靠小孩子撑起一部戏,0
0,26253737,非常父子档,在路上,215275511,还行,2021-11-27,01:27:38,打发时间看看不错,0
0,26253737,非常父子档,   NagaNg  ',101367466,还行,2021-11-23,18:41:08,金荷娜可太🉑了…,0
0,26253737,非常父子档,难看就是难看,233900449,还行,2021-11-21,22:06:03,题材一星 李治廷颜值一星 小孩演技一星,0
0,26253737,非常父子档,电影与文学,L2441727346,推荐,2021-11-21,11:43:49,“世界最美好的事情无疑是我牵着你，你牵着我，中间有一个可爱的小宝贝”观影完《非常父子档》后，其实虽然剧情故事普通，但是平易近人，演员精湛的表演，“泰丰”这个角色，灵气十足，以一场“寻找父亲的特殊旅途”展开，作品主题涵盖了“亲情，爱情”电影《非常父子档》中的片名，“非常”儿子，就述说出了父子关系的不寻常。无论是周力岩与父亲的关系，还是周力岩与儿子顾泰丰的关系，都是导演对于父子情最真诚的表达。两代人的情感，让我们看到了隐藏在矛盾中的爱，这种爱，痛彻心扉，无法取代。发生了一个又一个啼笑皆非，一个又一个有爱，有泪，有温情的故事。电影《非常父子档》运用独特叙事手法，通过一路的寻找，给观众铺展了两段父子之间的情谊——一者是传统的中国式父子关系；二来，则是跨越中韩的父子关系，它构建了一个走向温情，浪漫的家,0
0,26253737,非常父子档,🌸,187412657,力荐,2021-11-20,23:36:16,文梅森可爱爆了,0
0,26253737,非常父子档,oia,181890504,力荐,2021-11-17,23:54:50,喜欢，这欢快氛围和温馨感。,0
0,26253737,非常父子档,白奈,naerqing,还行,2021-11-14,01:09:51,还行 但我觉得李治廷和父亲和解那里表演太过用力  最后和孩子母亲在一起 也不太现实,0
0,26253737,非常父子档,MY.Silence,242048469,较差,2021-11-13,17:12:26,现实中如果真的遇到这种事会崩溃吧，为了圆满，强行男女主感情发展，莫名其妙就爱上了。,0
0,26253737,非常父子档,盛盛较瘦,shengyuli,较差,2021-11-12,01:49:01,小孩子全片最棒，剧情主线挺好，细节细碎。,0
0,26253737,非常父子档,叽哩咕噜,147609750,还行,2021-11-08,22:07:04,虽然很多地方没有逻辑又没啥特别的甚至老套无聊，但是总算看完了不用每一次短视频刷到都看一半吊着了！可能已经很长时间不开心了所以看这种没脑子的剧情挺轻松快乐的，景色不错小孩可爱算加分啦,0
0,26253737,非常父子档,蘇,171401200,较差,2021-10-24,06:55:04,看不下去,0
0,26253737,非常父子档,YLS,catlover33,很差,2021-10-20,21:17:05,奇怪的剧情和剪辑,1
0,26253737,非常父子档,disguisecherie,58021077,很差,2021-10-15,13:16:00,"冲着萌娃勉强给个一星
1.5倍速看毫无违和感
现实中男主会去捐X我头拧下来给导演
现实中男主的家庭会承认女主我胳膊拧下来给导演
现实中男女主会在一起我腿砍下来给导演
不要忽悠女性去X子库妄想着遇到一个又帅又有钱还内心极度缺乏安全感的富二代
现实中会为了那么一点钱去捐X的都是流浪汉level的
醒醒妹子们！",0
