page_index,movie_id,title,username,user_id,rating,date,time,comment,useful_count
0,26253737,非常父子档,易烊千金,218216930,还行,2021-10-11,17:48:20,可能是近几年影视剧套路发展太快，感觉剧情有点老套，像学生时期写的命题作文。前面小朋友去找爸爸的剧情挺搞笑的，让我想起了电视剧《小爸爸》，姑姑的表演好夸张，像极了小时候看的港片，还有整体的道具布景色调也让我感觉像90年代的港风一样复古，完全没想到这会是一部2016年的片子，还有男主和爸爸的亲子矛盾也蛮老套的，现在小学生写作文估计都不怎么用了。不过整体还蛮温馨，有什么事是比一家人在一起其乐融融更重要的呢？当作下饭电影看的话也算及格了。,0
0,26253737,非常父子档,小白.,222351506,还行,2021-10-03,13:55:39,没有很烂 剧情还好 能看下去 萌娃太招人稀罕了 三星给小孩,0
0,26253737,非常父子档,Gakki Smile,174499582,推荐,2021-10-02,17:09:18,儿子真萌,0
0,26253737,非常父子档,绿鲤鱼与驴,163476586,较差,2021-10-01,22:22:15,小蝌蚪找爸爸,0
0,26253737,非常父子档,你猜,127228405,推荐,2021-10-01,22:16:19,给小演员四颗，所以要先爱上妈妈才能认儿子？哈哈哈,0
0,26253737,非常父子档,瑞泽丶,j15707978017,推荐,2021-09-26,09:05:59,冷血蝌蚪？,0
0,26253737,非常父子档,小NYLAS,205861310,还行,2021-09-23,21:22:12,小朋友太可爱啦！！！！！,0
0,26253737,非常父子档,momo,60621990,较差,2021-09-23,00:23:13,。。。,0
0,26253737,非常父子档,地主家的傻儿子,134204516,较差,2021-09-21,22:15:59,亮点全在孩子身上了,0
0,26253737,非常父子档,春雨太阳,81744133,还行,2021-09-19,22:23:50,还行，中韩合拍。李治廷蛮帅的,0
0,26253737,非常父子档,稻花田里稻花香,240556067,还行,2021-09-14,18:50:37,好在抄袭的剧情是个小插曲没有怎么描绘。着重还是放在了家族亲情关系的描写上了。小演员真可爱。,0
0,26253737,非常父子档,犇媧媧,171615125,还行,2021-09-13,17:09:31,小朋友非常可爱！小朋友的部分可以，但是两个人发展感情的部分尬尬的，就是不知怎么就相爱了……然后脸盲竟然认错了演员,0
0,26253737,非常父子档,王老板,235116411,力荐,2021-09-09,14:47:26,甜甜的，很温馨。女主的嘴型居然都对的上，看来是下了功夫的。,0
0,26253737,非常父子档,巴拉巴拉,153864710,还行,2021-09-08,23:49:53,三星全给小朋友 好可爱,0
0,26253737,非常父子档,心情,46522267,推荐,2021-08-27,21:19:23,打卡,0
0,26253737,非常父子档,Andrew Z.,190434417,还行,2021-08-23,15:33:04,一般般….,0
0,26253737,非常父子档,豆瓣的朋友,126514158,推荐,2021-08-05,00:12:32,到底是吕中演的太好了  还是别人演的太差了?,0
0,26253737,非常父子档,王谨言,186623559,还行,2021-07-30,12:55:26,故事很烂俗，就看了看两个帅哥，情节根本经不起推敲,0
0,26253737,非常父子档,小菜一碟,80229487,很差,2021-07-29,22:06:55,演技不太行 故事情节不太能接受,0
0,26253737,非常父子档,豆友210602764,210602764,还行,2021-07-26,23:27:34,如果不讲逻辑性那还是能看的,0
0,26253737,非常父子档,你是为难的胖虎,178753354,还行,2021-07-20,16:37:10,可爱滴小孩子,0
0,26253737,非常父子档,小贤爱牛肉,134942753,很差,2021-07-18,20:57:06,"1星是荷娜女神和儿砸梅森的 

什么狗屁编剧脑残台词，妈妈胸是飞机场 低级趣味无聊没礼貌的批娃娃，，，  这种脑残台词麻烦离我儿子远点，蟹蟹 😊

男主也是个憨逼，什么傻屌台词巨婴人设， ，   ，， 把人家小娃娃往路上一扔就行，富二代我呸，，  除了颜值OK脑里怕是浆糊哦 ， 
，
全片亮点只有奶奶和姨奶奶！ 有气质+智商在线
积点口德，我不能再吐槽哦
",2
0,26253737,非常父子档,耶鹅爱吃土豆,211557966,推荐,2021-07-02,00:05:57,最喜欢可爱的小朋友了,0
0,26253737,非常父子档,橘子西的小鱼,171941534,推荐,2021-06-25,16:33:36,李治廷还是非常帅的,0
0,26253737,非常父子档,起风了,154081325,还行,2021-06-19,23:08:01,剧情看的有点懵逼，结局略仓促，小朋友还是挺可爱的,0
0,26253737,非常父子档,阿拉滋滋,212775451,还行,2021-06-10,10:35:18,有些温馨的电影，剧情搞笑，小朋友很可爱！还不错！,0
0,26253737,非常父子档,可爱柚,197782848,推荐,2021-05-26,12:37:49,特感人的父子情... 很有代入感 会收藏在看的,0
0,26253737,非常父子档,岁月静好,202223562,推荐,2021-05-19,14:22:42,很不错的电影，聪明的泰丰找到爸爸，最漂亮的结局是一家三口在一起了,0
0,26253737,非常父子档,RUNAWAY,WXM105805905,推荐,2021-05-11,03:49:44,很好看的一部电影，小朋友好可爱！！！,0
0,26253737,非常父子档,寻北,158001996,很差,2021-05-03,13:15:48,一分给小孩的演技。,0
0,26253737,非常父子档,nobodyknows。,149156894,较差,2021-05-02,23:24:02,有些许无厘头。,0
0,26253737,非常父子档,陆既明🐶🐶,tytyhappyhappy,还行,2021-04-18,14:50:15,不太好，太沙雕,0
0,26253737,非常父子档,华丽小艾,Movies312,还行,2021-04-17,16:48:02,孩子演得好,0
0,26253737,非常父子档,每天都能看到星,130237084,较差,2021-04-13,12:59:53,"我觉得这电影拍的挺不道德的
全都这样的话 谁敢捐献精子啊？
这是温馨吗？这是破坏市场规则，看得我火大。",0
0,26253737,非常父子档,Merit.K,215354390,力荐,2021-04-08,21:35:35,顾泰丰是小天使叭！,0
0,26253737,非常父子档,大三中文,145508332,还行,2021-04-03,23:14:42,小孩子果然比大人聪明！！,0
0,26253737,非常父子档,楚三吉,50284210,还行,2021-03-30,17:39:07,除了男主演得太用力，其他演技都尚可，小正太养得真好。,0
0,26253737,非常父子档,001,223916992,还行,2021-03-26,21:53:18,因为小弟弟太可爱了 所以给了三颗星哈哈哈哈,0
0,26253737,非常父子档,小柑橘,176167894,还行,2021-03-13,23:12:48,喜欢这种小朋友剧～轻喜剧，除了作品抄袭的部分，其他都挺好～,0
0,26253737,非常父子档,与飞之七,152858299,很差,2021-03-12,19:28:04,毫无价值可看性的电影，对于我来说，题材也不新鲜,0
0,26253737,非常父子档,我的观影报告,212684884,还行,2021-03-03,16:41:32,首先这个片子还是不错的！但缺点也很明显，孩子是不是聪明的过分了，当小说了，还会入侵电脑！这点我其实还可以接受，甜嘛！其次男女主，说真的，年龄的的差距，很让人出戏，反正我感觉不到！最大的败笔，男主的父亲，那是什么玩意儿，最后强行洗白，有意思吗？要不是看在小孩子的份儿上，我真不想给3星,0
0,26253737,非常父子档,捅主任,ibmpc586,较差,2021-02-23,00:04:39,很奇怪的组合…,0
0,26253737,非常父子档,elegantboy96679,166549000,还行,2021-02-21,14:28:35,风趣幽默温馨，看着不累。,0
0,26253737,非常父子档,对不起了三叶,BYD5201314,还行,2021-02-18,10:22:19,中韩合拍片，女主金荷娜给我留下了印象，剧情后期节奏太快，结尾也俗套。（ps：李治廷真的太像王力宏，里面小男孩挺可爱的）,0
0,26253737,非常父子档,LinhLinh,232782483,力荐,2021-02-17,15:49:39,good movie!,0
0,26253737,非常父子档,酱鸭柠檬,173607698,力荐,2021-02-17,15:28:21,高中计算机课上看的，挺嗨皮的,0
0,26253737,非常父子档,一念花开,42670875,推荐,2021-02-16,23:14:48,就是结局有点仓促，小朋友演的太好了，好萌好可爱啊,0
0,26253737,非常父子档,Faye,162698818,还行,2021-02-16,18:28:12,故事不太真实，像是看了一个童话故事。而且情节推动也没有做到位，父子情没有特别多的进展，周力岩和美艳的感情不明朗，开放性结局，可能是给观众想象空间吧。（小家伙蛮可爱的，李治廷的造型让我一下子就联想到星际牛仔里的Spike了,0
0,26253737,非常父子档,窗里童话,191502061,很差,2021-02-15,15:53:06,拍的还行吧 主要是不太认同片里的价值观.....,0
