page_index,movie_id,title,username,user_id,rating,date,time,comment,useful_count
0,26323026,临时演员,体温33。5,121212298,较差,2021-01-18,13:57:10,为了捧新人的电影吧,0
0,26323026,临时演员,凝羽飞,229345811,很差,2021-01-17,14:35:35,明星和屌丝，明星必是小三的设定……最近看了好多类似女主是小三然后和屌丝男主的爱情片了。老套的情节加上几乎没有高潮的剧情，爆米花电影的唯一作用就是消费爆米花。话说女主能再丑一点么？各种假发恶心到我了。唯一印象是配角林雪，这才是演员 。,0
0,26323026,临时演员,爱吃麻花的烤豆,162765848,较差,2021-01-08,13:02:04,期待,0
0,26323026,临时演员,文艺喵,148471924,很差,2021-01-02,18:32:10,看剧之前一定要看下评分，防止踩雷,0
0,26323026,临时演员,哇哈哈真快乐,176158455,还行,2021-01-01,20:13:42,还好吧,0
0,26323026,临时演员,豆友210602764,210602764,较差,2020-12-27,12:32:33,郑恺啊，除了跑男就只会拍这类型的电影了吗,0
0,26323026,临时演员,Palpitate85,202478643,还行,2020-12-25,22:38:14,感情可能产生的好快，当成轻松喜剧，放松一下也行,0
0,26323026,临时演员,躺着减肥,71785984,很差,2020-12-23,20:27:50,剧情太傻了。。,0
0,26323026,临时演员,王大冰,119111035,推荐,2020-12-22,20:29:02,虽然编剧很渣   但是我的眼泪不值钱,0
0,26323026,临时演员,初夏夏初,132158152,很差,2020-12-20,16:25:08,就很久以前偶像剧剧情的风格，随便拍拍的。虽然偶尔有几个镜头还有点感觉。,0
0,26323026,临时演员,还挺浪,115547662,还行,2020-12-20,14:09:16,剧情挺紧凑的，周末在家看非常不错的选择,0
0,26323026,临时演员,千寻,138670835,推荐,2020-12-14,19:56:56,凑合看,0
0,26323026,临时演员,一代宗师问哥,201459557,很差,2020-12-12,10:58:35,是宅男福利电影吗？爱情发生的莫名其妙，故事推进的毫无道理。,0
0,26323026,临时演员,三十一,227019753,较差,2020-12-04,20:34:41,演员演技还可以  剧情狗血太老套没有新意  ,1
0,26323026,临时演员,一蓑烟雨任平生,203678865,较差,2020-11-28,22:29:03,没什么意思，但我是厚道人,0
0,26323026,临时演员,伯爵·水魅,132021081,较差,2020-11-24,00:25:53,"郑恺和热依扎的感情线，末了还不如殷桃的一声啜泣。
这经纪人咋听着那么像周星驰呢？",0
0,26323026,临时演员,MXIRUO.,202613338,较差,2020-11-23,00:59:30,这个这个 嗯 一般般吧,0
