page_index,movie_id,title,username,user_id,rating,date,time,comment,useful_count
0,26873820,窦娥奇冤,不二幸村,160913466,很差,2017-05-01,13:09:24,被套路了的窦娥才是最冤的吧？这样消费历史好么？,0
0,26873820,窦娥奇冤,榜上有名猫,fang0079,较差,2017-04-29,22:43:04,炫耀特效，摆弄轻功，套路中的套路，意用惊悚手段，结果雷点满满，笑翻。,3
0,26873820,窦娥奇冤,妮妮妮娜,143573027,很差,2017-04-28,10:49:00,我觉得进了电影院的观众更冤，在毫无心理准备的情况下看了一部惊悚片。,0
0,26873820,窦娥奇冤,puppy,160759983,较差,2017-04-27,22:16:36,一分给中学课本的台词，一分给送我票的陌生人。这个电影拍出来到底为什么啊，也不赚钱，纯粹消费古代神话故事。唉，女主看的我想吐血，那生硬的演技！,0
0,26873820,窦娥奇冤,沐宇,tongjinyu,,2017-04-27,12:14:41,如坐针毡...真的是和一群大妈大爷一起看....,1
0,26873820,窦娥奇冤,恐龙,72820019,很差,2017-04-27,01:23:01,果然以后应该会很感慨跟表哥经常去看电影的这段时间吧！！在电影院看了我这辈子都不会买票去看的电影！,0
0,26873820,窦娥奇冤,Ether,103013614,较差,2017-04-25,21:46:33,我就不打一星…开始吓跑…好奇返场之后…讲究着看完了…哈哈哈哈哈…故弄玄虚…配乐简直可以狗带了…窦娥好黑…,0
0,26873820,窦娥奇冤,寂静时候不欢喜,80778295,还行,2017-04-24,20:18:06,这片子也是一个一言难尽的，感觉鬼神愣是被拍成了惊悚片的效果，看得我浑身发凉……知道导演想表达的主题是贪污反腐，不知道以为就是来拍鬼片的了呢，其实比鬼片拍的吓人……,0
0,26873820,窦娥奇冤,骑呢星人,34482289,较差,2017-04-24,18:28:12,2017/04/23 一惊一乍故弄玄机，浓浓的CCTV6陆小凤传奇之XX系列的感觉，如果知道是这样我是不会去电影院看的，减一星。,0
0,26873820,窦娥奇冤,Yellow_OTL,54880316,还行,2017-04-24,02:07:11,一惊一乍神他妈吓人。。。基本就是包青天查案的剧情，身为电影居然学电视剧用配音，事实上也是电视剧制作水平，唯一比较好的是借古讽今有点现实意义。。。,0
0,26873820,窦娥奇冤,山城瑞秋,61739057,还行,2017-04-22,11:16:30,讲真，在电影院我看哭了。,2
0,26873820,窦娥奇冤,18280,65450414,较差,2017-04-22,00:25:29,电影无太大问题，不过感觉不止80分钟，剪辑太多，有的事情没有交代清楚。确实有恐怖镜头,1
0,26873820,窦娥奇冤,兔小兔,tuxiaotuyangfan,还行,2017-04-21,22:16:09,纯唯物主义下的反腐倡廉作品～但看着窦娥被斩首的时候还是有些动容的～毕竟当时中学念这段课文气的不浅…,1
0,26873820,窦娥奇冤,lcy_,157930709,还行,2017-04-21,17:26:36,惊悚片 吓死我了 把眼镜都挡住了我,0
0,26873820,窦娥奇冤,wenwen,hujiapapa,较差,2017-04-21,16:41:48,新增的于为忠和窦霜儿两个关系人物实在是让人难以接受，特别是暗恋窦娥的于大人。窦娥在法场念那段改编自著名的【正宫·滚绣球】的话让人觉得编剧的传统文学功底不太好，先骂天后骂地导致韵律变得很难听。另外，结尾改编的不错，窦娥她爸的确也是罪人之一，应该受到惩罚，最终他也疯癫了。,0
0,26873820,窦娥奇冤,Marcus,79695986,还行,2017-04-21,14:08:37,演员们的表演都很真实自然，但整体并没有亮点，说不上好也说不上差，就是历史故事中规中矩与高度还原写实般的演绎，拍摄的手法很像央视电视剧，后半部分的严刑逼供真的挺愤懑，早已预料的悲剧结尾也让人倍感遗憾与无奈。其实并不是对历史人物的消费，个人认为电影更想侧重表达官官相护这种腐败的现实。,28
0,26873820,窦娥奇冤,穆子衿,155602014,较差,2017-04-21,11:09:42,这部电影也是想要表达反腐的意思吧，只是有必要拍成恐怖片的效果吗？,23
0,26873820,窦娥奇冤,Ryder,42011516,很差,2017-04-21,10:17:57,被消费的历史人物，才是真正的奇冤。,87
0,26873820,窦娥奇冤,kazuma,51715999,很差,2017-04-21,01:23:16,呵呵呵,0
0,26873820,窦娥奇冤,cherry,127589127,还行,2017-04-21,01:08:54,窦娥到底冤不冤,0
0,26873820,窦娥奇冤,听风,28072971,还行,2017-04-16,23:15:48,看了明星见面会场，在改编上真是下了功夫。可以看到想要做突破，只是，传统文学改编，如果对原著理解不够深刻，还是比较难的。,0
0,26873820,窦娥奇冤,木星的卫星,66385800,,2017-04-15,21:46:30,海报是抄袭吧,2
